,id,author,vader,title,created_utc,num_comments,score
0,jo8i2p,StronkCowPie,0.4588,How is high APY Yield Farming possible,1604536023,1,1
1,jo7vhk,BanklessHQ,0.0, Guide How to become a validator on Eth,1604533767,0,1
2,jo5lp0,ath398,0.9517,This project and The team has built a strong community with great potential The best specialists work and create confidence in this project for people,1604525950,0,1
3,jo50gb,remykonings,0.6633,Hear the latest on the KRAKEN project as guests from Atos join the TX  Tomorrow Explored podcast KRAKEN aims to develop a privacypreserving health and education data marketplace funded by EU Horizon,1604524023,0,1
4,jo4y75,Crypto_Economist42,-0.3182,If the ETH  deposit contract doesnt ever hit launch target will the ETH be lost,1604523823,2,1
5,jo3561,infura,0.0,Tutorial How to send a transaction sign it and broadcast it to the Ethereum network,1604518031,0,1
6,jo2sf2,shayanbahal,0.5267,Smart Contract Security Newsletter   This week Governance Flash Loan Attack Harvest Finance Hack many other DeFi hacks and security concerns and more,1604516910,0,1
7,jo29hp,bdinu89,0.0,Ethereum Launches Deposit Contract for Ethereum ,1604515294,0,1
8,jo1qgw,BlackFrogCrypto,0.0,American Crypto Bitcoin ATM has expanded in Waterloo IN Garfield Heights OH Mentor OH North Olmsted OH Alexandria VA and Woodbridge OH Check out our NEW locations,1604513631,0,1
9,jo1cug,ali12345678911,0.0,Yearn Global,1604512447,0,1
10,jo11j3,johanngr,0.5859,Create your own Online Pseudonym Parties test net,1604511476,0,1
11,jo0syd,sandakersmann,0.0,With release of deposit address Ethereum s Phase  launch date is in sight,1604510750,0,1
12,jo051c,tarasov1992,-0.4404,Ethereum  Deposit Contract Deployed Genesis Block Scheduled for December ,1604508653,3,1
13,jnzwai,wise_quote,0.0,Ethereum  Set to Launch on December ,1604507859,1,1
14,jnzjoz,token5gtd,0.2732,Womens Fashion amp Accessories  Crypto Accepted,1604506724,0,1
15,jnz8sd,domobyl,0.0,ETH  deposit contract is live Genesis launch scheduled for December st  pm UTC,1604505727,79,1
16,jnyift,multisend,0.2263, stimulus payment now worth ,1604503221,0,1
17,jnyi9w,hatter6822,0.0,ETH  Deposit Contract address and more,1604503204,4,1
18,jny7n5,coinmonks,0.3818,DeFi Index Funds The benefits of diversification and a comparison of recent performance,1604502174,0,1
19,jnx7i4,DirksEarring,0.0,Introducing the Batch Deposit Contract,1604498589,0,1
20,jnx46q,sunandsky789,0.4588,I bought all my high tech equipment with my ethereum,1604498251,0,1
22,jnvbkj,MK333666,0.0,The results of the US election will be published on Ethereums Blockchain,1604490351,0,1
23,jnv75m,Farmer365,0.0,OFFICIAL Nvidia RTX  MINING Hashrate Test RESULTS Can we get to Mhs,1604489733,0,1
24,jnua5q,StarryFilthyShot87,0.0,Given  and done what will the bandwidth be for simple simple eth sendss in the executable shard,1604484917,0,1
25,jntv5w,EROSBabe,-0.5423,The Cooling DeFi Mania Makes Ethereum Fees Drop ,1604482666,0,1
26,jntb56,coinmonks,0.7964,Six Lessons Learned as a Prize Winner from the ETHOnline  Hackathon,1604479444,0,1
27,jnt0hm,applesEgo,0.0,Atari token falls  just days after public sale concludes,1604477812,0,1
28,jns6pg,koinalio,0.0,What is Ethereum   for beginners ,1604473523,0,1
29,jnp70z,mrsotkogaming,0.0,PayPal Causes Bitcoin Explosion  Only  Of Clients Have Access,1604460125,0,1
30,jnouy5,thisisntus997,-0.2263,is it possible for an ETH transaction to disappear,1604458750,0,1
31,jnkpic,hatter6822,0.0,Deposit Contract CLI released ETH  is a Go,1604443438,39,1
32,jnkdvh,BrandonZ0302,0.0,Ethereum gas fees,1604442400,0,1
33,jnkbx8,cqcallaw,0.0,Will rising costs in fiat currency of ETH lock newcomers out of the game,1604442217,0,1
34,jnjlxj,linkedkeenan,0.0,How to get Random Numbers in an NFT ERC,1604439945,0,1
35,jnii7m,sialkot123,0.4404,good one,1604436514,0,1
36,jnigmj,johnmonger,0.34,The  Elections Are Boosting Crypto Prediction Markets,1604436377,8,1
37,jnh9ue,signedupforthisquest,0.0,PIGB running eth node lighthouse beacon and validator,1604432593,1,1
38,jnfo86,denkler,0.0,Towards stablecoins and DeFi mass adoption,1604427716,0,1
39,jne8gq,Google_Trends0,0.4019,How did Ethereum Smart contracts work  Googles Trends,1604423408,0,1
40,jnd1tg,coinmonks,0.0,Coinmonks Newsletter,1604419858,0,1
41,jnc8st,seanyo,0.296,Mempool Primitives How this new class of money legos enables new strategies,1604417337,0,1
42,jnc7y5,ZergShotgunAndYou,0.34,How Ethereum  is Redefining Blockchain Security,1604417255,4,1
43,jnbykk,najotere,0.0,NFTs seem to be taking off does anyone own some SuperRare sold over  mil of NFTs this month,1604416392,0,1
44,jnbxb2,bitangel84,0.0,FLV ART IS HERE,1604416278,0,1
45,k06foq,bmap_app,-0.0516,I haz POS staking noob question,1606229702,0,1
46,k06by9,avhloni,0.4404,Easy way to start staking Ethereum from the st of december,1606229347,4,1
47,k06br1,antox77,0.0,Prediction for end of  through ,1606229327,0,1
48,k05sgn,Wght_gl,0.0,After the Ethereum hardfork happens will an eth holder have coins in both blockchains by the same seed ,1606227512,0,1
49,k05j7b,Cryptognomes,0.0,SafeSwap PS,1606226617,0,1
50,k055xp,XanderPz,0.0,Late Staking,1606225261,3,1
51,k05183,integralcouch,0.0,Satoshi Nakamoto Lived In London While Working On Bitcoin,1606224746,0,1
52,k04uoq,Bitman321,0.0,How to find out what you do the most on ethereum with this simple open source tool,1606224041,1,1
53,k04gfh,oliveio,0.4019,AcidClock any Binance ticker on a Fitbit smart watch ETH  validator nodes status monitoring is planned,1606222458,0,1
54,k04ag1,DappRadar,0.0,Over  BILLION is now locked in DeFi,1606221745,1,1
55,k047q8,Shrabonk3534,0.0,CobaltLend Blockchain cryptocurrency and CBLT,1606221427,0,1
56,k047m4,SilenzFr,-0.2732,Any risk when signing something with my private key ,1606221412,0,1
57,k03tev,dmihal,0.7184,The Eth journey has begun Lets ride this thing to the moon ,1606219664,21,1
58,k03oq3,baqar978,0.0,MoonDeFi,1606219068,0,1
59,k03n3r,ankitnayan,0.0,PlotX amp Chainlink AMA,1606218853,0,1
60,k03jhf,CryptoHuff,0.0,Been in the crypto since  Rate my project,1606218376,0,1
61,k03hd5,gabbysancez,0.0,What does ETH  mean,1606218086,0,1
62,k02xnf,getblockio,0.0,Connect to the updated version of BESU node Hyperledger Besu v,1606215401,0,1
63,k02oi4,sjalq,0.0772,Essay competition on how Ethereum can help combat social media censorship,1606214061,9,1
64,k02b7z,sloma27,0.1027,PSA Scammer on Instagram pretending to be the official Vitalik and selling eth ,1606212220,0,1
65,k0269z,SorenStephenson,0.2023,Ether breaches  goes past significant psychological levels,1606211522,0,1
66,k021tr,CoinExcom,0.4404,Announcement on Supporting ETH for Financial Account,1606210903,0,1
67,k0210r,nodarj,0.0,Live example of a generalized front running bot,1606210783,0,1
68,k01s96,Ab3njman,0.0,BNB AirDrop,1606209553,0,1
69,k01jx3,SolitaryWalker_,0.4767,Do economies of scale network latency or other factors affect validator rewards,1606208370,0,1
70,k019e9,WinterPerception0,0.0,AvalancheEthereum Bridge is set to launch,1606206770,1,1
71,k017i7,im-just-your-bae,0.0,Can someone ELI ETH  and also what is staking,1606206498,0,1
72,k00sb5,ProficieNtOCE,0.0,Rotate eth deposit key,1606204322,0,1
73,k0036w,Visible_Theme3681,0.0,blockchain development company,1606200807,0,1
74,jzyudy,rainingcrypto,0.7178,Help  Extremely high fees when trying to depositing ETH with MetaMask to ETH,1606195043,0,1
75,jzyh0e,coinsmash1,0.7003,Kraken to support ETH  staking rewards,1606193543,4,1
76,jzyfpo,sorepie,0.0,Last date to stake,1606193394,0,1
77,jzy6iy,WeAcceptCrypto,0.0,ETH  Contract Questions,1606192352,2,1
78,jzxrn0,SebastianPatel,0.0,What do you think is the principal reason why Ethereum is up so much and how far do you think it will go,1606190674,1,1
79,jzxqr1,alecreeves1,0.2732,Will validators still be accepted after the initial eth  staking goal is met,1606190579,2,1
80,jzxo85,thirstywalls,0.0,Staking Returns,1606190314,4,1
81,jzxmco,wwii3,0.5719,Insurance claim success  DAI will be redeemable for Cover protocols first claim on Pickle hack,1606190107,1,1
82,jzxac2,luchins,0.0,Has BTC currently higher issuance than ETH,1606188788,7,1
83,jzx7n3,crypto_doctors,0.5267,And we did it Congrats to all ETH holdersLets hold this gem forever D,1606188497,2,1
84,jzx6px,helpprogram2,0.0,Can I stake etherium  in  months Can anyone becomes a validator how does it work,1606188394,0,1
85,jzwy97,lunarcrush,0.5859,Ethereum hr Social Dominance has trended as high as  of all social volume across the entire crypto market this week,1606187486,0,1
86,jzwvxa,Coaster89,0.5859,Can someone please explain to me like Im  years old what it means to stake ETH for ETH  amp should I do it,1606187228,13,1
87,jzwvtf,Texugo_do_mel,0.0, ,1606187216,2,1
88,jzwl6u,Empire_Building101,0.0,This is the way,1606186104,0,1
89,jzwjx5,rdm41,0.0,We did it,1606185973,3,1
90,jzwgvu,michael60634,0.0,eth deposit contract is fully funded,1606185656,5,1
91,jzwfh5,wmredditor,0.0516,Ethereum Community Reaches Milestone  ETH M Deposits Towards Eth Launch,1606185516,0,1
92,jzwbo1,etan1,0.0,ETH beacon chain locked for launch at Dec  ,1606185124,13,1
93,jzwbce,Rahul_2503,0.7351,Show Time Guys  Huge Congratulations to Vitalik and The Community,1606185095,0,1
94,jzw9y7,TouchmeZ,0.0, we did it boys,1606184952,0,1
95,jzw9ng,Pythagaris,0.0,The deposit contract is over ,1606184920,0,1
96,jzw91h,ninja_batman,0.0,ETH  Contract Fully Funded,1606184855,233,1
97,jzw8z3,interweaver,0.0,Its official we have enough validators for genesis,1606184850,0,1
98,jzw8yv,IceFly33,0.0,We Made It,1606184849,0,1
99,jzw8wt,Hanzburger,0.0,Threshold met ETH launch imminent,1606184843,0,1
100,jzw8ul,rohan3au,0.0,And were there Lets do this,1606184837,0,1
101,jzw8ua,Vitiell0,0.5859,ETH deposit threshold reached on the eve of deadline Congrats team ,1606184837,34,1
102,jzw8q5,GeekBite,0.0,We did it,1606184823,12,1
103,jzw6ir,throwayleonard,0.4019,Bitcoin Holder trying to understand ETH help,1606184604,0,1
104,jzw5zm,DuRtY_Crypto,0.5904,Ethereum DeFi  Will Change Your Life WISE Token,1606184553,0,1
105,jzw1lt,ligi,0.2732,Add the amount of pending txs  We are already above ,1606184104,1,1
106,jzvyhe,GeekBite,0.0,Its about to happen,1606183782,8,1
107,jzvtd2,Joeroast,0.0, staked for ETH ,1606183268,0,1
108,jzvlxg,Fakercel,0.0,,1606182510,0,1
109,jzviad,dapp_com,0.3612,Will you invest in Grammy nominee rapper LilYachty He will issue his own social token on Ethereum via Fyooz dapp With social tokens you can trade amp earn from the tokenized influencers you like How to participate in this token economy,1606182150,0,1
110,jzvb2u,iamsunbird,0.0,Less than  more validators needed for genesis,1606181412,0,1
111,jzv4vk,bartforhire13,0.4466,OK to use Trezor with Metamask for staking,1606180773,0,1
112,jzux36,Stack3,0.0,What do you think of Index Token Is it possible,1606179967,0,1
113,jzud5m,OziKoZmaj,0.4019,Vitalik Buterin looks like a good version of Neo Cortex from Crash Bandicoot,1606178010,0,1
114,jzucys,bunningz_sausage,-0.4588,Ill just leave this here,1606177992,0,1
115,jzualf,MrSirBeard,0.0,I dont need options,1606177762,1,1
116,jzu9bp,LuvSLOTA,0.34,What do you think will happen to ETH value if ETH  hits the benchmark,1606177640,0,1
117,jzt7hl,Sea_Emergency2542,-0.34,Crazy Ethereum Early Believer Story,1606174069,2,1
118,jzswiz,BanklessHQ,0.0,Crypto At The Dinner Table,1606173035,0,1
119,jzsn8g,dbleg2k,0.0,Staking with less than  ETH,1606172189,0,1
120,jzrz2z,lwilson747,0.0,Blockchain Business Models,1606170025,0,1
121,jzrppx,GoldSilver-Analyst,0.4019,Help someone before its too late,1606169202,0,1
122,jzrcdz,othello16,0.0,Deposit penalties,1606168092,0,1
123,jzr3h0,kanav-wazirxwarrior,0.0,Why Ethereum touched  usd ,1606167358,0,1
124,jzr048,xijpxi,0.5994,ETHEREUM BULL MARKET,1606167073,0,1
125,jzqzkj,ibelite,0.1027,ETH  Deposit Contract has reached  On track for launch by ,1606167026,0,1
126,jzqwy3,MyTribeCalledQuest,0.0772,We hit that magic number,1606166802,0,1
127,jzqstn,stratguy56,0.0,The IRS is Sending Inaccurate Letters to Thousands of Crypto Investors Claiming Taxes Owed,1606166458,8,1
128,jzq8tw,virpt,0.25,Take advantage of NULS POCM,1606164800,0,1
129,jzq7v4,whatisbakktpubkey,0.0,Transition to eth,1606164719,0,1
130,jzq5ka,ergosumdre,0.0,Where can I find documentation of the output from CMDTerminal,1606164515,0,1
131,jzq2wt,Silverni,0.0,Ethereum Surges Above  As Crypto Momentum Accelerates,1606164298,0,1
132,jzq02e,Crypto_Economist42,0.0,The deposit contract has hit ,1606164072,33,1
133,jzpx3k,Crypto_Economist42,0.0,We just passed  ETH in the deposit contract,1606163817,0,1
134,k3x1te,CrispyKremeOreo,-0.4404,How to track eth Genesis block health  stats on launch Dec st,1606747463,0,1
135,k3wsav,Solodeji,0.2263, Worth of ETH Locked In Deposits Contract as Ethereum  Set to Launch Tomorrow,1606746601,0,1
137,k3woee,TobiHovey,0.5423,Someone Solved This Strange Ethereum Puzzle Winning ,1606746240,0,1
138,k3wl2g,wilsonseann,0.0,Protocol Embedded Staking  An alternative way of stabilizing crypto tokens,1606745919,0,1
139,k3wbwq,TyRade753,0.0,ETH  Roll out,1606745031,0,1
140,k3wb8k,TyRade753,0.0,ETH  Roll out,1606744969,0,1
141,k3wa6h,TyRade753,0.0,ETH  GAS FEES,1606744869,0,1
142,k3w14z,bench4rench,0.0,Weekly Crypto News Roundup   Stories You Should Know About rd of November  th of November,1606743912,0,1
143,k3vzl6,godova,0.0,Ethereum Node Count Nearly Overtakes Bitcoin as ETH  Launch Approaches,1606743747,0,1
144,k3vu34,theinternetalf,0.7311,Confused by gas prices Why GWEI is  on Etherscan but  on Metamask estimate Please see screenshot Thanks,1606743178,0,1
145,k3vp5y,EddieBoong,0.0,When will be Ethereum  Usable,1606742710,39,1
146,k3vhzi,Alex_Rusi4,0.0,Announcement for adjustment of the deposit requirement,1606741964,0,1
147,k3ukfj,only_a_great_fool,-0.25,ANY ADVICE FOR A NONTECHNICAL ETH HOLDER WHO WANTS TO RUN A VALIDATOR,1606737821,0,1
148,k3uh04,CuriosityIsInnocent,-0.4939,ETH Stolen,1606737394,17,1
149,k3uex2,everstake,0.4939,Everstake has successfully upgraded ETHEREUM  beacon chain nodes to v ,1606737104,4,1
150,k3uet7,Cultural-Hope6365,0.0,PipeFlare  Online Arcade And Gaming Community,1606737090,0,1
151,k3uag8,CoinjoyAssistant,0.2263,ETH worth more than  million has been staked for Eths Phase  launch tomorrow,1606736479,0,1
152,k3tq9i,Alex_Rusi4,0.0,Instant Trades on Rubic is now live,1606733900,0,1
153,k3t756,klizmara,0.0,Ethereum staking,1606731140,2,1
154,k3t5m9,MarilynMonero21,0.0,Finally going live what do you guys think will happen with the GPUs amp the price,1606730927,0,1
155,k3sxv5,WinterPerception0,0.0,Hamsterpowered marble races come to Ethereum,1606729884,1,1
156,k3si0k,abcoathup,-0.2732,Crypto Trends  November   Eth Genesis  Frontrunning the MEV Crisis with Flashbots  EthereumJS VM v  Twitter bot for text in Ethereum call data,1606727607,0,1
157,k3rfus,LimunFTW,0.0,ETH  Phase  launch tomorrow Beacon chain marks a new beginning,1606722426,0,1
158,k3rbhz,bit_guru,-0.2732,Slashing protection for humans,1606721829,1,1
159,k3qt9y,animalroam,0.0,Staking after Nov ,1606719416,0,1
160,k3qoei,mizkizz,0.0,Ethereum Price Predictions for   ,1606718775,0,1
161,k3q58t,NOTPR0,0.8553,Sprout has fully launched all pools Get paid by every transfer from Wealth Redistributive Abflation and help support Public Goods,1606716418,0,1
162,k3q0du,Inevitable_Praline_6,0.6124,First times transferring QNT and I blew it Help please,1606715841,0,1
163,k3ohd5,RustOceanX,0.5267,Is a smart contract protected against manipulation during execution,1606709414,0,1
164,k3o4xp,KimPowe,0.296,How should we as human beings join the world of ETH Such as for ETH,1606708024,0,1
165,k3nspg,MikeYEAHMusic,0.0,Dont you basically see this bitcoin song eyetoeye,1606706699,0,1
166,k3mg3k,Ds123455,0.0,ZKSwap Design Specification,1606701556,0,1
167,k3m9hu,huevos_de_acero,-0.4404,Is there a countdown for the Beacon Chain genesis block,1606700886,2,1
168,k3kt9l,kennylienhard,0.3612,ETHweekly Getting Ready for ETH Price Volatility in the Decade of Ethereum  William M Peaster,1606695660,0,1
169,k3kck4,Ituglobal,0.2023,Will top cryptos rise further or fall further from here,1606694031,0,1
170,k3jw16,StellaKarr,0.4404,To improve healthcare industry via Blockchain OPU Labs collaborates Matic Network,1606692407,0,1
171,k3jupx,Cultural-Hope6365,0.0,CRYPTOTAB ,1606692277,0,1
172,k3jsob,Cultural-Hope6365,0.0,The Future of Cryptocurrency Mining is Here,1606692083,0,1
173,k3jgp1,Precious_Growth_,0.2023,UniDeFi  High Yield farmable deflationary DeFi token Antirug Liquidity lock No mint function,1606690938,0,1
174,k3jf4p,EvanVanNess,0.0, Latest Week in Ethereum News  proof of stake launches Dec ,1606690809,1,1
175,k3j1mo,StellaKarr,0.0,Matic Network announce working with Mysterium Network,1606689594,1,1
176,k3izch,TheCryptomath,0.0,ETHers,1606689379,13,1
177,k3iqpd,JokerTheBond,0.0,Im developing a lending protocol completely based on Uniswaps liquidity pool tokens,1606688587,6,1
178,k3ipy6,Butta_TRiBot,0.0,There are now more Ethereum nodes than Bitcoin nodes,1606688521,53,1
179,k3id5c,StellaKarr,-0.4084,ZED RUN on Matic Network,1606687356,0,1
180,k3hxae,Ajnamen23,0.34,Everybody is giving predictions,1606685943,11,1
181,k3hsmi,coinsmash1,0.0,Ethereum  Staking Maths,1606685518,0,1
182,k3hqms,TwitchScrubing,0.3612,Can someone Explain it like Im  the new etherum update,1606685332,60,1
183,k3gk5k,StephanoC,0.7684,Yield farming is a fad but DeFi promises to change the way we interact with money,1606681502,1,1
184,k3gbsb,freedomdollars,0.0,Here is a NEW crypto currency beginners guide,1606680716,1,1
185,k3fli9,ITradefromPrison,0.0,EThbtc ratios,1606678313,2,1
186,k3ffxt,bambamlabam,0.0,My Journey to Becoming a Validator on Ethereum   ConsenSys,1606677800,25,1
187,k3f4d7,ilikeminttea_,0.0,Numbdog  community with its own ERC token,1606676752,0,1
188,k3f37e,Idontfuckwityou1122,0.0, ETH Predictions,1606676654,0,1
189,k3evt2,btsfav,0.4019,DeFinitely   The Week in DeFi,1606675983,0,1
190,k3elaa,nodeocracy,-0.296,ELI how is uniswap able to avoid being regulated despite VC investment,1606675026,3,1
191,k3cvlm,jerry297,0.4019,Stkr Smart Contract Audit completed,1606669497,0,1
192,k3bwag,Glue_CH,-0.5023,Transaction confirmed but failed how did it happen and how to solve,1606666215,3,1
193,k3bm0q,Rachel_Pham,0.6124,Please help me with Bitcoin or Ethereum,1606665254,0,1
194,k3b1xg,mepec,0.0,Uniswap does a second UNI airrop,1606663275,1,1
195,k3avmj,baqar978,0.0,Bridge Mutual,1606662627,2,1
196,k3ao9r,baqar978,0.0,Tokenizer,1606661904,0,1
197,k39dz9,marked_earnings,0.2023, Top Tier Crypto Exchanges for New and Seasoned Traders,1606656577,0,1
198,k395fa,Sciply,0.0387,I have some Ethereum and want to turn it into PayPal but dont have an id,1606655497,0,1
199,k38qi3,marked_earnings,-0.4767,Web Tokens Kusama amp KSM Explained  The canary network of Polkadot serving to detect vulnerabilities or weaknesses in the Polkadot code base,1606653551,0,1
200,k385l0,marked_earnings,0.34,Guide to IOTA Thats the protocol streamlined to provide security for IoT InternetofThings via blockchain,1606650551,0,1
201,k37vnz,marked_earnings,0.0,Guide to to Ocean Protocol and OCEAN token,1606649051,0,1
202,k37ucq,keyeker,0.0,AMA with Tim Jan Strandberg and Justin Wright from Yield,1606648853,0,1
203,k37mro,-johoe,0.0,Johoes mempool statistics now also shows Ethereum,1606647694,12,1
204,k37igf,gregdhill,0.34,How do orgs secure their private keys for autonomous clients,1606647040,2,1
205,k37h7x,lucrica,-0.3612,Ethereum my regrets,1606646845,0,1
206,k378i0,ircrp,0.5106,Etherum Classic new mining algorithm to the rescue of its network,1606645410,0,1
207,k375bt,betogess,0.6124,Top exciting companies working on Ethereum,1606644916,5,1
208,k35i7t,keyeker,0.0,Rubic Weekly Report ,1606635872,0,1
209,k34fuk,keyeker,0.0,Introducing the Base Protocol,1606630437,0,1
210,k32p1g,raisean,0.0,buying eth,1606622881,0,1
211,k32jbc,bkc11,0.0,Will ETH inflation rate change on December  as soon as ETH  launches,1606622217,0,1
212,k32gjd,selfhelpfitness,0.0,k Blueprint  StepByStep Guide To Earning  Per Month,1606621915,0,1
213,k329p3,F-Severn,0.0,Resources to Learn,1606621147,3,1
215,k31mus,MopishFungus,0.6369,Best GPUs for mining,1606618604,0,1
216,k30vzd,mileydixie,0.0,Bitprime,1606615724,0,1
217,jwgo8m,Solodeji,0.4019,This Dubaibased Company to Support Ethereum  Launch with  Million in ETH Deposit,1605709554,81,107
218,jwgi24,TehBananaBread,0.0,Somebody knows what will happen to ethereum ETF trackers if it steps over to ,1605708942,0,1
219,jwfl2b,DappRadar,0.2023,Ethereums top  dapps hit  users this month,1605705397,0,11
220,jwfghy,[deleted],0.4939,Ethereum  Staking Reaches  ETH While Prices Hit Month High,1605704886,0,1
221,jwfdnd,matcheek,0.0,Are Eth tokens on sale now,1605704565,0,1
222,jwfdm2,ethswarm,0.0,Ethereum Swarm Live Release Event  November th  at  CET,1605704561,1,1
223,jweyip,virpt,0.6369,NerveNetwork has Implemented Crosschain Asset Circulation with Binance Smart Chain BSC,1605702742,0,3
224,jwelid,CoinjoyAssistant,0.5574,A Dubai investment firm is staking  million worth of ETH to support the Eth launch,1605701078,0,1
225,jwdifr,gandhiN,0.6369,Made an list of  Best Etherum Solidity Courses amp training for absolute beginners  Updated ,1605695724,0,1
226,jwd13p,SatoshiBizzle,0.0,DeFi Database a new resource with over  DeFi projects listed,1605693060,0,3
227,jwcyjm,CoinjoyAssistant,0.0,ETH Price Breakout Imminent As Ethereum Eyes  Levels,1605692632,0,1
228,jwcclg,JashRathod99,0.4767,Types of Artificial Intelligence AI,1605689214,0,1
229,jwc6uj,bitcoin-panda,-0.296,If you ever wanted to launch your erc token now you can No coding skills required,1605688344,1,0
230,jwbw4k,coincashew,0.3182,Want to build a ETH Validator Last chance to test before mainnet Pyrmont Testnet starts today,1605686701,7,5
231,jwaxox,fuckgnmk,0.6124,Completely forgot how to access my ETH coins Please help,1605681755,24,7
232,jw92zf,maximovic97,0.0,Transfer my Ethereum from Coinbase to Binance DEX Ethereum Token,1605673346,0,1
233,jw8r26,Zodra00,0.0,Thinking of mining a bit on the side if possible,1605672035,13,2
234,jw6wo0,moonshothunters,0.0,YFUNI presale is on LID partnered with  Dextools  Quillhash Audit  LID Protocol,1605665020,0,1
235,jw62g0,darcius79,0.4939,Rocket Pool  Medalla Beta Concludes,1605662057,9,13
236,jw5xj9,benchmark_protocol,0.0,We are the New Benchmark,1605661577,0,1
237,jw4y1i,vinpee_pro,0.0,Farm Trade,1605658124,0,1
238,jw4d77,CelebrationDear,0.0,Forsage,1605656128,0,1
239,jw41xx,abcoathup,0.7351,New version of OpenZeppelin Defender  Send transactions via the Relayer page  Withdraw funds from your Relayer  Improved support for Keepr Network Relayers  see what is coming up,1605655087,0,3
240,jw2wdh,BanklessHQ,0.0,How to maximize your Ledger,1605651395,0,0
241,jw2ri8,TobiHovey,0.7269,Mysterious Ethereum Ad Offers Reward for Solving This Puzzle,1605650968,0,1
242,jw2q90,Vitiell0,0.0,Crossed  ETH staked for ETH launch,1605650862,283,300
243,jw1p7j,[deleted],0.0, Reasons Ethereums Future Hangs in Balance Over EIP  Gas Fee Reform,1605647793,0,1
244,jw1g0e,mathiaszip,0.0,Ethereum Steam group,1605647044,0,1
245,jw0n2q,TheCurious0ne,0.0,Bitcoin at almost ATH while ETH at  of its ATH,1605644626,2,1
246,jw0jdy,coinmetrics,0.6597,DeFi market cap has started to rebound and has been climbing since early November thanks to a surge in ETH,1605644318,0,1
247,jw0a88,[deleted],0.8126,Idea virtual Secret Santa but with small amounts of crypto held as collateral until the gift is received by the other party,1605643560,0,1
248,jw0806,johnbjorn,0.2732,Ethereums God  Apotheosis on the Blockchain,1605643390,2,0
250,jw0044,openbitlab,0.3818,Idle raises M to scale its Yield Optimization Protocol,1605642737,0,3
251,jvzqso,Finecryptolady,0.0,What stock are you trading,1605641943,0,1
252,jvzd83,JBSchweitzer,0.0772,Medalla data challenge results,1605640792,0,9
253,jvz9i1,Catstail69,-0.6124,Is this a eth scam just found it retweeted with burner account to test and was imediatly locked,1605640490,2,0
254,jvz9e8,cryptonaut101,0.2263,Definitize to Allow Mining of DCARE Tokens SoonHow You Can Participate,1605640482,0,1
255,jvz8bz,Euronian,0.0,API Public Token Distribution Event,1605640390,0,1
256,jvz0o7,lwilson747,0.0,Decentralized Applications DApps,1605639724,0,1
257,jvy7lo,shayanbahal,0.0,Token Interaction Checklist  ConsenSys Diligence,1605637288,0,2
258,jvy3od,MagoCrypto,0.2023,Sergey Nazarov and Matthew Gould discuss how blockchain domains are becoming a decentralized ID and why its important,1605636953,11,39
259,jvxxs5,mudgen,0.0,Storing SVG Images in Contract Bytecode,1605636451,8,6
260,jvxbdo,Sufficient_Animator3,0.4215,Will Yield Farming  Dividend Sharing Be The Next Trend For DeFi,1605634553,0,1
261,jvx2y2,wmredditor,0.0,Worlds th Largest Bank and Others Pick Ethereum For New Digital Currency Project,1605633825,0,1
262,jvwmlh,zoolanderz,-0.4404,ETH Genesis Block,1605632437,8,0
263,jvwj7m,zoozoo121212,-0.4404,Genesis Block,1605632138,0,1
264,jvw631,ResponsibleArmy8225,0.296,Creating ERC Token and Contract,1605630978,0,1
265,jvw5nm,onegift1,0.0,Loststolen ETH,1605630937,0,1
266,jvw3wz,haxlllega,0.0,Ledger alows staking on Nano X,1605630786,0,1
268,jvvtru,TobiHovey,0.2263,Ethereums Top  Dapps Reach One Million Daily Users,1605629889,4,1
269,jvvowc,WinterPerception0,0.7579,ETH  launch is near but upgrade account is still only  full,1605629454,0,1
270,jvvesx,yoosh_crypto,0.7184,ETH Mooning,1605628549,1,1
271,jvv4a9,[deleted],0.4588,Ethereum Call To Arms Bankless NL,1605627577,0,1
272,jvus98,skystar14,-0.3818,Biggest Obstacles to Ethereum slaying it in  years from now,1605626440,17,7
273,jvuath,cainethelongshot,0.0,Sending ERC tokens to a ETH address generated on Trezor Suite,1605624819,3,2
274,jvu6r4,DappRadar,0.5423,Top  Ethereum dapps account for over  daily active users,1605624422,0,1
275,jvu3mm,johncarrycse,0.0,Curve Finance about Peanut,1605624114,0,1
