,id,author,vader,title,created_utc,num_comments,score
276,jvtx0r,BC_userstudy,-0.4588,Short academic survey What makes you as a Blockchain user more unique than nonusers We need you to evaluate your use of the Blockchain Technology Personal information disclosure is voluntary for compensation More info in description,1605623438,0,1
277,jvtuyt,coinmonks,0.0,Coinmonks newsletter of the week,1605623224,0,1
278,jvspnd,Crypto_Economist42,-0.6486,Coinmarketcap is still falsely labelling infura as being down This is market manipulation Shame on them,1605618638,9,1
279,jvsjre,federiconitidi,0.3612,UNI Incentive coming to an end  Whats next,1605617951,0,1
280,jvsgwa,mpoloq00,0.4767,ETH  Phase   query regarding rewards,1605617579,0,1
281,jvs4tk,ethmarek,-0.0258,Saw this poster in Warsaw metro today,1605616052,100,322
282,jvs3wr,[deleted],0.0,Breaking  ETH deposited today The current staking balance  ETH,1605615930,2,1
283,jvs004,Czfacts,0.296,Ethereum and Ripple to be Considered as Securities,1605615404,0,1
284,jvrzhg,mngigi,0.0,Will ETH  Launch by December st,1605615339,0,1
285,jvrow1,_iamvlad,0.4767,Staking Rewards Report ,1605613843,2,1
286,jvrmcs,DragonAvocados,0.0,Gastronomic and Other Wonders of DeFi or Mining Which One Should You Choose,1605613462,4,11
287,jvr51k,[deleted],-0.2732,Just a naive attempt to organize the Ethereum ecosystem in a single page,1605610913,0,1
288,jvqubi,hunnykaushal3,0.4215,STKR making ETH staking easier,1605609284,0,2
289,jvqfdi,Rainmakerman,-0.6486,DeFi protocol Origin gets attacked loses  million,1605607027,1,1
290,jvos3a,pcaversaccio,-0.4939,Urgent OUSD has hacked and there has been a loss of funds,1605597843,39,52
291,jvnj7l,[deleted],0.0,ZKSwap Live on the Ethereum Ropsten Testnet,1605591566,0,1
292,jvmpvd,ZKSwap,0.0,ZKSwap an AMM modeled layer dex based on ZKRollups is now live on Ethereum Ropsten testnet,1605587957,0,1
293,jvmpav,ZKSwap,0.0,ZKSwap a ZKRollup layer dex with AMM model is now live on Ropsten,1605587889,0,1
294,jvlemc,c-i-s-c-o,0.7003,POLL ETH holders that are NOT staking Would you change your mind if you could stake by delegating the task to a trusted rd party,1605582595,51,0
295,jvkoat,JBSchweitzer,0.0,AMA We are the EFs Eth  Research Team Pt   November ,1605579815,433,25
296,jvkbii,jennilynns90,0.0,ETH Mining Should I still jump in,1605578467,15,1
297,jvk0ml,BBY_KyberNetwork,0.0,KyberDAO Increasing Ecosystem Participation,1605577335,2,2
298,jvhxjf,remykonings,0.5106,Streamr is going strong on Data Unions with the EU legislation,1605569680,0,3
299,jvh9q6,BanklessHQ,0.4588,A Call to Arms,1605567414,0,0
300,jvh9lr,Solodeji,0.0,Ethereum Foundation Set To Sponsor Projects within ETH  Staking Sphere,1605567402,0,1
301,jumhpn,initzero88,0.4019,Help  How to remove a malware on Ledger Live ,1605449745,23,4
302,jumcmp,dezzy94,-0.296,Ethereum price prediction ETH descending to lower traces,1605449114,0,1
303,jum37h,remykonings,0.0,Streamr is making ways with DataUnions into GDPR in Europe,1605447939,0,11
304,jul7vx,AlanOne89,0.0,DeFi How Does it Compare Against Centralized Finance  Hacker Noon,1605443645,2,3
305,jukuao,CryptoLouise,0.0,Time to Remove Liquidity from UniSwap Claim UNI Unstake amp Remove Liquidity,1605441645,0,1
306,juk5l0,illusion000,0.5859,Become a validator using win,1605437643,53,64
307,juk28i,bitcoinsky,0.0,Where do I get  GEth,1605437064,4,0
308,jui5bp,mindgo,0.2263,does it worth to put some ether in a Staking Service now,1605425368,3,1
309,jui4we,unimaxfoundation,0.0, UniMax Finance amp Exchange ,1605425296,0,1
310,juhuh0,cometothecaml,0.34,A simple explanation of the Value DeFi hack,1605423622,13,1
311,juhnc2,Nurisyafiqah,0.7184,Buy Ethereum amp Crypto in Gulf Exchanges Guide to Crypto in the Middle East,1605422501,0,1
312,jugmpc,DowntownPin4,0.4576,This casino blockchain is about to witness a major boost,1605417378,0,1
313,jufv4d,shlok6988,0.0,CRSTLs unique burn,1605413809,0,1
314,jufte3,shlok6988,0.0,Crystal Finance features an enhanced,1605413587,0,1
315,jufk0a,OGHaze1,0.0,Stakefarm and game,1605412440,0,1
316,judmtx,dabagaboo,0.0772,Reaching out for help  Eth stolen,1605404335,11,1
317,judc6w,E-renter,0.5432,Rinkeby txs not showing up block explorer past  hours,1605403157,0,1
318,jucl1k,helloforrest,0.0,Wrapped Bitcoin WBTC Explained in Under  Seconds,1605400190,0,1
319,juc36b,Forward_Thinking01,-0.2732,Risk mitigation for ETH  validators  if there was a massive internet outage how would access the internet,1605398290,10,1
320,juc1dw,MoonshotSoon,0.0,Bitcoin fractal suggests ethereum will soon see large leg higher,1605398097,0,1
321,juc05e,MoonshotSoon,0.0,Ethereum Price Analysis,1605397970,0,1
322,jubzod,MoonshotSoon,0.6597,Ethereum Price Analysis ETH Bulls Stopped by  Resistance is  Still In Play,1605397920,0,1
323,ju9tnd,Apokathistemi,0.0,I sent ETC to a ETH address,1605389771,0,1
324,ju9sbr,christianjnorman,0.4019,Ethereum smart contracts and private key importing,1605389634,0,1
325,ju8d2h,ali12345678911,0.0,DEFI,1605384554,0,1
326,ju7dw1,AlCapown3d,0.0,HTML snippet for auctioning off adspace on Ethereum,1605381173,0,1
327,ju6b9y,Smith901,0.0,New Crypto,1605377422,0,1
328,ju5pz7,crypto8228,-0.25,Software needed to run properly a Ethereum  NODE,1605375333,0,1
329,ju4zdx,Dr-Maximum,0.4215,So much white noise on EIP online has the proposal been approved yet is there a date for implementation in sight ,1605372712,21,1
330,ju4rq4,SomerEsat,0.2411,PSA My Ethereum  Staking Guides Medalla Testnet are a resource for learning how to stake on Ubuntu without risking your funds,1605371930,58,1
331,ju4eq8,bordoisse,0.4101,What Is Civic And Why Is It Performing So Well,1605370633,0,1
332,ju45fy,migoses,0.0,Staying sane in the world of crypto markets,1605369702,0,1
333,ju453j,shannon2806,0.0,Etherisc teams up with Chainlink to deliver crop insurance in Kenya,1605369670,5,1
334,ju3uyp,Euronian,0.4588,Crypto Startup Wants to Break Chainlinks Grip on Oracle Market  Decrypt,1605368637,0,1
335,ju3uge,Zane_TLI,0.0,On Ethereum  PoS howwhen are new coins minted,1605368586,6,1
336,ju33lg,XgambleOnline,0.0,XGambleOnline  Home of the XGAT Token learn more,1605365657,0,1
337,ju2eq4,rabpeanet1986,0.0,The most frequent breakdowns when mining ether and what to do with them,1605362689,2,1
338,ju1pvh,shlok6988,0.0,Crystal Finance features an enhanced DeFi,1605359476,0,1
339,ju1ofp,Gullible-Register579,0.3612,Who controls the amount of ETH  Will it ever have a maximum supply like bitcoin,1605359279,0,1
340,ju1k0t,bdinu89,0.0,The  Most Lucrative Trading Pairs for UniSwap Liquidity Providers in ,1605358652,0,1
341,ju1deo,Czfacts,0.3182,Huge Ethereum Blackout Powers Crypto Trades to Impede Withdrawals  TCR,1605357698,0,1
342,ju0wdz,Rammboss69,0.0,asdasd,1605355163,0,1
343,jtzv8u,MemeyCurmudgeon,0.0,Is it possible to change a validator from one machine to another,1605348933,11,1
344,jtz24m,gabbysancez,0.0,Ethere future predictions,1605343943,0,1
345,jtyld1,Crypto_Economist42,0.3736,I want to stake  ETH in the Deposit Contract but Im worried it wont hit the launch target How can the EF reassure me that my ETH wont be stuck forever if we never hit the target,1605341358,41,1
346,jtykp7,Crypto_Economist42,-0.7003,Coinmarketcap still falsely states for days that Infura is down This is a suppression tactic and illegal market manipulation,1605341267,26,1
347,jtx5fg,xDraper,-0.1779,Accidental hard fork,1605334530,0,1
348,jtx4ne,xDraper,-0.1779,Whats this accidental hard fork,1605334423,0,1
349,jtwmhw,coinizie,0.0,Learn how to get a  return on investment of your capital in cryptocurrencies at a registered company,1605331950,0,1
350,jtw2xq,coinizie,0.0772,Do you want to get up to  ROI cryptocurrencies in a registered company ,1605329454,0,1
351,jtvvqr,cryptobyksquare,0.5859,Amazing Ethereum has a undo transaction button,1605328558,0,1
352,jttb83,ADintheA,-0.4449,Not my proudest fapVitalika,1605318181,3,1
353,jtsi8r,twigwam,0.0,A jampacked edition of Whats New in Eth   November ,1605315159,0,1
354,jtr17a,judgewooden,0.0,Should I become an ETH validator or not,1605309820,9,1
355,jtqo5o,Ayoola-victor,0.0,This Indicator Shows Ethereum is Structurally Similar to Where BTC Was in ,1605308601,2,1
356,jtowpu,Sponta7,0.0,Two similar transactions but one used  gas and the other why,1605302828,1,1
357,jtophn,cryptoboy1,0.0772,LexisNexis Risk Solutions  one of the largest protectors of private and confidential data in the world  and UK Fintech startup Nuggets announce a formalised partnership working together to enable the implementation of selfsovereign digital identity SSI solutions,1605302202,0,1
358,jtoljx,listening_intensely,0.0,Where to find out about the latest DeFi projects,1605301875,0,1
359,jtoho8,SadClock5925,0.0,Where to find info about up and coming DeFi projects,1605301576,0,1
360,jtnlb3,trogdortb001,0.5719,Alexandra Botez prominent Chess player amp Twitch streamer asks Vitalik to play,1605298994,95,1
361,jtnfiu,stratguy56,0.6369,The Best Crypto Exchanges for US Traders ,1605298617,0,1
362,jtn8nv,haxsyn,0.0,Introducing Etherflow by QuikNode,1605298213,1,1
363,jtn4bv,shayanbahal,0.6597,Dataset Smart Contract Sanctuary  All verified smart contracts from Etherscan,1605297856,0,1
364,jtlnfi,1blackhand,0.0,Secret Bids TrustMinimized Auction Contracts and again more Privacy for us all,1605293402,0,1
365,jtlm88,thehbro,0.3182,Economic Incentives for Proof of Stake,1605293302,0,1
366,jtlia6,myetheroll,0.0,The billionth DAI was just issued,1605292974,16,1
367,jtlfji,BrianAtSantiment,-0.2732,Ethereums Coin Supply  Held on Exchanges at TwoYear Low Levels  Santiment Insights,1605292736,2,1
369,jtl31p,BanklessHQ,0.0,The Weekly Rollup  November th,1605291688,1,1
370,jtkozo,Seanp023,0.0,Can you convert Binance PegETH tokens back to Ethereum,1605290506,6,1
371,jtk417,Mel_Britole,0.0,Validation,1605288738,3,1
372,jtk38c,whoseth,0.34,Blockchain Voting Can We Securely Vote Online,1605288681,0,1
373,jtk1rf,Informal_Writing6801,0.2263, worth of STAKE tokens sent to the ETH Deposit contract Why,1605288562,0,1
374,jtjtgp,JBSchweitzer,-0.296,eth quick update no   Danny Ryan,1605287857,2,2
375,jtjonf,cirpchejon1991,0.7184,News Emirex crypto exchange partners with First Bridge ITdevelopment company to develop better security solutions for cryptofinance industry,1605287461,4,2
376,jtj0m7,juicykitten22,0.0,How does ethereum sort out which transactions go where if a shorter chain becomes invalid Do they go to the longer chain,1605285467,2,1
377,jtiyou,StephanoC,0.0772,DeFi awaits Ethereum  and Accessibility expects us all,1605285314,0,1
378,jtix2v,asleppygorl,0.0,How does Ethereum figure out which transactions should be included on the longest chain when a shorter chain becomes invalid,1605285179,0,1
379,jtidou,SecretSalsaCrypto,0.0,Curve amp CRV Time To Go All In,1605283562,4,2
380,jtidma,DappRadar,0.0,One week later over  ETH currently M has been staked in the ETH deposit contract,1605283556,2,1
381,jthuvc,AmazingMG19,0.2023,Passive income with only  eth,1605282015,19,1
382,jthbuj,martin-btc75,0.7184,AMAZING PSYCHE COIN JOIN IT,1605280557,0,1
383,jth8rc,TobiHovey,-0.3818,Severe Bug Found in Core Library for Ethereum and ETC,1605280181,0,1
384,jth34x,[deleted],0.0,Ethereum Core Dev Meeting  ,1605278994,0,1
385,jnbb7l,coinmonks,0.0,A Comparison of Decentralised Crypto Funds,1604414148,0,1
386,jnazkq,pdxdrumtech,0.0,Grayscale Owns  Ethereum Supply After Acquiring  ETH Just Recently Analyst,1604412974,0,1
387,jnayys,yo-boi-alex,0.5859,Saw this Beauty Today on the Highway,1604412905,0,1
388,jnahc9,bordoisse,0.0,What is Ethboard,1604411063,0,1
389,jnadk9,bdinu89,-0.34,Could Huobis COO Alleged Arrest be Similar to OKExs Probe,1604410636,0,1
390,jna3xi,defidon,0.8481,DeFi DAO matches CZs M offer to new Binance Smart Chain Community with a welcome bonus of  for each new user,1604409543,0,1
391,jn9v3e,CoinjoyAssistant,-0.4767,Vitalik Buterin and the wrong predictions about the US elections,1604408502,0,1
392,jn9udg,twigwam,0.6908,Today the Associated Press AP will be using an Ethereum account to post US Presidential race calls to an Ethereum smart contract,1604408418,40,1
393,jn92qr,JimnyJones,0.4215,Mysterium Network Product Updates  October   Full report on whats in progress,1604404943,0,1
394,jn92cp,coinmonks,0.0,The World Of NFTs Part   The Present,1604404895,0,1
395,jn84ka,Gillynator,0.0,Question on transaction,1604399998,0,1
396,jn7rlb,koindeks,-0.7906,Market Killer Found This Whale Dumped Bitcoin Ethereum and Ripple,1604397910,0,1
397,jn7ogh,bdinu89,-0.5499,PayPal Has Big Plans For Crypto But Theres a Problem,1604397428,0,1
398,jn6nx5,calixtoportal,0.6249,Security when deploing smart contracts,1604391525,0,1
399,jn666l,WelcomeAwkward4135,0.0,Thinking about privacy on Ethereum ,1604388834,0,1
400,jn5xq0,coinmonks,0.1531,GasToken or how I learned to stop worrying and love gas price surges,1604387561,0,1
401,jn5u1a,erics0082,0.886,Finally just got the last of my  ETH Is it beneficial to set up a validator for staking now or waiting until phase  is complete Also any info on the best way to do it would be appreciated,1604387022,44,1
402,jn3zu9,Winter-Effective-623,0.0,Coinbase earn compound,1604378297,0,1
403,jn3srw,SmoothyFinance,0.0,Introduce Smoothy,1604377443,0,1
404,jn2xgo,mrsotkogaming,0.0,These Institutions Are Buying Up All The Bitcoin  Get Yours Before They Do,1604373930,0,1
405,jn0axt,Gillynator,0.0,question on transaction time,1604364320,0,1
406,jn09jv,Gillynator,-0.296,Missing ETH,1604364192,0,1
407,jmzj5t,Constant_Camp_1575,0.0,BeaconScan Guild Warz,1604361715,0,1
408,jmz32y,HikariWS,0.0,How will shards interact on ETH ,1604360181,3,1
409,jmyz7p,HikariWS,0.0,test,1604359821,0,1
410,jmymo2,BanklessHQ,-0.3818,The Fight Thats Yet to Come,1604358656,4,1
411,jmyfsc,coinmonks,0.0,Why do we Tolerate Censorship in DeFi,1604358048,8,1
412,jmw705,1waymarsticket,0.6597,Now you can play Call of Duty using DAI,1604351148,3,1
413,jmw45l,wmredditor,0.0,From K to  Billion DeFi King Uniswap Marks  Year Anniversary,1604350933,0,1
414,jmw3em,garolhtyd,0.0,YKEEPR  Legit KEEPR Fork,1604350877,0,1
415,jmvnw4,bdinu89,0.0,Automated Market Makers AMM  Everything You Need to Know,1604349625,0,1
416,jmv52s,mudgen,0.34,How Diamond Storage Works,1604347966,0,1
417,jmuz5h,Minestre,0.0,ETH  vs NEO ,1604347437,0,1
418,jmuolb,yahia_ghadiry,-0.3384,Very low hash rate compared to expected,1604346478,4,1
419,jmrqcw,mnsx37,0.0,VS Code extension to monitor the current gas price,1604337613,0,1
420,jmrnl3,sandravale85,0.5719,EmiSwap AMM Exchange to Perfect The DeFi Market,1604337378,8,1
421,jmr4hi,BanklessHQ,0.0,How Crypto is Empowering with Grayscales Director of Research Phil Bonello,1604335829,0,1
422,jmr2mf,yahia_ghadiry,0.0,How much internet does mining use,1604335680,9,1
423,jmr0tl,ChildhoodChance3019,0.9287,Crypto Mining Enthusiast This is your chance to buy Crypto Mining Equipment at the best price over the internet  REDUCED PRICES,1604335525,0,1
424,jmqn1x,Sh0tgunSh0gun,0.0,What is The Graph what is the role of Curators and why do we need them,1604334385,0,1
425,jmqk45,EvanVanNess,0.0, Latest Week in Ethereum News,1604334138,3,1
426,jmq89x,Hanzburger,0.0,Where can I find info on the status of ETH phases,1604333155,3,1
427,jmpfx8,apkhyil,0.0,When CRO holders find out about Plutus,1604330807,1,1
428,jmog3m,KamikazeChief,0.7717,Which are the best websites to learn about ethereum  and things like Defi,1604327606,1,1
429,jmoe4k,sasha_sh,0.0,Interview with Andre Cronje  DeFi Architect and Creator of Yearn Finance,1604327421,1,1
430,jmn9t9,CoinjoyAssistant,0.4019,How to efficiently trade with Ethereum,1604323272,0,1
431,jmn038,Mihailbat,0.9081,Gitcoin is proud to announce another awesome hackathon sponsored by Conflux with over K in prizes You will learn how to build the future of commerce which is more collaborative equitable and decentralized There will also be bounties from cosponsors such as AAVE and Chainlink Come join us,1604322151,0,1
432,jmmu5g,coinmonks,0.0,A Dive into Ethereum Transaction Details,1604321467,0,1
433,jmm8pp,JoshSucksYT,0.0,Just started mining eth how much will I make in a month with one GPU,1604318767,0,1
434,jmm5kp,bdinu89,0.0,Reserve Bank of Australia Plans to Launch Digital Currency on Ethereum,1604318380,0,1
435,jmkwxo,MintableOfficial,0.0,How a DAO can be ran by NFTs completely  a new type of DAO,1604311805,24,1
436,jmkqyw,Neophyte-,-0.6486,I think an eth killer is a fallacy be it ada dot etc if anything they will only complement eth even in  full phase what do you think,1604310878,0,1
437,jmk2kp,Usefulaluable,0.0,Research shows Bitcoin rally negatively impacted DeFi market,1604306886,0,1
438,jmj3ff,mudgen,0.34,Addressing Josselin Feists Concerns of EIP Diamond Standard,1604301395,0,1
439,jmgy05,lotusway,0.0,MNE,1604290885,0,1
440,jmfbn5,jklepatch,0.0,Harvest Finance M Hack Explained Step By Step,1604284184,2,1
441,jmetam,twigwam,0.0,Ethereums ConsenSys adds another CBDC project partnership w National Australia Bank,1604282121,11,1
442,jmc7o9,bucketup123,0.0,New Ethereum based MMORPG uses erc mineable as in game currency,1604272231,56,1
443,jmbn7u,WomanBorePinecone,0.0,New Defi Token BiDao What do you guys think,1604270204,0,1
444,jma7vu,WolfOfFusion,0.4215,Is there a chance Ethereums Wrapped Bitcoin WBTC could one day enter the Top  MC overtaking XRP and Tether,1604265303,6,1
445,jm9rsw,lapelotanodobla,-0.4404,Read contract state at specific block,1604263798,2,1
446,jm9bkj,mbtonev,0.4019,How to deploy Ethereum Smart Contract via remix IDE to the live network,1604262272,0,1
447,jm8pjt,albnasc,-0.4767,Buffett once said crypto is trash do you think hes wrong,1604260262,12,1
448,jm58vx,bdinu89,0.0,Privacy Tips on Storing and Transacting Ether ETH in ,1604248702,0,1
449,jm4b2f,volgarswami,0.0,Comparing Eth Clients on the Medalla Network,1604245404,1,1
450,jm1s71,Riemengeld,0.34,Why does ETH have a value,1604235372,4,1
451,jm0jua,WiseAcanthisitta5,0.0,State of Stablecoins,1604228902,2,1
452,jm0gxu,nugget_alex,0.2023,This Weeks Top Bitcoin Ethereum DeFi amp Global Finance News,1604228437,1,1
453,jlxvus,twigwam,0.0,Verizon Launches Tech to Log Press Releases on Ethereum,1604211890,3,1
454,jlwk7n,mrsotkogaming,0.5719,Happy Birthday Bitcoin Whitepaper  Years,1604204855,0,1
455,jlvvo6,Melinda_McCartney,0.0,Saving Uniswap v,1604201676,0,1
456,jltmny,OminousLatinWord,0.3612,What running a Geth node on a Raspberry Pi feels like,1604191887,73,1
457,jltm8c,twigwam,0.0,Whats New in Eth   October  ,1604191833,4,1
458,jlt8im,BrandonZ0302,0.0, Ethereum,1604190251,0,1
459,jlrq87,confusedguy1212,0.0,Is Vlad Zamfir still part of the Ethereum Foundation,1604184282,11,1
460,jlqeqq,nabering,0.0,Uniswap Governance Explained,1604179363,0,1
461,jlokpu,sherlock_0x7C4,0.0,How do I simulate multiple users in a remix unit test,1604172831,0,1
462,jloflk,rfkinline,0.2023,Finished coding my Raspberry Pi to be a ETH Dashboard Includes important market data news and tokens in your portfolio across multiple addresses All life and realtime,1604172339,1,1
463,jlmrni,EvanVanNess,0.0,The Crypto News Podcast episode  MyCrypto CEO Taylor Monahan,1604166641,0,1
464,jllnfg,rfkinline,0.2023,ETH Dashboard  on a Raspberry Pi Includes important market data news and tokens in your portfolio across multiple addresses All life and realtime,1604162851,0,1
465,jllej8,arslanbajwa,0.34,Four elements of DeFi value discovery,1604162008,0,1
466,jll7bm,BruhDLT,0.3612,Any opinion on the need for a blockchain indexing and querying protocol Like the Graph Will the Ethereum blockchain need such a thing,1604161330,7,1
467,jsvplp,TobiHovey,0.0,Not Enough People Are Staking on Ethereum  Heres why,1605191998,0,1
468,jsvjsg,DappRadar,0.0,DeFi and HighRisk dapps Whats the difference,1605191420,0,1
469,jsv7ij,linkedkeenan,0.0,sOIL and iOIL now live on Synthetix Powered by Chainlink,1605190186,1,1
470,jsv47w,RobertForster,0.0,The Case for Demurrage Tokens,1605189854,0,1
471,jsv3l7,kirill_stakewise,0.0,StakeWise v  introducing Tokens upgraded infrastructure and final beta,1605189794,0,1
473,jsu1ub,coinsmash1,0.0,Realtime Uniswap Markets now Live on Cryptowatch,1605185469,0,1
474,jstxmv,JimnyJones,0.0,Mysterium Network Product Updates,1605184918,0,1
475,jstrw1,ZergShotgunAndYou,0.4588,LIVE Ethereum  Call     GMT,1605184155,3,1
476,jstrvv,wise_quote,0.0,Bitcoin Undo Button Comes to Ethereum Blockchain,1605184154,17,1
477,jstj4j,Innuendo000Z,0.5949,Tornado gas fee so high,1605183001,2,1
478,jstfce,Nurisyafiqah,0.7184,Buy Bitcoin amp Crypto in Gulf Exchanges Guide to Crypto in the Middle East,1605182490,0,1
479,jstc5g,apstl88,0.0,Fuse Network activates delegated staking putting control in the hands of token holders,1605182045,1,1
480,jss1iy,YoungandInvestingYT,0.0,Why  will be THE YEAR of ETHEREUM,1605174886,0,1
481,jsrwab,bench4rench,0.3818,Ethereums Infuraiating Outage Revives Decentralization Concerns  CoinMarketCap,1605174037,0,1
482,jsrol4,Crypto_push,0.128,that feeling,1605172782,0,1
483,jsro87,WinterPerception0,0.0,MoonBeam project to recreate Ethereum functionality on Polkadot,1605172724,0,1
484,jsretj,jasz3217,0.0,Is ZK rollup a kind of sidechain,1605171224,18,1
485,jspshd,NullPhantom666,0.0,PSA ETHGasStation is currently returning wildly incorrect GAS prices,1605162608,3,1
486,jspo3d,MysticalPixels,0.4404, Etherium and a few good investors,1605161992,0,1
487,jspg4e,petein3d,0.6369,Best prediction markets,1605160958,4,1
488,jsotlv,STILL_DETOX,0.3612,How does staking validate without using a lot of processing power,1605158123,3,1
489,jsoh7n,masonicRed,0.0,Wrapped Filecoin pool goes live on Uniswap,1605156639,0,1
490,jsk08p,TobiHovey,0.0,This Ethereum Whale Owns the Most Expensive NFT of ,1605140064,0,1
491,jsjmci,letsgetbit,0.0,Ethereum  meme,1605138800,0,1
492,jsj7j2,xoinsotron,-0.25,Can my laptop run staking,1605137419,11,1
493,jsix5a,ricenbeats,0.4767,Are Ethereum  staking rewards paid in ETH or USDfiat,1605136475,3,1
494,jsinyp,moatus,0.2263,It may be worth considering a decentralized infrastructure for DeFi,1605135672,1,1
495,jsijtd,whoseth,0.4019,Idea for early Ethereum Stakers to receive special collectibles Vitalik signed ERCs,1605135319,0,1
496,jsigbh,BanklessHQ,0.6369,The Best DeFi Indices for Your Crypto Portfolio,1605135018,0,1
497,jsiegc,whoseth,0.4019,Idea for early Ethereum Stakers to receive special collectibles Vitalik signed ERCs Similar to this,1605134853,0,1
498,jsh7v0,ZooGanger,-0.2422,Update to Freewallet scam Everyone PLEASE READ,1605131217,0,1
499,jsh3ud,JayWelsh,0.4404,Today I realised that I could make an ETH  Deposit Contract minimum genesis status tracker by making a few small adjustments to a tool that I built for myself to track my portfolio here it is in case anyone finds it useful,1605130891,13,1
500,jsg5g9,lwilson747,0.0,Complete Ethereum amp Solidity Developer Masterclass,1605126759,0,1
501,jsftxi,applesEgo,0.0,LiquidStake set to unlock liquidity for Ethereum  Phase  stakers,1605125813,1,1
502,jsfs5f,CieloCorazon,0.0,Blockchain Futurist Conference,1605125672,1,1
503,jsezjb,PAAlmasi,0.0,InfuraDowntime and How Alchemy Remained Up,1605123386,1,1
504,jsertm,alive_consequence,0.0,Archive Nodes vs Full Nodes,1605122744,11,1
505,jsdv0i,friendsfingers,0.2732,Create an ERC Token in less than a minute,1605120020,0,1
506,jsduua,Asesinato,-0.3167,Im extremely hesitant to stake my Ethereum,1605120006,176,1
507,jscwuk,remykonings,0.6486,This years Streamr Network analysis revealed that it is on par with the top centralized services when it comes to latency  a stumbling block for many PP networks  while its scalability is superior thanks to decentralization Read the whitepaper,1605117161,1,1
508,jscei8,Solodeji,-0.7003,Vitalik Buterin Denies the Fork of Ethereum Network Stresses the Cause of Infura Service Outage,1605115639,0,1
509,jsc8wh,CadeltesMekmi,0.4588,Just made a video about ETH  you are welcome to have a look and give me your thoughts ,1605115178,0,1
510,jsc6mu,splix,0.0,Running faulttolerant Ethereum API,1605114984,0,1
511,jsc4zr,10gaugebang,0.0772,I want some adviceideas about staking,1605114850,0,1
512,jsc30z,bitrefill,0.0,Living on crypto in Vietnam An interview with Quynh Nguyen,1605114678,0,1
513,jsbg7r,MarcelaRaynes,0.0,Ethereum  Launch Timeline According To Vitalik Buterin Interview CoCreator of Ethereum,1605112779,0,1
514,jsb12t,TobiHovey,0.0,The M Question How to Stake Ethereum  and Stay Liquid,1605111446,0,1
515,jsav7u,StevenRad,0.0,DARMA Capital will allocate M in ETH to ETH staking,1605110944,0,1
516,jsa94a,ethereumhodler,0.0,looking for advice on staking,1605108978,0,1
517,jsa5se,TangerineParadise,0.6808,Compilation of useful Crypto Trading  Economic news Telegram channels Maybe that will help you,1605108678,0,1
518,jsa44b,linkedkeenan,0.0,TrustToken Introduces Proof of Reserve for TUSD Stablecoin in Collaboration With Chainlink and,1605108531,0,1
519,js9pj2,SuspiciousEyes2,0.0,How Ethereum is moving from PoW to PoS,1605107159,0,1
520,js95hf,entr_ashish,0.0,CoinDCX prepares to introduce UserFriendly Staking on ETH ,1605105210,0,1
521,js8yll,WelcomeAwkward4135,-0.25,Setting NFT trends in  with Aavegochi Matic Opensea Terra Virtua Zed Run ,1605104520,0,1
522,js8g5x,MeanTimeMeTime,0.0,We need more stakers,1605102620,1,1
523,js8fx4,Bjorketre,0.6808,Question Is there anywhere i can stake by using a safe third party Coinbase etc,1605102594,18,1
524,js8acz,Crypto_guide,0.0,Ethereum Service Providers Report Issues Blockchain Allegedly Faced Chain Split,1605102002,0,1
525,js89iy,nugget_alex,0.7906,The Greatest Opportunity Of Our Lifetimes  Mike Novogratz of Galaxy Digital,1605101911,1,1
526,js80xr,Solodeji,0.4767,Vitalik Buterin Says Staking Rewards and Penalties Policy of Ethereum  Have Been Reconsidered,1605100953,0,1
527,js7rb3,AlanOne89,0.0,Ethereum split on Vitalik Buterins blockchain  The Cryptonomist,1605099864,0,1
528,js7nbu,CoinjoyAssistant,0.4019,Binance donates  to support Ethereum projects,1605099436,0,1
