,id,author,vader,title,created_utc,num_comments,score
1062,jr60r7,lwilson747,0.0,Ethereum Developer Masterclass  Blockchain Development with Certificate of Completion,1604954942,0,1
1063,jr5tl0,sinner_man123,0.7184,how to buy lbc from hotbit,1604954365,0,1
1064,jr5s4a,i_like_dolphins_,0.3865,How on earth Tether is not absolutely condemned by the crypto community,1604954245,157,1
1065,jr55h4,Acceptable_Door7841,0.0,How to submit  eth to Ethereum  step by step,1604952371,0,1
1066,jr4law,Acceptable_Door7841,0.4939,Ethereum  is about to start Do I have to bet  Ethereum before December st I dont have  eth yet After December st I will have  eth Will I still have a chance to join  by then,1604950727,0,1
1067,k30hzb,studentofsolidity,0.0,Will ETH from the ETH chain and ETH from the ETH chain coexist at the same time and potentially trade at different prices,1606614304,0,1
1068,k2yeak,whiteninja123,0.0,Ether Supply,1606606888,0,1
1069,k2xgxo,Davinter30,0.0,Why does bitcoin price affect ethereum so much ,1606603638,46,1
1070,k2xgd8,daxiddee,0.0,Prepaid Visa amp Mastercard Rebates  OFF,1606603585,0,1
1071,k2x1p5,rohilegkl,0.0,  amp    ,1606602208,0,1
1072,k2w3d4,cryptosperm,0.3182,ETH transaction inputs in terms of a CPU means currently we have a hz CPU Eth is estimated  Khz CPU This is a X increase from our current CPU Do you realize how big this is,1606598969,0,1
1073,k2uqrk,JRBro,0.0,how i think Ethereum works OC,1606594474,34,1
1074,k2uhq5,ManamiH,0.6124,Ive an ethereum node working for receivingwithdrawing ETH will I need to upgrade it or something because of ETH  or are they different networks,1606593656,0,1
1075,k2udtn,berkekayaa,0.296,This is actually how eth is creating ,1606593308,4,1
1076,k2u2fs,9955335480,0.5106,MAKE MONEY ONLINE AND CREATE TRAFFIC,1606592258,0,1
1077,k2tik1,JillianCielBleu,-0.4019,Error sending OCEAN to exchange,1606590443,3,1
1078,k2th44,datboilee,0.0,BASE ABOUT TO GO LIVE,1606590320,0,1
1079,k2srs7,[deleted],0.3612,What Will It Be Like The Three Stages of US Martial Law and The Signs to Look For Before it Happens,1606588015,0,1
1080,k2soqs,traveladdikt,0.0,Can I still stake ETH on ETH We have till December st right,1606587746,6,1
1081,k2rxv7,Snap_Dragon11,0.5106,The original vision of bitcoins early adopters was that cryptocurrency would replace the legacy financial system Instead the cryptocurrency ecosystem is being absorbed into it,1606585337,0,1
1082,k2rkma,astroprojector,0.3182,Please explain how ETH  affects mining,1606584182,2,1
1083,k2q2tl,rich_bomb40,0.0,can i become to be validator with macbookpro on macOS,1606579323,0,1
1084,k2psf9,TheCurrencyA,-0.4019,Ethereum Retail Buyers Cash Out and Crypto Greed Continues in the Market,1606578330,0,1
1085,k2ont8,Ds123455,0.0,Layer DEX ZKSwap Tutorial,1606574227,0,1
1086,k2ncbz,zuev_egor,0.0,Possible EIP proposal Elliptic SSS scheme,1606568774,2,1
1087,k2llme,az0r4,0.4767,Can i still earn staking rewards if i cannot stake myself,1606559931,0,1
1088,k2ljf0,harjas2517,0.1779,An CETF holds assets such as cryptocurrency tokens coins,1606559602,0,1
1089,k2lfou,MoonshotSoon,0.3612,Ethereum  New proposal aims to ease the PoS transition,1606559025,31,1
1090,k2lf3y,BusinessViki,0.7717,Get your lucky Bull from Stobox BlackFriday,1606558929,0,1
1091,k2kuet,Komentatorkvadrat,-0.4588,LAST TIME BITCOIN DID THIS WAS IN  AND WE PUMPED  short term CAUTION,1606555612,0,1
1092,k2ksow,DuryMan,-0.4767,dangerous Malware,1606555316,0,1
1093,k2kpv2,baqar978,0.0,Defi project,1606554860,0,1
1094,k2knnr,sorepie,0.0,State Of Ethereum ecosystem as it seem to Investors,1606554511,0,1
1095,k2kmae,baqar978,0.0,Moondefi liquidity and staking,1606554295,0,1
1096,k2k96k,mdmahfuzurrhmn,0.0,Emporium Finance liquidity mining,1606552281,0,1
1097,k2jyy8,hankeybanky,0.0,Where can i bet on Trump,1606550725,0,1
1098,k2jjov,badshahjan,0.6369,Tokenizer you can find the best Token,1606548439,0,1
1099,k2jcf2,phaz33,-0.25,Stuck transaction with literally  fee sent,1606547378,0,1
1100,k2j1qx,BenBerlin,0.0,Someone is trying to build a sharded DLT in three weeks as proof of concept,1606545904,54,1
1101,k2iiv9,neonintubation,-0.4019,What is this contract Was my Ledger hacked,1606543450,1,1
1102,k2ib13,wasmyledgerhacked,-0.4019,Does anyone recognize this Ethereum address Was my Ledger hacked,1606542469,0,1
1103,k2hyq3,Black_Dragon007,0.0,Should we build Skynet on Ethereum,1606540940,0,1
1104,k2hy0t,grimonkey,0.4019,Help needed to understand eth depositdata file,1606540853,4,1
1105,k2hr2y,darksidesandthings,0.0,Newb wanting to get started,1606540025,5,1
1106,k2gsin,carloschettick,0.368,IDEALOGY Ideas and Projects through Crowdfunding,1606536370,0,1
1107,k2g47a,gxyo,0.9325,RBlockchainlottery Love the game of chance Love Crypto Check us out  please be responsible,1606533868,0,1
1108,k2g0so,PureBeginning,0.0,I have  etherum for sale,1606533515,0,1
1109,k2fxr3,pi_nerd,0.0,When do those running validator nodes begin to earn ether,1606533189,4,1
1110,k2e13r,datboilee,0.0,ALLIANCEBLOCK X PARSIQ,1606526381,0,1
1111,k2dr0f,wilsonseann,0.0,Protocol Embedded Staking  A new way of stabilizing crypto tokens,1606525334,0,1
1112,k2cr2u,8stringLTD,0.0,Will Eth  have a unique price,1606521765,3,1
1113,k2c44r,Fresh_Pen4033,0.0, USERS WILL BE PMPING A COIN TO OVER  IN  MINUTES,1606519563,0,1
1114,k2c061,0xterence,0.0,Prysm pregenesis patch release,1606519175,0,1
1115,k2bv1r,the__itis,0.0,ETH  Staking Question With  ETH  validators or  validator,1606518672,27,1
1116,k29jz5,zuhalg,0.5719,Help I Forgot How I Created My Ethereum Address,1606510774,0,1
1117,k29iia,Solodeji,0.0,This New Proposal Suggests How Ethereum Would Transition into PoS without Unnecessary Complexity,1606510642,0,1
1118,k29d7f,hexorx,0.0,Butterfly Protocol is in launch mode,1606510127,0,1
1119,k28k2t,tompetreshere,0.0,What to do with my  ETH Just kick back,1606507525,59,1
1120,k27xvn,coinmonks,0.0,The Skynet Hypothesis Why Im Betting Big on Yearn Finance YFI,1606505610,0,1
1121,k27tpp,rollingincrypto,0.128,BlockApps launched Ethereum based agricultural crop tracking network,1606505257,0,1
1122,k27qi2,TobiHovey,0.0,Proposal Suggests How Ethereum May be Folded Into Eth ,1606504987,0,1
1123,k26zhz,coinmonks,-0.4404,DNS Attacks Summary,1606502649,0,1
1124,k26krh,-chr0i,0.5994, Fundamental Factors Driving New Ethereum Bull Cycle Says Head of DTC Capital,1606501432,0,1
1125,k265az,theMASTERMIND66,0.5994,This video makes a comparison between Value investing and other strategies like crypto do you think Buffett s strategy is outdated,1606500155,0,1
1126,k2651p,kataraCode,0.0,Ideas  Project,1606500133,0,1
1127,k25rc6,eidron06,0.7184,Where should a beginner buy ethereum,1606499007,0,1
1128,k25kl4,twigwam,0.0,SomerEsats Lighthouse Nimbus Prysm Teku ETH Staking Guides,1606498443,0,1
1129,k25kbz,SilenzFr,0.0,I dont understand how ethereum  can offer finality,1606498421,0,1
1130,k25gjk,jbaylina,0.5766,Introducing the First L Interoperability Mechanism with Hermez Massive Migrations,1606498102,2,1
1131,k25cwa,Ironman49024,-0.4497, seed words but lost the order,1606497799,0,1
1132,k24vlr,victoroshi99,0.1779,Emporium Finance is set to empower merchants of all sizes to adopt ecommerce through digital currency on Ethereum blockchain,1606496376,0,1
1133,k24iv3,superduplicants,0.0,Ive just notice the price difference between etherscan coinmarketcap and coicodex,1606495227,0,1
1134,k24493,grg090,-0.34, Earn  ETH  Simple Aave Flash Loan  UniSwap Trick No Coding Required ,1606493948,0,1
1135,k23qt2,slootsgoonasloot,0.5664,If the whole point of decentralization is to not rely on a rd party dont dApps contradict itself,1606492809,4,1
1136,k234jb,JBSchweitzer,-0.296,eth quick update no   Danny Ryan,1606490830,2,1
1137,k22u7o,SecretSalsaCrypto,0.0,Crypto Tips Tools for your DeFi tokens,1606489880,0,1
1138,jpcjcc,BrianAtSantiment,0.4019,Santiment on TwEthereums Daily Active Addresses Headed for Highest Divergence vs Price in Three Weeks itter,1604693808,0,1
1139,jpc935,Tummes,0.4019,A few hopefully simple ELI questions for PoS,1604692894,23,1
1140,jpbuu4,finematics,0.0,Can ETH Become Deflationary EIP  Explained,1604691643,0,1
1141,jpb5a9,john-trevolting,0.0,Is eWasm still a thing,1604689418,13,1
1142,jpajrt,tokenoflove,0.3612,Will ETH becoming deflationary like BTC,1604687536,0,1
1143,jpaflw,NOTPR0,0.6808,You can now easily send multiple token transfers put payment memos for references or messages and batch Eth transfers to save gas all in ONE transaction with TransferX,1604687177,0,1
1144,jpa3fc,bdinu89,0.6124,Grayscale Ethereum Trust Crosses B in Assets Under Management,1604686095,0,1
1145,jxh7pu,RedVsBlueGVT,-0.4404,Red Vs Blue Gameplay Video  Early Alpha,1605841131,0,1
1146,jxgp6m,someguitarplayer,0.0772,Dmitry Buterin on Twitter All i want for Christmas is ETH  beacon chain to be up and running,1605839072,0,1
1148,jxezq9,[deleted],0.0,WEF Lists Blockchain Internet Creator Elastos in Global Innovators Community,1605832598,0,1
1149,jxey29,[deleted],0.0,As DeFi Grows Investors Look to Polkadot to Be the Next Ethereum,1605832427,0,1
1150,jxdyec,mudgen,0.3566,Organize contracts so they share the same contract storage and Ethereum address,1605828854,0,1
1151,jxdcud,TobiHovey,0.0,Ethereumbased Origin Puts  Million Bounty on OUSD Hacker,1605826744,0,1
1152,jxcwnh,BrianAtSantiment,0.0,Ethereum Behavior Analysis Update  Santiment Insights,1605825196,2,1
1153,jxcl11,Ayoola-victor,0.0,Nearly  of Bitcoins Circulating Supply Now Tokenized on Ethereum,1605824114,41,2
1154,jxcemf,Ferran_vocdoni,0.431,Its not that bad Open letter to MIT Digital Currency Initiative on anonymous voting,1605823536,0,1
1155,jxcbxf,fightforthefuture,-0.2177,The government wants to see your crypto transactions FINCEN and the Federal Reserve just proposed a new rule that would allow for more warrantless surveillance and that could make it more expensive and difficult to use crypto They are taking comments now until the th so make your voice heard,1605823300,4,1
1156,jxc8mw,purpleyak0,0.0,Is staking ETH a taxable event,1605823019,6,1
1157,jxc46z,openbitlab,0.0,Introducing the new Idle Governance Model,1605822619,0,1
1158,jxbspa,hapiti,0.0,Why  Eth,1605821591,9,1
1159,jxbs5r,lunokhod2,0.0,What noncustodial staking options exist,1605821542,14,1
1160,jxbapv,CryptoLouise,0.4588,Earn Interest with Ledger Live amp Compound Finance,1605820021,0,1
1161,jxb8ao,BanklessHQ,0.4033,Running an ETH Validator for the Barely Motivated,1605819803,2,1
1162,jx95nv,ancap17,0.0,Should i stake ETH,1605813330,19,1
1163,jx8hgu,Har01d,0.0,Ethereum  phase  countdown dashboard ,1605811328,4,2
1164,jx8frd,mikeblue7,0.0,GLT Tokenized dual physicaldigital crypto collectibles,1605811178,0,1
1165,jx7u8y,federiconitidi,0.4019,How to calculate the return from your Curve Boost,1605809406,0,1
1166,jx7be3,dojogang,0.0,PrimeDAO  A knowledgeable and assisted construction community,1605807883,0,1
1167,jx6ziv,jklepatch,0.0,Ethereum  Staking Tutorial  Setup Guide for running Validator on Pyrmont Testnet  Mainnet,1605806867,0,1
1168,jx6rsk,poojaranjan19,0.4588,Account Abstraction Community Call,1605806191,0,1
1169,jx6gcs,conor_10,0.0,Eth Launchpad Deposit Contract Walkthrough,1605805225,0,1
1170,jx6adv,SomerEsat,0.0,Updated Guide for UbuntuLighthousePyrmont,1605804710,1,1
1171,jx668z,jerry297,0.7322,Ankr STKR really did a fab job ETH  staking is easy now with STKR Micropools,1605804348,3,1
1172,jx5yhx,[deleted],0.5719,Ankrs STKR going toe to toe in the success of ETH  ETH is gonna change the whole scenario of crypto,1605803683,0,1
1173,jx5pb6,excellentchoiceyes,0.0,Account Abstraction EIP Why amp What,1605802919,1,1
1174,jx5n69,ais89,-0.2732,Why is Ethereums price lagging behind Bitcoin and Litecoins recent jump in price,1605802730,0,1
1175,jx5id4,PotentialFortune,0.0,The Ternio Story How This Small FinTech Is Revolutionizing Payments With Digital Currency  TechBullion,1605802308,0,1
1176,jx5gh4,the_fastestman_alive,0.296,WORKING BITCOIN GENERATOR  EARN  BTC PER DAY   LEGIT BITCOIN MONEY ADD  PROOF ,1605802141,0,1
1177,jx4o7d,coinsmash1,0.0,What is Uniswap  New Post Explains Protocol UNI token amp Governance,1605799609,0,1
1178,jx4etf,mariapaulafn,0.0,GNT to GLM Migration,1605798745,0,1
1179,jx48yq,deapool232,0.0,How to search an ethereum address,1605798209,3,1
1180,jx48yn,NoreenDeets,0.5859,This is the video Binance keeps trying to downvte and hide Please save it to reshare,1605798208,0,1
1181,jx47x4,blackrod14,0.0,DFinance release the mainnet version of the Dfinance blockchain,1605798113,0,1
1182,jx40pd,ksatoshi,-0.7351,This screams scam,1605797442,0,1
1183,jx3x94,ibelite,0.0516,ETH  Deposit Contract Reaches ,1605797108,85,1
1185,jx3hyb,anmolgaur45,0.0,Matic becomes the first outside Ethereum to launch native Chainlink feeds,1605795623,0,1
1186,jx3a3i,oed_,0.0,How to store signed and encrypted data on IPFS,1605794825,2,1
1187,jx396m,linkedkeenan,0.5267,Matic Network Launches Live Chainlink Price Feeds to Support its Growing DeFi Ecosystem,1605794726,0,1
1188,jx24vs,kethfinex,0.296,CertusOne ChorusOne PPValidator stakefish amp StakingFacilities join Lido as validators for liquid Ethereum staking,1605790344,0,1
1189,jx1i2t,ethmarek,0.0,Did xPoland just post the first clue,1605787456,21,4
1190,jx16c6,BTCUser_,0.0,Remaining Decentralized in a Centralized World,1605785854,0,2
1191,jx11nq,TheCurrencyA,0.4019,Ethereum May Be the Amazon of the Future Vitalik on Having a Vision and Believing In it,1605785193,0,1
1192,jx0s7p,suclearnub,0.0,Releasing some really old ENS addresses,1605783824,17,1
1193,jx0ra6,EthFair,0.0,new DeFi project ERC standard tokens,1605783690,0,1
1194,jwzwo2,Empire_Building101,0.0,So you think you can stake,1605779109,0,1
1195,jwzixi,CoinjoyAssistant,0.0,ETH   Vitalik Outlines  year Transformation plan for ETH ,1605776967,0,1
1196,jwzhxz,AngryAllosaurus,0.0,Polkadot DeFi Environment Moonbeam Releases EthereumCompatible Version,1605776813,0,1
1197,jwyrc3,xtarsy,0.0258,Ethereum  Serenity Update  k ETH deposited  days remaining to reach k ETH,1605772819,6,1
1198,jwvgue,[deleted],-0.6486,Concerned about Polkadot being an Ethereum killer,1605757867,0,1
1199,jwv79i,abcoathup,0.5719,Happy fifth birthday ERC ,1605756833,20,7
1200,jwv1vp,bpopkenny,0.7783,Best recommended token by BPOP of yesterday LTC Recommended KOL,1605756256,0,1
1201,jwu730,SenadBYW,0.7739,Selling ALL My NIO Stock To BUY This Investment Instead  ETH,1605753010,0,1
1202,jwti54,PaulMorphyForPrez,0.6369,Why does USDT often offer higher interest rates than other stable coins,1605750451,14,2
1203,jwssyx,BitcoinJae,0.5766, Reasons Ethereum Could Go To Its ALL TIME HIGH in   ETH ,1605747902,0,1
1204,jwspsw,ba5icsp00k,0.0,Etheruem  A few things to clarify,1605747609,12,2
1205,jwq8fw,Solodeji,0.3818,Vitalik Buterin Ethereum  Benefits Such As k TPS Will Come Faster Than People Expect,1605739258,0,1
1206,jwq2op,CherriesBlueberries0,0.0,On Emiswap Ethereumbased DeFi users can use collectible NFTcards used to multiplex personal revenue in Liquidity Pools,1605738738,4,16
1207,jwpt37,SomerEsat,0.0,Updated Guide for UbuntuPrysmPyrmont,1605737881,2,2
1208,jwpjbn,binkyb0y,0.0,New to crypto,1605737008,0,1
1209,jwpgqq,TobiHovey,0.0,Lil Yachty Grammy Nominated Rapper to Launch Ethereum Token,1605736788,8,1
1210,jwpe6x,poojaranjan19,0.6124,Shedding light on the Ethereum Network Upgrade Process,1605736564,0,1
1211,jwp8ds,BanklessHQ,0.0,Bonding Together,1605736059,0,1
1212,jwp14l,coinmonks,0.0,Universal IDE to query blockchain data,1605735396,0,1
1213,jwoaq6,DarthBarfBarf,0.0,Question about contract addresses,1605733127,1,3
1214,jwo84v,Ok-Carpenter7338,0.296,Reloaded Finance needs a front lead  join as cofounder  massive potential AMM,1605732897,0,1
1215,jwo57y,Jackogormano,0.0,ETH end of year prediction,1605732655,2,1
1216,jwnma4,cryptoctl,0.4404,Easy setup of an ETH  staking node,1605731086,1,2
1218,jwnh9q,Fnmokh,0.0,Looking for a guide to tokenize goods real estate cars luxury items etc,1605730661,5,0
1219,jwmxnv,jennilynns90,0.2732,Is ETH forking to create ETH,1605729010,4,1
1220,jwmst3,willwarren89,0.0,You can now trade  tokens on Matcha,1605728602,0,6
1221,jwmmrk,MayraGoodwin,0.0,DYMMAX liquidity pools and how do they function,1605728101,0,1
1222,jwm2l3,WeDoBtcBoost,0.0,Ethereum booster x   eth required to participate ,1605726483,0,1
1223,jwldke,lwilson747,0.0,Certified Solidity Developer CSD,1605724408,0,1
1224,jwkdat,albnasc,0.0,Michael Bloomberg story and how he built a fortune off the financial information you use everyday,1605721439,0,1
1225,jwk6v5,shlok6988,0.0,CRSTL will oversee the DAOStakeholders,1605720891,0,1
1226,jwk2zm,shlok6988,0.8625,CrystalDefi Blockchain great growth and will have a bright future,1605720570,0,1
1227,jwk2nd,[deleted],0.5267,PS for the crypto lovers,1605720542,30,5
1228,jwjxfh,levijohnson1,0.0,Bitcoin Suisse expects to offer Ethereum staking before Christmas,1605720100,1,1
1229,jwjrws,coinmonks,0.6369,How to stake  ETH  The best practices ETH staking,1605719636,0,1
1230,jwja9x,Aggravating-Vast1873,0.0,Recovery Info,1605718159,0,1
1231,jwj9k9,ymylfn,0.0,Mintable redesigned ERC for NFT,1605718096,0,1
1232,jwj8sx,Oweinrub,0.0,Vitalik Buterin Explains Ethereum And Its Origin Vitalik Buterin Interview Ethereum CoCreator,1605718030,2,4
1233,jz532l,virpt,0.0,Realworld applications drive NULS usage,1606084278,0,1
1234,jz4pwd,EvanVanNess,0.3612,Latest Week in Ethereum News Who is ready for stake ,1606083013,5,1
1235,jz4lc8,twigwam,0.0,BlockApps launches Ethereumbased Agritech network in collaboration with Bayer,1606082587,0,1
1236,jz45bb,indetronable,0.0258, days ago ETH  deposit contract was at  ETH Today we are at   ETH At currents rates we will reach the needed amount in less than  days ,1606081161,13,1
1237,jz43km,timeistheonlymoney,0.4466,JOKE Can I use the Ethereum blockchain to send a message back in time,1606081006,0,1
1238,jz3k1w,d1444,-0.5423,Newb here Will ethereum drop below  again,1606079274,3,1
1239,jz2utj,Defusion55,0.5267,So is ETH  going to create inflation or a massive increase in ETH supply come phase ,1606076971,11,1
1240,jz2f8g,zavisnik,0.5994,Where to buy low amounts of eth,1606075569,0,1
1241,jz2cud,dreadpirate_nakamoto,0.0,Announcing DARBE a Layer  Token for DAI,1606075360,0,1
1242,jz28c5,SomerEsat,0.0,Updated Guide for UbuntuPyrmontTeku,1606074978,0,1
1243,jz1u3y,Cryptognomes,0.0,Preordered two PSs,1606073694,0,1
1244,jz1gxw,BrianAtSantiment,0.2023,Ethereums NonWhales Outside the Top  Largest Addresses Hold the Highest Percent of ETHs Total Supply in  Months,1606072487,1,1
1245,jz1fwj,amos1994,0.3612,Origintrail Data Marketplaces Explained Food Data Marketplace  December st Launch  Privacy By Design  Origintrail Ready For Takeoff  Built On Ethereum,1606072391,0,1
1246,jz1egl,[deleted],0.3612,Origintrail Data Marketplaces Explained Food Data Marketplace  December st Launch  Privacy By Design  Origintrail Ready For Takeoff  Built On Ethereum,1606072259,0,1
1247,jz123o,Zlizard,0.0,Ethereum Lambo,1606071154,0,1
1248,jz0rgj,chiava95,0.4019,set function in my smart contractWhy doesnt it work,1606070181,0,1
1249,jz0p6j,Irrelephantoops,0.6705,Hope it helps,1606069975,1,1
1250,jz0ozv,CryptoChickenSoup,-0.5423,Newb here Will ethereum drop below  again ,1606069959,0,1
1251,jz0mnr,TheAnabolicDiet,0.4939,Thai music festival to use its own token for a cashless event,1606069748,19,1
1252,jz0kkm,wuhanvirusparty,0.0,Reputable crypto lottery,1606069548,9,1
1253,jz0fi6,thecryptomask,0.0,For those who dont stake what happens to their ETH on Dec ,1606069081,3,1
1254,jz0a5q,JayWelsh,0.0, of the minimum required stake for Ethereum  Serenity Phase  to launch has been achieved,1606068592,42,1
1255,jz098q,ibelite,0.0516,ETH Deposit Contract Reaches ,1606068515,114,1
1256,jz018l,theoryofbang,0.4588, gwei in gas how long will this take,1606067806,2,1
1257,jyzts4,pipapannekoek,0.0,Earn up to  with Coinbase Earn,1606067112,0,1
1258,jyzr2r,AlCapown3d,0.0,Ethereum in domain name,1606066882,4,1
1259,jyzmax,SenadBYW,0.0,My  Cryptocurrency Investment Portfolio REVEALED  Must Watch,1606066463,0,1
1260,jyxyac,vegeta_mavi,0.0,Is coinfabrik legit,1606060882,0,1
1261,jyxx52,lunarcrush,0.0,With Increasing Social Activity Ethereum is Coin of the Day on LunarCRUSH,1606060782,0,1
1262,jyxgdr,Fishpatrick1997,0.0,Ethereum ,1606059072,0,1
1263,jyxbag,VasiaPupkin3000,-0.296,No Fee Trading,1606058556,0,1
1264,jywxts,coinmonks,0.0,Rebalancing DPI,1606057173,0,1
1265,jywjhj,phunkstein,0.4019,Looking for help,1606055552,1,1
1266,jywbji,fart_McNugget,-0.34,Firing up the grill,1606054650,0,1
1267,jyw0be,ada4247,0.25,Ethereum   The risk vs rewards analysis,1606053366,0,1
1268,jyvwmp,apexwaldo,0.0,Stablecoin idea,1606052910,2,1
1269,jyvts9,rich_bomb40,0.0,Can i stake ethereum ,1606052569,0,1
1270,jyv9wr,bench4rench,0.0,Weekly Crypto News Roundup   Stories You Should Know About th of November  nd of November,1606050005,0,1
1271,jyv7u1,Educator_Anxious,0.0,I didnt know I had to have eth balance to send usdt,1606049722,0,1
1272,jyuqln,SwapzoneIO,0.9042,Eth is a set of upgrades that will improve the scalability security amp sustainability of Ethereum On the st of December we hope to see the Beacon Chain go live Learn more about the Ethereum upgrade before the event in our publishx piece,1606047270,0,1
1273,jytyce,rdm41,0.25,Today needs to be a very big day to have a chance at a  launch,1606043140,80,1
1274,jyt2px,meanjan,0.4019,ette EVMbased Blockchain Indexer with historical data query amp realtime notification support,1606037949,0,1
1275,jysj94,baqar978,0.0,Moondefi,1606034718,0,1
1276,jyse1s,rudtjeban,0.5719,Curious Questions About Metamask And Its Security,1606033860,1,1
1277,jysbx3,Hugobrookz,0.0,Have a Coffee now with this Current Scenario,1606033510,0,1
1278,jys4xt,PazCrypt,0.0,ETH  staking pool,1606032373,1,1
1279,jyrfg0,Astro32s,0.1531,Ethereum character for a Street Fighter game  looking for comments,1606028390,0,1
1280,jyr742,mdmahfuzurrhmn,0.5719,Emporium Finance Marketplace and Governance reward program,1606027151,0,1
1281,jyqp7q,Bitman321,0.25,How to quickly find the things you do the most on ethereum with this open source tool I created,1606024711,0,1
1282,jyqnrm,vintagegold1234,0.0,Ethereum Validators Idea,1606024508,0,1
1283,jyq5t3,jklepatch,0.0,Build your own staking pool for ETH ,1606022120,3,1
1284,jypy57,Fragsworth,0.6249,Where can I find the best concise but comprehensive documentation on how the new Proof of Stake works,1606021174,2,1
1285,jypiyg,vintagegold1234,-0.5423,Ethereum Validators Can You Use Time Slices of Blockchain History to Discover Bad Validators,1606019277,0,1
1287,jyjvbn,tunnckoCore,0.0,Brainstorming on registering custom and decentralized gTLDs,1605997350,1,1
1288,jyjseq,twigwam,0.0,Bitcoin Suisse to Deposit Nearly  ETH to Ethereum ,1605997059,18,1
1289,jyjs9h,Solodeji,0.3182,Ethereum  Deposit Contract in Steady Increase with Over  ETH Deposited Buterin Has So Far Sent  ETH,1605997046,2,1
1290,jyjbgl,-chr0i,0.0,Parabolic rally a real possibility after Ethereum price surges to ,1605995401,0,1
1291,jyiw8q,wwetnaojw,-0.836,Worst mistake of my life gas mistake,1605993891,98,1
1292,jyh5gx,0xf1d0,0.0,Probability of generating valid private key of ethereum account,1605987829,0,1
1293,jyh2pb,Crypto_Economist42,0.0,The Deposit contract has passed  ETH,1605987572,0,1
1294,jygny3,nickcrofts,0.0258, eth staked Projected target reach date dec th,1605986218,0,1
1295,jyg5w2,42069qwertz42069,0.0,Need adviceopinions,1605984591,0,1
1296,jyg1jl,BGnimma,0.0772,Want to swap my PS for ETH,1605984200,0,1
1297,jyfl9l,danteharker,0.7184,If you had  in Eth would you sellswap it to buy Bitcoin right now,1605982751,0,1
1298,jyfi0r,loveYouEth,0.0,Releasing ENS names,1605982441,1,1
1299,jyfffw,vympel_0001,0.0,Investing in Ether,1605982197,0,1
1300,jyf5h6,stefek99,0.0857,What is the tool showing me the TX fees in the mempool including the median in the current block,1605981290,1,1
1301,jyeb8d,hmd758,0.0,CryptoEmporium,1605978518,0,1
1302,jydto8,Crypto-Account,0.0,Staked Ethereum increases by  in just  hours,1605976912,113,1
1303,jydpi5,_marioc_,0.0,Your ETH price predictions for ,1605976525,0,1
1304,jydkww,grasponcrypto,0.5994,There should be a POAP for addresses with balances before and after  and  bull runs,1605976101,2,1
1305,jyd72d,technocrypto,0.2263,Why did it take  years A tweet thread explaining what made the beaconchain worth waiting for,1605974768,37,1
1306,jycn6l,ActualSalary5,0.0,Eth hype,1605972844,0,1
1307,k17enz,CumagMonkey,0.0,Tokamak Network joined DTT Alliance,1606361184,0,1
1308,k17dp8,dunnmines,0.0,Satoshi,1606361066,0,1
1309,k17avk,Shapushki,0.5719,Help I Forgot How I Created An Ethereum Address,1606360742,0,1
1310,k16st2,Shapushki,0.5719,Help I Forgot How I Created An Ethereum Address That Has Coins In It,1606358720,0,1
1311,k16jp3,ligi,0.6249,Great way to pick up your ETH node,1606357760,1,1
1312,k16dw7,Shapushki,0.5719,Help I Dont Know How I Created An Ethereum Address How Can I Access My Coins,1606357116,0,1
1313,k15men,backtosaveu,0.0,I just purchased  ETH,1606354191,18,1
1314,k158g6,lovingtheseaa,0.0,Will ETH go up,1606352679,0,1
1315,k13i2j,TwitchScrubing,0.0,How much eth do you need to stake with the new update,1606346410,1,1
1316,k13ei5,Cryptognomes,0.5719,Can I make anyone happy with a PS for retail price,1606346091,0,1
1317,k13cud,econoar,0.0,EthHub Weekly  Ethereum  Genesis set for  Yam announces Umbrella Protocol Andre Cronje introduces Deriswap Connext Network details Vector and Jeff Colemans thread on eth,1606345943,0,1
1318,k12yo1,who_just_in,0.4927,Is Ethereum the most useful network in the world,1606344722,4,1
1319,k12lca,m-chrzan,0.3182,A while back I wrote about a novel onchain auction design Heres a few variations on the theme,1606343585,0,1
1320,k12j38,Confesional,0.0,Institutional preToken Sale research report DXone Exchange,1606343391,1,1
1321,k11lwe,DuRtY_Crypto,0.6245,Ethereum  Is Here  Next Major DeFi Project WISE Token,1606340577,0,1
1322,k1176y,baqar978,0.0,Tokenizer Chain,1606339346,0,1
