,id,author,vader,title,created_utc,num_comments,score
529,js7d8l,Har01d,-0.296,Technical details on todays Ethereum chain split that caused many services to stop working,1605098217,5,1
530,js6sis,shewenttotalanakin,0.0,What moves the price of crypto,1605095542,0,1
531,js6rcn,i_like_rocks8,-0.3612,Where can I find a guide for dumbs on how to stake on ETH ,1605095374,0,1
532,js6qbh,Vandal36,0.0,Strongblock incentiviced Full Eth nodes,1605095235,0,1
533,js6m32,i_am_mortimer,0.0,Fix MetaMask issues while Infura is down,1605094659,0,1
534,js6m2p,WinterPerception0,0.0,What is Ethereum ,1605094658,0,1
535,js6ktd,i_am_mortimer,0.0,Fix MetaMask while Infura is down,1605094493,0,1
536,js64gc,ExeciN,0.0,Launchpad issues,1605092120,5,1
537,js5uuw,DazzlingBar,0.0,Introducing Peanut a DeFi Price Balancer That Increases Crypto LP Income,1605090724,0,1
538,js5ieh,TheCurrencyA,0.0,Vitalik Buterin Weighs the Cost of Attacks on PoW Chains against PoS Why ETH is Better,1605088931,0,1
539,js5h7z,juniper_os,0.3612,What do you imagine the future will be like with Ethereum,1605088769,0,1
540,js5eku,TheProdigalBootycall,0.6369,Best guide on staking eth,1605088384,0,1
541,js57dr,pcaversaccio,0.0,Ethereum infrastructure provider Infura is down crypto exchanges begin to disable ETH withdrawals,1605087289,108,1
542,js508s,andewthomson,0.5819,Saffron Finance SFI a new DeFi bluechip A very interesting contender in the Decentralized Finance space,1605086232,0,1
543,js4ztb,AlanOne89,0.4019,Binance donates  to support Ethereum projects  The Cryptonomist,1605086168,0,1
544,js4sk2,karalabe,0.5859,Security Go v is coming tomorrow a security release for Ethereum,1605085074,4,1
545,js4nh1,Plenix,0.5719,Reward running your own local node,1605084289,0,1
546,js4c5v,applesEgo,0.3818,Sam BankmanFried believes even ETH  cant handle DeFis potential growth,1605082613,0,1
547,js3fpx,insanespiral17,-0.6124,Just got hacked Lost all ETH and WBTC and USDC and AAVE Any suggestions,1605078014,0,1
548,js2yqs,cryptocomicon,-0.128,No need to run smart contracts on a blockchain once this is implemented,1605075778,0,1
549,js2vw5,cryptocomicon,0.0,Proof that it is possible to construct an unhackable program and a roadmap for doing it,1605075405,0,1
550,js2myk,decentralisebanksy,0.0, How to swap ETH to DAI on Uniswap and deposit DAI for pcDAI tickets on PoolTogether v ,1605074310,0,1
551,js21xp,mrsotkogaming,-0.4824,WARNING Hackers Draining Defi Markets,1605071725,0,1
552,js0vvx,farmingOnYieldApp,0.0,Upcoming launch of ERC token YLD with a  APY Ethereum DAO product,1605067096,0,1
553,js01qx,Acceptable_Door7841,0.0,Oasis Labs ROSE  All information about Oasis Labs ICO Token Sale  ICO Drops,1605063965,0,1
554,jrzodx,bpopkenny,0.7184,Best recommended token by BPOP of yesterday,1605062602,0,1
555,jzpwlr,virojobusiness,0.1531,I invite you to check this website where Can earn crypto for reading and writing articles ,1606163775,0,1
556,jzptn3,rdm41,0.0,Only  away from having enough ETH stakes to begin phase  for ETH ,1606163524,83,1
557,jzpoee,zFoux37,0.0,ETH  contract balance,1606163086,7,1
558,jzpdfr,lwilson747,0.0,Blockchain Revolution Specialization,1606162183,0,1
559,jzoypz,SolliliquiEr,-0.2023,Employer has given me a choice  pay my hourly salary in USD hr or pay me hr in Ethereum Which would you pick,1606161005,0,1
560,jzoy5w,thegreatced,0.0,  Molly Wintermute AI interview Hegic Developer MUST WATCH,1606160963,0,1
561,jzow4t,coinmonks,0.0, DeFi Bible   Must Knows Before You Enter The DeFi Space,1606160814,0,1
562,jzosku,stellarowl12,0.0,I made a deep dive overview of all things decentralized prediction markets running on Ethereum,1606160538,0,1
563,jzofi4,Matte171,0.2263,ETH deposit contract reach  only  hours after reaching ,1606159473,0,1
564,jzod3u,GnosisPM,0.0,Gnosis launches prediction marketbased collective GnosisDAO,1606159278,0,1
565,jzo78p,Shrabonk3534,0.6249,Great project,1606158775,0,1
566,jzo5h0,GnosisPM,0.0,Announcing GnosisDAO the predictionmarket driven collective,1606158625,0,1
567,jznemc,Fiach_Dubh,0.0,PayPal CEO Dan Schulman on CNN Talks Bitcoin Adoption and Digital Currencies  November rd ,1606156414,0,1
568,jzn6s6,ApartWorld298,-0.296,Missing Ether,1606155766,0,1
569,jzmlv8,litocoen,0.0,Read a full summary about HEGIC the new DeFI protocol bringing Options onto Ethereum,1606154081,1,1
570,jzmi6f,levijohnson1,0.4767,Clients of Bitcoin Suisse commit ETH worth USD m or  of all ETH needed for the launch of Ethereum ,1606153785,35,1
571,jzlku6,BanklessHQ,-0.6739, WTF Happened in   Meltem Demirors,1606151109,1,1
572,jzlck5,derp-skid-mark,0.0,ETH APR payments for staking,1606150468,2,1
573,jzlbs7,SolidShort2883,0.0,    We are on the cusp of history,1606150405,0,1
574,jzl1vs,bitrefill,0.0,Black Friday amp Cyber Monday on Bitrefill,1606149640,0,1
575,jzl00c,blersion,0.0,Why Is the Development of Ethereum  Necessary,1606149488,0,1
576,jzky70,bitrefill,0.25,Take advantage of Black Friday savings at Bitrefill,1606149333,0,1
577,jzkqdo,Bitcoin_Bender,0.0,The ultimate eth staking guide,1606148684,0,1
578,jzkka7,TheCurious0ne,0.0,Becoming tornado cash relay,1606148149,6,1
579,jzkio1,FlyOrangeBird,0.0,Ethereum Set to Erupt Higher Analyst Says,1606148003,0,1
580,jzkgyn,EthFair,0.0,EthFair  is a DeFi lottery project,1606147859,0,1
581,jzkd2b,samitannir,0.7906,Good opportunity for exclusive mentorship and dev work from top defi projects and founders,1606147535,0,1
582,jzkc2v,crypto_paper,-0.4019,Existing research about mofn paper seeds,1606147451,0,1
583,jzk5h3,Anthony-AltcoinXP,0.0,Two quick questions about Phase  Staking,1606146899,3,1
584,jzk1t4,Eclipseum,0.0,Eclipseum   Update  of Circulating Supply Locked for One Year,1606146569,0,1
585,jzjp34,Solodeji,0.0,Ethereum  Staking Deposits Surpass  of Required ETH As Price Hits ,1606145438,0,1
586,jzjkw8,Longjumping_Ebb_7301,0.0,A Minute Complete Guide to ETHEREUM ,1606145074,0,1
587,jzjg2v,roteck,-0.296,No mans land,1606144641,9,1
588,jzizt5,mcnicoll1,0.0,Crypto Emporium News,1606143215,0,1
589,jziy77,mcnicoll1,0.0,CryptoEmporium,1606143066,0,1
590,jzix5d,poojaranjan19,0.0,Danny Ryan on Peep an EIP Serenity Phase ,1606142968,0,1
591,jziwt6,spooky_listener,0.0,Web Tokens Threefold Token amp TFT,1606142938,0,1
592,jzitzr,LefterisJP,0.6124,Rotki the portfolio tracker that protects your privacy releases v with Eth staking and Uniswap support,1606142667,2,1
593,jzionq,TobiHovey,0.0,Ethereum Price Hits  for First Time Since June ,1606142146,0,1
594,jzini2,spooky_listener,0.4767,AAX Intelligence YFI CEL amp BTC,1606142037,0,1
595,jzifg4,AlteredMagnum,0.0,SwapDex coming at you The latest DEX in the DeFi world,1606141245,0,1
596,jzifdg,dt_22,0.4939,insert rocket emoji here,1606141237,1,1
597,jzicso,west38wa,0.0,ETHEREUM IS EXPLODING AS PREDICTED   NEXT ,1606140980,0,1
598,jzi5x6,naarme,0.0,The Psyche coin airdrop,1606140270,1,1
599,jzi2t7,Rafia5050,0.0,Emporium Finance,1606139969,0,1
600,jzi18x,CoinjoyAssistant,0.024,Ethereum Hits  Year High on Supply Deficit Woes More Gains Ahead,1606139806,0,1
601,jzhy96,mansoortaken,0.5106,Ethereum is now a Top  US traded asset by market cap,1606139490,0,1
602,jzhufu,torrentjay,0.0685,PLEASE HELP  Fail with error ERC transfer amount exceeds balance,1606139093,0,1
603,jzhsxn,dt_22,0.4939,insert rocket emoji,1606138940,0,1
604,jzhrk7,stork83,0.0,Emporium Finance   specifically chosen liquidity pools,1606138800,0,1
605,jzhqos,torrentjay,0.0685,PLEASE HELP  Fail with error ERC transfer amount exceeds balance,1606138706,0,1
606,jzhnwt,Ds123455,0.0,Bixin SNZ FBG back layer dex ZKSwap in  million angel round,1606138408,0,1
607,jzhk9f,fleixx,0.0,Beacon chain what now,1606138027,2,1
608,jzhaos,ibelite,0.1027,ETH  Deposit Contract reached just  day after ,1606136975,0,1
609,jzh99e,timeistheonlymoney,0.5719,What is Ethereums objective and when its  success what does it mean to everyone,1606136818,0,1
610,jzh4gw,BoziRap,0.0,Couple key points to remember when talking to people about ETH  in comparison to BTC,1606136318,0,1
611,jzh1dm,NineLiner,0.0,Detailed Analysis of Universal Market Access UMA,1606135940,0,1
612,jzgvlj,jsibelius,0.0,A concern regarding eth client centralisation,1606135260,3,1
613,jzg0gh,sorepie,0.0,Eth,1606131217,0,1
614,jzfxev,Fabrizio89,-0.128,How do I generate a private key offline,1606130798,3,1
615,jzf7bl,mnijs,0.0,Ethereum  FAQ,1606127078,1,1
616,jzf4jy,WinterPerception0,0.0,BlockApps partners with Bayer to launch new Ethereumbased network,1606126667,0,1
617,jzf4bb,SorenStephenson,0.0,Ethereum  Deposit Contracts Gather Steam As ETH Price Approaches ,1606126631,0,1
618,jzez47,coingecko,0.0,Vitalik Buterin NFT Sells for  ETH,1606125866,4,1
619,jzeyzi,Czfacts,0.0,An Ethereum address with a minimum of one ETH token can cross the mark of its previous ATH,1606125847,0,1
620,jzexze,KayleighSosnowski,-0.6917,US authorities not keen on dismissing sanctions charges based on Virgil Griffiths argument,1606125703,0,1
621,jzew21,Tricky_Troll,0.4404,An Easy to Understand Introduction to ETH  and its Different Phases,1606125409,28,1
622,jzeu1k,federiconitidi,0.3612,How to find the optimal liquidity pool allocation on Curve,1606125074,0,1
623,jzentf,xtarsy,0.4404,Ethereum  Staking Pool with Stkr  Easy way to stake any amount of ETH and keep your liquidity,1606124160,3,1
624,jzej8o,dapp_com,0.2023,Top Gambling DApps Ecosystem by d Volume  Ethereum M,1606123496,1,1
625,jze22v,JayWelsh,0.0,PSA Remember that the deadline for a st December Ethereum  launch is the th November  PM UTC,1606120946,1,1
626,jzdu17,ObjektiveX,0.0,ETH December ATH,1606119783,17,1
627,jzditz,mawa1127,0.0,ETH Genesis contract seeing uptick in deposits,1606118215,0,1
628,jzd6b6,abcoathup,0.6124,Crypto Trends  November   Nomic Labs DevX  Eth Genesis war effort gt  Prettier Solidity  Happy fifth birthday ERC ,1606116364,0,1
629,jzd481,Midbell,0.0,Looking for Mods for the rCryptoStaking subreddit,1606116082,0,1
631,jzcmw2,OpenLiterally,0.0,Are you currently purchasing,1606113684,0,1
632,jzboz3,elbalaa,0.3612,Noteworthy Token incentive distributed overlay networks,1606109383,0,1
633,jzazyg,heretoseexistence,-0.2342,NOOB question about ERC  GASFEES,1606106410,0,1
634,jz935c,HEX-Kit,0.0,ETH ,1606098814,68,1
635,jz8y6p,Tedskis,0.0,How to stake coins if they are on Bittrex,1606098269,0,1
636,jz8r3m,Stack3,0.0,Oracle for prices,1606097509,6,1
637,jz8k6p,garfield1110,-0.6124,I just fell for a scam puzzle and I just dont know why,1606096808,0,1
638,jz801x,azicedout,0.0,Eth  Staking Guide,1606094669,1,1
639,jz7biz,inoohbi,0.4588,Whats your favorite instructions for staking in Eth ,1606092189,0,1
640,jz7asy,bkhan123,0.0,New wave,1606092119,3,1
641,jz6b6f,webhaga,0.0,What is Ethereum  Ether ETH   For Beginners,1606088580,0,1
642,jz5wap,jrh_101,0.0,Q Quick question about Ethereum ,1606087135,0,1
643,jz5vcs,6imply,0.0,Sending to ETH deposit address manually,1606087046,0,1
644,jz5qfx,Texugo_do_mel,0.0772,Minimum number of validators necessary,1606086570,3,1
646,k223h5,AXEL_Network,0.0,Ethereum is officially on its way as the threshold for staked ETH to activate the process has been met,1606487466,0,1
647,k21twy,MarkyChoco,0.4939,This is good news for me and maybe for you I now know that Ethereum was funded through socalled crowdfunding group funding Vitalc Buttern is a researcher in the cryptolite as well as a battler programmer,1606486504,0,1
648,k21dp4,HolgerD77,0.0,EthereumJS VM v Release,1606484827,1,1
649,k209bh,nugget_alex,0.8519,This Months Top Ethereum News Innovation amp Development  Proudly Supported By Gitcoin,1606480171,3,1
650,k2085c,ZergShotgunAndYou,0.0,LIVE Ethereum Core Devs Meeting     UTC,1606480014,1,1
651,k1zuxz,baqar978,0.7184,Moon DeFi,1606478263,0,1
652,k1zrux,baqar978,0.0,tokenizerchain,1606477821,0,1
653,k1zhya,MintableOfficial,0.0,NFT DAOs  a game of governance not speculation  will projects switch to this governance style,1606476432,1,1
654,k1zhml,keyeker,0.1027, TOT give away for a limited time the first step for ecosystem incentives,1606476386,0,1
656,k1zf3m,jakkkmotivator,0.0,Ethereum  Is Launching On Dec Highlights Of The Changes To Ethereum Network,1606476063,0,1
657,k1z1kr,Alegarz,0.7531, Million Axion Giveaway  WORTH  Winner Announced In  Hours  Follow Steps To Enter,1606474152,0,1
658,k1yr06,cryptokoalaAus,0.0,Is the Bottom in BTC ETH XRP,1606472664,0,1
659,k1ypcw,sasha_sh,0.2023, METACAST Top Crypto Podcasts of November ,1606472442,0,1
660,k1ydd4,megalodn2,-0.128,ETH  Gas Demand and ETH Price,1606470776,0,1
661,k1y213,5starspace,0.5256,Why is nicehashs withdrawal fees so high,1606469111,4,1
662,k1y1ck,cryptogrubber,0.0,ETH gas price notification,1606469011,4,1
663,k1xmbg,SomerEsat,0.0,Eth Mainnet Staking Guide  Prysm,1606466868,9,1
664,k1x642,zerofruit,-0.6705,Why my Geth full node falls behind the block height comparing with the block number fetched from etherscan periodically,1606464541,0,1
665,k1woll,datboilee,0.0,A token pegged to total Crypto Market cap,1606462135,0,1
666,k1w7lb,keyeker,0.0,AMA with NANO CHAT,1606459845,0,1
667,k1w3wg,fulldecent,0.0,The Immutability Enforcement Proposal dies,1606459344,0,1
668,k1v4c6,keyeker,0.0,Base Protocol amp Boxmining  Understanding Rebase,1606454839,0,1
669,k1utkk,Enceladus999,0.34,Looking to build a new rig My first one is this a good list,1606453539,7,1
670,k1urps,SnooGoats2889,0.0,should we build this on Ethereum,1606453329,0,1
671,k1uo84,adrian6312,0.0,ENS Domain,1606452915,0,1
672,k1t91d,yiriwi,0.296,WORKING BITCOIN GENERATOR  EARN  BTC PER DAY   LEGIT BITCOIN MONEY ADD  PROOF  ,1606446720,0,1
673,k1t7ir,Particular-Sock5250,0.0,What happens to ETH when Eth  goes live,1606446544,0,1
674,k1sx4v,Delicious_Context_53,0.4019,Browse smart contracts,1606445368,0,1
675,k1sb2c,Flocculenta,0.0,Tokamak Network  The First OnDemand Layer  Aggregator to Debut  Coinspeaker,1606442899,0,1
676,k1qefh,bkc11,0.3612,Hello everyone How do I find out current ETH inflation rate Thank you ,1606435352,0,1
677,k1pzm3,XVXS-,0.0,bot on telegram,1606433809,0,1
678,k1orxl,SeanMclain,0.0,Etherium  Learning,1606429484,9,1
679,k1oksq,SomerEsat,0.0,Eth Mainnet Staking Guide  Teku,1606428819,0,1
680,k1o43u,deen5526,0.0,I just found  Ether in an old account I forgot I had,1606427271,133,1
681,k1o0op,radarmiss,0.7096,I am a sculptor and photographer and I am interested in trying my hand at making NFT art,1606426957,5,1
682,k1n1a6,Ds123455,0.0,ZKSwap Community GiveBack Coming Tomorrow ZKS to Testnet Users,1606423537,0,1
683,k1n0o3,ZKSwap,0.0,ZKSwap Community GiveBack Coming Tomorrow One Million ZKS to Testnet Users,1606423476,0,1
684,k1mjf5,abcoathup,0.7351,New in OpenZeppelin Defender  xDai support  JSON RPC endpoint  Improved address input  see what is coming up,1606421859,0,1
685,k1m5hg,openbitlab,0.0,After  year of activity Idle launches Governance merging UNI and COMP features,1606420559,0,1
686,k1ludx,jklepatch,-0.8468,How To Debug Metamask Errors DISCLAIMER NO FOX WAS HARMED DURING SHOOTING OF THIS VIDEO,1606419508,0,1
687,k1lbn6,shayanbahal,0.2263, Smart Contract Security Newsletter    This week Token Interaction checklist Ethereum accidental fork Flashloans are here to stay return of reentrancy attacks and more,1606417711,0,1
688,k1lahn,yeliaBdE,0.4404,Looking for a good introduction to Ethereum,1606417611,15,1
689,k1kzfg,dak9000,0.0,Macro Forces For and Against ETH Price,1606416626,0,1
690,k1kzdy,earlcottrell,0.0,Hey guys can I get your opinion on this project,1606416623,4,1
691,k1kx2g,Puzzleheaded-Ad-994,0.0,is test net up and running ,1606416407,0,1
692,k1kp1p,coinmonks,0.0,Decentralising the Cryptocurrency Derivatives Market,1606415702,0,1
693,k1knav,WidCoin_Platform,0.0,WidCoin CryptoCurrency,1606415544,0,1
694,k1km3o,WidCoin_Platform,0.0,WidCoin Cryptocurrency,1606415439,0,1
695,k1kg3q,helpprogram2,0.4588,Buy the dip,1606414914,0,1
696,k1kfzg,Eastlondonmanwithava,0.0,The Future we Choose,1606414903,0,1
697,k1jzrl,SilverShow,0.0,Ethereum  Less is more and more is coming  Next Event Ideas,1606413547,0,1
698,k1j2cb,RambleFeed,0.3612,Fidelity ready to offer Ethereum  announced by Christine Sandler,1606410712,0,1
699,k1iy2v,RambleFeed,0.5574,Ethereum Foundation Gives Out M in Grants to Boost Ecosystem,1606410364,0,1
700,k1ish8,OsrsNeedsF2P,-0.6597,Transaction fees are killing me,1606409932,0,1
701,k1i0qd,urgirlsmomsdaddy,0.0,Can you stake with less than ETH,1606407545,0,1
702,k1havw,iluvchickens,0.3182,Pray for me,1606405147,32,1
703,k1fo45,gajesh2007,0.25,I have created a video on Chainlink,1606399168,0,1
704,k1fmh6,dojogang,0.0,A tokenization framework is used to tokenize properties,1606398982,1,1
705,k1fb4g,_iamvlad,0.4767,Staking Rewards Report ,1606397676,2,1
707,k1f3tr,Aiwei1222,-0.296,Staking ETH lower than ETH,1606396804,0,1
708,k1erur,CryptoHuff,0.4588,Been in the crypto space since  Now I have finally decided to use ETH for my own interest Rate my project,1606395370,44,1
709,k1ecai,StephanoC,0.0,Announcing the next major ERC project to blast off on the TrustSwap Launchpad,1606393340,1,1
710,k1d7l4,Sebbo1337,0.0,updated list layer ,1606387885,0,1
711,k1czrd,McChuckleDuck,0.0,Online casinos,1606386805,0,1
712,k1ci7h,kethfinex,0.0,Lidos liquid staking contracts live on Ethereum testnet,1606384286,0,1
713,k1c83o,SomerEsat,0.0,Eth Mainnet Staking Guides  Lighthouse and Nimbus,1606382800,0,1
714,k1c3ty,lorecirstea,-0.5106,Golden Gate a trustless bridge between two Ethereumlike chains with a mechanism for general state synchronization preview,1606382202,0,1
715,k1c177,Henry_TG,0.0,Fees,1606381833,4,1
716,k1bvn1,ethmarek,0.0,xPoland posted the last clue eth still in the contract,1606381079,14,1
717,k1blse,Russen72,0.0,Anyone else getting this,1606379691,4,1
718,k1b4fu,sasha_sh,0.0,State of Stake vol  Paradigms biweekly update on ProofofStake ecosystem th November  th November,1606377259,0,1
719,k1b2m4,boommatt,0.0,Becoming a Validator,1606377004,1,1
720,k1atl3,TroutFart,0.3612, in tx fees on MEW swapping for  WBTC,1606375778,6,1
721,k1arne,DappRadar,0.5719,Liquidity is essential for the creation and growth of NFT dapps,1606375514,0,1
722,k1ao1b,Czfacts,0.4404,Vitalik Buterin reveals attractive statistics regarding Ethereum ,1606375028,0,1
723,k1abrj,PiePerson15,-0.4215,Looking to get into ethereum but I have no idea how,1606373476,8,1
724,k19yis,trancephorm,0.0,Is there any way that we can bulk move all tokens from one address to another,1606371821,8,1
725,k19ndt,joewheatley21,-0.3182,Lost half of my NXM tokens,1606370461,1,1
726,k18yvr,kautica0,0.0,ETH vs GSE vs LPT,1606367482,0,1
727,k18wpi,helpprogram2,-0.0258,I hope you animals are buying the dip I just dropped K on it,1606367233,0,1
728,k17tpu,Ulyzses,0.2732,Will ETH  create a new coin,1606362858,6,1
729,k17qi4,throwaway16180331,0.2732,Will ETH  create a separate coin,1606362493,0,1
730,k17kng,raymonddurk,0.0,Guide to staking for nontechnical people for ETH with DappNode,1606361860,0,1
731,k17fxg,Sabiba,0.0,txlookuplimit flag,1606361335,0,1
732,jvh3le,[deleted],0.0,A quick explanation of Ethereum ,1605566849,2,6
733,jvggj7,Donald-TokenHash,0.0,Introduction to Cryptocurrencies  Cypherpunks Bmoney Hashcash Bit Gold Bitcoin Ethereum and more,1605564808,0,1
734,jvgckx,santybro,0.4019,ethereum smart contracts repository,1605564455,2,2
735,jvg1hp,RochBrz,0.0,Looks familiar,1605563468,0,1
736,jvfgcv,coinmonks,0.0,A marriage of Market data with Blockchain data  Bitquery,1605561633,0,2
737,jvevvg,SMcKie,0.7885, Crosschain interop is the biggest barrier to L adoption today  Over the last few months weve quietly built Vector a xchain routing network that works with Ls Eth shards and even other L chains,1605559870,6,36
738,jveswg,_marioc_,0.0,Q Swp BTC to ETH,1605559613,0,1
739,jverei,bitrefill,0.0,Living on crypto in Brazil An interview with Luca de Menezes,1605559483,0,1
740,jveoi3,colekennelly,0.0,ETH Staking Webinar  Thursday November th,1605559248,0,1
741,jvemsm,lwilson747,0.0,Blockchain Cryptoassets and Decentralized Finance,1605559108,0,1
742,jve1sc,[deleted],0.0,Art  Ethereum Orca,1605557335,0,1
743,jvdsng,linkedkeenan,0.3612,Flash Loans and the Importance of TamperProof Oracles,1605556565,0,4
744,jvdqf8,ManyBlocksOnTheChain,0.4404,Good places to talk token models,1605556367,0,1
745,jvdfej,cryptomir,-0.34,Ethereum Price Analysis ETH Slumps as Eth Launch is Doubtful,1605555448,0,1
746,jvd80n,otemzi11,0.8801,Just when we thought NFTs couldnt get any more interesting and boom Very Nifty came into existence join us on Time to DApps as we talk about Very Nifty,1605554829,1,3
747,jvd3j8,nikola_j,0.0,Handy gas prices extension for BraveChromeEdge from DeFi Saver,1605554456,2,1
748,jvci9d,mdrasel99,0.4019,PRIME DAO Project looks promising,1605552687,0,1
749,jvca62,sagormondol01,0.2235,Time flies too fast for this never in life there is nothing to be missed,1605552001,0,1
750,jvc9zp,sagormondol01,0.5859,PrimeDAO has come to a successful journey,1605551984,0,1
751,jvc9tv,sagormondol01,0.7269,The development of the project for a long time and my friends too,1605551970,0,1
752,jvc8n4,NoreenDeets,0.1531,Be Careful With Your ETH on Binance,1605551864,0,1
753,jvbrud,lakerz690,0.0,Raspberry Pi  Validator,1605550422,9,1
754,jvbpgy,MikeYEAHMusic,0.0,Up  since I made this,1605550227,0,1
755,jvba0a,b0xTeam,0.0,bZx joins forces with Benchmark Protocol,1605548911,0,2
756,jvb4ib,[deleted],0.7506,Mods please sticky a comment directing some people to rethstaker Its a very small sub and itd be awesome if it was bigger,1605548430,0,1
757,jvb31v,trent_vanepps,0.0,ETHOnline Summary This was ETHGlobals largest  event A monthlong hackathon and weekly summits in October,1605548304,6,14
758,jv9yu6,litocoen,0.4404,Roxana Danila from Nexus Mutual on How to Build an Insurance Protocol to make DEFI safe,1605544842,2,7
759,jv9x0s,BanklessHQ,0.0, Grayscale B Bridge to Crypto  Michael Sonnenshein,1605544676,0,1
760,jv95py,[deleted],0.0,A Handy Gas Prices Extension for BraveChromeEdgeVivaldi,1605542252,2,1
761,jv8ovb,bambamlabam,-0.25,What are the minimum specifications to run an ETHEREUM node ,1605540680,59,32
762,jv8ljz,WiseMathematician9,0.0,AGOV Promotion Bounty,1605540353,0,1
763,jv8k5p,DappRadar,0.1477,Ethereums ecosystem is facing a major infrastructure challenge,1605540216,0,1
764,jv88w2,[deleted],0.0,Crypto airdrops in  for developers and investors,1605539142,0,1
765,jv832o,Bigp45,0.0,Checkout ShadowToken Cross Chain Interoperability video,1605538590,0,3
766,jv7zyz,tpmv69,0.0,Articles on ETH Token economics,1605538266,7,7
767,jv7z5w,virpt,0.0,Announcement on updating NerveNetwork to V,1605538182,0,7
768,jv6wxc,peck3277,0.0,Are there any eWASM implementations I can test,1605534112,8,18
769,jv6v9r,Ether0x,0.0,ETH Deposits Need To Start Turning Vertical If Were To Hit Genesis on December st,1605533913,24,7
770,jv6tvu,Eclipseum,0.3612,Introducing Eclipseum  The Antifragile DeFi Asset,1605533744,0,6
771,jv6lmt,CoinjoyAssistant,0.0,Belarus Bank to Offer Bitcoin Purchases With Litecoin and Ether Coming Soon,1605532751,0,1
772,jv6d6i,PrimeDAO,0.0,Deepdive into the PRIME Tokenomics and IDO ,1605531708,0,1
773,jv68yv,jigjag524,0.4215,Ethereum progress,1605531171,0,1
774,jv66hg,starterphrager,0.0,Getting started as a dev ganache question,1605530828,6,6
775,jv61nj,kenostech,0.6166,I received unknown ERC token  days ago Do any of you guys know what is it TIA,1605530176,0,1
776,jv5zbh,[deleted],0.0,I received unknown ERC token  days ago Any idea what is this,1605529872,0,1
777,jv5jvx,OGHaze1,0.0,Blockchain game redvsblue,1605527749,0,1
778,jv53mk,CoinjoyAssistant,0.0,Ethereum DeFi These projects will rise x according to analyst,1605525290,0,1
779,jv4llh,ScamBusterTV,0.0,Check out this review of Ivan on Tech Academy on Cryptowisser,1605522476,0,1
780,jv4dnz,coinmonks,0.0,DEX trade charts from more than  Ethereum DEXs,1605521198,0,1
781,jv41bc,Rathi04,0.0,The DeFi Boom is Making Me Nostalgic but there is a Dark Side,1605519254,13,32
782,jv3xgy,abcoathup,0.0,Crypto Trends  November   Chain split explainer  Price oracle use  samczsun  Whats New in Eth  Solidity in Ariana Grandes  music video,1605518643,0,5
783,jv35xu,kushkushxpress,0.0,Eth,1605514102,0,1
784,jv2uvn,ancyfrank2901,0.0,Ethereum Token Development Company,1605512369,0,1
785,jv1ww0,MintableOfficial,0.0,Dev Update    weeks until a new type of DAO and NFT marketplace,1605507399,10,21
786,jv1wtn,mybed54,0.0,What will the Eth  max supply be,1605507392,16,7
787,jv0vcc,meanjan,0.0,ette  Ethereum Blockchain Data Indexing Engine,1605502486,3,6
788,jv02zw,dapp_com,-0.4588,Top Game Dapps Ecosystem by d Volume Ethereum M Top No Axie Infinity M No Doges on Trial M No Sorare K,1605499081,0,1
789,juzz35,[deleted],-0.4588,Top Game Dapps Ecosystem by d Volume Ethereum M Top No Axie Infinity M No Doges on Trial M No PoolTogether K,1605498637,0,1
790,juztyb,halebass,0.4404,Do I have to put my private key in my ETH node Is that safe,1605498033,10,18
791,jux9st,[deleted],0.7184,Where can i buy eth ,1605487827,0,1
792,juwdjf,NambaCatz,-0.1145,Whale Farts Very stinky But the air clears soon enough,1605484458,0,0
793,juw8y5,Electric5heep,0.0,Staking your ETH  on STKR by ANKR,1605483982,0,1
794,juw346,jamesj,0.0,Evaluating Public Subgraphs as a Curator for The Graph,1605483368,0,1
795,juvzvi,applejuicey281,0.0,Becoming a validator in ETH when do I start doing work,1605483039,4,1
796,juum65,jigjag524,0.0,Ethereum predicaments,1605478073,0,1
797,jut7d7,KingNanoBunny,0.3612,The opinion of someone who actually uses the Ethereum network like a regular bank,1605473301,48,40
798,jus0qp,Solodeji,0.0,I Purchased  ETH from Vitalik Buterin and  BTC in First Crypto Investment  Mike Novogratz,1605469483,0,1
799,juqx3n,JayWelsh,0.5267,Solid progress towards Serenitys Minimum Required Stake,1605465785,186,302
800,juqtd6,[deleted],0.5267,Solid progress towards Serenitys Minumum Required Stake,1605465432,0,1
801,juqod2,damiank95,0.0,Eth,1605464960,0,1
802,juq586,[deleted],0.8573,Complete newbie to crypto but I want to buy some Ethereum and use it for trades,1605463169,0,1
