Unnamed: 0,id,author,vader,title,created_utc,num_comments,score
477,kjgdo8,harithk17,0.0,A live labeled chart of Eth depositors by Etherscan,1608820444,1,1
479,kjft0d,celticwarrior72,0.0,Stateless Eth   a question,1608818071,0,1
481,kjebla,Velaznito,0.0,Belgian Taxes on Cryptos,1608811303,0,1
483,kjddvb,Har01d,-0.4404,Blockchair becomes the first Ethereum block explorer to show token transfers and internal calls in pending transactions,1608806688,2,1
484,kjbk4p,emperor-penguin-,0.0,You guys think Ethereum is to the blockchain what Google is to the internet,1608797160,9,1
485,kjb5xg,throwaway761575,0.0,What is Ethereum price target in  years,1608795099,0,1
486,kjayzj,Diqiurenminbi,0.0,Vitalik spotted in Shenmue  in a hotel visitors book,1608794139,0,1
488,kjajsc,Pouyar69,-0.4588,Why ETH is going down ,1608792084,0,1
491,kj9lzu,Zendvibes,0.2732,Ethereum crypto Art NFT wireless digital canvas display playing back a gif Where no token has gone before mammoth mountain hot springs,1608787816,0,1
493,kj8n4v,tyzy_1187,-0.4976,Would purchasing ETH in a few days once it has gone down more be good or stupid Im very new to crypto and trading,1608783802,10,1
494,kj6y96,dwolftech,0.0,Hudson Jameson of the Ethereum Foundation Interview,1608777257,0,1
495,kj6vna,harithk17,0.0, million ETH in Eth,1608776969,43,1
497,kj5iyt,cochemuacos,0.2732,Looking for ideas about how to automate eth transactions under certain conditions,1608771809,0,1
499,kj5a9u,StellaKarr,0.5719,Injective Lab is partnering with Matic Network to expand layer derivatives trading globally Matic Network assets will be listed on Injective in the coming months expanding derivatives markets for assets,1608770924,1,1
500,kj5a16,ez4boo,-0.4588,Eth dump,1608770899,0,1
502,kj4mud,ArrayBoy,-0.5719,Ethereum negative  against bitcoin since  Is the flippennig over,1608768632,0,1
503,kj45ap,Romain_Jung,-0.2263,Ripple Lawsuit Triggers XRP Led Altcoin Apocalypse,1608766940,15,1
506,kj2pmf,owocki,-0.0772,Gitcoin Grants Round  Data Report Does Ethereum have rival Colluding Communities,1608762160,1,1
507,kj2iab,mybed54,0.4588,Is Ethereum undervalued,1608761475,26,1
508,kj1vp5,Pleasure_Seeker,0.4588,Hello im new to ethereum and i was just wondering how long it should take to send eth from coinbase to my ledger,1608759397,4,1
511,kj0479,pablitoJafar,0.0,More than  ETH is now being staked ,1608753681,0,1
512,kizyf7,TobiHovey,0.4588,Theres Now  Million ETH Locked Up in Ethereum ,1608753179,0,1
514,kizc6t,lihorne,0.4939,Amazon Managed Blockchain now supports Ethereum Preview,1608751181,32,1
516,kiyadu,redditsucks299,0.0,Learning to code on Ethereum with little prior experience,1608747789,1,1
517,kiy5kr,bencarl1998,0.0,Ethereum not received,1608747351,0,1
519,kixi3p,Astronaut-Remote,0.0,Why ETH over ADA,1608745306,36,1
520,kixh09,BadboyBandito,0.4588,Polymarket Digest  Trumps last stand Clemency for Ross and Betting on BTC to Break k,1608745213,1,1
522,ki0jrp,Gold_Mountain888,-0.4588,Investors track down rug pull scammers some Ethereum returned,1608621692,0,1
526,khzvs5,dapp_com,-0.34,Top DeFi finance dapps Ecosystem by d Volume Ethereum B still dominates No Compound B No MakerDAO B No Aave Protocol B,1608618674,1,1
527,khzt4s,InTheLoop23,0.0,Disrupting Finance How Blockchain Can Streamline Capital Markets,1608618363,0,1
528,khzmr6,canadianbacon5,0.5994,New ETH NFT Marketplace  Super Inexpensive to Mint your NFTs on Worlds first CrossChain NFT Marketplace,1608617609,0,1
529,khzi5z,brantlymillegan,0.5423,ENS now supports  blockchain addresses for records says it encompasses nearly all blockchain assets youd want to receive,1608617088,1,1
530,khyyan,Liuminescent,0.4215,Where to track Ethereum  release progress,1608614799,1,1
533,khxkor,moyehod,0.0,MYID Coin,1608609507,0,1
534,khwvd2,tandem_singularity,0.8979,Been sharing this with all the recent friends and family asking if they should buy BTC or ETH,1608606910,0,1
535,khwowe,lakamila,0.0,me trying  explain why crypto is the future,1608606244,61,1
537,khwgcv,MIB999999,0.0,Difference in mining speed Why Ethereum,1608605388,0,1
539,khv2qu,cryptoadvisor_78,-0.7184,I think people need to read this too many people think they have to sell through centralized exchanges,1608600457,0,1
540,kht4dy,ManahilGilbert,0.4588,When i am trying to buy a dip,1608593725,8,1
542,khs02d,BanklessHQ,0.4588,Did Mnuchin Break DeFi,1608590074,1,1
549,khr3z6,Path-Dependent,0.0,Tracking transaction on Ethereum Blockchain Explorer,1608587403,0,1
550,khqxt0,Path-Dependent,0.0,Did anyone notice a different address for sendingreceiving coin on their Celsius account around November ,1608586883,0,1
551,khqfww,celticwarrior72,0.0,Eth  what happens next,1608585391,11,1
554,khoqtj,mybed54,0.0,Throw back post to when Ethereum was under ,1608580314,10,1
556,kho724,pablitoJafar,0.0,Ethereum Developer We Are Going to Burn a Lot of ETH,1608578702,0,1
557,kho42m,NabilahFelix,0.0772,Story from Tech Uniswap Is the Number One Gas Guzzler on Ethereum,1608578467,0,1
558,khnum0,mrblockcrypto,-0.4588,Let it rip Vitalik  Defi eth,1608577709,0,1
559,khnh5k,AlessandroPiccione,0.5371,Why the transaction fee is so high how to pay less,1608576652,5,1
560,khn0xu,karelsova,0.0,Swapping USDC for ETH without having ETH for gas,1608575349,4,1
562,khmm66,PotentialFortune,0.4201,Every year Ternio does a video Year In Review and I highly recommend watching the  version which just came out,1608574142,0,1
565,khlooh,ohmygoodstuff,0.3182,Just learned about Ethereum Im curious about verification,1608571251,0,1
567,khksad,thebankroll,0.296,ETH Price Prediction Chat  join,1608568462,2,1
568,khk39u,Ituglobal,-0.5423,Ethereum Faces Rejection at  Resumes Downward Move,1608566312,0,1
569,khjzfs,chazzerg,0.2263,Is it worth staking  ETH into the staking pools,1608565960,83,1
570,khjyf6,CoinjoyAssistant,0.0,Ethereum Core Developer EIP will Be Implemented,1608565875,0,1
571,khjn05,virpt,0.0,CrossChain Milestone NerveNetwork Connects ETH BSC and NULS,1608564875,0,1
574,khit15,rollingincrypto,0.0,FV Bank will provide Ethereum custody to investors,1608562177,0,1
575,khii2f,DappRadar,-0.5106,The increased usage of dapps resulted in multiple exploits and hacks that amounted to more than  million,1608561149,1,1
577,khhuzy,NOWPayments,0.0,Ethereum Payments  Your Opinion,1608558965,0,1
578,khhuan,kenann7,0.3818,I bought eth at  am I stupid,1608558901,0,1
579,khhdmj,CoinjoyAssistant,0.0,Ethereum Weekly Setup Sees Price Near  by May ,1608557234,0,1
580,khh8gr,conor_10,0.6486,Eth update  a conversation with Ben Edgington  thanks Ben for agreeing to this,1608556700,0,1
582,khfd0a,jrrjdev,0.4144,Bitcoin will be the first and most adopted one like diesel cars,1608549074,20,1
586,khdtjt,InTheLoop23,0.7184,Middle East Crypto Exchange Review Where to Buy Bitcoin in MENA,1608541988,0,1
587,khdnls,EconomistBeard,0.6369,Best exchange for purchasing ETH in Australia,1608541212,0,1
589,khau6c,txtis,0.6369,Best way to send dozens or hundreds of addresses to ETH simultaneously,1608528036,0,1
592,kh9gpf,kennylienhard,-0.4588,ETHWeekly Inside the New Hack That Has Crypto Users Spooked  The Cryptowriter Podcast ,1608522766,0,1
593,kh8nn7,lilshwarma,0.0,options for staking lt  ETH,1608519802,125,1
599,kh3fd1,workbenny,0.0,Infrastructure Coins,1608501861,0,1
600,kh2wd4,EvanVanNess,0.0,Latest Week in Ethereum News ETH futures two big Microsoft announcements new Solidity etc,1608500194,1,1
601,kh2uff,FSpeshalXO,0.4588,Should i buy again ethereum or wait for it to dip ,1608500018,0,1
602,kh2l69,thebankroll,-0.128,Join the Ethereum Discord Server,1608499174,7,1
603,kh0mfh,systematic24,0.0,Crypto Domain and Cybersquatting Issues,1608493154,7,1
604,kh04me,redditsucks299,0.0,Resources to learn to code on ethereum,1608491609,0,1
607,knr2x1,SweetPie123,0.0,ETH jumps to its highest level since May ,1609425607,0,1
608,knqqp8,RafvPL,0.5574,Is it possible to search who hold certain tokens on ETH,1609424296,9,1
609,knqlib,rollingincrypto,0.4215,Ethereum has exploded by nearly  from  at the start of  to  towards the end of the year Still ETH price has remained  away from its highest level buying at this price is a steal Tyler Winklevoss,1609423711,0,1
612,knq6j1,Kriptomat,0.9022,To Celebrate Bitcoins Rise Above  Were Giving Away Some Goodies,1609422065,0,1
613,knp376,accappatoiviola,0.4588,Top  Countries by Productivity per Hour Worked  ,1609417326,0,1
615,know9j,WinterPerception0,0.7003,Ethereum could move above  popular crypto analyst says,1609416379,0,1
616,knot10,nakamotchan,-0.5267,I came up with a solution to the problem of hack and loss of private keys in cryptocurrencies,1609416004,0,1
617,knorjf,Deathglass,0.0,What are the bestlowest cost ethercrypto exchanges for actual currency,1609415793,4,1
621,knny2j,cacolac2,0.6369,Where is the money of this smart contract ,1609411721,0,1
623,knn0lg,alexius89,0.9001, APY on ETH deposits  AlphaHomora appears to be the best spot to park ETH currently giving  APY on ETH deposits due to a strong utilization of their protocol people farming on leverage borrowing ETH AlphaFinance is backed by major Defi VCs amp a huge CeFi Bank,1609406935,30,1
624,knn0fj,wishxy,-0.8331,Watch out Fake ONX Airdrop SCAM,1609406908,0,1
626,knmcv3,TysonSanXf,0.8779,The Number of Addresses Holding Ethereum Hit a Record High,1609403605,2,1
628,knl7iv,notthebread,-0.3612,I came across this live stream while browsing YouTube just now  looks like a scam,1609398310,0,1
629,knl2u7,Johnathonzhang,0.0,OnChain Data Shows Ethereum ETH Whale Accumulation Spikes Major Rally Ahead,1609397766,0,1
630,knkzog,TheCurrencyA,0.3612,What will  Be Like in Terms of Ethereum Ecosystem,1609397377,0,1
631,knkukl,lilsullo,0.7184,Just bought my first  ETH,1609396764,169,1
633,knkgvt,Throwawayiea,0.7003,Question for Long term Ethereum holders is it true about the January Bounce,1609395176,0,1
634,knjhzm,dreftylefty,-0.4767,Anatomy of a sim swap attack Fast response time hackers had only  hour with my phone,1609391299,37,1
635,knj9cp,Throwawayiea,0.0772,Is there a finite number of Ethereum tokens,1609390434,35,1
636,knhxrv,Trev5977,0.7859,Would it be unwise to use stimulus plus a little to buy another full share,1609385599,0,1
638,knhph3,saturation4,-0.6369,This group is planning to dump ETH in hrs causing a huge crash,1609384776,2,1
640,knfnnx,SweetPie123,0.0,Is ETH the elephant in the room ,1609377699,0,1
641,knfgc4,CreamScheme,0.0,How Ethereum  Can Catapult ETH to New Highs,1609377022,0,1
642,knf0kq,swedobearro,0.0,Gas prices,1609375607,17,1
643,knf0ip,ohmygoodstuff,-0.0772,Help me down the rabbit hole  Surveys Voting amp Polling,1609375603,0,1
644,kne3ie,planet_kamilita,0.4404,A lil crypto meme from urs truly,1609372619,8,1
645,kne227,kennylienhard,0.4404,My Ethereum Journey in  Highlights and Hope  William Peaster,1609372482,0,1
647,kncy38,graceanderick,0.0,My Identity My coin,1609369013,0,1
648,knchgy,mybed54,-0.6908,Can quantum computing kill Ethereum,1609367557,20,1
650,knbgey,huunji,0.0,YOUR MYID COINS,1609364321,0,1
652,knbeg5,lemmywinks11,0.0,Question about Eth ,1609364155,2,1
653,knbcb5,huunji,0.0,Have you purchased your MYID coin,1609363973,0,1
655,kn9s5f,shujin51,0.0,ETH now vs ,1609359188,14,1
658,kn89r2,ethereumhelp25,0.0,i accidently sent  ethereum to my ethereum classic account on my trezor,1609354623,0,1
659,kn87bl,UsualWhereas9783,0.0,What are the Ethereum price projections,1609354415,20,1
660,kn7o0i,coinmonks,0.0,ETH Beacon chain explorer and GraphQL APIs,1609352786,0,1
666,kn5cqv,cryptomir,0.5267,The Crypto Justice League Exists  What Happened to COVER and Whats Next,1609345773,0,1
667,kn5228,beefydeliverance_403,0.1027,Buccaneer v BUCC  token of privacy on Ethereum Full transaction demonstration It does make transfers invisible to etherscan,1609344813,5,1
668,kn3jn4,rollingincrypto,-0.0772,Github user dawidkabani sent  Chainlink of roughly K to an immutable Aavegotchi GHST smart contract on the Ethereum blockchain and lost it Crypto community helped him with a donation of K,1609339854,0,1
671,kn24gi,Freimusic,-0.0516,Hi Ether nuts come to the New year party if u have nothing else to do heh Hosed byt decentraland,1609334325,3,1
672,kn1zc8,Freimusic,0.2732,Hi Ethereum come to New year party if u have nothing else to do heh,1609333766,1,1
673,kn1kmv,Old-Quote-47,0.5719,How exactly does ETH increase in value over the next few years,1609332039,0,1
675,kn0c9j,ManahilGilbert,0.0,Ethereum researcher Virgil Griffiths trial to start in September ,1609326347,5,1
676,kmzfho,ouxLatashia,0.0,Bitcoin Sees A Key Correction What about Ethereum,1609321865,0,1
679,kmz1vt,currencycom,-0.0516,ETH technical analysis for December January  Ethers rebound from the day SMA shows strong demand at lower levels and that could propel the price to  in the short term,1609319916,0,1
680,kmyx8i,EJeremo,0.0,New Research Discloses the FrontRunning Bots in Ethereums Dark Forest,1609319234,0,1
682,kmyl2m,otemzi11,0.2263,TokenPocket Eth staking feature is live and individuals can stake a minimum of ETH also it houses a flexible stake feature meaning anyone can exit whenever they see the need,1609317471,7,1
683,kmyfi6,eavesdroppingyou,0.0,ELI how do you manage your ETH Walletswithdrawspaying,1609316739,3,1
687,klpkt8,celticwarrior72,0.0,Merging Eth into Eth  what happens next,1609158088,1,1
688,klpcxt,kennylienhard,0.7184,Number of Active Addresses in Ethereum is Up  in  Years  Dalmas Ngetich,1609157095,1,1
689,klownf,russianbabe,0.5267,Ethereum Dominance Getting Stronger,1609155119,0,1
691,klnrx6,moksha-mahey,0.7184,Ethereum bag holder since the dark ages The Gerald Analysis means were mooning fellow believers,1609149842,0,1
692,kln8ey,MuchTicket3,0.4939,Ethereum Price Reaches  a New High since ,1609147184,0,1
693,kln7hz,EJeremo,0.0,Ethereums Market Cap Outpaces Ferrari and BMW,1609147060,0,1
694,klmyvz,SFLgod,0.4588,Do you see Ethereum going up to  before New Years,1609145949,0,1
695,klmfq7,BasisRoutine2914,0.0,ETHUSD Analysis chart for next H,1609143369,0,1
696,klmf0u,Fair_Future_6044,0.0,EthUsd analysis for next  h,1609143282,0,1
697,kllyy1,Mission_Platypus_997,0.0,Litecoin vs Ethereum,1609141123,0,1
699,kllvyc,cryptotrader_2019,0.4588,Ethereum Breaking Out Here are the high probability trade setups for ETHUSDT,1609140732,0,1
700,kllqv4,coinmonks,0.2732,Create and deploy an Ethereum Blockchain Explorer to GitHub Pages,1609140069,1,1
703,klkxii,huobiglobal,0.0,ethv,1609136592,131,1
705,klk3sa,SEAR_ME,0.4588,Why ETH suddenly went up by ,1609133270,12,1
706,kljl1l,Czfacts,0.0,Large institutions Its time for Ethereum ,1609131258,0,1
707,klipjt,dapp_com,0.1027,Top  DEX Decentralized Exchanges Ecosystem by d Volume Ethereum B Top No Uniswap V B No dYdX B No Tokenlon B,1609127898,1,1
712,klecqj,Ruinswetdreams,-0.6124,Cryptotab is a scam,1609112668,56,1
713,kldxxn,southofearth,0.0,Is anyone else having an issue with sending Eth today,1609111260,0,1
714,kldwnq,Farmer365,0.2716, x RTX   Worlds Most Powerful GPU Mining Rig   GHs Ethereum Mining Rig,1609111149,0,1
715,kldg4z,mrhobbeys,0.0,what are the pros and cons of migrating a coin to the Ethereum blockchain,1609109623,11,1
717,klck7t,burakkeceli,0.4588,Three reasons why UTXO model will overtake Account model in the long run,1609106673,0,1
718,klcfv2,ivhano7,0.6369,Which coin is best to daytrade,1609106287,0,1
719,klc8c2,EvanVanNess,0.6908, Latest Week in Ethereum News Eth ecosystem pumping out interesting things even over Christmas,1609105577,1,1
720,klbms6,PlentyofYams,0.7184,I just USD  into ETH what are some fun smart contractsdappsdefi tools to use,1609103629,0,1
722,klb8wt,UnsaidRnD,-0.8422,Got my ETH and tokens stolen but no clue what I did wrong,1609102373,56,1
723,klb4rh,NOTPR0,0.7717,Keychain releases a tool to turn illiquid NFTs into erc controlled DAOs that can be bought out control NFT collections and fundraise to purchase more NFTs Simple dapp to turn illiquid assets liquid now on mainnet,1609101993,0,1
726,kladna,Jaycray95,0.8126,Im up  on Ethereum should I sell and hope to buy back if it dips or just hold Someone talk sense to me,1609099507,16,1
729,kl9o3u,t0wliee98,0.0,Crypto diversity,1609097256,11,1
730,kl9g2q,Anxious_Initiative_8,-0.7096,lost etherum on block,1609096529,0,1
731,kl9ce5,bdinu89,0.765,Ethereum  Deposits Hits  Million As ETH Price Hits Year High,1609096195,1,1
733,kl993s,lunarcrush,0.0,Ethereum Year Social Activity Summary,1609095899,0,1
734,kl95od,Anxious_Initiative_8,-0.4588,lost ethereum,1609095608,0,1
735,kl9398,ethereumhodler,0.0,ETH staking,1609095397,7,1
738,kl79ly,r3ddit0rofthedeep,0.6705,Will ether rise just like bitcoin did,1609089369,0,1
739,kl6px9,tenxnet,0.0,Experience with Europe ETH purchase looking for advice,1609087515,0,1
741,kl6l3l,at--at--,0.0,opinion BTC vs ETH Adoption,1609087052,77,1
742,kl6c40,rollingincrypto,0.0,Turkish central bank digital currency will be practically tested in  Naci Agbal Governor at Central Bank of Rep of Turkey announced that conceptual research had been completed on Digital Lira,1609086178,1,1
743,kl62f0,joelshredder,-0.4215,ETH broke  on Binance,1609085208,21,1
746,kl5stb,Jonnyell1,0.0,Ether ,1609084257,0,1
747,kl5dk7,sagivo,0.0,How to become an ETH validator,1609082673,3,1
749,kl523f,gafiiiiii,0.0,ITS ETHEREUM TIME,1609081506,0,1
750,kl511e,WiseMathematician9,0.0,ETHEREUM PRICE PREDICTION,1609081393,0,1
751,kl4ul6,ISHQISHQ,0.4588,Ethereum Breaks ATH for this cycle,1609080736,0,1
753,kl3uom,anonymousxo,0.4588,What percentage of my budget should I keep aside in case the market crashes to buy the dip,1609076469,0,1
754,kl3gl5,WeedRoll,0.0,Binance CEO CZ has pointed out that Ethereums market cap is bigger than that of Spotify GM Baidu Ferrari and BMW,1609074758,111,1
756,kl30og,BasisRoutine2914,0.2263,Strongly reject the price at the bottom probably rebound,1609072714,0,1
758,kl2mde,jklepatch,-0.25,How to cancel a transaction on Ethereum with Web,1609070833,0,1
759,kl21ga,Longjumping-Ad-8858,-0.6124,I got scammed,1609067907,0,1
761,kl20ch,elalish,0.0,BTC and ETH used to grow together now ETH is left behind,1609067731,68,1
762,kl1g9q,Skretch12,0.5719,Eth  Fair Value Calculation Suggestion,1609064552,38,1
763,kl1f9e,jkpj22,-0.5267,Are tokens a threat for ethereum price,1609064393,0,1
764,kl1dum,bullishkitty,0.0,Invest your eth in NFT art influenced by ancient African styles ,1609064171,0,1
768,kl0g0k,ethmining123,-0.4588,Lost ETH Private Key,1609059023,0,1
771,kg1u6k,Czfacts,0.8176,Will Ethereum Value Reach Four Figures Anytime Soon As BTC Breaks Above ATH Comment your views,1608354877,17,0
773,kg0dby,ToldYaSoo,0.0,Mining Bitcoin and Ethereum on AWS,1608348788,0,1
774,kfzr3j,notesy55,-0.4588,Wrapped coin lost,1608346365,0,1
775,kfyg4v,kethfinex,0.3182,Lido launches liquid Ethereum staking solution,1608341432,0,1
778,kfxe51,Mars_chego,0.0,You Can Now Trade YLD ERC on BitMax and Uniswap,1608337639,0,1
779,kfxd8p,Express-Ad367,0.7096,Anyone interested on safely btc cloud mining,1608337547,0,1
787,kfsovq,1dontpanic,0.4404,Enterprise Ethereum adoption Improve supply chain resiliency traceability and predictability with blockchain,1608322401,1,2
790,kfr605,abishekdharshan,0.0,GRT is live Now you can buy amp sell it on Zerion ,1608317618,0,2
794,kfpte5,react_crypto_dev,0.0,Vote for Ethereum on the CryptoIndex,1608313501,0,1
796,kfp8um,BTECHNEWS19,0.0,Ethereum Will Outperform Bitcoin in  says crypto trader,1608311757,0,1
798,kfp4py,Safe_Meal1393,0.3818,Growth Defi GRO in ETH,1608311414,2,1
799,kfofen,trent_vanepps,0.4588,Start  strong with MarketMake a DeFi hackathon Jan   Feb ,1608309266,0,11
800,kfoa2p,dojogang,0.0,OkGlobal Coin interview at NASDAQ for fox business news and Bloomberg TV international,1608308812,0,6
801,kfnlkt,PSRD,-0.7184,How to Sell crypto adresses,1608306657,0,1
804,kfmc1y,sammybridge666,-0.7269,Wrote private key down wrong,1608302569,0,1
806,kflahl,WinterPerception0,0.0,Eth rises to fourthlargest staking network in the world,1608298810,0,1
807,kfl8tm,taki2121,0.0,TFL in DeFi influence on ETH price,1608298628,0,1
808,kfl63t,[deleted],0.4939,What is blockchain certification crypto art and why should you care,1608298335,0,1
812,kfjvhh,blersion,0.5574,Fantastic Article Numbers Dont Lie  Reasons Why Ethereum Will Overtake Bitcoin,1608292957,0,1
813,kfjp6w,[deleted],0.4588,Ethereum  upgrade becomes fourth biggest proof of stake network following Eth deposit contract going live,1608292160,0,1
815,kfhgt9,Lysium23,0.0,Goerli ethereum,1608280912,0,1
816,kfhed5,Alex_Rusi4,0.0,Automated Market Makers in decentralized finance and Totems Unique Approach,1608280535,0,1
818,kfgio1,itgel_ganbold,0.0, Coins  Cryptocurrency Prices Extension for Visual Studio Code ,1608276106,0,1
819,kfemtv,Mars_chego,0.4588,Uniswaps Trading Volumes soared to over  usd Billion More ETH now Under Management,1608267753,9,7
820,kfei8z,Mars_chego,0.0,Bitcoin and Ether Market Update December  ,1608267287,2,1
824,kfah1t,SMcKie,0.4588,At Connext weve wrapped up the process of moving funds between chains using Vector into a simple dropin React component,1608252651,0,6
827,kf9teh,Pantzzzzless,0.4588,How long does it take for an out of gas transaction to roll back to my address,1608250434,3,1
828,kf9cc6,Dread222222,0.3612,Is it a bad time to buy ETH,1608248857,0,1
831,kf7lqb,TobiHovey,0.0,Wrapped ETH Comes to Tezos as It Takes on Ethereum DeFi Market,1608243278,0,1
832,kf762r,Ituglobal,0.7184,Ethereum Surges Ahead Targets the AllTime High of ,1608241925,0,1
833,kf54th,trogdortb001,0.0,MyCrypto launches faucet for testnet ETH Goerli Ropsten Rinkeby and Kovan,1608235741,2,10
835,kf42sq,BanklessHQ,0.0,Ethereum will fix enterprise tech,1608232666,0,3
839,kf2pz7,Brendan3005,0.0,Introducing TCAP The Worlds First Total Crypto Market Cap Token,1608228677,0,1
842,kf1jd4,PrimaryBranch,0.3612,Nexus Mutual hacker demands M in Ethereum in response to Hugh Karps k bounty grant,1608225217,0,1
843,kf1gmh,DappRadar,0.0,Ethereum generated more than  billion in transaction volume in ,1608224995,17,1
845,kf1c6y,SnooFloofs7541,0.0,Matcha  Simple crypto trading for everyone,1608224643,0,1
846,kf1anq,usfjx,0.8834,is it better to buy ETHE or ETCG to play Ethereum in a k,1608224525,0,1
847,kf17p9,galapag0,0.0,Breaking Aave Upgradeability,1608224298,0,1
848,kf1215,[deleted],0.0,Dapp transaction volumes in  surpassed  billion with  accounted for by Ethereums DeFi ecosystem,1608223817,4,2
850,kf0bp1,BasicMiniTacos,-0.3818,If youre not an Ethereum Investor Are you annoyed byangry about the price jump,1608221659,22,1
854,k565si,coinmarketguru,0.5106,Binance Ethereum Futures Trading Competition   ETH Prize Pool,1606901125,0,1
857,k560he,bench4rench,0.6369,How Many Users Have Already Locked Up K to Join Ethereum ,1606900346,0,1
858,k55voc,Czfacts,0.4588,Big Day for Ethereum as  Upgrade Launches Today,1606899666,0,1
859,k55ugz,EJeremo,0.4019,Will There be a Promising Future in Crypto Sector Following the Launch of Ethereum ,1606899501,1,1
860,k55o4a,nms10_official,0.0,Forsage ETH,1606898581,0,1
862,k5520n,coinmonks,0.0,Ethereum DEX GraphQL APIs with Examples  Bitquery,1606895447,0,1
863,k54z2j,DuRtY_Crypto,0.9158,Ethereum DeFi  Top  Reasons to buy WISE Token,1606895034,0,1
864,k54xe1,volgarswami,0.4767,So what is the ETH issuance rate now that the new beacon chain and the existing PoW chain are both issuing ETH rewards to validatorsminers,1606894813,6,1
865,k54nea,Astro32s,-0.296,Ethereum  no price jump,1606893510,0,1
867,k52yei,ConfidentMushroom,0.0,Ethereum  launches,1606886159,0,1
870,k51sl4,kennylienhard,0.0772,Mr F was here to Hail the Start of Ethereum   William M Peaster,1606881735,0,1
871,k51ock,TheCrunks,0.0772,Mr F was here to Hail the Start of Ethereum   William M Peaster  Voice,1606881305,0,1
872,k50w2g,gizram84,0.0,I noticed that about  Eth validators have a balance less than  eth Does anyone know why they were penalized so early on,1606878535,0,1
873,k50nwf,Raylin418,0.0,Will my eth get influenced when eth is launching,1606877752,8,1
874,k50hoc,Solodeji,0.2732,Charles Hoskinson Forgets Rivalry Congratulates Ethereums Vitalik Buterin for a Job Well Done,1606877155,0,1
875,k4zwv1,HEX-Kit,0.4019,ETH  Party,1606875211,49,1
876,k4zpps,cryptozypto,-0.3612,This looks like a scam Is this channel duping people with a live broadcast,1606874551,0,1
877,k4zcaa,imToken,-0.296,How to stake ETH as an ordinary crypto user who has no ETH,1606873311,6,1
878,k4z2n4,twonkos,-0.4588,Apparently some YouTuber  million subscribers got hacked and now his channel is just an ad bill for the Ethereum Foundation,1606872413,25,1
880,k4xwib,Capitalist15,0.0,ETH price,1606868502,0,1
882,k4xqa2,superlaser97,0.0,ETH fluctuations,1606867924,3,1
884,k4xhqh,Annapurna__,0.0,Eth Staking explained as a Financial Instrument,1606867143,4,1
885,k4xgk6,CryptoNite90,0.2263,Uncle wants to be k worth of Ethereum,1606867032,0,1
886,k4wvy8,matthewg49,0.0,Relearning Ethereum,1606865123,0,1
887,k4wjy9,BanklessHQ,0.0,How to trade ETH and WBTC options,1606864057,0,1
889,k4wbv8,HystericalXD,0.0,Can I use eth as a currency,1606863370,0,1
891,k4uote,bdinu89,0.4588,Ethereum  Serenity  A Look at This Monumental Upgrade,1606858464,0,1
892,k4uhz0,Guarda-Wallet,0.0,Guarda Ethereum staking pool is here,1606857908,0,1
894,k4tgmm,Drako1111,0.0,Will ethereum  has its own currency Or will it use the current ETH currency,1606854845,0,1
895,k4t9nr,tycooperaow,0.5719,Happy Eth Day,1606854287,4,1
896,k4sugg,carcarr17,0.0,Paypal for ethereum and preparation of eth ,1606853084,0,1
898,k4s8eh,vvalid,0.2263,Ive received  worth of MNE coin how can I turn it to ETH,1606851368,0,1
899,k4rvf2,ColinTalksCrypto,0.128,Ethereum  Has Launched What the Various Phases Entail Why I Wont Be Migrating My ETH to the ETH  Chain Yet,1606850353,0,1
901,k4rl61,realestategoose,0.0,Etherium Transaction,1606849567,0,1
905,k4q9h5,M4HD1BD,0.0,ETH Staking Pool on Guarda,1606845838,0,1
906,k4popz,em2391,-0.296,Is ETH  supposed to lower gas fees,1606844253,0,1
907,k4pn9v,excellentchoiceyes,0.0,Whats in store for ETH ,1606844140,0,1
