Unnamed: 0,id,author,vader,title,created_utc,num_comments,score
908,k4pc2k,finematics,0.0,Ethereum   The Beacon Chain PoS Sharding Docking Explained,1606843279,0,1
909,k4pbrv,bdinu89,0.4939,Ethereum  Beacon Chain Successfully Launches,1606843255,0,1
910,k4oxzd,Freimusic,0.128,Decentraland has launched  games all running fully onchain on ETH,1606842176,3,1
911,k4op8a,Trev625,0.0,ETH  Staking Pools,1606841496,0,1
913,k4nmfi,Negative-Outcome,0.34,Will staking decrease the value of my ether,1606838395,20,1
914,k4ngn5,TheCurrencyA,-0.4588,Ethereum ETH Community Hails Proof of Stake to Prevent Attack without Recourse,1606837927,0,1
916,k4n61j,TobiHovey,-0.5719,The Strange Message Written on Ethereum  First Block,1606837077,0,1
917,k4mwdb,the_ocs,0.0,The birth of Ethereum ,1606836261,0,1
918,k4momn,Solodeji,0.765,Ethereum  Phase  Is Finally Launched Successfully As PoW Difficulty Hit AllTime High,1606835590,0,1
920,k4mhxp,RandomPlayerCSGO,-0.296,Is eth a new token will my eth become obsolete when it launches,1606835002,0,1
923,k4lj22,TobiHovey,0.0,Ethereum  Goes Live With Launch of Beacon Chain,1606831822,0,1
924,k4kxi2,johnzinz,0.0,Tokenized US Dollars in Ethereum Network,1606829759,1,1
925,k4ktsd,redddiablo,0.4767,Binance launches ETH  Staking service with double rewards,1606829381,0,1
926,k4km9b,ObjektiveX,-0.4588,Explaining the ETH dip,1606828563,16,1
927,k4kd7q,kapishaggarwal89,0.0,Look at my Ethereum  Serenity Launch badge,1606827564,1,1
930,k4jwrf,ZergShotgunAndYou,0.0,Eth  Mainnet Launch Livestream,1606825603,7,1
931,k4jv5q,Rahul_2503,0.0,Ethereum  is launching with more than  validators from around the globe,1606825405,0,1
932,k4jtlw,Stealthex_io,0.5994,ETH Phase  is now LIVE Congratulations to Ethereum team,1606825218,1,1
933,k4jqvl,MintableOfficial,0.128,Ethereum  has officially launched Genesis  again A historic moment,1606824858,127,1
934,k4jq3d,anmolgaur45,0.0,ETH  beacon Chain is officially LIVE,1606824765,0,1
935,k4jlbg,DappRadar,0.0,Ethereum  is LIVE,1606824163,1,1
936,k4jkxg,martinbitter,0.0,ETH  is now officially live,1606824113,0,1
938,k4jhzh,AtHeartEngineer,0.0, min until Eth Launch,1606823721,1,1
940,k4ja0j,kethfinex,-0.0516,ETH Genesis Block Party  Vitalik Lido PrysmLabs amp many more,1606822645,0,1
941,k4j85j,ethmarek,0.2732,Mystery puzzle solved or why we gave away  ETH to an absolute stranger,1606822403,6,1
943,k4irj7,WinterPerception0,0.0,Ethereum  launch comes tomorrow what to expect to the next Ethereum,1606820208,0,1
944,k4ipic,Eth20,0.0,Ethereum Hdler,1606819918,0,1
945,k6w7ny,Make-U-Believe,0.0,Binance listing SKL  ETH EXECUTION LAYERS ARE TAKING OVER,1607124469,2,2
946,k6vz58,TobiHovey,-0.128,New Fund Exposes Canadas Traditional Investors to Ethereum,1607123639,0,1
950,k6v3wd,TheWierdGuy,0.0,Raoul Pal I think there is a change Ethereum could have a larger market cap than Bitcoin Ethereums narrative coming from talking heads is finally starting to change and the possibility of Ethereum becoming the dominant crypto is no longer a joke as Bitcoin maximalists suggest,1607120821,1,1
954,k6ueck,RambleFeed,0.0,Kraken will distribute  to Ethereum developers,1607118570,0,1
955,k6tq9t,Release67,0.0,How to access an ethereum Multisig Contract,1607116442,0,1
959,k6s9xj,vapid_horseman,-0.3612,Shortlist of the Main Mistakes and Misconceptions in Ethereum Mining,1607111942,0,6
965,k6pqi0,Professorfinance,0.6369,Why I personally think Ethereum is the best crypto investment,1607104103,0,1
966,k6pdg5,throwaway_34333,0.674,Vitalik Ethereum Foundation ConsenSys I hope you all partied into the night when ETH  was realse You all work so hard You all deserve it Thank you for ALL your hard work its working,1607102996,10,1
967,k6p7rs,TobiHovey,0.3182,Ethereum Transaction Volumes Hit  Billion in November,1607102508,23,1
971,k6opvo,MintableOfficial,0.7899,Our Gitcoin Grant is up Weve been BUIDLing since  No ICOs No ERCs  only progress,1607101044,4,1
974,k6okpb,everstake,0.4404, We are thrilled to announce   Everstake has released a notification bot for ETH,1607100620,2,1
975,k6oflk,Fahghettt,0.3612,ETC vs ETH whats the difference Should I be holding both,1607100192,0,1
977,k6o9i8,FonZeD,0.0,video NASDAQbacked DEFI crypto set to explode in ,1607099686,5,1
978,k6o4k7,Fahghett,0.6597,ETC vs ETH Whats the difference Which is a better investment Should I be holding both,1607099285,0,1
979,k6nuvv,Crypto_Economist42,0.4466,Key proponent of STABLE Act thinks Ethereum needs a banking license I guess the internet needs a banking license,1607098467,2,1
980,k6nkhi,tompetreshere,0.0,Staking ETH from Robinhood,1607097602,8,1
982,k6nje3,Accomplished_Ad_8814,0.0,Estimation for Ethereum  transition to complete,1607097503,6,1
984,k6mggb,vinyarb,0.0,Bitcoin HODLer a blockchain game,1607094071,0,1
985,k6mewj,wphowland,0.4588, click Ethereum Nodes as a service  Support the Ethereum network with no technical knowledge and make money doing so,1607093938,0,1
988,k6lpu1,CoinjoyAssistant,-0.2023,Ethereum Controversial EIP moves closer to mainnet implementation,1607091561,2,1
989,k6lfrk,Zestyclose-Row713,0.0,Is it to late for ethereum right now,1607090590,0,1
991,k6l5qw,DappRadar,-0.4576,Week in Review   Ethereum  underway and more trouble in the DeFi sector,1607089578,0,1
993,k6kjhy,TobiHovey,0.4588, Million ETH Gets Locked up in Ethereum ,1607087176,0,1
994,k6kghw,Solodeji,0.2263,Over  ETH worth More Than  Locked In Ethereum  Deposits Contract,1607086863,0,1
999,k6h7t9,arminham1967,0.0,Visa Partners With Ethereum DigitalDollar Startup That Raised  Million,1607071370,0,1
1000,k6gu6g,harjas2517,-0.357,You do not buy a token but collectively invest into the fund swapping your funds to UCAP tokens,1607069472,0,1
1002,k6ggve,huobiglobal,0.0,What is ETH  and What is Happening in Phase ,1607067712,0,1
1003,k6g0e3,peachgurl,0.0,Can someone explain to me how Ethereum works,1607065547,0,1
1004,k6flny,JayWelsh,0.0,Over  million ETH has now been deposited to the Ethereum  deposit contract,1607063662,25,1
1005,k6f5q5,harithk17,0.0,Eth has received its millionth ETH,1607061727,110,1
1006,k6f2fl,trancephorm,0.1779,This legit post and call for discussion has been censored here on rethereum Moderators are not replying and Im not breaking any rules Not getting any notification Post from my account looks normal but others are just seeing title and removed in the body,1607061322,3,1
1007,k6f0aq,trogdortb001,0.7184,OMG has been bought by a crypto investment firm in an undisclosed deal,1607061068,20,1
1008,k6etkd,Wellhereiam2018,-0.4588,Extremely noobish question about how to use keys to reclaim lost ethereum,1607060285,4,1
1010,k6edqa,pankur,-0.2263,CNN suggests Forget bitcoin These cryptocurrencies are surging even more,1607058598,1,1
1012,k6czyn,jeffery1212n,0.2023,Slashing Mechanism Introduced into Ethereum  Network for Developing Better,1607052948,0,1
1013,k6cjqk,Tunathechicken,0.0,What just happened to ETH,1607051585,4,1
1015,k8zble,jakkkmotivator,0.4939, Of All ETH Is In The Deposit Contract And Deposit Contract Reaches Above  ETH,1607409725,0,1
1017,k8yg6x,harithk17,0.4404,At  invalid ETH from Eth deposits were performing at better than Six Sigma,1607405806,3,1
1020,k8x94c,mrsotkogaming,0.4588,MicroStrategy To Pump Bitcoin With  Million Dollar Purchase,1607401093,0,1
1021,k8wkx0,dapp_com,-0.1027,Top Marketplace Dapps Ecosystem by d Volume Ethereum M No Opensea M No Rarible M,1607398581,1,1
1022,k8wdjo,hassie1,-0.4939,Found this NFT with yugioh and pepe combination selling for  Eth lol,1607397813,45,1
1025,k8szma,Butthead2242,0.0,Any idea why eth dipped after  launch,1607385944,0,1
1031,k8piki,TradingKitties,0.4588,Crypto Slang Explained for Normies Dont ape into shitcoins you gotta Hodl ETH,1607375159,5,1
1032,k8ph8d,ShotBot,-0.5423,Why ethereum will fail,1607375067,9,1
1035,k8ofsp,markovianmind,-0.4019,Problem syncing ETH chain to mounted drive,1607371996,1,1
1037,k8ntur,BrianAtSantiment,0.0,Ethereum and its Relationship to Dais Exchange Supply Something to Watch  Santiment Insights,1607370231,1,1
1039,k8nnym,WinterPerception0,0.0,Secret Network bringing in privacy features on the main Ethereum chain,1607369724,0,1
1043,k8lq0d,Solodeji,0.0,Grayscale Institutional Investors Are Increasingly Seeking Exposure to Ethereum ETH,1607364113,0,1
1045,k8lc4s,_The_Chris_,0.0,Where to stake ETH,1607363035,26,1
1046,k8ku85,itamarl,0.0,A designers guide to running an ETH  validator,1607361579,0,1
1047,k8jj90,BanklessHQ,0.0, The Global Game of Crypto  Bruno Maes,1607357686,0,1
1049,k8i5wv,dissonance8,0.0,when will ethereum swag return,1607353354,1,1
1051,k8hzkg,ConversionPlastics,0.4588,I invested roughly  into ethereum I read its predicted to go up to  How much will I make if I sit on it,1607352759,0,1
1053,k8hq2l,qbisq,0.5423,For the younger generation internet native entertainers have replaced rock stars and they dont seem to have an issue with internet money replacing banks,1607351860,4,1
1054,k8hiqt,poojaranjan19,0.0,Learn about EIP Ethereum Node Records with Felix Lange from the Ethereum Foundation,1607351136,0,1
1055,k8hhc4,twigwam,0.0,BBC gets into Ethereum NFTs with Doctor Who Worlds Apart,1607350989,3,1
1059,k8gnoa,Humble-Hospital-9632,0.5267,BART Exchange Launch   m Market Cap  First of Kind Algo Trading,1607347882,0,1
1061,k8fwl2,CoinjoyAssistant,0.7579,Ethereum Expects to Hit  as Price Holds Key Technical Support,1607344760,0,1
1063,k8f3ib,Benutzer2019,-0.5423,Do you think it will drop under  again,1607341112,0,1
1065,k8e0x3,Solodeji,0.0,Vitalik Buterin  of Ethereum ETH Total Supply Is Now Locked In Deposit Contract,1607336069,0,1
1066,k8dz91,Mihail193193,0.0,Strawberry with a taste of bitcoin,1607335849,0,1
1068,k8d5wm,abcoathup,0.7096,Crypto Trends  December   Beacon Chain Genesis  Economic Analysis of EIP  Solidity Underhanded Contest Winners  Updated Ethereum roadmap with progress bars,1607331528,0,1
1069,k8crpg,karzinom,-0.0258,Where to find information about safety measures of ethereum against sybil attacks,1607329445,1,1
1070,k8cmvq,trogdortb001,-0.34,Ethereum got mentioned in the season premiere of Shameless,1607328745,61,1
1072,k8asri,ShaneMkt,0.7579,Kyber Reserve Innovation Program New Liquidity Models For DeFi Up to K in grants,1607320111,0,1
1074,k894sp,sirrip,0.4404,An Eth rewardsrate tracking Twitter bot with some other useful Eth metrics too,1607313459,4,1
1075,k88rs7,karelsova,0.6705,Best way to contract call arguments,1607312088,2,1
1077,k87ts9,TheWierdGuy,0.8724,Which would you rather own  An asset that has zero inflation but does not generate passive income  An asset that has a perpetual  annual inflation rate but yields a nominal  a year Click to see the end game for ETH  and why custodiansfinancialbanking institutions will love it,1607308612,2,1
1078,k86mmx,Yung-Split,0.34,Can anyone explain the value proposition of Ethereum,1607304276,1,1
1079,k85q58,Georgieff12,0.4019,Help with Ethereum,1607300990,24,1
1080,k85pse,im-just-your-bae,0.0,Is there an ELI post for ETH that I can be directed to,1607300958,7,1
1082,k84c66,EvanVanNess,0.4939,Latest Week in Eth News eth successfully launches,1607296198,1,1
1083,k83z8l,colekennelly,0.0,More than  of the ETH supply has now been deposited to the deposit contract,1607295003,0,1
1084,k83mc5,finesse_finesse,-0.1779,I found a game that passively pays eth,1607293814,0,1
1085,k82yi6,spacecans,0.0,Decentralized Ad Exchange using Ether,1607291642,0,1
1088,kazejv,WinterPerception0,0.0,iQs Ethereum ETF begins trading on the Toronto Stock Exchange,1607677701,0,1
1090,kaxupy,CRYPTOARTADVISOR,-0.6408,DEADMAU x SUTU NFT DROP ,1607669965,0,1
1092,kawq1u,hippy_chad,-0.4767,I sent ETH to nonexistent wrong address,1607664975,5,1
1093,kawpy5,PAAlmasi,0.128,Address activity notifications just launched on ethereum,1607664963,3,1
1094,kawp33,Czfacts,0.5267,Ethereum is Trading Under the Critical Area Turns Green After Bounce from Support Line,1607664860,0,1
1097,kavd6f,mebinici,0.0,World first Ethereum ETF debuts in Canada  with a trading halt,1607659649,0,1
1098,kav6bw,boogaav,0.0,Hey Ethereumers what do you think about bringing more privacy to the biggest ethereum based Dapps,1607658962,18,1
1100,kaujya,alive_consequence,0.3818,Whether by choice or not storing your bitcoins on an exchange subjects you to unnecessary risk of theft account suspension and seizure Selfcustody ensures access and reduces the ability of exchanges to engage in fractional reserve,1607656702,10,1
1103,kasqq0,karelsova,0.2924,If all the Ethereum activity moved into one rollup we would get x scalability without losing composability am I right,1607650542,7,1
1104,kapx1x,Ituglobal,0.4588,Ethereum Fluctuates between  and  as Bulls Attempt to Breach the Recent High,1607641584,0,1
1105,kapn17,BanklessHQ,0.8225, Best Gifts for Crypto Lovers ,1607640757,0,1
1107,kap6kw,TobiHovey,0.0,Ethereum ETF Goes Live in Canada After  Million Raise,1607638960,3,1
1109,kao8bh,kberey,0.0,A quick overview about ETH  Animated explanation,1607634406,0,1
1111,kaniso,abcoathup,0.5267,New in OpenZeppelin Defender  Use webhooks to trigger Autotasks  Set fixed gas price for transaction requests  Set valid until for transaction submission  see what is coming up,1607632396,0,1
1112,kancpx,Tritondreyja,0.0,Abstract Ethereum  Merch Shirts Stickers Phone Cases and More,1607631916,0,1
1114,kalw3t,chickenkievsaregood,-0.296,ETH noob here concerned about how to cancel a transactionforce it to be completed,1607627765,10,1
1118,kak7i7,mbiz05,0.0,Where can I find a detailed explanation of how the Etheruem Proof of Stake algorithm works,1607622917,1,1
1119,kak5sc,Bluemandegen,-0.5423,DEGEBS Token air drop,1607622781,0,1
1127,kaj2ca,NextLevelOfThinking,0.296,Do tokens on ETH share the same Target Blockcreation,1607619608,0,1
1130,kahltv,JBSchweitzer,0.6124,Validated staking on eth   Perfect is the enemy of the good,1607615278,0,1
1132,kaglpy,DappRadar,0.0,The ETH Deposit Contract is adding k ETH a day,1607611954,3,1
1133,kag024,TobiHovey,0.0,Grayscale Buys  Million of Bitcoin and  Million of ETH,1607609809,0,1
1134,kafyr0,NOWPayments,0.0,Ethereum   a Quick Look,1607609669,0,1
1135,kaftbl,KofCrypto0720,0.7269,question With phase Zero the number of TPS has already increased and if not when Also whats the minimum amount of time to keep the ETHs staking in order to receive any reward,1607609093,0,1
1136,kafcli,bitrefill,0.0,Living on crypto in Australia An interview with Chris Pavlesik,1607607303,0,1
1139,kae8g1,NOWPayments,0.0,ETH as a currency for payments is used A LOT,1607602272,0,1
1142,kadii9,coinmonks,0.3182,Creating Ethereum  withdrawal keys using ethdo,1607598553,3,1
1143,kad6kg,heeyahnuh,0.7717,Heard of rFIS testing bounty programs k reward pool powered by Stafi StaFi is the first DeFi protocol unlocking liquidity of staked assets The protocol has a staking Liquidity Solution for Ethereum ,1607596782,0,1
1144,kacg7v,WinterPerception0,0.4588,iQ Ethereum Fund gears up for listing on Toronto Stock Exchange,1607592694,0,1
1145,kacfj0,DarkestChaos,0.0,LIVE  Cryptocurrency News Bitcoin Ethereum amp Much More Crypto Content December th ,1607592600,0,1
1149,kaar3r,coinmonks,0.0,Hardhat  ethereum development evolution So lets figure it out,1607583974,0,1
1150,kaapg4,ZackHererTwitch,-0.5106,Is someone able to tell me why the transaction failed Tried to swap ETHY to ETH on Uniswap,1607583758,2,1
1154,kaaaw0,coinmonks,0.0,The Ethereum Invoice Builder,1607581926,1,1
1155,ka8m17,dapp_com,0.8122,WBTC renBTC  are the ERC tokens that represent Bitcoin on Ethereum Invest in a package of these tokens with the best strategies Find the most profitable index How to With what Ethereum dapps,1607575000,0,1
1159,ka73j7,mrsotkogaming,-0.5423,JPMorgan Says Gold Will Suffer Because of Bitcoin,1607569283,0,1
1162,ka59ew,MadELIalUouR,0.5719,In  White hat hackers discovered a security vulnerability and preemptively stole mil USD worth of the cryptocurrency Ethereum before anyone else could stored the funds somewhere else and then returned all of the funds to their original owners xpost from TIL,1607562854,25,1
1163,ka4fma,Cris850,0.0,PC does not recognize gpus in risers only works in pcie slots,1607560036,0,1
1165,kd1wa8,TobiHovey,0.0,Investor Bids  on Ethereum NFT With  Second Left,1607966458,0,1
1166,kd0zlb,singularity87,0.0,Were going to get more people living on crypto Heres how,1607963735,0,1
1168,kd0og7,xxxdogsonacidxxx,0.6705,Long Take The  guide to Fintech SPACs and how to get them to like you,1607962778,0,1
1169,kd0e9r,BanklessHQ,0.0, Crypto from the Outside  Demetri Kofinas,1607961885,0,1
1173,kczkcc,WinterPerception0,0.0,Grayscale adds extra  million in Bitcoin and Ether,1607959234,0,1
1174,kczflg,PrimeCoinz,0.0,Ethereum QETH On The Toronto Stock Exchange  iQ Corp Managing Director Tom Lombardi Interview,1607958798,0,1
1176,kcz4fh,nnikolaki,0.4824,Understanding the STABLE Act and the Push to Regulate Crypto  Rohan Grey,1607957788,8,1
1177,kcyblf,mrnyc88,-0.7184,Cointal new information for sell the whole team,1607955075,0,1
1178,kcy2s8,DappRadar,0.0,Total  ETH are now staked in Ethereum  Deposit Contract,1607954260,1,1
1179,kcxwy3,tobyota9000,0.0,Eth never arrived,1607953642,2,1
1182,kcwcm0,Crazyeights203,0.4588,Gas prices have been too high recently,1607947252,5,1
1183,kcw36c,throwayleonard,0.9118,I know what I get when I buy a stock share or Bitcoin but what do I own when I buy ethereum,1607946060,18,1
1184,kcw1a6,avsm2ssd,0.0,How to use ethereum anonymously,1607945792,0,1
1185,kcw0tb,johndoyle33,0.0,IRS Yet to Decide on How to Tax Ethereum   TCR,1607945725,0,1
1186,kcvvrq,WinterPerception0,0.0,Ethereum  launch was smooth devs claim,1607945038,0,1
1189,kcv2if,sushi_b0i,0.0,Staking ETH  in KuCoin,1607941011,0,1
1190,kcv1yl,abcoathup,0.128,Crypto Trends  December   Electric Capital  Crypto Developer Report  Perfect is the enemy of good when staking on Eth  EF supported teams update  Beeples collection sold for gt  million,1607940931,0,1
1192,kcukdz,EJeremo,0.296,DEX is Competing for CEX Market Share on Ethereum,1607938520,0,1
1193,kcu418,FSTB,0.0,NEX is now also on Ethereum DEX with native BTC trading,1607936188,28,1
1194,kcu3al,bench4rench,0.0,Weekly Crypto News Roundup   Stories You Should Know About th of December  th of December,1607936073,0,1
1195,kctsvu,coinmonks,0.0,Ethereum is Maturing,1607934492,7,1
1197,kct25m,kennylienhard,0.0,ETHweekly Powered by Ethereum the Future May Be Very Progressive,1607930805,0,1
1198,kcswcz,BrandonZ0302,-0.4588,Ethereum Ripples XRP And Chainlink Are All Beating BitcoinThese Minor Cryptocurrencies Are Too,1607930020,0,1
1199,kcsn2k,dapp_com,-0.3818,Top Utility Dapps Eco by d Volume  Ethereum M No Origin Protocol M No Token Multisender No Token BulkSender,1607928813,1,1
1200,kcs2ec,snrpro,0.4215,Easiest way to stake Ethereum,1607926240,8,1
1201,kcrwlv,hindumafia,0.0,Where are all the ETH price predictions,1607925566,1,1
1202,kcqyqa,NodeNetworks,0.0,First time ever you can Bridge Litecoin LTC onto Ethereum,1607921717,0,1
1203,kcpfsq,hutch_man0,0.4754,I have a bit of coding knowledge What is the most efficient way for me to become a crypto dev,1607915979,0,1
1204,kcpe03,LitesLiger,0.4588,Top  Most Expensive NFT sales on Ethereum,1607915795,0,1
1205,kcpanq,mrsotkogaming,-0.7845,Oyster Pearl Founder Bruno Block May Face  Years For His Exit Scam,1607915459,0,1
1206,kcop2y,iThinkiGotNoPrsonlty,0.4588,Just bought  ETH coin on Coinbase as an investment Should I keep it or will it probably go down,1607913282,40,1
1207,kcn5ch,prudentlycrypto,0.0,asking for feedback on this definition of Ethereum,1607907806,0,1
1214,kcg3vi,PowerGreenFlower,0.0,Ethereum Stats Now,1607885269,0,1
1215,kcf705,seelemonsonline,0.4588,Metamask AR snap camera filter on a consensys call,1607882409,0,1
1216,kced3u,Lightsouttokyo,0.204,An Honest query As someone who doesnt come from a lineage of financially intelligentwell off people where can I focus my TIME and quite limited k savings to break the cycle of poverty,1607879767,0,1
1217,kcecyc,bench4rench,0.0,Phoney Silence Weekly Market Review by TokenInsight  CoinMarketCap,1607879754,0,1
1220,kccd90,LuckyInvestor24,0.0, of Ethereum  Validator Deposits are From Kraken,1607873055,0,1
1223,kca26n,Hank_Montgomery,0.0,Ethereum Chart on Piano,1607863700,0,1
1224,kc9e7f,Roversbidet,0.0,Ethereum trading group,1607860505,0,1
1227,kc7fyd,chrismalize,0.8271,StaFi rFIS Open Beta officially launched currently organizing a bounty program for those who love staking ETH and validators A pool of k up for grab for participants Details below ,1607849716,0,1
1228,kc5q66,Ituglobal,0.34,Annual Value Forecast for Ethereum,1607840499,0,1
1229,kc4a37,mrsotkogaming,0.8074,Huge News Microstrategy Plans To Buy  Million In Bitcoin After Bond Sale,1607834040,0,1
1230,kc498d,twigwam,0.0,Whats New in Eth   December ,1607833942,8,1
1231,kc3txg,TingTong197,0.7269,We got an AMA with FFARM at PM CET Flexed biceps Flaming Farm is a unique proprietary deflationary yield farming protocol In the end there is room for Community Questions Folded hands The best question will receive  dollar worth of ETH Giveaway,1607832193,0,1
1236,kc0nvk,kennylienhard,0.0,If Numbers Dont Lie then Ethereum  takes the Decentralization Crown Audio,1607819979,20,1
1240,kiwd8c,BanklessHQ,0.3182, Ethereum charts that hit ATHs in ,1608741685,1,1
1241,kiw9jn,carloscancab,-0.2263,INTERVIEW Running a Lawsuit against Facebook and Google for reparations to the Crypto community,1608741349,0,1
1244,kiujah,SweetPie123,0.4588,Ethereum  Validators Are Making  Compounded Yearly Interest,1608735478,0,1
1246,kiua99,rollingincrypto,0.3182,Increase in Australias general crypto sentiment as compared to ,1608734573,0,1
1247,kiu66p,Mr_SauravKT,0.0,For those who are wondering What is Ethereum  Serenity,1608734165,0,1
1248,kittnc,itamarl,-0.6486,Simple tool to find out which of your personal data has been leaked in the Ledger hack,1608732887,66,1
1249,kitphw,ManahilGilbert,0.2263,Heres How Much Investing  In Ethereum  Years Ago Would Be Worth Today,1608732462,6,1
1250,kit6ed,TangerineParadise,0.4404,Compilation of useful Crypto Trading Telegram channels,1608730487,0,1
1252,kisnos,LoreeKButler,0.4588,Ethereum Price Regains Traction to Trade Above ,1608728443,0,1
1254,kirtco,WalrusDangerous3988,0.0,ETH amp Live News  Ethereum Update Price prediction   Cryptocurrency today,1608724811,0,1
1255,kirsma,WalrusDangerous3988,-0.6124,Ethereum  ETC  BTC Giveaway Scam ,1608724724,0,1
1256,kirmqc,bdinu89,0.0,What To Do When the Crypto Markets are Bullish,1608723964,4,1
1258,kiqjb2,primipare,0.3182,Eth  what about my original Eth,1608718301,7,1
1261,kip71x,OptimalBit5,0.0516,StaFi rETHs solution to the Slash of ETH,1608711221,3,1
1265,kiogx9,rollingincrypto,0.0,Ethereum community I need your attention on this,1608707677,6,1
1266,kiobwx,Illustrious-Cream917,0.4588,CTSI staking will be live on the Ethereum Mainnet on December   AM HKT  Stay tuned for instructions to set up your node,1608707024,0,1
1267,kio8h4,socalbro99,0.0516,Quality stress test of the Nano main net just performed Spectacular record inside,1608706587,0,1
1270,kimg1i,theowaway1111,0.0,Would exchanging ETH to Monero and back to ETH mix my eth and keep it anonymous,1608699098,0,1
1271,kil7yz,Bonichi8e,0.0,Why Mintables MINT NFT DAO is a game changer for the Ethereum Network,1608694558,1,1
1272,kikrl6,spacetime2,0.4588,Which exchange that I stake ETH to get the interest,1608692942,5,1
1275,kij3wf,skytoohigh1591,0.0,Middle East Bitcoin Guide Five Ways to Get Bitcoin,1608687122,0,1
1276,kiidxh,kstepnowski03,0.7184,Buy ethereum under ,1608684716,12,1
1277,kii69g,ethereumhodler,0.0,Switching most of my altcoins to ETH,1608684009,0,1
1278,kii5h1,MoonshotSoon,0.0,Vitalik Buterin calls XRP a shitcoin following statements about ETH and BTC being ChineseControlled  ZyCrypto,1608683940,0,1
1281,kihkqz,mudgen,0.2023,Ethereum diamonds enable people to write contracts with virtually no size limit in a modular and gasefficient way Diamonds can be upgraded on the fly without having to redeploy existing functionality,1608682047,0,1
1284,kig2er,Ambagoulding,-0.2263,ETHEREUM RECOVERS FROM THE BRINK OF DEATH AS BULLS IGNITE STRONG RECOVERY,1608677301,0,1
1286,kif89t,CryptoMarketing,-0.2263,Ripple  XRP Lawsuit may have some implications for Ethereum,1608674696,1,1
1287,kidmsb,Existing_Setting_302,0.3612, LETS MAKE MONEY ,1608669755,0,1
1291,kicy3p,ethhax,-0.4767,Fake Uniswap Liquidity or How to Make  ETH in  mins,1608667660,14,1
1293,kibprk,poojaranjan19,0.4588,The New Ethereum Improvement Process,1608663860,0,1
1295,kiba0c,CryptoMarketing,-0.3182,Ripple Lawsuit being brought by SEC  XRP Price drops hard  Hmmmm it seems I remember someone giving warning,1608662536,0,1
1297,kia69s,seanyo,0.1779,Ethereum Gas Prices How the Mempool acts as a Competitive Market for Settlement,1608659240,1,1
1298,ki9z7p,AHighFifth,0.7269,Prior to the  upgrade how high do you think fees could get before the network was effectively useless,1608658669,0,1
1299,ki9e9k,blockchair,-0.4404,Blockchair Illuminates Dark Forest named Ethereum Mempool  first block explorer to show mempool transactions in detail including transfers for ERC tokens and contract calls,1608656924,0,1
1304,ki7gn5,xnotic,0.4588,Top  Headaches for Web Developers  Hacker Noon,1608650978,2,1
1305,ki6x9r,omnologist,-0.5233,Celsius has already delayed releasing my btc for two weeks now adds  more Im worried I wont receive at all,1608649248,0,1
1307,ki6mjn,rollingincrypto,0.743,Argentina sees a spike in the number of people buying Cryptocurrency,1608648254,21,1
1308,ki6bqx,Whatever--,0.4588,How to buy ethereum if is banned in my country,1608647251,26,1
1309,ki6bpo,nead4spd,-0.357,ETHE split not showing up properly on ETRADE,1608647247,0,1
1311,ki5t8e,kethfinex,0.3612,MIP proposal for staked ETH to be added as collateral asset for MakerDAO,1608645515,1,1
1312,ki5fe2,thewatisit,0.0,How to access Ethereum transactions through C,1608644085,8,1
1313,ki5czp,Interesting-Car1007,0.4019,Ethereum address etherscan smart contracts,1608643836,0,1
