Unnamed: 0,id,author,vader,title,created_utc,num_comments,score
1314,ki5cyy,CoinjoyAssistant,0.0,Vitalik Buterin Fires Shot at XRP For Calling Bitcoin amp Ethereum Chinesecontrolled,1608643834,0,1
1315,ki58yj,clacos17,0.3612,Ip and tx on the ethereum network,1608643414,7,1
1317,ki4ku3,DappRadar,0.4588,Top DeFi dapps in  by generated fees   UNISWAP with M,1608640694,2,1
1320,kh026u,Brainhack_,0.6908,Smart contract  waiting a long time for deployment,1608491399,0,1
1321,kgztn9,fathomix,0.6369,Is Smart Money Accumulating Ethereum into   Podcast Clip,1608490693,0,1
1324,kgy8lk,Fiach_Dubh,0.0,Mike Belshe Mentions Ethereum on Bloomberg  Dec th ,1608485769,0,1
1327,kgxnsf,hoti0101,0.1779,Are there any real world products or solutions built on the ethereum network,1608483957,14,1
1328,kgxmoo,Ilinca89,0.0,Snapshot for an Ethereum geth archive node,1608483864,8,1
1329,kgxfgw,camsteary,0.6597,Velotoken VLO audit shows high level security and decentralization,1608483247,2,1
1330,kgx77p,bratlret,0.0,Ethereum market cap vs  traditional companies,1608482542,0,1
1331,kgx2wv,CryptoSirWalrus,0.5859,Can someone put  BTC buy wall on ETHBTC pair to reverse the market There are no real sellers only exchange algos following ETHUSD,1608482164,0,1
1332,kgwnn7,kushcope,0.0,Eth  from ,1608480729,0,1
1333,kgwf30,pumptalottataint,-0.357,Why is ETH not climbing more similarly to BTC,1608480021,12,1
1334,kgu8k0,hatzygonal,-0.4404,Navigating crypto madness as a beginner  megapost,1608471966,3,1
1336,kgsrxk,0hb0111,-0.4588,Is there a way to fill lost seed words,1608464936,0,1
1338,kgsn6c,MeatWagon06,0.7717,Best bang for you buck ETH holding Defi yada,1608464177,0,1
1340,kgr86t,mur202,0.7184,Anyone wants to buy some ethereum related domains,1608456371,0,1
1342,kgqcal,Kav711,-0.6249,Hodling to the max from a low of  when I should have averaged down to hunnid,1608451481,0,1
1345,kgou9p,elalish,0.34,I staked ETH on Binance future value of BETH ,1608444079,4,1
1346,kgou72,beefydeliverance_403,0.0,BUCC  privacy token on Ethereum allowing transactions which not showing on etherscan,1608444070,2,1
1347,kgnx4l,Ituglobal,0.8201,Ethereum Overcomes  Resistance but Pauses above Support to Contemplate Next Move,1608440073,0,1
1349,kgmz1t,gcarrharris,0.7804,WISE has  green days left,1608436130,0,1
1350,kglt1x,smou3lih,-0.7351, common cryptocurrency scams  how to avoid them,1608431615,0,1
1352,kglclt,Dagoru95,0.7184,Is there a way to buy ETH without KYC,1608429829,15,1
1353,kgl8lm,ceegarner,0.0,Introducing TCAP The Total Crypto Market Cap Token,1608429419,2,1
1354,kgl6yv,hopeinmed,0.8271,Help Understanding ETH and Buying,1608429259,0,1
1355,kgl0ps,Matt29003,0.765,Can you give an immortal gift of crypto using a smart contract,1608428609,5,1
1356,kgk949,martingalewhale,0.6399,Can I create this smart contact on the ethereum blockchain,1608425748,8,1
1357,kgj50l,TtheSideshow,0.4939,Can Crypto Save  Practically Speaking,1608421694,0,1
1359,kgi1e2,MoonshotSoon,0.0,ANALYST WHO CALLED FOR  ETHEREUM THINKS THIS IS COMING NEXT,1608417894,0,1
1360,kghztj,draxxthemsklounts,0.0,New to ETH question regarding inflation,1608417742,0,1
1365,kggj5g,Jaycray95,0.7096,Im up  I know its not much should I sell now and hope it dips to buy back in Im new to the crypto world,1608412714,23,1
1366,kgfzs6,skrndnxjs,0.9042,L question about Loopring How to convert L Eth back to L Eth,1608410950,13,1
1367,kgfpja,haks313,0.7184,Should I buy more ,1608410047,0,1
1368,kgfisj,SL13PNIR,0.128,User uCryptoEconomist is attempting to stir up rivalry between communities and spam your sub,1608409424,78,2
1373,kgdk5s,AdditionalPop4821,0.0, Ethereum bullrun,1608403366,0,1
1376,kgbjkb,FCIAMB1979,0.0,ETH Ads,1608397495,0,1
1377,kgbh0l,bbqsauce666,0.0,Where to find a Technical CoFounder for an ETH Blockchainbased ERC startup,1608397296,0,1
1379,kgakus,lilshwarma,0.0,I have acquired some ETHnow what,1608394506,21,0
1383,kg8z06,[deleted],-0.3612,Senator plans to teach Congress how to use bitcoin to reduce the national debt is the next administration procrypto currency,1608389379,0,1
1385,kg8n1z,[deleted],0.5859,BBC NEWS Amazing discovery by Beirut scientific team  many crypto references were discovered in one of the most famous painting in the world,1608388184,0,1
1387,kg7zv8,haxsyn,0.0,A guide to accessing the mempooltxpool of Ethereum,1608385747,0,1
1388,kg7jjr,shatyikcahum,0.4927,Im trying to get into ethereum Is it really safe,1608383769,28,4
1390,kg6nfb,TingTong197,0.2492,The market for nonfungible tokens NFT is very promising but it is held back by an inefficient market structure The uniqueness of a token allows trading a longer and more expensive method than trading a fungible token,1608379588,2,1
1391,kg6h13,iMnoTGudd,0.0,can we jam the eth network with assertrequire functions,1608378745,0,1
1393,kg532t,[deleted],0.7184,For a long time the blockchain gaming market was dominated by simple gambling applications such as dice games But now developers are starting to ramp up their efforts with ETH and Ardor leading the pack,1608371471,0,1
1394,kg50gq,Liiono,0.0,Just purchased my first ETH,1608371083,129,41
1395,kg4sms,SrPeixinho,0.0,How to fund Formality Ideas and thoughts related to Ethereum,1608369922,7,2
1396,kg4d3u,fehllicks,0.5574,I made a youtube video in german with a comparison of the energy usage of different cryptocurrencies including ethereum Maybe some of you might like it and give feedback ,1608367563,0,1
1397,kg3tly,AlanOne89,0.0,Understanding The  Macro Areas of Decentralized Finance DeFi  Hacker Noon,1608364619,0,1
1398,kg34ji,PoliceBehindMe,0.7184,Buying ETH,1608360872,0,1
1400,kg2eez,joseph-hurtado,0.1779,The End of all Anonymity in US Crypto Assets is Coming in  Weeks,1608357353,53,12
1401,kg21ez,MendoInspired,0.0,xt crashing,1608355756,0,1
1402,kkvdot,lakerz690,0.0,Hash Rate Almost  New ATH ,1609036257,0,1
1403,kkv4jq,Neon_Biscuit,0.4939,Andrew Yang a crypto friendly politician discussing campaign finance laws If He Was a  Year Old Politician Hed Get Out the Way,1609035270,0,1
1404,kktj9e,UsualWhereas9783,0.0,What are the price projections for ethereum,1609029300,0,1
1405,kksp3a,OptimalUnity,0.5143,Beware You Tube Scamartists are back and they want your ETH DONT FALL FOR IT,1609026293,0,1
1407,kkrep2,riskboysoup,0.0,ETHE vs ETH,1609021798,0,1
1409,kkqtzj,Inevitable_Fly_3894,0.0,Is Eth only going to stand still and watch ,1609019848,0,1
1411,kkpfde,bullrj,0.765,I have a grand gun to my head do I buy it is spare for investment,1609014958,7,1
1416,kkoga3,Cryptogaya,0.4588,Hurry Up all  ADD IMMEDIATE LIQUIDITY ON UNISWAP,1609011614,0,1
1417,kkn052,Neon_Biscuit,0.0,Musician RAC said he met with Spotify to talk about Ethereum as of now they say its not competition,1609006555,0,1
1418,kkmxp2,hockeey1,0.5994,Value of holding Ether,1609006315,122,1
1420,kkmqmc,Banks718,0.4588,Potential BTC  XRP Pump Today,1609005658,0,1
1421,kkmjew,ArnoldS5,0.4588,Break of the channel,1609004941,0,1
1422,kklpp3,DorkHarshly,0.0,Exchanging to ETH first time,1609001996,4,1
1424,kkl9su,bulltrader2000,0.0,Is there a Ethereum version of OPHODL,1609000383,0,1
1425,kkl9ol,gregkregg,0.128,Having difficulties getting involved with crypto Help,1609000371,0,1
1426,kkl75a,1_7_7_6,0.3612,What is holding ETH back,1609000127,0,1
1427,kkkchi,NOWNodes,0.0,How to Become an Eth Validator Node,1608996927,2,1
1429,kkka39,lilshwarma,0.34,Question on the derivation of the value of ETH,1608996660,9,1
1430,kkk8t7,reddyrithesh,-0.1828,No bull run like Bitcoin,1608996519,32,1
1432,kkk5ns,NOWPayments,0.3818,Ethereum as a payment currency A Guide to Companies Accepting ETH,1608996174,0,1
1433,kkjlnq,rollingincrypto,0.8519,Barstool Medias Dave Portnoys smallbusiness relief fund will be accepting cryptocurrencies like Ethereum for donations as well Donations of around  has been made till now,1608993885,36,1
1434,kkj4ht,albnasc,0.4588,What market makers are and how they profit off you trading,1608991750,0,1
1436,kkih0v,sasha_sh,0.4588, METACAST Top Crypto Podcasts of December ,1608988720,0,1
1437,kki4qj,ArnoldS5,0.0,ETHUSD Lokk at the divergence,1608987035,0,1
1438,kkhwh5,melon_prophet,0.91, Happy Holidays from ChangeNOW and Simplex Grab your favorite coin and save  ,1608985868,1,1
1440,kkh68j,ivhano7,0.0,Xrp,1608982040,0,1
1442,kkgf39,ArnoldS5,0.5423,ETHERUM analysis for the next    hours for the next    hours Merry Christmas,1608977917,0,1
1444,kkfs6k,Ituglobal,-0.128,Ethereum in a Brief Rally Faces Strong Rejection at  Resistance,1608974183,0,1
1445,kke888,deusopus2020,0.0,What are the Pros and Cons of migrating a coin to the ethereum blockchain,1608964889,0,1
1446,kkcj6x,hassie1,0.0,Where do ETH developers hang out,1608957019,31,1
1447,kkcilh,hassie1,0.0,DxSale Network  First Decentralized Token Launchpad Service on Ethereum,1608956953,1,1
1448,kkc2o6,LonelyTunnelSnake,0.0,How I make  of Bitcoin per month using Shakepay you can too,1608955036,0,1
1449,kkbvaf,Soulreaper1776,0.0,Mining eth,1608954162,0,1
1452,kk96hu,pain_of_discipline,-0.4588,Did I just lost my ETH,1608942979,12,1
1454,kk7p1b,usfjx,0.4588,Is Ethereum undervalued This video looks into that and compares relativ,1608937066,10,1
1455,kk7is2,rocketeer56734,0.0,ETH  BETH token is now distributed on binance,1608936361,0,1
1456,kk7a04,Neyar22,0.5423,Plain and clear I need some  worth of ETH,1608935403,0,1
1457,kk6y8o,MoonlighterByDay,0.0,Small amounts of coin,1608934104,0,1
1458,kk6v5y,KUKOG,0.0,Price predictions,1608933766,2,1
1460,kk623n,zapgappop,-0.5829,Is storing crypto on exchanges really that bad,1608930514,355,1
1462,kk46iq,acurioussaracen,0.0,Will Ethereum outlast the competition,1608923170,65,1
1465,kk3mn4,rinlau_7,-0.296,Ethereum on ARM  turn your Raspberry Pi  into a node  No port forwarding dual stack lite,1608921147,0,1
1467,kk1z6u,PotentialFortune,0.4588,Welcome to the Fintech Age How Digital Currency Is Transforming Payments,1608914901,0,1
1469,kjzsu6,Application-Other,0.0,How is the price of ETH tied to ethereum features,1608906355,16,1
1471,kjyxg1,AESTHTK,0.3818,After the summer of DeFi and with NFT art currently in the spotlight is gaming the next wave of Ethereum innovation,1608902471,0,1
1472,kjyi50,Sinsulancha,0.0,Quick question on ETH,1608900400,13,1
1473,kjxpbb,Azmi0550,0.0,INITIAL EXCHANGE OFFERINGS for MY IDENTITY Coins will now be available on Indoex chainx and TOKPIE,1608896309,0,1
1474,kjxp33,cryptogurureals,0.3612,Making money in crypto,1608896273,0,1
1475,kjx6n9,Ituglobal,0.4767,Annual Forecast for Ethereum  ETH Is Expected to Reach High of ,1608893331,0,1
1477,kjx0pu,Czfacts,0.0,Ethereum Facing Bearish Momentum,1608892319,0,1
1478,kmyaxe,Warden_NL,-0.765,Watch out for possible scam or manipulated prices came across this,1609316075,2,1
1479,kmy3rl,K1ngZee,0.6997,Is it possible for an invalid tx to stay in the mempool for very long until it is valid,1609315211,0,1
1480,kmxk7u,staifih,0.0, Ethereum Predictions From a Crypto Oracle,1609312768,8,1
1481,kmx52m,Ok_Contract5494,0.34,What do you think is the max value of Eth before ,1609310942,0,1
1482,kmx338,moyehod,0.0,MYID Coins are currently an ethereum erc,1609310692,0,1
1483,kmwh0p,bdinu89,0.4588, of Ethereum Addresses are In Profit Following Recent Bullish Run,1609308244,0,1
1485,kmv8q5,Bitcoinseller2021,0.0,Bitcoin,1609303523,0,1
1487,kmuymu,Puzzled-Low4837,0.0,Upside of Ether,1609302500,11,1
1488,kmtonf,TysonSanXf,0.0,How to Make  Per Year by Ethereum Mining,1609297843,12,1
1489,kmtfwg,Mars_chego,0.0,Messari Analyst Ether ETH to Be on Institutional Investors Radar in ,1609297021,10,1
1490,kmt4e9,Stryker336,0.0,TikTok girl get your bags ethereum,1609295877,0,1
1491,kmszg4,mybed54,0.25,How many Ether are created each year,1609295392,22,1
1493,kmq2ds,leonmoro,0.4404,New to this is now a good time to invest in Ethereum,1609285758,18,1
1494,kmphvf,Arjun_alpha,0.0,ETH  stakingmin  ANKRThis post is for people who have less than  eth,1609283894,0,1
1497,kmoa1m,bitcoinsky,-0.8564,Who knows whats behind this dead address Why is there ETH going in and why has it such a crazy vanity address,1609280031,0,1
1499,kmnytp,nikitko13,0.6908,Hope guys you liked my crypto art,1609279040,35,1
1503,kmlwsh,One_Bread_9774,-0.4588,Big Hack,1609272767,0,1
1504,kmlgku,NOTPR0,0.7906,DEFI and CC are now up on uniswap or mintable on NDX Fully collateralized by the underlying tokens these indexes represent the target markets and passively adjust to track the top tokens allowing you to be exposed to all the top performers,1609271424,0,1
1505,kmlgg6,freeman_joe,0.0,Max supply of ETH,1609271414,22,1
1506,kmlff6,Shred-it-Brooo,0.6705,If anyone is trying to make quick profit pumping crypto prices Join the discord k members,1609271324,0,1
1507,kml7oa,International-Oil902,0.0,Scaling in Ethereum,1609270679,0,1
1508,kml7ec,CryptoArtPulse,0.0,How to Invest in Crypto Art or Art NFTs The Beginner to Pro Guide,1609270657,0,1
1509,kml0v2,Use-Then-Abuse,0.4215,XRP right now lol,1609270104,0,1
1510,kmkyvc,AskTradersTeam,0.3818,AstraZeneca Shares Climb As Cancer Treatment Approved In Japan,1609269925,0,1
1513,kmkmfb,No-Calligrapher-5636,-0.1779,Explain where I am wrong about Ethers potential future value,1609268844,0,1
1515,kminx3,wmredditor,0.4201,Kraken CEO Future is Extremely Bright for Ethereum and Investors Should Pay Attention,1609262816,0,1
1516,kmi6of,Unterlegen,0.9136,Looking for the best way to buy and hold crypto as a longterm investment,1609261349,67,1
1517,kmi59f,Fiach_Dubh,0.0,Kraken CEO Jesse Powell Live on Bloomberg Thinks Bitcoin Could Go to  Million over The Next Decade  Dec th ,1609261239,0,1
1518,kmhv6p,grigio,0.0,ELI Layer evolution in ETH  ETH,1609260365,5,1
1519,kmh3pw,Idontcareblahblah99,0.4404,Is ethereum safe from the SEC,1609257909,5,1
1520,kmh0vl,scumhorn,0.0772,Unpopular Opinion ETH needs to be simple to understand if you want adoption any time soon,1609257670,51,1
1523,kmg0k0,mercibien1,0.0,Wrapped ETH comes to Tezos,1609254180,0,1
1526,kmemhz,BasisRoutine2914,0.0,ETHUSD Update Analysis,1609249285,0,1
1527,kmeccn,Mr_SauravKT,0.2732,Good news for those who want to stake your ETH but havent done yet,1609248259,0,1
1530,kmckve,Sc00n,0.6369,How should I best stake my coins using my Ledger,1609240831,0,1
1534,kmb8ko,staifih,0.0,Three Market Trends Fueled Enterprise DLT Adoption in ,1609234404,1,1
1541,kma77o,FrugalityPays,-0.296,Whats the reasoning behind no supply cap for eth as oppose to btc which has m cap,1609229379,0,1
1542,kma77i,ezsou,0.4939,Bitcoin amp Ethereum Masterclass People Friendly Language,1609229378,0,1
1545,km95fk,Janica-bitcoin,0.0,Vitalik ButerinEndnotes on  Crypto and Beyond,1609224415,0,1
1546,km92cj,EJeremo,0.7351,Is Any Possibility for Ethereum To Enjoy A New AllTime High in ,1609224045,0,1
1547,km8yu5,Apart_Replacement_88,0.4588,Ethereum up  in ,1609223632,0,1
1549,km7wqa,Mars_chego,0.0,Bitcoin Ethereum and XRP Weekly Market Update December  ,1609219377,1,1
1550,km750x,mrsotkogaming,-0.2263,XRP is Rekt After SEC Lawsuit And Mass Exchange Delisting And Suspension,1609216424,0,1
1551,km5o6y,lakerz690,0.0,New Hash Rate ATH ,1609211172,0,1
1552,km4jnn,eternalgnome,0.6369,whats the best way to trade ETH options in America,1609207324,0,1
1554,km4a2i,Velo5117,0.0,ETH BOUT TO POP BABYYYY,1609206439,0,1
1555,km44xs,MadELIalUouR,0.0,Need Another  Goerli Testnet Eth,1609205968,0,1
1558,km3dok,erangalang,-0.7184,Sell ETH for BTC,1609203437,0,1
1559,km2rhn,SaltyDuck3,0.8807,Best time to buy ETH,1609201378,0,1
1560,km2oax,FrequentMushroom,-0.4588,Did I just lose all my ETH Sent from BEP to Trezor,1609201086,91,1
1563,km29gn,FrequentMushroom,0.0,Can I send BEP  BINANCE PegEthereum to standard Trezor Ethereum address,1609199753,0,1
1565,km1gl1,Ituglobal,0.6705,Ethereum Rebounds and Breaks  Resistance Resumes Upside Momentum,1609197179,0,1
1566,keyyts,TobiHovey,0.4588,Theres Now  Billion of Ethereum Locked Up in Eth ,1608217251,0,2
1567,kexwf5,drdent19,0.8442,Staking Derivative for ETH is live on Testnet join rETH bug bounty and win rewards upto k in USD,1608213468,14,2
1570,kewz61,citystates,0.0,Renaming of our ingame currency from HEX to HEXAGON,1608209879,0,1
1571,kewxni,BTCUser_,0.8964,The Great Monetary Reset  Bitcoin Breaks ALL TIME HIGH ,1608209701,0,2
1573,kew2mb,Zoomtra,-0.4588,I lost  WETH moving it from Metamask to coinbase I Think,1608205922,41,1
1574,kevubn,MartinLemire,0.0,Looking for Someone to Design an ERC Store Paid in Crypto,1608204817,0,1
1575,kevmt4,BerChris95,-0.4084,Etherum Smart Contract Need help to identify MLM scam,1608203791,0,1
1576,kevl9j,harithk17,0.0, Billion in the Eth Deposit Contract ,1608203558,49,1
1577,kevggl,xionglobalinc,0.5023,Is DeFi the chosen one to defy and recreate existing yet bygone financial infrastructures that long hounded hapless consumers If so is widespread adoption on the horizon And will it be easy It is still a long road but DeFi is set to get there,1608202931,0,1
1578,kev5yi,mybed54,0.0,Will Ethereum ever get a supply cap,1608201500,43,1
1579,keutr2,bench4rench,0.4588,As Bitcoin Surges How Have Other Altcoins Been Performing  CoinMarketCap,1608199864,0,1
1584,ketqaq,EJeremo,0.0,Ethereum Makes Its Yearlyhigh of  and Then,1608194324,0,1
1585,kersh2,Tiny_Kick5575,0.0,Whats the current state of Ethereum  Whats going on with  ,1608185195,0,1
1586,keropk,hodlDRGN,0.0,Interchain Ethereum and  other blockchains for a self sovereign virtual nation state,1608184775,0,1
1588,kepxj0,mrsotkogaming,0.3612,Bitcoin At  With Huge Institutional Demand Growing Daily,1608177992,0,1
1590,kep1p0,wmelon123,0.4588,Building a Paywall Infrastructure on Top of Raiden,1608174883,0,2
1591,keo9eu,Sharkelberryfinn,0.3612,Is it a bad idea to buy eth with btc,1608172268,0,1
1592,keo476,Sterlingz,-0.7184,Staked ETH tokens ETH aka BETH are selling for a  discount  guesses on minimum price in the next year,1608171793,0,1
1594,kenen5,TobiHovey,0.0,Ethereum Price at Highest Level Since May ,1608169566,0,1
1595,ken5td,LudwigVan17,0.0,How much for ETH  node,1608168809,11,1
1596,kemng7,[deleted],0.7184,Bought my first crypto today,1608167151,0,1
1597,kem9j4,Coinlens,0.9049, Weeks volumes of Ethereum Moving UP  Buy amp Hold,1608165848,0,1
1598,kem25x,TobiHovey,-0.5267,Heres One Crazy Stat About CME Offering Ethereum Futures,1608165170,0,1
1602,keke1y,KMuchoki,0.5423,How to create a security token in Ethereum,1608159915,0,1
1603,kejz6j,MoonshotSoon,0.0,Ethereum Price Prediction ETHUSD Faces Higher Side Price May Head For ,1608158749,4,1
1607,keicby,[deleted],-0.4588,First time getting into crypto by selling NFTs made our first whole ETH today and just put a new one up ,1608153873,0,1
1610,keh9n4,ShyUnion,0.6486,Ethereum Trails BTC But Fundamental Strength Likely to Drive It Higher,1608150693,12,1
1611,kegfw8,SMcKie,0.4588,At Connext weve wrapped up the process of moving funds between chains using Vector into a simple dropin React component ,1608148283,0,1
1613,keg7il,razor476,0.0,Crypto Tax Guide  Everything You Need To Know,1608147608,0,1
1615,kefsh1,ozxl,0.0,Received ether from unknown sender to my never used address,1608146361,0,1
1616,kefmmb,lakerz690,0.0,CME Announces Ether Futures Contracts,1608145882,0,1
1619,kef9c0,anonymous_coward_001,0.6757,Planning to upgrade minereum to level  then swap  of them via metamask But its possible only after  years Help,1608144800,1,1
1621,keezlw,Zebrone,0.128, months ago Polymarket launched on Ethereum Since then,1608143995,10,1
1623,kee1ac,bdinu89,0.0,CME Group Announces Arrival of Ether ETH Futures Contract,1608141161,0,1
1624,kedvyj,z-mtrl,0.0,Banks vs Decentralised Crypto System,1608140719,0,1
1625,kedszn,BanklessHQ,0.6124, Bull Run Tax Tips for ,1608140484,0,1
1626,kecqx1,cryptokoalaAus,0.3818,The Growth of Ethereum amp DeFi We gone from  Million to  Billion locked in USD in nearly  years,1608137291,1,1
1627,kecmyw,wphowland,0.6249,Over  Ethereum nodes around  are run by the strongblock community Create one through Strong NAAS or register your own on the protocol,1608136969,4,1
1628,kec5dy,Majestic-Proof-2437,0.0,AURON coin  Hybrid DeFi and CeFi,1608135494,0,1
1629,kec11j,lapalissiano,-0.0516,ETH Can delay in attestation save a validator from slashing,1608135115,0,1
1630,kec0f5,lapalissiano,-0.0516,ETH Delay in attestation can save a validator from slashing,1608135057,0,1
1631,kebw73,farmingOnYieldApp,0.4588,Uniswaps Trading Volumes Soared to over  Billion More ETH Now Under Management,1608134690,0,1
1632,kebvaj,fleepfleep,0.0,Why would wrapped ETH trade at a different price than ETH,1608134612,13,1
1637,kebaey,CoinjoyAssistant,0.0,Why Ethereum and XRP dominated the altcoin rally in ,1608132740,0,1
1639,keb8tm,ben_efx,0.5766,DeversiFi amp Loopring Establish L  a workinggroup committee for Layer  Ethereum ,1608132585,0,1
1642,keaeqx,twigwam,0.0,CME Group announces Ethereum futures product,1608129751,104,1
1645,ke9bsk,ShaneMkt,0.0,KyberPRO Framework Part  What is the Fed Price Reserve FPR System,1608125925,1,1
1647,ke7pza,sirlancelot1200,0.0,Leverj Adds Bitcoin Ethereum Futures With a Decentralized Twist  Decrypt,1608118973,0,1
1648,ke7o17,ManahilGilbert,0.0,Ethereum breakout could see prices spike to ,1608118708,3,1
1651,k4imvk,On_Chain,0.0,Getting WBTC on one of the Ethereum testnets,1606819550,0,1
1652,k4i6ai,rstgh,-0.5106,ETH transfer failed and request for USD deposit,1606817180,0,1
1654,k4hpme,WinterPerception0,0.0,Coinbase to enable users to stake and trade Ethereum  tokens,1606814880,0,1
1656,k4hcml,xerxes7777,0.0772,Since when did Vitalik become a Prison guard I thought the guy was rich from Ethereum,1606812995,2,1
1659,k4gqdx,cpieknik,0.0,ETH  Coinbase pro,1606809992,0,1
1662,k4g8wo,DappRadar,0.0,Less than h left until eth beacon chain launch Epoch ,1606807710,0,1
1663,k4g68p,darcius79,0.7351,Rocket Pool  ETH Our Vision,1606807381,6,1
1665,k4fp6a,roadster213,-0.7184,Ethereum  Sell The News Event is Live,1606805260,0,1
1667,k4egeb,wise_quote,0.0,Ethereum  Launches Tomorrow Heres What to Expect,1606800037,17,1
1668,k4cg32,Jlpg_12,0.0,Ethereum  Finally coming to Coinbase  Will it overcome ethereum scalability issues,1606792774,0,1
1670,k4bj9e,twigwam,0.0,Whats New in Eth   November   The Eve of Mainnet Edition,1606789720,0,1
1671,k4ad6k,ajc9630,0.0,What is the purpose of Consensys since the Ethereum Foundation exists,1606785845,6,1
1672,k49a64,Guarda-Wallet,0.0,ETH  is going to be live tomorrow GuardaWallet will launch the Ethereum Staking pool soon after that stay tuned ,1606782333,0,1
1674,k48xov,vapid_horseman,0.4588,Yield Farming on Emiswap Up to  annually on DAIUSDT and COMP,1606781236,0,1
1675,k48teo,TwitchScrubing,0.0,Yesterday I asked Reddit to explain the  update so I figured Id try making a video explaining it,1606780870,0,1
1676,k481m3,okboyo2,0.4588,Why is ethereum pumping if ethereum isnt going to become faster or cheaper tomorrow,1606778531,0,1
1677,k47m1h,TheQh,0.0,december  eth  what time,1606777258,0,1
1678,k478xn,pipermerriam,0.3612,Ethereum Signature Database now supports Event signatures,1606776184,1,1
1679,k46qts,Ituglobal,0.4588,Ethereum Could Rally to  High if  Resistance Is Breached,1606774679,0,1
1680,k463o6,TobiHovey,0.0,Ethereum XRP Prices Spike as Bitcoin Makes History,1606772831,0,1
1681,k45lj9,ioexx,0.0,Eth or Bitcoin,1606771392,0,1
1683,k454kk,Cocopoppyhead,0.5994,Real Visions brand new Ethereum Documentary has just been published Its  minutes long amp includes interviews with Vitalik joe Lubin Kain Warwick Hudson Jameson Paul Brody Raoul Pal amp more,1606770035,5,1
1684,k448uh,mrtest001,0.0,Is there a time limit on when Ethereum  coins can be migrated to Ethereum ,1606767580,2,1
1685,k441lt,bartttender,0.4019,Staking support for Eth on Coinbase,1606767012,0,1
1690,k43oi6,VanillaThunder399,0.4767,Ethereum  staking rewards coming to Coinbase in ,1606766016,141,1
1692,k43l4i,SatoshiHeist,-0.1531,How I traded the ethereum dip for a quick  in gains,1606765754,0,1
1696,k41z2r,Smongk,0.0,Have you guys heard about HodlC,1606761288,6,1
1698,k41f89,Romain_Jung,-0.4877,DeFi Protocol Pickle Finance Token Loses Almost Half Its Value After M Hack,1606759853,3,1
1700,k40p62,RambleFeed,0.0772,Ethereum Briefly Surpasses Bitcoin in Number of Nodes,1606757992,0,1
1702,k40n6y,cryptoballoffcl,0.0,NonEthereum coin sent to Ethereum address,1606757848,7,1
1703,k40dh1,tompetreshere,0.0,Ethereum  Staking on Robinhood,1606757171,0,1
1704,k4099t,justinjustinian,-0.0516,Noob question ethereum inflation,1606756870,0,1
1705,k408k1,CryptigoVespucci,0.0,A plain english explanation on what to expect from Ethereum ,1606756820,17,1
1706,k407b8,CryptigoVespucci,0.0,A plain english explanation of what the expect from Ethereum ,1606756730,1,1
1710,k3ysir,robingo667,0.0,ZK International NASDAQ ZKIN joins forces with Dentoro to develop DeFi products for Ethereum,1606752659,0,1
1713,k3xsg7,coingecko,0.3612,ETH  Proposal to Ease the Transition,1606749784,0,1
1714,k3xmbl,Diplomatt1986,0.3612, ETH and holding  Staking Advise,1606749277,32,1
1715,k3xi1s,dbsweets,0.6597,I started a YouTube channel to help the next wave of beginners If we can help folks learn technical fundamentals we will grow the Eth community,1606748902,0,1
1716,k3xf2u,Rammboss69,-0.2732,Binace withdraw crypto withdrawals have been temporarily disabled due to risk control,1606748642,0,1
1717,k818qz,blario,0.0,Why Ethereum,1607286143,49,1
1719,k80p4v,mattxlee,-0.4939,Ether from testnet was stolen,1607284420,0,1
1721,ka2h4i,TobiHovey,-0.7184,Beeple Is Selling Ethereum NFT Art You Can Hang on Your Wall,1607553635,0,1
1722,ka218u,BanklessHQ,0.6124,The Bull Case for Decentralized Index Funds,1607552200,0,1
1725,km1ed9,Ambagoulding,0.0,SEC Disapproves BOX Securityampxs Request to Report Stock Trading Data on Ethereum Blockchain,1609196983,3,1
1727,klzq5r,aaronkopplin,0.5423,I created an open source tool that allows you to publicly register a username like bob or alice to your ethereum address and store it on the blockchain,1609191722,0,1
1729,klzgcs,Banks718,0.4588,Potential BTC  XRP Pump JAN ND,1609190903,0,1
