Unnamed: 0,id,author,vader,title,created_utc,num_comments,score
1,k800vm,WittyDanger,0.0,Sent random ETH,1607282294,0,1
2,k7z94o,DingoCrazy,0.0,Should people that have only a few ETH stake on Kraken,1607279887,4,1
3,k7yq23,mitchman2716,-0.6124,Scammed,1607278247,0,1
5,k7yltf,xXguitarsenXx,-0.5423,How to sell my Cryptos Get the money into my bank account,1607277887,0,1
6,k7yfs9,EducationIsGood,0.0,Multiple ERC token transfer in one ETH transaction,1607277386,5,1
7,k7y0i8,apzero,-0.7096,An open letter to the ETH community  Feels bad man biggest mistake of my life,1607276072,1,1
8,k7xu2u,manihateitherebro,0.0,How to cash out to usdt Or exchange it to bitcoins,1607275532,0,1
9,k7wniv,redflexiseal,0.4588, of Ethereum circulating supply is locked up in staking,1607271800,0,1
12,k7v7c2,rollingincrypto,0.0, Axia Axie  tweets about how legendary it is  ETH,1607266894,0,1
13,k7v6s1,rollingincrypto,0.0,Axia Axie  tweets about how legendary it is  ETH,1607266842,0,1
14,k7ug4o,coinmonks,0.0,Ethereum  Staking  How it works,1607264039,0,1
17,k7tto6,bench4rench,0.0,Weekly Crypto News Roundup   Stories You Should Know About st of December  th of December,1607261590,0,1
20,k7sb24,vlad-editor,0.0,Romanian election Transparency running on an ethereum fork with PoA,1607254726,41,1
21,k7s1ud,Working_Leopard1521,0.0,Accidently send eth with eth bsc,1607253474,0,1
23,k7qv06,AlanOne89,0.0,How to Get Started in DeFi  Tips and a Practical Guide Book  Hacker Noon,1607247518,0,1
24,k7q37d,otemzi11,0.0,Ethereum  launches and one of the most anticipated feature is live Time to DApps takes a look at this feature,1607243544,7,1
26,k7osp9,2DumbTv,0.0,Are you staking ETH ,1607237241,32,1
27,k7oktl,Ituglobal,0.4588,Ethereums position among top cryptos,1607236161,0,1
28,k7o5i1,flurbius,0.0,crypto starter info,1607234213,3,1
31,k7m2xq,mktatreddit,0.0,OctoBay  Ethereum Payment Service for GitHub Users,1607225476,0,1
34,k7kn1o,Nickyjam-92,0.0,Eth  the hottest topic but,1607219939,5,1
36,k7j58e,TobiHovey,0.8176,Ethereum Addresses Holding  ETH Tops AllTime High,1607214239,1,1
38,k7gt8d,G_Orbeliani,0.0,How to find in Status Dapp secret keys of the generated Eth addresses,1607205922,0,1
40,k7g4u5,mebinici,0.0,Grayscale Ethereum Is Getting More Attention Beyond The Software Developers Realm  ZyCrypto,1607203674,0,1
41,k7flq6,HalfLifeSux,0.3612,Where do I fit in concerning eth,1607201863,8,1
42,k7fjg0,pesstass,0.5719,Original coin value towards ,1607201642,3,1
45,k7f356,JasmineWindField,0.0,Do I have to do the migration now fro ETH ,1607200101,0,1
47,k7erh6,monerador,0.0,What happens when your Ethereum  Keystore and password is compromised,1607199064,6,1
48,k7eode,Rammboss69,0.6249,Ethereum II will be awesome,1607198781,0,1
49,k7ecb5,JasmineWindField,0.0,what should I do with my ETH  now,1607197746,0,1
50,k7e10o,InternationalGoose22,0.0,Ethereum Mining,1607196790,0,1
51,k7drxc,Ghostserpent,0.4215,Will Ethereum Ever be Easier for the Average Person,1607196033,16,1
53,k7c2ya,takk7,0.0,My Journey to Becoming a Validator on Ethereum  Part ,1607190834,0,1
54,k7btur,battilio,-0.4767,Eth balance wrong,1607190051,0,1
55,k7aqpf,SnakeJerusalem,0.0,Will ethclient still be completely compatible with ethereum ,1607186640,0,1
56,k7aq46,TheWierdGuy,0.765,The crypto community needs to call out when prominent influencers like Pompliano use blatantly misleading titles andor narratives The latest one from Pomp Hedge Fund Millionaire Invests All His Money in Bitcoin He didnt he invested in Bitcoin AND Ethereum,1607186589,0,1
59,k79b0d,NOTPR0,-0.8442,Mint your own NFTs with Minty IPFS hosting no fees for creating or listing for sale No need to mint or list manually On Demand Pay to Mint NFTs Provide your information mint and sell your own NFTs,1607181885,0,1
61,k78oq9,Czfacts,0.0,IRS Yet to Decide on How to Tax Ethereum ,1607179614,0,1
64,k785jq,joenastyness,-0.3818,Does ETH have a name for its lowest denomination,1607177567,1,1
68,k764fw,DivideWarm,-0.4748,i wanted to stake ethereum myself but there is a lot more risk involved then I considered this blog helped me alot with my research,1607168723,0,1
69,k763tj,lorecirstea,0.0,Golden Gate  TrustlessBridging Ethereum EVM Blockchains  Part  Transaction Replay,1607168638,0,4
72,k74l02,jlovinn,0.4019,Can someone help me figure out why the transaction cost on this was ETH,1607160362,4,1
75,k740dj,Mr_SauravKT,0.0,How to stake your Ethereum if you dont have  ETH,1607157101,0,1
78,k72lfl,oilaro,-0.4767,How Blockchain Can Fix The Broken Consumer Price Index,1607149567,0,1
79,k72dmr,M4HD1BD,0.0,Guarda ETH Validator Node is now live,1607148490,3,1
80,k71oy8,JossX,0.2023,Got banned from rCryptocurrency if I win the bet guys eth goes for the sub ,1607145332,2,0
81,k710fc,coff33_blak,0.0,Eth  Usability,1607142458,2,0
82,k70ycr,emily7024,0.0,DeFi will take over ETH,1607142207,0,1
83,k70xqv,mdmahfuzurrhmn,0.0,Crypto Emporium ecommerce online store,1607142140,1,1
85,k704tz,TheCrunks,-0.4767,ETHweekly  Ethereum Is Under Attack ,1607138816,1,2
86,k6zyk1,SnooCompliments6873,-0.4588,Loss of US nodes yield network to russianChinese control,1607138109,0,1
87,k6ykhw,IsThereCheese,0.0,Question on staking ETH ,1607132733,0,1
88,k6yd60,genzr,0.8934,Sharing an online tool I created to help those trying to compare crypto against eachother Includes metrics for ethereum Looking for feedback from the interwebs on how I can expand and improve it over time,1607131978,2,1
90,k60xdn,Im_with_crazy,0.3818,Salt Lake car dealership now accepting Ethereum as payment for a new car,1607014271,0,1
92,k60rm8,PrimeCoinz,0.0,Ethereum  Prediction amp Visa Integrating Ethereum Based USDC,1607013809,0,1
95,k5zj5n,matthewargent,0.0,Introducing The Crypto ATeam Argent x Aave V,1607010112,0,1
97,k5yn43,TobiHovey,-0.4767,How to Stop Your Ethereum  Validator From Getting Slashed,1607007264,0,1
98,k5yi19,twigwam,0.0,eth Update   Bison Trails,1607006797,0,1
99,k5wxtx,bench4rench,0.6369,Revealed Which of the  Biggest Cryptos Performed Best in November  CoinMarketCap Blog,1607001090,0,1
100,k5wd8u,lorecirstea,0.0,EthltgtEth way bridge series Golden Gate  TrustlessBridging Ethereum EVM Blockchains  Part  Basics,1606998775,4,1
103,k5vi8n,DappRadar,0.0,Ethereum generated more than  billion in transaction volume in November ,1606994785,4,1
104,k5v394,MakeMoneyOnlineHome,0.4767,Ethereum Eth  Staking amp ETH Rewards Dividends Investing ,1606992794,0,1
105,k5v1lw,BTCUser_,0.0,The Absolute Fucking State  Bitcoin The Worlds Next Reserve Currency,1606992570,0,1
107,k5unfk,sasha_sh,0.347,Crypto Regulation News Visa partners with USDC Libra rebrands to Diem and launches in January  as USD stablecoin US Representatives has unveiled the STABLE Act Biden announces nomination of Janet Yellen to lead Treasury Department South Korea to delay new tax regime on crypto until ,1606990579,0,1
108,k5twrx,EJeremo,0.0,Will Ethereum  Make Itself Outperform Bitcoin,1606986556,12,1
110,k5sjma,SMcKie,0.3182,Curious how the new Vector protocol scales all ETH layer s bringing Ethereum into a new age Heres a code walkthrough as Chainsafeth begins the audit,1606979400,8,1
111,k5seju,ZergShotgunAndYou,0.4588,LIVE Ethereum  Call     GMT,1606978738,3,1
117,k5r5un,imToken,-0.25,imToken  out now Eth staking for dummies canceling queuing stuck transactions and new DEX UI,1606973102,0,1
118,k5qqsc,cometothecaml,-0.128,A new bill would make stablecoins illegal unless they get approval from the Fed,1606971404,29,1
123,k5opms,Tiny_Ad8558,-0.4939,why did the Ethereum Foundation steal youtube channels,1606963671,0,1
125,k5mlad,_Troll____,0.128,When do I and how I swap my ether to eth I want to avoid capital gains taxes,1606956313,6,1
127,k5lqpz,abcoathup,0.7269,New in OpenZeppelin Defender  Sokol test network support POA Network  Autotask sample snippets  Running a Keepr at a faster rate  see what is coming up,1606953469,0,1
128,k5l7rj,ElephantGlue,0.1779,Eth Layer  Solutions,1606951768,4,1
131,k5ki1s,DuRtY_Crypto,0.9158,Ethereum DeFi  Top  Reasons to buy WISE Token PRESALE,1606949479,1,1
134,k5k4qr,TobiHovey,-0.4588,Bitcoin on Ethereum Falls by  Million in Just Two Weeks,1606948318,0,1
135,k5k1za,BanklessHQ,0.3612,Institutional Money Managers Are Going Bankless,1606948084,0,1
139,k5iopq,leatheredlog,-0.4588,Have I lost my REP ERC tokens,1606943955,0,1
142,k5gdwo,Churchyboi89,-0.4588,Metamask etherium loss,1606937387,0,1
146,k5era2,TobiHovey,0.7845,Grayscale Splits Ethereum Stock Worth  Billion Making It Cheaper to Buy,1606932837,0,1
147,k5eq3q,avado_dserver,0.4404,Easy way to stake eth by running your own node,1606932740,0,1
149,k5e7pb,TheCurrencyA,0.1779,Ethereum Already a Global Settlement Layer for More than  Trillion in Digital Assets,1606931354,0,1
150,k5e37u,mymindismycastle,0.0,How often do you have to be present to run a validator on eth And what do you actually have to do,1606931012,13,1
152,k5do0a,colekennelly,0.0,Worldwide Google searches for Ethereum are going parabolic,1606929837,0,1
153,k5dlzf,Jimbley_Neutralon,0.7184,How to buy ETH,1606929679,0,1
156,k5cdyf,twigwam,0.0,Visa Partners With Ethereum Digital Dollar Startup That Raised  Million,1606926227,8,1
157,k5bxjj,garlicoinluvr,0.4019,Looking back on the evolution of ETH to now might help for newcomers,1606924889,0,1
159,k5bmno,rich_bomb40,0.296,is it ok i stake ethereum on binance,1606923984,0,1
160,k5b628,FlyOrangeBird,-0.4404,Genesis block of beacon chain winks into existence Ethereums proofofstake transition takes another step toward completion,1606922567,0,1
162,k5aocm,coinmonks,0.0,Ethereum  Phase Zero Launch,1606920965,0,1
164,k5aa43,blrm,0.8271,Trusted Execution Environments amp Ethereum Sandbox demo showing the importance of using trusted decentralized oracles with TEEs,1606919631,0,1
166,k597hl,Drabboomer,0.1139,How Ethereum EXPLODES To k Dont Miss It  ETH  Price Prediction  ,1606915732,4,1
168,k589rd,DRH2021,0.4588,Damonte high school student here,1606911816,0,1
170,k582z2,Farghaly,0.0,Multiclient Ethereum Kubernetes Operator valpha has been released,1606910948,0,1
174,k57nnc,Cassymontana,0.0,Correlation Bitcoin  Ethereum,1606908936,0,1
175,k5780k,Solodeji,0.8176,Improving Public Blockchains Is Like a Fine Wine Ripple CTO Applauds Buterins Team for ETH  Launch,1606906725,0,1
179,ka0zkd,Subject_Investment78,0.7845,Crypto Mining Equipment   OFF  Great Opportunity for Crypto Mining Investor,1607548901,0,1
188,k9vv0q,bordoisse,0.0,Understanding Ethereum  with OKEx,1607533894,0,1
197,k9twgj,staifih,0.0,Baseline Protocol unveils Ethereum interoperability deployment will take time,1607527930,0,1
199,k9tha3,ProfessionalLife7217,0.0,How to withdraw ether from eth account,1607526513,1,1
200,k9t804,BTCUser_,-0.7351,How To Avoid Crypto Scams ,1607525661,0,1
204,k9s92t,CoinjoyAssistant,0.4588,Ethereumbased DeFi token COVER looks set to rise by another   analyst,1607522220,0,1
205,k9s6ns,WinterPerception0,-0.128,Ethereum  staking contract Demand exceeds supply,1607521959,0,1
206,k9s4my,WinterPerception0,0.4019,Binance the crypto exchange offers support for Ethereum ,1607521754,0,1
207,k9rrln,Prodoggy,0.0,Balaji Srinivasan Gitcoin cofounder back K seed round for decentralized notification system on Ethereum,1607520280,0,1
210,k9qp40,Interesting-Car1007,-0.6124,DFI Coin and ethereum scams,1607515488,0,1
219,k9l9ix,begwall,0.0,Hey Ethereum Folk Post on my website and I may send you ,1607489313,0,1
220,k9kt4u,mrsotkogaming,0.25,Wells Fargo Thinking About Bitcoin And Cryptocurrencies Is Bullish,1607487596,0,1
221,k9jqpr,LimbBizkit,0.0,More than  ETH locked for staking via Kraken in four days,1607483708,0,1
222,k9jir9,SMcKie,0.9022,Today Cent is releasing Valuables a product to mint tweets and make them oneofakind NFTs Using crypto you can make offers to buy your favorite tweets from verified creators,1607482950,11,1
223,k9hs4y,maxito98,0.0,Cheapest way to withdraw ETH from Kraken,1607476854,0,1
225,k9e5fw,victoroshi99,0.8625,Crypto Emporium built on top of Ethreum set to redefine loyalty participation programs with the introduction of the Governance Rewards program,1607464996,0,1
226,k9d4ex,poojaranjan19,0.0,Ethereum Cat Herders Update ,1607461820,0,1
227,k9cz60,trogdortb001,0.0,ETH Staking Everything you need to know,1607461380,7,1
228,k9cyxv,pythonwiz,0.0,Wrote a Python script to send ether without needing to write Javascript code each time,1607461360,1,1
230,k9ct88,abcoathup,0.743,OpenZeppelin are hiring a Full stack Ethereum Developer Join global team building  Secure amp reliable infrastructure for transaction processing  Intuitive interface for contract administration  Using Serverless Typescript Svelte  With Ethereum experience or desire to learn,1607460879,0,1
231,k9cnls,edwardianpug,0.0,My Completed OpenSource ePaper Crypto Ticker,1607460404,30,1
232,k9cn4p,eleanor567,0.3182,Worlds Largest Nonprofit Now Accepts ETH DAI and other ERCs,1607460364,1,1
236,k9bfvm,cannainform2,0.0,Ethereum staking information,1607456809,1,1
237,k9an4x,KeyFox7,0.0,What is this ethereum,1607454549,0,1
238,k9amy7,econoar,0.5319,EthHub Weekly  Eth week  STABLE Act debate Visa partners with Circle and USDC StarkWare launched StarkEx  Aave v live on mainnet and Vitalik Buterins updated Ethereum roadmap,1607454533,0,1
239,k99oel,colekennelly,0.4767,Stake ETH with cryptos trusted partner of choice for ETH staking,1607451772,0,1
240,k99l1j,Tiernan_argent,-0.3252,We werent satisfied with the information out there about tokenized BTC so heres an introductory guide,1607451500,0,1
242,k98xj8,sasha_sh,0.0,DeFi in Ether Aave V on mainnet Yearn merges DeFi Looprings zkRollup AMM is here GnosisDAO announced Nexus Mutuals Custody cover is now live Melon integrates Synthetix The DeFi Bridge integrates RenVM and much more  by Paradigm  Paradigm  Dec ,1607449619,1,1
243,k98vku,G__Sus,-0.6124,Here come the scams,1607449454,41,1
244,k98uln,SoftBlocks,0.3182,Forsage Smart Contract Math M Profit M Transactions and K Losers,1607449380,9,1
245,k98t17,TheCrunks,0.0,The Beginning of the End of the  Gas Fee Era In Ethereum,1607449247,13,1
246,k98cj9,[deleted],0.3182,Forsage Math M Profit One Smart Contract and K Losers,1607447884,0,1
250,k95c6b,EternalWoo,-0.7184,How to sell an ERC token directly to its contract,1607438519,0,1
251,k95b3o,GecMan24,0.0,ETH minig bot,1607438415,0,1
252,k94vjg,sbcster,0.0,Ether Address Question,1607436892,3,1
253,k94qeq,TobiHovey,0.3612,MyEtherWallet Now Supports Ethereum  Staking,1607436353,0,1
255,k94iqv,SwaroopHegde,0.0,Gitcoin GR audits powered by Ethereum and IPFS,1607435560,1,1
256,k940yi,Dalz1,0.0,Ethereum   What it is When does it starts  The Basics,1607433595,0,1
257,k93kbo,DappRadar,0.1027,The proportion of staked ETH has reached the  mark Currently over M ETH,1607431579,107,1
258,k92xvs,kennylienhard,0.0,If Numbers Dont Lie Then Ethereum  Takes The Decentralization Crown,1607428595,82,1
259,k92fn5,MalminHaagert,-0.6124,ETH  EMAIL SCAM,1607425955,1,1
265,k90f7v,CumagMonkey,0.4588,Korea Blockchain Week  Top Conference Highlights  Hacker Noon,1607415090,1,1
266,k8zqqy,nimburkx,0.4588,Ethereum experts welcome to answer the question,1607411689,0,1
270,kby157,oliveio,0.0,Who owns private key of the ETH  deposit contract account,1607810612,6,1
271,kbxhqe,PowerGreenFlower,0.4588,Ethereum Today     Up,1607808867,0,1
272,kbwzpc,vprokopev,0.4576,How do I get from a complete noob to really good understanding of Ethereum and DeFi I am a developer doing Machine Learning,1607807254,11,1
273,kbwm8k,Lund16952,0.5904,New coin coming January currently on presale WISE token,1607806031,0,1
275,kbvwjl,RoidHogann,0.7184,How do I buy,1607803705,0,1
277,kbu6b6,Jacktenz,0.5106,Now that Eth  has launched where can I go to keep track of progress on the merger,1607798067,24,1
279,kbt2r2,coinmonks,0.0,Building a Wrapped BTC WBTC subgraph with The Graph,1607794445,0,1
281,kbt0wh,coinmonks,0.3612,How to Make Money With ETH,1607794269,0,1
283,kbrij9,Mr_SauravKT,0.3612,Are you ready for the Ethereum ,1607789083,0,1
286,kbqo0k,Majestic_Bit_5821,-0.4404,Reason behind keeping block time at  seconds in eth ,1607786066,0,1
287,kbqewc,Accretence,0.296,Can someone explain it in simple terms what will happen to my ETH when Ethereum  stable main network goes live,1607785142,21,1
289,kbq6nx,LeanMeamMemingMashin,-0.4767,Fake ether to Ropsten,1607784259,0,1
290,kbpztz,naphtdiquad47003,0.0,Buccaneer V  Ethereum smartcontract to execute anonymus transacations,1607783498,21,1
292,kbppem,lilkeysss,-0.357,transaction not showing up on etherscan,1607782293,0,1
293,kbpjzf,ShyUnion,-0.5106,ETH Killer blockchains  Do they stand a chance,1607781678,110,1
294,kbpget,Grass_Hurts,0.0,Gifting Ethereum,1607781255,0,1
301,kbm76p,LuckyInvestor24,0.0,WordPress enables ad revenue in Ethereum ETH,1607764511,0,1
302,kbm4wi,wil15021,0.7184,Advice on buying ethereum,1607764165,2,1
305,kbm02u,Pe1per,0.0,What will change with Ethereum ,1607763428,0,1
307,kblslu,Astro32s,0.1531,Vitalik Ethereum Character concept we do for a Fighter Game,1607762284,0,1
309,kblb1h,harjas2517,0.3612,In MoonDefi  the seller sends the asset to the core contract before calling the swap function,1607759632,0,1
310,kbjqax,samasim1995,0.0,How MANTRA Became Polkadots DeFi DAO  how does Ethereum compare,1607751819,23,1
312,kbiomq,cryptokoalaAus,0.0,Where do you store most of your Crypto ETH,1607747147,0,1
317,kbevd2,maxito98,-0.0516,Noob question Does sending eth to Kraken incurr extra fees,1607732528,3,1
322,kbaiv7,TaoistAlchemist,-0.3818,Is it possible to restrict the sale of an etherium token,1607718169,0,1
325,kb9mf0,Daniel_Crime,-0.6486,Eth Killer,1607715429,0,1
331,kb6xjv,Irene_Leon,0.0,The Ethereum  launch whats next how to become a Validator,1607707065,0,1
332,kb6qls,virpt,0.0,More Crypto Games Coming to NULS Blockchain,1607706455,0,1
335,kb5aka,TobiHovey,-0.4588,Amun Shuts Down Leveraged Bitcoin Ethereum Tokens,1607701912,0,1
336,kb4qyc,Splotch_au,0.0,The First Commercial Product on an Ethereum Second Layer  A Partnership with Fjord Maritime,1607700153,2,1
338,kb46qo,JuiceBitter,0.0,My New Etherum Xmas T,1607698282,11,1
339,kb3hy7,dojogang,0.6705,Tokenization opens up asset groups to a large pool of buyers,1607695923,0,1
341,kb1fp6,CoinjoyAssistant,0.0,Ethereum ETF debuts on the Toronto Stock Exchange rakes in  in trading volume,1607687943,0,1
344,kb0y65,Druss501,0.4588,The Relevant content curation system gets an upgrade to its newsfeeds where users bet on news articles,1607685605,1,1
345,kb0swj,ZergShotgunAndYou,0.0,LIVE Ethereum Core Devs Meeting     UTC,1607684873,4,1
346,kb0lo1,Stonkerer,0.0,Converting ETH to EUR and viceversa via Paypal,1607683874,2,1
349,kb0f00,VSAlpha,0.6808,How can Pokket pay such high interest rates,1607682923,3,1
350,kazxv7,EJeremo,0.34,How Does Ethereum  Security Model Work,1607680513,0,1
351,kazxjy,[deleted],0.0,Will the Biden Administration Fuel Bitcoin Market,1607680464,0,1
360,kdw5i7,BanklessHQ,0.1779,How to analyze crypto assets,1608071474,0,1
361,kdw36s,financeuniversal,0.4588,Ethereum ETH is About to See Liftoff if It Closes Above ,1608071261,0,1
363,kdvixu,1blackhand,0.0,Secret Network Launches Bridge to Bring Transactional Privacy to Ethereum,1608069493,1,1
364,kdv7wi,Melissa4219,0.0,Bitcoin Trading Signals,1608068539,0,1
365,kdv71b,adv4nced,0.836,brainstorming why not implementing a system of incentives and rewards for minters who stake using their own eth node Bonus for nodes in remoteloosely connected parts of the network topography,1608068470,5,1
366,kduh4x,jawnzoo,0.34,Is it a legit concern that Ethereum  could be classified as a security,1608066238,7,1
367,kdtz11,Big-Hold826,0.2732,New to Ethereum Have transaction speeds increased with the  beacon launch,1608064746,0,1
369,kdtf3u,Nash_Social,0.0,NEX is now also on Ethereum,1608063089,0,1
370,kdteer,Nash_Social,0.0,The Nash Exchange token NEX is now available on Ethereum,1608063034,0,1
371,kdt0cj,joshskywalker123,0.34,Warning for everyone Came across this ad on YouTube today Seems pretty scammy to me Be careful out there guys,1608061995,0,1
372,kdsqyz,havokgamer3898,-0.5106,Random idiot sent me c in Eth ,1608061209,10,1
374,kdsb1s,TaxBitTeam,0.0,What is Ethereum  and What Are The Tax Implications,1608059869,0,1
375,kds173,ashish_arma,0.4767,Id like to hold and forget my ETH what can I do,1608059049,40,1
378,kdr4rr,econoar,0.4588,EthHub Weekly  Gitcion Eth US regulatory rumors Bitwise brings crypto index fund to OTC EIP update Yam and UMA team up Blackpool fund for NFT space and Ethereum will process gttn this year,1608056469,0,1
379,kdr3x3,-chr0i,0.0,Crypto Trader Who Turned  Into K Says Ethereum Will Outperform Bitcoin in ,1608056398,6,1
383,kdq8w0,mukavelet,-0.7269,I guess no one can declare a war against ethereum anymore,1608053834,1,1
385,kdpjfg,worf2picardfor3,0.0,feedback for this definition of Ethereum,1608051727,0,1
386,kdpewo,TheCurrencyA,0.0,Ethereum ETH Users Should Not Borrow To Horde Cryptocurrency,1608051365,0,1
387,kdp479,virpt,0.3612,NerveNetwork MainNet Supports ETH and BNB Liquidity CrossChain Mining,1608050455,2,1
388,kdp29m,HelpfulTerry,0.3818,GROwth DEFI on ETH,1608050285,0,1
392,kdobum,04365722358265375663,0.0,NEW EXCHANGE BTC FOR EVERYONE,1608048016,0,1
394,kdo81d,lauracw100,0.0,Secret Network brings privacy to Ethereum,1608047679,0,1
395,kdnsgr,TobiHovey,0.0,Leverj Adds Bitcoin Ethereum Futures With a Decentralized Twist,1608046271,0,1
396,kdmikf,vanderboy17,-0.6124,Report a scam,1608041895,12,1
397,kdmfej,SorenStephenson,0.3818,Number of Ethereum and Bitcoin NonZero Addresses Hit New ATH  Ethereum World News,1608041582,0,1
399,kdlm44,sasha_sh,0.6124,Crypto Regulation News World governments agree on importance of crypto regulation at G meeting France to roll out strict regulations for all crypto transactions Sweden considering wide scale transition to digital currency Russian officials will now be required to declare their crypto holdings,1608038474,0,1
401,kdkwo2,DappRadar,0.0,What are crypto loans,1608035564,0,1
402,kdkelt,tannsophal999,0.0,Ethereum Drawing On Balloon,1608033277,0,1
403,kdk950,CoinjoyAssistant,0.0,Eth staking protocol Lido raises  million in new funding,1608032555,0,1
405,kdhybj,islyfe,0.0,Week in Ethereum ,1608020958,0,1
407,kdhnqk,coinmonks,-0.3612,Strategy Paper Stablecoin Return Summary,1608019492,0,1
409,kdhmon,coinmonks,0.0,The New Realm of Ethereum ,1608019355,0,1
412,kdgmzm,BeenBags362,0.4588,The ethereum based online decentralized casino that is partnered up with ChainLINK,1608014571,0,1
414,kdg3su,descartes458,0.7178,In the next six months I think the most interesting metrics to follow will be large accumulations in ETH addresses that can be attributed to institutional buyers soaking up supply and proving longterm upward price expectations from educated participants,1608012096,1,1
415,kddc1w,HEX-Kit,0.765,Save and Gain ETH,1608001381,4,1
416,kdd4sq,EverydaySmoke,0.0,Kraken clients have deposited more than  ETH into its Eth staking service,1608000668,1,1
420,kdb1u6,kennylienhard,0.0,Subscribe to The Cryptowriter Podcast for loads of Ethereum content ,1607993739,0,1
422,kda57k,mrnobodyman,0.34,How secure really is bitcoin compared to Ethereum from an economic perspective Lets put some numbers behind it,1607990834,32,1
424,kd9t6r,sirlancelot1200,0.2023,First noncustodial high leverage Plasma exchange launches trading competition No KYC,1607989806,0,1
426,kd94iu,NabilahFelix,0.7964,Vitalik Buterin warns followers against taking loans to buy cryptos like ETH BTC,1607987711,0,1
427,kd90sq,BanklessHQ,0.3612,The Second Crypto Money,1607987401,0,1
429,kd6z90,0b01,0.0,LLVMJIT Compiler for Ethereum VM,1607981230,0,1
430,kd6xd3,AlexSSD7,0.6369,Best AWS EC instance for Ethereum Node,1607981073,4,1
433,kd4jgt,3eph1r0th,0.6597,A useful Ledger Nano X tool that allows you to generate Eth validator keys with ease,1607974164,1,1
437,kd2c4u,Novel_Role,0.0,Are there more traditional user experiences for betting on sports with Ethereum,1607967795,23,1
440,kd26pk,coinmonks,0.0,Who is Vitalik Buterin the founder of Ethereum,1607967323,0,1
441,kd20oo,CryptigoVespucci,0.0772,Is Ethereum Money  Messari CEO says no,1607966830,4,1
443,kjvpoo,tQ0eex3ZDmjQiIp,0.4404,Gift ETH now at ,1608884283,0,1
444,kjubsc,HelloFellowHumanBein,0.0,Eth a stablecoin,1608876794,0,1
448,kjs7z3,SeedBoxer,0.0,Why are ETH addresses so expensive now,1608866656,15,1
449,kjs73k,Mars_chego,0.0,Bitcoin and Ethereum Market Update December  ,1608866552,0,1
450,kjrkyp,Crypto_Economist42,-0.296,The DAG has hit GB Old GPUs and ASICs will have to drop off the network today,1608863693,1,1
452,kjo6a4,freeman_joe,0.4404,What are strongest competitors to ETH,1608849069,224,1
453,kjo3xx,recessiontime,-0.1531,I need some help dumb xrp holder,1608848812,0,1
455,kjmkzr,TheWierdGuy,0.3705,Ethereum may not be money but Ether is Ether is the monetary base of Ethereums digital economy Its main purpose is to finance the networks operation and provide a native monetized medium to interact with an ever growing variety of tokenized assets,1608843014,4,1
456,kjm5mw,thebankroll,0.296,Join the Ethereum Live Chatroom,1608841470,0,1
457,kjlpls,aaronlovescrypto,0.4588,Top  DEXes of  Year End Review,1608839894,0,1
459,kjkuft,ki777iz,-0.886,I fell for the stupidest scam ever Is there a way to trace ethereum And can the police do anything about it,1608836787,17,1
460,kjkn96,CoinjoyAssistant,0.0,ETH  Masterplan Or  Transactions Per Second,1608836084,0,1
463,kjk9i2,Cryptomediumer,0.0,Ethereum has a minimum of   in  Insider information ,1608834738,0,1
468,kjj35e,bananacomaMAN,0.0,Investing in Ether,1608830582,0,1
469,kjilrd,bench4rench,0.0,Ethereums  Biggest Moments in   CoinMarketCap,1608828870,0,1
473,kjhmvy,Alex_Rusi4,0.2732,How Totem provides profitability in the decentralized financial market,1608825324,0,1
474,kjhj84,cryptomir,0.0,Price Analysis Ethereum ETH Price Rally to ,1608824935,0,1
475,kjhiww,MintableOfficial,0.5859,A huge step forward for NFTs and art Make NFTs come to life with Infinite Objects physical video print,1608824906,2,1
