Unnamed: 0,id,author,vader,title,created_utc,num_comments,score
1772,o5qz22,coinmonks,-0.3182,Uniswap V Explained  Concentrated Liquidity Impermanent Loss Slippage,1624378939,33,1
1773,o5qr46,Evan2321,-0.1779,Top  Mistakes to Avoid when Investing in Cryptocurrency DONT DO THIS,1624378343,0,1
1774,o5qop2,XtreReX,0.0,Prediction Market What will the price of balajis on bitclout be on July ,1624378167,0,1
1775,o5qknb,ChitChatCherry,-0.25,Crypto Market Crash   WHAT IS NEXT  TIME TO BUY CRYPTO  Bitcoin CRASH Today Live,1624377874,0,1
1779,o5q7ep,ad_ventures,0.3182,Ethereum based solution being used by the Egyptian government for all import export declarations from st July,1624376877,0,1
1782,o5pexd,DailyGweiBot,-0.3612,Unstable Coins  The Daily Gwei ,1624374741,1,1
1783,o5p63d,bananasannas,0.0,BTC vs USDT vs USD,1624374097,0,1
1784,o5p55n,l_zuKapitol,0.0,Ethereum on Coinbase,1624374035,0,1
1787,o5oxu5,swerv2183,-0.4588,Eth dump,1624373515,2,1
1788,o5ovci,twigwam,-0.4585,Zero Knowledge A Not Boring on Moon Math Privacy and Hype,1624373328,1,1
1791,o5ob04,HawkFrost549,0.4588,Ethereum Chads in  year from now  BUY THE DIP,1624371778,0,1
1793,o5o0yf,tofuonplate,0.2263,Any relation with Gas fee and actual worth of Ethereum,1624370968,0,1
1795,o5nzty,arnold-Sfgrtr4567,-0.2484,Robust Protocol  Dual Tokens RBT amp RBW  Extremely Limited Supply   New Concept  Early   ATH   M MCAP  Spectacular Roadmap   Liquidity Burned   Team Token Burned  No Presale,1624370875,0,1
1796,o5nud7,HawkFrost549,0.4588,Just got paid today guess who bought the dip,1624370458,26,1
1797,o5nnu3,dontlookatmeimfamous,0.4588,How long until ETH recovers,1624369945,0,1
1799,o5ngft,AidanIsSleepy,0.9336,honestly I really love just scrolling through this subreddit and not seeing any GuYs wE hAvE tO HoDl in rBitcoin and pretty much anywhere else Ive been its all the same shit just panicing people telling other people not to panic this sub is a nice change of scenery,1624369346,0,1
1800,o5n6d7,CryptoBFC,0.296,Meet Gajesh Naik the YearOld Who Developed a DeFi Protocol a M Money Manager  Crypto Bulls Club,1624368525,3,1
1801,o5mtda,Awkward-creeper,0.4588,Buy the dip,1624367447,1,1
1803,o5mih2,Silverfox4u,0.5423,Just another day at Ethereum Beach splashes and relaxing until the tide rolls back in China doesnt make the rules if they want out  GOODBYE,1624366550,0,1
1805,o5m3g0,ClockerXP,0.0,Another price shitstorm coming,1624365294,2,1
1806,o5lpj9,Riooraj,-0.4588,ETH market cap decline of  million due to the bearish market Vitalik Buterin lost millions of dollars as the crypto market bleeds,1624364073,0,1
1808,o5lfvg,Silverfox4u,-0.5423,DONT LET CHINA DECIDE ETHEREUM IS MOVING FORWARD  soon Fuck China,1624363212,0,1
1809,o5l6yp,filmyFX,0.0,Ethereum Technical Analysis   ,1624362385,0,1
1810,o5ksf4,FelipeFialhoReis,0.0,Imagine if I had known what ether would become in one year ,1624361044,0,1
1812,o5kfso,malykot,0.34,Ive recenty stumbled upon Goldman Sachs advising against investment in cryptocurrencies all the while theyve allowed Ethereum futures and options trading Any other instances of such traditional financial instances engaging in such double dealing,1624359828,0,1
1814,o5k35u,Shinyaku88,0.0,Price expectations,1624358583,1,1
1816,o5jaxr,anniekglmn,0.0,Which Ethereum protocols do you use to exchange stablecoins,1624355636,1,1
1818,o5ihqc,Impossible_Taste_671,0.4588,Cryptocurrencies Why Ethereum will outperform Bitcoin in the long term,1624352058,0,1
1819,o5icz1,Lilacriley,-0.7184,Ending poverty creating universal income amp healthcare for every human on Earth A crypto currency backed  in Diamonds Gold Technology Land amp USD preventing price loss The only Self growing currency THE LILAC SPACE DOLLAR LSD COMING August  Ending Global poverty amp more in lt years,1624351500,0,1
1821,o5i1es,Dorskind,0.0,Can we fork Ethereum to eliminate half the coins,1624350152,3,1
1823,o5hnr8,synapsisxxx,0.0,The real source of Ethereum,1624348613,5,1
1824,o5hiwk,gifxCrypto,-0.3818,GIFX Crypto Exchange With The Lowest Rate ,1624348068,0,1
1825,o5hhgs,miloglznava,0.0,ETH on CompoundAAVE,1624347911,0,1
1826,o5hdd5,Rskrish,0.0,Staking ETH  or holding ETH,1624347460,0,1
1827,o5h1ui,-davidde-,0.0,To all Ethereum holders and developers,1624346210,0,1
1830,o5gjd7,IANAL_but_AMA,0.6124,Sothebys will accept ETH for first time as payment for rare diamond,1624344280,0,1
1831,o5gd4p,Majieu,0.0,ETH lt,1624343605,0,1
1832,o5fyal,halebass,0.7579,My new share to friends who say I heard NFTs are just for money laundering,1624342026,1,1
1833,o5fwcg,sportifynews,0.2023,How big are the chances of Ethereum ETH to show a local bounce back,1624341813,3,1
1835,o5ffz5,No-Lunch1950,0.4588,Me finally starting a position in Ethereum were loading up sub K ,1624340111,0,1
1836,o5f9qo,GBArcturus,0.3612,Crypto currencys and tokens telegrams and subreddits are looking like cults,1624339482,0,1
1837,o5f5iw,dgon94,-0.1027,The Ethereum London Hard Fork,1624339058,3,1
1839,o5ejh0,cryptoplatforms,-0.1531,Bitcoin BTC Dogecoin Doge Ethereum ETH Massive Crypto Drop Time to Buy or Sell Nigel Green CEO,1624336908,0,1
1843,o7ogca,CoinjoyAssistant,0.0,Latest ETH news for this week,1624630192,1,1
1844,o7ogc8,TimelyPay6284,0.0,The Tether case is really building momentum Is Tether the Crypto Black Swan,1624630192,2,1
1847,o7noh0,TheDynasty368,-0.4404,Entire market is red except Shiba Inu This guy is trolling,1624627611,2,1
1848,o7nlli,CoinjoyAssistant,0.0,Ethereums muchawaited EIP gets deployed on Ropsen testnet,1624627336,0,1
1850,o7mzhf,Gamingworls,0.0,Eth usage,1624625136,0,1
1851,o7mmn5,bletchleymcgregor,0.0,More Than  Ethereum Burned On Ropsten Testnet Through EIP,1624623805,235,1
1852,o7mjdf,BillionaireBob,0.0,Can anyone eli the change from Eth to Eth and what I canshould do,1624623452,0,1
1853,o7mdhl,gettingit99,0.5452,Bear or bull With options expiring today we wont hit ath But is it time to go back up,1624622808,8,1
1854,o7m1zv,SilverHoard,-0.4588, million of Ethereum was just burned after keys are lost,1624621519,65,1
1855,o7ltbd,invincibleipod,0.0,today I finally got  eth,1624620532,21,1
1856,o7lpmm,bunsenstraat,0.0,Im looking for more photos of the Ethereum Spaceship house in Zug Or an address where it is located or coordinates ,1624620100,0,1
1857,o7l96s,jaquezmun,0.4995,Understanding how EIP  Eth and L Scaling affects ETH tokenomics  demand,1624618090,1,1
1858,o7l50j,santhoshj16,0.0,Ethereum blockchain users and developers survey Sponsored by Nethermind,1624617559,0,1
1859,o7kug2,jr11_jay,0.7184,Should I buy k of eth now,1624616168,0,1
1860,o7kj3u,archeactive,-0.5267,ARTICLE A danger for all the cryptocurrency world  Bitcoins Lighting Network,1624614617,0,1
1861,o7ke80,RandomWSBfan,-0.2755,Nope Hodl til retirement,1624613945,1,1
1862,o7k412,Cryptex3011,-0.7269,Has there ever been a short dress attack,1624612526,3,1
1863,o7k014,AppropriateFinance73,0.3612,Would you allin trade  BTC for ETH  Or keep BTC  Or do half half  Thank you,1624611980,2,1
1864,o7jtwq,CoinjoyAssistant,0.4588,Ethereum London upgrade launches on testnet as K staked in a day on Eth,1624611169,0,1
1865,o7j3yh,Sharkk-Investor112,0.4404,GET BTC BY ANSWERING FUNNY QUIZZES WHY NOT,1624607612,0,1
1866,o7izzy,galne82,0.0516,Ethereum  Contract Reaches  ETH Milestone,1624607039,0,1
1867,o7itty,Difficult-Number-416,0.0,ETH RUNNING WILD ,1624606180,0,1
1868,o7itl2,paul2k99,0.0,Im reading right  ETH burned on Ropsten in  hs,1624606144,19,1
1876,o7ge26,JoshKlaw,0.4939,I animated the eth logo for you guys Its a bit trippy Enjoy,1624595349,43,1
1877,o7gcsz,dapp_com,-0.5423,Ethereum gas price Gwei slid from  to less than  in a month Top Ethereum dapps d volume dropped Uniswap V  dYdX  Is the market cooling down,1624595204,0,1
1878,o7g6tu,dapp_com,-0.197,Top  NFT marketplace Eco by d Volume Most volumes dropped over  Ethereum M,1624594534,1,1
1879,o7fpcn,frenchwolfent,0.8777,Releasing the hounds soon  felt great seeing eth above k once again The comeback is very promising,1624592686,0,1
1880,o7f8ug,Puzzleheaded-Feed494,0.0,When do the Eth options expire on th What time,1624590802,0,1
1882,o7eg76,Resident_Piccolo_866,-0.3172,Do yall think eth will drop tomorrow I wanna buy more but as low as possible of course,1624587908,19,1
1883,o7ebf4,mrsotkogaming,-0.8271,John McAfees Ethereum Dead Mans Switch Conspiracy,1624587434,3,1
1884,o7cqyv,JPWhiskers1,-0.128,Coinbase dropped eth  interest from  to  after it is locked ,1624581300,0,1
1885,o7cjkm,Thboydudus,0.7184,Should i buy more,1624580561,0,1
1887,o7bvgx,twigwam,0.6124,Infura Launches Support for Optimistic Ethereum,1624578262,1,1
1888,o7bq9k,mikey9214,0.0,Will staking on coinbase still be available after eth launches,1624577786,6,1
1889,o7blc4,MrCheeks1978,0.0,First full Ethereum,1624577346,20,1
1890,o7bhkr,Lastlord295,0.6369,Investo Of Crypto We make exchanging your Crypto easy please trade us utilizing the Changelly Exchange with us,1624577006,0,1
1891,o7bgjx,MillennialBets,0.0,Does Ethereum have a published organizational chart,1624576917,0,1
1893,o7azjl,God_Smite11111,0.6369,Best ETH  Staking Pool at the moment,1624575501,0,1
1894,o7ax84,dgon94,0.2023,The Ethereum London Update amp Why Its Important,1624575315,1,0
1897,o7aub5,GhostPepper1969,-0.5423,ETH  dropped to  APR,1624575086,44,2
1902,o79ydb,Bosphoramus,0.0,Is it possible to constraint the ETH that can be traded for tokens in a single transaction,1624568567,0,1
1903,o79ptj,PM_ME_UR_TANGOS,0.5106,Which way do you think the price will move until expiry time am EST tonight and then where after Toss your predictions in the comments just for fun ,1624567776,6,1
1905,o79kjh,Erick_Alden,0.1695,Dont forget B in Ethereum options expires tomorrow Brace yourselves boys,1624567297,23,1
1908,o7933m,MySubtitlesWereSick,-0.4588,Sold my Dogecoin profits and bought a few Ethereum,1624565834,11,1
1909,o78t90,N7DJN8939SWK3,0.0,Blockchain deadman switch on ETH,1624564988,83,1
1911,o78jbj,rdouma,-0.4588,Is the Ethereum subreddit always this hostile or is this just an exception,1624564180,14,1
1912,o78fqt,Good-Rooster-9736,0.7184,Just bought more Eth at a gas station,1624563888,226,1
1913,o78emx,No_Insurance6064,0.0,EIP testnet running,1624563803,6,1
1916,o77rq1,oconnellcamera,0.0,BestWorstScam Report    StonkZFarm in the Gameswap Scamily,1624561907,1,1
1918,o77eh6,abnormal-today,-0.0516,More and more influencers getting payed to promote pump and dump coins off the Ethereum name If crypto becomes heavily regulated in the US itll be because of influencers and greed,1624560813,7,1
1919,o7755z,Glizzyator3000,0.0,Ethereums ETH EIP  Finally Implemented in Ropsten Testnet,1624560027,0,1
1922,o76uyb,snrou,0.4767,Coinbase ETH Staking rewards now at  APY,1624559162,156,1
1923,o76nnn,trogdortb001,-0.7351,Common NFT Scams to Avoid,1624558562,3,1
1925,o76jh6,bitrefill,0.0,Living on crypto in the Philippines An interview with Luis Buenaventura,1624558235,0,1
1928,o768eb,pineapple-jade,0.0,Venmo is doing ETH,1624557356,13,1
1932,o6liy5,RiptideTiger,-0.25,What will CDBCs being based off of run off of do for ETH,1624480869,4,1
1937,o6kjjj,littleprincetechnoir,0.0,Tell us about your modus operandi when investing in ETH,1624477943,2,1
1938,o6kbvv,ShotBot,-0.8225,BREAKING John McAfee Found Dead in Spanish Prison Cell,1624477331,117,1
1940,o6jobe,Expensive_Let_2720,0.8807,Would you trust buying k worth of ETH right now,1624475403,0,1
1941,o6jm3m,tomardkeen,0.1027,Network hashrate dropped from  to  but profitability is the same,1624475215,7,1
1942,o6jkme,EtherShredsErica,0.34,Ether is giving us all the middle finger,1624475089,0,1
1943,o6j5wd,yosemitebtc,0.0,a few weeks ago the eth and btc charts were indicating more or less seperation and now theyre correlating again what causes this,1624473771,6,1
1944,o6ix67,ELeCtRiCiTy_zAp,-0.5904,Chamath Palihapitiya Why Warren Buffett is WRONG about Bitcoin,1624472991,1,1
1945,o6irna,rollingincrypto,0.4215,NFT popular website Rarible build on Ethereum blockchain raises M funding today,1624472541,2,1
1947,o6ikt8,Cute-Reporter2543,0.4588,Follow up on the Lady Gaga NFT Auction can be purchased in ethereum,1624471993,0,1
1949,o6i0ye,Repulsive_Anxiety404,0.7184,Last AIRDROP  CorgieMoon  To the Moon ,1624470408,0,1
1950,o6hz8r,Smashbopp,0.4588,Uniswap V LP Tokens as Perpetual Put and Call Options,1624470259,1,1
1952,o6hr4q,UncleFreshness,0.0,Considering putting my BTC into ETH Thoughts,1624469580,0,1
1953,o6hj6d,Avisooo,0.0,The Ethereum buildingToronto,1624468929,1,1
1955,o6gy87,chapogrown,0.0,Could Ethereum be coming to Fortnite soon  ,1624467376,0,1
1956,o6gvrp,Dr_puffnsmoke,0.4588,ETH newcomer who just read up on the ETHETC fork from ,1624467202,4,1
1957,o6gvn6,WallStreetDoesntBet,0.0,The market could go through another heavy correction this weekend,1624467194,0,1
1958,o6gh7w,CloudFew6986,0.0,Using Ethereum,1624466124,0,1
1961,o6gb4f,AdCapital2210,-0.25,Ethereums London Hardfork Ready to Drop on the Ropsten Testnet,1624465618,11,1
1963,o6g6je,rollingincrypto,0.3612,Rarible currently supports the ERC and ERC token standards Both are almost exclusively utilized in NFT markets whereas the more widespread ERC standard is used in Ethereums developing decentralized finance DeFi marketplaces,1624465239,1,1
1964,o6g32s,CulturalInstruction3,0.0,Feds CBDC on Ethereum,1624464957,0,1
1965,o6fyo9,itsvenkmann,0.0,Ethereum  Merger Spec Finalized,1624464570,3,1
1967,o6fcrb,c-r-y-p-t-o-,0.0,What will Happen to ETH When the London Hardfork Drops on Ropsten,1624462796,0,1
1968,o6fae8,c-r-y-p-t-o-,0.0,What will Happen to ETH when the London Fork Arrives on the Ropsten Testnet,1624462592,0,1
1969,o6f1we,dumbcryptoape,0.0,Ethereum Scaling Updates,1624461891,0,1
1971,o6egtq,TobiHovey,0.3182,Yield Raises M to Expand Fixed Rate DeFi Lending on Ethereum,1624460184,2,1
1972,o6efi0,HammondXX,0.0,Lets all go to this virtual townhall with Chair Powell and get our questions answered,1624460072,2,1
1973,o6eafj,rollingincrypto,0.0,Digital Shekel Secret CDBC experiment of Bank of Israel on Ethereum revealed,1624459651,1,1
1974,o6e9r4,Juankestein,-0.5267,Just started selling these steel backup plates online Accepting ETH,1624459592,241,1
1975,o6dnoi,HammondXX,0.2075,A little crypto humor for these trying times ,1624457691,1,1
1979,o6cqh4,Brinker59,0.0,Not your keys not your crypto Part ,1624454598,41,1
1981,o6cc9i,cprding1,0.7184,Strategic Lambo buying power,1624453245,0,1
1983,o6c5r1,duckfudge2049,0.0, ETH supposedly yeeted into the void,1624452623,43,1
1984,o6c25i,Rezvord,-0.3252,I mining ETH but doesnt go money eth on account,1624452254,0,1
1985,o6bs5z,rollingincrypto,0.0,Bank of Israel secret CBDC experiment on Ethereum Blockchain revealed,1624451215,2,1
1987,o6bc52,HK-11,0.0,ethereum analysis,1624449568,0,1
1988,o6bajl,vpisovaluw,-0.4588,IS Big Short investor Michael Burry right about crypto and meme stocks facing mother of all crashes,1624449388,0,1
1989,o6b3dy,Bitprofitprovider,0.6249,What a great mooning We sell here Next min load another Load your bnb,1624448530,0,1
1990,o6axsr,bordoisse,0.0,Is Polygon MATIC the King of Ethereum ETH Layer ,1624447868,9,1
1991,o6acxf,ARONBOSS,0.0,Israel Central Bank Reportedly May Use Ethereum ETH for Digital Currency CBDC  AronBoss,1624445352,11,1
1993,o69nd1,Cranberry_Afraid,0.4588,All Eth and its Tokens are Up,1624441914,0,1
1994,o69fh7,Venomous_B,0.0,ETH to become basis for digital Shekel,1624440802,0,1
1995,o69bti,WeltraumMarine,0.0,Bank of Israel to Use Ethereum Tech for Digital Shekel Report,1624440307,32,1
1996,o691zf,arminham1967,-0.5423,Ethereum Creator Loses Over  Million As Crypto Market Collapses,1624438999,0,1
1997,o68ko9,h3xkey,0.3612,Governments would like to push new legislation and laws regarding all crypto,1624436489,13,1
1999,o680ha,NewGardon,-0.3979,When running the JS demo in the remix integrated environment there is always such an error cannot call ScriptRunner from terminal Can you help me see whats wrong thanks,1624433626,0,1
2000,o67zjc,MirageInc,0.296,Eth Alert,1624433494,0,1
2001,o67v2j,chunckychunck,0.0382,Staking coins on Kraken vs you do not leave your coins on the exchange,1624432887,10,1
2004,o66xcm,hiilol69,0.0,Hopium Juice Upcoming Crypto events Data Charts,1624428507,0,1
2005,o66uqy,Brinker59,0.0,Not your keys not your crypto,1624428180,560,1
2006,o66hix,Alexgcryptofan,-0.6124,How Ethereum Uncle Block Mechanism could raise the chance of an Eclipse attack,1624426594,1,1
2010,o65dg4,sobi-one,0.0,Ethereum Expiry on Friday Whats your take,1624421982,15,1
2013,o64w1r,JackB4Ucryptostonkrs,0.0,Ether at discount again,1624420140,2,1
2014,o4a5xk,shashwat73,0.0,DeFIRE to issue wrapped tokens for ADA ADA and Ethereum CNE,1624208877,0,1
2015,o4a55q,Zenzoku,0.0772,Cap on number of Ethereum validators,1624208813,0,1
2017,o48xte,takizawarola172,0.6908,Famous Comedian Bill Burrs Bitcoin Story Excites You,1624205302,0,1
2018,o48sk5,Great_Things_in_Iife,0.7506,I am a finance freelance professional recieved my rd payment this week in ethereum just because I know its the best crypto ever Etherium Is Everything,1624204914,0,1
2021,o46rr9,NikkoIndustries,-0.6369,ETH down to k should we be worried,1624198941,44,1
2022,o46c4q,rollingincrypto,0.5279,Because of the technological innovation Ethereum will utilize even less energy than Bitcoin and Its conceivable that more investors will be drawn to Ethereum in the future,1624197756,209,1
2023,o464ro,mrflorida55,0.5106,Anyone for Ethe GS Trust,1624197196,4,1
2024,o462r2,Willis_Wastalkinbout,-0.5423,If the price of ETH dropped to K,1624197031,10,1
2025,o45yrx,def_abcd,0.4019,Hello  Im a new investor in eth Could u help me,1624196709,6,1
2026,o45u6m,Impossible_Taste_671,-0.5423,Why ETHEREUM will bounce back from the current price drop,1624196274,1,1
2028,o45q75,ChikaBtc,-0.4404,looking for criticism on my essay about what differentiates Bitcoin from altcoins ,1624195900,0,1
2030,o454m0,itsblockchain,-0.4588,Market corrections are not affecting Ethereum holders much as  of accounts will remain in profits even if ETH price drops below  in the near future,1624193797,1,1
2031,o4511i,thejoker2023,0.2732,BTC gt ETH change in hierarchy,1624193440,9,1
2032,o44nud,Diggdedededededee,0.0,Ethereum Mining Pool,1624192149,2,1
2033,o44l2e,goswamikundan19,0.0,Rapidfirecrypto  A Crypto Token With a Motive,1624191889,0,1
2034,o43r3n,Scuntintizza,0.0,Ethereum beer,1624189054,0,1
2035,o434vb,ghostoutfits,0.0516,Is PoS a store of value Why would BTC maximalists say no,1624186499,27,1
2039,o42afw,LoreKK97,-0.7262,Why are cryptos falling so bad in the past  months,1624183180,0,1
2040,o41zzm,Originalimoc,-0.8345,PSA SCAM WARNING lets ALL report them to YouTube,1624181955,1,1
2043,o4154e,ConnectedInnovation,-0.6486,ETHEREUM KILLERS IN  WHAT ARE THE ALTERNATIVES,1624178360,0,1
2044,o40vpp,ftteacherptinvestor,0.4404,Is it a good idea to be a crypto day trader as a hobby,1624177336,15,0
2046,o40nx5,ftteacherptinvestor,0.4404,Is it a good idea to be a crypto day trader,1624176597,6,1
2047,o40nh5,[deleted],0.4404,Is is a good idea to be a crypto day trader,1624176553,0,1
2049,o4087c,AncientAd6139,0.9349,Me laughs at people who bought in at k Also me bought at k,1624174854,3,0
2050,o3zejh,The-Crypto-Portal,0.0,The Future of Ethereum,1624171151,2,2
2051,o3zd6y,The-Crypto-Portal,0.0,Ethereum vs Ethereum ClassicWhat is the difference,1624170967,4,0
2052,o3zch5,The-Crypto-Portal,0.0,Learn about Ethereum,1624170860,0,0
2053,o3zc77,The-Crypto-Portal,0.0,What is Ethereum A beginners guide,1624170818,0,0
2054,o3zag2,The-Crypto-Portal,0.0,Vitalik Buterin Says Ethereum Will Scale to  Transactions Per Second TPS,1624170583,59,1
2055,o3za21,The-Crypto-Portal,-0.4019,A review of the Ethereum White Paper Ethereum Explained,1624170527,1,0
2056,o3z9m6,The-Crypto-Portal,0.0,Appealing to the average Joe in Ethereum amp the cryptocurrency space,1624170467,1,0
2059,o3xtgn,PeacockMamba,0.0258,Vitalik keeps on chugging along towards ETH  all aboard Chugga chugg chugga chugga choo chooooo ,1624164392,3,2
2060,o3xsp3,iPremium,0.533,Michael Burry warns the mother of all crashes but no we are not selling ,1624164304,8,0
2061,o3xnau,nugget954,-0.1779,How much am I losing out on by staking a full node worth  ETH on Kraken vs on my own laptop,1624163685,20,1
2063,o3wge6,sheepsgonewild,0.0,Learning a ton about the early days of Vitalik and the Ethereum crowd,1624159395,156,14
2065,o3vkq6,Cute-Reporter2543,0.0,Lady Gaga st NFT can be purchased in Ethereum,1624156134,0,1
2066,o3vduf,[deleted],0.0,Sent Ether posweth from MetaMask to Binance,1624155434,0,1
2069,o3tiot,Sufficient-Document3,0.8176,You can get  interest just from staking for  days On an asset that is constantly trending up with mass future potential,1624148643,0,1
2070,o3td2g,[deleted],0.7184,To buy Ethereum,1624148109,0,1
2073,o3szva,Zeros-hero,0.6369,Best place to stake Ether,1624146901,0,1
2074,o3swez,A_solo_tripper,0.0,Years of history claiming Ethereum will go to PoS starting ,1624146569,58,6
2075,o3s31b,TheRealCraigmac,0.0951,Talk with me Before You Buy or Sell From NoW Forward You Wont Regret It Promise ,1624143837,3,1
2078,o3rlh1,[deleted],0.368,It baffles me how so many people refer to Ether as a shitcoin Mainly Bitcoin maxis FYI I have nothing against Bitcoin,1624142253,0,1
2079,o3rk15,mklovr18,0.0,So this is the state of the NFT market,1624142123,0,1
2081,o3rhcr,quarter-life-crysis,0.4019,Help need advice on staking my ETH and getting ETH via Coinbase,1624141887,0,1
2082,o3r9cl,No-Disaster-5129,0.0,I accidently sent WETH to a ETH address,1624141172,0,1
2083,o3r7gi,CryptoDeFinance,0.0,Historical moments of the CNN channel will be recorded in a collection of NFT  Crypto DeFinance,1624141000,0,4
2085,o3r2ap,burtamanda,0.0,Bitcoin SV Giveaway,1624140532,2,1
2086,o3r0f3,BTC-Code,0.0,Ethereum Options End on the ,1624140359,0,1
2087,o3ql5j,thefoodboylover,0.0,SEC decided to not regulate bitcoin and other cryptocurrencies in ,1624139025,108,10
2088,o3q88r,Lastlord295,0.4404,Join the growing STC Ecosystem Student Coin aims to change the future of the digital economy,1624137920,0,1
2089,o3q32s,MEzero-TM,0.296,Ultra Sound Money ,1624137473,2,1
2090,o3pfzm,chrisdh79,0.3182,Crypto Analyst Very Likely That by  Ethereum Will Hit  per ETH,1624135515,1,1
2092,o3p34d,ShotBot,-0.6478,Craig Wright calls out ICOs Chainlink Defi for being total scams,1624134405,22,0
2093,o3p116,Repulsive-Teacher470,0.802,On board with ethereum jus bought my first share ,1624134234,0,1
2096,o3nmga,ARONBOSS,-0.1027,Testnet Date Announced For Ethereums ETH London Hard Fork  AronBoss,1624130133,4,3
2097,o3nl59,Signal_Data_6796,-0.296,Wait until ETH  for lower gas fees,1624130028,0,1
2098,o3ni1i,mymonochromeeyes,0.1779,Long time scam on YouTube somehow still active,1624129780,0,1
2099,o3n9a9,Focus_Leading,0.0,Next moonshot,1624129142,5,1
2101,o24kkc,A_solo_tripper,0.0,What is the price of ETH coins right now Or is it still in sandbox state,1623955688,34,0
2102,o248ia,mudgen,0.0,Interview with Coder of Aavegochi  Nick Mudge Building on Ethereum and Polygon,1623954845,0,3
2103,o247mo,[deleted],0.0,Interview with Coder of Aavegochi and QuickSwap  Nick Mudge Building on Ethereum and Polygon,1623954784,0,1
2104,o23yfp,BoxyM3,0.4215,I keep adding to my positionthese dip sales are too nice to pass up,1623954154,23,10
2106,o23ctk,ShotBot,0.0,Mark Cuban Calls for DeFi Regulation After His Crypto Investment Goes to Zero,1623952632,29,6
2109,o22dr7,AndysMilk,0.0,Ethereum to k,1623950144,0,1
2111,o21zz4,[deleted],0.4404,Just made this Thought wood would be a better way to ecofriendly ethereum,1623949167,0,1
2112,o21tnk,Successful_Fox_894,0.0,What if Cristiano Was paid in crypto,1623948711,0,1
2113,o21nm3,TallAside6090,0.7184,Should i buy eth today,1623948263,0,1
2114,o21ne3,ShotBot,0.4019,MATIC Continues To Outdo Ethereum in Active Users and Transactions,1623948246,9,0
2115,o21dcg,ShotBot,0.0,Is Matic a bearish force on Ether,1623947475,18,4
2116,o20y6m,Mercuryo-hare,0.1779,Layer  Solutions For Ethereum,1623946381,0,1
2118,o20th2,ShotBot,-0.5267,TITAN falls nearly  in latest Polygon DeFi exploit,1623946035,6,1
2120,o20kuf,BruinsFan1394,0.0,Crypto Interview,1623945405,0,1
2122,o206h0,mystic_works,0.8779,Does the success of crypto built on the Ethereum network help increase the value of ETH,1623944309,15,13
2123,o204wp,ceoofugly,0.4588,New to investing Sign up for Wealthsimple with my referral code to get  Code SAMAQ,1623944193,0,1
2125,o1zyec,Nickjaggerrrr,0.7506,Can someone please explain what staking is like Im a  year old I dont think Im quite understanding what the benefits of it are and also how to even stake my ether,1623943726,8,3
2126,o1zxi3,twigwam,0.4404,Website to watch ETH burn in real time thanks to EIP,1623943656,8,3
2127,o1zsgc,Interesting-Bag-9000,0.4404,crypto is easy,1623943278,2,13
2130,o1zdgg,AugmentedGlobal,0.2023,We are making a nice run still  WBCH left with  in liquidity on UniSwap,1623942183,2,0
2132,o1yz12,No_Doc_Here,0.0,Ethereum Timelines with Tim Beiko  EIP  Merge End of PoW PoS ETH ,1623941137,0,6
2133,o1yqxw,NeverHeardThat,0.3321,This really puts ETHs energy consumption in perspective,1623940535,426,655
2135,o1ybjx,CoinjoyAssistant,0.0,Ethereum on Polkadot Integrates with Unifty to Let Its Users Mint NFTs,1623939421,0,1
2137,o1yaa2,maferase,0.0,Is Portugal really a Tax Haven for crypto,1623939330,0,3
2141,o1xly6,wizardofthesonic,0.0,The new dawn of DeFi insurance  InsurAce is the FIRST insurance protocol to launch on both Ethereum Network and BSC,1623937507,2,1
2142,o1xkr3,CorrineSomers,0.0,Michael Saylor Has Changed His Mind on Ethereum,1623937415,5,6
2147,o1x1u4,Bubbly-Dependent351,0.7579,THOREUMPRESALE Launched Today  minute ago Pancakeswap  Liquidity Locked  Going to the Moon ,1623935919,0,1
2149,o1wvi6,thewildjoker,0.0,Index publisher MSCI looking at launch of crypto indexes,1623935417,2,1
