Unnamed: 0,id,author,vader,title,created_utc,num_comments,score
0,ny8h36,Elijah-Lloyd30,0.0,Ethereum gtgt This design Tshirt has been made today,1623509510,0,1
1,ny8ekh,Yeokk123,0.0,Borrowed this book from the local library what do you think about this book Is there any more other things or place I can learn more about Ethereum instead of just trading them,1623509310,21,1
2,ny87lk,Popcateum,0.0,Ethereum is too expensive So I made a Popcateum,1623508754,0,1
3,ny85rm,According_Western914,0.0,Who buys AMP ,1623508607,1,1
5,ny7s4n,ethbullrun,0.34,El Salvador government giving fully loaded computers to everybody so they can access the internet Bitcoin an modern technology,1623507505,24,1
8,ny7fgl,RemyTheWhippet,0.0,One full BTC Vs ETH,1623506514,12,1
12,ny5ikm,joebidensuncle,-0.2023,Really debating if I should put some money in ethereum Now that the price is down should I do it or not Sway my opinion,1623500363,13,1
13,ny5g91,ExplorationOfEarth,0.0,Eat this Elon,1623500138,12,1
14,ny5c53,iProphet3,0.0,Ethereum  Hologram NFT on Sale  Rarible,1623499728,1,1
16,ny41qv,rollingincrypto,0.1779,Namibia is seeing increased reports of crypto investors losing money to scammers,1623494942,2,1
17,ny3z2d,lorecirstea,0.2944,Most Flexible IDE for Ethereum contracts AND dApps beta release,1623494640,1,1
18,ny3jyg,AllwaysBuyCheap,0.0,Can I transfer ether to an account in mainnet from a loopring account,1623492890,0,1
19,ny2sts,Ludguallon,0.0,Recruiting Crypto Believers,1623489779,9,1
22,ny20ma,hirenkavad,0.3182,What will happen to matic polygon and other layer  solution after eth  ,1623486406,0,1
24,ny1bok,CorrineSomers,0.2023,How Layer  Is Primed To Solve Ethereum Scalability Issues,1623483525,2,1
25,ny0xx5,HilariaPosada,0.4588,Reddit CoFounder Alexis Ohanian has unveiled that he has a lot of Ethereum ETH Meanwhile Ohanian did not mention the exact amount of the ETH he holds Ohanian disclosed his passion for Ethereum in an interview,1623481859,7,1
28,ny0kz2,ushury,0.4019,Beginner needs help with ETH and BEP stuff,1623480365,0,1
31,nxzvly,Jaedos,0.3612,Firefox DeFi Dapps and a hot hanging laptop,1623477390,1,1
32,nxzr0u,Impossible_Taste_671,0.0,Why Ethereum Needs To Be On Your List,1623476897,0,1
33,nxzkut,Altruistic_Bother_42,0.0,not able to get eth from rinkeby faucet,1623476222,0,1
35,nxytek,Altruistic_Bother_42,0.0,not able to get some eth from the rinkeby faucet,1623473299,0,1
36,nxys8x,Altruistic_Bother_42,0.0,im not able to get rinkeby eth from the faucet,1623473184,0,1
37,nxy9oi,No_Clue_5667,0.7184,I believe everyone is buying GameStop and AMC stock that is why the whole cryptocurrency market is crashing and being annihilated,1623471295,13,1
39,nxxk1s,Solodeji,0.2023,How Layer  Is Primed To Solve Scalability Issues of Ethereum before the Launch of ETH ,1623468780,77,1
40,nxx3hw,abcoathup,0.0, Latest Week in Ethereum News,1623467179,0,1
41,nxwje2,North-Criticism9161,0.8306,Im The Yin to the Suns Yang the moon incarnated Im not passive Captcha failing you now were awake not artificial Intellegence just actual intellegence were cant be stopped you cant erase us,1623465291,0,1
42,nxvili,Aggravating-Carry250,-0.128,What factors lead up to the current crypto market crash were currently experiencing,1623461831,0,1
43,nxv66w,Grade19282,-0.8442,Billionaire Elon Musk was charged with nd Degree Felony Assault,1623460654,0,1
45,nxtplo,PeacockMamba,0.296,Elon Musk Markets and Money ,1623455859,7,1
46,nxtc5r,Groodly2836,-0.3818,Anonymous Threaten Elon Musk over Tweets,1623454670,0,1
47,nxsgb9,Choice-Group-5322,-0.2732,Ethereum lagging,1623451822,6,1
49,nxs1uy,CryptoDeFinance,0.0,Bitcoin Twitter integration soon says CEO Jack Dorsey  Crypto DeFinance,1623450645,2,1
50,nxpszw,Wooden-Response-5275,0.8762,Scam token on uniswap that lets you buy tokens but not let you sell Increasing the value of token  newun is the contract owner,1623444385,0,1
51,nxpsqv,mngigi,0.4939,How to Succeed in Crypto,1623444367,9,1
53,nxpq0s,kippers871,0.0,London signals ethereum,1623444164,0,1
54,nxppr6,HoboBaggins24,0.0,Ethereum Token for Interactive Anime,1623444145,0,1
56,nxp8p4,Normal_Audience680,0.0,ETH Question,1623442828,8,1
58,nxp5yb,PGCL,0.34,Would you value more a company if their communications were on Reddit rather than on other social media networks,1623442625,0,1
59,nxp53v,WallStreetDoesntBet,-0.5256,Most dangerous ETH token,1623442562,15,1
60,nxow2v,stuntpope,0.0,Bitcoin is Dedollarization Ethereum is DeFinancialization,1623441869,2,1
61,nxove8,okjsss,0.6249,Join the Crypto Pump family,1623441816,0,1
62,nxol99,Alienbaba170,0.0,New ERC Gem x Future of Crypto  BOOMB  k MC  HOURS OLD  Utility Token,1623441073,12,1
64,nxo7j2,stevewonderburg,0.6351,Still no update from Rocket Pool despite severe launch delays,1623439999,1,1
66,nxnocx,crypto_pub,0.5719,Reddit CoFounder Revealed That He Loves ETH So Much,1623438482,25,1
68,nxnfsz,[deleted],0.0,Ethereum,1623437847,0,1
69,nxnd2l,[deleted],0.0,Ethereum gtgt Today this new design tshirt has been made,1623437635,0,1
70,nxn8hd,Hornyallday12345,0.0,Whats happening to eth,1623437281,0,1
71,nxmu7r,sebastianrw,0.0,Comparison of commissions and times per transaction Bitcoin Ethereum Litecoin Dogecoin Nano,1623436212,2,1
75,nxm2yy,wyrdboi,-0.128,Join the Giga Chads Crypto Fraternity Discord Server,1623434183,2,1
77,nxlim8,Kubomom,0.264,Why is ETH price suddenly dropping when there is more positive news than FUD this week,1623432721,0,1
79,nxldz1,cryptofuture4me,0.64,Ethereum To k Most EXCITING Crypto Prediction,1623432405,10,2
82,nxl5qa,eliesczhae,0.2263,Ethereum Minecraft NFT for web esports This is sick  love it,1623431815,1,1
83,nxkw0e,developeron29,0.0,Search for price of every cryptocurrency and compare with ETHEREUM,1623431099,0,1
84,nvxtck,twigwam,0.2263,MEV in Eth  An Early Exploration,1623250423,0,1
92,nvvzo7,fickle_fuck,0.0,Ethereum Developer Bundle kit anyone tried these,1623245406,0,1
93,nvvyjk,crypto_pub,0.0,Vitalik Buterin talks about Ethereum and Dogecoin Collaboration Nearly five years taken to get to where they are now  turned into  million by investing only in DOGE,1623245311,0,1
95,nvv7wb,BoyYeetzWorld,0.0,PayPal handled nearly  billion in Bitcoin Ethereum and Litecoin trades in May,1623243196,4,1
97,nvuixu,altz3r0,-0.507,So I lost access to my address anyway to get it back,1623241084,0,1
98,nvu61j,Ondrejjc,0.0,Have you heard about the new sustainable digital currency developed by Stanford PhDs,1623240234,0,1
100,nvtmed,BizzLytic,0.0,CRYPTO,1623238529,0,1
102,nvt862,CZgang,-0.0516,CZ VS ELON TOKEN The fight of the year Available June  on PancakeSwap  Anti Whale  Reward for holders token burn ,1623237072,0,1
103,nvt51v,VAMPXIII,0.1779,Layer  Solutions Stand To Transform The Crypto World,1623236763,3,1
104,nvsopu,Crnorukac,0.0,Vitalik discussing Ethereum and blockchain space  Podcast,1623235111,1,1
107,nvrvpw,jadezh8736,0.0,Crypto Airdrop Giveaway,1623231954,0,1
110,nvrpws,singhkajal24355,0.296,DeFi is all about Money Legos ,1623231300,6,1
111,nvrkw9,Mesiko20,0.0,Ethereum will surpass Bitcoin Ethereum News,1623230734,2,1
112,nvrip3,Foltak,0.0,This is Antarcticas unofficial flag so I guess we know what its unofficial currency is,1623230478,47,1
114,nvrcf2,BitcoinWide,0.3818,San Jose Sharks Becomes First NHL Team To Accept Bitcoin Ethereum Dogecoin,1623229738,0,1
118,nvr16l,CryptoDeFinance,0.4939,Congress of El Salvador approves Bitcoin Law and gives legal tender to the cryptocurrency  Crypto DeFinance,1623228470,8,1
121,nvq9pe,CoinjoyAssistant,0.6486,TA Ethereum Signals Recovery How ETH Could Start A Strong Increase,1623225252,1,1
122,nvpp80,shatirullu,0.5859, Amazing Characters  ETH,1623222741,0,1
123,nvoyxy,bahnruss,0.3182,send eth to cool dude,1623219759,0,1
124,nvok9w,superpio09,0.8402,Warriors unite Final boarding call for ROK moon mission,1623218137,0,1
126,nvoben,tumblatum,0.0,Back to eth after few years Is there any practical use or still waiting,1623217177,9,1
127,nvo42s,gbgghmre657u6,0.7184,Im The Moon,1623216390,0,1
130,nvlqmd,SNN20,0.4404,ETC will get green again soon,1623207922,7,1
131,nvlgs9,IkenSpinoza,0.873,The Remarkable Growth of Cryptocurrencies  TOP ,1623207029,0,1
133,nvkz4x,SnooTangerines4358,0.4215,The future of financehow crypto can unlock immense opportunity in real estate,1623205398,5,1
135,nvknge,brollikk,0.5221,Crypto for the homeless  Handed out McDonalds in philly Nothing special but a little at a time adds up,1623204326,7,1
137,nvjiut,glguju1188,0.8271,After years I finally am convinced Bought M of ETH today,1623200645,37,0
138,nvirzx,noaxeneeded,0.4588,Crypto Interest Rates  Summary Table For June,1623198161,0,1
139,nvir6i,brantlymillegan,-0.1263,Ethereum had accidentally solved a major problem of the Internet true Single SignOn,1623198085,138,1
140,nvi7ed,eclecticjuggernaut,0.7184,never been one to buy into shtcoins,1623196397,6,1
144,nvhiaq,tngcoin,0.7783,Tong Jerky is Proud to celebrate nearly  years of using Ethereum,1623194369,0,1
147,nvh116,Comfortable-Ad-795,-0.4588,DEFI HACK,1623192965,0,1
148,nvgubt,angelbud6,0.0,My investment in Eth,1623192433,0,1
149,nvgm0l,ilikedastock,0.802,What is best way to pick up developing Dapps on ethereum blockchain Just read the docs,1623191766,6,1
150,nvgkzj,EuphoricLawfulness46,-0.0258,PROFIT FROM THE SAME METHOD AS THE BURGERSWAP ATTACK,1623191688,0,1
151,nvga9p,dabidoe,0.5719,Vitalik Loves the Doge,1623190865,0,1
155,nvfxnc,fatfirewoman,0.7184,Just buy and hold ETH vs using Aave vs Uniswap vs Alchemix,1623189958,3,1
156,nvfw9c,NotMyMainAccount1010,0.4019,Beginner Who Wants Help With ETH,1623189861,0,1
157,nvfvkl,NotMyMainAccount1010,-0.1779,stupid beginner asking for help with ETH,1623189816,0,1
163,nvea5o,Harukkai,0.3182,Yall see Ethereum hitting k within a yeartwo or is that just completely unrealistic,1623185873,15,1
164,nve13i,ARONBOSS,0.8738,Whales Dont Sell Ethereum ETH and Buy Bitcoin BTC According to Santiment  AronBoss,1623185254,2,1
165,nve036,vbuterin,0.0,EthMag Proposed scheme for encoding Ethereum state into a Verkle tree,1623185183,16,1
168,o0fj9z,[deleted],-0.8481,I fell for this scam and sent someone ETH for no reason,1623766944,48,0
170,o0fbeb,DailyGweiBot,0.0,Dude Wheres My ETH  The Daily Gwei ,1623766339,2,5
171,o0f8ol,investor_Susan,0.4404,PROFITABLE BITCOIN,1623766129,0,1
176,o0e6mv,motu147,0.9455,I may not be Elon but Im doing what I can I own a small soap and beard care company and finally set it up to accept ETH Whatever I can do to help it become a more mainstream form of payment,1623763184,41,121
177,o0dtvz,cryptocalbot,0.0,Add to your calendar Ethereum ETH event Ropsten Fork  June  ,1623762115,4,15
178,o0divt,R_r_r_r_r_r_r_R_R,0.5766,Discussion L for Ethereum or MATIC,1623761180,6,1
179,o0d6qg,FLAMINGOFINANCE,0.8225,O tokens are on Ethereum network and price being boosted as o Tokens Staking on PancakeSwap BSC Network Crypto Blockchain o Rewards  up  last  hours,1623760076,0,2
180,o0d4rx,sportifynews,0.0,Ethereum Bulls Will Take It to K Soon Lark Davis,1623759898,0,1
181,o0d35w,jojupiterv2,0.0,alternative BTCPAY SERVER for ethereum and erc,1623759754,0,1
182,o0cx2b,[deleted],0.0,Ethereum Bulls Will Take It to K Soon,1623759201,0,1
185,o0cpzk,crypto_pub,0.7269,Top crypto Youtuber Lark Davis predicts that ETH will reach K soon He cited  reasons including the POS transition and Ethereum  update for the rise,1623758522,18,1
188,o0ci3s,HappyEngine4338,0.6705,Stargate VR mining up and running on the Mainet crypto etherum Blockchain First phase of building my cryptocurrency Virtual Reality game ready and complete Next goal is too start making its own cryptocurrency exchange,1623757792,0,1
191,o0c6dx,Left_Rich_681,-0.5106,After Bitcoin Goldman Sachs stretch in Crypto trading by offering plans for Ethereum,1623756691,0,1
192,o0c2v3,KTR87,0.5766,Ethereum Ls vs L Competitors,1623756345,0,1
195,o0bd95,lorecirstea,0.0,A small preview of our Taylor IDE built with Marks Factory Taylor is the only EVM interpreted language in Ethereum,1623753813,0,15
196,o0b7sq,Terrible-Possible-91,0.4404,Is ethereum safe,1623753238,0,1
197,o0azch,thewildjoker,0.0,Goldman Sachs to Offer Ethereum Futures Report,1623752337,2,6
198,o0atnc,[deleted],0.4588,Top crypto YouTuber Lark Davis has just come out with a video predicting ETH going to ,1623751716,8,0
202,o09s2i,HalcyoNighT,0.0,What is Ethereum  ByteSized Ethereum Podcast  hosted by Alex Botez and Topher Benson,1623747315,5,0
203,o09s2g,Holiday-Obligation93,-0.4215,The Brutal Truth About Bitcoin,1623747315,0,1
209,o07rvm,darcius79,0.6369,Rocket Pool Dev Update  June ,1623739052,5,15
212,o07kuj,Aggressive_Survey_79,0.1027,What are the chances of an ETH hard fork,1623738292,18,1
214,o06so9,DefiniteOptimist,-0.2023,Why has daily active ethereum addresses dropped so sharply recently,1623735389,28,0
217,o062rb,[deleted],0.5423,Give me one reason Ethereum is superior to Tron A thread,1623732773,0,1
219,o05hjj,sportifynews,0.9001,Buy Ethereum Before its Tech Upgrade Makes the Price Soar,1623730671,12,14
224,o02hym,Ituglobal,-0.6808,Ethereum Risks Further Decline as It Faces Rejection at ,1623721055,0,1
225,o02evf,[deleted],-0.5423,NFT Drop  bidding starts at  ETH,1623720798,6,0
227,o0288x,TexasSki,0.0,Goldman Sachs will offer ether options for crypto clients report ETH ,1623720210,6,46
228,o023w4,Maleficent_Quiet7709,0.0,Scammer,1623719824,0,1
230,o01xf2,TCr0wn,0.0,Is Bitcoin Maximalism Toxic For The Crypto Community  Weekly Recap,1623719243,0,0
231,o00v1k,investor_Susan,0.0,Crypto currency Investment,1623715797,0,1
233,nzzwu9,Mars_chego,0.4019,Roughly  of Ether ETH Supply Locked in Smart Contracts,1623712867,6,5
234,nzzicz,BoyYeetzWorld,0.6486,Weekly outflows from Ethereum investment products hit an alltime high,1623711682,4,5
236,nzz62w,twigwam,0.4019, of all ETH is being utilized in smart contracts,1623710665,39,91
237,nzz478,TheHodlDon,0.0,Bitcoin rises after Elon musk Tesla tweet What to expect of bitcoin price in the coming days,1623710505,0,1
239,nzya9p,[deleted],0.0,Making stacks off my  ETH stake on Coinbase,1623708157,0,1
244,nzwwbg,BoyYeetzWorld,0.6249,United Kingdom farmers now use cow dung to power Ethereum mining and increase revenue,1623704432,26,62
245,nzwvh8,JAKE-LAF,0.0,How to stake my ETH,1623704385,17,0
247,nzw5lo,socalquest,0.0,My ETH Average Cost ,1623702465,4,0
248,nzvvkj,brollikk,0.6597,Crypto for the homeless  more pizza  over  meals delivered now Would appreciate some help handing out food,1623701716,64,48
251,nzvden,Major_Ad8178,0.0,Yesterday I received my very first payment for a haircut in Ethereum,1623700442,0,1
252,nzvd0l,Mr_Wolf9,0.0,For the first time in my life I could purchase Ethereum directly from an ATM here in Geneva Switzerland I could also purchase Bitcoin Litecoin and Monero,1623700415,587,1998
253,nzvcnc,ShondraRiemann,-0.4588,Crypto Market Cap Has Fallen Considerably Since Last Month,1623700386,0,1
257,ntn9va,gharvhel,0.34,Ethereum leading they way in volume and gains,1622990573,5,1
258,ntn4e1,kunstname,0.6249,Great Message from Anonymous to Elon Musk,1622990138,0,1
260,ntmfi6,MattwillYums,0.3167,Where can I find the most comprehensive learning materials for ethereum,1622988133,4,1
261,ntm55k,PonkyTonker,0.0,Wojak buys crypto,1622987278,1,1
263,ntluhq,BoyYeetzWorld,0.3612,As markets cool ETH gas fees hit a monthly low,1622986386,0,1
269,ntl2t9,4CAonPoint,0.6908,Is anyone else excited that ETH chart isnt mimicking Bitcoin anymore In fact but coin is dropping and ETH is going up Let the flip begin,1622983933,0,1
270,ntkwu9,VLADIMIROVIC_L,-0.2144,What is the difference between ethereum and a web server I already understand the oracle problem but besides that why cant we have decentralised frontends,1622983376,0,1
275,ntkfew,International_Past15,0.34,BITCOIN non ha bisogno di ELON MUSK  MIGLIOR STARTEGIA per CRIPTOVALUTE  cosa bisogna fare,1622981639,0,1
276,ntkdcd,VLADIMIROVIC_L,-0.2144,What is the difference between Ethereum and a web server I so far understand the oracle problem but besides that why dont we have decentralised frontends,1622981417,0,1
279,ntjaew,that_one_indian_dude,0.5106,Higher Quality Ethereum Wallpaper for Smartphones tips appreciated,1622977334,4,1
280,ntisa4,that_one_indian_dude,0.5106,Ethereum Wallpaper for Smartphones tips appreciated,1622975294,1,1
282,nthk2k,Raphar93,0.0,PaperFox Token  New Gem in DEFI,1622970080,1,1
284,ntguon,SenseAndCents,0.0,Some Ethereum DD,1622967105,0,1
286,ntgfew,InternalBig8650,0.0,Ether staking,1622965324,0,1
287,ntgd69,Bitlive-pro,0.0,HOW TO Exchange Ethereum to Monero,1622965049,0,1
288,ntg194,cryptic_minds,0.0,One of the many steps forward in the crypto world,1622963528,0,1
289,ntfwxb,Dr_Toona,0.0,Hitler Seeks Crypto Investing Advice,1622963007,3,1
290,ntfrl9,murt,0.0,Ethereum Foundation Unicorns,1622962423,6,1
291,ntflln,verbatin1969,0.7184,Moon take away,1622961723,6,1
299,nteem3,shocktop69,0.0,Floyd wearing Ethereum gear to weighins ,1622956995,0,1
300,nteavo,wowridiculous,0.0,Ethereum TShirt worn by Floyd Money Mayweather on the World Stage,1622956611,2,1
301,nte92i,Liberosist,0.0,Understanding Ethereums rollupcentric roadmap,1622956418,5,1
303,ntdhz4,neocybersonic,0.6369,Best Ethereum conference,1622953665,6,1
304,ntd8bp,coinmonks,0.0,Wrapped Bitcoin  The Bridge to Decentralised Finance,1622952676,2,1
307,ntcqr3,terp_studios,0.0,Some Ethereum woodburned art I made recently,1622950922,117,1
308,ntcor3,BoyYeetzWorld,-0.7717,Elon Musk blamed by Anonymous for destroying lives of cryptocurrency holders and attempting to control Bitcoin,1622950723,0,1
311,ntb6ui,Blk_d,0.0,Ethereum node now live in space ,1622945439,15,1
313,ntawn6,vajrapani1,0.0258,Is weth backed by eth,1622944458,3,1
315,ntajsz,MrNotSensitive,0.197,Can cryptos really become legal tender,1622943209,13,1
317,nt9u57,Grade19282,-0.3818,In the Battle over Bitcoin Its Bull vs Bear in Elon Musks Brain,1622940836,0,1
318,nt9jja,twigwam,0.0,Whats New in Eth   June   Edition ,1622939831,2,1
319,nt9i8g,Grade19282,0.0,Over  of Bitcoins Circulating Supply Hasnt Moved in the Last Year,1622939717,0,1
321,nt8z7r,d1nkys,0.4019,Interesting narratives coming out of Bitcoin  about ETH flippening,1622937965,6,1
322,nt8rtn,AccomplishedHornet5,0.0,Im from El Salvador and Im here to clarify some things about the BTC adoption recently announced,1622937309,4,1
323,nt8n07,logic_beach,0.6249,POAP explained succinctly An awesome nonfinancial protocol built on Ethereum that has potential to become ubiquitous,1622936859,13,1
326,nt7yhf,vinay1668,0.0,Anonymous message to Elon musk,1622934673,13,1
330,nt7aj2,CapableLength0,-0.6808,So this is Ethereum yet we cant talk about pricing Our investments then what the hell is this group here for To talk about things out of our control,1622932615,11,1
331,nt6v8j,OrigamiThoughts,0.0,Anyone Else Receiving Eth Randomly,1622931323,9,1
333,nt68ky,BoyYeetzWorld,0.34,What can a secure Dogecoin to Ethereum bridge achieve,1622929495,0,1
334,nt5wrz,thepokerplayer7,0.4767,I am just too much admire to Ethereum even i dont have any Ether,1622928578,4,1
335,nt5gkx,montaigne85,0.6124,Elon Musk pretty much agrees with Vitalik,1622927379,15,1
336,nt4u3c,Yusukeshairline,0.0,new to eth,1622925594,0,1
337,nt4sji,swiftcube,0.0,Eth Gas Station estimates reliable,1622925473,3,1
341,nt4382,josejozay,0.3612,Ethereum Tx Cost,1622923383,4,1
344,nrf54n,Deathcerri,0.0,Any work in Ethereum for Accountants,1622731374,3,1
345,nrf1bc,ReviewEquivalent1266,0.34,Are NFTs inflating the value of Ethereum,1622731085,0,1
346,nretoy,cerebral_surfer,0.6597,Professional derivative trader LF help with automated ETH smart contracts,1622730512,0,1
347,nreoyd,CryptoMaxChute,0.0,The Knights Templar The Masonic Order and Crypto Whats The Connection,1622730152,0,1
348,nreo8e,Steak-Rich,0.4019,Help Palestine with Cryptos ,1622730101,0,1
349,nrek46,BitcoinWide,0.3818,Tesla Taxi Aschaffenburg Is First Taxi Company in Germany to Accept Ethereum amp Other Crypto as Payment,1622729791,2,1
350,nrehgp,DailyGweiBot,0.0,The Core of Ethereum  The Daily Gwei ,1622729585,1,1
354,nrdj0j,jgills,0.6597,Professional derivative trader LF help with smart contracts and ETH programming,1622726923,0,1
355,nrdgvu,frank__costello,0.5994,Own the Internet A Bull Case for Ethereum,1622726754,1,1
358,nrczon,sissjwm,-0.8442,Billionaire Elon Musk was charged with nd Degree Felony Assault this Saturday Morning,1622725358,0,1
359,nrcz3a,yavoqctjeriuy,0.0,Automata ATA is available to stake on binance launchpool possible price prediction at launch,1622725310,1,1
360,nrcvpy,zucchini_fries,0.0,Borrowing using Crypto as Collateral My Experiences and Findings,1622725060,22,1
361,nrcodq,sissjwm,-0.296,Face masks no longer required in classrooms,1622724463,0,1
364,nrbnkx,Sea-Guard2144,0.0,The Crypto Market Today June ,1622721289,0,1
365,nrbn9y,nodeocracy,-0.0516,Is there any downside to have  rollups instead of sharding then moving on to solve statelessness,1622721262,6,1
367,nrb3p8,hgsrgh,0.4588,Top  Ethereum Addresses Hold  Million ETH Large ETH addresses have purchased Ethereum in large amounts over the last few weeks,1622719623,0,1
369,nrb0s3,Gunnar_Peterson,0.0,What happened to my ETH,1622719310,14,1
371,nran19,true-bitcoiner,0.0,Norton Steps Toward ETH Mining should have DogeCoin Option,1622717897,0,1
372,nrak3p,carlosonee,0.2732,The Winklevoss Twins claim that Ethereums price might reach  in the long run,1622717564,0,1
373,nrahdq,qX__xb,0.8689,Such amazing news Ether heads towards the moon literally,1622717259,1,1
375,nr9el1,CorrineSomers,0.0,ETH Stacked On Ethereum  Surpasses  Million,1622712924,6,1
376,nr98oz,CorrineSomers,0.0,ETH Mining Revenue Beat BTC in May but Will the Lead Last,1622712246,3,1
377,nr954q,Pelopida92,0.0,Programmatically verify that someone owns a particular ETH address without asking for his private keys,1622711828,5,1
378,nr91mx,WallStreetVids,0.7184,How can nonUS person buy BNB with BTC or ETH,1622711429,5,1
379,nr8tr7,Trina_L,0.3182,Ethereum ETH Good News for  Million Users How Will Its Price Be Affected,1622710541,16,1
380,nr8nlb,methuselon,0.7184,Elon Musks hidden message Ethereum To The Moon in his tweet yesterday,1622709820,0,1
381,nr8ksw,crypto_pub,0.0,Vitalik Buterin Comments on Barriers on Roadmap to Eth,1622709499,4,1
382,nr8gar,BulbAndFries,0.4019,Ethereum Explained World Computer Smart Contracts and a new Financial Revolution Animated Explainer,1622708958,12,1
385,nr83jv,IcyManner,0.2909, gas fees were good because they showed high eth usage so arent current low fees bad due to lack of usage,1622707465,23,1
389,nr6pcr,ConnorD0509,0.0,Whats the difference between ETHPAX main ethereum and ETHBTC,1622701801,3,1
390,nr66ne,sportifynews,0.0,Why Mark Cuban Is Right About Ethereum,1622699680,3,1
392,nr63uu,JeremySoCa,0.7783,Wow massive PoS just shows how strong the future is,1622699358,1,1
394,nr5evk,Vegetable-Fudge-2433,0.743,Lets break k tonight too much positivity in eth,1622696648,0,1
396,nr5a6v,salchipop,0.4019,Animated Explainer Video Ethereum Explained World Computer Smart Contracts and a new Financial Revolution,1622696170,0,1
402,nr3bpn,Structure_Clear,0.3612,Is there a coin that mimics that stock market index of countries like the US Japan Germany etc,1622689254,0,1
410,nr0umd,ElonMuks-earth2,0.0,New Coin  Ethereum PRO,1622681067,12,1
413,nr0byg,GitCoins_1122,0.0,ANKR Coin WEB Do you research now,1622679380,0,1
414,nr0brz,Quick_Development533,0.4588,Investing in reputable liquidity pools or setting up an ETH  validator node,1622679365,0,1
417,nqzuxr,Fwb100,0.0258,BIG NEWSSSEthereum To SOON Be Accepted As A form of payment by this company in the UK It is run by a  year old entrepreneur TO THE MOOOON Filledwithbarakah,1622677854,0,1
418,nqz9jk,wiwiwjwis9xjse,0.7506,Coinbase Pro opens up to dogecoin after cryptocurrencys  gain this year,1622675981,0,1
419,nqz55m,snapczterz,0.5994,Even Vitalik Buterin is surprised at just how long Eth is taking,1622675611,0,1
420,nqz3vc,OMGLilTech,0.0772,Im new to Crypto in general and I want to trade crypto for a living,1622675503,0,1
421,nqyx9n,Mars_chego,0.2023,Prysmatic Labs Releases Important Update on Eth Development,1622674980,5,1
426,nqy555,Iraqy_Lobster,0.34,What percentage of ETH staked in  will make the network secure Right now only  is staked,1622672744,10,1
428,nqy03v,g_inc,0.4576,Just saw this artwork Really nice idea written in description Ill drop it in comment section Artwork looks great as well,1622672351,2,0
429,nqxgeu,SolorMining,0.0,Wrapped Bitcoin WBTC explained Bitcoin on Ethereum,1622670865,1,1
431,o8xz5l,PM_ME_UR_TANGOS,-0.4404,Is it reasonably possible for a government to block the use of a any currency type,1624803605,41,1
433,o8xr72,Order_Responsible,-0.5719,Possible for Negative Return with ETH Staking,1624802853,0,1
434,o8xp3z,PCnerd1024,-0.4767,stuck transaction due to low gas price transaction is confirmed,1624802654,19,1
435,o8xnwu,sky_Driver88,0.0,ETH  point Oh,1624802546,0,1
436,o8xj61,JWXemself_queerBIPOC,0.0,Anyone know how to turn USD into transferable ETH fast,1624802110,102,1
437,o8xf52,Safe-Helicopter9466,0.0,Was chatting to my barber about crypto currencysparticularly ethereum and the network  ecosystem,1624801715,0,1
438,o8w9lw,cryptomoviearts,0.0,Jack SPARROW  Johnny Depp NFT Portrait   Crypto Movie Arts   ETH,1624797343,3,1
439,o8w5gc,LunaticBillion,0.0,What will hapen to my eth when eth  comes out,1624796891,0,1
441,o8vary,crypto_pub,0.0,ETH Will Beat BTC amp Flip the Market Says Crypto YouTuber,1624793204,10,1
442,o8uz56,ProChangeBaz,-0.5574,Any place to speak about Windows vulnerabilities and hacks,1624791761,0,1
443,o8uota,BOSS171102,0.0,YouTube and Tiktok Star Justin Marc donates  in ETH to a childrens school in Mexico City,1624790391,0,1
445,o8t17y,CoinjoyAssistant,0.2732,Weekly Digest Ethereum London amp Alternative Flare Gas Energy,1624782446,0,1
446,o8szpn,LilFrenchLad,-0.4588,ETH dump or not,1624782240,11,1
448,o8rf45,gharvhel,0.0,Ethereum fees at  gweis ,1624774477,218,1
