Unnamed: 0,id,author,vader,title,created_utc,num_comments,score
2578,nsagy1,Artifax_of_the_Mind,0.25,Had a dream last night Vitalik Buterin invited me to an insider meeting and then he and I plus a few others proceeded to take bong rips on a beach and brainstorm ETH applications,1622827384,5,1
2579,nsagl5,Emirate123,0.4976,Due to this pandemic virus that is all over the world we say a very big sorry to our community at large and also stay safe in there various locations  due to this Binance will donate  worth of BTC ETH bnb,1622827358,0,1
2580,nsae9m,CorrineSomers,0.0,Ethereum Mining Feature to Come on Norton  Antivirus,1622827191,3,1
2582,nsad28,[deleted],-0.3182,Does anyone know how the maybe delay from Eth  will affect the Eip launch ,1622827102,0,1
2583,nrsxxn,frcmricmrc,0.0,CRYPTO FOUNDER ALLEGEDLY REVEALED,1622768730,0,1
2584,nrsv5z,Illustrious-Host-110,0.0,ETH,1622768484,19,1
2585,nrsqal,frcmricmrc,0.0,Bitcoin founder allegedly revealed,1622768058,0,1
2588,nrs6p8,qX__xb,0.9568,Amazing new Vitalik Buterin interview Aired about e hours ago The interview is long but truly great Thanks uvbuterin ,1622766285,1,1
2589,nrrvtg,RossiB6,0.0,Ethereum NFTs and Gaming,1622765357,21,1
2590,nrreen,Whitestickyman,0.0,Ethereum Vs Solana Design philosophy,1622763894,3,1
2593,nrqgpu,FitTechnician7260,0.4588,rVTHOTrading is up for sale,1622761134,1,0
2595,nrq62x,twigwam,0.0,Charting The Path To Proof of Stake Ethereum  ConsenSys Blog,1622760285,1,2
2596,nrpzv0,CryptoDeFinance,0.0,Norton Crypto is the new ethereum mining feature from Norton AntiVirus  Crypto DeFinance,1622759802,2,1
2597,nrps1f,AppleCrisps76,0.4172,For those that dont want to convert to ETH  and have your funds locked up what staking services are you using,1622759184,0,1
2598,nrprvr,twigwam,0.0,Scaling Ethereum with zkSync  Union Square Ventures,1622759172,4,1
2600,nrpj13,someonerandom0987,-0.7184,Selling my real estate via ethereum,1622758497,11,1
2606,nrowu8,Herb_Approach,-0.25,Drop a like or else you will pass away in the next  minutes,1622756804,0,1
2608,nroiv1,Pixel_Pockets,0.0,Been mining ETH for the past couple of days on multiple PCs Do I need a pool for this,1622755772,2,2
2609,nroin2,HopiumFreeBull,0.6597,Getting rich means taking profits Getting wealthy means Hodling for  years Truth,1622755755,0,1
2610,nroe71,trent_vanepps,0.0,Vitalik Buterin Ethereum   Lex Fridman Podcast ,1622755429,60,2
2615,nrn0js,byhallows,0.0,Running Home,1622751790,0,1
2616,nrmuh7,Powerful1c,0.6705,Polygon MATIC the exciting Layer scaling solution for Ethereum is now trading on InvestVoyager,1622751357,2,1
2619,nrmblt,cyclist_1490,0.296,Why is regular money not programmable,1622750016,6,1
2621,nrlz9a,CryptoDeFinance,0.1027,Israel conflict boost Bitcoin donation to Hamas  Crypto DeFinance,1622749153,2,1
2622,nrlryl,trogdortb001,-0.296,Please ELI Why did the Ethereum gas prices drop off a cliff,1622748616,40,2
2623,nrlqde,trogdortb001,0.0,Mempool competition drives Ethereums realtime gas fee marketplace,1622748497,1,2
2624,nrlmyk,trogdortb001,-0.34,Did you know that Ethereum launched with a block gas limit of FIVE THOUSAND You couldnt even send transactions,1622748249,0,1
2631,nrkob5,saad_bin_noman,0.0,need ether,1622745803,0,1
2632,nrkawd,Vinasis,-0.2263,This Article Suggests that ETH  will be delayed till late ,1622744816,19,1
2635,nrk8kf,madmoonboy,0.0,Should I go all in on ETH,1622744648,30,1
2636,nrjlcr,[deleted],0.4215,Nice one ethereum,1622743008,0,1
2637,nrjf7w,tzegian,0.0,Crypto Transaction Decoder,1622742566,2,1
2643,nri3s6,Terrible-Possible-91,0.0,Norton  Announces Feature to Enable Ethereum Mining on All Computers,1622739143,0,1
2646,nrhicn,OkMongoose7304,-0.4404,How to Use Block Explorers for Beginners in Crypto,1622737582,0,1
2648,nrhfoo,Cheap-Adhesiveness14,0.0,Ethereum vs The Rest of The Crypto World,1622737385,0,1
2652,nrgg3l,TheCryptoBaron,0.0,An Ethereum Community Story from the Crypto Baron,1622734812,0,1
2653,nrgfjk,Omega663,0.0,Ethereum Camo Logo Tee,1622734771,0,1
2654,nrg2kd,ImaginaryBear2078,0.7579,Is buying etherum now at k a smart move  is coming next month and I have no idea what that may do to the price,1622733805,15,1
2655,nrfu99,Flawe,0.0,Mark mic dropping,1622733193,798,1
2657,nzhsxb,coinmonks,0.4019,Smart Contracts on Ethereum,1623658079,2,2
2658,nzhqzg,[deleted],0.128,Ethereum Classic price poised for a surge The altcoin has been outperforming the market recently but can it bounce back over the  resistance level,1623657830,8,0
2660,nzh8ei,HilariaPosada,0.0,Ethereum CoFounder Anthony Di Iorio Bets Big on ADA and DOT,1623655530,10,0
2661,nzgx8j,[deleted],0.8278,Titan looks like a pretty good setup it could very well run TTNP ,1623654092,0,1
2663,nzfhxg,C0DER-,0.0,Wojsk Tries Crypto Mining,1623648330,0,1
2664,nzfff1,Worried-Software-600,0.4404, a good price to get in Thoughts,1623648065,60,1
2665,nzfdka,[deleted],0.0,Find Ethereum on Coin Hunt World,1623647870,1,0
2668,nzdx2g,childlike-fool,0.4995,Have Patience and HODL,1623642685,0,16
2669,nzdq5x,BrandoFresh91,-0.4766,Ok so this is main question i haveOnce I get to  ETHI can be a validator rightok so what do I do from there What do I have to do to sustain my validation and not lose my ETHIm confusedIm completely sold on Ethereum and want to become a validator but not sure what to do from there,1623642029,109,18
2670,nzdeld,cklester,-0.357,Transferred GLM Not Showing Up Under Golem,1623640951,6,0
2671,nzd50i,goppox,0.5766,L tokens to ETH conversion,1623640086,22,6
2673,nzcykl,[deleted],0.5766,L tokens to ETH,1623639497,0,1
2676,nzb7rl,GhostPepper1969,0.8591,Ethereum is the superior crypto Buy dips Hold,1623633796,2,5
2678,nzaty8,iLOVEhentaiAND420,0.0,Is it possible to turn  Ethereum into  with daytrading it,1623632601,28,0
2679,nzapk8,DCC808,0.5267,Where the Ethereum logo inspiration really came from  Fellow in pic is staked to Eth ,1623632227,4,2
2681,nz8x01,ncongruntth,0.7125,ETH  ROCKET INU   JUST LISTED ON UNISWAP  A REAL NEW GEM NextGen Deflationary,1623626721,2,0
2684,nz8ccn,TheNirosX,0.8658,This scam just came up in my youtube recommendations right now an obvious scam but watch out people they buy likes and views to make it authentic using Vitalik as clickbait,1623625033,5,6
2685,nz85hj,DueSource3196,0.0,Shelly Palmer and Todd Cooper will talk about how to launch NFTs for Marketing,1623624465,0,1
2686,nz82u1,greatrat00,0.6705,Ethereum NFT token to asset mappings are offchain and nobody cares,1623624254,0,1
2688,nz7rwd,ncongruntth,0.7125,ETH The NextGen Deflationary Token   ROCKET INU  LAUNCH IN  HOUR ,1623623388,4,0
2690,nz6snj,hiilol69,0.5719,Small Cap Blockchain Stocks  Mid Elon Musk Loves Bitcoin Nvidia,1623620625,0,1
2691,nz6sde,RetardStonk,0.4215,So bitcoins taproot has been approved How does this affect ethereum,1623620605,28,4
2692,nz6q27,argosopentech,0.7184,Buy Argos Translate for Mac direct with Ethereum,1623620422,0,2
2694,nz6jyd,christossav,0.0,Still HODLING though ,1623619932,0,1
2695,nz5apj,Defiant_Statement_81,-0.296,Ethereum will be obsolete,1623616421,29,0
2696,nz585l,BPBPERRYMAN10,0.0,Heres  for all new people starting in Bitcoin UK,1623616212,0,1
2698,nz4pt6,Lastlord295,0.0,Guys lets talk on CryptoFly Cryptofly offers the largest collection of cryptocurrency logo clothing and apparel available We use only the highest quality materials and graphics to manufacture our guaranteed products so you can always be fly with crypto fly threads,1623614798,0,1
2699,nz4pgw,Feisty-Kitchen2760,0.0,Ethereum Etherium,1623614774,23,4
2700,nz4p49,ShondraRiemann,-0.3818,Upbit Expels  Cryptos Plunging Their Prices,1623614747,4,0
2701,nz4own,Play-That,0.296,WE HERE TO MAKE MONEY RIGHT,1623614731,0,1
2703,nz46r5,MrTornnado,0.296,A Sensitive Topic I have tried to share some tips,1623613401,0,1
2704,nz3xe8,WallStreetDoesntBet,0.5256,Cryptocurrency  Huang CEO of Nvidia Ethereum is going to be very valuable,1623612659,0,1
2705,nz3ta4,lorecirstea,0.8481,The Ethereum Foundation and all companies who had an ICO are the treasurers of the value that ETHtoken buyers have conferred them with their dreams and efforts It incarnates the hope that Ethereum is truly innovative That it brings to the market the best tech BUT ,1623612332,5,0
2708,nz3266,[deleted],0.0,Pool Staking my ETH,1623610192,0,1
2709,nz2x41,BDubbleSI,0.0164,How comes people are taking the piss out of those with  ETH Im seeing so many tweets like this,1623609780,23,3
2710,nz2hva,socalquest,0.0601,My ETH holdings down   Im not even sweating it  HODL,1623608522,50,0
2711,nz2bol,coded-art,0.0,Crypto bash,1623608005,0,1
2714,nqg1bj,Sharan-Reddy,-0.7184,How to sell NFT on Ethereum,1622618638,1,1
2716,nqfnuv,crypto_pub,-0.6478,Ethereum Blockchain reached low average transaction fees In the time of heavy traffic the Transaction fees are much higher One of the major pain points of Ethereum is Transaction fees,1622617096,1,1
2717,nqfkbw,WasiKhanyas,0.25,Please help newbie on what percentages to invest in which coins for  years down the road,1622616687,0,1
2718,nqfdzj,Miserable-Pie,-0.5423,Crash Game Crypto Gambling Predictor  JUNE   Roobet Stake Bustabit RustChance CSGOROLL,1622615997,1,1
2719,nqfc0y,j2ee-123,0.4404,Staking ETH  in Binance Other Better Alternatives,1622615786,1,1
2721,nqet5m,CARRYONLUGGAGE,0.4215,Improving upon Dapp Universitys ERC Tutorial,1622613625,2,1
2722,nqecn8,MyMonkeyIsGreek,0.6369,Question about the true value of crypto,1622611829,0,1
2723,nqdx0l,crypto_pub,0.34,Even Vitalik Buterin is surprised at just how long Eth is taking Ethereum cofounder cites people problems as one of the obstacles to progress,1622610231,49,1
2726,nqditu,terp_studios,0.0,Making an Ethereum coaster Never realized how much the logo is based on sacred geometry till I went to draw it,1622608839,21,1
2727,nqdfr9,BairakaDV,0.4588, million ETH are now locked up in the Ethereum  contract data from onchain analysis tool Dune Analytics shows The lockup is part of the networks shift from a proof of work PoW consensus design to a proof of stake PoS one,1622608531,3,1
2728,nqd3q3,ghjkl94,0.0,CHEAPER WAY to transfer ETH from Binance to Metamask,1622607345,0,1
2729,nqczrw,korrupt-samurai,0.0,Peroni to use blockchain traceability on the Ethereum public blockchain,1622606964,0,1
2730,nqcpa7,dapp_com,0.4588,Top Dapps by Volume in May  Ethereum amp  BSC dydx d volume B ,1622605969,1,1
2731,nqcdru,dapp_com,0.4588,Top  Blockchain Game Eco by d Volume Ethereum M,1622604879,1,1
2733,nqc6mm,coinmonks,0.7184,Now Is Time to Buy More ETH,1622604241,7,1
2734,nqbykr,Lumpy-Initiative-779,-0.5674,Not to play devils advocate but list everything wrong with ethereum,1622603523,23,1
2735,nqbcvi,witthatgrip,0.0,Will Ethereum need iExec to Scale,1622601588,4,1
2737,nqakkp,CaptainKommando77,0.0,I am opening a crypto farm,1622599027,0,1
2738,nqabgw,BeefBarley6931,0.0,Staking  ethereum,1622598219,0,1
2742,nq9zu9,static-cactus22,-0.25,I Exchanged ETH to ETHBEP and now everything is stuck,1622597200,6,1
2743,nq9ila,TheDogeCoinShop,0.2732,ETH NOW ACCEPTED AS PAYMENT,1622595706,2,1
2745,nq85hu,mjanov,0.802,I like making pretty pictures and I like HODLING my ETH,1622591513,0,1
2750,nq7cjg,dalton_averra132,0.4019,Need help with Ethereum,1622589091,0,1
2751,nq74sg,BoyYeetzWorld,-0.25,CBDCs Could Run on Ethereum Says ExHead of Chinas Digital Yuan Effort,1622588454,8,1
2752,nq73sj,thebitpages,0.0,Interview with Nick Tomaino Crypto Pioneer and Eth Investor and rethereum reader,1622588386,2,1
2753,nq6hct,audieleon,0.7783,VitaDAO Community Call DAO focused on early stage longevity funding Come Join,1622586601,0,1
2755,nq66r3,CorrineSomers,0.7184,ETH and Other Altcoins Could This Be a Buy Signal,1622585762,4,1
2756,nq647b,Pitiful_Research_316,0.6908,Ethereum smart call question,1622585561,0,1
2758,nq5f2p,twigwam,0.0,Blitmaps are firstoftheirkind x collectible artworks that are stored permanently and processed entirely on the Ethereum blockchain,1622583667,1,1
2759,nq5er9,boom187,0.6486,Is there a way to get my eth back if I accidentally sent the smart chain Please someone help,1622583642,22,1
2760,nq5dg4,twigwam,0.0,Prysmatic Labs Ethereum Monthly Development Update   June,1622583549,1,1
2761,nq595b,twigwam,0.4588,As Microsoft Azure closes shop ConsenSys Quorum opens up to new users,1622583238,1,1
2764,nq50o0,CryptoDeFinance,0.4588,Chinese defy government and cryptocurrency trading rise  Crypto DeFinance,1622582624,2,1
2765,nq4m6t,Lanky_Opposite5827,0.0,The  Bullish Elements of Ethereum,1622581549,380,1
2767,nq49yq,Working-Inside-1750,0.3612,Crypto is like family it has its up and downs,1622580686,0,1
2768,nq414z,MuskX_Finance,0.836,MuskX BEP Token on BSC correlated directly with the success of SpaceX landing rockets for reuse,1622580062,0,1
2770,nq3tr0,bigdichenergy,0.6908,Will Ethereum  fix high gas fees and if yes when will it be implemented,1622579527,10,1
2771,nq3sek,TobiHovey,0.4588,Ethereum Mining Revenue Topped Bitcoin in May With  Billion,1622579435,25,1
2772,nq3r52,xTremeSwag,0.25,Is it possible for me to recover these lost tokens Please help,1622579354,4,1
2775,nq2y1b,AimeelovesTyronne32,0.4019,Need help converting XLM to Ethereum,1622577283,0,1
2776,nq1x37,econoar,0.6808,EthHub Weekly Recap  Calm before the storm Ray Dalio likes Ethereum Arbitrum One mainnet beta launched Gitcoin introduces GTC token Makers multichain strategy Turbogeth is now Erigon and a chat about EIP,1622574653,2,1
2777,nq1wh4,Artwork_in_space,0.0,Etherium Man NFT ,1622574610,0,1
2778,nq16j7,jumbledFox,0.0,Use eth domain with github pages,1622572796,4,1
2780,nwxvf5,[deleted],0.7906,Pretty cool to see Floyd Mayweather promoting an Ethereum token Even cooler that he did it at a Bitcoin convention,1623357549,6,0
2781,nwxpu6,_saran,0.0,Am I too late to invest in etherum ,1623357144,0,1
2782,nwxbqm,mreldridge001,0.8779,This is awesome to the moon,1623356146,2,1
2783,nwwvig,jackybeeblebrox,0.0,On Ethereum and Flippenings,1623355044,30,4
2786,nwwcq6,poormoneypenny,0.0258,How much could Ether grow if Bitcoin will reach k or  Millions,1623353713,0,1
2787,nww77h,coryaross,0.0,Mogul Productions highly anticipated Access Pass NFTs Have Arrived,1623353320,2,1
2788,nww74j,Infinite_Abundance8,0.6369,Best places to purchase ETH besides Sendwyre,1623353314,0,1
2790,nwvd2f,TobiHovey,0.0,Reddit CoFounder Says A Lot of His Holdings Are in Ethereum,1623351235,157,1
2792,nwv4qq,liveyourlifebro,-0.7964,Bitcoin fake Elon Musk giveaway scam cost man ,1623350662,21,5
2798,nwudgn,PatrickZuest,-0.7096,Short Survey About Sandwich Attacks in Ethereum,1623348793,0,1
2802,nwtljf,TobiHovey,0.0,Polygon x Spend  Million in Ethereum DeFi Developer Push,1623346855,15,1
2807,nwsvg5,BerthjeTTV,0.8271,Is it smart to buy ethereum at the current price,1623345043,57,1
2808,nwst1m,Sly21C,0.6486,GreatApe  million MC Just listed on Coingecko Up  in  Hours Dev is same dev that wrote original RFI code Code is impossible to rug Liquidity is permanent,1623344883,7,0
2809,nwsr2b,Adorable_Bee_3436,0.4588,Stay Up to date with all crypto news,1623344747,0,1
2812,nwsi1w,[deleted],-0.6486,This guy said Bitcoin and Ethereum are dead Heres my response,1623344129,0,1
2813,nwrt4k,Sly21C,0.6486,GREATAPE Just Listed on Coingecko  Million MC Up  in  hours Code is impossible to rug GreatApe dev is same dev for original RFI,1623342381,16,0
2815,nwrgch,Grade19282,-0.3818,Anonymous Threaten Elon Musk Over Viral Bitcoin Tweets,1623341497,0,1
2817,nyfvpd,obsd92107,0.0,Doge Meme NFT Sells for Millions,1623530242,0,1
2818,nyfct4,Serious-Anteater-331,0.743,The truth about Ethereum deflation when you burn  more than being produced based on s upgrade you create deflationary conditions for ETH This is a necessary condition but perhaps the sufficiency will be determined laterRegardless you should be bullish on Ethereum if you have a brain,1623528833,23,1
2820,nyf03j,1beherenow,0.0,crypto exchange,1623527893,0,1
2823,nyen4g,No-Noise-3728,-0.0772,Help tracking down nft whereabouts on opensea,1623526875,0,1
2824,nyem6t,1beherenow,0.0,Crypto fee to withdraw to cold storage,1623526814,0,1
2825,nyegmj,ferryev71,0.7184,BestSafest Way to Buy Ethereum,1623526358,0,1
2826,nyef1m,topshottanoganja,0.0,What is Ethereum expected to touch by end of ,1623526254,1,1
2828,nydzid,archeactive,0.5106,Building a literally indestructible censorshipresistant marketing tool with Ethereum technology  the idea of a madman  the APEX of Ethereum smart contracts,1623525088,4,1
2829,nydm6l,Good_strokes,0.0, Price Impacts on trades,1623524099,0,1
2831,nycrd2,ShondraRiemann,0.0,Whales Purchase on Bitcoin Is Rising,1623521717,1,1
2832,nycjbm,Clinamenic,0.0,Are there any Ethereum developers working on a DAO SDK,1623521062,6,1
2840,nyagqz,kthunder13,0.4939,Polygon  Guide How To Save ETH Gas Fees in DeFi,1623515056,0,1
2842,ny9vfd,NOTPR0,-0.5267,Did you know you can take a  interest loan out on your crypto so that you can spend from your ETH without needing to actually sell it through CDPs Open a loan on the ETHgtCash out loangtSpend and pay  taxes because loans are not taxed,1623513353,3,1
2843,ny9ta2,charmcitycuddles,0.0,Ethereums EIP Goes Live Next Month Heres a Quick Rundown,1623513183,24,1
2846,ny9fpo,ladnammar,0.0,ETHEREUM Mining,1623512159,0,1
2847,ny9856,GutBeer101,0.5106,When the value of ETH crashes will stablecoins like DAI or USDC be affected ,1623511608,4,1
2848,ny90zm,AndersDander,0.0,Ethereum Namer Service ENS what it is why you should use it and how to get started,1623511038,13,1
2849,ny8vl5,Otherwise-League7842,0.34,Altex easily the next x coin ,1623510626,0,1
2850,ny8rgb,CarpetThorb,0.7184,You can now buy blemflarcks on Ethereum ,1623510317,2,1
2851,nu0l3b,PseudoscientificLuo,0.0,What determines Ethereums level of decentralization,1623028732,13,1
2852,nu0i1p,pubgmisc,0.2263,Noob Question Couldnt any competitor just copy Ethereums code well everything it has,1623028450,0,1
2853,nu0a68,Gotigers811,0.4019,Texas Governor Signs Law Creating Legal Framework for Crypto Investments,1623027703,29,1
2854,nu05b9,siid14,0.0,EthereumMax,1623027269,8,1
2856,ntz7zb,Holymoses43,0.2023,Floyd Mayweather the richest athlete of all time sporting an Ethereum shirt during promotional events for his fight with Logan Paul,1623024124,0,1
2860,nty9n5,Visual_Firefighter81,-0.25,Blockstream Mining a bitcoin mining company run by a Twitter cofounder is investing in solarpowered bitcoin mining,1623021095,0,1
2861,nty8oe,Justin534,0.4588,Whats up with gas fees,1623021013,25,1
2862,ntxhon,magikian,0.3818,Question Was the gas exploit that was fixed with Berlin the cause of the High gas prices,1623018759,0,1
2863,ntxhdm,dan-nolan,0.0,You CAN still redeem your theDAO tokens,1623018735,0,1
2864,ntxfmj,Bush_did_HRC_on_911,-0.4404,Would shorter block times reduce MEV,1623018596,5,1
2866,ntx5le,LottaPassion,0.0,Logan Paul owns both ETH and ElonGate sources claim,1623017796,3,1
2867,ntx25n,Vamparael,0.875,Please help Buying Ethereum or any crypto in Hawaii,1623017529,0,1
2869,ntwlpu,samg114,-0.5439,How does ethereum difficulty work without leading s like Bitcoin,1623016232,0,1
2870,ntwaj3,thefoodboylover,0.7184,Biden  trillion federal budget is it time to buy crypto,1623015348,20,1
2871,ntw97t,SimilarCommercial233,0.0,How much eth should a balanced crypto portfolio have,1623015248,0,1
2872,ntw8yn,mattyba11,0.0,Explaining ETH to my boomer boss,1623015231,0,1
2874,ntvzuo,mattyba11,0.0,My boss asked me to explain ETH to a  year old hows this,1623014528,0,1
2876,ntvb9j,redmage123,0.0,Ethereum Oracle for equities prices,1623012692,2,1
2877,ntuszb,Hot_BlueStar,0.0,Since  years ago till now  million ETH has been locked in DeFi and  million has been staked since ETH  Genesis m just the beginning IMO,1623011291,7,1
2878,ntupzm,brantlymillegan,0.0,For bitcoiners its bitcoin vs fiat For ethereans fiat and bitcoin are just dapps in the broader Ethereum ecosystem Dai USDC wBTC etc,1623011053,24,2
2879,ntu9vc,Eli_EES,0.0,EthBlockchain Stock Market ,1623009829,1,1
2880,ntu8qu,BoyYeetzWorld,0.4588,Solana is seeking up to  million in order to compete with Ethereum,1623009745,0,1
2881,ntu3n7,PatientSwimming,-0.6908,Elon trynna kill another Crypto,1623009391,7,1
2882,ntu254,FoMajor,0.0,ETH Artwork I Made,1623009281,0,1
2885,nttpw2,loz509,0.6808,Help me better understand gwei eth and gas fees,1623008369,0,1
2886,nttg6j,mo_bach,0.0,How Big is Ethereum,1623007628,0,1
2888,ntszpm,stevewonderburg,0.4404,Update concerning the delay of Rocket Pool,1623006400,26,1
2890,nts7xv,DogetnetDotNet,0.0,One Giant Step For Decentralization An Ethereum Node Is Now At The International Space Station,1623004275,8,1
2893,ntrc2q,saskatchewaniankush,-0.2584,Looking for a way to stake my ETH without giving it to an exchange,1623001903,19,1
2896,ntpwgb,Dcryptodose,0.0,Ethereum to overtake BTC,1622997884,0,1
2901,ntpd6z,itsblockchain,-0.7906,ETH gas fees dropped below  on Sunday The latest drop in gas fees now sees Ethereum transactions as being more viable once again,1622996423,72,1
2902,ntpawg,AF-_-1997,0.0,I dont understand this graph Why is  Gwei gas price faster to confirm than Gwei gas price,1622996241,2,1
2903,ntp5gg,CP_2020,0.0,What do ETH holders think about Safemoon,1622995811,0,1
2904,ntp3k3,ryannvos,0.7184,Where to buy ETH in Canada,1622995669,0,1
2906,ntox9t,tactmaster,0.4939,How can a translation with gas price of  Gwei succeed,1622995205,0,1
2907,ntore1,Exitmorelikeentrance,0.0,Alibaba Google Among More Than  Companies Seeking Singapore Crypto Licenses,1622994741,3,1
2912,ntnmqd,omgitsbrad,0.0,As a Bitcoin holder Eth makes complete sense to me,1622991613,559,1
2913,nw80r1,CryptoDeFinance,0.1779,Amazon Job Opening for Head of Products on Blockchain  Crypto DeFinance,1623277304,2,3
2915,nw7u0x,bitchybonita,0.0,Ethereum Powered Curve Finance Is About To Skyrocket,1623276780,1,0
2919,nw7d2f,JayWelsh,-0.8047,Apologies if this is not allowed here but in the spirit of the space I just thought Id share that today an actual apartment was sold as an NFT which is crazy to consider,1623275478,0,1
2922,nw6wx2,twigwam,0.0,Tokenizing livestock  Nebraska ranch first to use new cattle supply chain tracking technology using Ethereum,1623274270,5,3
2923,nw6otc,NoeticOptions,0.5994,What are the possible implications of Ethereum being classified as a Commodity or Security vs an Asset,1623273651,8,1
2925,nw5mtk,Rough-Weakness-4221,0.6369,Is Ethereum a Dog Coin at Heart,1623270855,0,1
2927,nw5j9m,manan26,0.0,Crypto Hedge fund,1623270593,0,1
2928,nw4t5f,NicheNut,0.4939,How do I become an ETH whale asking for a friend,1623268657,0,1
2929,nw4fhq,soszjal,0.4019,Community with special crypto signals,1623267657,1,1
2930,nw4eyu,Intrepid-Wait-6102,0.0,Crypto transfer what does this mean,1623267618,0,1
2931,nw44s7,ImaginaryPsychiarist,0.0,ETH  Transition Poll,1623266900,0,1
2932,nw43kf,pocketreviews,-0.4588,A History of The DAO Hack,1623266808,1,1
2933,nw40ol,SirLowkeyy,-0.7906,BEWARE Vitaliks Instagram account has been hacked and someone is running a scam on it,1623266592,0,1
2934,nw3yj3,henrysv25,-0.0516,Is this true or has Vitaliks instagram been hacked  Esto es verdad o han hackeado el instagram a Vitalik,1623266427,0,1
2935,nw3xip,Global_Giving,0.4767,GlobalGiving c Crypto Donations for Coronavirus Relief Fund,1623266360,2,1
2936,nw3w4c,Foreign_Reach_4093,0.7184,Where can I buy ethereum as a minor,1623266264,0,1
2939,nw3gfg,timbeiko,0.4588,London Upgrade Overview ,1623265147,4,1
2941,nw37vi,twigwam,0.4588,London Upgrade Overview  A description of the EIPs included in London,1623264519,1,1
2942,nw2zi8,WildCard321,-0.5574,I made stupid website which tells you if Nvidia have screwed up their LHRimplementation again,1623263914,2,1
2947,nw1vt2,gravemindx,0.4404,Read to the endWhat good has Matic or Ada done for Ethereum anyway,1623261035,8,1
2948,nw1qnb,KTR87,0.2023,Ethereums NearTerm Dominance,1623260680,0,1
2949,nw1p8u,gravemindx,0.4404,What good has Matic or Ada done for Ethereum anyway,1623260575,6,1
2951,nw1eei,haochizzle,0.0,ChainSafes Eth Typescript implementation Lodestar v has just been released,1623259797,0,1
2952,nw1bmx,sorryjustsaying,-0.7184,The first Real Estate NFT was just sold on the Ethereum blockchain,1623259595,6,1
2954,nw193q,Gott1234,0.0,Where can I find the part of the ethereum code with the consensus protocol,1623259408,1,1
2957,nw05ca,Inner-Issue1908,0.0,Eth is a sht coin,1623256561,0,1
2958,nvzvds,poojaranjan19,0.4588,London Upgrade Overview A description of the EIPs included in London,1623255829,0,1
2959,nvzn99,eterneraki,0.34,Is native scalibility ever going to be possible with ethereum without sacrificing decentralization speed security or composability,1623255246,75,1
2960,nvzf4r,Impossible-Rip8524,0.0,Ethereum based on World of Warcraft,1623254670,0,1
2961,nvzbfq,Impossible-Rip8524,0.4939,The name Ethereum was inspired in World of Warcraft,1623254433,0,1
2962,nvz97i,Powerful_Ad5424,-0.4767,xddedFbEADFefbcFD Someone send a poor man ETH,1623254290,0,1
2963,nvz6rg,MochaWithSugar,0.0,How to Redesign Ethereum website complete UIUX guide,1623254104,0,1
2964,nvz2pf,VRG0211,0.0772,I want to understand the bearperspective on ethereum Where do I go,1623253802,0,1
2965,nvywoy,Dependent-Jelly8236,0.0,and Doge,1623253360,0,1
2966,nvywe3,gafiiiiii,0.3182,Guys we hit  million builders,1623253337,3,1
2968,nvypo7,Business_Bug9758,0.0,ETH Token NFT anyone,1623252835,0,1
2970,nvyoqw,Business_Bug9758,0.0,Ethereum Token NFT anyone,1623252769,0,1
2975,nvy4wq,CryptoWhale4Lyfe,0.3182,Ethereum also supported ,1623251289,5,1
2976,nvy4m2,Easy_Specialist_2148,0.4588,Crypto QampA Ethereum as gas for the digital economy decentralizations high costs and hurdles to mass adoption,1623251268,2,1
2977,nvy0pa,Serious-Anteater-331,0.5423,Which country in the  will adopt Ethereum next as a legally recognized Store of Value andor currency,1623250960,7,1
2978,o7qvny,BurbonBodega,0.5859,So did the bears win with the Eth options expiring since the price was below ,1624637669,1,1
2979,o7qspu,EtherShredsErica,0.0,Ether is flipping us off,1624637415,0,1
