Unnamed: 0,id,author,vader,title,created_utc,num_comments,score
875,nvaa81,econoar,0.7906,EthHub Weekly Recap  ETH and BTC shifting dynamics Google allowing crypto ads again zkEVM from zkSync Zapper levels up Umbra live for privacy txs Gnosis client team joins Erigon and Justin Drake on why ETH price is important,1623175365,0,1
876,nva1nu,trulyinsightful,0.0,Ethereum touching  Usd,1623174718,0,1
878,nv9xu9,jacob-scott,0.3182,The original Doge meme is being auctioned as an NFT,1623174433,1,1
879,nv9oao,No-Twist1747,-0.296,Missed BTC by  ETH  This token will give U x remember it,1623173724,0,1
880,nv9kq0,Critical-Ad-4946,0.4588,Rate my mining stats please D These are MSI OC up to a steady point to prevent crash and overheat spent a few hours upping and lowering while crashing  times before i feel happy with the result are these good or bad,1623173454,10,1
882,nv92ud,lokiloki22,0.4588,How to Set Up an ETH  Validator on Goerli Testnet,1623172158,21,1
885,nv7ldi,Dresslerj1,0.0,Did Bitcoin Maximalism Become Fanaticism at the Miami Conference,1623168281,4,1
886,nv6j4x,Shireesh19,0.0,Ethereum faucets,1623166231,2,1
887,nv6a53,Jmckizzle,0.7184,Bought my ticket to ride the eth coaster yesterday already paying off ,1623165275,3,1
888,nv67ua,Eredyn,0.0,Interacting with Wrapped ETH contract on Ropsten vs Mainnet,1623165013,4,1
890,nv63op,Drawnfromh20,0.0,Institutions Are Turning Bearish On Bitcoin But Bullish On Ethereum Indicates Key Metric,1623164613,10,1
892,nv5za7,Newsjunkeefromlondon,0.0,Next generation of investors One in four students now own crypto,1623164312,2,1
893,nv5w0m,stock_manager23,0.624,I have been really a partaker of crypto ever since my brother introduced me to my manager Williams who has help me very well in my trading you can contact my manger   ,1623164068,0,1
895,nv54c4,Jimmypickle002,0.0,Amc effect on crypto,1623162023,0,1
896,nv4xj0,DailyGweiBot,-0.6908,Fear and Greed  The Daily Gwei ,1623161532,1,1
897,nv4vy5,earthian_vs,0.7184,Should I keep ETH and ETC I bought ETH  ,1623161405,3,1
900,nv463m,mrjaposo,-0.5423,Dropped and replaced,1623159342,0,1
903,nv2th4,s618o,0.0,Moving tokens from BSC to Ethereum and Polygon MATIC or other chains,1623154986,1,0
905,nv2duu,Mesiko20,0.0,Ethereum news,1623153490,5,0
908,nv2a01,pawurb,0.8402,Deploying My First Ethereum Smart Contract for Fun and Profit,1623153105,2,2
911,nv22eb,CoinjoyAssistant,0.4588,Ethereums Vitalik Buterin Made  Profit on Dogecoin,1623152542,1,1
913,nv1p55,crypto_pub,-0.128,Ethereums Vitalik Buterin Made  Profit on Dogecoin Ethereum cofounder Vitalik Buterim invested  in Dogecoin in  In  Buterin sold his DOGE for a whopping  million Also Buterin credits Elon Musk for the  DOGE price spike,1623151190,1,0
914,nv1flk,sasha_sh,0.0516,DeFi in Ether Aave reaches  spot in TVL Arbitrum One mainnet beta live Matcha  is here One Year of RenVM Yearn Finance  Chainlink Okcoin integrates Polygon Gnosis client dev team joins Erigon formerly TurboGeth Balancer raises M Introduction to the INDEX Token and more,1623150152,4,3
915,nv0yw2,NoThanks93330,-0.296,Why is there no lightning network for Etherium,1623145240,33,1
917,nv0s5x,howardroark2002,0.8834,Are these good value and why all of a sudden is it hideously expensive to buy from China,1623144445,4,1
922,nuycvu,LetterOk6577,-0.7184,Should i sell ,1623134489,0,1
924,nuy5qb,PeacockMamba,0.8251,Please read this Very important information Help understand these price fluctuations Remember ether is more then a token Its the future Its the blockchain network of the future Industry and finance will run on the ether blockchain Some already are Educate Trust Hold,1623133670,9,1
926,nuxlll,LazerXT,-0.7184,I need to know how to sell ethereum,1623131407,0,1
927,nuxg25,Noazartz,0.1027,IM ENJOYING THE TASTY DIP,1623130827,1,1
931,nux3co,sjshhdhdhd,0.0,Where can I gamble eth,1623129484,1,1
933,nux0s9,straight-lampin,-0.8946,Poor Moose sold and didnt HODL,1623129212,1,1
934,nuwcr6,dolarestheguy,-0.2732,This is the issue with NFT Why the market collapsed,1623126751,0,1
936,nuvrk8,SilverRule,0.2406,Why cant oracles be created in the form of smart contractsDapps within Ethereum as opposed to a separate blockchain,1623124669,0,1
937,nuvnbo,Decent-Pumpkin-5117,0.6369,Crypto love,1623124273,0,1
939,nuuwzd,haxsyn,0.0,Integrate IPFS with Ethereum,1623121808,1,1
941,nutyy2,ShadowSlick,0.0,My address contains  eth from  I have  different  char private keys in the UTC file I got but none of the accounts contain the eth when I import it to metamask How do I get the eth out,1623118753,0,1
942,nutyoe,Clownier,0.0,Ethereum Gas Fees,1623118730,36,1
943,nutiyh,redmage123,-0.4588,Lost Private Keys question,1623117337,6,1
947,nut3k4,joeln15,-0.2263,Does ETH risk becoming boring like an ATampT,1623115935,0,1
950,nui237,HODLANUJ,0.5423,Ethereum Gains x Against Bitcoin In Bear Crypto Market Time To Buy,1623086489,1,1
951,nuhnrl,jahill2000,0.0,Ethereum Deposit Time and  Deposit Time,1623085487,0,1
952,nuhjj8,Slow-Republic-7531,0.0,ETH Fee for contract,1623085220,0,1
953,nuhisd,Slow-Republic-7531,0.4588,ETH Fee for Strong,1623085179,0,1
954,nuhdau,icanmakeam3ss,-0.7184,US Art show circuit selling my work for ETH,1623084785,0,1
955,nuhbiu,icanmakeam3ss,-0.7184,Art show curcuit selling my art for ethereum,1623084663,0,1
956,nuh3zj,Bigote_de_Swann,-0.3612,ETH  bETH doubt,1623084155,6,1
957,nugzo7,Equal_Road5238,0.0,ETH  Sharding,1623083860,0,1
959,nugfyx,IrvingStanley54,0.659,This is really awesome Ethereum,1623082530,0,1
960,nugcde,Mathje,0.6124,The Big Four smart contract rollup chains  Arbitrum Optimistic Ethereum zkSync  and StarkNet,1623082284,1,1
961,nug1z6,PrivateStrawberry,0.0,Arbitrum is bringing scalability to Ethereum,1623081604,0,1
962,nufzqi,bordoisse,0.6249,Polygon now a popular goto layer  solution for the Ethereum Blockchain,1623081454,8,1
963,nuflkz,quantstampcomms,0.4588,The Rise of Crypto Lending ,1623080470,0,1
964,nufeu8,sahilsen-_-,0.0,How to integrate IPFS with Ethereum,1623079995,0,1
967,nueaxi,RustyShackelford__,0.6705,I want to love Eth,1623077242,0,1
969,nue1h5,twigwam,0.7096,There is now billion mil ETH of value committed to the security of Ethereum through staking,1623076537,370,1
970,nudntj,Annapurna__,0.25,Theres a New Vision for Crypto and Its Wildly Different From Bitcoin,1623075518,6,1
971,nudmlo,twigwam,0.4588,PEEPanEIP  Altair Beacon chain upgrade with Vitalik Buterin and Danny Ryan,1623075427,0,1
973,nud65m,m0bscure,0.0,Where did my ETH go,1623074239,0,1
975,nud461,poojaranjan19,0.4588,Altair Beacon chain upgrade with Danny R amp Vitalik B,1623074081,1,1
980,nubo0h,HilariaPosada,0.5423,This Wednesday the Ethereum Unikles will be removed from Booster Packs forever Make sure to get your hands on this ultrarare specialedition NFT Its already trading for over  ETH on OpenSea  Unicorn face Money with wings,1623069985,0,1
983,nua0wd,WestCoastWeather,0.3182,When is Ethereum gonna hit k,1623065122,1,1
984,nu9zud,I-BuyThis,0.0,Anonymous Message to Elon Musk,1623065018,0,1
985,nu9u6b,jakkkmotivator,0.0,Coinshares Lists PhysicallyBacked ETPs Of Bitcoin Ethereum And Litecoin On Germany Main Exchange Brse Xetra,1623064452,0,1
986,nu9stp,Afieldsharpen,-0.4588,After bitcoin falls what will happen to other cryptocurrencies,1623064310,5,1
987,nu9g63,y_angelov,-0.4588,Is this a glitch ETH TPS down to ,1623063028,3,1
989,nu924g,takizawarola172,-0.1531,I got involved in the crypto craze and made  million,1623061533,0,1
990,nu8zsb,Vashe00,-0.4588,Is the Ropsten Network down,1623061285,0,1
991,nu89fh,bertie_88,0.25,Can dapps and defi be created on bitcoin or do we need ethereum,1623058273,34,1
995,nu7amm,rollingincrypto,-0.0772,Sorry Bears,1623053850,16,1
997,nu6ygk,mdl-ai,0.9287,Just watched Vitalik on Lex Fridman and convinced me to buy my first Eth To the moon,1623052284,0,1
998,nu6vhw,sportifynews,0.0,Ethereum Outpaces Bitcoin Heres Why ETH Could Surpass ,1623051898,2,1
1000,nu6pii,rlaxx1,0.0,SpaceX Dragon CRS Mission Delivered The First Ethereum Crypto Node To The Space Station For SpaceChain,1623051151,68,1
1001,nu6p9k,honkystonk53,0.0,Ethereum Nodes and Shards simplified explanation for beginners,1623051120,0,1
1008,nu4nug,throwaway126492729,0.2263,Say you have millions worth of ETH what about the bank,1623042986,26,1
1011,nu41f6,hoodlaces,-0.1027,Is this a crude albeit fair representation of the difference in abilities to code for BTC and ETH,1623040749,6,1
1012,nu40d3,Drawnfromh20,0.9153,Elon Musk Reveals Surprise Support For Ethereum Cofounders Amazing Plan To Upgrade Joke Bitcoin Rival Dogecoin,1623040643,15,1
1013,nu3xwt,Phillyphan08,0.0,Where to day trade ethereum with the least Amt of fees closest to buysell prices that works in the us,1623040400,0,1
1014,nu3vkp,1147585,0.5859,How long does a block reward take to post to external account,1623040171,2,1
1015,nu3tw7,Sushipin019,0.0,Looking to start out Forex and Crypto trading in Asia,1623040007,0,1
1016,nu3r5b,Drawnfromh20,0.0,Elon cosigns ETH,1623039734,1,1
1018,nu31pt,Drawnfromh20,0.0,Room cosigns eth,1623037277,0,1
1020,nu2t61,jdlloyd,-0.2023,Floyd Money Mayweather has the ETH logo on his shorts vs Logan Paul tonight,1623036396,0,1
1021,nu2rw9,jason_in_sd,0.0,Floyd Mayweather repping Ethereum at tonights exhibition bout against Logan Paul,1623036261,11,1
1022,nu2o9p,bitbuggs,0.3612,Floyd Mayweather promoting Ethereum,1623035880,168,1
1024,nu2nm2,Old-dirty-Crypto,0.0,Is that ethereum,1623035813,9,1
1025,nu2gvh,jno199666,0.2263,Lets say you have millions worth of ETH,1623035128,0,1
1026,nu2d6h,Old-dirty-Crypto,-0.4588,Flyod Mayweather wearing ethereum shorts,1623034782,0,1
1027,nu26jx,fancy_trash_panda,0.6486,Can someone please comment on this article Top  Price Prediction Bitcoin Ethereum Ripple BTC ETH and XRP may decline ,1623034125,16,1
1029,nu1vqr,Common_Tater_,0.0,What is ETH ,1623033099,2,1
1030,nu1qr3,SP414,0.0,TMT ETH,1623032632,0,1
1031,nu1oj2,GETNAKD1523,0.7184,BUY ETHEREUM,1623032416,0,1
1032,nu163q,TheDogeCoinShop,0.2732,ETH ACCEPTED AS PAYMENT,1623030725,2,1
1033,nu0uaq,Trina_L,0.0,ETHs Price Consolidation will End in June,1623029607,0,1
1034,nxkr8d,Momma_frank,0.0,Why is ETH dipping harder than others,1623430769,6,1
1035,nxkr4b,Stealthex_io,0.1796,Its never too late to stack on some crypto Want to buy ETH but not sure how Weve got you,1623430761,0,1
1036,nxki1t,twigwam,0.0,Ethereum Core Devs Meeting  ,1623430086,2,1
1038,nxk8kd,Sebastian-Scherer,0.0,Blockchain market grow,1623429401,0,1
1039,nxk4ta,Ok-Bid1985,0.5859,This guy is amazing Got both BNB and ETH from him,1623429132,0,1
1040,nxjba0,Dallxx11,0.0,Noticed this on one of the games my son was playingThe tokens are Ethereum,1623427034,0,1
1041,nxj25j,Popcateum,0.0,light meme ethereum popcateum,1623426374,0,1
1046,nxi9y2,cryptocurrencypr,0.5994,Libonomy is prepared to keep up witht the times,1623424313,0,1
1047,nxi0mp,yeahbuddy186,0.1655,I found a supplement company that accepts Ethereum but NOT Bitcoin I emailed the company and their CEO responded This was her response,1623423652,133,1
1051,nxfxgj,CoinjoyAssistant,0.5267,Reddit cofounder Alexis Ohanian praises Ethereum reveals he owns a lot of ETH,1623417924,10,1
1054,nxfntx,smashdownbabylon,0.4019,Smart contracts and Eth ,1623417120,8,1
1055,nxflcb,BitcoinWide,0.6808,DJ David Guetta puts luxury Miami pad up for sale will accept cryptocurrency for it,1623416902,0,1
1058,nxeo2m,Jimi__God,0.0,Staking ethereum,1623414025,11,1
1060,nxe1c5,BitcoinWide,0.3182,Menin Hospitality Accepts Multiple Cryptocurrencies Through BitPay,1623412006,1,1
1061,nxdyb6,Jimbley_Neutralon,0.0,Over  of my bitcoin is now tokenized on Ethereum  WHY,1623411721,3,1
1063,nxdhbm,Vairlee,0.8074,Welcome new friends to join the digital currency AlchemyPay community,1623410079,0,1
1065,nxd2w8,Jimbley_Neutralon,0.4588,News updates for the top DeFi protocols,1623408610,2,1
1067,nxcgic,GamesInfluencer,0.0,TA Ethereum Revisits  Heres What Could Trigger More Downsides,1623406193,5,1
1068,nxc97c,ARONBOSS,0.3818,David Guetta Will Accept Bitcoin BTC and Ethereum ETH For  Million Flat  AronBoss,1623405418,1,1
1071,nxblax,Dangerous_Try8644,0.7983,Why doesnt the ethereum team create an L solution,1623402757,28,1
1073,nxb3xk,Melodic-Magazine-519,0.0,Nanopool downfor anyone else,1623400734,2,1
1074,nxasd3,CAMT53,0.7269,Any kind help obtaining enough rinkeby ETH to test contract deployment,1623399431,0,1
1075,nxaikn,FutureFinanceFreedom,0.0,Eth Gas Fees,1623398315,0,1
1076,nx9x44,Sufficient_Hold_1428,0.3818,Sheetz to start accepting Bitcoin ETH and other cryptocurrencies on the Flexa Networks and its ERC token AMP as collateral,1623395858,1,1
1077,nx9pvm,shivamnema05,0.5046,I wanted to learn more about eth solutions and wnated to have hands on experience Please suggest me where to start,1623394998,0,1
1080,nx8ajk,HoboBaggins24,0.4588,Anime for Hyping up Ethereum,1623389384,0,1
1081,nx7kog,Efficient-Sir6418,0.0,Libonomy Blockchain Transaction Ethereum,1623386776,0,1
1082,nx7hb8,Psychological-Use384,0.0,LLC Investing in ETH,1623386448,0,1
1085,nx7a7a,Grade19282,-0.3818,Anonymous Threatens Elon Musk over Viral Tweets,1623385728,0,1
1091,nx4mlc,jlkirbee,0.7184,Where does Vitalik buy his ether,1623376856,39,5
1092,nx4d3u,cameronvanhoy,0.0,Is the ETH network currently clogged or is it just me,1623375997,6,1
1096,nx488z,ExcellentParty5476,0.0,Ethereum All in ,1623375550,8,5
1100,nx3fhq,Guru_of_Spores,0.0,I was mining ETH back in  I just found my public key and password but thats all I have Is it possible to get my ETH or am I SOL,1623373031,23,2
1101,nx3778,Gondar1994,-0.4019,The biggest hindrance to making crypto mainstream My opinion obviously,1623372295,15,3
1102,nx1x44,Show84,0.4588,Whats your  favorite things about Ethereum and why,1623368439,8,0
1103,nx1st0,Agreeable_Spring5816,0.2656,The bull need to get out of the FUD mud,1623368081,14,17
1106,nx0ob2,[deleted],-0.743,Crypto Scam Victims,1623364841,0,1
1108,nwzxdi,The_MP-,0.5994,GITCOIN IS BULL FAST GET SOME NOW,1623362840,6,0
1110,nwz0vu,Temporary_Grass_2872,0.0,My office building is all in on ETH,1623360483,0,1
1111,nwyynx,lwc-wtang12,0.128,Comparing Binance smart chain to ethereum basically no comparison,1623360322,10,5
1115,nwyajp,BigDaddyDallas,0.3818,Now Accepting Ethereum ,1623358596,40,38
1117,nwxzta,No_Chemistry_7892,0.0,EthHub Weekly,1623357857,0,1
1120,nztxv1,chitachita-01,0.0,Build on Ethereum Rigor enables homebuilders to access funds on web now open for beta,1623696629,0,1
1123,nztkby,Slack_Liner_,-0.6124,Someone is trying to tell me Ethereum is a scam,1623695642,35,0
1124,nzt296,Worried-Software-600,0.8268,To all those who have been holding Ethereum for a really long time from experience does this look like the start of a bull run if ya had to guess,1623694343,6,1
1125,nzt0wz,TobiHovey,0.0,Goldman Sachs Plans to Start Trading Ethereum Options Futures,1623694244,55,264
1126,nzss2t,SquareyPoo,-0.3653,ETH Giveaway Scam on YT again Beware and dont fall for it,1623693604,4,15
1128,nzski2,Etherguy1,-0.4767,Fake ETH or big future plans for ETH,1623693037,0,1
1130,nzs8ko,Mesiko20,0.0,Ethereum News and Price Prediction,1623692138,0,1
1132,nzs447,saurabhmandy,0.0,Building decentralized stock market,1623691807,0,1
1133,nzs3yf,twigwam,-0.4404,Ethereum EIP Testnet Block Set,1623691797,12,5
1134,nzs3xp,JiggyWitIt91,-0.4588,Ehthereum is going up When should I sell it,1623691795,0,1
1136,nzs01x,Solodeji,0.0258,Ethereum Improvement Proposal EIP  Set To Have First Testnet Block,1623691505,2,14
1138,nzrcvn,crypto_pub,0.4019,Around  of ETH supply got locked in smart contracts The ETHs amount is somewhat equal to the DAO event Most of ETH is locked in the Beacon Chain contract,1623689827,4,11
1140,nzqsbr,onelovex3,0.1027,Goldman Expands in Crypto Trading With Plans for Ether Options,1623688304,19,50
1141,nzq9ay,ShondraRiemann,0.4019,ETH Got Locked in Smart Contracts,1623686890,2,0
1142,nzpxem,Flash4473,-0.6124,Scam running on YT live  impersonating Ethereum Foundation,1623685960,0,1
1145,nzp957,The_Bit_X,0.0,A question from a new ethereum learner,1623684168,2,1
1147,nzox13,PeterMatthews54,0.0,My retirement plan Ethereum,1623683298,0,0
1152,nzoaq4,Econobayy,0.802,Top  Best Cryptocurrency To Invest in ,1623681597,0,1
1157,nzno2z,bodytexture,0.0, kick token airdrop anyone made it to redeem them,1623679872,0,1
1158,nzn2f3,Coldsnap,0.6705,EIP is going live soon as part of the London upgrade Does anyone have any questions for the EIP team that youd like answered,1623678129,171,183
1159,nzmsu5,Coldsnap,-0.4019,Latest Ethereum Cat Herders PEEPanEIP video has been posted PEEPanEIP  EIP EVM Object Format EOF amp EIP Reject new contracts starting with xEF byte with Alex B Pawe B Andrei M,1623677325,0,3
1160,nzmpw8,Botsfolio,0.3182,Will Ethereum hit k this week,1623677071,0,1
1162,nzmiie,Terrible-Possible-91,0.4404,Is Ethereum safe,1623676446,0,1
1163,nzmemu,Your__God_,-0.6249,Bitcoin anonymity is just a big myth  and using it to launder dirty money is stupid a crypto ATM chief says,1623676105,0,1
1164,nzmbky,Jimbley_Neutralon,0.0,The Bitcoin Ethereum DeFi Index,1623675846,7,0
1165,nzlzk2,LordDakier,0.0,ETH  Staking  Binance,1623674803,16,2
1166,nzly5j,_SaWT_,0.7184,Can I buy ethereum if Im under the age of ,1623674680,27,7
1168,nzlgq9,MarkOSullivan,0.0,The French national football team have become the first national football team to issue NFTs on Ethereum ,1623673021,97,983
1169,nzlgjs,cryptomoonlanding1,0.8402, Interest Loan for  Should I buy ETH,1623673005,0,1
1170,nzl82j,bruhagan,0.0,First National Sports Team to issue NFTs on Ethereum Frances Football Team,1623672147,0,1
1171,nzl5vj,Uttav,-0.6369,Conflict resolution during validation in a block and concurrent transactions on same account limit in ethereum ,1623671955,0,1
1173,nzjwbz,[deleted],0.0,Could this possibly be Ethereums return to the  mark or will we see a turnaround,1623667131,0,0
1175,nzjqh5,BitcoinWide,0.0772,Roofing firm among soaring number of Scot firms being paid in cryptocurrency,1623666438,0,3
1176,nzjh5f,CorrineSomers,0.0,Almost a Quarter of the Entire Ethereum Supply Is Locked,1623665378,72,180
1179,nzj8aj,ComPressOrk,0.0,ETH Report Stagnant  ,1623664398,2,1
1180,nziwce,sportifynews,0.5994,Ethereum might create another opportunity for buyers to kickstart new uptrend,1623662964,2,2
1182,nzhx3v,[deleted],0.8278,Titan Pharmaceuticals looks like a pretty good setup it could very well run TTNP ,1623658593,5,0
1184,npzl6j,hiilol69,0.4019,WallStreet D Crypto Special BTC News,1622568849,0,1
1185,npzk0l,redhood86ro,0.0,How to build a dApp on Ethereum,1622568772,1,1
1186,npz6ya,Responsible_Ad_6044,0.0,Learn about etherium in less than a minute,1622567836,0,1
1188,npywt7,jumbledFox,0.0,Cant register eth domain trying for hours now,1622567141,1,1
1189,npyr6f,bmorekareful,0.7184,Where and how to buy Eth,1622566779,0,1
1190,npyqlk,bitrefill,0.5267,XMRs Fluffy Pony Chinas mining crackdown HK blockchain to fight censorship  To the Moon ep ,1622566739,1,1
1195,npxgvr,Responsible_Ad_6044,0.0,Etherium and bitcoin,1622563504,0,1
1196,npxb54,I_putz,0.7184,We didnot make it to the moon yet,1622563114,1,1
1197,npx8kg,IkenSpinoza,0.6369, Best performing cryptos from  until ,1622562927,0,1
1198,npx2x1,doeiwkxi3,-0.5106,John McAfee faces dying in prison for the same thing Elon Musk does on Twitter says his wife,1622562514,0,1
1199,npwwcj,CoinjoyAssistant,0.4588,Ethereum Shows Strong Signs of Returning to ATH of ,1622562025,9,2
1200,npwgq8,jessemartz,0.8494,Another reason to buy ETH ASAP amp HODL ,1622560899,1,1
1202,npw43k,poojaranjan19,0.0,Ethereum blockchain users and developers survey,1622559950,0,1
1206,npvlg2,JauntyTurtle,0.2263,Staking ETH  running a node worth it,1622558530,4,1
1208,npv8hs,Lost_Art_805,-0.3182,Game Art NFT  The Crypto of the Game Industry  Upcoming Launch on telegram   PartnershipsAdvertising Coming Soon  Live AMA  Anti Whale ,1622557525,0,1
1211,npusmp,Aggravating-Ear6289,0.0,Flippening Prediction Market Updates,1622556289,2,1
1215,nptxsi,wauzibauzi,0.0,ETH batch sending tool,1622553749,0,1
1216,nptmuf,Maleficent-Fix-5587,0.0,Eth ,1622552888,0,1
1218,nptgho,socalquest,0.1779,The Amazon Of Information Goldman Sees Ethereum Overtaking Bitcoin,1622552474,3,1
1219,nptgdv,hasanabedalnabi,0.0,future of crypto  BOOOOM,1622552465,0,1
1221,npt1ic,Acceptable-Ad3874,0.2732,Virtual Fitness Classes paid with Ethereum,1622551158,0,1
1222,npt0u8,gravemindx,0.0,A Git Repo to update Youtube title and description to reflect Ethereum Prices,1622551096,1,1
1223,npsz5i,ligi,0.6369,Calling for a better name for  when it hits end users,1622550938,33,1
1225,npswxz,Jimbley_Neutralon,0.4588,The best podcasts to stay uptodate on the Ethereum ecosystem Am I missing anything,1622550732,0,1
1226,npsv5n,DragonflyOk7954,0.4588,How long does it take to receive ether on MetaMask,1622550574,0,1
1230,nprtr3,CreatorofGod-,0.5267,For all the Ethereum  lovers and stakers,1622547156,0,1
1232,npra13,Sospian,-0.5423,Status Dropped,1622545118,0,1
1236,nppxir,miketester7678,0.2263,We built Bitcoin treasuries for Ethereum,1622539520,0,1
1237,nppwyw,flyingsolo0101,-0.4767,Etherium to provide a Universal Basic Income to poor,1622539455,0,1
1238,nppvyg,Stonesafe,0.4019,China should support ETH rather than Bitcoin,1622539332,0,1
1240,npproz,miketester7678,0.6369,PH launch We built ETH treasuriessimilar to bitcoin treasuries  Upvotes appreciated,1622538818,1,1
1242,npplth,Gold-Tackle197,0.0,New Token called Killbit KILB,1622538129,0,1
1243,nppl07,Mercy_artz1,0.4215,How etherum saved my life,1622538031,84,1
1244,nppg42,Ituglobal,0.0,Ethereum Pushes to the Upside Targets Resistance at ,1622537456,0,1
1247,npp6dc,ARATIX59,0.0,All eth whales in real time,1622536245,2,1
1248,npp5gv,childlike-fool,-0.7184,Would you sell your ethereum for vechain,1622536138,0,1
1251,npoj75,muchWrap72,0.7778,Make more profit on purchases and loyalty points with DragonBite,1622533500,0,1
1252,npno4q,DrFolAmour007,0.0,Can Ethereum be used for investing in the economy,1622529763,5,1
1254,npnljt,Miserable-Pie,-0.5423,CBET Crash Game Predictor V  JUNE   Roobet Stake Bustabit and JetX,1622529445,0,1
1257,npmveo,sportifynews,0.2263,More Than  Million in Ethereum Worth  Billion Rests in the Eth Staking Contract,1622526345,0,1
1258,npmiu7,jajajinxo,0.0,Should the State or the Market Provide Digital Currency,1622524947,0,1
1259,npmbc9,Kadakt,0.3182,Do you ever see ethereum hitting k ,1622524135,20,1
1266,npka95,Shatter_Hand,-0.4588,Knight of the Dip,1622516848,9,1
1267,npk2nb,roberthonker,-0.25,Why would anyone run a node before ETH,1622516171,2,1
1270,npjzge,roberthonker,-0.25,Why would anyone run a node before PoS is implemented,1622515868,0,1
1271,npjxbi,jthompson2964,0.4588,Trend of ADA to strengthens ETH,1622515672,0,1
1272,npjx69,Taurus-The-Bull,0.0,Hi guys What are your thoughts on ETH for the next couple of weeks Predictions,1622515659,0,1
1273,nt3ddv,jtixador18,0.4588,Yfin airdrop hurry up It will be listed soon Nothing to do just paste your ETH addres,1622921325,1,1
1275,nt321q,JackTheTranscoder,0.296,The future of money The digital currency revolution is here and may sweep away  years of monetary history,1622920452,7,1
1277,nt2woo,666deathlegion,0.4588,Anyone else feel bullish on Tellor for long term investment Especially with only mil market cap as of right now,1622920022,3,1
1279,nt2ab3,crystalrun,0.3612,People like this in the BTC community are why the flippening will happen sooner than expected,1622918259,4,1
1280,nt29i1,crystalrun,0.3612,People like this in the BTC community are the reason why the flip will happen sooner than expected,1622918195,0,1
1282,nt1wxs,CryptoLatency,0.8225,Just hodl my good and desesperate friend An old chart say this always happen,1622917204,0,1
1283,nt1hhf,Capital-Topic-3359,0.5859,ETH IS PAIRED WITH FAX TOKEN IN ITS PROMOTION OF FAX REMOTE CHARGER APPLICATION PLUS  WIN,1622916026,0,1
1284,nt1gs9,StandardAfternoon289,0.5473,LOL Physical ETH Coins Exist Kinda dope,1622915984,0,1
1285,nt15ij,kehlder,0.0,Yo Come watch bitcoin miami  with us,1622915104,0,1
1286,nt0w5k,xyzxyxz,0.4588,remember were in the top ,1622914366,0,1
1287,nt0l8k,Trantidon,0.0,Running a Full Node locally,1622913513,8,1
1288,nt070s,Icy_Werewolf4367,0.0,Am I understanding ETH  correct,1622912410,0,1
1291,nszvuo,JsizzlTheCnote,0.0,sent binance peg ethereum to my public Ethereum atomic address,1622911549,0,1
1292,nszrhe,ExpensiveWasabi,0.4404,Good places to stake Eth,1622911203,0,1
1295,nsz5su,thepokerplayer7,0.4767,am just too much admire to Ethereum even i dont have any Ether,1622909530,0,1
1297,nsyk8m,DogetnetDotNet,0.7184,Ethereum To The Moon SpaceX To Launch First Ethereum Node To The International Space Station,1622907903,0,1
1298,nsy9km,Clucasism1,0.0,Come Watch Bitcoin Miami with Us,1622907070,0,1
1299,nsy767,Conscious_Evening_57,0.9313,Whats the difference And which is a better buy long term Any adviceopinion welcome,1622906893,6,1
1300,nsy2pu,CyberMonkey728,0.0,Ethereum Decentralization Question,1622906549,11,1
1302,nsxruf,fecalfettucine,-0.7184,Can Crypto  Com alter or sell coins you stake through them,1622905704,5,1
1305,nsx0jm,that_one_indian_dude,0.0,Crypto Domain names and the ETH,1622903547,21,1
1306,nswuyf,Theory-Early,-0.1027,Bitcoin Miami Conference warns attendees its a Bitcoin not Crypto conference and not to talk about other coins Floyd Mayweather,1622903093,716,1
1307,nswocu,wherestheporn1,-0.5423,Watch This Video On What Anonymous Said To Elon Musk After The Crash,1622902570,2,1
1309,nsw6fu,gharvhel,0.34,Ethereum is scaling while maintaining security,1622901065,25,1
1310,nsw0yx,WarriorSafemoon,0.0,Ethereum price heads toward a bullish breakout Ethereum price is forming an ascending triangle pattern forecasting a  upswing to ,1622900600,0,1
1311,nsvsem,socalquest,0.9274,Former btc lover now ETH lover just bought  ETH,1622899843,35,1
1313,nsvbnu,ryny24,0.0,Im not understanding GAS prices,1622898300,9,1
1314,nsvaum,FSA2014,0.6249,On Vitalik and Etheream Charles Hoskinson  Great stuff,1622898218,0,1
