,id,author,vader,title,created_utc,num_comments,score
1195,i1q18t,darkestfoxnyc,0.4588,What's you favorite YouTube channel/podcast/blog for getting daily crypto news + commentary?,1596277315,5,1
1196,i1pry9,CkresCho,0.0516,If you could cryogenically freeze yourself for a thousand years?,1596275835,15,1
1197,i1po75,entpia,0.0,Bitcoin is gold.,1596275196,3,1
1198,i1pjx2,caliexotics420,0.3818,The bulls are loose,1596274495,2,1
1199,i3vwn8,cherryboyblue,0.0,Voyager Transfers,1596589795,0,1
1200,i3vv94,Daveliuz,-0.7003,"Flooding Threatens China’s Bitcoin Miners, Chinese Billionaire Says ‘Three Gorges Dam Collapse Imminent’",1596589636,0,1
1201,i3vt9i,climbingkoala27,0.4404,Is it safe to move btc off of a ledger right now?,1596589425,14,1
1202,i3vp4p,bitpaint,0.0,Releasing Bitcoin campfire!,1596588954,0,1
1205,i3v65f,Sweet_Organization10,0.0,Bitcoin Whale,1596586899,0,1
1207,i3uz7h,xmen-73,0.2023,Earn passive income in crypto,1596586169,0,1
1208,i3uq6z,Usdflips,0.0,Texas and using Binance Exchange,1596585228,2,1
1209,i3upzq,Paydjah,-0.4767,Professional dust attack (analysis) or trolling?,1596585205,5,1
1210,i3unn0,david115599,0.0,Here we go again,1596584955,1,1
1211,i3u1qw,lightningjunkies,-0.4404,Lightning Junkies episode Rene Pickhardt talks LN Pathfinding + Blackmail Attacks,1596582726,1,1
1212,i3u0eh,BashCo,0.0,Bitcoin Rapid-Fire: BITCOIN AND SCARCITY: A MEDITATION w/ Reed Womack,1596582595,0,1
1213,i3trur,BitcoinIsDigitalGold,0.4003,Dave Portnoy's Rant About Bitcoin! [The Winklevoss Twins Agreed To Help Him With This],1596581750,15,1
1214,i3trsa,Bitcoin1776,0.3089,NFL Mask Mandate? No problem for now. We are everywhere and nowhere.,1596581743,0,1
1215,i3tqvm,StoneHammers,0.0,Me in a few weeks,1596581658,0,1
1216,i3tkd0,stationarycommotion,0.4019,fees help,1596580991,12,1
1219,i3tdp8,BashCo,0.0,Bitcoin Audible: Read_425 - If You Only Read One Thing Before Buying Bitcoin... [Sylvain Saurel],1596580352,1,1
1220,i3sxa1,Daveliuz,0.0,Bitcoin Black Friday 2020 Will Host Major Discounts For BTC Payments,1596578824,0,1
1221,i3sx9d,Daveliuz,0.0,BitBlockBoom Is Bringing Bitcoiners Back Together,1596578822,0,1
1222,i3su9h,VampireVlad,0.0258,"The second season of The Bitcoin Takeover Podcast takes off with a surprise teaser episode involving Italian BTC maximalist Giacomo Zucco. Throughout the hour-long interview, you will get to find out more information about Mr.",1596578540,0,1
1223,i3sp2r,BillofBitcoin,0.0,Little poem i wrote for yall,1596578053,2,1
1225,i3sh21,btc_revel,0.0,Tehran Skyscraper Combines Cryptocurrency Mining with Vertical Water Park,1596577300,1,1
1226,i3rzen,bitdex,-0.5423,'Rat Poison Squared on Steroids': What's New in Bitcoin's Latest Lightning Release,1596575685,0,1
1227,i3rucr,Daveliuz,-0.4019,South African Bitcoin Investment Company Faces Fresh Scam Allegations,1596575230,0,1
1228,i3rqvr,NorgeWood,0.7184,"Dave Portnoy, or El Prez, of Barstool Sports wants to buy all the Bitcoins.",1596574921,1,1
1229,i3r715,Hexoid,0.3182,"I'm not a troll, I'm just curious.",1596573150,22,1
1230,i3r0xg,SHARPTRADING,0.0,What is future of bitcoin?,1596572611,1,1
1231,i3r07j,bitdex,0.0,P2P Bitcoin volume hit all-time highs this week,1596572552,0,1
1233,i3qqyw,SAT0SHl,0.0,Pizza Express up for sale...,1596571762,3,1
1235,i3qnhs,amygdalad,-0.6249,Lebanons currency crisis paves the way to a new future - Bitcoin,1596571467,6,1
1236,i3qma6,RattleGoreBitcoin,0.0,Lollapalooza 2020 [Live performance] Shoreline gives a shoutout to Bitcoin,1596571363,6,1
1237,i3qm2i,thegreatced,0.0,Bzx (BZRX) The Shipping Manifest: July 2020!,1596571346,0,1
1238,i3qhp4,ftrades,0.0,A Bitcoin cookie,1596570968,2,1
1239,i3qhoc,Iamblichus-,0.0,Beyond Bitcoin - Economics of Bitcoin,1596570966,0,1
1240,i3qfbb,ChinnyBeneath,0.7184,"Barstool Sports Founder David Portnoy Wants to ""Buy All The Bitcoins""",1596570772,55,1
1241,i3q36a,thomascr9695,-0.3612,Ignore Peter Schiff,1596569731,16,1
1242,i3q2pi,charlobino,0.2732,What are the steps to create a Bitcoin API from scratch for Bitcoin market data ?,1596569691,2,1
1244,i3pr0h,cheese4brains,0.368,"FYI to anyone who needs to hear this, the real bitcoin discussion is happening on twitter and always has been.",1596568693,28,1
1246,i3pljt,bluechip10,0.0,Donate Bitcoin for a land development project.,1596568246,1,1
1247,i3phzi,KayleighSosnowski,0.5994,BTC’s Bull Trend Fueled By Deliberation on Stimulus Bill,1596567964,0,1
1248,i3pcgo,Leech-64,0.0,Mathematical Trends and log graphs,1596567495,2,1
1249,i3p5xt,lostcorass,-0.168,(serious question) Is the entire Bitcoin Blockchain a collection of preloaded chunks of a Minecraft type world generator? (yet?),1596566906,13,1
1250,i3ozjo,GotPizzaMouth,0.0,When I hear the Winklevii say there are Trillions of reasons to own bitcoin,1596566340,6,1
1251,i3oxe0,bitdex,0.0,Lightning Terminal: Your Home for Bitcoin Lightning Liquidity,1596566162,0,1
1252,i3otzx,simplelifestyle,0.128,"Putin signs law legalizing Bitcoin &amp; other cryptocurrencies, lifting them out of Russian legal 'grey-zone'",1596565875,0,1
1253,i3o5y9,noaltnoaltyouthealt,0.4215,"Twitter Hack Shows That Crypto Is Easier to Investigate Than Fiat, Say Industry Law Experts",1596563791,1,1
1254,i3o5r2,Payersite,0.0,Payeer Exchange: Learn How to Trade Bitcoin with Payeer on Android,1596563772,0,1
1256,i3nv2j,CoinjoyAssistant,0.0,BTC price effect on the mining industry,1596562831,0,1
1257,i3ntvo,anaccount-wascreated,-0.6187,"Sooooo this just happened...... surprising no one, the website is a scam. Requiring a deposit if you want to withdraw. Now I don’t think anyone would fall for this but just in case. Oh oh and he promptly blocked me after that",1596562726,1,1
1258,i3nqpv,atrueretard,0.34,Does anyone know how these Value Changes are calcuated?,1596562456,1,1
1259,i3nqp6,mazigner02,0.6458,"Earn TFuel, INCNT and Brave tokens at the same time!!!",1596562455,1,1
1261,i3noql,aemmeroli,0.6705,Creating my own zero trust seed with 6 dice,1596562288,10,1
1262,i3nmnj,notjokr,0.7003,"5 years ago, I sold Bitcoin to pay rent I was behind on. Today, I learned that if I held, I could be $70,000 richer. Dang lol",1596562107,79,1
1263,i3nmgj,vicious_delicious_77,0.34,Phone Security and Coinbase,1596562091,10,1
1264,i3nla8,sirgerardo,0.0,¿DeFi?,1596561992,1,1
1265,i3niea,Satoux3,0.5719,"Bitfinex offers $400 million reward for 120,000 Bitcoin hack",1596561735,4,1
1266,i3ndvs,kaz2727,0.3182,Check out r/Btcvideos. Looking for moderators/marketers. A crypto channel that offers the community every means of communication to spread truth and perspective of Crypto for crypto.,1596561337,1,1
1267,i3nb7h,alcaow,0.0,Fees question,1596561100,15,1
1268,i3n82p,Daveliuz,0.5994,The Human Rights Foundation Awards Grants to Three More Bitcoin Projects,1596560831,0,1
1269,i3n79p,SocialAddiction1,0.6389,"Why are people so confident bitcoin will reach 100,000$?",1596560768,138,1
1270,i3n2kt,Dboobz71,0.0,Fade Bitcoin to black,1596560382,0,1
1271,i3n0zx,DyslexicPenguin,0.34,How do you expect bitcoin to rise in value if you just keep on hodl-ing?,1596560238,9,1
1272,i3mt1n,Gigantile,0.0,"Daily Crypto Brief for Tuesday, August 4, 2020",1596559549,0,1
1273,i3mbv7,Dark_Alchemist,0.0,Coinbase is working with China,1596558050,18,1
1274,i3m75z,tmoore711,0.0,Don't let current price control your emotions this is about a journey of time.,1596557622,0,1
1275,i3m6qn,roasbeef,0.7424,⚡️It's LiT! Announcing Lightning Terminal: Your Home for Lightning Liquidity ⚡️,1596557587,13,1
1276,i3lyto,Leader92,-0.1027,Ledger response to BTC derivatives exploit.,1596556890,73,1
1277,i3lw2z,swtangelx,-0.6124,Cryptocurrency job scam?,1596556640,26,1
1278,i3ls36,KayleighSosnowski,-0.25,Netwalker ransomware nets hackers $25mln in BTC in 2020 alone – McAfee,1596556290,1,1
1279,i3lpb5,bitcoin_ft,0.1027,Youtube still actively supporting these crypto scams? This just popped on one video I was watching.,1596556039,2,1
1280,i3lmye,kaz2727,0.0,Why I’m sticking with bitcoin. Why it might be be my retirement.,1596555828,0,1
1281,i3lm69,Bitcoin_Magazine,0.0,"How To Activate A New Soft Fork Analysis and discussion With Matt Odell, Ben Carman, and CK.",1596555756,0,1
1282,i3lkma,Bitcoin_Magazine,0.0,"Bitcoin in Prague with Alena Vranova, Jimmy Song, and Alex Gladstein",1596555619,0,1
1285,i3ldmg,Consistent_Stay_3471,0.0,Earn BTCs,1596554979,0,1
1286,i3ldcw,cryptohoney,0.0,2016 revisited,1596554956,6,1
1287,i3l51a,Perfectenschlag_,0.4574,I could use your help with a quick survey for work!,1596554198,6,1
1288,i3l27o,SpockSays,0.6908,Bullish,1596553937,7,1
1290,i3l0uo,ZeitgeistGangster,0.5267,Is the crack in my screen preventing the QR code from transacting?,1596553816,0,1
1292,i3kln0,brando2131,0.0,Whats the purpose of lndhub?,1596552393,6,1
1294,i3ka0u,LocalTear,0.0,WebSockets in World of Blockchain,1596551264,0,1
1295,i3k8zg,cryptominerst,-0.2263,Innosilicon G32-500 / G32-1800 available from first and only batch Limited to the quantity you see on the products page,1596551163,0,1
1296,i3k6s7,pm_me_egg_pics_,0.4404,Is there an easy way to set up alerts for when Bitcoin dips?,1596550945,5,1
1297,i3jxl7,Daveliuz,0.4215,Government Official Updates Progress of India’s Cryptocurrency Law,1596550039,0,1
1298,i3jwpq,phabulu,0.4588,"Here on My Country, we are close to the all-time high",1596549953,22,1
1299,i4oao4,futurebrought,-0.4767,Guys it's still happening. What's wrong with YouTube?,1596704334,3,1
1300,i4o8dv,IgorAlisson,0.0,Address Issues,1596703963,16,1
1301,i4o3cf,Bitcoin_to_da_Moon,-0.128,"Nasdaq-Listed MicroStrategy, Wary of Looming Dollar Inflation, Turns to Bitcoin and Gold",1596703170,1,1
1302,i4o2rz,Chris_Svorcik,0.8834,🚀 Bitcoin Bulls Breaks Ascending Wedge Chart Pattern 🚀,1596703089,1,1
1303,i4nzgn,traderforbtc,0.3612,localbitcoins trying to throttle voice like colonial rulers.,1596702583,0,1
1305,i4n810,BindoMcBindo,-0.6476,"Scam live on YouTube now! Elon musk airdrop, report if you see it",1596698457,5,1
1306,i4n7yl,rddtpro,-0.6124,what is this going on another bitcoin scam on youtube this time?,1596698448,2,1
1307,i4n777,altcoinpost,0.2023,Top 7 Crypto Instagram Accounts To Follow,1596698346,1,1
1308,i4n0q2,colocharica,0.4588,to eat this night. (haha),1596697437,1,1
1309,i4mzhy,rBitcoinMod,0.0,"Daily Discussion, August 06, 2020",1596697269,263,1
1310,i4mww2,NeedFUD,0.0,"Exit Fiat, Enter Bitcoin",1596696888,82,1
1311,i4mrey,Radiant-Ad-5076,0.0,Etherium pre mined question,1596696088,2,1
1312,i4mqlb,Environmental-Solid7,0.296,EARN MONEY ONLINE,1596695957,0,1
1313,i4mo4k,Ituglobal,0.0,"Bitcoin Consolidates Above $11,000, May Possibly Retest the $12,000 Mark",1596695622,0,1
1314,i4mlb7,WocketMan0351,0.0,Inflation is already starting to happen,1596695203,2,1
1315,i4lv6d,lizciocca7866,0.0,"Cooling Tower Parts, Components And Functions | Linquip",1596691589,0,1
1316,i4lpet,fraqaq,-0.4939,Anyone else want it to drop more than go up?,1596690816,11,1
1318,i4lgu0,Alternative-Reason13,0.0,Falsificação e DLT,1596689706,0,1
1319,i4ldv8,theanxiousbandit,0.0,How to deal with Bitcoin scammers,1596689318,0,1
1320,i4lb5r,mouthymouth,0.0,"I'm new to bitcoin, and I keep seeing these seemingly wild claims of bitcoin skyrocketing in the near future. Is there any concrete truth/proof/evidence to these claims?",1596688966,22,1
1321,i4l606,bearCatBird,-0.0772,"Serious question about bitcoin use in 30 years - If bitcoin stabilizes and becomes a deflationary currency, what will incentivize you to ever lend your bitcoin to a new small business owner?",1596688307,103,1
1323,i4kya9,Osage7,-0.3612,How hard is it to solve a block?,1596687349,14,1
1324,i4ku5a,Daveliuz,0.4404,US Congressmen Want IRS to Balance Taxation and Innovation in the Cryptocurrency Space,1596686844,0,1
1325,i4kq3u,NateNate60,0.6369,Need help with Lightning Network. I'm getting ready to ditch BCH,1596686362,110,1
1326,i4kq0e,Stunmachine_Dev,0.0,Earn Bitcoins by completing surveys,1596686350,0,1
1327,i4k1qv,gaskills,0.0,If you were offered $1m today on the condition you that you are never allowed to own bitcoin or gold ever in the future do you take it?,1596683461,26,1
1329,i4j9gz,mcabert321,0.0,FUND RECOVERY,1596680467,0,1
1330,i4j8mz,tom98239273,0.7184,Photo taken at the moon,1596680386,0,1
1331,i4iuyl,feetkisser69,-0.128,"Do u think it will dip below 10,000 again like it always does?",1596678970,29,1
1332,i4ih06,BitBlockBlog,-0.3182,"BitBlockBlog Evening News Post( 05Aug 20): Porn Interrupts Twitter Trail, Bitcasino, &amp; Square Bitcoin Haul",1596677510,1,1
1333,i4ia5e,bitcoin_ft,0.0,Back on track to 12k?,1596676812,3,1
1335,i4i2fn,Daveliuz,0.743,Peer-to-Peer Bitcoin Trading Tops $95 Million as Sub-Saharan Africa Records Set All Time High,1596676041,0,1
1337,i4hwi2,hcarpach,-0.2263,"Ledger and Trezor wallets are vulnerable to bitcoin theft (both companies knew for over a year, did nothing until now)",1596675462,9,1
1338,i4hvog,ChaseLand,0.0,Bitcoin Price Over Time,1596675385,6,1
1339,i4hvbe,BashCo,0.2732,"Bitcoin Audible: Chat_45 - Bitcoin &amp; an Energy Revolution, A panel at the VOB Conf",1596675352,0,1
1340,i4hssl,MSsagea,0.0,Why Blockchain is Rising????,1596675117,1,1
1342,i4hjh8,Lumin8_Crypto,0.6369,BTC News Today 2020: Bullish Signs That Demand For Bitcoin Is Skyrocketing,1596674203,5,1
1343,i4hi40,simplelifestyle,0.0,Mexico: Residents Can Now Spend Crypto at Millions of Visa-Accepting Stores,1596674070,6,1
1344,i4hfdg,oktoptopus,0.0,ONE OF US!! ONE OF US!!,1596673797,0,1
1346,i4hc1k,cabmar2k,0.5984,Feel like this applies really well right now....,1596673434,0,1
1347,i4hajt,TankMiddleFiddle,-0.4215,Just another scam ....thats what bitcoin is based and surviving up on._____,1596673282,5,1
1348,i4h2os,VampireVlad,0.0,Typography,1596672479,0,1
1349,i4h247,aemmeroli,0.0,What happens with additional entropy?,1596672425,5,1
1350,i4h03z,intothecryptoverse,0.0,BTC/USD vs. BTC/EUR: A slightly different tale,1596672225,1,1
1351,i4gsaz,J5CJ,0.0,new poster for my room. is what it is,1596671461,0,1
1352,i4gpz2,MagoCrypto,0.0516,"Bitcoin heads for $12,000 as gold reaches $2,000 milestone.",1596671240,13,1
1353,i4gpca,bau___,0.0,What was BitcoinXT,1596671176,0,1
1354,i4gikq,schigity,-0.6553,I think this is another bitcoin scam with Elon that is currently happening??,1596670512,4,1
1355,i4g7r2,StEPhEn-u-no,0.6808,Can one y’all send me some bitcoin. Will be appreciated l. Please send 2 BTC to bitcoin address. bitcoin://1EKcigWiptWPbp7RVnRw65J6Ua6a48Kpgr?amount=2,1596669452,0,1
1356,i4g29v,atrueretard,0.0,$1.2B MicroStrategy Will Hold Bitcoin as Part of its Cash Reserves,1596668886,5,1
1357,i4g1tn,Daveliuz,0.6369,S2F Price Model Suggests Bitcoin Price Hits $100K – Author Claims Model Is Perfectly on Track,1596668840,0,1
1358,i4fx1f,watching_machine,0.0,"How is this still happening? ""Verified"" account on Youtube Recommendations again? Why is Youtube so slack in monitoring this!?",1596668388,1,1
1359,i4fta3,just_a_fellow_brokeb,-0.4215,Just a fellow broke boi,1596668031,1,1
1360,i4fsw6,simplelifestyle,-0.296,"There's no inflation, you say?",1596667990,0,1
1361,i4fr10,bitdex,0.0,Bitcoin is Becoming an Inflation Hedge.,1596667811,7,1
1362,i4f9r2,YonTheDon_,-0.128,Still unconfirmed?,1596666165,15,1
1363,i4f9i9,gloomy_chibi,0.0,Cryptos vault,1596666141,7,1
1364,i4f7mn,Fittiboy,0.0,Are Satoshi's coins quantum resistant?,1596665961,9,1
1365,i4f59m,Osage7,0.0,NEW to BTC,1596665734,12,1
1368,i4exae,VampireVlad,0.4588,"On June 29th 2019 I've had the pleasure to interview Indian bitcoiner Rajarshi Maitra. I was curious to find out more about the state of BTC adoption in the world's second most populous country, but I ended up discovering so much more.",1596664992,0,1
1369,i4esu3,ninjua265,-0.6697,Why XRP Is The Most Hated Cryptocurrency,1596664590,1,1
1370,i4ee3u,awgsm,0.0,Coinbase verification and initial deposit,1596663258,4,1
1371,i4e58o,Air-minem,0.0,Coinatmradar or Google?,1596662480,3,1
1372,i4e1ve,FromTheGarage,0.0,When you’re on a date and you start talking about Bitcoin,1596662167,0,1
1373,i4dxmu,AnonymoDJ,0.8481,Let’s 🚀 to the🌛,1596661779,21,1
1374,i4dvnd,justinjustinian,0.34,Issue with using usd denominated value,1596661604,5,1
1376,i4d81o,kill-me-in-june,0.0,Kraken 3-day hold on new accounts?,1596659492,4,1
1377,i4d5y0,NimbleBodhi,0.0,BTCPay Server 1.0.5.4 has been released,1596659309,10,1
1378,i4cy13,RalphAnderson_,0.0,Crypto Update,1596658618,1,1
1379,i4cufy,JeremyLinForever,-0.5106,I need Bitcoin to hit $1m because I’m sick of it...,1596658298,14,1
1380,i4cgtc,EvilfaceDJ,0.0,LIVE BTC CHART + VIDEOS!!!! (trying to grow here),1596657191,1,1
1381,i4c38f,Rezvord,-0.128,Rig,1596655977,5,1
1382,i4c2vz,kasinoDex,0.0,REGIONS WILL SHUT YOUR ACCOUNT IF THEY SEE CRYPTO TRANSACTIONS,1596655947,0,1
1383,i4bzek,Ok_Challenge_7882,0.0,Test,1596655677,1,1
1384,i4bzcn,JRthePUMP,0.8777,My friend is passionate about Bitcoin and made a Bitcoin anthem for us to enjoy. Check it out!,1596655672,0,1
1385,i4bxrg,Bigbangstar,0.4939,💔💔,1596655541,0,1
1386,i4bwnr,bitdex,0.0,U.S. Congressman Tom Emmer says ‘Bitcoin ain’t going away’,1596655446,7,1
1387,i4brzw,TunesMedia,0.0,"Bitcoin in, gold out among young investors, claims JPMorgan",1596655050,0,1
1388,i4br3u,Xclusively-Tochilyn,0.4404,3 Main Ways to Profit from Crypto in 2020 | Cryptocurrency News | The Official ChangeNOW Blog,1596654975,2,1
1390,i4bau4,coindrop,0.7345,This mug has been with me since the summer of 2017. Hopefully I will only have to drink with the right hand from now on. TTM!,1596653605,0,1
1391,i4b560,DomasVaicius,0.0,Coinbase vs Coinbase Pro,1596653121,12,1
1392,i4avgc,Daleedge,0.0,What’s your percentage of Bitcoin/Crypto in your total investments ?,1596652317,15,1
1393,i4at4f,spinkald,0.4404,The fluctuation of the bolivar is good for bitcoin traders,1596652111,3,1
1394,i4acqb,alextailorswift,0.3818,more then 300 coupons and discounts from companies accepting Bitcoin,1596650696,0,1
1395,i4a98w,BashCo,0.0,Bitcoin Magazine: FED Watch - “Fed Insider Reveals What’s Really Going On (w/ Danielle DiMartino Booth)” - FED 18,1596650397,1,1
1396,i4a8hx,CryptigoVespucci,-0.128,Square has purchased $1.5B BTC over the last 12 months to meet retail demand for CashApp purchasers,1596650332,37,1
1397,i4a0zg,ishmoo21,0.4404,Is my ledger backup safe?,1596649664,6,1
1398,i49o2t,astro99206,0.0,"Russia's Biggest Bank ""Sberbank"" to Launch Its Own StableCoin - Crypto Pencil",1596648529,4,1
1399,i5pqsh,faisige,0.5423,0.005 BTC Signup Bonus ||Earn 19$ Per Month,1596847217,5,1
1400,i5pn1y,adam-007,0.0,Coinbase,1596846806,44,1
1401,i5p7y7,VampireVlad,0.0,Full Width Page with Slideshow,1596845238,1,1
1402,i5p6bi,jonlucas0,0.4019,Do you know you can earn up to 3500 dollars in 24hrs with you smart phone?,1596845058,0,1
1403,i5oxjx,cryptobriefing,0.0,Pro-Bitcoin SEC Commissioner Hester Peirce Elected to Serve Five More Years,1596844152,0,1
1404,i5oqf7,Micheal_kingsley,0.0,"#Bitcoin #forextrading #options💯you can invest $200 earn $2,000 4days $300 earn $3,000 4days $400 earn $4,000 4days $500 earn $5,000 6days $600 earn $6,000 7days $700 earn $7,000 7days $800 earn $8,000 7days $900 earn $9,000 7days $1000 earn $10,000 14days $2000 earn $20,000 14days $3000 earn $30k",1596843402,2,1
1406,i5o46i,Bull127,0.2263,Here are 5 Ways to Short Bitcoin - AKA how to get rekt in a bull market.,1596841148,3,1
1407,i5nww1,BashCo,0.0,Bitcoin Rapid-Fire: BITCOINER BOOK CLUB #2 - The Bitcoin Standard,1596840416,1,1
1408,i5nd6q,andrew_vickers,0.0,"Should a 14 year old kid invest into Bitcoin? If so, how much?",1596838525,158,1
1409,i5mqci,Loon_Mambo,0.0,What would a nearby nova do to Bitcoin?,1596836369,9,1
1410,i5mnu7,coincodecap,0.0,"96,857 BTC ( 1,1$ billion ) moved today in the transaction",1596836125,0,1
1411,i5mjd3,ITSLILGEEK,0.4019,help....,1596835713,0,1
1412,i5mftc,LilyJohnson96,0.0,Scammed and robbed,1596835377,26,1
1413,i5m618,BashCo,0.0,Citizen Bitcoin: Obi Nwosu: The Power of Bitcoin,1596834494,0,1
1415,i5lvxh,nice2yz,0.5574,California Energy Commission Backs Green-Energy Pilot Using RSK's Bitcoin Smart Contracts,1596833564,5,1
1416,i5lre8,glichingcandy,0.0,Postcard from 1905 with a bitcoin stamp,1596833141,1,1
1417,i5llmx,krismaster87,0.7184,Is it late to buy Bitcoins?,1596832614,38,1
1418,i5letp,MaleficentChoice3,0.0,Generating an indexed btc address from an xpub key,1596832006,8,1
1419,i5l9og,aCummyGnat,0.7845,Taking out of savings to buy 1 Bitcoin worth it?,1596831561,31,1
1420,i5l4wi,zizzle44,0.0,NEW BITCOIN STUFF,1596831134,0,1
1421,i5l02i,FiniteRegress,0.0,The constellation of clues and data suggesting major institutions in BTC are finally more than rumors,1596830707,2,1
1422,i5kzgz,yasuomoi,0.0,I drank the koolaid today buying 0.1 bitcoin. Hi space brothers and sisters.,1596830656,131,1
1423,i5kr8x,Comar31,0.0,Bitcoin vs Central banks,1596829914,0,1
1424,i5kbq9,BashCo,0.0,Tales from the Crypt: #183: Whitney Webb,1596828499,0,1
1425,i5k8gm,joekur01,0.0,Bitcoin is King,1596828202,3,1
1426,i5k3hf,one_mansjourney,0.2755,Take out student loan for bitcoin with no debt,1596827768,27,1
1428,i5jhp4,emekshi,0.2732,Barbers Accepted BTC,1596825885,4,1
1429,i5jdzg,Thavash,0.0,Bitcoin's Stock to Flow model is on track !,1596825551,0,1
1430,i5ip3h,Dr_nikoo,0.4588,Plz help me out,1596823398,0,1
1433,i5idg1,ButteryPopcornn,0.3818,Some analysts are predicting a bigger bull run to come; others believe that Bitcoin could lose its gains.,1596822332,9,1
1434,i5id8c,Crypto4Canadians,-0.6476,Beware of This Bitcoin Job Scam!,1596822312,0,1
1435,i5i7ed,OnlyReveal6,0.0,Are we facing a Bitcoin Bullrun?,1596821792,21,1
1437,i5i4wa,Durpy15648,0.2023,What would a significant solar flare do to Bitcoin?,1596821571,21,1
1438,i5hugz,BashCo,-0.34,Bitcoin Magazine: The Van Wirdum Sjorsnado - The Time-warp Soft Fork &amp; Bitcoin Cash's Difficulty Adjustment Drama - NADO 5,1596820647,6,1
1441,i5h6tr,Rogzy,0.1007,Why Bitcoin matters !,1596818513,1,1
1442,i5h10x,BashCo,-0.3612,Tales from the Crypt: #184: Clark Moody,1596817985,0,1
1444,i5gzp0,sylsau,0.6588,"You Bought Bitcoin for the First Time? Great! Now, It’s Time to Define a Strategy and Stick to It",1596817867,1,1
1445,i5gy3j,TheRealXiaphas,0.7184,Alex Becker: You Should Buy Bitcoin BEFORE October (3 BIG Reasons),1596817727,1,1
1446,i5gpk3,Cap-Agitated,0.0,Erik Finman became a bitcoin millionaire at 18- now he’s thinking about life beyond crypto,1596816920,0,1
1447,i5goh8,MClaborn2010,0.4767,[Monument] Cryptocurrency Predictions Using Artificial Intelligence,1596816818,7,1
1448,i5gm2a,grittygatorr,0.0,"Bitcoin trading laws impede stablecoin development, says Japan regulator",1596816598,3,1
1450,i5gicy,rnvk,0.3612,LilyWallet: Setting up and sending a 2-of-3 multisig tx with Matt,1596816259,9,1
1451,i5ggbt,Purple1Rain,0.0,BTC vs Eth,1596816083,2,1
1452,i5gfp1,bitcoin_fixes_that,0.0,Current state of affairs,1596816038,1,1
1453,i5gauo,PleasantObjective0,0.0,"Ok, which one of you is paying 9300 sat/vbyte and why?",1596815595,10,1
1454,i5g6cu,primalfabric,0.9312,"Bitcoin is finally starting to see a Bull Run, now is perhaps a great time to start accepting bitcoin as payments 🚀! Here are some of the Top choices for Bitcoin Payment Gateways [No KYC]",1596815168,38,1
1455,i5fsb2,Disastrous_Ad6579,0.0,Bit coin mining.v,1596813849,0,1
1456,i5fllu,Guybrushmonkey79,0.0,Who wants to send me Bitcoin?,1596813217,0,1
1457,i5fk25,Subfolded,-0.7184,A different way to stack sats: Sell PUT options,1596813079,0,1
1458,i5fhga,Daveliuz,0.3818,Only Bitcoin Outpaces G4 Central Bank Balance Sheet Growth,1596812850,0,1
1459,i5fhf3,Prometheukles,0.7269,I hope you can read German 👋🏻,1596812846,5,1
1460,i5fdgb,VampireVlad,0.0,Instagram feed gallery,1596812495,2,1
1461,i5fd7l,testimoni,-0.1027,Trying hard,1596812473,0,1
1462,i5fcd2,sscall,0.0,Taxes and Gambling,1596812402,11,1
1463,i5f5l0,mrholmes1991,0.0,Interdax Crypto Market Report July 2020,1596811739,1,1
1464,i5f3zu,hex17or,-0.8176,I see this (and similar) scams as recommended videos almost on a daily basis on @YouTube and I make it a point to report each of these videos as spam/misleading but I'm appalled by the complete inaction from YouTube to tackle this nuisance.,1596811580,2,1
1465,i5f17v,Leader92,0.0,Petrodollar is facing some serious challenges.,1596811306,0,1
1466,i5exyy,riqelme,0.0,Wall Street Revealed To Be Edging Out Bitcoin Traders With $1 Million+ Transactions,1596811002,0,1
1467,i5ely2,simplelifestyle,0.802,Blomberg bullish on Bitcoin. Is promoting it on its main YT channel.,1596809849,133,1
1468,i5e268,epacg,0.0,Europains,1596807878,11,1
1470,i5dwsx,TrudleR,0.0516,"What is a full-node worth, if only miners can do a 51% attack. Where is the security?",1596807331,41,1
1471,i5dtyy,Godex_io,0.7184,"Check out a list of BTC merchants, who are brave and progressive enough to accept Bitcoin in 2020.",1596807048,2,1
1472,i5dsq0,fellowcitzen,0.0,China and Russia ditch dollar in move toward 'financial alliance',1596806914,28,1
1473,i5dmrc,nikitabetty48,0.6696,Booming Crytocurrency and best investment scheme ever!,1596806269,0,1
1475,i5dj9a,Abdulthefool,0.836,"Now that banks can hold crypto, is it safe to buy BTC on robinhood?",1596805883,8,1
1478,i5cymy,Voscovius,0.4576,Someone is really smart...,1596803559,1,1
1479,i5cpq1,catchyalater00,0.7184,I can officially say that I am now in the 0.1 club. To the Moon and then some guys and gals. We are in the midst of a revolution. You got to take the power back.,1596802531,54,1
1480,i5clt9,Daveliuz,0.0,"Bitcoin Ownership Steadily Shifts From Whales to Small Investors, Data Shows",1596802048,0,1
1481,i5chdc,start2019dev,0.0,Testnet Coins,1596801513,7,1
1482,i5cepf,hypmoden,0.4767,Explaining Bitcoin to your newbie friends,1596801155,1,1
1483,i5ccie,OceanSu,0.0,Let's witness the BTC period together,1596800850,0,1
