,id,author,vader,title,created_utc,num_comments,score
3572,i73zve,themonkier,0.0,Bitcoin entering 12K,1597062903,1,1
3573,i73kmz,At0m11c,0.0,It cant just be me,1597061118,0,1
3574,i73ivk,a_jalan,0.3612,"What's the point of a 'crypto revolution', if people eventually end up treating crypto like stocks?",1597060920,69,1
3575,i73f3w,MyNameIsTakenUgh,0.0,WHERE SHOULD I FIND BITCOIN SELLERS?,1597060463,4,1
3576,i736e4,Johnwicked11,0.2732,Join our cause in helping beirut blast victims,1597059355,4,1
3577,i731cb,BitBlockBlog,0.0,Bitcoin &amp; Blockchain News for 10 Aug 2020,1597058712,0,1
3578,i72za4,Delbert_Delaney,0.3167,One of the most exciting facts about bitcoin revolves around its creator Satoshi Nakamoto. The character is still shrouded in mystery as no one has ever come out confirm they know someone with such identity.,1597058452,1,1
3579,i72xsa,Public-Thing,0.0,BRD pending transactions,1597058254,4,1
3580,i72vf5,InvestWise89,0.8271,Subredditstats are bullish too :),1597057943,23,1
3581,i72vcd,onelovex3,-0.0258,"Bitcoin has broken its all-time high vs Argentine Peso, Turkish Lira and Brazilian Real.",1597057934,140,1
3582,i72u4d,MrCrownnnnn,0.0,Iron Bitcoin Man,1597057776,0,1
3583,i72rki,Grammar_Natsee_,-0.6696,Bitcoin is ridiculous and will have lots of problems in the future! [97 years old comic strip],1597057429,0,1
3584,i72q3z,rBitcoinMod,0.0,"Mentor Monday, August 10, 2020: Ask all your bitcoin questions!",1597057243,92,1
3585,i72poy,Roy1984,0.4404,Billionaire Venture Capitalist Tim Draper Explains Why Bitcoin Is Better Than National Currencies,1597057199,12,1
3586,i72opd,Sekiro78,0.0,aaaaand it's gone,1597057068,1,1
3587,i72mi3,Bl4ckBoXx,0.0,Is it possible to spend 1 of 2 outputs in same address?,1597056758,15,1
3588,i72kex,NeedFUD,0.6239,"Welcome back, long time no see!",1597056456,0,1
3589,i72grn,Delbert_Delaney,0.0,Mazive,1597055944,1,1
3591,i72e1x,orangehello1,0.6369,Cryptography is at the heart of bitcoin and other digital currencies . learn the basics,1597055560,0,1
3592,i729jw,MrCrownnnnn,0.0,The Iron Bitcoin Man,1597054892,0,1
3593,i727sp,Wll199250,0.0,Does anyone understand the two-way short-term trading of Bitcoin,1597054618,1,1
3594,i724q8,TheRealQualinesti,0.0,Is Bitcoin Code legit?,1597054161,13,1
3595,i720a0,Wll199250,0.0,Who can understand the two-way short-term trading of Bitcoin？,1597053542,0,1
3596,i7203i,[deleted],0.0,Does anyone know this guy?,1597053513,0,1
3598,i71to0,collayrohan,0.7319,How does cryptocurrencies gain value??,1597052548,0,1
3599,i71sx4,CjOnChain,-0.5574,"Canaan's Co-Chairman was 'Out', Chinese BIG3 Bitcoin Miner Makers under Inner Wars",1597052441,2,1
3600,i71nx9,BitAmp-Official,0.0,Almost every timezone now...,1597051706,1,1
3601,i71mw5,Data-Cracking-Blade,0.3182,Bitcoin is love ❤️,1597051556,0,1
3602,i71mav,thisdodobird,0.0,Gifting Bitcoin to the Family,1597051472,32,1
3603,i71lzk,BrilliantBorder6,0.0,Coin&amp;Coin - The World’s First Mini Contract,1597051424,0,1
3604,i71hue,ZAppa2103,0.0,Can you believe it!? From saving 50-400 every month! Finally did it!,1597050780,1,1
3605,i71dff,MK333666,0.2748,Bitcoin has a Great Mood and is in the Extreme Greed zone,1597050111,3,1
3606,i71bq0,AlchoRe,0.0,How to get into crypto :,1597049839,0,1
3607,i71ad8,Naturebuoy,0.0,"Currently, the price reflected on Coinbase is ≈ USD$4500 higher than the spot price.",1597049623,0,1
3608,i7190o,Naturebuoy,0.0,"At the moment, the differen between Coin base and spot market price is ≈ USD$4500",1597049410,0,1
3609,i717s8,CryptoeinInMyJordans,0.5994,The ultimate Bull,1597049203,1,1
3610,i714dp,jokoge,0.6115,Top 7 most profitable mining pools for beginners,1597048652,1,1
3612,i70tjo,Accomplished_Ad_8814,0.0,Programming: sending a payment,1597046954,5,1
3613,i70sui,Daveliuz,-0.4215,Investors Move 10% of Their Gold From Hong Kong Amid Financial Censorship Fears,1597046844,0,1
3614,i70otl,KayleighSosnowski,-0.4215,Bitcoin Price Just Broke $12K as Retail Investors Flood Market,1597046238,9,1
3615,i70mlm,SnooHedgehogs2336,0.4019,help...,1597045896,1,1
3616,i70dhz,paulcheung1990,0.0,Who is forking Filecoin?,1597044524,1,1
3617,i70bgu,Leader92,0.0,Inflation gave birth to Nazi Germany.,1597044206,2,1
3618,i707hh,Coinviva,0.0,Coinviva Bitcoin Market Weekly Report - Week of 10/08/2020,1597043605,0,1
3619,i703fe,kmgeraldo,0.765,Best place to make Bitcoin easily,1597043003,0,1
3620,i702s4,BJM_132,0.4404,Is bitcoin trading a good way to earn,1597042913,2,1
3621,i6zg9g,PrudentAlbatross3435,0.2263,Bitcoin shines bright in the darkness of fiat,1597039634,2,1
3622,i6zdkj,umlemmegetuh,0.0,Bitcoin for Giftcards?,1597039251,3,1
3623,i6z8fo,umlemmegetuh,0.0,Bitcoin for giftcards possible?,1597038518,3,1
3624,i6z28o,jeaux_seph,0.0,Y’all remember when...,1597037685,4,1
3625,i6z1aq,blckbird007,0.0,Bitcoin to ????????,1597037557,11,1
3626,i6ywug,stevenbmt1984,0.1779,Regal Assets Review,1597036945,2,1
3627,i6ycur,looloolooitsbutters,0.4926,Custom Raspberry Pi + 64x32 rgb led matrix bitcoin ticker. Hope to see 20K+ on it soon!,1597034412,35,1
3628,i6y4b7,Stack3,0.0,Is there such a thing as programmable monero?,1597033383,1,1
3629,i6y2kg,Shenghia,0.0,Seems legit,1597033184,0,1
3630,i6y035,zackl2300,-0.1779,Seriously 12k ?,1597032862,1,1
3632,i6xyl8,FriendlyListen8,-0.4588,When is the dip coming? Waiting to go all in.,1597032681,9,1
3633,i6xwig,Daveliuz,0.0,"Non-fungible Digital Artwork Sale Shatters Records, ‘Picasso’s Bull’ NFT Sells for $55K",1597032428,0,1
3635,i6xiw7,jjcool44,0.0,What's a decentralized exchange?,1597030826,5,1
3636,i6xhan,Osage7,0.0,Exchange,1597030655,12,1
3637,i6xf4k,sserbianb,0.0,Is trading crypto the same as trading fiat forex?,1597030406,7,1
3638,i6xewm,0x7fEeD,0.0,We Give Up (Surrender),1597030382,3,1
3640,i6x3ng,bitchimpissingblood,-0.34,bitcoinwisdom alarm just woke me up from my nap,1597029109,0,1
3641,i6x0fq,NoIdeaWhatImDoing___,0.9226,Is it a good strategy to sell the high and buy the lows for btc? Or never sell and just buy the lows.,1597028752,68,1
3643,i6wp4d,Alternative-Reason13,0.0,Propriedade Fracionária de Imóveis,1597027501,0,1
3644,i6wmjv,demthiccthighs,0.0,I just came bois,1597027213,3,1
3645,i6wgco,tom98239273,0.0,V Shaped Recovery,1597026543,0,1
3646,i6wbi1,Ponypooh,0.0,"อาลัยด้วยรัก ""เปิ้ล หัทยา"" โอบกอดลูกๆ ""หนุน-หนัง"" ลอยอังคาร ส่งพ่อตั้วครั้งสุดท้าย",1597026011,0,1
3647,i6wae8,Auslanderr30,0.5719,"Happy 12,000 mf",1597025888,210,1
3648,i6waai,Boredguy32,0.0,Bitcoin 12k 2.0,1597025875,0,1
3649,i6w8g1,NvrIdle,0.0,12k has been conquered!!,1597025665,125,1
3652,i7v95p,JayRod082,0.0,A Summary for Today’s Price Action,1597164557,1,1
3653,i7v20f,dojogang,0.7003,How do you make a good profit?,1597163909,11,1
3654,i7uw99,JMyersDefense,0.4404,Bitcoin &amp; Street Crime: Why Boosting Home Security Is A Necessity And How To Protect Your Bitcoin,1597163392,1,1
3655,i7uv40,taglesswhite,0.0,Based driver,1597163288,0,1
3656,i7up15,KlydeFN,0.0,How do i get bitcoin under 18,1597162747,18,1
3658,i7ucgx,crypto_bot,0.0,"Bitcoin Network Status Update Tuesday, August 11, 2020",1597161651,0,1
3659,i7u900,ECOS_am,0.0,History of mining: Venezuela,1597161342,1,1
3660,i7u7ka,viajero_loco,0.296,"[""Ethereum wasn't designed to be [...] a global decentralized money. That's Bitcoin""]",1597161215,3,1
3661,i7u4ff,demirb,-0.4215,How to get money back from scam?,1597160941,10,1
3662,i7u2fa,viajero_loco,0.296,"""Ethereum wasn't designed to be [...] a global decentralized money. That's Bitcoin""",1597160745,1,1
3663,i7tyk2,JessDeclercq,0.0,P2P platforms,1597160389,6,1
3664,i7tsjp,barelyceliac,-0.3182,Bitcoin dumping,1597159790,9,1
3665,i7trv4,BittrexGlobal,0.5423,"MicroStrategy Buys $250M in Bitcoin, Calling the Crypto 'Superior to Cash'",1597159716,1,1
3666,i7tqtf,bronash,0.5574,Bitcoin featured in Rich Brian's latest music video,1597159615,18,1
3667,i7tj8u,WritingCrypto,0.0,Miner Outflows surged up to 525 BTC,1597158864,0,1
3668,i7tinj,42duckmasks,0.0,What are these Base58 addresses? Eli5?,1597158808,2,1
3669,i7t7c7,BittrexGlobal,-0.6222,Russia Backs Away From Total Cryptocurrency Ban,1597157633,7,1
3670,i7t5pk,nina_crypto,0.5859,Ledger User Interviews- Register to win a Ledger Nano X,1597157467,6,1
3671,i7sttt,nolith_ita,0.0,Understanding breez reserve balance,1597156198,5,1
3672,i7sszp,LumpaReverb,-0.4939,Can Satoshi steal my bitcoins?,1597156112,5,1
3673,i7skej,sirfaith,0.0,"INVESTMENT HOLDING OF ONLINE CASINO, POKER AND SPORTS BETTING",1597155252,0,1
3674,i7siun,BitSecret,0.1007,Are you tired of feeling like a second class investor when investing in Bitcoin / crypto? I was just reminded when posting a question at r/financialindependence. Let us stand up to their double standards!,1597155098,0,1
3675,i7sfht,abercrombezie,-0.25,Run on Bank ATMs in California - running out of Cash #itshappening,1597154765,15,1
3677,i7sb95,CarelessBowler5,0.0,Encryption for the Real World?,1597154348,2,1
3678,i7saw9,peercents,0.0,Coinmama Experience,1597154306,2,1
3680,i7s1oj,KayleighSosnowski,0.875,Business Intelligence giants MicroStrategy buy 21000 BTC worth $250 million,1597153369,1,1
3681,i7rxma,SaneFive,0.0,"Ex-Google hacker retrieves $300,000 in Bitcoin from encrypted file",1597152950,1,1
3682,i7rwbf,Chunky_Cheeze,0.0,Publicly traded company MicroStrategy invests $250 million in Bitcoin,1597152813,8,1
3683,i7rwb3,the420chronicler,0.9432,"MicroStrategy's operating cash flow and income have seen a significant decline over the last several years. Its PE ratio is above the industry average. Their Bitcoin buy could be viewed as a Hail Mary to save their business. As long as the business is a long-term going concern, it's a smart move.",1597152812,16,1
3684,i7rtm4,BuddhaTheHippy,0.0,Adam,1597152531,0,1
3686,i7rrqb,Niftygeek,0.4215,What is the future of bitcoin as a charity tool ?,1597152335,8,1
3687,i7rr6d,mccormack555,0.0,Objectivism: The Philosophy of Ayn Rand with Yaron Brook — What Bitcoin Did,1597152279,0,1
3688,i7rqys,RogerWilco357,0.0,Supply Cap,1597152258,0,1
3689,i7rmqe,UNBLOCKFEST,0.0,Ledger funds are gone !,1597151801,18,1
3690,i7r3t6,moelwardani,0.6696,Vixes is the best!,1597149753,0,1
3692,i7qs4c,BashCo,-0.4404,A mysterious group has hijacked Tor exit nodes to perform SSL stripping attacks [against Bitcoin users],1597148375,129,1
3693,i7qn68,boogaav,0.4199,Institutions officially started using bitcoin as a reserve asset! Huuuge move.,1597147768,1,1
3694,i7qm0k,Daveliuz,-0.25,Paytm Freezes Indian Bank Accounts Suspected of Cryptocurrency Trading: Report,1597147628,0,1
3695,i7qk1x,Bitcoin1776,0.9022,"Grayscale ad remix ‘We don’t give a fuck what you buy, you get rich either way. Just buy some.’",1597147397,2,1
3696,i7qb9b,-Saunter-,0.8553,"Best way to sell Bitcoin in Iran? I need to help my friend get salary, please help!",1597146293,12,1
3697,i7qabl,fleecedlightning,-0.296,Think I have old bitcoin somewhere. I have no idea where it is.,1597146169,8,1
3698,i7q9zc,StevenRad,0.7184,MicroStrategy becomes first listed company to buy $250M in bitcoin as part of its capital allocation strategy,1597146135,189,1
3699,i7q7ky,TheGreatMuffin,0.7964,MicroStrategy (largest independent publicly-traded business intelligence company) adopts Bitcoin as primary treasury reserve asset,1597145828,57,1
3700,i7pzul,FellowChildren,-0.4588,"Liechtenstein Financial Market Authority (FMA) has rejected an application for Union Bank to bring on Binance chief executive as a ""major"" shareholder.",1597144834,3,1
3701,i7pymt,felipecp1,0.0,Think about it,1597144684,0,1
3702,i7pyd2,FellowChildren,-0.4404,Binance denied ownership of bank in Liechtenstein. Failed to meet trust criteria.,1597144641,0,1
3703,i7pw2y,nugget_alex,0.0,"Chain Walking, Data Analytics &amp; Crypto Trends - Finding Edge With On Chain Analysis",1597144345,1,1
3704,i7psxk,pavlo36,-0.4588,Why does everyone talk about Bitcoin in such a short term?,1597143924,39,1
3705,i7psly,BitBlockBlog,0.0,Bitcoin &amp; Blockchain News for 11 Aug 2020,1597143879,0,1
3706,i7ps8v,Pleaseimbegginyall07,0.3182,please i'm begging y'all it's just 0.77c,1597143843,0,1
3707,i7prvf,iamthakurabhishek,0.8126,"India’s crypto trade volumes have soared since the Supreme Court lifted banking restrictions in March, with bitcoin peer-to-peer trade volume reaching an all-time high of $13.7 million in July.",1597143800,0,1
3709,i7p75b,BitcoinW0rld,-0.3182,"Bitcoin Trading Grows In Argentina, Brazil As Local Currency Weakens",1597140898,1,1
3710,i7p5jx,BitcoinW0rld,-0.8126,Bitcoin Mining Difficulty Increases As Miners Sell More BTC,1597140666,0,1
3711,i7oo4y,BusinessCow6786,0.0,2020 Is The Year For Bitcoin: Crypto Experts,1597138046,0,1
3712,i7oo3a,Lisa411527,0.3612,Investment advantages of bitcoin exchange rate market,1597138039,0,1
3713,i7okmn,Fabgotho,0.0,A Bitcoin Miner Heatstroked In His Sleep. This Is What Happened To His Organs,1597137537,1,1
3714,i7okj3,FastOutside,0.0,Calculating Bitcoin price on the time of transaction,1597137521,1,1
3715,i7ogwd,MMC5998,-0.5994,Can anyone present me with the bear case for Bitcoin?,1597136991,99,1
3716,i7o7sf,UBCStudent9929,0.0,Premining SHA-256 hashes,1597135610,27,1
3718,i7o6zl,God1com,0.0,Full node vs lighting node,1597135478,13,1
3720,i7nti1,__Yassine__,0.0,Any advice that you would have given to yourself when you were starting out?,1597133371,17,1
3721,i7now6,code_efficiently,0.0,Why are the software wallets still used?,1597132678,6,1
3724,i7nig1,polagon,0.2023,Top 6 Decentralized Exchanges in 2020 With Unique Features,1597131679,0,1
3725,i7ngg4,siddude11,0.0,What are your thoughts on Adam Back?,1597131392,1,1
3726,i7nest,NaturalConstant4,0.4404,Increasing my bitcoin holdings by doing useful work,1597131143,12,1
3727,i7ncg8,crypto_druid,-0.4404,How would you describe what Bitcoin and block chain is to someone who doesn't know anything about it?,1597130776,20,1
3728,i7nbv9,989x4000,0.4767,Bitpay finally allows bc1 Segwit wallets. The ability to send 1 sat/byte transactions. The ability to send Unconfirmed Funds.,1597130683,8,1
3729,i7n4og,Daveliuz,0.0,Chainlink Competitor Band Token Grows 300% in 7 Days Setting New ATH,1597129644,0,1
3730,i7n1pz,rBitcoinMod,0.0,"Daily Discussion, August 11, 2020",1597129243,218,1
3731,i7n1ae,989x4000,0.4767,Bitpay finally allows bc1 Segwit wallets. The ability to send 1 sat/byte. The ability to send Unconfirmed Funds.,1597129188,0,1
3732,i7mtbo,elmoelmo69,0.6369,Best way to cash out in Hong Kong?,1597128056,9,1
3733,i7mr1x,TheDyanmicDoc,-0.0798,Urgent. Do not be like me.,1597127741,19,1
3734,i7mjja,Leader92,0.5574,Is GetSpendl trustworthy?,1597126679,0,1
3737,i7m5by,MohsenMad,0.0,USD-D to USD-T,1597124769,2,1
3739,i7lt8f,district999,0.0,So could this be the start of a new cycle?,1597123211,3,1
3740,i7ladj,ethan_bitaroo,0.0,Evolution of a Toxic Bitcoin Maxi,1597120846,0,1
3741,i7l7un,NambiarAshish,0.34,Why decides the value of bitcoin?,1597120547,13,1
3743,i7kzv3,varikonniemi,0.0,Multipath TCP on lightning,1597119591,11,1
3744,iasm0l,Epfxtrading,0.0,Are you new to bitcoin trading?,1597585724,0,1
3745,ias9t5,RalphAnderson_,0.0,Hmmm🤔🤔,1597584231,5,1
3746,ias9r3,TheRealYuno,-0.5678,Why are the sites used to buy/sell bitcoin so fucking terrible?,1597584225,31,1
3747,ias24l,WaggishNickel,0.9001,"Max Keiser taunts Warren Buffet, saying he will buy bitcoin at $50,000 as the Berkshire Hathaway billionaire offloads banking stocks to buy Gold",1597583293,167,1
3748,iaryh3,TNosce,0.6908,"If I ran a nice, what is the profit for me doing so?",1597582864,9,1
3749,iarpdf,MediaPrestigious8342,0.4019,BITCOIN OR X R P for donation or Support,1597581742,1,1
3750,iark0d,TariqKilani01,0.0,Uniswap on mobile,1597581065,1,1
3751,iarji8,mccormack555,0.0,Bitcoin Vs Ethereum with Samson Mow &amp; Vitalik Buterin — What Bitcoin Did,1597580997,51,1
3752,iarhre,MotherPop9,0.0,Fundo ambiental,1597580767,0,1
3753,iarhmm,Background_Ad_1928,0.0,Earn BTC with Cryptoperhour,1597580748,0,1
3754,iare68,DogsRgud4U,0.0,Bring the beach to your backyard by installing a luxurious sand pool!,1597580333,0,1
3755,iarbnl,simplelifestyle,0.0,"Front Page of Reddit right now: "" US Postal Service files patent for a blockchain-based voting system"". (NP X-Post)",1597580008,3,1
3756,iarbfx,minimally__invasive,0.7184,⚡️ Let's talk Lightning: What's your favorite Lightning client for Android / iOS / Windows / macOS and why?,1597579978,25,1
3761,iar2do,James-green1,0.5319,"ARE YOU INTERESTED IN EARNING EXTRA INCOME EVERY 24 HOURS OR WEEKLY £✓€✓ EARN 1,000$ TO 10,000$ EVERY WEEK WITH MY COMPANY, INBOX ME AND I WILL GET YOU REGISTERED",1597578775,1,1
3762,iaqzoz,ZAppa2103,0.0,Am I the only only?,1597578376,1,1
3763,iaqz4u,KayleighSosnowski,0.0,"Hong Kong Police captured three Bitcoin ATM robbers who stole $30,000",1597578294,2,1
3764,iaquxx,Daleedge,0.0,A new way of mining,1597577688,0,1
3765,iaqts3,nugget_alex,0.2023,"This Week's Top Bitcoin, Crypto, Global Finance &amp; Economic News",1597577532,1,1
3766,iaqs0e,SaneFive,0.0,How a second wave of coronavirus will impact Bitcoin,1597577262,2,1
3767,iaqrpv,Ponypooh,0.0,"""ดัง พันกร"" ร้องเพลงเสียงเพราะเหมือนเดิม แต่คลิปนี้ทำคนโฟกัสไปที่ขา",1597577219,0,1
3768,iaqpze,ZAppa2103,0.4404,Hope,1597576962,1,1
3769,iaqjo1,Antelope_Bulky,0.0,Earn BTC through our mining system,1597576016,0,1
3770,iaq8lp,lamcouz,0.0,去中心化金融2.0 (Aegis Defi),1597574296,0,1
3771,iaq3sp,RalphAnderson_,-0.2247,Quite tricky...,1597573548,1,1
3772,iapsrn,Tulipan81,0.0,VanityMnem is the new Vanitygen,1597571821,3,1
3773,iappap,sserbianb,0.0,What will become of your BTC when you just hodl until it becomes a daily transactional currency?,1597571260,20,1
3774,iapmf6,Bitcoin_to_da_Moon,0.0,Bitcoin Fee Estimator,1597570804,4,1
3776,iapeap,parakite,0.4019,"LiFi is coming to @Liquid_BTC via asset-based lending smart contracts. Authored by @dmpsim, the paper ""Asset-Based Lending smart contract for Liquid network""",1597569500,6,1
3777,iapdce,jamespunk,0.0,Monthly update of stacking sats,1597569349,10,1
3778,iaovmd,MarilynMonero21,0.0,Bitcoin &amp; Black America with Isaiah Jackson,1597566397,2,1
3780,iaoq3p,BehestKarov,0.0,THE FORCE IN BITCOIN book,1597565478,1,1
3781,iaooo2,Daveliuz,-0.7096,"US Regulator Charges Tech Firm, CEO in $5 Million ICO Fraud Case",1597565228,0,1
3782,iaohkh,nastemusic,0.0,This guy is almost always right.,1597564004,0,1
3783,iaoei9,parakite,0.0,QuantaBytes: A Survey of Bitcoin Transaction Types,1597563498,2,1
3784,iaodig,stormcrypto,0.0,🔥Earn crypto just Watch video,1597563338,0,1
3785,iaoctk,iamcoderisk,0.3612,Is bitcoin hosted on server like vps?,1597563219,2,1
3786,iao0g5,rBitcoinMod,0.0,"Daily Discussion, August 16, 2020",1597561210,92,1
3787,ianwl3,Competitive-Whole851,0.0,Imagine $OXT,1597560576,2,1
3788,ianki6,Set_Main,0.0772,Want 1 bitcoin,1597558729,1,1
3789,ianc0c,Official_stiltz,0.0,ROOBET BITCOIN USERS,1597557496,0,1
3790,ianb52,devilnode,0.2023,A mask with dollars gifted by my girlfriend. I had to break up. No fiat in da house.,1597557362,1,1
3792,ian5b7,animuz11,0.2263,What is 1 satoshi is worth more than 1 cent?,1597556521,18,1
3793,iamlzc,Abroad-Serious,0.6369,"The latest Bitcoin bug, interested parties leave mailbox",1597553906,0,1
3794,iamg9w,Schmeckleberry,0.7184,Cheapest place to buy bitcoin with immediate release,1597553112,16,1
3797,ialwbt,enew82,0.0,What if Bezo’s bought 50% of Bitcoin ??,1597550564,23,1
3798,ialvkp,enew82,0.0,What is Beso’s bought 50% of all BTC,1597550473,0,1
3799,ibs47x,midtownoracle,0.0,We are the early adopters.,1597716323,1,1
3800,ibs3g7,MarilynMonero21,0.0,Bitcoin &amp; Black America,1597716246,23,1
3801,ibrsvq,chessiechoice,0.0,Bitcoin bet,1597715187,6,1
3802,ibrla9,Supergenius18,0.8847,I want to invest in Bitcoin but I don't know how I feel about making the early adapters rich. Should I care?,1597714389,20,1
3803,ibranf,TheSoulFactor,0.0,5 Days ago I said BTCs about to do a little pop... And Here it is. It Happened!,1597713274,7,1
3804,ibr8uk,tiotol,0.4215,What are bitcoins really? I'm having a hard time explaining to a friend.,1597713084,31,1
3805,ibr6k5,Daveliuz,0.4767,Bitcoin Cash and Litecoin Trusts from Grayscale Investments Begin Trading,1597712845,0,1
3806,ibr5cg,TecuaniTec,-0.5267,"Why invest in Bitcoin? 1. Bitcoin critics turning a 180° 2. Bitcoin is #34 in world currencies, beating New Zealand 3. Russia Dumping U.S. Dollar 4. Warren Buffet sells Banks buys GOLD🥇 5. It's just getting started 📉",1597712718,11,1
3807,ibr1w5,Personal_Potential_7,0.0,Bitcoin private key recovery,1597712385,1,1
3808,ibqtop,demthiccthighs,0.0,HODL BOIS! HODL!,1597711526,12,1
3809,ibqr5t,Yuri_Jai,0.128,*NEW* 12x18 in. Deconstructed/Decentralized Bitcoin Art Print on pearlized luminous paper,1597711265,1,1
3810,ibqizf,Ituglobal,0.1027,"Ethereum Eyes a New High of $500, Battles Resistance at $440",1597710417,0,1
3811,ibqeof,21suns,0.0,"Can we do ""odometer"" posts? I caught a snapshot when the price was $12345.",1597709969,0,1
3812,ibq6lw,pixel4209,-0.0601,IDK if it's worth it,1597709152,19,1
3813,ibq4pj,HenryK81,-0.3802,"LIVE Bitcoin Solidly Breaks Critical $12,000 Resistance | MUCH CRYPTOCURRENCY NEWS- Ethereum &amp; More!",1597708964,1,1
3814,ibq034,couscous200,-0.6369,How to speed up a transaction that’s already been sent. Sent with low fees by accident,1597708521,7,1
3815,ibpk2x,that_stoner_guy,0.0,"Just bought 2 bitcoins, am I doing this right?",1597706954,7,1
3816,ibpbwm,tiotol,-0.2263,"Relationship between nodes, transactions, and blocks?",1597706134,3,1
3817,ibp9qu,TheCryptomath,0.7184,Buy Bitcoin,1597705921,0,1
3818,ibp7qt,fuck12_2001,0.6124,"Please help, CashApp to Mycelium transaction not working",1597705729,0,1
3819,ibp6zz,BashCo,0.0,Bitcoin Audible: Read_429 - Discovering Bitcoin #5 - Digital Scarcity [Giacomo Zucco],1597705659,0,1
3820,ibp6sa,Daveliuz,-0.8176,"Ethereum Classic 51% Attack: Okex Crypto Exchange Suffers $5.6 Million Loss, Contemplates Delisting ETC",1597705637,0,1
3821,iboqip,that_stoner_guy,0.0,Question about running a full node,1597704086,18,1
3823,ibnx8k,buyingthediptoday,0.0,"A technical analysis of Bitcoin, Ethereum and some Altcoins.",1597701490,1,1
3824,ibnwyr,Noduz,0.0,2 guys at two Bitcoin farms in Bulgaria stole 1.25 million EUR in electricity from town network in just over a year.,1597701467,6,1
3825,ibnw5h,pabloflores1230,0.0,Bicoin,1597701391,0,1
3827,ibnu1d,aemmeroli,0.0,Cold storage in the future,1597701203,4,1
3828,ibnrfz,intothecryptoverse,0.0,Bitcoin price prediction using logarithmic regression,1597700981,3,1
3829,ibnop8,Leader92,0.0,Power of lightning .. at a glance.,1597700723,34,1
3830,ibng5w,leoparker1,0.34,"📊Bitcoin manager 💲Binary option trader 📈Bitcoin investment 🔷 Earn $5,500 daily, DM📩📩 For info trading 405-504-3450",1597699959,0,1
3831,ibn5je,stanhopeofficial,0.0,Got it.,1597699042,1,1
3832,ibn42h,seamonster82,0.0,The revolution is just starting.,1597698914,34,1
3833,ibn27y,that_stoner_guy,0.0,Just bought my first bitcoins,1597698759,0,1
3834,ibmzst,rpmusictv,0.0,Why is there such a discrepancy between coin star btc price and the actual price coin star almost $1000 higher???,1597698551,12,1
3835,ibmzsn,thebawller,0.0,Tip bot in other subreddits,1597698551,0,1
3836,ibmyf1,Daveliuz,0.0,"$RMPL Launches, Revolutionizing the Cryptocurrency Market with a Decentralized Elastic Supply Model",1597698430,0,1
3837,ibmus7,Grimantali,0.0,Cryptocurrencies Correlation Tool?,1597698123,9,1
3838,ibmfzh,fillet_b,0.0,"If you listened to Vitalik ETH vs BTC debate, you'd know (Etleneum) makes sense",1597696874,3,1
3839,ibmad1,atrueretard,0.2263,Bitcoin now worth more than all of the New Zealand Dollars in existance. #34 largest currency in the world.,1597696392,42,1
3840,ibm4ge,PodClips,0.0,Abra CEO Bill Barhydt &amp; Anthony Pompliano Think Bitcoin Could Hit $100K By the End of 2021 (45-second audio clip),1597695902,3,1
3841,iblwd1,yasuomoi,0.0772,I divided Gold market cap by number of Bitcoins. We are living in a simulation.,1597695231,0,1
3843,iblv0f,Boredguy32,0.4329,What percent of your net worth is in Bitcoin? Over 50%? 25-50%? 10-25%? 5-10%? or less than 5%?,1597695118,20,1
3845,ibligi,Leading_Zeros,0.6369,Corona Bailouts: The Greatest MONETARY EXPERIMENT in History? - VisualP...,1597694040,0,1
3847,ibkvrs,johnyzee,0.0,China and Russia ditch dollar in move towards ‘financial alliance’,1597692110,17,1
3848,ibkl75,heist95,0.9359,The 82-year-old former head of investments at Prudential is bullish on Bitcoin as a hedge against inflation. Expect a huge influx of money into Bitcoin as older investors start using it to protect their wealth!,1597691210,4,1
3849,ibkkl3,Rmicoli,0.6792,Please help!!,1597691160,0,1
3852,ibk7uv,Bitcoin_Magazine,0.3595,Tomorrow is Technical Tuesday with Bitcoin Magazine! Join us for a RaspiBlitz 3 Hour Deep-dive at 1-4pm EDT,1597690113,0,1
3853,ibk0u1,PayDepot,-0.1027,NEW 1 Pay Depot Bitcoin ATMs at Manville Food and Tobacco - NJ,1597689527,4,1
3855,ibju0c,gluegunfun,0.3612,Been out the game for over 2 years. Buying my first bitcoin ($500) today or tomorrow. Ready to hold and not trade myself to zero.,1597688970,5,1
3856,ibjtj5,WaggishNickel,0.0,"Bitcoin's hash rate hits a new all time highs as the king cryptocurrency breaches $12,400 - a price not seen in over a year",1597688929,1,1
3857,ibjhee,henryyoung42,0.0,Bitcoin payments over XMPP,1597687959,1,1
3858,ibjf7q,Ed__Atts,0.0,Apparently we're going up.,1597687779,0,1
3859,ibja0m,77szrt,0.0,40K this year. 400K next year.,1597687366,1,1
3860,ibj76o,varikonniemi,0.0,blockstream satellite with flat panel antenna + SDR,1597687135,2,1
3861,ibj57h,Treeko493,-0.296,Double spend no rbf tag,1597686975,13,1
3862,ibj4zd,sillydrunkstoner,0.34,If Adam back is confirmed at some point to be Satoshi how will this affect the value?,1597686955,1,1
