,id,author,vader,title,created_utc,num_comments,score
0,i318aq,fkee31e70c,-0.1926,Friendly reminder: Don't buy bitcoin,1596475388,148,0
1,i30wy5,Daveliuz,-0.5809,Indians Five Times More Likely to Suffer Crypto-Related Hacks: Report,1596474440,0,1
3,i30qhp,freebit,0.0,Satoshi Nakamoto? Where is he/she/them? Where are their bitcoins?,1596473913,5,1
5,i30m9v,SecretFederal7279,0.9616,"Amazon's success largely stems from its innovative technologies and practices, many of which were championed by its CEO, Jeff Bezos. ... This innovative technology was a huge investment for the e-commerce giant—one that fostered exceptional results. Because it is gaining everyone's trust.",1596473555,0,1
8,i30e41,ArchPower,-0.5423,So I'm about to drop my 401k into Bitcoin. Talk me out of it.,1596472848,157,1
9,i30czn,NeedTissuez,-0.4574,Still Gold Advice. Don’t be discouraged!,1596472746,1,1
10,i30cvl,JohnnyDrama68,-0.5106,"I'm an idiot, I thought I was being slick",1596472737,208,1
11,i30be6,KayleighSosnowski,0.0,Swiss Bank to provide Bitcoin Trading and Custodial Services,1596472615,4,1
12,i304ew,L1sak24,-0.1531,I’ve made a playlist for all the BTC enthusiasts. (Short story and a description in the post),1596472008,5,1
14,i2zp5l,RaviPatel251990,0.0,Wallpaper,1596470645,0,1
15,i2zi6y,psyco_llama,0.3612,"HODL'ers be like, I still made more this week than last week...",1596470016,2,1
16,i2zff3,Purple1Rain,0.0,Why can’t the code be changed to make more than 21 million BTC ?,1596469757,76,1
17,i2zecg,sunkist5,-0.4588,Bitcoin after every dip,1596469654,16,1
18,i2zdph,CryptoBucksApp,0.4767,Wise words from Eric Schmidt,1596469592,0,1
20,i2z92n,RealSimZor,0.34,Finally got a secure way to store all the bitcoins,1596469169,1,1
21,i2z7b2,Gigantile,0.0,"Daily Crypto Brief for Monday, August 3, 2020",1596469012,0,1
22,i2z5x5,LightningPlus,0.0,Pomp Podcast #352: Congressman Tom Emmer on Bitcoin and Decentralization,1596468879,1,1
23,i2z3t6,enoploteuthidae,-0.5719,How do police seize criminals' BTC?,1596468679,16,1
24,i2z3pc,bitaps,0.0,Bitcoin mixer tool released,1596468673,0,1
25,i2z0rm,quickquestionhalp,0.0,Has it really been 3 years?,1596468398,17,1
26,i2z011,BITCOINBITCHESBUD,0.0,EXIT THE $YSTEM,1596468332,0,1
28,i2yny5,Traderlo,-0.5574,Anyone know of any new BTC shit forks?,1596467245,11,1
30,i2ynvm,acertenay,0.8807,What is the best place to buy bitcoins online in the Netherlands?,1596467239,17,1
31,i2ymok,attolini,0.0,Why bitcoiners distance themselves from shitcoiners,1596467134,1,1
32,i2yhvj,questioningmoney,0.6124,Audio Newsletter - Questioning Money (Bitcoin friendly),1596466687,0,1
33,i2y7lk,[deleted],0.5792,Moderators? My posts suddenly require approval upon submission! have I done something?,1596465681,0,1
34,i2xwtb,tom98239273,0.4404,Bitcoin is already DeFi thanks for coming to my Ted Talk.,1596464610,24,1
35,i2xwnn,Herjaguar,0.5859,Today is an amazing day for MCO users.,1596464595,2,1
36,i2xtf7,NormalResearcher,-0.4588,I was banned from r/bitcoincash,1596464262,1,1
37,i2xt2j,thedowcast,0.0,Bitcoin research prediction algorithm using the location of the Sun,1596464223,2,1
38,i2xrwe,thesoleprano,0.0,Seed phrase recovery,1596464102,20,1
39,i2xotf,shalev396,0.0,pi network,1596463790,0,1
40,i2xnc3,Daveliuz,0.0,"Alleged Twitter Hack ‘Mastermind’ Owns $3 Million in Bitcoin, Bail Set at $725K",1596463643,0,1
41,i2xiaq,[deleted],-0.5009,Who could imagine Google Maps could be so disoriented?,1596463157,0,1
42,i2xhxs,ChangeNow_io,-0.5009,Who could imagine a map service could be so disoriented?,1596463116,1,1
43,i2x9p3,CoinjoyAssistant,0.6369,Best BTC analysts of 2020,1596462230,1,1
44,i2x8ed,WaggishNickel,0.0,"Goldman Sachs: Gold will hit $2,300 by 2022; but what of bitcoin (given its absolute scarcity)?",1596462101,11,1
45,i2wxlx,Shenron2020,-0.875,"How does bitcoin find a Block with 1 transaction, the (6.25 Newly Generated Coins) awarded to a miner? No other transactions inside the block. These blocks have appear immediately after the previous block has been found. 3 of these quickly mined blocks have appeared today.",1596460910,0,1
46,i2worw,chiboy01,0.0,Invest in btc,1596459970,1,1
47,i2wn1a,chiboy01,0.2263,The Easiest Place to Invest - Gladeoption Investment Limited,1596459781,6,1
48,i2wdkc,Mc_Luol,0.296,Can you be traced through the money you put in a bitcoin ATM?,1596458669,23,1
49,i2wczo,finn9021,-0.4939,"MTGOX Claim # starting with ""a"" - Am I screwed?",1596458604,1,1
50,i2wah6,SharonRobles,0.4019,We compiled a database of 11k+ investors to help you raise your seed round 🤑,1596458310,1,1
51,i2w7ri,LegendzEnt,-0.6835,"Just bought this bad boy installed @ Palmers inn Restaurant 28660 Harper Ave, St Clair Shores, MI 48081 invest in the Future of Money. A lot of People do not trust exchanges",1596457990,46,1
52,i2w5r1,jmag14,0.4404,Recently been doing some research into bitcoin and got a Coinbase acc to test the waters get an idea of this world. Using only Coinbase is there margin to make a decent profit or are other methods preferred ?,1596457736,17,1
53,i2vz1d,RickSanchezIRL,0.0,10 million dollar bitcoin,1596456940,11,1
54,i2vx5s,wmredditor,0.2263,17-year-old Twitter Hacker Has Over $3 Million Worth of Bitcoin (BTC),1596456700,3,1
55,i2vu0x,InfiniteExceptions,-0.25,Can I cancel -reindex and continue later?,1596456325,3,1
56,i2vrsy,polagon,0.0,12 of the most Bitcoin-friendly banks in 2020,1596456066,6,1
57,i2vpwg,rachidafr,0.4404,Is the Bitcoin Bull Run About to Start?,1596455825,14,1
58,i2voog,Mapumbu,0.4588,How can I earn interest whilst HODL'ING my Bitcoin?,1596455670,15,1
60,i2v6i3,BitBlockBlog,0.0,News Update for 03 Aug 20,1596453268,0,1
61,i2v0d0,rBitcoinMod,0.0,"Mentor Monday, August 03, 2020: Ask all your bitcoin questions!",1596452421,25,1
62,i2uyxm,btsfav,0.6696,Bitcoin Experiment: Financial Freedom with Faucets?! Week 3,1596452218,4,1
63,i2uwur,GlassMeccaNow,0.6124,Undervalued meme format,1596451916,0,1
64,i2uvop,bitcoin_baklava,0.0,CoinJoin change???,1596451748,11,1
65,i2ur7r,DFroody,0.0,It's been 6 days since i purchased bitcoin for the first time....,1596451099,243,1
66,i2upr7,PabloClarke,-0.6486,Beware of These Bitcoin Tricks and Scams,1596450876,0,1
67,i2umsy,KayleighSosnowski,0.0,"17-year old Twitter hacker holds 300 Bitcoin – his bail set for $750,000",1596450442,14,1
68,i2um84,miaperla,0.0,A Thorough Understanding Of Cryptocurrency Exchange Development,1596450350,0,1
69,i2uku7,tldr-hodl,0.4019,Monday Art Special - Coldkey by Lucho Poletti,1596450163,7,1
70,i2ukbk,tldr-hodl,0.0,Monday Art - MoonLambo,1596450087,2,1
71,i2uk9a,tldr-hodl,0.0,Monday Art - Andrea Plaza,1596450079,1,1
72,i2uk4n,tldr-hodl,0.0,Monday Art - Ancora,1596450064,2,1
73,i2ue77,emilstyle91,-0.6486,Will crypto ever rise again or they are simply dead?,1596449150,4,1
74,i2ubd2,Qawa3id,0.0,IOS14,1596448734,0,1
75,i2u193,grabbertdi,0.0,Russia bans cryptocurrency as a payment form,1596447163,59,1
76,i2u06y,No-Helicopter-909,0.0,2020 08 03 16 50 IMG 0321Xinjiang@travel,1596446997,1,1
77,i2tzm9,Coinviva,0.0,Bitcoin Market Weekly Report - Week of 03/08/2020,1596446904,0,1
78,i2tyc7,KodeineKrazyyy,0.0,Coinbase BTC via Chime,1596446703,2,1
79,i2txf3,bitcoin_ft,-0.1027,CWT travel to pay $4.5 M in Bitcoin as ransom to hackers,1596446551,0,1
80,i2tgco,owen5669,0.6369,Bitcoin is the best place to invest..,1596443797,1,1
81,i2tfu7,artashi_,0.0,Bitcoin was just called magical internet beans by someone. I forgot how far behind the general pop. still is.,1596443713,96,1
82,i2sya8,HunterYT,0.1531,"I see price predictions of bitcoin hitting 100k in 5 years possibly. Now if that happened, wouldn't that mean that by 2140 once the last bitcoin is mined, the price is ridiculously high?",1596440927,104,1
83,i2seqq,rBitcoinMod,0.0,"Daily Discussion, August 03, 2020",1596438009,143,1
84,i2rud9,olbed,0.0,Made BTC ticker with candle charts (websockets for updating charts and price),1596434922,0,1
85,i2rtyz,cryptosp,0.0,Debunking Common Bitcoin Myths by ARK invest,1596434869,4,1
86,i2rsfr,tjknocker,0.0,How do I explain to someone who doesn’t know anything about bitcoin that there will never be more than 21 million bitcoins?,1596434637,64,1
87,i2rd0y,Leader92,0.0,"It's Bitcoin, don't get fooled like I did with any other coin, no matter their CMC.",1596432417,0,1
88,i2r9kp,Federer107,0.6369,What is the best and most reliable Decentralized Exchange?,1596431939,26,1
89,i2r0tn,nich35,0.4767,Email List by Country - Worldwide Email Lists-Country Wise List,1596430786,1,1
90,i2qkdc,WillWam,0.3182,Will Bitcoin even be a viable payment solution in 10 years?,1596428665,6,1
91,i2qc9p,Daveliuz,0.0,"Publicly Traded Firms Launch New Mining Rigs, Less Hashrate Than Competitors",1596427643,0,1
92,i2q8zu,dumpstersludge,0.0,Where did everyone from r/darknetmarkets go?,1596427255,8,1
93,i2q6sf,Alternative-Reason13,0.0,5G e IA,1596426992,0,1
94,i2psem,amaplz23,0.0,Is Blockchain enough proof for filing taxes?,1596425246,10,1
95,i2pnme,eerietheery,0.0,I've been telling my family about Bitcoin for 8 years and today I get a message from a sibling. Somehow it's still a mystery.,1596424690,0,1
96,i2pkpi,amaplz23,0.0,am i too new to post,1596424339,0,1
97,i2ph06,Victoriaeddie,0.3612,I’m here to teach you something that can make you extra cash at your own comfort zone,1596423906,0,1
98,i2p0au,americanthaiguy,0.0,Bigger than the Twitter hack?,1596421992,1,1
101,i4yp14,tazuno,0.7184,How do I buy bitcoin,1596743008,10,1
102,i4ymoi,AiSatan,0.2244,Be careful! Another Elon Musk Bitcoin giveaway live at youtube.,1596742803,2,1
103,i4ylwi,intothecryptoverse,0.5994,Bitcoin bull market starting?,1596742731,0,1
104,i4y54a,dannyhb88,0.4019,Help,1596741280,44,1
105,i4y3sh,BTCUser_,0.5994,Are We in a Crypto Bull Market?,1596741160,11,1
106,i4y010,Daveliuz,0.0,Bluehelix Global Expansion – Strategically Cooperates with Japanese Licensed Exchange Xtheta,1596740841,0,1
108,i4y005,Daveliuz,0.0,Grandmas On Lightning,1596740839,0,1
109,i4xt0p,bitficus,0.0,"Watch out, they sting!",1596740276,0,1
110,i4xonj,bassbeatsbanging,0.0,Anyone having issues with BitPay (or bitcoin being slow,1596739887,6,1
111,i4xmnz,dvsdan,-0.4767,Could the CCP 51% attack bitcoin?,1596739715,19,1
112,i4xkpq,Rattlesnake_Mullet,0.0,Hodlers watching the charts right now,1596739546,0,1
113,i4xi1m,99dsb,0.0,How am I able to receive bitcoin through Lightning on BlueWallet without opening a channel?,1596739322,10,1
114,i4xchl,Ru8iX123,0.0,Laws in India,1596738855,3,1
115,i4x7fe,justinCrypto,0.0,Question,1596738416,5,1
116,i4wx75,nick-bravo,0.296,Question about creating 'fake'-transactions and about making changes to the Bitcoin protocol,1596737541,8,1
117,i4wtoc,Daveliuz,-0.4767,$5.6 Million Double Spent: ETC Team Finally Acknowledges the 51% Attack on Network,1596737240,0,1
118,i4wsfo,kurdebolek,0.6689,"[May 19, 2011] lifehacker: ""And right now, the BitCoin is trading very high! As I write this, one BitCoin is worth $7.5. Not too shabby at all.""",1596737130,14,1
120,i4wq0z,YungNillaP,0.0,Euro Pacific Bank for Americans,1596736926,0,1
121,i4wlty,bitrawr,0.25,Why is Bitcoin Going Up? A Comprehensive Analysis,1596736547,1,1
122,i4wfl8,EmillZ247,-0.1027,Bitmart exchange told me to pay to re open my account is that possible in the crypto space ?,1596735991,1,1
123,i4wblx,simplelifestyle,-0.3595,No inflation! ...Got Bitcoin?,1596735648,0,1
124,i4w8o4,bin0c,0.4902,DHL just dropped off my first Ledger. Protecting my investment and hodling are my two biggest takeaways so far. Thanks for all of the tips over the past month everyone.,1596735387,95,1
127,i4w0hd,israeliboy95,0.0,John Mcafee sells out,1596734676,10,1
128,i4vx92,Ethbull_io,0.0,Ethbull Officially Launch The NEW FORSAGE!,1596734396,0,1
129,i4vvrm,Chl0r0PHIL,0.0,Use Multisig,1596734264,38,1
130,i4vrya,Purple1Rain,0.0,BTC vs BTC cash,1596733932,15,1
131,i4vocm,OohpeUL,-0.504,Block 642499 - 1 Transaction? What happened?,1596733624,5,1
132,i4vlz8,bitdex,0.2263,$1 Billion Worth of Bitcoin Just Sent For a $4 Fee,1596733422,7,1
133,i4vjwm,genieforge,0.0,BTCIOT - Solar Panel Full node interview with Chimezie Chuta,1596733258,1,1
134,i4v5kd,freebit,0.0,Supply scarcity reminders for all.,1596732010,18,1
135,i4v2rw,Haigfish,0.0,Miner fee question,1596731759,4,1
136,i4uwm9,ggabriel8,0.0,Just Released a new episode on my personal relationship to economics and how that lead me to Bitcoin.,1596731214,2,1
137,i4uwd7,BitBlockBlog,0.0,BitBlockBlog News (6 AUG 20): Bitcoin IRA,1596731190,0,1
139,i4umda,vmrey,0.1779,Goldman Sachs names new head of digital assets in bet that blockchain is the future of financial markets,1596730290,31,1
140,i4ujbo,RFV1985,-0.7096,My bank has yet again lowered the “staking reward” for the shittiest shitcoin of them all. Guess that means I’ll be moving even more USD to BTC.,1596730017,0,1
142,i4ufu8,ReedWommack,0.4404,AlienCoin --a useful thought experiment...,1596729714,20,1
143,i4udf7,EllisMurphy1,0.7184,Is it possible to buy bitcoin under 18,1596729506,0,1
144,i4u8yv,lizardscum,0.3612,Send me your hard earned bitcoin. Thanks in advance,1596729091,1,1
146,i4u70q,PettheBitcoinPan,0.7184,Time to buy Bitcoin?,1596728913,1,1
147,i4u6t0,selfmade000,-0.128,Bitcoin Transactions - Unconfirmed Parent,1596728893,0,1
148,i4u6eh,saffron1990,0.4404,Hear me Hear me. The bull run is upon us,1596728854,0,1
149,i4u5wo,CoinjoyAssistant,0.0,Elon Musk and bitcoin,1596728808,1,1
150,i4u5el,brianddk,0.128,PSA: Low fee TXNs still clear every day from 4am to 8am UTC,1596728763,15,1
151,i4tzyl,grittygatorr,0.0,"Americans are “pouring” cash, stimulus checks into Bitcoin and gold",1596728253,46,1
152,i4tww1,tmoore711,0.0,Elitist Bitcoin owners,1596727968,13,1
153,i4twk3,onwardstothem00n,0.0,I think I've bet my job on bitcoin,1596727936,0,1
154,i4tv6q,mbrookson,0.4939,Throwback 2013 - feel Kevin O’Leary’s excitement for Bitcoin,1596727808,6,1
155,i4ttqq,SaneFive,-0.3182,Lost Bitcoin: 3.7 million Bitcoin are probably gone forever,1596727669,162,1
156,i4tr71,WhoCaresForUsernames,0.5267,"One more new bitcoin user, share bitcoin share knowledge.",1596727428,0,1
157,i4tmr4,bitdex,0.0,$30 Million In BTC And BCH Seized By German Authorities And FBI,1596726994,5,1
158,i4te9u,VampireVlad,0.0,Boxed gallery,1596726214,0,1
159,i4tbak,rnvk,0.0,Fully Noded &amp; Coldcard - Single Sig Tutorial,1596725945,0,1
160,i4suza,Bitcoin_Magazine,0.1832,“You’ve printed trillions of dollars and continue to print more and more with no end in sight. Do you really think this is going to end well?” Steve Mnuchin and Donald Trump:,1596724385,2,1
161,i4su8n,Topinger,-0.037,"Bitcoin will become more important and stronger after Coronavirus crisis, Says US Congressman",1596724319,5,1
162,i4srlp,micklep2012,0.0,£9k!!! Woooo,1596724058,1,1
163,i4spes,nick-bravo,-0.3182,Russian Gas for Germany (or Europe?) - Assets and property threatened to be frozen and seized,1596723832,1,1
164,i4somf,nick-bravo,-0.3182,Russian Gas for Germany (North Stream 2) - Assets and property threatened to be frozen and seized,1596723753,1,1
165,i4snfl,GloMan24k,0.0,$25-$200,1596723640,0,1
166,i4slsc,Theonlytazz2,0.0,We did it guys!,1596723477,0,1
167,i4sjgf,Tbonesteakumz,0.0,"Pulled the trigger, 1BTC",1596723248,437,1
168,i4sita,QCryptoWeb,0.0,Blockchain/Crypto roles,1596723183,1,1
169,i4se9q,zavulcan,0.7184,Where or how can I buy a small amount of Bitcoin based in the UK without having to sign up to any sites or anything?,1596722736,17,1
170,i4s9nf,Bosstana,0.2185,"US ,UK ,CANADA ,EU ,AUSTRALIA ETC... Bank logs available,FULLZ , CC,DUMPS ,DUMPS WITH PINS That has high balance of 9500$ and can be cashout through the ATM available at cool prices ....DM ME NOW... TEXTNOW @+1 (740) 202-8862,, TELEGRAM @Kranium20",1596722272,0,1
171,i4s8kv,SirSquax,0.0,Bitcoin 10.000€ !!,1596722150,5,1
172,i4rz5q,BashCo,0.5106,Fun with Bitcoin: Interview with NICO aka @Bitvolt7,1596721140,0,1
173,i4rxyg,Enqrypted_,0.0,Buying crypto under 18?,1596721020,4,1
174,i4ribn,mcfcxdylan,0.296,Does anyone know where I can transfer money from my PayPal to bitcoin?,1596719335,12,1
175,i4rhd5,Daveliuz,0.6705,OKCoin Awards Latest Developer Grant To Marco Falke,1596719231,0,1
176,i4rc3w,MostBoringStan,-0.128,Asking scammers the tough questions,1596718659,1,1
177,i4qz8m,bdinu89,0.0,7 Cryptocurrency Trading Bots For Beginners,1596717170,1,1
178,i4qtrw,iJordyMM,0.0,Where did all the volume come from at the peak in 2018?,1596716513,7,1
179,i4qszb,the420chronicler,0.4215,A true OG Bitcoiner should be defined as someone who bought or earned Bitcoin before 2012 and never sold back for USD.,1596716408,10,1
180,i4qdtl,shariyam,0.0,Cryptocurrency's India journey to be halted?,1596714632,0,1
181,i4qat3,_vavkamil_,0.4404,"DEF CON Safe Mode - Michael Stay - How we recovered XXX,000 in Bitcoin from an encrypted zip file",1596714250,1,1
182,i4pwq3,Leader92,0.0,"Your boy upgraded his internet connection to 100mb. Spent weeks downloading the chain, now syncing.",1596712570,34,1
185,i4pspq,Daveliuz,0.0,Bitcoin P2P Trading Soars in India as New Exchange Launches,1596712033,0,1
186,i4psbn,KayleighSosnowski,0.4588,Bitcoin targeting new ATH as it prepares to break major resistance,1596711980,1,1
187,i4pohc,Lamrink,0.0,SOML,1596711478,0,1
188,i4pmwg,magn6024,0.0,Wanting to close my coinbase account and need to transfer some BTC and ETH to another account. I don't have any.,1596711258,8,1
190,i4pgb7,Xcoins_official,0.0,Why Bitcoin Is On The Rise,1596710386,2,1
191,i4pe42,vmrey,0.1779,Family Offices Consider Digital Assets - BITCOIN,1596710079,0,1
192,i4p8th,Bmighty77,0.0,"Turn $10 Into $2,500",1596709318,0,1
193,i4ou5h,kkoenen,0.0,My 2 ct usd in satoshi,1596707184,7,1
194,i4ou2w,StreetwiseCrypto,0.0,The Evolution of Bitcoin [Infographic],1596707174,0,1
196,i4oghg,NeedFUD,0.0,"For the nocoiners, take a Orange Pill!",1596705192,0,1
197,i4of4g,DrWhomst,0.34,"My uncle gave me those, what are they exactly and do they have any value?",1596704985,7,1
198,i4oe9w,ANGRYBOI27,0.0,Wasabi coinjoin vs Samourai whirlpool?,1596704859,46,1
199,i4oe14,sylsau,0.6249,"Weak U.S. Dollar Boosts Gold Above $2K, Just As It Will Boost Bitcoin to a New All-Time High",1596704826,36,1
200,i6sa60,SeaLevelHappiness,0.0772,plz....,1597010931,0,1
201,i6s6to,coinsmash1,-0.25,"This time, fiat will die for good",1597010626,0,1
203,i6rt5s,TaliDontBanMe,0.1531,"Sent money to my address, says confirmed but I have not received it...",1597009324,5,1
204,i6rs2e,BitBlockBlog,0.0,Bitcoin &amp; Blockchain News for 09 August 2020,1597009220,0,1
205,i6rq3m,stringcheese244,-0.0772,I'm sorry y'all....,1597009043,0,1
206,i6rjdy,NateNate60,0.0,Being told to set the network to testnet by lightningd,1597008418,4,1
207,i6rgl4,Scorp1974,0.6124,Please help?,1597008154,10,1
208,i6rfry,wmredditor,0.0,Canadian Amateur Weatherman Frankie MacDonald Has a Bitcoin Advice for You,1597008076,2,1
210,i6r8xu,sageandsucculents,0.0,Am I Getting Scammed?,1597007402,34,1
212,i6r1ee,fixerofthings,0.0,I got scammed out of BC on a website but they forgot to mask their email. I think I found the guy. What can I do?,1597006698,10,1
213,i6qeth,Federal_Parking6258,0.0,Cashing out,1597004558,5,1
214,i6qdtj,0mr_jok3r0,0.0,Bitcoin entre na minha pool,1597004466,0,1
215,i6qaem,glaknight,0.2263,"Bitcoin whale transfers 92,857 BTC worth $1.1 billion",1597004132,0,1
216,i6q9xp,reddit_undo,0.0,Bitcoin on Exchanges,1597004086,11,1
217,i6q57e,bitdex,0.2263,"Bitcoin Worth Over $300,000 Recovered From an Old Zip File: Here's How",1597003638,0,1
218,i6q54c,Daveliuz,-0.4588,Nasdaq-Listed Company Sued for Backing $2 Billion Loans With 83 Tons of Fake Gold,1597003631,0,1
219,i6q4c6,noereman,0.3612,"People who have been into BTC for 3+ years, what has it been like?",1597003558,99,1
220,i6q0ye,kellysmith,0.0,Bitcoin community asked Ethereum how much ETH there is in circulation. Hilarity ensued.,1597003261,4,1
221,i6ph89,ashandrea,0.0,Next ruling crypto currency,1597001487,1,1
223,i6pgam,mickyservices,0.0,Earn Excessive Bitcoin From Our Global Forex Market Today!!!,1597001401,0,1
224,i6p9p4,BitcoinW0rld,0.522,China Will Not Dominate Mining For Long: Lopp,1597000788,2,1
225,i6ouvp,CatherinePhilips018,0.0,SELLING CRYPTO,1596999474,1,1
226,i6oneg,ArienDunbar1,0.4019,A Simple Tool To Help You Trade Bitcoin,1596998807,0,1
227,i6oj2k,MikeYEAHMusic,0.0,"Yo, yo, check it",1596998416,1,1
228,i6ogx3,V-Highwind,0.1531,When your heart stops beating,1596998224,0,1
229,i6odkp,atrueretard,0.0,"Grayscale bitcoin etf bought another 5,973 Bitcoins sometime in the past 3 days",1596997919,54,1
230,i6obp5,BitcoinW0rld,0.0,Bitcoin Equals Netflix In Total Market Cap,1596997749,1,1
231,i6o7iw,1Dqt8Aetc,0.3612,Something about the last 12 months put a smile on Bitcoin's face.,1596997367,17,1
232,i6o2od,MagoCrypto,0.5523,Let's not forget this legend who started a bull run 3 years ago.,1596996907,2,1
233,i6nwga,bitdex,-0.4019,Binance Encounters Problems with Its Bitcoin Futures,1596996334,0,1
234,i6nu5d,DeadPhish33,0.0,Scammers out in full force today,1596996132,1,1
235,i6nn9z,Primary-Peanut-2774,0.4588,Welcome,1596995510,0,1
236,i6njk0,pinellaspete,0.0,Bitcoin Full Node: I repurposed some gaming computer parts and built a full node. (With Pics.),1596995146,14,1
237,i6ndiv,ssnorge,-0.4215,"Three years ago I made my first Bitcoin purchase, and my only regret is not buying more",1596994579,0,1
239,i6n0b5,ducati_monster,-0.25,U.S. coin shortage. Saw this posted in the local mart. I think this is a sign that cryptocurrency needs to become more mainstream.,1596993337,1,1
240,i6muy7,Daveliuz,0.0,Germany Begins Closing Down All Unlicensed Bitcoin ATMs,1596992837,0,1
241,i6mni5,BlueRhino23,0.4588,Digifox &amp; 8% Interest,1596992155,9,1
243,i6m1di,NimbleBodhi,-0.5267,Are Chinese Miners a Threat to Bitcoin?,1596989968,3,1
245,i6lpz5,crypto_bot,0.0,"Bitcoin Network Status Update Sunday, August 09, 2020",1596988845,1,1
246,i6lng0,No-Structure-8830,0.0,Analyst Reveals the Pitfalls in Bitcoin Wallets That Could Be Misuse,1596988594,0,1
247,i6ldd6,jamesmichaeldunn,0.3818,I have put together a short survey to help better understand the reasons behind why people invest in Bitcoin. This is for my thesis.,1596987594,21,1
248,i6l7cr,mjbruns2,0.0,Is there a way to cash out bitcoin to Skrill or Payoneer?,1596986993,5,1
249,i6l5ts,LebJR1991,-0.25,Bitcoin disaster relief fund for the blast that happened in Beirut on the 4th of August.,1596986834,3,1
250,i6kwu9,usenow,0.0,"Bitcoin matches Netflix, AT&amp;T in total market cap",1596985883,0,1
252,i6kw5k,grittygatorr,0.4404,"Trump vs Biden, who’s better for Bitcoin and crypto?",1596985813,23,1
254,i6kfl5,TeslaWatt,0.2023,The Top 5 Defining Trends for Crypto in Late 2020,1596984114,0,1
255,i6k0rm,Miladran,0.0,A scientific study into the purchasing power of Bitcoin over time,1596982522,24,1
256,i6jw8n,Daveliuz,-0.4767,Bitfinex Scoffs at Tether Market Manipulation Lawsuit: Bittrex and Poloniex File for Summary Judgment,1596982040,0,1
257,i6jl2o,TrippingPirate,0.2228,Total number of Bitcoins in use!,1596980778,10,1
258,i6jeqz,etmetm,0.0,SLP199: Electrum devs talk about Lightning network and future developments on Livera Podcast,1596980052,0,1
259,i6je6q,MihaiLP22,0.4404,Easy to do,1596979995,0,1
260,i6jb26,MihaiLP22,0.0,New way of mining bitCoins,1596979614,0,1
261,i6jam7,WorkingLime,0.0,"447 BTC were traded in Venezuela using LocalBitcoin (up from 436) last week, buying BTC with Bs. and selling BTC for Bs. (Bolivares, Venezuelan ""official"" currency). These 447 BTC were 1,279,211,00,000 Bs. (Bolivares, ATH). One BTC is around 3,400,000,000 Bs. Monthly minimum wage is around 2.5 USD.",1596979562,17,1
263,i6j53c,BitcoinW0rld,0.0,Bitcoin Grows As Big As Bank Of America,1596978891,5,1
264,i6j4hg,cryptoragsdesign,0.0,Everything is Bitcoin and Bitcoin is everything!,1596978813,7,1
265,i6izpj,bitcoin_baklava,0.1877,Solid privacy plan or nah???,1596978256,117,1
266,i6iud2,SoundofCreekWater,-0.4137,"80% of BTC are mined in China, mining equipment is overwhelmingly made in China, and a relatively small number of mostly Chinese mining pools / miners are keeping up the blockchain. Are you worried about this centralization? If not, why not?",1596977611,81,1
267,i6ihdd,Visual-Ad-652,0.2263,Bitcoin ;),1596975882,0,1
268,i6iakw,victhroway1234532,0.4528,"Why's bitcoin not like a queue(first in, first out) and transaction fees fixed ? this way users don't have to fight with other users willing to pay very high fees.",1596974960,19,1
269,i6i7i8,Ponypooh,0.0,"""ดีเจมะตูม"" รูดซิปปาก ดราม่า ""ต้นหอม"" ผิดใจ ""หนูเล็ก"" โซเชียลโยง แกงเลียงถ้วยเดียว?",1596974531,0,1
270,i6i1y6,poppysan,0.4754,Very True,1596973739,3,1
271,i6i1b4,SocialAddiction1,0.0,Monthly trading,1596973650,10,1
272,i6i0v8,Ch4rlls,0.0,Bitcoin Black,1596973581,0,1
273,i6i0o8,Ch4rlls,0.0,Bitcoin Black v Bitcoin,1596973547,0,1
274,i6hlf1,InvestorsMotivation,0.0,[AUS] Question about Bitcoin Gambling,1596971194,19,1
275,i6hka1,Paleece,-0.4215,Coinbase is Lies,1596971032,9,1
276,i6h4ps,ethan_bitaroo,0.0,What did you do during the coronavirus?,1596968460,89,1
277,i6h42q,Eplemos4Life,-0.4019,Stink bids fee,1596968363,2,1
278,i6h2yl,Ethanyew,-0.296,Advice needed on bitfinex withdrawal delay [REPOST],1596968182,11,1
279,i6gvq5,sandywilson,0.8779,What great thing can I buy with bitcoin.,1596967039,22,1
282,i6goy3,riqelme,0.0,Bitcoin Is Now Almost As Big as Bank of America,1596965904,0,1
283,i6ghec,sylsau,0.0,The $12K Zone Is Now the Key to Bitcoin’s Price Evolution in the Coming Weeks,1596964688,1,1
284,i6ghat,nice2yz,0.0,"20 Institutional Bitcoin Investors Revealed, But Soon The List May Vanish",1596964669,0,1
285,i6gfvk,DiscombobulatedDot58,0.0,bitcoin mining investing,1596964424,5,1
286,i6g0bp,StManson,0.6369,Best Crypto Currency for Day Trading?,1596961779,5,1
287,i6fucl,E-BETTING,0.0,betting account,1596960748,0,1
