,id,author,vader,title,created_utc,num_comments,score
2398,iel6f5,NimbleBodhi,0.0,Beyond Coffee: Bitcoin for Every Day Use with LNURL,1598112689,14,1
2399,ia7ije,Ponypooh,0.0,"เกินต้าน ""หยก ธัญยกันต์"" นั่งชิวๆ แต่อึ๋มแย่งซีนจนลืมมองหน้า",1597498788,0,1
2400,ia7i0h,pornvisory,0.6588,Porn and blockchain! A great mix,1597498728,0,1
2401,ia79v0,NoobCoinz,0.6249,The Great HODling Poll - What percentage of your stack do you trade?,1597497805,0,1
2402,ia78k6,lambert663,0.0,"OCTA FX , a cryptocurrency investment fund. Dm now to starting trading",1597497656,0,1
2403,ia76ov,Stalslagga,-0.7096,"Police arrest three after six Hong Kong bitcoin ATMs pilfered for HK$230,000 in first-of-its-kind crime in the city",1597497435,1,1
2404,ia71pa,Nucky76,-0.4404,U.S. Postal Service Counters Trump Attacks On Mail-In Voting With A New Blockchain Patent,1597496871,1,1
2405,ia71dx,Dillys619,0.25,Is there a chance I can recover my coins?,1597496835,13,1
2406,ia6xt8,Legendaddy64,0.7184,What is the cheapest way to buy Bitcoin?,1597496457,4,1
2407,ia6vw0,Jessetto,0.3182,I think I just got scammed by coin me.. those bitcoin atm Coinstar machines in all wallmarts. Please make this post go viral,1597496240,17,1
2408,ia6slo,JenniferJack34,0.0,BITCOIN,1597495847,0,1
2409,ia6gw3,Front-Crow-8734,0.0,Mining,1597494454,0,1
2410,ia6fx4,JenniferJack34,0.0,Professional manager,1597494331,1,1
2411,ia6cdg,HittingRichard,0.0,Increasing questions regarding underage buying,1597493896,10,1
2412,ia6ayt,Anonymous84832,0.0,Btc id?,1597493721,7,1
2413,ia67h4,SocialAddiction1,0.0,Day trading,1597493283,11,1
2414,ia6788,Daveliuz,0.2732,Andreas Antonopoulos: Hex Team Offered Me 10 BTC to Speak Well of Their Token,1597493250,0,1
2415,ia5uir,WCEncinares,0.0,Bitcoin Staking,1597491589,8,1
2416,ia5tab,fatearth420,0.4019,Bitcoin core help,1597491408,17,1
2417,ia5i9v,nolith_ita,0.3818,LN: why a merchant should accept customers’ channels?,1597489815,24,1
2418,ia5gzo,evanlinjin,0.0,What is the intended use case of the `nLocktime` field in Bitcoin transactions?,1597489628,11,1
2419,ia5eu5,Immediate_Company104,-0.7269,WhatsMiner M40 440 Th/s scam hoax or in development?,1597489339,2,1
2421,ia5com,AliGidH,0.8209,Hourly rebase! 10% by actual price. Launches in one hour! Check this project! Best core Team! Join or remain silent!,1597489025,0,1
2422,ia577g,tamerlane888,0.0,The Future Of Bitcoin?,1597488160,10,1
2423,ia4v53,KayleighSosnowski,0.6249,"U.K. Woman duped the government to buy $150,000 worth of Bitcoin",1597486295,38,1
2424,ia4pwx,TheBlackSwanof86,0.079,I’m completely naive to how bit coin works any help?,1597485516,40,1
2425,ia4pk9,Beneficial-Guitar-77,0.0,Can Bitcoin really make money？,1597485459,0,1
2428,ia4fwg,Jonescrystal122,0.0,How to invest in Bitcoin? Future predictions for bitcoin prices,1597483833,0,1
2430,ia483b,mitchconnor1337,0.0,What got you guys in to bitcoin?,1597482536,83,1
2431,ia47z3,Jonescrystal122,0.0,What is Bitcoin and what is the bitcoin chart?,1597482516,1,1
2432,ia47ix,Beneficial-Guitar-77,0.0,What exactly is a Bitcoin option?,1597482443,0,1
2438,ia3xrh,polagon,0.6369,6 of the best cryptocurrency margin trading platforms compared (trade with caution),1597480779,1,1
2439,ia3wfj,dojogang,0.0,Radix is the future of DeFi,1597480563,0,1
2440,ia3w77,StarRavin,0.3182,Make sure to put your bitcoins in a cold storage,1597480519,11,1
2441,ia3vpe,Haunting_Ad4741,0.0,Iloveyou,1597480431,1,1
2442,ia3nvb,sumBTC,0.0,Fiat is off the gold standard. Shticoins are off the Bitcoin standard.,1597479114,2,1
2443,ia3m5y,Daveliuz,0.0,Miner Hut 8 Reports Q2 Revenue Plunged 67% to $6.9 Million Due to Bitcoin Halving,1597478828,0,1
2444,ia3m4p,NewBitcoinUser_,0.5093,Crypto enthusiast has launched the largest Bitcoin logo caps store!,1597478823,1,1
2445,ia39w1,Mr_SauravKT,0.6369,5 Best Bitcoin Exchanges in 2020 | Review by ChangeNOW.,1597476844,1,1
2446,ia31zq,hagotchusodomites,0.0,Winklevoss V. Zuckerberg,1597475540,7,1
2447,ia2y2u,My_Perception_92,-0.1232,"Can someone explain to me how does investing In bitcoin work?. I’m not sure if I’m wording it right but I’m trying to find out if I invest let’s say 500 In bit coin what would my return be if bitcoin hits 20,000.",1597474918,14,1
2448,ia2y0f,pavlo36,0.7184,"""If you would buy"" calculator is now available for Android too",1597474907,4,1
2449,ia2xd1,rBitcoinMod,0.0,"Daily Discussion, August 15, 2020",1597474812,155,1
2450,ia2wjl,Dockin,0.0,Running My Own Tor Bitcoin Lightning Node,1597474682,25,1
2451,ia2wa9,ihopeforit,0.0,Paying someone to manage a portfolio,1597474637,10,1
2452,ia2voy,Husa7894,0.4404,"I have a question(take it easy on me, I’m new)",1597474534,11,1
2453,ia2v37,Longjumping_Canary_4,0.0,Buying bitcoin,1597474427,0,1
2454,ia2t0k,gloomy_chibi,0.5994,Current bull state,1597474122,9,1
2455,ia2pf9,WaZabs,-0.2263,210000 blocks HOLD theory dashboard,1597473559,11,1
2456,ia2e1d,george_socrates,0.4588,Will we break it this weekend?,1597471859,1,1
2457,ia1qqp,whereTheboof_,0.0,Looking to finally get into bitcoin,1597468542,9,1
2459,ia16hr,GIueStick,0.4404,Is this any good?,1597465783,4,1
2460,ia14p9,Ravi_Mishra,0.5974,Investing in Bitcoin for the first time! Any tips highly appreciated 🙏,1597465536,27,1
2461,ia13hl,Alternative-Reason13,0.0,Geopolítica e blockchain,1597465371,0,1
2462,ia0mjr,tarunisonredddit,0.0,Lighting Network - Discussion,1597463202,8,1
2463,ia0i2v,kroenkeisadonkey,0.5859,"Just got in 1,200 dollars worth of bitcoin at 11,800. Good investment?",1597462650,110,1
2465,ia05m5,RedWineBlackPiano,0.0,Blockchain deja vu,1597461139,0,1
2466,ia01r7,Greg108,0.0,"Absent record of price On Aug 04, 2020, as far as I know for the first time in history, Yahoo Finance! does not have any record of the exchange rate neither for BTC-EUR nor for BTC-USD. What may be the cause? What happened on that day?",1597460671,1,1
2467,i9zzvn,kraniumSeller,0.0,👀Attention👀Atention👀 I need old World remit account for loading ??? I can load about 5k so if you got a world Remit account hit me Up now let’s deal👀👀 You don’t need to make any upfront payments Telegram @Kranium20 TextNow @740 202 8862,1597460450,0,1
2468,i9zy2z,Trident1000,0.0,Elon Musk Has Spoken,1597460232,0,1
2469,i9zoe7,junglehypothesis,0.7184,Time to buy Bitcoin: ex-Prudential CEO George Ball | Reuters Video,1597459071,19,1
2471,i9zki5,RedWineBlackPiano,0.0,Blockchain explained,1597458624,0,1
2472,i9z872,ryuubishira,0.7184,Binance P2P - How to use it to buy crypto directly PTBR,1597457145,2,1
2473,i9z7r3,RedWineBlackPiano,0.0,Blockchain explained visually,1597457096,0,1
2475,i9yz1q,yik77,0.0,What does it take to own a BTC ATM box in the US [2020]?,1597456086,10,1
2477,i9yh98,RedHeadedKoi,0.3612,Echo Trees ~ Incentive Routing ~ A non-blockchain digital currency.,1597454053,0,1
2478,i9ydp9,Daveliuz,0.0,"Nasdaq-Listed Firm Marathon Buys 10,500 Next-Gen Bitcoin Miners for $23M",1597453647,0,1
2479,i9y8hg,ningrim,0.431,just saw this commercial for Grayscale on Tucker Carlson; not half bad,1597453076,15,1
2480,i9xqvl,bestvoucher,0.4767,Steam &amp; Amazon Voucher for 80% easily with Bitcoin,1597451147,0,1
2481,i9xpsc,bcash678,0.0,Selling Bitcoin for Cashapp,1597451027,2,1
2482,i9xgrm,traderalert,0.0,ALGO the next 100x,1597450070,1,1
2483,i9x6mw,bitsteiner,0.7476,So what happens next? Do Munger and Buffett buy bitcoin?,1597449054,5,1
2484,i9x3i7,simplelifestyle,0.0,"Mike Novogratz on Bitcoin, Macro Trading, Ayahuasca, Redemption, and More | The Tim Ferriss Show",1597448732,0,1
2485,i9x1c8,JohhnyFive33,0.0,Earn $10 XLM Stellar Lumens on CoinBase,1597448522,0,1
2486,i9wzyi,Glugstar,0.0,Pre-downloaded data for full node setup,1597448376,8,1
2487,i9wtpo,macrohumanity,0.3802,crypto-ATMs &amp; crypto-debit cards. Opinions please!,1597447748,12,1
2488,i9wj4b,AxDal,0.0,Berkshire Hathaway reduces bank holdings and adds gold mining company Barrick Gold,1597446677,15,1
2491,i9vf8z,bigjamey,-0.7383,Bought 50euros of bitcoin from a coin source atm and sent it- should have been 60$ and the fee so I sent 65 and ended up 15$ short- is there a damn 20$ fee to send 60$ ???,1597442806,9,1
2492,i9ve92,PixelatedPastry,0.7184,Is there any way for me to buy some btc as a minor?,1597442710,3,1
2493,i9vd9r,underhuggare,0.0,Lightning for noobs?,1597442621,147,1
2494,i9v62q,BashCo,-0.1531,Bitcoin Audible: Guy's Take - The Dominoes are Falling [#30],1597441954,3,1
2495,i9v42k,krypticsan,0.0,Just bought my first thing using Bitcoin,1597441765,8,1
2496,i9v2nd,soriez,0.5719,"First time trying to run a node, wish me luck 🤞",1597441626,38,1
2497,i9uxiz,suuumma,0.0,Bitcoin - 1D6xMNmnrUaZcA42riVoNY4efu2jHgHYFM,1597441155,1,1
2499,ifro0w,newguy52645,0.34,Someone giving away some mBTC?,1598284574,2,1
2500,ifriav,WaggishNickel,0.5994,5 reasons why bitcoin's bull marathon has probably just started,1598284082,3,1
2502,ifr81b,stratguy56,0.0,Over 150 Million Americans Must Report Crypto Taxes With IRS Update,1598283189,9,1
2503,ifr4s1,independentTeamwork,0.0,Fastest way to get bitcoin for a purchase? And question about privacy,1598282903,8,1
2504,ifqrn3,merwanedr,0.34,oogway: A secure Bitcoin utility library for Python,1598281740,15,1
2505,ifqju3,throwaway94857392,0.0,Software engineer looking to switch to a Bitcoin-related job,1598281040,4,1
2506,ifqezk,TheMarketAugur,0.0,Just Add Another Zero: Part II,1598280601,0,1
2507,ifq0tm,emaG3M,0.0,Primer on Cryptography for the Technical and Nontechnical (Part II Authenticated Encryption),1598279312,0,1
2509,ifpt0k,paoloBITWAGE,0.0,Another company announces it is buying bitcoin as capital allocation strategy.,1598278576,60,1
2510,ifprzb,paoloBITWAGE,0.3612,Another company announces it is buying Bitcoin as a Reserve Asset,1598278474,0,1
2511,ifpqla,paoloBITWAGE,0.3612,Why We're Holding Bitcoin as a Reserve Asset,1598278350,0,1
2513,ifpni1,NicoleJamson,0.3612,Christopher Gimmer co-founder of Snappa : Why We’re Holding Bitcoin as a Reserve Asset,1598278064,3,1
2514,ifplyu,DigiFamous,0.0,How To Go From 100 To 9 Million In 10 Years,1598277921,2,1
2515,ifplc5,Being_Crazy,0.0,START AN INVESTMENT TODAY,1598277865,0,1
2516,ifp172,Fickle-Campaign6506,0.4404,Pi is much better,1598275894,0,1
2517,ifow1b,KingMe6,-0.34,restarting my full node and getting some errors,1598275393,0,1
2518,ifovco,digiiital,-0.4404,U.S. election and a weak dollar are ‘high-octane’ drivers for Bitcoin,1598275331,4,1
2521,ifoi6b,SeminolesRenegade,0.0,Any feedback from Bisq users?,1598274049,25,1
2522,ifohsj,TheGreatMuffin,-0.2732,Don’t Fear the Reaper: Concerns about Bitcoin’s long-term supply credibility are overblown — but not for the reasons you might think,1598274014,3,1
2525,ifnyci,Anet3DPrinter,0.0,UPDATE: On The $100 Bitcoin Givaway,1598271861,20,1
2526,ifntvk,FutureIsDigital,0.6249,Looking for websites with crypto products or great gifts for crypto people. Know any?,1598271331,0,1
2527,ifnspl,parakite,0.0,Map of the Bitcoin Network - Gloria Zhao,1598271192,1,1
2528,ifnpj4,Daveliuz,-0.5574,$50 Billion in Cryptocurrency Left China Amid Escalating Trade Wars,1598270831,0,1
2529,ifnp8h,EntrepreneurNo7760,0.0,"Crypto Mining Equipment - Summer SALE 15-35% OFF, Antminer Z15, Antminer S19 Pro 110Th/s StrongU STU U6, Innosilicon A10, Todek Toddminer C1 Pro and much more",1598270794,0,1
2530,ifnl70,bricsjournal,0.0,Custom Journal Writing Services,1598270340,0,1
2531,ifnjtb,BitBlockBlog,0.0,Bitcoin &amp; Blockchain News for 24 August 20,1598270165,0,1
2532,ifnb5g,DegensLeader,0.3182,When Even Cats Know The Truth,1598269039,0,1
2534,ifn1tv,Affectionate-Fee6136,0.0,will bitcoin rise higher then it is at this position,1598267827,7,1
2535,ifn0pl,Limp-Energy,0.802,Fair Play on blockchain + 200% Bonus.,1598267671,0,1
2536,ifmxv1,growthmonkey,-0.5267,Bearish bets in bitcoin futures from leveraged funds recently rose to record highs on the Chicago Mercantile Exchange (CME) – though that doesn’t necessarily imply a fresh sell-off is coming.,1598267286,0,1
2537,ifmuga,rBitcoinMod,0.0,"Mentor Monday, August 24, 2020: Ask all your bitcoin questions!",1598266827,3,1
2538,ifmmbz,Pantamis,-0.4003,Bitcoin difficulty ATH !,1598265657,1,1
2539,ifmhyp,Digibit1,-0.7184,AI used to combat illegal crypto mining on supercomputers - Financial News,1598265041,9,1
2540,ifmdta,Appropriate_Maybe_79,0.0,Build for Bharat First Indian DeFi Program launch by Binance,1598264454,0,1
2541,ifmcl9,Alert_Negotiation,0.1759,"Invested at COVID £4.2k crash, cashed out at ~£9k, bought a 17 plate Fiesta ST!",1598264278,0,1
2542,ifm75q,koinjuio,0.0,"For all of you that wanted to ditch with CMC for data on the BTC, Koinju Beta is now live",1598263502,10,1
2543,ifm5t8,normcrypto,0.0,Tesla Overtakes the Combined Crypto Market Cap - Crypto and Forex News,1598263311,3,1
2544,ifm3o0,NicoleJamson,0.2263,"BitMEX grants $40,000 to developer of Bitcoin scalability project Utreexo",1598262990,1,1
2545,iflp27,Bojangledangle26,0.0,Client-side coin mixer?,1598260738,2,1
2546,iflbzi,kd_superbomber,0.0,More eyes in India,1598258663,0,1
2548,ifl8ij,SoraLhouz,0.6597,Help me help you,1598258151,0,1
2549,ifl2sy,Ponypooh,0.0,"""น้าเน็ก"" น้ำตาซึม เผยคำพูด ""โรเบิร์ต สายควัน"" หลังป่วยมะเร็งปอด",1598257281,0,1
2550,ifl0rk,bitdex,0.0,Bitcoin Is the Cause of Many Bank-Issued Forms of Crypto,1598256969,0,1
2551,ifkx5l,Daveliuz,0.0,Brazilian Crypto Companies to Self-Regulate: Target a $100 Billion Market by Year-End,1598256450,0,1
2552,ifkak3,AlanOne89,0.0,Iran: over 1000 Bitcoin farms closed - The Cryptonomist,1598252988,11,1
2553,ifk6x6,williamofoo,0.4404,"Bitcoin, using ixx exchange should be a good choice",1598252442,1,1
2554,ifk6n7,rBitcoinMod,0.0,"Daily Discussion, August 24, 2020",1598252409,72,1
2555,ifk6a2,sserbianb,0.6808,how do i even accept tips from random people can someone help pls,1598252353,4,1
2556,ifk2sf,Miserable-Major,0.0,Would you answer this question?,1598251819,37,1
2557,ifk0ob,AlanOne89,0.0,Ryanair: the CEO Michael O'Leary vs. Bitcoin - The Cryptonomist,1598251489,2,1
2558,ifj5za,Lamrink,0.0,Saviour currency,1598247167,1,1
2560,ifinkh,NimbleBodhi,0.0,Fully Noded &amp; C-Lightning Chat using the Noise plugin,1598244786,1,1
2561,ifig9b,fid77,0.3818,Building A Stronger Financial System: Traditional Finance &amp; Crypto (w/ Raoul Pal and Simon Dixon),1598243837,4,1
2565,ifi0jo,Ponypooh,0.0,“คารีสา” เผยสภาพจิตใจ “ป๊อบ ปองกูล” และภรรยายังไม่ดีขึ้น บาดแผลครั้งนี้ใหญ่ ต้องใช้เวลา,1598241924,0,1
2566,ifhzph,CoinMan747,0.5106,"First they ignore you, then they laugh at you, then they fight you, then you win",1598241837,0,1
2567,ifhkht,hdwallpapers20000,0.0,Daisy Shah HD Wallpaer,1598240053,0,1
2568,ifhjpq,Ponypooh,0.0,"""ป๊อบ ปองกูล"" ทวิตเดือด! โดนไล่อย่างหมูอย่างหมา ถ่ายรูปเสร็จบอก ไปไกลๆ ตี*",1598239961,0,1
2570,ifhdcq,Intelligent_Pea6126,0.1901,hmu for methods and fullz and things like that my instagram is @methodboyzay but you can text me on here,1598239233,1,1
2571,ifh9sw,SteveReddon,0.0,Geese on sidewalk in the rain,1598238828,1,1
2572,ifh8xo,Suicidal-duck,0.3716,Fun concept: playing monopoly but with sats on the lightning network,1598238732,47,1
2573,ifh7ny,Suicidal-duck,0.1027,Playing monopoly but with sats on the lightning network,1598238581,0,1
2574,ifgs1i,aano00,-0.3182,Who lost the most Bitcoins in history?,1598236898,34,1
2575,ifgexd,aano00,0.0,If I trade Bitcoin without the middle man how IRS gonna track me?,1598235460,59,1
2576,ifgedm,maxc,0.0,I write a medium guide: How to purchase bitcoin 100% anonymously without ID,1598235395,11,1
2577,ifgail,stellarowl12,0.8053,Is Bitcoin a good asset to hold when Prepping for the Apocalypse?? (our top 5 assets to hold),1598234979,7,1
2578,ifg0oh,Shahahaha20,0.0,Bitcoin family tree?,1598233910,0,1
2580,iffzns,satsthestandard,-0.5106,Bitcoin made me feel depressed.,1598233801,46,1
2581,iffwuo,Alternative-Reason13,0.0,Serviços de Governança,1598233499,0,1
2582,iffvg6,johnturmel,0.6124,The Spock Upgrade of the FED banking software,1598233345,1,1
2583,iffpdf,satsthestandard,-0.6442,"Learning more about ""Why bitcoin?"" made feel depressed. I'm not sure what to do next.",1598232684,0,1
2584,iffjco,wmredditor,0.0,"This is Only The Third Time Bitcoin Has Traded Above $10,000 for up to 28 Days",1598232022,25,1
2585,iffg3c,ethan_bitaroo,-0.4215,"IMF made a video about cryptocurrencies. They didn't get everything right nor accurate but still, it's a milestone 🤓 (and it's actually not as cringey as you might expect)",1598231656,13,1
2586,iffef4,ethan_bitaroo,-0.4215,"IMF made a video about cryptocurrencies. They didn't get everything right nor accurate but still, it's a milestone 🤓 (and it's actually not as cringey as you'd expect)",1598231480,0,1
2587,iffdis,A_solo_tripper,0.7964,Bitcoin And Other Cryptocurrencies Should Be Protected Under Freedom Of Speech.,1598231373,14,1
2588,iffdg9,Unhappy-Blacksmith-3,0.0,We need a stock split,1598231366,12,1
2590,iferlc,LLMOONJ,0.25,Created a Bitcoin Stock Art: 5 Years of market activity + Bitcoin cash in the back.,1598229057,136,1
2591,ifeph2,David_ADS,0.0,The secret is...,1598228834,2,1
2592,ifeamv,vaxblade,0.0,Hi,1598227278,0,1
2593,ifdywv,micaeel,0.4215,it has been a nice road,1598226059,0,1
2594,ifdu5f,Maddy247boy,0.6209,GROW YOUR BTC EASY STEP BY STEP!!!!,1598225574,12,1
2595,ifdu45,Gh0sta,0.0,IMF shilling crypto,1598225570,2,1
2596,ifdog7,milliblack,0.0,Make $100,1598224981,0,1
2597,ifdacq,BenjaminGate10,0.4215,Mining in progress #coinmasterfx #mining #bitcoin #cfdtrading #investing #investmentcoach #litcoin #eth #investing # investment,1598223535,5,1
2598,ifd9eb,wmredditor,-0.296,"If 20% of people in the world woke up today to understand how dangerous inflation is, Bitcoin would be worth $1M tomorrow",1598223432,144,1
2599,ih12dr,Sendbitcoinplease,0.4019,Btc support,1598456197,0,1
2600,ih11iu,BashCo,0.296,Bitcoin Rapid-Fire: BITCOINER BOOK CLUB #3 - Masters and Slaves of Money,1598456125,0,1
2601,ih0pws,DesignerAccount,0.0,"""Not your keys, not your bitcoin"" is now law!!",1598455099,11,1
2602,ih0iny,Daveliuz,-0.4939,"Sources Say World’s Largest Darknet Empire Market Exit Scammed, $30 Million in Bitcoin Stolen",1598454437,0,1
2603,igzzx3,SaneFive,0.25,The day someone created 184 billion Bitcoin,1598452643,9,1
2604,igzysb,Iranoutofhotsauce,0.6588,"Just HOLD ing at the beach, great read!",1598452533,0,1
2605,igzp1p,learnfemalenature,0.0,Cashout Strategy’s,1598451569,15,1
2606,igznzl,Master-Leader2549,0.0,Journalist+Behind+Explosive+Bitcoin+Investigation+Teases+New+Info+on+Satoshi+Nakamoto,1598451461,0,1
2607,igzm5y,TylerBerry123,0.0,Bitcoin Conversion Service,1598451281,1,1
2608,igyrvc,bdinu89,0.6249,5 Great Crypto Exchange Platforms that Don’t Require KYC Verification,1598448375,0,1
2609,igyr7i,SavingsRepeat9172,0.4019,Help with blockchain funds,1598448304,5,1
2610,igyi6f,NicoleJamson,0.3182,Democrats ask White House for Details on Huge Bitcoin Bust,1598447328,0,1
2613,igy6oj,Sendbitcoinplease,0.4019,Support,1598446087,0,1
2614,igy60v,andresopeth,0.0,Moving 6 digit sum using Bitcoin?,1598446008,42,1
2615,igxwgv,TheGreatMuffin,0.0,Bitcoin Optech Newsletter #112,1598444905,3,1
2617,igxnzp,Affectionate-Fee6136,0.4404,Making Bitcoin Trading easy,1598443874,0,1
2618,igxn12,coinsmash1,0.3612,Bitcoin is currently 2x the Nasdaq and Gold for year-to-date asset performance,1598443764,2,1
2619,igxh93,BitBlockBlog,0.0,Bitcoin &amp; Blockchain News for 26 Aug 2020,1598443067,1,1
2620,igxgl4,09824675,0.7906,Virtue signalling at its best. New BitBae is in town. All vintage pieces reworked by me. ✂️,1598442978,0,1
2622,igx2mu,paoloBITWAGE,-0.296,Bitwage Rolls Out Tax Calculator Tool as IRS Ramps Up Crypto Pressure - CoinDesk,1598441121,0,1
2624,igwfiu,martijn_bolt,-0.0258,Ethereum 2.0 giving me flashbacks :-(,1598437825,0,1
2625,igwe1u,azrael6947,0.0,Having issue downloading entire blockchain,1598437609,9,1
2627,igwad2,Aggressive_Report_44,0.6808,donate bitcoin to support the start of a useful small business,1598437072,0,1
2628,igw8wr,thisisclemfandango,0.0,"Remembering April 2013, my intro to BTC, and the /u/bitcoinbillionaire Reddit saga.",1598436839,5,1
2629,igw69r,alwaysasubtleway,0.4588,"Those who think Bitcoin’s price is too high, thats because we dont have spilts as traditional stocks do.",1598436444,5,1
2630,igw2vb,thejaisonthomas,0.0,apparently,1598435975,0,1
2632,igvxyk,Yankeeruinx,0.0,Stakenet Lightning DEX is now in Open Beta - Trade and use BTC over Lightning Network.,1598435217,3,1
2633,igvvca,Bomber_MoreMMR,-0.2263,Did you find exchange interfaces confusing as a beginner?,1598434824,8,1
2634,iguwfp,stevewilgazyo,0.4019,How to manage ASICs and GPU rigs efficiently with Hive OS,1598429277,0,1
2635,iguw79,Daveliuz,0.0,Bittrex Global Announces Listing of Sensorium (SENSO),1598429235,0,1
2636,igupdi,YogurtclosetSalty723,0.0,Should they rename bitcoin as KINGOFCOINS???,1598428172,14,1
2637,igunih,Leader92,0.6239,"If you made as little as $200 crypto gains, consider upgrading your security! [My story]",1598427876,0,1
2639,iguhcp,hexcode,0.3802,NextDNS accepts Bitcoin!,1598426935,2,1
2640,igu6ch,Beneficial-Guitar-77,0.0,"How to get Bitcoin quickly——bitcoin price,IXX Exchange",1598425288,0,1
2641,igtwmj,Gpravesha,0.0,Real estate as a career: Myths and tips to begin,1598423839,2,1
2643,igtdxh,Ponypooh,0.0,"""วินัย ไกรบุตร"" เผยภาพพันผ้าก็อซบริเวณใบหน้า บอกอย่าตกใจแค่มาบำบัด",1598421294,0,1
2644,igt68z,seraf1990,0.3563,WARNING!Please guys be extremely careful!,1598420286,306,1
2645,igszmv,coinmarketguru,0.0,How to Trade Bitcoin - Guide to Buying and Selling BTC,1598419393,1,1
2646,igsmaz,Takamul,0.6597,Virtual digital currency is being recommended by rich Arabs,1598417616,2,1
2647,igs32z,cryptobusinessworld,0.0,"Breaking News from Crypto Business World (CBW) - Aug 25 , 2020",1598415225,0,1
2648,igrsbw,Training-Drive-3209,0.0,TRADING FOREX TRADING FOREX TRADING FOREX TRADING FOREX TRADING FOREX,1598413994,0,1
2650,igr40k,Daveliuz,0.0,Developers Plan to Compete in Bitcoin Cash-Fueled Hackathon ‘BCH Devcon III’,1598411247,0,1
2651,igr26x,overdrewmatic,0.0387,Want to withdraw but can't until deposit,1598411059,0,1
2652,igqxqz,TallFactor2,0.6908,Biggest Launch On 9th Sep 2020 On Tron Based Verified Smart Contract-Based Auto Mated Income Generator Machine Book Your Top Position Bellow..Time is Money,1598410574,0,1
2653,igqqrg,CorbyjMaxwell123,0.0,"Promo code ""corbymaxwell""",1598409811,0,1
2654,igqeyh,attolini,0.5719,Mining reward Transaction Fee flippening,1598408551,5,1
2655,igq55k,starcoiner,0.0,100ASC &amp; 3000 SMTS﻿ &amp; 1000 Player Event!! Add News Token 3500 BBC,1598407494,0,1
2656,igpzmx,remitherat2,-0.296,How To Avoid Taxes [Crypto Edition],1598406923,0,1
2657,igpyp3,cryptoanalyticatech,0.0,Bitcoin is going down ?,1598406814,17,1
2658,igpf26,Kantijagwani,0.5413,Why Bitcoin is the Most Advanced Form of Money,1598404744,0,1
2659,igp2pw,CravingDonut,0.8908,"After four years of explaining of the benefits, I finally convinced my dad to buy bitcoin!",1598403453,28,1
2660,igoocc,williexx10,0.0,Answer Amber's investor survey to earn $20 Bitcoin!,1598401908,0,1
2661,ignx6s,ElHandsomeDevil,0.0,Bought modafinil from buymoda via Coinbase,1598399114,6,1
2662,ignh0j,Castratikon,0.0,Issues with Kraken verification,1598397487,3,1
2663,igng6g,lordiswatching,0.1779,"You will make $50 in 5 minutes (Very easy, and absolutely no catch)",1598397400,0,1
2664,ignes4,thndrgames,-0.25,"Here's a teaser for our new Bitcoin Lightning Network enabled game, TURBO 84. It's a follow up to the first bitcoin game we released this year, Bitcoin Bounce.",1598397257,9,1
2666,ign6ii,atrueretard,-0.0516,"If you wanted to place some bids on a exchange and leave them there for a year, which would you use and why?",1598396457,10,1
2667,ign57b,yasuomoi,-0.1531,"You Might Have Missed it, but Blockchain is Now Mainstream",1598396332,0,1
2669,ign3jh,intothecryptoverse,0.0,Bitcoin price: Business as usual,1598396171,0,1
2670,ign0tv,TREER123,0.0,12 v 24,1598395904,22,1
2671,igmwyg,ultrajoba,0.0772,Keybase sold us out can we fork and open source it plz,1598395517,13,1
2672,igmwnk,NetgearX6S4000,0.3612,My college essay on Bitcoin and computers. First Draft. Thought you all might like this.,1598395486,10,1
2673,igmp4u,DiamondTechRL,0.0,Reddit Account,1598394766,1,1
2674,igmnqs,Paulobr124,0.0,Even it knows...,1598394629,0,1
2675,igmjge,MattiaProserpio00,0.0,Bitcoin Deflationary Spiral,1598394227,7,1
2676,igm87s,Putrid-Ant9976,0.0,Bitcoin Gambling 100% real,1598393181,0,1
2677,igm5oi,VAL76HDR,0.0,MarketBot Promo,1598392950,1,0
2679,iglza9,growthmonkey,0.0,Bitcoin is in the bubble but not as you think,1598392360,132,1
2680,iglq0h,parrire,-0.3612,U.S. National Debt Clock : Real Time brrrrrrrrr,1598391533,1,1
2681,iglho8,siddude11,0.0,If Bitcoin Had A Bill/Note Version,1598390788,9,1
2682,igld6e,TheGreatMuffin,0.0,Bitcoin Core contributor Andrew Chow's (Achow101) Twitch channel where you can watch him programming for Bitcoin Core and explaining his thoughts,1598390414,4,1
2684,igl2l2,LightningPlus,-0.0772,Keiser Report | Bankers Will Protest in the Streets + Simon Dixon on Bitcoin | Summer Solutions | E1584,1598389499,1,1
2685,igl0o4,Typical-Birthday6446,-0.4939,My transaction isn't confirming because of a low miner preference (I used a low fee),1598389335,6,1
2686,igkosx,Fiach_Dubh,0.0,The Bank of Canada Wants to Know What You Think About Inflation!,1598388299,3,1
