,title
2840,"Guide to Bitcoin Mining Stocks | RIOT, MARA, BITF, HIVE, HUT Comparison and Analysis"
2841,I bought my first ever BTC only after receiving a hardware wallet! Now I feel proud to own these digital property rights.
2843,Recover bitcoin wallet
2857,Guys stay away from eth-ant/#/.com its a scamm they are a fraud and scammed me for all my money including share and pass this message to all crypto pages share it and tell everyone STAY AWAY FROM https://eth-ant.com/#/ ( liquidation mining pool scamm ) STAY AWAY link below is the scam!
2860,El Salvador Credit Card Benefits
2870,Genesis Volatility (GVol) weekly analysis - Check out our weekly Newsletter link is in our bio
2874,What do you think about my crypto site?
2879,New Umbrel update is out with a P2P Twitter-like app built on the Lightning Network
2881,It is bitcoin.com wallet reliable?
2882,I spent 50 hours doing DD on the 5 biggest Bitcoin Mining Stocks. Are they a better investment than Bitcoin?
2884,Journey through crypto securely on the Voyager app.
2908,DefiBetX2 crypto betting platform
2924,Legacy Bitcoins Wallet
2953,"""Bitcoin Mining Ban in China is Leading to Hash Rate Decentralization"" - Matt Hawkins"
2954,Gift card ?
2963,I never thought I would try to get scammed out of btc on a dating site. 🤣
2980,Free Bitcoin Earning Sites In 2021Top 5 Free Bitcoin Earning Sites In 2021 Earn BTC Without Investment 2021 Latest
2988,The Onion: Study Finds Processing Power Wasted Mining Bitcoin Only Thing Preventing Sentient Computers From Wiping Out Humanity
2993,"Goodbye Legacy Financial System El Salvador’s Chivo Wallet can be topped up with any credit, debit or gift card, anywhere in the world - zero commission! Bitcoin is changing lives."
3002,Can I use Salad to mine bitcoin?
3006,You might find this helpful … I have been using lots of different cyptocurrency exchange platforms over the past 2 months but the best one so far was this one ➡ https://www.kraken.com/u/trade?fbclid=IwAR3pO7RpGvacKiE9ViEOeNtyoIwzS3YW9pKGOofQ0IfqaZhl-e7L7HQLe0c#
3016,MEW wallet sucks
3024,5 Ways to Buy Bitcoin with Debit Card or Credit Card (2021)
3037,Taliban mining Bitcoin
3050,Dogecoin NFT. Link in comments!
3057,Is ECOS cloud mining profitable?
3059,Wasabi Wallet Preview Progress
3062,Do you know that most of the time your computer capacity remains unused? Start using your computer resources more efficiently and earn at the same time! Install CryptoTab browser and it will mine bitcoins in the background while you are just surfing the web. Join my mining pool -
3074,"Earn free money by sharing your data. Verified by trust pilot. Check it out now. Only downfall it take long to raise cash, but it's free."
3084,🚨🚨🚨LIVE STREAM SCAM ON YOUTUBE RN!!! DO NOT SEND ANY ETH TO THEM!!! PLEASE SPREAD THE WORD ON OTHER CRYPTO SUBREDDITS!!!🚨🚨🚨 go to the YouTube link and report stream for scam! Checked the eth address and victims have already sent over $25k worth of Eth to them...🤦
3090,GANA 100 DOLARES BUSCANDO AQUI https://bit.ly/3kCQHFK
3093,Best wallet
3098,Bitcoin app ideas ?
3128,🥞🥞 TASTE SOME CREPE 🥞 🥞 DXSALE LAUNCHED!! 2% Auto-liquidity 68% Presale and pancake listing 25% Burned 5% Marketing Wallet 2% Community Reserve #Crepebsc #BSC
3158,"Can I ""hide"" my withdrawal address which I've used on an exchange? Do I have to change my wallet public key?"
3178,"New to bitcoin, which app should I use to purchase? I use Crypto.com app now but I know theres better out there. Thanks!"
3179,Can you send bitcoin from Kraken pro to personal wallet like coinbase pro with lower fees?
3193,Belarus President Urges Citizens to Mine Crypto Rather Than Seek Low-Paying Jobs Overseas
3200,Considerations in running cloud wallet
3202,"Download crypto tab browser and start mining bitcoin today, it is even easier than you think, just download and sign in with your google account, it works just like chrome but you mine in the background, i have personally made money from this, this is not an ad btw"
3228,Sign up on Huobi exchange!!! Link in comment
3229,Gryphon Mining - ticker: ANY. Anyone else buying these guys? Will be one of the largest US miners and Carbon Negative. Worth checking out…
3236,Buying BTC with FOLD Card?
3239,Help making sense of HEX seed key to retrieve access to wallet. +Reward
3242,Belarusian President encourages fellow citizens to engage in cryptocurrency mining
3244,FREE BITCOIN MINING!!!
3280,iBG finance official : your one-stop investment advisory platform. The iBG smart engine integrates various income vs. risk parameters to provide investors with recommendations of formulated investment strategies and portfolio options.
3299,https://app.stormgain.com/friend/BNS48972843👆👆👆👆👆👆👈👈👈👈👈👈👉👆👆👇👇👆👇👇👇
3300,HOW TO EARN $25 BTC DAILY ON PAXFUL USING PAXFUL MINING WEBSITE YOU WILL ALSO RECEIVE $500 BTC FOR FREE HAS A REGISTRATION BONUS CLICK THE LINK BELOW TO WATCH THE VIDEO ON HOW IT WORKS
3311,https://swee.ps/sIdmW_eUhtbIP
3338,Free 50 DOLLARS FOR SIGNING UP ON CRYPTO.Com. Use my referral link https://crypto.com/app/2hpgsf3zvy to sign up for Crypto.com and we both get $50 USD :)
3341,"These 14- and 9-year-old siblings earn over $30,000 a month mining cryptocurrency"
3351,"Total noob…just got Coinbase and Coinbase Wallet. All verified. Invested $200 Australian. Not wanting to do daily trades or anything, happy to sit and watch. Any suggestions for next steps?"
3371,In all honesty is this form of CryptoTab mining even profitable?
3383,"The most simple way to get BTC—surf the Net with the CryptoTab Browser. You just do your everyday needs like watching movies, texting friends, browsing the web, and receive bitcoins at the same time. The built-in mining algorithm makes it possible. Learn more here"
3392,Just bought Bitcoin from an atm how do I use it or transfer it to an online wallet?
3406,If you're lending your Bitcoins make sure to see your deposit address with a watch-only wallet
3430,"“Bitcoin miners are making Bitcoin stronger as they raise capital, recruit talent, build facilities, upgrade technology, join communities, support the local economy, secure the network, mine bitcoin, and #hodl it on their balance sheets.” -Michael Saylor"
3449,how can i get a bitcoin credit card
3462,Buying an exchange gift card that doesnt count as a cash advance?
3470,"Bitcoin Core Portable, packaged for use on any Windows PC, released by PortableApps.com"
3472,"$500 for free in Bitcoin when signing up, no needed to pay any fees, verified link, and payment proof"
3500,Freebitcoin Review || How to earn on freebitco.in || Earn bitcoin &amp; crypto for free
3517,Noob question: Can you send Bitcoin from a lightning wallet/exchange to a normal segwit wallet?
3521,Bitcoin: arrived mining green!
3531,"Check this site , you can micro mine Bitcoin and build up over time!"
3560,Satoshi said in this link that he would increase block size if necessary
3564,Which app offers best price to buy Bitcoin? Robinhood or Coinbase Pro?
3568,"El Salvador's new bitcoin wallet allows for cross-border, virtually instantaneous, zero-fee transactions -- a game changer for a country where 70% of the population depends on money sent home from abroad to get by. @KenzieSigalos has more. https://cnb.cx/3E2jmwK"
3569,Get hands on Bitcoin Cloud Mining with Free GH/S Every Hour
3574,One of my friend asked me if Honeygrain is a legit mining platform. Thanks for the response!🙌🏻
3577,Mastercard Acquired Crypto Intelligence Platform CipherTrace
3600,Random thought… If Quantum computing becomes available to the general public by 2030. How would that impact the BTC mining industry or The BTC network?
3606,Is it possible to get a BitCoin debit card?
3616,Bitcoin wallet taxes
3619,How to get a lightening wallet?
3623,I just found someones bitcoin wallet login on a screenshot website (250k worth of crypto)
3630,Looking for a site to buy Bitcoin that is easy to use for people without ID.
3635,https://onlyfans.com/wettpeach
3638,Hello guys I am currently giving away free copies of my bitcoin investing course if you would like one comment 'me' below
3643,https://psychedelicshop.org/
3648,Y’all stay safe but if you need help recovering your lost crypto wallet.. ever been scammed on with Bitcoin or forex investments and also need your hacked accounts back message @brainzhack on Instagram he’s legit and reliable!✅
3660,HEY CHECK OUT THIS FREE VIDEO THAT HELP ME GENERATE OVER $1000 IN SALES THROUGH FB ADS DON’T MISS THIS FREE OPPORTUNITY https://snip.ly/ye1sp0
3664,FIRST 3 PERSONS TO MESSAGE ME GETS 1BTC FOR FREE
3665,YOU CAN EARN $1000 BITCOIN WEEKLY WITH CRYPTOTAB APP
3668,➖Start from € 100 to Mining/minting.
3669,“App developers can now choose Bitcoin payments in iPhones after a court order. Apple to allow 3rd party payment options. There are more than 1 Billion iPhones in the world. This is HUGE!”
3672,"Generate Thousands of ""Stable Coins"" Completely Free. Nothing To Buy! Convert Them To USD or Other Currencies, Soon."
3674,"If you own a crypto payment app and you want to provide users with private wallet, then how do you avoid mining fees everytime when you transfer btc to their wallets?"
3685,"URGENT EL SALVADOR Questions: The ""Chivo"" ""Government Issued Wallet"" WTF?"
3701,I accidentally sent money to the wrong email when I was trying to withdraw CAD from my fiat wallet on CtyptoDotCom. Could anyone please help me?
3718,"0.5 free Bitcoin when signing up to the link below, verified link legit pay out, no need to pay any fees totally free"
3719,Why is the community not promoting methods of protecting value in case of wallet loss/theft?
3721,"Friends who do trading, this professional indicator brings you 90% closer to success. You can trade on any currency, any time and any broker. Gives a great signal for trading. Signals for both Forex and Binary .. Price $ 100. https://t.co/BWCl0tEVdS"
3726,"Get $500 BTC for free when signing up in this link, no need to pay any fees, verified link"
3755,What is Bitcoin? I don’t use Reddit so please don’t mind my mistakes but what actually is bitcoin? It just came to my attention that it isn’t a digital mario cart coin but like u actually mine for it ? Wtf help ☹️
3756,"Learn How to Recover your Lost or Stolen Bitcoin | Recover Lost Bitcoin, | Recover lost Cryptocurrency, | www.blackaccss.com"
3769,Bitcoin Miners And Oil Producers To Discuss Crypto-Mining Opportunities
3787,Trying the Chivo App in El Salvador
3799,Mining bitcoin with bare minimum
3803,201 btc hack script txt download🤑
3822,"Learn how to trade Bitcoin,mine and earn extra cash in one week even in your house..Ask me how."
3835,Help needed - is there a wallet that will display your name or email at the same time as your address and/or transaction history?
3873,Calculating Fold card average cash back
3876,How Bitcoin Mining Works
3879,Bitso announced as a core partner for El Salvador's Bitcoin wallet
3880,Currently 18M BTC what happened with Mining after 21M ?
3886,How long can my bitcoin remain in lightning wallet ?
3901,The new Chivio wallet put out by the El Salvador government is a surveillance tool which has access to the microphone and sends all contacts to the server!
3915,Blockchain Crypto Wallet
3927,"Great gambling website where you can use any form of crypto, not just bitcoin! You also get a wheel spin with my code to get you started, and a daily wheel spin where you earn free crypto! If nothing else, you can at least spin the wheel everyday! 4x deposit bonuses and level rewards too!"
3928,Best platform for daytrading?
3932,It’s risk free and 100% profitable where you can grow up your funds while you are at home.note : you’re not sending your to anyone. WhatsApp +12134442866
3943,Free £10 of Bitcoin. Read below. BPJKNOTT
3958,Daily Free 50-500 Dogecoin
3961,Remitano Launches Remitano Network Coin - Free Airdrops to All Users
3979,Episode 29: Inside The Mine
3993,https://btcfree.win/?r=3744438
3997,Start you BLOCKCHAIN/ CryptoCurrency Business in the UAE and get a LIFETIME FREE UAE VISA
4003,i need a site to buy
4005,Earn bitcoin for free
4028,How do exchanges set mining fees?
4036,Help in britexcoin.com
4067,join my crypto tab browser pool and mine bitcoin for free and risk free!!
4102,"I paid ,$50 or so to an eBay seller claiming to mine Bitcoin with his rig, a few years back!"
4124,Vacationing- take wallet with me?
4131,"Using multisig for cold storage, do you keep seed backups or hardware wallets or both?"
4133,Is the Kraken app for Android down?
4138,Rise - foundation.app/@Flat_Arc
4142,Rise. 1 of 1 NFT just dropped at - foundation.app/@Flat_Arc
4147,Rise | foundation.app/@Flat_Arc
4172,"Get paid in bitcoin to download apps, play games etc 🤳🏻instant $25 sign up bonus today only!"
4197,"Get paid in bitcoin to download apps, play games etc 🤳🏻 $25 sign up bonus today only!"
4205,"Get paid in bitcoin to download apps, play games etc 🤳🏻 $25 sign up bonus"
4214,Want to earn some extra Bitcoin on the side? Check out this new game and start stacking extra sats for free today!
4216,A Beginner Seeking Help From Experienced/Expert Redditors On Mining.
4218,"I am class of 2017, and from today onwards I do not have to work anymore. I am a free man."
4226,Buying coffee with Bitcoin at Point Break Café in El Salvador using Muun wallet
4229,"Twitter may be implementing bitcoin on the platform, reveals leaked image"
4232,"I wrote an article recently discussing whether the US will ban Bitcoin and received a lot of good feedback here. For those of you who would rather listen, here’s the audio. Your own thoughts on the subject are appreciated. https://youtu.be/Eizbfrup5SE"
4246,"Get Paid through bitcoin 📲 to download apps, play games etc 😅 click link below $25 dollar sign up bonus"
4251,Noob here. Is cloud mining worth the price of admission?
4272,How to Mine Bitcoin using your smartphone🤑
4280,Can i still recover a 2014 bitcoin wallet?
4301,Argentina's E-Trade platform is adding Bitcoin trading for its 200K users. Says adoption cannot be missed.
4325,"If anyone wants $20 of free Bitcoin using my QR code, feel free 👍"
4349,"It might not be a Lambo. But it's mine. BTC is not a get rich quick scheme, but if you HODL for long enough, it will change your life."
4353,🧨🧨🧨Buy $iBG today at 🦄 Uniswap.org
4354,Setting Limit/Stop orders from Hardware Wallet + Trade over Lightning from Hardware Wallet?
4357,For all crypto fans..... https://t.me/Crypt0fans
4383,Received an email with an attachment for free Bitcoin... Nice try scammers!
4388,I think the BTC wallet security calculation is WRONG
4400,PayPal enables is 2million UK customers to buy Bitcoin from within its app
4403,US banks fight back against government overreach - Reuters.com
4404,https://t.me/joinchat/RLBkAUbwLtRhN2Yy
4411,Privacy Guarantees of Wasabi Wallet 2.0
4412,Privacy Guarantees of Wasabi Wallet 2.0: How Wabisabi Works
4418,US companies announce plans for nuclear-powered bitcoin mine. Talen's Susquehanna nuclear power plant to develop 300 MW of zero-carbon bitcoin mining capacity.
4421,How to improve grammar online for free?
4423,just join and you dogecoin will auto generates free fist watch videos in youtube then join if u dont believe no internet need not coneected need
4426,"Is it possible, that you can get 1 full Bitcoin, when some rich or kindly ppl just send a small amount to a wallet? Let’s find out! Please don’t feel like I’m beging, im just interested to see if it works."
4449,"Someone please explain this bitcoin wallet contract and what ""AS IS"" means unless ""applicable by law"""
4464,Free PSN Codes
4469,How to charge fiat debit/credit card online and convert to Bitcoin?
4475,Hardware Wallet Comparisons (Store Your BTC OFF The Exchanges)
4490,Chivo wallet... is it trustworthy?
4501,"Mrs Jane, has anyone ever used this person? I saw loads of recommendations about 'her'. They want me to transfer £500 worth of bitcoin to her wallet, and apparently 5 days late I'll have £2,5k and all they want is 10% comission fee. Everything in me is saying it's a scam....help"
4512,Scammer Wallet DO NOT SEND
4515,Join and earn the next biggest digital currency for free.
4538,"Best platform for stop losses, alerts, and ease of wallet access?"
4544,Earn Daily 0.002- 0.1 Litecoin Free
4581,Start Earning Passive Cryptocurrency with Helium Hotspot Mining
4584,https://www.youtube.com/watch?v=DSQCdcm-aZs
4586,"Just it again, This Free BTC is Better than It older version"
4587,CryptoTab Browser is the world’s first web browser with built-in mining features. Familiar Chrome user interface is perfectly combined with extremely fast mining speed. Mine and browse at the same time!
4609,Free printed Bitcoin poster posted anywhere!
4617,Mine
4618,Mine Bitcoins
4619,Renewable mining
4621,Who's interested in crypto mining
4622,[OC] Instantly turn your GBP into BTC! Introducing my automated crypto shop at ⚡ZedZeroth.com⚡ Pay by UK bank transfer and bitcoin is sent direct to your wallet/vendor within minutes! I've been trading crypto for 5 years with 100% positive feedback :) See you there soon!
4640,"I drove over to the El Salvador consulate in Atlanta Friday afternoon. The Chivo ATM was alive and well &amp; citizens can remit dollars in their pockets home to El Salvador for free, at the speed of light. This is huge."
4663,Get 10$ bitcoin when you sign up to coinbase with this link
4687,What are the cons of reusing a cold wallet address for withdrawals?
4695,Wanna mine BITCOIN for FREE ? Download right NOW Cryptotab and start your own Fortune !!!
4697,BTC Miner and BTC management tool #Bitcoin #Crypto #Blockchain Download: 👉 https://ouo.press/652bw
4700,Free AI Telegram bot predicts BTC price
4703,"According To El Salvador President, Nayib Bukele, 1.1 Million Salvadorans Now Using Chivo Bitcoin Wallet"
4739,"defi no pledge liquidity mining, contact me"
4746,How Bitcoin Mining Might Help Nations With Domestic Energy Production
4750,"Hello, I am from Venezuela and I have questions about BTC mining"
4751,It might be a Lambo but it's all mine. Thanks BTC!
4753,"&lt;a href=""http://www.freebiebitcoin.com""&gt;Earn free bitcoin&lt;/a&gt;"
4765,Is bitcoin mining a lottery?
4769,What's your #1 hot wallet recommendation for smartphones?
