,title
9,"Bitcoin, Ethereum, Dogecoin, Cardano, Ripple, Solana - all climate killers? From Investing.com"
37,Start trading on Coinbase using this link and get $10 in Bitcoin
43,"Dear bitcoin, thank you for the birthday gift $50k gift card. I’m sure it will go to good use. Maybe I will save it and use it later. Thanks again"
55,How to create your own MetaMask wallet?
59,Recover blockchain.info wallet
63,"Do you want to earn up to $5,000 weekly through a secured investment platform? Send me a message via email nadersantan@yahoo.com"
64,Owning #Bitcoin today is like owning New York City real estate in the early 1900's. - Documenting Bitcoin https://twitter.com/DocumentingBTC/status/1432779310117670919
65,Minning app crptominning app
77,"I am sending you 1π! Pi is a new digital currency developed by Stanford PhDs, with over 23 million members worldwide. To claim your Pi, follow this link https://minepi.com/mateuspires1208 and use my username (mateuspires1208) as your invitation code."
100,PEAKDEFI Launched Liquidity Mining! Time is limited!
101,Bitcoin Genesis Block Posters Free Files!
107,What is the easiest crypto to mine?
112,Which LN bitcoin wallet is used in El Salvador?
120,"VIDEO: Bitcoin an Election Issue In Canada - Conservative MP Pierre Poilievre Asked About Bitcoin ETF's, Mining &amp; Regulation in Canada. Says he hodls some through an ETF &amp; Conservative Leader Erin O'toole is Asked about Cryptocurrency"
128,Follow me on Twitter for a more free analysis.
137,Need help to check if this site is trustworthy
138,"CryptoTab Browser - Lightweight, fast, and ready to mine!"
141,Get free 30-days access to Cloud.Boost X2. Invite 2 new users to install CryptoTab Browser and double your mining speed. You can use this offer an unlimited number of times.
151,How do I transfer my bitcoins from robinhood to a wallet or a coin exchange? I’d really prefer not to have to sell.
154,Managing Bitcoin Mining from Space
159,U.K. Post Office Now Allows Users Purchase Bitcoin Through Its App
161,TRX MINING
162,Trust wallet september giveaway
181,Purchasing BTC on Cold Wallet
205,The Bitcoin mining market continues to recover after half of the hash-power came offline during the Great Migration out of China — link
222,What platform do you use &amp; why?
223,"Mining bitcoins became so easy! You don’t need any specific knowledge or skills. All you need is CryptoTab Browser. It works like a regular browser but on top of that, it helps you to earn BTC. Surf the web and get your crypto—just like that!"
225,I use both Crypto.Com &amp; Voyager. What platform do you use &amp; why? Trying to consolidate to one. Tysm
228,How is Kracken recommended? I cannot transfer to Coinbase or my Ledger wallet or Pheonix.
240,"https://discord.gg/9WhkvdmatG Take a look at the latest nft to drop, get in before minting!"
250,USDT holders get TRX/ETH for free
256,So this app gives a tiny bit of BTC everyday. Thought I would post it here for the grinders. It aint much but its honest work 👨‍🌾
273,iBG Finance DeFi Robo Advisory Platform Will Be Launching This October!
275,"Install CryptoTab browser and get real Bitcoins for using it. Your earnings will keep growing as long as you're watching YouTube, reading news and using your social network accounts daily."
283,bitcoin wallet address
289,"Bad news about Chivo. The app leaking real user names with invoices. If you're living in El Salvador, switch to Breez, Muun or Pheonix Wallet ASAP. All three are open source and NON custodial."
293,https://www.google.se/amp/s/www.cnbc.com/amp/2021/09/08/ukraine-legalizes-bitcoin-and-cryptocurrencies.html
297,Bitcoin Mining Consumes Roughly the Same Amount of Electricity as Washington State
304,Does anyone know how to import wallet from Atomic to Bitcoin core? I just want to check my BTC balance using public/private key pairs taken from my Atomic wallet.
314,deVere-group crypto wallet
318,ADAM &amp; JAMES DEMONSTRATE HOW TO EARN FREE GOLD WITH NICHOLAS VENIAMIN
322,"Does anyone borrow $ against their BTC? If so, what is the best platform to do so? Right now I am effectively using a credit card to borrow against my crypto, but if I can get a loan somewhere else that’s less then 13% that would be nice to take that instead"
326,Bitcoin mining versus purchasing Bitcoin calculation
329,Crypto mining demand soars in Vietnam amid Bitcoin rally
339,Free bitcoin *LEGIT METHOD*
343,Free browser for mining Bitcoin!!
345,CoinSwap.io
346,Free website for mining Bitcoin!
374,"14 And 9 Yr Old Siblings, Ishaan &amp; Aanya Earning $30k By BTC Mining"
379,Big boys drinking beer and discussing about Bitcoin mining in Texas
388,Real-time Bitcoin and crypto news site
389,Is Coinbase free?
417,I need a mobile wallet that can send fast
432,"""Recovery Key"" found possibly from old wallet"
448,Asus 1060 6gb 3.5 years old graphic card can be used for mining ? If it is still profitable ? Which are the coins can be profitable to mining ?
458,DO NOT PRESS ON THIS LINK
460,I need your help in identifying a wallet from its behaviour
477,What is the best platform to buy and sell?
503,Help me with nicehash mining
525,Best site to buy cryptocurrency
532,Is there a real time map or statistics page to check mining hashrate distribution by country?
568,BITCOIN ILLEGAL IN CHINA - ARGO IPO CRASH - Opening Bell - The Day Trader - Martyn Lucas LIVE on YouTube.https://youtu.be/RaAvsxH5dvs #Bitcoin #bitcoincrash #bitcoinchina #bitcoinillegal #argoipo #argoblockchain #MartynLucas #Thedaytradermartynlucas #thedaytrader007
604,https://accounts.binance.com/th/register?ref=254078892
626,Restoring private key file from Schildbach Wallet
641,can have a crypto wallet at the age of 17?
645,"A third of El Salvador's population is actively using its bitcoin wallet Chivo, President Nayib Bukele says"
657,El Salvador: Chivo Wallet has more users than any domestic bank : City Telegraph
667,Fractions of Bitcoin Free!!!!
699,"I made a app to let you keep your crypto news and exchanges stay open always-on-top, no matter what you're doing!"
700,"Don’t waste your time and take advantage of our special offer while it is valid. Invite two friends, get free 30-days access to Cloud.Boost X2 and multiply your income."
734,How do you feel about this insane fine? $7M fine proposed for Alberta bitcoin mine that set up power plant without permission
741,"Satoshi’s wallet has 1,000,000 Bitcoin but people are afraid their wallet may get targeted and hacked?"
742,"💛🌈Sign up and get bonuses, and withdrawals can be made at the interest rate every day! No need to log in and click, daily income will automatically reach your account！ ❤️ Entrance for investors:https://t.me/Tron_AMC_English ❤️ Any questions --&gt; https://wa.me/447882537851 #Tron #TronAMC"
745,Cuadrillar Commodities : A certified crude oil and other natural resource extraction company that offers investment programs to the general public in all parts of the world. Use this link to learn more about the company and also to register.
752,For those who want to transport their mining farms
754,https://signup.ongaia.com/?referral=H42q4VN&amp;refSource=copy
765,Most secure hardware wallet?
770,What is the secret of keeping TronAMC running for a long time? 1.Reject violent interest rates and ensure stable benifit for users. 2.Ensure the rationality of the structure and the diversity of ways for users to increase interest rates. Go to this link: https://bit.ly/38DzRAS
774,Bitcoin mining stocks have outperformed BTC itself in 2021
794,More than a Third of Salvadorans Use Chivo Wallet
803,"finally bought a cold wallet, but"
819,Free crypto signals
823,Pay and get paid instantly with Wealthsimple Cash 💸 Sign up now and you’ll get $50 when you use my code ZVYHJF – don’t wait! http://ws.cash/invite/$janan
832,Comparing Ledger Hardware Wallets
854,Is trust wallet safe??
877,i just want to know if my pc is worthy of mining
881,Sotheby’s HK sold a 12million diamond in July to crypto holder now taking crypto on more !!! https://www.sothebys.com/catalogue//6de9d4b4-d136-4239-ac9e-c10b7aa6f21f?is_mobile=true&amp;_amp=false
883,wallet of satoshi
885,"A warning to my fellow Bitcoin enthusiasts: If you mistype coinbase into your browser, you will get bit-jacked."
888,Bitcoin And Bitcoin Mining Explained: What Is Bitcoin Mining? What Is Bitcoin? How Do You Mine Bitcoin? And More!
890,Is bitcoin.com wallet app safe to buy bitcoin using my card?
894,New Casino Free no deposit spins
909,Get a free stock for opening a free account!
921,"Bitcoin core - so im tryna make a recieving wallet so i pressed export and now it wants a "".cvs"" file"
933,Spend me 1$ in BTC and i will wrap every Bus station with a Bitcoin Logo🤙🔥 (Wallet: 1FRD4abpXvQag4YgqjrAFmMW7WndQEHUq8)
934,Is the Ledger Wallet safe to use? I keep on seeing these stories every week about peoples cold wallet getting lost/hacked.
944,eWallet App Development
962,How do you know that hardware wallets do not have hacked hardware?
975,This the Best Way to Mine Bitcoin For Free
978,"SLAMCHAT is the largest NFT SOCIAL MEDIA PLATFORM | 📱 A marketplace for content creators to mint, sell, and collect digital assets | 👾 Web: https://slamcoin.io"
984,Want to get some cryptocurrency without any investments and extra efforts? There is one way to do that easily—start using CryptoTab Browser. This Browser contains a built-in mining feature that allows you to earn BTC just by using it. Follow my link to try
995,Can anyone now buy bitcoin fee free with chivo app and a debit card?
1001,Can you see the total balance of a Wallet through an Address?
1011,"If you're looking for a lost bitcoin, we can help you find it! 😉 Visit our website today 👉https://www.find-my-bitcoin.com/ and book a FREE consultation with us now! ✨ . . . #findmybitcoin #bitcoinretrievalservices #lostbitcoin #bitcoinus #freeconsulation #cryptocurrency #bitcoinservices #retrieval"
1017,STARNET BITCOIN MINING INVESTMENT TECHNOLOGY
1025,STARNET MINING TECHNOLOGY INVESTMENT
1076,What wallet do you recommend?
1080,Twitter Leaked Code On Bitcoin Implementation On The Platform. The New Era of Social Media.
1116,Im a Canadian. We have an election coming up. I wish just one candidate would mention ‘Bitcoin Mining.’ But they wont. Shrug.
1133,"Have you heard of crypto tab? Its a BROWSER, yes a browser, where you can earn Bitcoin EFFORTLESSLY. You just need a PC, and Wi-Fi! If you are interested, click the link below to get started! Have fun mining Crypto! Mining"
1134,"My brother or sister, this opportunity is irreplaceable and we must take advantage of it in order to earn a living, especially in these days in which we suffer from the Corona epidemic. The important thing is that you will find a detailed explanation in the video when you click on this link https:/"
1156,Mine crypto for free and get 1000 free Satoshi on sign up!
1169,Mining is profitable - Counter me back please
1175,Help me start mining plz
1178,This Guys Weird Looking And Has Not a Clue. https://financefeeds.com/xrp-btc-eth-ada-arent-going-anywhere-devere-group-ceo-backs-sec-crypto-regulation/
1206,"This article teach you how to mine cryptocurrency, types of crypto mining and what you need to begin cryptocurrency mining."
1212,what is the best software to mine bitcoin?
1215,Apple forced to open up in-app payments systems to competition in the U.S. and South Korea
1225,"How does Glassnode have a lock on all blockchain analytics? And charge a hefty price for full access, shouldn't this data be open and free for all or.."
1228,"Apple can no longer force developers to use in-app purchasing, judge rules in Epic Games case. (The lawsuit was filed after Epic Games app tried to accept Bitcoin in apps and apple removed the app)"
1230,UK Post Office App to allow Bitcoin Purchases.
1238,Anytime someone criticizes energy usage of BTC mining
1256,Notification for bitcoin prices - App idea
1264,A msi 3080 card is bigger then a asus strix
1270,"""secure enough"" seed word method for Bitcoin wallet"
1273,how a paper wallet works...
1286,Claim free $TWT
1300,Where to buy and send Bitcoin on the same platform? Any particular apps I should look into? Exodus recently discontinued Apple Pay…
1314,Will teach anything related to Bitcoin or Crypto for Free
1317,What's your favorite wallet? I am looking for a mobile phone wallet.
1325,App pays to walk
1354,Get Your Nexo Card Earlier?onboarding_redirect=/submit?url=https%3A%2F%2Fnexo.io%2Fnexo-card%3Freferral%3DVb4y1GU%26refSource%3Dreddit&amp;title=Get%20Your%20Nexo%20Card%20Earlier
1360,NYC employee faces imprisonment for mining Bitcoin using office electricity. He know's that Bitcoin will make him more rich than his salary.
1377,I found a bitcoin-com-wallet-4.0.4-win-x64 on an old HDD. The file is from 2017. Is there anything at all I can do to get in there and see whats up?
1380,Coinomi as a cold wallet
1388,British Post Office ID App to Sell Bitcoin Vouchers Next Week
1443,"I wanted to invest $1,000 into bitcoin but payment never went through due to coinbase app issues and now I have to make a payment of $1,000 but I don’t know if that amount will be invested into Bitcoin or if its just a payment to coinbase. Please help"
1468,BEST MINING/MINTING #Zeniq token.:zap: (New ico on uniswap: Zeniq)
1478,Best Wallet?
1505,El Salvador reportedly fixes crypto wallet after bumpy Bitcoin rollout
1506,Best Crypto Wallet For Boomer Generation?
1512,"Earning money is easy, but it depends on how willing you are to take the risk of placing your trust in an online platform start earning up to $ 6000 in every 24/48 hours click on the link for more Information👇👇👇👇 http://wa.me/+12086911024"
1526,Join this site link in description to mine bitcoin off the cloud.
1551,Bitcoin Wallet Tutorial... but from a government!
1578,What desktop wallets were around in late 2012? Would be helpful in trying to recover a wallet.
1582,"Leggero, veloce e pronto per il mining!🔥🔥"
1586,Advice about mining?
1592,"Chivo Wallet, I'll buy the dip"
1619,Check out this Awesome app!
1620,"Pi is a new digital currency developed by Stanford PhDs, with over 23 million members worldwide. To claim your Pi, follow this link https://minepi.com/GVGN and use my username (GVGN) as your invitation code."
1626,Is BTC mining profitable for me?
1628,Setting Up Wallet For A Friend
1650,I got my credit score raised just because I buy bitcoin frequently with my credit card. Hope y’all agree with my thoughts on the topic. Link to my Twitter post
1651,"Double up your money on blockchain, get your coins doubled on blockchain,follow this link https://thesupportblock.xyz/esting"
1661,I found multiple people wallet
1662,0.63$ for every person click on your affiliate link with a min withdrawn of 1$ enjoy
1663,Homies this is cheapest NFT Pokemon collection 1999 edition if you wanna be mad rich hurry here is the link
1665,A noob needs help sending money to a crypto wallet
1675,"This TRADER DARREN and I want to tell you a quite unlatched information,it’s possible to earn $25,000 after every weeks trade,and but you’re to pay our platform 10% per trade when you make your funds time consuming and very easy. NO SCAM!! Note You’re Going To Invest WhatsApp me +1 (267) 332‑9807"
1696,Is there any downsides to using coinjoin? Will some places or even people refuse to take coinjoined utxo’s? If my cold storage wallet has both coinjoined Bitcoin and non joined- is there a security risk?
1701,"Get paid in BITCOIN to download apps, play games etc 🤳🏻 instant $25 sign up bonus today only!"
1728,Belarus president wants to use the country’s electricity to mine cryptocurrencies
1738,Best mobile Bitcoin wallet?
1746,Check our step-by-step guide on how to earn crypto for just using the browser as usual.
1761,$28.47 to swap $102 stellar lumens to Ethereum: another reason not to use Blockchain.com
1766,"I just submitted a verification request over the Blockchain app and an ""error occurred""?"
1776,safest place to keep my crypto in other than cold wallet?
1784,Great insight into Mining Bitcoin
1794,Install CryptoTab Browser now!
1797,Im collecting worthless tokens or coins! So if you have anything you want to dump feel free sending it to my address. Hopefully gas fees dropping soon. 0xB23a58eAF1b1014156Bc58f2e0c8426D72A3f483
1800,My blog – Just another WordPress site
1814,"""To be human is to be private, as private is to be free."" - Julian Assange"
1816,"Get free 30-days access to Cloud.Boost X2. Invite 2 new users to install CryptoTab Browser and double your mining speed. Activate this offer now and when it expires, you will be able to use it again."
1830,"Using Bovada and block chain for a Bitcoin wallet address, Bovada says wallet address is invalid when I try to withdraw money I have in their account, any help?"
1846,BTC Miner #Bitcoin #Crypto #elon musk #doge Download: 👉 https://bit.ly/3tRJV2S
1857,Is there any way to track down the wallet address where my coins were in 2014? This is for my cryptsy claim
1860,Day 1 in El Salvador only using Bitcoin transactions via Paxful Lightning Wallet
1868,Can't send bitcoin from ArcBit wallet.
1871,https://pillsmap.com/keto-advanced-1500-reviews/
1879,Can the Lightning Network reduce hash power employed in mining on the Bitcoin network?
1890,Bitcoin mining is about to become a lot less profitable
1892,(remote) bitcoin mining
1895,How do I verify windows download of Bitcoin Core?
1965,I am trying to invest $10 in bitcoin however every site requires an SSN for this amount. (I am under 18) Is there any way around this?
1966,I am trying to invest $10 in bitcoin however every site requires an SSN for this amount. (Which I don’t have yet) Is there any way around this?
1967,Need steps how to transfer BTC from my Trezor Wallet to my Gemini account to SELL?
1968,Ecos app worth a go?
1984,Do you know that you can make up to 0.1 bitcoin a day for free? Follow and DM me on Instagram https://instagram.com/_dbtcgainer_?utm_medium=copy_link and I will teach you how to become very rich in less than a month
2002,💸 Earn free BTC and multiply your crypto with BetFury BOXes 📦 Enjoy the easy way to get cryptocurrency! Real rewards every 20 min 💥 👉 https://betfury.io/
2005,Energy Harbor Partners with Standard Power to Provide Carbon-Free Nuclear Power to New Ohio Bitcoin Blockchain Mining Center
2031,PayPal Launches New Digital Payments App With Crypto Capabilities
2038,MARA Stock Is Worth Over 45% More From Higher Bitcoin Mining Sales
2063,What is the safest way to create Paper BTC wallet?
2065,Bitcoin Mining Is Estimated to Represent 0.9% of Global Carbon Emissions by 2030
2072,"Bitcoin mining will contribute just 0.9% to total global emissions by 2030, even in the most bullish price scenario: NYDIG"
2075,Day 4 of a week in El Salvador using Bitcoin via The Paxful Lightning Wallet | Today Bri + Renata head to Santa Ana to visit small businesses making the most of Bitcoin
2095,Is there an easy and quick way to buy cryptocurrency with a credit card?
2096,Coinbase wallet and BEP20
2115,The University of Wyoming begins mining Bitcoin in an event that is the first of its kind in the history of the United States.
2130,Free share!!!
2148,"A dream coupled with Action creates reality. There are many scams out there but when you look closer. You will hit your gold mine finally. With a 5 year reputation, alot of usability and changing lives of millions across the globe. Join us here for a free presentation. https://t.me/nuiInternational."
2152,Why not mine?
2157,Free 1 Year Casa Gold Plan
2171,Should Bitcoin have a minimal constant inflation (say 0.1% per year) to keep mining profitable?
2172,Jack Maller's Comments on Twitter Integrating Bitcoin via Strike App
2173,How reliable is bte.cash
2175,Cold wallet
2179,https://decrypt.co/81879/bitcoin-ethereum-recover-from-chinas-latest-crypto-crackdown
2180,Mining on an ASIC miner block
2190,Get A free swan Bitcoin E-book and also you can earn Bitcoin with swan on Auto-pilot
2191,a site to help people understand the looming economic crisis we face
2195,Twitter: introducing Bitcoin payment feature on its platform
2224,"Hi, is anyone interested in investing for BTC mining?"
2227,China bans all forms of crypto trading and mining
2251,Help me mining
2255,"Message me for more legit details on our to start investing in Bitcoin platform now, if you are interested"
2264,"If you are interested to invest in Bitcoin and start earning money, just click on the link to join now"
2267,how do I setup bitcoin mining
2278,An NFT for the serious Bitcoin holder. Only 25 minted. Link in comments.
2293,Hackers Compromise Web Portal Bitcoin.org — DNS Hijack Replaces Site With BTC Doubler Scam
2312,bitcoin atm never gave receipt and still no btc in my wallet after 2-3hours
2314,Tarot Card predictions for Bitcoin
2328,Buying Bitcoin with a Credit Card
2329,ELI5 - private key vs hw wallet security
2334,Who can help me I only got 5$ free form coin base
2338,"Live trading seminar on going. Be part of my trading for a financial change. Bitcoin mining/forex has been beneficial to many seat at home while making money, don't doubt, give it a trial and testify letter."
2347,Any ideas which wallet this is?
2349,Buy Bitcoin with no fees on Strike App. Looks like I won't be buying on Cashapp anymore..
2351,hey guys this is the best site to moniter anything u need on the cloud try it out ..!!
2355,"I had about $40 worth of Bitcoin in 2014, finally regained access to my coinbase wallet here soon and waiting for account review to see what is in there. So would that mean I have approx. $8k now? (Newbie here) if so, would it be smarter to sell or hold?"
2356,"How much do YOU need Bitcoin to be, for you to be truly financially free"
2357,"Since China banned Bitcoin, exchanges should blacklist their wallet like they would a ransomware gang."
2359,Earn free bitcoin
2360,my link to start bitcoin mining
2378,You are the weakest link
2380,Get $10 of free bitcoin
2392,Hello. Free app for mining bitcoin!
2395,CoinJoin in Sparrow Wallet!
2397,"Share your Ticker Setup, Here is mine."
2399,"Share your Ticker Setup, Here Mine."
2405,Question to everyone who stores bitcoin in a cold wallet
2407,Look at this brilliant take. Unbelievable. https://fortune.com/2021/09/28/currency-of-alt-right-how-white-supremacists-and-far-right-use-bitcoin/
2411,Nayib Bukele on Twitter : First Steps of Volcano Mining
2416,El Salvador's volcano bitcoin mining is open for business
2438,Leading Crypto Mining Machine Maker Bitmain Said to Halt Sales in China
2500,Miami Mayor: China’s Crypto Crackdown ‘Creates Incredible Opportunity for America’ in Bitcoin Mining
2502,New Zealand Exploring Possibility of Issuing a Digital Currency. https://apple.news/AJXjSVJ-RSgegGXiM20ImFA
2505,"Am glad to introduce to you this Genuine company to earn cool cash while staying at home, I am benefiting from this company till date,that is why am sharing the goodnews with you because this was how I was directed too,click on the link and contact Mr Shawn Mendes and start earning like everyone"
2528,Anyone having problems with Green Wallet?
2529,Green Wallet
2553,What is the best/most trusted wallet for the lightning network?
2559,"Bitcoin investing app Relai has become a regulated Virtual Asset Service Provider (VASP) in Switzerland, allowing it to provide bitcoin brokerage services to customers in the country and Europe"
2585,How to connect your Trezor to your Umbrel Node using Sparrow Wallet - a short 2 minute video.
2591,"Let me teach you how to make $150,000 to $300,000 every week through bitcoin trading and all crypto mining"
2608,Blockfi credit card 👍
2616,"El Salvador Chivo Bitcoin Wallet Has Surpassed 500,000 Users"
2619,Question is Bitfarms a good buy they are using 99% clean energy to mine bitcoin !!
2634,Free $12 in bitcoin at first sign up
2639,Best Bitcoin Mining Software In 2021 2022
2642,Public keys and hardware wallet
2643,"“Bitcoin mining converts electrical energy into digital energy. In time, the world will view the production of digital energy for export no differently than the production of aluminum, steel, oil, or petrochemicals.” -Michael Saylor"
2647,"Bitcoin can reduce CO2 emissions, mining experts explain how"
2666,#1 HYIPs https://zetbull.com/?ref=Marduk420
2673,For guaranteed investment and resolve of complaints contacting on telegram @ https://t.me/FX_TRADING_SECRET_FREE1 or via whatsapp on https://wa.me/+1(732)8761165 all requests and complaints 100% assured
2675,"Laos is legalising Bitcoin mining. Laos has 78 hydropower plants with an installed capacity of 9,972 MW in operation. Laos only uses 1,222 MW. Countries with wasted renewable energy have an opportunity in front of them right now"
2680,Several Wallets on one app
2683,josealbertoherrera@gmail.com
2693,Airdrop - free coins! Not scam!
2720,SMARTHASHS CLOUD MINING?
2722,Selling all the $300 off in my wallet..first come first serve basis...dm now
2725,Hi guys I have a new way to start earning 0.3 Bitcoin for free no investment it's 💯 free and when you register you get 0.005btc all you need to do is claim 0.00005btc every hour everyday you just link on this link and get started making Bitcoin for free .😮🤑
2735,Wallet issue:
2748,Need a good wallet
2751,Lil Nas X and Cash App are giving away BTC
2757,Crypto Tab Browser
2786,blue wallet (app) lightning network recovery only qr-code or LndHub link???
2795,#ARB $ARBKF $ARBK Doesn’t get much more official for @ArgoBlockchain than the @Nasdaq website. IPO 23/09 CONFIRMED! Cracking close today too! src: nasdaq.com/market-activit…
2816,"Finally, I’ve already bought mine!"
2820,How do i convince someone cloud bitcoin mining is a scam
2822,How do i convince someone bitcoin mining is a scam?
2824,"So, I found a way to get free bitcoin! Comment if you have questions, I'm glad to help!"
2839,Coinbase adds hardware security keys for logging in
