,id,author,vader,title,created_utc,num_comments,score
2591,i1z6mx,mysticcannabinoid,0.0,Fellas I know this is not the correct sub to be posting this but I need some advice on a move on diversifying my portfolio For now I have no income so I can only take out money I had already invested I have  percent bitcoin and  percent vechain How much of a future does vechain have ,1596313815,0,1
2592,i1z0av,arijitdas,-0.8402,Three People Accused of Executing Massive Twitter Attack Stealing More Than  in Bitcoin,1596313236,1,1
2593,i1yzet,Simps100moyo,0.7184,Where and How to buy BTC and ETH on the internet,1596313154,0,1
2594,i1yyhi,XToken_org,-0.296,Why is no one talking about IRIS,1596313100,0,1
2595,i1yvqp,TLDRTaylor,0.0,Bitcoin Unhackable It Happened twice Not Blowing Smoke,1596312928,2,1
2596,i1yv9a,CryptoDanO,0.4404,How do you decide when to take Profit both as Trader and HODL,1596312896,0,1
2597,i1yu3q,At0m11c,0.0,Leta go bitcoin new ath incoming,1596312815,7,1
2598,i1yswq,Shamrock9827,0.7096,Is XRP a good Long Term Investment,1596312734,0,1
2599,i1yrk5,criiiiiiiisp,0.0,Bitcoin just surpassed  Euro,1596312640,3,1
2600,i1yrgn,anonymousxo,-0.0516,Noob in New York who cant sign up for binance  should I look for another exchange,1596312634,2,1
2601,i1yfkt,blessive,0.0,President Putin signs new bill to prohibit crypto payment in Russia by ,1596311533,0,1
2602,i1yeub,squireofrnew,0.7184,The price of a moon,1596311458,2,1
2603,i1yahs,SamZFury,0.5994, Bull Market in a Nutshell,1596311030,1,1
2604,i1y6iu,myhaxdontwork,0.0,Its gonna be a wild ride,1596310659,3,1
2605,i1y1qf,PapiPoseidon,0.6478,Which Cryptocurrency is the most undervalued coin do you guys think,1596310197,2,1
2606,i1xvqr,stanley9528,0.0,Crowdsale Is Live Now Tycoon Unveils Token Online Shop,1596309604,5,1
2607,i1xvcy,NoNutNovermber42069,-0.6124,Another scam ad YouTube,1596309562,6,1
2608,i1xuc2,davidoseven,0.6597,I have around k of crypto within a checkbook controlled self directed Roth IRA structure What would be your long term play here Im  years old,1596309452,2,1
2609,i1xpmp,kacatheleader,0.0,How to get into cryptocurrencies,1596308992,0,1
2610,i1xnfx,velly77,-0.8519,HODLing Tulips since and you cant HODL bitcoin from shame shame shame,1596308782,9,1
2611,i1xa8m,Liverymen,0.3612,Can someone recommend a crypto exchange that does this,1596307485,0,1
2612,i1x6s4,tycoon_io,0.0,Tycoon Crowdsale is LIVE,1596307162,0,1
2613,i1x642,lTortle,0.34,Is there any crypto tax software that tells you if a trade will be taxed as long or short term capital gains in real time,1596307094,2,1
2614,i1x43y,sylsau,0.6908,Bitcoin Gives Everyone an Equal Opportunity and Thats Truly Revolutionary,1596306897,3,1
2615,i1wy5j,nocluewhat2do14,0.0,I sent my ample to my ethereum address,1596306313,0,1
2616,i1wsqu,shinyspirtomb,-0.6124,PSA If you see a cryptocurrency scam advertisement on Youtube you can report them here,1596305775,0,1
2617,i1wpon,trenbonz,0.5319,THIS IS WHAT BIDAO WARRIORSTROLL AND SHILLS DO BEST ND TO CHEERLEADING FOR A SCAM ICO BIDAO BID TOKEN  FUNNY THING IS THEY STILL THEMSELFS ARE FOOLED AND SCAMMED amp BELIVE ITS LEGIT SMFH HEY WARRIORS STICK TO SUCKING BECAUSE INVESTING IS NOT YOUR THING bidao bidaoscam ,1596305471,0,1
2618,i1wlfg,Paytrill,0.0,Paytrill A cryptocurrency you can count on,1596305080,2,1
2619,i1wbqp,Qryptoskydiver,0.2732,Well I got my initial investment out  and then some,1596304128,13,1
2620,i1vyxp,Always_Question,0.5766,Reducing Gas Costs by Migrating Tether to L,1596302894,10,1
2621,i1vxl3,DannyWhoElse,-0.7184,How to sell,1596302764,0,1
2622,i1vtvz,Vassera,0.0,Withdraw Options,1596302390,0,1
2623,i1vnr6,Sparkspsrk,-0.4019,Long time lurker in this sub Been investing slowly but steadily since  My portfolio just broke ,1596301773,2,1
2624,i1vkvm,capt-Ipkiss,0.0,Crypto in Russia,1596301493,0,1
2625,i1vfp1,gourangabishoi,0.2732,Never depend on single income Make investment to create a second source,1596300983,1,1
2626,i1vd3l,blessive,0.0,Coinbase Considers Listing Ethereum DeFi Tokens Ampleforth Balancer Band Curve Kava,1596300724,2,1
2627,i1v6ag,bawdyanarchist,0.2023,Monero Devs Solve Cross Chain Atomic Swaps with Bitcoin,1596300011,58,1
2628,i1v4mk,burstymy,0.0,The total Ethereum fees have been surpassing Bitcoins fees for a month and a half now,1596299834,68,1
2630,i1uyuo,Rodcorte,0.0,What is this,1596299283,14,1
2631,i1uy8r,crypto00700,0.0,ethereum mining ,1596299222,0,1
2632,i1ulw3,Lumin8_Crypto,0.296,BTC News Today  Bitcoin  SEVEN Times Your Money By HODL,1596297949,3,1
2633,i1ud93,medicalstudent83592,0.0,ChangeNOW,1596297057,0,1
2634,i1u7s8,At0m11c,0.0,Matthew Mcconaugheys reaction to Bitcoin price,1596296466,2,1
2635,i1u4i4,UnknownEssence,-0.4588,Ethereum Classic has been  attacked again,1596296151,4,1
2636,i1tzpb,1776Aesthetic,0.0,DMM to launch Governance Dashboard,1596295669,1,1
2637,i1txv3,ethereumflow,0.0,Ambrosus is Open for Business A Two Week Recap,1596295482,0,1
2638,i1tugx,snowyflat32,0.5994,Wealth Producing Assets as a Hedge Against Inflation,1596295135,2,1
2639,i1tk2w,gcbeehler5,-0.4767,Binance on Twitter  etc  attack,1596294049,0,1
2640,i1tjla,ethereumflow,0.0,Nearly  Million in Bitcoin Moved to Ethereum in July Led by Retail Traders,1596294003,1,1
2641,i1tikh,TaoOfSatoshi,-0.4767,Scammers get arrested Blockchain for gamers Talking Dash DApps and more  CATV LIVE today at PM UTC,1596293887,3,1
2643,i1teoc,globobenito997,0.0,Reporting EVERY LITTLE transaction to the tax man IRS Really necessary,1596293467,0,1
2644,i1t9as,nanooverbtc,-0.4588,ETC  attacked chain reorganized,1596292885,2,1
2645,i1t7cj,Leoak47,0.8164,Do you guys recommend putting money into VET Please dont say do your research because I have done it and want others opinions Why would you put money into it or why wouldnt you put money into it Do you see actual use for the project do you not see actual value of it Thanks,1596292672,2,1
2646,i1t4pa,MagoCrypto,0.0,How yall sound talking to girls,1596292378,23,1
2647,i1t3s3,Leoak47,0.9077,Do you guys recommend putting money into VET Please dont say do your research because I have done it and want others opinions Why would you put money into it or why wouldnt you put money into it Do you see actual use for the project do you not see actual value of it Any help is great,1596292277,2,1
2648,i1t1ho,Leoak47,0.6784,Do you guys recommend putting money into VET Please dont say do your research because I have done it and want others opinions Why would you put money into it or why wouldnt you put money into it Do you see actual use for the project do you not see actual value of it,1596292012,2,1
2649,i1t0td,Leoak47,0.9494,Do you guys recommend putting money into VET Please dont say do your research because I have done it and want others opinions Why would you put money into it or why wouldnt you put money into it Any help would be great and appreciated,1596291927,2,1
2650,i1t0cv,Leoak47,0.7658,Do you guys recommend putting money into VET Please dont say do your research because I have done it and want others opinions Why would you put money into it or why wouldnt you put money into it,1596291875,2,1
2651,i1syzx,Leoak47,0.6808,Do you guys recommend investing in VET  Please dont come and say do your research because I have done it I want other opinions on why they say yes or why they say no,1596291718,2,1
2652,i1sp13,mngigi,-0.4767,nd  attack on Ethereum Classic,1596290600,61,1
2653,i1sbsv,Selina_Mary,0.6908,Altcoins enter a bullish trend,1596289043,0,1
2654,i1sbab,AnonyUwuswame,0.0,BTC Charts,1596288982,0,1
2655,i1s8eo,CarterSullivan,0.25,Magicoin XMG is predicted to experience a massive surge in popularity Invest amp start mining now while the price is low,1596288633,2,1
2656,i1s4rs,JardJard,0.0,Try to tell me I dont have a future in TA,1596288172,0,1
2657,i1s4qi,stelescu,0.7184,How to buy crypto,1596288166,0,1
2658,i1rwuq,MammothSir9,0.2023,Block  Bitcoin Cash Fans Worldwide Celebrate the Cryptocurrencys rd Anniversary,1596287169,0,1
2659,i1ru9n,0XenaCro,-0.4356,CryptoTab MINING HAS NEVER BEEN EASIER,1596286855,0,1
2660,i1rswa,EuW_MadWard,0.0,Trying to get rid of your bags in ,1596286682,12,1
2661,i1rq65,blessive,-0.5423,The issue of scammers and bad actors within the crypto space,1596286327,0,1
2662,i1ro3o,slywalkers,-0.1779,This is where I now hide my private key or mnemonic seed,1596286048,105,1
2663,i1rmui,adamis1985,0.5423,Claim your bonus ,1596285877,0,1
2664,i1rm17,Plutusedge15,0.0,Bitcoin FOMO Is Back,1596285784,0,1
2665,i1rf63,Summer_2021,-0.1027,Top  cryptos Whats missing What shouldnt be here What is actually being used today,1596284885,26,1
2666,i1r9kv,lookingforacistrash,0.0,Burning tokens sounds kind of nazi,1596284117,6,1
2667,i1r90l,Davejrworld,0.0,Anyone have a price prediction for Elrond,1596284037,0,1
2668,i1r8x0,getyourcryptocard,0.5423,Bonus ,1596284022,1,1
2669,i2qxdk,blessive,0.0,ETH Price Recovers to  Following Hectic Day But Whats Next Ethereum Price Analysis,1596430328,0,1
2670,i2qxa6,slywalkers,-0.1531,The new protesting sign Bitcoin  peaceful protest against the corrupt banking system,1596430315,48,1
2671,i2qv9q,nanooverbtc,-0.2023,Bcash developers want to change the block time but roger ver is opposed ,1596430042,19,1
2672,i2qi38,paul_t1mfv,0.0, Business Development Blockchain Career GuideIndepth Analysis,1596428369,0,1
2673,i2qcfy,AHoomanBeanz,0.5859,Forex trader looking to start trading Crytpo as well help with brokers and lot sizes,1596427663,10,1
2674,i2q2it,absurd_world,0.0,All cryptos down except doge have reason to believe it goes up  or more tonight,1596426468,0,1
2675,i2prjv,TechAdept,-0.0516,Reddcoin RDD Block Party  July  Redd Core Developer AMA User QampA  YouTube,1596425150,2,1
2676,i2pa3r,blessive,0.0,DeFi vs Stablecoins Volatility returns to crypto markets,1596423135,0,1
2677,i2p9q0,Phroneo,0.2023,ShareRing Uses Blockchain to Solve Self Sovereign Identity and Proof of Health Simultaneously,1596423089,2,1
2678,i2p5ce,ffstick43,0.6369,Best Crypto Ticker,1596422567,0,1
2679,i2oj9u,RepoTactics1,0.3818,ShortTerm Trade Receivables Harbor Trade Credit MCD Collateral Application,1596420034,0,1
2680,i2o9ft,Xhyaephurian,0.6808,If you are interested in easy crypto,1596418951,0,1
2681,i2nuca,EvanVanNess,0.0,Latest Week in Eth News ,1596417302,3,1
2682,i2nr13,BountyPh,0.0,VITE AND STATICS,1596416939,2,1
2683,i2nqss,_risho_,0.0,What are the pros and cons of bitcoins UTXO based model vs Ethereums account based model,1596416913,10,1
2684,i2nmx7,nice2yz,0.3089,How Not to Lose Your Cryptocurrency License in Estonia,1596416506,2,1
2685,i2nlzg,_risho_,0.4404,What are the pros and cons of bitcoins UTXO based model vs Ethereums account based model Is one objectively better than the other or do they serve different usecases,1596416413,2,1
2686,i2ndvg,babybird80,0.0,Crypto Novice,1596415561,0,1
2687,i2na5o,tesa23,0.296,Crypto is the word and world  join crypto now,1596415163,1,1
2688,i2n5ek,SuccessfulNick,-0.0258,Curious to know thoughts on this Seemed like a typical scam at first but after extensive research it appears to be legit Just takes time and your  investment supposedly turns into more Can anyone give more input,1596414701,9,1
2690,i2mg5a,burstymy,0.0,Uniswap DEX Overtakes Gemini Bittrex Poloniex in Trading Volumes,1596412075,0,1
2691,i2mae9,troytrojan01,0.765,Why is NULS undervalued Especially with their Proof of Credit Mining,1596411470,1,1
2693,i2ln2n,Zippah,0.4588,DeFi explosion pushes Ethereum price to  high,1596409053,2,1
2694,i2ljtv,blessive,0.3182,A bitcoin ETP is now actively managed on the Swiss SIX exchange,1596408729,2,1
2695,i2lirg,atlanticide,0.4767,SAY IT LOUDIM INTO XRP AND IM PROUD,1596408619,2,1
2696,i2lim6,CryptoCarlosUK,0.7184,What would I buy with  in crypto today,1596408603,4,1
2697,i2lhbr,coolfarmer,0.3612,I heard you like ICOS,1596408470,3,1
2699,i2kvjs,ethereumflow,-0.4215,Bitcoin as an Investment for a Recession,1596406308,6,1
2700,i2khri,Plutusedge15,0.0,Bitcoin surpasses  then tumbles in wild weekend action  Bloomberg,1596404955,0,1
2701,i2kg0u,Arthur_Pug,-0.4215,Kolomine VOT scam tokenexchange alert,1596404780,0,1
2702,i2kdpd,mo_kae,0.7184,where to buy crypto currency with paypal,1596404553,0,1
2703,i2ka21,manjaro_fan,0.0,Is Binance USD reliable,1596404209,8,1
2704,i2k8bx,manjaro_fan,0.0,Is Binance reliable,1596404041,0,1
2705,i2k5qe,TheCryptomath,0.0,It could have been you ,1596403795,5,1
2706,i2k3p1,Crypto4Canadians,0.4404,This ONE THING Has Helped Me Be A Profitable Trader,1596403594,16,1
2707,i2jtk4,Randomplayeri,0.2263,Stimulus Check Put Into Bitcoin Is Now Worth Over ,1596402617,152,1
2708,i2jof6,Cryptodelphiadotco,0.0,The Sunday Dips are Back,1596402129,2,1
2709,i2jlqe,newspaperreader,0.0,gramfree fans,1596401867,2,1
2710,i2jkbn,monethical,-0.5106,Top and worst coins according to trend and momentum indicators August nd,1596401730,2,1
2711,i2ji9p,blessive,-0.743,Why Bitcoin Is a Bad Investment for a Recession,1596401533,2,1
2712,i2jheu,MeghanOlseni,0.0,Posted about Centric CNS a few days ago on here Now its up ,1596401453,6,1
2713,i2jf2r,Huwhite_Wharrior,-0.1027,Anon got BOGGED hard,1596401225,6,1
2714,i2je0r,numberONEdasher,0.0,Today I discovered the news about Donut Coin Now I am all in on DONUT running on Ethereum ERC Dogecoin Zcash Bitcoin real peer to peer,1596401120,0,1
2715,i2jatk,lj26ft,0.6908,Institutional investors benefit most from OCC crypto clarity,1596400817,1,1
2716,i2iyu9,TheCurrencyA,0.5719,Stellar Lumens XLM Anyone Can Develop a Stable Coin Like Tether USDT,1596399660,1,1
2717,i2ipq5,MammothSir9,0.357,China Never Banned Bitcoin as Commodity Beijing Arbitration Commission Explains,1596398782,2,1
2718,i2iji0,zghorner,-0.4215,Former Cryptocurrency hater looking to learn,1596398215,68,1
2719,i2i9ew,iusedtofuckmyferbies,0.0516,Lol warren lied about having btc ,1596397263,2,1
2720,i2i71p,numberONEdasher,0.8271,I need some help here figuring out which coin to buy,1596397042,4,1
2721,i2i423,joycesticks,0.0,The ResearchCoin Whitepaper  an ERC token designed to accelerate the pace of scientific research,1596396751,0,1
2722,i2i3hh,misterflyyy,0.296,Me just finding out yall make money off karma,1596396698,11,1
2723,i2i05s,andewthomson,0.128,DeFiRev Exclusive Interview  Inside the Mind of Sam BankmanFried the genius behind FTX amp Alameda Research,1596396381,0,1
2724,i2hszi,GorticusSmash,-0.6597,Has anyone ever heard of an exchange deposit being blocked because the Recharged failed,1596395687,1,1
2725,i2hhg2,buyingthediptoday,-0.5994,Vertical climbs beget violent retraces,1596394634,0,1
2726,i2hgy9,divertss,0.0,What is your little known alt coin moonshot,1596394586,114,1
2727,i2hgxk,Fabudabu,0.0,searching crypto blog,1596394585,0,1
2728,i2hef4,jhnlerner,0.0,HBar Destination Tag,1596394356,0,1
2729,i2h3o8,Heady_Wook,0.296,Join us for the final episode of our Bitcoin full node deepdive series with Ronin Dojo live today on YouTube at pm PDT ,1596393362,0,1
2730,i2h0f6,Automated_Trading,0.0,AUTOMATED TRADING,1596393067,2,1
2731,i2h04w,valz7007,0.2023,Top Secret Military Grade Bitcoin System,1596393039,0,1
2732,i2gs8u,tompower11,0.0,Earn XLM on coinbase,1596392291,2,1
2733,i2gq3w,legionlegend90,0.0,Mineable Crypto ON phone,1596392090,0,1
2734,i2go6v,ethereumflow,0.6808,For any ADA holders patiently waiting Exodus is now ready for Shelley Mobile pending approval desktop a go,1596391903,15,1
2735,i2glsc,nanooverbtc,0.4588,Bakkt had  in volume this week amp  in open interest,1596391676,5,1
2736,i2gd3h,TLDRTaylor,0.0,Spotted in The Economist,1596390881,2,1
2737,i2gcbp,philanthropyhustle,-0.6124,Today i received  Adverts surrounding the ETH Scam,1596390809,0,1
2738,i2gbh1,blessive,0.4588,Chainlink Marines Buy the Dip Anticipating New AllTime Highs,1596390731,0,1
2739,i2g5te,ShotBot,0.4404,More Ether Holders Are in Profit Than There Are BTC Addresses in Total TheFlippening,1596390184,0,1
2740,i2g5ar,[deleted],0.4404,More Ether Holders Are in Profit Than There Are BTC Addresses in Total,1596390135,2,1
2741,i2g3vu,sylsau,0.7003,The Next Bitcoin Bull Run Will Be Different for the Better,1596390007,13,1
2742,i2fv1r,Crrunk,0.6369,What are the best sources for cryptoinvesting information and analysis Sources without sensationalism,1596389160,26,1
2743,i2fu2i,nanooverbtc,0.4939,Bitcoin Is Riding High Again as Investors Embrace Risk,1596389067,4,1
2744,i2fro7,nanooverbtc,0.2263,Peter Schiff going straight to the burn ward,1596388846,2,1
2745,i2fram,chrysotileman,0.0,Psychic gives feedback on Zilliqa you wont believe the outcome,1596388812,1,1
2746,i2fnhk,PhysicalPool2,0.4404,Pleased To announce the Crypcore Exchange,1596388441,0,1
2747,i2fdo3,lowlarkin,0.0,Is this too late or too early,1596387498,36,1
2748,i2fd5n,ShotBot,0.0,The FLIPPENING is happening,1596387448,54,1
2749,i2eoyd,Aodin90,0.0,New to Cryptocurrency some advice needed,1596385077,0,1
2750,i2eisc,tradingedu,-0.0258,Understand The Markets Before Risking Your Money,1596384458,0,1
2751,i2efml,BlackHertis-50Cents,0.0,GramFree,1596384148,0,1
2752,i2eene,nullifies,-0.1531,Ive been away from crypto for  years what headlines did I miss,1596384062,15,1
2753,i2e9bq,blessive,0.5574,Things are looking up for Bakkt as it records positive movement for bitcoin futures,1596383539,2,1
2754,i2e6zm,dukenewcome93,0.4588,Building interest on crypto,1596383303,0,1
2755,i2dwr2,dchen000,0.5106,What currency do you like outside of the top  by market cap,1596382257,0,1
2756,i2dtz3,dchen000,0.5106,Which crypto do you like that is outside the top  by mkt cap,1596381953,0,1
2757,ibxj8m,MammothSir9,0.0,Sichuan Officials Continue to Foster the Relationship Between Bitcoin Mining and Hydropower,1597741572,2,1
2758,ibxdqm,blessive,0.4215,Popular US magazine names Ripple among the fastestgrowing companies in America,1597740730,2,1
2759,ibx25u,bextman,-0.6124,AMPL Ampleforth is a scam Stay away,1597738907,0,1
2761,ibwysy,katesatoshi,0.0258,WhiteBIT reduced VisaMasterCard deposit and withdrawal fees for UAH to  Cheapest fiat onoff ramp in Ukraine,1597738383,1,1
2762,ibwqtg,blessive,0.0,BTCUSD Recovers Below  from Early Blitz Sally Hos Technical Analysis  April  BTC,1597737131,0,1
2763,ibwlbw,doge_c137,0.4215,that is a satisfactory number,1597736251,3,1
2764,ibw7q3,Copperfield1,0.0,HODL,1597734198,1,1
2765,ibw6an,Significant_Station1,0.0,Earn cryptocurrency,1597734003,0,1
2766,ibw5q0,parakite,0.0,Bitcoin Nodes Summary,1597733921,3,1
2767,ibw34b,blessive,0.6369,The Babylon Project A Blockchain Focused Hackathon with a Commitment to Diversity amp Inclusion,1597733523,0,1
2768,ibw1b0,Shradha_Singh,0.4588,What is making BAT and TRON move that high,1597733256,0,1
2769,ibw0ua,hodlnautwallet,0.7906, Quick Tips to Increase Online Security and Protect Your Crypto Assets,1597733180,0,1
2770,ibvyw6,Newmovement69,0.5859,Grayscale opens trading for Bitcoin Cash Litecoin Trusts with M in assets  Decrypt,1597732901,4,1
2771,ibvyeu,ivehadsomesexokay,0.0,Nano S Survives NormalCold Cycle,1597732825,18,1
2772,ibvxbb,ivehadsomesexokay,0.296,Surviving the Normal Cold Cycle,1597732656,0,1
2773,ibvrrz,YANAF_Online,0.0,Crypto communities for mental healthaddictions,1597731868,0,1
2774,ibvost,aurumherba,0.0,BITCOIN steigt auf ber   US Dollar  BITCOIN vs GOLD News deu,1597731445,2,1
2775,ibvmtq,undergroundinvesting,0.5704,Most bitcoins already cost at least k but probably more like  million Michael Goldstein,1597731172,0,1
2776,ibvj5j,ethereumflow,0.0,My first  days in crypto Sort of a beginners guide based on my time in the community,1597730661,0,1
2777,ibv6lk,ethereumflow,0.0,My first  days in the crypto community a guide I wrote from my journey into crypto community,1597728960,1,1
2778,ibv6fb,FishStix_ish,-0.7906,bad meme idea bad execution,1597728937,2,1
2779,ibv45q,iiSTEPHEN8,0.0,GET UNIQUE INVESTMENT IDEAS,1597728634,2,1
2780,ibv3lz,dontworrybehodl,0.128,The next x coin  Launched today  KEN,1597728560,0,1
2781,ibuv02,hansl45,0.0,Do you know its a plus token,1597727448,0,1
2782,ibum0t,blessive,0.0,France further its CBDC experiment for a digital euro,1597726325,0,1
2783,ibucmg,RipeForInvesting,0.0,BAT,1597725143,2,1
2784,ibuc2l,heythere1000349,0.0,New to crypto thoughts on what I bought,1597725082,0,1
2785,ibubi4,CryptoHopeful,0.0,Yahoo Finance Article Qtum Launches Multi Million Dollar Developer Fund and Goes All in on Defi,1597725015,4,1
2786,ibu9s9,vonkatmandu,0.0186,I have k that I wanna wish to invest in crypto without caring about what will happen to it for the next  years or so,1597724810,0,1
2787,ibu5hd,10000xHEX,-0.6369,Did Andreas Antonopoulos abuse his influence and troll a coin,1597724313,0,1
2788,ibtz9p,cbdr1ch33,0.0,Newbie Can you explain different markets amp volumes,1597723575,0,1
2789,ibtyu7,bakerej,0.6249,Great interview with Jimmy Nguyen President of Bitcoin Association,1597723527,2,1
2790,ibtyjx,BTC_Kook,0.0,Unpopular Opinion Dr Craig Wright is Satoshi Nakamoto,1597723501,19,1
2791,ibtxhs,genius3edition,0.0,What are the most talked about coins of ,1597723376,14,1
2792,ibtqu9,MikeYEAHMusic,0.0,I have made my mark in history with this new Bitcoin song Check back in  years,1597722617,3,1
2793,ibtlzc,TheFreeCryptoPress,-0.25,New Channel Teaser,1597722068,0,1
2794,ibtipr,Suitguy2017,0.5267,IDEX stakers winning recieving payouts for over  years,1597721698,3,1
2795,ibt4cm,horizondecadance,0.0,My thoughts on FLOW,1597720114,0,1
2796,ibt3rz,Rosinball,-0.4404,Which altcoin do you believe will be used to pay off mortgages and other debt past ,1597720052,0,1
2797,ibsnxb,trogdortb001,0.6249,Its time to get real because the market is going up and all the new users here could lose their crypto Here are the  best things you can do to protect yourself amp your funds,1597718365,2,1
2798,ibsniw,merryyeetmas117,0.6369,Best crypto indices,1597718316,0,1
2799,ibsj7s,ethereumflow,-0.6249,Amid US Postal Service Crisis USPS Files Patent for Blockchain Mailin Voting Scheme,1597717873,8,1
2800,ibsik1,J2Duncan,-0.5423,Days Since Last Bad Trade Bitcoin Mug,1597717800,2,1
2801,ibsc9h,Davidm523,-0.0772,Reliable sources Serious,1597717153,0,1
2803,ibs2xl,logohere,0.0,ZAP Protocol Reddit Community AMA Questions,1597716201,0,1
2804,ibrw4b,FatSora,0.0,Wonder what Banktoad thinks,1597715518,5,1
2805,ibrh7f,Dalo2003,0.296,How to make money fast,1597713959,0,1
2806,ibrcx7,-End-,-0.2973,After a few years of hodling and DCA when Im able I have finally broke into the green For anyone who is still in the red just have patience Crypto is not going away Good luck out there HODL Gang,1597713513,35,1
2807,ibr6yl,TecuaniTec,-0.7579, Bitcoin critics turning a   Bitcoin is  in world currencies beating New Zealand  Russia Dumping US Dollar  Warren Buffet sells Banks buys GOLD  Its just getting started,1597712887,8,1
2808,ibr6ob,Frostbite282,0.0,Qtum Launches Multi Million Dollar Developer Fund and Goes All in on Defi,1597712857,15,1
2809,ibr42e,someone3245,0.0,Does anyone know how to find the earliest price of OPQ,1597712591,4,1
2810,ibr2n1,JoJopama,0.4767,Bitcoin Cash and Litecoin Trusts from Grayscale Investments Begin Trading  Finance Bitcoin News,1597712457,1,1
2811,ibqyhv,The_Evil_Panda,0.25,How do I pay tax on my crypto gains,1597712025,0,1
2812,ibqvac,VillainRavage,0.3612,Get ready for ETH  and say goodbye to gas fees,1597711701,4,1
2813,ibqumy,Yuri_Jai,0.128,NEW x in DeconstructedDecentralized Bitcoin Art Print on pearlized luminous paper,1597711630,2,1
2815,ibqezg,Teknotokon_II,0.4404,Would Greyscales Digital Large Cap Fund be a good investment,1597710004,7,1
2816,ibq6qn,-Just_Another_Guy-,0.3612,It looks like ChainLink is beginning a cooldown period,1597709169,8,1
2817,ibq6p7,MammothSir9,0.4767,Bitcoin Cash and Litecoin Trusts from Grayscale Investments Begin Trading,1597709165,0,1
2818,ibq1p5,instafxck_itz_freddy,0.0,NEW CRYPTO CURRENCY,1597708686,0,1
2819,ibpy5x,blessive,0.3612,Trade Like a Chad Guide to Ethereum Options Trading,1597708334,2,1
2820,ibpe58,otherwisemilk,0.0,The state of fees right now,1597706360,17,1
2821,ibp6fa,jeremyisreal1,0.8271,Convinced step dad to buy bitcoin and now he thinks hes an expert in SHITCOINS how do I talk him off the ledge,1597705603,0,1
2822,ibp5f7,johnsons97,-0.2732,Profit trade scam,1597705505,0,1
2823,ibp4dc,Psychological_Leg,-0.296,Does anyone know how come James Altuchers Crypto Trader program is no longer available,1597705402,0,1
2824,iboyru,BitcoinIsDigitalGold,0.8658,Litecoin Gets Bullish Again As Mimblewimble Upgrade Approaches,1597704861,2,1
2825,iboxbe,blessive,0.0,Bitcoin Hits  Ethereum and XRP Breakout,1597704726,0,1
2826,ibov52,[deleted],-0.1531,Is DEFI the next ICO craze And How will the bubble pop,1597704524,0,1
2827,iboszw,walkonwayvs,0.0,Just posted this article series about everything you should be using in crypto let me know what you think,1597704317,4,1
2828,iboim8,monethical,0.2023,Top coins according to trend and momentum August th,1597703386,0,1
2829,ibogrf,ArrayBoy,0.25,Can we all just admit eth failed to scale after all the shit they gave bitcoin bitcoin succeeded and eth failed in this regard,1597703217,2,1
2830,iboecx,guhraffe999,0.6124,I need your help please,1597702997,0,1
2831,ibod6u,seagullsuser,-0.5859,ETH Fraud,1597702892,2,1
2832,ibo69p,betsie2k,0.7579,Best blockchain book recommendations please,1597702277,2,1
2833,ibo50e,Administrative-Bag-6,0.4404,Thanx guys i now know kucoin is a good exchange,1597702162,0,1
2834,ibo3qa,Terrible-Control6022,0.6124,I need some help please,1597702052,0,1
2835,ibnrnc,intothecryptoverse,0.0,Bitcoin price prediction using logarithmic regression,1597701000,4,1
2836,ibnjaf,Michalux,0.6908,Why am I still bullish on Ampleforth,1597700239,0,1
2837,ibnhte,acobyt,0.7983,TOP Alt Coins with Huge Potential What is Trust Swap XIO Update,1597700108,0,1
2838,ibnguj,crypjunkie,0.0,Crypto Zoidberg  Author of CryptoNote  Reigning Privacy King,1597700021,2,1
2839,ibmxnr,MammothSir9,0.0,RMPL Launches Revolutionizing the Cryptocurrency Market with a Decentralized Elastic Supply Model,1597698364,0,1
2840,ibmwli,New_ShitLord,0.0,Beware of phishing Crypto ads,1597698275,5,1
