,id,author,vader,title,created_utc,num_comments,score
4187,j6j88k,CmMozzie,-0.4767,John McAfee has been arrested and awaiting extradition to the US,1602039353,0,1
4188,j6j7sm,djpearson,0.7579,In the past few years interest in cryptocurrencies has surged This interest has prompted,1602039301,0,1
4189,j6j7jk,imaducksfan,0.0,Google Teams up with EOS,1602039273,3,1
4190,j6itlo,imaducksfan,0.0,Google Joins forces with EOS,1602037660,0,1
4191,j6ir2s,DarkestChaos,-0.9299,John McAfee Really Arrested  Google EOS Block Producer  UK Crypto Ban  Bitcoin Death Cross,1602037396,0,1
4192,j6ioq8,yohandrei,0.0,Korea,1602037134,6,1
4193,j6im85,JJ_RABBID,-0.3412,Why its almost impossible not to profit with Xplosive Ethereum xETH,1602036858,0,1
4194,j6ijim,Cryptolexicon,0.3626,LaborX  Finding a job or sidegig in the Blockchain industry has gotten a little easier,1602036549,1,1
4195,j6ihw6,wgcole01,0.0,Ripple Outlines XRP Adoption Strategy Unveils RippleX and Ripple Impact,1602036366,2,1
4196,j6ibae,vrom_von_beyond,0.0,MOBI Announces the First Electric Vehicle Grid Integration Standard on Blockchain in Collaboration with Honda PGampE and GM Among Others,1602035652,0,1
4197,j6iadk,elonmusk-A12,0.0516,The first BLOCKCHAIN currency Start mining on your phone today before it reaches  million users currently at  million,1602035544,2,1
4198,j6i1m7,owolf8,0.6124,Thinking about moon and this song is stuck in my head,1602034562,0,1
4199,j6i0tm,jinglejangle106,0.0,SingularityNET AGI,1602034475,0,1
4200,j6hwsa,karoman25,0.3182,The Truth about Bitcoin,1602034028,4,1
4201,j6hn0o,MammothSir9,-0.2263,The Search for Satoshi Nakamoto A Look at  Suspected Bitcoin Creators,1602032950,0,1
4202,j6hltu,Vignaroli,0.5982,Oh no Ripple to leave the US Yes I agree it would be more fitting to have Ripples run their pretend empire from a caribean island That will so help their legitimacy,1602032821,13,1
4203,j6hfgx,OrganicDroid,0.0,Meanwhile at the shitcoin factory,1602032134,16,1
4204,j6heyz,blessive,0.0,UK Bans Retail Investors from Buying Bitcoin Derivatives,1602032080,2,1
4205,j6haks,I_LIVE_ON_THE_SUN,-0.8074,Inside the JPMorgan Trading Desk the US Called a Crime Ring Charged with criminal racketeering and may pay a record  billion dollar fine,1602031607,6,1
4206,j6h9jh,darkelfas,0.4215,A true holder,1602031493,27,1
4207,j6h9fw,badaccountant28,0.0,When bitcoin drops,1602031480,4,1
4208,j6gz80,karoman25,0.0,Maximalists vs Spreading,1602030385,26,1
4209,j6gxqe,darkelfas,0.0,A lil confession we can all relate to,1602030220,4,1
4210,j6gw5d,installeris,-0.4404,Dirty,1602030052,3,1
4211,j6gvzl,girlshero,0.34,Todays value from  investment,1602030034,2,1
4212,j6gqqa,I_LIVE_ON_THE_SUN,0.5719,My boss loves the work I put in,1602029483,3,1
4213,j6ggbo,soustecky,-0.0243,dOnT wOrRy AbOuT tHe DeBt,1602028390,3,1
4214,j6ggbb,I_LIVE_ON_THE_SUN,-0.4023,You cant trust the government and the fed,1602028389,0,1
4216,j6g7v7,scottsimon36,0.4404,Ten cryptos rated as better tech than Bitcoin XRP,1602027472,7,1
4217,j6g720,GiubSon,0.3071,my clueless friend got into something she has no idea about shes not able to withdraw her fund saying that she has to upgrade her membership to gold in order to do so i thought it was just private trading on some asian exchange but it seems she got into something more than that any idea,1602027387,10,1
4218,jfjlm2,scara89,0.0,Just In Judge sign the Kik vs SEC proposal Its over ,1603307926,1,1
4219,jfjkw4,TR5_,0.3182,Currencies now supported by PayPal,1603307867,5,1
4220,jfjk9y,gdj11,0.0,His name was Satoshi Nakamoto,1603307815,2,1
4221,jfjghe,DavePi81,0.0,Just sold all my btc,1603307489,14,1
4222,jfjewm,i_dont_feel_creative,0.6908,Now that we are bullish again,1603307360,1,1
4223,jfjbn6,maytorge1984,0.3612,We ready for Liftoff,1603307092,8,1
4224,jfjaxa,KNTXT,0.0,Litecoin Surges After PayPal Includes It Among the Cryptos Customers Can Buy Sell Hold,1603307035,4,1
4225,jfjawh,Wulkingdead,0.0,University to Send Private Ethereum Blockchain Into Space,1603307033,2,1
4226,jfjalo,TelliTaleHeart,0.0,PI NETWORK MINING INVITATION,1603307007,0,1
4227,jfj789,Weasel435,0.5766,Polymarket prediction market running on Ethereums L Matic raised funds from Naval Ravikant Balaji Srinivasan etc Coindesk,1603306733,6,1
4228,jfj6bh,Joey9OH7,0.4939,A conversation on baby boomers their vast wealth and the crypto markets institutional investors ,1603306655,1,1
4229,jfj2jq,blessive,0.6808,DeFi data set to improve Javascript smart contracts,1603306346,0,1
4230,jfj2bm,Joey9OH7,0.7579,A conversation on institutional investors their vast baby boomer wealth and positivity,1603306328,2,1
4231,jfiyvj,HashMoose,-0.6862,PSA Paypal is a terrible custodian of both funds and personal information They should never be trusted with crypto most of all,1603306048,70,1
4232,jfivf6,Tellabobbob,0.4754,Its official Bitcoin now more popular than sex,1603305760,18,1
4233,jfitz8,alexdemc,-0.4767,My BTC has broken even for the first time since  ,1603305633,134,1
4234,jfit72,gdj11,0.3182,Please Im hungry,1603305566,10,1
4235,jfijqk,gdj11,0.0,Why do image posts keep getting immediately removed,1603304787,10,1
4236,jfiiwa,salil19,0.4588,Bitcoin on chain transfer volume exceeds m as price rises to  month high,1603304715,0,1
4237,jfih5d,crypto_grandma,0.7609,The PayPal cryptocurrency news is the top hot post on rinvesting crypto so hot right now,1603304573,2,1
4238,jfieik,crypto_grandma,0.7609,The paypal cryptocurrency news is the top hot post on rinvesting Crypto so hot right now,1603304355,0,1
4239,jfic00,myhaxdontwork,0.3612,Are you ready,1603304151,15,1
4240,jfi8of,gdj11,0.6124,Please help me,1603303871,3,1
4241,jfi59s,MammothSir9,0.0,Market Update Bitcoin Nears  Holds RecordBreaking Day Streak Above K,1603303585,0,1
4242,jfi4sv,Magelis86,-0.4588,With rcryptocurrency being now monetized via moons can people cheat using upvote bots to get more moons,1603303545,24,1
4243,jfi3of,riqelme,0.7178,PayPal Adds Bitcoin Most Bullish News of the Year,1603303452,3,1
4244,jfhz7n,flacciduck,0.0,The end is nigh,1603303093,18,1
4245,jfhxzt,flacciduck,0.4215,The true way to HODL,1603302988,0,1
4246,jfhxek,Cryptolexicon,-0.3612,LENDUSD Suspicious Price Action  getting alerts every  minutes Price swings between  and  day in day out,1603302939,2,1
4247,jfhvnq,Kevkillerke,0.296,Unable to send money to Coinbase from my bank,1603302795,7,1
4248,jfhvd8,blessive,-0.1027,Traders warn about Ethereum and DeFi tokens as momentum dwindles against Bitcoin,1603302767,0,1
4249,jfht5s,sylsau,0.0,The Day When Most US Companies Will Put Into Bitcoin a Portion of Their T in Cash Is Approaching,1603302581,0,1
4250,jfhp6z,Kevkillerke,0.3612,My bank doesnt let me transfer money to Coinbase due to security risks Is there any workaround,1603302237,2,1
4251,jfhnyl,Zaeem87,0.2235,Cant Stop Myself Today From Refreshing Every  Sec,1603302138,5,1
4252,jfhkph,Teknotokon_II,0.0,I had a question about the whole maximum possible price line I hear thrown around a lot,1603301865,17,1
4253,jfhgdc,Texugo_do_mel,-0.4404,Worthless banknotes in Venezuela are used to make handbags,1603301506,13,1
4254,jfhft0,gremlin0x,0.0,FuckPaypal,1603301457,76,1
4255,jfhar4,SweetPie123,0.3182,Centralized Exchanges Recorded Over  Increase In Trading Volume For Tether and USDC In Q,1603301030,1,1
4256,jfh86r,mekkes,0.0,On our way to k Woooohooo,1603300832,6,1
4257,jfh5k9,TR5_,0.3182,Supported Currencies on paypal,1603300610,8,1
4258,jfh4o9,Wulkingdead,0.4588,Bitcoin hits new  high,1603300536,2,1
4259,jfh3jx,Sufficient_Picture19,-0.3182,ETH being such a tease,1603300447,6,1
4260,jfh0t4,KryptoniK15,0.0,The FOMOing Has Begun,1603300213,0,1
4261,jfh0fj,SimpleSolutionsMath,0.6808,Pretty detailed swing TA on Bitcoin from earlier today Perhaps it can bring some value to you guys ,1603300183,0,1
4262,jfh051,SpaceHoppity,0.0,I think more people should be made aware of this small fact from the PayPal Crypto FAQ,1603300159,18,1
4263,jfgy1z,TDavid13,0.0,Paypal Confirms Market Entry Crypto to M Merchants,1603299986,0,1
4264,jfgxhe,GloriousGibbons,0.3612,Bitcoin soars to K as PayPal proves crypto is ready for everyone,1603299935,0,1
4265,jfguk4,patrickstar466,0.0,Bitcoin leaps to highest since July  after PayPal opens service to cryptocurrencies  Currency News  Financial and Business News  Markets Insider,1603299711,2,1
4266,jfgtof,Roy1984,0.0,Okaaay we got those PayPal news,1603299641,3,1
4267,jfgtl9,00100101011010,0.3612,Get ready for an influx of nbs ,1603299635,26,1
4268,jfgqwp,the01crow,0.0,The SocialGraph Blurt Blockchain Project  Graphene,1603299407,0,1
4269,jfgpoz,SoheilPakpour,0.4019,Learn How To Trade With The Help Of Fibonacci Retracements,1603299302,0,1
4270,jfgmyl,Majestic-Proof-2437,0.0,liquid core,1603299072,0,1
4271,jfgjfa,At0m11c,0.9001,Moon boys and girls we are going to the moon,1603298763,2,1
4272,jfggam,Sufficient_Picture19,0.0,Bitcoin surges after Paypal jumps into the cryptocurrency business,1603298494,8,1
4273,jfgdjs,polies_official,0.0,Polies Here We Come,1603298253,0,1
4274,jfgas7,Fritz1818,0.0,Go baby go,1603298002,7,1
4275,jfgas0,supaevil,0.0, years later and  million people benefiting Checkin on Akon Lighting Africa,1603298001,0,1
4276,jfg4as,iamwiam1,0.0,Bitcoin mining,1603297464,0,1
4277,jfg3fl,kapi1335,0.0,Very bullis,1603297397,0,1
4278,jfg3d1,Plutusedge15,0.0,Polkadot Protocol StaFi to Form DAO With Commonwealth and Edgeware,1603297391,0,1
4279,jfg1cl,daakkast,0.0,BTC at ATH in Brazilian currency Real,1603297225,0,1
4280,jffy0w,professorbird_,0.0,Where should I invest my extra  from Robinhood,1603296954,2,1
4281,jffxns,coolcuriousdude,0.0,Stonks,1603296925,3,1
4282,jffwwn,SweetPie123,-0.0772,Downside of legalizing bitcoin From  Russian officials will be required to declare assets held in cryptocurrency as income,1603296862,5,1
4283,jffu1x,lpqm,0.6486,O Labs raises M in investment round to boost Asiabased growth for Mina Protocol,1603296620,0,1
4284,jfft15,Irrelephantoops,0.0,This is how I feel about PayPal being another Robinhood,1603296534,4,1
4285,jffrpn,AfshinNoorozi,0.2023,Bitcoin trading dominance back to  dominance but price is not rise to ,1603296423,0,1
4286,jffmdc,RandomActsOfAnus,0.0,PAYPAL Today we are announcing the launch of a new service that will enable customers to buy hold Cryptocurrency directly from their PayPal account and sell,1603295988,0,1
4287,jffkdk,rs112233,0.0,Its Paypal time ,1603295813,9,1
4288,jffji4,QCSmello,0.0,Project Feedback Requested,1603295738,0,1
4289,jffgil,Plutusedge15,0.7178,PayPal Adds Bitcoin Most Bullish News of the Year  CoinDesk,1603295489,6,1
4290,jfffef,Irrelephantoops,0.0,This is how I feel about PayPal just being another Robinhood,1603295394,4,1
4291,jffesw,PM_ME_UR_ROOM_VIEW,0.0,Question about Moons first distribution round,1603295341,12,1
4292,jffcms,Cultural_Care_8630,0.6633,SECRETS OF KUCOIN MEDIA SUCCESS PR Case Study Webinar,1603295159,0,1
4293,jffc2r,PM_ME_UR_ROOM_VIEW,0.0,Question about moons,1603295110,2,1
4294,jffby7,Grown_wolf,0.0,Nfts Crypto Bonds and the sync network,1603295098,1,1
4295,jffbj7,Enkiduthebeast,0.4019,Published Pool Party Nodes launches StrongBlock ETH Node,1603295060,2,1
4296,jffbf2,maytorge1984,0.0,For all those that Sold,1603295052,5,1
4297,jff9qc,Sawyer86uk,-0.3612,Vitali Strikes Back ETH not an alt,1603294903,12,1
4298,jff8lt,stratguy56,0.0,How to do Cryptocurrency Taxes with TurboTax,1603294802,3,1
4299,jff4vg,flacciduck,0.5106,New York Lawyers Propose Toolkit for Keeping Decentralized Blockchains Honest,1603294471,2,1
4300,jff4qi,cryptodiggy,0.0,Paypal To Open Network To Cryptocurrency,1603294459,6,1
4301,jfexb6,wmredditor,0.7579,Bitcoin Reaches New  High As Bulls Smell a Repeat of  Craze,1603293819,27,1
4302,jfeve7,Nexy007,-0.3182,This week bancor released the firstever singlesided AMM pools Learn how to add liquidity amp earn impermanent loss protection in  simple steps,1603293658,0,1
4303,jfeps5,Midwest_Parrothead,0.0,Ethereum VR Game The Sandbox partners with Atari Rollercoaster Tycoon World Shaun the Sheep and more,1603293166,2,1
4304,jfeo0r,KX9lol,0.25,Satoshis vision ,1603293018,75,1
4305,jfej44,slywalkers,0.2042,This is the highlight of the PayPal news Theyre not only preventing withdrawals to selfcustody they wont even allow transfers between accounts,1603292607,19,1
4306,jfegdx,AchwaqKhalid,0.0,PayPal launches new service enabling users to buy hold and sell cryptocurrency ,1603292390,0,1
4307,jbpj75,Fxck,0.4201,If Bitcoin is emailEthereum goes far beyond that Its more like the Internet CFTC Chairman Heath,1602775172,0,1
4308,jbpj53,Fhelans,-0.4019,No single digital currency will dominate the world  Bank of Japan,1602775166,147,1
4309,jbphuk,Zuckerbergjr,0.0,Lets goooo any etherium bagholders here,1602775052,8,1
4310,jbphu0,Frogmech,-0.7184,CoinTelegraph article with tips to avoid DeFi scams in nd section,1602775051,2,1
4311,jbphgj,devboricha,0.0,Latest Bitcoin price and analysis BTC to USD,1602775021,4,1
4312,jbpea3,Solebusta,0.0,fUNI Uniswap Released on Fantom,1602774752,2,1
4313,jbpbgr,erer566,0.0,Taproot Has Been Merged Into Bitcoin Core Heres What That Means,1602774518,23,1
4314,jbp81j,pcaversaccio,0.0,Filecoin Launch Finally Brings M ICO to Fruition,1602774220,0,1
4315,jbp4us,Gasset,-0.128,Grayscale Adds  Billion to Crypto Products in Q Sees Unprecedented Demand for Bitcoin Cash,1602773941,4,1
4316,jbp23g,getblockio,0.0,Access to ETH node with transaction tracing,1602773694,0,1
4317,jbp0ea,blessive,0.0,Bitcoin price prediction BTC to rise again analysts,1602773546,0,1
4318,jbozj3,Ovv_Topik,0.0,I bet hes thinking about,1602773470,350,1
4319,jbox75,flacciduck,0.6597,Hopefully this can help newcomers,1602773260,6,1
4320,jbovoe,Cryptoman1962,0.0,Hire A CryptocurrencyWebsite and Mobile Developer,1602773115,0,1
4321,jbovnm,OfficialDodo,0.0,Bitcoin price metric suggests K surge after US elections,1602773113,4,1
4322,jboq4b,Monster_Chief17,0.6486,Moons have a bright future and a lot of real value right now,1602772622,14,1
4323,jbom3o,Fhelans,-0.1531,How the DeFi Craze Made Its Way to China,1602772262,0,1
4324,jboklx,sometimesiamjustabox,0.0,Fantom update with fUNI,1602772120,7,1
4325,jboji0,Solebusta,0.0,fUNI released The wait is over,1602772014,4,1
4326,jboeeh,silver_light,0.0,Square Bitcoin revenue by quarter,1602771521,19,1
4327,jboe8i,Aplayfulcamel,0.0,Whats your favourite crypto currency,1602771503,42,1
4328,jbodjy,CryptoPlanetVIP,0.0,New Research from Fidelity Suggests Bitcoin Should Comprise of  of investment Portfolio,1602771436,6,1
4329,jbodbd,Fhelans,0.0,Bitcoin SellOff Accelerates amid US Stock Downtrend,1602771410,8,1
4330,jbocga,madfires,0.0,Facebooks Libra continues to push forward,1602771330,10,1
4331,jboc8b,NaranKapital,0.0,Even I cant type in my own seed phrase now ,1602771306,11,1
4332,jbob8i,EneaForgali,0.0,Btc,1602771205,0,1
4333,jboa88,HumanTeam2020,0.6124,Human Team Please help,1602771104,0,1
4334,jbo928,-Saunter-,0.2732,Daily reminder that it took  months for MicroStrategy to properly prepare amp purchase Bitcoin Well be seeing copycat moves half a year from now,1602770994,2,1
4335,jbo70g,smoljanovic,0.2023,Top Things You Should Know About Serum SRM,1602770794,0,1
4336,jbo6r8,Labrodoge,0.7579,Value DeFi  k Token burned today  TVL   Great project have a look,1602770771,0,1
4337,jbo5vc,thelionshire,0.5267,Where to Put Your ETH amp Stablecoins to Make You Money While You Sleep  Defi Money Market,1602770692,6,1
4338,jbo4m7,coincommemorative,0.7964,Commemorative coins on the Ethereum blockchain LOS ANGELES RAMS in honor of victory Super Bowl XXXIV,1602770582,2,1
4339,jbo2kc,Rmenotti,0.4588,luck casino,1602770405,0,1
4340,jbo0lu,frostykuiper,0.3818,Serious question are you in on this because of the potential profits decentralizationmeaning or both,1602770225,35,1
4341,jbnw7p,dasd455445,0.6369,Forex Copier  The best trade copying software,1602769785,0,1
4342,jbnvu8,NinjaDK,0.4404,Schnorr signatures amp Taproot has finally been merged into Bitcoin Core today When activated at a later date TBD they will bring about better transactional capabilities to Bitcoin while increasing the networks privacy features,1602769747,2,1
4343,jbnvs2,NOWPayments,0.34,Filecoin can also be a payment method NOWPayments is excited to make this happen ,1602769740,4,1
4344,jbnva2,devboricha,0.0,Always with me,1602769690,10,1
4345,jbns6v,crypto_grandma,0.0,At what price if any would you walk away from crypto forever,1602769379,81,1
4346,jbnq86,Magelis86,0.0,Newbie here  Is there any way to get moons using the Rinkeby faucet,1602769186,9,1
4347,jbnpti,nanooverbtc,0.0,Central Bank of The Bahamas eyeing international use of Sand Dollar,1602769144,0,1
4348,jbnlga,loganjones44,0.4588,UK Media Mogul Calls DeFi Revolutionary,1602768730,0,1
4349,jbnkos,CryptographerFine810,0.6369,The best way to earn crypto using okex jumpstart mining,1602768648,0,1
4350,jbnfiq,PhutureDAO,0.0,PhutureDAO  the vanguard of the crypto ecosystem,1602768127,0,1
4351,jbnbxu,T0MAS0N,0.5994,JD Coin is an opensourced blockchainbased decentralized smart money,1602767774,0,1
4352,jbnbnk,leepawg,-0.4215,Scam Alert,1602767744,0,1
4353,jbnba2,ResponsibleAd9086,0.0,Unpacking defi,1602767706,0,1
4354,jbn9ei,aregus,0.0,Why are you stacking  ETH,1602767511,6,1
4355,jbn8gb,4TheCultur3,0.0,LOOOL guys whos going to tell him ,1602767414,7,1
4356,jbn6ys,flacciduck,0.0,Former Gulag in Russian Arctic Bids to Become Bitcoin Mining Hotspot,1602767258,1,1
4357,jbn53z,8------D--,0.0,The Inevitability of Big Blockchain,1602767076,0,1
4358,jbn3wf,[deleted],0.4588,Cryptomian Rhapsody because I have too much time on my hands Alternative lyric suggestions welcome,1602766957,0,1
4359,jbn2xv,CaptLuLu,0.7184,Rothschilds Buy Bitcoin,1602766862,0,1
4360,jbmymo,myhaxdontwork,-0.3818,For newcomers Criminal charges filed against BitMEX Why this is a good thing for crypto,1602766400,2,1
4361,jbmxh7,Equal_Annual_2861,0.8658,Win TRON Rewards in Crypto Traders Telegram Group Lucky Draw,1602766274,0,1
4362,jbmt5x,lemonjunkiie,0.2263,Earn  worth of EOS just by doing a quiz,1602765792,0,1
4363,jbmokj,morten_dm,0.4588,Do these triangles work long term,1602765263,11,1
4365,jbmmb5,Mat7ias,0.3612,New Golem Alpha II reveal  were ready for you to come build with us  k USD in bounties with this release,1602765007,0,1
4366,jbmlbu,SerialMasticator,-0.3291,Its chaos but nobody can know,1602764891,4,1
4367,jbmjk8,AyaanShah10,0.0,EU Brings regulations to Crypto How do you feel about it,1602764680,0,1
4368,jbmgq0,International-life04,0.0,Develop crypto game jackpot poker blackjack crypto gaming website,1602764356,0,1
4369,jbmeju,cyger,0.0,More gamers around the world are moving into crypto,1602764099,67,1
4370,jbmdsh,Placebo77,0.0,Bitmau,1602764008,0,1
4371,jbmbxk,ch0s3n0n3,0.4215,Worlds Growing Stockpile of NegativeYielding Debt a Positive for Bitcoin Say Analysts,1602763784,10,1
4372,jbmbw6,rmg19992104,0.0,Rothschild investment corporation are buying bitcoin,1602763779,7,1
4373,jbm9rq,zakoal,0.0,Spanish Bill Will Forces Citizens to Declare all their Cryptocurrencies,1602763517,14,1
4375,jbm8j8,TheatreOD,0.0,Introducing your friends to crypto can be dangerous,1602763385,5,1
4376,jbm3tl,Usefulaluable,-0.34,BProtocol Foundation lawyers argue that US courts are unable to settle global cases,1602762850,2,1
4378,jbm2tk,Amastacia_crypto,0.7096,From  to  Million Coin Circle KOL Happy Shares the Road of Gold Mining in China,1602762725,0,1
4379,jbm0iq,Crypto4Canadians,0.0,FA Explained and Why You NEED It,1602762426,4,1
4380,jbltj6,jelgertje,0.2263,Will Bitcoin be worth  in  year,1602761539,2,1
4381,jblt2l,jelgertje,0.2263,Ethereum will be worth  in  years,1602761477,2,1
4382,jblry7,jelgertje,0.2263,Bitcoin will be worth  in  year,1602761327,2,1
4383,jblrlt,niceplateau,0.0,Lumero will be used for which region,1602761289,0,1
4384,jblr3h,SweetPie123,0.5106,The effect of Trust Funds and companies buying BTC,1602761225,138,1
4385,jblqgd,TestiestJoker89,0.0,What is your favourite emerging coin from the past year and why,1602761149,0,1
4386,jblq09,nstratz,0.0,Final Alpha Release for IOTA Streams,1602761094,2,1
4387,jblpcy,cryptologyx,0.2732,well would youpunk,1602761014,8,1
4388,jblmvj,aerios01,0.0,Covalent is calling all data mages content wizards bounty hunters and art warlocks,1602760693,6,1
4389,jbll6b,SweetPie123,0.0,Crypto MampA In  On Track To Hit  Billion,1602760466,1,1
4390,jbll5h,asshole_cookies,0.1027,Banks and Bailouts Stifle Wall Street While Investors Await Filecoin Launch,1602760462,0,1
4391,jbll4i,thchax,0.0,Russia Sets Limit on Cryptocurrency Investments,1602760458,1,1
4392,jblj04,cryptologyx,-0.2732,Why does this message make me nervous,1602760177,2,1
4393,jbliu5,TheatreOD,0.0,When the big boys FOMO you know big things are coming,1602760155,5,1
4394,jblik8,girlshero,0.3597,When more money was printed in one month than in two centuries,1602760123,3,1
4395,jf6h6o,blessive,0.296,Kik and The SEC Reach a  Million Agreement to End Their LongLasting Legal Battle,1603255944,0,1
4396,jf6fpp,Sufficient_Picture19,0.34,Bitcoin average transaction value increases  since July,1603255753,7,1
4397,jf6en0,McMallory,0.0,Stimulus Rumblings and Rising BTC Price,1603255617,12,1
4398,jf69qb,Clash_My_Clans,-0.5773,Futures Traders Arent as Bullish This Time Around as Bitcoin Price Revisits  Data Indicates,1603255011,1,1
4399,jf6591,salil19,0.0,OKEx is resuming peertopeer fiat trading for Chinese yuan,1603254464,4,1
4400,jf609u,Harveywallbangerr,-0.5766,With BTC hitting k today Im glad that our man from last week can finally sleep RIP,1603253850,2,1
4401,jf5uuk,mokal9090,0.34,welp im giving away NFTs  people,1603253192,0,1
4402,jf5rbj,BringTheFuture,0.5994,Michael Saylor On Bitcoin The LongTerm Bull Case,1603252784,11,1
4403,jf5pq9,CaptLuLu,-0.296,The US acting comptroller of the currency Brian Brooks predicts th decentralized finance DeFi will render many of the financial services offered by banks obsolete just as email disrupted the postal service,1603252602,5,1
4404,jf5hd5,iphelix,0.0,Bitcoin Cyber City  virtual reality world to meet and talk about Bitcoin,1603251609,2,1
4405,jf5awr,Plutusedge15,0.0,Ethereums Bitcoin Ratio Crashes,1603250856,0,1
4406,jf58xr,Cryptodragonnz,0.2656,Buttcoin and other FUD nocoiner communities trying to keep out all the newly minted crypto bulls,1603250628,2,1
4407,jf58e2,myhaxdontwork,0.8126,What a great feeling to have before the day comes to a close Feeling optimistic as BTC breaks above ,1603250565,2,1
4408,jf52qx,olihowells,0.4019,Bitcoin active addresses approaching  million,1603249924,4,1
4409,jf4v9e,DetroitMotorShow,0.34,Bitcoin Proponents Bemoan Joe Bidens Proposed Capital Gains Hike,1603249131,4,1
4410,jf4tph,why_dont_we_fuck,-0.4767,what could possibly go wrong,1603248963,10,1
4411,jf4rk6,Fpsmoose,0.0,Xrp YouTubers are a bunch of cons,1603248735,14,1
4412,jf4rcu,Moeen11106,0.7184,You can buy Marco token MRC on IEO from October th,1603248714,0,1
4413,jf4q0s,rrs1179,0.0,Bitcoin up others down,1603248575,19,1
4414,jf4oyz,da_dreamerr,0.0,Brian Brooks believes decentralized finance will take over many of the services currently offered by banks,1603248463,2,1
4415,jf4mbu,Set1Less,0.0,The Rush To Own Indias Bitcoin Market Is Back On,1603248182,2,1
4416,jf4gjh,JoJopama,0.0,ATMs spreading Globally,1603247576,5,1
4417,jf4g9n,simoniwei,-0.128,Breaking the barrier,1603247544,9,1
4418,jf4fjr,sinner_man123,0.7184,how to buy lbc in hotbit,1603247470,0,1
4419,jf46xx,DetroitMotorShow,0.0,Kraken launches desktop trading terminal CryptoWatch for expert traders,1603246596,0,1
4420,jf45cs,jobby23,0.2177,How Do Traders Profit Despite  Capital Gains Tax,1603246424,37,1
4421,jf3zpa,DetroitMotorShow,0.0,Powell Says Federal Reserve Is Considering Proprietary Cryptocurrency,1603245852,7,1
4422,jf3xs2,_perks_,0.0,Immutable announces first ZK Rollup scalability engine for NFT developers bringing massive scale and zero gas costs to Ethereum,1603245664,0,1
4423,jf3wbs,nathanielx9,0.0,Bitcoin detaching from altcoins,1603245521,3,1
4424,jf3w5d,markstormweather,-0.296,Got a question Why would a coin show that it is up and then when I try to trade it for that price it trades for a lower price,1603245504,2,1
4425,jf3ozl,russianyulz,0.0,Pi mining,1603244801,0,1
4426,jf3ih9,patrickstar466,0.0,BRRRR Tether printer turns on the same day as BTC breach K,1603244155,40,1
4427,jf3ddz,-Just_Another_Guy-,0.0,All the companies buying BTC right now waiting for the new ATH,1603243655,4,1
4428,jf3arj,BNieman,0.7531,BULLISH CASES FOR BITCOIN BTC AT K AS ALTCOINS PULL BACK Cryptocurrency Analysis ,1603243400,10,1
4429,jf38si,AmericanHead,0.738,Big win for crypto industry  finally a little bit of clarity from the SEC,1603243213,3,1
4430,jf3806,Kevkillerke,-0.0772,Looks like we just broke k BTC ,1603243144,3,1
4431,jf376k,-Just_Another_Guy-,0.0,Current state of the market,1603243067,3,1
4432,jf372x,AmericanHead,0.7957,This a win for crypto st case that a token which was sold as a security  can still be considered a commodity  once theres utility Kin can now operate as a utility token without SEC pressure,1603243056,2,1
4433,jf30rz,cometothecaml,0.0,Were back over k again,1603242410,2,1
4434,jf2vt0,livewithoutchains,-0.4767,It only ever gets worse,1603241925,7,1
4435,jf2u1a,nice2yz,0.4927,Will Traditional Finance Firms Prove More Attractive For Onboarding New Crypto Investors,1603241747,16,1
4436,jf2m5k,joenorwood77,0.0,Discussion of the Day Compound Dai CDAI,1603240980,2,1
4437,jf2lwd,natedogggggyyyy,0.3612,Injective Protocol Hot DeFi Project by Binance Labs Launches today,1603240952,3,1
4438,jf2f4f,Joey9OH7,0.0,Any Europeans  British hodlers actually use Revolut Or is this blasphemous,1603240293,16,1
4439,jf2br3,jimmyj123456,0.0,Dapp developer,1603239968,0,1
4440,jf1pky,Mr_Stratos,0.34,Whats the value proposition for current governance tokens,1603237858,6,1
4441,jf1nht,150yearsOld,0.3612,bcashers be like,1603237659,5,1
4442,jf1mds,Sizxtima,0.4767,Rewards and Promo Deals,1603237551,0,1
