,id,author,vader,title,created_utc,num_comments,score
2092,jdhohh,ResponsibleAd9086,0.0,The big move is coming k by years end,1603033039,3,2
2093,jdhmqo,astrokade,-0.5106,Polkadots First Trustless Wrapped Bitcoin PolkaBTC Coming in Early  ,1603032848,5,1
2094,jdhmgc,nanooverbtc,0.0,Peter Schiff walks out on  minutes interview after his bank Euro Pacific ensnared in global tax evasion probe,1603032820,131,1
2095,jdheh0,EmergencyWitness7,0.4404,Good Youtube channels for price action trading,1603031972,0,1
2096,jdhdq6,SweetPie123,0.5106,BTC and Public Traded Companies match made in heaven or the end of a decentralised BTC,1603031893,9,1
2097,jdhcek,CrispyRoger,0.0,Retreive your Tronlink with your Mnemonic seed phrase OR Private Key,1603031747,0,1
2098,jdha0m,Gasset,0.3818,Bitcoins Creator vs Bezos Satoshi Nakamotos Uphill Climb to Surpass the Amazon Founders Net Worth,1603031488,9,1
2099,jdh43g,joecoin,0.9001,ROOM is closing for good We think our mission is accomplished and it is time to go back to our home planet Thanks for all the fish and the generous tips,1603030842,5,1
2100,jdh2q0,cecil_X,0.5423,These Bitcoin signals are similar to its  glory days,1603030692,0,1
2101,jdgzf8,crypto_grandma,0.0,Suggestion Meme Mondays,1603030321,15,1
2102,jdgz1f,DaJeroen,0.0,Beeple made some Ethereum artwork,1603030279,2,1
2103,jdgxnl,brontellT,0.5859,Does anyone else feel super uncomfortable in a bull market and oddly at ease during a bear market,1603030130,14,1
2104,jdgukk,CryptoPlanetVIP,0.0,Authorities Made  Customer Information Requests to Coinbase in H ,1603029795,1,1
2105,jdgtaa,ch0s3n0n3,0.0,After Investing  Million Into Bitcoin Michael Saylor Says Ethereum Ripple Chainlink EOS and Tron Advocates Need New Strategy,1603029659,2,1
2106,jdgsmq,Deivids15,-0.4588,Infographic of ways you can invest in crypto OC  this keeps getting banned,1603029599,6,1
2107,jdgsbd,MierenKnager,-0.5106, million Americans slipped into poverty amid coronavirus pandemic new study says,1603029563,3,1
2108,jgr890,Badeindi,0.0,And down it goes,1603472868,2,1
2109,jgr6o0,Towelielie,0.3182,Huge issues with wirex alternatives,1603472735,10,1
2110,jgr6f6,QuantifyCrypto,0.5719,A Trading Plan for Cryptocurrency Success  Part ,1603472714,0,1
2111,jgr5pb,jmadding,0.5095,BGA Game Demo Day  Blockchain Game Alliance Features The Sandbox Metaverse with  in Total Prizes,1603472659,0,1
2112,jgr2vh,SwayStar123,0.4404,How Bitcoin native DEXs stack up against Centralized exchanges Good read,1603472444,7,1
2113,jgr0do,hoticolist,0.0,Oasis Labs ROSE Token Sale is now listed in Crypto Directories,1603472235,0,1
2114,jgqwl2,alliswell19,0.1779,Microstrategy CEO Reveals BTC Purchase is Corporate Strategy to Adopt Bitcoin Standard,1603471913,4,1
2115,jgqryd,DreamerOfSpring,0.0,Flippening is inevitable,1603471521,7,1
2116,jgqrqk,sylsau,0.5423,Bitcoin Gives You Abundant Access to the Only Two Riches That Matter in Life,1603471501,2,1
2118,jgqlga,Wulkingdead,0.0,Grayscale Bought An Additional  Million Of CryptoCurrency,1603470981,5,1
2119,jgqkoh,Dcoinevangelist,0.0,PLUTO TOKEN A,1603470919,0,1
2120,jgqkfe,Frankjankjink,0.0,Pluto token,1603470899,0,1
2121,jgqh3j,sara_dew,0.0,Pluto Token,1603470608,0,1
2122,jgqg47,Tellabobbob,0.0,She does not understand that to find the next Bitcoin one have to dig through lots of shitcoins,1603470522,4,1
2123,jgqdw9,Heriyanto86,0.4019,Pluto Token PLT is utilizing Defi and the blockchain technology of distributed ledger and smart contracts to bring all the participants in the supply chain,1603470331,1,1
2124,jgqcax,youessbee,0.6369,Can someone help me a noob figure out what on earth Bitrue customer support just told me about my account Its complete jargon to me,1603470195,16,1
2125,jgqbh7,earnwithchristineg5,0.3818,Bitcoin Weekly Technical Setup Shows a Clear Price Target ,1603470131,0,1
2126,jgqamk,slywalkers,0.0,Report Shows  of Crypto Execs Expect the Industry to Accelerate Companies Are Hiring,1603470053,0,1
2127,jgq9cb,Kevino_007,0.0,Can anyone tell me what this is,1603469939,4,1
2128,jgq94g,Kiki131316,0.0,Joint now for airdrop  PLT,1603469918,0,1
2129,jgq6g3,cryptoviser,-0.7845,DASH DeFi BRIDGE Launches Binance CeDeFi Filecoin Denies Mining Crisis,1603469694,0,1
2130,jgq5t2,Alan13102,0.0,Joint for ardrop  PLT,1603469638,0,1
2131,jgq3aq,TDavid13,0.0,Analysts say Bitcoin to K is Possible  Bloomberg,1603469420,46,1
2132,jgq33b,cybergen001,0.0,Plutotoken,1603469403,2,1
2133,jgq2k4,NiceLolBro,0.0,The Communitys Thoughts on Vechain,1603469355,13,1
2134,jgq232,Javeedsyed587,0.0,Pluto Token Rise of a new Project,1603469316,0,1
2135,jgq1q2,papdams,0.0,Pluto Token PLT,1603469286,0,1
2136,jgq0hh,da_dreamerr,0.0,Ethereum  is a big deal And its coming next month,1603469182,10,1
2137,jgpzgy,Jolly-Alternative790,0.0,WHAT IS PLUTO TOKEN PLT,1603469098,0,1
2138,jgpyxo,TDavid13,0.0,Microstrategy CEO  What will I do when Bitcoin goes x,1603469056,0,1
2139,jgpy8t,Plutusedge15,0.0,DeFi Aggregator Zerion Rebrands to a OneStop Shop for Investors,1603469005,0,1
2140,jgpwsi,DonteeWeaver,0.6705,Updated CRO Staking Requirements  Last Chance To Get  Sign Up Bonus,1603468888,0,1
2141,jgpw2j,TDavid13,0.0,Japanese soccer star Keisuke Honda launches his own cryptocurrency,1603468832,0,1
2143,jgptcr,buzzbooz,0.0,Bringing DeFi to Bitcoin,1603468603,2,1
2144,jgpqhc,RV_123,-0.3412,Sometimes business isnt good,1603468356,9,1
2145,jgpokr,earnwithchristineg5,0.0,Getting started with cryptocurrency,1603468196,0,1
2146,jgpoi6,CryptoKitt,0.0,Why DeFi NEEDs Privacy,1603468189,4,1
2147,jgpjy5,Far_Spot3749,0.4019,Help me,1603467787,2,1
2148,jgpc6p,ggabriel8,0.7845,Boosted Finance Overview  Boost your yields with boost,1603467107,0,1
2149,jgpbc7,albnasc,0.4215,Nice video about trading and the difference between trading and investing,1603467034,3,1
2150,jgpbae,devboricha,0.0,Okex,1603467030,8,1
2151,jgp9w8,devboricha,0.0,OKEX,1603466910,2,1
2152,jgp6x3,Crackorjackzors,0.5106,How do we as a community drive  encourage adoption,1603466642,25,1
2153,jgp2bs,ch0s3n0n3,0.0,Ethereum On Track To Complete  Trillion in Transactions in ,1603466236,1,1
2154,jgp1eg,TR5_,0.6124,Top post on rInvesting exciting times for both PayPal and the Crypto world,1603466157,1,1
2155,jgos61,jogger_pogger,0.0,Proposed Chinese Law Outlaws All YuanPegged Tokens  Except for Its CBDC,1603465361,46,1
2156,jgos4a,tiredasfuckreally,0.7351,With Influx of new users here starting to invest in Crypto should be mindful about safety of their funds before investing Here are top  things to do to protect yourself,1603465356,2,1
2157,jgoqk6,pale_blue_dots,0.0,We are going to see over the next  years a rebuilding of the financial infrastructure of this country digitalization of the financial services system that is going to be mostly built on Ethereum  CNBC SquawkBox,1603465220,4,1
2158,jgoo20,pale_blue_dots,0.4215,Mike Novogratz likes stocks bitcoin ahead of the election The liquidity tsunami is just too big,1603464996,3,1
2159,jgoka0,send_nipples,0.0,Any day now,1603464672,5,1
2160,jgoflz,pale_blue_dots,0.2263,This WordPress plugin will allow authors to timestamp content on the Ethereum blockchain,1603464248,4,1
2161,jgocyg,CryptoBanano,0.5319,VeChain Renji Hospital and DNV GL Held Strategic Partnership Signing Ceremony To Launch Worlds First Blockchain Intelligent Tumor Treatment Center,1603464013,1,1
2162,jgo9ya,tiredasfuckreally,0.0,ETH  is here,1603463742,7,1
2163,jgo8m1,GloriousGibbons,0.0,Michael Saylor claims the company will hold Bitcoin for  years,1603463610,6,1
2164,jgo482,SweetPie123,0.0,Coinye the memecoin that never could flourish,1603463206,21,1
2165,jgo1ls,GoldenRain99,0.0,Digital Ruble pilot likely to launch in ,1603462960,8,1
2166,jgo0qv,GoldenRain99,0.0,Crypto X the Music Industry,1603462882,4,1
2167,jgnz1g,askingquestiongetUSD,0.0, This Week in Fintech ,1603462714,0,1
2168,jgnx91,TheWierdGuy,-0.5256,Raoul Paul and Michael Saylors Bitcoin vs Ethereum analysis is deeply flawed and here is why,1603462548,2,1
2169,jgnwgo,lakerz690,-0.3182,Institutional frenzy CME becomes nd biggest Bitcoin futures market,1603462484,6,1
2170,jgnt4h,Solebusta,0.0,Them feels,1603462183,128,1
2171,jgnp64,GloriousGibbons,0.3291,Bitcoin hits its highest level since  but two traders are split on whether its worth buying,1603461819,5,1
2172,jgno9y,GloriousGibbons,0.0,Kik sees open path for Kin exchange listing following SEC settlement,1603461737,1,1
2173,jgnl8l,lakerz690,0.0,Bank of Japan Wants to Hear Public Opinion on Digital Yen  Decrypt,1603461452,4,1
2174,jgnjun,scara89,-0.3027,Kiks Token Survives SEC Battle No Barrier to Exchange Listings Says Kin Foundation,1603461310,0,1
2175,jgnjff,SweetPie123,0.25,Will Bitcoin or gold provide higher returns under quantitative easing environment,1603461270,2,1
2176,jgni78,newthrowawayfor2017,0.0,Hedge Fund Veteran Explains Why Bitcoin Acts as a Life Raft,1603461147,3,1
2177,jgnhjy,vinnie_chapman,0.7184,PayPal Looking To Buy Bitcoin Custodian BitGo Inc,1603461089,0,1
2178,jgnh2w,newthrowawayfor2017,0.0,BitMEX Delves Deeper Into DeFi With New Futures Listings,1603461041,0,1
2179,jgngie,SoheilPakpour,0.0,Moving Averages SMA vs EMA,1603460986,3,1
2181,jgnfof,TR5_,0.0,Bitocon vs other investments for  so far,1603460904,8,1
2182,jgnb9m,Tanuki__,0.8779,We built a website to help entrepreneurs find the best crypto friendly tools and services,1603460453,0,1
2183,jgn81a,da_f3nix,0.7184,Oh mighty BTC take our altbags with you while you moon,1603460129,7,1
2184,jgn817,send_nipples,0.0,ETH hodlers of  rise up,1603460129,9,1
2185,jgn7dv,Taitou_UK,0.0,MFW mainstream news starts talking about crypto again,1603460061,2,1
2186,jgn4q7,cryptodiggy,0.5994,Top  Proof of Stake Coins For Huge Passive Income,1603459791,2,1
2187,jgn4oh,DetroitMotorShow,0.0,The Big Four Audit Firms PwC KMPG EnY etc Are Gearing Up to Become Crypto and Blockchain Auditors,1603459786,8,1
2188,jgn4oe,Oxygenjacket,0.34,Total volume traded on DEXs Growing and growing ,1603459785,4,1
2189,jgn3y1,lakerz690,0.0,XLM Stellar to skip Protocol  Cites issue with validator crashes,1603459713,1,1
2190,jgn3vv,EROSBabe,0.2023,The Supply of DAI Fiercely Surged  Reaching to Nearly B,1603459707,1,1
2191,jgn3mw,bhaveshaNew,0.0,PayPal Might Launch Its Own Crypto In Next  to  Months CoinShares CSO,1603459680,0,1
2192,jgn37r,da_dreamerr,0.1695, doge   doge Never Forget,1603459635,7,1
2193,jgn32h,LyndaMcnaulty,0.4404,How to Maximise Yield Farming Profits  NewsBTC,1603459622,0,1
2194,jgn27d,pinnickfan,0.0,Bitcoin escrow Services,1603459530,9,1
2195,jgn0ql,lakerz690,-0.4588,Blockchain Firm Ripple Likely Leaving US Over Regulation Frustrations,1603459377,6,1
2196,jgmysj,Set1Less,0.0,Quantstamp will audit the entire blockchain of a new DeFi project on Polkadot,1603459173,3,1
2197,jgmxbt,[deleted],-0.34,China Cracks Down on Illegal Gambling amp Money Laundering Schemes,1603459023,0,1
2198,jgmwda,nanooverbtc,0.0,Mode invests  of cash reserves in bitcoin,1603458928,5,1
2199,jhlvw4,The-Crypto-Portal,0.0,Ripple CTO There wont be a one world fiat but XRP might be the bridge currency,1603593355,15,1
2200,jhltlt,maytorge1984,-0.1531,Those huge red Bars,1603593091,3,1
2201,jhlsc5,sgtslaughterTV,0.0,Two data points Bitcoin price  months post halving vs Bitcoin price  months post halving,1603592940,3,1
2202,jhlpyb,AmericanHead,0.3612,CoinMarketCap Top  trending crypto assets this week,1603592646,0,1
2203,jhll42,Kike328,-0.5719,FBI Investigated Extortion Attempt Over Allegedly Negative Ripple Videos,1603592056,4,1
2204,jhlg2k,FellatioFellas,0.5574,Explainer on how supply shock and popular mediadriven demand causes Bitcoin posthalving parabolic increases in price Bull market confirmed,1603591468,0,1
2205,jhle9z,flooha,0.0,Ledger phishing email,1603591270,2,1
2206,jhlcfb,flooha,0.296,Alert New Ledger phishing email going around,1603591065,2,1
2207,jhlaao,Saikothasan,0.128,Exclusive UKListed Mode Now Holds  Million Of Bitcoin,1603590827,0,1
2208,jhl9yq,maytorge1984,0.0,Going balls deep in Shitcoins,1603590788,7,1
2209,jhl8k1,Harveywallbangerr,-0.34,Crazy to think were currently sitting at a yearly ATH Do we keep grinding or breakout What are your thoughts,1603590630,25,1
2210,jhl6wv,TimShopifyPro,0.7845,Visit this URL and get to know more about how to convert your Bitcoin to Other Cryptocurrrencies of your choice and Win Valuable Giveaways,1603590432,2,1
2211,jhl56l,cecil_X,0.3818,Paul Tudor Jones Bitcoin Is the Best Tool to Fight Inflation  Live Bitcoin News,1603590227,1,1
2212,jhl2qg,eleanor567,0.0,LIVE Kevin Hart shouts out Bitcoin Ethereum and other cryptocurrencies while hosting MDA Telethon,1603589940,22,1
2213,jhl18k,TDavid13,0.0,Crypto Cruise Ship Satoshi Ancoring in Panama,1603589763,8,1
2214,jhkzj1,TDavid13,0.0,Bitcoin should be k right now  Bloomberg Analyst,1603589569,15,1
2215,jhkzbv,pale_blue_dots,-0.5719,FinCEN Files Show Criminals Moved Billions As Banks Watched,1603589547,0,1
2216,jhkyjq,TDavid13,0.0,Analysis and Future of Crypto  Bloomberg,1603589457,0,1
2217,jhkwfh,Mcgillby,0.0,Bitcoin Closes Above K for First Time Since January ,1603589204,0,1
2218,jhkvma,fatal_music,0.0,Beginner Trading  Swapping Tutorial On Honeyswap,1603589108,2,1
2219,jhkvk9,skylargrey1111,0.4404,Moving Country is crypto better for moving finances,1603589100,0,1
2220,jhkvh3,mister10percent,0.8481, Monero is floating at  where I live I feel like weve found a coin that can actually be used as money I can use this to buy shit of my friends and I can see and understand the inflation,1603589089,2,1
2221,jhkt9a,Diqiurenminbi,0.0,Took a look at the WaltonChain sub today,1603588832,2,1
2222,jhkt6u,wgcole01,0.0,XRP Moving Approximately  in Remittances From US to Mexico According to Founder of Crypto Exchange Bitso,1603588825,155,1
2223,jhkrm1,thisisPatDuffy,0.0,LIVE Kevin Hart shouts out Bitcoin Ethereum and other crypto while hosting MDA Telethon,1603588639,3,1
2224,jhkmee,Kike328,0.5267,How US authorities are using old Anti money laundering tools to crack down on crypto,1603588056,2,1
2225,jhkloy,JustFoundItDudePT,0.0,Banks,1603587972,3,1
2226,jhklok,MammothSir9,0.4588,Oracle Vinny Lingham Expects High Bitcoin Volatility BTC Price Likely to Hold K Handle for  Days,1603587971,0,1
2227,jhkcuz,Beavis_1975,0.0,Crypto Mining ,1603586986,0,1
2228,jhk9ma,darkelfas,0.7316,DeFi Total Value Locked Reaches B AllTime High Despite Cooling Hype,1603586621,2,1
2229,jhk8gh,darkelfas,0.0,Amid BTC Vs Gold rivalry millennials to fuel next BTC rally says JPMorgan,1603586487,4,1
2230,jhk7nz,sauciestwaters,0.3447,In the last bull run bitcoin had multiple pullbacks of  to test the  day moving average Selling your coin now on a pullback is like selling on the red circle on this chart Insane gains are coming dont get shaken out,1603586398,4,1
2231,jhk6jj,I_LIVE_ON_THE_SUN,-0.2924,Dont accept this system,1603586265,8,1
2232,jhk5yz,perscontbet1982,-0.5423,Do you Suffer from Crypto Addiction ,1603586203,110,1
2233,jhk574,DarkBlueScience,0.0,How to earn cryptocurrency,1603586113,0,1
2234,jhk1ye,sauciestwaters,0.3447,In the last bull run Bitcoin had multiple pullbacks of  to test the  day moving average Selling your coin now is like selling on the red circle on this chart Insane gains are coming dont get shaken out,1603585754,4,1
2235,jhjufe,IllMakeItUpNow,0.7184,Yum Moon Edible,1603584918,13,1
2236,jhjqao,evtherev86,0.7688,One more amazing night please,1603584472,3,1
2237,jhjo66,advertsparadise,0.7178,REN is the most bullish of the  Coins,1603584241,5,1
2238,jhjj15,CryptoRichRecords,0.0,Made a song about Crypto  Bitcoin  what do you guys think,1603583692,2,1
2239,jhjhn7,cecil_X,0.0,AMD Could Repurpose FirstGen RDNA GPUs for Cryptocurrency Mining,1603583539,0,1
2240,jhjenw,CryptographerFine810,-0.7402, most common cryptocurrency scams and how to avoid them,1603583209,2,1
2241,jhjcdb,SweetPie123,-0.1027,Large Bitcoin Holders Just Moved  BTC Analysts Grow Cautious,1603582967,33,1
2242,jhj8lk,Benmarvel,0.0,BeaconScan Guild Warz,1603582572,0,1
2243,jhj7dn,TR5_,0.0,Bill Harris ex PayPal CEO in ,1603582450,4,1
2244,jhj5bz,Super_Sprinkles_9044,0.0,The rise of crypto investment funds,1603582242,0,1
2245,jhj59r,AmericanHead,-0.3412,Not that easy,1603582235,7,1
2247,jhj34j,badaccountant28,0.0,Hodl,1603582022,5,1
2248,jhiq55,redruggles5,-0.0516,WTB SXSW Blankos Block Party exclusives,1603580658,0,1
2249,jhiohk,badaccountant28,0.0,Bitcoin,1603580502,4,1
2250,jhii89,perscontbet1982,0.5994,First they laugh at you then they want to be you,1603579855,7,1
2251,jhii6v,Absintherium,0.0,Question,1603579850,0,1
2252,jhibcm,kanginlee,0.0,DKPP WhitePaper V Is Now live,1603579141,0,1
2253,jhhyod,SerialMasticator,0.0,Degen at a Wedding,1603577869,4,1
2254,jhhxdm,SerialMasticator,0.0,HODLers at a Wedding,1603577742,0,1
2255,jhhx2s,QuantifyCrypto,0.6249, Year to Date Heatmap  Great Performance for Crypto,1603577711,0,1
2256,jhhw6r,maytorge1984,0.6369,Im smart enough to Agree with the Tv dude,1603577623,4,1
2257,jhhu1x,Maskimus,0.0,Kanye West Bitcoiners Know How to Liberate Humanity,1603577411,5,1
2258,jhhpie,TDavid13,0.8816,JP Morgan Bullish on Bitcoin It has long term potential,1603576962,0,1
2259,jhhpfx,smoljanovic,0.673,PayPal started accepting crypto currency Here is why I dont give a shit,1603576956,21,1
2260,jhhm8h,One_Air_4248,0.2263,Why wont yellow trading coin allow people to transfer there coins to ethereum once it is an ERC token,1603576652,0,1
2261,jhhj76,blackstreetxy,0.6674,What do you guys think of Ethereum vs Bitcoin since Ethereum is more energy efficient,1603576364,0,1
2263,jhhgv6,Th0mX,0.0,Why is there so much talk of a impending bullrun,1603576132,2,1
2264,jhhdgt,NexTurtle,0.6808,Whatever your view may be on Bitcoin one thing is clear to me Bitcoin is a perpetual call option on the future We dont get many of these during our life span,1603575795,0,1
2265,jhhbnc,FabriceManzo,0.0,Bitcoin Gold  ,1603575616,3,1
2266,jhh7m6,NightKingsBitch,0.5256,I saw it mentioned he spoke about it figured the actual clip is more valuable,1603575216,1,1
2267,jhh7f0,MierenKnager,0.0,Ethereum elevator pitch,1603575197,4,1
2268,jhh628,TheCryptomath,0.0772,What do you want for Christmas ,1603575069,5,1
2269,jhh0kg,NinjaDK,0.0,The reason we need cryptocurrencies,1603574555,5,1
2270,jhgwx3,SweetPie123,0.368,Bitcoin Price Could Triple Even After a Modest Switch From Gold JP Morgan Says,1603574204,15,1
2271,jhgwst,Magelis86,0.5719,To help others please share your biggest mistakes so far in crypto,1603574194,19,1
2272,jhgs9k,NinjaDK,0.0,Kanye West goes all in on Bitcoin,1603573755,8,1
2273,jhgrb8,NinjaDK,0.0,Kanye West hyping Bitcoin,1603573668,2,1
2274,jhgqix,Crypthomie,0.0,This comment is priceless,1603573590,4,1
2275,jhgpji,shewmai,0.4215,Kanye West discussing Cryptocurrencies on Joe Rogan These are guys that really have a perspective on what the true liberation of America and Humanity will be,1603573503,41,1
2276,jhglho,nanooverbtc,0.4927,Who Was Cryptos Most Influential Person in  Vote Now,1603573126,0,1
2277,jhgkps,salil19,0.4215,Kanye West talking about how Bitcoiners are the true liberation of American  Dont delete my post automod ,1603573050,10,1
2278,jhgkp6,cryptothisandthat,0.0,Do your crypto taxes,1603573049,0,1
2279,jhgfcd,Professor_Top,0.4404,If Bitcoin gets a weekend pump to  now wed have the biggest CME gap in history,1603572510,7,1
2280,jhgdyj,ethereumflow,0.0,SharkTron  DeFi Project That Implies Complete Autonomy  Press release Bitcoin News,1603572377,0,1
2283,jils4u,pale_blue_dots,0.3612,Bitcoin is like digital gold and wont be used the same as a traditional currency in at least  years billionaire investor Mike Novogratz says,1603741874,3,1
2284,jildq1,-Just_Another_Guy-,0.7193,Dont mess with the bulls,1603740705,5,1
2285,jil4cc,EvanVanNess,0.0, Latest Week in ETH News is out,1603739959,1,1
2286,jikzi7,entr_ashish,0.0,Binance Announces Axie Infinity AXS Token Sale on Launchpad,1603739528,1,1
2287,jikxah,finlessdunebuggy,0.0,Which one of you did this,1603739339,5,1
2288,jikvif,MammothSir9,0.886, Trillion in Assets Looking for Ideal Store of Value A Bull Case for Bitcoin,1603739186,0,1
2289,jikuq1,Bigp45,0.0,Submit your questions for the recently announced ElastosFilecoin alliance FilDA,1603739117,0,1
2290,jikstg,RussellHustle,-0.4588,You know what shitcoin is in an unrecoverable bear market The US dollar  in  is worth  cents in  its down  over  years,1603738970,0,1
2291,jikqf1,Sam_1256,-0.6124,Legit or Scam,1603738786,0,1
2292,jikpdw,HashMoose,0.5106,Highest Value Crypto Transaction In History Worth  Just Posted With a Transaction Fee of Just ,1603738701,43,1
2293,jikm8h,rivoke,0.0,Whale Moves  Billion in Bitcoin  Bitcoin,1603738436,7,1
2294,jikkgj,bronkula,0.0067,Having a physical streamdeck ticker is neat no matter how red those candles are,1603738289,4,1
2295,jikikb,DoctorNicholasVoodoo,0.2023,Cryptocurrency PreElection Top and Macroeconomic Outlook to make Quick ,1603738126,5,1
2296,jikhnu,TDavid13,0.0,New Era of Mining Equipment  ASICLine,1603738052,1,1
2298,jikgr4,TDavid13,0.296,Whale Alert  User moves  Million USD in Bitcoin,1603737976,8,1
2299,jikgmo,salil19,-0.1027,Crypto traders hard at trading,1603737966,3,1
2300,jikdou,HashMoose,0.0258,Bitcoin Starts Dumping After  Transaction highest real time USD value of a BTC transaction in history,1603737718,0,1
2301,jikd9w,SweetPie123,0.296,Whale alert  crypto user moves B in Bitcoin,1603737682,22,1
2302,jikaes,installeris,0.0,BITCOIN JUST POSTED ITS FIRST WEEKLY CLOSE ABOVE  SINCE ,1603737435,0,1
2303,jik9ml,installeris,0.368,Bitcoin Will X Compared to Gold Says JP Morgan,1603737367,51,1
2304,jik5bd,w3llFukM35id3w4y5,0.0,All it needs is a BTC logo,1603737011,4,1
2305,jik3j0,sylsau,0.1779,Rise Fall Stagnation Here Is the Mindset You Should Adopt With the Bitcoin Price,1603736867,4,1
2306,jik3fr,doge_c137,0.0,Election  Whats at Stake for the Crypto Industry,1603736860,1,1
2307,jik2mw,HashMoose,0.5106,Number of Bitcoin Addresses Holding Over  BTC Hits New High,1603736795,14,1
2308,jik033,Kroschi,0.0,Quick reminder Nobody knows the future price of insert random coin,1603736582,0,1
2309,jijxk1,Chrisdako,0.0,Just noticed the Reddit Vault on my Account,1603736372,0,1
2310,jijvbu,ResponsibleAd9086,0.743,Winning The Crypto Lottery Just Got Fairer Thanks to Chainlink,1603736180,0,1
2311,jijr9k,CaptLuLu,0.0258,Seven Japanese companies will invest in a new system that will manage many trade operations online using blockchain technology to prevent tampering,1603735843,0,1
2312,jijpgb,Sawyer86uk,0.0,We all feel it,1603735692,4,1
2313,jijmgw,Sawyer86uk,0.5574,The Crypto hero we deserve,1603735455,4,1
2314,jijm1a,bench4rench,0.3612,Ethereum  Nearly Ready for Launch Says Auditor,1603735421,0,1
2315,jijijw,gilfjord,0.6486,I know crypto is the DeMiSe oF tHe BaNkiNg SyStEm but that hasnt happened yet What banks are you using Which banks are crypto friendly,1603735151,17,1
2316,jijfmr,PAlove,0.0,Blacklight  find out which websites are using usertracking technologies,1603734903,0,1
2317,jijdww,Dalz1,0.3818,Top Cryptos Marketcap Bar Chart Race Animation  The race for the top  October   LeoFinance,1603734760,2,1
2318,jijcyo,Shubbler,0.2057,Are there any quality crypto Twitter pages that arent circle jerks,1603734683,7,1
2319,jij7yf,send_nipples,-0.4767,What could go wrong,1603734269,1,1
2320,jij6pi,Wulkingdead,0.0,Bitcoin Tokenized on Ethereum crosses B,1603734171,0,1
2321,jij5ck,DetroitMotorShow,-0.6705,Harvest Finance M Attack Triggers M Bank Run in Latest DeFi Exploit,1603734063,1,1
2322,jiiv9j,madfires,0.0,A group of major Japanese companies are expected to launch a blockchain based system to digitize trade operations,1603733221,0,1
2323,jiirbz,Sufficient_Picture19,0.7125, critical points from JP Morgans bullish Bitcoin report  CryptoSlate,1603732900,2,1
2324,jiir59,Solebusta,0.3612,And you say thank you,1603732885,7,1
2325,jiipo2,CryptoBanano,0.0,Let BTC do its thing alts will soon follow,1603732759,4,1
2326,jiiojq,fastRabbit,0.7184,Direct trade or rd party trust,1603732662,0,1
2327,jiiojm,Fritz1818,0.0,spoiler this meme also ,1603732661,4,1
2328,jiioe0,Craysco,0.0,Never used Nano heres how to get started in less than  seconds,1603732648,2,1
2329,jiilrp,AtanoKSi,0.0,Tomatocoin,1603732418,0,1
2330,jiij9p,KomodoPlatform,0.9118,Gleec Coin Integrates Komodos Security Solution   Moons reward for the best dPoW explanation  End in  hours,1603732210,21,1
2331,jiid6k,CaptLuLu,0.0,Toyotas IT arm is working on a digital currency pilot test,1603731715,0,1
2332,jii7ny,perscontbet1982,0.5423,Want to be rich soon  Nah,1603731258,15,1
2333,jihyrh,Wulkingdead,0.0,Alibaba Founder Jack Ma Digital Currencies are the Future of Financial System,1603730525,6,1
2334,jihxwa,salil19,0.5994,Monday Morning Bitcoin Bull Pennant Breakout Could Target k,1603730453,3,1
2335,jihwb4,da_dreamerr,0.0,Ethereum On Pace to Settle Over  Trillion in Transactions in ,1603730306,1,1
2336,jihw8q,send_nipples,0.0,When ETH breaks ,1603730300,2,1
2337,jihvry,Sawyer86uk,0.4404,Always a good day when the dollar falls,1603730257,3,1
2338,jihuha,DickandGordy,-0.4019,Todays Market Crash and the future of currency,1603730142,3,1
2339,jihtzw,GrendolfinAsia,0.0,Currency for cryptos,1603730102,0,1
2340,jihege,Solebusta,0.5859,Its okay At least BTC is still green,1603728736,3,1
2341,jihe91,SweetPie123,0.296,Hilversum traders get up to  years for money laundering  million in Bitcoin seized,1603728716,2,1
2342,jihcm5,GoldenRain99,0.4019,Nexxo a blockchain company aims to help small firms flourish,1603728575,0,1
2343,jihb3j,GoldenRain99,0.0,Kenyas central bank exploring CBDCs due to mushrooming of private cryptos,1603728444,0,1
2344,jih9si,GloriousGibbons,-0.6705,EU Rejects Petition for TaxBased CryptoCrime Victims Fund,1603728325,3,1
2345,jih9hv,blackrod08,0.0,Reef and Covalent to Bring DeFi Mainstream Adoption With Polkadot,1603728298,0,1
2346,jih80y,ResponsibleAd9086,-0.4588,Ethereum Defi Dapp Harvest Flashloan Attacked Funds Gone to Binance,1603728167,0,1
2347,jih4o3,techATNL,-0.3612,Kucoin suspicious withdrawals,1603727866,1,1
