,id,author,vader,title,created_utc,num_comments,score
3892,iaryuh,dudefooddude504,0.0,Up and TrustSwap,1597582903,6,1
3893,iarshp,ToppyNikci,0.0,OrchidOxt Coin up over ,1597582144,0,1
3894,iarjyh,chilledmyspine,0.0,Federal Reserve Bank Joining Forces with MIT to Work on Cryptocurrency,1597581058,0,1
3895,iare76,alliswell19,0.0,The Cypherpunks and Fathers of Bitcoin,1597580338,19,1
3896,iarbfl,Ogkush69x,-0.2263,So umm Anybody gonna talk about how oxt is pumping like crazy   in the last hours,1597579977,0,1
3897,iar9dc,cryptoadventura,0.6249,WMA BTC pushing to break past k while ETH surges well above ,1597579713,0,1
3898,iar8e4,Gasset,0.0,Total Fees in the last week Bitcoin  millions and Ethereum  millions The next coin is Monero with  in fees,1597579590,3,1
3899,iar6ve,TheMopFromMars,0.0,What on Earth is going on with Orchid OXT,1597579405,2,1
3900,iar4va,aiyayajojo,0.9593,Hi all New to investing in crypto What do yall think about StakeNet XSN Love the concept but wondering how much of the success of these alt coins are determined by the marketing efforts and ability to raise capital Learning how to conduct DD any tips appreciated ,1597579141,4,1
3901,iar1kl,Cripto_maniac_NL,0.0,PI network,1597578657,0,1
3902,iar1k7,goldjade99,0.0,Hong Kong Police captured three Bitcoin ATM robbers who stole ,1597578656,2,1
3903,iar0oq,Spooky512,0.0,Alternatives to coinbase,1597578525,2,1
3904,iar0gk,joycegreen2,0.4019,ARE YOU INTERESTED IN EARNING EXTRA INCOME EVERY  HOURS OR WEEKLY  EARN  TO  EVERY WEEK WITH MY COMPANY INBOX ME AND I WILL GET YOU REGISTERED,1597578489,0,1
3905,iaqukn,nugget_alex,0.2023,This Weeks Top Bitcoin Crypto Global Finance amp Economic News,1597577637,3,1
3906,iaqtie,zymwise,0.0,Melon  Elon M  Elon Musk  is Elon on the marked,1597577488,4,1
3907,iaqm1w,slam93,0.0,Pi network,1597576382,0,1
3908,iaqjf7,MammothSir9,0.0, of South Koreas Largest Banks to Provide Cryptocurrency Services,1597575976,0,1
3909,iaqerc,Daleedge,0.4939,PI Network  Next Exciting Crypto,1597575285,0,1
3910,iaqcmu,Old_Skin369,-0.296,Missing Crypto from Ledger account,1597574952,0,1
3911,i52sqx,nanooverbtc,0.4588,How long are you on Bitcoin,1596756505,9,1
3912,i52poh,troytrojan01,-0.0207,Hi IoTeX people Just take a look at what we have in stock for you  our brand new video guide on how to swap IOTX easily on SwapSpace without an account Welcome to check it out,1596756196,2,1
3913,i52mp9,sunchakr,0.0,THIS WEEK ON MONERO TALK Joel Gugger Monero Atomic Swaps Update,1596755913,0,1
3914,i525c1,kelleyreed159546,-0.4019,Baidus XuperOS White Paper Blockchain Unicorns in China and Digital Currencies in the Monetary System  China Market Watch,1596754245,0,1
3915,i51nyv,Nathb95,0.0258,Unstoppable domains  Are  letter Dotcrypto domain worth the  pricetag,1596752605,0,1
3916,i51lot,PotentialFortune,0.6369,TERN the best kept secret My  day review of the blockcard,1596752398,0,1
3918,i51gcj,nice2yz,0.0,Why Ukraine Is Ripe for Cryptocurrency Adoption,1596751892,1,1
3919,i51fcp,ShotBot,0.0,HOW TO NOT BE A BITCOIN CRYPTOMORON,1596751799,2,1
3920,i51bno,margarita_cowboy,0.5106,How to transfer SHR from Bitmart to Trust,1596751465,0,1
3921,i517kb,christianjpberg,-0.1916,Yineu YIN is about to FLY past BTC Missed CyberCoin UNC AMPL Dont miss this Day,1596751091,0,1
3922,i5173m,ShotBot,0.4019,North American Investors Vastly Favor Bitcoin Over Other Cryptocurrencies,1596751046,3,1
3923,i5142g,Chris9393,-0.2023,Best exchange to sell crypto for cash,1596750770,0,1
3924,i50zc4,jonutjonut,0.0,VERTCOINS VERTHASH COMING SOON,1596750338,0,1
3925,i50v3r,Sean359,0.0,Neblio Buildathon,1596749957,0,1
3926,i50s20,Nest_Fan,0.0,Whats different from NEST Oracle and ChainLink,1596749697,0,1
3927,i50ogi,GamaouaT,-0.4767,I want to FOMO on a ERC but have doubt,1596749374,0,1
3928,i50mjs,ehfre,0.3182,Please,1596749211,14,1
3929,i50m49,ShotBot,-0.5267,Conspiracy,1596749173,2,1
3930,i50lb4,Status-Lead,-0.6124,VinDAX exchange is potentially pulling an exit scam right now,1596749104,0,1
3931,i50iiz,dajonn,0.0,FEEESS,1596748860,0,1
3932,i50ey5,huffydood,0.6124, Bitcoin Bounty for some one tha will help me out please,1596748537,0,1
3933,i50dek,fletchDigital,0.7506,Has anyone had success with auto crypto trading arbitrage Would appreciate insights,1596748387,0,1
3934,i5098f,NoExpertBut,0.7184,This guy with his moon stick,1596747995,2,1
3935,i50985,Affectionate-Damage1,0.0,My Mining Team,1596747993,0,1
3936,i5085a,siderealiq,-0.4767,Fake Telegram accounts how to recognize them,1596747894,0,1
3937,i503qw,ftx_sucks,-0.1027,FTX  Commissions Issues amp Terrible Customer Support,1596747513,0,1
3938,i503kf,BirdsAsHelicopters,0.0,rbitcoin right now,1596747497,38,1
3939,i500q7,ShotBot,0.34,Ethereum Gold promises passive interest over time for investing your ETH How is this different than bitconnect and other ponzi schemes,1596747263,10,1
3940,i4zxd7,cryptobriefing,0.4588,EOS Ecosystem Dying BP Collusion Community Fragmentation High Costs,1596746996,21,1
3941,i4zlz2,PeterAugur,0.0,Hyperchange x Augur Decentralized Prediction Markets  w Tom Kysar,1596745970,2,1
3942,i4zjtp,nanooverbtc,0.1779,Goldman names new head of digital assets in bet that blockchain is the future of financial markets,1596745775,6,1
3943,i4zd8l,arijitdas,0.7717,Sundays Are the Perfect Time to Buy the Bitcoin Dip Data Shows,1596745197,5,1
3944,i4za42,Kickboxer111,0.0772,What are the biggest problemshurdles in the cryptocurrency industry today I am starting a business and want to fix them,1596744910,0,1
3945,i4z4ik,I_might_be_your_dad,0.7181,Its not that hard to profit from mining lol,1596744408,2,1
3946,i4z41d,MammothSir9,-0.2263,Testimony From Craig Wrights ExWife Throws a Twist in the Billion Dollar Bitcoin Lawsuit,1596744369,2,1
3947,i4z3e7,tagawa,-0.25,BAND on the run,1596744314,11,1
3948,i4z1r7,tagawa,-0.25,BANDs on the run,1596744168,2,1
3949,i4yu7f,Imgoingtowingit,0.0,Earn  KNC on Coinbase for watching  videos answers included,1596743484,2,1
3950,iikswv,Laughing1992,0.0,Defi gem,1598668673,0,1
3951,iikr00,PTBTC,0.0,What can I use to track all of my crypto,1598668451,1,1
3952,iikex8,ruvarejoyce,0.0,REIMAGINE  Is Live The Worlds Largest Blockchain Conference,1598667069,0,1
3953,iikatw,Ituglobal,-0.2023,BTC ETH XRP and BCH Begin Strange Movements,1598666595,4,1
3954,iik1al,TecuaniTec,0.0,Overcoming Limiting Beliefs in Crypto,1598665492,1,1
3955,iik0xi,Leoak47,0.7964,Is ledgerX safe for options trading  Or is there a better website or please tell me your experience for a USA customer if possible,1598665450,2,1
3956,iiju4e,mikachi123,0.3612,subscribe his youtube channel thank you,1598664664,0,1
3957,iijsfz,BlueberryWatermellon,-0.4019,Going All InRoobet Crash Strategy,1598664472,0,1
3958,iijlui,bitcoinjesus2020,0.0,kucoin scamming with KYC out of nowhere after only  deposits and  withdraws in about  months,1598663680,0,1
3959,iij4a4,Sceptical_Spectacles,0.6124,Efinity Promising scaling solution for ETH chain Conduct near instant transactions offchain settle the results onchain,1598661683,0,1
3960,iij1ra,Zachincool,0.0,Hes at it again,1598661397,8,1
3961,iiix7o,iamchitranjanbaghi,0.0,Digibytes DigiAsset token for Reddits community token system,1598660883,0,1
3962,iiihi9,frankenstein2035,0.0,Bitcoin Private Key Finder And Hack,1598659171,0,1
3963,iihusm,Umunachi,0.0,Educate me Pending Swap,1598656751,0,1
3964,iihno8,i-am-a-human0001,-0.25,Cancel Ivan on Tech,1598656005,0,1
3965,iihnbn,MammothSir9,0.0,Visa Exec Says Opt Out With Bitcoin Slamming Feds Policy Change Toward Inflation,1598655970,0,1
3966,iihhyh,100BTCChallenge,0.0772, BTC Challenge,1598655441,0,1
3967,iihh5y,sushiiallday,-0.6096,See so much hate on Bitcoin in the Ethereum Community thought this was fitting,1598655354,5,1
3968,iihfxj,joenorwood77,0.0,Discussion of the Day Amon AMN,1598655232,1,1
3969,iih9cz,BitcoinIsDigitalGold,0.5423,Clip Raoul Pal Praising Ethereum On A Bitcoin Podcast Why He Is Investing In Ethereum,1598654563,0,1
3970,iih3tv,smoljanovic,0.34,CRYPTORAMA The Future Six Stores of Value Columns,1598654019,0,1
3971,iih3es,The_Sighborg,-0.25,Can we talk about the bots pumping articles out right now,1598653979,19,1
3972,iigsf6,The_Sighborg,0.4404,the bot pump articles coming out now,1598652896,2,1
3974,iigfp9,LunchLurker,0.4019,Smart Contract Summit Day  Livestream,1598651666,0,1
3975,iigec1,SerialMasticator,0.0,Bitcoin our financial saviour,1598651541,3,1
3976,iig805,Leuko_,0.0,About the PI coin,1598650973,0,1
3977,iig2be,ethereumflow,0.4588, Top Actors Comedians and Rappers Advocating Crypto industry,1598650445,5,1
3978,iig1zn,The-Crypto-Portal,0.0,InterestingI wonder what has been happening behind the scenes since then Records Reveal Ripple CEO Brad Garlinghouse Met With Senior Trump Administration Official in ,1598650415,4,1
3979,iifywb,The_Sighborg,0.4588,Throwback meme buy the meme sell the rumor eat tendies when the news hits,1598650130,3,1
3980,iiflzw,UnknownDeveloper,0.0,Bots have infiltrated the Bitcoin community,1598648979,3,1
3981,iifhpr,orlandox683x,0.5859, to the winner,1598648596,11,1
3982,iifbeh,Snoo_37856,0.4588,Binance support number ,1598648023,0,1
3983,iifad5,blessive,0.2023,Top Investors Bet  Million that DeFi Will Move to Polkadot Network,1598647927,0,1
3984,iif9a0,KupAdam31,0.0,How Does Staking Works,1598647828,0,1
3985,iif58b,tomba123,0.4215,Nice article about maybe the biggest game changer ORACLES that cryptocurrency has ever seen,1598647473,3,1
3986,iif3ct,mrsotkogaming,0.2732,Polkadot Performs Well After  Split,1598647317,2,1
3987,iiex3q,BTCUser_,0.0,Day Trading Will Drain Your Soul,1598646757,4,1
3988,iiepka,BittrexGlobal,0.0,Ethereum Is a Dark Forest,1598646085,4,1
3989,iiekim,jamesrt2004,0.0,Hiring software developers Send your resume,1598645614,0,1
3990,iiefht,MammothSir9,0.0,Federal Reserves Major Policy Shift to Push Up Inflation Could Send Bitcoin Price to K,1598645180,0,1
3991,iie5wj,blessive,0.0,ShapeShift employee allegedly stole  in Bitcoin from company accounts,1598644332,0,1
3992,iie3o1,JeremyLinForever,0.25,Alright which one of you owns this car,1598644136,24,1
3993,iid7l8,ConanWolf46,-0.5994,Manipulation of the conversation or just overly strict mods Ethereum Classic Discord Server,1598641317,0,1
3994,iicwp8,Byt3r,0.0,Doubling down  the Fed,1598640371,2,1
3995,iicv43,1234yomama1234,0.0,Questions on the future of crypto from someone that used the first Bitcoin atm at waves cafe in  Are we aiding the movement towards a dystopian future,1598640228,18,1
3996,iicu39,zombie0077,-0.6124,Youtube srsly Eth scam right in da face,1598640135,5,1
3997,iic0gr,MakeMoneyOnlineHome,0.0,Bitcoin Cash  This You NEED To Know ,1598637568,0,1
3998,iibj8o,Latig10,0.9164,GREAT OPPORTUNITY  Launch bonus,1598636101,1,1
3999,iiazig,MammothSir9,0.0,Bitcoin Slips in Latest Crypto Ranking by Chinese GovernmentBacked Center,1598634375,2,1
4000,iiaw0i,Plutusedge15,0.0,Ethereum Increases Returns in an Investment Portfolio Finds Study,1598634078,0,1
4001,iiat1e,blackrod180,0.5994,AERGO  Bull flag formation about to breakout to the upside for KUCOINAERGOBTC by StevenAitchison,1598633817,0,1
4002,iiaq27,G99SEMAN,0.7184,I sold all my Bitcoins to buy my dreamcar today,1598633544,515,1
4003,iiaeaa,At0m11c,-0.34,Dollar and other Fiat money is going to shit,1598632498,7,1
4005,iiaav5,Gordon_Law,0.0, tax form has major implications for crypto traders,1598632202,2,1
4006,iia7wk,arijitdas,0.296,Money is evolving Its time to adapt  A crypto advertisement by binance in a bus stand at London,1598631932,2,1
4007,iia5sn,LyndaMcnaulty,0.7096,Best Defi Interoperability Solutions  Exploring Fusion vs Cosmos vs Polkadot  Sponsored Bitcoin News,1598631750,0,1
4008,iia2hl,buzzbooz,-0.4215,Defi On Bitcoin Will Make Ethereum Useless,1598631467,2,1
4009,iia0t3,nanooverbtc,0.0,Equinor partners with bitcoin mining company to significantly reduce flaring from operations through bitcoin mining,1598631310,3,1
4010,ii9uv8,LyndaMcnaulty,0.0,FUSION DCRM Interoperability Connecting All Blockchains with Traditional Finance,1598630787,0,1
4011,ii9u97,InternetScary,0.0,AUX big news coming New listing in  days Big Exchange,1598630738,1,1
4012,ii9r6n,jackals02,0.7184,Coinbase log in issue Looking to buy IOTX on binance,1598630485,0,1
4013,ii9ive,TimmyAts,0.0,Quantum Financial Reset To A DD Hybrid State Ahead,1598629779,2,1
4014,ii9al7,MakeMoneyOnlineHome,0.0,Beginners Guide to Own Bitcoin Cryptocurrency ,1598629058,2,1
4015,ii96j9,mishax1,0.5106,So people wanted me to shill those oversold last years accumulations Have fun,1598628716,3,1
4016,ii95uo,MakeMoneyOnlineHome,0.6739,WOW  in Bitcoin TODAY will make YOU a MILLIONAIRE by ,1598628659,0,1
4017,ii8z6o,VampireVlad,0.0,How amp Why to Set Up a Shamir Backup on Trezor Model T,1598628063,7,1
4018,ii8yjb,dogchaser11,0.3612,A regular listen in times like this,1598628008,0,1
4019,i7yh8q,googm70,0.296,Noob question in reinvesting gains,1597174674,0,1
4020,i7yfa0,nanooverbtc,-0.0258,Bitcoin has broken its alltime high vs Argentine Peso Turkish Lira and Brazilian Real,1597174507,2,1
4021,i7yagc,usedmyrealnamefirst,-0.1027,Trump Says Hes Seriously Considering a Capital Gains Tax Cut,1597174070,317,1
4022,i7y6s0,nanooverbtc,0.0,Reflections on Coinbase Bitcoin Transaction Batching,1597173747,2,1
4023,i7y4dr,nanooverbtc,0.6908,Media is bullish again,1597173533,1,1
4024,i7y4ah,lj26ft,-0.4588,Crypto capital is the common thread between Bitfinex Quadrigacx and other troubled exchanges,1597173524,2,1
4025,i7xvtd,MammothSir9,0.5423,Billion Dollar Public Company Microstrategy Moves  Million Into BTC Says Bitcoin Superior to Cash,1597172781,0,1
4026,i7xvld,Eeyore99,-0.5829,Are DeFi projects really that bad,1597172760,0,1
4027,i7xt8q,chilledmyspine,-0.5574,Hackers steal Bitcoin through largescale exploit on Tor report,1597172559,4,1
4028,i7xqf5,Plantush,0.0,Trendering TRND   min video competition  Community votes   TRND pool,1597172328,0,1
4029,i7xdos,sendmorechuckberry,0.6908,A case for a wildly bullish Ethereum,1597171220,0,1
4030,i7x6tw,MagoCrypto,-0.1531,A New DeFi Exchange Says It Has Solved An IndustryWide Problem,1597170625,0,1
4031,i7wsng,jesushatedgod,0.8176,Buy btc anonymously and have it ready same day,1597169398,2,1
4032,i7wri3,jesushatedgod,0.5859,Buy btc and get it same day no id,1597169301,2,1
4033,i7wm2v,Plutusedge15,0.5267,Band Protocols Strong Uptrend Backed by  Surge in Unique Addresses,1597168843,0,1
4034,i7wipf,WittDitty,0.6249,The Elusive Value of Ether interesting piece on evaluating ETH,1597168543,3,1
4035,i7wge0,blessive,0.0,This DeFi token by FTX went up  right after launching,1597168343,0,1
4037,i7w0vw,daslawdawg,0.0,How to understand the basics of cryptocurrency from an investing standpoint,1597166983,0,1
4038,i7vv4l,ubunchofcrazyjok,0.128,For people missing tokens for the binance BNB contest I can help out with those few extras I have,1597166472,2,1
4039,i7vo43,Le_Temps_retrouve,0.2023,Top DeFi Projects in  Part Two,1597165857,2,1
4040,i7vl88,sylsau,0.7843,The Best Way to Use Bitcoin Right Now Is as a Store of Value Not to Pay for Coffee Daily,1597165603,15,1
4041,i7vh16,mutDallasCowboys,-0.296,Can I avoid the fees anyway,1597165252,2,1
4042,i7v9yx,girlshero,0.0,Thoughts on COSMOS ATOM  The Internet of Blockchain,1597164631,2,1
4043,i7v4g4,RIOP3L,0.0,hodl,1597164131,2,1
4044,i7uw28,wudaokor,0.2732,Serum SER a new DEX built on Solana by the FTX team IEOd on Friday at  listed today on Binance FTX BitMax and is currently up gt on the day ,1597163374,0,1
4045,i7uqju,kellysmith,-0.4404,Realistic Signals Group scandal  Fund manager may have walked away with U k in investor funds,1597162877,0,1
4046,i7ujpv,popolenzi,-0.4404,Switcheo Tradehub genesis block launch tomorrow on Tednermint,1597162276,6,1
4047,i7uh8r,FisheyJay,0.3182,SingularityNets decentralized AI market place is open for business and theres a cool python deezer API that uses machine learning check it out,1597162067,0,1
4048,i7ug18,MammothSir9,0.3182,Peru India Indonesia Nigeria Among Countries With Highest Crypto Usage Increase,1597161962,0,1
4049,i7ufcx,spoonfednonsense,0.296,Last Day of EDCON Join us for ETH  discussions amp more,1597161901,1,1
4050,i7udcx,JessDeclercq,0.0,PP experience,1597161728,0,1
4051,i7uatt,TheoryFragrant4375,0.7184,When can we buy bitcoin or chainlink again at half price,1597161509,0,1
4052,i7tzh4,FisheyJay,0.2263,AGI SingularityNet staking portal decentralized AI portal steak your tokens for  days at a time check out their calculator which will allow you to calculate your staking earnings of your AGI tokens,1597160469,0,1
4053,i7tmj9,GoingMenthol,0.743,Forbes The Great Chinese Money Experiment Is Over,1597159208,4,1
4054,i7tddf,HoonCackles,0.0,Uniswap not enough liquidity for swap,1597158274,9,1
4055,i7t71h,BittrexGlobal,-0.6222,Russia Backs Away From Total Cryptocurrency Ban,1597157600,7,1
4056,i7t1bh,nina_crypto,0.5859,Ledger User Interviews Register to win a Ledger Nano X,1597156982,2,1
4057,i7svry,sirfaith,0.0,INVESTMENT HOLDING OF ONLINE CASINO POKER AND SPORTS BETTING,1597156395,2,1
4058,i7shmc,nanooverbtc,-0.25,Run on BofA ATMs in California,1597154978,3,1
4059,i7s3um,RobertJameson,0.2732,Crypto Derivatives Exchange OKEx CEO Jay Hao Reveals that Bitcoin and Gold Correlation Increased during COVID,1597153585,4,1
4060,i7s2lg,cyger,0.5423,MicroStrategy Buys M in Bitcoin Calling the Crypto Superior to Cash   Bitcoin,1597153462,33,1
4061,i7s2cw,Competitive_Study569,0.0,Click sign up start earning,1597153440,0,1
4062,i7s1ni,the420chronicler,0.8807,MicroStrategys operating cash flow and income have seen a significant decline over the last several years Its PE ratio is above the industry average The Bitcoin buy could be viewed as a Hail Mary to save their business but as long as the business is a longterm going concern its a smart move,1597153365,2,1
4064,i7rs6h,gcbeehler5,0.541,Chainlink  Why so special ,1597152385,1,1
4065,i7rs23,Niftygeek,0.7351,Join our cause and help us expand the real application of cryptocurrency for a cause that will heal humanity,1597152372,0,1
4066,i7rba8,CubeLegend,0.4215,Mediacoin is a PP blockchainbased file sharing network,1597150595,4,1
4067,i7r8xc,Robby16,0.0,Slowly then suddenly m revenue company MicroStrategy puts m into btc as their reserve,1597150333,6,1
4068,i7r6tr,gcbeehler5,0.8689,Top  Best Performing Rewards Earning Crypto Assets  July  Summary,1597150102,0,1
4070,i7qki0,MediumAdhesiveness5,0.6124,MicroStrategy Adopts Bitcoin as Primary Treasury Reserve Asset,1597147449,8,1
4071,i7q96h,sveg944,0.0,A question about savings in the bank,1597146032,0,1
4072,i7q8dd,thedowcast,0.0,Bitcoin research prediction algorithm using the location of the Sun,1597145923,3,1
4073,i7q0j3,WaggishNickel,0.0,Bitcoin price volatility is picking up but what do industry professionals have to say about that,1597144914,0,1
4074,i7pxyf,Alfaq_duckhead,0.25,How do you value how much to pay for a Coin,1597144591,5,1
4075,i7pwu1,J-Mosc,0.0,I had various crypto on Binance exchange back during the  boom bust I live in FL US Is there a way to still access funds,1597144438,12,1
4076,i7pw8r,nugget_alex,0.0,Chain Walking Data Analytics amp Crypto Trends  Finding Edge With On Chain Analysis,1597144367,1,1
4077,i7pq02,iamthakurabhishek,0.8126,Indias crypto trade volumes have soared since the Supreme Court lifted banking restrictions in March with bitcoin peertopeer trade volume reaching an alltime high of  million in July,1597143547,4,1
4078,i7pp2z,BaramoviAyden,0.8481,Bitcoin is a digital currency that you can easily invest on and earns a good profits return within the period of one week trade and your earnings is  guarantee write me privately for more info,1597143419,2,1
4079,i7pm4m,biggiedip,0.1779,Why are you not trading with BLZ  New trading pairs on binance BLZBUSD BLZUSDT OTHER PAIRS AVAILABLE BLZBTC BLZETH BLZBNB Bluzelle is a massive growing market,1597143026,0,1
4080,i7plg7,mammoth0,0.6124,IOTA Revs Its Engines for Mainnet Upgrade Launch,1597142930,45,1
4081,i7pb31,oggew2,-0.6124,What is tonoitpythonsignals Scam,1597141480,0,1
4082,i7p822,R_wild,0.0,Transfer cryptos from Ledger to Trezor,1597141040,0,1
4083,i7p4wd,NickLaz0r,0.0,OCEAN Protocol announces partnership with the UN First cryptocurrency to ever do so,1597140560,0,1
4084,i7p3do,tyrsun,-0.4019,Bitrue XRP Raffle Problem,1597140334,4,1
4085,i7p0oj,Jokerslayer369,0.0,Will paxgold go up ,1597139961,0,1
4086,i7oyd0,percysaiyan,0.0,Adoption and Projects,1597139610,5,1
4087,i7ov68,v0id_xyz,-0.2732,What are the risks in Staking USDT,1597139120,9,1
4088,i7onrh,BusinessCow6786,0.0, Is The Year For Bitcoin Crypto Experts,1597137986,8,1
4089,i7olhs,art_of_bug,-0.3612,Nebulas  Exhausting Disk Space Using Contract Logging,1597137659,0,1
4090,i7ojex,aminok,0.0,Reddits first blockchainbased community token donut exceeds a market cap of  million,1597137361,25,1
4091,i7oey6,imolev,0.0,Go For Launch An Update  Switcheo staking update  launch confirmed  August th,1597136714,0,1
4092,i7obgt,OrganixTeam,-0.4019,Organix Protocol  DeFi on EOS the website and white paper is released and the airdrop campaign starts,1597136192,0,1
4093,i7o1f2,Bobcat-Shot,-0.3182,Can I get my XRP back I lost it all,1597134617,0,1
4094,i7nzy0,arijitdas,-0.1027,A South Korean beach wants you to pay in Ethereum,1597134375,5,1
4095,i7nzpr,Harrycdq,0.0772,Want to start earning   every day  Then write to me soon mkharrycdq,1597134333,6,1
4096,i7numx,polagon,0.2023,Top  Decentralized Exchanges in  With Unique Features,1597133538,1,1
4097,ijd8cp,Ferguson0311,0.0,Get now,1598796551,2,1
4098,ijd7r2,nanooverbtc,0.0,In world first bankissued stablecoin used at online retailer,1598796485,0,1
4099,ijd6pf,MammothSir9,-0.8074,Ethereum Classic Suffers  Attack Again Delisting Risk Amplified,1598796370,0,1
4100,ijcx7w,NOTPR0,0.0,Sprout  The Pseudoabflationary Self Funding Altruistic DAO,1598795207,1,1
4101,ijctlk,Erdi99,0.6908,Noob questions good coins to investhow long to hold onto,1598794769,0,1
4102,ijcn2e,bitstamperio,0.128,Bitcoin street art legal wall Lausanne  Switzerland,1598793947,2,1
4103,ijcljg,FusionOfAlloy,0.5267,KLP  Kulupu This coin is at  right now on qtrade Less than a month old PoW Amazing transparent team working hard Polkadot Substrate,1598793754,5,1
4104,ijchip,vinnybag0donuts,0.5106,I feel like Im buying the top of every coin right now,1598793211,49,1
4105,ijcf2e,Oninteressant123,0.0,People have spent almost M USD on Eth gas for Uniswap,1598792910,9,1
4107,ijccmy,goldjade99,0.3818,Federal Agencies have been reaping the benefits of Blockchain Tech,1598792614,0,1
4108,ijcbfn,Dazadeen,0.0,DeFiat token,1598792467,0,1
4109,ijcb1q,Dazadeen,0.0,DeFiat DFT  Potential disruptor,1598792417,0,1
4110,ijc7yq,boogaav,0.0,Guys Decentralize Future is here ,1598792008,5,1
4112,ijc1rp,BobLoblaw45,0.0,Gemini on Blockfolio,1598791134,2,1
4113,ijbxlc,JoJopama,0.3182,DeFi Payment Solution Company Integrates Litecoin,1598790555,4,1
4114,ijbwko,mezombiee,-0.7351,Ethereum Classic Suffers Third  Attack in a Month,1598790405,3,1
4115,ijbv6a,Oxygenjacket,0.0,Uniswap has overtaken Coinbase in trading volume,1598790200,123,1
4116,ijbsca,marenqo,-0.34,Ramp network crazy Bank verification,1598789839,0,1
4117,ijbkwo,religionresearcher,0.296,If you are not making tons of money in crypto now then you are not made for this,1598788842,21,1
4118,ijbe0l,religionresearcher,0.296,If you are not making tons of money on Defi now then you are not made for crypto,1598787754,3,1
4119,ijaxmc,TangerineParadise,0.4404,Compilation of useful Business  Trading Telegram channels,1598784889,0,1
4120,ijawl7,blessive,-0.2263,BTCUSD Again Pressured Below  Sally Hos Technical Analysis  June  BTC,1598784730,0,1
4121,ijag4e,MammothSir9,0.2023,Polkadot Top  Redenomination Shot Is the Token Now Bigger Than Chainlink,1598781968,0,1
4122,ijafgm,xmr_kayront,0.0,You Have a Choice To Make,1598781851,0,1
4123,ijadye,xmr_kayront,0.0,Your Choice To Make,1598781606,0,1
4124,ijad6y,archozzy,0.0,Suggest me a Token,1598781464,7,1
4125,ijaccs,archozzy,0.0,Shill me a token,1598781316,2,1
4126,ija730,cncamusic,0.34,Coinbase is giving away Comp EOS and XLM for answering some questions,1598780434,2,1
4127,ija72q,Michael__X,-0.4767,Why culinary currencies are dangerous to speculate on,1598780432,3,1
4128,ij9yqa,Ferguson0311,0.296,Join now before its to late,1598778979,0,1
4129,ij9ye1,Matrixsam,0.0,Give Back the BAT,1598778922,0,1
4130,ij9w3i,goldjade99,0.7297,UK FCA proposes changes to include Crypto businesses in AML reporting,1598778528,3,1
4131,ij9vt8,Tricky_Troll,0.3368,So many shattered hopes and dreams,1598778487,17,1
4132,ij9qt2,burstymy,0.0,A single dapp on Ethereum Uniswap pays more fees to its users than the entire Bitcoin network,1598777639,104,1
4133,ij9cqs,bitcademyfb,0.0,Yield finance just right now,1598775311,4,1
4134,ij9c6g,Ragtag_fleet,0.0,Defi Project Yearn Finance Smashes Records as Native Token Surpasse,1598775220,10,1
4135,ij9c4l,cryptodiggy,0.4404,The Biggest Cryptocurrency Bull Run Ever,1598775209,5,1
4136,ij90gj,HAIRYdrum,0.0,Dont be this guy,1598773296,3,1
4137,ij8xto,WaggishNickel,0.4019,Cash locked Decentralised Finance DeFi smart contracts closes in on  billion as investors continue to pile shrugging off concerns over new protocols and their incredible valuations,1598772873,0,1
4138,ij8xrb,lizzieport,0.0,How do you spot the cryptoscams,1598772865,0,1
4139,ij8ijw,Apportrarn,0.6486,Scammers pretend to be popular Bitcoin profit system to distribute malware,1598770553,2,1
4140,ij8hmh,Ashishb_45,0.0,First episode of talks show ZLFTalks with CEO amp Founder Chevkev of project Nolecoin is live Check it out ,1598770405,4,1
4141,ij88zj,senzsze,0.296,CoinGenius NFT Day  NFTs  Creating a New Standard panel discussion,1598769118,4,1
4142,ij856q,ESMYEEL,0.0,Reimagine,1598768557,0,1
4144,ij7ymv,MammothSir9,0.7096,Lysander Spooner Natural Law  The Science of Justice,1598767568,0,1
4145,ij7unh,marquitos4783,0.0,CRYPTO CURRENCY REGULATION,1598766955,0,1
4146,ij7f5r,RokHoppa,0.0,Shoutout To Matic Network Validators,1598764665,0,1
