,id,author,vader,title,created_utc,num_comments,score
790,fmligv,elninjafuego,0.4019,Need help Quick survey for college,1584821692,6,1
791,fmlarh,pmr212,0.0,The District Weekly  March st,1584821069,0,1
792,fmkrb5,CryptoEK,0.0,Dont use cash  Use cryptocurrency,1584819337,0,1
793,fmkqot,At0m11c,0.0,Bitcoin in  and the global markets,1584819278,4,1
795,fmk6ar,ketchuma,0.1531,Stakenet Dev Update  LN Swap Beta Test Invite  March  ,1584817389,0,1
796,fmjva6,okean123,0.3182,The Steem blockchain now is centralized under one person  Please stay away,1584816318,46,1
797,fmjjue,blessive,0.5106,Maker Foundations Rescue Proposal Drops Stability Fee to ,1584815184,0,1
798,fmjgq4,1randyrong1,0.4588,Buy the dip,1584814876,3,1
799,fmjezu,itsblockchain,0.0,Impact of the  Halving on the Bitcoin Industry,1584814702,16,1
800,fmj9bd,intothecryptoverse,0.0,Ethereum An update on the ETHBTC ratio,1584814139,4,1
801,fmj98a,crypto-jay,0.5473,LUCRATIVE BLOCKCHAIN OPPORTUNITY  Recruiting Team,1584814132,6,1
802,fmil0y,AlanOne89,0.34,Crypto a new store of value or another form of investment,1584811712,0,1
803,fmiivj,CJ_900,0.0,How Ethereum amp Chainlink Will Change Blockchain Technology,1584811482,2,1
804,fmi76y,longspeek,-0.5423,The US Government answer to everything a fistful of dollars Another epic fail,1584810280,0,1
806,fmi3oq,capitalol,0.0,Federal Reserve to lend additional  trillion a day to large banks,1584809942,62,1
807,fmhy3s,CryptoPlanetVIP,0.4019,DeeMoney Partnership to Help Ripple Deepen its Roots in Thailand,1584809374,2,1
808,fmhpq1,sylsau,0.2584,When Buying Bitcoin Dont Make the Mistake to Be a Momentum Trader,1584808501,3,1
809,fmhixr,smbale,0.3612,Bitcoin IRA Poll Majority of Investors Believe Bitcoin Will Rebound Past  In A Few Weeks,1584807803,3,1
810,fmhb5u,HDV1976,0.0,CLXmU,1584807000,1,1
811,fmgxur,allaudin00,0.0,crypto,1584805618,0,1
812,fmgmk3,blessive,-0.8074,Cryptos Circulation in Russia Looks Grim as Central Bank Could Ban Issuance,1584804385,0,1
813,fmg7cs,EasyLivingChief,0.0,Building on Blockchain pt  ft Joe Ciccolo CAMS CFE AMLCA,1584802711,1,1
814,fmfq9j,yogiwaan,0.0, Whitepaper,1584800732,10,1
815,fmflue,WeakHands_Trader,0.0,Charlie Lee vs Senators,1584800193,12,1
816,fmfjop,holle197,-0.0516,Help publishing crypto block,1584799929,0,1
817,fmfckg,Kuroda120,0.0,Why cryptocurrency,1584799065,0,1
818,fmf1d3,arryanna,0.7184,Stablecoins How many are there the Differences and How to Buy them,1584797670,9,1
819,fmen44,broccolifries,0.0,How does cryptocurrency work,1584795789,0,1
820,fmekni,Hwgttm,0.0,Grimm Gothic release April th ,1584795482,0,1
821,fmeg0e,LefterisJP,0.3182,Rotki the portfolio tracker that respects your privacy now autodetects ethereum tokens owned by an account with the new v release,1584794870,8,1
822,fme22k,Hyper_Intake123,0.0,How do I know much I should invest,1584792761,23,1
823,fmd8yf,ashu82,0.0,Earn Bitcoins,1584787985,0,1
824,fmd42b,cryphtodimi,0.1779,IOST Becomes First Blockchain Project Advertised by Amazon AWS China,1584787121,0,1
825,fmcgzp,jadekhan103,0.0,How To Invest in Cryptocurrencies Right Now In   Web Earning,1584783133,0,1
826,fmc5v1,frturtle,0.0,multisignature technology questiom,1584781095,0,1
827,fmbz91,ltbluepoetry,0.34,Friend and I talking about bad dreams we had last night,1584779894,1,1
828,fmboal,THEANONLIE,0.0,Which toe rag mod gave me this flair,1584777954,0,1
829,fmbm75,kingslayer555555,-0.3182,Lost Vechain,1584777580,0,1
830,fmb0cd,Kayzee12,0.0,Open a new account in the next  hours  Robinhood,1584773765,1,1
832,fmaqal,MarilynMonero21,0.0,I fixed it ,1584772193,16,1
833,fma14l,blessive,0.0516,Binance Coin price reaches  whats next,1584768384,0,1
834,fm91yb,mistamom,0.3493,Jesse Benton did nothing wrong Nick Spanos Way to lie to everyone because a lot of Ron Paul  voters dont even like him and know better than to trust you abusive jerkoff,1584763467,0,1
835,fm8k4g,blessive,0.0,Bitcoin tries to shrug off the global financial meltdown as it rebounds sharply,1584761176,2,1
836,fck4nn,blessive,0.0,Ripple XRP Or Stellar XLM,1583187495,2,1
837,fcjybe,CryptoCardNews,0.0,Execution is everything,1583186825,2,1
838,fcjxmf,yusfaitth,0.0,Reason to invest in LCG ICO,1583186756,0,1
839,fcjur0,amorpisseur,0.0,Your stake in Steem on centralized exchanges was just used to take over the Steem Blockchain,1583186457,3,1
840,fcjenp,ColinTalksCrypto,-0.5423, The Steem blockchain has been taken over by Binance Huobi Poloniex after a recent acquisition by Justin Sun of Tron DPOS fail Can this happen to EOS,1583184766,1,1
841,fcjcyh,okean123,0.4939,Why Crypto Should Care About Justin Suns Steem Drama  CoinDesk,1583184590,2,1
842,fcj9hf,tijapa,0.0,Cammegh and CasinoCoin,1583184217,1,1
843,fcj67v,Akadot,0.0,Who here secretly thinks crypto will go parabolic when,1583183866,0,1
844,fciwba,wheretfamilmfao,-0.296,PayPal to Bitcoin No fees,1583182832,0,1
845,fcivu6,jonnytakashi,0.0,Testers needed for TradingView indicators,1583182784,0,1
846,fciupy,jonnytakashi,0.0,Testers needed for TradingView indiators,1583182670,0,1
847,fciojr,YoOga96,0.2732,LCG Energy ,1583182030,0,1
848,fcieks,yusfaitth,0.0,LCG Contest,1583180981,0,1
850,fcicej,financeoptimum,0.0,This is the IQ era  what is Satoshis IQ,1583180757,0,1
851,fci591,Monster_Chief17,0.4215,CZ confirms that Binnance approved the upgradehardfork on the Steemit network,1583179997,0,1
852,fchwlv,saberstormx,0.7783,CZ confirms that Binance approved the actions taken in the Steemit incident I was made aware of this upgradehardfork beforehand and approved it Projects do this all the time and we are usually just in a supportive position,1583179124,3,1
853,fchlx4,pangux,0.0,Topps Digital on Twitter,1583177981,0,1
854,fchlum,crossflix536,0.2732,Im very new to cryptocurrency How do I create addresses,1583177973,0,1
855,fchefj,mebinici,0.0,Marshall Islands Sovereign Digital Currency Will Be Based on Algorand,1583177183,5,1
856,fch8qo,Postarin,0.0,xpost from rMonero Cryptocurrency is the Second Amendment of the Internet,1583176570,2,1
857,fch7dw,loyydd,0.0,Mobile mining,1583176418,0,1
858,fch1ui,Busterlimes,0.0,Coinbase,1583175848,12,1
859,fcgvev,mebinici,-0.2263,AntiCrypto Bank Wells Fargo Involved in Billion Dollar Scandal,1583175193,26,1
860,fcgv7h,ProGamerIII,0.0,LinkedIn article describing the actual impact ETN makes,1583175170,1,1
861,fcgsvj,gerhhard,0.25,Bitcoin Jokes on google news your world bplaced,1583174922,3,1
862,fcgr1z,stellarowl12,0.0,Why StocktoFlow model predicts K Bitcoin before Dec ,1583174737,2,1
863,fcgph5,DarrenCoinRivet,-0.6739,Paris Blockchain Week CANCELLED over coronavirus fears,1583174580,1,1
864,fcgnzm,Hakim920525,0.0,UCONTEST,1583174422,2,1
865,fcg1o4,knitfroggy,0.0,Instant Crypto CashOut with Instant Sepa,1583172088,1,1
866,fcftzt,knitfroggy,0.0,Defi Lego How many versions of Dai are there,1583171270,0,1
867,fcfolf,tjones0808,-0.2732,Youve been warned,1583170687,3,1
868,fcflbb,maikelyans,0.0,Airdrop LCG,1583170339,0,1
869,fcfkis,Alex162748,0.0,Possible scammer,1583170262,0,1
870,fcfka4,maikelyans,0.296,Join airdrop,1583170236,0,1
871,fcfk9t,victory_cater01,0.0,DINT  Investment Token A Business Management Tool,1583170235,0,1
872,fcfdhv,blessive,0.7964,Litecoin LTC price hovers at  but analysts feeling the bulls,1583169505,0,1
874,fcf0zc,serejandmyself,0.6249,The Great Web Journal Time stoppers,1583168201,1,1
875,fceysn,TrioDeJaneiro,0.0,Is Rivbit legit,1583167965,0,1
876,fcevhg,BluaBaleno,-0.3182,Steem blockchain goes down Accusations of collusion spreads  steemit,1583167628,100,1
877,fceurh,Econcrypt,0.0,International chamber of Commerce and Perlin targeting commodities in Singapore,1583167555,1,1
878,fceuhx,faizal6694,0.0,Lcg contest,1583167527,0,1
879,fcetsn,arulsanjaya,0.6124,good project from LCG Energy,1583167455,1,1
880,fces4u,Efficient_Fig,0.0,Found at a Goodwill thrift store in San Francisco,1583167280,4,1
881,fcertg,Ketifus,0.3612,BTC Tx getting further and further from away conformation,1583167248,9,1
882,fcerom,arulsanjaya,0.6124,good project from LGC Energy,1583167234,0,1
883,fce6wp,enom85,-0.4019,Bitcoin Luno account got hacked My funds gone,1583165006,0,1
884,fce6oe,SwapSpace_co,0.5859, Successful ICOs You Need to Know About,1583164982,0,1
885,fce2dj,sylsau,0.0,Once You Discover Bitcoin You Can Never Go Back,1583164525,9,1
886,fce10s,kcota871,0.296,Not trying to shill Just thought it eould intresting to share,1583164378,2,1
887,fcdr10,Forsaken_Line,0.0,LCH,1583163232,0,1
888,fcdmf4,digiiital,0.4588,Bitcoin Perpetual Swaps At Yearly High Surpassing bn Within  Hours,1583162728,1,1
889,fcdd1n,Public-Clothes,0.0,Lcg,1583161639,0,1
890,fcdce0,Gurney_Halleck_,0.3818,Ambrosus is the partner of European Unions innovation branch for entrepreneurship in food,1583161565,41,1
891,fcd9kh,Forsaken_Line,0.0,Cryptocurency,1583161249,0,1
892,fcd7f8,DigiFamous,0.0,Who Invented Bitcoin,1583160996,1,1
893,fcd6ay,yusfaitth,0.0,New LCG Contest,1583160859,0,1
894,fcd64e,ImpressiveTreacle6,0.0,Airdrop GiveAway,1583160839,0,1
895,fcd2fx,Final-Shallot,0.0,Giveaway,1583160425,0,1
896,fcd1t3,-RaisedByWolves-,0.836,Whens the next bull run and WHAT should one buy,1583160345,71,1
897,fcd11s,ReneCarper,0.872,UK FinTechs are Integrating Crypto into Loyalty Reward Programmes to Support Mass Adoption  Hackernoon,1583160251,0,1
898,fccz2j,rivoke,0.0,This Week In Crypto,1583160003,0,1
899,fccvkr,AdventurousGround5,0.0,Boom,1583159574,0,1
900,fccomn,blessive,0.0,Latest Investment Moves FTX Exchange Closer to Unicorn Status,1583158696,0,1
901,fcco26,lordfervi,0.0,Binance Poloniex and Huobi used client funds to take over the Steem network,1583158618,1,1
902,fccmkn,Zaskia55,0.4404,Good giveaway,1583158419,1,1
903,fccmaw,darthflux14,0.0258,CitiOS RR tokens is on its  low and stable price,1583158386,0,1
904,fcciva,Balmond11,0.0,New Contest Borr,1583157933,0,1
905,fccclf,Magelis86,0.128,People always talk about the coin the love the most What is the coin that you hate the most Why,1583157126,2,1
906,fcc5ri,igordimitriev,0.0,New regulated Europe cryptocurrency exchange,1583156180,0,1
908,fcbmxo,NataleFerrara,0.6369,Augur REP and the best DeFi projects  The Cryptonomist,1583153674,2,1
909,fcbaxb,DexM23,0.0,Can one phrase got the same word multiple times,1583151948,1,1
910,fcba52,DexM23,0.0,Can a seed phrase got the same word multiple times,1583151819,1,1
911,fcb2j2,polagon,0.7184,Most commonly asked question by beginners  is it too late to buy Bitcoin   reasons why its not,1583150640,2,1
912,fcb1pd,Ethical-trade,0.2023,CoV and its impact on the markets spoiler your bags will be fine,1583150512,1,1
913,fcayci,Ituglobal,0.4019,Cryptocurrencies Exhaust Downward Move Suggesting Bulls will Take Control,1583149984,0,1
914,fcaqa2,wgcole01,0.296,National Bank of Fujairah Partners With Ripple for CrossBorder Money Transfers  Al Bawaba,1583148557,38,1
915,fcamfy,blessive,-0.4215,Philippines receives th highest count of cyber threats in ,1583147891,0,1
916,fcafss,LiveTree,0.0,SED Livetree Seed token  In search of a Seed token exchange strategy,1583146744,2,1
917,fca0wf,Whiskeywonder,0.2263,I dunno why ETH doesnt just use Fantom that can run ETH Dapps faster cheaper at scale and interoperate better than ETH  will,1583143960,4,1
918,fc9wje,cavpatrol,0.0,Rate my Crypto Allocation,1583143180,0,1
919,fc9k53,zakoal,-0.3182,IOTA Trinity Hack Users lost Millions of Euros Tangle still on Hold for Transactions  Bitcoins,1583140835,5,1
920,fc9jdn,blessive,0.0,Binance Adds Direct Bank Transfers for Turkish Lira Through AKBank,1583140705,0,1
921,fc9gx3,rivoke,0.2023,Huobi Token A Top Coin,1583140226,3,1
922,fc9fp6,rivoke,0.0,TSLA The Stock that Outperformed Bitcoin,1583140038,13,1
923,fc9eyi,rivoke,0.34,Value of Burned OKB Tokens Likely to Pass M,1583139908,2,1
924,fc9e8n,rivoke,0.0,How bZx Knowingly Rekt DeFi,1583139766,3,1
925,fib1t9,nycityinsomniac,0.6249,BlockFi did an awesome job yesterday,1584150729,9,1
926,fiaw9o,Whiskeywonder,0.7378,I think Chico Crypto has the best understanding of why bitcoin crashed so hard and its why its status as a safe haven hasnt changed one bit to me personally,1584150026,3,1
927,fia9fp,TiltMastery,-0.5274,So Crypto gets the losses of the market yesterday but not the gains,1584147219,2,1
928,fi9nga,ArtisticMongoose5,0.1027,bitcoin fails when it succeeds,1584144645,0,1
929,fi9m8f,ArtisticMongoose5,0.1027,bitcoin only fails when it succeeds,1584144499,0,1
930,fi9jbk,MustafaAnas99,0.7184,Why Snowden said he would buy Bitcoin NOW ,1584144136,0,1
931,fi916z,thewrongh0le,0.4404,Get started with crypto easy,1584142050,0,1
932,fi8qlb,ethbtc,0.34,Are there any valuation frameworksphilosphies that exist to value governance tokens,1584140871,0,1
933,fi8lgg,OverRatedProgrammer,0.4404,Is there a good exchange for people in the US to use anymore,1584140318,11,1
934,fi8i72,PapaAlpaka,-0.296, Websites You Should Avoid At All Cost plus a template for adding more,1584139960,2,1
935,fi8aws,financeoptimum,0.0,CEOs are out,1584139149,5,1
936,fi7vj9,joenorwood77,0.0,Discussion of the Day Golem GNT,1584137515,25,1
937,fi7qc1,tralxz,0.0,Guide for BTC Maximalists,1584136969,6,1
938,fi7ofm,ngt_,0.0,Shipchain Community  Articles from token holders about SHIP Ethereum and the Shipchain Network and how blockchain and IoT will deeply transform the logistics industry in the next  years,1584136772,3,1
939,fi7g5w,phileo,0.3818,I didnt know the SampP was capable of Bart Simpson patterns,1584135911,4,1
940,fi772m,mark2517,0.4019,Bitcoin IS a safe haven asset but not in a way you may think,1584134936,23,1
941,fi743s,sylsau,0.0,Bitcoin Under K It Is Sale Season,1584134599,2,1
942,fi73gy,not420guilty,0.6486,Dear Bitcoin customer support,1584134536,2,1
943,fi6htp,turtlecane,-0.2023,This Is the First Bear Stock Market Since Bitcoin Was Created Likewise the Conditions That Led to the Creation of Bitcoin Have Returned,1584132284,30,1
944,fi6ey9,tralxz,0.0,Storing Life Savings in BTC,1584131982,6,1
945,fi69gx,bibone1,-0.888,Utter MakerDAO failure Man Suffers Cruel  ETH K CDP Liquidation,1584131413,42,1
946,fi5p2h,Arinupa,-0.2732,Do You think Cryptocurrency could survive the apocalypse Say the governments collapsed,1584129300,9,1
947,fi5msj,throwawaycryptodream,0.6705,Okay which crypto right now is a bargain price steal to buy,1584129068,0,1
948,fi5lfq,notooth1,-0.296,Decentralized cryptocurrency exchanges with no transaction fee,1584128931,0,1
949,fi5j4z,Arinupa,-0.2732,Do you think Blockchain could survive the apocalypse Say the governments collapsed,1584128687,2,1
950,fi56f8,amaMikeySmth,0.7778, most successful examples of using Smart Contracts in everyday life,1584127356,1,1
951,fi4u2r,tralxz,0.0,BTC in developing countries,1584126126,506,1
952,fi4t32,Kibu98,0.0,Notifications,1584126024,2,1
953,fi4q0b,Econcrypt,0.0,USDT or USDC,1584125708,2,1
954,fi4lkk,tralxz,-0.3182,Reason why BTC is dumping,1584125271,7,1
955,fi4eou,MK333666,-0.2732,New York wants from all Crypto companies Financial Risk plan for the impact of COVID,1584124548,1,1
956,fi48ge,Sterling_Drake,0.5423,Coins are bouncing more than Tiger on crack,1584123907,2,1
957,fi47pd,Hoflivion,0.0,New Airdrop Etherfinex Nectar Airdrop,1584123832,0,1
958,fi3wd4,efwuhbk,0.0,Actually getting fd,1584122663,1,1
959,fi3w14,feelings_arent_facts,0.25,How do you feel about Ethereum now that Bitcoin has failed to demonstrate itself as a good store of value,1584122628,84,1
960,fi3seu,wgcole01,0.4939,Transaction volume for XRPAUD pair reaches new alltime high,1584122262,3,1
961,fi3osd,HechoamanoFR,0.3182,Hecho a mano accepts cryptos ,1584121888,0,1
962,fi39uy,scapegoat_,-0.4588,Are there any examples of exchanges working with or being forced to give up info to governmentsauthorities excluding tax reasons,1584120318,2,1
963,fi37g7,Huynh_B,0.0,What are about to see or seeing,1584120085,5,1
964,fi3519,Huynh_B,0.0,What we about to see or seeing,1584119848,2,1
965,fi342w,hhio618,0.5725,Decentralized money is so new and small its so vulnerable right now but good days yet to come,1584119747,0,1
966,fi2p68,SirWiggulbottom,0.0,Hello Im new,1584118245,0,1
967,fi2erv,Goobi_dog,-0.2263,Thought experiment What if all development stopped on all crypto projects What coin would continue to be most usable for the next  years,1584117158,11,1
968,fi233n,Leftwing_agitator,0.0258,Sigh unzips bank account,1584115955,42,1
969,fi22pe,NewCoinCollector2020,-0.8588,PSA for new Bitcoin buyers Avoid Binance and especially avoid its rd party affiliate SIMPLEX They will straight up rip you off for  Im disgusted with this Binance Company Never again,1584115915,1,1
970,fi22cu,throwaway63729199363,0.0,Im very new to this I invested  in bitcoin at  what now,1584115885,2,1
971,fi1zn5,DimouJ,0.0,SafeWhat,1584115604,2,1
972,fi1u4w,KrosiLinux64,-0.0516,Noob Question,1584115038,0,1
973,fi1nwe,calufa,0.0258,Bitcoin loses  of its value in broad cryptocurrency rout,1584114387,0,1
974,fi1ggh,treebagz,0.5994, Drops Feel Like Gains Now,1584113574,2,1
975,fi1e55,Outside-Funny,0.4588,Competition for all Ethereum amp Crypto holders  ETH in Prizes,1584113327,1,1
976,fi1bej,KomodoWorld,0.0,Can We Build a PostFeudal Web   By Kadan Stadelmann CTO of Komodo,1584113044,0,1
977,fi181s,BitcoinMafia,-0.4767,Remember the m NEM stoken in the Coincheck hack YeahTokyo police arrested  guys who bought m of it on the dark web,1584112697,10,1
978,fi15d5,NewToNano,-0.4215,How might corona virus or a recession affect coin exchanges,1584112398,0,1
979,fi0tg2,malemanjul1,-0.5267,Is Google Quantum Computer a threat to cryptocurrency,1584111098,0,1
980,fi0quw,-0-O-,0.3818,Crypto growth trend since ,1584110813,7,1
981,fi0qks,callmebrucewayne,-0.5945,So I Got Locked Out Of My Funds So Someone Can Rob Me For My Coins,1584110783,2,1
982,fi0pec,callmebrucewayne,-0.2263,How many of you guys poor knowing someone stole your money,1584110650,2,1
983,fi0o1g,hamza-al24,0.0,YouTube Removes Crypto contents,1584110488,0,1
984,fi0l2f,Qwahzi,0.0,The Nano beta has just passed  CPS on the st layer,1584110162,0,1
985,fi0k1t,ryanseanadams,-0.3818,You just experienced the worst day in crypto What was it like,1584110046,0,1
986,fi065p,callmebrucewayne,-0.5945,So I was locked out of my funds so someone can rob me for my coins,1584108405,1,1
987,fi04f3,yhungkevo,0.0,Selling bitcoin and mining rigs,1584108211,0,1
988,fi01mv,blessive,0.0,BitMEX CEO I dont believe we will revisit ,1584107902,0,1
989,fhzvgu,nugget_alex,-0.5524,Why Did Bitcoin Crash So Hard Today  Bitmex Liquidation Cascades Explained,1584107165,1,1
990,fhzs1x,TaoOfSatoshi,0.2263,Setting The Record Straight For Dash In Japan,1584106736,0,1
991,fhzrwe,cocorico23,0.0,RVN price performance throughout   Indepth analysis,1584106716,0,1
992,fhzjcp,HousePlanX,0.0,Does CoronaVirus outbreak to crypto world,1584105640,1,1
993,fhzgtm,someguy01010,0.6124,BTC tx with enough fee unconfirmed for long time,1584105295,0,1
994,fhz8sf,buzzbooz,-0.2323,Walking in Dubai and saw this bear celebrating ,1584104302,1,1
995,fhz87i,Zethnos,0.0,How do I see the h average price of a coin,1584104223,0,1
996,fhz204,abakus83,0.0,Bitcoin Black airdrop,1584103383,1,1
997,fhyqxl,CryptoOnly,0.0,Its been a wild ride,1584101908,3,1
998,fhylae,ThebesAndSound,-0.6378,Remember that time bitcoin was almost killed by a bat soup,1584101129,2,1
999,fhyi08,blessive,0.7184,Edward Snowden this is first time in a while I wanted to buy Bitcoin for this reason,1584100690,1,1
1000,fhygn1,JettGRundle,0.0,MKR Crypto,1584100500,1,1
1001,fhyg9b,SouthPoint777,0.0,crypto crew classes,1584100449,0,1
1002,fhyerh,erisiamk,0.3612,What exchanges do people recommend at the moment,1584100240,4,1
1003,fhy9h6,SouthPoint777,0.0,Crypto crew classes,1584099436,0,1
1004,fhxyur,itsblockchain,0.3919,Bitcoin dropped by  but Hashrate increased by  now whats next,1584097819,6,1
1005,fhxxzx,danutz2006,0.8481,How can I buy Ethereum using my Paypal account safely,1584097690,0,1
1006,fhxubq,Askrypto,-0.4019,Some Indian Banks are Still Arbitrarily Refusing to Process Crypto Transactions,1584097142,1,1
1007,fhxu14,blessive,0.0,TRON amp BitTorrent The Story Of Two Firms Under One Man,1584097094,0,1
1008,fhxtta,DeviantAsp,-0.4019,The reason for the recent dumps,1584097059,11,1
1009,fhxtmx,tralxz,-0.7925,Lightning Network for real store of value  Toilet Paper RIP BTC,1584097030,1,1
1010,fhxt97,gokumarketofficial,0.0,Buy amp Sell NEM Instantly with Bank Account via Gokumarket Escrow enabled PP Trading,1584096960,0,1
1011,fhxs4k,okean123,0.0,User flair question,1584096788,6,1
1012,ffmsn4,Quethrosar,-0.5859,Wtf did you all do today,1583716870,2,1
1013,ffmslb,blessive,-0.5423,Chainlink Will Suffer Deep Decline Says Analyst,1583716863,0,1
1014,ffms7y,Costoffreedom,0.0,US Cryptocurrency Regulations Are Ramping Up in ,1583716813,10,1
1015,ffmrkd,tradeando1,0.3818,Day trading too hard because of high fees,1583716735,0,1
1016,ffmayx,CryptoEK,-0.296,Avoid COVID and use cryptocurrency,1583714643,0,1
1017,ffm1lf,cpsasite2c,0.0,How to Fund your MTI or Mirror Trading International Account,1583713513,0,1
1018,fflzfr,joenorwood77,0.0,USD Coin USDC,1583713253,6,1
1019,fflzaw,cpsasite2c,0.0,How to Fund your Mirror Trading International MTI Account,1583713233,2,1
1020,fflsok,LaboratoryOne,0.0,How do I amend my  Taxes,1583712405,19,1
1021,fflg1k,mercuchio23,0.4019,Looking for some help on wechat,1583710888,0,1
1022,ffl5xa,sgtslaughterTV,-0.7269,This guy says that our recent drop came from a plustoken dump of their bitcoin,1583709676,4,1
1023,ffl0zv,tammymega,0.0,Bitsecured Com,1583709094,0,1
1024,ffko02,PapaAlpaka,0.0,How to Cash Out Bitcoin Directly into Your Bank Account  CryptoSorted,1583707612,3,1
1025,ffkh63,coinsmash1,0.4215,Oil is down nearly  lol,1583706832,0,1
1026,ffkdz7,coinsmash1,0.4215,Oil minus  lol,1583706478,0,1
1027,ffk71x,pale_blue_dots,0.34,Morningstar Rates First Ethereum Security In  Million Fatburger Deal,1583705707,7,1
1028,ffjz6s,Chukwueloka,0.0,Entraded PreLaunches on Product Hunt,1583704823,0,1
1029,ffjy9h,eddietheboss,-0.4019,Binance refusing to give info about Jurisdiction and applicable law,1583704719,0,1
1030,ffjslo,bijansha,0.0,When was the last time you used Coinbase What did you do exactly,1583704091,28,1
1031,ffj6hu,TheCryptodude01,0.5994,Ok I have read some interesting news lately,1583701688,0,1
1032,ffj5zk,morggin,0.0,What is the strangest Fiat currency you have seen,1583701630,1,1
1033,ffj5xv,TheCryptodude01,-0.4708,OK I have read some crazy shit Crypto Market Cap  Trillion,1583701625,0,1
1034,ffisxu,h3xadecimal2,0.6369,A Perfectly Symmetrically DeltaNeutral Market Maker,1583700251,0,1
1035,ffimxr,Bitinsure,-0.1317, reasons why most traders lose money,1583699597,1,1
1036,ffihua,WePassedTheRubicon,-0.4767,How dangerous exactly are whales in the crypto realm,1583699061,0,1
1037,ffigw0,eleanor567,-0.128,I will be paying  capital gains taxes this year on crypto Why Because I donate crypto to nonprofits which completely offsets my tax burden IWD,1583698955,2,1
1038,ffifiu,btoned,0.0,Its whats the deal with crypto,1583698813,202,1
1039,ffier7,thisisPatDuffy,0.4707,I dont like paying taxes So I donated some crypto today to offset cap gains Because Im not stupid IWD,1583698737,0,1
1040,ffiahc,martinkarolev,0.0,Im hardly moving but still breathing,1583698283,1,1
1041,ffhkw7,hroob777,-0.5267,Crex Exchange Accused of Hiding Hack From Customers,1583695588,2,1
1042,ffhhjl,blessive,0.1531,Centralized financial hubs at risk of Coronavirus spread can cryptocurrencies help,1583695270,0,1
1043,ffhepv,Hodlon2,0.0,REKT city,1583694974,3,1
1044,ffh2oe,Nillabean1988,0.0,Central Banks Are Exploring Blockchain  but For Their Own Reasons,1583693700,2,1
1045,ffh1av,RandoKillrizian,-0.5267,Anyone know of any class action yet against hitbitc If there isnt yet why dont we do this im a victim Im ashamed to admit it,1583693556,1,1
1046,ffgrkb,sylsau,0.8074,Buy  Bitcoin HODL Safely Forget the Price Then Wait to Become a Millionaire in the Future,1583692498,12,1
1047,ffgm2e,orionsun83,0.6369,Cryptocurrency mining at its best,1583691915,0,1
1048,ffg00q,msrjoyce,0.0258,What Canadian exchange should I use to deposit and withdrawal from Used to use QuadrigaCX,1583689480,0,1
1049,fffqcs,Njoiyt,0.0,Dharma  DeFi Simplified,1583688382,0,1
1050,fffait,Mustafart,0.0,figuring taxes when cashing out,1583686625,10,1
1051,fff4n7,Trident1000,0.6369,What is the best Bitcoin futures markets with the following criteria,1583685968,3,1
1052,fff2e1,Jlist21,-0.3744,Top  Things Most People Get Wrong About Bitcoin,1583685700,3,1
1053,ffeuca,kenney2,0.0,BlockBurnHQ,1583684778,0,1
1054,ffetv2,BitttBurger,0.0,When are the owners of BitMex going to Jail,1583684726,74,1
1055,ffeq3x,HumbleCorrespondent,0.0,With a nod to Malta Asias blockchain island is open for business,1583684285,1,1
1056,ffek5z,definitelynotdeleted,0.0,Cryptocurrencies today,1583683580,1,1
1057,ffeehf,Leftwing_agitator,-0.3182,Iota Founder Confirms He Will Personally Reimburse Victims of Hack,1583682927,194,1
1058,ffdzav,agamex7,0.0,Blockchain has arrived by Relictum Pro,1583681110,0,1
1059,ffdgql,TheHairyScribe,0.0,Comparing two or more coins,1583678821,6,1
1060,ffd5sk,poundofcheese,0.296,Cryptaroo  A short story about the single greatest crypto event that never happened,1583677375,1,1
1061,ffckez,katlynwilliams1518,0.296, on poshmark when you join,1583674299,1,1
1062,ffcet2,PierrAlex,0.6908,Ethereum  Here is why analysts price predictions are bullish for ,1583673489,2,1
1063,ffc9xf,okean123,-0.2753,Former Steemit Head of Communications Andrew Levine speaks up against Tron and Justin Sun Its not about the money for us Yes we want to have a more abundant future but not like this Not this way,1583672741,196,1
1064,ffbywy,LevelingUpGaming,0.4019,Looking for help with choosing a broker,1583670953,0,1
1065,ffbnop,MyClickBankBuilder,0.0,Learn How You Can Earn a Figure SideIncome Working Online,1583669037,0,1
1066,ffbh5y,genius3edition,-0.8225,Why do some whales dump rather then sell in bits,1583667880,70,1
1067,ffbbot,ankarlie,0.0,How Do NonCustodial Exchanges Work Without A User Management System,1583666818,0,1
