,id,author,vader,title,created_utc,num_comments,score
0,fcxuff,Darkc0iL,0.0,Crypto Puzzle,1583255811,2,1
1,fcxs0f,FiniteRegress,-0.25,New Charlie Shrem interview at SFOX on his journey with Bitcoin over the years what it takes to run one of the biggest crypto podcasts and where he thinks the sector is headed next,1583255544,4,1
2,fcxohx,kevinburrow34,0.0,Pi Crypto currency,1583255165,0,1
3,fcxn3f,Alexand0x,0.0,districtx Dev Update  March rd ,1583255007,2,1
4,fcxdnc,spaghetti_M,0.0,How should we react when you find more and more proof of a scamcoin,1583253997,0,1
5,fcxd7z,ProfessorChaous1214,0.0,Robinhood Funds are NOT SAFU,1583253950,3,1
6,fcxbrp,AndreasHe,-0.8316,Federal Reserve announces its first emergency rate cut since the financial crisis,1583253799,5,1
7,fcxa49,G3RSTY7,-0.128,A reflection on Fed cutting rates,1583253635,2,1
8,fcx8du,Wittymonkey,0.0,Why are crypto and US market so correlated,1583253450,0,1
9,fcx0ub,Think-Decision,-0.3818,Ann Litecoin lcp With   attack defense,1583252662,0,1
10,fcwywj,BlockchainIndia,-0.2732,The legal battle is not the final one for the Indian cryptocurrency industry,1583252456,2,1
11,fcwvt7,pskkll,0.0,WhEn mOoOooN,1583252113,0,1
12,fcwry5,joe_cgy,0.0,bunch of updates to Coinigy,1583251708,1,1
13,fcwrwn,CanyonsPrime,0.2732,The One and Only Thing Cryptocurrencies Do Uniquely Well,1583251704,1,1
14,fcwrtu,omadhia,0.7184,Where can I buy cryptocurrency in India with paypal,1583251697,0,1
15,fcwjqo,Slater44,0.0,Dont HODL,1583250803,4,1
16,fcwhjw,sownderraw,0.0,Tokenswim Airdrop Subscription Service,1583250560,0,1
17,fcwcn5,alireza083,0.0,bitcoin faucet,1583250019,0,1
18,fcwbk2,YT-Hyperlink,0.0,Pi Network referral code ip,1583249896,0,1
19,fcw08g,cocorico23,0.0,SFOX interview with Charlie Shrem,1583248596,3,1
20,fcvwd8,bfifty1fifty,0.0,Announcing the Corda Token SD,1583248165,0,1
21,fcvs53,MetroBust,0.0,Pi Network,1583247684,0,1
23,fcvkio,mebinici,0.4588,Stablecoins amp Legacy Finance How can stablecoinholders earn interest from legacy Finance,1583246773,2,1
24,fcvjyt,007Crypto420,0.0,LCG,1583246702,0,1
25,fcv7a6,intothecryptoverse,0.0,Altcoin performances this year,1583245133,3,1
26,fcv74c,johnpolite,-0.0772,BULLISH GERMANY BANKS ALLOWED TO SELL OR STORE CRYPTOCURRECIES,1583245111,0,1
27,fcv715,blessive,0.0,Bitcoin price predictions for   What Financial Experts expect,1583245100,0,1
28,fcv5ot,Nawaao,-0.3182,Hackers steal  million worth of bitcoin from worlds largest cryptocurrency exchange,1583244929,4,1
29,fcv2i6,ReavonGO,0.4019,German company secured blockchain patent,1583244535,0,1
30,fcuhh6,samvraiii1,-0.0772,Sup Reddit Is there someone who can help me with short UXtest related to cryptotrading industry It wont take more than  minutes,1583241746,0,1
31,fcu42s,rivoke,0.0,Whats The Point of Blockchain Beyond Just Cryptocurrencies,1583239928,6,1
32,fcu3bx,kaydesmith,0.0,The case for a national blockchain,1583239824,1,1
33,fcu1l1,DifficultShow2,0.0,Looking Beyond Ethereum Crypto Interoperability Is Key,1583239549,3,1
34,fctvsj,productninja,0.296,The nonadvertisement chat where traders share their experience and knowledge,1583238686,5,1
35,fctt7q,totatree,0.6369,Elon Musk says Dogecoin is the best cryptocurrency,1583238302,215,1
36,fctq3t,hmm22828,0.2732,LCG Energy,1583237817,0,1
37,fctjj4,rezivor,-0.2023,How to stall transactions on the bitcoin blockchain,1583236779,4,1
38,fctd6o,kaefergeneral,0.0,Topps going fullon Blockchain bringing NFTs to the masses,1583235731,21,1
39,fct4jo,blessive,0.296,Early adopters called Bitcoin the future of money  years ago its up x since,1583234286,1,1
41,fct0yd,Anx55zaa,0.0, Relictum Pro ,1583233674,6,1
42,fct0bq,samlapoint,0.0,One of the worlds first central bank digital currencies the Marshall Islands SOV will be built on Algorand,1583233567,2,1
43,fcsg5p,Huynhhung0,0.5859,Win up to  EUR in LCG,1583229766,0,1
44,fcsflp,Huynhhung0,0.5859,Win up to  EUR,1583229668,0,1
45,fcs65x,Crazy_Entertainment,0.0,Current Bitcoin Price  March rd  Bitcoin Ethereum Dash Litecoin,1583227825,2,1
46,fcs5dt,bitzuri,0.0,Quotes,1583227674,1,1
47,fcs388,markethiver,-0.2023,There is a new player in Town  Ecoin reaches k users in less than  days  aim to be crypto mass adoption ice breaker  Ecoin Airdrop is absolutely a record in the cryptocurrency industry  Ecoin run on EOS  Ts blockchain,1583227238,0,1
48,fcrtjc,sgtslaughterTV,0.6369,This is probably the best speech Ive heard about cryptocurrency in the past year and the speaker hits the nail on the head  Long Story Short we need more working projects and applications,1583225251,12,1
49,fcrpt6,nugget_alex,0.5413,Bitcoins Most Exciting Updates Are Coming In   Developer Jimmy Song,1583224511,12,1
50,fcris3,servatyar,0.0,The nearest BTM to you ,1583223147,4,1
52,fcrgou,Ckenadam,0.743,LCG energy the best ICO,1583222758,0,1
53,fcr9h5,Uhes,0.2732,LCG ENERGY,1583221402,0,1
54,fcr8vb,azoundria2,-0.4019,Was There a Service Named KeepCoin or Similar Hacked In ,1583221290,0,1
55,fcqwvl,Ckenadam,0.5859,Viral contest can win up to  EUR in LCG and  BTC,1583219111,0,1
56,fcqv7c,amaMikeySmth,0.1027,Top  Cryptocurrency Hacks in  How do you protect your savings from hacking,1583218830,2,1
57,fcqmfl,Che_Crypto,0.0,US stocks and crypto exchange,1583217364,0,1
58,fcqhvd,celkl,0.0,Airdrop bounty,1583216628,0,1
60,fcphdi,rezivor,0.0,What happens if you send an enormous amount of micro bch transactions to addresses on the btc blockchain Does it have any effect on either network,1583211187,2,1
61,fcp8yy,Whiskeywonder,0.7769,Time to talk about Fantom In layman terms its Hashgraph but decentralized and the fastest finality in crypto But most importantly it is the first crypto to have a stable coin which will be fully backed by a central bank though the project XAR Network,1583209950,11,1
62,fcp76t,CryptoCollectibles,0.4939,Why Crypto Should Care About Justin Suns Steem Drama  Yahoo Finance,1583209709,2,1
63,fcp4gp,joenorwood77,0.0,Ethereum ETH,1583209313,116,1
64,fcowcl,localname1,0.0,US Sues to Tap Crypto Accounts Tied to North Korean Hack,1583208200,1,1
65,fcoq2w,rymezke,0.4939,Crypto Advice Smells like a Scam Call for Help,1583207368,0,1
66,fcokgm,coinfunda,0.4404,Algo Affiliates Review Is it Safe Affiliate Network,1583206628,0,1
67,fco1c1,pale_blue_dots,0.0,Smartlands and Sothebys Tokenise London Real Estate,1583204218,0,1
68,fcnyug,GilangLF94,0.7526,LCG ENERGY Contest Total Prize ,1583203900,0,1
69,fcnx6q,GilangLF94,0.4939,The first blockchainbased energy token from an energy supply company,1583203695,0,1
70,fcnpvj,Enjoylife786,0.5719,Tezos reward calculation,1583202780,0,1
71,fcnipa,blessive,-0.3818,Big exchanges conduct a hostile takeover of Steem blockchain following TRON acquisition,1583201886,0,1
74,fcmhz6,Opposite-Feature,-0.4404,Abandon content,1583197280,0,1
75,fcmep6,Buttoshi,0.4404,Nightclub is better analogy than packed restaurant,1583196864,51,1
76,fcm2oj,mboyde,0.5106,USDC in AlphaWallet gt real cash money,1583195412,0,1
77,fclx79,DarkestChaos,-0.3818,Hostile TakeOver Steem Edition  Wax Partnership  Germany Regulates Crypto  Dorsey Drama  More,1583194760,1,1
78,fclwrc,blessive,-0.6486,Paris Blockchain Week cancels amidst rising Coronavirus threat,1583194704,0,1
79,fclsau,AutoModerator,0.0,Daily Discussion  March   GMT,1583194162,423,1
80,fclqyh,Weary_Ground,0.0,cryptocurrency,1583193984,0,1
81,fclp3b,Mynameis__--__,0.0,Inside the Worlds Largest Bitcoin Fund,1583193768,4,1
82,fcljvk,Zizizone,0.0,PiCoins,1583193173,0,1
83,fclido,rmalinpl,0.0,Is KuCoin trying to pull a HitBTC on me,1583193007,0,1
84,fckhxx,maria0900,0.0,Investment,1583188921,0,1
85,fjdt5x,blessive,-0.128,Stablecoin Demand Soars in Response to Bitcoin Volatility,1584327132,1,1
86,fjdh8l,Audemed,-0.4588,Illinois to lay claim to abandoned cryptocurrencies under new bill,1584325661,0,1
87,fjdg21,jusjudge,0.9136,New to cryptocurrency What are some good websites to buysell on with low fees What are some solid currencies to buy at this time Any videos for dumbies in regards to cryptocurrency Anything is helpful Thank you,1584325529,2,1
88,fjdfcs,jusjudge,0.8126,New to cryptocurrency What are some good websites to buysell on with low fees What are some solid currencies to buy at this time,1584325446,2,1
89,fjdbho,cryptofreakygirl,0.0,BitMax weekly update Mar,1584324971,0,1
90,fjd8k7,Symbiotic_Aura,0.0,DigiByte Giveaway,1584324628,0,1
91,fjd6my,Articulator129,0.0,How I bought my first house with crypto,1584324405,0,1
92,fjcnte,Csdhacker,0.0,Pi network,1584322197,0,1
93,fjcejd,pmhee555,0.0,Using blockchain technology to mitigate the spread of Coronavirus COVID,1584321143,8,1
94,fjbqo2,mojindu464,-0.4215,Already then guciii guys if we hit a recession after the corona virus goes away and the dollar dies Bye dollar what happen to crypto I need to know,1584318467,0,1
95,fjbc4b,TradingSurfers,0.0,BTC Daily,1584316849,0,1
96,fjbazn,Kibu98,-0.2732,This is the real announcement The Fed also cut reserve requirements for thousands of banks to zero,1584316727,96,1
97,fjbakh,Kibu98,-0.2732,he Fed also cut reserve requirements for thousands of banks to zero,1584316680,0,1
98,fjb7bi,ngt_,0.0,What the FAQ Everything you wanted to know and more about Shipchain an opensource and public blockchain about to transform the logistics industry,1584316338,4,1
99,fjavj2,TradingSurfers,0.0,BTC Daily TimeFrame  Primary count,1584315071,0,1
100,fjasun,boring_lawyer95,-0.4404,Longterm fiatcrypto trading foe a newby,1584314795,5,1
101,fjaado,Horny_Crusader,0.0,Its Linux time,1584312895,0,1
102,fja91d,gogo199432,-0.6124,TalerBit Scam,1584312765,0,1
103,fj9xv3,joenorwood77,0.0,Discussion of the Day Enjin Coin ENJ,1584311616,8,1
104,fj9t9y,howtobanano,0.743,Help Fighting Coronavirus by Supporting FoldingHome with your CPUGPU  Get Rewarded in Crypto,1584311168,8,1
105,fj9mpe,martinkarolev,0.2023,Federal Reserve cuts interest rates to zero restarts QE,1584310506,1,1
106,fj9mcf,martinkarolev,0.2023,Federal Reserve cuts interest rates to zero restart QE,1584310466,0,1
107,fj95z5,nathanielx9,0.2263,Interest rates cut due to the virus,1584308689,2,1
108,fj8squ,tommad2000,-0.0516,Federal Reserve cuts rates to zero and launches massive  billion quantitative easing program,1584307208,2,1
109,fj8r1j,SinnyCal,-0.4019,Viz Bitcoin Price vs  Mentions in News of bitcoin crash,1584307010,4,1
110,fj8n37,redddiablo,-0.2023,Federal Reserve slashes rates to zero restarts QE,1584306617,7,1
111,fj8mjf,wallynext,0.3182,FED cuts rates to zero and launches massive  billion quantitative easing program potential markets rebound on Monday,1584306562,372,1
112,fj83iq,k0ntrol,0.0,How to get back my FA account when I have backup codes ,1584304683,2,1
113,fj7suf,_0_1,-0.1027,Thi is what we trained for rd bailout,1584303609,1,1
114,fj7p2k,SaveTurtleRyan,0.0,Opinion or comments about Currency Pi,1584303229,0,1
115,fj7l0g,pandeybhvsh,0.0,HYIP Script that has unique features,1584302833,0,1
116,fj7jox,grootbuttt,0.0,Another Rate my Crypto portfolio,1584302711,0,1
117,fj6z3b,SaveTurtleRyan,0.0,So What is this Pi currency,1584300654,0,1
118,fj6qy6,boredcr25,-0.2144,I have assets in  altcoins worth around k but have low liquidity  where can I swap them for as little as ,1584299863,0,1
119,fj6qnq,stellarowl12,0.0,Any Business Development Managers here in the cryptoblockchain industry,1584299838,2,1
121,fj6m6d,boredcr25,-0.1823,So I have assets in  altcoins worth around k but have low liquidity  where can I swap them for as little as ,1584299380,2,1
122,fj6f7b,TheForbiddenMage,0.0,Get your own keys,1584298690,0,1
123,fj66uf,MK333666,0.0,Corona tests BTC TRENDLINE,1584297889,3,1
124,fj640t,BigFatSkinnyDude,0.0,I think crypto guys need to take this into consideration Its not the type of inflation you may think,1584297614,0,1
125,fj5wjl,grootbuttt,0.0,Rate my Crypto holdings,1584296890,0,1
127,fj5tny,joaopedroo,0.0,COVID Remote Work Alternatives,1584296617,0,1
128,fj5bin,okean123,0.2023,Justin Suns own representative says he agrees with the soft fork against Suns Steem stake,1584294793,4,1
129,fj4xts,Jakakss,0.0,Coin Swaps  MainNet,1584293394,0,1
130,fj4fdp,Redditplantsyo,0.3612,People using crypto in my town to buy and sell stuff  can someone explain how I can start tx with others First timer,1584291546,0,1
131,fj4do5,sylsau,0.296,The True Bitcoiners Can Only Reveal Themselves in a Strong Bear Market,1584291374,18,1
132,fj4cox,HumbleCorrespondent,-0.6369,Do cryptos benefits outweigh the terrorist financing risks for the Jewish state,1584291269,5,1
133,fj49ai,shinyspirtomb,-0.296,Im missing one of my seed words on Electron Cash,1584290914,38,1
134,fj446g,ankarlie,0.2732,Safeguarding Customers on CEXs Whats Being Done and What Can Be Done An Analysis,1584290391,0,1
135,fj43ay,cryptonaut101,0.7096,Solve Care raising   dollars worth of tokens with Huobi against COVID,1584290294,0,1
136,fj3t0w,victory_cater01,0.0,Medium,1584289222,0,1
137,fj3icd,PowerDubs,0.0,Atari starting the roll out of the Atari Token slated release Aug st,1584288130,27,1
138,fj35eo,gurjasmeet,0.0,oiporial,1584286757,0,1
139,fj2z6f,sashabaron,-0.8807,How come there is no exchange allowing to short sell the coin,1584286070,0,1
140,fj2fer,yandabanda,-0.5106,Edward Snowden Buying Bitcoin Because of Too Much Panic Too Little Reason,1584283860,0,1
141,fj1l8m,TaoOfSatoshi,-0.3818,BTC PlusToken Scam Selloff BTC Store of value HitBTC Implements Dash Chainlocks and more  CATV LIVE today at PM UTC,1584280262,1,1
142,fj0ouv,1xHUEHUEHUE,0.4215,Lets talk about the safety of DeFi,1584275705,19,1
143,fj0l50,Panosmek,-0.6249,How to survive an economic crisis,1584275129,25,1
144,fj0kc5,_DTM-,-0.4019,Should we expect another crash of crypto when USA will shut down because of the Coronavirus,1584275016,0,1
146,fj07we,3lilougps,0.0,Tethereum Leverage Bot TLB,1584273124,0,1
147,fizs9n,yodadog2,0.7739,BUY AntiCoronaCovid Protection with Cryptocurrency,1584270580,0,1
148,fizbdg,Andriyan02,0.2732,NEW LCG Energy Viral Contest,1584267704,0,1
149,fiz1zw,Tehni,0.3182,Whats stopping everyone from swing trading DAI for massive profit,1584266098,31,1
150,fiz103,blessive,0.0,Sally Hos Technical Analysis  March  BTC ETH,1584265932,0,1
151,fiyyqg,DeettaSternberg,0.0,Get me Wheat,1584265500,2,1
152,fiyfem,C___F___B,-0.4767,IOTA Foundation employees censor IOTA subreddit posts thus preventing people from claiming their tokens held by the foundation now,1584262078,0,1
153,fiydrz,5ir_,0.0,Cryptomining,1584261766,0,1
154,fiy4im,grumpyfrench,-0.296,Could we do a minecraft on blockchain To avoid censorship and deletion Asking in light of the library project In the game,1584260023,1,1
155,fixwn2,ArrayBoy,0.8402,Yesterday we saw price appreciate rapidly by the biggest intraday gain in Bitcoins history from its bottom just below  to over  within  minutes So I think its safe to say Bitcoin isnt going anywhere,1584258635,0,1
156,fixtsp,chaosthroughorder,-0.6486,The REAL reason for the BTC crash PlusToken scammers dump mil of BTC,1584258095,26,1
157,fixrvk,nugget_alex,0.2023,This Weeks Top Bitcoin Cryptocurrency Finance amp Global News,1584257720,1,1
158,fixl7u,FuzzyGood,0.0,question about binance futures trading,1584256475,0,1
159,fixjt8,MrCryptoMuffin,0.0,Starting up a little crypto facebook group,1584256215,0,1
160,fixhj6,The-Crypto-Portal,0.0,What do you think Three things Central Bankers can learn from Bitcoin regulations amp regulatory ambiguity,1584255803,3,1
161,fix7aj,IHateFortnite05,0.0,Introducing Pi,1584254021,0,1
162,fiwsaa,blessive,0.0,Bitcoin isnt out of the woods yet despite Fridays stock market rally,1584251542,1,1
163,fiwo3u,intothecryptoverse,0.0,Total cryptocurrency market capitalization logarithmic regression band,1584250855,4,1
164,fiwhsy,definitelynotdeleted,0.0,Bitcoin Weekend Course,1584249858,1,1
165,fivp13,Sokomiloreo,0.0,The base economy of OLCF token,1584245702,0,1
166,fivig6,amithasan1994,0.743,Bitcoin Strong Price Prediction   Before hit alltime high it will go ,1584244825,4,1
167,fivb3z,pro_artist,0.0,Too late to invest,1584243904,0,1
168,fiv55t,happymommie,0.4019,Help with crypto investing,1584243151,0,1
169,fiuwnm,TGaySubToPewdiepie,0.4404,Early stage cryptocurrency with good potential Pi Network,1584242049,0,1
170,fiuuk6,DishonDischaGaming,0.0,gloop,1584241785,0,1
171,fiutyq,amithasan1994,0.0,How to make  a day using cryptocurrency,1584241716,0,1
172,fg2vcx,lutepatrick,0.0,Investing ,1583791667,0,1
173,fg2jqy,DMT_7,0.0,Voyager Account was compromised,1583790484,0,1
174,fg20kj,blockmomo,0.0,Liquidity mining  a new way to earn tokens,1583788506,0,1
175,fg1iau,ninjajaguar,0.0,Just sold about  of my alts,1583786667,25,1
176,fg1atz,goodwill_cunting,0.2023,Current sentiment of crypto Read the top comments from rnews,1583785904,3,1
177,fg19lb,manasivora,0.8555,SkyPages  MIT Hackathon Grand Prize Winners,1583785777,0,1
178,fg14d7,coinsmash1,0.0,Schiff gets it,1583785263,5,1
179,fg10dr,nanomind,0.0,Introducing the Enjin Multiverse Program,1583784870,2,1
181,fg0grk,sylsau,0.0,Talking in Sat Rather Than in Bitcoin Will Be the Norm in the Future,1583782917,7,1
182,fg0dch,Kera667,0.5534,If people have faster payment methods and sellers can instantly access sales revenue without a bank no one will keep money in bank accounts that pay extremely low interest on deposits,1583782576,1,1
183,fg0aaw,castorfromtheva,0.3353,Major Ripple supporter sells of all XRP holdings due to toxic community,1583782287,41,1
184,fg06he,Xazax310,0.0,My stance on Ethereum ProgPoW and the ASIC Question,1583781907,4,1
185,fg01zy,UltimateCrypto7,0.0,The  Cryptocurrency Tournament,1583781479,0,1
186,ffzygv,alok310,0.3818,Whats your call on Ethereum  Will ProgPow update be implemented and effective in pushing ETH price post the  drop that we have seen recently,1583781123,1,1
187,ffzvz6,Walkingstiff,0.296,PI   mineable through your phone Join the beta today,1583780866,2,1
188,ffzn0t,Criptogenio,0.3182,Beyond Fungibility  Increase your exposure to NFTs NonFungible Tokens with Enjin ENJ,1583779973,0,1
189,ffzf5o,cocorico23,0.0,Trading is halted on NYSE due to massive selloff BTC trading can never be halted,1583779187,0,1
190,ffz54f,towandahorder,-0.8074,Bitcoin started dumping hours before the stock market sell off,1583778164,0,1
191,ffz4av,blessive,0.4588,Saudi Aramco share price over  dip reveal BTC beauty,1583778083,0,1
192,ffyqmi,manzitt,0.296,Selling a mining rig dont know much info Help,1583776660,5,1
193,ffypr4,BluaBaleno,-0.2059,Binance Huobi withdraws support for the takeover of Steem blockchain but Justin Sun isnt ready to give up  steemit,1583776571,0,1
194,ffxmzv,Funkycold6,0.0,Crypto Act of ,1583772620,0,1
195,ffxd7z,burneraccount1092395,0.3818,Caution Were sitting on longterm log growth trend If this breaks look out below,1583771562,0,1
196,ffx4mw,kumar0088,0.0,Axio Crypto,1583770634,0,1
197,ffwy97,teamnani,0.0,Just zoom out,1583769971,0,1
198,ffwmgf,UrielBarca,0.0,I did a fuckup dont have enough etherium for transaction fees and dont know how to get it need about  eth and cant find a minimum purchase price lt,1583768736,2,1
199,ffwipk,clinton1984,-0.4019,Selfishness,1583768336,3,1
200,ffwdc2,A_Stones_throw,0.6597,When will crypto be a truly uncorrelated asset if ever,1583767755,4,1
201,ffwaqo,fafdAfV,0.0,Intuitive Understanding of Quantum Computation and PostQuantum Cryptography,1583767473,0,1
202,ffw8s3,blessive,0.3566,Spearheading the Crypto Revolution More Countries Join the Bandwagon Following South Koreas Crypto Law,1583767265,0,1
203,ffw3yg,joshlyll,0.0,Bidesk  The new sub  mil mcap  Polished AF exchange token,1583766720,0,1
204,ffw0d1,pangux,0.0,Crypto and Blockchain Events This Spring,1583766336,1,1
205,ffvd65,i12sellstuff123,-0.6705,THE SCAMMER CRYPTOCHOE IS BACK WITH A NEW NAME STAY AWAY FROM THIS FRAUD HE IS A SCAMMER,1583763683,0,1
206,ffv8m7,UnknownEssence,0.0,Coinbase Pro is Robbing You on Trading Fees,1583763147,107,1
207,ffv21z,martinkarolev,-0.8398,This is crazy Some guy in China made a soup so bad that it collapsed the global economy,1583762344,559,1
208,ffv12g,DoinWhatImDoin,0.0,Supply Chains and Hedera Hashgraph Why We Use HCS,1583762214,0,1
209,ffuymi,9aint6rop,0.0,Here we go again ,1583761909,5,1
210,ffuupn,nata_nata,0.0,pTokens family  pBtc is now available on Kyber Network ,1583761426,0,1
211,ffue9m,kuntal1987,0.3818,Lots of Earning Opportunities,1583759368,0,1
212,ffuc3s,chiman17,0.6249,Great project,1583759093,0,1
213,ffu6dt,retrotympanym,0.0,Cryptocurrency graphs,1583758310,0,1
214,fftzn1,Ethical-trade,0.0,Rule ,1583757351,2,1
215,fftyrv,Ethical-trade,0.0,PSA,1583757228,1,1
216,fftnon,Bianca2906,0.7506,Top Jokes On Bitcoin Cryptocurrency And Blockchain That Will Make You Laugh,1583755624,0,1
217,fftlm1,StandardCA,-0.2732,Crypto and blockchain will disrupt the ETF industry in the same way ETF disrupted mutual funds through lower cost of transactions and global reach  Podcast interview with Dan Doney CEO of Securrency,1583755327,2,1
218,fftcp6,MK333666,-0.1531,Btc falling  is Coronavirus primary factor,1583753906,3,1
219,fft3fz,thisonedudeyouknow,0.0,For the Blockchain Developers,1583752450,6,1
220,fft2tp,btsecom,0.4939,Save up to  on trading fees using BTSE token,1583752349,0,1
221,ffsxhq,localname1,-0.296,Cryptos No Refuge in Market Carnage as Bitcoin Slumps to ,1583751484,9,1
222,ffsuwq,bitzuri,0.6486,Bitzuri  An Instant Easy and Secure Cryptocurrency Exchange  Now Make the Most Out of Your Crypto,1583751043,1,1
223,ffsqov,TommyofLeeds,0.7351,Blockchain is Perfect for Skins and Virtual Asset Ownership,1583750319,3,1
224,ffsksr,HorseBootup,0.0,Chinas Central Bank to Inject M into Blockchain Trade Platfor,1583749261,3,1
225,ffsiqz,LordVicticus1,0.765,Been following this person for a while now they seem to be associated with Journalist EW lmao what is this poll Voted Yes for the memes,1583748912,2,1
226,ffsg50,gfunksound,0.0,Oppose EARN IT Act  Email Your Representative,1583748422,0,1
227,ffseqy,T_Atsiz,0.0,Mining without software,1583748153,0,1
228,ffsazh,DappRadar,0.2732, DeFi  MakerDAO has increased its h users by ,1583747457,0,1
229,ffs28k,Lamuks,0.4683,Why do people get so excited about low fees on huge transfers on crypto,1583745813,0,1
230,ffs1dh,blessive,0.7184,Analyst Bitcoin could see an explosive upwards movement after tapping key buy zone,1583745669,1,1
231,ffs161,DappRadar,0.2732, DeFi  MakerDAO has increased its users by ,1583745630,0,1
232,ffrych,itsemalkay,0.0,reaccumulation is happening,1583745072,3,1
233,ffrx48,quitachba1991,0.0,Forbes China  Technology empowering Users with Data Protection,1583744842,1,1
234,ffrqut,jayjay16022,0.0,Live footage of HODLers checking Coinmarketcap this morning,1583743672,1,1
235,ffrq0l,lisamartinez_,0.0,Hello XRP,1583743513,3,1
236,ffrlfc,ShibN,0.0,Midas Coin Emissions  The Bitcoin News,1583742571,0,1
237,ffrk82,definitelynotdeleted,0.0,Black monday,1583742343,1,1
238,ffrk02,arneath,-0.2732,Bitcoin Falls to Month Low Below K Amid Global Market Rout,1583742301,1,1
239,ffr604,Wutanf,0.4404,What on Gods Green Earth ,1583739694,4,1
240,ffqzdg,blessive,0.0,Blockchain and DLT can ramp up global monetary system,1583738473,0,1
241,ffqqmm,Nuad,-0.1027,At these hard times this old chart becomes relevant again,1583736887,1,1
242,ffqjx0,financlfreedomcj,0.7184,Crypto Apocalypse To buy or hold off This is what I am doing,1583735711,4,1
243,ffqcu0,ColdLar_2,-0.1027,Global risk assets,1583734497,1,1
244,ffq6m7,NateWong0929,0.0,Will BNB attain absolute deflation after OKB and Huobi token all achieved,1583733428,0,1
245,ffpvkc,jamesjolly3,-0.3612,Shake It With Some Strange,1583731624,1,1
246,ffpmth,jj20202,0.0,Generation Crypto Fund,1583730281,0,1
248,ffpc2u,prabu1990,0.0,Cryptocurrency Development,1583728665,0,1
249,ffp6lj,sleeping_carrot,-0.4939,Searched ethereum on YouTube and there was an ethereum giveaway scam at the top in description,1583727878,0,1
250,ffp53f,blessive,0.3818,Data Suggests Ether Lenders Have Forgiven bZx,1583727671,0,1
251,ffp028,ujjain,0.4404,My company gives me the choice Is it better to get paid in bitcoin or euro as a Perpetual traveler Digital Nomad,1583726951,1,1
252,ffowe0,brianddk,0.4019,How to clean the dust in your Coinbase Pro and retail accounts a howto,1583726458,5,1
253,ffoqwk,cm18,0.0,The EARN IT Act will make running a crypto node just as big of a headache as running a Tor exit node,1583725745,146,1
254,ffntel,ApokatastasisComes,0.0,Check this out,1583721353,0,1
255,ffnn9v,Enjoylife786,0.0,Latest crypto news and price analysis,1583720611,0,1
256,ffn23f,Apeman1991,0.4404,Easy midlong term income potential ,1583718016,0,1
257,ffmuxz,ewaters77,0.4019,Help me Understand,1583717151,0,1
258,feixjr,donatien1,0.0,Crypto earnings and investments,1583523766,1,1
259,feiuvm,Leoak47,0.6369,If anyone is interestedI just posted on whats going on and would like to have a discussion with everyone who is interested go follow and comment what you think,1583523479,2,1
260,feisax,Leoak47,0.4019,If anyone is interested,1583523189,2,1
261,feipn7,blessive,0.0,Bitfinex Adds Margin Trading for FTX Token,1583522899,0,1
262,feij7v,Horriblyhipster,0.0,Why Is Bitcoin Future Fluent,1583522216,3,1
263,fei26i,btc-smile,0.0,Coinbase CEO Explains How Crypto Will Go from  Million to  Billion Users  Steemit,1583520424,8,1
264,fehp5b,btc-smile,-0.4019,Coinbase CEO Says Bitcoin BTC May Lose Cryptocurrency Race to Altcoins  Heres Why,1583518989,11,1
265,fehnjo,btc-smile,0.1027,Ethereum Whales Accumulate in Anticipation of ETH ,1583518816,3,1
266,fehgsz,Kibu98,0.0,Nike Macys trial blockchain with RFID for tracking products in supply chain,1583518090,8,1
267,fehbad,wgcole01,0.0,Ripple Has Drastically Raised XRP Adoption in Mexico Bitsos Head of Finance,1583517520,0,1
268,feh9p0,prong76,0.4404,HTC to Roll Out Privacy Focused G Router With Ability to Run Bitcoin Node,1583517349,4,1
269,fegsp2,notuff,-0.6124,People starting a convo to scam after an reaction on this sub,1583515516,8,1
270,fegrhn,DoinWhatImDoin,0.0,Why Hashgraph HBAR just surged  despite market stagnance  CryptoSlate,1583515385,1,1
