,id,author,vader,title,created_utc,num_comments,score
0,j4iuvp,girlshero,0.4215,Safety first,1601745327,13,1
1,j4it6n,typtyphus,0.0,Scaling bitcoin on ETG Prior to Base layer scaling is years away,1601745169,16,1
2,j4ir6z,Letternewcom,0.296,Does your smartphone earn money,1601744981,2,1
3,j4iq6t,devboricha,0.4404,Erthereum getting good,1601744895,14,1
4,j4ipv8,DogGodFrogLog,0.0,Aavegotchi  k Bug Bounty,1601744866,0,1
5,j4in2t,philjonesfaceoffury,0.0,Stock tokenization to bring new stock pairings similar to btceth,1601744613,3,1
6,j4igvn,scara89,0.4767,The  on Kik case In the Kik case judge was less explicit about wether Kin could be construed as a security He said the sale of Kin was the sale of a security  by default theres an assumption its a security  but Kin its just code,1601744057,0,1
7,j4ig6c,theskunkmaster,-0.1027,I Bought a Gaming PC with Crypto  Trying to show all the naysayers that you can use crypto as a means to pay,1601743993,0,1
8,j4iew9,CryptoLouise,0.0,Zerion Review Track amp Manage your DeFi Portfolio,1601743877,1,1
9,j4id1b,Finncialhealth,0.0,Xrp Ripple News Today and Price Prediction October  Ripple Now In Financial Institutions,1601743700,2,1
10,j4ib1b,Wulkingdead,0.0,SEC Is Willing to Try a Tokenized ETF Chairman Says,1601743508,0,1
11,j4i7ng,elastosarkansas,0.0,Stock Tokenization  Crypto type stock pairings on commonly traded stocks andor commodities,1601743212,0,1
12,j4i5os,rorykmckenna,0.0,HNY,1601743037,0,1
13,j4hzvc,digiiital,-0.5859,Investor scammed  in alleged new Chinese crypto fraud,1601742501,1,1
14,j4hzqh,AmyAnthony,0.0,Tulips the second coming,1601742489,7,1
15,j4hy1h,AmyAnthony,-0.3384,The second coming of the tulip mania Deflationary staking and yield farming project Multi Token and very low marketcap,1601742332,0,1
16,j4hv1p,tradewithmiller,-0.1027,Working hard or hardly working,1601742047,11,1
17,j4hubp,ThatWunderkind,0.4767,KuCoin CEO says suspected hackers have been found with substantial proof at hand,1601741976,19,1
18,j4hsqw,ekilibrus,0.0,to B or not to B,1601741824,8,1
19,j4hqvv,WebSocialServices,0.2263,Surprised Keanu  Pretentious Memes,1601741653,1,1
20,j4hmfc,timkinslow,0.2468,BREAKING LIQUIDBANK TO LIST ON COINSBIT  DONT MISS LIQ TOKEN LISTING ON COINSBIT th Oct ,1601741261,0,1
21,j4hiep,Plutusedge15,0.1027,Ethereum  Testnet Already Has Reached GB,1601740914,0,1
22,j4hh25,serejandmyself,0.7845,Cyber is glad to announce its new social bounty campaign Earn canary EUL tokens for liking following creating memes and much more,1601740807,0,1
23,j4hde1,crypto_grandma,0.0,Bitcoin is Gold with wings Extract from the book Bitcoin Billionaires,1601740458,11,1
24,j4haez,Ringo157,0.0,NEO is the biggest crypto in China,1601740183,12,1
25,j4h3d6,NinjaDK,0.6249,Ledger Live is soon to feature full node support for Bitcoin giving you full control of privacy,1601739533,4,1
26,j4h0m7,NinjaDK,0.0,Layer  is already here its time to use it,1601739270,10,1
27,j4grz2,NinjaDK,0.0,Those transaction fees on Honeyswap,1601738432,9,1
28,j4gpkn,CryptoPlanetVIP,0.0,IRS Signs Contracts with Two Data Firms that will work on Cracking Monero Privacy,1601738202,8,1
29,j4gp8g,madfires,0.0,Dash going for Privacy coin status,1601738171,2,1
30,j4gofs,[deleted],0.0,Dash should not be considered a privacy coin Dash team says,1601738091,0,1
31,j4gl4f,rorowhat,0.0,Justin at it again,1601737759,6,1
32,j4gl2a,Cryptolexicon,0.0,The State of Crypto adoption in South Korea,1601737753,3,1
33,j4gkww,bsbnsc,-0.1511,Why xDAI and Honeyswap arent the top yet,1601737737,0,1
34,j4gjgd,savage12362,0.0,Seems legitthoughts,1601737597,9,1
35,j4ghuy,Crypto4Canadians,0.6037,Investopedia  A WEALTH of Knowledge,1601737446,0,1
36,j4gfcx,Zaeem87,0.0,Memories,1601737206,2,1
37,j4ga18,xBinKz,-0.34,So youre thinking about investing in bitcoin Dont  Bitcoin  The Guardian Trigger warning,1601736646,8,1
38,j4fz4y,GloriousGibbons,0.0,Historical bitcoin price for Oct ,1601735494,2,1
39,j4fw72,Gringo4,0.4939,MOONs are going to save the world ,1601735162,0,1
40,j4fvsc,Plutusedge15,0.0,Rari Capital integrates Aave for Automated Yield Farming,1601735115,0,1
41,j4fr7h,cryptofan01,-0.6597,K stolen my life has no more purpose,1601734621,0,1
42,j4foma,diablek,0.296,Shut up and take my money,1601734334,6,1
43,j4flxq,nathanielx9,-0.0516,Bybit seeing BitMex customers leave,1601734063,18,1
44,j4fl8p,MammothSir9,-0.5574,Abkhazia Lifts TwoYear Ban on Bitcoin Mining Moves to Regulate the Sector,1601733991,2,1
45,j4fl8h,CommercialTouch9,0.0,London street art,1601733990,54,1
46,j4fivo,gibro94,0.0,BTC ETH or Other in  years,1601733742,15,1
47,j4fh9l,nanooverbtc,0.0, vs ,1601733590,6,1
48,j4fegv,LegendOfXela14,0.0,I know everyone in the world is looking for this but,1601733308,0,1
49,j4fcwg,blessive,0.5423,Lawyers execs explain how BitMEX news could help Bitcoin ETF chances,1601733139,2,1
50,j4fbej,djhatrick12,-0.2023,Crypto Tax Liability  TokenTax,1601732973,11,1
51,j4f4ra,cecil_X,-0.25,Open sesame Will cracking Monero reveal treasure or fools gold,1601732255,7,1
52,j4f4p0,Neophyte-,0.0516,Recently interested in polkadot i have questions regarding how any upcoming metamask integration will work moonbeam looks interesting but do you need to run a node,1601732248,0,1
53,j4f4fc,XRPinquisitive,0.7184,Bit Burgers  note how the lady has Cocaine written on her jumper Maybe she uses bitcoin from the burger sales to buy coke ,1601732215,4,1
54,j4f3q1,_shirobaby,0.0,Tulips Liquidity Mining is live Presenting the Shitcoin Fertilizer,1601732140,8,1
55,j4ep4n,CaptLuLu,0.0,Bitcoins Transaction Fees Almost Double Ethereums After BitMEX Exodus,1601730345,0,1
56,j4efr1,madfires,0.0,Feels,1601725638,9,1
57,j4ef7m,this1seasy,0.0,Dash  masternodes,1601725556,0,1
58,j4edgy,Wulkingdead,0.0,National digital currencies may become another sphere of competition,1601725312,4,1
59,j4e6qn,sammytv,0.3182,A LEGIT DARKWEB VENDOR FOR YALL ADVENTURE SEEKERS,1601724359,0,1
60,j4e579,Gurney_Halleck_,0.0,Half a Million in Satoshiera Bitcoin Just Moved to Bitfinex,1601724119,13,1
61,j4e1b8,EROSBabe,0.296,ETH  Serves as A Material Risk for Grayscales Ethereum Trust,1601723513,3,1
62,j4dz16,financeoptimum,-0.6369,The Feds Losing Battle with Technological Deflation,1601723170,8,1
63,j4dwyv,FellatioFellas,0.4692,Theory Bitcoin didnt crash after Trump announcement of Covid infection because the US Treasury owns some,1601722876,2,1
64,j4duid,Kezchenko,0.5859,This is a post merely created to generate moons True or False,1601722511,2,1
65,j4dtvm,devboricha,0.0,Exchanges are seeing their Bitcoin balances fall while its use in DeFi spikes,1601722416,0,1
66,j4dq3v,frevazgold,0.0,Crypto Quiz,1601721828,5,1
67,j4dprt,DarkestChaos,0.0,A BIG Bitcoin Move Is Incoming  Coinbase Now Offers Instant Withdrawals  Daily Cryptocurrency News,1601721779,1,1
68,j4dmi9,TR5_,-0.4019,Central Bankers Are About To Lose All Their Power,1601721291,1,1
69,j4dmcb,SwayStar123,0.3182,Interesting read on Satoshis Paradox,1601721265,5,1
70,j4dk4o,bench4rench,0.0,Crypto Exchanges Line Up as BitMEX Outflows Mount,1601720926,0,1
71,j4diuo,farshid120,0.4588,How long each cryptocurrency takes to be transferred,1601720727,0,1
72,j4dckw,installeris,0.0,Stack those sats ,1601719757,49,1
73,j4d6oz,TheatreOD,0.0,Wolf of Crypto Sound on,1601718858,175,1
74,j4d5x5,blessive,0.0,Data shows most Bitcoin exchanges require negligible KYC,1601718727,2,1
75,j4d1ub,XanderTiber,0.0,Avalanche Network,1601718062,13,1
76,j4cymg,Mrbitcoinnews22,0.0,Le prix du Bitcoin dit de rester calme et de continuer,1601717545,2,1
77,j4cxbw,CommercialTouch9,-0.5267,KuCoin Thief Swapped LTC for Bitcoin on CEX Chainalysis,1601717358,10,1
78,j4cwxw,XanderTiber,0.0,Avalanche Avax running Denali testnet,1601717296,2,1
79,j4cru8,Monsieur_Albert,0.0,ECB Applies for Cryptocurrency Based Digital Euro Trademark Amid Feasibility Study,1601716472,0,1
80,j4cpye,girlshero,0.0,only BTC,1601716170,0,1
81,j4cor3,MammothSir9,0.0772,Crypto Exchange Coinbase Hands Over Customer Data to UK Tax Authority,1601715980,0,1
82,j4cntl,Wulkingdead,0.0,Ethereum  Buterin presents new plan for  TPS until phase ,1601715833,0,1
83,j4cmoy,563847293810,0.0,Lots of lines and triangles,1601715663,13,1
84,j4cm6j,ResponsibilityOne707,0.4215,LoL,1601715589,7,1
85,jc1qm6,erer566,0.0,Crypto changed my life,1602816334,6,1
86,jc1nz1,pariswasnthome,0.0772, Billion in Bitcoin is about to be released to Mt Gox trustees,1602816038,12,1
87,jc1drs,DynamicPimp,0.0,Macro trend are looking sweetcorn BTC to  ,1602814927,3,1
88,jc18fr,livingrovedaloca,0.0,For those I spoke with yesterday about xmr being tracked and traced,1602814317,6,1
89,jc15hh,djpearson,0.3818,Bitcoins hashrate climbed to an alltime highATHthis week touching  exahash per ndEHson October  Despite the current price rise and also hashrate ATH on Wednesday just a tiny group of nextgeneration mining rigs are profiting at present bitcoin exchange prices,1602813971,2,1
90,jc12wc,Ae12_musk,-0.1531,What should I set my stop loss and take profit as,1602813687,0,1
91,jc0y3k,AsianPotato77,0.3818,Your probably tired of these posts but I need help with my brick,1602813138,15,1
92,jc0trr,Consistent_Lynx,0.0,Hello Im new,1602812644,1,1
93,jc0rqu,Texugo_do_mel,0.0,Almost  Robinhood accounts infiltrated by hackers NOT YOUR KEYS NOT YOUR COINS,1602812427,4,1
94,jc0mqj,lakerz690,0.0,Uniswap Protocol Integrated Into Tradingview,1602811849,1,1
95,jc093v,ethereumflow,0.0,Nearly  Accounts Compromised in Latest Robinhood Hack,1602810369,7,1
96,jc08t5,[deleted],-0.3477,Almost  Robinhood accounts hacked Report,1602810335,0,1
97,jc02ze,leroooyyyyyyjenkins,0.4588,Tezos Commons on Twitter  Welcome Sword Group Tezos Corporate Bakery,1602809678,1,1
98,jc01p0,blessive,0.0,The  crypto ICO that raised m in  minutes is finally launching,1602809534,0,1
99,jc00tl,Bluecoregamming,0.0,Who else from  is still here,1602809436,62,1
100,jbzvpa,looperino_memes,0.3612,Bitcoin yearly ROI courtesy of Benjamin Cowen,1602808871,13,1
101,jbzon4,tobeamonkeyandknow,-0.296,Funds no longer can be added to coinbase account,1602808074,0,1
102,jbzlax,wheelzoffortune,0.0,Anyone elses brain conditioned to see things in a cryptofinancial way,1602807701,23,1
103,jbzise,Sillyjones,-0.6124,Wondering if this is a scam,1602807426,9,1
104,jbzi8u,SteJay21,0.0,Coinbase down,1602807376,14,1
105,jbzhxh,shadowlpb,0.0,Huobi Plugs Into EUs SEPA and UK Faster Payments Systems  CoinDesk,1602807337,0,1
106,jbzg1a,AutoModerator,0.0,Daily Discussion  October   GMT,1602807142,2214,1
107,jbzcoh,MammothSir9,0.4603,Bitcoin Mining Rigs Struggle for Profits Despite BTCs Hashrate Reaching an AllTime High,1602806783,2,1
108,jbz44y,TheatreOD,0.0,People have been saying its a bubble from the start,1602805893,3,1
109,jbz2ug,Christopher-Pyne,0.0964,Veteran crypto investors predict one million dollar Bitcoin price by the time you finish reading this sentence,1602805759,3,1
110,jbz0sy,TheatreOD,0.0,Crypto imagination vs reality,1602805537,4,1
111,jbyvid,CryptoKarmaFarmer,0.7739,I came here to farm MOON  is that even possible,1602804979,0,1
112,jbyudv,kingy420,0.0,Whats everyones projection for the defi landscape come a years time,1602804856,2,1
113,jbysod,LonesoftGames,0.4019,Help with understanding how selling bricks from the fortnite subreddit works,1602804677,7,1
114,jbyr5v,NomNomNomNation,-0.1263,I am a complete and utter noob and have no idea what Im doing or what a single term in the Cryptocurrency terminoligy means  How can I make money from my Reddit cryptocurrency,1602804512,17,1
115,jbyqtx,NextLevelCanvas,0.9169,The Outcome  Shawar  I am  Years Old a bit outdated i would like to thank the bitcoin community and the developers working behind such great cryptographic projects that will shape our future such amazing technology it allows your work to live on the blockchain untouched,1602804477,0,1
116,jbyosb,EdwardBN4,0.0,Hedging Crypto Ideas needed,1602804261,0,1
117,jbyl9c,DetroitMotorShow,-0.1027,Attempting to stifle encryption is a waste of time suggests Status security chief on DoJ and Law Enforcements backdoor requirements,1602803913,6,1
118,jbykn8,Snidrogen,0.4215,It is true though,1602803846,3,1
119,jbyiwf,newthrowawayfor2017,0.0,Marathon Patent Group Announces Megawatt Bitcoin Mining Farm,1602803667,6,1
120,jbyfy3,FireType92494,0.5994,Exit Strategy During Next Bull Cycle,1602803362,21,1
121,jby7n7,fitnesssova,0.6597,Bitcoin Holders Get Ready  Bitcoin Bull Market Run is Likely to Repeat Again,1602802509,12,1
122,jby5ig,stokednsteezy,0.0,I dont understand the hype for XRP,1602802287,15,1
123,jby3wy,Tgoldman95,0.4019,xMoons help From Reddit to Honeyswap,1602802123,0,1
124,jby2y2,JustFoundItDudePT,-0.8316,China president told his troops today to prepare for war with the US If there is actually a war between China and USA how do you think it will affect crypto as a whole,1602802026,5,1
125,jby22n,Left-Narwhal2811,0.0,oh timestope or pinetwork,1602801941,0,1
126,jby1zs,nanooverbtc,0.2023,The Treasury Market May Be So Big That the Fed Cant Step Away,1602801931,1,1
127,jby1r3,nmerf1993,0.0,Learn How to Invest in Bitcoin amp Crypto Currency,1602801906,0,1
128,jbxxtt,FireType92494,0.0,Exit Strategy,1602801510,0,1
129,jbxvwp,Modvtheman,0.7506,What do the prospects look like of illicit behaviour involving cryptocurrency Help with Research Project,1602801321,0,1
130,jbxuvi,PM_pregnantgoat,0.0,Coinbase Pro to List Wrapped Bitcoin WBTC,1602801222,15,1
131,jbxro8,donnychakras,0.34,Attention scooter enthusiasts,1602800914,6,1
132,jbxmb0,DetroitMotorShow,0.1027,PC Gamer Magazine Streamers have reached their final form cryptocurrency,1602800401,8,1
133,jbxkd5,DetroitMotorShow,-0.1531,EToro Report DeFi Craze in Ethereum Reminds of ,1602800210,2,1
134,jbxiql,walkonwayvs,0.4215,Chico Crypto Talks About Moons as being The BIGGEST Yet UNKNOWN Opportunity in Crypto,1602800051,5,1
135,jbxhnk,donnychakras,0.34,Calling all scooter enthusiasts,1602799951,0,1
136,jbxay9,altcoinmaximalist,0.0,oops  he did it again,1602799326,0,1
137,jbx6lg,maxstandard,-0.5859,DONT FALL FOR ETH  DEPOSIT CONTRACT SCAMS,1602798905,0,1
138,jbx5x3,milldrive,-0.6597,Bitalium Possibly Might Shut Down Fakes Security Audit For Exit Scam With Their Cryptocurrency token,1602798842,3,1
139,jbwz5o,MierenKnager,-0.743,shorts will be dead why Dan Tapiero expects a massive Bitcoin shortage,1602798193,8,1
140,jbwyrl,maxstandard,-0.3612,Please dont fall for ETH  scams,1602798157,0,1
141,jbwwqe,princehints,0.7845,The Federal Reserve says it will allow inflation to moderately rise before raising interest rates spurring confusion over how long the central bank will let the money printer go BRRR,1602797967,12,1
142,jbwwff,BringTheFuture,0.0,We are trending on rfunny,1602797938,2,1
143,jbwvdd,Plutusedge15,0.0,Filecoin Launch Takes Its  ICO Investors on a Wild Ride  Decrypt,1602797834,4,1
144,jbwv6e,Finncialhealth,0.0,VeChain News and Price Prediction October  VeChain Second Largest EAS Label Supplier,1602797815,2,1
145,jbwuyq,MierenKnager,0.6478,United States printed more money that in  centuries combined,1602797795,0,1
146,jbwu0t,CaptLuLu,0.5773,John McAfee Didnt Kill Himself He Tweets From Jail,1602797704,0,1
147,jbws6h,princehints,-0.5719,Fed Vice Chair Admission Fed May Never Be Able To Stop Manipulating The Market,1602797536,0,1
148,jbwnrv,MierenKnager,0.296,Crypto takes away the governments monopoly on money,1602797110,4,1
149,jbwmip,erer566,0.0,Fed Chair Powell to speak next week at IMF on digital currencies,1602796991,1,1
150,jbwjgc,Fhelans,0.0258,Its only a matter of time,1602796711,9,1
151,jbwicr,NinjaDK,-0.3182,Digital asset exchange Bitstamp has beefed up its insurance measures to combat the inherent uncertainties associated with the crypto space,1602796606,0,1
152,jbwhpt,Jef_Wesb,0.1027,A UBI project called GoodDollar G just reached   daily claimers Thoughts on the project,1602796548,0,1
153,jbwhpd,remykonings,0.4215,The Network whitepaper is in peer review the first round of audits for Data Unions  is complete a major refactor of the JS Client is in progress and more  follow the latest tech stack news in the Streamr dev update,1602796547,0,1
154,jbwfap,Elegant-Fig,0.0,Finxflo  Worlds First DeFi Aggregator  English Subtitles,1602796322,0,1
155,jbwepi,JDRB99,0.0,Pi Network,1602796268,0,1
156,jbwcak,blablablablabla78,0.4588,AP and Everipedia Team Up to Publish US Election Race Calls on the Blockchain,1602796047,2,1
157,jbw5c7,jonbristow,0.0,The Rothschild Investment Corporation has bought  bitcoins,1602795413,0,1
158,jbw4xo,Mcgillby,0.5423,Esports Team to Pay FIFA Super Smash Bros Players in XRP,1602795378,15,1
159,jbw1sv,Deivids15,0.7184,Moon Calculator,1602795101,42,1
160,jbw0sq,Nussayr_Saidi,0.0,Now this is something we all need,1602795004,5,1
161,jbvwgu,Fhelans,0.0,Hackers Infiltrated Almost  Robinhood Accounts,1602794618,6,1
162,jbvvej,borderal,-0.5574,Is Uniswap frontrunning illegal,1602794530,25,1
163,jbvtxd,StakeKeeping,0.0,Just announced Bitcoin is coming to Polkadot in early ,1602794400,8,1
164,jbvpey,digiiital,0.6597,Bitcoin is a unique asset beneficial to a portfolio finance giant ascertains,1602793998,4,1
165,jbvoz7,Veronica_clark,0.5413,Please tell me what you think I already tired and they are really amazing,1602793965,0,1
166,jbvnny,salil19,0.0,Chock the bears,1602793853,2,1
167,jbvmpb,merkur_dev,0.5106,RanCORE The worlds first  honest project,1602793770,0,1
168,jbvha0,mohiemen,0.0,Facebooks Libra cryptocurrency taps exHSBC exec as CFO of payments unit,1602793316,0,1
169,jbvgbo,alxcnwy,0.5106,Crop tops,1602793228,5,1
170,jbvg5k,borderal,-0.5574,Is uniswap frontrunning illegal in the USA,1602793215,2,1
171,jbvekd,Toni-Roni,0.0,How does one start day trading crypto,1602793072,23,1
172,jbve8y,natedogggggyyyy,0.4019,Blockchain Voting and the  Election The Future of Voting An Interesting Perspective,1602793044,8,1
173,jbvc0j,DetroitMotorShow,0.0,ARK Next Generation Internet ETF ARKW holds around  of its portfolio in BTC,1602792852,2,1
174,jbvaac,The-Crypto-Portal,0.25,Ripple Exploring Prototype Use Cases for XRP Maps Out Vision for Future of Crypto Ecosystem,1602792705,5,1
175,jbv6ub,MammothSir9,-0.4215,Philippines Regulator Warns Investors to Steer Clear of Mining Citys Bitcoin Vault Ponzi,1602792401,0,1
176,jbv1bi,arijitdas,-0.5574,Airbnb For Data Filecoin Begins Space Wars With Google Cloud,1602791931,0,1
177,j88hko,fantaaraga,0.0,The next ignite  maticnetwork,1602281343,0,1
178,j88fyx,MammothSir9,0.0,Defi Market Cap Drops  in One Day Proponents Say Tokens Self Correcting,1602281196,0,1
179,j88flq,Cryptorich13,0.0,The IRS wants to know your location,1602281159,5,1
180,j886z3,blessive,0.0,Bitcoin in Spanish Parliament All  Deputies of Congress Are Now BTC Holders,1602280331,2,1
181,j886p1,karoman25,0.0,They be thirsty for it,1602280304,7,1
182,j885ug,h3xadecimal2,0.743,AIs from AI Dungeon  to sexy to funny and one based wholly on Reddit,1602280224,0,1
183,j884qz,Newmovement69,0.0,Digital identity is the future US congressman Bill Foster says,1602280113,3,1
184,j88006,Johnny_Ramstein,0.0,Unistake,1602279660,0,1
185,j87zsy,doubled1c3,0.0,Is there a website that tracks how many Bitcoin addresses have more than  BTC in them,1602279638,13,1
186,j87znp,fatal_music,-0.3182,In late  I purchased my first cryptocurrency roughly  of Litecoin When I woke up it was down  and I sold immediately for a loss Do you remember the first time you got rekt,1602279624,0,1
187,j87zde,DoctorNicholasVoodoo,0.34,Cryptocurrency amp Macroeconomics Chat The Election is Coming how to Play it,1602279596,3,1
188,j87xd7,crypto_grandma,0.0,An accurate description of how most of us look at the crypto markets,1602279418,3,1
189,j87wxo,Groda2023,0.6534,Crypto can really make your mind spin lets take a little break and relax i give you The Satoshi Rhapsody ,1602279384,5,1
190,j87v6n,monethical,0.2023,Top coins according to trend and momentum indicators October th,1602279236,0,1
191,j87v0i,Fhelans,0.0,What we do in life echoes in eternity,1602279217,2,1
192,j87pvr,SamsungGalaxyPlayer,0.8668,Trivia with  MOON in prizes in  minutes,1602278738,58,1
193,j87oba,da_dreamerr,-0.2732,Bitcoin  Another Fud lemme beat you down i know how to handle you now,1602278590,0,1
194,j87i3n,riqelme,0.0,Back of Japan Is Prepping Digital Currency Trials for Early ,1602278018,2,1
195,j87f53,AfafHillen,0.0,If you think BTC is going to k if you think BTC is going to k,1602277752,0,1
196,j87dwq,Saraph98,-0.25,how can i cancel transition,1602277638,0,1
197,j87bl3,Its_a_long_way_down,0.0,This is the way,1602277429,3,1
198,j87aic,owolf8,0.3818,At least these heavy bags are making me stronger,1602277328,5,1
199,j879ib,owolf8,0.0,Jack Dorsey is a bitcoin maximalist,1602277236,6,1
200,j874j1,erer566,0.0,Ethereum  project lead announces new bug bounty program,1602276777,0,1
201,j87405,blessive,0.0,New Whiskey distillery plans to raise funds through cryptocurrency,1602276729,0,1
202,j86zu2,karoman25,0.5267,Why are the considered Visionary,1602276340,0,1
203,j86n78,Zaeem87,0.4404,Time for a pump,1602275210,2,1
204,j86me9,nice2yz,0.1613,Massive Protests Led to Suspension of SWIFT and Banking Activities in Kyrgyzstan,1602275135,4,1
205,j86kul,nice2yz,0.2023,Tech Millionaire John McAfee Is Having a Great Time in Prison,1602274997,0,1
206,j86hro,Fhelans,0.0, BTC currently held on Corporate balance sheets,1602274743,9,1
207,j86eu3,crypto_grandma,0.0,What crypto investors think when they watch the news,1602274473,9,1
208,j86ely,PornSoftware,0.0,Adult Strategy Game on the Blockchain,1602274452,0,1
209,j86bj8,vinlo,-0.3612,These Cointelegraph Articles are Getting Ridiculous,1602274180,5,1
210,j867mx,intothecryptoverse,0.0,Monero breakout against Bitcoin to continue,1602273823,3,1
211,j865yn,milldrive,-0.7378, ROI Tron MLM With A Fake Address pointing to Hilton Hotel called TronGet,1602273690,3,1
212,j864r2,Confesional,0.0,EXPLAINED The EUS latest efforts to regulate Cryptocurrencies and CryptoAssets,1602273587,1,1
213,j864mp,jonas_h,0.0,An update on my book Why Cryptocurrencies,1602273575,0,1
214,j86485,intothecryptoverse,0.0,Bitcoin A cross of the  week SMA and the  week EMA,1602273537,3,1
215,j863h6,Set1Less,0.0,Blue Whale Spotting,1602273468,4,1
216,j862v4,ethereumflow,0.4404,Standby Regulation is Coming  Komodo KMD opinions aside they bring up some good points about regulatory changes regarding the DEX scene coming up,1602273407,2,1
217,j860fm,darkelfas,0.5574,When rcryptocurrency finally sees a post with a positive forecast,1602273175,0,1
218,j860bk,Set1Less,0.0,BLUE WHALE SPOTTED,1602273164,2,1
219,j85zw4,blessive,0.5106,John McAfee is Doing Great in Prison Its like The Hilton,1602273128,0,1
220,j85xhg,installeris,0.9001,The real news is that Bitcoin is so liquid that it can swallow Squares m buy without any sizeable impact on price The same can be said about MicroStrategys m buy Bitcoins liquidity is already sufficient for the herd thats coming,1602272908,7,1
221,j85u6d,shewmai,0.0,In light of the recent Square BTC purchase Jack Dorsey Twitter CEO on Bitcoin The Internet Will Have a Currency  Joe Rogan,1602272609,18,1
222,j85pb7,karoman25,-0.1531,The US is falling behind,1602272175,9,1
223,j85nfi,PM_ME_UR_ROOM_VIEW,0.0,Just a reminder that we might not be out of the woods yet,1602272011,4,1
224,j85lqc,PM_ME_UR_ROOM_VIEW,0.0,Its about the tech guys,1602271869,2,1
225,j85hww,karoman25,0.2732,This time for sure i swear,1602271508,9,1
226,j85c36,braun224,0.2263,Anyone else surprised there isnt another Western country listed in total adoption The US is an outlier,1602270985,0,1
228,j8550r,Sir-Copperfield,0.0,Are layer  side chains up and running,1602270359,0,1
229,j850yq,slywalkers,-0.296,Still No Bitcoin ETF in the US Whats Happening,1602270010,7,1
230,j84zww,slywalkers,-0.5574,Are you going to sell at ATH considering the constant decrease of USD value,1602269911,0,1
231,j84uha,sourviewer,0.0,Bitboy the scammer,1602269406,0,1
232,j84ueh,stratguy56,0.0,Uniswap Airdrop Tax Implications Income Taxes,1602269398,1,1
233,j84toa,darkelfas,0.0,Sneak ,1602269336,3,1
234,j84t2q,installeris,0.3182,Please,1602269283,8,1
235,j84shj,installeris,0.0,rtrashy,1602269226,6,1
236,j84s17,KX9lol,0.0,CoinDesk claims Andre Cronje has quit developing for Yearn Andre claps back,1602269185,0,1
237,j84kdz,ch0s3n0n3,0.0,Are Crypto and Blockchain Key to a Tech Renaissance,1602268504,1,1
238,j84hbq,cryptoonews,0.6369, Best Alternatives For Coinbase Full Guide,1602268225,2,1
239,j84d1f,karoman25,0.6908,Bullish trend reversal underway as Bitcoin price holds above ,1602267835,1,1
240,j84crc,riqelme,0.0,Chinese city to host digital currency lottery as part of DCEP trial,1602267809,2,1
241,j849ch,-Just_Another_Guy-,0.0,Crypto markets lately,1602267508,2,1
242,j847id,WebSocialServices,0.0,How volatile is Bitcoin today,1602267342,0,1
243,j8425d,braun224,0.4588,CME gauging interest for ETH futures,1602266863,3,1
244,j841r4,CrYpTo_2021,0.0,Whos heard of Radix Is it really the future of DEFI,1602266824,5,1
245,j83v9f,nanooverbtc,0.0,Over  BTC are held by publicly traded companies,1602266256,15,1
246,j83tuq,CrYpTo_2021,0.0,Whos heard of Radix Could they really be the future of DEFI,1602266134,2,1
247,j83pcb,darkmimer,0.34,Only for blockchain enthusiasts,1602265712,0,1
248,j83l5d,pale_blue_dots,0.0,Researchers gave thousands of dollars to homeless people The results defied stereotypes,1602265326,2,1
249,j83kl5,karoman25,0.0,Future of Digital Currencys,1602265278,2,1
250,j83jfj,GangOfficer,0.0,New DeFi With rabbits and pancakes By Binance,1602265181,5,1
251,j83jc0,Mega_Token,0.0,MEGA Round  airdrop,1602265171,9,1
252,j83irs,Karpaty,-0.6808,Billionaire Jeff Gundlach says stocks will crash predicts a weaker dollar and questions Bitcoin Quote I dont believe in Bitcoin I think that its a lie I think that its very tracked traceable I dont think its anonymous,1602265121,42,1
253,j83ift,EROSBabe,-0.2732,DoJs New Crypto Enforcement Guidelines Spurs up Disputes in the Community,1602265092,1,1
