,id,author,vader,title,created_utc,num_comments,score
6285,j33fl6,fhg13,0.0,IOTA Access introduction,1601534349,2,1
6286,j33eky,CryptoAlex97,0.0,I am wondering Why I cannot send my eth token and why there says insufficiente for gas fee if i have eth in there,1601534206,9,1
6287,j33c2m,buzumuzu,0.0,  API ,1601533856,2,1
6288,j339mx,ibiscp,-0.5777,Im feeling so dumb,1601533530,0,1
6289,j339ah,Wulkingdead,0.0,IOTA releases new product together with Jaguar Land Rover STMicroelectronics,1601533477,0,1
6290,j338m7,RockBottomPheww,0.3182,So can I have your attention please,1601533382,0,1
6291,j334qy,aurumherba,0.0,Mein CRYPTOLEHRGELD und wie ich zum BITCOINMAXIMALIST wurde  Kry,1601532855,2,1
6292,j333ql,cecil_X,-0.296,Court rules Kiks  ICO violated US securities laws,1601532710,0,1
6293,j331nf,sometimesiamjustabox,-0.34,Shameless,1601532410,6,1
6294,j32xcb,crypto_grandma,0.4588,Even if you bought BTC at all time high by dollar cost averaging  every  weeks youd own over  BTC and be up ,1601531825,10,1
6295,j32wb9,mishax1,0.0946,Its never been easier to get the active user base from this sub  Major privacy concerns,1601531676,45,1
6296,j32ve2,blessive,-0.0015,Bitcoin traders arent safe using basic Tor features says security expert,1601531541,2,1
6297,j32o1s,CaptLuLu,-0.5994,Onecoin Victims Join Petition Seeking Establishment of European Crypto Fraud Compensation Fund  News Bitcoin News,1601530537,1,1
6298,j32mmc,CaptLuLu,0.0,Something New is Cooking at SushiSwap,1601530351,4,1
6299,j8m165,braichy,0.0,Digital Yuan is a reality now,1602342436,23,1
6300,j8m0u8,MammothSir9,0.0,Digital Yuan Giveaway Chinas Shenzhen City Hands Out  Million Yuan in Central Bank Digital Currency,1602342402,0,1
6301,j8lxym,EROSBabe,0.0,A Look at the Relationship between US Presidential Election and Bitcoins Price,1602342110,2,1
6302,j8lx3s,installeris,0.0,Hop in,1602342030,4,1
6303,j8lqif,installeris,0.0,Wake me up when its all over,1602341369,3,1
6304,j8lp14,darkelfas,0.0,Yall got anymore of those bitcoins,1602341216,6,1
6305,j8lo49,CommercialTouch9,0.0,CryptoKitties Team Raise  Million in Flow Crypto Token Sale,1602341123,8,1
6306,j8lkl7,BankBailout,0.4019,DeFi help What is a rug pull,1602340769,3,1
6307,j8lk38,darkelfas,0.0,Yall got anymore of those Bitcoins,1602340715,3,1
6308,j8ljpb,parakite,-0.128,XRP is probably a security dont tagattack me  The Block  march ,1602340675,16,1
6309,j8lixz,Painydayy,0.0,Yall got anymore of those crypto coins,1602340592,3,1
6310,j8lf0k,-Just_Another_Guy-,-0.3252,I mean isnt true,1602340183,5,1
6311,j8leeu,SweetPie123,-0.3804,A more critical approach to the companies buying Bitcoin right now,1602340117,2,1
6312,j8lcgv,darkelfas,0.3182,A huge oof,1602339904,4,1
6313,j8lbuk,darkelfas,0.0,Hold on,1602339838,3,1
6314,j8lbne,SweetPie123,0.0,What the Painful DeFi Correction Did Actually Good For the Market,1602339818,8,1
6315,j8l7uf,casvb_,0.0,Do crypto traders smoke,1602339405,0,1
6316,j8l5qv,myhaxdontwork,0.0,Buying altcoins these days,1602339183,2,1
6317,j8l5jm,Plutusedge15,0.0,Introducing the Index Cooperative For Community Governed Indexes,1602339161,0,1
6318,j8l260,MammothSir9,0.6369,Buying Bitcoin Locally vs Online Which Bitcoin of America Method is Best for You,1602338792,2,1
6319,j8kzoa,nanooverbtc,0.3182,Key OnChain Data Shows Whales Are Actively Accumulating Bitcoin,1602338542,14,1
6320,j8kwdt,TheatreOD,0.0,Gotta stack those  ETH,1602338182,3,1
6321,j8ku5n,blessive,0.0,BitMEX CTO Samuel Reed Stakes  Million on Upcoming Court Date,1602337931,0,1
6322,j8ktiu,nanooverbtc,0.0,In the last  months weve seen a  BTC reduction in spot exchange reserves,1602337864,3,1
6323,j8krwt,TheatreOD,0.0,The simplest explanation of Bitcoin,1602337679,3,1
6324,j8koyf,darkelfas,0.0,Especially today,1602337358,2,1
6325,j8knse,nanooverbtc,0.4019,Bitcoin Active Addresses Shatters ,1602337232,52,1
6326,j8kkg4,TheatreOD,0.0,Its going to happen eventually,1602336882,2,1
6327,j8ki2y,da_dreamerr,0.5719,Perfect Fibonacci Extension Progression Points To Next Bitcoin Peak At ,1602336623,27,1
6328,j8kh24,installeris,0.0,Crypto prices  years ago today,1602336509,6,1
6329,j8kgar,Ceahorser,0.5574, Safe Haven Assets,1602336427,0,1
6330,j8kdrv,Jack_810,0.5574,POSITIVE TURN IN CRYPTO MARKET,1602336149,2,1
6331,j8kcbn,installeris,0.0,Crypto prices  years ago,1602335983,4,1
6332,j8k653,Fritz1818,0.0,I see this coming next month,1602335257,20,1
6333,j8k5vz,alhackbarth,0.6249,Do you participate in crypto adoption groups Bitcoin Soars to  Great crypto resou,1602335227,2,1
6334,j8k5jn,hodlingsince2010,0.8402,Another reason I love Torum xD,1602335188,2,1
6335,j8k544,neo_star,0.3818,Profiting off BCH fork,1602335137,14,1
6336,j8k3tv,susanking1956,-0.7184,How do I sell insurance BTC puts I already own,1602334993,8,1
6337,j8k03o,rober700,-0.4019,YFI and UNI dumped by FTX Ceo SBFAlameda After Sushiswap exit drama,1602334586,1,1
6338,j8jzh6,HassanAmmar22,-0.128,Bitcoin breaks  barrier yesterday  Economist,1602334511,1,1
6339,j8jz96,asshole_cookies,0.0,This sub rn,1602334482,3,1
6340,j8jz2d,nanooverbtc,0.4588,Number of active bitcoin users surpasses ATH,1602334462,0,1
6341,j8jro7,nanooverbtc,0.6249,The Great Reddit Scaling BakeOff,1602333530,0,1
6342,j8jpwb,Fhelans,0.34,New Ethereum yield farm backed by Binance top crypto VCs just launched,1602333315,6,1
6343,j8jok3,loganjones44,0.0,Ethereum Transactions Costing More than Bitcoins for more than Two Months,1602333148,2,1
6344,j8jirq,nstratz,0.0,HelloIOTA Roundup  IOTA Industrial Standard Automotive eHealth Bittorrent and much more,1602332416,3,1
6345,j8jglc,litpath,0.4588,The other side of that DOJ report distributed ledger technology upon which all cryptocurrencies build raises breathtaking possibilities for human flourishing,1602332116,26,1
6346,j8je3c,arslanbajwa,0.0,History of DeFi,1602331803,1,1
6348,j8jc5x,LucianoSainz,0.4019,IOTA Dives Into The World Of Smart Contracts With Its Latest Release,1602331536,1,1
6349,j8jc22,coinsmash1,0.0,Johnny  is DeFi,1602331524,3,1
6350,j8jb5v,salil19,0.0,A report by crypto metrics firm CoinGecko confirms that decentralized finance had a massive impact on the market this summer,1602331410,1,1
6351,j8j62t,Brilliant_Ad_9858,0.0, BITKOIN,1602330706,0,1
6352,j8j3e5,da_dreamerr,0.8807,Bitcoin Tops K on US Stimulus Prospects Seems to Confirm Bullish Trend,1602330343,7,1
6353,j8iusq,Jargog,0.2263,Buy low sell high Atleast thats the idea,1602329099,4,1
6354,j8ipcs,Good-Ad808,0.0,JACS Bounty Campaign,1602328306,0,1
6355,j8ioky,InterviewBrief,0.34,Ethereum Based Multiplayer Game With Shared Fees,1602328192,3,1
6356,j8iitf,Konman101,0.34,New Ethereum Based Multiplayer Game With Shared Fees,1602327342,4,1
6357,j8ifmh,Clash_My_Clans,0.0,How nearly everyone feels these few days,1602326830,4,1
6358,j8iag9,aobretin,-0.1027,Someone is upset they dont get to laundry money,1602326025,1,1
6359,j8i8wp,ggabriel8,0.0,The Index Cooperative  DeFis first Index fund now offers early adopter liquidity mining,1602325790,2,1
6360,j8i34h,chrysotileman,0.0,ZilSwap Airdrop Confirmed For Liquidity Providers And Users  ZilSwap Moving To DAO Consensus,1602324888,0,1
6361,j8i33x,ToshiBoi,0.0,Everyone is getting chocolate Bitcoin this year,1602324886,4,1
6362,j8hyxb,Lonzero1,0.0,Why statera is the most comfy hold,1602324264,0,1
6363,jajc7l,ieFoulger,0.4201,Total Value Locked TVL of yieldfarming on Cheese Bank exceeded  million US dollars highest APY can reach to ,1602613803,0,1
6364,jaja6z,aescolanus,0.2023,Market Friday Bitcoin The Great Reset and Systemic Failure  Gold Goats n Guns,1602613640,2,1
6365,jaj83p,Beefman,-0.4939,COTI Launches Decentralized Fear Index for DeFi Markets,1602613466,0,1
6366,jaj453,ch0s3n0n3,0.0,BITCOINS MARKET STRUCTURE INDICATES A MASSIVE MOVE HIGHER IS ON THE HORIZON,1602613143,2,1
6367,jaizfp,GloriousGibbons,0.0,NYDIG Custodies Over  Billion in Bitcoin and Cryptocurrency,1602612759,0,1
6368,jaiz3s,coinmonks,0.0,How to investigate an Ethereum address  Bitquery,1602612733,2,1
6369,jaiupe,MammothSir9,0.0,Ternio Joins Visas Fast Track Program As New Enablement Partner,1602612378,0,1
6370,jair7g,lever200,0.0,Ledger or Trezor,1602612099,2,1
6371,jaioi3,PotentialFortune,0.3818,Ternio Partners With Visa As First Crypto Focused Fast Track Enablement Partner,1602611889,0,1
6372,jail5x,coinmetrics,0.0,Privacy coins are back on the rise  Monero transfers are hitting new alltime highs,1602611601,15,1
6373,jaikkt,blessive,0.2023,Significant Correction in the Works for Oracle Projects Chainlink and Band,1602611554,0,1
6374,jaij23,ieFoulger,0.4005,Total Value Locked TVL of yieldfarming on Cheese Bank exceeded  million US dollars,1602611430,0,1
6375,jaihvd,sylsau,0.6908,The  Characteristics Defining a Real Money in Which Bitcoin Excels,1602611325,3,1
6376,jaibir,squireofrnew,0.0,I think we know where Trump stands,1602610775,26,1
6377,jai731,aiforev,0.0,PayMe Now Available Claim your PayID before it gets taken,1602610405,6,1
6378,jahus7,hodlingsince2010,0.4019,oh boi smart move,1602609386,8,1
6379,jahqcd,Solebusta,0.0,Perspective,1602609024,10,1
6380,jahpax,digiiital,-0.4019,Russias central bank issues an official consultation paper on a digital ruble,1602608944,2,1
6381,jahnao,miharbidaddah,0.4005,Publicly traded companies holding BTC With a total value of over   billion equivalent to nearly  BTC,1602608776,13,1
6382,jahk29,Tellabobbob,0.3612,Bitcoin price steady as B asset manager scoops up  BTC,1602608507,11,1
6383,jahioe,investormikee,0.0,Always remember this every morning,1602608402,3,1
6384,jahilq,salil19,0.0,Hodlers,1602608395,6,1
6385,jahh24,nanooverbtc,-0.7184,The slaying of the bearwhale k BTC sell order,1602608275,1,1
6386,jahduf,Grazsrootz,-0.1027,crosspost from WSB  hello idk where to post is there some bug with polkaDOT i received  billions,1602608009,3,1
6387,jahdm6,nanooverbtc,0.25, of USD M supply has been created in  vs just  for BTC,1602607991,2,1
6388,jah9aj,nanooverbtc,-0.7717,G Warns of Crypto Threat From Tidal Wave of Ransomware Attacks,1602607645,0,1
6389,jah96p,TheatreOD,0.0,At least I have a plan,1602607636,5,1
6390,jah7w9,Dominik98715,0.0,Hi i made this crypto meme vid,1602607526,0,1
6391,jah5m7,dustybooty,-0.296,Anyone understand why online exchanges have a pro version with lower fees,1602607337,0,1
6392,jagw8q,Alexand0x,0.0,districtx Dev Update  October th ,1602606540,0,1
6393,jagu61,Plutusedge15,-0.4767,Chinas Digital Currency a Totalitarian Nightmare,1602606355,0,1
6394,jagprv,slywalkers,0.2782,Bank of England Governor Says Bitcoin Has Little Intrinsic Value,1602605989,3,1
6395,jagk5e,Mmprtsr,0.0,Just saw this WSB is this legit,1602605505,24,1
6396,jaghsx,saxemberg,-0.5423,A small thread on the harm the Swiss version of the travel rule could cause on blockchain,1602605311,0,1
6397,jagf9s,kyletorpey,0.0,New Fidelity Report Explains Why Trillions of Dollars Could Move Into Bitcoin in the Coming Years,1602605098,13,1
6398,jage88,ch0s3n0n3,0.3612,After Pushing Ahead of XRP Bloomberg Predicts This Crypto Asset Will Surpass Ethereum in ,1602605011,9,1
6399,jagc68,controllerofplanetx,0.4588,I CALL EVERYBODY TO HODL,1602604839,2,1
6400,jag1bg,coinmetrics,-0.34,The three BitMEX founder private keys have been active even though the CTO was arrested and Arthur Hayes is still on the run,1602603929,4,1
6401,jaftl4,EROSBabe,0.0,A Nobel Laureate Joins Algorands Advisor Team  Silvio Micali,1602603289,1,1
6402,jafs8r,nanooverbtc,0.743,Stone Ridge Calls Its M in Bitcoin Primary Treasury Reserve Asset NYDIG Unit Raises M,1602603187,1,1
6403,jafs7s,EROSBabe,0.3818,Noir An Innovation of Aztec for Privacy,1602603185,0,1
6404,jafq7c,nstratz,0.0,IOTA roadmap update  Path to coordicide,1602603019,0,1
6405,jafnne,Banana_Lion_Roar,0.2263,Just found out about Reddits moons How likely is it that they become really big and actually worth something Or will they just become irrelevant,1602602805,43,1
6406,jafn0y,mzfshark,0.0,Somebody got this too,1602602750,0,1
6407,jafkap,Banana_Lion_Roar,-0.7351,Just found out about the moons how likely is it that they become really big or will they just become unimportant and die out,1602602525,2,1
6408,jafiev,PotentialFortune,0.0,Ternio and VISA partner to enable digital currency payments on VISA products,1602602371,1,1
6409,jafi7g,DetroitMotorShow,0.0,Billionaire Russian oligarch and owner of UK news outlet Independent says Cryptocurrency has the power to revolutionise a corrupt banking system,1602602355,28,3
6410,jaffsv,JustFoundItDudePT,-0.2006,Be your own bank CGD a portuguese bank is completely offline for over  hours,1602602138,1,1
6411,jafcru,BardCookie,0.0,How borrow MILLIONS of Dai on DEFI with ZERO Collateral AAVEDyDx,1602601883,0,1
6412,jaf2g2,WeSmartChain,0.0,What is WSC Token,1602601010,0,1
6413,jaf1zc,NightKingsBitch,0.6924,For those who havent seen rcryptocurrency Moons have been added to coingecko Still in testnet so no data on price or anything else but its great to see that info is starting to pop up in more places,1602600965,76,1
6414,jaf19h,burstymy,0.0,Stone Ridge Reveals  Million Bitcoin Investment As Part Of BillionDollar SpinOff,1602600901,2,1
6415,jaezxn,IndistinguishableHUD,0.0,Crypto Cruising,1602600784,2,1
6416,jaez1o,Falciani,0.0,Former Facebook exec Bitcoin is an insurance policy against the Fed,1602600713,3,1
6417,jaew8u,theprodigy_s,0.0,Most purchased coins in the past  weeks,1602600479,47,1
6418,jaetr0,Gasset,0.2023,Bank of England Moves Closer to Negative Interest Rates Asks Banks if They Are Ready,1602600251,3,1
6419,jaes4w,Leonid83,0.7783,IoTeX is combining the security built into Nordics nRF and its blockchain technology to protect the integrity of critical asset tracking data,1602600124,1,1
6420,jaeqdi,zerohalo,-0.296, Crypto Trading Hacks No one wants you to know Hindi,1602599970,0,1
6421,jaek2t,Nemofound,0.3612,What the economy looks like if Bitcoin hit ,1602599438,31,1
6422,jaejuw,eurekabits,-0.4767,Stop all the protests and start to get into cryptoS,1602599418,0,1
6423,jaedy4,mishax1,0.0,So Kraken added Moons and Bricks to their Guides page Kraken listed all their guides tokens,1602598918,5,1
6424,jae8xs,nathanielx9,0.0,Thoughts on MTL,1602598471,0,1
6425,jae7f4,The_Zoinkster,0.0,How exactly would I get started into getting into cryptocurrency,1602598328,17,1
6426,jae7ar,leepawg,0.0,HODL UP HODL UP,1602598317,0,1
6427,jae6hm,StormShadow3D,-0.25,Altcoin Buzz has run a feature on Bancor v,1602598240,0,1
6428,jae4v6,xymiche,0.6597,A couple of days of green dildos and this sub be like,1602598097,5,1
6429,jae4kt,braun224,0.6908,Bitcoin correlation charts Interesting to see it break away from the stock market,1602598073,1,1
6430,jae1by,Maximixus,0.4215,IBMVIDT Datalink  Corona Safety Indicator Sensors,1602597802,0,1
6431,jady14,xof711,0.0,The Bank of Japans Approach to Central Bank Digital Currency   Bank of Japan,1602597561,0,1
6432,jadx2e,xof711,0.4404,Regulatory CleanUp Moves Are Good for Crypto Fundstrat Says,1602597475,0,1
6433,jadihm,FellatioFellas,0.0,And Another One,1602596153,2,1
6434,jadi3s,MasterDebater100,-0.2732,Lagging behind tech stocks,1602596118,0,1
6435,jadfi9,SocialSuicideSquad,0.2195,I really really want to,1602595889,7,1
6436,jadf75,nanooverbtc,0.0,Start buying MOONS on Kraken,1602595864,0,1
6437,jad6z4,pale_blue_dots,0.4588,Crypto Industry Gets Its Own Dedicated Newswire,1602595084,0,1
6438,jad5xx,DirksEarring,0.0,PoS RoundUp Vitalik rolls out rollup plan Major releases for Oasis and SKALE,1602594979,0,1
6439,jad52z,nanooverbtc,0.7739,Start buying MOON on Kraken,1602594892,4,1
6440,jad27b,da_dreamerr,0.5267, billion asset management firm is holding  million worth of Bitcoin,1602594605,3,1
6442,jad153,PotentialFortune,0.3818,Ternio has become the first crypto focused enablement partner for VISA to deliver digital currency utility on VISA products,1602594490,3,1
6443,j3t7v4,Luffydude,0.0,Coinbase disclosing account and personal info to the taxman in the UK ,1601640191,12,1
6444,j3t7ra,Seisouhen,0.0,Wirecard Files for Insolvency What Does It Mean for Bitcoin  Crypto Briefing,1601640178,2,1
6445,j3t325,blessive,-0.6908,US National Pleads Guilty To a M Worth Bitcoin Escrow Fraud,1601639551,0,1
6446,j3t1qm,Thor010,0.34,Trump gets the virus and the value of our coins gets down,1601639378,2,1
6447,j3ssdo,bench4rench,-0.25,Has Uniswap UNI Finally Run Out of Steam TA  nd of October,1601638056,4,1
6448,j3sn04,wmredditor,0.4588,Privacy King Monero XMR Hits New AllTime High for Transactions Despite Bounty Contracts,1601637280,10,1
6449,j3skx1,Sygian,0.4019,How to manage ASICs and GPU rigs efficiently,1601636962,1,1
6450,j3sj46,elmira_kuzmina,0.0,Where should I go to invest in crypto,1601636691,0,1
6451,j3sh9c,cecil_X,0.0,SEC chair perhaps all stocks could become blockchain tokens  Ledger Insights,1601636435,2,1
6452,j3sgf2,chiamalogio,0.0,knock knock,1601636321,3,1
6453,j3sg1h,SamZFury,0.0,Knock Knock,1601636270,2,1
6454,j3sfhr,Revjym,0.802,WillyWoo speaking the truth about Bitmex on Twitter This is actually good for adoption and the price long term,1601636184,2,1
6455,j3s83p,Karpaty,0.0,Following BitMEX owners indictment are Binance FTX and SushiSwap next,1601635064,4,1
6456,j3rt73,LootCoin,0.3612,European Central Bank publishes report on digital euro says we need to be ready to issue it,1601632770,3,1
6457,j3rssa,67no,0.4939,Value Locked In DeFI Surpasses  sexdecillion    Synthetix Dominance At ,1601632708,7,1
6458,j3rs4q,LootCoin,-0.5267,Romania set to auction Bitcoin and Ether confiscated in criminal case,1601632611,5,1
6459,j3rrpx,SaftNow_Coin,-0.4019,Professional White paper writer and designer,1601632545,0,1
6460,j3rkne,xymiche,0.0,Hold Always,1601631396,3,1
6461,j3rhr4,MFrawl,0.4019,Wow full fud season underway,1601630909,16,1
6462,j9kydl,12930jr,0.4215,the true identity of satoshi nakamoto,1602479988,0,1
6463,j9kxz4,ZoneFamliar,0.0,Bitcoin to receive Tsunami of new investment according to Tyler Winklevoss,1602479930,12,1
6464,j9kt0h,Imaginary-Flamingo-,0.0,He Bought,1602479258,3,1
6465,j9kms9,Falciani,0.1779,Bitcoin is going to do to banks what email did the post office and Amazon did to retail Understandably those at the center of the financial system are concerned   years ago,1602478509,21,1
6467,j9kd9t,spenceowen,0.0,Can an Operating System be decentralized in some sense,1602477318,0,1
6468,j9kcjc,ZoneFamliar,0.4019,Kavas DeFi protocol Harvest to support XRP staking,1602477229,2,1
6469,j9k759,intothecryptoverse,0.5859,Bitcoin So was that a successful test of the  week MA Week ,1602476539,2,1
6470,j9k24y,Amazing-Mirror-9731,0.0,TrustWallet BinanceSmartChain,1602475909,0,1
6471,j9k08x,ZoneFamliar,-0.2023,Unstoppable Domains cofounder Brad Kam hosts Reddit AMA,1602475691,13,1
6472,j9jzid,MammothSir9,0.0,Defi Community Members Aim to Sue Yearn Finance Creator Andre Cronje and Fork YFI,1602475596,0,1
6473,j9jy8b,Zuckerbergjr,0.4215,Coiner lol,1602475441,8,1
6474,j9jwi0,Set1Less,0.0,Overview of  DeFiFocused Layer  Networks built on Ethereum,1602475240,2,1
6475,j9jumb,Set1Less,0.0,Ethereum Indicators Suggest ETH Could See Liftoff To  Above ,1602475013,4,1
6476,j9jh9d,imaducksfan,0.5719,Happy crypto Halloween,1602473442,4,1
6477,j9jgeo,chi-ngon,0.0,Will it bart,1602473342,4,1
6478,j9j74i,HashMoose,0.0,Theres now a literal shitcoin to track San Francisco street poop  Decrypt,1602472222,27,1
6479,j9j6n4,JayFab6061,0.0,Uhhhhmmmmanyone else riding this monero train,1602472162,2,1
6480,j9iygk,Win_with_Math,0.0,A sign of things to come,1602471192,7,1
6481,j9imy8,IndianaJeep,0.6369,Best way to DCA,1602469820,0,1
6482,j9ih34,Stagjam,0.0,China digital currency could revolutionize global payments,1602469145,2,1
6483,j9iewj,jzpur,-0.6486,Celsius Network Big News  Is DeFi Dead  Venezuela Builds Decentralized Exchange  BID Token BID,1602468882,0,1
6484,j9i5ol,MellowY3llow,0.0,Coinsbit Announcements,1602467845,0,1
6485,j9i4iv,CryptoIrma,0.0,Beware of Scammers,1602467718,0,1
6486,j9hzt1,hollowbin,0.0,Anybody heard about or know anything about the service profitfarmers ,1602467174,5,1
6488,j9hp9e,purplepicklle,0.0,Has anyone ever heard of this,1602465995,0,1
6489,j9hk29,rosedye,-0.743,What is a vampire attack  How did sushi swap steal uniswap liquidity pool,1602465407,3,1
6490,j9hegx,Set1Less,-0.0258,US Vs China who will win the digital currency war,1602464790,0,1
6491,j9hclb,Falciani,0.0,Bitcoin for Spains Congress BTC Sent to  Spanish Parliament Members,1602464587,2,1
6492,j9h8a5,Culture-Tiny,0.0,anonymous transactions,1602464106,0,1
6493,j9h7ta,Culture-Tiny,0.0,cryptoCurrency,1602464053,0,1
6494,j9h6rq,blessive,0.0,Ethereum price prediction ETH onto  analyst,1602463934,0,1
6495,j9h315,ConfidenceFast,0.0,Try it,1602463518,0,1
6496,j9gzdh,Bluecoregamming,0.5267,Congrats to the owner of  Doge,1602463107,126,1
6497,j9gy5f,nanooverbtc,0.0,How it started vs how its going,1602462974,2,1
6498,j9gxx7,Christopher-Pyne,0.0,The End of Tech Stocks,1602462946,4,1
6499,j9gwc4,AKeveryday,0.0,Ive been thinking of getting rid of all alt coins for bitcoin,1602462772,2,1
6500,j9gsbw,PM_pregnantgoat,0.0,Every time,1602462320,8,1
6501,j9gn7q,donnychakras,0.0,Axion is very close to launch ,1602461768,0,1
6502,j9ginr,ryan0302,0.0,Question about Faucets,1602461265,0,1
6503,j9ghrt,Deivids15,0.0,Soon to be Coinbase billionaire,1602461173,3,1
6504,j9gfo8,Gh0sta,0.4019,Be Smart,1602460951,4,1
6505,j9gcuh,holduntil2020,0.2263, Million Worth of Satoshiera Bitcoin Just Moved,1602460653,10,1
6506,j9g9yn,blessive,0.0,If all US companies followed Square  billion would enter Bitcoin,1602460334,0,1
6507,j9fql3,-Just_Another_Guy-,0.5598,This is so true,1602458274,4,1
6508,j9foct,Christopher-Pyne,0.0,Since the introduction of Moons,1602458047,4,1
6509,j9fnub,Fhelans,0.0,Dont be left behind,1602457994,2,1
6511,j96d85,Craysco,0.6249,Ive been looking into NFTs in the digital art world recently and my mind always goes back to Pepe and Wojak I keep thinking if there was a NFT for this pairs original digital art it would be worth millions What would someone pay for the original Wojak and Pepe NFTs if they existed,1602426644,10,1
6512,j9619x,devboricha,0.7184,To moon ,1602425438,15,2
6513,j9619u,Set1Less,-0.1027,Bitcoin Is An Insurance Policy Against The Fed Warns Former Facebook Exec,1602425437,4,1
6514,j95yv3,incepting,0.0,Bitcoin Price and comment volume in Daily Discussions since September ,1602425197,3,1
6515,j95wft,nanooverbtc,0.4019,Top Official Signals ECB Would Allow Inflation to Overshoot,1602424937,5,1
6516,j95ns5,Enricooxygens,0.0,Crypto dissertation ideas,1602423926,11,1
6517,j95l44,Coffeeman2787,0.0,Any developers looking into a find that meme format Be it video or JPEG,1602423642,0,1
6518,j95hg1,FellatioFellas,0.3612,A Wild FUDFISH has appeared and he looks like he wants to pull that rug,1602423237,6,1
6519,j95b51,businessgains,0.0,Hedera Hashgraph thoughts,1602422529,0,1
6520,j95a0y,an0kri,0.4404,Am I better off just investing in BTC and ETH,1602422408,64,1
6521,j959c8,Clash_My_Clans,0.0516,How Blockchain Technology Can Help Fighting Against COVID,1602422324,1,1
6522,j958fv,anmolgaur45,-0.7783,The scams keep going while Crypto YouTube channels get banned,1602422213,6,1
6523,j957nx,Adorable-Software942,0.7739,BRAIN to MOON,1602422120,0,1
6524,j9561s,Crypto4Canadians,0.0,PSA BEWARE OF CRYPTO MALWARE,1602421924,2,1
6525,j94yk5,wgcole01,0.0,Ripple Says Global Payments Network Live in  Countries and  Currency Pairs With XRP Remittances Running in Five Regions,1602421056,9,1
6526,j94vyi,blessive,0.0,Bitcoin Edges Towards  Less Than a Month Before US Elections,1602420738,0,1
6527,j94m0f,SweetPie123,0.0,MicroStrategys Bitcoin Purchase Means All Norwegians Own Some Bitcoin,1602419574,3,1
6528,j94kgt,Zzzoem,0.0,John DeVadoss left NEO amp community,1602419378,2,1
6529,j94ha2,Christopher-Pyne,0.0,This subreddit over the last few weeks,1602418974,6,1
6530,j94ewt,hippopomonster,0.0,Q in a nutshell,1602418681,4,1
6532,j94805,Usefulaluable,0.0,Crypterium offers an unbeatable  APR on all crypto loans,1602417753,7,1
6533,j947j4,AnserGent,0.0,Can a coinbase account statement be used to prove the amount I own for immigration ,1602417691,0,1
6534,j946vd,litpath,0.2732,BBC visually explains crypto txs at a beginner level,1602417607,23,1
6535,j93x6w,Cryptokingg94,0.4588,Anyone looking for crypto loans  interest on  day loan  collateral needed,1602416252,0,1
6536,j93v8i,nugget_alex,0.0,Crypto Markets DeFi NFTs Finance amp Economics  Weekly News Wrap Up,1602415987,1,1
6537,j93sav,Freeprogrammer,-0.5873,Why did Litecoin crash and never recover like BTC and ETH,1602415560,2,1
6538,j93r4k,Chubkajipsnatch,-0.7184,It might be time to sell all your Bitcoin,1602415380,19,1
6539,j93ncj,nulsservice,0.0,NULS new partnership with Veraprotocol,1602414845,0,1
6540,j93jt3,cryptotapas,0.1779,Why this bull run has no precedence ONE key metric to rule them all,1602414309,1,1
6541,j93i5t,salil19,0.4404,Wanna Know about cake is it profitable to farm or stake,1602414103,8,1
6542,j93e8d,blessive,0.2732,Trust no one Founders of once million Ethereum coin rug pull users,1602413526,0,1
6543,j93d9d,Faker93,0.0, Word Mnemonic Phrase,1602413385,2,1
6544,j93a8s,Interesting-Ease2603,0.4404,Legit and Profitable,1602412943,0,1
6545,j93509,DonnieBrast,0.0,The new Whiskey distillery on the Faroe Islands wants to raise capital through cryptocurrencies,1602412144,1,1
6546,j932xd,CommercialTouch9,0.2023,Robinhood Users Say Accounts Were Looted No One to Call,1602411828,29,1
6547,j930hh,SweetPie123,-0.4215,FCA Survey Shows Significant Disapproval for Retail Derivatives Ban,1602411462,1,1
6548,j92vud,Tellabobbob,0.8738,A reminder to buy now never sell just HODL,1602410745,12,1
6549,j92qa5,blessive,0.4215,Hegic v Launch Ushers in Staking and Liquidity Mining Opportunity,1602409928,0,1
6551,j92os6,Triadji,-0.3818,Satoshi Nakamoto Expels The Bankers,1602409705,11,1
6552,j92kn8,samthe3rd,0.4939,PIVX is the first cryptocurrency to be presented to the masses on Amazon AppleTV Roku and CNBC promoting Privacy and Proof of Stake,1602409134,0,1
6553,j92g6e,Triadji,-0.296,No Comment,1602408499,12,1
