,id,author,vader,title,created_utc,num_comments,score
1811,hh6j7d,b37k,0.3818,Crypto  Blockchain Opportunities,1593310732,0,1
1812,hh6c63,naviejsason,-0.2732,How low can you go,1593309910,81,32
1813,hh667x,darbsllim,-0.25,I turned The Characters Bitcoin speech at a BLM protest into a song,1593309195,2,0
1814,hh65op,blessive,0.0,BTCUSD Bears Again Eyeing  Sally Hos Technical Analysis  June  BTC,1593309132,0,1
1815,hh5vnf,QuartzPuffyStar,-0.886,The government is full on attacking encryption Why is not every Crypto millionaire out here lobby the hell out of their attacks,1593307952,1,1
1816,hh5bj4,alexander_markz87,0.4019,Crypto Party,1593305583,0,1
1817,hh5b42,blessive,0.0,A Bitcoin Developer a Goldbug and a TV Host Walk Into a Bar,1593305536,1,1
1818,hh4ret,Bobby2254,0.0,Crypto rock garden,1593303301,3,1
1819,hh4mmp,MammothSir9,0.0,Jim Rogers Mark Cuban Peter Schiff Will Go AllIn on Bitcoin  Max Keiser,1593302778,1,1
1820,hh4jy2,Feed-Me-Crypto,0.0,Breaking News,1593302492,0,1
1821,hh4exa,blessive,-0.4215,ETHUSD Fails Around  Sally Hos Technical Analysis  June  ETH,1593301946,0,1
1822,hh42qt,MeetNextGo,-0.3818,Predict the lowest Wirecard stock price ever,1593300708,0,1
1823,hh3vmz,J_KingXD12,0.25,Does anyone know something about this alleged crypto created by the Chinese Gov,1593300024,0,1
1824,hh3eax,blessive,0.0,COVID has accelerated the need to develop CBDC says BIS Report,1593298335,0,1
1825,hh2wqb,Dosamary,0.4019,FORSAGE SMART CONTRACT,1593296654,1,1
1826,hh2pw6,thor404,0.7184,How do I buy cryptocurrrency as if I am from Portugal or Malta,1593296009,0,1
1827,hh2kwz,MammothSir9,0.7579,Popular Analyst Reveals New Bitcoin Pricing Model Prediction Suggests Bullish Run a Month Away,1593295566,0,1
1828,hh2kwb,vikingcharm,-0.3612,Cindicator CND  is looking like a scam,1593295565,0,1
1829,hh1v9i,af1000s,0.0,I give you  of my referral commission on gigabet ,1593293190,0,1
1830,hh1msa,virgojeep,-0.4767,Deep fake Justin Sun,1593292376,0,0
1832,hi4gsb,type_error,0.0,With how the market is moving recently We are all thinking this JPOW ROLLERCOASTER xpost WSB,1593452238,5,6
1833,hi493r,xBrando5o,-0.4005,So crazy this man basically predicted the future of crypto,1593451635,1,3
1834,hi3v95,EvanVanNess,0.0,Latest Week in Ethereum News ,1593450539,1,4
1835,hi305i,LoloCrypto,0.5719,Question on DeFi and earning interest on assets used for collateral,1593447959,0,1
1836,hi2n44,areddituser46,0.0,Total Tether Supply Unchanged Following  Million USDT Swap,1593446837,2,1
1837,hi2hwb,BigStacks38,0.0,How to withdrawl from coin base to bank account Usa,1593446384,0,1
1838,hi2gcz,hcglobal_org_sucks,-0.5719,I got Catfished and tricked into investing into a Fake Crypto Exchange Heres how it went down,1593446251,0,1
1839,hi22y6,frankie_mastro,0.0,Facebook IoTeX R Among New Members of Confidential Computing Consortium  CoinDesk,1593445031,4,4
1840,hi20oz,wwtctoken,0.0,Airdrop happening,1593444831,0,1
1841,hi1y9k,KeturahLongmore,-0.7717,Bitcoin could be stolen in Lightning Network attack warn researchers,1593444608,41,9
1842,hi1d36,tamilreviewtoday,0.0,How to Trade on OkEx  How to open  close Swap  Margin Trades,1593442695,1,1
1843,hi1d1o,foflexity,0.0,Seeking experienced node operators,1593442691,1,1
1844,hi1cc2,Smooth-Fold,0.34,Secure Identity Expert Explains How Cryptography Gives Us Power Over Personal Data,1593442626,1,5
1845,hi13tu,Max_Roc,0.0,How do you calculate a coins price potential,1593441779,1,1
1846,hi13t0,CryptoWeather_online,0.4404,What is Market Replay and how does it make you a better trader,1593441777,0,1
1847,hi0xyn,nanooverbtc,-0.6369, Trillion  Economic Stimulus Visualized in Physical CashUSD is Doomed,1593441245,20,2
1848,hi0x5q,naviejsason,0.0,Deadredundant projects and sleeper coins,1593441164,33,1
1849,hi0p3c,nanooverbtc,-0.4588,Panicked Investors Inundate Brokers as Zimbabwe Shuts Stock Exchange to Steady Currency,1593440395,1,1
1850,hi0or6,DappRadar,0.0,Daily activity in the DeFi category has grown  YoY,1593440363,2,1
1851,hi0lsf,DavidBanks12,0.34,South Korean Government Taps Blockchain for Storing Clinical Diabetes Data Securely,1593440080,1,1
1852,hi0gwx,rivoke,0.0,SwissBorg CHSBUDS is up  in the last  hours,1593439606,0,1
1853,hi07ut,blessive,-0.6908,Theres  million of BTC on the Ethereum networkand thats bearish for Bitcoin,1593438721,0,1
1854,hi05ux,sharatdotinfo,0.7845,The best and safest way to DeFi,1593438513,7,1
1855,hi01lv,WorldlyAdeptness01,0.0,BREAKING Binance Partners with Chinese SOE for Blockchain in Supply Chain,1593438073,0,1
1856,hhzv61,Lumin8_Crypto,0.4404,BTC News Today  The Next Bitcoin BTC Bull Run,1593437398,3,1
1857,hhzux9,Rational_Optimist,-0.7003,Was Balancer Hacked Internally DeFi Protocol Balancer Hacked By Exploit It Seemingly Knew About,1593437370,1,1
1858,hhzsp4,TaoOfSatoshi,0.4588,Grass Roots Passion For Dash w Blake Chamness,1593437135,0,1
1859,hhz5fi,MegaSeshBro,0.0,Bitcoin vs other coins price performance question,1593434539,0,1
1860,hhz3kw,nugget_alex,0.0,So Ive Been Asked To Speak About Ethereum amp DeFi At A Large Financial Conference Tomorrow,1593434317,3,1
1861,hhyrfv,Giacomovico,-0.34,Bitwala How to recover your funds and Warning,1593432880,0,1
1862,hhyo7e,dmhco,0.0,Lux Brands cheaper than wholesale only in cmc cryptos,1593432474,1,1
1863,hhyncf,MammothSir9,-0.3818,Lebanons Financial Meltdown Currency Plunges  Huge Losses at Central Bank IMF Bailout Stalled,1593432374,0,1
1864,hhyn90,CoinjoyAssistant,0.0,What Is Sharding Sharding Technology Explained,1593432363,1,1
1865,hhyey5,Belzebump,0.0,Arbitrage by Grayscale Inkind Contribution,1593431341,0,1
1866,hhybd7,MrV777,0.0,Online Blockchain Hackathon,1593430858,1,1
1867,hhyas0,trontrxripple,0.6249,How is It Safe for a Beginner to Make Money on Cryptocurrency,1593430782,0,1
1868,hhy2cs,trontrxripple,0.0,Lockdown fuels cryptocurrency investment,1593429632,0,1
1869,hhy0tp,fasco710,0.0, ROI Monthly,1593429426,0,1
1870,hhxqcg,anmolgaur45,-0.7096,DeFi Protocol Balancer hacked through exploit it seemingly knew about A spat between the Balancer and STA team following the  hack suggests that the DeFi protocol was aware of the weakness,1593428007,20,1
1871,hhxpth,JosefinaCrane,0.0,Justin Sun Broadcasts BTFS Mainnet Highlights,1593427927,1,1
1872,hhxo9z,apkhyil,0.0,Were in the stcentury using financial systems developed in the thcentury based on a thcentury understanding of trade and finances,1593427693,24,1
1873,hhxi5s,Nas9611,0.0,Typical Crypto,1593426822,0,1
1874,hhxccg,cryptomir,0.4019,Cryptos to Watch Promising Altcoins,1593425964,15,1
1876,hhx8p2,cecil_X,0.34,CounterStrike Superstars to Play in CryptoPowered Tournament,1593425410,2,1
1877,hhx4q9,bianconeri_bear,0.7184,Which crypto to buy,1593424817,0,1
1878,hhwwcb,DylanKid,-0.431,Vulnerability discovered in Liquid allowing blockstream employees to steal bitcoin  BTC were affected bug known to blockstream but never fixed,1593423491,458,1
1879,hhwsht,sendmorechuckberry,0.0,Hacker Drains Over  from Balancer Pools,1593422935,3,1
1880,hhwbsv,Rahul_2503,0.0,Matic Staking Live ,1593420417,0,1
1881,hhw637,Mrbitcoinnews22,0.0, des projets de cryptographie sont des ordures,1593419548,0,1
1882,hhw0h8,Kobby0,0.0,Is there annual fee or do I need a server for buying Bitcoin,1593418699,0,1
1883,hhw01c,Homingpsyd,0.0,My crypto millionaire altar,1593418621,3,1
1884,hhvz2a,syron17,0.4404,How safe is funding on Bitfinex,1593418461,0,1
1885,hhvx0g,AntonSIX751,0.3612,Whats your mobile phone of choice as a crypto enthusiast,1593418159,0,1
1886,hhvvwq,smithluke1982,-0.34,Austrian regulators issue warning against four unregistered crypto firms,1593418004,0,1
1887,hhvv2j,pihusingh,0.0, Decentralized Finance The Next Big Thing in the Decentralized Space,1593417871,0,1
1889,hhvn0b,beemerteam,0.4767,A New Era Rise of Artificial Intelligence Cryptos,1593416666,2,1
1890,hhv72e,Suenoscoin,0.0,ANN  Suenos  PoS  Service Oriented Currency,1593414289,0,1
1891,hhv2i6,trail_account,0.0,PNL of my BTCUSD contract position on Delta Exchange,1593413638,0,1
1892,hhv1y1,blessive,-0.2732,BTCUSD Mending from a MultiWeek Low Sally Hos Technical Analysis  June  BTC,1593413546,0,1
1893,hhuvoj,mrsotkogaming,0.34,DeFi Yield Farming Gains Will Not Last Forever,1593412641,2,1
1894,hhutyk,NeuralNetworks_RT_AI,0.0,Finally an Article If can Read,1593412396,0,1
1895,hhuqgc,RuneKlan,0.7488,Homemade Excel BTC development chart Maybe some will find this useful,1593411891,7,1
1896,hhujjn,juzan42,0.6249,You are awesome,1593410923,0,1
1897,hhubsy,oladayo2016,-0.5574,Is China planning on destroying the US banking system,1593409866,0,1
1898,hhu0cw,VampireVlad,-0.5574,Lightning vs Liquid The New Bitcoin Scaling Wars,1593408289,2,1
1899,hhtxo6,chasethechaser,0.0,When the NBA resumes Spencer Dinwiddie will have the word Trillion on the back of his jersey,1593407924,0,1
1900,hhtriy,kelfrensouza,0.4019,Ethereum Smart Contract System TRENDING,1593407134,0,1
1901,hhtq2i,intothecryptoverse,0.3818,Cryptocurrency Portfolio Optimization,1593406937,4,1
1902,hhtazb,Federer107,0.0,An article on Bitcoin and the Art Market,1593405024,2,1
1903,hht63u,4rindam,-0.6124,One of the Balancer Pools just got hacked k worth of crypto stolen,1593404415,9,4
1905,hhror7,PeraHodlr,0.0,Interview with a man without using fiat,1593398074,3,2
1906,hhrn0z,Kpowers87,0.0,Peerbet  Betting with KIN,1593397869,0,1
1907,hhr26t,AD1AD,0.4939,I decided to give some Crypto to my opponents in Rocket League for each goal they scored Heres what happened BitcoinOutLoud,1593395517,20,3
1908,hhr1rj,qwelpp,0.8542,Dumb Money Entering the Market Why buy bitcoin when bitcoin gold and bitcoin diamond are so much cheaper Lol,1593395468,4,2
1909,hhqvmn,rickbonduski,0.0,Referrsl,1593394760,0,1
1910,hhowev,nouhi,-0.3612,First Balancer Labs incident liquidity pool drained ,1593387090,0,1
1912,hhogvi,coinsmash1,0.0258,Tether is backed by fiattrouble is that noone can prove it as fiat doesnt exist,1593385481,96,6
1913,hhogdm,rowland89,0.4404,OneLedger OLT will be a good holdbuy than ETH at this current price,1593385433,0,1
1914,h0gz2p,digitalduster,0.2263,A Gold vs Bitcoin debate worth some sats,1591813961,0,1
1915,h0gt5o,BigWillie_86,0.0,Opinions on Coinify,1591813510,3,0
1917,h0gm5r,[deleted],0.4215,Microsoft Vice President of Identity Alex Simons tweets about MSs progress with decentralized identity DID Says they are betting big on open standards Blog post in tweet,1591812987,0,1
1918,h0gedl,farfaraway,0.0,Building the right thing  Ultra unveils more details about their tech stack based on EOSIO,1591812375,0,0
1919,h0fx7l,Similar-Lead,0.0,Vidy Cloud Mining,1591811044,0,1
1920,h0fhp1,shwnasvavv393,0.0,Hello everyone,1591809863,0,1
1921,h0faf8,schneidernatej,0.3612,Its like hitting the reverse lottery,1591809294,2,8
1922,h0f5fb,EX-SCUDO,0.0,What Is PumpandDump Scheme Beginners Guide,1591808920,4,2
1923,h0f0ql,KandinskyCrypto,0.0,People Are Talking Bitcoin,1591808575,0,1
1924,h0ezc1,MamieCowan,-0.6249,Bitcoin Possibility of Becoming a Major Means of Payment In this Time of Global Crisis,1591808471,2,2
1925,h0eu9g,StormShadow3D,0.0,How to Provide Liquidity to Kyber Network Crystal KNC on Bancor,1591808075,0,1
1926,h0eshk,blessive,0.0,Ripple Price Analysis Decision Time For XRP As It Approaches The Apex of a Descending Triangle,1591807941,1,1
1927,h0ekss,[deleted],0.7184,You can now buy crypto with Ledger Live,1591807316,1,1
1928,h0ei9m,klansek,0.6369,Best practices for Blockchain based inheritance,1591807110,0,1
1929,h0eenp,cris090784,0.0,Spisedr wallpapers,1591806815,4,1
1930,h0e8mm,heist95,0.34,Fidelity Report Over  of Institutions See Value in CryptoAssets,1591806164,4,13
1931,h0e2jq,Uggamouse,-0.128,The Looming Bank Collapse The US financial system could be on the cusp of calamity This time we might not be able to save it,1591805543,20,69
1932,h0dxxj,MammothSir9,-0.3818,A Number of Small Bitcoin Mining Farms Are Quitting as Older Mining Rigs Become Worthless,1591805164,1,1
1933,h0dizi,[deleted],0.0,So what is yours opinion about Reddit Vault,1591803919,0,1
1934,h0diwe,LuckyWarGod,-0.128,bitcoin tricks,1591803912,0,1
1935,h0de9l,[deleted],0.0,Bitcoin price vs SF model over the last  months,1591803534,0,1
1936,h0ddnb,coinfunda,0.0,World Markets Review Points To Know Before Starting,1591803486,0,1
1937,h0dcmw,LuckyWarGod,-0.0516,bitcoin trick,1591803403,0,1
1938,h0daiq,UTM592,-0.2263,This needs to be stopped,1591803229,2,1
1939,h0d85q,LuckyWarGod,-0.0516,giveaway trick,1591803040,0,1
1940,h0d687,Helpme-jkimdumb,0.0,How do you think the digital dollar will affect all other crypto currencies,1591802881,0,1
1941,h0d39i,kartsynot,0.0,Question,1591802637,11,1
1942,h0cu88,memlorfwastaken,-0.128,Join the official HarambeCoin discord server,1591801655,0,1
1943,h0cgik,FiniteRegress,0.6908,New institutionoriented market report highlights the unexpectedly quick recovery of DeFi increasingly homogeneous volatility levels between cryptocurrencies and an increasingly bullish crypto sentiment in general,1591800372,1,3
1944,h0cb2c,coinfunda,0.0,How You Can Use Cryptocurrency for Online Gambling,1591799896,0,1
1945,h0b19n,Mrbitcoinnews22,0.4588,Bitcoin Options Open Interest Rises  in a Month to Hit  Billion,1591795947,0,1
1946,h0ai0y,worldtraveller321,0.296,Helping Content Creators,1591794242,0,1
1947,h0agh2,Lumin8_Crypto,0.7184,BTC News Today  If You Owned  Millions  Would You Buy Bitcoin,1591794105,3,0
1948,h0ablv,4rindam,0.0, million USD whale transfer  USD with a  Million USD fee,1591793667,3,0
1949,h0aa3q,blessive,0.0,ETH price ranges below  ahead of Beacon Chain mainnet,1591793533,0,1
1950,h0a70s,Bass3642,0.296,What coin would you use to transfer larger sums of money,1591793243,20,8
1951,h0a3pr,cyger,-0.4019,Bitcoin Still Faces OnChain Scaling Trouble Ahead Decred CoFounder Says,1591792928,11,8
1952,h09uk5,Silveringtoken,0.5574,Silvering SLVG New Silver Asset Backed Cryptocurrency With Buying Back Guarantee,1591791965,0,1
1953,h09s80,buzzbooz,0.0,M Fee to transfer  ,1591791698,11,16
1954,h09gtw,daxtaslapp,0.0,What do you guys think of this coin,1591790382,0,1
1955,h09fo8,daxtaslapp,0.0,What do you guys think about Quant QNT,1591790246,0,1
1957,h09c1c,GraemeConradie,0.0,Building a Team inside Fintech Systems,1591789829,0,1
1958,h097ni,[deleted],0.2023,Bitcoin dominance does not tell the full picture of the the dominancegrowth of Bitcoin price when compared to other coins,1591789299,0,1
1959,h094js,pihusingh,-0.2263,Ripple Has Asked Court to Dismiss a Lawsuit Against it,1591788932,0,1
1960,h094jm,semtexzv,0.0,What is happening with KNC ,1591788932,0,1
1961,h08zsx,Rainmakerman,0.2023,As long as this can happen there is no mass adoption in sight,1591788393,2,1
1962,h08i2e,blessive,0.0,Big Institutions Are Making Room for Bitcoin Says Fidelity,1591786327,1,1
1963,h08htf,PBWSummit,0.0,Blockchain The Future of Payments  Insights from the Paris Blockchain Week Summit ,1591786294,1,1
1964,h088dc,Mrbitcoinnews22,0.0,Ghanas Central Bank Confirms Its Still Looking to Pilot a Digital Currency,1591785136,0,1
1965,h084e7,Blockchainsapiens,0.0,Zilliqa introducing staking with first partners KuCoin and Binance,1591784633,7,5
1966,h083m8,ShibN,0.7003,EcoDollar A Decentralized Cryptocurrency Supporting Green Planet Initiative  The Bitcoin News,1591784536,0,0
1967,h083ln,Phillip723M,0.1779,Who also noticed that ethereum is growing real fast in Pace with Bitcoin,1591784533,3,1
1968,h07zzo,webb32503,0.0,Transfer  ETH with  ETH transaction fee,1591784046,4,3
1969,h07vfx,Nando_memew,0.0,A new cryptocurrency just came out,1591783444,0,1
1970,h07m4z,ladevise,0.6369,Best Exchange for launching the new coin,1591782165,0,1
1971,h07h8c,gimareason,-0.6808,What the hell is going on,1591781469,3,1
1972,h06x28,StandardCA,0.0,Podcast interview with Ray Youssef CEO of Paxful,1591778631,0,0
1973,h06vg4,romeomax,0.0,Celsius network and Taxes,1591778410,0,1
1974,h06e0q,4chan_anon__,0.0,HexT a Fork of Hex has just pumped over X in the last week and is still going,1591776035,3,1
1975,h06cr9,okean123,0.0,German Stock Exchange Will List Bitcoin ETP  Cointelegraph,1591775862,2,15
1976,h061qr,Mrbitcoinnews22,0.0,Analyst Snickers at Those Who Invest in Gold but Not Bitcoin,1591774347,1,1
1977,h04tc4,blessive,-0.25,BTCUSD Creeps Higher After Run to  Sally Hos Technical Analysis  June  BTC,1591768325,0,1
1978,h04ab2,The-Crypto-Portal,-0.128,InterestingDoubt it will move the price of XRP Ripples Payment Network Sees Surge In Demand amp Plans To Open New XRP Remittance Corridors This Year,1591765804,7,0
1979,h041x0,blessive,-0.6124,An Alleged Ponzi Scheme Makes up  of Paxos Stablecoin Activity,1591764737,0,1
1981,h03rz9,Mrbitcoinnews22,0.0,Un agent de bord des mirats arabes unis risque une peine de plus de    par dfaut pour un prt cryptographique,1591763538,0,1
1982,h03id2,[deleted],0.5574,This picture sums up the uniswap craze perfectly  screenshot from rcryptomoonshots post announcing Ethprivate,1591762384,3,1
1983,h02rmt,4rindam,-0.4019,Only invest what you can afford to lose,1591759279,8,6
1984,h02qwe,[deleted],0.0,VeChain to transform sustainable marine system with blockchain,1591759196,1,2
1985,hfohki,ShotBot,-0.6124,Is defi a ponzi scheme,1593100342,23,1
1986,hfoglw,CharmingPicture,0.5106,Have some fun ,1593100258,7,1
1987,hfodsh,Dr_brainless,0.0,Can someone tell me what this robot does I see it every where since this morning,1593099989,2,1
1988,hfod1i,keaniie,-0.7804,Bitconeeeee no wait thats actually the chart of one of the largest German Tech stocks Well it was one of the largest RIP,1593099920,5,1
1989,hfoayz,ShotBot,0.0,Can someone explain to me how DeFi is any different than BitConnect,1593099730,2,1
1990,hfoa61,saud29,0.0,What is a blockchain How Does It Work,1593099654,0,1
1991,hfo72f,mcshanksshanks,0.0,WAX Garbage Pail Kid NFTs and the one and only William Shatner,1593099373,3,1
1992,hfngqg,CryptoBucksApp,0.0,Chuck E Cheese  Bitcoin  ,1593096848,3,1
1993,hfnfde,mrholmes1991,0.0,ETH  Explained Staking Sharding and Scaling Ethereum,1593096707,3,1
1994,hfnb0d,MokebeBigDingus,0.0,Release ze Coveed,1593096265,2,1
1995,hfn6gn,jwinterm,0.5994,Honestly surprised this wasnt instaremoved as offtopic in rBitcoin,1593095824,1,1
1996,hfmsuq,sajal56,0.0,Need Pi Network refferal code,1593094434,0,1
1997,hfmrkg,heist95,0.0258,Venezuelas Bitcoin Payments Test in Context Why It Matters,1593094298,4,2
1998,hfmppt,sherlockwriter,0.0,BlockCard on TERNIO Token Store,1593094105,0,1
1999,hfmoia,MammothSir9,-0.1027,Australians Can Now Pay for Bitcoin at  Australia Post Offices,1593093980,1,1
2000,hfmoeo,[deleted],0.7184,You Can Now Buy Bitcoin At CVS Eleven RiteAid,1593093969,2,1
2001,hfmhpb,rslucas03,0.4019,Circle Announces Support for USDC Stablecoin on Algorand Blockchain,1593093256,5,2
2002,hfmhbj,Czfacts,0.3182,Agro Blockchain Purchased Bitmain Z To Expand Its Crypto Mining Capacity,1593093211,0,1
2003,hfm67n,PlantWolf,-0.836,Were in a cataclysm you blind privileged insulated amp selfabsorbed twats Pay attention Fucks sake Wake the hell up,1593092021,2,1
2004,hfm2ng,NeptuneAgency,0.0,ISISAffiliated News Website to Collect Donations with Monero,1593091657,15,1
2005,hfm1sl,Lumin8_Crypto,0.8176,BTC News Today  I Would Like To Buy A Book Of Stamps And  In Bitcoin,1593091566,8,1
2006,hfm00e,Milton_R,0.25,Real Vision  The Crypto Gathering,1593091370,1,1
2007,hflsn3,Mat7ias,0.0,Golem  Unraveling The Next Milestone Part II Architecture  learn how we are building New Golem,1593090521,0,1
2008,hfljto,blessive,0.2023,Top  Blockchain Startups to Watch for in ,1593089535,0,1
2009,hflij4,Certain_Monk,0.4019,yes,1593089383,3,1
2010,hfl891,WorldlyAdeptness01,0.0258,Ethereum Transactions Reach  Levels as Price Takes a Dive,1593088142,3,1
2011,hfkzho,blakchild88,0.0,Can I have some moonz ,1593087033,3,1
2012,hfktst,WorldlyAdeptness01,0.3612,New York regulators aim to ease crypto regulations in the state,1593086314,70,1
2013,hfkqjs,Pranaym2001,-0.5859,The legalised scheme of saving billions in tax fraud,1593085880,0,1
2014,hfkodd,Pokxx,0.0,BAT mCap M  cBAT mCap M,1593085581,1,1
2015,hfknq4,Roy1984,0.0,Andreas Antonopoulos  Obama Story What He Said About Bitcoin,1593085491,12,1
2016,hfkhks,pihusingh,0.0, PayPal is Hiring Crypto and Blockchain Experts Amid Rumours,1593084640,0,1
2017,hfk4nd,litpath,0.6908,Year cycle OG Bob Loukas owns ETH turns bullish on ETH,1593082804,4,1
2018,hfjz7e,SandrewwBogey,0.0,A hacker group stole  million from  Bitcoin exchanges,1593081968,5,1
2019,hfjnw7,cyrilsmith555,0.0,BUY OR SELL CRYPTOCURRENCY,1593080246,0,1
2021,hfjj4i,arslanbajwa,0.0,Understand the principle of Balancer liquidity mining,1593079512,1,1
2022,hfj31e,CarelessV1rus,0.0,Algorand Foundation and Circle Bring Digital Dollars Powered by USDC to Algorand Blockchain,1593076951,0,1
2023,hfj139,KeturahLongmore,-0.296,Wirecard files for insolvency after  billion went missing,1593076646,35,1
2024,hfizpm,Geyser46567,0.0,Koinpro,1593076425,0,1
2025,hfityy,AvocadosAreMeh,0.2732,Do moons do nothing other than provide a blockchain tracked karma system for certain subs,1593075548,15,1
2026,hfio7e,arijitdas,0.6124,DeFi is ready for India but are Indian authorities ready for crypto,1593074604,0,1
2027,hfilss,Louis6787,-0.4588,Beating everything,1593074210,4,1
2028,hfiflz,Born-Edbond,0.4141,Kyber Network announced as the first Bancor V launch pool This partnership means you can provide liquidity while staying long on KNC and no impermanent loss,1593073220,9,1
2029,hfi8s8,Dearestrachael,0.0,Earn millions with Forsage,1593072178,0,1
2030,hfi4so,blessive,0.4019,Bitcoin price falls towards the  support,1593071539,0,1
2031,hfi4ky,Genderfox,0.5267,The Richest Man in Babylon  Holds Bitcoin,1593071502,2,1
2032,hfi355,Born-Edbond,0.7269,Bancor announces Kyber Network KNC V KNC pool will allow holders to provide liquidity and earn a share of the pools trading fees while maintaining their long position on KNC,1593071286,0,1
2033,hfi1tu,mishax1,0.2023,Two users from the Top  MOONS chart barely has Karma while one is only  months old,1593071074,26,1
2034,hfhk3h,Lexinejoyce,0.0,Hey,1593068548,0,1
2035,hfgt6c,parakite,0.4404,Video I sold this crypto and bought bitcoin instead  trader Charlie Burton explains why he recently sold his holdings in XRP ripple and bought more bitcoin instead We also discuss whether this was perhaps a good idea or not  Alessio Rastani,1593064933,14,1
2036,hfgpd4,blessive,0.431,Bancor Price Analysis BNT Surges  in  Hours Despite Bitcoins Latest Drop,1593064344,0,1
2037,hfgi2y,coinmonks,0.0,Blockchain Could Provide ID for Those Who Need It Most,1593062323,0,1
2038,hfgfg4,CaddarkCrypto,0.7739,What Influence Will the MOON CryptoCurrency Have on the Content amp Quality of this Subreddit,1593061672,2,1
2039,hfgd1w,WorldlyAdeptness01,0.0,Mastercard Outlines Issues Holding Crypto Back from being a Payments Method,1593061183,10,1
2040,hfgar4,blessive,-0.4404,PlusToken Scams M Worth of Ethereum Is On the Move,1593060728,0,1
2041,hffziy,Certain_Monk,0.0,Dogecoin of DeFi,1593059142,3,1
2042,hffx4s,BoyScout22,0.0,Binance lists COMP,1593058762,1,1
2043,hffvs7,BasedAlpha92,0.0,The Dogecoin of DeFi,1593058579,1,1
2044,hffnix,cH3v0,0.0,I see you big baller,1593057538,3,1
2045,hffjen,TheDessalet,0.0,Hmm,1593057031,2,1
2046,hffj9t,Tarus1475258,0.8251,Most promising digital asset to be valued in the coming months,1593057011,3,1
2047,hff4qw,DarkestChaos,0.6124,K Crypto News  Marvel VP amp Shatner Join WAX  Algorand Adds USDC  PlusToken Moving ETH  More,1593055272,1,1
2048,hfevto,Cryptocoindisplay,0.659,Our newest display From  to  long  Display up to  if your most desired coins,1593054218,3,1
2049,hfet09,jack15256,0.4019,definitely non shill adding liquidity to Uniswap,1593053914,0,1
2050,hferb8,naviejsason,0.0,Whats your goal for your crypto portfolio,1593053711,81,1
2051,hfel52,jack15256,0.0,non shill I added liquidity to Uniswap,1593052993,0,1
2052,hfe9wg,easonCccc,0.0,Any suggestion on earning more coins during pandemic,1593051725,0,1
2053,hfdt9i,blessive,-0.296,Jack Dorseys BitcoinFriendly Square Accused of Unfairly Withholding  Of Customers Funds,1593049934,1,1
2054,hfdfsd,HODLAMB0,0.2023,What are your top ,1593048460,69,1
2055,hfdcul,theGreatDaniad,0.8442,Is there any trusted redditor to buy bitcoins with paypal from,1593048153,0,1
2056,hfda8s,angel091276,0.2732,Listed my NFT creation for sale on rarible,1593047869,0,1
2057,hfcyic,yunghungboy,0.4588,Investing a couple grand in Chainlink,1593046564,0,1
2058,hfcv8d,msl2008,0.0,Grayscale Record Day,1593046146,0,1
2059,hfctno,scara89,0.0,The outcome of the Kik case is likely to further define the status of blockchain token models in the US market Check this post to know about the stats of the process,1593045939,1,1
2060,hfct5h,DogMeatTalk,0.7096,How long did it take for yous to become a profitable trader,1593045872,1,1
2061,hfcmuy,VoskCoin,0.8331,Should YOU BUY Masternode Crypto Coins Review amp Profitability,1593045128,2,1
2062,hfcg4v,craytreez,0.0,Be a Pioneer before the next halving,1593044212,0,1
2063,hfc8aj,davidcalabria8014,0.1027,How the hell do I buy Vechain in New York,1593042886,0,1
2064,hfbp7i,finfreeotc,0.0,The wait is almost over The only non custodial crypto marketplace is about to lauch,1593040535,6,1
2065,hfbnvn,cryptotapas,0.873,GOOD NEWS Supreme Court limits the extent of SEC disgorgement fines  will help crypto space,1593040335,7,2
2066,hfbbl7,lucidrop,0.0,just saw all these really prices cryptos and was wondering why nobody talks about them,1593039030,13,1
2067,hfb8hr,DetectiveLtDan,0.0,Trading out of NYS,1593038707,0,1
2068,hfaw30,FantasyAdvice99,0.6124,PLEASE HELP,1593037477,0,1
2069,hfat78,slywalkers,0.0258,Why Bitcoin matters for human rights in two minutes,1593037208,8,1
2070,hfap3f,monethical,-0.5106,Top and worst coins according to trend and momentum indicators June th,1593036812,3,1
2071,hfal5y,Zodd60,0.0,How to Earn Crypto With Your Crypto,1593036455,0,1
2072,hfaiv3,k2thesawa,0.0,Different exchanges,1593036241,0,1
2073,hfa6rw,Fiach_Dubh,0.25,The Crypto Gathering PreParty Wwith Raoul Pal  Real Vision,1593035085,0,2
