,id,author,vader,title,created_utc,num_comments,score
2602,gutezw,Craysco,0.0,Unofficial Daily Discussion the official one went to ,1591046724,2,1
2603,gutd46,IrishButtercream,-0.1027,Bitmain Launches Cheaper Mining Machines After Bitcoin Halving and Losing Market Share to MicroBT,1591046563,2,0
2604,gutbhh,Joohansson,-0.6633,NANO Espresso over NFC,1591046422,113,20
2605,gutatw,JayDay777,0.0,Pi network,1591046363,0,1
2606,gut4fk,hodlerdoor,0.0,Woki and gitcoin doing DAI quadratic funding for local businesses in Boulder CO,1591045805,0,1
2607,gut2ss,acvanzant,0.296,The Age of Magic Money,1591045663,1,0
2608,gusr3o,IrishButtercream,0.0,What are Collectible Tokens and How Can You Invest in Them  Bitcoin Market Journal,1591044683,2,1
2609,gusnr9,IrishButtercream,0.0,CoinMarketCap Alters Ranking System for Crypto Exchanges,1591044391,0,1
2610,h7z604,pranaman,0.0,anyone heard of vsscoins and if it is legit or not,1592016952,0,1
2612,h7z4cg,raafaell,0.0,IOTA hits new milestone with its coordinatorless project,1592016762,2,1
2613,h7ysyh,Mrbitcoinnews22,-0.1531,South Korean Experts Say Crypto Is a Poor SafeHaven Asset,1592015548,0,1
2614,h7yphu,EdisonClayton,-0.128,Introducing Verida Health  Decentralised Healthcare Solutions no ICO just products,1592015180,1,1
2615,h7y5wk,cryptodabhead,-0.4215,SCAM WEBSITE ALERT,1592013159,0,1
2616,h7y38g,localname1,-0.4019,Bloomberg  JPMorgan Says Bitcoin Crash Survival Shows It Has Staying Power,1592012873,4,2
2617,h7y1gg,dkass,0.0,Cryptos Are In A Kangaroo Market,1592012676,3,2
2618,h7y05p,dkass,0.0,CNBC Breaking News Cryptos Are In A Kangaroo Market,1592012540,0,1
2619,h7xn69,arjaymanalo06,0.0,FlashX Coin Only Listed Today with k in just a couple of hour,1592011218,1,2
2620,h7xc2f,TheDuk33,0.0,Integrating NonBitcoin Applications with the Lightning Network suggestions,1592010096,2,6
2621,h7x90x,Ituglobal,0.7579,IOTA Is in a Strong Uptrend Engaging Significant Price Levels,1592009787,0,1
2622,h7x4vy,quobject,0.0,Quobjectcoin,1592009375,0,1
2623,h7x2xn,_HandsomeJack_,0.0,Did the Mt Gox Bitcoin hacker finally reveal himself,1592009166,3,1
2624,h7wvwi,[deleted],0.0,EARN Pi MINING ON YOUR PHONE  IN THE BACKGROUND,1592008453,0,1
2625,h7wlvj,az_millymally,-0.5994, Reasons Why Bitcoin Price Could Crash if US Stock Market Collapses,1592007475,1,1
2626,h7wl86,az_millymally,0.0,Central Bank Digital Currencies,1592007408,1,1
2627,h7wkyn,az_millymally,0.5859,Cryptocurrency Day Trading How to Get Started amp How to Win,1592007381,1,2
2629,h7vsjl,Mrbitcoinnews22,0.0,Wilshire Phoenix Files With SEC for Publicly Traded BitcoinBacked Fund,1592004736,1,1
2630,h7vbt5,MammothSir9,-0.3612,Japanese Court Upheld Former Mt Gox CEOs Conviction for Manipulating Data,1592003187,0,1
2631,h7vb13,goldenergott,0.765,Are stable coins a safe longterm asset,1592003123,0,1
2632,h7va31,lifeandtimes89,0.0,Daaaaammmmmnnnnn,1592003044,22,23
2633,h7uuv9,FatnDrunknStupid,0.0,Fucking coinbase,1592001683,7,3
2634,h7uczd,monethical,-0.5106,Crypto trend and momentum indicators top and worst coins,1592000081,4,1
2635,h7ucu7,nanooverbtc,-0.296,Wilshire Phoenix files with SEC to compete with Grayscale proposes lower annual fee of  vs Grayscales ,1592000069,2,2
2636,h7ubso,abcoathup,0.5046,OpenZeppelin Contracts v  first release candidate  ERC multitoken standard  functionCall  More Replacements for call  Using SafeMath on Small Signed Integers  whats next  Give the release candidate a try and feedback in the forum,1591999978,0,1
2637,h7u54g,reallymemorable,0.0,CCXT not pulling all BCH data,1591999386,0,1
2638,h7u0mw,MrChesswiz18,0.0,Start Earning Mining Crypto On Mobile,1591998962,0,0
2639,h7u0mc,Ofenkartoffel33,0.0,Question Priority of Bitcoin transactions,1591998960,2,0
2640,h7tyb9,blessive,0.0,One of the Worlds Largest Bitcoin Mining Pools Set to Launch New Financial Products,1591998734,1,1
2641,h7tnag,VishalBhagat,0.0,Fck TA,1591997668,0,1
2642,h7th54,Plutusedge15,-0.4404,New York Times publishes details about its blockchain prototype project  The Block,1591997065,1,1
2643,h7ta5l,joenorwood77,0.0,Discussion of the Day BEAM,1591996406,8,8
2644,h7sjdy,Mrbitcoinnews22,0.0,Blockchain Firm Pitches CBDC Operating System to Bank of England,1591993951,0,1
2645,h7sg48,speedyarrow415,0.0,White Founder Vitalik Buterin Steps Down from Ethereum Foundation Replaced by Black CEO,1591993652,2,0
2646,h7s24j,MammothSir9,0.2732,US Financial Services Committee Hearing Discussed the Creation of a Digital Dollar,1591992365,0,1
2647,h7rxb2,Stank_Lee,0.0,Thoughts on KYDC for staking,1591991925,12,0
2648,h7ruqj,mossbacher,0.0,OC Rounding to zeros,1591991687,5,0
2649,h7romd,Nesh_,0.0,Pirate Chain ARRR May Update,1591991139,9,6
2650,h7rgup,gabtotal,0.0,poloniex digibyte supply dgb digibyte,1591990447,0,1
2651,h7rbca,ManyArtichoke,0.5413,What we most care about is entering stuff in the most immutable hardened record imaginable and right now thats bitcoin Thats why we use it  Daniel Buchner Head of Decentralized Identity at Microsoft,1591989956,2,5
2652,h7r78w,Marnellie,-0.4767,Warning about EDI Freight Trust is likely a scam,1591989590,0,1
2653,h7r5qz,Hang10Dude,0.5719,Statera STA finally a coin with perfect tokenomics,1591989457,25,10
2654,h7r4rc,monethical,0.5106,Ethereum tops BTC as the most resilient coin in the last week  weekly crypto report,1591989366,0,1
2655,h7r3rz,ClintEhrlich,0.0,National Science Foundation Funds Research Into Crypto Dollars,1591989269,0,1
2656,h7r3py,ashiitake,0.0,Its just the beginning for ARK and the IoT,1591989264,1,1
2657,h7r2m7,Whiskeywonder,0.9403,I honestly think the theme of the next bull market is defi not  of what was hot in  Statera is a perfect example of the kind of project we should be focused on,1591989159,20,2
2658,h7qycz,[deleted],0.5719,Statera STA  Finally a coin with perfect tokenomics,1591988781,0,1
2659,h7qonz,almostadoctorr,0.8779,Easiest way to buy bitcoin please,1591987918,0,1
2660,h7qnkq,[deleted],0.0772,Proof of Authority,1591987822,0,1
2661,h7qlt2,[deleted],0.0,KyberSwap Integrates Chainlink Price Reference Data for Enhanced Price Feeds,1591987657,1,1
2662,h7q4un,az_millymally,-0.3818,Craig Wright Apparently Just Admitted to Hacking Mt Gox,1591986158,18,18
2663,h7pttn,frank__costello,0.0,Did the Mt Gox Bitcoin hacker finally reveal himself  Craig Wright claims he owned the recipient addresses,1591985183,12,23
2664,h7ptlr,MammothSir9,0.0516,Canadian Regulator Unveils the Truth Behind Collapsed Crypto Exchange Quadrigacx,1591985166,0,1
2665,h7pt4h,revanyo,0.5106,NanoPaint See the speed and network capacity of Nano with an interactive and fun UI,1591985127,1,29
2666,h7psrn,[deleted],0.0,I made a website to gather all the nonKYC crypto services The idea is to make it grow with all kinds of services,1591985097,0,1
2667,h7pdnr,cryptotapas,-0.7096, Million dollar fine Indias plan to ban Crypto could kill its blockchain opportunities,1591983762,14,6
2668,h7p6n8,Mrbitcoinnews22,-0.2023,Vitalik Buterin Comments on Strange Transaction Fees,1591983151,0,1
2669,h7p3gv,pwolf88,0.0,OMG Network what we know so far part ,1591982866,6,4
2670,h7odxk,CoinMan747,0.5859,xD,1591980634,2,1
2671,h7o9xo,mishax1,-0.7096,FeexVbAHbybZjqQMjJrcCrHGWsbuF Craig claims this address is his and the keys were hacked however the coins are documented as stolen from MtGox,1591980272,0,1
2672,h7nqmx,ram2222,0.7184,Bitcoin going to the moon in ,1591978659,3,1
2673,h7n8ge,[deleted],0.3612,Bank of England ready to act,1591977095,1,1
2674,h7n70e,ShotBot,0.0,Bitcoin vs SampP ,1591976968,10,7
2675,h7n615,warrchaser,0.0,Thankyou Grayscale,1591976885,8,35
2676,h7n2zv,osteo-path,-0.128,Pentagon Documents Reveal The US Has Planned For A Bitcoin Rebellion,1591976621,0,1
2677,h7n2f4,Saleh_ahmad1,0.6249,What an awesome Fiverr gig,1591976569,0,1
2678,h7muvo,Mrbitcoinnews22,0.0,Biggest Crypto Exchanges Push for Global Presence,1591975932,0,1
2679,h7mqdf,Flimsy-Network,0.0,Liquid Airdrop,1591975555,0,1
2680,h7mnut,[deleted],0.0,DeFi cannot be gamed by such simplistically orchestrated rhythms,1591975337,0,1
2681,h7mgkq,nanooverbtc,0.0,Robin Williams Compares BanksWall Street to Junkies,1591974694,13,57
2682,h7mc9w,Ewss26,0.0,Funding crypto to coinberry,1591974337,0,1
2683,h7mb46,kerrymcook,0.0,Volatile Scammers roaming Reddit ,1591974241,3,1
2684,h7mail,sylsau,-0.128,Bitcoin Is Currently Facing the  Psychological Barrier,1591974188,2,6
2685,gxxj8x,intothecryptoverse,0.0,Bitcoin ROI from the halving  year cycle vs lengthening cycle projection,1591472294,1,1
2686,gxxcnc,feelings_arent_facts,-0.5106,People let unethical behavior slide in crypto because they hold their coins,1591471719,1,1
2687,gxx9e0,Plutusedge15,0.0,M Daily What Would It Mean to Sustain Bitcoin Price at ,1591471429,0,1
2688,gxx67u,ScuttlingChuds,0.4019,Requesting Help  Trying to locate ETH sent from MEW to my Ledger Nano S,1591471136,0,1
2689,gxwp5p,estrojennnn,-0.1779,NEW Workout  Equipment store offering to accept crypto through Coinpayments,1591469552,2,1
2690,gxwou2,blessive,0.0,BCH Consolidates Around  But A Big Move Might Be Incoming Bitcoin Cash Price Analysis,1591469524,0,1
2691,gxwhff,Redac07,0.0,Apex token CPX My pick for moonshot and why,1591468822,32,1
2692,gxw9c2,KingNanoBunny,0.6669,Nano founder  Smart contracts dont solve a problem people need solved,1591468018,0,1
2693,gxw2et,CryptoPlanetVIP,0.516,New JP Morgan Study Claims the Issuance of CBDCs will End the Dominance of the US Dollar,1591467349,2,1
2694,gxvyxt,solid_boss55,0.0,Breakthrough in compatibility between blockchain and banking Nimiq amp TEN Bank product of WEG Bank AG,1591467025,0,1
2695,gxus32,Joe-M-4,0.2023,I bought k of the Top Ten Cryptos on January st  Result Down ,1591463252,230,1
2696,gxuraf,MammothSir9,-0.6597,Carl Watner The Tragedy of Political Government,1591463180,0,1
2697,gxuqqq,sunnycruizer,0.0,Is Ripple the next Bitcoin,1591463136,2,1
2698,gxtzwp,gdj11,0.0,What options are there for converting USDT to other stablecoins,1591460709,6,1
2699,gxtzpw,MrBeowulf91,0.0,IDEXTools,1591460693,0,1
2700,gxtrry,JustJesseREDDIT,0.0,Harambecoin The New Cryptocurrency,1591459971,0,1
2701,gxtr5h,nanooverbtc,0.0,The New Leviathan,1591459912,0,1
2702,gxtpsw,Shudip_477,0.0,RenVM Launches as Bitcoin on Ethereum Surges,1591459783,0,1
2703,gxtnv7,CryptoGameDeals,0.6908,Started my own online game store that only accepts crypto Yay anonymous and cheap too,1591459600,0,1
2704,gxtc99,milieyio,-0.4019,Has Amfeix committed a  million fraud against investors,1591458543,2,1
2705,gxt9pt,TheCryptomath,-0.3182,VeChain VET with the leaked Tyson Foods partnership,1591458281,1,1
2706,gxt84u,deemelvtm,0.0,Games,1591458122,0,1
2707,gxt68n,bivashpaul1,0.296,To entering smartphone based crypto world join PI NETWORK,1591457932,0,1
2708,gxt60t,Dannivar,0.0,The Bitcoin halving Was the price adjustment,1591457910,1,1
2709,gxt4lj,Veteran_guy,0.6597,Everytime BTC wants to pump Resistance line be like,1591457770,0,1
2710,gxsly0,MammothSir9,0.6908,Bonus Army Occupiers  Uprising Bitcoins Peaceful Protest Is Pure Civil Disobedience,1591455975,0,1
2711,gw8yyx,MammothSir9,0.0,US Regulators Target Bitcoin ATMs  of the Funds Exit the Country via Machines,1591239975,2,1
2712,gw8pst,frank__costello,0.34,Federal Reserve Endorses EthereumBacked Alternative To Libor,1591238999,3,1
2713,gw8om9,binc114,0.0,Where do I start,1591238862,0,1
2715,gw81gf,joenorwood77,0.0,Discussion of the Day Loopring LRC,1591236400,5,1
2716,gw819j,ScroogeMcDuckyPants,0.4939,Need advice for the cheapest method to convert US dollar into euro for my Italian friend whos getting robbed on conversion fees,1591236378,0,1
2717,gw80f4,KashMango,-0.6124,Coinbase is a Scam,1591236295,15,1
2718,gw806p,DarkestChaos,0.6249,Why Bitcoin Could Reach  This Year  Ethereum Is Undervalued It Should Be Closer To ,1591236271,3,1
2719,gw7z10,BIGroman23,0.0,Binance,1591236155,0,1
2720,gw77p6,ActualSeaworthiness8,0.0,Mining up,1591233371,0,1
2721,gw71vv,MammothSir9,0.0,Roger Ver Donates K in Bitcoin Cash to Casa de Amparo Childrens Shelter,1591232761,0,1
2722,gw7107,Fencesitta,0.4215,This San Francisco Startup Is Looking To Portugal For Crypto Talent,1591232675,2,1
2723,gw6bv3,patrickMouse,0.743,I have interviewed Craig Wright for  hours the last  weeks  hours ago he gave me my favorite interview yet SPOILER  Tulip Trust Response Last  Mins,1591230184,3,1
2724,gw5u8x,melissaBrian0,0.4588,Bloomberg Bitcoin will approach record high of about  this year,1591228411,0,1
2725,gw5iqs,rezivor,0.0772,When the market is locked up like it is now virtually hidden walls on all coins  there is no large walls anywhere so what exactly is producing this resistance,1591227304,2,1
2726,gw5dbn,tagawa,0.2449,Bitcoin gold most likely assets to thrive in  new report claims  Decrypt,1591226793,7,1
2727,gw5bi6,jam1111,0.0,xDai Chain Review MultiChain Staking a Dual Token Model and  APR,1591226630,0,1
2728,gw5b14,Plutusedge15,-0.1531,Latest Bitcoin Core Code Release Protects Against NationState Attacks  CoinDesk,1591226588,2,1
2729,gw501o,doomlol96,0.0,What are DigiAssets   DigiByte Blockchain,1591225608,3,0
2731,gw4qco,Joshyboy1111,0.6124,Please help multiple CoinbaseBinance accounts,1591224734,0,1
2732,gw4dna,Vascular_D,0.0,Enterprise Ethereum Alliance EEA has quite a few bigname members such as BP Intel and Microsoft,1591223593,9,5
2733,gw4a4x,olihowells,0.2023,Unpopular opinion Binance being the top exchange on coinmarketcap is completely reasonable,1591223274,2,1
2734,gw4a4u,Nillabean1988,0.8388,EZ Blockchain launches a new business line EZ Energy devoted to stranded trapped and renewable energy,1591223274,0,1
2735,gw47pl,[deleted],0.0,Ethereum Blockchain as a Service now on Azure,1591223066,2,1
2736,gw3vmw,Vascular_D,0.0,Crypto Veterans Whats your process,1591222030,8,2
2737,gw3t7n,EvanVanNess,0.0,Annotated edition for latest Week in Eth News,1591221836,2,1
2738,gw3qw8,shubse,0.0,Mining,1591221643,0,1
2739,gw3g4m,Jono_Buzz,0.0,Initiative Q crypto invites  spots left,1591220734,2,1
2740,gw3b7h,Plutusedge15,0.0,Big name investors participate in Numerai Token sale,1591220317,0,0
2741,gw38zm,dim-pap,0.0,What is preferred exchange for cryptotofiat,1591220134,16,2
2743,gw35pw,monethical,0.4588,High market capitalization coins are overperforming the market,1591219868,2,1
2744,gw2sw2,Schwitter,0.5994,Could we start telling people that the name Bitcoin comes from the fact that it is a verified value Like a bitten gold coin,1591218784,2,1
2745,gw2nzd,MammothSir9,0.1695,Despite Russias Confusing Crypto Laws PP Bitcoin Trade Volumes Soar,1591218373,2,1
2746,gw2jn9,pwolf88,0.0,OMG Network Mainnet Beta  Soon Is Here,1591218028,2,0
2747,gw2gks,EX-SCUDO,0.0,What Are ERC Tokens Beginners Guide,1591217776,0,1
2748,gw2by1,julia_s13,0.0,Crypto for Dummies,1591217384,0,1
2749,gw28jq,alpha8484,0.0,Basic Articles for Noobies,1591217086,0,1
2750,gw25fd,Coinbuster1234,0.0,Crypto mining,1591216813,1,1
2751,gw1v4j,annynbyrg,-0.6124,all premined coins are a scam,1591215921,126,2
2752,gw1ucg,alvarosb,-0.6249,Adam Back Crisis Will Push BTC to K Even Without Institutions,1591215851,6,1
2754,gw1f9x,[deleted],0.3602,For newcomers please watch out for this Live SpaceX Special Event Viewers lured to send Bitcoin under the promise that they will receive double the amount in return One of the most classic but effective scams out there,1591214544,2,1
2755,gw17hi,cryptogeezuzz,-0.34,YouTubes top recommended video for me was literally a scam,1591213895,177,6
2756,gw14wq,IIamII,0.296,I made a Creating Cryptocurrency Meme Art Logos in Grasshopper,1591213674,2,3
2757,gw12r1,nohiddenmeaning,0.6369,Suppose I was out of the game for two years Whats the best way to find out about any currency I unknowingly own via forks or similar from a vast variety of coins,1591213488,2,1
2759,gw0o90,Alex_Ownagez,0.0,POTENTIAL COINS FOR BINANCE TRADING COMPETITION,1591212281,2,1
2760,gw0j4l,cocorico23,0.0,Arbitrage signals ClickCapture from orderbook aggregating  excnages  OTC desks,1591211859,0,1
2761,gw0fkd,brentoshiro,0.0,Matcha x SNX,1591211572,0,1
2762,gw0fhr,Salatini,0.0,Why are the biggest cryptocurrency exchanges based in malta,1591211565,9,1
2763,gw0f7n,rslucas03,0.0,Algorand Insurers investigate blockchain corroborates,1591211540,0,8
2764,gw0788,YungThroatSlayer,0.0,SHOULD I TRADE ETC,1591210909,0,1
2765,gvzmwh,LGBait,0.0,FLOYD Token,1591209288,0,1
2766,gvz0gs,MammothSir9,-0.3182,US Government Prediction Economy Faces Year Recovery  Trillion Loss From Coronavirus,1591207562,0,1
2767,gvz09i,Skull_Thrasher_,0.0,What are your thoughts on holding cryptos till the end of ,1591207546,0,1
2768,gvyqbe,blessive,-0.5106,Switzerland bank sets to begin offering crypto services,1591206731,0,1
2769,gvymka,[deleted],0.0,Hey guys  PassiveIncome,1591206410,0,1
2770,gvye6t,areddituser46,-0.4767,Cryptocurrency Exchange Coincheck Suffers Data Breach,1591205677,1,2
2771,gvy7nz,DappRadar,0.0,DeFi powers dapp ecosystem up  to  billion in May ,1591205123,0,1
2772,gvy3qy,magnusvollen,0.0,DeversiFi  DEx Integrates Starkware to Enable K Trades Per Second,1591204781,2,2
2773,gvxw62,newspaperreader,0.0,Gramfree is real,1591204106,1,1
2774,gvxq8o,Lugar1234,0.0,TO AMPLIFY THE BLM MOVEMENT CONSIDER THIS,1591203626,0,1
2775,gvxnia,riqelme,0.0,Matic Launches Mainnet Aiming to Bring More Firepower to Ethereum,1591203390,2,2
2776,gvxiyx,cscorvette,0.0,First EVER CasinoCoin YouTube Channel,1591202991,0,1
2777,gvx5ee,[deleted],0.0,crypto futureexchange trade invest ethereum,1591201779,0,1
2778,gvx4cw,areddituser46,0.7845,Bullish Bitcoin Open Interest and PutCall Ration Near OneYear Lows,1591201685,1,1
2779,gvx010,CurtD34,0.128,Cannabis Cryptocurrencies Trying to Make Coin in Legal Marijuana,1591201308,2,2
2780,gvwpnk,jpip510,0.0,Conan OBrien mentions Mining Bitcoin ,1591200355,2,1
2781,gvwnyl,statues_die_too,0.0,Bitcoins daily trading volume will match that of US equities and bonds by  CoinMetrics,1591200218,13,5
2782,gvwmdc,DannyColesYe,0.0,Crypto bots,1591200083,0,1
2783,gvwb27,Brimmstone2016,0.4019,Help A New Crypto Guy in Texas,1591199050,0,1
2784,gvw25m,[deleted],0.3182,Coinbase slashes USDC stablecoin rewards by nearly ,1591198235,0,3
2785,gvvofb,qoheletal,-0.6486,Is DAML dead already,1591196972,9,1
2786,gvvm4z,MammothSir9,-0.7579,Bitcoins Flash Rally to  was Fake Short the Cryptocurrency Warns Renowned Trader Bollinger,1591196770,0,1
2787,gvvjz1,[deleted],0.0,Never seen moving on screen,1591196579,2,0
2788,ha06ta,Barry_ETH,0.0,Open Blockchains The five pillars,1592297509,3,1
2789,ha0571,sendmorechuckberry,0.0,Bitcoin Price Retakes K as Analyst Says K Breakout May Be Next,1592297267,5,1
2790,ha01kj,Tricks_team,0.6124,How bitcoins gained their value,1592296837,0,1
2791,h9zwnj,CryptoDanO,0.0,Which Exchanges offer a option for Recurring or Scheduled Purchases,1592296252,0,1
2792,h9zd88,blessive,0.5994,Forget kittens Chainlinks verifiable randomness now brings fair winnings to ChainFaces golf games,1592293927,0,1
2793,h9zcnt,aurumherba,0.0,Warum  ein GROARTIGES Jahr fr BITCOIN ist  Kryptowhrungen News,1592293857,3,1
2794,h9zav9,InbloxEvents,0.6369,Webinar  Planning the best Crypto Portfolios,1592293631,0,1
2795,h9y5ba,ynotplay,0.0762,Why is Coinbase suggesting that you dont have to pay US taxes if you earned less than  in crypto for the year,1592288354,25,1
2796,h9y31b,nanooverbtc,0.0,SampP  measured in BTC change your unit of account,1592288068,2,1
2797,h9xw1y,nanooverbtc,0.0,The Fed says it is going to start buying individual corporate bonds hello zombie corporations,1592287224,0,1
2798,h9xoso,kilmarta,0.0,Review  tutorial of Bitfinex and Binance Lending,1592286320,0,1
2799,h9xmc8,MierenKnager,0.0,Cryptotipping bots for all subreddits,1592286030,8,1
2800,h9wndh,nima_sh,0.0,Bitcoin Whale Population Approaching September  Levels,1592282018,32,1
2801,h9vgcu,ClintEhrlich,0.2023,The Government Is Playing Around With a Hybrid Crypto Dollar  Virtual equivalent of taping gold to dollar bills,1592277423,8,1
2802,h9v7ak,Fuchsei,0.6369,EOSIO Games like this look promising,1592276518,0,1
2803,h9v6yn,soulstream4dayz,0.0,Synthetix Network Explanation,1592276485,12,1
2804,h9v6ny,snones,0.4215,New cypherpunk crypto movement gaining traction on chan,1592276457,10,1
2805,h9v1a6,blessive,0.0258,Bitcoin price recovers to reach  whats next,1592275932,0,1
2806,h9uwhi,ConsequenceImmediate,0.4215,New cypherpunk movement gaining traction on chan,1592275447,0,1
2807,h9uph4,Mrbitcoinnews22,0.0,Japanese Crypto Holders Prefer XRP Over ETH,1592274752,2,1
2808,h9ugu7,Minimums777,0.0,Converting BTC to Fiat,1592273886,0,1
2809,h9ubfz,bogsxz,0.7717,pretty cool training on how to make money by affiliate marketing,1592273347,0,1
2810,h9t83t,Rational_Optimist,0.3612,COMP The Native Asset of the Compound DeFi Protocol begins Its First Day of Trading,1592269516,2,1
2811,h9szp2,blessive,0.0,We Couldnt Wait for ETH  Blockchain Game Kronoverse Explains Move to Bitcoin SV,1592268726,0,1
2812,h9sq87,rahnnyc,0.0,XLM,1592267794,0,1
2814,h9s5cf,mnbuckeye87,-0.8074,Here I thought criminals only used BTC and Crypto for their illegal activities,1592265822,84,1
2816,h9rtvg,The-Crypto-Portal,0.4404,Media Titan w Over  Million Readers Tests RippleBacked Coil for Web Monetization Good for XRP,1592264760,2,1
2817,h9rijf,joenorwood77,0.0,Discussion of the Day Quantstamp QSP,1592263721,2,1
2818,h9rg98,mhella,0.0,COPE UP OR PACK UP Traditional Financial Institutions Scamper To Become Digital CurrencyEnabled Custodians,1592263520,0,1
2820,h9qsbo,Plutusedge15,0.0,CME Bitcoin Options Market Grew x in the Past Month  CoinDesk,1592261364,2,1
2821,h9qmv5,LilBrule,0.0,Scoot over Kardashians,1592260877,2,1
2822,h9qf1q,bttrcallnewnamesaul,0.0,Onfo Coin,1592260196,0,1
2823,h9qbnt,CryptoDerivativ,0.0,Arbitrage explained on live trading videos   to  BTC on BitMEX testnet all trades on camera with explanation,1592259890,0,1
2824,h9q4gp,nanooverbtc,0.836,Inactive Bitcoin Supply Reaches Year High Pointing to Bullish Sentiment,1592259224,5,1
2825,h9pvee,NewsAtBraveNewCoin,0.4404,Stack Sats  How Vimba makes it easy to Dollar Cost Average into Bitcoin,1592258408,0,1
2826,h9poql,onceEPIC,0.6369,Best ratio for investment BTCETHADA,1592257787,0,1
2827,h9poho,tommyfknshelby,0.0,BlockV VEE in use in pubs in Australia,1592257764,6,1
2829,h9p60z,cs260,0.4588,Grateful Bitcoin,1592256037,3,1
2830,h9oxop,[deleted],0.0,Dev Protocol receives M JPY from Monex Ventures and MIRAISE,1592255262,2,1
2831,h9orar,tpg1984,0.0,Coinbase Pro Withdrawals Disabled,1592254704,0,1
2832,h9opdc,monethical,0.0,Weekly Sectorial Report all sectors fall with BTC but not more than it  Monethical,1592254531,0,1
2833,h9okmp,HarryZKE,-0.34,Why do people go crazy for Bitcoin,1592254112,10,1
2834,h9of83,carbombe,0.0,A new cryptocurrency to invest in Pi,1592253636,0,1
2835,h9oeyp,PapaAlpaka,0.296,Cryptocurrency doesnt need to compete with Government Money,1592253614,2,1
2836,h9o9o6,Mrbitcoinnews22,0.0,Price Analysis  BTC ETH XRP BCH BSV LTC BNB EOS CRO ADA,1592253140,0,1
2837,h9o4f3,SnooAdvice6649,0.0,Local Bitcoin Depot ATM takes  of  as a fee,1592252685,0,1
2838,h9nze3,Scary-Pension,0.296,MMM FAMILY JOIN US NOW,1592252240,0,1
2839,h9nxs9,sylsau,-0.8074,Want to Get the Most Out of Bitcoin Beware of Your Worst Enemy Yourself,1592252088,3,1
2840,h9nwx5,areddituser46,0.0,Over  Million Bitcoin Longs Liquidated on BitMEX as Bitcoin Falls,1592252014,1,1
2841,h9nrw2,MammothSir9,0.128, Chinese Banks Say Legal Crypto Traders Accounts Will Not Be Frozen as Police Widen Crackdown,1592251584,0,1
2842,h9nr92,Cameronjames06,0.296,Join the Pi community,1592251531,2,0
2843,h9nme3,lillo9546,0.0,HODL ExchangeWallett setup,1592251119,0,1
2844,h9niob,EX-SCUDO,0.0,What Are Stablecoins Beginners Guide,1592250800,3,2
2845,h9nigk,OverKindheartedness0,0.0,New upcoming Digital Currency,1592250781,0,1
2846,h9nb7h,Pelesul,0.0,PI mining inv code PelesVlad,1592250134,0,1
2847,h9n95w,ecurrencyhodler,0.0,With CheckTemplateVerify Litecoin Looks to be the Testbed for Bitcoin Once Again,1592249955,0,1
2848,h9m7kv,paragismb,-0.5859,Wtf is GasToken,1592246751,2,1
2849,h9m39e,BlockGuy2020,-0.296,Avoid Crypto Volatility amp Get Paid in Stablecoins USDC  Circle Bitwage Partnership  Jonathan Chester Interview,1592246367,4,1
2850,h9lqle,drinksbeerdaily,0.0,Quant has partnered with Oracle as a Fintech Partner delivering Financial Services Infrastructure to Oracle FS clients,1592245251,0,1
2851,h9ljup,Max_Roc,-0.5267,How stupid was this,1592244646,2,1
2852,h9ligj,Yonny369,0.0,Business,1592244530,2,1
2853,h9l6mi,blessive,0.5106,US bank JPMorgan Bitcoin shows strong resilience even after massive price plunges cryptocurrency is here to stay,1592243522,0,1
2854,h9l5bb,drinksbeerdaily,0.0,Quant Network has partnered with Oracle as a Fintech partner delivering Financial Services Infrastructure to Oracle FS clients,1592243407,82,1
2855,h9kxm7,faizum,0.9719,Money bazaar finance customer care number  Money bazaar finance customer care number  Money bazaar finance customer care number  Money bazaar finance customer care number  Money bazaar finance cus,1592242734,8,1
2856,h9kv7d,-SHKKVN-,0.3612,is there anything like blockfolio for pc ,1592242520,0,1
2857,h9kt81,Mrbitcoinnews22,0.2263,Crypto Taxes Are Due July  but Be Careful  You May Need More Time,1592242347,0,1
2858,h9klno,Flywhenican,0.0,How much can you make mining cryptocurrency on your phone,1592241684,0,1
2859,h9kar0,[deleted],0.0,What is Proton Chain Introducing the Next Evolution in Fintech,1592240723,1,1
2860,h9k9ng,thelionshire,0.0,Blockchain Bites JPMorgan on Bitcoin South Korea on CBDCs and the Porn Industry on Crypto,1592240623,6,1
2861,h9k32z,[deleted],0.0,Revolut cryptocurrency policy changing,1592240042,0,1
2862,hh1l4e,[deleted],0.3182,Why Crypto Matters US Money Supply Soars Amid The Pandemic Whats Next,1593292221,1,3
2863,hh13yw,iSpartaco,0.0,Is your favourite crypto project a mouse or a lion Have it compared to our EU factoring elephant to see how it measures up in the animal kingdom,1593290587,1,2
