,id,author,vader,title,created_utc,num_comments,score
1569,fjnxeo,yandabanda,0.3818,Tether Lauds Market Cap Growth Amidst Cryptocurrency Pandemonium,1584376910,0,1
1570,fjnm0b,Monster_Chief17,0.0583,CZ and Justin Sun are moving millions of Steem tokens around like its no biggie while Binance users still cant withdraw their tokens These two loverboys just cant resist centralization no matter the cost,1584375754,56,1
1571,fjnkbr,LoveBlockChain1,0.34, Euro Value Airdrops,1584375583,0,1
1572,fjn7pp,unahmahhei6aeChahgh4,0.836,Is now a good time to buy some crypto,1584374342,2,1
1574,fjmosf,iamshashikumar,-0.4939,Baidu Employee Jailed for Mining Crypto on  Company Servers,1584372350,0,1
1575,fjmmc2,genius3edition,-0.6249,Correlating with the market is the worst thing that has happened to Bitcoin,1584372091,51,1
1576,fjmium,cryptographico,-0.5106,Angry Warlord An Interactive Mobile Game Built on The Telos Blockchain,1584371719,1,1
1577,fjm6bd,the_ats,0.7003,Roast my Fun Depth Chart Analysis like old times Just my musings,1584370385,2,1
1578,fjm68e,kaan1000,0.0772,I Want To Develop My Own Cryptocurrency,1584370376,0,1
1579,fjm294,geromeo,0.0,So wheres the bottom,1584369961,66,1
1580,fjm0vo,Kipyegonn,0.0,MakerDAO set auction price at  but DAI Premium may soar if Ethereum ETH Prices Tank,1584369797,1,1
1581,fjlvhn,namvu1990,0.0,Now available at your local convenient stores in London,1584369194,2,1
1582,fjlv75,maksutiard51,0.0,Visit this,1584369164,0,1
1583,fjlt2s,arryanna,0.2023,Top  DeFi information websites,1584368923,0,1
1584,fjlsut,cryptonewsguy,-0.6037,given the recent news of the FEDs who else is pivoting to BOMB,1584368901,3,1
1585,fjlpv7,ennel,0.0,anyone know what website is that,1584368556,4,1
1586,fjlofu,financeoptimum,-0.296,Fed Cuts Rates to Zero,1584368398,7,1
1587,fjlnug,StockPicksNYC,0.4404,Video showing how easy it is to spend cryptocurrency,1584368327,2,1
1588,fjlli4,Pauladgen,0.0,How Switzerland is Becoming a Blockchain Epicenter in Europe,1584368058,2,1
1589,ff2u5l,kinscrypto,0.6597,Ecoins invites you to join worlds fastest growing crypto I invite you to join the worlds fastest growing cryptocurrency  Ecoin designed by the exMicrosoft guys which boasts of worlds first AIdriven Emailbased Identity engine that can detect genuine emails from fake ones ensuring one per,1583620541,3,1
1590,ff2r2k,TheCryptoDivision,-0.296,How will the fed rate cuts impact different markets,1583620175,0,1
1591,ff2109,Quickmaker,0.4019,Frozen hotbit funds  Help,1583617166,0,1
1592,ff1jos,saimonreddit,0.0,Currently which exchanges do not require identity conformation,1583615188,0,1
1593,ff1gp3,pmr212,0.0,The District Weekly  March th,1583614862,0,1
1594,ff10s5,miamivicemami,0.0,CryptoTalk Is Spankchain the End of Pornhub,1583613048,1,1
1595,ff0zjt,blessive,0.0,Bitcoin BTC Repeats Similar Fractal Can This Lead to Similar Outcome,1583612903,1,1
1596,ff0ko7,coinsmash1,0.0772,Binance CEO says that people are buying up STEEM because they want more coins to vote,1583611261,31,1
1597,ff0ijk,bestasics,0.0,Antminer S  Ths and S Pro  Ths open for April batch Preorder,1583611017,1,1
1598,ff0go2,Sly21C,0.4404,What do you guys think of ETHBEAR Its essentially a x short on Ethereum done in an easy way Theres also ETHBULL which is x long on Ethereum,1583610798,28,1
1599,ff0gka,Electric_Billy,0.6369,Best place to park ethereum,1583610787,0,1
1600,fezwk7,bitcoininclear,0.0,On very large numbers and cryptocurrencies,1583608586,3,1
1601,fezwf2,Tokendatabase,0.0,API and CSV Files for Crypto Markets News and Analytics,1583608570,0,1
1602,fezmfx,CryptoPlanetVIP,0.0,How Jack Dorseys Potential Ouster from Twitter Could be a Boon for Crypto,1583607493,0,1
1603,fezlud,CryptoPlanetVIP,-0.128,A YouTuber in Mexico Kidnapped a Woman and Demand a Ransom in Bitcoin,1583607431,2,1
1604,fez8ma,Skieth123,0.0,How much for the usd coin,1583605958,0,1
1605,feypuz,Drinking_Out_of_Cups,0.2263,Pi Is it worth a try,1583603898,1,1
1606,feylhl,eleanor567,0.0,Cryptocurrency Empowering Billions For International Womens Day,1583603413,4,1
1607,feyb82,dootiedog,0.4215,Made this in my painting class a lot of people asked me what it was lol,1583602231,1,1
1608,fexzk5,BRAINIAC06,0.254,Pi currency is not worth a single penny but its worth a try,1583600869,0,1
1609,fex9z0,okean123,0.3612,Cointelegraph just roasted Justin Sun like nobody has ever before,1583597884,160,1
1610,fex1bs,ColinTalksCrypto,0.0,The majority of the Steem Takeover Witnesses have officially been being pushed out by real communityvoted Witnesses  are now from the communitys selection and not from HuobiPoloniexBinanceJustin Sun,1583596871,1,1
1611,fewyfu,daniyal2629,0.0,Investing in gold mining via blockchain games,1583596535,0,1
1612,fewooy,iqstockbroker1,0.0,Cryptocurrency,1583595392,0,1
1613,fewm1y,TaoOfSatoshi,0.0,BTC Hashrate on  Tron vs Steem Indias back in Bittrex DASHUSD and more  CATV LIVE,1583595074,0,1
1614,fevyi3,ruby152,0.0,BROWSE FASTER,1583592073,1,1
1615,fevsxr,blessive,0.0,Steem Community Takes Back Majority from Justin Sun,1583591294,0,1
1616,fevb6b,ColinTalksCrypto,-0.3818,The First Bitcoin Bull Run to Be Timed With a Recession Proof Coronavirus is an Economic Scapegoat,1583588746,20,1
1617,fevarz,ColinTalksCrypto,-0.3818, The First BitcoinCrypto Bull Run to Be Timed With a Recession Proof Coronavirus is an Economic Scapegoat,1583588688,0,1
1618,fevajc,j4c0p,0.2263,Someone Just Minted a DogeThemed Crypto Token Worth ,1583588653,20,1
1619,fev479,blessive,-0.0772,Coinbase CEO Solving these four problems will bring billions of people to crypto,1583587687,0,1
1620,fev46a,blessive,0.0,HBAR purchase blunder costs  to a trader,1583587685,0,1
1621,fev3dx,localname1,0.0,What Are Stablecoins,1583587564,4,1
1622,fev11p,kaileyhinz,0.296,How to Make Money With Cryptocurrency Trading Using Software,1583587211,0,1
1623,feu1z0,BENshakalaka,0.4588,Book Review Blockchain The Next Everything spoiler my new favorite Crypto book,1583581162,11,1
1624,fetzpj,hardforking,0.0,Cryptocurrency trading  Meet the market makers,1583580730,2,1
1625,fety2s,Nileke,0.0,Thinking promotional slogan of dForum on Mobile Cloud,1583580428,0,1
1626,fetgp9,cyber0funk,0.5574,Is CryptAPI trustworthy,1583577035,0,1
1627,fetg2c,blessive,0.0,CrossChain Liquidity a Major Movement in DeFi,1583576906,0,1
1628,fetcwl,polagon,0.539, of the worlds most crypto friendly banks,1583576304,11,1
1629,fetcju,JessDeclercq,0.0,Hiring,1583576234,0,1
1630,fet74a,Kera667,-0.1027,Institutional investors and other funds are willing to pay  more than the market price for the socalled virgin Bitcoins,1583575159,1,1
1631,fet67s,polagon,0.4939,Check out these  Bitcoin amp crypto friendly banks,1583574979,1,1
1632,fet34h,sylsau,0.0,The  Priorities for Bitcoin Development in the Coming Years,1583574374,5,1
1633,feszeu,Raulitiu,-0.4019,Canaan misleading ipo investors,1583573642,0,1
1634,fesy0i,okean123,-0.5106,Binance CEO Admonishes Justin Sun Over Steem Fiasco Transparency works,1583573363,4,1
1635,festxu,Kibu98,0.0,How many years it will take for people to convert to crypto,1583572612,20,1
1636,fescmb,SlowMist_Team,-0.2732,Beware of the Risk of USDT False Topup Due to Omni Counterfeit Coins,1583569240,0,1
1637,ferxb5,umerprince,0.0,Why Cryptocurrencies Are Such A Big Deal,1583566235,1,1
1638,ferg59,nanomind,-0.3612,TCP Episode   Enjin Deep Dive Blockchain Gaming NFT Disruption,1583563099,2,1
1639,fere8v,odhevra,-0.296,ForkGoogle Community Initiative Against Googles Pressure on Bitcoin,1583562767,2,1
1640,fer61u,bonyaserg,0.3818,For ease of calculation the INL cryptocurrency was developed backed by real estate,1583561354,0,1
1641,fepvqa,daznez,0.0,Which crypto merchant service providers do website owners here use,1583554222,6,1
1642,fepqko,cryptokal88,0.1027,Need help in recovering my lost BTC,1583553457,0,1
1643,fepia4,Shafique435,0.0,Cyptoros,1583552292,0,1
1644,fepemh,fiserman,0.0,Old Interview with Founder of Ethereum Vitalik Buterin,1583551759,2,1
1645,fep1h2,Enjoylife786,0.0,Crypto and blockchain daily news,1583549965,0,1
1646,feopra,Tgoldmania,0.7906, BEST OPPORTUNITY FOR EVERYONE WHO IS LOOKING TO MAKE INCOME FROM HOME EVERY SINGLE DAY,1583548336,0,1
1647,feoo5u,HongRiki,0.7184,When happen someone buy all the coin on an exchange,1583548120,2,1
1648,feo64t,gonggrabber,0.6204,ARK Messenger Fully Autonomous and Secure Chat Service on the ARK blockchain Real time secure chat completely private,1583545693,17,1
1649,fenwq7,HongRiki,-0.2732,When low liquidity exchange market boom is bought out,1583544477,2,1
1650,fenk6n,nc11NattyJuice,-0.1027,IOTA be like Hey we fucked up Want your money back Do our KYC,1583542856,2,1
1651,fenfox,EasyLivingChief,0.0,Building on Blockchain pt  ft Didi Taihuttu The Bitcoin Family,1583542262,2,1
1652,fen2ut,MonkeyWrenchZk,0.2263,Add lbj d Jk SW isdhjddbek,1583540674,2,1
1653,femynz,sirsmith148,-0.6124,Scam Probably,1583540172,38,1
1654,femx0w,joenorwood77,0.0,Bitcoin SV BSV,1583539954,17,1
1655,femvi9,jhulter,0.0,Next Bitcoin Check it Time for some mining,1583539741,0,1
1656,femqxz,__prison__mike__,0.0258,Help to fight COVID with your cryptomining computers,1583539164,2,1
1657,femf36,MetalButterflySocks,0.0,An unreasonable request,1583537717,0,1
1658,fem8ap,dithritiummain,0.0,Buccaneer Ethereums first privacy token airdrop,1583536899,0,1
1659,feliyr,johnpolite,0.0,THE REASON WHY YOUTUBE IS BANNING CRYPRO YOUYUBERS,1583533978,0,1
1660,felgea,blessive,0.3182,This occurrence on Bitcoins futures chart shows fresh  highs might be in sight,1583533690,0,1
1661,fel3pg,lucabovo26,0.0,Presento Kuailian per gli italiani presenti nel gruppo piattaforma che permette di guadagnare le commissioni generate da masternodes,1583532273,0,1
1662,feknfk,Clown_Will_Eat_Me,0.0,You merely adopted volatility,1583530466,79,1
1663,fekgce,Raulitiu,0.7351,French court says bitcoin is intangible asset just like money,1583529704,0,1
1664,fek5gn,frontalpha,0.0,Bitconnect tokens,1583528516,0,1
1665,fek325,hackercoolio,-0.6124,Sistemkoin is a scam exchange BEWARE,1583528255,2,1
1666,fek2bd,yoshichenu,0.0,Keysheet Crypto Product Reviews  NerdWallet for Crypto,1583528174,2,1
1667,fek0c3,hermanhugh666,-0.25,Pumping stocks on Pornhub with Jacob Wilensky,1583527957,2,1
1668,fejsfi,IBlackNightI,0.0,Question Why ,1583527104,0,1
1669,fejfzu,pandeybhvsh,0.0,Integrate your HYIP,1583525756,0,1
1670,fejamr,Reddit-shipchain,0.0,Shipchain Dispatch Report Q  Stay up to date with the th Industrial Revolution,1583525168,2,1
1671,fej85i,superCobraJet,-0.3818,The Fed Is Quarantining Some Cash to Fight the Coronavirus,1583524906,14,1
1672,fgsfkr,DappRadar,0.34,Ethereum is up  in terms of USD value Feb  vs Feb ,1583905912,0,1
1673,fgry8r,pmayall,0.0857,WOW Banned from ri o t a subreddit for having an alternative opinion isnt this what they accused cc of,1583903182,44,1
1674,fgrq29,Ozweegoraf,0.34,Are there any nonvet holders that see value in it,1583901999,0,1
1675,fgreio,kingscrown69,-0.4215,VCC Exchanges stops being no KYC Move to Bittrex ASAP,1583900374,2,1
1676,fgqp4v,yingchunbin,0.0,Ecoin airdrop  ECOIN    ECOIN per referral already listed on Probit,1583897042,0,1
1677,fgqp4o,yingchunbin,0.0,Ozcar airdrop  OCR    OCR per referral,1583897041,0,1
1678,fgq3r9,mrholmes1991,0.4588,What is Taproot and How Will it Benefit Bitcoin,1583894376,2,1
1679,fgpvkc,thevedgehead,0.0,The charts are showing that alt season is almost here,1583893393,2,1
1680,fgpuk6,blessive,0.0,Will The World Bow To Blockchain,1583893273,0,1
1681,fgp92i,frazev,0.0,Coinhelp,1583890740,0,1
1682,fgp5mq,twobcap,-0.296,No  DEX,1583890356,0,1
1683,fgp4du,jekpopulous2,-0.1027,MCO Visa now works with AppleGoogleSamsung Pay US Only,1583890214,30,1
1684,fgozoj,blessive,0.3612,Is Ethereum ETH Ready To Fall Below  Again,1583889690,0,1
1685,fgozl4,maharg2017,0.0,Crypto Chicken,1583889681,4,1
1686,fgou95,tyr034,0.0,BlueStone  When PoolTogether meets Compound a DeFi protocol built for fixed rate loan,1583889068,0,1
1687,fgosm8,gameboyalex,0.0,Aussie DeFi exchange scaling up to become EthMEX,1583888864,1,1
1688,fgocvw,sgtslaughterTV,0.3612,Absolute fail  from a scammer youtube livestream channel context inside They are changing the way they do things Be safe friends,1583887041,1,1
1689,fgnv28,rejectedstrawberry,0.0,how much data does bitcoin mining use,1583884957,16,1
1690,fgnf9q,Crypto-LEGION,-0.34,NEW CRYPTO KYC DATA LEAK ,1583883163,0,1
1691,fgnb9o,troytrojan01,0.0,Blockchain amp IoT Landscape in ,1583882716,1,1
1692,fgn38n,nanomind,0.0,Off The Chain  PlanB on Why Bitcoins StockToFlow Model Is Becoming More Accurate Over Time,1583881832,2,1
1693,fgn06x,joenorwood77,0.0,Civic CVC,1583881494,23,1
1694,fgmvof,Crypto-LEGION,-0.34,NEW KYC DATA LEAK TOOK PLACE ON THE NETWORK ,1583881010,0,1
1695,fgmlyi,goldjee,0.0,WereNow hiring a few people in the area to keep Data entry records of patients with Medicare Must be willing to get HIPAA certifiedits only  and takes an hr online Full and part time wk Messageme  for more details,1583880001,4,1
1696,fglu6f,katieoverall,0.0,Bittrex just announced CPC listing and the price shot up to  Is altcoin season here,1583877169,2,1
1697,fgls21,samistart,0.7184,Buy crypto with fiat,1583876959,0,1
1698,fgliyd,soceity,-0.886,Social media posts may have an impact on Bitcoin Bearish sentiment for Bitcoin has hit the highest level in over a year with  bearish posts in the past  hours,1583876015,0,1
1699,fgkul6,imp3order,0.0,This is gentleman,1583873525,1,1
1700,fgku0t,cpsasite2c,0.4404,Mirror Trading International is MTI Made Easy,1583873468,3,1
1701,fgk2m8,247BitcoinTrade,0.0,We buy and sell bitcoins,1583870720,2,1
1702,fgjzb6,PerkyThePorkyPig,0.0,BTSE Donates  to the BTCPay Project,1583870396,0,1
1703,fgjps9,bradymeegs,0.0,Cryptotraders logic,1583869445,1,1
1704,fgjlkq,UnknownEssence,0.0,Reminder Most Crypto Experts are Idiots,1583869019,292,1
1705,fgjg9n,Leonya9,-0.296,bitcoin for everyone  No investment needed,1583868503,3,1
1706,fgjcp7,Registeredopinion,-0.3612,How Cryptocurrency Whales Are Manipulating the Market,1583868155,2,1
1707,fgivys,naviyah999,0.0,cryptocurrency lesson   what is bitcoin and how to trade it,1583866501,2,1
1708,fgiva1,intheend999,0.0,kucoin scammed end of trying,1583866439,0,1
1709,fgir6h,BigM97,0.1027,Accidentally Used BTC address for Litecoin Withdrawal Need Help,1583866021,0,1
1710,fgimgn,DarkestChaos,0.2023,Will Bitcoins Halvening Save The Price  Oil Price Feud Rocks Markets  Daily Cryptocurrency News,1583865528,1,1
1711,fgigga,jobo22,0.0,Daily Fantasy Crypto,1583864893,0,1
1712,fgiaa2,Initial-Donkey,0.0,USDT is coming,1583864236,3,1
1713,fghz1v,ReySantosCrypto,0.0,The Xrp Stablecoin song live on YouTube featuring Hodgetwins xrp,1583863078,0,1
1714,fghisu,imp3order,0.4404,Heres some good news regarding covid,1583861411,2,1
1715,fghfnf,Andrewstephen2020,0.0,TRY IT,1583861093,0,1
1716,fgh6eh,BobWalsch,0.0,Last time under ,1583860139,2,1
1717,fgh5qe,mangoruby,0.0,USDT now  of all crypto projects,1583860078,2,1
1718,fggzvd,imp3order,0.4767,Bit of relief,1583859511,0,1
1719,fggq1v,Aftert1me,0.3818,IOTA  Coordinator has been resumed Read about the steps taken to protect Trinity users the role of the Coordinator amp the future development of IOTA,1583858504,0,1
1720,fggouh,Chrysalisair,0.3612,Crypto traders hot on Ethereum Classic cold on EOS reveals Stocktwits social data for ,1583858388,3,1
1721,fggoao,Raleigh_CA,0.0,Why I think Ren is a gamechanger for decentralized finance,1583858335,31,1
1722,fggmzu,TangledLinks,0.0,Vega Protocol wants DeFi without the drama  Decrypt,1583858195,1,1
1723,fggd5o,remykonings,0.4215,Progress on the Network and Data Unions framework a preview of the MyDiem DU and DATA tokenomics research amp development commencing  read the latest in the Streamr dev update,1583857209,0,1
1724,fgg46l,Nullius_123,-0.4215,Recession Bitcoin and the Central Banks,1583856276,14,1
1726,fgg3fa,ryan-adams84,-0.1531,Time Money Health Future  recession ,1583856196,1,1
1727,fgg2o7,Johnbriant124,0.0,The Real Spotcoin Story,1583856123,0,1
1728,fgfxpw,arryanna,0.0,DeFi only on Ethereum Projects on other blockchains,1583855613,6,1
1729,fgfw8d,AliantPayments,0.0,Are Cryptocurrency and Blockchain the Future of Global Payments,1583855459,0,1
1730,fgfw7h,Grustly,0.5267,When can Monopoly money be able to used as real money,1583855456,2,1
1731,fgfrpj,coinsmash1,0.0,FED just pumped more than the market cap of Bitcoin into the financial system,1583854969,122,1
1732,fgff90,Dared2Party,0.0,This could be the next big Currency,1583853608,0,1
1733,fgfcbz,rampatra,0.0,My First Mining PC with  GTX ,1583853287,1,1
1734,fgf7i0,classicsolution4,0.6369,RICHARD HEART BUYS  MILL HEX ON UNISWAP THEN BRAGS PRICE WENT UP,1583852767,0,1
1735,fgf5i6,cryptosarah14,0.3716,Daily reminder that short term fluctuations just like gold has short term fluctuations does not mean Bitcoin isnt a store of value In fact the only thing I would argue is its not just a store of value but actually an increasing store of value,1583852555,3,1
1736,fgf3tx,lambolifeofficial,0.0, Legit Reasons Why Cryptocurrency is the Future,1583852376,1,1
1737,fgewvg,weiDex,0.0,OTC Market Making software for our crosschain swaps,1583851585,0,1
1738,fgeqkw,wilfrigomez,0.7717,pretty cool training on how to make money as a marketer,1583850864,0,1
1739,fgemmt,DoinWhatImDoin,-0.8481,Lower the market goes the more people have to sell which exacerbates downside Adami,1583850417,1,1
1741,fgegi8,carleverett2,0.3612,Carbon Credits are Coming to Crypto,1583849727,0,1
1742,fgebin,derekforealjr,0.0,Why are you withdrawing btc,1583849136,1,1
1743,fge6vi,ankit-ta,0.0,In the last  days ETH price fell by  Time for another round of liquidations,1583848603,0,1
1744,fge6n9,chainclash,0.0,Expectations vs Reality  Why Bitcoins price went down,1583848576,1,1
1745,fge44e,nstratz,0.34,IOTA value transactions will resume PM CET Trinity hack aftermath,1583848274,67,1
1746,fge33p,daddy-pancake20,0.0,Taxes,1583848146,0,1
1747,fge06l,sharonan,0.0,Dev Update  This month in Conceal March ,1583847806,0,1
1748,fgdh41,bexterexter,-0.3182,How do fiat reserves for stablecoins work Im confused,1583845386,0,1
1749,fgdfum,CryptoUncut,0.7184,Come and win BTC  ETH by opening the PATCOIN treasure boxes,1583845222,1,1
1750,fgch6v,Johndrc,0.0,Bitcoin myth is real,1583840421,1,1
1751,fgc8z6,2Panik,-0.2057,Didnt age well again,1583839181,2,1
1752,fgc5ed,sylsau,0.4782,Bitcoin Price Drops Sharply but Dont Worry You Still Own the Same Amount of BTC,1583838634,2,1
1754,fnhkdz,enqvistx,0.3818,Introducing COINQVEST Enterprise Cryptocurrency Payment Processing on Stellar Accept Digital Currencies Settle in USD EUR NGN,1584958275,0,1
1755,fngqyb,KidInOldManBody,0.6908,Why Im bullish for crypto,1584953504,4,1
1756,fngj9u,itsblockchain,0.4549,Bitcoin reclaimed major weekly support Is Recovery possible to  before halving,1584952241,0,1
1757,fnfxbt,blessive,-0.3182,Blockchain managers in US part of critical infrastructure workforce,1584948548,0,1
1758,fnfw45,gdj11,0.4215,Whats the easiest way for people in the USA to purchase Tether USDT,1584948337,0,1
1759,fnfvjp,Trade77,0.8647,HeartNumber is established by AI and Artificial Neural Network leader Sangyoul Kim and it is redefining algorithmic trading HEART NUMBER  Smart Investing trading blockchaintechnology AI,1584948241,0,1
1760,fnfvau,enwapame,0.0,Earn Bitcoin Without Investment,1584948198,0,1
1761,fnfufo,fatsupport,-0.6124,Obvious Youtube Crypto Scam,1584948060,0,1
1762,fnflkw,xmr-rusticbison,0.0,How to use a trading bot in a PP market for BTCUSDT,1584946656,0,1
1763,fnf10o,MissionKale,-0.4466,Anyone here had NO prior experience in Blockchain and then moved to a Blockchaincrypto job,1584943406,0,1
1764,fnf0o7,Franklinthemanlol,0.0,A New Beginning For KuCoin,1584943357,4,1
1765,fnegpv,anabonehpets,0.296,Is USDC stable enough to use as a savings account,1584940394,0,1
1766,fne62q,soulstream4dayz,-0.296,Poll Is This The Bottom or Will Bitcoin Go Lower,1584938938,4,1
1767,fndlj4,GeneralZex,0.0,How does one reconcile dust on their taxes,1584936174,4,1
1768,fndbjo,The-Crypto-Portal,-0.34,InterestingWhat do you think Appealing to the average Joe in the cryptocurrency spaceIt will be interesting to see what happens on the back end after the financial crisis dies down,1584934908,0,1
1769,fncxic,harishrupda,0.0,i really thought they were storm troopers,1584933152,3,1
1770,fncq22,amithasan1994,0.0,How to get million YouTube subscribers video  Intro  step by step  to  million,1584932252,1,1
1771,fncad9,Thewisertime,0.296,Join my team on pi and start earning pi,1584930372,2,1
1772,fnbeog,blessive,0.4927,Bitcoin more attractive as the coronavirus spreads study,1584926778,2,1
1773,fnbaff,beechwillow,-0.128,Two high cryptocurrency exchanges have reported distributed denialofservice DDoS assaults on their programs within the final  hours,1584926298,10,1
1775,fnb51i,tech510,0.5574,Has anyone use vertex capital Or had any positive experience with them I just signed up and the thing that has me a little sketched out is that I have to screenshot I deposit into my account with them in order to start investing,1584925673,7,1
1776,fna2c7,TheNewBo,0.0,Is anyone developing a CYPTOCURRENTCY right now,1584921530,2,1
1777,fn9zx2,joenorwood77,0.0,Discussion of the Day VeChain VET,1584921269,137,1
1778,fn9tl5,spirtdica,0.6369,Best exchange for tiny amounts of fork coins BCH BSV etc,1584920583,12,1
1779,fn9fv4,HomeLandMiner,-0.5106,Now Im only offering BTC Will take ZEC,1584919142,14,1
1780,fn9awy,munmun-dog7,0.4588,Pls help,1584918619,7,1
1781,fn99el,Tgoldmania,0.0,HELLO ARE YOU INTO ONLINE MONEYMAKING BUSINESS,1584918460,0,1
1782,fn8sdu,brantlymillegan,0.0,What I Learned at ETHVR Dispatches from a VRBased Ethereum Meetup,1584916704,2,1
1783,fn8k8t,CryptoYoda13,0.0,McFee amp Pompliano,1584915903,1,1
1784,fn87le,telorecomiendo,0.0,Crypto wall street,1584914655,3,1
1785,fn7khw,blessive,0.0387,Kava Wants to Challenge MakerDAO but Will it Work,1584912370,0,1
1786,fn74f1,Yorkshire80,0.0,Theres a clearing period for COINBASE withdrawals now,1584910811,0,1
1787,fn6yc5,sylsau,0.34,This Economic Crisis Will Be Different Because Bitcoin Is Here to Help You Protect Your Money,1584910244,13,1
1788,fn6ojl,Nilla_Wafers,0.8658,Does anyone know wherehow I can buy precious metals with cryptos,1584909258,2,1
1789,fn6odz,nafisepari,0.4404,Good Project,1584909245,0,1
1790,fn6n5r,pure3v1L,-0.5423,Let them choke on it,1584909132,0,1
1791,fn6jdk,blessive,0.1531,Top traders make a strong case for why Bitcoin could drop sub by ,1584908763,0,1
1792,fn6iu0,Brett-Collins,0.3612,NonKYC Exchange like BitMex for USA Residents,1584908712,4,1
1793,fn6a03,shewmai,0.128,Bank of America took out  from my checking account for an unknown legal order,1584907868,3,1
1794,fn5wzq,troytrojan01,0.5994,Ucam  Blockchain Security Camera is Ready for Prime Time,1584906686,0,1
1795,fn5s9l,Corneafx,0.3612,HEX juicy importance,1584906242,0,1
1796,fn5mjm,Sonovabicz,0.7555,PLEASE HELP KuCoin liquidates at will How do they calculate the MARK PRICE for Margin,1584905723,0,1
1797,fn5in9,Crevative,-0.8096,MUST WATCH Venezuelas currency is so worthless children are now playing with the worthless notes in the street Unprecedented debt globally will be inflated away the end of the pure fiat currency system is near,1584905371,0,1
1798,fn5blb,denkomanceski,0.0,Hurry,1584904706,0,1
1799,fn5818,localname1,0.8038,Stores accepting Bitcoin Some accept other cryptocurrencies This is HUGE,1584904359,36,1
1800,fn4nqn,intothecryptoverse,0.0,Bitcoin Overlaying the market cycle ROI  Is Bitcoin still on track,1584902465,3,1
1801,fn4ncy,Breadstick4,0.8807,best places to buy,1584902430,8,1
1802,fn4ksu,Thavash,0.0,ETH  BTC Update  March ,1584902181,2,1
1803,fn4ecu,blessive,-0.6369,Tezos Decided to Stop Fighting Lawsuits Will Reach Settlements,1584901574,0,1
1804,fn3r1w,CryptoPlanetVIP,-0.296,What is Coronavirus Coverage Distracting Us From,1584899477,0,1
1805,fn3nvk,ethereumcpw,0.0,What is Golem GNT  Distributed Computing Infrastructure  Beginners Guide,1584899172,10,1
1806,fn3k6p,cryptonaut101,0.4576,The Most Promising Blockchain Healthcare Projects ,1584898818,0,1
1807,fn3dhq,mqrasi,0.0,Looking forward to yet another ERC token to buy and sell infection,1584898171,3,1
1808,fn2to4,PerkyThePorkyPig,0.0,PrimeXBT  Commodities Indices and Forex with Bitcoin,1584896240,2,1
1809,fn2fyb,FILLAS247,0.4019,Hey guys Can you help me get karma,1584894867,0,1
1810,fn2e7o,oldgreg4488,-0.5106,Am I Dumb For Buying,1584894704,69,1
1811,fn299d,Uncrown,-0.4215,Cryptocurrency ban was lifted in India we are organizing cryptocurrency awareness seminars in its top engineering amp technology colleges,1584894206,2,1
1812,fn25kt,suuwap,0.0,Selling mega file filled wit financial books and other novelties only usd in btc,1584893838,3,1
1813,fn241q,telorecomiendo,-0.5574,Russia New Bill Could Put Blanket Ban on Cryptocurrency Issuance amp Sale,1584893673,3,1
1814,fn1st7,PeedyGonzalez,0.0,Diversified Staking Operation,1584892517,0,1
1815,fn1mgz,MRbmx1,0.0,Offers  discounts in some currencies ETH,1584891661,1,1
1816,fn1he9,myguywer,0.4404,As a fulltime traveler Crypto IS my safe haven,1584890976,0,1
1817,fn17t3,Mjjjokes,0.25,How often do investors invest in the company that created a cryptocurrency rather than just the cryptocurrency itself,1584889664,4,1
1818,fn11m1,grbergeron,0.0,Price Swing,1584888873,0,1
1819,fn0ig4,UnidentifiedTarget,-0.4939,In US  What coin type should I exchange into for Economic Collapse,1584886283,1,1
1821,fn05jr,hardforking,-0.6249,Financial crisis and Crypto CEOs of Crypto and traditional finance com,1584884519,1,1
1822,fn026r,garyabicknell,0.0,BBVA Online Checking,1584884120,0,1
1823,fmzwek,Qwahzi,-0.5423,Announcing Counter Strike Global Offensive with Nano payouts,1584883391,10,1
1824,fmzspm,riqelme,0.0,Facebooks Libra is Back  Heres What You Need to Know,1584882927,1,1
1825,fmzphp,yandabanda,0.4939,Besides Bitcoin Which Sectors Are Showing Strength During the Coronavirus Pandemic,1584882530,0,1
