,id,author,vader,title,created_utc,num_comments,score
0,i6s3v9,AzraelSR,0.0,Ive just started using pi network and mining coin what do you guys think will be the fate of pi in the future,1597010349,0,1
1,i6rzi3,blessive,0.4404,EOS price falls below  price pump ahead,1597009926,0,1
2,i6rvha,Timetraveler62540000,0.4215,That time when shaquille o neal shilled quarkcoin lol,1597009535,1,1
3,i6rr65,GenghisEmmett,0.4168,The Case for Privacy Coins even if youre not a criminal,1597009136,2,1
4,i6r96a,monethical,-0.5106,Top and worst coins according to trend and momentum indicators August th,1597007423,0,1
5,i6qvkq,Alfox73,0.4767,Any intelligence on Blockstack stx Why Coinbase is considering to list it,1597006146,2,1
6,i6quc1,pgh_ski,0.0,DEFCON  Building a Microcontroller Bitcoin Address Generator,1597006022,0,1
7,i6qofg,ShotBot,0.0,Craig Wright Bitcoin is not a cryptocurrency,1597005467,5,1
8,i6qkow,yinusa04,0.296,Make Money by doing simple tasks,1597005119,0,1
9,i6q9ea,flammable_donut,0.0,Dont do crypto transactions over TOR,1597004033,2,1
11,i6q4ih,MammothSir9,-0.4588,NasdaqListed Company Sued for Backing  Billion Loans With  Tons of Fake Gold,1597003572,0,1
12,i6q2o1,dysseus,0.0,Whats going on here,1597003409,7,1
13,i6q1yy,1000thdisciple,0.0,Cryptomining vs cryptotrading which is more lucrative,1597003348,0,1
14,i6pxwd,NorskKiwi,0.0,South Korea Reviving Tourism and User Privacy Via Blockchain Based ID Systems,1597002981,3,1
15,i6pueb,kellysmith,-0.4404,The Ethereum SupplyGate scandal  For the past  years everyone relied on Etherscan for ETH supply data,1597002679,43,1
16,i6phvh,Mrbitcoinnews22,0.2023,Top  Cryptocurrencies to Watch This Week BTC ETH XRP XMR XTZ,1597001543,0,1
17,i6phhe,ShotBot,0.4588,In retrospect this was a massive  year long head and shoulders pattern,1597001505,26,1
18,i6pgiy,ashandrea,0.0,Next ruling crypto currency,1597001422,0,1
19,i6pazn,scara89,0.0,KIN deleting one  decimal ,1597000914,10,1
20,i6oo57,TLDRTaylor,0.0,If You Held Bitcoin on December st ,1596998872,2,1
21,i6omuk,boraerol76,0.0,Portland Stock Office LLC,1596998756,0,1
22,i6olp6,jzpur,0.0,DeFi Token of the Week  DeFi News,1596998650,0,1
23,i6oinj,ethereumflow,0.0,Researchers Claim Crypto Exchange Hacks Happen in Three Ways,1596998379,0,1
24,i6oe1l,V-Highwind,0.1531,When your heart stops beating,1596997965,4,1
25,i6oahn,BitcoinW0rld,0.0516,Chainlink Price Sets New Record As It Reaches ,1596997636,1,1
26,i6oa61,callmebonkers1984,-0.5994,can anyone sell me gbp of SXP OR any well known altcoin,1596997607,0,1
27,i6o49y,cryptojeetu,-0.1027,Why banks are the problem and Bitcoin is the solution,1596997054,1,1
28,i6o2fc,ALESTA1,0.0,What is defi,1596996884,2,1
30,i6nr2g,electrominer2,-0.4173,So tron sucks,1596995854,0,1
31,i6nlav,VariousPreparation43,0.0,  ,1596995321,0,1
32,i6nl1x,mrchamisa,0.0,Have you guys heqrd of ChainEX,1596995296,3,1
33,i6n97d,BusinessCow6786,0.0,Digital yuan is going ahead to trial in Chinas big testing firms,1596994176,1,1
34,i6n8kt,crazyguy43,-0.4767,Should I sell my ChainLink holdings after making  profits,1596994116,0,1
35,i6mzlz,sotaponi,0.25,MXC exchange is holding Sora XOR tokens hostage and the token holders desperately need help  public attention worth millions in USD,1596993271,0,1
36,i6mx5g,Plutusedge15,-0.4939,Bitcoins Stolen Revolution  CoinDesk,1596993040,2,1
37,i6mud0,MammothSir9,0.0,Germany Begins Closing Down All Unlicensed Bitcoin ATMs,1596992783,2,1
38,i6msko,taquitaqui,-0.6124,The tube scam starting at only  ETH Can participate only one the time,1596992630,8,1
39,i6mcdv,girlshero,0.0,What is CHAINLINK,1596991046,17,1
41,i6m0ix,AleccioIsland,0.2023,Which are the top  crypto hedge funds and what are their investment paradigms,1596989880,0,1
42,i6lztl,nhphotog,0.0,Newbie here new to day trading,1596989804,2,1
43,i6lyif,Ragtag_fleet,0.0,Goldman Sachs Cryptocurrency Possible Collaboration With JPMorgan and Facebook  News Bitcoin News,1596989672,7,1
44,i6lxmo,Ragtag_fleet,0.0,Major Korean Bank to Offer Cryptocurrency Custody Services,1596989589,0,1
45,i6lkba,nhphotog,0.431,Newbie not doing too bad on coinbase,1596988289,2,1
46,i6lgpt,bill_hilly,0.3182,If you buy bitcoin from a bitcoin ATM is there a timeframe in which you have to sign up with your identity to claim it or can you just keep the paper slip indefinitely,1596987927,2,1
47,i6lc6a,SpeedyChingChong,0.4716, yo whos really really eager to start with crypto,1596987470,87,1
49,i6klvj,CommercialTouch9,0.0,South Korean Highways Will Have BlockchainPowered Toll Payments,1596984779,85,1
50,i6klho,blessive,0.4588,Tezos Explodes To Month High Is  Upcoming XTZ Price Analysis,1596984737,0,1
51,i6kj99,yusufinolis,0.6369,Best way of earning crypto,1596984507,0,1
52,i6kbbb,dodovano,-0.5859,Caught this as an ad on Youtube Does anyone even believe such scams these days,1596983648,12,1
53,i6k7ej,AgentBathroom,0.0,Blockpass PASS under k Marketcap,1596983238,0,1
54,i6k6ag,Plutusedge15,0.0,Mobile DeFi and the Shift Toward SelfSovereignty,1596983116,0,1
55,i6k0sw,s_technologies,0.0,Does the marketcap of a coin always suggest the price,1596982526,0,1
57,i6jo7z,sylsau,0.0,The K Zone Is Now the Key to Bitcoins Price Evolution in the Coming Weeks,1596981172,2,1
58,i6jeg8,mrlarryanders,0.4019,Interesting investments August ,1596980019,13,1
59,i6jdh2,WorkingLime,0.0,Venezuela Weekly around  BTC are traded using LocalBitcoin from Bs Venezuela offical currency to BTC and from BTC to Bs Last week it was  BTC One BTC is  Bs Monthly minimum wage is around  USD,1596979911,42,1
60,i6iybv,907C,0.0,rDeFiPie is now live,1596978090,1,1
61,i6iwpz,Faruq_service,0.4215,UNITED CRYPTO ALLIANCE,1596977916,0,1
62,i6isrd,mrpeanutbutter123123,0.0,What country would you say is most in need of crypto,1596977420,0,1
63,i6iop5,NapBots,0.3612,IDEX Raises M to Rebuild Hybrid Exchange for Algorithmic Traders The seed expense will be utilised to restart the Ethereumdependent trade so algorithmic traders can greater use the system,1596976880,1,1
64,i6ik4d,GV470,-0.5106,Earn Crypto by gaming  a beginners guide to Angry Warlord,1596976261,9,1
65,i6iehb,Fun2Crypt,-0.0516,Buying Crypto Currency in the US Noob,1596975499,0,1
66,i6i9av,bzhdl94,-0.7096,Crypto Fear and greed index data,1596974772,0,1
67,i6i991,BazingaBen,0.0,The quest to liberate  of bitcoin from an old ZIP file,1596974766,6,1
68,i6i7wb,CryptoLouise,0.4588,BlockFi How to Earn up to  Interest Trade amp Borrow,1596974587,2,1
69,i6htc5,adamov10,0.296,Bitcoin or Alts Where to put my money,1596972426,0,1
70,i6hocp,biltu32,0.836,Is it still a good time to buy some chains,1596971649,0,1
71,i6hnvw,JefeDanxer,0.4019,Whats the safest way for storing big amounts of USDT,1596971569,50,1
72,i6hmdt,CryptopreneurDHILLON,0.6369,Best Mining,1596971347,0,1
73,i6hl0t,mooz2020_,0.6705,pretty cool training on how to earn side income as a manager in cryptocurrency,1596971136,0,1
74,i6hk9j,dev_lurve,-0.5423,Do you use the trailing stop loss,1596971030,0,1
75,i6hf1s,arijitdas,-0.5574,OKEx CEO Says Indian Crypto Ban Unlikely Has  Scenarios in Mind,1596970184,0,1
76,i6heeh,trenbonz,0.8613,DID ALL THESE GREAT MINDS USE PARTS OF THERE BRAIN WE CANT TAP INTO WERE THEY GETTING INFORMATION FROM ANOTHER WORLD PLACE OR DIMENSION MAYBE THE UNIVERSE OF KNOWLEDGE WHY CANT WE USE MORE THEN  OF OUR BRAINS COULD THEY BREAK BITCOINS CRYPTOLOGYEinstein nicolatesla halking,1596970074,0,1
77,i6h81m,trenbonz,0.8613,DID ALL THESE GREAT MINDS USE PARTS OF THERE BRAIN WE CANT TAP INTO WERE THEY GETTING INFORMATION FROM ANOTHER WORLD PLACE OR DIMENSION MAYBE THE UNIVERSE OF KNOWLEDGE WHY CANT WE USE MORE THEN  OF OUR BRAINS COULD THEY BREAK BITCOINS CRYPTOLOGYEinstein nicolatesla stephenhalking ,1596969018,0,1
78,iakzsd,Sticky2k,0.0,Bittrex keeps telling me they are unable to process my deposits Anyone have this issue before,1597546570,0,1
79,iakxpt,blessive,0.6249,Bulls relentless to push Bitcoin price above ,1597546328,0,1
80,iakuw1,evaldez14,0.8807,What is the Best Cryptocurrency Exchange To Buy Bitcoin and Altcoins in   ULTIMATE GUIDE,1597545994,2,1
81,iakler,skimdelakrimloco,0.7184,Should I buy some CRV curve,1597544902,0,1
82,iakgxk,daniel29ty,0.1139,DONT MISS OUT ON THE LAST STAGE OF USDD TOKEN SALES,1597544404,2,1
83,iakeso,Cryptolexicon,0.8316,Name and Praise Best customer service in the Crypto space,1597544162,6,1
84,iak80e,MediumAdhesiveness5,0.34,United States is suing  Virtual Currency Assets,1597543397,3,1
85,iajkch,pop_tea,0.0,Bot to earn bitcoin,1597540723,0,1
86,iairyb,nanooverbtc,0.4939,The printer is our friend,1597537641,1,1
87,iaihfj,Miotares,0.0,I currently have  to spend What would you suggest I thought about  BTC and ETH,1597536521,0,1
88,iaib6e,EvilfaceDJ,0.7184,Juat a few reasons to buy bitcoin IMO,1597535880,3,1
89,iai831,blessive,0.5789,YAM Finance Announces Protocol Migration Plan Will This Save The Crashing Project,1597535544,0,1
90,iai67u,LimbBizkit,0.2732,Bulls Stampede Toward K Bitcoin Price as Weekly Close Approaches,1597535355,0,1
91,iahu1s,JackArmstrongBJJ,0.0,Can someone explain to me how HotBit works,1597534099,1,1
92,iahptr,sdatwa87,0.6369,What best crypto bots that work with binance futures or bitmex,1597533671,0,1
93,iahh7f,MammothSir9,0.0,Mike Novogratzs Galaxy Digital Holdings Reports  Million Income for Q Weve Crossed the Rubicon,1597532772,0,1
94,iahc0f,banterpanther,0.0,Hotbit held me hostage,1597532247,10,1
95,iah4i3,teenagechrist07,0.0,Mining BitcoinDiamond BCD,1597531476,0,1
96,iagqek,ethereumflow,-0.2732,Record Ethereum Network Use and Gas Fees Pose Risk to DeFi Expansion,1597530042,2,1
97,iagood,kellysmith,0.4767,ELI How Avalanche AVAX staking rewards will work,1597529870,0,1
98,iagct5,Careful_Musician_402,0.0,Trading,1597528708,0,1
99,iag98o,alliswell19,0.0,Start with Bitcoin first,1597528369,27,1
100,iag2r5,AlDrgm,0.4404,Oh so can i make profit,1597527743,0,1
101,iafku4,smoljanovic,0.0,The Cosmos ATOM  Cryptocurrency Guide,1597526004,2,1
102,iafjf2,LimbBizkit,-0.4767,Millionaire Bitcoin Whale Places Crypto Market on Notice Warns Big Losses Coming to Newbie Traders,1597525871,12,1
103,iafhj7,electrominer2,0.4215,Vitalik NFT for sale for charity,1597525699,0,1
104,iafcb2,LimbBizkit,-0.5994,Russian Lawmaker Crypto Pay Could Destroy the Financial System,1597525206,0,1
105,iafc1r,yippykaiyay012,0.0,DLT based cobot by CRETEC for industry  now available Can be paid in cryptocurrency,1597525178,3,1
106,iaf47s,myhaxdontwork,-0.6124,Worthless digital money they said Keep hating,1597524390,11,1
107,iaf23i,Mobilenewsflash,0.2263, Idena iDNA decentralized identities are validated so far it is about to become the most decentralized blockchain,1597524184,8,1
108,iaf0gj,yippykaiyay012,0.0,IOTA based cobot by CRETEC for industry  now available,1597524025,0,1
109,iadtyj,traderalert,0.0,Orchid Doubles,1597520030,0,1
111,iadpbv,DenisReid2020,0.0,New coin,1597519589,0,1
112,iadnsq,DenisReid2020,0.0,Use my id,1597519451,0,1
113,iadiux,Wololo242,0.0,Why do all Blockchain ETFs have zero actual blockchain holdings,1597519008,9,1
114,iadfzs,LFSW,0.0,Me watching the market take off while my holdings do nothing,1597518756,59,1
115,iad8q2,cow_durr,0.0,What are some Credible crypto sources,1597518108,8,1
116,iad0qf,Haktir,0.5719,The perfect storm,1597517397,0,1
117,iacod7,cryptotapas,0.6369,How to spot the best crypto to invest for the next decade,1597516285,6,1
118,iachvh,arijitdas,-0.9157,Bitcoin Fear amp Greed Index shows that past month was FEAR and now its getting Extreme Greed,1597515703,9,1
119,iacf9m,cyger,0.0,Warren Buffett Buying Gold May Push Bitcoin to K Investors Say,1597515470,8,1
120,iace4n,nickjlongo,0.4939,Reddits big cryptocurrency move is an exciting test,1597515368,2,1
121,iac9am,cryptoadventura,0.3612,The Importance of System Stability of Crypto Exchanges,1597514945,0,1
122,iac8jv,chilledmyspine,0.0,The US Post Office Files a Patent for a BlockchainBased Voting System,1597514881,36,1
123,iac79k,MammothSir9,0.0,Law Firm Sees Crypto Investors Flocking to St Kitts amp Nevis for Dual Citizenship,1597514773,0,1
124,iac6hf,fan_of_hakiksexydays,0.7096,That sweet moment when your profit gets past your acquisition cost,1597514705,6,1
125,iac2r3,BlindedReason,0.2584,I cant argue with that,1597514385,3,1
126,iac2bd,fan_of_hakiksexydays,0.7096,That sweet moment when your profit gets past your acquisition costs,1597514346,2,1
127,iac24g,pmr212,0.0,districtx  The District Weekly  August th,1597514328,0,1
128,iac1jw,ChandlerMc,0.4215,Lol Waves,1597514273,5,1
129,iabtcv,The5talker,0.0,is smartexploit legit,1597513539,0,1
130,iabm5i,user444tify,0.0516,Use Psychology to Reduce Pump n Dumps,1597512894,4,1
131,iablej,MemoryDealers,0.0,Milton Friedman  Understanding Inflation,1597512829,7,1
132,iabdb6,Plutusedge15,0.0,Will Ethereum Proof of Work Keep Running,1597512123,0,1
133,iab1mn,eosmcdee,0.0, in fees in ONE ETH transaction can anyone explain why,1597511072,15,1
134,iaap1y,hey_its_meeee,-0.5622,Okay can someone can explain WTF is going on with Chainlink ,1597509947,2,1
135,iaakm0,sylsau,0.6249,Voting Donald Trump or Joe Biden Is the Same Dare to Vote Bitcoin for a Great Reset,1597509553,13,1
136,iaajms,beonk,0.802,Best long term investment,1597509461,98,1
137,iaa9r8,mehdi313,0.0,Im predicting Stellar Lumen will rise against Bitcoin in coming days,1597508558,5,1
138,iaa8oa,Opf91,0.6597,Optimizing taxes on crypto gains in Canada,1597508465,0,1
139,iaa7qi,mehdi313,0.0,Im predicting Stellar will rise against Bitcoin in coming days,1597508381,2,1
140,iaa5cv,brrnskii,0.836,Which cryptos to buy for longterm profit,1597508147,0,1
141,iaa1re,HumbleCorrespondent,0.3612,Are central bankers ready to eliminate the middleman and lend directly to us At cost,1597507807,2,1
142,ia9yth,slywalkers,-0.5664,Satoshi Nakamoto when asked You will not find a solution to political problems in cryptography,1597507527,151,1
143,ia9q84,blessive,-0.0772,This data suggests Ethereums intense uptrend may stall as it reaches ,1597506732,0,1
144,ia9p4u,lilman4003,0.0,Pi,1597506638,0,1
145,ia9jlj,kellysmith,0.0,Ask Crypto Why is this coin same price on every exchange,1597506115,29,1
146,ia9h8s,A_lot_of_damage123,0.4404,Good stuff,1597505890,0,1
147,ia9fu8,DudzTx,0.3612,ICON  ICX  Get ready for MyID,1597505758,1,1
148,ia9e3w,nahuelior,0.296,What to do with money,1597505590,20,1
149,ia9af8,PM_me_catpics,0.0,Can the banks seize my crypto,1597505242,27,1
150,ia988d,Dericus,0.0,BitBoy reviews HPB,1597505032,2,1
151,ia95qg,OtheDreamer,0.5719,Os Guide to Huge Gains for the Average Investor,1597504809,2,1
152,ia8zl2,Tirpitz-UKW,-0.3612,Bamboozled for honey,1597504231,0,1
153,ia8x0t,MammothSir9,0.7328,Bitcoin and Tesla Americas Most Loved Assets on Tradingview,1597503982,2,1
154,ia8ul7,anmolgaur45,0.0,One of the leading cryptocurrency exchanges in India WazirX today said they are gearing up to develop and launch their first decentralized finance product in partnership with the Matic network,1597503752,5,1
155,ia8s8o,MarikoCooley,-0.128,MXC Exchanges corrupt actions force clients to lose money on XOR SORA ,1597503532,1,1
156,ia8pm9,Lil_Natsu,0.7845,Is buying x long bull tokens from ftx for example considered margin trading,1597503273,0,1
157,ia8pcx,HadiPixel,0.0,Have you ever heard about Pi CryptoCurrency the latest and hottest trend in the market of ,1597503249,2,1
158,ia8p5f,moldyjellybean,0.0,Cheap hybrid car that can store your MTB inside the car Prius RAV hybrid,1597503226,0,1
159,ia8cn1,clayton1012111,-0.7845,Hong Kong Thieves rob HK from Bitcoin ATMs they should have taken the Bitcoin,1597502001,2,1
160,ia8c3l,clayton1012111,-0.7845,Hong Kong Thieves rob HK from Bitcoin ATMs They should have taken the Bitcoin,1597501945,0,1
161,ia7w5d,nugget_alex,0.0, Subs Hangout BTC ETH DeFi Gold amp Silver  The Job Isnt Done Yet,1597500296,1,1
162,ia7m5h,jullovich,0.3182,Romain GrosjeanF on ESPN Spanish GP team Haas Sponsored by Soccercoin Cool,1597499188,3,1
163,ichldr,alemao458994,0.0,Ganhos vitalcios,1597814128,0,1
164,ichk1v,jeedx,0.0,Your DCA Philosophy,1597813965,4,1
165,ichagv,blessive,-0.3612,As Bitcoin Struggles At  Here Are The Next Targets On a Breakdown BTC Price Analysis,1597812727,0,1
166,ich8gt,mishax1,0.0,The future is here,1597812486,107,1
167,icguzz,frankie_mastro,0.0,IoTeX Joins Coinbases Rosetta to Simplify Blockchain amp Exchange Integrations,1597810828,5,1
168,icgrgj,ethereumflow,-0.8591, XRP Stolen by Scam Artists on YouTube  of Victims Use Coinbase Report,1597810405,8,1
169,icgou9,assetcoin,-0.296,No Recess During a Pandemic,1597810097,2,1
170,icgk9r,LinguiniPants,0.0,Any specific reason why everything is going down tonight,1597809582,2,1
171,icggjl,blessive,0.2263,YFI Worth More Than Bitcoin Prices Pass k Following Insurance Product Launch,1597809139,0,1
172,icg7y0,wagnertamanaha,-0.4767,Cointelegraph Ashton Kutchers Terrible Artwork Lives on as NFT After Incineration,1597808157,2,1
173,icg2ee,anmolgaur45,0.296,Future of Money is Digital Currency,1597807539,5,1
174,icfybk,ZOMPIREBLAZE,0.0,Pi future of crypto,1597807079,2,1
176,icfqes,Squeaky-Bed,0.0,Coinbase when you need it the most,1597806194,1,1
177,icfm8r,SnooWalruses613,0.0,Thoughts on Ethereum stock,1597805708,0,1
178,icfj1q,joenorwood77,0.0,Discussion of the Day INT Chain INT,1597805350,3,1
179,icf2jf,VoskCoin,0.8506,Mining Ethereum in  is SUPER PROFITABLE Why,1597803556,4,1
180,icekpu,Mrglow33,0.8271,Help me buy weed,1597801682,0,1
181,icehmn,Wilbatruss1257,0.0,Question regarding crypto laws and gambling,1597801351,0,1
182,iced1n,MarkAndrewSkates,0.0,Beginner looking to invest small amounts advice,1597800850,29,1
183,ice5eg,nice2yz,0.0,Key Timing for Adoption Crypto Goes Mainstream With TV Newspaper Ads,1597800042,1,1
184,icdx7v,MammothSir9,0.3612,Report Bitcoin Untied from the Economic Cycle Largely Uncorrelated to Other Asset Classes,1597799187,0,1
185,icdwr9,CoinFest,0.4019,Using crypto to help Hong Kong,1597799139,0,1
186,icdwmh,rivoke,0.0,YFI Price Overtakes Bitcoin at  Flippening is Complete,1597799124,6,1
188,icdhzb,twonkos,0.2263,How bears feel after shortselling  worth of Bitcoin,1597797657,0,1
189,icd3gr,henry__freeman,0.0,For those working from home at the moment take this as your Trial to that REAL laptop lifestyle ,1597796145,13,1
190,icd08u,AutoModerator,0.0,Daily Discussion  August   GMT,1597795813,808,1
191,icczb0,henry__freeman,0.4404,Another profitable day ,1597795716,2,1
192,iccvyu,CmMozzie,0.0,Institutional Investors are buying crypto by the hundreds of millions,1597795393,1,1
193,iccut0,Brynn_122,0.0,Future of AltCoins,1597795280,0,1
194,iccl1l,Elena_daviz,0.0,Binary Trade,1597794288,0,1
195,iccbk3,alsz07,-0.4215,Future of trading with traditional stocks lies in DeFi,1597793376,0,1
196,icc9a1,vaxblade,0.0,Vibe coin,1597793146,0,1
197,icc7xx,gunnakeepthis1,0.0,make it hodl,1597793016,16,1
198,icc30d,John_Titor_Jnr,0.4404,Are you new to Crypto I started in late  heres some useful resources,1597792529,28,1
199,icbv0y,Showitgirl,-0.7783,Why in the hell is causing people to think Ripple is going to hit k per coin What am I missing,1597791763,28,1
200,icbpk3,msbj1,0.0,Bitcoin Why  Looks To Be The Year Of Bitcoin amp Business,1597791230,2,1
201,icbp23,Hopeful_Ad9169,0.0,Which is this utmost bitcoin account,1597791179,0,1
202,icbkn8,CrazyFactz,0.8792,What is more profitable this bull run holding altcoins for long term in BTC pair or holding in USDT pair,1597790753,10,1
203,icbgmx,Mr_Olavski,0.4404,A good addition to DeFi,1597790385,0,1
204,icbent,monethical,0.2023,Top coins according to trend and momentum indicators August th,1597790199,0,1
205,icbajj,nanooverbtc,-0.5574,Riot Blockchain Supercharges Mining Ops With  More Bitmain Rigs as Bitcoin Price Soars,1597789820,0,1
206,icb1e0,ddas244,0.0,Some Bitcoin DD,1597788957,11,1
207,icanx4,b10m1m1cry,0.0,Binance JEX token,1597787726,0,1
208,icanex,CommercialTouch9,0.0,Vitalik Buterin Sold His Ether for Fiat Not Bitcoin,1597787683,16,1
209,icam99,TheProliferator,0.0,Mentor me,1597787579,18,1
210,icabt3,Nest_Fan,0.0,NEST Token Application scenario,1597786626,0,1
211,icaa81,Brilliant-Ad-4967,-0.3612,Im getting an error message cannot connect to server on Coinbase can anyone help me how to fix this no customer response,1597786484,0,1
212,ica95q,Oninteressant123,0.296,Democratize money pic is not recent,1597786391,4,1
213,ica958,LimbBizkit,0.4005,Total Value Locked in DeFi Is Overestimated by  Billion  Data Shows,1597786390,0,1
214,ica8lk,ShotBot,0.0, of Investors Will Hold Bitcoin Even if Price Falls to ,1597786338,10,1
215,ica75y,JamieFosters,0.5994,Alice and Bob love Moneros stealth addresses,1597786206,2,1
216,ic9vit,Craysco,0.128,Many feeling this after todays shenanigans,1597785164,3,1
217,ic9ryh,ShotBot,0.0772,Vitalik Buterin Ethereum  Presents a Much Harder Challenge Than We Thought,1597784838,6,1
218,ic9rxi,Chris--1,0.0,Grayscales AUM literally grew  billion within a month Currently  billion invested,1597784836,0,1
219,ic9r2j,MammothSir9,0.0,Warren Buffett Changes Mind on Gold He Will PanicBuy Bitcoin at K Says Max Keiser,1597784762,0,1
220,ic9nuf,garlickbagel,0.4588,what happens if you hold an interest bearing token in a uniswap pool,1597784490,2,1
221,ic9jx6,MichaelStephen2428,0.5719,VI Uniswap pool created to boost VI liquidity,1597784152,0,1
222,ic9jbx,BittyTitty42069,0.0,LEVERAGEMARGINSOPTIONS,1597784103,0,1
223,ic9ifb,MikaR53S,0.4588,Long term portfolio  years,1597784025,0,1
224,ic9hbp,goldjade99,0.0,Construction set to begin on Reallife Wakanda Akon City,1597783930,2,1
225,ic9gjo,SuperDeepFriedBacon,0.0,Im new with cryptocurrencies and I dont know where to start,1597783867,0,1
226,ic9e1d,shawnwingsit,0.0,Cryptocurrency and the US election cycle,1597783647,4,1
227,ic9ck9,Stevitski,0.0,A new era for BOLT,1597783517,0,1
228,ic9c8e,autum88,0.2263,Bithumb showing  balance after successful deposit after  block conformations,1597783487,1,1
229,ic9bju,[deleted],0.5719,Hot Take Election uncertainty in the United States will push a lot of investors to look for a hedge in an uncertain time This is to Bitcoins benefit between now and November rd,1597783431,2,1
230,ic96yk,bigdreamsbybabysteps,-0.34,Revolutionary Crypto Combat Farming Game  Cede,1597783028,0,1
231,ic8v37,nanooverbtc,-0.5574,Bitcoin exchange reserves have fallen to a month low,1597782016,2,1
232,ic8u52,nanooverbtc,-0.5423,Blockchain Bites Hashrates Drop Bitcoiners Hodl and an Open Letter to Bankers,1597781929,0,1
233,ic8or0,nanooverbtc,-0.4588,US dollar has broken support now at the lowest level in two years,1597781468,2,1
234,ic8ns4,ethereumflow,0.0,Chainlink price drops  amid massive selloff second day in a row,1597781380,0,1
235,ic8jov,FiniteRegress,0.9231,Sign of greater institutional interest in crypto dark pools are cropping up to make it easier to buy crypto undetected without impacting the market,1597781032,1,1
236,ic8boe,coughsfromthesoul,0.0,What are everyones thoughts on LBC from LBRY,1597780360,0,1
237,ic8ao3,crypt0queen,-0.4588,My partner and I make Nixie Bitcoin Tickers They live stream the current price Here are the IN Tubes in Vintage Dip lt CQ,1597780280,15,1
238,ic88ty,SWTyler,0.0,Anyone tried SuperWorld,1597780125,0,1
239,ic84p6,jam1111,0.4404,Akropolis Review For Profit Daos Capital Pools and Undercollateralized Lending,1597779772,1,1
240,ic839w,MediaSmurf,0.0,Bridge Protocol is a selfsovereign identity system SSID Its an opensource product available for the Ethereum and NEO blockchain Bridge Protocol leverages the BRDG token which is a crosschain utility token on both Ethereum and NEO Here is my summary about this project,1597779655,0,1
241,ic8287,Bewinxed,-0.2263,VIEWS Dev stole my design Used it on their socials and Chrome Extension and banned me without paying Their extension is possibly malware as well,1597779565,190,1
242,ic80yr,XtreReX,0.0,What will the price of CRV be on September st ,1597779462,4,1
243,ic7wyj,Mrbitcoinnews22,0.0,More Than  People Have Entered ByBits MillionDollar Trading Competition,1597779134,0,1
244,ic7tcj,arijitdas,0.0516,Graeme Garioch won a hefty figure on the Scottish version of the game show Deal or No Deal has lost nearly  to Bitcoin scammers,1597778822,0,1
245,ic7oj7,RoastedArmadillo,0.7184,Im new to crypto what should I use to buy Flexacoin,1597778417,1,1
246,ic7odw,doge_c137,0.0,Bitcoin hash rate drops  due to heavy rains in China,1597778406,16,1
247,ic7m2t,Plutusedge15,0.4019,One Small Step for Bitcoin  SpaceChain Secured Transfer From International Space Station  CoinDesk,1597778191,2,1
248,ic7krx,the420chronicler,-0.7579,If you needed any other reason to get into Crypto then look no further than the Federal Reserves Balance Sheet since  Bitcoin Ether and other cryptocurrencies are insurance policies with different risk profiles that offer protection from government currency collapse,1597778075,5,1
249,ic7fdv,throwawaybankam,0.0,PSA a caution on using ATHs as benchmarks,1597777616,11,1
250,ic76qu,lakerz690,0.4767,Adex ADX now offers staking rewards currently at  APY,1597776884,1,1
251,ic727q,ethereumflow,0.2023,More on Cardanos ETC Treasury Idea Charles Hoskinson,1597776515,2,1
252,ic70ii,trade_with_bliss,0.0,BINARYTRADEPLATFORM,1597776371,2,1
253,ig91k6,Striking-Quiet-6784,0.0,I cant take out my ENJ token,1598348862,0,1
254,ig8uou,M-Dawood-Khan,0.5719,Harry loves bitcoin,1598347856,2,1
255,ig8tbb,Far-Acanthaceae4863,0.0,Bitcoin investment group in telegram,1598347649,0,1
256,ig8svw,swiftins078,0.0, EIDULADHA QURBANI JUST IN  Pkr ,1598347584,2,1
257,ig8r7s,Craysco,-0.4784,Reminiscing over the good old noob days damn I was indecisive chasing those pumps dont be like Jan  me,1598347355,3,1
258,ig8qq2,qertoip,0.5719,DeFi is a decentralization theater but there is still merit to it,1598347283,0,1
259,ig8f0g,blessive,0.0,How YFI is Returning  Million Annualized for Token Holders,1598345531,0,1
260,ig890k,Born-Edbond,0.4404,What makes Aave and Land innovative DeFi players,1598344645,1,1
261,ig84r6,LegendaryDieter,0.34,Small crypto thats likely to raise in value,1598344002,0,1
