,id,author,vader,title,created_utc,num_comments,score
0,gxs1hq,sylsau,0.0, Essential Reasons Why We Need Plan Bitcoin,1591453978,1,1
1,gxrvkj,TaoOfSatoshi,0.0,Dash Economics Proposal Crypto Around the World Anypay vs BTCand more  CATV LIVE today at PM UTC,1591453389,1,1
2,gxrtqh,Liljz11,0.0,DERO Egalitarian AstroBWT Mining Algorithm Benchmarks,1591453213,1,1
3,gxrsda,nanooverbtc,-0.1027,Mark Cuban doesnt understand that people have to work for USD by finding a company or a person with USD to pay them,1591453074,8,1
4,gxrpyd,nanooverbtc,0.2023,Mark Cuban doesnt understand that people have to work for USD by finding a company or person with money to pay them,1591452822,0,1
5,gxrk22,Saman93,0.0,question Questions about tether,1591452227,8,1
6,gxrihk,ProteinShakesAreBae,0.2263,Bots that allow shorting bitcoin,1591452073,0,1
8,gxrd4r,blessive,0.3612,Like Ethereum Tezos Plans to Introduce Domain Names,1591451530,1,1
9,gxraea,benmdi,0.0, Why Crypto Is Antifragile To ,1591451250,2,1
10,gxqzjs,DripleTT,0.0,Time to do this with our FIAT,1591450103,17,1
11,gxqzg5,Hornstinger,0.128,Is there a solid unbiased viewpoint on all Crypto Exchanges,1591450094,11,1
12,gxqz7v,NitPo,0.6369,Best multiwallet,1591450068,0,1
13,gxqwti,JoeFCaputo0113,0.4588,Favorite PoS coins to earn dividends from,1591449810,1,1
14,gxqubo,alvarosb,0.0,Grayscale Is Buying Up More Than Just Bitcoin,1591449532,19,1
15,gxqng2,MammothSir9,0.5106,Virtual Assets Unleashes Retail Cash Reload Innovation for Purchasing Cryptocurrency,1591448776,0,1
16,gxqk9d,Pol8y,0.0,SiaStreamcoming soon for your media and streaming needs,1591448455,2,1
18,gxqjhb,Pol8y,0.0, Cybersecurity reasons to use Blockchain,1591448384,5,1
19,gxqbbf,Czfacts,0.0,Swiss Bank SEBA Launches Blockchain amp Crypto Themed Educational Courses,1591447441,0,1
20,gxq9gv,Crypto4Canadians,0.7125,The BEST Way To Trade Crypto in Canada,1591447232,4,1
21,gxq6wb,Selina_Mary,0.25,Ripple XRP Price Analysis XRPUSD Faces Plunge To  As Bulls Play Dead,1591446934,0,1
22,gxpzfk,iwanttoridemybicycl3,0.0,Investment behavior in Cryptocurrencies  Questionnaire,1591446016,0,1
23,gxpyp7,Ton1206,0.2732,Unibright and Provide to create first Baselined Blockchain toolset,1591445926,0,1
24,gxprm6,jonbristow,0.0,What happens if a token has x ETH of liquidity and someone buys x ETH or more of that token on Uniswap,1591445049,1,1
25,gxpl3k,dhruvish0697,0.0,Alternative for coinbase,1591444230,0,1
26,gxpbq9,Satoshimeds,0.0,Is there a space for an upcoming crypto exchange in this crowded business,1591443009,0,1
27,gxp903,IrfanGurel,0.6808,Lets win CHSB and BTC playing prediction games,1591442653,0,1
28,gxp2y4,pihusingh,-0.296, Kyrgyzstan Looking to Impose  Tax on Crypto Mining,1591441823,0,1
29,gxp1q4,degenbetz,0.0,Big Facts,1591441654,1,1
30,gxox02,FutureFinancial3284,0.2023,Top Pick POWER,1591441059,0,1
31,gxowf5,Gepo1234,0.5927,Heres a new thing Im not an expert on these things by any means but i think now is a good time to invest,1591440985,1,1
32,gxow49,Z0oka,-0.4118,Noob thats want to get into the crypto game but has no idea were to start,1591440946,18,1
33,gxolsk,undergroundinvesting,0.0,Discussion on Ethereum and the roadmap to Serenity Eth ,1591439486,5,1
34,gxohtc,OneProtion3,0.0,Blockchain initiatives for the pharma industry by the Cruzbit network,1591438934,1,1
35,gxo536,blessive,0.0,Building on Bitcoin Blockstream is connecting investors with Liquid Network fanatics,1591437122,1,1
36,gxo46w,aminok,-0.1027,Loopring Pay is Live zkRollup Transfers  Fast feeless ERC transfers with the complete selfcustodial guarantees of Layer ,1591436997,17,1
37,gxnkmj,MoamenMohamad1,-0.6124,What was that one scam called,1591434230,0,1
38,gxnfmy,blessive,0.3612,Research firm Bitcoin could see a sharp rebound past  if volume trend shifts,1591433545,0,1
39,gxnbre,insidetrader8,0.0,First Ever Digitalized Bank AFRICUNIA,1591432994,1,1
40,gxnal2,btsfav,0.4019,DeFinitely   The week in DeFi,1591432821,0,1
41,gxn7eu,Mrbitcoinnews22,0.0,Blockchain to Disrupt Music Industry and Make It Change Tune,1591432347,0,1
42,gxmrcb,Magic_Hunter,0.5719,Website Creation And Hosting That Accept Crypto,1591429928,0,1
43,gxmpub,mishax1,0.5267,Want to find out how effective blockchain analysis tools are Post your Coinbase receiving address on the internet and find out,1591429695,0,1
44,gxmood,PapaAlpaka,-0.3182,Its official Facebooks Libra is boring,1591429510,38,1
45,gxmirs,pradcool89,0.0087,How can you earn little extra money by doing a cryptocurrency business it is not a joke its real try it now,1591428639,0,1
46,gxmfn5,39T5fqdsRustdroAJK2H,-0.2732,The Grey Gold  How Billions in Lost Investment Could be Regained,1591428173,0,1
47,gxmdw8,arslanbajwa,0.0,Satoshi Nakamoto and Bitcoin,1591427909,3,1
48,gxm19j,slywalkers,0.1779,There are verified number of Bitcoin scams running on YouTube lately Please stay safe,1591425978,122,1
49,gxlx2m,amrobertson86,0.0,DCA Split,1591425342,0,1
50,gxlv08,iamnickycharles,0.0,Coinbase Vs WEBULL fractional investing ,1591425045,0,1
51,gxlsnt,Ceahorser,0.0,Trading and sending,1591424697,0,1
52,gxljul,Born2win20,0.4404,BREAKING Bloomberg DOUBLES DOWN Says Bitcoin BULL RUN Is Coming June,1591423450,0,1
53,gxlgwh,Rldavo,0.0,Any thoughts about buying DAPP,1591423045,0,1
54,gxlf8m,kuriputo,0.0,fiat to crypto onramp recommendations,1591422803,0,1
55,gxlep5,blessive,0.0,Chainlinks price oracles power derivatives and cryptofinance products running on new DeFi exchange,1591422724,0,1
56,gxl699,alvarosb,0.7964,Fidelity digital assets continue to gain adoption and interest by a variety of institutional investors Boom,1591421548,5,1
57,gxl0s2,krakenthelittle,0.0,What do you guys think of NitroexNTX ,1591420830,0,1
58,gxkxx4,1EARTH_,0.0,Running twetch,1591420442,1,1
59,gxkv6g,Complete-Goal,0.0,Airdrop,1591420101,0,1
60,gxknms,blessive,0.0,Bitcoin Is Close To The Next Big Move,1591419144,1,1
61,gxkdgl,lingi6,0.296,Decentralisation of Money ,1591417863,0,1
62,gxk90k,intothecryptoverse,-0.6908,Bitcoin The bearish scenario,1591417332,2,1
63,gxk61x,wgcole01,0.5423,Looming XRP Upgrade to Implement Unusual Feature Despite Apparent Opposition From Ripple,1591416968,5,1
64,gxjtug,blessive,-0.6908,Bearish Headwinds at  for BTCUSD Sally Hos Technical Analysis  June  BTC,1591415530,0,1
65,gxjn2t,ponnak,0.2023,Euro exchange rates Top  Currency for June   UTC,1591414757,1,1
66,gxjlau,warrchaser,0.5859,BTC Dominance about to break the  day upwards channel Altseason ahead,1591414551,93,1
67,gxit4q,baerbelleksa,-0.9186,Seeds is Giving ETH to Fight Racist Violence amp Police Brutality If you want to pitch in give here,1591411471,3,1
68,gxiq4j,Alex_Ownagez,0.0, ERC Helicopter ,1591411159,0,1
69,gxim08,Mrbitcoinnews22,0.7964,Former Chinese Central Bank Exec Praises Commercial Success of Bitcoin,1591410731,2,1
70,gxigvy,671futbol,0.0,IRL V shaped recovery X rainbow chart,1591410187,3,1
71,gxidna,Evenstar22,0.8553,Hi Guys Id be deeply grateful if youd come and check out my first crypto for beginners educational video A lot of people I see have trouble with making their first peer to peer purchase and they dont understand how it works I hope its ok to post my own content and Im happy to answer qs,1591409842,4,1
72,gxhzkl,blessive,0.4973,Theres a reason why XRP still has a b market cap despite it being overvalued,1591408331,2,1
73,gxhncn,teddyjr32378,0.0,Litecoin update,1591407042,32,1
74,gxhb97,bitcoiner014,0.4019,Satoshi Nakamoto Had Outside Cryptography Help Says Early Bitcoin Dev,1591405766,2,1
75,gxh96o,MammothSir9,0.0,Patoshi Researcher Says Altruistic Satoshi Will Never Spend His M Bitcoin,1591405563,1,1
76,gxh4q7,nobodysir,0.0,FLAME Uniswap Token Offereing  hours old,1591405104,0,1
78,gxguqo,pytonem,0.0,Hypothetical Question How can I implement crypto currency into hobbies,1591404085,14,1
80,gxgkca,Administrative-Run-5,0.6249,Great new project,1591403028,0,1
81,gxgdao,AutoModerator,0.0,Daily Discussion  June   GMT,1591402322,381,1
82,gxg9s0,orangesherbet0,0.0,Coinbase wants to identify Bitcoin users for the DEA and IRS  Decrypt,1591401968,13,1
83,gxg5nl,chimichangahustle,0.0,Coinbase wants to identify Bitcoin users for the DEA and IRS,1591401568,0,1
85,gxfvh1,DeltaFreq,-0.144,Why arent more people in unstable economies fleeing to stable coins,1591400592,0,1
86,gxfsbn,Kryptedbbkick,0.5719,Determining crypto value increase on current,1591400283,0,1
87,gxfs9t,joenorwood77,0.0,Discussion of the Day Blockstack STX,1591400278,0,1
88,gvvd6k,tunderman6,0.0,LBC ACCOUNT LOADING,1591195970,0,1
89,gvv6at,slywalkers,-0.4019,Bitcoin white paper is a real Bible,1591195317,9,0
90,gvv2ml,jesse_VE,-0.296,No words needed,1591194965,131,3
91,gvv242,Lumin8_Crypto,0.0,BTC News Today  Bitcoin Tanks As  Million In Longs Are Liquidated,1591194914,15,0
92,gvv02w,heist95,0.0,Crypto Adoption Spotlight Iran,1591194717,10,7
94,gvuth2,rivoke,0.25,Why Did Bitcoin Break  But Crashed Shortly After,1591194089,19,4
95,gvuri7,sendmorechuckberry,-0.296,Bitcoin no longer dependent on derivatives trading,1591193896,0,1
96,gvukqi,whatisfomo,-0.5267,Biggest threat to Bitcoin does not come from China it comes from these factors,1591193245,7,3
97,gvu7bg,Streembit-Matt,0.3182,Monetization advice please,1591191903,0,1
98,gvtzfx,satoshisbrain,0.0516,No Business is ever crowded if you are bringing new and added value to that space ie BarterTrades Trading Ecosystem CryptoExchange Cryptocurrencies Bitcoin Crypto BTC ETH,1591191083,0,1
99,gvtsuv,Greatrnover,-0.7589,Goldman Sachs is Bearish on Bitcoin  This Shouldnt Be a Surprise,1591190390,2,1
100,gvtpz6,coinpowernews,0.0,Liquid gold argan oil for Digital gold bitcoin We are heirs of argan grounds designated by UNESCO,1591190067,0,1
101,gvtoot,masattar,0.6249,WM Project Looks Great,1591189923,0,1
102,gvto76,coinpowernews,0.0,Liquid gold argan oil for Digital gold bitcoin  we are UNESCO heirs of argan grounds,1591189870,0,1
103,gvto4r,Czfacts,0.0,Japanese Minister Taro Aso Talks About Cryptocurrency and Stablecoin,1591189863,0,1
104,gvtkph,Red5point1,0.0,Bart Pattern Basics,1591189495,8,1
105,gvtiex,CryptoNarf,0.4588,LTO Network Governance improvement burning M LTO from the foundation  of total supply,1591189259,6,1
106,gvtcwl,Lumin8_Crypto,0.0,BTC News Today  Bitcoin Tanks As  Million In Shorts Are Liquidated,1591188647,2,1
107,gvt1s5,razzyboss1,0.0,Opinions on LiteCoin,1591187380,33,1
108,gvszs1,wgcole01,0.0,XRP Check Feature May Surface Soon,1591187142,2,1
109,gvsx9u,Mike_911888,0.0,Zilliqa price prediction   ZILUSDTBTC Action plan,1591186856,1,1
110,gvsrs3,kingtroll12321,0.0,Robinhood states available,1591186165,0,1
111,gvsrnx,CorderMenqui,0.0,AVA Labs integrates Chainlinks RealTime Price Data,1591186153,1,1
112,gvsi92,andrius_sampaio,0.0,PT BR  GRANDES SAQUES EM CRIPTOMOEDAS CHAMAM A ATENO,1591184962,0,1
113,gvsgu3,andrius_sampaio,-0.296,PT BR  GRANDE SAQUES NO MUNDO DAS CRIPTOMOEDAS,1591184765,0,1
114,gvs8f0,mr_dude_guy,0.0,Weekly Roundup of US Regulations ,1591183662,0,1
115,gvrtzz,DappRadar,0.5423,Esports league starts paying winnings in ETH and DAI Can Esports take us a step closer toward mass adoption,1591181808,1,1
116,gvrnk9,Legitinternetguy,-0.4023,According to Binance we shouldnt trust Binance ,1591180962,4,1
119,gvr5ib,Rishnarangepaw,0.3182,Curious of peoples thoughts on Pi,1591178534,0,1
120,gvr3ml,asifisf,0.0,My Keybase proof redditathi  keybaseathi FNZmxEffpkCIvereoTjOwLgoaKdslXejwA,1591178296,0,1
121,gvr1r0,imiblockchain,0.0,Why China Invests In Blockchain But Not In Cryptocurrency,1591178020,1,1
122,gvqzcl,linusgoddamtorvalds,-0.1779,How Azure Security Center detects a Bitcoin mining attack,1591177686,2,1
123,gvqqki,gregbaines,0.0,Bitmain Investment,1591176420,0,1
124,gvqmje,Flat_Project12,0.0,Ripple Chief Brad Garlinghouse Meets With Central Bank Leaders in Brazil,1591175853,2,1
125,gvqllq,wgcole01,0.0,Ripple meets with Central Bank of Brazil  XRP involved,1591175721,20,1
126,gvqleq,DanTup,0.7184,Reputable places to buy crypto from the UK in either GBP or USD,1591175693,48,1
127,gvqafo,AWest_42,0.0,Bitcoin Investment,1591174227,0,1
128,gvq9c2,Ituglobal,0.4215,Ripple XRP Powerful Uptrend Remains Feasible Amidst Larger Uptrend,1591174069,2,1
129,gvq5t2,RoughRisk,0.0,What are the different types of cryptocurrency Explanation,1591173584,1,1
130,gvq42m,KrysBezel,0.0,Swiss Bank Maerki Baumann to soon launch crypto custody and trading services,1591173336,1,1
131,gvq3k7,coinprepr,0.4576,There is a very interesting post on crypto here rmydrugofchoice,1591173267,0,1
132,gvq071,park_injured,-0.4019,Arthur Hayes Bitmex CEO tweets BTC basis is starting to get juicy hours before BTC dumps more than  in one hour,1591172812,3,1
133,gvpzq8,TheEyeofQNT,0.2732,QNT now on Kyber Network and ead more about Quant how weve solved Interoperability and are bringing financial institutions and enterprise to blockchain,1591172744,7,1
134,gvpri2,mena_26,0.0,Crypto currency,1591171602,0,1
135,gvpdfx,beemerteam,-0.34,Cryptos On The Forefront Fighting COVID Backed by Trillions in New Funding,1591169640,7,1
136,gvpd08,giantTamer8,-0.4019,Every time theres a flash crash,1591169584,3,1
137,gvp9jh,BaconWrapedAsparagus,-0.7184,Wikihow do I know when to sell,1591169111,8,1
138,gvp8bi,dynasty_maxed,0.4939,Top  Crypto Companies by market value,1591168941,0,1
139,gvp2ae,PaulJawosky,-0.6249,Citi warns markets are out of step with grim reality,1591168131,25,1
140,gvp05k,Enkiduthebeast,-0.4466,Published Turtle Networks NO KYC DEX summer trading contest featuring  BPSAA members Sentinel VPN,1591167868,1,1
141,gvoj4f,exturuder,0.7783,Section Order th Event Be the leader of a section and share  USD worth ETH reward Use the official binance broker HeartNumber and trade,1591165608,0,1
142,gvofh4,salubrio,0.0,I made a thing to teach myself how to bitcoin Build towers with BTC satoshis,1591165128,4,1
143,gvofaw,denomeme,-0.2263,I think I found the reason why stocks keep going up Federal reserve now has  reserve requirements which means banks can give infinite amounts of loans without anything on reserves which may have caused some unwanted consequences,1591165104,3,1
144,gvoa3j,intothecryptoverse,0.0,Bitcoin logarithmic regression and underover valuation of cryptocurrency marketcap,1591164401,4,1
145,gvnawz,SmmFoxFollow,0.6369,FoxFollow Best amp Cheapst SMM sevices  Get Followrs Now ,1591159916,0,1
146,gvn08l,VitisV,0.4927,It was the first thing I noticed Already feeling more secure,1591158551,25,1
147,gvmjcw,areddituser46,0.0,Bitcoin Mining Pool Outflows Surge Just Before Bitcoin Dips Back Below ,1591156534,0,1
148,gvlxs7,DillW3ed,0.4215,Which exchange for dollar cost averaging in the United States,1591153913,0,1
149,gvlupw,MammothSir9,0.4019,Bitcoin Cash VietnamBased FiattoCrypto Trading Support Added to Bvnex Exchange,1591153563,0,1
150,gvlqsw,letscryptonize,0.0,Japanese finance minister may oppose a reduction in the Crypto tax,1591153127,0,1
151,gvlndb,Plutusedge15,-0.5574,Riot Blockchain Plans Sale of Crypto Exchange as It Invests More Millions in Bitcoin Mining  CoinDesk,1591152707,1,1
152,gvlkhr,iphelix,0.0,Week  ,1591152355,1,1
153,gvkxvr,Gas_Pumper,-0.1761,I would like to exchange knowledge I am a tax accountant that has been researching crypto tax rules but Im not sure what common questions are,1591149812,25,1
154,gvktku,step1985hen,0.0,Ethereum,1591149329,1,1
155,gvk6a1,diwnuwlnswkings,0.0,Big Data Blockchains Numerai vs Ocean  whats their difference,1591146748,0,1
156,gvjy9x,cryptoyoda201,0.0,A Frame in Time A Look at the Impact of the Coronavirus Selloff on BTC Addresses,1591145907,2,1
157,gvjuro,blessive,0.2023,Chinas calls for speed up of Hainans Blockchain Pilot Zone no sign of crypto even as Digital Yuan rises,1591145526,0,1
158,gvjr0q,Lizardcorn,0.0,ANALYSX XYS Decentralized Chain Analysis,1591145121,0,1
159,gvjjnq,PapaAlpaka,0.5994,Cryptobartender helps social distancing sells drinks in a contactless way accepts EOS and EOS tokens and instantly distributes income,1591144353,1,1
160,gvirrc,AWest_42,0.0,Bitcoin manning,1591141474,0,1
161,gvipbs,PapaAlpaka,0.0, in DAI Writing Contest  Twitter Giveaway  AtomicWalletTutorial,1591141236,1,1
162,gviii6,pantry38,0.6597,Well that was fun for a second,1591140572,4,1
163,gvhzw2,DrAntagonism,0.2023,Top  Cryptos by market cap present Bar race visualization,1591138817,4,1
164,gvhxxy,macg747,0.8192,TOP  crypto DEFI projects to buy now and why ,1591138634,0,1
165,gvhwrm,[deleted],0.0,this just happened on live television,1591138522,4,3
166,gvhlue,areddituser46,0.5574,Canaan Creative Stock up  as Bitcoin Flirts ,1591137521,0,1
167,gvh68x,[deleted],0.7783,The only positive thing about being messaged by scammers on telegram is the laughs you can have,1591136111,4,1
168,gvgxcg,roguespudagent,-0.694,BlockCard and Ternio SCAM,1591135336,0,1
169,gvgrul,MammothTrash,0.0,My First Investment  Coinbase and Ripple,1591134854,4,1
170,gvgqdf,blessive,-0.1531,Bitcoin Cash price meets the  resistance before falling to ,1591134724,0,1
171,gzor78,blankey1337,-0.5719,With DeleteCoinbase trending I picked a bad week to add Coinbase support to Block Monitor,1591714763,1,0
172,gzopvh,Fritz1818,0.0,Whatever happened to Potcoin,1591714643,2,2
173,gzopkp,[deleted],0.4215,CoinCorner Launches the First Bitcoin Cashback Service in the United Kingdom,1591714615,2,1
174,gzooan,fan_of_hakiksexydays,0.7184,Reddit Moon and taxes,1591714500,7,1
175,gzog2d,AshleyParker1992,0.0,Take on the Kraken at Ego Casino,1591713747,0,1
176,gzocwo,IconGuideStar,0.5719,ICON Reward rate rrep Global Commission rate irep  Inflation  The  key ICON Token,1591713439,2,1
177,gzob1i,Thunderosa,0.0,Together we can use new technology to limit the intrusion of corrupt bankers and governments and participate in a financial system that empowers the people,1591713260,2,9
178,gzo4t0,LoudCarpen,0.9169,While many people consider Bitcoin a great innovation and invest in it for fun or to be in line with the latest trends others regard it as a safe haven that can be used to hedge against devaluing national currencies,1591712664,2,16
179,gzo49u,unavailable365,0.0,Directorio DeFi en Espaol,1591712616,0,1
180,gzo432,iphelix,0.0,ConsenSys DeFi compliance service,1591712598,1,1
181,gznwil,Binanceseller,0.0,Binance Futures Trading Guide Explained Earn Up to X With Leverage Trading,1591711893,3,0
182,gznu05,MrieBry,0.1779,Ecoin is currently the fastest growing Cryptocurrency,1591711665,1,1
183,gznq0d,ricak,0.4588,CeFi and DeFi interest paid  how is it generated,1591711314,0,1
184,gznpzf,NoFishyBusinessHere,0.7096,Brave always brightens up my day,1591711312,2,1
185,gznoae,Bitcoin-fortune17,0.0,bitcoin,1591711164,0,1
186,gznij3,Czfacts,0.0,Saudi Arabia Central Bank Using Blockchain to Transfers Funds to Local Banks,1591710638,0,1
187,gzn6d9,RockmSockmjesus,0.2263,Redditor finds their old laptop containing over  Million worth of Bitcoin,1591709428,238,657
188,gzn604,heist95,0.0258,Crypto derivatives options futures etc volume at alltime highs and why that matters,1591709394,0,3
189,gzmupu,PaoloBain,0.0,Will Eos Voice social network be international,1591708261,0,1
190,gzmtxu,gcbeehler5,0.0,Reddit Moons,1591708186,6,5
191,gzmmt7,Lumin8_Crypto,0.0,BTC News Today   Places Where You Can Spend Your Bitcoin,1591707477,3,2
192,gzm8ah,Mrbitcoinnews22,0.0,A Luxury Yacht or a Snickers Bitcoin Beats Gold in New  Comparison,1591705937,0,1
193,gzm4f1,pihusingh,0.5859, Amazing Crypto Quotes,1591705515,1,1
194,gzm3vz,TheWiseGrasshopper,0.4939,In honor of Goldmans recent report,1591705458,12,22
195,gzltcc,Selina_Mary,-0.4588,Ripple XRP Price Analysis XRP Price Steadies Amid Short Term Consolidation,1591704262,0,1
196,gzls54,Chyeadeed,0.3612,Bitcoin is like Pong,1591704126,7,0
197,gzll90,vladpikaciu,0.4404,Is GPU cloud mining profitable,1591703326,0,1
198,gzl2xb,businessia,-0.5423,China Could Force Donald Trump And The Fed To Destroy The US Banking System,1591701157,2,1
199,gzkwx0,Shudip_477,0.0,If someone gave you bitcoin what would you do with it,1591700413,1,1
200,gzkvhl,[deleted],0.368,Cryptofriendly Bank Frick now processes payments via USDC stablecoin says it is faster than SWIFT,1591700261,1,1
201,gzktog,wgcole01,0.0,Swiss bank includes Bitcoin Ethereum and XRP in its portfolio,1591700047,1,1
202,gzkoba,poleska,0.0,New York and France Regulators Ink A New MoU For FinTech Partnership,1591699361,1,2
203,gzk5y8,cryptoprenuer1,0.6369,Stellar Lumens at its best,1591696952,4,1
204,gzjujs,Secret_Resident_314,0.6249,I am a scammer and I have a great project for you,1591695372,0,1
205,gzjsx5,Mrbitcoinnews22,0.0,Fiat fait face  un aplatissement du Bitcoin alors que Covid envoie un approvisionnement en M de plus de  tonnes,1591695150,1,1
206,gzjlc3,[deleted],0.4939,EWT is on Rank  gt topaltcoinsin Elon Musk and Tesla working with Energy Web Token EWT,1591694143,1,0
207,gzjb8m,blessive,0.0,TRON amp BitTorrent The Story Of Two Firms Under One Man,1591692742,0,1
208,gzincl,Vincent_Lionheart,0.0,Binance broker bots,1591689432,5,2
209,gzil5r,blessive,0.1531,Historical  Level is Bearishly Challenging for BTCUSD Sally Hos Technical Analysis  June  BTC,1591689130,0,1
210,gzij3i,InevitableStress3,-0.3612,Future argument about Bitcoin,1591688854,2,0
211,gzih06,Livid_Atmosphere,0.0,When is Ethereum  releasing,1591688556,0,1
212,gzicn4,aurumherba,0.0,Bitcoins VORZEICHEN fr einen BULLENMARKT Kryptowhrungen News deutsch,1591687975,2,1
213,gzibfo,btsfav,0.5023,Privacy no more ConsenSys to track your DeFi moves but there is hope,1591687823,1,1
214,gzi3p0,NavelGrave,-0.5994,Federal Reserve Paper Suggests Commercial Banking May Become Obsolete,1591686774,1,1
215,gzhyoz,exturuder,0.0,HeartNumber has started as an official binance broker,1591686130,0,6
216,gzhxyg,denomeme,0.0,TradingView tutorial and how I analyze cryptos,1591686041,2,0
217,gzhxd0,intothecryptoverse,0.0,Bitcoin Market Cycle ROI Different perspectives,1591685964,1,2
218,gzhx90,TrailingCrypto,0.0,Automated Crypto Trading,1591685952,0,1
219,gzguii,4rindam,-0.1531,Former KFC employee arrested over running Silk Road like operation,1591680953,5,6
220,gzgu6x,CryptoNewAngel,0.7184,SRK to the moon,1591680912,0,1
221,gzfy2b,redpanda3335x,0.0,Taxed on Selling Stocks If I Convert to Crypto,1591677101,0,1
222,gzfpdy,CryptoPlanetVIP,0.0,Someone Signed Over a Hundred BTC Addresses that Craig Wright Claims to Own,1591676096,2,1
223,gzfnhn,WackoWizard217,0.0,ConsenSys is launching a DeFifocused compliance service,1591675890,1,2
224,gzfcup,blessive,-0.4019,Bitcoin price consolidating after flash crash,1591674739,0,1
225,gzf059,initfordansfw,0.0,Future of Crypto,1591673352,0,1
227,gzelnb,weekndwarrior,0.6369,Which exchange has the best LIQUIDITY,1591671813,0,1
228,gzehak,Digimaxtoken,0.0,Digimax DGMT  giveaway,1591671358,1,1
230,gzdtzh,Johas,-0.872,BTC Scam Alert Beware Fake Musk BTcC scam Live on Youtube,1591668957,1,1
231,gzdfyu,blessive,0.0,How Businesses Are Adapting To Cryptocurrencies,1591667528,0,1
232,gzd608,emergingtech04,0.0,Daily and Monthly Giveaway from Emerging Technology,1591666513,0,1
234,gzc3cz,Mrbitcoinnews22,0.0,Alchemy Pushes RealTime Crypto Notifications to Your Device,1591662748,0,1
235,gzc1pn,Deact93,0.0,NEW Mining Goes Mobile Pi Network allows users to earn PI cryptocurrency from any mobile device  Cryptocurrency similar to Bitcoin GET IN EARLY,1591662605,0,1
236,gzbx1b,whattheclap,0.0,Is the LABlockchainSummit Promotion Legitimate,1591662151,2,1
237,gzbncx,MammothSir9,0.25,Poloniex Bittrex Named in Lawsuit Involving the Alleged TetherFueled Crypto Pump,1591661188,0,1
238,gzbn4s,anotherplayer_ae,-0.4215,Is faucets a waste of time,1591661169,0,1
240,gzag8z,DarkMatterEclipse,0.4215,DeleteCoinbase hashtag gaining speed on Twitter,1591657253,41,65
241,gzac7u,Trevinator1981,0.0,Swissborg,1591656885,0,1
242,gzab9g,cough_cough_harrumph,0.0,Pending Transaction for ETH Question,1591656797,8,6
243,gz9rmw,krabspresstheF,0.0,Can someone tell me what would be the name of bots that outbid you by  cent on exchanges,1591655035,0,1
244,gz9le1,InquisitiveBoba,0.4939,How is Money Created  Everything You Need to Know,1591654524,8,9
245,gz99wz,Idk74927,0.0,What happens to crypto during a divorce,1591653568,0,1
246,gz96t4,CryptoPlanetVIP,0.0,Albania Enacts New Crypto Law,1591653324,1,1
247,gz8v1l,RockmSockmjesus,0.0,Ethereum surpassed Bitcoin by  in Daily Transaction Fees,1591652386,165,767
248,gz8ph6,Mrbitcoinnews22,-0.7152,Ransomware Gang Strikes Again with More Auctions Listing Stolen Data,1591651933,0,1
249,gz8jtz,Ton1206,0.0,A deep dive on the state of digital currencies in the tech industry by Utrust Academy,1591651491,1,1
250,h9hzpl,CryptojuniorC1,0.0,DeepTradeBot Review   Why Should You Use AI Trading Tools,1592233180,0,1
251,h9hvxc,Snoo_46506,0.0,The Liquid Bit airdrop has been started,1592232828,0,1
252,h9hph8,berkcelik16,0.0,Liquid Bit Airdrop,1592232243,0,1
253,h9hmi4,Canuspeaking,0.0,Cryptobank,1592231976,0,1
254,h9hkz4,Kenyanen,-0.628,Finally got this bad boy in the mail,1592231834,16,1
255,h9hhm7,Mrbitcoinnews22,0.0,Fireblocks Integrates Chainalysis Know Your Transaction Feature,1592231533,0,1
256,h9hdus,tho69420,0.296,PUT YOUR MONEY ON BITCOIN THEY SAID,1592231204,0,1
257,h9gyib,JeganGN,0.296,Bitcoin The End of Money as We Know It ,1592229809,4,0
258,h9gp8u,BitcoinFrance,0.8588,My first post here I hope it is well welcomed I found someone who can make any design on face masks and I choose to be a Bitcoin representative I think adoption can be spread via visual too They are really nice to wear btw,1592228959,3,1
259,h9gj5i,lazynoir,-0.7717,Bitcoin Price is Looking Bearish with Downside to  Expected Ahead,1592228354,21,1
260,h9gb93,carloscancab,0.0,Research firm oriented towards institutional investors Reddits tokens MASSIVE for crypto adoption,1592227563,8,1
261,h9g2ka,Token_Brice,0.3612,Fixing the lottery  Play the worlds first decentralised nonloss lottery PoolTogether and cash out your jackpot using an Ethereum native payment solution Monolith  no unnecessary intermediaries needed,1592226678,0,1
262,h9f9eq,Joseit0,0.0,Announcing The Token Deployment Bounty,1592223699,0,1
