,id,author,vader,title,created_utc,num_comments,score
1294,ia4njt,blessive,0.0,South Korean blockchain payments for elderly coming soon,1597485130,0,1
1295,ia4kvm,Scary_Ad_1922,0.0,Samsung Declared New Partnership with Gemini Crypto Exchange,1597484659,0,1
1296,ia4j7w,Mr_Rivera,0.0,Man he still doesnt get it,1597484376,2,1
1297,ia4isr,Dope_HD,0.0,New Crypto Casino With Unlimited Faucet EOS ETH USDT BTC amp MORE,1597484303,0,1
1298,ia4ion,electrominer2,0.0,Noncrypto publication talking about blockchain Here comes the FOMO,1597484285,0,1
1299,ia4iat,BSmoke420,0.7184,Has the potential to moon this big waves being made Be one of the first on it earn while you use Tiktok is done,1597484219,0,1
1300,ia4f7b,offwwworld,0.4939,Anyone else see that Wealth Simple is adding Bitcoin amp Ethereum Theyre using Gemini to do it with,1597483715,12,1
1301,ia490k,11235813aq,0.0,Api key,1597482690,0,1
1302,ia40b2,lepidoo1,0.0,COMEX Trades,1597481228,4,1
1303,ia3hqr,MrBruncle,0.7506,biz wants to help this kid become an overnight success Cumulus Protocol CLOUD,1597478107,0,1
1304,ia3gn2,blessive,0.0,Heres why Galaxy Digital isnt farming Ethereum DeFis fields just yet,1597477934,2,1
1305,ia3bva,MrBruncle,0.5719,biz wants to make this kid an overnight success Cumulus Protocol CLOUD,1597477163,0,1
1306,ia38gh,RecentSheepherder943,0.6369,Antiviral landing page and a set of banners will help you to attract new users to your mining network during the COVID outbreak Use it to generate leads and grow your online income at a fast pace,1597476610,0,1
1307,ia2yif,doob4266,0.0, to invest,1597474984,0,1
1308,ia2xnk,Madson84,0.0,New project AIRDROP,1597474855,0,1
1309,ia2tq2,CommercialTouch9,0.0,Policymakers in the US and EU are pushing to use blockchain in  billion cannabis market,1597474230,3,1
1310,ia2p9h,dwayne7483,0.296,Making money fast,1597473532,2,1
1311,ia2nhe,AlanOne89,0.6369,Best crypto performances after Covid  The Cryptonomist,1597473266,1,1
1312,ia2nba,pankaj13052008,0.0,Tozex project,1597473242,0,1
1313,ia2hm3,ArrayBoy,0.0,Fed says it is developing an experimental digital currency,1597472395,6,1
1314,ia2dv3,slywalkers,0.0,This is why Bitcoin will disrupt them,1597471830,153,1
1315,ia2dsb,logohere,0.0,Nick Spanos with Vitalik,1597471820,2,1
1316,ia27m8,shivam17033,0.4588,I have been following ZLFToken  Last  weeks they have done good and zlf is backed by online education as industry I believe online education as industry can be a game changer  Thoughts ,1597470927,3,1
1317,ia268p,blessive,0.0,Bitcoin Cash price varies near  what to expect,1597470730,0,1
1318,ia1v01,PurpleJetskis,-0.1027,New here How and when do you pay taxes on CryptoCurrency,1597469148,7,1
1319,ia1frg,Zappa-,0.0,Is there a way to invest to get broad exposure to cryptocurrency,1597467041,2,1
1320,ia14kp,jdthemm,0.4995, LIST OF NEW amp HOT AIRDROPS ,1597465519,2,1
1321,ia13kp,sammmos,0.0,freefortnite freetheworld,1597465383,0,1
1322,ia11us,chinsam65,-0.3818,Cryptocurrency Business Website Scripts amp Blockchain Development at the lowest cost,1597465164,0,1
1323,ia0vvi,MammothSir9,0.0,US Federal Reserve Reveals Building a Digital Dollar Codebase With MIT,1597464383,0,1
1324,ia0vuf,alliswell19,0.3612,Ethereum fees be like,1597464379,3,1
1325,ia0vgx,Crypto-Angel,-0.128,A series of  attacks puts Ethereum Classics security into question,1597464330,0,1
1326,ia0p2q,blessive,0.128,How Curve Finances CRV Token Launched Without Anyone Knowing,1597463525,0,1
1327,ia0fsg,cryptodiggy,0.0,Sentivate SNTVT Review  x Potential Coin,1597462378,0,1
1328,ia07af,Droid-NZL,0.0,YAM lambo,1597461339,0,1
1329,ia04i9,Lingenfelter,0.0,DEFI,1597461000,2,1
1330,ia024b,JamieFosters,0.0,The reality of altcoins,1597460714,3,1
1331,i9zyoo,Trident1000,0.0,Elon Musk Has Spoken,1597460305,27,1
1332,i9zvfa,trenbonz,0.854,BIDAO BID TOKEN WARRIORS HOW EASILY WE FOOLED ALL YOU CRYPTO INVESTORS NOT ONCE TWICE EVEN MORE THEN  TIMES WE VE DONE THE SAME SCAMS THANKS FOR ALL THIS EASY MONEY THANK YA MAM bidao bidaochain bidscam eth ico btc bidaowarriors,1597459910,0,1
1333,i9zm4c,GCryptoG,0.7184,Need help IDing the crypto with the mask icon spider web and donut Any info is appreciated,1597458811,2,1
1334,i9ziq8,TheProliferator,0.6808,They support BLM and handle VPN may be a good bet,1597458412,8,1
1335,i9zfvn,blinkOneEightyBewb,0.0,USDBTC,1597458070,2,1
1336,i9zfqy,fxrebate,0.0,Is there anyone making a Robinhood of Crytpo,1597458055,0,1
1337,i9za9w,Pesabase,0.0,DeFi daily,1597457396,2,1
1338,i9z9bq,Plutusedge15,-0.7717,Ethereum Transaction Fees Drop By  After Collapse of Yam Finance,1597457286,0,1
1339,i9z9bm,leof135,0.0,What does it mean when the Fed is getting into the crypto game,1597457286,8,1
1340,i9z01w,Redac07,0.6908,Bullish on market cap crypto,1597456201,4,1
1341,i9yqau,cannedshrimp,-0.6486,BTC Mining Firm Layer Accused of Patent Infringement,1597455095,5,1
1342,i9yjro,Slick_Trix,0.4588,Current benefit of online casinos,1597454349,2,1
1343,i9yfma,Bumchairleg,0.4939,A friend is fundraising for Something I know nothing about crypto can someone explain this to me,1597453871,0,1
1344,i9y95v,LimbBizkit,0.3818,PayAccept Promises to Bridge the Gap between Traditional and Digital Financial Ecosystem,1597453155,0,1
1345,i9y5i7,blondiemcblondeface,0.0,Living on altcoin trading Hotels and Boobjobs AMA,1597452747,0,1
1346,i9y0dw,8-bit_gaming,0.2732,Energy Web Token  Tesla,1597452167,2,1
1347,i9xy44,Antique-Highlight,-0.4019,Coinbase error,1597451917,0,1
1348,i9xx8v,CryptolCO,-0.5423,You know youve had a bad week trading when your reddit ads are trying to console you,1597451830,2,1
1349,i9xjn0,wasifazam,0.0,Price Prediction for ethereum by ,1597450375,0,1
1351,i9xfmo,CmMozzie,0.0,Coinbase Earn is back with COMP,1597449951,0,1
1352,i9xe9x,Graft856,0.0,Poloniex Exchange Lists Zap,1597449806,0,1
1353,i9xcgp,nanooverbtc,0.7184,Mike Novogratz and Dave Portnoy Say Buy Bitcoin and Not Gold,1597449625,20,1
1354,i9x5ba,sphiwemlilo,0.0,Forsage Registration Guide,1597448917,2,1
1355,i9wkne,bdub3531,0.0,Selling Theta Tokens in the US,1597446825,0,1
1356,i9wk2h,OreoFugde,-0.5859,I want to sell my GoldenTea Account I dont know if this is worth something or not so how much can you offer This is my field,1597446768,8,1
1357,ih5g1c,iNaugs,0.0,POLKADOT REVIEW  THE FUTURE OF NOW,1598469698,2,1
1358,ih5akr,subilink,0.3612,Bitrue is upgrading its Financial Services by embracing the advantages of DeFi,1598469238,0,1
1359,ih50ck,ketchuma,0.93,WinOSXLinux Stakenets noncustodial Lightning DEX is now in Open Beta Whether youve never used a DEX before or youve used many wed love your feedback The community is friendly and happy to help,1598468401,0,1
1360,ih4yei,Oninteressant123,-0.34,Learn from this guys mistake Triple check that the address youre sending to is correct,1598468236,1,1
1361,ih4jxo,myhaxdontwork,0.0,Check out my gainssss said the millennial to the boomer,1598467002,2,1
1362,ih4g8m,moneyprintergo-brrrr,-0.6428,Kings Trade Capital  who else falls for this shit,1598466699,0,1
1363,ih4ftf,MsVario,0.7184,Dogecoin to the moon You have to see this k club,1598466662,4,1
1364,ih4dru,MsVario,0.7184,DOGECOIN TO THE MOON,1598466487,2,1
1365,ih4dpf,DrAntagonism,0.0,Mathew DSouza Bitcoin Pioneer Dies At ,1598466483,2,1
1366,ih4dci,LilBaja,0.0,How About That HNT Rise,1598466449,0,1
1367,ih45si,PrinceCharmin13,0.0,Litecoin vs Ethereum,1598465805,0,1
1368,ih44rt,acertenay,0.4404,What are some good crypto YouTubers to follow,1598465713,2,1
1369,ih4492,SgtHawk,0.0,Bitcoins Scarcity Game,1598465667,2,1
1370,ih3yh6,MammothSir9,0.0,Akon Joins Presidential Campaign of Bitcoin Entrepreneur Brock Pierce as Chief Strategist,1598465185,2,1
1371,ih3xk3,ziggyzago,0.0,My wife got me a shirt from the future,1598465113,5,1
1372,ih3wyd,sylsau,-0.1027,Stop Using Weak Money Like US Dollar for Pricing Bitcoin Use Gold Instead for More Accuracy,1598465063,6,1
1373,ih3w0a,Responsible-Repeat70,0.4215,Bitrue nice project,1598464980,0,1
1374,ih3uki,std2017,0.0,Swap you nut tokens to EQ ,1598464867,0,1
1375,ih3syk,Guarda-Wallet,0.5267,Questions For Passionate DeFi Users,1598464733,1,1
1376,ih3ohx,Plutusedge15,0.34,Its Part and Parcel of Crypto How Memes Drive Narrative and Value  CoinDesk,1598464343,0,1
1377,ih3mng,PotentialFortune,0.0,Why Is Ternio Blockcard Rocking it Lets ask Dan Goldman,1598464189,2,1
1378,ih3jh9,masterrhodigy,0.0,Newest Biggest Airdrop by Zolous,1598463915,0,1
1379,ih3gny,workwork3,0.128,Stakenet just launched a btcltcxsn level  dex based on lightning beta a step forward for defi ,1598463675,2,1
1380,ih3cvb,WideWorry,0.0,LeaseHold announced going to Probit exchange Verified,1598463352,0,1
1381,ih39xt,Lordmd02,0.0,Marketplace,1598463101,0,1
1382,ih32nv,CarlosCazun,0.6705,a friend wanted to make money but he didnt knew how so i told him im going to use  of his pocket and show him that he can do money if he puts the effort in This is going to be at least a  Month project,1598462478,0,1
1383,ih2wmh,sleek_98,-0.296,Its no news that Cryptocurrency is taking over the Industry Check the  New Crypto Projects to watch out for in ,1598461942,2,1
1384,ih2huk,Flat_Load,0.0,bitrue BFT airdrop,1598460645,0,1
1385,ih2dzm,wgcole01,0.0,Ripple Partner Flare Networks To Introduce Interoperability Bridge Between XRP And Ethereum,1598460294,22,1
1386,ih28ip,gkilic52,0.0,Ieo details,1598459816,0,1
1387,ih27gt,DoubleEdgeEX,0.0,Polkadot forecast and price analyses,1598459719,2,1
1388,ih1xvn,nanooverbtc,0.0,Fidelity President Files For New Bitcoin Fund,1598458874,17,1
1389,ih1qjk,Pawie999,0.0,Student Coin thoughts,1598458265,0,1
1390,ih1p7x,Individual-Cry-5209,0.0,Bitrue combining Cefi and Defi,1598458149,0,1
1391,ih1kar,CryptoWing17,0.0,Bitcoin stranded on email question,1598457741,0,1
1392,ih1glw,cdb9990,0.296,Oh yeah Lots of millionaires out there tonight,1598457430,18,1
1393,ih1gie,davidcf67,0.4939,Provide liquidity to Omen markets and get rewarded in PNK,1598457423,0,1
1394,ih1d78,blessive,0.1027,Bitcoin Ethereum and XRP Investors Eye These Critical Support Levels,1598457132,0,1
1395,ih1a93,arijitdas,0.0,Still dont get Bitcoin,1598456880,2,1
1396,ih13ij,alliswell19,0.0,The  Laws of Bitcoin,1598456296,62,1
1397,ih11ux,Sendbitcoinplease,0.0,vUpzSYSkFNyhdSCVNDUNBvHJeWKVX  btc,1598456155,2,1
1398,ih11sz,cyger,-0.0685,SEC Expands Accredited Investor Definition  Knowledge and sophistication will now be considered Not just net worth,1598456150,2,1
1399,ih11bu,ethereumflow,-0.5267,Australian company takes Ripple to court over alleged violations of trademark laws,1598456109,2,1
1400,ih0whd,jordanbevann,0.0,Blockfolio is acquired by FTX cryptocurrency exchange for  million,1598455684,1,1
1401,ih0owx,goldjade99,0.0,Democrats Request Update on Crypto Confiscated in AntiTerrorism Operation,1598455003,1,1
1402,ih0nwu,RARBK,0.0,A HyperLedger Based Client that is compatible with Ethereum ,1598454912,0,1
1403,ih0i5o,MammothSir9,-0.4939,Sources Say Worlds Largest Darknet Empire Market Exit Scammed  Million in Bitcoin Stolen,1598454389,0,1
1404,ih0hut,valcyclovir,0.4019,OriginTrail Joins the GS Global EPCIS amp CBV  Working Group to Help Shape the Global Language of Business,1598454362,0,1
1405,ih0hlk,zhell_,0.1779,Baemail The Superhero Inbox protects your time and privacy with encrypted emails on the blockchain delivered to a value ordered inbox to make spammers pay you,1598454338,2,1
1406,ih0hhx,slywalkers,0.5994,Mother of All Bitcoin Bull Runs MOABBR,1598454332,9,1
1407,ih0gdv,Novodad,0.4588,How to break into crypto  CAREER,1598454233,0,1
1408,ih0bth,Midwest_Parrothead,0.0,Filezilla users can now store their files on multiregion redundant decentralized storage,1598453798,0,1
1409,ih0asi,flying_mongoose69,0.6369,Whats the best way to cash out in the UK,1598453699,22,1
1410,igzvu0,NorskKiwi,0.0,Shinhan Bank Koreas largest launches a revolutionary Public  Private blockchain KYC service with ICON,1598452243,18,1
1411,igzpuc,Electronic-Initial76,0.0,Invest and earn in bitcoin,1598451644,0,1
1412,igzphr,MicMicgrill,0.0,Cryptocurrency from your mobile,1598451613,0,1
1413,igzltr,cyranoa4,0.0,Mastercard Files Patent for IOTA TangleBased,1598451244,5,1
1414,igzlpd,furezasan,0.0,cryptowalletbros This is what happens when you withdraw your yaLINK from Yearn,1598451232,3,1
1415,igzlod,HighrAndHighr,0.0,Announcing The Meme Protocol Yield Farming meets NFTs ,1598451230,10,1
1416,igzdy0,archozzy,0.0,CoinMetro launches affiliate program  CoinMetro Token XCM doubles in  days,1598450498,1,1
1417,igz79m,blessive,-0.1027,Dark Side of DeFi Millions USD Worth of ETH Lost to Uniswap Rug Pulls,1598449927,2,1
1419,igz2im,arijitdas,0.4144,The Bitcoin market really do be like that,1598449436,12,1
1420,igyt31,Selina_Mary,0.0,Ripples Swell  is Getting Close,1598448505,0,1
1421,igymv8,charlesgwynne,0.0,Optin Launch Date Announced for NEM Based Symbol,1598447865,0,1
1422,igydda,FdzAmanda,0.0,DZI is now farming on TRON to get Pearls Looking forward to rebase of definitiondzi,1598446826,0,1
1423,igy874,Bmighty77,0.0,networkingchicks,1598446248,2,1
1424,igy71d,StandardCA,-0.1779,Podcast interview with Emin Gun Sirer and Kevin Sekniqi of Ava Labs The Digitization of Assets,1598446124,0,1
1425,igy2we,Blaumannkuh,0.0,Opinions on Parsiq PRQ,1598445665,14,1
1426,igxyyi,Plutusedge15,0.34,FTX Exchanges M Deal for MobileFirst Blockfolio Is a Retail Trading Play,1598445203,1,1
1427,igxyo0,enyoji,0.0,Statement,1598445165,0,1
1428,igxyj4,coinsmash1,0.3612,Bitcoin leads the way in year to date asset performance,1598445153,15,1
1429,igxv4z,DudzTx,0.3182,Mass Adoption in S Korea  ICX  ICON  another huge advance,1598444739,9,1
1430,igxsnx,goldjade99,0.0,Crypto Influencer and Musician Akon Bolsters Brock Pierces Presidential Bid,1598444460,1,1
1431,igxlho,MammothSir9,0.0,Minereum Launches Crypto Bond With up To  Yield,1598443578,0,1
1432,igxi54,Remote-Flounder8,0.296,Yani ok birey istemiyorum sizden sadece baglantya basp bitcoin kazanmanz istiyorum,1598443187,0,1
1433,igxhq7,wilm007,0.0,Selfkey on Binance,1598443131,0,1
1434,igwyl3,myhaxdontwork,0.743,Tether tops Paypal and Bitcoin for average daily transfer value A part of me is happy A part of me is sad whys it gotta be Tether,1598440538,27,1
1435,igwx0t,nugget_alex,-0.2263,Ripple faces lawsuit in Australia over PayID branding,1598440314,7,1
1436,igwrmq,arthurfelixx,0.0,AI Crypto Trading Bot,1598439587,0,1
1437,igwquq,arijitdas,0.0,Bitcoin is a bubble,1598439478,5,1
1438,igwmqm,vastlinks,0.0,Custodial vs Decentralized Exchanges Whats the Difference,1598438868,0,1
1439,ii0etx,Choice-East,0.0,Ledger Backup Pack bundle offer  Ledger Nano X  Ledger Nano S ,1598588249,1,1
1440,ii0dez,Forsaken_Purchase808,0.7184,Buy to,1598588077,0,1
1441,ii0age,mhhlz,0.0,Media outlets where you can get information about cryptocurrencies,1598587722,0,1
1442,ii0a14,UnconventionalCrypto,0.4588,Will Quantum Computing Break Bitcoin amp Cryptocurrencies,1598587666,6,1
1443,ii0424,Some-Platypus-1813,0.6369,Best deal,1598586962,0,1
1444,ii02c3,blessive,0.0,Starbucks blockchain coffee tracing system chronicles every beans journey,1598586746,0,1
1445,ihzvnf,Lumin8_Crypto,0.4404,BTC News Today  Is Bitcoin Better Than CASH,1598585980,2,1
1446,ihzmff,Sanjay4129007,0.0,bitrue,1598584891,0,1
1447,ihzk6e,Aryan5497,0.0,birtul,1598584627,0,1
1448,ihzhqe,SnooPredictions280,0.0,Bitrueofficial,1598584333,0,1
1449,ihzek2,MammothSir9,0.1531,As Gold Prices Soar Two GoldBacked Tokens See Increased Demand Fetching Premiums,1598583976,0,1
1450,ihzcz4,The_Sighborg,0.0,How is buying activity  percent but price going down,1598583803,2,1
1451,ihz7g9,LennartFjeldstrom,0.6369,Best casino for crypto Roobet fast and reliable,1598583178,0,1
1452,ihyujz,Other-Illustrator980,0.0,bittrue,1598581685,0,1
1453,ihyloo,Alvipatwary,0.0,Bitrue is upgrading,1598580677,0,1
1454,ihyifa,niZmoXMR,0.0,View Token Contract on Dharma,1598580325,2,1
1455,ihyf4n,zbcom,0.0,AMACentralityCENNZnet   to spread blockchain technology to the world,1598579981,1,1
1456,ihybzn,Academic-Ad1728,0.0,BITRUE LEADS,1598579624,0,1
1457,ihyb9y,ethereumflow,-0.4215,Vitalik Buterin Outlines Biggest Threats to Bitcoin Ethereum and Crypto Markets,1598579546,2,1
1458,ihyajl,444mdzahid2,0.0,Bitrue Official Announcement,1598579468,0,1
1459,ihy1la,Analyst-Wooden,0.0,Biture,1598578485,0,1
1460,ihxus8,RokHoppa,0.0,Matic Network x MegaCryptoPolis,1598577743,2,1
1461,ihxtgt,pankaj13052008,0.0,YOUengin project,1598577591,0,1
1462,ihxpha,daniejjimenez,0.2023,Top Ethereum game Mega Crypto Polisis onboarding to Matic,1598577137,2,1
1463,ihxch2,Boring_Pound_7475,0.0,Bitrur,1598575712,0,1
1464,ihx5jl,sky_official_0,0.0,Bitrue project,1598574965,0,1
1465,ihwsck,tradervsmarket,-0.6908,Why do all Altcoins have a bearish trendline,1598573545,0,1
1466,ihwqlm,mohamedsaber00,0.7184,Buy Crypto without KYC,1598573369,0,1
1467,ihwolg,MammothSir9,-0.6597,Over  Billion EthereumBased Tokens Vulnerable to Fake Deposit Exploit,1598573163,0,1
1468,ihwbow,Greedy_Pineapple,0.5423,New Token gt SherLOCK Security,1598571829,0,1
1469,ihvyw8,troytrojan01,0.0,The summary from the IoTeX AMA with SatoshiClub is now published  They dropped some gems about the future of IoTeX in this session Check it out,1598570533,1,1
1470,ihvung,AYTechTv,0.296,Earn money simply doing tasks or get YouTube subscribers or Instagram followers or twitter followers or reddit to,1598570104,0,1
1471,ihvthk,StandardCA,-0.34,Classic proof of stake consensus algorithms dont scale  podcast interview with Emin Gun Sirer,1598569986,2,1
1472,ihvmzk,daniejjimenez,0.5267,FLETA Partners with HyperPay for Advanced Services and Security,1598569360,0,1
1473,ihvmp0,vastlinks,0.1779,How Ramp DEFI Will Unlock  Billion of Staked Digital Assets,1598569330,0,1
1474,ihvjpu,fitnesssova,0.836,Which is better Investment  BITCOIN or  ETHEREUM  This is What I Buy,1598569040,8,1
1475,ihvbtu,Vtachh,0.8074,Wanted to share my Friends Passion project a Starcraft themed DeFi Protocol PYLON Whats unique about PYLON is that it uses a real world GPU mining farm to return revenue directly back to PYLON holders,1598568264,0,1
1476,ihur84,TechFocussed,0.4939,Cathie Wood from ARK Invest Decred is promising Were looking carefully at that,1598566258,0,1
1477,ihuqug,almarti2713,0.0,Is using DeFi as a savings account,1598566220,2,1
1478,ihudj8,hanmerhand,0.0,Flamingo Finance  DeFi on NEO,1598564979,0,1
1479,ihu8qt,jam1111,0.0,Cartesi Review Layer  Scaling Linux Bridge Decentralized Games,1598564531,0,1
1480,ihu8mg,salsaszn,-0.891,Over a week ago the people of Mali and the military ousted their president and arrested several Government officials for their incompetence Now theyre being punished for it If only there was a currency that can avoid all this ,1598564522,0,1
1481,ihu1a0,malestatestanding,0.0,An Astonishing  Million Bitcoin QR Codes Generated at Bitcoin QR Code Maker,1598563856,0,1
1482,ihtmtn,lroman,0.4588,Tyler Winklevoss believes Bitcoin price is headed to  in the long term if it overtakes gold,1598562531,10,1
1483,ihtky3,MammothSir9,0.0,SEC Redefines Accredited Investors to Include Those With Proven Knowledge,1598562368,0,1
1485,iht8wz,itwasnice2cu,0.7184,Get to one bitcoin first or buy a fraction and altcoins,1598561300,0,1
1486,iht7s8,r3alz,-0.25,A bunch of coins moving to Defi then pumping,1598561193,0,1
1487,ihszi6,maniana123456,0.0,Crypto Exchange,1598560463,0,1
1488,ihsxyx,Mrbitcoinnews22,0.1027,Wealthy Bitcoin critic Peter Schiff is soliciting BTC birthday gifts for his son,1598560328,2,1
1489,ihsxs4,kleyst,-0.6124,Is this a Scam or a GOLDmine,1598560312,0,1
1490,ihsmu3,Flamingos_Go_Ha,0.0949,I made this shirt so Youtubers can stop saying it every damn video XD,1598559346,0,1
1491,ihskly,Sachin0151,0.0,Bitrue Crypto currency Exchange,1598559142,0,1
1492,ibbwx7,blessive,0.0,BnkToTheFuture CEO on COVID this is a global reset for finance,1597661537,0,1
1493,ibbu5c,cryptotapas,0.4767,Conversation with my friends reveals that we are TOO EARLY,1597661163,1,1
1494,ibbtxh,MuseOfZeus,-0.2263,Certain currencies have a uniform dip and rise graph why not earn loads from the exchange CHECK REFERENCE IMAGE,1597661134,0,1
1495,ibbgyz,parakite,0.0,What did Bitcoin Core contributors ever do for us,1597659356,31,1
1496,ibbgxr,wmredditor,0.0,Fiat is Trash A Simple Way to Understand Bitcoins Use Case,1597659350,23,1
1497,ibb9wo,team-4,-0.4767,Nano not fudding not shilling just stating badly,1597658381,0,1
1498,ibb14j,iampomo,0.0,Has DSX Global gone bust,1597657085,10,1
1499,ibakeq,GreystarTheWizard,0.3612,Could crypro disrupt services like afterpay,1597654597,5,1
1500,ibaids,arijitdas,0.4588,The construction of Akon City the  Billion futuristic city that will function solely on the akoin cryptocurrency is underway Akon says cryptocurrency will empower Africans to overcome hurdles such as high inflation and government corruption,1597654279,293,1
1501,ibafpr,parakite,0.0,Roughtime caused clock skew Incident ,1597653854,0,1
1502,ibaflr,parakite,0.0,Lighthouse Update ,1597653835,0,1
1503,ibade6,someone3245,-0.2263,How do i remove unwanted coins from Kucoin,1597653484,2,1
1504,ibadd3,Bitcoinsproutclub,0.0,Bitcoin Will Rule The World,1597653480,2,1
1505,ibac8y,andewthomson,0.0516,DFIO Token makes suprise launch on Sunday This Elite DeFi Club and Thinktank ups the DeFi Game as a serious contender,1597653310,13,1
1506,iba44j,Remstyles,0.0,A simple infographics on the features of Bluzelle,1597652047,4,1
1507,iba0oi,bitrawr,-0.5859,Failing fiat institutional adoption mining economics and brrrr The  reasons Bitcoin is beating out every other asset class,1597651527,3,1
1508,ib9xtw,abcoathup,0.0,Crypto Trends  August  ,1597651107,0,1
1509,ib9ven,blessive,-0.3818,US Post Office could turn to blockchain tech after Trump threatens shutdown,1597650736,0,1
1510,ib9tcv,peetjes,0.0,OmiseGo price raise,1597650423,0,1
1511,ib9s3t,TinokuraP974,0.0,Bitcoin Black,1597650227,0,1
1512,ib9q9t,aurumherba,-0.5994,BITCOIN auf BULLENKURS   in SICHTWEITE Die beste ANLAGESTRATEGI,1597649941,2,1
1513,ib9m2r,tamer_dnt,0.9184,Ive been following this Twitter account recently and Ive found some good picks and useful information for recent trades Its been especially beneficial in our current market climate Just posting here in the chance someone else might benefit too,1597649299,0,1
1514,ib9ldh,okay_next,0.7845,The new generation of investors is about access rather than possession preferring live dialog Crypto enables investors to engage the assets  be part of a community and engage in conversations that drive value,1597649187,5,1
1515,ib9elc,lewisbecker121,0.7783,Happy new Week friends let do business together,1597648217,2,1
1516,ib9csd,nonicknamefornow,0.296,Is this Akoin story real or its a joke it must be a joke no way people invested for real in this,1597647959,0,1
1517,ib96vm,therealcoppernail,0.0,Gifto,1597647093,2,1
1518,ib964n,cryptodiggy,0.0,Phantasma SOUL Review  NFT Interoperability amp x Potential,1597646974,2,1
1519,ib8vsw,b10m1m1cry,0.0,USA  Online exchange,1597645443,4,1
1520,ib8qo9,Bextapurlz,0.0,How to swap Monero for other coins,1597644714,0,1
1521,ib8neq,gohhan,0.2023,Bitcoin wont stay as the top coon when crypto go main streem Change my mind,1597644253,16,1
1522,ib8i8y,blessive,-0.4019,Prysm time bug behind ETH  Medalla testnet crash,1597643540,2,1
1523,ib8exl,KusEmek1,0.0,Just a reminder,1597643089,2,1
1524,ib8duo,intothecryptoverse,0.4215,Ethereum continues gaining on Bitcoin,1597642943,3,1
1525,ib8d9s,ethereumflow,0.4754,Learn Blockchain with Blockchain Fundamentals from Komodo a very helpful new addition to the Komodo website,1597642862,0,1
1526,ib8ab2,OnlyCrayz,0.0,Newbie,1597642466,0,1
1527,ib834y,PTBTC,-0.1027,Mass adoption is hard,1597641513,0,1
1528,ib80z1,joshagosh,-0.0516,Noob with tax questions,1597641219,4,1
1529,ib7vgt,Bountyhunter09,-0.4404,The Block Hight of CocosBCX Has Exceeded  Million,1597640530,0,1
1530,ib7uem,sacred_algebra_2,0.802,I am a small business interested in accepting crypto Any tips for a business to do this in a legal secure and cheap to convert to fiat way,1597640400,2,1
1531,ib7u8q,Bountyhunter09,0.0,rMarkaccyToken Lounge,1597640375,0,1
1532,ib7tto,dsfh2992,0.0,Monetizing Data Center SpacePower,1597640321,0,1
1533,ib7qwt,blessive,-0.1027,ChainLink developer activity turns red hot surpasses Bitcoin,1597639941,2,1
1534,ib7njm,UnderscoreYarn,0.6007,Is there an easier way to exchange crypto to usd in small amounts without ridiculous fees,1597639514,0,1
1535,ib7mps,aka_benezzy,0.5659,Question about solving the nothing at stake problem,1597639409,0,1
1536,ib7lxq,waiiai,0.6007,Is there an easier way to exchange small amounts of crypto into spendable USD and preferably without ridiculous fees,1597639309,0,1
1537,ib7ldg,aka_benezzy,-0.2411,Question about a nothing at stake solution,1597639243,0,1
1538,ib7iws,angieb15,-0.4404,US Postal Service Counters Trump Attacks on MailIn Voting With A New Blockchain Patent,1597638935,2,1
1539,ib7icj,sempaikai,0.0,Anyone know of any upcoming DeFi appsprojects NOT built on Ethereum,1597638867,8,1
1540,ib7dhs,jwinterm,0.0,Bitcoin versus Ethereum with Samson Mow and Vitalik Buterin on the What Bitcoin Did podcast,1597638244,40,1
1541,ib78mz,Nileke,0.0,Serverless chat with coin economycirculation,1597637651,0,1
1542,ib77p0,BYTOM_OFFICIAL,0.0,AMA Recap  Why is MOV more than just another DEX,1597637539,0,1
1543,ib6ylo,beatbahx,0.0,Ethereum  Guide for Beginners,1597636427,2,1
1544,ib6xya,Alphamunkey,-0.2263,DCA sell profits into stable coin,1597636345,0,1
1545,ib6xu5,blessive,0.0772,New Research unveils how pump and dump schemes work in crypto industry,1597636331,0,1
1546,ib6shb,SqueakyTits101,-0.3182,The struggle is real,1597635706,5,1
1547,ib6q9m,BitcoinIsDigitalGold,-0.4215,CZ Reveals The Misunderstanding They Had With DigiByte Before They Were Listed On Binance,1597635437,1,1
1548,ib6pi8,nanooverbtc,0.7964,ExPrudential Securities CEO Calls Bitcoin a Safe Haven,1597635352,5,1
1549,ib6d7y,atrueretard,-0.5859,Crash it with the USPS fud,1597633881,6,1
