,id,author,vader,title,created_utc,num_comments,score
2345,frr8oy,OfficialFreeBitcoin,-0.2263,COVID Health Workers Battle Amidst Shortage CryptoCommunity Steps Up to Help,1585576586,0,1
2346,frr4d5,martijn580,0.4019, Minute to help a startup,1585576155,0,1
2347,frr2n7,blessive,0.0,The Future of Litecoin,1585575980,1,1
2348,frr20g,yandabanda,0.2023,Top Websites to Find your Crypto News,1585575909,1,1
2349,frr0eh,coinmonks,-0.6249,March  BTC Analysis  Coronavirus Catalyzes Global Economic Crisis,1585575738,1,1
2350,frqt7y,bertalan016,0.4019,An interesting story,1585574984,2,1
2351,frq37y,ausfinex_,0.0,What should you look for in an cryptocurrency exchange,1585572154,0,1
2352,frpsjm,dunryc,0.6249,AR company is rewarding users with crypto for social distancing in their growing AR game,1585570900,9,1
2353,frpp8e,meofherethere,0.0,XTRABYTES Roadmap  Q ,1585570511,34,1
2354,frpk30,THOMAS01NELSON,0.0,Bitcoin investment,1585569889,0,1
2355,frpevc,syncmaster70,0.5859,In many ways the industry is better prepared than other sectors for the storm Crypto companies are more inclined to work remotely and are accustomed to convening in virtual space rather than meatspace,1585569240,10,1
2356,frpayv,blessive,0.2263,Wall Street giant chief fears end of debt super cycle Is crypto the solution,1585568769,0,1
2357,frp394,StandardCA,0.0,Most of our institutional clients invest in several different cryptocurrencies  Podcast interview with Marc Bhargava President of Tagomi,1585567803,0,1
2358,frp13c,StandardCA,0.0,Most of our institutional clients invest in several cryptocurrencies not just Bitcoin  Podcast interview with Marc Bhargava President of Tagomi,1585567526,2,1
2359,froypb,TrailingCrypto,0.4404,Bitcoin has and will change the world for the better,1585567224,3,1
2360,froykt,alleeycaatt,-0.2732,Swedish bitcoin pizza place risks bankruptcy due to coronavirus Our revenue is down  percent,1585567211,9,1
2361,froxha,InterBit-Investment,0.0,How to buy and sell Bitcoin anonymous ,1585567072,1,1
2362,fropr2,itsblockchain,0.0,A simple guide to understanding FTX Bull and Bear tokens,1585566121,1,1
2363,froi5n,seppmayer,0.4019,Smart contract,1585565073,2,1
2364,frntte,blessive,-0.4215,BTCUSD Stops Hit Below  on Fade Lower Sally Hos Technical Analysis  March  BTC,1585561569,0,1
2365,frnbw2,MeetMeAtGE,0.0,Bitcoin Price Falls Below  on Declining Trading Volume,1585558824,2,1
2366,frn4f7,SivaArulmani,0.3612,AMANPURI Exchanges Advantages,1585557612,0,1
2367,frmk3w,boludo54,0.7964,Hi just wanted to share this website i made that is basically a collection of widgets of different sources to see the price of bitcoin and other crypto im no pro at website building but im open to suggestions hope you like it,1585554426,18,1
2368,frmfvp,parakite,0.128,An Exclusive Interview With Pomp,1585553758,1,1
2369,frm8jg,xmr-rusticbison,0.0,Can you margin trade using PP software,1585552636,1,1
2371,frlumi,Remstyles,-0.128,Over the coming few weeks when the liquidity crisis is over Bitcoin will perform well just like gold,1585550563,60,1
2372,frlsze,snapperbuzz,0.0,The DataPowered Patient Precision Medicine Enabled by Decentralized Identity and Blockchain  Snapperbuzz,1585550332,0,1
2373,frls89,snapperbuzz,0.2103,Tokenized physical gold PAX Gold is listed on European digital asset exchange SMART VALOR to offer investor protection in a time of crisis  Snapperbuzz,1585550221,0,1
2374,frls0r,snapperbuzz,0.0,Hyperledger Fabric Installation And Build Your First Network By SANKET RAITURKAR,1585550188,2,1
2375,frlc7q,plusfivetomeow,-0.5563,What Makes a Cryptocurrency Token a Security Why Its Really Bad to Be Classified as One and How to Avoid It,1585547959,1,1
2376,frkxyp,Agcryptonic,0.0,Does Kraken Exchange give your info to the IRS,1585545938,0,1
2378,frjxy2,cinnamonmintmint,0.0,New cryptocurrency Pi,1585541208,0,1
2379,frjx2v,eth_trader_12,-0.5994,Why it is more likely for BTC to fizzle out and practically die than not,1585541108,27,1
2380,frjnrd,thuytranntmk,0.6369,I love this page,1585539976,0,1
2381,frjibl,clcys,0.0,Three major Lightning clients developers team doing an AMA with Chinese community about bitcoin and Lightning,1585539316,2,1
2382,frj8xn,soceity,0.5859,Bitcoin giveaway on Twitter   MILLION Satoshis to giveaway by LunarCRUSH Only  Days Remain Winner expected to be announced Wednesday,1585538195,0,1
2383,friwv3,SivaArulmani,0.0,AMANPURI is an unique Exchange Why,1585536797,0,1
2384,frhx6d,blessive,0.3818,Binance announces FTX leveraged token delisting to protect traders,1585532779,0,1
2385,frhtjs,hey9999,0.0,Binance doesnt even provide a price average line,1585532373,12,1
2386,frhopx,bryloc27,0.0,Investing your stimulus,1585531861,0,1
2387,frhcx6,10000multiplier,-0.2732,We are all going through some growing pains,1585530563,8,3
2388,frh03b,blessive,0.4588,Why a veteran investor believes Bitcoin will revisit its  high within  months,1585529168,0,1
2389,frgdmu,fitnesssova,0.0,Raoul Pal Makes His Bitcoin Price Prediction  Is More Than You Think,1585526890,13,4
2390,frffxr,The-Crypto-Portal,-0.1027,A review of the original Bitcoin White Paper by Satoshi Nakamoto This was obviously the genesis of the crypto revolution What do you think,1585523488,7,1
2391,frfcce,pluton63,0.0,Trump hints at a Digital Dollar Currency,1585523136,0,1
2392,frf8s5,MightyRez,0.4019,Anyone interested in a lifetime ProfitTrailer andor PTfeeder license,1585522800,1,1
2393,frez3c,PotentialMuffin0,0.7269,How long should I hold my crypto in order to avoid my profits being taxes as business income instead of capital gains in Canada,1585521845,0,1
2394,frexgs,EvanVanNess,0.0,Week in Ethereum News for March  ,1585521682,2,2
2395,frej5w,TechAdept,0.0,Reddcoin RDD Dev Team Video Update  March   Quarantine Edition,1585520271,1,0
2396,frefp3,h3xadecimal2,0.296,How to Set Up and Run the BitMEX and Deribit Market Maker Crypto Trading Bots Configure  Optimize,1585519920,0,1
2397,frdpy4,Johann9444,0.0,Cryptocurrency Question,1585517391,0,1
2398,frdlri,sylsau,0.0,While the Fed and Donald Trump speak about infinite amount USD Bitcoin is sticking to its monetary policy,1585516971,6,0
2399,frcyz3,genius3edition,-0.5563,Binance force selling the FTX tokens is very unethical,1585514756,38,5
2400,frcqub,cannotbecensored,-0.6124,Scam Crypto Giveaway Livestream Impersonating Bill Gates With  Viewers Live Now,1585513956,3,1
2401,frcqe5,set-271,-0.2023,This Guy Knew The Shits About To Hit The Fan In World Financial Markets,1585513918,15,2
2402,frcp0b,areddituser46,0.0,Looking for BlockchainCrypto Writers,1585513781,2,1
2403,frcfdw,henrikik,0.0,What happened to AnLink Blockchain NetworkAnn Router,1585512846,1,1
2404,frccsw,blabla45677,0.7184,Are there still any crypto currencies left out there that I can buy online for EURGBP without KYC,1585512613,0,1
2405,frc06f,Buttoshi,-0.1531,An example why only POW solves Byzantine Generals Problem Trustlesly,1585511421,5,0
2406,fo60ta,Kipyegonn,0.25,Analyst Warns Bitcoin Owners not to get too excited about QE,1585060166,1,1
2407,fo5wbe,Dezeyay,-0.4939,Hard forks can be a risks for DeFI NFTs and STOs Heres how Tezos avoids this issue,1585059685,0,1
2408,fo5ptj,AliantPayments,0.2732,New Coronavirus Stimulus Bill In Congress Creates US Digital Dollar,1585058992,0,1
2409,fo5oom,AffectionateDrop3,0.0,Awsome,1585058872,0,1
2410,fo5nru,MRbmx1,0.3182,i promise you will make  Bitcoin in  min when you read this post,1585058774,1,1
2411,fo56h4,JennieJohnston,0.0,Bitcoin Trooper on Twitter,1585056816,0,1
2412,fo56ci,itscbj,0.4404,Earn Pi easy,1585056806,0,1
2414,fo4vb9,Fiach_Dubh,0.4404,BRRRRRRR to  Trillion in FED printing Bitcoin amp Gold as Safe Havens Macro Voices  Mar  ,1585055501,3,1
2415,fo4i4e,Cryptocove254,-0.2944,The Tezos Foundation is proposing  million as settlement for a class action suit that has been dragging on for three years They also plan to introduce a privacy feature as they court banks who are extremely demanding,1585053893,1,1
2416,fo4f5v,telorecomiendo,0.9432,Goldman Sachs Call to Buy Gold Cheers Bitcoin Bulls Heres Why,1585053507,1,1
2417,fo49kt,jennifermiu,0.0,Bridgewater hedge funds fall further on coronavirus market rout what do you think about it,1585052745,0,1
2418,fo3two,telorecomiendo,0.5574,US Economy Recommend to Create Digital Dollar Amidst Covid,1585050655,0,1
2419,fo3o1k,whatisfomo,0.5719,Pi Network mobile mining coin now has over  twitter followers and  Insta followers it is slowly gaining traction and its Mainnet is scheduled to launch Is all the hype worth it,1585049801,3,1
2420,fo3n3i,xmr-rusticbison,0.296,How to make money with decentralized OTC,1585049661,0,1
2421,fo3gde,wnuins,0.4215,Singaporebased cryptocurrency exchange Bybit recently added tether USDT perpetual contracts to its suite of derivative products Making it clearer and easier for traders to make investment decisions using USD,1585048634,3,1
2422,fo3dhy,sysster,0.0,How is the coronavirus affecting the crypto lending sector,1585048228,0,1
2423,fo35i2,sylsau,0.25,Bitcoin HODLERS Have an Essential Advantage Over Bitcoin Traders,1585047109,1,1
2424,fo2qme,guru_seller,0.0,CRYPTO FUTURE IS HERE,1585044867,2,1
2425,fo2ks1,coinmonks,-0.8521,Never Let A Good Crisis Go To Waste,1585044064,0,1
2426,fo2eey,clcys,0.0,How Can Crypto Change the World,1585043086,0,1
2427,fo2cuy,Bort_talk,0.0772,If a CBDC is created and that fiat from the country is failing what good is it Lets assume some serious inflation is about to kick in,1585042848,0,1
2428,fo28e8,blessive,0.4404,Economic downturn erases trillions from stock market and shows just how tiny crypto truly is,1585042152,0,1
2429,fo26r3,TeraMahabir,0.6597,Good day to all I would like someone to explain to me what kind of image it is Utopia pp  what is it,1585041885,2,1
2430,fo23vo,BitexchangeDotCrypto,0.4404,Bumped on this Stay on the bright side There is a light ahead I see it ,1585041463,0,1
2431,fo22bk,ng1188,0.0,Stellar Lumens earn up to ,1585041217,0,1
2432,fo21dl,coinfunda,0.34,Can you Play Online Casino Games with Cryptocurrency,1585041080,0,1
2433,fo1w4c,beechwillow,0.0,What are Crypto Alerts How to Trade on Them in ,1585040298,0,1
2434,fo1obo,Ozi1992,0.4588,Federal Reserve pledges asset purchases with no limit to support markets,1585039022,41,1
2435,fo1dnl,LogicalBandicoot0,0.0,NOIA the first real utility coin,1585037324,0,1
2436,fo1cq1,LogicalBandicoot0,0.4215,NOIA the first true utility coin,1585037180,0,1
2437,fo1amv,LogicalBandicoot0,0.0,NOIAs Ark,1585036829,0,1
2438,fo18x2,jusjudge,0.6486,Anyone here trade coins that are worth less than the dollar or slightly over If so why and which ones I check some of them out like DASH and wonder if people normally buysell them If they are worth so little though what is the end goal,1585036530,1,1
2439,fo15hy,blockchainified,-0.4939,IOTA funds were stolen Ti k on th March  after network relaunch longread,1585035936,59,1
2440,fo15e6,epcoin,0.5994,Work from home earn passive income by refer your friends,1585035916,1,1
2441,fo12sb,LastOriginal5,0.0,Digital Dollar,1585035478,0,1
2442,fo0yma,seriousdefect,0.4767,Adoption is coming my friends,1585034816,7,1
2443,fo0vi5,mobco,0.6808,Marius Kramer on Quora says that Ripple is not gonna work because banks are still not applying it in the realworld field of finances enough for it to mature Is this true And if so to what extent,1585034323,0,1
2444,fo0t9p,Ford456fgfd,0.0,brrrrrr,1585033980,0,1
2445,fo0nri,Kipyegonn,-0.1027,As the world fights the Coronavirus TradingView is doing its part through a board that keeps track of the pandemic TradingView also accepts Bitcoin,1585033163,1,1
2446,fo0lm1,Lorgrom,0.4588,My favorite crypto casino,1585032812,0,1
2447,fo0h56,enwapame,0.0,Ways to Earn Bitcoin on Android Without Investment,1585032091,1,1
2448,fo0ccm,blessive,0.5423,Bitcoin Surges on Stock Market Optimism for Coronavirus Stimulus,1585031357,1,1
2449,fnzxo8,Plus-Entry,0.0,How to get cryptocurrency at ,1585029087,0,1
2450,fnzqwr,intothecryptoverse,-0.2263,Bitcoin is showing strength during this global crisis,1585028100,8,1
2451,fnzpxh,wengchunkn,0.7184,NRoulette a novel open source online roulette project to reward programmers and roulette ladies with IDless interface to cryptocurrencies,1585027958,2,1
2452,fnzfvh,cheatacristina,0.0,New to trading crypto,1585026551,0,1
2453,fnywfx,blessive,0.0,BTCUSD Moderates After Trading Above  Sally Hos Technical Analysis  March  BTC,1585024167,0,1
2454,fnxr80,DigitalInstincts,0.25,Solana  dutch auction on coinlist goes live in  hours  algorandstyle price guarantee,1585019166,4,1
2455,fnxe9z,Purtoga,-0.4404,Steem Fork Faces Legal Threat From Mining Firm Over Hive Name,1585017669,4,1
2456,fnxe97,BigBadBeattle,-0.4019,Discord for Crypto,1585017667,0,1
2457,fnx8y0,DarkestChaos,0.6369,Will Endless Money Printing Benefit Bitcoin  Daily Cryptocurrency News LIVE March rd ,1585017067,0,1
2458,fnx827,blessive,0.0,New featurerich Uniswap V to launch in  Q,1585016963,0,1
2459,fnx7sg,MemoryDealers,0.802, buy in Blockchain Poker tournament Join now,1585016936,0,1
2460,fnx0an,jayx239,0.0,What would happen,1585016066,0,1
2461,fnwmew,ewaters77,0.5574,Explanation Please  how is it possible that all of these coins always follow the same pattern following BTC in sure Kind of impossible right,1585014500,72,1
2462,fnwdzh,AnOblongBox,0.0,BTC Technical Analysis Tonight March    EST,1585013594,3,1
2463,fnwbv8,blessive,0.0,What Bakkt Could Do LongTerm For Bitcoin,1585013370,2,1
2464,fnw3hu,thats_so_over,0.0,BTC continues to rise why,1585012437,27,1
2465,fnw0sh,QtotheM,0.0,The Fed Today,1585012140,1,1
2466,fnvuc2,MariusDarkq,0.0,Get  in TELEGRAM crypto,1585011416,1,1
2468,fnvhkh,bitcoingamblingdice,0.0,BITCOIN REVIEW  PM,1585010061,2,1
2469,fnvcxi,NadKingKool,0.7096,Is Tether inflating our precious internet money,1585009587,0,1
2470,fnvaol,PopLab_Ads,0.0,How to become a Blockchain Expert,1585009359,0,1
2471,fnulqw,GreenGoblin05,0.5859,Hey guys Im brand new to Reddit and Crypto basically I started off very small just to get my feet wet by buying  worth of BTC I plan on using crypto as a savings account for myself instead of stocks Any suggestions Thanks,1585006793,0,1
2472,fnufl4,blessive,0.296,This relatively small amount of money will pumpanddump Bitcoins price,1585006153,0,1
2473,fnu4gw,flv24,-0.1027,I think dash is trying to warn us about whats going to happen in april,1585005016,10,1
2474,fnu4a2,thecrash1001,0.0,In COVID Stimulus US Congress Eyes Digital Dollar to Send Aid to the Unbanked,1585004996,0,1
2475,fntmnv,dereksilva,0.0,Power in Numbers BRD Integrates Orchids Digital Currency OXT,1585003228,0,1
2476,fntm9x,joenorwood77,0.0,Discussion of the Day WAVES,1585003187,5,1
2477,fnsxl5,Jamalkm732,0.0,Deflexchange,1585000799,0,1
2478,fnsky5,MFRubbers,0.0,WHALECOIN The Rarest Crypto In The World  Max Supply,1584999586,7,1
2479,fnsko5,pandeybhvsh,0.0,Drive into the online investment business,1584999562,0,1
2480,fnsaux,Ripple12345,0.0,Here comes the digital dollar,1584998667,5,1
2481,fns2zc,BrianAtSantiment,0.4019,Ethereums Daily Active Addresses Have Risen to Month Highs After Black Thursdays Price Retraction,1584997970,3,1
2482,fnrkw9,deusopus,0.0,purchasing an item on craigslist with cryptocurrency,1584996313,0,1
2486,fnql6r,nelsonblaha,0.128,Economy in trouble print more Bitcoin,1584992997,17,1
2487,fnqdrb,Mountain-Conflict,0.7003,Numerous regulations issued by countries of the world have created a special trend that will determine the industry over the next years  the lowest volatility is the key to success in global adoption,1584992310,0,1
2488,fnqcj6,rdal42,0.0,Bitcoin Faucets,1584992196,0,1
2489,ff3xe4,averagejoedothealth,0.34,Scottish Privacy amp Security Firm Maidsafe MAID Publish Big Milestone with Baby Fleming Release,1583625173,9,1
2490,ff3oy8,SwervynBurban,-0.3182,Is it really decentralization if CountriesGovernments can ban or regulate it What is the solution,1583624162,0,1
2491,ff3dc3,C0C0zz,0.0,What are your thoughts on the effects of internaional health issues on the price of BTC,1583622777,0,1
2492,ff36fe,Discounted_,0.0,New Way of scaling decentralized payments,1583621964,0,1
2493,ff2x2c,PEMZYBOY,0.0,crypto trading,1583620875,0,1
2494,fbevbw,azintel1,0.0,Crypto trading bots,1582993487,1,1
2495,fbesci,michae2xl,0.0,Netflix Serie AlteredCarbon is showing Bitcoin and few others  T  episode  min,1582993157,5,1
2496,fbepuu,ninjajaguar,0.0,How much of your overall investment portfolio is in crypto,1582992885,22,1
2497,fbek01,Michaelallenking,0.0,Bitcoin on Ethereum with pTokens now is reality,1582992225,4,1
2498,fbehdq,roamingandy,0.6969,Right now investors are dumping their stocks If a few big institutional investors decided to switch it into crypto theyd spark a bull that would utterly dwarf our last silly season as others see crypto rise as wall st falls Seems so obvious im surprised none have done so already,1582991945,5,1
2499,fbe4d5,DarkCrypto118,0.3182,Popular discord servers on daily crypto talks I can join anyone,1582990419,0,1
2500,fbdw62,Z0rasen,0.2732,Buy the bear tokens  instead of the dips,1582989443,0,1
2501,fbdtmt,blessive,0.0,Bitcoin and Black America Is There a Stigma Around Cryptocurrency,1582989137,1,1
2502,fbds2w,cindydaily,0.0,Bitcoin Cash Maximalist Vs Bitcoin Maximalist  BCH Vs BTC Bet ,1582988952,4,1
2503,fjlhh6,itsblockchain,0.0,Bakkt raises M from Microsoft Pantera and other venture capitalists They have plan to release consumer application soon,1584367592,13,1
2504,fjldoa,jigglypuffies21,-0.1531,Is now a good or bad time to invest in Cryptocurrency due to the effect of Coronavirus on the market,1584367159,0,1
2505,fjlcnj,CryptoSorted,0.9001,Top  Best Cryptocurrencies to Buy NOW ,1584367042,0,1
2506,fjl4dr,anttiviljami,-0.4019,ERC Toilet Paper Coin,1584366068,4,1
2507,fjku2h,MK333666,0.0,Russia is banning the circulation and issuing of Cryptocurrencies,1584364841,12,1
2508,fjku0k,bumbim22,0.0258,So How much  have you Saved for the Crash,1584364832,0,1
2509,fjkt1v,FD1313,0.0,LGC,1584364711,0,1
2510,fjkr6u,stvmcg,0.0,Crypto Financial Sovereignty Interview with John McAfee,1584364458,0,1
2511,fjkhr1,martinkarolev,0.1027, US Dollar worth of German Paper Money during a period of hyperinflation ,1584363254,4,1
2513,fjk97e,gnat777,0.368,TOP        Bitcoin,1584362136,2,1
2514,fjk8ee,Maxgarfield,0.0,Revolutionize your crypto trading,1584362030,0,1
2515,fjk1ku,Oldcontribution2,0.0,Is USD Coin USDC available in USUKEurope Any experiences using USDC on CoinbaseKraken here,1584361102,0,1
2516,fjjsa2,netrunnernobody,0.0,Coronavirus and Cryptocurrency How It Affects You,1584359810,1,1
2517,fjjojb,ShibN,0.0,Streamies Democratizing Content Generation and Distribution Using the Power of Blockchain  The Bitcoin News,1584359263,0,1
2518,fjjmcu,riddeledwitholes,0.6369,Today is the Greatest Day of Our Lives,1584358945,17,1
2519,fjjm80,nathanielx9,0.0,Gold vs Bitcoin,1584358927,3,1
2520,fjjinc,Askrypto,0.0,Bitcoin Slides  to K Black Monday,1584358372,0,1
2521,fjj2v9,blessive,-0.296,Federal Reserve Cuts Rates to  as Bitcoin Follows Stocks,1584355937,1,1
2522,fjj0fx,dtek991b,0.0,Should I invest in Bitcoin while its down,1584355528,0,1
2523,fjiylh,CryptoWeather_online,0.7096,This is not over Not end of crypto We are in the same boat Good luck everyone,1584355224,7,1
2524,fjiwob,ProfessionalMuffin4,0.0,Bitcoin Ether and XRP Weekly Market Update March  ,1584354879,0,1
2525,fjiwa4,BitcoinPike,0.5423,A New Amazon That Accepts Cryptocurrency Launched Globally,1584354815,2,1
2526,fjiv6f,feelthehatred,0.0,Hang on HODLkitty,1584354638,1,1
2527,fjio8x,AirlessWombat,0.4019,Help for a novice scrub ,1584353492,0,1
2528,fjim4f,sschat,0.0,While cryptocurreny is still waiting for some basic mass adoption things are about to get real here,1584353132,3,1
2529,fji8zd,smbale,0.0,Bitrump the Multicurrency Cryptoasset Exchange is open for White Labeling,1584350962,0,1
2530,fji8ev,reko91,0.3612,Whats your portfolio look like,1584350863,22,1
2531,fji4kp,SummerOT,0.5719,EASY NO INVESTMENTS     PER DAY   NOOB FRIENDLY,1584350223,0,1
2532,fji2j9,Gubbe85,-0.4019,Bitcoiners are toilet paper hoarders,1584349851,0,1
2533,fjhxp5,AcrobaticEar3,0.0,succes always,1584349034,0,1
2534,fjhxdx,nycityinsomniac,-0.4927,Im completely irresponsible and about to be liquidated,1584348978,97,1
2535,fjhpxg,UnableView0,-0.5106,To exchanges offering margin  reduce the max leverage bring back sanity,1584347681,0,1
2536,fjhb2g,blessive,-0.5423,Bitcoin searches on Google are rocketing upward even after the massive drop heres why,1584345124,1,1
2537,fjh5tc,taylorzhangc,0.5994,Help Wanted Latin America Crypto Community Freelance Job,1584344246,0,1
2538,fjgxvu,-0-O-,0.4088,Couldnt help but laugh at lifetime rewards going down due to the value being presented in USD,1584342950,4,1
2539,fjgwp4,InevitableStress3,-0.5423,Bitcoin Price Drop Is This the Right Time to Step Up Buying Digital Coin,1584342752,0,1
2540,fjgmpk,EAW_astro,0.0,Spread the word,1584341186,86,1
2541,fjgmos,CopyWiz20,0.3612,Advice on Asset Management,1584341181,0,1
2542,fjgjhq,shuhu43,0.4215,Nice crypto,1584340643,0,1
2543,fjgg8j,cryptolamboman,-0.5574,This Corona Situation and you all think Banks will bankrupt and people will go to Cryptos Think again,1584340133,135,1
2544,fjg8zi,hok98,0.0,Any opinion about this new ICO alternative called the Lockdrop,1584339004,1,1
2545,fjg7te,Cresource_,-0.296,No Of Bitcoin ATMs by country From which country you are,1584338821,3,1
2546,fjfqm1,mirrasel,0.6249,Is it a good time for the newcomers to join the market,1584336240,25,1
2547,fjfnc9,DT7890,0.6369,If you love Telegram check out our messenger for Telegram,1584335763,0,1
2548,fjf0wo,NambaCatz,0.3612,Looks like all the CROOKS cashed out ,1584332636,1,1
2549,fjf0ec,Littlestan,0.0,For those wondering what the Federal Reserve is and how it dictates practically every major financial choice in the US and beyond,1584332562,12,1
2550,fjeshk,amithasan1994,0.0,Bitcoin and cryptocurrency secret strategy to make K a month,1584331482,4,1
2551,fk4iud,axomutugo-1131,-0.128,New Funny Videos   People doing stupid things P,1584448690,0,1
2552,fk4eng,surajsomish1133,0.1779,What does the future hold for Indias cryptocommunity after reversal of cryptoban by SC  Blockchain Application Development  Somish Blockchain Solutions,1584448177,1,1
2553,fk4edm,jack_knowles,-0.296,Sending USDC from Coinbase  no send button available Little new whats going on,1584448143,0,1
2554,fk48jb,RalphJameson,0.0,Finally,1584447376,2,1
2555,fk48db,wallynext,-0.765,Spain Italy France and Belgium Ban Short Selling,1584447353,15,1
2556,fk466u,wallynext,-0.765,France Belgium Spain and Italy Ban Short selling,1584447072,0,1
2557,fk44tt,NewportToIndiana,0.0,Last Wednesday,1584446893,2,1
2558,fk44gn,blessive,0.0,Philippine Stock Exchange shuts down almost indefinitely,1584446849,0,1
2559,fk437p,itsblockchain,0.2023,Top  Blockchain companies in the world,1584446695,2,1
2560,fk42v4,industrywired,0.2023,Top Trends in Cryptocurrency Everyone Should Look For in ,1584446651,0,1
2561,fk3evm,blessive,0.6597,Binance stablecoins exponential growth shows crypto investors are flocking for safety,1584443233,0,1
2562,fk38wx,adamxrt,0.0,Anyone buying OXT ORCHID,1584442384,0,1
2563,fk36fm,gjhech,-0.4019,I just got hacked,1584441996,0,1
2564,fk32ls,nugget_alex,0.743,Emergency Policy Implemented Worldwide To Save Global Economy Is All Bullish For Crypto,1584441407,11,1
2565,fk2ywg,beechwillow,0.0,Bitcoin and Altcoins Recover Signaling More Possible Upsides,1584440832,0,1
2566,fk2vop,fittes7,0.0,Even kids understand that,1584440325,7,1
2567,fk2rl1,ShibN,0.0,Announcing Rhovit and ChainX Listing Event  Crypto Shib,1584439691,0,1
2568,fk2p48,ae-support,0.0,Coin Perspective   An Interview with Crypto Lawyer Thomas Ngele,1584439320,1,1
2569,fk2k7z,JuniorCar,0.4588,Monopoly Shows why the Recent Fed Measures Cant Work in the Long Term,1584438634,1,1
2570,fk2aaf,Crypto_Patrick,-0.7184,Sell Naww,1584437162,2,1
2571,fk26i7,Apps4Life,0.0,RPK  Recoverable Private Keys,1584436499,35,1
2572,fk1itm,jeneeshkap,0.0,Blockchain Cryptocurrency Marketing Job,1584432495,0,1
2573,fk1ijl,blessive,0.4588,Global interest for Bitcoin could be about to explode heres why,1584432443,1,1
2574,fk1835,Dan_theGman14,0.3612,Help Using BTC to Exchange CADUSD as Bitcoin Noob Safely and Without Large Fees Fiance Stuck in Venezuela With No Options,1584430714,0,1
2575,fk14zx,EyeofHorus777,0.0,BTC vs BCH,1584430237,0,1
2576,fk0igt,DogGodFrogLog,0.0,MakerDAO Governance Community Chat  Compensating vault holders that liquidated at  bid,1584426767,3,1
2577,fk0hc9,mobfather,0.0,Triffic dApp Goes Into Public Beta,1584426592,0,1
2578,fgbr2v,yandabanda,-0.836,PLUS Token Scam Dumps Another  BTC M May Be Responsible for Bitcoin Drop,1583836340,0,1
2579,fgbqnh,Tige-Rkitty,-0.0516,MiddleEastern Financial Crisis Presents Huge Opportunities for Cryptocurrencies,1583836274,0,1
2580,fgbixo,MartinKongMing,0.296,TokenPocket  Join our AMA of DeFi at  am Mar   UTC,1583834932,0,1
2581,fgbikb,muchacho_pl,0.5267, BAT purchased by Brave,1583834860,46,1
2582,fgbfjx,Pinnymc,0.4767,Staking Rewards,1583834324,0,1
2583,fgbdxb,nugget_alex,-0.4939,Italy Suspends Mortgage Payments For The Entire Country As Financial System Faces Collapse,1583834053,2,1
2584,fgawcs,icocatapult,0.0258,Community Matters  Chainlink Edition by DAO Maker,1583830882,0,1
2585,fganjv,aminok,0.296,Fatburger Experiments With Securities Issued on Ethereum,1583829172,2,1
2586,fgadwf,Mostlywater55,0.0,Anyone else dealing with Robinhood being down AGAIN,1583827372,0,1
2587,fgabtn,Tasha_Lyons632147,0.0,New Decade Resolutions  ,1583826974,2,1
2588,fgaac7,sarfaraj_patel786,0.0,Market CommentarySELL AUDCHF,1583826689,0,1
2589,fga8es,nareal12181,0.4019,Another interesting journey,1583826302,1,1
2591,fga0o0,JohannesKanter,0.34,Is issuing security tokens in  a viable way for funding,1583824846,0,1
2592,fg9xyb,megastef33,0.0,Rejoignez le rseau,1583824359,0,1
2593,fg9gpq,blessive,-0.7184,Oil Deal Collapse Hits Markets Reeling from Coronavirus Fears,1583821268,0,1
