,id,author,vader,title,created_utc,num_comments,score
1030,gz3o2l,[deleted],0.4019,Chainalysis Introducing Investigation and Compliance Support for Dash and Zcash,1591637193,0,1
1031,gz3k05,pale_blue_dots,0.5719,Would like to see a discussion on crowdstaking Its supposed to be a liquidityfocused amp communitybased alternative funding model with a vision to mitigate risk align incentives and bring control back to token holders,1591636841,0,5
1032,gz3iol,taslid,0.0,A digital currency,1591636725,0,1
1033,gz39il,4rindam,0.0,Reliance wants entry into Blockchain industry,1591635929,0,0
1034,gz38bp,HyperHyperion,0.0,Tax on CrytpoCurrency Belgium,1591635836,0,1
1035,gz2z3v,mclovinplasse,0.0,Understanding Crypto lendingborrowing,1591635046,0,1
1036,gz2s73,Aftert1me,0.0,IOTA  new Hornet node,1591634442,21,14
1037,gz2ges,Auxanos,0.4019,Any crypto games worth playing,1591633411,0,1
1038,gz2fe8,MaynulHoqueMH,0.7783,What is the Best Cryptocurrency on this Time I want invest So Comment your Suggestions please,1591633330,0,1
1039,gz2bch,wwtctoken,0.0,Airdrop has started you can avail cryptocurrency here,1591632965,0,1
1040,gz2ajz,bawdyanarchist,0.0,Chainanalysis Report for  Privacy Coins,1591632887,58,71
1041,gz284l,cellardoorProgrammer,0.0,Decided to pull the trigger on a bunch of alt coins on Coinbase and monero from Kraken,1591632676,35,14
1042,gz24qf,NetworkTerrible,0.0,Guys do anyone know why I cant creat my vault,1591632372,2,1
1043,gz1wzn,cyrotecx,0.5319,MAKER MKR gets a MarketCap BOOST,1591631672,0,1
1044,gz1pc0,MagneGM,0.0,Not receiving my bitcoin,1591630988,35,7
1045,gz1n95,Deadper3,0.3182,Indian Telecoms Secures B From ProCrypto UAE Fund,1591630796,0,2
1046,gz1i0g,Mrbitcoinnews22,0.4404,Bitcoin Price K Within Weeks Recovery Mimics   Bull Run,1591630333,0,1
1047,gz19ip,bhaveshaNew,0.4404,Analyst Predicts Next Bull Run Will Send Bitcoin to K and Ether to K,1591629564,13,0
1048,gz14hn,heist95,0.2732,Coinbase is fueling increased US govt surveillance of cryptoassets,1591629110,91,352
1049,gz0ue1,pangux,0.0,Why quant Network will be massive  Overledger explained,1591628216,2,1
1050,gz0sby,SundayBestDay,0.34,German Federal Office for Information Security BSI mentions VeChain and OriginTrail as the future Blockchain Supply Chain Management market leaders,1591628020,32,156
1051,gz0qqm,pangux,0.0,WHY QUANT NETWORK WILL BE MASSIVE  QNT PRICE PREDICTION  OVERLEDGER EXPLAINED,1591627873,1,1
1052,gz0ptf,whycantichooseausern,0.0,The Rise of USDT and DeFi,1591627781,2,2
1053,gz0o1v,chrysotileman,0.5859,Set up a Zeeves Tipping bot and win Zil  follow simple instructions on Tweet,1591627612,0,0
1054,gz0bn5,sylsau,0.0,Without Bitcoin Blockchains Technology Has Nothing Revolutionary,1591626433,4,0
1055,gz00tr,[deleted],-0.25,The Paper Network an option for your grandma to adopt Bitcoin,1591625386,2,1
1056,gz00gb,Edge_Coleman,-0.5574,Chinese police discover illegal bitcoin mining activities,1591625352,0,1
1057,gyzyha,MammothSir9,-0.0516, of Coinbase Users Willing to Leave the Exchange Due to Mounting Privacy Concerns,1591625175,0,1
1058,gyzs7y,vyroc_team,-0.0516, of Coinbase Users Willing to Leave the Exchange Due to Mounting Privacy Concerns  Exchanges Bitcoin News,1591624592,2,1
1059,gyzomr,kergocaslopus,0.0,Looking for female cryptotraders Im a female documentary filmmaker and BTC Hodler Looking to interview female cryptotraders for a new experimental documentary about female traders of crypto,1591624231,0,1
1060,gyzhxx,Snoo_56583,0.0,Parttime Job,1591623546,0,1
1061,gyz8aa,softlaunch,0.0,The Escobars Believe Theyve Found the Real Satoshi,1591622529,1,0
1062,gyysu2,h3xadecimal4,0.743,I built a whole bunch of AIs from sexy to funny and one based wholly on Reddit,1591620933,0,1
1063,gyyr7p,cryptomir,0.6369,Best Altcoins to Invest in Today,1591620746,5,0
1064,gyygkf,Mrbitcoinnews22,-0.4939,Ransom Costs for Stolen Data Rose  From  to ,1591619546,0,1
1065,gyy23e,DravenChenZhen,0.0,Just a few days left Live Webinar The Beginners Guide to Game Monetisation with Blockchain,1591617838,1,4
1066,gyy0ki,wgcole01,0.0,Ripple Executive Says About  Financial Institutions Have Joined Its Global Payments Network,1591617660,7,0
1067,gyxvjn,pihusingh,0.0, What Do You Understand By Nonce In Cryptocurrency,1591617043,0,1
1068,gyxtao,BrickOrBuild,0.0,One paragraph to explain blockchain technology and its potential to a  year old man who thinks the US governmet is king,1591616731,0,1
1069,gyxrkd,clappercoda,0.5859,Make sure your GPUs are ready for the summer,1591616519,4,14
1070,gyxqva,Anas9500,0.3182,Blockchain in Finance An Alternative Solution,1591616421,0,1
1071,gyxn0v,ggabriel8,0.0,Dont Use Xapo,1591615915,2,0
1072,gyxj9e,CalmSteady,0.0,USDT,1591615439,0,1
1073,gyxiu8,MyCoinStory,0.0,Thousands of Bank Accounts of Crypto OTC Traders in Chinas Guangdong Are Frozen by Local Police,1591615388,1,1
1074,gyxgph,lakersbaker,0.3182,Bill Gates actually tells the whole truth,1591615098,1,1
1075,gyxflz,Selina_Mary,0.2263,ETHUSD Blasts Through Resistance At  Will Next Resistance Level Allow For ,1591614949,0,1
1076,gyxat7,Habibcensus,0.0,The Emergence of Decentralized Finance,1591614323,0,1
1077,gyxaga,[deleted],0.0,Blockchain Pervades Space Industry,1591614278,0,1
1078,gyx4yn,Czfacts,-0.5423,Research Revealed Drop in Trading Volume of USDC Despite Market Recovery,1591613542,0,1
1079,gywqte,Iamcursed,0.0,Anyone knows who are people behind this project  Sweden coin,1591611561,0,1
1080,gywesa,Cresource_,-0.4588,Cryptocurrency markets recover from weekend dip with  billion injection,1591609849,6,1
1081,gywdnn,mec2019,0.0, usd,1591609677,1,1
1083,gwng5r,areddituser46,0.0,Bloomberg Report Predicts Tether Will Overtake Ethereum,1591296315,8,1
1084,gwng4v,elizasbreath,0.4019,Thought this was interesting,1591296313,59,1
1085,gwn4tr,SavagePancakez,0.0,Shitcoin collection,1591295358,2,1
1086,gwn3f4,SoDakZak,-0.6705,Reddit is being polluted with cryptocurrency spam accounts,1591295237,28,2
1087,gwn2nk,Throwaway17396054,-0.6124,Us  Scam,1591295172,0,1
1088,gwmx7e,ThePowerOfPoop,0.0,Deflationary Tokens,1591294713,17,0
1089,gwmwot,coutenho,0.2732,Brooklyn art collective creates gallery of works made entirely with ETH NFTs,1591294669,6,1
1091,gwmhlf,[deleted],0.6369,Whats the best way to get into and earn Crypto Currency,1591293422,2,1
1092,gwmd21,BrokeronWallst,0.8494,TIP  TICKER SHIP is moving up from  cents to  BuY SHIP NOW THANK ME LATER ,1591293027,2,1
1093,gwmbjk,TheCryptoKang,-0.0572,The SECRET Bitcoin chart they dont want YOU to see aka Im showing you exactly whats going to happen,1591292899,4,1
1094,gwm4jv,jovan1990,0.0,WMA IEO,1591292312,2,1
1095,gwlnqa,Mrbitcoinnews22,0.0,Crypto Exchange OKEx Launches Ether Options EOS Options to Follow,1591290869,0,1
1096,gwlig9,RonTurkey,0.2006,Hey all Im looking to dump all my BCH for another coin Which trading pair looks most favorable,1591290418,2,1
1097,gwld0g,sylsau,0.3818,Vires in Numeris Bitcoin Is Stronger Than Ever,1591289960,3,1
1098,gwkk68,Sheikhupuri,0.296,Googles Partner  Join and Earn TFUEL Coins  Watch Streams Earn Crypto,1591287471,0,1
1099,gwkgld,takito565,0.296,Cryptocurrency Firms Now Recognized as Money Service Businesses in Canada,1591287153,2,1
1101,gwjvg2,bitcoiner014,0.0,Bitcoin Is a Paradigm Shift Beyond Wall Street,1591285302,1,1
1102,gwjkbi,bitcoiner014,0.4588,Bitcoin will approach record high of about  this year,1591284336,0,1
1103,gwj92n,TrailingCrypto,-0.7184,Trailing Limit Sell,1591283348,1,3
1104,gwj70p,MammothSir9,-0.2732,Japanese Finance Minister Shoots Down Plan to Cut Bitcoin Tax to  Cites CryptoDivide,1591283174,0,1
1105,gwj4e2,arryanna,0.0,Eidoo to Burn  of Companys Token Holdings to Kickstart One of the Biggest Daos in Defi  Sponsored Bitcoin News,1591282947,6,9
1106,gwiptf,[deleted],-0.3818,Bitmains Feuding CoFounders Are Fracturing the Firm and Staff Are Caught in the Middle,1591281650,0,2
1107,gwimih,TheWierdGuy,0.5719,Excellent video explaining why there is so much hype around Ethereum lately,1591281351,8,2
1108,gwimdl,dribbleon,0.3182, Reasons why hiveterminals solution is leading the blockchain factoring revolution,1591281337,1,1
1109,gwibut,Max_Roc,-0.2411,Are there any diy cold storage options for altcoins not supported by trezorledger ,1591280391,1,1
1110,gwi7j7,[deleted],0.4588,EthereumBased Interest Rate Benchmarks Suggested by Federal Reserve Chairman,1591279966,0,1
1111,gwi22n,IceHistory0,-0.3612,History of the US Debt Clock,1591279471,10,2
1112,gwhu3q,blessive,0.765, trillion asset manager Fidelity Crypto assets will continue to gain institutional adoption,1591278748,0,1
1113,gwhrkd,lketchersid,0.0,Recap of Blockstack  testnet  neon phase,1591278507,0,1
1114,gwhi4s,coinsmash1,0.0,Bitcoin makes th consecutive higherlow in the last  days,1591277541,3,1
1115,gwhgf2,rkvinyl,-0.4019,Craig Wright Fights Back You Dont Understand Digital Signatures At All,1591277369,1,1
1116,gwgmsa,Hyrter,0.1779,A new growing coin called Pi Made for everyone,1591274206,0,1
1117,gwgfpm,Hyrter,0.1779,New growing coin called Pi Made for everyone,1591273437,0,1
1118,gwgd7i,kdewdrop,0.0,Elon musk legit,1591273149,3,1
1119,gwgc7e,Unhappy_Shopping,0.5106,Kick Ecosystem CEO has written a message community revealing plans and expressing gratitude,1591273032,0,1
1120,gwfxm3,slywalkers,-0.6072,Dont buy George Floyd Token or FLYD,1591271330,0,1
1121,gwfgtb,SergioDemianLerner,0.0,AMA Session with Sergio Lerner,1591269286,76,1
1122,gwfcmu,MammothSir9,0.659,Exponential Growth Bitcoins Trading Volume Could Rival Major Asset Classes,1591268773,1,1
1123,gwf9nm,TommyofLeeds,0.296,Bitcoin Is A Peaceful Protest,1591268424,2,1
1124,gwf88h,btsfav,0.0,My thoughts on Closed Beta Liquidity Search Engine Matcha,1591268248,0,1
1125,gwf5ln,nikhilsaraf9,0.0,Bitcoin vs Altcoins,1591267918,0,1
1126,gwf015,39T5fqdsRustdroAJK2H,-0.296,The Generational Divide in Crypto  It Has To Stop,1591267195,3,1
1127,gweq00,FunkyGrass,-0.6124,BlockFi Legit or Scam,1591265826,41,1
1128,gwelh3,AWest_42,0.0,Bitcoin mining investment,1591265182,1,1
1129,gwekg7,JuniorCar,0.0772,A study by UK consumer rights advocate found that among  high street banks  had inadequate measures for logins and two for account management including approving new payees and editing account details,1591265045,8,1
1130,gwe30p,_Plexus_,-0.4404,Bitcoin art  Genesis Block ,1591262663,0,1
1131,gwe06l,RoughRisk,0.6369,Bitcoin  Best cryptocurrency to invest in ,1591262289,4,1
1133,gwdtuf,CoinjoyAssistant,0.0,TON Explained What Was TON And Is It Really Over,1591261440,0,1
1134,gwdb9b,Bit2buzz,0.0,Why are we building the Crypto PR and Tech Media Agency from India,1591258933,1,1
1135,gwd8ra,yningc,-0.128,Discussion about the offline and offchain tech,1591258577,1,1
1136,gwd8a8,Arkelator,0.4754,The most popular Steem dapp just migrated to rival network Hive  Decrypt,1591258511,1,1
1138,gwcsd7,DravenChenZhen,-0.0516,How to solve pending stuck transactions on Ethereum,1591256381,4,1
1139,gwcroq,longtimeamb,0.0,Quant network,1591256290,0,1
1140,gwcp4e,cryptoadventura,0.0,Beginners Guide to Cryptocurrency Margin Trading,1591255963,1,1
1141,gwcoyw,aurumherba,0.0,Bitcoin NIE WIEDER unter   US Dollar  Kryptowhrungen News deu,1591255942,2,1
1143,gwcfwi,areddituser46,0.4588,Bitcoin Three Year DCA Out Performs Gold By a Long Shot,1591254736,10,1
1144,gwccx5,WannaBuildASpaceman,0.4019,Issues with Bittrex Exchange Support,1591254333,0,1
1145,gwcakr,wailok3,0.5719,Tokenize your brand Reward your customers,1591254046,0,1
1146,gwbza0,obailukan1994,0.9299,All of the success of WM project goes to the strong and amazing team and has team work very active and promisingobailukan,1591252555,0,1
1147,gwbng7,futurevee101,0.0,What do you think of Mobile Cryptocurrencies,1591251098,17,1
1148,gwbm1w,intothecryptoverse,0.0,ETHBTC approaching historical resistance,1591250925,5,1
1149,gwbgw0,Qebly,0.0,Ways to start trading in z,1591250315,0,1
1150,gwbdu0,blessive,0.0,Ethereum price consolidating after volatility analyst,1591249943,0,1
1151,gwb30f,trav_krazy,0.34, TINY COINS THAT HAVE POTENTIAL GAINS OF MILLIONS,1591248653,2,1
1153,gwaybn,theochino,0.0,CryptoCowboy rapper running for Congress in New York State,1591248117,0,1
1154,gwaw43,runvnc,-0.5859,Have you guys seen these SpaceX stream bitcoin scams,1591247844,3,1
1155,gwaqcq,Blockchain_org,0.0, Crypto Trends For The Next  Years,1591247174,0,1
1156,gwamiw,pihusingh,0.0,Beginners Guide To WazirX PP Exchange Indian Exchange,1591246730,0,1
1157,gwajca,blessive,0.0, an Early Hurdle for BTCUSD Sally Hos Technical Analysis  June  BTC,1591246347,0,1
1158,gwa94b,trungn1993,0.0,Similar projects to Theta to earn tokens,1591245143,0,1
1159,gw9nve,blessive,-0.4019,Ethereum XRP and Litecoin Outperform Amidst MarketWide Crash,1591242743,0,1
1160,gw9mgw,bb8866999,0.296,You can do it too lots of people are earning and testifying join us now with just  and earn over  investing,1591242584,5,1
1161,gw9mdr,BitsAndBobs304,0.0258,are there middlemen companies that allow customers to pay with creditdebit on your website and pay you out in crypto instead of the many services that do the opposite,1591242573,2,1
1162,gw9bhg,Stonekrypt,0.0,Fishing  for Private Keys at the LA River with the Shieldfolio Stonebook,1591241362,4,1
1163,gw9452,eztjeric,0.0,Joine the pioneering stage ECOINS,1591240544,0,1
1164,gyh195,Swakke10,0.3818,Use this incite code for extra credit,1591552794,0,1
1165,gygxex,crepuscopoli,0.0,New to crypto Should I invest,1591552428,83,1
1166,gygwcc,blessive,0.0,Claims of Selling Bitcoin Users Data Are Overblown Says Coinbase,1591552329,2,1
1167,gyg97u,4rindam,-0.5423,Crypto Crime on the rise,1591550151,0,1
1168,gyfzgz,thepizzaboarder,0.0,Crypto mining from your phone the future of Bitcoin,1591549245,0,1
1169,gyftwn,blessive,-0.5423,Why an analyst is proposing Ethereums inflation should drop to match that of Bitcoin,1591548725,0,1
1170,gyfbfi,RepoTactics1,0.4019,MakerDAOs MKR Token Gets a Boost in Liquidity,1591546970,12,1
1171,gyexoq,39T5fqdsRustdroAJK2H,-0.2263,Hex  How the Airdrop Might be Making Your Bitcoins and Privacy Vulnerable,1591545642,0,1
1172,gyemvd,dudeman4948,0.0,My PI,1591544579,0,1
1173,gyeb2w,FinalCoinOfficial,0.296,Join a crypto team,1591543384,0,1
1174,gye38b,DylanKid,-0.296,Southern District of New York amended complaint against Bitfinex and Tether,1591542572,4,1
1176,gydvsc,zincrox,-0.7003,Strange Crypto Currency email  a scam,1591541842,4,1
1177,gydvb9,PetroHoryachka,0.3182,Read please,1591541797,0,1
1179,gydkol,Czfacts,0.5994,Ethereum  The Much Awaited Staking Upgrade to Ethereum,1591540791,0,1
1180,gydd83,howlongisausername,0.0,Whats the majority opinion on XRP or Ripple here,1591540074,0,1
1181,gycrli,nanooverbtc,-0.6859,Bloomberg expects bitcoin to double to  this year says something needs to go really wrong for it to not appreciate,1591537951,4,1
1182,gycqsd,tunechi8383,-0.296,Clearing The Doubts about Statera Project,1591537877,1,1
1184,gycm4d,BrentonVue,0.0,HX  A DAO driven HEX replacement,1591537345,0,1
1185,gycgj1,Jonasgreg,0.765,Crypto and forex Trading has always been easy to me reason is when added good signal principles and effortlessly working team together Youre most likely to get to the top echelon,1591536777,0,1
1186,gybqwm,NISCBTFM,0.0,Roundly X Cant find anything about them really anyone use it already,1591534063,4,1
1187,gybiva,Mrbitcoinnews22,-0.2263,Forget K Bitcoin K Breakout Will Catch Everyone Off Guard,1591533140,0,1
1188,gyb39e,coinCram,0.5106,Still running strong,1591531298,2,1
1189,gyav7x,onelovex3,0.0,Tezos Joins Ethereum in Providing Blockchain DNS,1591530309,2,1
1190,gyauo9,BlockchainSocialist,0.0,Crypto World needs to tell Larry Summers to fck off,1591530242,1,1
1191,gyacfk,Richard-Vera,0.0,Test,1591527928,0,1
1193,gya7gh,growthmonkey,0.6369,Which one are the best Crypto Movies,1591527307,0,1
1194,gy9yoo,flat_line_,0.7184,Where to buy Grayscale GBTC,1591526127,10,1
1195,gy9rr3,JoshuaNg,0.0,Morpher can turn any data feed into a market Imagine that,1591525166,0,1
1196,gy9k3q,albertalbs,0.4215,Is it true Google is banning people talking about Cryptocurrency and Decentralized Virtual currencies on YouTube,1591524138,0,1
1197,gy9aao,jamespunk,0.0,Stacking sats until M,1591522765,15,1
1198,gy979p,Mrbitcoinnews22,-0.4019,Le crime cryptographique  la hausse  de bonnes chances que  devienne un record,1591522332,0,1
1199,gy8sr0,blessive,0.0,Binance Coin price falls to  range,1591519927,0,1
1200,gy8icj,arslanbajwa,0.0258,It is a matter of time before Tethers market capitalization overtakes Ethereum Bloomberg,1591518206,3,1
1201,gy8ew4,thestockists,0.9545,Bitcoin BTC is holding the important support levels well Important levels have been marked in the chart Bias is still bullish as long as the support levels are held st target of the move above will be   Lets keep an eye  and see how it plays,1591517635,0,1
1202,gy8dx4,polagon,0.296,Tezos join Ethereum with domain names  simplifying the crypto experience,1591517477,2,1
1203,gy8d7p,nugget_alex,0.2023,This Weeks Top Bitcoin Cryptocurrency amp Global Finance News  June th ,1591517368,0,1
1204,gy8c7v,rachidafr,0.5994,Grayscale Is Massively Accumulating Bitcoin in Advance of the Upcoming Bull Market,1591517205,10,1
1205,gy89ps,evelynfx10,0.0,lovemyself,1591516810,2,1
1206,gy86gy,GramGraciela,0.6486,Gain  worth of GRAM crypto currency,1591516272,2,1
1207,gy85ez,McNeiltherealdeal,0.0,Day old Uniswap Gem  FLAMA,1591516096,0,1
1208,gy846t,dumgenius,0.0,Bitcoin Is the Currency of the Gods,1591515877,3,1
1209,gy7vb7,2019Jamesy,0.0,k investment,1591514448,2,1
1210,gy7km7,Sid_911,0.0,The new bitcoin might be here,1591512795,0,1
1211,gy7cbv,Mrbitcoinnews22,0.0,Comment le Bitcoin peut aider la communaut afroamricaine,1591511526,2,1
1212,gy7blr,exturuder,0.0,HeartNumber is Redefining algorithmic trading Check out these videos,1591511423,0,1
1213,gy72kj,aneonl,0.4939,What exciting Cryptocurrencies are you watching,1591510096,0,1
1214,gy6ypt,Ant112990,0.0,Found this on USPS,1591509543,0,1
1215,gy6vtp,blessive,0.0516,Bitcoin price reaches  whats next,1591509130,0,1
1216,gy6sas,tianbuyung1,0.3182,Hybrid Blockchain Solution,1591508620,0,1
1217,gy6hs5,ArnitaHayward,0.0,This Chinese City Is Launching a Blockchain Notary Program,1591507187,1,1
1218,gy65rm,blessive,0.0,Beware Cryptojacking Attempts Surge  In Q of  Kaspersky Reports,1591505546,0,1
1219,gy54xc,Mrbitcoinnews22,0.0, choses que chaque investisseur Crypto devrait savoir sur le trading de contrats  terme Bitcoin,1591500747,1,1
1220,gy54i8,doubleup3or4times,0.0,Hold the boys in blue accountable,1591500696,2,1
1221,gy4t2f,Foreign-Elephant-648,0.0,Coinbase XLM airdrop,1591499307,2,1
1222,gy4qb3,Artist_of_Scam,0.7096,Help for my scammed friend,1591498978,0,1
1223,gy4lup,4rindam,0.5719,The Success of OmiseGO Puts Loopring in the Spotlight,1591498438,1,1
1224,gy405x,ommletz,0.0,NEWb,1591495849,0,1
1225,gy3j48,emnunez,0.0,What Exchange New York Users alt coins,1591494055,0,1
1226,gy3il9,VampireVlad,0.0,Why Delete Coinbase,1591493998,1,1
1227,gy30z8,joenorwood77,0.0,Discussion of the Day Flexacoin FXC,1591492179,2,1
1228,gy2jpj,throwaway86163,0.3612,How would one go about exchanging  million euros into anonymous crypto like monero fast,1591490357,0,1
1229,gy2fsu,Mrbitcoinnews22,0.0,Cette ville chinoise lance un programme de notaire Blockchain,1591489941,0,1
1230,gy2b9x,Amisukuzy,0.5859,How I Get Successful Bitcoin Mining Software,1591489476,0,1
1231,gy2817,Mobilenewsflash,0.34,Bismuth Toolbox is now available from Google Play store,1591489154,0,1
1232,gy1tvc,tiotopcafebread,0.0,Hey guys what was the latest coin added to Coinbase,1591487693,0,1
1233,gy1gmn,Mobilenewsflash,0.4404,Conceal Network  CCX  Private Decentralized Safe amp Micro Cap Cryptocurrency Banking,1591486390,3,1
1234,gy123w,wgcole01,0.0,US Consumer Financial Protection Bureau Highlights Ripple and XRP,1591484990,17,1
1235,gy0x8a,fitnesssova,-0.34,Uncertainty Proof Portfolio Reviled  Bitcoin x in  Years,1591484526,2,1
1236,gy0r6h,blessive,0.2023,Europes Top Law Enforcement Agency Investigating Bitcoin Mixer,1591483938,1,1
1237,gy0cdb,bittrexbot_software,0.0,New trading bot for the bitrrex exchange,1591482374,0,1
1238,gy03p3,dumgenius,0.296,Bitcoin Is the Currency of the Gods a discussion on the early impetus for designing decentralized money schemes,1591481454,2,1
1239,gxzqf8,AbruptlySoundCeased,0.0,Does anyone have experience with setting up a cryptorelated LLC in Wyoming or another state,1591480084,3,1
1240,gxz9mn,-Clayford08-,-0.2103,HEX Coin  The Savings Account That LOSES Your Money,1591478371,57,1
1241,gxyvdx,callmeceej,0.6249,great videos,1591476899,0,1
1242,gxytpz,blessive,-0.7906,Crypto scams have stolen  billion in the spring of  with Wotoken leading the list,1591476729,0,1
1243,gxyqjw,mazeplayzr,0.0,Hi everyone I know this doesnt belong here Currently going through some rough times ,1591476410,0,1
1244,gxynb5,T0MAS0N,0.0,Perpetual Contracts amp Where you can trade them,1591476076,0,1
1245,gxxslr,blessive,-0.0516, Would Leave Coinbase As It Offers Crypto Surveillance Tools to the US Government,1591473130,0,1
1246,haapoy,tylerlee232,0.0,Lets Unite,1592335279,0,1
1247,haafq1,SGSJR06,0.4404,The gift of EOS cryptocurrency,1592334436,2,1
1248,haa96f,chuckhriczko,0.0,LBit,1592333916,0,1
1249,haa575,TonyDaGreek,0.0,XMR,1592333581,0,1
1250,haa1hd,[deleted],0.0,Akon Announces  Billion Construction Contract to Build City in Senegal  Bringing change to Africa with Akoin,1592333268,2,0
1251,ha9y0t,RosemaryFreedman,-0.34,Bitcoin Mining Difficulty Makes Biggest Jump in  Months,1592332973,47,28
1252,ha9vjp,[deleted],0.0,Looking for a hedge,1592332768,2,1
1253,ha9uss,[deleted],0.0,Moons and Bricks All you should know about Reddit tokens,1592332703,0,1
1254,ha9shn,jabeeman,0.4404,Good article,1592332513,0,1
1255,ha9dhp,KeturahLongmore,0.2023,Deloitte  survey shows substantial jump in blockchain adoption,1592331222,4,9
1256,ha8yc2,blessive,-0.4767,Vitalik Buterin Says Bitcoin SF Model Is Wrong,1592329939,1,1
1257,ha8qqt,marcusmv3,0.0,Anyone else follow PAXG What is going on with the Bithumb Global PAXGUSDT market,1592329295,3,2
1259,ha8ifn,overheardcoffee,0.0,CHZ trade idea,1592328597,0,1
1260,ha8hid,DjOogieboogey,0.2023,Top Affiliate Marketing Courses Reviewed,1592328516,1,1
1261,ha8g7x,giorgospidias,0.0,Fibo Quantum  Highly Converting Forex Product,1592328409,0,1
1262,ha8b7b,nvitone23,0.0,Nano V Update,1592327998,177,40
1263,ha8avu,[deleted],0.0,We made the list,1592327969,1,1
1264,ha868h,TheNecroPope007,0.0,Is Pi Cryptocurrency Network Legit,1592327568,0,1
1265,ha81pa,MammothSir9,0.128,Virtual Panda BTM Launched for Colombian Residents Dispenses BTC BCH DAI and Dash,1592327189,0,1
1266,ha80f5,euphoria7192,0.0,Key smartlink,1592327091,0,1
1267,ha7ym9,serejandmyself,0.0,Citizen Cosmos podcast with Ethan Buchman Cosmos cofounder about DeFi the now and then of Cosmos POS palace and much more,1592326943,0,1
1268,ha7x9j,coinsmash1,-0.3612,Bitcoins mining difficulty just adjusted upward by biggest difficulty increase in over two years,1592326836,13,2
1269,ha7rft,blessive,0.296,What Is Ampleforth How AMPL Is Redefining Decentralized Money,1592326331,0,1
1270,ha7naf,footyfriend,-0.5106,Bitmex showing Disturbing George Floyd Capcha,1592325971,11,0
1271,ha7jd4,iamjosiahw,0.6124,Help Please,1592325625,0,1
1272,ha7jbw,EvanVanNess,0.0,Annotated edition of latest Week in Eth News  whats happening in the ecosystem COMP mining and more,1592325622,1,2
1273,ha7hs2,Spencer_windingtree,0.34,Everything you need to know about the open and secure travel marketplaces Winding Tree is developing on Ethereum Register for our webinar with PhocusWire to learn more,1592325489,2,0
1274,ha7h1g,shuknasty,0.0,Liquid Bit airdrop,1592325424,0,1
1275,ha7e8c,KNGA911,0.0,transfer issue,1592325194,0,1
1276,ha77nh,unphuckable,0.1779,Good news for anyone who missed the ZILLIQA Token Swap,1592324629,1,0
1277,ha7351,rsysreddit,-0.3182,Eating Ghost  ,1592324249,1,1
1278,ha72bf,SenatusSPQR,0.0,Discussing the Currency in CryptoCurrency,1592324177,6,1
1279,ha6ug0,twigwam,0.0,Former CFTC Chair Christopher Giancarlo on Unchained Podcast in regards to Digital Dollar Project  Lets try Ethereum amongst other approaches  c,1592323482,0,1
1280,ha6f6g,00dacypher,-0.1779,Washington state dilemma,1592322117,0,1
1281,ha69td,racistpandaaa,0.4019,Third party mining,1592321639,0,1
1282,ha63ka,JBSchweitzer,0.4588,The x Files EIP  and the Ethereum Improvement Horizon,1592321086,1,0
1283,ha60qu,hughestech54,0.0,Tozex Multi Sig,1592320842,2,1
1284,ha5zox,heist95,0.8271,Dormant Bitcoin at a  Year High and Why Thats Bullish,1592320749,5,3
1285,ha5tr8,[deleted],0.0,The Federal Reserve vs Covid,1592320219,2,1
1286,ha5r3a,MammothSir9,0.0,Bitcoin Whale Population Spikes to   Highest Level in Three Years,1592319985,1,1
1287,ha5hjv,blessive,-0.128,Wall Street veteran is predicting a  decline in the SampP  potentially hurting Bitcoins prospects,1592319146,1,1
1288,ha5h57,Roy1984,0.34,What Is The Value Of Reddits Moons Cryptocurrency,1592319113,22,1
1289,ha5frf,michael4445,-0.34,Crazy video on the state of the US Dollar,1592318983,3,1
1290,ha5d16,slec82,0.0,Leaves the new coin that you dont know yet,1592318726,1,1
1291,ha5cpa,thelionshire,-0.7003,Craig Wright Denies Hacking Mt Gox Says He Bought That Bitcoin,1592318694,6,1
1292,ha54i5,Mrbitcoinnews22,0.0,Gitcoin and Polkadot Cooperate to Bring New Developers to Blockchain,1592317954,0,1
1293,ha4wqk,OriginalGravity8,0.4588,Budget long term cold storage,1592317227,35,3
1294,ha4vet,Grills93,0.0,Hey guys I just published a review on Syncfab MFG a blockchain company that I believe will drastically change OEM Supplychains,1592317098,2,3
1295,ha4qpl,mojindu464,-0.296,Seriously  Who the hell takes pentagon owned  bloomberg seriously anyway  This is under comedy because bloomberg a joke Also the pentagon ran a simulation on bitcoin challenging rich fucks since hey not all of us have banks right Looking at you Africa,1592316663,6,0
1296,ha4g5e,ben_efx,0.0, to start a memewar ,1592315683,0,1
