,id,author,vader,title,created_utc,num_comments,score
3480,gdxehy,luxxx75,0.0,I think BTC just retested the last breakdown point and will keep moving consolidation today.,1588684088,1,1
3482,gdx9ea,janus9000,0.6249,In This is Money today - UK’s financial website. - How and where to buy (and sell) bitcoin and cryptocurrencies in the Wild West of exchanges and wallets - and do you have to declare profits to the taxman?,1588683512,0,1
3484,gdx57k,stephanlivera,0.3612,"SLP171 planB &amp; Saifedean - Bitcoin S2FX, S2F and Evolution From Collectible to Financial Asset",1588683029,0,1
3485,gdx2lb,SumaZero,0.0,"Habemus Halving, habrá Alzas para el Bitcoin - CRIPTO TENDENCIA",1588682708,0,1
3486,gdx1ol,kearnsyy,-0.3089,BTC purchase on blockchain not showing (Help),1588682604,4,1
3487,gdwk38,KnoNuthinNewb,-0.5423,Cause of price drop post-halving?,1588680496,11,1
3488,gdwbj0,btcmiss,-0.5719,Immediately after the halving we go from ~$16m daily selling pressure to ~$8m just from miners selling their rewards. Why does everyone think the price will dump or that this is a short term nonevent for price?,1588679464,8,1
3489,gdwb33,21btc,0.0258,What is Bitcoin backed by?,1588679417,10,1
3490,gdw9wp,btcmiss,-0.5583,Immediately after the halving we go from seeing ~$16m of daily selling pressure to ~$8m just from miners selling their daily rewarda. How can the price not pump?,1588679249,0,1
3491,gdw895,mccormack555,0.0,Bitcoin is Reshaping the World with Robert Breedlove — What Bitcoin Did,1588679030,0,1
3492,gdw2lo,pklvo,0.4019,Help for getting bitcoins,1588678268,3,1
3493,gdw18k,hoiru,0.0,Over what?,1588678069,2,1
3494,gdvzvj,shenegamy,0.5267,I'm feeling safe with bitcoin,1588677881,31,1
3495,gdvqyl,H1gH_EnD,0.8504,How can I celebrate the halving? Where is the best digital Halving-Party?,1588676677,12,1
3497,gfhrn2,ReedSteed,0.0,Finally!,1588894141,6,9
3498,gfhria,wf84,0.0,Here we go again! 10 k,1588894128,2,2
3499,gfhrfc,ssmly360,0.0,10k. Let’s get it,1588894118,14,2
3500,gfhrb0,jazzrootsherbs,0.2023,Beautiful 😭,1588894107,340,13
3501,gfhqnw,Fiach_Dubh,-0.6908,"In The Grim Darkness of the Future, There is Only Bitcoin.",1588894046,1,1
3502,gfhojj,Jezzes,0.4767,Alexa's only valuable skill.,1588893834,6,4
3503,gfhkp7,LightningPlus,0.0,Bitcoin Q&amp;A: Climbing the Sovereignty Staircase - Andreas Antonopoulos,1588893444,0,1
3504,gfhiwb,[deleted],0.296,"Hello community, I come here to share my bitcoin analysis.",1588893263,2,1
3505,gfhbvd,dirtywhitemagic,-0.4404,suck lifeforce,1588892590,3,2
3506,gfh5so,TheForgivenZed,0.0,When bitcoins boutta hit 10000,1588892019,5,4
3507,gfh10x,Coppernotch91,0.6369,Why love BTC?,1588891570,3,1
3508,gfh0n4,[deleted],-0.296,"Olá comunidade, venho aqui para compartilhar minha análise do bitcoin. Para isso coloquei os valores dos preços em dólar no período diário, outro indicador importante que usei foi o google trends, fiz a pesquisa usando a palavra bitcoin, nos ultimos 5 anos, em todo o mundo fiz um gráfico combinando",1588891531,2,1
3509,gfh0iy,apoefjmqdsfls,0.0,BitKassa closing Down (Dutch bitcoin payment provider),1588891519,12,2
3510,gfgzse,stock56trader,0.0,Bitcoin options,1588891449,6,1
3511,gfgu05,KushFreeman,0.0,Bitcoin Halving Market Behavior Prediction. This is a prevailing opinion trending on Twitter.,1588890880,0,1
3512,gfgtft,Pet_no_24,0.0,Bitcoins not available after a transfer,1588890820,15,1
3513,gfgqrj,TheRebelliousSpire,0.0,Buying bitcoin in Canada?,1588890564,10,1
3514,gfgof0,CryptoBigBags,0.0,"Coinbase , Earn 10% BTC Halving giveaway",1588890342,8,0
3515,gfggz0,ODready,0.0,Its gonna do 10000!?,1588889646,21,2
3517,gfgbe0,irukandjie,-0.1779,Does anyone get the feeling that we are missing the boat on something else revolutionary?,1588889142,9,1
3518,gfgaci,vfexx28,0.3612,get ready for 10K,1588889048,42,3
3519,gfg9e2,garchmodel,0.0772,rule number one of bitcoin club,1588888963,4,2
3520,gfg6cq,XRBeast,0.6476,Legit (!) call to change my mind; the only advantage bitcoin has over nano is its first-mover-advantage.,1588888676,4,0
3521,gfg08k,quinoaqueefs,0.0,Can someone direct me to a bitcoin for dummies thread?,1588888113,11,2
3522,gffzaa,Zek256,-0.2263,I imagine this is how people felt when they found forgotten BTC,1588888025,9,2
3523,gffywo,jamesyb0y,0.5574,"Bitcoin Flirts With $10,000 As Crypto Extends Gains",1588887988,0,1
3524,gffwum,ko2991,0.7131,Opinions on the halving ? Will ya buy now or after halving ? Do you truly think at the halving bitcoin will drop again ?,1588887795,16,2
3525,gffwd5,Mynameis__--__,0.3182,Can Capitalism Survive? Chamath Palihapitiya Isn’t Sure,1588887751,1,0
3526,gffu21,_WinnerTakesAll_,0.0,"Paul Tudor Jones reportedly buys bitcoin as an inflation hedge, compares crypto to 70s gold trade",1588887545,1,0
3527,gffs9f,rj8899,0.0,How do you guys think the market would operate if you couldn’t put in automatic buy and sell orders? How does that feature influence when you guys buy and sell?,1588887379,2,1
3528,gffrn0,Saad5665,0.0,What is Blogging - Earn through Blog - Blogging for beginners - Bussiness Blogging - Earn 100$ by blogging,1588887323,0,1
3529,gffqzm,HCOONa,0.6249,Has there ever been opportunities like Bitcoin before?,1588887268,25,2
3530,gffnud,Baseme6,0.8442,"Bitcoin is looking extra bullish at the moment, still expecting a dump, or to the moon?",1588886986,4,0
3531,gffhwm,[deleted],0.0,Paul Tudor Jones bets on Bitcoin,1588886458,2,2
3532,gffhig,ToTYly_AUSem,0.0,Just made my first purchase with BTC and I have a few questions,1588886421,3,1
3533,gffhbw,vitaminBTC,0.25,Economist explains Quantitative Easing in 2011,1588886407,1,2
3534,gffac4,sun_of_darkness,-0.6523,"If you're gonna come up with a shitcoin, at least don't ALSO GIVE IT A SHIT NAME",1588885788,9,2
3535,gfey0y,sylsau,0.0,"Exchanging Your $1,200 Stimulus Check Against Bitcoin Will Make You a Genius in Some Years",1588884697,10,4
3536,gfeo5g,cryptosp,-0.68,SCAM ALERT! Looks like scammers are using Steve Wozniak's name to scam people,1588883839,11,7
3537,gfeh51,Party-Builder,0.0,HODLER,1588883227,5,1
3538,gfeg90,At0m11c,0.3612,Here is how the halving 2012 and 2016 looked like,1588883150,18,5
3539,gfeb4t,Exxe2502,0.0,ATTENTION!,1588882703,11,4
3540,gfeatr,juanbta01,0.6249,Great news,1588882678,0,1
3541,gfe9lf,midasilva,0.8625,"Hello community, I come here to publish my bitcoin analysis, for that I used the excel function (forecast spreadsheet), put the price values in reais in the weekly period, did the same with the volume and made a graph combining the values, ok there the result.",1588882572,2,0
3542,gfe86s,roasbeef,0.7184,⚡️Multi-Path Payments in LND: Making Channel Balances Add Up ⚡️,1588882451,40,5
3544,gfe3km,austinehmann,0.8074,Does anyone wanna send me like $11 in bitcoin? 😂😂 so I can get chipotle,1588882036,24,2
3545,gfe35z,ivan_macalay,0.8519,"Do you know that you can make over $5,450 in 6 days with a minimum investment of $500 in bitcoin mining. All procedures are to be taken by you nd also doesn’t require sending money to anyone to ensure max safety of investments. If interested Dm +1(419)7512644 ( Whatsapp or telegram )",1588882001,0,1
3546,gfe2nv,bitrefill,0.5719,Celebrate the 3rd Bitcoin Halving with Bitrefill,1588881958,0,1
3547,gfdz30,CoinjoyAssistant,0.0,Opinions of 12 cryptocurrency experts on Bitcoin price after halving 2020,1588881657,0,1
3548,gfdsca,SaneFive,0.296,"Money printing is driving people to Bitcoin, says Ledger CEO",1588881076,1,7
3549,gfdrzm,deas42,0.6249,"BTC is Great, on an Exchange maybe not so much",1588881046,2,1
3550,gfdr6k,wmredditor,0.4404,BTC Eyes $10K: 81% Of The Current Bitcoin Supply In Profit As Halving Approaches,1588880981,0,1
3551,gfdqyf,alecww3,0.7184,Buy now or wait?,1588880962,22,1
3552,gfdqr8,muchi21muchi21,0.4588,I’ve been in this game far too long. Sodled I’m out (for now).,1588880948,43,0
3553,gfdqna,pittsburghhodlr,0.2732,"19 days until BITCOIN HALVING, can it hit $10,000? [this aged well ...]",1588880938,1,0
3554,gfdkwo,FLNI,0.0,"From ""Bitcoin is Common Sense""",1588880444,5,5
3556,gfdjb8,Hanspanzer,0.0,"Bitcoin CME Futures hit $10,000!!!",1588880302,13,10
3557,gfdied,paulkaraffa,0.0,We Built a Bitcoin Dungeon Crawler! You're On A Quest to Find Satoshi Nakamoto's Bitcoins.,1588880220,2,1
3558,gfdfnk,voodooftw,0.0,"I am Richie Lai, co-founder of Bittrex, and today I’m joined by some industry colleagues, so you can Ask Us Anything on the Bitcoin Halvening. (XPOST)",1588879984,4,2
3560,gfd5co,Audimental,0.8689,Lovely Thursday 😊,1588879104,0,1
3561,gfd3fy,diamond2464,0.0,Bitcoin contest,1588878937,0,1
3562,gfd2pq,[deleted],-0.4964,Couldn't be more happy with my decision.,1588878874,4,4
3565,gfcyah,elindinga,0.0,What does influence the price action of Bitcoin?,1588878494,6,0
3566,gfcvud,[deleted],0.0,Bitcoin mining (cryptocurrency),1588878288,2,0
3568,gfct4x,CryptoCuban1,0.0,Eeny Meeny Miney Moe,1588878059,11,1
3570,gfcrik,cashiu,0.0258,Is Lighting Network backed from Core Developers or it is being treated as a separate project?,1588877934,6,2
3571,gfcrf2,token_media,0.8271,"Bullish: Paxful and LocalBitcoins Record High Volumes, Luno and Ebitcoins See Influx of New Users In Africa",1588877925,0,1
3572,gfcqrb,melod3e,0.4588,GO LONG,1588877864,0,0
3573,gfcqfa,spookiestevie,-0.4939,Bomb says so ¯\_(ツ)_/¯,1588877836,4,4
3574,gfcq0a,btcfad,0.0,The Crypto World: A financial renaissance,1588877801,0,1
3575,gfcpqt,LightningNetwork123,0.6124,Could someone help me out with some testnet btc please 🙏,1588877779,0,1
3577,gfcmi1,harrywda,0.296,What if we ran out of money?,1588877499,12,0
3579,gfcip3,xyzzy-86,0.3182,is BTC price in USD fair anymore ?,1588877162,7,3
3580,gfchac,kingsofall,0.0,Already mining for that halving coming soon anyone else,1588877033,13,3
3582,gfceja,btcfad,0.0,etherium is proliferating!,1588876793,0,1
3583,gfcchw,SharpCantTailSharp,0.0,Dwight Shrute was an early adopter,1588876618,3,0
3585,gfcb17,lunarcrush,0.4588,"Bitcoin social volume is....STRAIGHT. UP. 13,644 social posts in just the last hour. 🌎💨💨💨🔥🔥🔥🚀🌜🪐🛸👽",1588876486,8,3
3587,gfc5lp,Btcwhisperer,0.0,Haven’t seen this subreddit 10k online since 2017,1588876011,0,1
3589,gfc4ak,camielzz,0.296,Creating the Ultimate bitcoin beginner guide.,1588875900,6,0
3590,gfc3ni,adflondon,0.0,Hodlers Continue Accumulating BTC as Halving Approaches,1588875840,3,2
3594,gfbxb9,thebride3,-0.5697,So sad! Bitcoin mining farm gets flooded.,1588875287,6,0
3595,gfbw2o,thebrian7872,0.0,Hydroponic lettuce delivered by drone and paid via BTC Lightning Network!,1588875175,2,1
3596,gg4v51,serly1986,0.0,SerbaQQ Game Online Terbaru Dengan 9 Permainan Terbaik Dan Sistem Keamanan 100%,1588982847,0,1
3597,gg4uj4,fivecinco05,0.0,New to Trading - Questions,1588982782,5,1
3598,gg4swb,Kingjoker776,-0.7184,Dip dip potato chip,1588982617,7,1
3599,gg4p7a,KalEll66,0.1263,Don’t tell Americans they are falling behind in this most important technology since the internet.,1588982243,9,1
3600,gg4g87,luckymen_in_crypto,0.4215,"in the last 3 weeks we have seen, it is too easy to pump BTC price from 7000 to 9900. So with the same amount of coins currently circulating in the market. Is pumping BCH price from 260 to 2600 as simple as pumping BTC price from 7000 to 9900 usd?",1588981336,1,1
3601,gg4fda,melissaBrian0,0.0,China brings Blockchain into Avaiation,1588981252,0,1
3603,gg4bw2,Cartmanhartman,0.5267,"For the people in this sub, is bitcoin more of a hobby, an ideal, or a job for you?",1588980929,15,1
3604,gg461d,alevine5,0.0,Diversifying,1588980341,0,1
3605,gg45pw,jamesyb0y,0.4588,This Bitcoin Open Interest Trend Signals that There is Massive Room to Rally,1588980311,0,1
3606,gg44lt,Blitzz98,0.0,Investing Stimulus Check,1588980201,3,1
3607,gg448k,tbnz24,0.5423,Are there any CME futures gaps below the price. Looks like there might of been a small gap created between 25-26 april. Dam YouTubers only seen to talk about these when it suits.,1588980164,0,1
3608,gg43kk,Dcantu3312,0.0,What should I do?,1588980105,5,1
3609,gg40qr,Plenty_Shine,0.0,MASSIVE DAILY BITCOIN GIVEAWAY AND DONATIONS,1588979827,0,1
3610,gg409z,NarakuLeDemonSlayer,0.5106,i know most people are probably ecstatic right now,1588979781,19,1
3611,gg3w62,IhavEaquEstIoN3267,0.5106,How can bitcoin be mass adopted if it’s price moves up and down everyday ? &amp; Ethical question,1588979386,39,1
3614,gg3n65,Pr0f1tPr0ph3t,-0.6115,ShapeShift is more pathetic than their “KeepUNsafe” BS ColdStorage HardWallet...,1588978526,11,1
3616,gg3jeo,GryffindorAle,0.0,Selling Bitcoin for cashapp,1588978167,4,1
3617,gg3dmk,nomoremodesty,0.0,Drawing board,1588977620,2,1
3618,gg3auy,jamesyb0y,0.5574,"“I Can’t Wait to Throw Up Less Bitcoin”, Says Bitcoin Cartoon Hero",1588977347,0,1
3619,gg39j3,bitcoincandle,-0.4939,Portable WLAN SSID Bitcoin Spammer,1588977214,3,1
3620,gg363y,vladimir0506,0.0,YouMix,1588976893,1,1
3621,gg35gq,ponchovilla71,0.0,Grabbing the btc market by the horns,1588976832,0,1
3623,gg30z1,airborneANDrowdy,0.2235,I can't stop looking at this.,1588976399,2,1
3624,gg307s,manosmeze,0.782,Do you really think that institutions will let all of us get rich that easy from bitcoin ??,1588976318,9,1
3625,gg2w31,wowdisme,0.0,Unpopular opinion: Bitcoin isn´t what it claims to be,1588975924,10,1
3626,gg2vlx,davexlr,0.2023,Top 5 Bitcoin payment processors in 2020,1588975878,0,1
3628,gg2r28,Dethkook,0.5719,That perfect moment.,1588975458,1,1
3629,gg2qq0,cryptening,0.0,Shitcoiners in 2017: bitcoin went from 80% market cap in 2013 to 35% market cap. Bitcoiners in 2020: Shitcoins went from 200 to 7800 and bitcoin is still at 80% market cap!,1588975427,0,1
3630,gg2on3,lingghezhi,0.0,EBook: Trading the Bitcoin halving event,1588975235,0,1
3631,gg2nkg,eragmus,-0.3182,Power Struggle at Bitmain Escalates Into Physical Brawl (Caixin),1588975137,4,1
3632,gg2n6n,jamesyb0y,0.7783,'It opens up a new universe': Mike Novogratz on the significance of Paul Tudor Jones' bullish bitcoin take,1588975101,2,1
3633,gg2fyi,570215,0.0,Bitcoin's marketcap is ~183 Billion USD.,1588974430,1,1
3634,gg2bu0,093j4t9034jt,0.296,Is this a joke,1588974055,0,1
3635,gg2akr,ChangeNow_io,0.508,"Wake up and shine, Mr. Freeman! Bitcoin Halving is near!",1588973942,1,1
3636,gg24sa,coachhh_,-0.6553,Bitcoin investment scam or legit??,1588973414,13,1
3637,gg242t,dxxczz,-0.7184,Bitcoin sell,1588973349,3,1
3639,gg1z7x,abercrombezie,0.0,Bitcoin consuming all that Trump Change BRRRRR,1588972917,1,1
3640,gg1q5e,SealTheApproved,0.0,Me right now,1588972128,2,1
3641,gg1niw,Queijocas,0.7964,"This is beautiful, I had to take a print",1588971895,3,1
3642,gg1l5m,vfexx28,0.0,Up up and away.,1588971688,1,1
3643,gg1jfv,n3xtap,0.5994,Beautiful,1588971547,1,1
3644,gg1fw0,The_Anonymous_Player,0.0,Question about Bitcoin Transactions.,1588971229,4,1
3646,gg1e61,kriptomist,0.0,#Altcoin vs #Bitcoin,1588971081,1,1
3647,gg17l2,MyMissPlant,0.4019,Bull Steam Ahead: Halving Leads To Historic Miner Output Selling Pressure Reduction,1588970499,1,1
3648,gg15fn,Digiff,0.8452,"There are hodlers and HODLERS. Just look at this Guy, who kept it strong and up and is still around. WOW!",1588970311,0,1
3649,gg0zz1,froz3nwhal3,0.7184,How Can I buy small amounts of Bitcoin?,1588969838,34,1
3650,gg0z9d,FiniteRegress,0.8481,Institutional crypto market report presents new data supporting a sustained positive correlation between S&amp;P 500 and BTC throughout the last month; institutional parties thinking about Bitcoin may not be as halving-focused as many crypto commentators are right now,1588969778,0,1
3651,gg0yzd,pwnage09,-0.4767,Whats wrong with bitcoin transaction time at the moment? Big fee too,1588969755,17,1
3652,gg0wxg,bitcoin_baklava,0.0,What is NgU technology?,1588969578,5,1
3655,gg0opj,spookiestevie,0.0,Panik!!!,1588968863,3,1
3656,gg0obw,spookiestevie,-0.3182,Despair.,1588968831,26,1
3657,gg0lh0,jamesyb0y,0.0,"5 causes bitcoin price might hit $100,000 in 2021 as Tudor Jones buys",1588968583,1,1
3658,gg0kx3,Suchalinelyword_,-0.4767,"As pandemic rages, anything goes for bitcoin's third 'halving'",1588968538,2,1
3659,gg0jgf,SamotoNakatoshi256,0.0,The Boomer-Fiat Standard,1588968407,2,1
3660,gg0isv,tradingnomads,-0.34,Who's also still looking at the BTC chart on Friday night?🔥,1588968347,6,1
3662,gg0h4p,HappyDadOfFourJesus,0.0,The exact date and time of the Bitcoin halving?,1588968206,4,1
3664,gg06wb,Paulobr124,0.0,Bitcoin Futures &amp; Gambling,1588967348,4,1
3665,gg04ha,intothecryptoverse,-0.4199,Bitcoin: Logarithmic regression overload!,1588967125,0,1
3666,gfzz8p,smallrookie,0.0,coinpayment private key import,1588966667,2,1
3667,gfzylh,mcafee789,-0.5848,"Drop Gold, Beat Paul T Jones By Owning ACTUAL Bitcoin!",1588966608,0,1
3668,gfzuuu,destamieyi,0.0,just what i found could make tons of bitcoin,1588966297,2,1
3669,gfzu2k,adam0000345,0.3612,Incentive Structure Question,1588966230,19,1
3670,gfzh8h,the420chronicler,0.6696,"The Bitcoin Revolution is a choice. Don't ever forget that. No matter how high or low the price gets, Bitcoin will continue to exist and persist as long as we choose for it to exist.",1588965121,2,1
3671,gfzgjy,Iwanttobeanactor1,0.0,Should I invest 200$ in bitcoin?,1588965062,15,1
3672,gfzdro,the420chronicler,0.5894,"The Bitcoin Revolutions - ""Because I choose to"".... just remember that no matter how high or low the price goes, Bitcoin will continue exist as long as we choose for it to exist.",1588964844,0,1
3673,gfzc5c,jakubblin,0.0,You know what to do.,1588964727,3,1
3674,gfzb1b,vitorvous,0.0,"Sell your shitcoins, buy BTC",1588964645,0,1
3675,gfz5hx,linuxkernelhacker,0.0,"1 BTC = 10,000 USD (8-bit art visualization)",1588964171,6,1
3676,gfz55v,ponchovilla71,0.7184,Buy more btc now or after halving?,1588964141,10,1
3677,gfyskr,undergroundking417,0.0,BITFINEX,1588963042,5,1
3679,gfygt6,MatasRoze,0.7073,"Just a reminder, that this masterpiece exists",1588962031,14,1
3680,gfyf9u,GoKone,0.6486,"""In a world that craves new safe assets, there may be a growing role for Bitcoin."" - Paul Tudor Jones",1588961902,4,1
3681,gfye5o,guinq,0.4767,Effective Proof Of Stake; How does it work?,1588961806,1,1
3682,gfydtj,OtheDreamer,0.0,Trading and Technical Analysis,1588961780,4,1
3683,gfy2kj,bitrefill,0.0,"Mother’s Day is almost here, this is why you should think Bitrefill",1588960834,0,1
3684,gfy003,jamesyb0y,-0.1779,Bitcoin Pre-Halving Hash Rate Volatility to Shake Up the Mining Sector,1588960614,1,1
3685,gfxzs5,jamesyb0y,-0.4767,"As pandemic rages, anything goes for bitcoin’s third ‘halving’",1588960594,0,1
3686,gfxzak,jamesyb0y,-0.3818,Massive bank heist in Brazil ends in failed Bitcoin escape,1588960554,0,1
3687,gfxur9,[deleted],-0.6124,This is obviously a scam. How do I report it?,1588960171,0,1
3688,gfxud2,1Dqt8Aetc,-0.4019,This is one of those days when Rollercoaster guy gets reckless.,1588960136,10,2
3690,gfxld2,frosty_sword,0.0,Bitcoin vs Fiat Currency,1588959359,21,1
3691,gfxhxt,keto_brain,0.8548,Most Cost Effective Way To Buy BTC,1588959065,11,1
3692,gfxcon,Farghaly,0.0,Bitcoin is going to zerooooooo,1588958597,10,0
3693,gfxbh4,PD_is_here,0.0,Yikity Yikes,1588958499,2,1
3694,gfx8zu,riqelme,0.0,Open Positions on Bitcoin Options Pass $1B for First Time,1588958273,4,2
3695,gfx6pr,lost_civilizations,-0.5574,Alt coins destroys lives,1588958062,45,0
3696,gfu5jm,InMyDayTVwasBooks,0.0,Regarding Swan Bitcoin,1588947861,5,1
3697,gfu4wv,TommyofLeeds,0.0,What is Likely to Happen After The Bitcoin Halvening?,1588947799,16,1
3698,gfu2w8,m_whale99,0.0,What CME gaps are left?,1588947605,2,1
3699,gftuyl,flutetaloot,0.0,Fell into some bitcoin,1588946802,38,1
3700,gftt31,KyleLL1,0.4137,Is there a nonbiased place to know about worthwhile cryptos??,1588946616,0,1
3701,gftns5,OKEx-official,0.0,Cryptocurrency market jumps by over $13 billion driven by bitcoin as major technical event approaches,1588946095,4,2
3702,gftkbo,tojukaka,0.0,UTXO,1588945744,14,2
3703,gfthlo,hodlerkiller,0.4939,"Both Sides REKT, Hodle Simple Bitcoin and enjoy the ride",1588945459,1,1
3704,gfth2v,Rugby11,-0.1531,US Debt Hits $25T — Stimulus Checks That Bought Bitcoin Now Worth $1.6K,1588945406,5,1
3705,gftg8e,Lumin8_Crypto,0.296,Bitcoin News Today 2020: Bitcoin Beats Netflix’s Money Heist On Twitter India,1588945312,0,1
3706,gftf4a,funnybitcreator,0.1007,"Only 500 blocks left! Another advantage of a bitcoin full node, live stream this historical monument in real time",1588945207,16,1
3708,gft76m,Peter4real,0.0,Moonrock,1588944386,6,1
3709,gft6x3,drvksn,-0.69,Deutsche Bank's Collapse! Banks Are Under Pressure Everywhere On The Planet,1588944363,8,1
3710,gft4nw,Nillabean1988,-0.5423,IDC: EU Blockchain Spending Will See Temporary Drop Due to COVID-19,1588944133,1,1
3711,gft37e,SumaZero,0.0,Bitcoin testea los $10.000 antes del Halving - CRIPTO TENDENCIA,1588943992,0,1
3712,gft1vl,evil_krow,0.7476,Pullback time? Or to the moon?,1588943849,8,1
3713,gfsycb,franksynopsis,-0.8176,I see these scams all over FB and YT - 'organic' conversations where someone drops a bitcoin guru's name and then 10 other people chime in validating said guru. Do various unrelated people cut and paste the same scam template or is it a one guy/group employing bots? I have seen maybe 30 of these,1588943476,3,1
3714,gfsxa2,myquidproquo,-0.2263,500 blocks to go...,1588943354,14,1
3715,gfsx7d,coindataflow,0.0,not financial advice,1588943346,1,1
3717,gfsrez,IceHistory0,-0.3612,History of the U.S Debt Clock,1588942776,0,1
3718,gfskex,MaxRockatansky514,0.0,"ISO 20022, any thoughts on how this might impact Bitcoin?",1588941998,3,1
3719,gfsjjo,bytetree,0.0,Coming Soon.,1588941901,14,1
3720,gfs7xe,ShiftalOfficial,0.5106,"Bitcoin tops $10,000 first time since February, before halving. What does the upcoming ‘halving’ mean for your investment stance towards bitcoin?",1588940577,6,1
3721,gfs5hh,0xCristianoff,0.0,Every bitcoin holders' children after halving,1588940288,3,1
3722,gfs56u,carcaju99,0.5562,Let people have fun!,1588940251,6,1
3723,gfs4r4,BashCo,0.0,"Honey Badger Diaries: Episode 32: Alejandro De La Torre, Berlin (Germany)",1588940197,0,1
3724,gfs4j3,Anynomous2,-0.3595,Google censors Bitcoin halving news!,1588940172,17,1
3725,gfs261,celestialtiger5,0.0,Beginner Tip?,1588939895,2,1
3726,gfrvbf,mccormack555,0.1027,Libertarianism &amp; Politics with Adam Brown &amp; Sean Finch — What Bitcoin Did,1588939076,0,1
3727,gfrqol,olafurp,0.0,The halvation,1588938498,0,1
3728,gfrqo4,dfollowm,0.8235,Need help. Can't stop watching the BTC Meme Video :D,1588938497,4,1
3730,gfrgrq,dumboverthinker,0.0,Bitcoin here in the Philippines,1588937235,0,1
3731,gfrfzn,the420chronicler,0.4588,What do OG Bitcoiners think about BlockFi and the interest rates they offer?,1588937143,3,1
3732,gfrebf,affluentbody,0.368,TOP 10 RANKING Crypto Coins by Market Capitalization [Historical 2013 – 2020],1588936925,1,1
3733,gfrdqs,Jakyyy,0.5994,Bulls incoming,1588936856,2,1
3734,gfrcrf,Cxesar,-0.7739,"RIP HAL FINNEY ""His last post on a BTC Forum""",1588936719,174,1
3735,gfrcpq,leon_the_nibba,-0.5423,Hey can someone drop 1 cent of bitcoin in my account,1588936714,0,1
3736,gfrbd0,Ether_Exchange,0.0,"4 Trends Behind Bitcoin’s Eruption to $10,000",1588936537,0,1
3737,gfrago,jackielarson,0.0,I forgot about my Bitcoin from 2012,1588936419,63,1
3738,gfr2cv,ToniT800,-0.5859,"Why do so many people here keep saying that halving will cut supply by 50%, therefore the price should go up? This is nonsense...",1588935403,22,1
3739,gfqxqh,cstrike2,0.4404,Bitcoin Mining Isn’t Profitable?,1588934797,4,1
3741,gfqsy2,winbtcnow,0.0,Bitcoin Halving Infographic,1588934136,0,1
3742,gfqsjh,Stelerito,0.25,What is the bitcoin halving and how could it affect bitcoin mining in the long run?,1588934079,0,1
3743,gfqs6q,Mrs_BTC,0.0,BTC vs Gold,1588934032,21,1
3744,gfqolr,192838475647382910,0.0,Where u at?!,1588933554,104,1
3745,gfqlcq,theforwardbrain,0.3182,This is the truth,1588933105,1,1
3746,gfqho9,martin141994,-0.3382,Don’t be naive !,1588932610,1,1
3747,gfqe40,pkarpisek11,0.0,Coloured coins implementation,1588932144,2,1
3748,gfq9c7,Klaasiker,0.0,What do you think of Faucets?,1588931504,7,1
3749,gfq882,InvestWise89,-0.4767,"Repost in the future, if i was wrong",1588931360,2,1
3750,gfq76t,franksynopsis,0.0,"has anyone gone down one of these rabbit holes? what's the story here? I see them all over youtube, facebook - always w a different name, same format.",1588931216,12,1
3751,gfq6lt,obeg95,-0.4767,Bitcoin HODL sad its over $10000,1588931125,8,1
3752,gfq50v,Bitcoin_to_da_Moon,0.0,It is called - The Halving - (NOT Halvening),1588930901,8,1
3753,gfq4u5,kos155,0.0,what can i do here,1588930875,1,1
3754,gfq3hl,martin141994,-0.6124,Elon Musk scam,1588930696,1,1
3756,gfq1xn,Kickboks,0.7184,All this talk of minors on this sub... I thought you had to be 18+ to buy Bitcoin?,1588930482,1,1
3757,gfq0iq,-Pokesh-,0.0,Hello is this real ?,1588930292,5,1
3759,gfpm7i,ArtofBlocks,0.0,Consumer Contract Externality and Bitcoin Escrow,1588928343,0,1
3760,gfpll2,Crypto-Angel,0.6369,Billionaire Paul Tudor Jones: ‘My bet is it will be bitcoin’ as the best inflation hedge,1588928262,4,1
3761,gfpkvq,dancrypted,0.7901,"‘Your money is safe at the banks!‘ El Risitas recaps the political, economical and financial events of early 2020 and comes to a clear conclusion pro Bitcoin.",1588928161,3,1
3763,gfpjos,8btccom,-0.2023,Bitmain Drama Continues with the Company’s Business License Robbed and Jihan Calls Micree Bullshit,1588927989,0,1
3764,gfpjob,mar4t2,0.0,Waiting for this,1588927987,1,1
3765,gfpjdd,paprikablokjes,0.6369,Looking for the best counterarguments,1588927943,10,1
3766,gfpit5,blockchain68952,-0.3182,the ultimate tease,1588927869,0,1
3767,gfpidj,Haxedus,0.0,Past few months have been a rollercoaster,1588927814,3,1
3768,gfpe7q,WaxuTutu,0.0,This is why bitcoin will go up,1588927210,15,1
3769,gfpe50,eida2023,0.6908,"Morgan Creek CEO Turns Bullish, Says Bitcoin Could Pass $100,000 by 2021",1588927200,0,1
