,id,author,vader,title,created_utc,num_comments,score
1718,gkbu0j,indianblockchain,0.0,Explore Hyperledger Concepts with IBI,1589558508,0,1
1719,gkbtk5,crypto_bot,0.0,"Bitcoin Network Status Update Friday, May 15, 2020",1589558471,0,0
1721,gkbngt,Coinbaazar_Official,0.0,"Bitcoin Halving , and its Effects",1589557938,3,0
1722,gkbjoz,[deleted],-0.4939,Me was stolen a lot of Kryto,1589557600,5,0
1723,gkbjgt,yerawizardarrypotta,-0.2593,Can you run dapps on Bitcoin? Like how Ethereum allows dapps to run on chain? Or is there a second layer project that allows them?,1589557581,1,1
1724,gkbdbs,kyletorpey,0.0,Peter Thiel-Backed Layer1 Wants to Own 25% of the Bitcoin Hashrate By End of 2021,1589557043,14,1
1725,gkbch9,[deleted],0.0,Saw this today in NYC - Hahaahaha,1589556975,0,1
1726,gkb6xj,puck2,-0.3595,Seen in the wild! Convert coins to sats. At Stop &amp; Shop in Northeast USA.,1589556482,31,10
1727,gkb3pr,itisworking1,0.8442,"If bitcoin does moon, how will you deal with family members and friends?",1589556196,75,5
1729,gkanqo,DecryptMedia,-0.2023,Australian woman charged for running her own Bitcoin exchange,1589554771,5,2
1731,gkaee0,Moritz341,0.7269,You know These people 😂✌🏻,1589553887,5,0
1732,gkacwi,Koshepen,0.5023,Although this is not bitcoin but I still want to share it with you.,1589553747,0,1
1733,gkaasc,Bitcoin_to_da_Moon,-0.1027,Pandemic Bills Are So Big That Only Money-Printing Can Pay Them,1589553556,3,3
1734,gkaaoc,sylsau,0.0,What Does Bitcoin Really Represent?,1589553542,4,2
1737,gka5tr,Pietro1203,0.0,Question about transaction,1589553087,6,1
1738,gka550,jackvince000,0.8225,"Saw this while cycling my bike on the UK. Don’t quite get why you’d buy a house if you had 250 bitcoin but still, interesting and great to see even if it looks dodgy and scam like (I checked out the website and it didn’t exist)",1589553016,38,8
1739,gka27t,anon2414691,0.0,Futures Trading For Bitcoin’s Hashrate Has Arrived,1589552729,5,1
1740,gka0py,and-andreas,0.8957,Where do i buy Bitcoin safe and easy?,1589552586,10,1
1741,gk9ykg,anonfamprobs,0.0,Bitcoin trading,1589552380,3,2
1742,gk9xle,[deleted],0.6369,Love forex life,1589552282,2,0
1743,gk9wxu,[deleted],0.4939,BRRRR infinite print,1589552219,0,1
1744,gk9s2g,simplelifestyle,0.296,Kenyan crypto-currency pioneer: 'I make my money from Bitcoin and tasty roast meat',1589551753,1,1
1745,gk9o9l,jafusca9,-0.296,Advice on buying and selling bitcoin to avoid bank closures and foreign currency limitations,1589551383,1,1
1746,gk9nz8,dawid88,0.0,My referal,1589551360,0,1
1747,gk9ki6,Marcantonio97,-0.2023,Strange people i met,1589551027,7,1
1748,gk9jse,BashCo,0.0,"Honey Badger Diaries: Episode 34: Giacomo Zucco, Milan (Italy) [pt. 2]",1589550955,0,2
1749,gk9dan,GabeNewell_,0.4588,"Long term Hodler here. Scenario: We hit $20,000 by Dec 2020. Are we still going to be making excuses for $10 transaction fees?",1589550282,20,1
1750,gk9cc0,Miky06,0.0,"Remember, use BECH32 addresses",1589550184,39,1
1751,gk9b5a,Leonid83,0.0,IoTeX Pantheon — Enterprise-Ready Consortium Blockchain for IoT,1589550054,0,1
1752,gk956v,LuckyLeprechaun3,0.0,End goal for those who own BTC?,1589549427,17,1
1753,gk94cd,Lumin8_Crypto,0.3595,"Bitcoin News Today 2020: India Alert! Trading Volume Up By 47% And Sign Ups 1,000%.",1589549340,4,1
1754,gk93xy,northofwinterfell,0.0772,💩 The B Cash Challenge 💩,1589549295,1,1
1755,gk8y59,SumaZero,0.0,El precio del Bitcoin: ¿Recuperamos los $10.000? - CRIPTO TENDENCIA,1589548664,0,1
1756,gk8u4v,manfromnantucket1984,0.4588,How to survive your first Bitcoin Hackathon? Tales from the #LightningHacksprint. ⚡,1589548223,2,1
1757,gk8rv3,indomitus1,0.0,Segwit vs Legacy : receiving btc,1589547985,3,1
1759,gk8kt4,BitfuryGeorge,0.0926,Selling crap BCH for Bitcoins was one of the smartest moves I ve done &amp; it was the easiest as after evaluating who were the coders and developers behind BCash I realized they simply had no chance 😭,1589547251,1,1
1761,gk8i12,anonymus24312,-0.6597,Arguments against paper wallets,1589546927,35,1
1762,gk8h38,WorkingLime,0.0,"Venezuela update. One BTC is around 1,800,000,000 Bs. (Bolivares). 593 BTC were traded last week, up from 493 BTC (only using LocalBitcoin), these 593 BTC traded are 938,664,000,000 Bs. (ATH) Minimum monthly is around 5 USD.",1589546817,33,1
1763,gk8h1g,L82SA819,-0.2235,How to start saving / investing in BTC if you don't have any money?,1589546811,25,1
1764,gk8dv8,piixpayadmin,0.5501,"If you visit Prague, don't forget to check Paralelni Polis, really cool community and place!",1589546441,5,1
1765,gk8dal,jjnoob123,0.0,Currency of the future,1589546382,0,1
1766,gk8as6,lukas_napster,0.296,Coinbase doesn't react - Deposited Money not in my account.,1589546093,16,1
1767,gk847b,VitaminD3goodforyou,0.3818,Coinbase trying to weasel out why they purposely shut down during Bitcoin opportunities.,1589545333,0,1
1768,gk83t9,1978krcz,0.0,"Cryptocurrency News Roundup for May 14, 2020",1589545289,0,1
1769,gk83c5,spookiestevie,0.7712,"Take back our money, take back our freedom!",1589545232,26,1
1770,gk7wl1,bucelm,0.0,Satoshi says...,1589544455,5,1
1771,gk7v9h,guyfunhello,0.4329,"Anyone know of a service like Changelly based in the US? Or perhaps, another option?",1589544297,3,1
1772,gk7szm,castrazafaria,0.5949,Are altcoins considered decentralized so long as they’re on a blockchain?,1589544038,7,1
1773,gk7s5c,ShotBot,0.0,Will a unit smaller than a satoshi ever be introduced?,1589543944,33,1
1774,gk7pg5,I2ecover,0.4601,Okay. So serious question about taxing. Need help.,1589543579,11,1
1776,gk7nbl,DecryptMedia,0.0772,Bitcoin options trading no longer at the mercy of slow blockchains,1589543304,0,1
1777,gk7hid,jotega6113,0.4588,Quicken Support Phone Number 1-888-403-0506,1589542583,1,1
1778,gk7h6r,VampireVlad,-0.25,"""Adam Back is Satoshi"" YouTube video is bcash propaganda",1589542541,2,1
1779,gk7ezu,ShotBot,-0.3818,How common do you think bitcoin is for politicians and countries for trading in illegal favors?,1589542271,2,1
1780,gk7dqb,Firmuccess,-0.6361,Binance Podcast with Ophelia SNYDER from AMUN about tokens and SHORT BTC. When is a good time to short for you guys ? With leverage or nope ?,1589542101,0,1
1781,gk7bc8,Calambity_Jane,0.4588,Bitcoin Shop @ Grand Bazaar - Istanbul Turkey 🇹🇷 (2nd one I've seen this week),1589541792,9,1
1782,gk7ave,tenders74,0.3612,President Trump: The Military Is Being Mobilized To Distribute A Coronavirus Vaccine Once It's Ready,1589541739,1,1
1783,gk75ie,Kinolva,0.0,PSA: It is still possible for the average person to stack MILLIONS or BILLIONS of Satoshi... For now...,1589541046,25,1
1784,gk74p8,Eiajm,0.2023,"Odds on reaching 13,000$ this year?",1589540942,2,1
1785,gk6ust,GillesCadignan,0.0,The (Other) Bitcoin Standard,1589539657,0,1
1786,gk6sbs,Czfacts,0.0,"BTC Price Will Not Surge Post-Halving, Says Digital Finance Expert Carlo Cocuzzo",1589539317,0,1
1787,gk6pqs,Perfspots,0.0,Bitcoin Halving explained in Swiss German. Any Swiss here?,1589538966,2,1
1788,gk6hr4,Crypto-Angel,0.0,Visa Files Patent for Cryptocurrency System to Replace Cash,1589537827,1,1
1789,gk6bdd,klausmenator,-0.5994,"This bear is saying ""Hi""",1589536885,1,1
1790,gk6572,nigressnajari,0.2263,Prefabricated house for sale. 35k worth of bitcoin. Can provide references,1589535969,2,1
1791,gk653e,sikacash,0.0,1 000 000 US DOLLAR GIVEN AWAY,1589535954,0,1
1792,gk62cg,ripplesuckz,-0.0516,"Craig Wright Promised to Crash The Bitcoin Price… So, What Now?",1589535551,2,1
1793,gk5tep,Sundy86,0.3919,Sad but true,1589534207,0,1
1794,gk5m1e,ripplesuckz,-0.128,Post-Halving Report: Brazil Could Be New Bitcoin Demand Driver,1589533105,1,1
1795,gk5h1u,Bitcoin_to_da_Moon,0.0,Here’s Why Exchanges Haven’t Integrated Bitcoin’s Lightning Network,1589532365,1,1
1796,gk5edp,KaaruKaaru,0.7003,"Guys, look what I found in a small town in Kenya. Bitcoin accepted here. Feels great to pay for my lunch with bitcoin",1589531966,308,1
1797,gk59uj,YungMixtape2004,0.296,How to get commit access to the bitcoin github,1589531286,3,1
1798,ghj1pc,pnbamania,0.6505,"Train is leaving, LAST CALL! Everybody get onboard the Bitcoin Express! ...",1589182294,6,1
1799,ghizsu,kskelts,-0.3802,"630000 (halving) today or tomorrow, be odd if any longer, don't pull out!",1589182015,5,1
1800,ghiy4q,EAOE_Crypto,0.0,Young Bucks,1589181774,11,1
1801,ghivph,TheOrbOfAgamotto,-0.6239,"9 blocks mined all within an hour as we inched closer to Block 630,000!",1589181432,0,1
1802,ghit81,King_crypt,0.0,And so it Begins..,1589181089,4,1
1803,ghit0u,ShotBot,-0.6908,We seen oil go negative. Can bitcoin theoretically trade at negative values?,1589181060,16,1
1804,ghiojs,rBitcoinMod,0.0,"Daily Discussion, May 11, 2020",1589180458,217,1
1805,ghillh,childish_KAM,0.0,Bitcoin making moves in VR,1589180036,1,1
1807,ghifub,intothecryptoverse,0.0,The Bitcoin Halving is upon us! A look at prior expansion/contraction phases,1589179233,1,1
1808,ghie1v,MarkPapermaster,0.7046,What is your endgame plan for hodling? 20 years? 1 000 000 USD? Or will you hodl forever and never ever sell no matter what?,1589178981,38,1
1809,ghibcy,slvbtc,0.0,Bitcoin is the biggest trojan horse to have ever existed,1589178607,61,1
1810,ghi22x,notacooleagle,0.0,Why can different transaction outputs have the same scriptpubkey?,1589177370,0,1
1812,ghhu01,SignificantExam9,0.0,Bitcoin miner,1589176268,0,1
1813,ghhsi0,Healthsupplementoffe,0.7184,How to buy Bitcoin from people directly? A few options:,1589176063,0,1
1814,ghhqcf,bama_done,0.0,THE Halving FOMO,1589175783,7,1
1815,ghhgr4,StormyStress,0.4003,Elon Musk giving away BTC ETH!,1589174514,1,1
1816,ghhgb2,adam0000345,0.0,Miner's Fees,1589174452,5,1
1817,ghh1l9,jendo10,0.0,Halving question...,1589172596,8,1
1818,ghh05f,MichaeljRgs,0.5859,How to buy Bitcoin with no ID?,1589172408,15,1
1819,ghgvtb,IsThereCheese,0.0,Everyone the *second* the halvening hits..,1589171877,0,1
1820,ghgtcp,anmolgaur45,0.4776,We're almost there!! Nice.,1589171569,10,1
1821,ghgsnw,RickSanchez-E6Y72,-0.2942,TickTock - 100 blocks to go!,1589171483,4,1
1823,ghgeif,Moriloqui,0.4767,"""Birthday hug from Dad""",1589169845,1,1
1824,ghg9bv,summasnowball,0.0,The halvening,1589169261,17,1
1825,ghg64e,coingecko,0.0,Bitcoin halving - now only less than 17 hours to go!,1589168898,0,1
1827,ghg1nu,shaundemayo,0.4588,"Bitcoin beginner here, theoretically if someone bought 1 BTC on April 15 when it was at $6,624 and then sold it at the high of $10,000 on May 7, they would make $3,376?",1589168360,36,1
1828,ghg0ae,ishmoo21,-0.4404,Samsung block chain keystore,1589168188,4,1
1829,ghfuzg,bearCatBird,0.7096,When bitcoin is worth $1 Million in a year but it can only buy you a roll of toilet paper due to inflation.,1589167568,12,1
1830,ghfl1r,getlitgiu,0.4019,"Seing all the lambo comments on this page, this guy clearly sold his bitcoin at the 2017 peak (check out the house vs the car)",1589166395,0,1
1831,ghfjyx,AwareDifficulty5,0.0,Earn Bitcoin in my Cryptotab Mining Pool Team Now!,1589166282,0,1
1832,ghfift,hoplezz,0.0,How can i find txid on blockchain/coinbase?,1589166103,4,1
1834,ghfhc0,getlitgiu,0.0,Something tells me the guy who lives here bought bitcoin before 2017,1589166002,1,1
1836,ghfahb,Street_Governments,0.0,Buying Gold with BC question.,1589165235,1,1
1837,ghf81k,gulfbitcoin,0.0,2012 halving to 2016 halving: 54x. 2016 halving to now: 13x.,1589164952,6,1
1838,ghf651,EdySanu,0.0,Bitcoin Halving Today!,1589164733,4,1
1839,ghf3x6,dailyblockchain_news,0.0,"Bitcoin prepares for halving, Libra appoints CEO",1589164488,0,1
1841,gheum5,dailyblockchain_news,0.4019,Bitcoin Price Bounces at Key Trendline Support 1 Day Before BTC Halving,1589163458,0,1
1842,gherum,thomas10474,0.0,How do I purchase bitcoin,1589163138,6,1
1843,ghenyt,_SwIP3_hackk,0.0,#BARGAINSTORERETURNSEXPLOIT,1589162721,0,1
1844,gheg8r,torontos_416,0.0516,Are you guys planning on cashing out if BTC reaches an ATH after the halving?,1589161902,22,1
1845,gheb70,magnusvollen,0.0,🚀Bitcoin Price 1st of May,1589161351,0,1
1846,ghea8f,magnusvollen,0.0,🚀Bitcoin Price 1st May,1589161244,0,1
1849,ghdzsz,keiths_stones,0.1779,Has anyone hosted miners with Blockware Solutions?,1589160166,3,1
1850,ghdvuy,kios0,0.7184,Halving moon,1589159743,3,1
1852,ghdtm3,dailyblockchain_news,0.0,"Bitcoin Tests $10,000, ‘Halving Dump,’ $1M BTC Predicted: Hodler’s Digest, May 4–10",1589159503,0,1
1853,ghdina,NufMeister,0.34,My bitcoin node validating each transaction,1589158352,215,1
1854,ghdhs3,kashifuddinshaikh,0.0,Butcoin &amp; You?,1589158264,0,1
1855,ghddzc,youknowyourjudowell,0.0,Does anyone use/have experience with the exchange ‘Coin Counter’?,1589157867,2,1
1856,ghcv1o,Malibutwo,0.0,"Were people saying ""the halving is already priced in"" before the last two?",1589155967,21,1
1857,ghcrzv,CriticalSodium,0.0,Ledger S vs X,1589155646,10,1
1858,ghcj1w,antyyyy4,0.0,Methods/sauce,1589154754,3,1
1859,ghcima,stephanlivera,0.0,SLP172 Nicolas Dorier &amp; Kukks – P2EP Comes To BTCPay Server,1589154714,1,1
1860,ghci9h,reggaebomb,0.836,"Divergence on RSI, a good time to buy?",1589154679,4,1
1861,ghch27,elliotwave,0.0,The Bitcoin Time Traveler is back!,1589154562,0,1
1862,ghcfd9,antyyyy4,0.0,Sauce/methods/logs/drops/cvvs/ect.,1589154390,1,1
1863,ghceme,Crypto-Angel,0.0,$275 Million: Bitcoin Traders Face Mass Liquidation Following Latest Selloff,1589154314,0,1
1864,ghcdmz,FunctioningLurker,0.0,My one-line halving countdown,1589154219,0,1
1865,ghc73u,LC_GOD,-0.5859,bitcoin youtube live scams,1589153600,5,1
1866,ghc2wg,kodakarmathrowaway,0.5362,Just realized I don’t technically “own” my bot coin on Robinhood? What is the wisest way to handle my situation?,1589153200,23,1
1867,ghbxi2,CoinHubATM,0.0,These are facts,1589152683,6,1
1868,ghbpwu,DrDic,-0.296,‘Quora explains why Bitcoins are a bad idea’ June 2011. “Bitcoin then lost around a third of its value but has since climbed back up to around $22 per Bitcoin”,1589151955,2,1
1869,ghboef,THEN3LLI,0.0,Price right now,1589151821,1,0
1870,ghbgfh,Big_Happy_Henry,-0.6476,Biggest Cryptocurrency Scam Happening now! Blockchain Live Streams,1589151077,1,2
1871,ghbbkj,dailyblockchain_news,0.0,All crypto news in one place!,1589150608,5,2
1872,ghb8f6,ThatWazMe,0.0772,I'm spending my bitcoin. I just want to get rid of it.,1589150309,35,0
1873,ghb2xe,HarryRobso,-0.1779,I made a proof of concept for a Bitcoin based election program (don't take it too seriously),1589149788,4,1
1874,ghb0ed,FlipMoriarty,0.1999,We should talk less about the price or the halving. Advertising Bitcoin through potential profits due to the halving will not attract the people you need in this economy and just lead to another bubble. The one thing that really counts and that we need to push for is mass adoption.,1589149547,12,1
1875,ghauiu,CrescentDays,0.6369,What's the best holding strategy between those two?,1589148976,1,1
1877,ghaqvc,swipingsky,0.0,Bitcoin as a currency,1589148622,7,2
1878,ghahg4,iruleU,0.7351,What are some alternatives to coinbase? The fees are pretty high.,1589147721,46,2
1879,ghaasw,cryptogiraffewins,-0.4574,"Another Bitcoin scam ou Youtube, Report please!",1589147100,12,0
1880,ghaagq,iNerse,0.5204,Can we call this guy a whale? What do you think about that?,1589147067,8,0
1881,gh9yve,Msmaecrypto,0.75,A post for mom's... Today is our day and I wish you a fabulous one!,1589145981,0,0
1882,gh9ur9,letsgetbit,0.0,"Bitcoin Quant &amp; Blogger Plan B, forcast BTC potential above $250k, this coming halving cycle.",1589145595,8,0
1884,gh9nib,cainethelongshot,-0.1007,Cheers to those fools who zoomed out!,1589144919,158,21
1885,gh9i24,onlineguy29,0.0,Why are the mods censoring everyone on this sub?,1589144442,1,1
1886,gh9g8u,[deleted],-0.1007,Cheers to those fools who zoomed out! [updated],1589144287,0,1
1887,gh95nv,CollegeAdmission88,0.0,The Biggest Cryptocurrency Channel On YouTube Just Capitulated on ALL Altcoin and Went ALL In On Bitcoin.,1589143353,6,0
1888,gh9547,Speedyjagman,0.3612,Ready for the Halving Guys,1589143304,11,3
1890,gh8xl6,hungryentrepreneur,0.3182,"PSA: Just because FIAT is bad doesn't inherently make bitcoin good, nor does it make it a good currency in general.",1589142631,50,0
1891,gh8m7s,tob23ler,0.128,Joker HODL (2008),1589141626,3,6
1892,gh8gtj,Friendly_Crab,0.0,Greenland Whale Fisheries,1589141163,0,2
1893,gh8gr1,xangelhui,0.4939,Bitcoin has been pretty wild these last few weeks.. can’t expect anything,1589141157,12,1
1894,gh8fup,theriderofrohan7,0.0,What factors do you guys take into consideration when day trading?,1589141074,9,1
1895,gh8b35,spookiestevie,0.0,Look at this photograph!,1589140668,8,3
1896,gh88zv,bojangles313,-0.6739,72 Hours for Coinbase to move my BTC to my Nano Ledger. WTF,1589140484,26,3
1897,gh8807,Uberdriver_janis,0.0,I just cant get this in my head,1589140392,10,1
1898,gifdvg,farrukh96,0.3818,Bitcoin Cash turned out to be innovation in Pakistan,1589303338,0,1
1900,gifabc,NanoBank,-0.4939,"Cut the issue in half. ✂ #Bitcoin is now a rarer and scarce resource. Only 6.25 #BTC worldwide for each block. The annual #inflation of the #Bitcoin network will decrease from ~ 3.64% to ~ 1.8%, and this is a significant milestone, since now it will be below the target level of the #US #FederalR",1589303053,2,1
1901,gif3n6,vrajshah11,0.0,Telegram discontinue cryptocurrency name Gram which was built on principles of Bitcoin,1589302519,0,1
1902,gif2i2,dan_held,0.0,Public service announcement.,1589302425,48,1
1903,gieswf,stratguy56,0.5319,How to Report Bitcoin Losses On Your Taxes - and save MONEY,1589301631,0,1
1904,giejzz,Bitcoin_to_da_Moon,0.5413,What are the most exciting new Lightning Network features?,1589300888,5,1
1905,giec9o,thehandwowpack,-0.4767,Three Things American Mainstream Media Has Wrong About COVID-19 and the Economy,1589300256,0,1
1906,giea0n,psychedelikchef,-0.296,As someone who has no knowledge on bitcoin... Why should I get it and how soon should I get it considering the changes in society lately?,1589300072,14,1
1907,gie8mr,AceKingofHearts,0.7165,So f*cking bullish on btc,1589299963,1,1
1908,gie84m,octergon,0.0,Lets take a moment,1589299926,6,1
1909,gie4im,ClonedY,0.4019,20 Trillion INR is going to get injected to boost Indian Economy,1589299628,5,1
1910,gie225,curiouschipmunk1010,-0.6124,Bitcoin Scam,1589299433,1,1
1911,gidzxv,crypto_bot,0.0,"Bitcoin Network Status Update Tuesday, May 12, 2020",1589299264,0,1
1912,gidxfk,192838475647382910,0.4939,Now let’s fuel the rocket.,1589299055,0,1
1913,gidu9t,abudab1,-0.6124,Could we report on youtube this live scam,1589298785,4,1
1914,gidruv,SolidFaiz,0.0,Thought this belonged here,1589298584,18,1
1915,gidrcm,nickweston001,0.6452,Don't look so far.... Success is in you!,1589298543,7,1
1917,gidn95,_WinnerTakesAll_,0.6705,Are Bitcoin and Bitcoin service providers ready for high transaction volume and mass influx of new users?,1589298192,6,1
1918,gidmjw,Starlory,0.6833,As of today i paid 406€ for this beautiful indie game.,1589298131,31,1
1920,gidhtv,MK333666,0.1779,"Paul Tudor Jones American billionaire and hedge fund manager, has almost 2% of its assets in BTC",1589297740,2,1
1921,giddc8,polagon,0.0,Reminder to beginners to use 2FA when possible,1589297358,2,1
1922,gidafc,eff-snarf,0.0,Smartwatch with a Bitcoin price ticker?,1589297112,3,1
1923,gid89j,speakersandwich,0.0,Bitcoin Price at Each Halving,1589296925,55,1
1924,gid6rv,TorstenEndofMoney,0.0,"Movie still from #CryptopiaFilm, the new cinema documentary is available for streaming now.",1589296804,5,1
1926,gid3wi,KingInTheNorthish,0.0,How does one tackle this???,1589296550,7,1
1928,gid1yu,sylsau,0.4019,Bitcoin revolution will happen whether you support it or not,1589296371,3,1
1929,gid12e,BitcoinAItradingbot,0.0,How to subscribe in Dephlagy Ai Auto Trading Bot,1589296293,0,1
1930,gicxxw,your_local_dumba3s,0.4019,An interesting watch,1589296013,0,1
1931,gicxcp,kolinHall,0.0,Anyone have any estimates as to when we might see Taproot &amp; Schnorr added,1589295959,3,1
1932,gicwti,Feedmecats335,0.0516,Opinion: Bitcoin Will Rise to Insane Valuations by 2025 and You Still Won’t Make a Profit From It,1589295913,4,1
1933,gictkh,rzymachiavelli,0.0,How to follow development news,1589295645,2,1
1934,gicp9y,HelloNOTW,0.0,There are many mysteries around whales in the crypto world,1589295248,1,1
1936,gichy1,sumitshinde2608,0.0,Bitcoin traders what you say?,1589294565,2,1
1937,gichke,Bitcoin_to_da_Moon,0.0,JPMorgan now serves crypto exchanges,1589294529,7,1
1938,gicgqe,mytvwatchesme,0.0,Native Segwit or Segwit on Ledger,1589294454,16,1
1939,gicf9x,kingsofall,0.1779,Here's after the the halving (its still growing),1589294318,0,1
1940,gicdj7,CautiousHippo1,0.0,Earn Bitcoin without any investment,1589294157,0,1
1941,gic5wr,saintpetejackboy,0.0,Here we go again...,1589293440,16,1
1942,gic4ad,sylsau,0.0,Bitcoin Becomes Scarcer Than Ever in One Historic Day,1589293285,5,1
1943,gibzed,Lumin8_Crypto,0.0,"Bitcoin News Today May 12, 2020: 3 Reasons For The Bitcoin Price ‘Halving Dump’",1589292808,0,1
1944,gibytv,mishax1,0.6369,Best 6 minutes you'll ever hear about Bitcoin. (2018),1589292755,59,1
1945,gibyhk,NoReflection2,-0.0772,The Real Satoshi Exposed,1589292723,1,1
1946,gibrtf,awertheim,0.0,Who here stacked sats and sold exactly 0 of them during Bitcoin Era 3? Hands up people!,1589292087,4,1
1947,gibopc,ShotBot,-0.6908,Bitcoin post halving trending bearish?,1589291792,2,1
1948,gibk6p,StandardCA,0.0129,"The Bitcoin halving matters, but for different reasons than you might think",1589291331,0,1
1949,gibk50,slvbtc,-0.128,Its all supply and demand,1589291325,35,1
1950,gibho9,prud444,-0.0516,What are the advantages and disadvantages of buying Bitcoin halving?,1589291086,1,1
1951,gibbh1,stanman1324,0.4404,Theoretical question: what if a person cashed in their reward after mining the next block and it was accepted?,1589290475,9,1
1952,gibb6r,LegitimateBuffalo1,0.0,What is going on?,1589290449,0,1
1953,gib9zl,stanman1324,-0.0258,Theoretical question: what if a person cashed in there reward after creating a fake block?,1589290331,0,1
1954,gib9bl,Sneakybobo,0.0,Soon,1589290264,55,1
1955,gib7wz,dsouzalds,0.8122,"I can hardly wait for Bankiom - 3 minute bank account, 1 second loan approval and easiest money manager!",1589290122,0,1
1957,gib2sz,mishax1,0.6369,Best 6 minutes about Bitcoin you'll ever hear. (2018),1589289626,0,1
1958,giazik,bitcoininclear,0.0,dissecting the bitcoin whitepaper - part 7 - disk space,1589289277,4,1
1959,giazdr,moabitsaga,0.2023,A Substantial Following of Crypto Trades / NEON on $2,1589289263,1,1
1960,giaz7f,sammyb67,0.34,Jamie Diamond eating his words,1589289244,0,1
1961,giax8u,xanderpua,-0.3818,"It's been an honor to HODL with you. But sadly, I'm leaving BTC for now.",1589289042,271,1
1962,giax6f,Christie_Ariels,0.0,Morning Thoughts; What's the next plan after halving??,1589289035,2,1
1964,giaw33,Dankest_Potatoes,0.0,New investors after the halving,1589288921,232,1
1966,giapws,ShiftalOfficial,0.3365,"Bitcoin Halving: Crypto experts are expecting a second explosion in value | History teaches us that after this post-halving drop in price, there is a subsequent bull run! Waiting for price hike. Fingers crossed!",1589288291,1,1
1967,giaobz,childish_KAM,0.0,Billionaire investor on Bitcoin,1589288117,3,1
1968,giamwn,Sol-eski,0.0,Halving. What now?,1589287954,12,1
1969,giaj4m,slvbtc,0.0,How should we define the different bitcoin eras?,1589287525,2,1
1970,giae3p,a1705471,0.0,BTC Price following the halvening,1589286963,10,1
1971,giadrp,Vernon51,-0.5267,We need lower bitcoin prices to stop miner centralization,1589286923,7,1
1972,gia8r9,MrStarrrr,0.0,Halving Celebration Story Thread 2020,1589286347,0,1
1973,gia8bc,bojangles313,0.0,Trezor Model T- Shipping Clarification,1589286298,1,1
1975,gia7zl,SourAppl3,0.34,Capital Gains Tax,1589286261,3,1
1976,gia5wn,ibiscp,-0.1511,How would it be if there was no block reward?,1589286032,10,1
1977,gia50y,JonFog78,-0.1531,Did I miss something?,1589285933,24,1
1978,gia2mk,VLADIMIROVIC_L,0.8357,What's the best talk that explains how bitcoin works? It should show why the innovation is so important and roughly how the consensus mechanism is designed.,1589285651,10,1
1979,gi9z7i,mccormack555,0.0516,Is Bitcoin Trading a Dirty Business? With Willy Woo — What Bitcoin Did,1589285271,0,1
1980,gi9y5s,depressssssss,-0.3612,bitcoin sucks,1589285149,3,1
1981,gi9qj2,dolannoodlesauce,0.0,Let’s talk about exchanges,1589284251,15,1
1982,gi9owi,JonVici1,0.3612,Looks like my prediction came through with the HALVING,1589284051,5,1
1983,gi9kob,Sandboxeaa,0.2023,Bitcoin Halving Comes and Goes with Important Message,1589283550,0,1
1984,gi9j2s,fionnanod98,0.0,Buying Bitcoin,1589283362,5,1
1985,gi9gnl,bdinu89,0.7184,Should You Buy BTC Now That Bitcoin Halving Event Has Concluded?,1589283068,8,1
1986,gi90ew,pervez1234,0.0,How to maintenance your vessel!!!!,1589281010,0,1
1987,gi8zzd,BitCowboy,0.0,How are outputs to segwit P2SH or P2WPKH addresses different?,1589280949,4,1
1988,gi8yir,iamthebike,-0.5719,i em have a problem bitcoin stuck,1589280746,6,1
1990,gi8qel,the420chronicler,0.8658,The Fed starts to buy ETFs today with money printed out of thin air. Some of this money will find its way into Bitcoin. Act accordingly.,1589279648,19,1
1991,gi8k22,ripplesuckz,0.4215,Statement From Billionaire Paul Tudor Jones Makes Powerful Case for Bitcoin and Crypto,1589278810,1,1
1993,gi8aev,nabes_63,0.0,Purchasing BTC,1589277479,11,1
1994,gi85o8,prong76,0.0,Bitcoin Holds Ground as Third Halving Event Happened without Glitch,1589276820,1,1
1996,gi805k,AwkwardHonk,0.0,How interoperability brings blockchain back to its roots,1589276037,0,1
1997,gi7zv1,PriyankaCoinex,0.9184,One of the most significant events in the crypto world has occurred today.🎉🎉🎉 Bitcoin went through the third in its history Halving ⚡️ The block reward reduced from 12.5 BTC to 6.25 BTC.,1589275997,0,1
1999,gle1eb,TariqKilani01,0.3182,Coinbase is taking huge fees,1589715887,54,1
