,id,author,vader,title,created_utc,num_comments,score
4929,gmvmt8,somerandomuser45,-0.25,Armory stuck for days... Anyone got an idea of how to solv this?,1589917177,5,1
4930,gmvi0j,anzel2002,0.2263,"A few weeks ago a billionaire announced that he acquired about 11 thousand bitcoins, or about 100 million worth, how many more billionaires can actually do what he did without greatly increasing the price?",1589916769,14,1
4931,gmvfj4,SamuelT1999,0.2263,Waht if mining isn`t worth it anymore?,1589916565,13,1
4932,gmvdsj,genius3edition,-0.6249,Luke Dashjr retweeted this image about the dangers of big blocks,1589916421,20,1
4933,gmvclf,jacha93,0.2023,Treasury says 4 million Americans should expect prepaid debit cards with stimulus payments,1589916318,5,1
4934,gmvbko,Crypto4Canadians,0.0,Opendime - A Very Unique Bitcoin USB Stick,1589916233,0,1
4935,gmvb2h,crazyfool01,0.4588,Bitcoin/Lightning Oil Painting with glitter ₿😍 40x50cm,1589916189,3,4
4936,gmv9bm,cyaaron,0.0,Can I get an F in chat?,1589916041,4,1
4938,gmv74m,[deleted],0.0,Am I right?,1589915852,4,0
4939,gmus5z,GallifreyanVisitor,0.1027,The year is 2021. 3 large chinooks cut across the cerulean sky and descend on the home of a mega wealthy CEO.,1589914593,16,1
4940,gmunvm,dallidrai,0.5081,Hey check out my video below I'd really appreciate some feedback!,1589914236,0,1
4942,gmul48,Quintall1,0.8779,"Observation: Mempool getting flooded with high fee TX while it is not even necessary, while social media campaign goes full on ""muh fees are so high"". Coincidence?",1589913996,11,1
4943,gmudm2,Elephant_ITR,0.0,Crypto scam/potential phishing,1589913347,36,1
4944,gmu6kw,phileo,-0.5267,Bitcoin Q&amp;A: What's the Biggest Threat to Bitcoin in 2020?,1589912749,16,3
4945,gmu3nb,Smolsen99,0.3182,College student curious in bitcoin.,1589912510,25,4
4946,gmtvjr,Bishop68,0.0,Deviant?,1589911833,1,1
4947,gmtuhm,Tanque74,0.4404,Steam gift cards in exchange for Bitcoin,1589911743,1,0
4948,gmto1z,lunarcrush,0.5563,Bitcoin social volume has been very strong over the past month,1589911201,0,1
4949,gmtif6,ImaneElAbid,-0.4215,Prevent Sybil attacks,1589910697,2,1
4950,gmthir,Coinozi,0.0,CoinOzi - Cryptocurrency News Aggregator,1589910613,1,0
4951,gmte1f,anantjethalia1001,0.2023,Why is Blockchain important?,1589910314,0,1
4952,gmt9yn,AnOrlyFox,0.4588,Newbie seeking guidance. :),1589909967,15,1
4953,gmt9ws,ThunderCowz,0.0,Question about xfer,1589909964,4,1
4954,gmt27r,jenny82ishere,-0.2263,Want to sign for more exchanges that work in US. Caveat - no selfies.,1589909315,5,2
4955,gmt1j8,RedRage04,0.0,I Have Discovered the Key to Adoption,1589909255,3,0
4956,gmsr3j,turpin23,0.7184,Fortune cookie say Bitcoin will jump over Moon.,1589908382,8,10
4957,gmspop,ChangeNow_io,0.0,"She was a poem, but he couldn't read",1589908267,7,2
4958,gmshzc,[deleted],0.0,Crypto Culture,1589907627,0,1
4959,gmsetk,ChangeNow_io,0.8221,"Now, as J.K. Rowling has expressed her interest in Bitcoin, we believe there should be more popular authors talking about it. For instance, Stephen King . We tried to imagine what his book covers would look like if he wrote about bitcoin.",1589907354,10,3
4960,gmsc2r,NRafael,0.0,The Fed in 2020,1589907116,87,4
4961,gms812,BashCo,0.0,Tales from the Crypt: #162: Robert Breedlove,1589906769,0,1
4962,gms0b0,tedmann12,0.296,Taking money from 401k to invest in BTC,1589906088,50,0
4963,gmrwvp,ahajko,0.6249,Is there an easy way for non-crypto users to transfer money into my blockchain account?,1589905795,6,1
4964,gmrtxk,WarmMyToast,0.8176,Website like BTCXE to buy Bitcoin directly online?,1589905526,0,1
4965,gmrs5w,trade3x3roy,0.0,bitcoin trading report may 2020,1589905373,1,0
4966,gmrqxy,moabitsaga,0.3182,"""Mystery Plan Completed"" - Original Artwork by Moabit",1589905272,6,0
4967,gmrnfb,VampireVlad,0.0,Why Adam Back is not Satoshi Nakamoto (response to Barely Sociable's video),1589904971,2,0
4968,gmrguc,TCS13579,0.9001,should i invest in proof of trust ltd ?!? PLEASE HELP !!,1589904419,4,0
4969,gmrdnd,radshan_,-0.4767,[Experience] How I proved my family wrong about BTC.,1589904158,2,1
4970,gmrcpl,crypto_bot,0.0,"Bitcoin Network Status Update Tuesday, May 19, 2020",1589904087,0,1
4971,gmrccn,anthologyxxviii,-0.4019,BlockFi client information hacked,1589904059,5,0
4972,gmr7fe,wongway1,-0.5423,"Coinbase is trash, stay the fuck away",1589903637,17,1
4973,gmr2fa,FutureWillingness8,0.0,I just think its not possible,1589903207,25,0
4974,gmr11b,coshyeezy123,0.0,How can I invest in bitcoin?,1589903084,13,0
4975,gmqxid,ShotBot,-0.4767,Why the bitcoin stock to flow model is wrong and bitcoin price prediction.,1589902784,3,2
4976,gmquxd,SaneFive,0.0258,Here's when Bitcoin will actually reach 99.99% uptime,1589902558,0,2
4977,gmqtr9,Lofde_,0.6486,Curious if there's a way to make interest on loans,1589902456,15,0
4978,gmqr3b,Rayanator69,-0.4588,About that End of May Dip...,1589902228,29,1
4979,gmqq9h,cgbhardrock,0.4574,Help me!,1589902154,0,1
4980,gmqpub,Jocke1234,0.4404,Could you nudge this down 0.92 for satisfaction?,1589902114,1,1
4982,gmqkir,TheSimkin,0.7184,Bitcoin and Friends: Hodling Is Good,1589901642,4,1
4983,gmqk45,genius3edition,0.6486,I hope Core never ever increases the blocksize. Security is right.,1589901607,222,6
4984,gmqglw,sylsau,-0.2023,"Jerome Powell’s Interview Confirms That the Fiat System Is Flawed, Bitcoin Is the Solution",1589901288,3,2
4986,gmq9zz,marco75001,0.0,"5/18/2020 #BITCOIN ZAP — 630,868",1589900713,0,1
4987,gmq7oc,MinimalismCode,0.6369,🧡₿🧡,1589900506,7,6
4988,gmq45m,bookw360,0.2023,Fine,1589900192,2,0
4989,gmpzh4,wmredditor,0.0,We Wouldn't Be Talking About Crypto Without Bitcoin: Winklevoss Twins,1589899763,1,0
4991,gmp9e1,Elum224,-0.5411,"Block-fi suffered data breach, watch out for the phising!",1589897346,50,6
4993,gmp3ph,Blockchain_io,0.25,Paymium' referral: a chance for 1 ETH each month,1589896835,0,1
4994,gmouwt,Oxygenjacket,0.0,PixelPortfolio is now available on IOS (and android) Now everyone can track their bitcoin holdings in pixelart.,1589895977,0,2
4995,gmotsh,DecryptMedia,-0.5994,"ISIS's $300 million war chest is hidden in Bitcoin, says think tank",1589895867,12,2
4996,gsibce,umbraascensor,0.4404,Safe Bitcoining programs,1590711830,4,1
4998,gsi8in,marthabutlerfx,0.0,Invest now,1590711547,0,1
4999,gsi66b,son_of_Bill_W,-0.7096,I suck at buying the dip,1590711296,34,1
5000,gsi3fw,dnhstv,0.0,Coinbase Down Again,1590711035,1,1
5001,gsi1uf,JusTheDip,0.5106,Prize linked saving with Bitcoin,1590710883,2,1
5002,gsi1tn,codyt54,0.0,Investment,1590710881,0,1
5005,gshoiy,skyfame23,0.4019,Ethereum Smart Contract,1590709579,1,1
5006,gshhpm,icakally,0.0,This website makes me $800 BTC every day - Classified Ad,1590708898,1,1
5008,gshe11,intothecryptoverse,0.0,Bitcoin continues to defy the bears,1590708531,1,1
5009,gshbnw,evilqubit,0.2732,smartcontract prediction based on ethereum (create your own bets),1590708294,1,1
5010,gshb0m,Kaka99999,0.3612,Explain like I’m five,1590708233,7,1
5011,gsh588,heilaonajh,0.6369,Best exchanges,1590707678,4,1
5012,gsh1k9,HolaAditya,0.0,Goldman Sachs Slammed Bitcoin Sparking Disapproval From the Crypto Community,1590707316,1,1
5013,gsh01p,BashCo,0.296,Citizen Bitcoin: Jeff Booth: The Money of Tomorrow,1590707161,1,1
5014,gsgxqs,daniel446,0.34,about the Bitcoin value,1590706945,5,1
5015,gsgtxe,admin_default,0.1531,Some fine content from one the craziest subs on Reddit,1590706589,2,1
5016,gsgtkp,admin_default,0.1531,Some fine content from one of the craziest subs on Reddit,1590706556,0,1
5017,gsgrzo,vajidsikand,0.8316,Gemini Company made cryptocurrency easier to buy via Samsung phones,1590706409,0,1
5018,gsgorn,vaderlaser,0.4215,"Hey, I made a BTC themed website for Charity with Games",1590706106,2,1
5019,gsgnj6,S_Nakamoto0103,0.0,Does anyone here know how to add sales tax to a BTCPay PoS invoice?,1590705987,17,1
5020,gsgl89,NevilleLongbottomBTC,0.3612,ready?,1590705765,3,1
5022,gsgi1a,StarRavin,0.0,Bitcoin chocolates,1590705456,0,1
5023,gsgblz,BashCo,0.0,Bitcoin Audible: Read_398 - The Political Theology of Bitcoin [Erik Cason],1590704850,0,1
5024,gsfys3,Macro_Aurelius,0.0,General Bitcoin community question,1590703665,10,1
5025,gsftl7,BashCo,0.0,Tales from the Crypt: Rabbit Hole Recap: Week of 2020.05.25,1590703191,1,1
5026,gsf48b,onlyfansplugFS,-0.5423,drop your thoughts 💭🤔,1590700913,11,1
5027,gsf236,btc545dotcom,0.0,Can bitcoin really go to $300k-$400k in next 5-10 years?,1590700724,1,1
5028,gsf1qw,brianddk,0.3818,ELI5: Why are people astonished that Goldman Sacks pans bitcoin?,1590700694,5,1
5029,gsf0ab,CRYPTORALF,0.0,"Jack Dorsey: censorship on twitter on one day, proponent of decentralization (BTC) on the other day.",1590700563,2,1
5030,gsewz4,YourBabyWhale69,-0.5267,What is the Biggest Threat to Bitcoin in 2020? | Bitcoiner Dan Held Interview [May 28th 2020],1590700262,32,1
5031,gseua8,Rich_Grape,0.0,Earn bitcoin,1590700022,1,1
5032,gsetla,iamsolazybastard,-0.7479,"I so lazy, so lazy, give me your bitcoin..",1590699967,1,1
5033,gser21,gizram84,0.0,Private key puzzle - 1 BTC,1590699749,0,1
5034,gsepys,sylsau,-0.2057,"Goldman Sachs Doesn’t Understand Bitcoin, and That’s Not Surprising",1590699653,4,1
5035,gsep6g,Spinuz94,0.296,Chuckled,1590699593,5,1
5036,gseiyq,JayStingray86,0.3182,Curious,1590699036,8,1
5037,gsec7g,BrianAtSantiment,0.6908,Making a Cautiously Bullish Case for BTC,1590698429,2,1
5038,gse925,psyco_llama,0.779,"I didn't buy a car, but I did buy a business!",1590698140,33,1
5039,gse8ae,waytoomuchnoise,0.0,Cryptofunding tomorrow,1590698071,1,1
5041,gse67w,christopher_west72,0.0,Forex and crypto,1590697882,0,1
5042,gse4ks,Mr_Beau_Jangles,0.0,Dave Ramsey’s thoughts,1590697733,19,1
5044,gsdwag,bitcoin-bull,0.0,"""What Are You Smoking?"" Winklevoss Pans Goldman Sachs Bitcoin Bashing",1590697011,0,1
5045,gsds85,CC_EF_JTF,-0.128,In the Mesh – Towards global offline Lightning channels,1590696664,1,1
5047,gsdhrw,RandomnessTalk,0.6369,How to Use Virtual Credit Cards to Protect Your Financial Information,1590695811,0,1
5048,gsd728,CryptoWireNow,0.0,It’s never too late.,1590694893,7,1
5049,gscqoz,JustPvmBro,0.296,Are people into bitcoin for the adoption or the money?,1590693551,19,1
5051,gsce1a,BeneficialMusician4,0.0,Send,1590692490,1,1
5052,gscdto,rabaioli,0.0,"Guys, I need your opinion on the Bitcoin thread I made on Twitter:",1590692475,3,1
5053,gscbbj,starkiller3373,0.4019,Fold support has initated a refund for my giftcards.,1590692262,3,1
5054,gsc992,C0untryGuy,0.0,"If they are buying at this rate, this should be a indicator for more people to take notice",1590692096,4,1
5055,gsc4y4,Khaflame27,0.0,Cant broadcast/sign on electrum ??!!,1590691740,9,1
5056,gsc2bc,DonnieBrast,0.0,"Bitcoin hits $9,500 in sudden price surge",1590691507,2,1
5057,gsbzr7,tinycoin,0.0,MARTY: Doc! I need to get back to the year 2140,1590691288,0,1
5058,gsby2a,Moeezzy1,0.5719,My opinion on Goldman summarized in a perfect quote,1590691147,3,1
5059,gsbxo8,DonnieBrast,0.4215,Telegram CEO Donates 10 BTC to Charity Project in Russia,1590691114,0,1
5060,gsbtue,kealenz,0.0,US Plan to Delist Chinese Stocks Could Trigger Massive Bitcoin Buying Spree,1590690785,20,1
5061,gsbql0,coinstart,0.0,How to Anonymous Bitcoin (Summer 2020 Edition),1590690500,2,1
5062,gsbete,spookiestevie,0.3612,Future bitcoiners be like:,1590689507,1,1
5063,gsbbxa,BitcoinIsDigitalGold,0.5242,Going LIVE Very Soon With Bitcoin OG Dan Held! Opportunity To Ask Him Anything [About Bitcoin]!,1590689257,1,1
5064,gsbbfr,heist95,0.0,Started a 2-minute daily newsletter for Bitcoiners,1590689214,4,1
5067,gsb8sf,pandeybhvsh,0.0,Extensible HYIP Script,1590688989,0,1
5068,gsazna,lucayepa,0.0,Have you ever wondered?,1590688214,9,1
5070,gsaq72,litocoen,0.7125,Podcast with CEO of NEXO why Bitcoin is the BEST collateral,1590687374,2,1
5071,gsapgx,Leoza0,0.3182,Can someone tell me why this unknown currencies get a +40% increase in an hour?,1590687306,2,2
5072,gsap83,nikolaiteslovich,0.5563,My Attempt at an Analogy. Feedback would be greatly appreciated.,1590687282,4,1
5074,gsalg8,LiOuyang,0.0,"My students, the return on their investment",1590686947,0,1
5075,gsa4q9,HairBones69,0.0,What's the deal with privacy coins?,1590685475,3,1
5076,gsa454,mirelkobra,0.4019,"ETH Smart Contract Where 100% Of Income Comes To Members In Instant Payouts Earn As Much As $10,000 A Month Starting With As Little As $7 – $40 In Capital",1590685428,0,1
5077,gs9xjc,curiouschipmunk1010,0.0,What is your Bitcoin goal?,1590684857,19,1
5078,gs9tyq,Mgoutsaliouk53,-0.4767,China 51% attack,1590684552,21,1
5079,gs9o6d,1978krcz,0.4588,How Long Can Bitcoin’s Upward Move Continue? (TA - 28th of May),1590684036,0,1
5080,gs8jsz,NovelSuspect,0.6908,"I think I've finally convinced my parents it invest in BTC, but they're still pretty clueless. What's the best (short) video I can send them that sums it all up?",1590680418,13,0
5081,gs8jgh,Blockficustomer,0.0,RICO used in SIM swap crypto judgement,1590680388,4,1
5082,gs89ww,GabeNewell_,0.4019,"""If I had only known about Bitcoin in 2010, I would have definitely invested"".",1590679521,371,4
5083,gs896y,pm_interesting_fact,0.0,What are some of the roadblocks holding back mainstream adoption for cryptocurrency?,1590679453,9,0
5084,gs88ti,GerryTrevor,0.7184,whats the cheapest to buy btc on.. coinmarket cap? cz binance doesnt hav cad,1590679419,10,1
5085,gs85e6,yvngfang,0.0,libertyx account still on hold,1590679105,0,1
5086,gs80yd,Randombirdpoop,0.3612,Global asset traders,1590678701,1,1
5087,gs7xs6,Green_Avocado8,-0.296,How to Bait Apathy....,1590678440,0,1
5088,gs7wh0,ilpirata79,0.0,Account based vs coin based,1590678325,2,1
5090,gs7rhl,tradingnomads,0.4939,Bitcoin Breaks Out. Are we going to try the $10k level again? Enjoy the ride guys.,1590677897,45,3
5092,gs7ozr,SimpleSwapExchange,0.0,Goldman Sachs states that ‘Bitcoin is not a real asset’,1590677654,5,1
5093,gs7mt0,DonnieBrast,0.4754,Reddit tokens are much more popular in the FortNiteBR community than in CryptoCurrency,1590677447,1,1
5095,gs7i65,MotherPop9,0.0,Cardano e Visa,1590676979,0,1
5096,gqp484,trevandezz,0.7096,"Bitcoin halving event July 9 2016 compared to halving event in 2020. It’s doing the exact same thing. The high of $20,000 was reached like 500 days after the halving event in 2016",1590462510,17,1
5097,gqp3yu,TholianWeb20,0.0,It finally happened!,1590462482,1,1
5098,gqp2ut,Seexe,0.4588,Your favorite exchange ?,1590462356,18,1
5099,gqooye,admin_default,0.6597,Helping a friend reopen her business with Bitcoin,1590460751,5,1
5100,gqolum,guy-from-across-pond,0.0,Buying silver uk,1590460395,6,1
5101,gqodoo,MasterOhTheObvious,0.0,Node distro for micro PC?,1590459471,3,1
5103,gqo6vi,LookAtMyWristAbout10,0.4926,"[W] Covert skins, knives, good deals! [H] .0423 BTC = $350",1590458688,0,1
5104,gqo5ny,speakersandwich,0.0,Things move quickly around here,1590458555,7,1
5106,gqnytr,GodGMN,-0.4696,"Why do I want to run a Bitcoin Node? I have a raspberry pi I use for a couple services, can I run a Bitcoin node with them, or does it take over the entire machine for that purpose?",1590457814,10,1
5107,gqnxev,ardentsaviorops,0.0,Unsalted Cenotaph,1590457653,1,1
5109,gqnb7p,curiouschipmunk1010,0.0,"It's not a car, but today I own 1 bitcoin",1590455234,0,1
5110,gqn97x,YourBabyWhale69,0.1695,"The United States has just publicly threatened China with economic sanctions over their Hong Kong national security law. Last year at the height of the US-China trade war (mid-2019) demand for bitcoin was so high in China, that people were willingly paying a $300 premium for it. Here we go again..",1590455020,36,1
5111,gqn83p,vitorvous,0.0772,"This community should be decentralized like Bitcoin, no Dictator Mods.",1590454909,12,1
5112,gqn6kv,YourBabyWhale69,0.1695,The United States has just publicly threatened China with economic sanctions over their Hong Kong national security law. Last year at the height of the US-China trade war (mid-2019) demand for bitcoin was so high in Chinese that people were willingly paying a $300 premium for it. #PlanB #OptOut,1590454755,0,1
5113,gqn6dj,vitorvous,0.4588,"Bitcoin’s Break Below a Key Level has Opened the Gates for a Move to $5,900",1590454732,6,1
5114,gqn3bh,aldenasanti21,0.0,Moremoney,1590454387,0,1
5115,gqn0nc,dan_held,0.1027,US banks can now legally hold 0% of deposits.,1590454102,53,1
5116,gqmsuh,Ramswillwin,0.0,"Not a Lambo, but bought with Bitcoin.",1590453254,7,1
5117,gqmrr5,BitMC,0.8176,Who ready for BTC to moon?,1590453147,3,1
5118,gqmj9x,tinycoin,0.0258,"Its only a matter of time before Bitcoin rises another 10,000% to 100 million dollars and mining farms become the decentralized banks of the future.",1590452245,18,1
5119,gqmiek,trevandezz,0.4767,"Bitcoin Pennant target coincides with previous weekly resistance at $19,379. Black lines are monthly resistance. Cheers bois",1590452152,11,1
5120,gqmh6d,Shenron2020,0.802,The ISSUE with⚡️Lightning is how complicated it is to use 🤦‍♀️ There has to be a better solution on the horizon...,1590452016,5,1
5121,gqmc9l,HarryRobso,0.3612,Aspire to be like this...,1590451508,2,1
5122,gqm4gb,HarryRobso,0.0,This reminds me of something 🤔,1590450758,0,1
5123,gqm47e,redditor157b,0.25,"""Bitcoin is a peer to peer electronic cash system created by Dr. Craig Wright under the pseudonym Satoshi Nakamoto.""",1590450734,4,1
5124,gqm007,BashCo,0.0,"Bitcoin Audible: Chat_39 - Bitcoin Renaissance - with Marty Bent, John Vallis, Alex Gladstein, Elizabeth Prefontaine, &amp; Brady Swenson",1590450294,0,1
5125,gqlzjg,tinycoin,0.743,Why do people treat Bitcoin as digital gold when Satoshi Nakamoto clearly states in his whitepaper Bitcoin is a Peer-to-Peer electronic cash system. Lets get the record straight for once.,1590450246,13,1
5126,gqlyvi,acejosh11,0.0,"Its not a Lambo, but I bought this with bitcoin today at 21!",1590450175,676,1
5127,gqlvni,fitnesssova,0.0,"Raoul Pal Explores $1,000,000 Bitcoin's Price Possibility in this Halving Cycle",1590449842,13,1
5128,gqls12,Darth_Dew,0.0,DCA in? DCA out?,1590449479,3,1
5129,gqlqrt,marvintymo,0.0,If you came across Satoshi Nakomoto's keys would you claim to be the bitcoin creator?,1590449351,13,1
5130,gqlqoj,ONEinsight,0.8885,You all are amazing humans. Together we unite. (Deal on Amazon if you buy 3),1590449341,7,1
5131,gqlqji,btcmiss,0.0,Judge Bloom when Craig Wright walks into court July 6th,1590449325,6,1
5133,gqlea9,edlimsanity,0.3034,[HELP] PrimeXBT trade confusion,1590448022,1,1
5134,gqlaj9,Zaidinator7,0.0,Questions about mining and choosing nonces.,1590447646,8,1
5135,gql8aa,4tysixandtwo,0.0,Any Info On CBTC?,1590447417,0,1
5136,gql1ec,Zaidinator7,0.0,Why can the SHA-256 not be reversed?,1590446698,11,1
5137,gqkx50,Annoumousy86,0.1531,Have we lost hope?,1590446268,8,1
5138,gqksoc,g687,0.0,Are the mt gox addresses kwown?,1590445810,1,1
5139,gqkrzs,crypto_blood,-0.6588,"Robert Kiyosaki Interview About Pension Crisis, Bitcoin to $75k! &amp; New Book w/ Ted Siedle",1590445743,0,1
5140,gqkl7g,videogamingtown,0.0,Email price alerts?,1590445063,5,1
5141,gqkjbk,7289571,0.5319,HELP ID THEFT — PAXFUL,1590444876,5,1
5142,gqkcz3,divertss,0.4019,"To those who support BCH, can you debate this article?",1590444262,5,1
5143,gqk8hn,nohayek,0.0,Account Termination: Got scammed by Bitstamp this week (crosspost from r/Bitstamp),1590443840,10,1
5144,gqk5ly,jenny82ishere,-0.4404,Ultra religious lunatic trying to make tonal number system relevant.,1590443564,1,1
5145,gqjxvs,Mark_JJ,-0.6249,Will You Be Able To Get Cash From Banks In A Crisis? Mike Maloney,1590442812,4,1
5146,gqjwyb,rbird1992,0.0,Gone forever?,1590442718,4,1
5147,gqjqll,tinycoin,0.4019,"Mining farms will become the first decentralized banks by 2022. 10,000% gains in Bitcoin is imminent. Expect Bitcoin to reach 100 million by 2023. Bitcoins will be tokenized on Stellar when a Satoshi reaches $1. Stake Bitcoin on a Ledger Miner X to tokenize every Satoshi for more cents.",1590442105,1,1
5150,gqjfxq,adam3us,0.2311,"thanks to the anonymous early miner, the tulip is down to the chewbacca defense. not long now.",1590441086,28,1
5151,gqjdlh,npryde,0.0,Crypto news/articles aggregator in Telegram,1590440869,3,1
5152,gqj7q2,bitcoinminerEU,0.0,Dephlagy Bitcoin Ai Copy-trading bot May 2020 results,1590440329,0,1
5153,gqj023,BitMC,0.0,Who’s vibe is this?,1590439610,3,1
5155,gqitot,Ception_,0.7184,Were to buy Biitcoin?,1590439036,0,1
5156,gqiqs6,ilpirata79,0.0,Exchanges with Liquid and Lightning,1590438784,31,1
5158,gqinll,lowcapcrypto,0.7906,Best Ever Bitcoin BTC Buying Opportunity Is Coming Up,1590438496,3,1
5161,gqih9p,JacquesM1986,0.0,Heard about the Pi Network?,1590437950,1,1
5162,gqibha,Suszi_landry,0.0,Forex and Bitcoin Trade,1590437439,3,1
5163,gqi4wl,austin_silver,0.6369,"Stop thinking, enough planning ... now make shit happen I can start trading for you, a commission of 20% of the profit is paid -you have 24/7 access to your account from anywhere DM me if interested. . #dream # winning # mexico #califor nia #yatch #luxury # luxurylifestyle # luxuryreale state #lux",1590436870,0,1
5164,gqi325,mnijs,-0.3182,Spot the odd man out,1590436701,7,1
5165,gqhz36,BitMC,0.3612,Who stacks like this?,1590436350,6,1
5167,gqhrs8,benmdi,-0.7003,"👻 The Ghost Of Satoshi — His Dormant Coins Are A Liability For The Network, But Moving Them Would Be A Bigger Mistake",1590435717,2,1
5168,gqh89a,Bronco5858,0.0,Bitcoin ATMs,1590434030,18,1
5169,gqh63x,rnvk,-0.4404,Block Digest #221 - Nothing Is Laser Proof (Except Mirrors),1590433846,0,1
5170,gqh2nm,gdpr_researcher,0.0,GDPR,1590433550,4,1
5171,gqh0mz,Moeezzy1,0.0,Cheap hydroelectric season,1590433387,11,1
5172,gqh047,ubwfibqdinqunuxneihq,-0.2732,What are the risks of having Pantoshis happening? (Newbie question),1590433346,1,1
5173,gqgze0,pheydos,0.0,BTC for FIAT,1590433288,14,1
5174,gqgyp5,Henryjacks,0.0,Bitcoin earning,1590433234,0,1
5175,gqgs6q,oomem,0.3182,Why don't outputs per transaction increase since 2016 with batching supposedly used more and more?,1590432700,2,1
5176,gqgq1s,oomem,-0.1685,Why the number of outputs per transaction doe not seem to increase since 2016 with batching supposedly used more and more?,1590432520,0,1
5177,gqgkkk,goodtimetrading,0.0,BITCOIN HASH RIBBONS CAPITULATING!!,1590432045,0,1
5179,gqgjtw,vitorvous,-0.3182,MANY LOST COINS,1590431984,5,1
5180,gqghgj,costolleumus,0.0,"Sell, Buy and Earn bitcoins",1590431781,1,1
5181,gqggy1,HarryRobso,0.0,A Beginners Guide To Setting Up A Full Node On Your PC,1590431741,2,1
5182,gqggsd,Bad-Boy-Bubby,0.3182,9000 Please can the next time we cross it be the last.,1590431727,3,1
5183,gqgfba,BitMC,0.0,BTC be wild,1590431600,4,1
5184,gqg4w3,appplejack007,0.2263,Just read this post by Canada Revnue Agency. Ridiculous. How can people get around paying taxes on bitcoin capital gain in Canada?,1590430714,22,1
5185,gqfv5c,ringbingping,0.0,"I think, all the people HODLing BTC/BCH/BSV must read this post by Cobra",1590429886,5,1
5186,gqfgno,ondertoon,0.0772,Real World Ask. I want to receive payments with Bitcoin in my coffe-bar in Italy.,1590428563,57,1
5187,gqfgmx,Ae39533n,0.0,Cryptocurrency trading,1590428561,6,1
5188,gqfgd5,liquidexplodingdinos,0.0,"Can someone ELI5 this article: Think There Is Only 21M Bitcoin? Think Again, Says Weiss Ratings.",1590428542,10,1
5189,gqfe0o,BitcoinFan7,0.6478,Bitcoin as the hardest money is the most powerful tool in your arsenal.,1590428321,6,1
5190,gqfdza,djmedakev,0.4404,Easy way to accumulate...,1590428318,4,1
5191,gqf9au,daigunn,0.2244,"Help , sent with low fee!",1590427900,9,1
5192,gqf1y7,BitcoinCanSaveUsAll,0.0,Bitcoin Node PSA,1590427242,3,1
5193,gqexzw,botolo,0.7184,Where do you buy your BTC from?,1590426892,16,1
5194,gqesyr,redditvillageidiot,0.0,BTC transfer from Electrum to Ledger Nano S,1590426451,11,1
5195,gqepq9,alexshorty2,0.0,New Generation Coin with almost 0 effort,1590426164,0,1
5197,gt5oz4,O10infinity,0.0,Effects of Mark Zuckerberg being Satoshi Nakamoto,1590802741,8,1
5198,gt5f2k,itnvrr,-0.3182,REKT : Lost 9 BTC(AMA),1590801622,0,1
5199,gt59rr,latif244,-0.296,Bitcoin Mining Pool: No Mining Fees and Get Daily Payouts,1590801014,0,1
5200,gt54a4,Bila_l_,0.0,Coinbase Pro,1590800406,12,1
5201,gt4rom,GrilledCheezzy,0.0,"In podunk South Carolina, USA. First time seeing one in my area.",1590799017,22,1
5203,gt4jtr,sparqco,0.2263,"""gOt My kEyS gOt My CoInS"" ;)",1590798163,0,1
5204,gt4h0t,chaintribe,0.0,SATOSHI IN HIS TOWER (animated artwork),1590797857,0,1
5205,gt4emb,EarlyEstablishment4,0.0,300% for 24h,1590797585,0,1
5206,gt4cbr,Pantamis,0.4404,Is Loop In a good tool for Bitcoin fungibility ?,1590797348,3,1
5207,gt45rg,inhodel,-0.25,Anxious to see what my son will say to me.,1590796644,294,1
5208,gt41x6,yokak60758,-0.5423,Bitcoin Rally Falters as Stocks Drop Ahead of Trump’s China Speech today,1590796224,1,1
5209,gt3n25,Cyber_TronTM,0.4404,How do I make profit ?,1590794663,0,1
5210,gt3i3a,0rbytal,0.296,Can I run a miner just to save on transaction fees?,1590794128,27,1
5211,gt3216,vigilante_stark,-0.3818,Bitfinex problem - Why are my withdrawal options greyed out?,1590792453,1,1
5212,gt303k,maryswolfthallk,0.0,Agen Judi Bola Nova88 Terpercaya - Userbola,1590792244,0,1
5213,gt2vzt,watoshinakaboto,0.0772,I want bitcoin for my gold,1590791827,1,1
5214,gt2s2h,iCaptainGeorge,0.0,Crypto trading,1590791431,0,1
5215,gt2n2o,IsaN-BitcoinTax,0.0,Traditional Investment Banks and Crypto,1590790932,0,1
5216,gt2jqd,ntkweinor,0.0,New Peer to Peer Exchange Provides Africans with an Alternative to Paxful,1590790609,0,1
5217,gt2ez7,lucidfutures,-0.25,Protest At The Federal Reserve,1590790154,3,1
5219,gt1vli,RealPodda,0.4404,Is options trading on Binance safe?,1590788321,7,2
5220,gt1o9c,dontgiveintoawe,0.3612,😅,1590787593,10,2
5221,gt1nj8,YourBabyWhale69,0.0258,The United States Just Released A White Paper for the US Digital Dollar..*gulp*,1590787521,29,2
5222,gt1mzu,Kurtilas,0.8172,"If BTC today have a good value, partly thanks to ross!!Sign the Petition",1590787470,0,1
