,id,author,vader,title,created_utc,num_comments,score
0,gcu7cm,BROKERWALLST,0.9826,"Just a Tip a Real Hot Tip About 😉 Dogecoin, Its under a penny now and its being Sold on mostly all Platforms, Its going to Hit an All time High of $1.00 Buy Buy Buy and Hold Dogecoins you will be Rich &amp; thank Me !!! DOGECOIN =$$$$",1588525960,0,1
1,gcu79c,throwawayidc69,0.4019,Help buying bitcoin in New York?,1588525952,14,1
2,gcu5wy,the420chronicler,0.0,The Halving and the Self-Fulfilling Prophesy of Bitcoin,1588525823,21,1
3,gcu4kd,DecryptMedia,-0.296,"Gold shortage proves Bitcoin’s superiority, argues Coinbase",1588525694,12,1
5,gcu1oh,whatsthedealone,0.7351,How long can USD safely stay on an exchange after a trade?,1588525416,12,1
6,gcu0kz,genocidechimp,0.0,When to invest in Bitcoin Halving correctly?,1588525305,14,1
7,gctyoy,Haxedus,-0.3818,The Epic Bitcoin Dump of 2020,1588525128,441,1
8,gctxpa,CryptoTab-Browser,0.8304,"This year we will hand out more than $ 7,000 to those who are most active inviting new users.",1588525028,0,1
9,gctwx0,brute299,-0.3612,Chase Bank is being difficult when buying BtC,1588524949,18,1
10,gctwnf,eenimeeniminymo,0.0,Extended Public Keys...,1588524923,7,1
11,gcttmf,awesomeprimitive,0.7346,Building The Most Beautiful Mud Boutiques Hotel For Rescue Abandons Cats,1588524622,0,1
13,gctooz,RecentDrop9,0.0,Advice on wallets,1588524136,7,1
14,gctleo,magic889,-0.3182,Bitcoin May be Topping Out After Buyers Lost a Key Level,1588523814,1,1
15,gctjha,brenniecooki,0.4588,Claim Up too $200 per hour :),1588523622,0,1
16,gctf1n,samcornwell,-0.4404,"66,666,666,666,666,666 hashes per block right now, thought you should know.",1588523188,6,1
17,gctd73,asso,0.0,"Despite the Halving, Is Tether the Real Reason Pushing Bitcoin Price to $10.000?",1588523002,3,1
18,gctb9w,ncoelho,0.0,Sent Bitcoin per country (visualization),1588522823,0,1
20,gct63z,GBC__,0.0,Paxful Trade Teacher,1588522305,3,1
21,gct5cz,DeKinney,-0.6597,"I lost 10,000$ off of a fake crypto exchange",1588522233,13,1
22,gct4qw,FLNI,-0.128,"Proof-of-work in colonial Maryland: Burning tobacco for paper money, burning electricity for $BTC",1588522175,0,1
23,gct01u,David_bc777,0.296,Earn money with the new cryptocurrency during Quarantine,1588521714,0,1
24,gcsz94,crypto_bot,0.0,"Bitcoin Network Status Update Sunday, May 03, 2020",1588521645,0,1
25,gcsyq6,DeKinney,0.5267,"Me and my friends were scammed over 10,000$ and want to get this website REMOVED and it's hosts found.",1588521604,12,1
26,gcsyel,stvmcg,0.2023,Top resources for learning about Bitcoin in 2020 (beginners),1588521572,0,1
27,gcsvh6,sylsau,0.0,It is there that the Bitcoin Halving really occurs,1588521271,3,1
28,gcsr17,spookiestevie,0.0,RIGHT NOW!,1588520811,3,1
31,gcs9av,Alina6991,0.0,Poolin pool told which bitcoin miners will become unprofitable after halving,1588518977,0,1
32,gcs450,DarkCrypto118,0.6486,Wanna talk about money...life change and make friends then join my server,1588518423,0,1
33,gcrs7y,Czfacts,0.3182,"Pierre Rochard, Prominent Bitcoin Advocate Believes Bitcoin Is More Liquid Than Gold",1588517203,0,1
34,gcrix5,Miladran,0.4588,Bitcoin hash rate hit a new all-time high,1588516216,8,1
35,gcrgz0,Xenon8791,0.0,JUST SIGN UP AND START EARNING TODAY,1588516003,0,1
36,gcrdbb,fakethefake,0.0,Stellar lumens,1588515609,1,1
37,gcr9pj,revikat,0.0,Get $100 Playstation Voucher Now!,1588515197,0,1
38,gcr5rc,yaztal,0.5423,Bitcoin Superior to Gold amid Coronavirus Pandemic – Report,1588514768,3,1
39,gcqwi1,itsLewiis,-0.5106,How dangerous is it to leave your coins on an exchange?,1588513891,30,1
41,gcqf57,Zemunsta,0.0,The case for Bitcoin being a collectable,1588511794,7,1
42,gcqd55,spookiestevie,0.0,How do you choose to store your human time?,1588511556,26,1
43,gcq8hu,anmolgaur45,0.0,Where are we with bitcoin?,1588510979,52,1
44,gcq8gm,Scratchasaurus,0.0,The Annals of Bitcoin Twitter - Major points in Bitcoin history as told by tweets,1588510975,0,1
45,gcq8at,AlotBetta,0.7184,How to buy Bitcoin with your PayPal Account (No Fee Tutorial),1588510957,4,1
46,gcq38l,spookiestevie,0.7906,"Your money is under siege, you should probably buy some defences...",1588510340,2,1
47,gcpzdc,spookiestevie,-0.7003,"Warren Buffet's Berkshire Hathaway loses $50B during coronavirus pandemic. Bitcoin +25% in 2020 Which is the ""rat poison squared""?",1588509820,1,1
49,gcpsly,RickSanchez-E6Y72,-0.7012,Why doesn't the most powerful miner always get the valid block first? Is there some kind of random selection?,1588508951,17,1
50,gcpq58,Stevie_wonders88,0.0,Bitcoin 'experts' in a nutshell,1588508621,9,1
51,gcpq4w,spookiestevie,0.9501,"I am pretty bullish, are you pretty bullish?",1588508620,62,1
52,gcppg6,TianyuGao,0.0,Does anyone know this guy in real life?,1588508537,0,1
53,gcpkyg,Alina6991,0.7184,Justin Sun suggests buying Ilona Macka to buy BTC,1588507917,0,1
55,gcpfvg,ViN09,0.0,Levels of control: crypto VS traditional electronic payment,1588507227,3,1
56,gcp9w9,magnusvollen,0.0,🚨Time For Plan B,1588506398,5,1
57,gcp0cv,manfromnantucket1984,0.7901,"Back the f**k up! Christian Decker aka Dr. Bitcoin will be talking about how to properly secure your Lightning Network node, what the trade-offs are and what improvements the next 18 months will bring. ⚡ Tonight, 8 pm GMT+2 live on the interwebz.",1588505062,13,1
58,gcoz98,jakkkmotivator,0.0,Social Distancing Guidelines,1588504918,1,1
59,gcoxgz,gatmac5,-0.6486,You’re Worried About the Wrong Markets,1588504660,3,1
60,gcoqii,SirCatuds,0.8588,"I'm new here, please support me. It'll help me in my life. Thank you so much!",1588503653,0,1
61,gcontg,the420chronicler,0.4515,Will the Bitcoin ATM industry merge with the arcade gaming industry? Will we see a proliferation of arcade games that only accept Bitcoin in order to operate?,1588503233,11,1
62,gcok3l,MikeSantos_Bjj,0.0,Halving in 8 days. Go for it!!!,1588502692,5,1
64,gco9v6,sylsau,-0.6249,This Economic Crisis Shows Why Bitcoin Is Essential for the Future,1588501106,2,1
66,gco7zg,1978krcz,0.0,Weekly Crypto News Roundup - 27th of April - 2nd of May,1588500811,0,1
68,gco0n1,CryptoHodler888,-0.7269,Twitter's Jack Dorsey Is Dangerously Wrong About Bitcoin’s Role as World Currency,1588499701,4,1
69,gcnzak,Pet-esh,0.7184,Bit Coin Vs VPN - Leading Allows to Buy Vpn Services Through Bit Coins,1588499487,0,1
70,gcntsg,yaztal,0.0,Community Reacts to Elon Musk’s Jaw-Dropping Tweet about Bitcoin,1588498588,1,1
71,gcnnmt,infinitysatoshi,0.0,seeker(buscador que mina bitcoins automatico),1588497574,0,1
72,gcnn74,Rattlesnake_Mullet,0.0,Where the halving will happen in the Bitcoin code (technical),1588497495,15,1
73,gcn8p7,Btcyoda,0.5207,"BITCOIN, Probably the only thing left that doesn't socialize loses and privatizes gains.",1588495065,44,1
74,gcn88d,heronharry1,-0.7964,"Is there such thing as a ""Recovery Agent""? Sounds suspicious as hell to me",1588494984,16,1
75,gcn5u3,Lemardt,0.0,The WEF just dropped a blockchain deployment kit... mass adoption pending,1588494574,2,1
77,gcmxdq,Nate_2key,0.8316,"Because the family is growing, we have to reassure our newcomers. Welcome in the new world guys 🎉",1588493157,1,1
78,gcmx7j,TheCCForums,0.7184,Buy bitcoin without fees,1588493127,0,1
79,gcmws5,Rattlesnake_Mullet,0.0,Technical question about Bitcoin code regarding fixed supply of 21 million,1588493062,15,1
80,gcmuxm,0xtail1,-0.5423,You thought the fed was bad? Wait until you hear about the cows...,1588492753,1,1
81,gcmu7e,phx_67,-0.5574,What Can Governments Actually Do To Ban Bitcoin and Other Cryptocurrencies?,1588492626,47,1
82,gcmskc,DarkEvil007,0.0,BITCOIN SIP @Bitdroplet,1588492351,3,1
83,gcmrvt,dirtywhitemagic,0.0,Philippines (Cebu) OTC Cash-in,1588492227,1,1
84,gcmrn8,fiddleitout,0.0,"Bitcoin got mentioned several times in this movie. And compared to Gold, S&amp;P500 and others from the early days.",1588492190,1,1
85,gcmqct,TerribleAnimator3,0.0,"How to get Bitcoin, wait for it",1588491972,0,1
86,gcmgni,thegrassisntgrenner,0.0,Trading Question.,1588490328,2,1
87,gcmfyw,Dcryptonews,0.0,Bitcoin Is Already $9000. What's Coming Next $ 9500? $11500?,1588490215,12,1
88,gcmb2o,Dcryptonews,-0.5423,"Bitcoin Is $9000, Whats Comming Up $9500 ... $ 11500? Drop Your Predictions.",1588489420,2,1
89,gcma1g,rBitcoinMod,0.0,"Daily Discussion, May 03, 2020",1588489261,178,1
91,gcm27k,P00PY_Butt,0.0,Question on Africa and Bitcoin,1588488051,10,1
92,gcm0a5,CallmeSteven1,0.0,Bitcoin is hoarding mainstream media attention,1588487744,0,1
93,gclzrd,sporadicjesus,0.4404,Is it better to invest in btc instead of bch?,1588487660,20,1
95,gclxff,reyvillegas1,0.0,La quema de bancos en el Líbano dará pie a la caída del dinero fiat y su reemplazo por el Bitcoin?...,1588487288,5,1
97,gclt5x,DontBeAFlatlinerMan,0.0,What are some good real time block visualizers?,1588486617,4,1
98,gclrti,cmcgrath572,0.0,Where should I keep my Bitcoin?,1588486408,12,1
99,geqv9l,hungrywon,0.0,Selling,1588793826,4,1
100,geqts0,SrFrapo,0.3353,"Ted talk about teaching monkeys finance &amp; studying them. Found negative interest made them spend more. Shortly after, banks around the world started introducing negative interest in their systems. Encouraging a generation to spend more &amp; save less, leading to a generation of controllabl poor people",1588793693,10,1
101,geqq7w,stimorol12,0.0,I won’t say you should buy or sell. Just check the image and figure it out yourself. #btc,1588793386,11,1
102,geqq09,catchyalater00,-0.1695,"Came across this today near my tiny little town. They weren't joking, it really is a revolution. Let's do this 💪",1588793364,0,1
103,geqpty,charlesrobinso,0.0,2020 1oz Gold Britannia (Oriental Border) Coin,1588793351,3,1
104,geqoue,Sal-BitcoinTax,0.0,A Deep Dive Into IRS Crypto Tax Audits (Podcast and Highlights),1588793262,5,1
105,geqncs,pocketleg,-0.4869,Bitcoin Fund Manager scams another. He must be stopped. I dont know where else to post this. Help!!,1588793135,2,1
106,geqkdm,SAT0SHI_NAKAM0T0,-0.2732,Bitcoin Node Count falls to 3 year low,1588792880,10,1
107,geqeto,DapperW,0.0,Quick! Should I invest after the halving?,1588792400,26,1
109,geq77g,mrtn-92,0.0,The word is spreading,1588791747,6,1
110,geq6sf,andyjr86,0.0,Bitcoin Halving 2020 Analysis BTC $BTC,1588791708,0,1
111,geq4oc,mostafa-khaled,0.0,Could Bitcoin Really be Heading to $288K? | Podcast Notes from Plan₿ on The What Bitcoin Did Podcast,1588791527,6,1
112,gepxsn,Justingamingdude,0.0,Bitcoin,1588790942,6,1
113,gepv7u,abdullahmnsr2,0.533,What is Bitcoin halving? Why is it a good thing? What happens to the price after the halving?,1588790708,8,1
114,gepu4c,babyass,0.4404,A practical proposition to naturally make bitcoin better.,1588790609,9,1
115,gepku9,eida2023,-0.1779,"Bitcoin S2FX Creator Will Go Dark if His Model Succeeds, Says Six-Figure Bitcoin Could Lead to War",1588789800,0,1
116,gepgdc,PaulyPickles,0.4767,Wasn’t able to cross post this but I figured this would be appreciated. Michigan protests...,1588789397,342,1
117,gepaik,nottnic,-0.7964,"Fucked up trying to short at 7,500 and I want back in for halving. Thoughts?",1588788879,5,1
118,gep4tx,watching_machine,-0.5096,Doesn't feel great,1588788387,7,1
119,geolth,192838475647382910,0.7184,Buy it. Hold it.,1588786736,58,1
120,geolfm,shiznt,0.0,"Art for Bitcoin, but is Bitcoin for Art?",1588786701,0,1
122,geo02b,cesarvspr,0.0,Why don't we have stocks exchanges with bitcoin as currency yet?,1588784851,24,1
123,genpvt,DetectorReddit,-0.644,"Can anyone explain Stock-to-Flow? Why does this dude think if BTC hits $288,000 there will be a war?",1588783972,3,1
124,genehz,Sirbinkai,0.0,"Will the cost of producing Bitcoin go up, not change, or go down after halvening?",1588782974,25,1
125,genb7f,BitcoinMorpheus,0.0,How does it make you feel to know that Coinbase has 5% of extant Bitcoin under custody?,1588782695,12,2
126,genah5,manosmeze,0.0,Are we seeing a possible head and shoulders or I am trippin ??,1588782630,9,1
127,gen9ef,murat_selim,0.0,Binance,1588782534,0,1
128,gen97l,Bitcoin_to_da_Moon,0.0,Ukraine considers using nuclear plants for Cryptocurrency mining,1588782516,7,0
129,gen94z,AliantPayments,0.0,The next Bitcoin halving is this month- here's exactly what that means.,1588782511,2,1
130,gen0hm,totallymanlytears,-0.5423,Dumb question from a noob,1588781728,24,1
131,gemjj7,spookiestevie,-0.2023,"Broken incentives, Bitcoin fixes this.",1588780218,2,1
132,gemdsg,majortunnur,0.0,Emerging Business Industries (2020) by an affiliate marketer for TradeOptionGains,1588779683,2,1
133,gem7nn,tojukaka,-0.0772,Everything popular is wrong. Does this include Bitcoin?,1588779119,7,0
134,gem5ng,Sandboxeaa,0.7184,Epic Tweet 🌛,1588778926,19,5
135,gem33t,MammothTrash,0.0,$100k to $1 million || Episode 3,1588778695,1,1
136,gelzsg,CryptigoVespucci,-0.5994,Anyone remember the Bitstamp Bear Whale?,1588778415,4,0
137,gelvit,rnvk,0.0,"Announcing BLOCKCLOCKmini, uses 7 Eink digits and now affordable!",1588778030,1,2
138,gelrtm,InMyDayTVwasBooks,0.4215,Nice.,1588777711,296,4
139,gelnw3,undergroundking417,0.0,Bitcoin address verifying sites,1588777370,6,1
140,gelm7c,SaneFive,0.0,"Bitcoin outperformed Google, Facebook and Apple in Q1 this year",1588777234,3,1
141,gellj7,dan_held,0.0,Tick tock,1588777181,1,1
142,geleyw,Kickboks,0.3612,You guys can thank me later,1588776594,10,1
143,geldb8,olesbullet,-0.3612,"Criptoretro on Instagram: “💥Las mejores noticias y análisis técnico de Bitcoin,Ethereum y Blockchain.💥 Síguenos en Twitter estamos cómo: @CRIPTORETRO4 #bitcoin…”",1588776441,1,1
144,gelcmw,imjustguessingright,-0.195,"Bitcoin is like Batman, Because without the joker its worthless.",1588776378,6,0
145,gel8a3,luxxx75,0.0,Yesterday was a record volume of Bitcoin options trading at LME!,1588775992,5,0
146,gel4ve,kornpow,0.0,Keep old iPhone for multi-sig,1588775672,10,0
147,gel3jn,OKEx-official,0.6486,"Hot TV show Billions kicked off its new season with Bitcoin, lol",1588775550,1,3
149,gekyzb,Nate_2key,0.0,Because we know it's more complicated...,1588775128,3,0
150,gekxza,hungchang,0.3182,Pick your own adventure,1588775036,11,2
151,gekxpu,ReviewMePls,0.0,"You can get ""A brief introduction to Bitcoin"" by paying with Bitcoin on Purse",1588775008,4,1
152,gekv40,BobLeeSwagguh,0.4588,Is generating interest on Bitcoin viable?,1588774752,5,1
154,geknmq,zzanzare,-0.1759,Adoption! Pine64 is asking who wants to pay with Bitcoin for their open-source&amp;open-hw phone,1588774035,1,1
155,gekm5w,Fiach_Dubh,-0.3182,₿loomberg: Bitcoin Is Staging a Comeback Reminiscent of 2017 Bubble Frenzy,1588773895,31,2
156,gek676,jdmaring,0.0,Transfer from Coinbase to DropBit Confirmed 117 times but balance shows $0,1588772319,16,1
157,gek4qr,doucheflute93,0.0,Where do you guys see bitcoin going?,1588772173,17,1
158,gek4d5,SmokeyMcPotUK,0.0,"WTB Bitcoin for Cash £1500+ (Hounslow,West London)",1588772133,1,1
159,gek0vc,localname1,-0.3182,Bloomberg | Bitcoin Is Staging a Comeback Reminiscent of 2017 Bubble Frenzy,1588771781,2,1
160,gejzph,bollyget,-0.1027,Earn Bitcoin Daily $100 With Guarantee Without Investment (Private Ebook Leak) | 5 May 2020,1588771652,0,1
161,gejx97,Lumin8_Crypto,0.0,Bitcoin News Today 2020: Will 3 Billion People In India And China Drive Bitcoin and Crypto Mass Adoption?,1588771396,0,1
162,gejx4l,cocoguillen89,0.0,New folder 📂 € = 0,1588771382,5,1
163,gejuiz,skynetwardog,0.0,ZERO!!!!,1588771112,2,1
164,gejr15,Novacdino,0.0,I have a new religion starting today,1588770743,14,1
165,gejowb,SumaZero,0.0,El precio del Bitcoin insiste en Alcista - CRIPTO TENDENCIA,1588770526,0,1
166,gejl49,nikola28,0.0,Blockchain in Healthcare: the Advancing Essentials,1588770147,3,1
168,gej832,balamshir,-0.5574,Bought bitcoin at 11k (AUD) and at 13.9k (AUD) and now its at 14.5k and I still lost money. What the fuck is going on?,1588768748,20,1
169,gej25q,makkerfelix,0.4939,hey guys its going up pretty fast innit,1588768054,4,1
170,geivq1,MrFoxy97,-0.0516,Noob question,1588767303,19,1
171,geitjd,ghoubrir,0.4588,Buy now or wait for the dip?,1588767052,33,1
172,geiql7,spookiestevie,0.6912,"Bitcoin is mooning, it just hasn't reached your country yet.",1588766718,62,1
173,geiqe3,btcmiss,0.0,4 Reasons for an (almost) immediate Bitcoin price surge after the halving,1588766694,17,1
174,geioks,ripplesuckz,-0.0258,Increased Adoption Will Decrease Bitcoin Price Manipulation By Whales,1588766488,2,1
175,geio7s,ByteBulls,0.4767,Can bitcoin halving make cryptocurrencies reach all-time high again?,1588766450,2,1
176,geig80,chiefy81,0.0,Bitcoin Optech Newsletter #96,1588765441,4,1
177,gei53z,arminham1967,0.4588,"PR: Bityard Launches YouTube Recruitment Competition with over 38,000 XRP in Prizes",1588764029,0,1
178,gei4ow,west38wa,0.0,"Bitcoin to Peak at $115,000 by August Next Year, Says Pantera Capital CEO -",1588763979,1,1
179,gei0iy,magiczeroes,0.0,This is the big one,1588763414,7,1
180,gehsl9,iphar,0.2263,1BTC is worth 1BTC,1588762355,1,1
182,gehqsq,bitnewsbot,0.0,How Bitcoin Halving Will Affect Traders,1588762105,0,1
183,geho57,RomanEmpire75,0.1779,The path to escape..,1588761757,1,1
184,gehmyi,luxxx75,0.0,Bittrex Global will release its own exchange token,1588761611,1,1
185,gehlie,Denver-Ski,0.1779,$9k holding and growing - Peter Schaffer’s will eat his words,1588761426,0,1
186,gehj8s,ripplesuckz,0.6808,Will Bitcoin’s Velocity Help It Perform Better in May Than in April?,1588761152,1,1
187,gehh57,Eric_Davis_44,0.0,Tool to see specific price at any date / time stamp ?,1588760880,3,1
188,gehgo8,nopara73,0.0,Few Words on Decentralization and Anonymous Payments,1588760811,3,1
189,gehg6y,BeastNoah,0.555,Earn money while surfing the web! | Passive Income!,1588760750,0,1
190,gehfkd,plain_dust,0.0,You Knew it was coming!,1588760661,1,1
191,gehfhz,heyprotraveler,-0.7351,9200 there it is🔥🔥🔥,1588760653,0,1
192,geheve,heyprotraveler,0.0,9100!!!!!!!!,1588760572,0,1
193,gehetd,OppositeMidnight,0.0,"First Ever Global Distribution of Bitcoin Mining, This Cambridge Researcher Used 30% of the World's Total Hashrate.",1588760563,4,1
194,geh7x8,trilli0nn,0.3612,rBitcoin be like...,1588759660,40,1
195,geh6zr,kimberly0688,0.4404,Hi guys am buying and selling Bitcoin. With good rates. Chat me up,1588759538,1,1
196,geh1bu,NZSGFTW,0.1245,"A few weeks ago I made a post about bitcoin halving search rate being triple what it was the last halving and it had incomplete results as April had not yet ended. Well, April has ended and the results are in. We're looking at a 3.33x increase in search rate.",1588758779,26,1
198,gegwu3,Xu_jing,0.0,Hello,1588758130,1,1
199,gkn6ui,Yustope,0.0,"LibertyX transaction hasn’t confirmed, it’s been days",1589597389,3,1
200,gkn6d6,SteveR1982,-0.4019,The Having Problem,1589597334,45,1
201,gkn1t7,dailyblockchain_news,-0.2732,Coinbase Moves to Cut Blockchain Load With Bitcoin Batching,1589596789,0,1
202,gkn14m,alexionut6,0.0,Did anybody debunked this guy? He's doing a livestream right now,1589596705,10,1
204,gkn016,jamieurie,-0.1027,"""It Sounds Blah"": J. K. Rowling Drunkenly Tweets About Bitcoin",1589596567,1,1
205,gkmyyt,letsgetbit,0.4767,"Somethings off about this group when they were young. Oh well, they created the road for Satoshi.",1589596440,4,1
206,gkml9l,lastmjs,0.0,BTC on Ethereum dashboard,1589594902,3,1
207,gkmjmc,Stonekrypt,0.296,Bitcoin meetup in VRchat starts at 8:30 PM pst tonight. Join with VR or PC.,1589594717,1,1
208,gkma4w,HeavyBackground2,-0.3182,Lost guy,1589593702,1,1
210,gkm2c9,SpockSays,0.4588,"Favorite scene from ""Charlie and the Satoshi Citadel"".",1589592859,0,1
211,gklwak,TREER123,0.0,If I owe $100,1589592216,13,1
212,gkllob,dailyblockchain_news,0.3612,Bitcoin (BTC) is Possibly the Scarcest Asset Known to Humanity – Weiss,1589591119,0,1
213,gklifl,Bitcoin1776,0.5719,"Pretty much, although massive currency issuance by govt central banks is making Bitcoin Internet 👻 money look solid by comparison",1589590795,2,1
214,gklej6,Michael12390,0.3612,Do any of you guys own commodities like gold and silver along with your Bitcoin?,1589590379,9,1
215,gklbz2,[deleted],0.0,Coinbase!,1589590115,0,1
217,gkl8hl,jaeenc,0.2732,Seems like a huge scam please explain,1589589751,18,1
218,gkl18w,smedia48,0.2263,Visa Patent Filing Would Allow Central Banks to Mint Digital Fiat Currencies Using Blockchain - CoinDesk,1589589033,3,1
219,gkl0kd,ponchovilla71,0.0,Feds when they went BRRRR (Actual before and after photos),1589588962,0,1
221,gkkwcq,Alexandru1233563,0.0,What price do you think btc will hit this year,1589588540,4,0
222,gkkr06,[deleted],-0.1027,He challenged you to donate to me.,1589587978,6,0
224,gkkfl2,infinite_dendrite,0.3612,"Drew this, thought you might like it",1589586811,8,3
225,gkke1a,tradertrader350,0.0,Uh oh rocky road ahead for BTC?,1589586660,4,1
226,gkk5oz,TheCryptomath,0.0,Infographics of the main consensus forks of Bitcoin by u/lugaxker,1589585821,8,4
227,gkk2yk,dailyblockchain_news,0.6408,Dear JK Rowling: Bitcoin is Magic,1589585555,0,1
228,gkjjyc,asgardian_superman,0.0,So... That happened.,1589583755,18,8
229,gkjjja,TheHammerJ,0.0,"Despite all the Brrrrr, USD is currently undergoing deflation",1589583715,52,3
230,gkjjbs,CheapJicama,0.0,Full node wallets?,1589583696,19,1
231,gkjec8,NZSGFTW,0.0,It's just not gonna happen!,1589583208,32,4
233,gkjci5,flappyhok69420,0.0,A little kid asked his father for bitcoin as a birthday present,1589583029,25,5
234,gkj9ve,HarutoSakura,-0.2263,Bitcoin Might Benefit From A US-China Cold War,1589582756,0,1
235,gkj6nv,imjustguessingright,0.5994,"""I dont know where the money went?"" meme help",1589582450,0,2
236,gkj63f,Audi-R8-200PK,0.0,BTC or BCH,1589582401,10,0
237,gkj5f9,skraginator,0.0,"If this isn't a real thing yet, it is now!",1589582335,6,1
238,gkj0kp,infinite_dendrite,0.0,'Cosmic Bitcoin',1589581850,0,1
239,gkivxu,IamChrisGaming,0.0,Bitcoin transaction 0/3 confirmations in 12 hours...,1589581403,13,1
240,gkivgx,ff20001000,0.7184,Where do you guys buy your bitcoin?,1589581359,22,1
241,gkirlb,spookiestevie,0.0,👀,1589580979,327,10
242,gkipnq,vectorvoid,0.0,If bitcoin was an animal what would it be?,1589580796,22,1
243,gkimmk,eragmus,0.128,"Elon Musk replies to J.K. Rowling: “Pretty much, although massive currency issuance by govt central banks is making Bitcoin Internet 👻 money look solid by comparison”",1589580508,51,6
244,gkim84,iamaneditor,0.3885,Elon replies to JK Rowling,1589580468,9,5
245,gki8xb,endless,0.3612,could something like liquidapps scale bitcoin?,1589579217,7,1
246,gki5d0,DoobieMcBeast,0.0,Bitstamp removed my account and took out a large fee,1589578881,15,1
249,gkhkjn,alkimiadev,-0.25,CPFP with larger fee still stuck,1589576922,2,1
250,gkhiof,dailyblockchain_news,0.0,Some US Citizens Look to Be Splashing Their Stimulus Cash on Cryptocurrency! We will! Will you?,1589576746,0,1
251,gkhfuf,ChinnyBeneath,0.3818,Harry Potter Author J.K. Rowling Wants To Learn About Bitcoin; Crypto Twitter Helps Out,1589576487,1,2
253,gkhavg,artlover3,0.0,"Has anyone used Changelly, is it legit?",1589576030,7,1
254,gkh8ry,Michael12390,0.3612,Thought you guys would like this,1589575827,125,12
256,gkh6fa,ShotBot,-0.4019,700 dollar slow crash of the course of a day,1589575605,12,0
258,gkgymw,monethical,-0.3818,"Weekly Market Report, BTC recovers after pre-halving dump",1589574876,1,1
259,gkgmfm,rivoke,-0.0772,"J.K. Rowling, Author Of Harry Potter Is Interested in Bitcoin, Time To Short?",1589573739,0,1
260,gkggxn,192838475647382910,0.4404,I hope everyone knows this...,1589573229,15,4
261,gkggsd,john_carver_2020,0.7845,"If you're a US citizen, the long-term capital gains tax you pay on Bitcoin is equivalent to a property sale (up to 15% depending on income). The long-term capital gains tax on Gold? 28%. Seems like another advantage to BTC over Gold.",1589573214,58,6
262,gkgfnf,3eph1r0th,-0.25,Run your Bitcoin Full Node in a few clicks on Allnodes,1589573111,12,1
263,gkgdgp,xangelhui,0.0,Bitcoin on decline but for how much longer?,1589572919,16,0
264,gkgb3m,nateless,-0.7096,The most recent attempt to launder stolen UPbit hacked funds involves an array of well-known exchanges,1589572710,1,0
265,gkg994,spookiestevie,0.0,To my American homies: Bitcoin isn't a stock.,1589572532,25,4
266,gkg83l,TheCryptomath,0.3612,Is this what mainstream adoption of Bitcoin looks like?,1589572431,2,2
267,gkg5iy,GGG720,0.0,Beginning Investor,1589572211,14,6
268,gkg4m4,dailyblockchain_news,-0.5707,Hate our posts? Read what you want to on our most recent section!,1589572127,0,1
270,gkfycc,BassieWouters,0.0,Bitcoin Explained: A Guide To Understanding Bitcoin,1589571563,0,2
271,gkfvaw,1idle,0.0,The what?!,1589571294,2,2
272,gkfsxh,tob23ler,0.0,Question about potential hyperinflation of USD in relation to BTC,1589571088,15,4
273,gkfqen,sputn1ck,0.0,Bitcoin Memes made it to our video game,1589570857,11,4
274,gkfqak,euphemized,0.0,"J.K. Rowling doesn’t understand Bitcoin, Twitter tries to explain - Decrypt",1589570846,3,6
275,gkfp10,Godex_io,0.7184,What would you choose to buy?,1589570732,11,1
276,gkfnyh,dailyblockchain_news,0.0,"Pantera Capital’s Bitcoin Fund is Up 10,000% to Date While its Altcoin Funds Flounder",1589570637,0,1
277,gkfmy7,dan_held,0.0,Bitcoin is in the eye of the be(HODLer),1589570550,0,2
278,gkfiwc,TheCryptomath,0.474,That's more like it!,1589570188,8,10
279,gkfg1i,19NinetyNine,0.5859,"While we are at home in comfort browsing Reddit, this man is sitting in jail. Away from his own mother and father. Pray for him.",1589569940,49,8
280,gkfa4w,ashraf246,-0.25,Transaction stuck for 2 days,1589569425,9,1
283,gkev6b,[deleted],0.0,Bruh,1589568109,0,1
284,gkesot,nickmannawar,-0.4795,Wife kept asking why I looked so stressed...,1589567892,3,4
285,gken6s,shirayu23,0.0,Y’all ever heard of CyberPunk 2077?,1589567399,5,1
287,gkebhw,D-Dracula,0.0,Cryptocurrency Documentary Review: Should You Watch It and Why,1589566364,0,0
288,gke8k1,Foz2000,0.0,Warren Buffet on bitcoin,1589566105,29,0
