,id,author,vader,title,created_utc,num_comments,score
2125,g8i6vw,VampireVlad,0.5574,Article Bitcoin and Pokemon have a lot more in common than you think  and it might be useful to extend narratives beyond our usual echo chamber,1587921354,9,1
2126,g8i5u1,Robert07r,0.0,Exchanger  Transfer Bitcoin to PayPal Exchange USD,1587921261,0,1
2127,g8i240,Guacanayas999,0.0,Why bitcoin cant be fast as bitcoin cash without using lighting network,1587920945,3,1
2128,g8hrwx,imjustguessingright,-0.4404,What are your thoughts on returning lost coins to the open market Good idea or bad idea,1587920046,24,1
2130,g8hjtg,statoshi,0.0,The Memes Make the Bitcoin,1587919289,3,1
2131,g8hh8u,DecryptMedia,0.0,Twitter CEO Jack Dorsey Bitcoin whitepaper is poetry,1587919055,62,1
2132,g8hh2d,celsius_hodler,0.0,My new license plate Sweden ,1587919041,1,1
2133,g8hgxr,Guacanayas999,0.4748,Hello Ive been a bitcoin maximalist per years but just today I Tried to use Bitcoin Cash BCH and it just works very well And fast,1587919029,0,1
2134,g8h9kl,elomaster666,0.4404,Blockchain any good,1587918361,12,1
2135,g8govy,charliefxtrades,0.0,Forex,1587916473,4,1
2136,g8gfwa,Chaz_Castodik,0.0,Cryptobubble of   ,1587915613,26,1
2137,g8gb86,manishrd,0.0, waiting for you,1587915176,0,1
2138,g8g81q,Arman1s,0.0,H Paypal  W BTC,1587914867,3,1
2139,g8ft84,Sandboxeaa,0.4404,Mark Cuban Waiting on Bitcoin to Get Better Will Stick to Bananas,1587913411,1,1
2140,g8fef2,salmonskinsalad,0.7184,How do I buy bitcoin and use it daily,1587911951,23,1
2141,g8faot,prinzeroc,0.0,Uniswap transaction pending for  hours,1587911578,4,1
2142,g8ez7r,Crypto4Canadians,0.0,Ledger and Trezor Comparison,1587910351,15,1
2143,g8euxt,financeoptimum,0.5994,Early Bitcoin Bull Chamath Palihapitiya Social Capital  Annual Letter,1587909897,3,1
2144,g8et07,intothecryptoverse,0.0,The Bitcoin halving approaches Here is what to expect,1587909684,5,1
2145,g8ej0x,emaz_83,0.0,ETC on the rise,1587908456,2,1
2146,g8ehhd,AussieBitcoiners,-0.34,Accidentally sent LTC from exchange to BTC address in my Trezor And was able to recover,1587908267,1,1
2147,g8dq5i,bitcosar,0.0,Bitcoin Yarlanmas Halving in Son Gnler,1587905064,0,1
2148,g8dikg,VanKaren,0.0,How i got a quick loan,1587904114,0,1
2149,g8dffj,mishax1,0.0,Bitcoin is about to close th week in a row of higher closing,1587903713,6,1
2150,g8d7tb,mishax1,0.0,Bitcoin is about to close th week in a row,1587902696,0,1
2151,g8d7l9,parakite,0.1779,BTCPay Server Now Processing Blockstreams Liquid Assets   Jan ,1587902667,8,1
2152,g8d6mf,parakite,0.0,Saving the World from Americas Bloodsucking Hegemony  Thoughts from Chinas Central Bank,1587902540,0,1
2153,g8d5ts,jackvince000,0.0,Could Bitcoin be used as a basis to attach future fiat currencies to it,1587902432,5,1
2154,g8d2fk,k3tan,0.0,RoninDojo Bitcoin Node Video Tutorial,1587901936,0,1
2155,g8cu75,qlpxumni,-0.0516,The irony,1587900726,5,1
2156,g8csqb,manfromnantucket1984,0.0,The Lightning Network is putting Bitcoin back into gaming Andr Neves and Christian Moss of ZEBEEDEE will show you how Tonight at  pm GMT in a tab near you,1587900507,5,1
2157,g8cops,parakite,0.5106,HODLers HODLing Number of Addresses Holding Bitcoin for More than One Year Hits Record High,1587899913,1,1
2159,g8cj8k,Eternitynaomy,0.4215,LOL,1587899106,0,1
2160,g8cfew,zrx1,-0.4215,SCAM ALERT DO NOT SEND BTC,1587898548,2,1
2161,g8ccso,Block-Create-Art,0.5994,Sip the wine and have a good Dream,1587898165,1,1
2162,g8c5ty,otasotas,0.0,Is it the time bitcoin,1587897107,0,1
2163,g8bw7i,Breakfastwithchapo,-0.7184,Is no one concerned about the inefficiencies with printing Tether And how that could possibly ruin Bitcoin,1587895627,0,1
2164,g8bsxw,Breakfastwithchapo,0.836,How do I know of the current price is a good buy,1587895154,9,1
2165,g8bgtw,AnserGent,0.0,How do I make Bitcoin Ownership Records,1587893200,4,1
2166,g8b5bb,coincodecap,0.0,Bitcoin and The Business Cycle,1587891341,1,1
2167,g8asm8,elindinga,0.34,What has hindered Bitcoin from getting mainstream adoption This week I shared the findings of my report that investigated the terms and conditions of  crypto exchanges,1587889258,2,1
2168,g8apw6,jesser110,0.8578,It seems to me that bitcoin is very old and has outdated tech So besides the hype that it will become something great can it really become something great when there are other faster coins out there,1587888824,11,1
2169,g8aka6,InbloxEvents,0.0,Chainbusters Global  A Unique Roundtable Discussion Series,1587887969,0,1
2170,g8ajzt,1949494,0.0,Was I fished,1587887919,8,1
2171,g8ajsc,dieuthuyenvtt,0.4588,Cng dng ca Proxerex Sigma Tau tng cng chc nng sinh l  n ng,1587887883,0,1
2172,g8ai6t,CryptoBitCoinUSD,0.0,Hopium,1587887618,106,1
2173,g8a8jr,Archiver_test4,-0.4019,Please report this scam Over k watching live right now,1587886075,0,1
2174,g8a7ug,bkrall,0.0,Dimensions  Adoption Speculation amp the Volatility of Bitcoin  AAX Academy,1587885965,0,1
2175,g8a539,parakite,0.0,The Puell Multiple,1587885565,0,1
2176,g8a0je,mccormack555,0.0,Bitcoin World  Bitcoin in Zimbabwe with Anita Posch  What Bitcoin Did,1587884911,6,1
2177,g8a0a6,pericles90,0.0,Binance Futures Calculator,1587884874,0,1
2178,g89zq5,Coolster-crypto,0.296,Is Bitcoin the hardest form of money,1587884793,22,1
2179,g89xbl,rBitcoinMod,0.0,Daily Discussion April  ,1587884462,125,1
2180,g89jkg,GarySei,-0.1877,Gary again who cant buy BTC i have an offer No scam,1587882401,0,1
2181,g89aih,Elphas419,-0.4019,Black Thursday Crash,1587881104,0,1
2182,g8999f,bama_done,0.0,will bitcoin get cheaper,1587880933,0,1
2183,g893pk,Josh_Mane,0.4404,Last  chars and public key makes brute Force easy,1587880188,1,1
2184,g890jv,Lewoniewski,0.0,Cryptocurrencies Perception Using Wikipedia and Google Trends,1587879733,2,1
2185,g88xob,KlutzyGolf,0.0,Bitcoin King Products from BITCOIN KING,1587879340,0,1
2186,g88g71,PunkIsBunk,0.0,CME Futures Prediction for this Month,1587877036,2,1
2187,g87uew,PineTreeVanguard,-0.4767,What is going on here Fake Bitcoin Event,1587874286,1,1
2188,g87qzl,CannaWurks,-0.6124,There is currently a scam LIVE on YouTube right now,1587873847,0,1
2189,g87nqn,_hazlo,0.0,I have owned Bitcoin since ,1587873467,0,1
2190,g87b0o,Techno-Anonymity,0.0,How will Bitcoin go back to Bitcoin,1587871915,7,1
2191,g878ar,ByteBulls,0.3818,Bitcoin Price Pushes to Clear  as Key Weekly Close Approaches,1587871585,0,1
2192,g876ll,northofwinterfell,-0.4341,Live BTC Giveaway SCAM A prerecorded Jack Dorsey Interview on Rogan Anyone know how to contact Google to shut this dogshit down asap I already reported it but apparently there are k ppl watching now,1587871378,6,1
2194,g6won0,brickgloryhole,0.0,Buying Bitcoin under ,1587681817,3,1
2195,g6wl8h,BashCo,0.0,Honey Badger Diaries Episode  Jason Chew Selangor Malaysia,1587681484,0,1
2196,g6wgc7,eljaboom,0.0,The Declaration Of Bitcoins Independence ,1587681010,4,1
2197,g6wbjl,341172278,0.0,What is a reasonable transaction fee,1587680548,3,1
2198,g6wbg1,TheSimkin,0.0,Price for HASH on nicehash seems to be way up anyone know why,1587680537,0,1
2199,g6w9lk,th1kan,0.0,A Technical Introduction to Blockchain,1587680367,0,1
2200,g6w6rx,Gr33nHatt3R,0.0,Bitcoin Startup Purse May Have a Lifeline After All  CoinDesk,1587680099,5,1
2201,g6w6kl,jdann14,0.2023,I wonder what the chances of BTC prices not increasing after halving,1587680079,13,1
2202,g6w2uj,ztakovic15,0.0,cryptomonnaie,1587679740,1,1
2203,g6w2mv,341172278,-0.128,Unconfirmed transaction for over an hour peep my transaction fee,1587679719,5,1
2204,g6vxaq,the-one011,0.1779,missing profit in paxful,1587679226,0,1
2205,g6vtb3,johnlee228160,0.296,A new way to earn money FySelf,1587678856,0,1
2206,g6vt2t,Skullkid-On-Acid,0.0,Should have bought,1587678836,6,1
2207,g6vplg,asm__dude,0.0,Finally I can say Im part of the  Million Club,1587678507,3,1
2208,g6vmcy,johnlee228160,0.296,New way to earn money,1587678199,0,1
2209,g6v87v,lunarcrush,0.7184,Bitcoin social engagement has moved to a month high today on  interactions,1587676905,0,1
2210,g6v702,dirkdigler551988,0.4019,Help,1587676799,12,1
2211,g6uz7m,cryptozink,-0.4215,New Bitcoin Ponzi Scheme Alert,1587676077,2,1
2212,g6uinz,anarchysoft,0.2732, Percent of Bitcoin Mining Powered With Renewable Energy,1587674585,68,1
2213,g6ud44,notyourpilot,0.0,Coinbase showing Bitcoin price at  on April   Why,1587674085,10,1
2214,g6u4r4,skagnboneman12,0.0,After Bitcoin today,1587673353,3,1
2215,g6u0mb,ronbubble28,0.0,Why A LOT of institutional investors are getting in right now,1587672998,0,1
2216,g6txkj,HarryRobso,0.7783,What is the best way for a small online business to accept Bitcoin payments without any middle man,1587672732,5,1
2217,g6tt1v,Charles_Design,0.5719,Why does Bitcoins mining reward decrease every four years and not gradually,1587672336,10,1
2218,g6tnje,Blockchains-Expert,0.0,New BlockchainsExpert video Fautil investir dans Chainlink,1587671837,0,1
2219,g6tmig,MrCrownnnnn,0.0,Dollar Price Update  Satoshi per dollar,1587671743,11,1
2220,g6thql,dan_held,-0.3182,Bloomberg StockMarket Shakeout Accelerates Bitcoins GoldLike Transition,1587671304,18,1
2221,g6tgla,chilianlin87,0.34,Bitcoin  Cryptocurrency Security Is It Possible to Add a Second Layer,1587671196,4,1
2222,g6t96t,someguy32323,-0.4019,I think I may be being scammed on discord need advice from bitcoin experts,1587670522,16,1
2223,g6so8b,Stonekrypt,-0.296,A Bitcoin Meetup in VRchat  No mask needed,1587668686,1,1
2224,g6sk4z,jack55321,-0.128,Ledger cleared the cache and some btc disappeared,1587668339,3,1
2225,g6sgqh,parakite,-0.2023,Controversial Analyst PlanB Updates Bitcoin BTC Halving Forecast Predicts Breakout Crypto Rally,1587668031,0,1
2226,g6sfa7,nerviosus,0.7845,Is it worth to buy a Nano X instead of a Nano S,1587667907,25,1
2227,g6s3q7,sylsau,0.4215,As the World Turns Upside Down Plan Bitcoin Is Gaining Momentum,1587666871,6,1
2228,g6rzy4,AnonAh525252,0.0772,What prevents Trezor from going rogue and putting a cryptostealing bug into a firmware update,1587666534,22,1
2229,g6ry5x,whatisfomo,0.0,Microsofts patent  is getting trolled and rightfully so,1587666369,3,1
2230,g6rnok,the8bitreject,0.296,Money printer go brrrr,1587665431,3,1
2231,g6ra1r,castn07,-0.6124,Being scammed not only once through a scam,1587664202,30,1
2232,g6r9cf,degenbetz,0.0,Jack Dorseys new Twitter bio,1587664140,4,1
2233,g6r8nz,MK333666,0.0,The USA believes in the future of Cryptocurrency and Blockchain proves a recent survey,1587664073,0,1
2234,g6r7lv,Lumin8_Crypto,0.8271,Bitcoin News Today  Ideas To Help You Should I Buy Bitcoin Now Or Wait,1587663972,1,1
2235,g6r6wc,NOWPayments,0.0,BTC,1587663905,0,1
2236,g6r1yt,sumBTC,0.0,Price changed  in  hours I remember the time when bitcoin was  plus or minus  for  months Bitcoin really is a different animal now,1587663458,2,1
2237,g6r0k4,Huddy64839263,0.1027,Need help Im new and accidently lost my bit cash,1587663335,7,1
2238,g6qzgr,burgosamovar,0.3412,Dont Worry,1587663235,3,1
2239,g6qwvo,vmrey,0.8591,Chinas Digital Currency To Be Given A Test Drive By US Companies  Bullish on Bitcoin  Amazing news,1587663007,0,1
2240,g6qsk2,min5338,-0.4939,Urgent Do you guys think this website is a scam or not,1587662604,4,1
2241,g6qrbs,cl0aker7,0.0,Places to post items and services for Bitcoin,1587662491,2,1
2242,g6qigf,Youfollowrafiki,0.296,How much money is there to be made in trading btc these days,1587661702,4,1
2243,g6q6t9,bitentrepreneur,0.3612,What the Bitcoin Mining Landscape Will Look Like After Halving,1587660668,0,1
2244,g6q3lh,FleecyRhombus,0.0,Question about sending bitcoin,1587660366,7,1
2245,g6q1e0,AnxiousWar,-0.5267,NETELLER I THINK I JUST GOT SCAMMED THEY HAVE MY INFORMATION am I in danger,1587660161,6,1
2246,g6q1bo,RandomnessTalk,0.0,Cashless Society   Pros amp Cons,1587660156,0,1
2247,g6pwaa,simplelifestyle,0.8268,More money coming into Bitcoin  PM Trudeau announces B in new COVID funding for students  The benefit will see eligible postsecondary students receive  a month from May to August and if you are taking care of someone else or have a disability that amount increases to  monthly,1587659686,5,1
2248,g6pw8g,anzel2002,0.4588,Even if Bitcoin increases  per month which some people think is too high too fast it will only end the year around k,1587659681,11,1
2249,g6pd8f,arminham1967,0.0,Binance Spinoff Aims To Be BitcoinPowered Venmo Of Africa,1587657939,0,1
2250,g6pd79,TheSimkin,0.7269,Last Epoch before the halving Great chance we can get a May th halving ,1587657936,1,1
2251,g6p330,eida2023,0.0,Bitcoin Crosses  as Data Reveals Investors Add Over M To Their HODL Positions Daily,1587657000,0,1
2252,g6p2c5,LitesLiger,0.4939,Collection of ServicesApps that Give Cashback on Bitcoin when you shop online on stores like Ebay Amazon Newegg Many others,1587656932,0,1
2253,g6oz54,BatMelk,0.0,Finally got my wife on board,1587656637,40,1
2254,g6ohnq,Navier-gives-strokes,0.4404,CryptoTab good or not,1587655038,0,1
2255,g6oglo,coincodecap,-0.4449,Opinion Bitcoin wont make you rich any time soon,1587654935,4,1
2256,g6ogf0,coincodecap,-0.7674,Stupid Opinion Bitcoin Has No Intrinsic Value and Its Going to ,1587654918,5,1
2257,g6oflg,bitcoininvestcc,0.0,Breaking News on Bitcoin News,1587654844,0,1
2258,g6oc7e,h3rlihy,-0.1179,No Tether isnt pumping Bitcoin new academic study claims  Decrypt,1587654543,8,1
2259,g6ob2v,derek_fx,0.0,mining,1587654436,9,1
2260,g6nyx1,SaneFive,0.4019,Argentinas central bank is tinkering with Bitcoin smart contracts,1587653311,0,1
2261,g6nyui,polagon,-0.7096,What the Bitcoin Crypto Fear amp Greed Index is amp how to use it,1587653304,0,1
2262,g6nxzd,192838475647382910,0.0,AAAAAAAAAAAAAAAAAAAAAAAAAA,1587653219,0,1
2263,g6nx9k,rpguy04,0.0,Apollo,1587653152,1,1
2264,g6nwos,sky_success,0.8245,This recession is one of its kind Dont miss the chance to learn about about the economy The wakeup call is now Sharing is caring Care about your future Join the elite in managing the crisis  of retail investors lose most of their capital on spreadbetting You will not be alone Its time,1587653096,0,1
2265,g6nsb8,tobiscato,0.0,Thoughts on this By Ross Ulbricht,1587652676,2,1
2266,g6nm2n,Send_some_BITCOIN,0.0,What caused this surge,1587652092,43,1
2267,g6nl2o,Cramson_Sconefield,0.0,Here we go again,1587651988,3,1
2268,g6ncs3,BashCo,0.5106,Fun with Bitcoin Intwerview with Yan Pritzker,1587651160,0,1
2269,g6nalp,AffectionateShelter6,0.0,Get started now,1587650956,1,1
2270,g6n1wc,bitrefill,0.0,Reminder Saturday April th is the cutoff for video submissions to Bitrefills Living on Crypto Video Contest,1587650087,0,1
2271,g6mxx3,WorkingLime,0.0,Venezuela update One BTC is around  Bs Bolivares days ago it was  Bs  BTC were traded last week up from  using LocalBitcoin Minimum monthly wage down to  USD,1587649690,85,1
2272,g6moqt,PersonalHarp461,0.743,im  and want to buy bitcoin what are websites that dont make you verify your identify,1587648722,17,1
2273,g9x7wr,stfnfdtv,0.6486,Money onlinesimple maybe if you got a lot of friends,1588113111,0,1
2274,g9x7w2,slvbtc,0.7506,Money is just a social contract and bitcoin is the best way to implement that social contract,1588113109,5,1
2275,g9x1wo,MagnusWDHH,0.0,Physical simulations on a blockchain,1588112543,10,1
2276,g9wvbo,ZeroCool86,0.0,Windows BTC Taskbar Price Ticker Widget,1588111945,0,1
2277,g9wh5j,DecryptMedia,0.6908,Bitcoin stocktoflow model predicts bullish price outcome post halving,1588110668,0,1
2278,g9wgj3,ebliever,0.0,Who is sending dust,1588110614,51,1
2279,g9w4kj,BullionRepublic,0.4019,Thought you guys might appreciate this Its a financial report from a company called GMI Its called The Unfolding Normally they charge a few hundred for membership It was written exactly one month ago My summary in the comments,1588109540,1,1
2280,g9w11f,love_money_guru,0.0,Thoughts on BTC mining stocks mainly looking at Hive Blockchain Technologies,1588109229,8,1
2281,g9vylo,boynas,0.5719,How do you think a Facebooks Libra success would affect Bitcoin,1588109012,0,1
2282,g9vi3s,mccormack555,0.0,Bitcoin Purity with Rodolfo Novak  What Bitcoin Did,1588107581,0,1
2283,g9v9wp,mudnut,-0.6739,These are SCAMS,1588106861,0,1
2284,g9v5l7,ronbubble28,0.0,Why the US is about to start cracking down on Btc,1588106487,2,1
2285,g9ux03,Spencer_Nolan_Rice,0.6264,Where to buy bitcoin as Binance and Coinbase arent ok for me,1588105754,0,1
2286,g9uve9,smokiearts,0.0,Kraken,1588105606,25,1
2287,g9uoko,AltSpaceAlt,0.8807,what is the Best place to buy BTC in Guernsey Channel islands,1588105013,0,1
2288,g9unke,phil1217in,0.0,Halving,1588104921,16,1
2289,g9uiza,kskelts,0.8476,in  weeks bitcoin booms back to not four digits but the holy christs  digits dont let those shit experts lie they just want you out before price rises for good,1588104518,9,1
2290,g9uezz,shtutzwaffle,0.3182,Please send me BTC,1588104178,1,1
2291,g9ucnh,sumBTC,0.7003,With the next halving well move from the billion to the million reward era,1588103986,8,1
2292,g9u7om,mavinter,0.8807,What is the best way to buy Bitcoin anonymously,1588103551,14,1
2293,g9u718,NimbleBodhi,0.0,How will the EARN IT Act Affect Bitcoin,1588103495,0,1
2294,g9u62v,shtutzwaffle,0.0,The richs can send me BTC,1588103413,3,1
2295,g9tqai,Ghostcarapace3,-0.4019,Some scenarios to crash the US dollar over the next year,1588102033,6,1
2296,g9tgpb,CrispyPork12,0.4019,Newbie need help,1588101180,10,1
2297,g9tf8j,sylsau,0.7184,Dont follow blindly the masses educate yourself then buy Bitcoin,1588101053,18,2
2298,g9tdfa,ponybreath,0.4019,Need help with lightning node,1588100896,4,1
2299,g9tazb,msl2008,0.0,Grayscale GBTC BTC Holdings Still Increasing in April,1588100684,45,2
2300,g9t5e8,lagunak47,0.0,Knock knock,1588100197,5,1
2301,g9t3sf,Josh_Mane,-0.282,What if exchanges dont really buy a Bitcoin but maintains the number,1588100051,11,1
2302,g9t0gu,MK333666,0.5859,The Chinese city Yaan will provide Cheap Energy to support the Blockchain industry,1588099762,0,1
2303,g9sxsl,ZackHererTwitch,0.0,The most expensive weed Ive ever smoked and I dont even remember it,1588099533,4,2
2304,g9sg4f,BigBoyoWonga,0.0,Question from UK,1588097961,12,1
2305,g9rork,Blazzord,0.4404, Anonymous Bitcoin OG Eljaboom  His Thoughts On A Crypto Bull Run Digibytes Place amp Potential,1588095482,1,0
2306,g9rgj0,happy2n,-0.4767,Fake bitcoin transaction sender tool,1588094753,0,1
2307,g9rcve,NPCHuman,0.0,I Just Sent a Scammer   Do Not Fall For This,1588094426,113,2
2308,g9r8f4,teasider,0.0,Bonappetit,1588094014,0,1
2309,g9r01o,EmmanuelBlockchain,0.3612,Service to DCA in Europe like Bittr ,1588093274,11,2
2310,g9qv2m,the420chronicler,0.0,Bitcoin users wield a kind of pricesetting power over the price of Bitcoin per Google,1588092837,1,0
2311,g9qqg9,Every_Singer,0.0,coins Not confirmed,1588092420,2,1
2312,g9qq5m,nerviosus,0.0,Why my raspibolt isnt going through TOR,1588092392,12,1
2313,g9qprl,OnTheDecks,0.4391,A wellwritten writeup on predictions for Bitcoins third halving I found it really helps understand different perspectives,1588092356,0,1
2315,g9qmaz,michaelsdirenzo,0.0,What day of the week to setup DCA buys,1588092046,10,3
2316,g9ql54,sergioxjavier,0.8126,Hello everyone Im new to the crypto space and wanted to ask about yalls opinions on dollar cost averaging into bitcoin Good practice Or better to wait till buying opportunities I know its very volatile,1588091945,5,2
2317,g9qgoe,NOWPayments,0.4754, Most Popular Cryptocurrencies,1588091533,1,1
2318,g9qdvr,coincodecap,0.0,A Bitmex Python Tutorial,1588091287,0,1
2319,g9qcqa,Mr_Insecurity,0.0,Bitcoin past ratesmoney spent calculator,1588091186,4,1
2320,g9qahh,coincodecap,0.0,Simple Mining and the effect it has on the halving,1588090984,0,1
2321,g9q9w2,coincodecap,0.0,Bitcoin Halving The Public Perception and Charts,1588090928,0,1
2322,g9q47i,JakeTheCryptoKing,0.0,What is the Bitcoin Halving Explained at the Most Basic Level,1588090443,4,2
2323,g9q41o,janus9000,0.2732,The Bitcoin god has spoken again  Andreas Antonopoulos new interview about the new central banks digital currencies vs Bitcoin and the US dollar,1588090427,5,2
2324,g9pwha,fresheneesz,0.0,Over reliance on the fed is trickle down economics,1588089780,2,0
2325,g9puny,crypto_bot,0.0,Bitcoin Network Status Update Tuesday April  ,1588089634,0,3
2326,g9pld0,Foz3061,0.0,Minergate,1588088790,2,0
2327,g9pkia,jonesocnosis,0.3612,Vegeta getting ready for the halving,1588088711,2,2
2328,g9pf12,[deleted],-0.6124,FB giveaway scam,1588088213,7,0
2329,g9p9vp,martinkarolev,0.0,Close to k BTC has been withdrawn from Bitfinex in the past  days,1588087748,14,3
2331,g9p899,DecryptMedia,0.4215,Bitcoin investors holding ahead of May  halving  Despite markets being rattled last month data from Glassnode shows investors are feeling optimistic,1588087602,2,2
2332,g9oyzn,[deleted],-0.296,Earn bitcoin Online With No Effort,1588086736,0,1
2333,g9oqhj,sabadysh,0.0, months and minimum investment,1588085973,1,0
2334,g9ojf2,reedyp,-0.4019,Bitcoin Whale Suggests BTC Price Will Crash  Halving Is Priced in,1588085299,1,1
2335,g9ohw8,coingecko,0.0,Everything you need to know about Bitcoin Halving  in one page  An Infographic,1588085156,7,0
2336,g9oept,BashCo,0.0,Tales from the Crypt  Amiti Uttarwar,1588084853,0,4
2337,g9nqf6,pumpyz,-0.34,Mistake,1588082510,1,0
2338,g9nitd,AlanOne89,0.5719,Bitcoin wins the virtual NASCAR race  The Cryptonomist,1588081772,2,1
2339,g9ngfj,SonOfVoopo,0.0,Bitcoin Halvening baby onesie,1588081527,4,1
2340,g9n1kf,Toazz,0.0,LocalBitcoins usage per country in   Compared to CPI Political Stability Index and PFI,1588079989,6,1
2341,g9mztx,ArkaneAngel,0.0,Anyone hear about Finalmente Global,1588079803,1,1
2342,g9mxyb,TrulyWacky,0.7184,Do you buy any other coins or only Bitcoin,1588079589,1,1
2343,g9mrxq,thecryptoboss69,0.4939,Bitcoin About To Sky Rocket,1588078932,5,1
2344,g9mp8b,OwnFly1,0.0,New StocktoFlow Forecast Puts Average Bitcoin Price at K by ,1588078664,0,1
2345,g9mo2h,TheCryptomath,0.7003,Normally folks exclude BTC from this chart when you add it you see that it is the best performing asset class for  out of the last  years,1588078541,3,1
2346,g9mnrd,asso,0.7964,Stimulus Checks  The Best Fuel for Bitcoin PreHalving Pump,1588078505,0,1
2347,g9mlyc,MrCrownnnnn,0.7346,Top  most awesome Bitcoin Hoodies en Sweaters  NeedFUD,1588078312,0,1
2348,g9mjtr,HKBNews,0.0,China Launches Blockchainbased Service Work BSN to Rule the World  By Chapman Chen HKBNews,1588078072,1,1
2349,g9miws,Lumin8_Crypto,0.0,Bitcoin News Today  New StocktoFlow Forecast Puts Average Bitcoin Price at  by ,1588077971,5,1
2350,g9ma7z,Andrewbolexy,0.0,CRYPTOCURRENCY,1588076966,0,1
2351,g9m8nq,ripplesuckz,0.0516,Bitcoin to the Rescue as US Fed Fake Economy Has Burst According to Ron Paul,1588076758,4,1
2352,g9lxxf,Abdouuu_la,0.0,Companies holding bitcoin,1588075377,3,1
2353,g9lw0n,CardCoins,0.0,Why a Startup Youve Never Heard of Is Now Sponsoring a Bitcoin Core Developer,1588075123,0,1
2354,g9lrmm,cako1905,0.4215,Nice Bitcoin Halving Countdown at CMC,1588074541,6,1
2355,g9lpzo,blockchain68952,0.0,Here are the evergreen factors to predict Bitcoin prices,1588074310,0,1
2356,g9lnnr,ByteBulls,0.0,New StocktoFlow Forecast Puts Average Bitcoin Price at K by ,1588074001,2,1
2357,gaqei5,bitcoinferret,-0.4019,ATH in May six figures by July shitcoin rally crash before year end obituaries four year wait,1588227838,3,1
2358,gaqe50,Any_Budget,0.0,Bitcoin now outperforming SampP  for the first time since equity selloff,1588227786,1,1
2359,gaqdws,killer_squidx,0.0,,1588227758,0,1
2360,gaqdi1,meefozio,0.3612,Feels like a melt up to me,1588227699,4,1
2361,gaqcga,RadiantAssumption5,0.0,Bitc,1588227555,1,1
2362,gaqcan,sleepdeprivedindian,0.9349,Feeling bullish Buy a Call option,1588227533,0,1
2363,gaqatv,wildcard_94,0.0,For the people that has seen this happen many times,1588227324,3,1
2364,gaq646,VJ_Content_Developer,0.0,Potential Usage of Blockchain In Educational Sector,1588226680,1,1
2365,gaq5rw,yo_v,0.1724,I saved up money and dont want to do a wrong move,1588226643,19,1
2366,gaq3nw,Explicy,0.0,Everyone holding right now,1588226365,1,1
2367,gaq2lm,evil_chicken86,0.0,What do you think about that,1588226210,1,1
2368,gaq0sg,Mikerobin25,-0.25,k and pumping,1588225946,5,1
2369,gapzir,Jargento,0.0,Seed storage,1588225777,11,1
2370,gapr3j,TRWNBC,0.0,Everything is on schedule for the Halving,1588224656,12,1
2371,gapkw2,MotherPop9,0.0,Impacto Social Blockchain,1588223842,0,1
2372,gapixl,ranlevi,0.0,SegWitx podcast looking for submissions,1588223569,9,1
2373,gapism,tomtiddlywink,0.1027,Why would anyone want to hold bonds when interest rates go negative Who wants to pay to loan their money,1588223551,35,1
2374,gapcxl,lost_civilizations,-0.5719,Slow drift to insanity from holding alts,1588222779,6,1
2375,gap7d7,FabulousButterfly0,-0.25,Transaction stuck,1588222052,1,1
2376,gap5uk,Kinolva,0.778,FYI There arent enough BTC for HALF of todays millionaires to own JUST ONE Owning ONE bitcoin puts youat minimumin the top  of the human population in terms of total possible Bitcoin wealth distribution,1588221850,146,1
2377,gap4bv,swarthout2222,0.4019,CME Gaps Help,1588221662,1,1
2378,gap31n,theanxiousbandit,0.0,Should you buy or should you sell,1588221498,32,1
2379,gaoyx4,theons-weiner-stump,0.0,Wildin out,1588220995,15,1
2380,gaoxj4,piassaip-,0.7184,Know when to buy in BTC,1588220816,0,1
2381,gaovf4,EmotionalBath8,0.0,Did some spring cleaning and found out Im a millionaire What do I do now,1588220552,0,1
2382,gaounu,lastintherow,0.128,That feeling when you send so many eurosdollarswhatever to your trading website and it is taking days to get in whilst BTC is climbing,1588220464,7,1
2383,gaotna,JohnWicksPuppyDog,0.0,Its over  Can it hold it though,1588220348,10,1
2384,gaosn7,puppers90,0.5106,Obligatory PSA The Trust Machine,1588220223,0,1
2385,gaop6e,VeeAar,0.0,THIS RARE OCCURRENCE THAT SIGNALED START OF BITCOINS   RALLY IS BACK,1588219796,0,1
2386,gaolp7,Sekiro78,-0.7184,At what price will you sell k,1588219379,24,1
2387,gaoce3,baronofbitcoin,-0.6705,Fatality,1588218290,7,1
2388,gaobn0,GrilledCheezzy,0.0,Here we go,1588218200,0,1
