,id,author,vader,title,created_utc,num_comments,score
0,fw00od,bloodywala,0.8689,Best way to check seed works Safely and securely,1586184502,13,1
1,fw00b0,pcaversaccio,0.4201,Does Bitcoin Behave More Like Gold or Equities,1586184470,2,1
2,fw008h,openbitlab,0.0,Tent bought with Bitcoin donations deployed in Italy,1586184461,0,1
3,fw001n,religionresearcher,0.0,In April   usd  k satoshis and now april   usd  k satoshis,1586184443,2,1
4,fvzw0c,neegroid420,0.0,Is coincola legit,1586184033,3,1
6,fvzo62,Coolster-crypto,0.2732,Bitcoin CME Futures gap mystery solved,1586183207,2,1
7,fvzkj3,Techno3006,0.0,Looking for someone who knows how to invest,1586182839,19,1
8,fvzi5i,btcmiss,0.0,Bitcoin Key Metrics Recover As Price Surges,1586182595,0,1
9,fvze1q,bitsea2x,0.0,BitSea  Legit Bitcoin Doubler,1586182168,1,1
10,fvzalq,Highdesertlavender,-0.4927, percent or more unemployment,1586181814,21,1
11,fvz8j4,Kraken-James,0.0,Kraken Releases VIRES IN NUMERIS A Concise Primer on Bitcoin,1586181614,6,1
12,fvz3lz,Aspanu24,0.0,Why is bitcoin taxed when its a currency If I exchange my dollar for a euro and it goes up would I be taxed,1586181093,9,1
13,fvyv6j,mohammadeliseomarcus,0.0,What he invented again,1586180184,1,1
14,fvyre0,wncx,0.0,PH BexproBExpress Receives BSP Virtual Currency Exchange License,1586179776,0,1
15,fvyqhs,MK333666,0.0,Revolution of Digital Currency coming,1586179677,4,1
16,fvyorj,localname1,-0.128,Bitcoin Demand Is About To Skyrocket On Massive  Trillion Coronavirus Stimulus,1586179482,9,1
17,fvyk50,IamGeorg,0.5719,Happy Bday Satoshi Nakamoto,1586178992,0,1
18,fvyihf,bitsea2x,0.0,Legit Bitcoin Double,1586178806,0,1
19,fvyeav,Funny-Aide,0.0,Bitcoin technical analysis and trade setups,1586178357,0,1
20,fvy2zh,tldr-hodl,0.0,Monday Art  Rajiv Kamperveen,1586177057,2,1
21,fvy2rf,tldr-hodl,0.0,Monday Art  RYR,1586177029,2,1
22,fvy28f,tldr-hodl,0.0,Monday Art  CultBitz,1586176966,2,1
23,fvxxq4,bitroyaltrading,0.5267,ICO  An ideal Fundraising Method,1586176427,0,1
24,fvxvtz,Grutttt,0.0,MINING AIRDROP Get a PHT token   USD,1586176205,0,1
25,fvxusx,lancentor,0.0,PI mining,1586176078,0,1
26,fvx9qt,MyHentaiAcx,0.0,This Book WILL teach you how to earn  a DAY using this script,1586173334,5,1
27,fvx6e4,Sandboxeaa,0.0,Bitcoin Correlations Keep Getting Drawn This Time its Gold,1586172847,0,1
29,fvx4up,PureOffer,0.0258,Bitcoin BTC to Reach  by End of Year Interview With Major Investor Kyle Chasse,1586172626,0,1
30,fvx1w7,Sandboxeaa,0.0,Bitcoin BTC Back Above  as March sees Record Trading Volume,1586172200,1,1
31,fvwwto,IamGeorg,0.0,Bitcoin Price latest updates,1586171493,1,1
32,fvwugm,risakasparasasd,0.0,this is workiiiiinnnnnnnk,1586171209,0,1
33,fvwszq,checkraise86,0.7184,Spending BTC to buy something is altcoin promotion When was BTC an altcoin,1586171012,3,1
34,fvwrxc,69676f72,0.0,Mining BTC in Containers malware,1586170866,2,1
35,fvwrtz,rBitcoinMod,0.0,Mentor Monday April   Ask all your bitcoin questions,1586170854,78,1
36,fvwr74,automax,0.0,Bitcoin is up nearly  how did the analysts shape up,1586170759,0,1
37,fvwosz,MolestedScavenger,-0.0516,How to be safe from a  wrench attack,1586170409,102,1
38,fvwkmf,MeetMeAtGE,0.3987,Bank Of Korea Launched A Test Program For Its Cryptocurrency Despite Low Demand,1586169824,1,1
39,fvwi9x,sasha_sh,0.2263,Crypto Regulation News South Koreas central bank begins pilot program for testing digital currency US lawmakers considering digital dollar to stimulate economy Bank of France says Ethereum and Ripple could power central bank digital currencies,1586169501,2,1
40,fvw7jb,TheLuminescent,0.5423,Need urgent help Sent bitcoins to armory without understanding it,1586167960,19,1
41,fvw6xf,checkraise86,0.7184,How To Buy Anything With Bitcoin Using Instagram,1586167877,1,1
42,fvw1mp,jk3l,0.4019,BitCoin help,1586167170,0,1
44,fvvtcl,Kinglens311,-0.5719,COINME ARE CRIMINALS,1586165960,0,1
45,fvvsez,Bitcoin_to_da_Moon,-0.6908,Dollar Squeeze Worsens in Lebanon as Banks Restrict Withdrawals,1586165814,0,1
46,fvvpce,OldManKade,0.6705,Let us all take each other by the virtual hand and pray,1586165345,0,1
47,fvvjrb,weeklypaisa,0.0,Gold XAUUSD Elliott Wave Analysis th April ,1586164459,0,1
48,fvviwu,artistmattem,0.0,If anyone wants to know why bitcoin is in the  range now,1586164335,9,1
49,fvvdy1,andrehorta,0.7184,Buy BitcoinUSDT at Binance in EUR,1586163619,0,1
50,fvv7mt,kashyappavra,0.1779,Digital or IT Solutions Survey,1586162660,1,1
51,fvv7ia,mezombiee,0.0,Japan to Enforce New Crypto Laws from Next Month,1586162641,11,1
52,fvv4t0,Insiria,0.5423,How will the mining award ever get to btcblock if dividing by  never gets you to ,1586162238,15,1
53,fvuyuj,kylenemmanueljude,0.0,What happen this time,1586161366,0,1
54,fvu45b,browncoat_girl,-0.6124,Is this a scam and has anyone heard of it before,1586157081,10,1
55,fvtz76,rBitcoinMod,0.0,Daily Discussion April  ,1586156444,79,1
56,fvtr2d,OKEx-official,0.0,BTC surges above ,1586155299,21,1
57,fvtg17,MaMaMatthias,0.0,Ledger or Trezor,1586153690,39,1
58,fvtfbe,mimblezimble,-0.4767,Price suppression with fake inexistent bitcoins,1586153581,40,1
59,fvt50k,letsgetbit,0.4215,Bitcoin is for Savers Saved Me from Scrubbing Toilets  How I started a Bitcoin meme blog,1586152151,0,1
60,fvsy0l,Odins_kin,0.0,Does anyone actually think BTC will go to k in ,1586151154,24,1
61,fvswai,krazykittiekat,0.0,Bitcoin,1586150927,0,1
62,fvsf6x,howlingwolfpress,0.0,My life in one meme,1586148647,4,1
63,fvsang,nilesh,-0.6369,DUMP BTC DUMP BTC,1586148041,3,1
64,fvs95i,MeetMeAtGE,0.0, Reasons a Deeper Correction in Stocks May End Bitcoins Rally to K,1586147845,0,1
65,fvs2wt,WorldSpark,0.8283,Bitcoin is very lucky and very unlucky at the same time lucky  because it did not see any recession in its life time giving it time to grow Unlucky  it is about to face a apocalyptical financial downturn when it is still in its infancy many problem to solve before it can do any heavy lifting,1586147016,89,1
66,fvrfuy,justforpornleavemebe,-0.4588,Its tragic that most people see holders as this absolute chad of a man,1586144135,2,1
67,fvr25n,stupidmentat,0.0,What Happens to Bitcoin if the Fed is dissolved and the US returns to the Gold Standard,1586142494,1,1
68,fvqjd4,Bitman321,0.5815,Make no mistake the temporary measures of corona will be anything but like the income tax,1586140298,1,1
69,fvq1no,Coaster89,0.0,Do Trezors set off metal detectors,1586138294,2,0
70,fvpyx6,EarlGrey171,0.1531,BE CAREFUL,1586137972,5,2
71,fvpyc5,MolestedScavenger,0.4404,I hope we range for  more months,1586137903,0,0
72,fvp8w8,CutoutH,0.8519,Out of interest if a billionaire were to hypothetically come along and want to buy  million in BTC how would then even go about doing that,1586135037,12,1
73,fvp2j4,Crypto_Life_TA,0.0,BITCOIN BREAKOUT Imminent BTC to Go UP or DOWN amp Targets Bitcoin Tradi,1586134304,5,0
74,fvozpv,blindedzeppelin,0.5106,Bitcoin Vs Bitcoin Cash Debate ProsCons Lets have an honest and openminded discussion,1586133987,5,0
75,fvoqeu,duong1989,0.3182,FEDs solution for economic recovery from pandemic,1586133001,4,2
76,fvoky0,Henry_crown02,0.0,BITCOIN,1586132421,0,1
77,fvohxv,Mariamread,0.2023, days of quarantine in my country and today I need to tell you something important,1586132110,1,2
78,fvo7rq,69676f72,-0.1531, Crypto Firms Targeted by  Lawsuits in New York,1586130984,0,1
79,fvnoy0,launweisel,0.6486,Join BitcoinBlack rewards,1586128979,0,1
80,fvnhdq,LacksAgency,0.2263,Bitcoins Worth  Recovered by Breaking Zip Encryption,1586128164,7,3
81,fvngjl,Crypto4Canadians,0.0,How LeverageMargin Trading Works,1586128071,9,1
82,fvnfeb,[deleted],-0.743,Coronavirus killing the market and binance getting lawsuit,1586127947,0,0
83,fvna5m,BitcoinRebelRouser,-0.6486,Andreas Antonopoulos Reveal Why No Government or Corporation Can Attack Bitcoin,1586127405,0,1
85,fvmpm6,ningrim,-0.4215,what recession,1586125304,3,6
86,fvmnrd,vladimir0506,0.0,Bitcoin Testnet,1586125129,16,1
87,fvmmuu,[deleted],0.5473,Mark Cuban Reveals the TRUE POTENTIAL  of Cryptocurrency in  NEW FOOTAGE,1586125044,0,7
88,fvmmo9,PositivePackage,-0.5719,I dont get why people think clinical depression is entirely genetic,1586125025,5,1
89,fu9q61,DavidBanks12,0.6908,Billionaire Mike Novogratz is Bullish on Bitcoin says Price will double in the next six months,1585925423,15,1
90,fu9gjt,A_solo_tripper,0.0,US Gov Verify your bitcoin address and receive your  via bitcoin payment in  hours Would you do it,1585924451,16,1
91,fu9c46,asso,-0.7906,Authoritarian Leaders are Exploiting Covid Crisis to Grab More Power,1585923991,16,1
92,fu97r2,scallywag63,0.0,Buying Bitcoin,1585923545,22,0
93,fu8xmo,GermanPetrovic,0.0,What is this,1585922517,2,1
94,fu8j7f,DopeMixtape,-0.296,Will paypal banclose my account if I place a Stop Payment Order,1585920941,1,1
96,fu8crr,TotalRepost,0.3612,I like this new channel,1585920236,4,1
97,fu896g,weiDex,0.0,New Automated Liquidity Provider Software for BTCltgtETH crosschain swaps,1585919832,0,1
98,fu7wqa,Sandboxeaa,0.6808,Bitcoin Surges  And Is Likely to Set Up A Fresh Strong BTC Price Rally,1585918479,27,1
99,fu7wg4,stephanlivera,0.0,SLP Cory Klippsten  Bitcoins Intransigent Minority Swan Bitcoin amp Bitcoiner Ventures,1585918449,0,1
100,fu7ss3,Ddonitz,0.0,Opinions on Switchere,1585918014,4,1
101,fu7p51,Michael12390,-0.6124,US jobs report unemployment rose to  in March after Februarys year low,1585917568,1,1
102,fu7nj4,ResponsibleNovel6,0.0,Earn With Bitcoin Ads,1585917379,0,1
103,fu7c7l,ensignlee,0.4404,Props to BlockFi for easy withdrawals,1585916040,5,1
104,fu71vy,btcmiss,0.0,Nobody touch anything,1585914778,2,1
105,fu6te7,ethtrader2,0.9201,BUSTING THE MYTH Bitcoin has zero value amp is backed by nothing Must Read and Share  I would love Peter Schiff and Mark Cubans response  I think this is the best thesis out there,1585913619,32,1
106,fu6lh9,hugg3rs,0.3612,Some mining in the background like FoldingHome,1585912571,5,1
107,fu6gm7,JennieJohnston,0.0,John Mcafee now says that whoever thinks Bitcoin will get to a million is insaneall it took was to launch his own coin,1585911939,6,1
109,fu66qs,ripplesuckz,0.0,Vitalik Buterin Tells Bitcoin Dev That BTC Wasnt Always Digital Gold,1585910599,3,1
110,fu5x11,pihusingh,0.34,Will COVID Play Spoilsport for Bitcoin Halving ,1585909246,0,1
111,fu5w7y,EddieVincentFan,0.0,As the world economy shuts down multibillionaire Chamath Palihapitiya talks bitcoin,1585909130,72,1
112,fu59vv,Anandgarg007,0.128,Due to the lack of progress in national cryptocurrency regulations the major Brazillian cryptocurrency exchange closes down,1585905981,0,1
113,fu52lq,financeoptimum,0.0,Paul Le Roux,1585904987,0,1
114,fu4qw1,CamiloMm31,0.0,Bitcoin latest news,1585903263,0,1
115,fu4oki,grim_gravySS,0.7184,Should I buy now,1585902900,13,1
116,fu4iz8,ChiMiGoGo,0.3818,Ask people if they accept bitcoin,1585902057,61,1
117,fu4f8a,Redsald,-0.1531,A Thesis and Hypothesis For Supply Chain Shortages During COVID in Regard to Bitcoin,1585901504,3,1
118,fu4ej0,IamGeorg,0.0,k Again,1585901405,25,1
119,fu4d46,InbloxEvents,0.0,Chainbusters  A roundtable discussion series on blockchain and crypto,1585901182,0,1
120,fu4avw,cryptohazard,0.7184,So when is the Fed and other central banks going to buy Bitcoin,1585900847,17,1
121,fu4adv,SabinaLanedj999,0.0,Looking For Cloudy Polished Concrete,1585900770,0,1
122,fu44rz,simplelifestyle,0.0,This is the moment for change,1585899916,26,1
123,fu3svl,Collective_Holdings,-0.5859,Common sense against scams,1585898152,3,1
124,fu3on4,Coolster-crypto,-0.7805,What is the marginal cost of producing a   note by the Fed A few US cents What is the marginal cost of producing  BTC Up to   Remind me why BTC critics argue it has no intrinsic value,1585897534,40,1
125,fu3mj7,rBitcoinMod,0.0,Daily Discussion April  ,1585897250,120,1
126,fu3k21,NGirn,0.0,Getting Paid In Bitcoin,1585896895,16,1
127,fu308a,magicaviation,0.4588,Autopilot BTC Method  a DAY Noob Friendly,1585894075,1,1
128,fu225y,LostInDaSauce1,0.4404,I gotta say today was a good day,1585889693,0,1
129,fu201q,jeandumas94,0.0,For anyone wanting to understand how Mining works and how the network achieves consensus,1585889444,0,1
130,fu1rse,bitsteiner,0.7184,And we have a lift off to the moon,1585888442,0,1
131,fu1p94,maxc,0.0,How many jumps from a shady transaction do you have to be for your transaction not be flagged,1585888165,11,1
132,fu1o8k,Alexia5412,0.0,Bitcoin Likely to Become The New Normal For Gen Z,1585888038,0,1
133,fu1nf2,hedayatabbaszadeh,0.2732,Bitcoin to  gt ,1585887941,3,1
134,fu1j0q,maxc,0.0,What are the actions one can take to counter blockchain analysis techniques,1585887429,7,1
135,fu1iwt,localname1,0.0,Mike Novogratz on the State of Markets Bitcoin,1585887416,1,1
136,fu1i0d,KPop_Poster,-0.128,What can we do to get this slanderous website offline,1585887298,7,1
137,fu19gt,Saman93,-0.6124,Dailyhodl is scamming people by advertising scam YouTube channels,1585886318,12,1
138,fu18m3,WearyCourt3,0.0,Is this normal,1585886215,19,1
139,fu0upx,micaeel,-0.1531,Good or Bad,1585884623,0,1
141,fu0sty,NewBitcoinUser_,0.0,Learn why you should consider becoming a member of  million Bitcoin club,1585884413,1,1
142,fu0a5i,Random_420-69,0.4404,Upvote to hope that it goes back up big,1585882381,0,1
143,fu00gl,Smitty_Smalls,-0.2263,The evolution of money seems to have taken a wrong turn,1585881317,10,1
144,ftz4s9,eXPHorizon,0.296,I need money Wanna make some together  D,1585877906,1,1
145,ftz2td,benperrin117,0.6486,How Halving May Affect BTC Buy and Sell Pressure  Robert Kiyosaki Bitcoin Bull  Lightning and Liquid Innovation,1585877683,0,1
146,ftz1t3,anon2414691,-0.4404,USD monetary base blue and currency in circulation red Up to date ,1585877573,5,1
147,ftyxfw,Crypto_Life_TA,0.3818,Time to BUYLONG BITCOIN Bull trap Bitcoin analysis  BTC trading and ,1585877091,2,1
148,ftyrda,primieroeechie,0.7579,Brave Bat rewards for kids,1585876466,0,1
149,ftyexe,MeetMeAtGE,0.0772,CryptoThere  Bitcoin Reaches K Day High as US Unemployment Hits  Million,1585875126,0,1
150,fty7bi,vendstepper007,-0.25,How would one run escrow on bitcoind,1585874344,3,1
151,ftx98x,Gboneskillet,0.0,Questions about running a node VS mining,1585870829,11,1
152,ftx2wm,Bitcoin1776,0.7096,Thoughts on this Bitcoin Business promoting Corona Stimulus Money  Money Printer go Brrrrrrrrrrrrrr,1585870193,0,1
153,ftx1w7,dirtywhitemagic,0.0,View graph inverse goodbrain,1585870091,1,1
154,ftwzj9,BashCo,0.0,Tales from the Crypt Rabbit Hole Recap ,1585869861,0,1
155,ftwfpk,darcon_pr,0.0,Need Your Feedback on a Bitcoin Project Slogan,1585867937,2,1
156,ftw53r,fowcasmowde,0.0,Hypothetically speaking if they outlaw Bitcoin could a nd layer privacy protocol be built,1585866905,2,1
157,ftvwwq,throwaway823947,0.0258,Some Americans could wait up to  weeks to receive stimulus checksthe Bureau of Fiscal Service estimates they can only cut  million checks a month IRS tells House Democrats  If only there were some way to send any denomination of money instantly,1585866105,7,1
158,ftvvgd,satoshiBoi,0.6705,protects your wealth from Tyrants,1585865968,25,1
159,ftvloe,BashCo,0.0,Lightning Junkies LNJ  Andreas M Antonopoulos talking Lightning,1585865051,1,1
160,ftuuqi,NebBetta,0.7269,Pretty funny BitPay,1585862515,0,1
161,ftus7w,ReasonedTwo,0.0,I shouldve invested in Covid back in Febuarynow its too late,1585862281,0,1
162,ftus5o,Heresmaxers69,0.4404,Good ole spongebob meme,1585862274,2,1
163,ftum51,bit123987,0.0258,EARN  PER  SECONDS IN BITCOIN NO INVESTMENT FULL AUTOPILOT HUGE,1585861723,0,1
164,ftuleg,Morphies83,0.0,All the time,1585861652,29,1
166,fttr5g,keulenhauer,0.25,Your second Chance,1585858932,0,1
167,ftto39,lildopamine,-0.4767,What wrong with this how do I convert my coins back to dollars,1585858656,3,1
168,fttk6m,bitcoinioctib,0.836,I buy these to keep my glass safe and stumbled upon this new design,1585858310,0,1
169,fttj70,brittneyapril,0.4215,Does anyone in this sub actually own bitcoin lol,1585858222,0,1
170,fzxvsr,zinc191,0.0,Coinbase pro open order,1586702585,0,1
171,fzxm5v,ChronicTheHemphog420,0.0,The Federal Reserve vs COVID,1586701569,26,30
172,fzxg6l,questa12345678,0.6908,I tried to create my first bitcoin generator it should create something like  a day can you review it,1586700931,0,1
173,fzxfq3,leeladitya,0.0,Woah Bitcoin for USD ,1586700882,7,0
174,fzxc0b,abhishek177,0.7184,Is it the right decision to buy a bitcoin now,1586700477,16,0
175,fzx0cv,Lass3BTC,-0.6249,Why Tim Draper Believes Bitcoin will Flourish in Times of Current Crisis,1586699117,1,3
176,fzwv7v,edswf1,0.0,coinfarm review,1586698520,0,1
177,fzwr3z,jorah1978,0.0,Crypto Investor Behavior Report,1586698077,0,1
178,fzwph8,Crypto_Rootz,-0.7184,How to Sell the IDEA of Cryptocurrency,1586697903,2,0
179,fzwezk,SuperJew113,-0.4549,Peter Schiff and his major bitcoin crash predictions,1586696753,7,4
180,fzw4k4,[deleted],0.0,Keep updated with trends ,1586695593,3,1
181,fzw23b,asso,-0.1531,How to Deal with an Economic Crisis Politicians Solution is Printing Money,1586695295,8,1
182,fzvwx0,mccormack555,0.0,Uncensored Bitcoin Narratives with Junseth  What Bitcoin Did,1586694663,2,2
183,fzvwoh,yousifisprobably,0.0,Jeff Berwick  How Bitcoin Can Change The World,1586694635,2,0
184,fzvv7m,pcvcolin,0.0,What to do with those stimulus package funds rolling out in different countries around the world,1586694454,0,0
185,fzvsng,[deleted],0.0095,th march drop is almost gone so long partner dont get hyped this is in CAD,1586694130,1,0
186,fzvrtl,JeganGN,0.296,Bitcoin and fiat money,1586694027,8,13
187,fzvlv7,nolimitzman0,0.2732,My Easter present this morning My kids know me too well,1586693274,4,13
188,fzvl9n,[deleted],0.0,How the ICO market has changed from  to  or dying ICO,1586693196,1,0
189,fzvjs6,[deleted],0.6124,My Easter gift this morning My kids know me too well,1586693008,0,1
190,fzvj0j,edswf1,0.0,stayhomeandearncoins,1586692914,0,0
191,fzukc8,AffectionateSeason3,0.0,Take consideration,1586688028,1,1
192,fzu41e,claudius850,0.4588,Get  of your favorite Binance Dex coin through an Easter Egg hunt,1586685675,1,1
193,fztys3,TheMoonCarl,0.0,Only  days left to the Bitcoin halving,1586684916,2,1
194,fztyol,[deleted],0.3818,Bitcoin in its Historically Second Best Performing Month But More Volatile  Kraken Report,1586684902,0,0
195,fztxuf,Frank-BitTex,0.0,How to start trading Bitcoins either as a Side gig or Fulltime,1586684775,0,1
197,fztp2l,sidixonbf,-0.1027,How Big Is A Trillion Dollars Understanding the bailout numbers,1586683466,8,1
198,fztnin,skz-,0.3818,Payment merchants that lets you accept lightning payments and pays out in lightning,1586683237,3,3
199,fztgcw,[deleted],0.0,This ones on me,1586682199,2,0
200,fztblq,heyjuppe,0.3415,Need little help to startup my career,1586681498,1,0
201,fzt42v,AltruisticAioli2,0.0,BTC ATM in Switzerland in times of Corona,1586680399,4,0
202,fzsini,10K9k3dXmJ86Xq5j,0.0772,COVID forced many businesses to start selling online Right now what is the fastest and easiest way to start accepting bitcoin with a minimal exchange rate risk,1586677392,19,11
203,fzsij5,fenkinx,0.0,If Bitcoin Works in Zimbabwe It Works Everywhere,1586677377,7,25
204,fzsffk,MrCrownnnnn,0.0,How many of these  Bitcoin facts do you know,1586676958,0,2
205,fzs6bc,mlmashish,0.0,Work from home,1586675723,0,1
206,fzrz4f,[deleted],0.7184,Debating whether to hit the buy now button,1586674745,12,1
207,fzrt41,MaxGZBR,-0.34,Crazy idea,1586673936,5,0
208,fzrdeu,Gotunos,0.0,Pi network  making cryptocurrency with phone,1586671821,0,1
209,fzrak7,RaZoR_jeedai,0.5719,Happy Easter HODL on,1586671452,2,20
210,fzr7yu,phx_67,-0.5574,What Can Governments Actually Do to Ban Bitcoin and Other Cryptocurrencies and What Can We Do About It,1586671125,72,65
211,fzr3rg,Shieldfolio,0.4005,The Worlds Most Secure Notebook for Crypto,1586670587,27,1
212,fzqrjv,[deleted],0.0,Check out the BitcoinVR world in VRchat,1586668975,1,1
213,fzq7oi,intothecryptoverse,0.2023,Macrotrend of Bitcoin dominance,1586666474,0,1
214,fzpnbe,stewarta90,0.4215,Be nice to me ,1586664010,10,0
215,fzphzw,[deleted],-0.1027,Since I have invested I got curious about the future of bitcoin and resorted to reading up on time traveling stories This man claims Bitcoin will crash Is this possible,1586663394,5,1
216,fzphdu,Zaidinator7,0.0,How does an xpub derive all of the addresses that can be used to receive btc,1586663322,2,4
217,fzpedt,florentinoorrantia,-0.296,Should I stop simping to get more Bitcoin,1586662956,20,0
218,fzp60t,redditcoin69,0.0,Legacy Markets   seconds video,1586661970,34,811
219,fzof6j,cnguyen138,-0.5267,I got a bitcoin on Robinhood is that a stupid move,1586658883,19,0
220,fznrpg,EcoGEMClub,-0.5994,BTC is going to drop down hard again,1586656224,0,1
221,fzmxol,[deleted],0.0,Hold on to your sats,1586653013,8,0
222,fzlowo,oluisrael11,0.0,Bitcoin ATM gets to Africas largest country,1586648440,9,7
223,fzl5ss,KalEll66,-0.2755,Cash is not an Asset,1586646568,16,4
224,fzkt8p,plattinum817,0.0,Watch this,1586645300,0,0
225,fzkdto,OuTobiBG,0.0,How i make  per day from home,1586643682,0,1
226,fzk97a,jojorabbit11,0.0,Basic Bitcoin Stats,1586643200,5,0
227,fzk37m,johnzengin,-0.7184,How much did you sell maximum for which price and how much it would be today,1586642590,10,1
228,fzjflh,[deleted],0.0,Opinion,1586640174,5,1
229,fzjahp,LostCosmonauts,0.0,Getting a new computer  how do I take my BTC,1586639658,14,1
230,fzj3v5,flimbiscuit,0.0,Using a Visa Giftcard on Coinmama,1586638983,2,1
231,fzizjb,wojtekwasz,0.0,Here we go Isnt it simple,1586638551,2,0
232,fziw4k,chrisbenny3903,0.0,Selling Bitcoin PayPal ,1586638212,1,0
233,fziueo,soceity,0.0,There Are  Different Scenarios Where Bitcoin Will Go If Any One Thing Happens Remember Me I Am The First To Predict This,1586638038,69,102
234,fzitz4,thegrandknight,0.6369,My portfolio is getting a boost Thank you Canada,1586637992,35,21
235,fzijni,johnzengin,0.2732,Do You Know How To Create Transaction By Coding,1586637422,6,2
236,fzi9bu,Zlatan4Ever,0.0,Ren Protocol,1586636972,1,0
237,fzhk12,po00on,0.0,Compromised Seed Question,1586635875,15,0
238,fzhgwf,E-renter,0.7003,Any day you buy Bitcoin you have a  chance of seeing lower prices in lt year keep your powder dry,1586635752,10,0
239,fzh6m3,onderaydogan,0.296,Sign up for the Crypto money exchange,1586635352,0,1
240,fzfs5v,token_media,0.0,Bitcoin in Kenya  Ultimate HowTo Get Started Guide in ,1586633403,0,0
241,fzfljo,SandwichOfEarl,0.0,The Federal Reserve vs Covid xpost,1586633147,4,33
242,fzfh7z,Fabulous-Garbage,0.0,Hi,1586632984,0,1
243,fzfdlb,undadatunda,0.0,Venezuelans have a new way to send crypto without Internet,1586632841,5,14
244,fzfa1g,aymenboulgheb,0.891,hello everyone  is there anyone tried this website befor  is it honest  I watched a video on youtube shows that is honest  help please,1586632709,8,0
245,fxtw0c,DecryptMedia,0.3182,Bitcoin halving sees huge surge in search volumes,1586444339,8,2
246,fxtubv,Smooth-Fold,-0.4404,Helicopter Money Way out of Crisis or Fallacy of Traditional Economics,1586444178,12,5
247,fxtqhd,eida2023,0.0,Bakkts Former CEO Sells All Her Stocks After COVID Insider Trading Allegations,1586443800,0,1
248,fxtlog,wncx,0.0,bexpress,1586443303,0,0
249,fxtkze,420-AlDS,0.9001,Where do YOU buy you buy your bitcoin,1586443232,9,0
250,fxtk04,PTMDK,-0.5719,Bitstarz stealing more then ,1586443135,4,1
251,fxtit1,sebkoper,0.0,Rolling  based price alerts,1586443012,0,1
252,fxtgv9,sickpeltier,0.0,CB pro deposit time,1586442805,4,1
253,fxtfq3,Troflecopter,0.0,Trading halted for IPO on worlds first bitcoin fund,1586442692,2,1
254,fxtelp,nataschaortunoO,0.0,someone knows,1586442581,12,0
255,fxtci9,CryptoRoot,0.5719,Rofl,1586442367,4,4
256,fxt916,Ford456fgfd,0.0,Another  trillion from the Fed inflation to the roof while Bitcoin is halving,1586442008,0,1
257,fxt6ml,zimson-995,0.4404,Today might be a good day,1586441776,7,1
258,fxt438,WorkingLime,0.0,Venezuela update Last week  BTC UP from  were traded using LocalBitcoin which is around  Bs Bolivares ATH last week it was  Bs Minimum wage is around  USD per MONTH One BTC is  Bs from  Bs last week AMA,1586441532,51,1
259,fxt2nh,Orb1tal_,-0.3182,Isnt that kind of bad that were printing out more money for his stimulus check and writing another stimulus check for businesses,1586441398,9,1
260,fxt26m,ChangeNow_io,0.0, trillion is on the way Made a reminder for you on this occasion,1586441354,293,1
261,fxsycv,eleanor567,0.34,Crypto poker tournament with Charlie Shrem Tone Vays and others Anyone can play,1586440969,1,1
262,fxsxhu,Why_So_Serious123,0.3182,I have cashapp I need some BTC please hurry,1586440881,3,1
263,fxsu36,right-again,-0.2235,Why Bitcoin and similar cryptocurrencies are not money,1586440534,10,1
264,fxss5w,right-again,-0.2235,Why Bitcoin and similar cryptocurrencies will never become money,1586440333,0,1
265,fxsr7a,mostafa-khaled,0.2716,Time Preference is the most important economics lesson  Podcast Notes from Saifedean Ammous on OnceBITten,1586440235,1,1
266,fxsq5w,mostafa-khaled,0.0,Is Bitcoins Stock to Flow Model is becoming more accurate  Podcast Notes from PlanB on The Pomp Podcast,1586440122,5,1
267,fxsj5a,mblight11,0.0,Bybit,1586439362,2,1
268,fxscmv,TheOGKingOfPop,0.0,Bitcoin buyingselling How do I start,1586438615,40,1
269,fxsbz3,nugget_alex,0.0,Bank Of England Helicopter Go Brrrr,1586438546,26,1
271,fxs9eq,Lumin8_Crypto,0.6249,Bitcoin News Today India  Increase In Bitcoin Trading Crypto Charity Poker Bitcoin Poker and Satoshi Nakamoto,1586438261,1,1
272,fxs85k,Sandboxeaa,0.5859,Rich Dad Poor Dad Author Says Put your Trust in Bitcoin,1586438125,1,1
273,fxrxz8,eeddeedde,0.0,Fed unveils details of its muchanticipated Main Street lending program,1586437001,4,1
274,fxrwhj,rtsll,0.0,University lecturer explains the economics behind the crypto mining,1586436831,0,1
275,fxrrit,answermetero,0.4939,My friend just gave me  in bitcoin to start what do I do now,1586436265,37,1
276,fxrmns,Sandboxeaa,-0.3818,Could Bitcoins PostHalving Dump Mitigated by Covid,1586435677,3,1
277,fxrk6d,Semitistik,0.0,btc atm nycfees,1586435360,1,1
