,id,author,vader,title,created_utc,num_comments,score
2913,g11j34,BitcoinBoffin,0.0,Bitcoin Adoption and Conways Game of Life,1586851533,4,2
2914,g11hbv,IndividualThoughts,0.0,Can you use any USB cable to connect a trezor,1586851278,4,5
2915,g1194c,nopara73,0.0,Wasabi Research Club   Anonymous Credentials,1586850084,0,22
2916,g110qp,anonymous29912991,0.0,Forgot blockchain password and phrase,1586848894,7,0
2917,g10v0v,imjunpark,0.0,which exchanges do you use,1586848107,13,5
2918,g10szm,Lass3BTC,0.5994,Riskon Asset or Store of Value Bitcoin Outperforming Banks and Payment Processors,1586847847,1,0
2919,g10rk9,rBitcoinMod,0.0,Daily Discussion April  ,1586847657,132,17
2920,g10qnl,user574007,0.0,I bought my first  Bitcoin today I know its not much but its just the beginning,1586847527,241,1251
2921,g10pki,[deleted],0.4019,someone ask me to help him withdraw his bitcoin,1586847380,1,1
2922,g10p94,Ramdhanisaefulloh,0.1139,Come Look into this WhatsMiner M LAUNCH EVENT guys dont miss it  Twitter  WhatsminerMBT Tg  whatsminercommunity,1586847331,0,2
2923,g10jj5,atnake,0.0,Is it too late to recover my bitcoin from Mt Gox,1586846562,2,3
2924,g107b4,[deleted],0.0,BTC available on Go CryptoMarket  compare realtime prices on different exchanges,1586844898,0,0
2925,g10663,Elizxer,0.4019,Bitcoin mining with cooler and leave by the balcony good idea,1586844730,10,0
2926,g0zt7q,RileyWH,0.0,WHO DO I USE,1586842979,20,3
2927,g0yxm3,jbray1,0.4215,Bitcoin  the natural pivot towards greed and power is exactly why Im long,1586838870,1,0
2928,g0yvhc,[deleted],0.0,For my AnCaps out there,1586838620,0,0
2929,g0yeds,[deleted],0.0,Mayer Multiple,1586836670,1,0
2930,g0yeci,[deleted],0.765,Best Average Monthly Gains for Bitcoin came in April amp May,1586836666,1,1
2931,g0xydx,[deleted],0.0,Bitcoin Network Status Update Monday April  ,1586834833,0,1
2932,g0xwoh,kyletorpey,0.4201,Bitcoin Has Outperformed All Other Major Asset Classes Over The Past Year,1586834647,3,13
2933,g0xp07,coincodecap,0.2023,Top  Softwares for Managing Bitcoin Mining,1586833739,0,0
2934,g0xgpe,[deleted],0.0,API for Crypto News Metrics,1586832790,0,0
2935,g0x8fl,adamjonasbrother,0.0,Why ALPHABET will be the breakout stock of the year,1586831817,2,0
2936,g0x7sg,[deleted],0.0,Coinbase always spams me with codes everytime I try to login,1586831748,0,1
2937,g0x36d,[deleted],0.0,Selling bitcoin,1586831225,7,2
2938,g0wrna,Sweaty_Draw,0.0,Need OPSec advice,1586829942,11,4
2939,g0wcay,69676f72,0.0,Whats the next Bitcoin,1586828311,9,0
2940,g0vuxf,[deleted],0.5267,What is the Richest Bitcoin Address,1586826519,6,0
2941,g0vui3,Kinolva,0.0,I found my Citadel,1586826474,13,1
2942,g0voqn,[deleted],0.0,How did someone not raid Gerad Cottens house,1586825881,2,3
2943,g0vnq1,0103630001,0.3182,I got Valid bank logs CcCvv DumpsDumps with pinsDoing willPayPalCashappWire and bank transfer at cool rate Now pm me on Telegram Bosstana Textnow  ,1586825773,0,1
2944,g0vbia,dont-listentome,0.4588,Important properties of money I keep forgetting them So Im just gonna post it here,1586824530,6,5
2945,g0ut0h,Balthiery,-0.8402,Are BTCrecovery services scam For those who fell for Bitclub Networks Ponzi Scheme,1586822639,3,0
2946,g0uk9y,Wade12323,0.3612,Investing in Bitcoin be like,1586821757,17,130
2947,g0uiyb,Mistermathman,0.0,Bitcoin only does one thing,1586821628,6,1
2948,g0u1n1,fabito40,0.0,VIDEO GRATUITO,1586819897,0,0
2949,g0u1in,jiar300,0.7184,How I teach kids to buy bitcoin,1586819885,9,50
2950,g0tvdp,djsoundmoney3,0.4588,Any long term users of Coinkite Coldcard are you still using it have you changed to something else,1586819300,9,9
2951,g0tru4,IntelCorei420,-0.128,What its like to short bitcoin bottoms,1586818981,0,1
2952,g0tke1,dan_held,0.0,Bitcoin was priced correctly in          ,1586818275,19,32
2953,g0sp8g,6955113068,0.0,Tamron mm f VC USD lens review,1586815409,1,1
2954,g0sj7a,patrickMouse,0.0, hours of live crypto ,1586814866,0,0
2955,g0sfnm,BitcoinRebelRouser,-0.5719,We anticipate the worst economic fallout since the Great Depression  International Monetary Fund,1586814541,9,67
2956,g0sbr4,[deleted],0.0,Yup,1586814184,0,1
2957,g0s9zo,Meta_Modeller,0.4939,Max Keiser explains why only gold silver and bitcoin can save you now,1586814026,10,0
2958,g0s2yt,Sauudhaarees,0.0,Investment,1586813393,0,1
2959,g0s1s3,BashCo,-0.4404,Cryptoconomy Read  Dont be Misled by Red Herrings  Treatise on Bitcoin amp Privacy Part  Giacomo Zucco,1586813283,1,10
2960,g0rtib,Ezwar,-0.4767,Ledger Live on PC always shows the wrong price,1586812540,9,3
2961,g0r6ff,reuben_crowder,0.0,What happened to Bitcoin Network Status Update,1586810494,2,8
2962,g0q7xi,[deleted],0.836,Is bitbns safe to buy Bitcoins,1586807369,1,1
2963,g0q678,SayNoToCoinbase,0.0,Anyone else having Visa payment issues to their exchanges,1586807212,5,1
2964,g0q0e7,norfbayboy,0.6908,Visa Is About To Make Bitcoin Spending Easier And Better,1586806693,5,9
2965,g0p5sd,sstackzz,0.0,Can the blockchain ever be turned off,1586804011,8,1
2966,g0p5l6,wunderbit_co,0.0,BTC is going DOWN,1586803995,1,0
2967,g0oza1,gparriott,0.0,Blockfi,1586803456,9,8
2968,g0oyuu,bswen,-0.8591,George Washington  Paper money has had the effect in your state that it will ever have to ruin commerce oppress the honest and open the door to every species of fraud and injustice Jerome Powell ,1586803419,48,115
2969,g0otq2,CoinCompassBTC,0.0,Bitcoin amp Markets Update for  April  Bitcoin Prosperity Podcast,1586802984,0,0
2970,g0ok0y,dtlars,0.0,Take time for BTC,1586802172,5,8
2971,g0ogie,[deleted],0.6369,What Category Best Describes Your Political Beliefs,1586801882,0,1
2972,g0oes2,208_nate,0.6807,Almost k views on our Bitcoin short THANK YOU This community is the majority of those views and the comments have been so encouraging,1586801744,79,221
2973,g0oasc,tldr-hodl,0.0,Monday Art  Victory,1586801408,1,2
2974,fx26ig,SatoshiHouse,0.0,Tim Draper Pandemic Could Be The Tipping Point For Bitcoin,1586331837,1,1
2975,fx23ix,sahiluppal4k,0.4215,True content,1586331426,2,1
2976,fx1nuv,rBitcoinMod,0.0,Daily Discussion April  ,1586329255,63,1
2977,fx1lko,longhashglobal,0.4404,Blockchain for Good  Virtual Hackathon,1586328951,0,1
2978,fx16vb,Bison-indatent,0.7845,Cryptopia Account Holders won Lets take a moment to honor Peter Watts QC Counsel for Acc Holders and the judge David Gendall,1586327004,17,1
2979,fx0yy4,intothecryptoverse,0.0,Bitcoin Eyeing the  week  or  week ,1586326006,1,1
2980,fx0yt4,himadri-saha,0.4939,Bitcoin has made an impressive recovery since the big crash last month further cementing its status as a safe haven asset in times of adversity,1586325989,0,1
2981,fwzsil,surajsomish1133,0.0,Blockchain  A crucial skill in the postlockdown world,1586320411,0,1
2982,fwznum,MKBtravel,0.0,Here we goPrice Testing at ,1586319793,1,1
2983,fwzhft,Shaggy_insomniac,0.0,Me waiting for bitcoin to go below k again after selling my kidney to invest,1586319018,15,1
2984,fwzdhg,Crypto-Angel,-0.3818,Bitcoin Whale World is in for Biggest Economic Shock in Generations,1586318563,0,1
2985,fwzc3g,MKBtravel,0.0,Any Idea,1586318398,22,1
2986,fwz9jn,ByteBulls,0.0,Bitcoin Spikes by x in  Days Whats Actually Behind the Big Rally,1586318081,0,1
2987,fwz8p3,LightningPlus,0.0,Keiser Report  Quantitative Hardening  Simon Dixon on Bitcoin  E,1586317972,5,1
2988,fwyt09,3DPrintGeneral,0.0,After roughly  years my buddy who had roughly  when Crypsty shut down far more now obv just got his settlement check,1586316066,75,1
2989,fwyop9,fsuboi2015,0.0,Quarantine beer gone,1586315563,0,1
2990,fwymkd,Indels,0.0,Didnt receive BTC sent to legacy address,1586315331,18,1
2991,fwyh9v,anon2414691,0.5423,Musical Chairs Please provide feedback or share if its shareworthy Maybe if it goes viral it will actually have an impact,1586314732,0,1
2992,fwygff,asterisk___,0.4588,Asterisk Public call for philanthropic funding crowdfunding,1586314628,1,1
2993,fwy90y,cryptofan101,0.4019, Smart Ways To Bet On The Upcoming Bitcoin Halvening With Options  Sparrow  Trade BTC amp ETH options,1586313802,0,1
2994,fwxm56,Amichateur,0.0,How many lightning shops are there today More than  I am asking because of this bet  months ago,1586311263,19,1
2995,fwx5ib,kingscrown69,0.4404,Creative Bitcoin amp Cryptocurrency Things to do During COVID Pandemic,1586309474,0,1
2996,fwwvxg,annagalias,0.0,Trade BTC ETH and XRP using Bexpress Pro,1586308438,0,1
2997,fwwflw,Public-Discipline,0.0,Chcesz kopa darmowe Bitcoiny dziki swojej przegldarce  Zapraszam ,1586306606,0,1
2998,fwwavw,PrimeCoinz,0.5766,BITCOIN NEW ALL TIME HIGH IN  Says Bobby Lee,1586306131,3,1
2999,fwwaol,copenhagen_bram,0.296,Has anyone tried making open source physical money,1586306112,10,1
3000,fwvoph,EmilySunders,0.6369,Bitcoin is perfectly adapted to the current situation,1586303800,0,1
3001,fwvhde,djmedakev,-0.3182,BTC and fees Im confused,1586303103,21,1
3002,fwv71g,oksigen,0.5267,Hodlers congrats,1586302085,1,1
3003,fwv6rw,hornedviper9,-0.7717,yrold White Kid shot dead two black suspects sought,1586302059,0,1
3004,fwv440,rafaelagp,0.0,Linux Cli with Web Front End,1586301790,12,1
3005,fwuv0k,Jknoccin0,0.0,Private key,1586300903,23,1
3006,fwuo5s,Crypto-Angel,0.0,Ray Dalio Still Thinks Cash Is Trash as Printing Presses Roll,1586300219,12,1
3007,fwuhgz,hornedviper9,-0.3818,Muslims threaten Hindus in Birmingham,1586299566,5,1
3008,fwuguu,unknownbtc,0.3612,Trading btc be like,1586299504,159,1
3009,fwu3h2,sizzy905,0.0,Hello,1586298201,0,1
3010,fwtt4d,FrequentAgency,0.05,Why do you think bitcoin is safe Sorry Satoshi is not safe as you think,1586297255,49,1
3011,fwtl1o,bolu_dfs,0.0,Kraken Scummy Behavior,1586296501,8,1
3012,fwtisg,BashCo,0.0,Bitcoin RapidFire Didi Taihuttu Sold All His Possesions Invested in Bitcoin and Started The Bitcoin Family,1586296291,1,1
3013,fwt4rv,frankflemming,-0.3182,Is This A Bitcoin Scam Help,1586294989,20,1
3014,fwsur4,HarleySilverWolf,0.0,How Bitcoin Was Born amp Why TOKEN TALES Animation,1586294052,1,1
3015,fwsia5,refercoins,0.0,Earn Bitcoin With Your Social Media,1586292899,0,1
3016,fwser8,florravenna,0.4939,Save up to  in fees with Muuns new mempoolbased estimator,1586292571,1,1
3017,fwscm8,quellofool,-0.6124,Watch out for the new Elon Musk Fund scam,1586292379,1,1
3018,fws9ma,vivian-ramirez,0.0,The cextrade familyinvestmentcrypto,1586292106,7,1
3019,fws72h,trailblazer087,-0.4588,Bitcoin short from ,1586291866,1,1
3020,g3znsp,CorrectPoetry0,0.0,I did a thing the other day and Im actually going to hold it this time,1587262004,7,5
3021,g3zh6f,watoshinakaboto,0.0,fiat vs bitcoin,1587261210,2,0
3022,g3z550,[deleted],0.0,Toss a coin to your Witcher ,1587259756,6,0
3023,g3ys42,HolaGold,0.0,trading bot,1587258236,0,1
3024,g3yju8,abercrombezie,-0.4767,Imagine  of Binance trades being Fake,1587257265,10,5
3025,g3yile,AugustHeat87,0.2023,These Were The Top  Bitcoin Memes In  Do They Still Hold Up,1587257118,2,1
3026,g3y0ib,ijaz209,0.0,advertisment on rBitcoin is possible,1587255067,3,1
3027,g3xqwo,PrettyCandidate,0.4404,Bitcoin trading  am I being too conservative with  profit,1587254008,17,0
3028,g3xh9v,goldencryptopro,0.0,Dm,1587252983,2,2
3029,g3wmc3,bryguypromotesPI,0.0,Pi Coin,1587249683,0,1
3030,g3wm3r,kvngs1,0.4939,Be the sunshine,1587249659,2,1
3031,g3wivj,Gunnerud,0.8807,Where is the best place to buy BTC,1587249328,16,2
3032,g3wdyp,MorphMorph,0.0,Bitcoin Halving  ShortSleeve Unisex TShirt,1587248818,0,1
3033,g3wbbm,Boriz0,0.0,My first article about Bitcoin costs  over LN to unlock,1587248536,9,2
3034,g3w9b2,burgosamovar,0.0,GreatAmericanMining on Twitter,1587248329,0,0
3035,g3w4ba,YourBabyWhale69,0.0,Heres a video explaining how the government is protecting us through this pandemic and why Bitcoin is the antidote ,1587247809,16,34
3036,g3w1b5,[deleted],0.0,Heres a video explanation of how the government protecting us through this pandemic and why Bitcoin is the antidote ,1587247501,0,1
3037,g3vyme,pingpongplaya69420,-0.3818,What is the consensus of BTCs USD price being manipulated solely by bitfinex,1587247223,5,0
3038,g3vtrv,MrElFranko,0.0,What are your opinions on Proof of Stake,1587246733,34,0
3039,g3vk5a,vaibhavparnalia,0.3818, hours to clear a check deposit Modern banking system is inefficient,1587245763,297,40
3040,g3vcow,bitcosar,0.0,Bitcoin  Bin Dolara kabilir,1587245008,1,0
3041,g3vbxe,playboy0071,0.34,What stops the top mining pools join together and hijack the network,1587244931,19,0
3042,g3v9z1,oguzhan4806,0.0,Will Bitcoin fall or rise,1587244738,3,0
3043,g3v3ws,Skippaayy,0.7003,Is buying an SJ profitable or a good idea,1587244119,16,2
3044,g3v2fx,herzmeister,0.6187,Is this what life in a Bitcoin  Citadel  is going to look like  The Bitcoin Castle  Awesome crimemysterydark comedy shortfilm  German but English subtitles now available,1587243978,4,3
3045,g3utva,CorrectPoetry0,0.7579,United States West Point Mint Closes Indefinitely making precious metals harder to obtain,1587243131,10,3
3046,g3ugke,cryptovaultincome,0.6037,UPDATE ON METP  From  TO  ABOUT TO ROCKET,1587241822,0,0
3047,g3ufun,NZSGFTW,0.0,Bitcoin halving search in google trends now triple what it was in ,1587241748,29,18
3048,g3ufg9,[deleted],0.0,Bitcoin halving search in google trends more than triple what it was in ,1587241707,0,1
3049,g3uey3,[deleted],0.0,Hodl  Hodl,1587241660,2,1
3050,g3u509,[deleted],0.0,New User How do I actually get a bitcoin that I can spend,1587240694,19,2
3051,g3u43x,VampireVlad,0.34,Bitcoin is actually faster than all altcoins if we consider security as the main criterion,1587240602,27,18
3052,g3tprk,KalEll66,0.0,The Creature from Jekyll Island,1587239208,6,4
3053,g3td2j,__Lumpy__,0.0,A case for privacy coins,1587237959,2,2
3054,g3t8kc,riskhash,0.0,What are you expecting after halving,1587237531,43,10
3055,g3sw6u,koinkafasi,0.296,En ok Kazandran Kripto Paralar   ,1587236362,1,1
3056,g3snxi,psycholioben,0.6808,Id like my stocks and other information assets to have the same or similar security and properties of bitcoin possibly held on the same or a parallel blockchain,1587235562,3,2
3057,g3sc8e,pecheverri,0.0,wire transfers from coinbase pro,1587234427,0,1
3058,g3sabl,dan_held,0.296,Bitcoin is the apex predator of money,1587234239,69,2
3059,g3rv9s,nerviosus,-0.2235,Whats your opinion on Mises Regression Theorem on why Bitcoin is not money,1587232790,6,0
3060,g3rsaz,Crypto-Guide,-0.6124,Just another PSA If you search on the Chrome Web Store for Ledger Live everything you find is a scam Same ones that I covered last week are back up again And will probably be up for a at least a little while before getting removed Being your own bank is a big responsibility,1587232503,3,15
3061,g3r95e,LightningPlus,0.5423,Bonus Livestream Session  Lightning  Andreas Antonopoulos,1587230621,1,14
3062,g3r7ij,getitletson,0.0,Why is there blocksize limit but not a blockchain size limit,1587230458,11,0
3063,g3r272,thewifigenie,-0.2323,Forex Community  Join this discord to learn how to make residual income and income from trading ,1587229935,1,1
3064,g3r1ft,giabanga,0.3182,The Everything Bubble might have popped amp that could be huge for crypto Took me a while to compile the  sources Forbes Reuters Ray Dalio Financial Times,1587229860,16,14
3065,g3qqo8,stonksmarket,0.25,What do you think would happen to Bitcoin if they gov created FederalReserveCoin,1587228840,9,0
3066,g3qp1m,dan_held,0.0,Each Bitcoin owner is an individual Fort Knox,1587228676,9,4
3067,g3qo1p,tinny_og,0.0,Purchasing Bitcoin,1587228579,15,1
3068,g3q7mn,jam_55,0.0,Investing in bitcoin,1587226989,0,0
3069,g3q6ep,btcmiss,0.0,Hashrate Explodes  Higher In Past Month,1587226872,1,2
3071,g3q5xv,[deleted],0.0,Hashrate Explodes  Higher in Past Month,1587226826,0,1
3072,g3pzcw,odonnellnoel,0.0, Green  Red,1587226167,2,0
3073,g3ptlt,crypto_bot,0.0,Bitcoin Network Status Update Saturday April  ,1587225615,0,0
3074,g3pssf,WorkingLime,0.0,Venezuela update Last week  BTC DOWN from  were traded using LocalBitcoin which is around  Bs Bolivares ATH last week it was  Bs Minimum wage is around  USD per MONTH One BTC is  Bs from  Bs last week AMA,1587225533,58,2
3075,g3pmch,sylsau,-0.5204,Does Your Fiat Money Still Have Any Value Short answer No Buy Bitcoin,1587224869,10,1
3076,g3pib0,statoshi,-0.4939,How the SEC Nearly Destroyed my Retirement Account,1587224450,8,1
3077,g3p8o0,Patagonia246,0.0,When the  inflates x faster than bitcoin,1587223468,7,2
3078,g3p7kt,[deleted],0.0,When the dollar inflates over x faster than bitcoin,1587223350,0,2
3079,g3p53n,Palpatine88888,-0.3182,Can a person recover lost bitcoins and claim the coins for themselves,1587223102,15,1
3080,g3p2k7,BashCo,0.4588,Tales from the Crypt  Marshall Long,1587222841,0,1
3081,g3oux0,letsgetbit,0.0,Me on the phone with the government this morning,1587222048,0,1
3082,g4s449,financeoptimum,-0.6369,The Feds Losing Battle with Technological Deflation,1587386714,13,1
3083,g4rtmr,BatMelk,-0.1531,It is well enough that people of the nation do not understand our banking and monetary system for if they did I believe there would be a revolution before tomorrow morning Henry Ford pencil and airbrush on paper x april ,1587385430,3,1
3084,g4rqqc,MK333666,0.0258,BitMEX donated   million to support the fight against COVID,1587385078,24,1
3086,g4rexj,chadrbanks,0.4019,CryptoButter Daily Update China Announces New BSN Chain Smart Contracts Galore Singapore Tax Breaks US Investors Beware,1587383597,0,1
3087,g4rbcm,BashCo,0.4215,Honey Badger Diaries Episode  Sunny Ray Not In India Anymore Apparently,1587383132,0,1
3088,g4r9nw,Roy1984,0.0,Famous Investor Tim Draper  Governments Have To Switch From Control To Service,1587382918,4,1
3089,g4r3at,Koss_Nadaram,0.0,Minerium,1587382117,1,1
3090,g4r1ne,hassan112232,-0.7804,Try to not laughing  funny animals fails,1587381900,1,1
3091,g4qv05,Bitcoin_to_da_Moon,0.296,The Money Taboo That Central Banks Have Shied Away From So Far,1587381061,1,1
3092,g4qso6,coincodecap,0.765,Bitcoin Save and Gain,1587380755,0,1
3093,g4qq32,Squeaky-Bed,-0.4767,TMobiles response  months after SIM Swap Attack,1587380426,11,1
3094,g4qksk,GamingChamster,0.0,Defrosting the economy in the USA is starting,1587379631,0,1
3095,g4qhbb,GamingChamster,0.4019,Peoples Bank of China yes were testing the digital yuan,1587379094,0,1
3096,g4qbud,heavenswordx,-0.4404,Controversial opinion Tether is causing BTC price to remain artificially low,1587378245,2,1
3097,g4pta5,blockchaincenter_de,0.2415,Is Bitcoin really an uncorrelated assets I made a live tool that monitors correlation with gold and stocks,1587375508,48,1
3098,g4pt7o,skynetwardog,0.0,What you think guys about this graph,1587375499,5,1
3099,g4psae,8btccom,0.0,China Crypto Roundup April April  Chinas Ahead of the Game with Digital Yuan Kicks into Action,1587375356,1,1
3100,g4polr,VSAlpha,0.0,Every day that passes,1587374813,1,1
3101,g4pitp,coincodecap,0.2732,Public Perception of Coming Bitcoin Halving Increased Cryptocurrency Social Sentiment Volatility,1587373967,0,1
3102,g4pf8n,TheTesseractAcademy,-0.1531,How has COVID affected cryptocurrencies and is this the right time to invest,1587373451,1,1
3103,g4pd36,cryptotraderking,0.5994,Litecoin will outperform Bitcoin in  Bull market and heres why Jan  bitcoin  litecoin   July  bitcoin  litecoin   March  bitcoin  litecoin   Future Prices Bitcoin  Litecoin   btc bitcoin ltc litecoin,1587373128,0,1
3104,g4p2y4,ImAFlyingPancake,-0.5574,What happens if an exchange goes bankrupt,1587371567,19,1
3106,g4onks,fordexplorerzzz,0.1511,Got my bitcoin instantly Never got charged for it,1587369366,3,1
3107,g4oj1j,gokumarketofficial,0.2023,Explore the Top  NEM XEM RealWorld Use Cases With GokuMarket,1587368714,0,1
3108,g4oj02,CryptoBK365,0.4588,Bitcoin Price Prediction  Can Bitcoin Break  in  BTC Price Forecast,1587368709,4,1
3109,g4o9cd,Air-minem,0.0,Buying Bitcoins in South Korea,1587367297,5,1
3110,g4o4v1,InteractiveNeverUsed,0.7003,I had to start somewhere I just hope this is a good sign,1587366655,7,1
3111,g4o0dt,rBitcoinMod,0.0,Daily Discussion April  ,1587366059,36,1
3112,g4nyo4,hodler_by_nature,0.4019,Looking to talk to people who are interested in using Bitcoin in Ecommerce,1587365821,1,1
3113,g4no12,bekind1989,0.34,Twitter dude earning kyear excited about stacking USD in BTC over  months receives more than USD in donations in hrs,1587364308,3,1
3114,g4ndq2,Voscovius,0.6369,When is the best time to invest in some Sats,1587362871,8,1
3115,g4ndd1,tarima24,0.0,Crypto Investment,1587362825,0,1
3116,g4n4su,letsgetbit,0.0,The Halvening is near BTC Halving   Neva Fomo meme blog,1587361616,1,1
3117,g4n3qo,passio-777,0.8268,QRYPTOR  Most friendly user interface to Encrypt physical data as seed or Private Key It will work offline and be open source My goal is to make this tool accessible for those who are novices with computers systems and encourage people to encrypt easily the private key they keep at home,1587361459,0,1
3119,g4n14g,Karmaa,0.5859,Ive always felt like we are past the original rollercoaster ride and should have a new mascot,1587361088,2,1
3120,g4msvr,localpythondev,-0.3818,Lost bitcoin Serious question,1587359917,22,1
3121,g4mpwx,nullc,0.0772,In the US lost your job and selling long held Bitcoin to pay your bills Watch out for estimated taxes and underpayment penalties,1587359516,30,1
3122,g4mld9,Magic_Turtle23,0.4019,I need guidance and help ,1587358893,0,1
3123,g4mef7,stonksmarket,-0.033,Why doesnt Tether just print  trillion usdt like the federal reserve does,1587357957,1,1
3124,g4m0nd,CoinMan747,0.5859,xD,1587356137,2,1
3125,g4lznd,MeetMeAtGE,-0.7964, Chinese Men Arrested in Malaysia for Bitcoin Scam,1587356008,2,1
3126,g4lxpx,fabito40,0.0,DESCUENTO ESPECIAL HOTMART  Nuevo MegaPublicador Plus,1587355777,0,1
3127,g4lejr,koavf,-0.7096,Bitcoin stealer infected  libraries of major programming language  Decrypt,1587353422,4,1
3128,g4ldns,nrgardne,-0.0341,Is bitcoin not a charity for those with lesser shares,1587353309,3,1
3129,g4l45s,SubstantialPrint0,0.0,TRADE IN BITCOIN,1587352129,0,1
3130,g4kxcr,JeeJeegro,0.0,Because of Bitcoin I can finally fix my teeth,1587351319,32,1
3131,g4kwsm,brianddk,-0.128,HowTo Crafting an offline TXN with the trezorlib python API,1587351250,0,1
3132,g4kpd0,Tall-Saint,0.0258,Is it just me or has it been suspiciously quiet lately lol,1587350361,59,1
3133,g4kp5m,Tall-Saint,0.4728,Is it just me or has it been relatively quite lately lol,1587350338,0,1
3134,g4key1,HairyBig8,-0.5523,How come Empire Market doesnt allow the sale of weapons,1587349139,0,1
3135,g4kess,RRMine,0.0,RRMine discusses the Future of Bitcoin Mining ahead of Halving,1587349119,0,1
3136,g4ke7w,Crypto_Life_TA,0.6908,BITCOIN Could Go UP TO   Bullish Reversal Pattern Forming  BTC,1587349057,2,1
3137,g4jya2,OneBigPuddle,0.0,Blockchain router,1587347208,1,1
3138,g4jw1x,Scyfer007,0.34,Play Games for BitcoinETHDOGE,1587346959,0,1
3139,g4jje0,BitcoinBoffin,0.0,Jim Simons Medallion Fund Signals Entry Into Crypto Markets Ahead Of Historic Halving,1587345529,10,1
3140,g4jg8s,Cnblby,0.5574,Is Binance Trustworthy Binance Review ,1587345186,0,1
3141,g4j73r,spookiestevie,-0.3818,The final battle,1587344192,5,1
3142,g4j6t7,spookiestevie,-0.3818,The final battle,1587344160,1,1
3143,g4j3if,Ryan8000,0.0,Bitcoin,1587343783,12,1
3144,g4iwmh,DeadShot_76,0.0,Changelly decentralized,1587343026,5,1
3145,g4irx6,partyman08,0.7184,What buy orders are yall doing,1587342532,3,1
3146,g4ii1m,jackparishh27,0.0,Bitcoinnn,1587341483,1,1
3147,g4i82b,q8reda,0.4019,Anyone interested,1587340435,0,1
3148,g4hvyf,brianddk,0.0,Calculate txnid from raw txnhex,1587339163,6,1
3149,g4hkm7,rim922,0.0,Question where did everyone go,1587338007,1,1
3150,g4herp,CryptoRamble,0.0,Bitcoin Micropayments,1587337411,4,1
3151,g4hcp1,JonVici1,0.5994,Im a teenage game developer with an interest for bitcoin and a low tax roof and high tax rate,1587337206,6,1
3152,g4h3rt,kalucki23,-0.6124,StakedWallet Another Ponzi Scheme,1587336313,0,1
3153,g4gzpv,genieforge,0.4019,WCN Bitcoin Halvening Party,1587335911,0,1
3154,g4gxxe,mam5pcgamer,0.3612,New to crypto here Which exchange would you recommend,1587335730,5,1
3155,g4gvtv,garlickbagel,0.0,Whats the deal with mining contracts,1587335526,0,1
3156,g4gloa,jakov1212,0.0,Explanation needed,1587334503,8,1
3157,g4ghmq,Daly55582,0.4019,Someone help me out,1587334098,13,1
3158,g4gh0s,KelvinCastle,0.296,I just tried to explain what cryptocurrency to my parents Yeah Im never doing that again,1587334033,1,1
3159,g4gehn,msl2008,-0.4019,Physical vs paper price,1587333780,2,1
3160,g4gauz,kanzeka,0.7184,buy by bitcoin,1587333415,1,1
3161,g4g9dg,cam2711111,-0.4767,Bitstarz are refusing pay me and closed my account,1587333262,23,1
3162,g4g6n4,eida2023,0.0,Americans Are Buying Crypto With Their Stimulus Checks,1587333000,0,1
3163,g4g12c,mar4t2,0.0,Can I ask you ,1587332452,8,1
3164,g4fxah,NPZGaming,0.6605,A way to buy bitcoin with PayPal and more no KYC or other verification for as low as  and as high as ,1587332065,0,1
3165,g4fvs7,VertPal,0.7783,How to buy bitcoin with PayPal and more as little as  and as high as  with no KYC or verification,1587331919,0,1
3166,g4fme3,mare1999,0.4019,How can bitcoin help the economy,1587330982,2,1
3167,g2xqqb,uppitymexican,-0.6402,Technology challenged Fintech guru who compromised client data and couldnt save his emails wants  million of stupid money to maybe invest in blockchain technology,1587110937,1,2
3168,g2xq1r,milosbtc,0.0,Our First YouTube Video,1587110838,0,0
3170,g2xe2e,IrinaZenledger,0.0,How is COVID Going to Affect Crypto Markets,1587109196,0,1
3171,g2xb47,GiGi_GK,0.0,New crypto,1587108783,0,1
3172,g2xacq,1488Tucker,0.0,How to invest in bitcoin the right way,1587108685,0,0
3173,g2wuik,FavourKing,0.7845,Guys please can u help me with good informations about HOW BITCOIN MINING WORKS from your experience,1587106553,6,0
3175,g2wlw0,Pretend-Associate,0.0516,everybody complaining on Coinbase because the money on it are theirnot yours but has anyone ever been robbed or so by it,1587105409,17,1
3176,g2wlvn,88771133,0.0,Guyys i get payout  dollars,1587105407,0,1
