,id,author,vader,title,created_utc,num_comments,score
1091,fz377k,irr1tatedone,0.3612,For those looking to start crypto trading like me,1586604821,0,1
1093,fz30mj,Bklyn2DTLA,0.7184,As Of Today Where Can Someone In The US Buy BTC Instantly ,1586604181,16,1
1094,fz2m1w,polagon,0.8807,For beginners   of the best places to buy Bitcoin from,1586602725,0,1
1095,fz2itg,picopup,0.0,Trezor recovery question,1586602413,8,1
1096,fz2d4h,Chancholingo,0.0,Putting in my tax return,1586601811,13,1
1097,fz1nm9,BashCo,0.0,Bitcoin RapidFire RapidFire Didi Taihuttu,1586599226,0,1
1098,fz1lrd,kalangobr,0.0,I finally have  bitcoin,1586599041,11,1
1099,fz1jy2,eeddeedde,-0.6808,This community seems to either be antibitcoin or too dumb to know whats important Whats wrong with the mods,1586598870,6,1
1100,fz0ym6,talhaslimane,0.0,,1586596730,1,1
1101,fz0uol,ChoiceVariety8,0.3182,Make money by simply Doubling your bitcoins its  legit Im making money from it meaning any one can earn from it Hurry while bitcoin still low invest now before its late,1586596298,1,1
1102,fz0ebf,MrCrownnnnn,0.0,Get out of the system with Bitcoin Gold and Silver,1586594652,1,1
1103,fz07ls,AlcoholicJoe,0.0,Would bitcoin holders get hunted down in the future,1586593994,7,1
1104,fyzvdr,plattinum817,0.4019,Support a Husla,1586592825,0,1
1105,fyzu1h,DT7890,0.6249,HappyChineseNewYear with Up to Ten Times of Mining Profits Also share hashrate that worths  million CNY,1586592694,0,1
1106,fyzqu0,Ashkan0666,0.0,BITCOIN,1586592399,0,1
1107,fyzbb3,jadekhan103,0.7269,Top  Richest Bitcoin Owners and Their Net Worth,1586590877,0,1
1108,fyz9br,bdangh,0.4215,I just want to leave this here if someone interested in how far bitcoin gambling evolved,1586590667,6,1
1109,fyyv82,CoinCompassBTC,0.765,Bitcoiners please share with your newbie friends family nocoiners amp precoiners What is Bitcoin mining Bitcoin Basics Podcast,1586589282,0,1
1110,fyymbm,rBitcoinMod,0.0,Daily Discussion April  ,1586588445,87,1
1111,fyy8tn,sejwa,0.0,bitcoin  matrix HODL crypto,1586587109,30,1
1112,fyy86m,buri220171,0.0,Bitcoin future,1586587035,7,1
1113,fywyg1,Lurlerrr,0.0,Bitcoin printer go ohmmm FIXED,1586581642,3,1
1114,fywumd,satoshis_virgins,0.0,Satoshis Virgins releases their first song about Bitcoin,1586581171,3,1
1116,fyw287,forde250,0.0,Reddit point system using the other coin,1586577726,6,1
1117,fyvu1u,StockAcanthocephala0,0.0,         ,1586576788,0,1
1118,fyvqq0,sgtslaughterTV,0.0,Does any reputable economist have a Forecast on the future of the dollar in  to  years,1586576396,6,1
1119,fyvm0g,nowitsalllgone,-0.296,Anonymous trustminimized noKYC lending in bitcoin A Proposal no implementation yet,1586575841,4,1
1120,fyv9de,Jadencallaway,0.0,How do you think Bitcoin will react to  million Americans getting ,1586574419,12,1
1121,fyufso,bitcoin-bull,0.0,Bitcoins Tight,1586571482,3,1
1122,fyu4mb,R_wild,0.8807,Best way to buy bitcoin with AUD,1586570254,6,1
1123,fyu0yy,-raj_kumar-,0.0,Bet you cant watch this only one time  From AlexDanco,1586569863,6,1
1124,fyts28,ordinarymudafuka,0.0,FUTURE OF BITCOIN,1586568904,18,1
1125,fytn39,AltAccount896,0.0,Does anyone here follow Crypto R Us on YouTube Why was his channel terminated,1586568368,0,1
1126,fytman,Abhirajsethi,0.0,Bitcoin Storage,1586568281,12,1
1127,fyta7m,SirLavish,0.0,I Dont Know About You but Seeing All this Whale Movement Makes Me Think BTC is Not As Decentralized as We Think,1586566995,44,1
1128,fttf9b,spookiestevie,0.0,CHOP CHOP IN  DAYS,1585857876,2,1
1129,ftt804,jesusjesusabrams,0.296,Oh yeah  in a day Lets check that account ,1585857243,2,1
1130,ftt7vf,adam3us,0.296,a new bitcoin centric stable coin model from bullbitcoin LCAD respendable canadian dollar redeemable only for Bitcoin,1585857230,16,1
1131,ftt2eg,WalterTheWhitest,0.0,H PayPal W BTC,1585856743,0,1
1132,ftsz04,IronBallsMiginty,0.0,Ledger incoming,1585856434,9,1
1133,ftsx8y,FlickItAgain,0.0,When you see  in  mins,1585856268,0,1
1134,ftsvx8,Fiat-Lux00,0.0,Bitcoin sentiment picks up again,1585856147,0,1
1135,ftspzd,BadNerfAgent,-0.4019,Is anyone having trouble with coinbase pro atm,1585855600,0,1
1136,ftsgzy,BashCo,-0.6739,Citizen Bitcoin Ben and Collin WTF Happened in ,1585854773,0,1
1137,ftsglt,chainclash,-0.3612,Crypto Celebrity Fighting Game is now live  Does the BTC Clan have what it takes,1585854736,0,1
1138,ftsf1u,hitendrakhalasi,0.0,Bitcoin Black Coin,1585854598,0,1
1139,ftsd26,areddituser46,0.0,Binance to Launch Bitcoin Mining Pool  TheCryptoAssociate,1585854418,0,1
1140,ftscs3,DutchZ33,0.1027,Stop profiting pussies,1585854388,0,1
1141,ftsa0r,roasbeef,0.0,Announcing Faraday Tame your Lightning Node with Close Recommendations,1585854139,24,1
1142,fts4pf,roasbeef,0.0,Announce Faraday Tame your Lightning Node with Close Recommendations,1585853665,0,1
1143,fts2tz,Fiach_Dubh,0.0,Pomp Interviews Billionaire Chamath on Bitcoin Pensions amp COVID Macro Effects  April nd ,1585853501,0,1
1144,fts2og,NZSGFTW,0.507,Some simple TA This aligns roughly near end of  the same time span as was from last halving to ATH I am no expert so would love to hear your guys thoughts,1585853487,8,1
1145,ftrwog,ponybreath,0.6597,SoundCloud is taking suggestions for payment types to help support artists,1585852947,0,1
1146,ftr79o,Synalization,-0.7184,Sell,1585850716,0,1
1147,ftqs58,keepitraul,0.0,This is how it feels to own Bitcoin right now,1585849365,0,1
1148,ftqnh5,rachidafr,0.7184,The Decision to Buy Bitcoin Depends on Individual Awareness First and Foremost,1585848943,0,1
1149,ftqng3,weeklypaisa,0.0,Gold XAUUSD Technical Analysis nd April  Forex Trading by Elliott Wave Analysis Forex Signal,1585848940,0,1
1150,ftqmgq,juansgalt,0.0,Bitcoin is now over ,1585848853,3,1
1151,ftq76h,vickytcscanada,0.87,Time to Moon BTC GRIN,1585847520,0,1
1152,ftq4nc,rezivor,0.4588,Welcome back Bitcoin,1585847293,9,1
1153,ftq395,At0m11c,0.0,Bitcoin ,1585847175,0,1
1154,ftq251,Lomofre88,0.0,Its over  ,1585847079,102,1
1155,ftq0d0,WorkingLime,-0.6249,Venezuela update Last week  BTC down from  were traded using LocalBitcoin which is around  Bs Minimum wage is around  USD per month One BTC is  Bs Bolivares AMA Worldwide crisis,1585846928,21,1
1156,ftpuj4,Alh12984,0.0,Freebitcoin,1585846427,1,1
1157,ftprhr,2Panik,0.0,Craig Wright Victorious in Kleiman Case After Signing with Satoshis Key,1585846176,0,1
1158,ftpkya,beastmode12310,0.4588,Break ,1585845568,0,1
1159,ftpgv2,Juice_Daniels,0.0,Is Coinbase Not Working For Anyone Else,1585845182,0,1
1160,ftpc7m,sangymalhotra,0.0,Mobikwik to Offer  Million Indian Users Direct Cryptocurrency Trading Via Buyucoin Integration  Exchanges Bitcoin News,1585844755,0,1
1161,ftpbfz,spiffyXD,0.0,Blockstream CEO Explains Why Next Bitcoin Halving Is QuantitativeHardening,1585844686,2,1
1162,ftp926,crypto_bot,0.0,Bitcoin Network Status Update Thursday April  ,1585844469,0,1
1163,ftp5sj,WaggishNickel,0.4767,Bitcoin relief rally Is it time to become a contrarian Newsletter,1585844173,0,1
1164,ftoyfh,ibrooo777,0.4404,Bitcoin Profit Sverige,1585843500,0,1
1165,ftoucy,Cryptowake,0.0,Satoshi Privacy  Crypto Wake Up  Daily Bitcoin News amp Cryptocurrency Analysis Today,1585843142,0,1
1166,ftosa6,ibrooo777,0.0,vad r bitcoin,1585842949,0,1
1167,ftocwy,CryptigoVespucci,0.0,BitcGo CEO Bitcoin is not a hedge against the stock market performing poorly bitcoin is not a hedge against the coronavirus Bitcoin is a hedge against the US dollar and inflation,1585841531,6,1
1168,ftnwal,CrashesWorldTV,0.0,Bitcoin trading without verify identity,1585839937,0,1
1169,ftntbn,cryptograffiti,0.5106, Strong ,1585839645,13,1
1170,ftngf5,SaneFive,0.0,Revolut brings Bitcoin to all of its  million users,1585838355,8,1
1172,ftn8io,whynotmranderson,0.3818,Survey Crypto Wants Stronger Response to Coronavirus  CoinDesk,1585837547,0,1
1173,ftn3qh,sccrdmn90,0.0,Maybe today isnt the day to invest,1585837059,3,1
1175,ftn0dc,Alexia5412,0.6908,Bitcoin Takes a Bullish Toll Above k Ramps the Trading Volume,1585836703,0,1
1176,ftmwe2,oliver250,0.0,Cryptocurrency Emoji Quiz,1585836299,1,1
1177,ftmufj,asso,0.0,Protection Against Inflation Real Estate Bitcoin or Gold,1585836100,0,1
1178,ftmuaa,cocryptominer,0.296,Helping delivery drivers and spreading Bitcoin,1585836085,1,1
1179,ftmqgz,Cade_Connelly_13,0.2732,Cryptocurrency Now Accepted at Arkansas Jewelry Retailer,1585835698,0,1
1180,ftmem0,bwinsy,0.0,Binance and CoinMarketCap Announce Acquisition,1585834415,0,1
1181,ftm7yg,DavidBanks12,0.0,Here is what the estimated real supply of Bitcoin today out of total M capped supply,1585833667,0,1
1182,ftm74h,autonova3,0.0,Bitcoin and Runescape partyhats,1585833575,25,1
1183,ftm0g8,WhatIsFightClub_,0.5719,Finally Something Worth Sharing On Here  Open Today Only,1585832835,0,1
1184,ftlnmy,Mcoyle777,0.9393,Can somebody please explain to me in simple terms how I can buy bitcoin I am new to technology and would appreciate the help thanks,1585831299,6,1
1185,ftlhkr,parrire,0.0,After investing in btc for over  years I finally hodl a whole coin,1585830544,39,1
1186,ftlgym,parrire,0.0,After investing in btc for over  years hodl a whole coin,1585830465,0,1
1187,ftl7jj,Lucybbb,0.8537,Im soliciting for donation on behalf of my friend Tammy shes really going through a tough time with the current coronavirus outbreak Anything you can give her will go a long way but if you dont have anything to offer please help make the video go viral,1585829287,10,1
1188,ftl3bh,bahe1938,0.7269,Italian Bank Adds Bitcoin Support as the Nation Emerges into a Brave New World,1585828773,34,1
1189,ftkoiv,castorfromtheva,0.0,Egyptian Central Bank Limits Cash Withdrawals Bitcoin Fixes This,1585826695,0,1
1190,ftkm16,Sandboxeaa,0.3612,Bitcoin BTC Boosted as Stock Markets Take Another Dive,1585826350,0,1
1191,ftkjea,Alexia5412,0.4019,Coronavirus Italian mayor prints local currency to help residents in need,1585825964,0,1
1192,ftkepg,mrmaxma,0.0,Nongovernmental organization Nocoro called for donations to serve the prevention of Covid,1585825313,0,1
1193,ftk98u,Collective_Holdings,0.0,Bybit Perpetual contracts,1585824547,0,1
1194,ftk0t1,ripplesuckz,-0.5423,How Bitcoins Price Drop Affects Mining Geography,1585823351,0,1
1195,ftjq3y,Billiez100,0.0,Binary investment,1585821771,0,1
1196,ftjps6,ripplesuckz,-0.1027,Craig Wright Warns That Law Is Coming For Bitcoin,1585821730,0,1
1197,ftjibf,Billiez100,0.7845,Ive been a Binary Option Trader for years now and I can guarantee you steady income Using accurate signals and trading techniques you can earn at least  in hours If youre interested in earning Kindly inbox me or WhatsApp ,1585820588,0,1
1198,ftjcth,Bitcoin_to_da_Moon,0.25,bitcoin halving is quantitativehardening fiat undergoing lots of politically driven quantitative easing bitcoin supply algorithm starts quantitative hardening next month,1585819769,6,1
1199,ftjceu,dukeraoulcrown,0.0,Earn bitcoin coinbase invit,1585819715,0,1
1200,ftj9df,BitCayne,0.6369,Its enough to love bitcoin,1585819273,0,1
1201,ftiwg8,Uberdriver_janis,-0.6369,Missed the Dip,1585817396,2,1
1202,ftiuii,joephinderink,0.0,Should I invest in bitcoin at the moment,1585817088,0,1
1203,ftiofj,BashCo,0.0,The Honey Badger Diaries Episode  Greg Slepak California USA,1585816131,0,1
1204,ftikxq,Mehrdad619,0.0,   ,1585815593,0,1
1205,fti01l,redditretard09,0.4588,Honestly we are still dying,1585812396,0,1
1206,fthugg,CoinCompassBTC,0.296,Peter McCormack WhatBitcoinDid join us to discuss Bitcoin amp the Coronavirus from a pragmatic perspective Bitcoin Basics Podcast,1585811590,0,1
1207,fthtne,presroncfx4,0.8126,Are you interested in trading forex This an opportunity for you to get a trade account managed by an experienced forex broker with good returns on your investments inbox directly for more information,1585811476,0,1
1208,fthpa0,rBitcoinMod,0.0,Daily Discussion April  ,1585810852,144,1
1209,fthm2s,MeetMeAtGE,0.0,Cloud Mining Company Bitsu Disables Withdrawals,1585810383,0,1
1210,ftgwik,TimZeGerman,0.0,Im doing my part,1585806648,0,1
1211,ftgkaj,CharlyDayy,-0.2732,Forgot it was April fools about had a heart attack,1585804943,2,1
1212,ftgfse,sniperstube,-0.4939,This Bitcoin Indicator Shows MASSIVE Influx of Buyers Soon  April Fools,1585804337,0,1
1213,fyjjdu,slvbtc,0.5267,Digital sound money vs physical sound money,1586537464,8,1
1214,fyjhfl,emolmos,0.0,My opinion on what will happen,1586537304,40,1
1215,fyjhei,aboutblank512,-0.34,Beware of Coinbase My experiene with the worst support ever met,1586537302,12,1
1216,fyjham,Goncido,0.6705,The Safe Place For Your Crypto Coins  Protect Your Crypto,1586537294,2,1
1217,fyjfk2,dsgfOG,0.3612,A few questions I would like to get answers to,1586537147,5,1
1218,fyjbhl,WalterHuey,0.0,Quantitative hardening season  comming may th,1586536803,9,1
1219,fyj76v,ahileom,0.0,What are you thinking Will the Bitcoin rise again or Is this the end,1586536428,12,1
1220,fyj5g8,thevedgehead,0.0,Bitcoin potentially hitting  by end of year,1586536277,7,1
1221,fyi7rp,joedirt9322,0.0,Soo bitcoin is untraceable right,1586533447,18,1
1222,fyi79x,AliHJ94,0.8807,Best way to buy bitcoins,1586533404,16,1
1223,fyi3r9,curryfrank,0.0,Make investments now,1586533112,1,1
1224,fyi2lk,TheCoiniac,0.0,Theres an infinite amount of cash in the Federal Reserve Bitcoin is the exit,1586533010,41,1
1225,fyhqwp,LordHaldon,0.0,We need  to lift right now Everyone should be doing all that they can to get mass adoption,1586531981,0,1
1226,fyhnno,rnvk,0.0,Coldpower NODATA USB power supply from V battery,1586531692,11,1
1227,fyhecm,dan-nolan,0.0,How do Digital Signatures work,1586530882,0,1
1228,fyhbdr,degenbetz,0.0,BitMEX CEO on the world after COVID Choose your fiction,1586530620,0,1
1229,fyh6bv,CoinjoyAssistant,0.4404,Bitcoin Investment or sale on these days would yield maximum profits,1586530168,0,1
1230,fyh3aa,Edward_Morbius,0.296,Getting a lot of blackmail spamscams Can I cost a bitcoin scammer money by sending really tiny amounts,1586529888,8,0
1231,fyh1v3,primalfabric,-0.128,With US printing an endless supply of money and the pandemic that has engulfed the world the global economy is likely to crash This is the time for people to start looking for alternates aka Bitcoin,1586529762,0,1
1232,fygzl0,[deleted],-0.128,With US printing an endless supply of money and the pandemic that has engulfed the world the global economy is set to crash This is the time for people to start looking for alternates aka Bitcoin,1586529563,0,1
1233,fygyd5,primalfabric,0.4404,Is anyone using YouTubeTwitch Live Streaming and want to accept bitcoin donations,1586529444,0,1
1235,fygitp,Chl0r0PHIL,0.6705, Million is NonNegotiable  The unmanipulable supply is the primary reason why bitcoin is valuable which is the only reason its secure,1586527958,70,1
1236,fyghr6,Ganeshadream,0.0,Down we go,1586527859,5,1
1237,fyg3zo,slvbtc,-0.3208,Dont underestimate bitcoins potential during the coming economic collapse,1586526440,52,1
1238,fyg1lk,VladyslavaBloxlive,0.0,Trader and angel investor WhalePanda believes some people actually know who Satoshi Nakamoto is,1586526172,1,1
1239,fyfwgh,NZSGFTW,0.0,I guess this will be a picture to talk about someday,1586525564,476,1
1240,fyfobg,leolage20,0.0,Im newbie,1586524601,2,1
1241,fyfnj9,dmdeemer,0.2924,Dont be fooled by the Paycheck Protection Plan andor the stimulus payments to individuals,1586524507,59,1
1242,fyfkx3,insidetrader8,0.7207,Do you know the most profitable exchange tokens If not check my latest article on publishx OKB ZB HT GT FTT Bitcoin cryptocurrency CryptoNews,1586524202,0,1
1243,fyfgq6,Lumin8_Crypto,0.7184,Should I Buy Bitcoin Now Or Wait Bitcoin Whales  Mill Bitcoin Halving Spikes On Google Search BitMEX CEO  BTC,1586523738,4,1
1244,fyfgai,DollarSouffle,0.2023,The Top  Reasons You Need A Bitcoin Mixer,1586523688,1,1
1245,fyffad,the_700t,0.0,What are your thoughts on Ravencoin,1586523572,5,1
1246,fyf578,walton-chain-massive,-0.2732,rbtc is now banning people that discuss low hash rate and transactions not being confirmed,1586522310,2,1
1247,fyf0pr,Sandboxeaa,-0.128,Bitcoin Whale Numbers Suggest Halving Could lead to higher Demand,1586521715,2,1
1248,fyezwb,mccormack555,0.0,Bitcoins Coming of Age with Dan Morehead  What Bitcoin Did,1586521604,0,1
1249,fyei03,CoinjoyAssistant,-0.128,Bitcoins Booming Demand to Be a Boon Even after  Rally Heres How,1586519267,0,1
1250,fyehf8,wiesl3,0.0,Single address with  million BTC,1586519195,11,1
1251,fye1bt,ITHROWITAWAYFAR,0.2263,F to pay respects,1586517172,0,1
1252,fydxt2,Latbet24,0.5574,I AM rich   ,1586516778,21,1
1253,fydqtv,96yardy,-0.0516,Bitcoin noob question,1586515920,14,1
1254,fydgv2,coincodecap,-0.8074,The dangers of selling Bitcoin options Naseem Taleb and Disaster Puts,1586514624,0,1
1255,fyddvd,coincodecap,0.6369,Bitcoin Options Beginner  Best Resources and First Trade Idea,1586514254,1,1
1256,fycryz,IamGeorg,0.0,On your face Trump,1586511588,5,1
1257,fyc9xr,slvbtc,0.0,Need I say More,1586509431,11,1
1258,fyc6wi,frustrated_dog_owner,-0.0258,Ive only owned bitcoin for  years It seems to me it is just being manipulated like everything else at this point bitcoin hodlers are just the new gold bugs with tech thrown into the mix,1586509070,47,1
1259,fyc451,polagon,0.7184,A look into what are some of the cheapest ways to buy BTC  whats your goto option,1586508726,0,1
1260,fyc3et,At0m11c,0.0,How to store Bitcoin,1586508640,31,1
1261,fyc0m1,lidan006,0.0,Bitcoin analysis,1586508300,0,1
1262,fybj01,Encephalomagna,0.0,The first mainnet trade for actual not wrapped BTC on a noncustodial DEX took place today,1586506144,20,1
1263,fybfoi,kcito,-0.34,How does bitcoin combat inflation if its so volatile,1586505736,13,1
1264,fyb2tx,imjunpark,0.0,Just a quick question from Newbie to know little more about bitcoin,1586504258,1,1
1265,fyavtd,johnforstnoble,0.25,Dream car ,1586503421,0,1
1266,fyarax,sejwa,-0.34,bitcoin  under fire HODL crypto,1586502916,1,1
1267,fyajl8,rBitcoinMod,0.0,Daily Discussion April  ,1586502049,156,1
1268,fy9vc6,WalterHuey,0.3612,EU agree on  billion euro state aid package Brrrr,1586499155,14,1
1269,fy9osc,1jb,0.0,Electrum Question about sending bitcoin,1586498292,5,1
1270,fy9az5,coincodecap,0.0,An Overview of Bitcoin Lightning Network,1586496714,13,1
1271,fy96ek,tneal4200,0.4019,Anybody have any spare btc to help grow my portfolio,1586496192,1,1
1272,fy8pza,non20ccharusername,-0.3979,What are the best low risk no kyc interest bearing crypto accounts,1586494430,2,1
1273,fy8lhq,sirfaith,0.5106,ONLINE JOBS THAT CREATES A RELIABLE DAILY STABLE INCOME,1586493942,0,1
1274,fy89v7,jumaiza,0.7184,Should I buy bitcoin right now,1586492726,7,1
1275,fy83z5,PowerPort27,0.0,Im putting  in Bitcoin and  on a Glock,1586492111,185,1
1276,fy7ynh,sainiyogesh01,0.0,Introduce OXBTC New Cloud Mining Contract,1586491565,1,1
1277,fy7b42,btcsolutionsca,0.6956,Thanks for the taxes We dont give a fuck about your business,1586489155,6,1
1278,fy6v6r,IWillHODLForLife,0.5574,Is  Bitcoin enough to get rich,1586487593,15,1
1279,fy67zm,Jwolfdk,0.0,Is Bitcoin built to last several generations,1586485372,13,1
1280,fy5t5q,multibitcoinaire,0.0,The Year is ,1586484000,0,1
1281,fy5oq2,letsretirenow,0.0,Does outsourced technical analysis exists,1586483572,6,1
1282,fy5gnz,cookmanager,0.0,USA Earned Income in Bitcoin amp Income Taxes,1586482821,10,1
1283,fy4zml,yahiheb,0.0,First merged PR to bitcoin core Am I considered a core contributor,1586481250,2,1
1284,fy4qx4,RemarkableInspection,0.3034,HELP Missing one character in Bitcoin private key,1586480447,14,1
1285,fy4pi4,bubbalucas1479,0.3612,Do you want to join VFD,1586480323,0,1
1286,fy4805,trial_and_improve,0.34,Does each coin have a unique value,1586478743,5,1
1287,fy45w8,Scholes_SC2,0.0,Youtube censorship,1586478548,2,1
1288,fy45u3,Morescratch,-0.6486,So is BCH finally dead,1586478543,26,1
1289,fy3dpq,57GREGG,0.0,Anyone using Coinbase Vault,1586475875,11,1
1290,fy39pc,topexpert551,0.5766,WELCOME TO POWERING DATA FOR THE NEW EQUITY BLOCKCHAIN A Global decentralize network to buy amp sell Crypto Coin,1586475490,0,1
1291,fy322v,ryanmark101,0.296,Make money via bitcoin Mining while sleeping,1586474759,0,1
1292,fy322g,LongHash,-0.5233,It Now Costs Over x More to Attack Bitcoin Than Bitcoin Cash,1586474758,0,1
1293,fy2mzp,dmkzeal,0.7184,Looking for lowest fees derivative exchanges for my self Tried Bybit the fees are two high and arbitralily for my liking  Hope the community suggest some alternatives,1586473186,2,1
1294,fy2lbr,SelitosOne-Eye,-0.1566,Printing money doesnt create inflation unless there is a shortage of goods someone today,1586473019,3,1
1295,fwrmmy,oslo_haha,-0.7184,Whats the reason people mass sell their holdings,1586290037,10,1
1296,fwrln6,skydiveguy,0.0,Every day at PM EST,1586289946,12,1
1297,fwrlfj,ColinTalksCrypto,0.2263,Gold vs Bitcoin What I Learned Buying Silver amp Gold with Bitcoin amp Crypto  Was it worth it Episode ,1586289927,0,1
1298,fwr11i,b2run,0.0,Master CZ Part  is live Deepfake,1586288116,0,1
1299,fwr0gd,areddituser46,0.2023,A Look at Bitcoin Dominance  TheCryptoAssociate,1586288059,0,1
1300,fwqz9d,onelovex3,0.1531,UFC fighter Ben Askren changes his name to Bitcoin Halving May ,1586287947,60,1
1301,fwqs6p,omidfadavi,0.0,  Cryptocurrency       ,1586287325,1,1
1302,fwqrcm,bitcosar,0.0,aka Gibi  Bitcoin  Dolara Satld,1586287254,1,1
1304,fwql6c,hashoshi4,0.0,A simple guide to the Bitcoin halving event video,1586286718,0,1
1305,fwqfbg,whatisfomo,0.0, things including Bitcoin that will forever be different in a post COVID world Inflationhalvingcashless economyCBDC will all change worlds view on Bitcoin,1586286213,4,1
1306,fwpxv1,vicentcoded,0.0,forex trading channel,1586284657,0,1
1307,fwp5p3,StevenRad,0.2023,What exchanges are saying about the upcoming bitcoin block reward halving,1586282183,2,1
1308,fwp54z,icemanintakes,0.4019,Help required,1586282134,6,1
1309,fwoxrb,MR039,0.4019,Help required,1586281470,0,1
1310,fwou31,DerEwige,0.0,Using lightning for anonymization,1586281141,7,1
1311,fwoowc,toSaturnAndBeyond,0.0,Hypothetically how would you cash out K,1586280687,141,1
1312,fwoonf,Beefjerkysurf,0.0,If all current BTC owners  bought BTC with their  check,1586280667,15,1
1313,fwonbc,DecentralizedLaw,-0.4404,What is Your Biggest Worry For Further Bitcoin Implementation,1586280544,19,1
1314,fwo95y,wojtekthesoldierbear,0.0,Coins are just hashtags now after Coinjoin operation,1586279307,6,1
1315,fwo4g4,CRYTOBOI2020,0.0,Bitcoin airdrop,1586278893,8,1
1316,fwnonv,adriangf17,0.0258,Xapo withdrawal,1586277444,4,1
1317,fwnlg8,infinite_dendrite,0.0,Just spotted in a Fidelity investor update regarding current stock markets This is why we need Bitcoin,1586277145,7,2
1318,fwne2m,crypto_bot,0.0,Bitcoin Network Status Update Tuesday April  ,1586276480,0,1
1319,fwn90z,negus_nagast,0.4404,Lets cut the shit on Satoshi,1586276011,14,2
1320,fwn8n5,adfrost,0.0,Bitcoin mining,1586275975,8,1
1321,fwn0jf,hashpowah,0.0,Blockin Launches Explorer with Mempool Data,1586275260,0,3
1322,fwmpfy,wifiron,0.0,Tax complication for selling stuff for BTC and cashing out US,1586274218,5,1
1323,fwmock,HairBones69,-0.4854,Im and pro Bitcoin in the long term but how much it follows the stock market is upsetting,1586274099,11,1
1324,fwmi3o,bankoncrypto,0.0,Bitcoin  EPIC REVERSAL,1586273495,1,0
1325,fwman4,Lord_Whis,-0.6124,Scam website from  attempting to resurface,1586272757,2,1
1326,fwm4xi,DecryptMedia,-0.128,Demand for Bitcoin online courses explodes by ,1586272186,10,8
1327,fwm4o0,learntheway,0.0,Requesting some guidance regarding Bitcoin,1586272158,6,1
1328,fwlxb6,WhoWasBlowjob,-0.296,Reading this stuff about KYC has me worried any Canadians with a Bitbuy account,1586271445,28,2
1329,fwlpol,mrholmes1991,0.34,Bitcoins USD value of transfers is bouncing back,1586270672,0,0
1330,fwl4kp,Lumin8_Crypto,0.5994,Bitcoin News Today Banks Cause Indians To Own Bitcoin Bitcoin Bulls HODL Stars Aligning for BTC,1586268519,1,1
1331,fwktuh,the420chronicler,0.5859,The Pomp podcast with Kiyosaki was  cringe Caveat emptor Just remember that Bitcoin is supposed to be a big inclusive tent and how you say things is sometimes just as important what you say and what you believe Im glad that Pomp disowns Kiyosakis opinions at the start of his podcast,1586267394,21,1
1332,fwkqcj,ihateyeezys,0.0,buying bitcoin,1586267018,0,1
1333,fwkmup,mynibbamynibba321,0.0,Has anyone here tried QuickCoin in Canada,1586266630,15,1
1334,fwkjzl,demka55,0.7184,Ask What is the cheapest way to buy Bitcoin,1586266311,70,1
1335,fwk23b,Chumaaa17,0.2023,Passive income in BTC,1586264288,0,1
1336,fwjsq3,dapper-detective,0.0,What does this mean,1586263149,2,1
1337,fwjken,stephanlivera,0.0,SLP Gleb Naumenko  erlay Bitcoin transaction relay,1586262100,0,1
1338,fwji68,localname1,0.0,Forbes  Billionaire Makes The Case For A  Million Bitcoin Price,1586261819,1,1
1339,fwj432,rieschiek,-0.7184,Sell now or wait for halving,1586259989,20,1
1340,fwj2sn,mccormack555,-0.6597,Is Chainalysis Evil with Jonathan Levin  What Bitcoin Did,1586259815,9,1
1341,fwj0y9,asso,0.4939,Bitcoin Hash Rate Increases Is BTC Back to Strength,1586259561,8,1
1342,fwizlp,Euy_St,0.0,GO,1586259365,0,1
1343,fwivw6,xvorkus,0.4019,Beginner Needing help,1586258868,2,1
1344,fwistz,Merchbacash,0.4767,Why is bitcoin valuable,1586258433,10,1
1345,fwinn3,Louis6787,0.6369,Best investment of the decade again,1586257741,259,1
1346,fwimf4,Latbet24,0.0,Digital Dollars for All,1586257568,8,1
1347,fwilew,MK333666,0.0,A new study shows that M BTC is not moving over the past  years,1586257422,1,1
1348,fwifyd,mickyd2020,0.0,Bitcoin loan,1586256667,0,1
1349,fwiegq,shadowbandit,0.0,Bitcoin Printed This Exact Pattern Prior to s Explosion to  Its Back,1586256445,0,1
1350,fwie7m,walton-chain-massive,0.0,Video from a BCH meetup,1586256408,2,1
1352,fwhuh5,bitentrepreneur,-0.4404,Poolin Launches Bitcoin Block Explorer With Detailed Fee Guidance amp Halving Data,1586253518,0,1
1353,fwhsxu,8btccom,0.0,China Crypto Roundup CBDC Highlighted Again Binance Inching Back to Asia,1586253262,0,1
1354,fwhpxv,yourclassmanager01,0.0,ielts institute management software,1586252810,0,1
