Unnamed: 0,id,author,vader,title,created_utc,num_comments,score
5701,mhxba3,Hopeless3026,0.4588,Should i buy now or wait for the dip ,1617289689,0,1
5702,mhx7e0,claudiuadam,0.0,Bitcoin  Ether  Litecoin allocation,1617289370,0,1
5703,mhx6pq,AndrewSuperswag,0.6486,My bitcoin investment finally reached  figures today Blessed to be a part of this community ,1617289319,0,1
5706,mhx3nx,salil19,0.0,Bitcoin price doubles in institutionally driven first quarter Whats in q,1617289082,5,1
5710,mhwyl5,heist95,0.0258,What billionare Chamath Palihapitiya gets wrong about Bitcoin inflation wealth inequality and the Cantillon Effect,1617288666,18,1
5711,mhwy94,PlaneAdvantage5542,0.0,Morgan Stanley officially investing in BTC,1617288640,56,1
5712,mhwxl9,SpeaKrLipSync,0.0,Bernie wants more BTC,1617288582,10,1
5715,mhwpdx,MastaMayne,0.0,Us with a new ATH back in our sights,1617287925,18,1
5717,mhwk13,Zafer66,0.0,How can coinbase pro send me my bitcoins in half an hour with a fee of  but when i try to send something it costs  for the fast transaction,1617287474,5,1
5720,mhwd1y,LibrarianWide703,0.0,MLB team Oakland Athletics sells tickets with bitcoin for first time,1617286929,0,1
5721,mhwcyy,Upstairs_Ad_8180,0.0,How Does Lending BTC Impact Price,1617286921,4,1
5722,mhw9al,justbrowsinnreadin,-0.4588,Inverse inflation Having no Bitcoin exposure is just risky in ,1617286614,0,1
5723,mhw7zj,PodClips,0.3612,Why Bitcoin Naysayers Are Like Medieval Priests minute audio clip from Max Keiser,1617286504,0,1
5725,mhw2la,travy8D,0.4995,Even Fortnite is pushing the HODL,1617286081,0,1
5726,mhw0f0,ZedZeroth,0.0,I asked BullionByPost about gold storage and they called me immediately explaining everything personally over the phone I asked Gemini about BTC storage By email Then Twitter Then Reddit Then via their two insurers Aon and Marsh Literally nobody has responded to anything for over a month now,1617285899,22,1
5727,mhw039,Flat_Struggle_9680,-0.3612,Youtubers talking about the historical patterns of bitcoin are ridiculous,1617285875,11,1
5728,mhvygo,bitcointothemoon_,-0.7269,Teletubbies Lead the Madness as April Fools Bitcoin Bedlam Runs Amok,1617285737,0,1
5729,mhvxmp,stanhopeofficial,-0.25,THIS JUST IN BITCOIN IS CANCELLED,1617285663,0,1
5730,mhvv0p,ManfredTheWonderDog,0.4588,Why the different interest rates on crypto,1617285452,8,1
5732,mhvkdp,Jimmytwotimes4,0.9227,What are the best crypto referral programs I have tried Binance Indorse  and Coinbase They are all working really well for me so would love to join some more,1617284523,0,1
5733,mhv9iv,Liquor_Lollipops,0.0,New BITCOIN Liquor Lollipops ,1617283566,1,1
5734,mhv8xt,intothecryptoverse,0.5106,Fun with Crypto,1617283514,2,1
5737,mhv53d,megaczi,0.0,Bitcoin Telegram,1617283172,0,1
5738,mhuz31,DaenyxBerlarys,0.3818,How to fairly address volatility when accepting bitcoin payment,1617282647,8,1
5739,mhuxo3,ihateuusername,0.6283,NOT APRIL FOOLS FORTNITE ADDS HODL MEME TO THEIR SKIN DESCRIPTION,1617282522,4,1
5741,mhuqvo,Damxchange,0.0,My Case for  Million Bitcoin Price,1617281952,0,1
5744,mhukpb,logopaul,0.0,Bitcoin emoji is real,1617281356,0,1
5745,mhugn8,the-derpetologist,0.3182,Added bitcoin price to my phone stock ticker a few months ago  and it still keeps showing me old articles telling me it could hit k soon,1617280962,1,1
5746,mhuezl,Lesty7,-0.296,What happens to bitcoin if the economy collapses,1617280810,119,1
5747,mhuep1,Quantum_Flex,-0.7184,Told my wife I sold BTC today,1617280784,0,1
5748,mhudk4,DogeWorldy,0.3818,Will more companies follow in Teslas footsteps and accept Bitcoin as a payment method,1617280679,6,1
5749,mhual2,sultansatoshi,0.4588,Pi Cycle Top Indicator,1617280400,0,1
5750,mhuaf3,BobbyPerew,0.4939,Bitcoin as a System  Thoughts inspired by Luhmann,1617280379,3,1
5752,mhu7ml,c_barraud,0.0,Crypto Brief  April st   Christophe Barraud,1617280093,0,1
5754,mhu5sh,coinfabulator,-0.7184,Michael Saylor says Sell,1617279902,6,1
5755,mhu3im,iamjohnsonmendonca,0.0,Legality of bitcoin by country or territory,1617279668,0,1
5756,mhu1im,Felipe_Silva_,0.0,Where are bitcoins not allowed,1617279457,11,1
5760,mhtvyz,BinanceFly364,0.7003,Which CEXs allow Europeans to buy low amounts of BTC without ID verification,1617278902,10,1
5763,mhtmbb,BitcoinWide,0.3182,Scottish music school accepts Bitcoin as payment for lessons,1617277906,3,1
5764,mhti3s,lib3rty47,0.4588,tesla has reported to have traded bitcoin for doge the morning for april st Doge coin going up,1617277442,1,1
5765,mhtfuz,Bitfuturex,0.7167,I am an pro trader and I had an ideal of risk investment but profitbleyou must try to see send me  to  USD of BTC and I will make an operation on IQ optionI target  of my ops than I send back what you sent more  for the kids it is not a scam chat me private for more info,1617277200,5,1
5766,mhtbhy,Bubbly-Ratio8007,0.3202,Bank Of Scotland Blocking Crypto Purchase But Claiming No Block,1617276714,13,1
5769,mht8uo,Get_the_nak,0.296,Philosophy In order to understand btc you need to understand money,1617276417,111,1
5770,mht8mj,Fiach_Dubh,0.7184,Novogratz is Bullish Talks Goldman Sachs amp Bitcoin Dips Are Going to Be Bought  March  ,1617276390,5,1
5771,mjihoa,thexydoge,0.4588,How far can bitcoin go in  if it repeats the  high pattern Featured,1617487760,1,1
5773,mjigc4,Daveliuz,0.4588,Bitcoin Bounty Referenced on an Episode of Marvels The Falcon and the Winter Soldier,1617487641,0,1
5774,mjifq2,CC_EF_JTF,-0.4404,School of Block  Bitcoin Without Internet VIDEO,1617487588,0,1
5776,mji8ua,Weird_Pomegranate570,0.296,Will my pin on my ledger stay the same if I break or lose it and restore a new one ,1617486997,0,1
5779,mji4d8,ggguysdoge,0.0,For analyst Bitcoin rally is at an end,1617486592,0,1
5782,mji0b0,ggguysdoge,0.0,For analyst bitcoin rally is at an end,1617486226,0,1
5783,mjhz4l,vaughanm88,0.3818,My Bitcoin Core Full Node  alive amp kicking,1617486119,24,3
5784,mjhyjo,HugoRamos,0.0,Guys the latest episode of the FYouMoney Show is live Daily briefing of Bitcoin price action and the analysis and thoughts about the Pi Cycle indicator You can watch it now,1617486067,0,1
5786,mjhw15,Swimming_Ad2716,0.0,Government and Bitcoin,1617485850,19,2
5787,mjht9h,Rosekandolaki,0.4019,Help with e transfer Bitbuy,1617485605,3,1
5789,mjhnb2,Andre01g,0.8553,HODLERS in emerging markets with restricted currencies how easy is to buy BTC and what are the most popular exchanges,1617485076,1,1
5790,mjhk3d,SuckingOffaBitcoin,0.6841,My Blood Brothers from the Class of  we have come this far and after  years we can certainly HODL out for  more months,1617484798,10,3
5791,mjhg8g,romasalah,0.0,Coinfarcast Scientific Price Analysis amp Prediction,1617484471,0,1
5797,mjgzqn,SuckingOffaBitcoin,0.3182,When Bitcoin hits  USD I am going to have a new life,1617483025,8,0
5798,mjgsw1,Limp-Balance-9252,0.872,BTT Price Prediction  NEW ALL TIME HIGH HUGE GAINS AT BITTORRENT ,1617482413,0,0
5802,mjgknx,hethestranger,0.0,HODLing is not linear its a spectrum,1617481674,77,1
5803,mjgiv5,kadudu888,0.4767,What else could excite Paris Hilton more than Bitcoin,1617481513,6,1
5804,mjggve,CryptoGeek24,0.7184,how i bought my tesla for ,1617481343,4,1
5807,mjg6ty,Melodic_Potential_67,0.3818,Dish network is now accepting Bitcoin as payment,1617480474,0,1
5808,mjg6q5,sunkist5,0.3612,Bitcoin is a black hole of monetary energy storage that over time will rip and absorb all excess value that people have placed on inferior value stores including gold real estate and equities Other assets will only reflect utility value and discounted future BTC flow valuations,1617480463,0,1
5810,mjg6gh,Daveliuz,0.296,HipHop Star Snoop Dogg Says Bitcoin Here to Stay Lauds NFTs for Creating Direct Connection Between Artists and Fans,1617480440,0,1
5811,mjg4mn,VirualWhisperer,0.6124,What does the rBitcoin community think about the future of BTC regarding the energy consumption concerns Here is a good decrypt article about the issue,1617480287,13,1
5812,mjg3tg,ragnar_gaming25,0.34,Bitcoin mining and market value,1617480222,0,1
5813,mjg2z9,bitcointothemoon_,0.25,PayPal Crypto Goldman Sachs Vehicle BTC Bugatti and  Crypto Jokes,1617480161,0,1
5815,mjfv47,aat022,0.0,The next bitcoin,1617479483,0,1
5816,mjfr7v,s11kim,0.0, coin base,1617479153,9,1
5818,mjfot2,ryanbully,0.4588,How long is this transaction gonna take,1617478946,4,1
5819,mjfoi5,michalesalla,0.0,Do you think the future of bitcoin will be really that complicated,1617478919,1,1
5820,mjfnix,Addicted2sax,0.0,Finding crypto investment plan bitcoin DeFi and NFTs,1617478837,5,1
5821,mjfj3y,Spartan7320,0.0,To my surpice my brother made me a bitcoin sweater for my birthday,1617478473,14,1
5823,mjfcpo,bfeeny,0.3182,For those that actually have a SDIRA and hold coin please some advice,1617477926,10,1
5824,mjfc4y,Mosky7,-0.1695,Coinbase will not allow me to purchase ANY crypto,1617477876,12,1
5825,mjfbud,slywalkers,0.0,Remember the toilet roll saga Thats Bitcoin in a few years,1617477850,1,1
5826,mjfa18,Expensive_Remote2288,0.3818,General Motors Plans To Accept Bitcoins,1617477696,19,1
5827,mjf9nq,iwannadrumbetter,0.0,Is most of the hash power for Bitcoin in China,1617477665,10,1
5829,mjf39h,Th3M0rn1ng5h0w,0.0,Rumors about Bitcoin,1617477118,0,1
5831,mjexl4,BorzyReptiloid,0.4404,Main issue we have all those posts explaining why BTC is good is,1617476635,4,1
5832,mjewze,PrizeSign5,0.0,Did Bitcoin Pizza Guy still have a lot of Bitcoin,1617476589,45,1
5833,mjenid,crispykfc,-0.4588,How does everyone plan on using their profits post market cycle,1617475790,0,1
5834,mjelk2,GearFinancial4469,0.4215,Max Keiser Bitcoin BTC saved Paris Hiltons life,1617475623,11,1
5836,mjeja3,Spartan7320,0.0,My brother surpiced me with a Bitcoin sweater for my birthday,1617475425,3,1
5838,mjecrg,Rabbit_Actual,0.0,A mortgage just for hodlers,1617474855,486,1
5839,mjebyp,Emily34jenny67,-0.7184,WHO WANTS TO SELL HIS OR HER BITCOIN,1617474783,0,1
5840,mje93x,roy253,0.4019,Easter k Bitcoin Special,1617474548,3,1
5841,mje78d,HappyLuckBox,-0.25,Wanting to run my own Full Node,1617474394,14,1
5845,mje16o,Crafty_Supermarket15,0.7322,Some friendly tips and suggestions for getting out of poverty so you can buy more bitcoin,1617473883,80,1
5848,mjduv9,BBQCopter,-0.5994,Indias Impending War on Crypto,1617473361,3,1
5849,mjdttu,mrfilthynasty4141,0.7301,What gives  Costs me like  just to send  in btc Never was this high but with fees like this why would anyone use btc at all This increase is insane,1617473277,1,1
5850,mjdtgl,Daveliuz,0.0,Employment Search Websites Show a Vast Amount of Jobs in the Bitcoin and Blockchain Industry,1617473245,0,1
5851,mjdp9s,DIELAN00,0.4404,Why is Portugal good for crypto investors,1617472901,22,2
5852,mjdowv,mrxovoc,0.0,Bitcoin vs Big Tech,1617472871,0,1
5855,mjdiac,CouponBoss91,0.25,HELP PLEASE LOST COINS,1617472325,3,1
5856,mjdi8n,SheepherderLow6145,0.0,Exchanging BTC from TrustWallet,1617472320,3,1
5857,mjdhbs,PsychologicalAd438,0.8625,Using Bitcoin like a bond to pay for my moms long term care Good idea Bad idea You got a better idea,1617472242,8,1
5858,mino5j,PodClips,-0.4588,Max Kesier says the US MUST start mining amp hoarding Bitcoin  heres why short audio clip,1617380404,8,1
5860,minmtr,xxautismaticxx,0.0,What do I do with my  Bitcoin,1617380285,19,1
5861,minmjc,extrinsicly_valued,0.0,Goldmans BTC Hypocrisy,1617380263,96,1
5862,minky2,LibrarianWide703,0.0,Paris Hilton Announces Investment In Bitcoin,1617380130,10,1
5864,minfnn,ChelseaKyleYT,0.0,I made a video about Bitcoin,1617379699,2,1
5865,minfbc,unfuckingstoppable,-0.5574,DEBUNKING Ray Dalios Bitcoin Ban Prediction  Swan Signal Apr nd,1617379670,2,1
5867,min98j,freezetheday,0.4215,Bitcoin exist in Marvel Cinematic Universe MCU  spoilers on Falcon and Winter Soldier,1617379196,0,1
5868,min50v,hnr01,-0.8611,Why dont we have Moons for rBTC Hell we can use Satoshis,1617378833,1,1
5870,mimxvu,IlinistRainbow6,0.4588,One day we break through k,1617378213,1,1
5873,mimwit,PrincyPy,0.0,Kevin OLeary goes  degrees on Bitcoin,1617378096,7,1
5874,mimtaw,Bitcoin_Magazine,0.0,New ATH huh  Reminder make BTC your unit of account not USD,1617377819,1,1
5875,mimoxa,leebob1974,-0.6124,Kraken scam,1617377445,9,1
5877,mimn77,angak,0.0,Bitcoin Harley Davidson,1617377299,12,1
5878,mimlsh,sanakftw,0.0,Why is the crypto called Bitcoin can anyone explain,1617377172,0,1
5880,mimjdo,MNRuhlman,0.0,It is Risen indeed,1617376962,13,1
5883,mim7ww,lupindub,0.0,What was Bitcoins actual ATH,1617375982,9,1
5884,mim5p1,Joshd30,0.4215,Marvel acknowledges Bitcoin,1617375798,30,1
5885,mim3fq,humanewanderer,0.1531,First time ever to hold solid  bitcoin,1617375620,337,1
5886,mim2tx,statistics_video,0.4588,OC Top Cryptocurrency by Market Capitalization   to ,1617375583,4,1
5887,mim0fv,prettygoodboy,-0.0516,BTC noob here looking to get in on the ride,1617375373,12,1
5888,milz9s,Present_Signature_49,-0.6124,Scam a email,1617375272,5,1
5889,milwx1,GoodN0se,0.0,Robinhood Crypto and Taxes,1617375071,16,1
5890,milvzb,Lobsterplant,-0.3313,I am starting a small business and am going to be accepting Bitcoin now And who says you cant buy anything with Bitcoin,1617374987,0,1
5891,milsno,terrorani,0.0,Bitcoin Collateralized Loans,1617374688,30,1
5893,milqxf,CoinCompassBTC,0.4404,Why Bitcoin is better than Ethereum technical amp economic differences Ethereum  misconceptions amp marketing hype max supply amp circulating supply amp digital gold vs digital oil Bitcoin Basics Podcast,1617374532,2,1
5896,milkuq,mccormack555,0.0,Bitcoins Path to  Trillion with Cameron amp Tyler Winklevoss  What Bitcoin Did,1617373988,5,1
5901,mildgt,lolasnickner,0.0,BTC futures reflect overheated retail action as BTC eyes  again,1617373336,0,1
5905,mil41q,Daveliuz,0.296,Bitcoin The Aperture Of Money,1617372510,0,1
5906,mikyk9,l33tdude,0.0,Bitcoin mood going into April,1617372030,14,1
5907,mikt7j,Smirkydarkdude,0.0,Bitcoin and the Golden Ratio,1617371533,0,1
5910,mikk5b,simplelifestyle,0.0,Bitcoin and Other Crypto Currencies Can Now Be Used to Charge EMoney  Rakuten Inc,1617370695,1,1
5911,mikewi,throwawaAAAA3455678,0.296,IRS Initiates Operation Hidden Treasure to Root Out Unreported Crypto Income,1617370221,7,1
5912,mikbyq,oconnellcamera,0.0,iQ  Another Bitcoin ETF coming into the market,1617369966,1,1
5913,mikaa0,Abdulahkabeer,0.0,Will Bitcoins Price Peak at  in April StocktoFlow Prediction,1617369814,6,1
5914,mik5to,ananaconjugo,0.0,Cmo explicaran Bitcoin a alguien  fuera de tema,1617369398,0,1
5915,mik4hh,tinytempo,0.6124,Just wondering why my post titled Anyone else get the feeling Michael Saylor is pumping for a dump was removed I thought this was a forum for discussion not just to lavish praise on BTC,1617369261,4,1
5917,mik2t8,tcwtcw,0.4215,Mark Cuban on his cryptocurrency portfolio I own a lot of Ethereum because I think its the closest to a true currency,1617369100,5,1
5918,mik1ai,oconnellcamera,0.0,Is a K breakout coming,1617368955,0,1
5919,mik0bp,PrivacyGirlTech,-0.4367,Top  No Sign Up Bitcoin To Monero Exchanges  No Registration Cryptocurrency Exchange,1617368861,1,1
5920,mik06w,Daveliuz,-0.6444,Study Highlights the Most Common NFT Scams Amid the Current Mainstream Hype,1617368849,0,1
5921,mik014,oconnellcamera,0.1779,Canadas Purpose Bitcoin ETF may be cutting into Grayscales market share,1617368832,1,1
5922,mijp0q,apriordan,-0.6124,BitIRA  scam or legit anyone,1617367800,8,1
5924,mijlbs,Obsy73,0.0,Bitcoin is now in the MCU,1617367439,0,1
5926,mijjux,jseverso42,-0.1779,Rise of the dreaded Others coins,1617367298,9,1
5927,mijj7w,gcorestudio,-0.0258,PERPETUAL PUMP AND DUMP,1617367235,16,1
5929,mijg56,itwaswillbe,0.0,Stocks to crypto,1617366921,10,1
5930,mijfod,BitcoinWide,0.3818,Bitcoin for Babe Ruth Sports auction house will accept crypto,1617366871,0,1
5931,mijeyk,TheDogeDom,-0.4019,Was the Nakamoto white paper correct,1617366795,4,1
5932,mijemr,displaybeats,0.4019,Historically this meme triggers a price movement when it reaches the hot section of rBitcoin,1617366765,0,1
5933,mijee5,bitcointothemoon_,0.0,Guys File Your Crypto Taxes the IRS is Coming,1617366736,0,1
5935,mij9tq,bearCatBird,-0.3182,Bitcoin such a tease,1617366255,0,1
5936,mij9rm,Zealousideal_Snow_54,0.0,Bitcoin ATM idea ,1617366250,9,1
5938,mit7vl,rayfin,0.5267,We have reached the top,1617396318,9,1
5939,mit6sp,Any-Explanation-6877,0.0,Bitcoin is In the falcon and the winter solider,1617396232,0,1
5940,mit66y,Icy-Profit6935,0.0,Bitcoin or Bonds,1617396187,2,1
5941,mit49v,LibrarianWide703,0.0,Amount of electricity used for Bitcoin BTC mining outstrips Sweden,1617396029,7,1
5942,mit45l,YllFigureItOut,0.6808,How many exchanges accept Liquid Im trying to gauge the markets interest,1617396019,1,1
5943,mit1m4,onursakaryaa,0.4588,Bitcoin Halving Epoch Scale Primed to Send Price x Higher in Long Term  CoinTechn,1617395816,2,1
5946,missck,divian_99,0.743,Deeper Network scoops top prize at recent Polkadot hackathon,1617395057,0,1
5950,misg0a,Daveliuz,0.4215,Shark Tanks Mark Cuban Says Ethereum Is Closest Crypto We Have to a True Currency,1617394057,0,1
5952,miscu9,humanbeing21,0.7783,BTC transfer with zero confirmations after a few hours Best way to resolve,1617393810,10,1
5953,misard,BitRacer-9798e,0.0,Bitcoin tax implications,1617393647,12,1
5955,mis92u,Ordningman,0.0,I used to have  bitcoin,1617393520,93,1
5957,mis4lg,JimmyAtreides,-0.296,Stop disclosing the amount of BTC you own,1617393159,180,1
5960,mis043,SoggyDoggi,0.0516,That one mfer who bit a coin in  not realizing he would make a bunch of losers rich  years later,1617392827,1,1
5961,mirtf6,ImTiaan,0.0,I started a Liquid Bitcoin LBTC merch store,1617392268,18,1
5964,mirmys,avandoorslaer,0.4588,Bitcoin sentiment picks up again,1617391755,2,1
5966,mirhkm,unfuckingstoppable,0.0,Bitcoin Flippening Gold Even Bloomberg is Coming Around  April st ,1617391318,0,1
5967,mirfw0,ErrorCompute,0.7184,Buying Bitcoin at the gas station Is this legit,1617391184,0,1
5968,miralu,meirmouyal,0.0,Would Satoshi Nakamoto prefer Bitcoin over Bitcoin Cash,1617390757,0,1
5969,mira3j,PM-ME-THOZE-BOOBS,0.1164,Ramit Sethi is ignorant  there is nothing wrong with holding BTC in your investment portfolio,1617390717,2,1
5970,mir7tb,mrxovoc,0.4588,Top  market cap crypto volume in   YTD TO ,1617390535,1,1
5972,mir5vr,BitDrill,0.4588,How long will it take for static method with minimum fee to get confirmed,1617390378,15,1
5975,mir1x4,unfuckingstoppable,-0.2263,Nic Carter Tackles Common Bitcoin Criticisms With  Sided Dice  Lex Fridman Clips Apr ,1617390080,10,1
5976,mir1ji,VampireVlad,0.5859,Why Taking the Unpopular Path Makes Bitcoin Successful,1617390049,0,1
5977,mir0i1,Panhandle_for_crypto,0.3716,Bitcoin Payments Are Great But Stablecoins Are The Future Of Crypto,1617389977,9,1
5978,miqxtm,Designer-Possible-37,-0.6124,Cryptocurrency Reddit Scam,1617389748,3,1
5980,miqos3,CriptomoedaNews,0.0,Anlise de Preo Bitcoin,1617389015,0,1
5981,miqmvf,wiseoldape,0.7184,How would you buy millions of dollars of Bitcoin if you had to,1617388865,0,1
5984,miqkz5,jasonstapleton,0.0,Just  of my many bitcoin purchases from last year,1617388719,1,1
5986,miqgzb,reap3r28,0.5106,My first NFT for fun Bitcoin Art,1617388399,1,1
5987,miqet6,echojunge,0.4588,The Bounty in the newest episode of Marvels FALCON amp THE WINTER SOLDIER is in BTC,1617388231,12,1
5989,miqc42,gonesailing00,0.0,The velocity of Bitcoin and other cryptocurrencies,1617388024,16,1
5990,miq607,Icy-Profit6935,0.4588,Upside Suggesting a strong upside for upcoming weeks What is your take on this,1617387544,1,1
5991,miq5po,Abdulahkabeer,-0.4767,I Was Wrong About Bitcoin  Peter Schiff,1617387521,7,1
5994,mipx3l,No-Organization-9846,0.0,Bitcoin is now in the MainMainstream,1617386863,5,1
5996,miptho,Money_Jellyfish543,-0.1779,HUGE PROFITS,1617386593,0,1
5997,mipgwc,HugoRamos,0.6852,Hey guys The best show on Earth just uploaded a new episode Dont miss my take on the emminent breakout of Bitcoin price action ,1617385624,0,1
5999,mipalq,SafeConsideration897,0.0,Resistance waiting for another breakout for a new ATH,1617385110,1,1
6000,mip920,MenacingMelons,0.0,Are heat sinkfan cases required for running a full node on an RPi,1617384988,11,1
6001,mip8dv,192ksc,0.0,Bitcoin Loan vs Margin Trading,1617384933,36,1
6002,mip77u,NanoBotler,0.0,MCU using Bitcoin for bounty,1617384837,0,1
6003,mip3tw,Simplybitcoin1,0.0,Daily Bitcoin News April nd ,1617384573,0,1
6004,mip2zr,LightSkinGreg,0.7964,When I bought Bitcoin I committed  of my portfolio,1617384503,48,1
6006,miown4,HolladKing,0.0,Bitcoin Will Replace The Central Bank  Max Keiser,1617383998,0,1
6007,miowll,boat-the-row,0.4019,Bitcoin will appreciate in ,1617383995,0,1
6008,miow6v,odlicno,0.0,Getting paid in Bitcoin,1617383961,2,1
6009,miov45,PhongerN2013,0.0,To all Full BTCs Hodlers,1617383877,34,1
6011,mioscs,i_do_too_,0.4215,Bitcoin in the marvel universe,1617383655,3,1
6012,mior0q,bitcointothemoon_,0.0,Garlinghouse  Bitcoin Transaction Requires  Gallons of Gasoline,1617383548,0,1
6013,mion7x,ChineseInfluenza,0.0,Bitcoin Fee Question,1617383247,4,1
6014,mion2y,Daveliuz,0.0,Morgan Stanley Adds Bitcoin to  Mutual Funds Investment Strategies,1617383237,0,1
6015,miomsm,ak334466,0.7184,Ethereum to the moon,1617383213,1,1
6017,mioj9x,bitcointothemoon_,0.0,ExSEC Chair On Bitcoin Regulation New BTC ETF N Korean Crypto Hackers  More News,1617382936,0,1
6018,mioh5g,felp_sssss,0.0,How monero works and how its different from BITCOIN,1617382778,2,1
6020,mioh3e,lik22,0.0,Im new to Crypto,1617382773,14,1
6021,miog0b,vanishfr,0.0,How Bitcoin changes Remittances in El Salvador  Mike Person,1617382679,0,1
6024,mio6aq,Okitraz1986,0.4215,Bitcoin in the Marvel Cinematic Universe Falcon Winter Soldier,1617381891,9,1
6025,mio01h,sylsau,-0.8442,Nigerias Central Bank Declares War on Bitcoin in a Losing Battle With the People,1617381381,15,1
6026,minytb,standardworks,0.0258,The Price of Bitcoin Currency is Expected to Reach ,1617381277,2,1
6027,minv25,Hitrocker,0.6369,Bitcoin arbitrage bots which one is the best,1617380972,3,1
6028,mmxiwi,3peatscoob,0.0,Investing in bitcoin,1617904790,17,1
6029,mmxgni,NeedleworkerNo2874,0.0,when Bitcoin private key has been found,1617904614,3,1
6030,mmxeqz,Neizir,0.7506,Southampton FC of the English Premier League agree landmark sponsorship deal which could see the club paid in Bitcoin for performance related bonuses Massive news,1617904465,1,1
6031,mmxdd4,thatoneguyonreddit91,-0.357,Can someone explain why bitcoin hasnt gone up the last few weeks,1617904371,26,1
6032,mmxcr6,brovbro,0.0,How to flip a Bitcoin,1617904326,1,1
6033,mmxai0,chagggy,0.4404,What will happen to alt coins when the bitcoin bull run ends near the end of the year,1617904156,18,1
6034,mmx2og,magarun,0.7184,To the moon ,1617903563,54,1
6035,mmx20a,SuckingOffaBitcoin,-0.7622,For those people who say Bitcoin is pollution it is not as if they dont drive cars or dont eat meat or dont buy nonlifesupporting products If you want to stick to fiat just say it and stop being such hyprocrites seriously,1617903511,10,1
6036,mmx1ze,NestleVera,0.4767,Where do Michael Saylor Willy Woo Tesla amp other whales store their BTC,1617903508,15,1
6037,mmx11u,Aware-Razzmatazz1450,0.0,Bitcoin Price BTCUSD BTC Live Chart News amp Analysis,1617903439,0,1
6038,mmwvdq,redditforazeem,0.0,Programming bitcoin from scratch in Python,1617903012,0,1
6042,mmwhih,SuckingOffaBitcoin,0.25, Turth Combined then we have  certainty  After the th halving in  Bitcoin will become m or more before  end,1617901949,5,1
6044,mmwecd,cyclist2001,0.0,Actual conversation but Bitcoin isnt real,1617901707,180,1
6046,mmw9cy,bitcointothemoon_,0.0,NYDIG Raises USD M Meitu Buys More BTC Crypto Climate Accord  More News,1617901339,0,1
6048,mmw490,Tuswiftly,-0.4939,The delusion of some of the alt coins subs in unreal Guess we should sell our btc for Enjin lol,1617900977,0,1
6049,mmw43b,finsersR,0.0,Hypothetical what happens if governments start banning conversion between BTC and fiat,1617900965,8,1
6050,mmvzuq,MaVericKj29,0.0,Figured I would try this because anything is possible Would anybody be willing and able to spare  bitcoin All I would need is  If you can my address is bcqxaelxjzpumgvrrrlurstkgfsxx,1617900626,4,1
6051,mmvytr,daydrinkingwithbob,0.0,Why Im all in on bitcoin,1617900546,2,1
6052,mmvxwl,NeedleworkerNo2874,0.0258,If there were no shtcoin btc may hit K day,1617900476,2,1
6053,mmvxkw,NOWPayments,0.0772,Pay for Amazon with Bitcoin  possible though not directly,1617900454,5,1
6055,mmvv5g,sylsau,0.836,Buying Bitcoin Now Is Investing Today in a Better Tomorrow,1617900257,1,1
6056,mmvv19,Affectionate_Cup7034,-0.4215,If someone could send me  to my btc adress Ill PayPal u  I just dont own a Bitcoin account,1617900248,1,1
6058,mmvszd,Kirito_Beleren,0.0,SEC likely to approve Bitcoin ETF in  years says analyst,1617900084,6,1
6059,mmvoi4,Bitcoin_Magazine,0.5267,Caruso To Accept Rent In BTC Allocate Portion Of Treasury To BTC,1617899719,1,1
6060,mmvjgh,zachahial,0.0,My bitcoin analysis,1617899329,1,1
6061,mmvg6c,Tcobli,0.0258,Whats up with block ,1617899069,2,1
6062,mmvfyd,CoinCompassBTC,0.0,Whats the difference between the Bitcoin Lightning Network amp Blockstreams Liquid Network Bitcoin Basics Podcast,1617899051,0,1
6065,mmvcpp,NeedleworkerNo2874,0.4588,Btc can up K if there arent shitcoins,1617898805,1,1
6066,mmvays,Aware-Razzmatazz1450,0.0,OMG BTC,1617898670,0,1
6067,mmv9f6,Yogev16,0.7184,Buying some coins,1617898550,16,2
6068,mmv85c,SolorMining,0.3182,Real Estate Billionaire Buys Bitcoin Accepts BTC for Rent Payment at His Residential and Retail Properties,1617898452,3,1
6071,mmv3ro,Bitcoin_is_plan_A,0.0,The amount of times Bitcoin was mentioned in a companies earnings reports,1617898127,4,1
6072,mmv1hz,SolorMining,-0.357,StockToFlow Creator Bitcoin Cycle Nowhere Near The Top  BTCNN,1617897956,7,1
6079,mmulfg,Cryptex3011,0.4215,Is Bitcoin a progress in the economic world,1617896686,0,1
6082,mmufm2,Gen_Tsos_Koolaid,-0.128,The Problem with Fiat Money and Central Banks that Bitcoin Fixes,1617896225,0,1
