Unnamed: 0,id,author,vader,title,created_utc,num_comments,score
3,mja38s,Tuttifruttiaccount,0.0,LETS FACE IT BITCOIN IS FLOWED TO CONSIDER BITCOIN AS A CRYPTOCURRENCY FINITE IN TIME,1617461807,17,1
6,mj9u7m,sasquish,0.0,What would happen to bitcoin and other cryptocurrencies in a Carrington event,1617461000,20,1
7,mj9md5,Kryxtalein,0.5106,Fun with a scammer,1617460298,20,1
8,mj9lv3,vicgsports,0.824,YO I NEED HELP Btc in PayPal Best place to move it to,1617460253,10,1
10,mj9k94,oconnellcamera,0.6369,Heres why April may be the best month yet for Bitcoin price,1617460109,1,1
11,mj9hf1,GensuruBomba,0.0,What happens if India bans bitcoin,1617459847,27,1
14,mj9cxd,mcfc_4eva,0.4902,Is Bitcoin really a useful currency,1617459436,18,1
16,mj92c5,oaiolon,0.0,Chinese Bitcoin mining farm,1617458466,5,1
18,mj8yxc,JoeB34,0.0,Bitcoins Contango  what it is amp why it could lead to hyperbitcoinization,1617458141,11,1
19,mj8xvm,PhotoZealousideal982,-0.5423,This was the cryptocurrency climate before the last big crash,1617458040,12,1
20,mj8wbk,throwingbugs,-0.6124,SatoshiBones  Bitzillions Exit Scam,1617457890,2,1
21,mj8vu9,Admirable-Soft-4159,0.6808,Is profitable to use boost on cryptotab,1617457849,0,1
24,mj8j6g,Oasise,0.836,Good time to buy,1617456606,4,1
25,mj8eov,No_Resolve_6948,0.7184,Where to buy,1617456159,0,1
27,mj8d60,PulitzerPrice,0.0,CoinShares Partners With Canadas iQ to Launch New Bitcoin ETF on TSX,1617455997,0,1
32,mj7xec,Loris156,0.0,I built a clock that shows cryptocurrency prices weather and forecasts,1617454417,25,1
33,mj7kzg,MTPokitz,0.0,Mining Bitcoin with computers more than four times more expensive than mining for gold,1617453013,2,1
34,mj7k9s,Banalfarmer-goldhnds,0.6369,Bitcoin is love,1617452926,49,1
36,mj7dx1,0xCuber,0.0,I own  bitcoins,1617452187,45,1
37,mj7bzw,Icy_Yard_8213,-0.5994,Civil war within Bitcoin,1617451955,1,1
38,mj78hp,s_josh_f,0.0,Why You Shouldnt Disclose Your Bitcoin Wealthtobe,1617451542,29,1
39,mj772m,daniel_sw,-0.4535,Theoretical question who profits more Buy the dip sell the peak and repeat VS Buy the dip hold and repeat,1617451388,25,1
40,mj75dd,hosannabrand,0.6908,Is Bitcoin Building Up Support Near ,1617451210,3,1
42,mj74zu,Botsfolio,0.5705,Bitcoin more likely to be successful than Ethereum in the long run Nothing can be like Bitcoin ever D,1617451170,2,1
43,mj71sr,Botsfolio,-0.1027,PayPal Allows Customers To Pay With Bitcoin To Merchants How about this for BTC adoption,1617450756,0,1
44,mj6z61,kapelo2018,0.7184,How do I buy Bitcoins,1617450443,2,1
45,mj6p7k,Jbob1390,-0.802,Sorry if this sounds ignorant but Im new to this is this a scam,1617449176,3,1
46,mj6o0i,Bozzaholic,0.7184,Trying to buy stuff from Newegg in the UK using BTC,1617449017,4,1
48,mj6im0,Jbob1390,-0.8442,Sorry to sound ignorant Im kinda new to this Got this message today on discord is it a scam,1617448312,0,1
49,mj6h3c,Outside_Express,0.7269,Is it silly to buy now,1617448106,26,1
50,mj6f8m,Pordlod,0.0,Crypto porfolio,1617447870,15,1
58,mj632k,paperboiko,0.7184,Buying bitcoins for non US residents,1617446242,12,1
59,mj62xc,hakoexe,0.2411,Bitcoin mining using phone without battery loss ,1617446220,0,1
60,mj5xa9,Educational-Horse177,0.4404,Make Bitcoin Easy One Time setup Only,1617445456,0,1
61,mj5tuh,LibrarianWide703,0.0,A Giant Bitcoin Whale Has Emerged Bitcoins Are Moving,1617445016,3,1
62,mj5tpt,vinnie_chapman,0.6124,Willy Woo A Bitcoin Will Be Worth Millions Of Dollars One Day,1617444998,102,1
66,mj5ojd,Luxusowy,0.25,If you care so much about Bitcoin stop posting its price and amount of your holdings post examples of adoption instead,1617444330,220,1
69,mj5c4e,SEAR_ME,0.2023,Just noticed that Bitcoin dominance has decreased some what does it mean,1617442643,22,1
74,mj4zl8,coolestbat,0.4588,Marvels The Falcon and The Winter Soldier E,1617440940,0,1
76,mj4piv,Negative_Comedian870,-0.4215,Bitter Chocolate,1617439538,0,1
78,mj4klg,debarunlahiri,0.4767,I have a question How long would it take to reach BTC with Mhs,1617438856,0,1
79,mj4ju1,bitcointothemoon_,0.0,Litecoin Signal Shines Suggests Downtrend Against Bitcoin Is Over,1617438743,0,1
80,mj4d3t,TheLazerWolfProject,0.0,Bitcoin symbol spotted in Falcon and the Winter Soldier ep,1617437825,23,1
84,mj45ie,Puppy-love-,0.0,Bitcoin is your own personal insurance,1617436817,4,1
85,mj4309,20210403,0.296,The Honey Badger of Money,1617436485,0,1
86,mj42ch,WDfx2EU,-0.5267,Stop telling people to stop disclosing the amount of BTC they own,1617436399,24,1
87,mj3yzt,investgaryeebitcoin,0.4019,We help people to get started with bitcoin,1617435938,0,1
88,mldl6e,BenTG,-0.3818,What would a BTC liquidity crisis look like,1617721171,37,1
89,mlddsb,sifuhall,0.0,Skeptoid podcast on Bitcoin,1617720596,1,1
91,mld8h9,BitcoinWide,0.3818,Nashville boutique hotel to accept cryptocurrency as payment,1617720184,13,1
92,mld6vt,droidsagd,0.0,Question on Bitcoin Perpetual futures and Spot order flow,1617720064,4,1
93,mld2zw,Choice-Group-5322,0.0,Bitcoin hovering,1617719762,1,1
94,mld20u,joshuad31,-0.1027,The last time I came on rBitcion to discuss the FBI and  Bitcoin I was ridiculed Are you certain this was the right thing to do Why not look at the evidence instead,1617719687,3,1
98,mlcxdz,TruthSeeker109,0.0,FIRST IN PERSON CRYPTO EXPO,1617719321,14,1
100,mlcr2v,EffyGold,0.4228,Any insight into why these havent confirmed yet Kind of frustrating New to BTC First transactions been stuck for  hours and the second has a high fee and is stuck too Any help appreciated,1617718841,6,1
101,mlcp0s,Botsfolio,-0.4404,Who Hates Bitcoin and Why Government amp Banks,1617718684,0,1
102,mlcmqq,francella92,-0.7184,When to sell,1617718511,15,1
103,mlclz1,No_Audience_3064,-0.8126,Why does the BTC community hate BCH and why does the BCH community hate BTC,1617718452,3,1
104,mlclp0,checksnchill,-0.4588,Some BTC whale is jealous Of ALT Coins,1617718430,0,1
106,mlcixb,geliton66,-0.6908,I want to sell my bitcoin,1617718221,0,1
107,mlcitx,MilkQueen,0.5574,Is PayPals crypto trade trustworthy,1617718214,0,1
108,mlchgu,Daveliuz,0.0,South Koreas Kimchi Premium Returns BTC and ETH Prices Jump  Higher Than the Global Average,1617718108,0,1
109,mlchg7,Daveliuz,-0.0644,Cryptowisser  NFT Marketplaces Dominate the Market but More Will Come as NFTs Continue to Boom,1617718107,0,1
110,mlcfg3,maxwavesb,0.0,Bitcoin this spring TOTHEMOON  JORDAN,1617717944,1,1
111,mlccxm,TobiHovey,0.0,UNICEF CryptoFund Gets  Million in Institutional Bitcoin Donation,1617717759,3,1
113,mlc6ch,SunnyBelanger,0.836,Is it a good time to continue buying bitcoin ,1617717252,2,1
114,mlbxwe,AluminiumMk1,-0.2263,The Verge Is there a future for bitcoin An investor and a skeptic debate,1617716557,11,1
116,mlbv8k,lavazzalove,-0.5106,Companies Offering Compensation In Bitcoin,1617716335,2,1
119,mlblk6,Wise_King_Raphael02,0.0,What is crypto ETF and ETP,1617715520,1,1
121,mlbjpw,fatma_ezzouhry,0.0,Cryptomonnaie  Analyse Bitcoin Ethereum Ripple XRP,1617715373,0,1
124,mlbeyq,adaddyofgirls,0.4215,Officially have over  of a Bitcoin Hoping to eventually own a whole coin,1617714973,0,1
125,mlbea7,FellatioFellas,0.2006,Maybe Kevin OLeary Is Ridiculously Claiming He Wont Own Any China Coin For One Very Good Reason,1617714918,12,1
128,mlbcgl,bitcointothemoon_,-0.3182,Dj vu Bitcoin Setup Near K Looks Similar to KBreakout Delay,1617714758,0,1
129,mlb9jr,TobiHovey,-0.5423,Mohamed ElErian Bitcoin Is Not Too Big To Fail,1617714517,1,1
130,mlb9im,Fiach_Dubh,0.128,Cathie Wood on Bitcoin Hitting a Trillion Dollar Marketcap amp Creative Destruction  April th ,1617714514,9,1
131,mlb5rd,khobi84,0.0,Intraday Market View for  Tuesday,1617714218,0,1
133,mlb1si,Amber_Sam,0.3182,The socalled Kimchi premium or bitcoin price difference in South Korea has hit  percent,1617713893,6,1
134,mlaysg,Routine_Rest8832,-0.6597,This guy is killing it Day Trading bitcoin almost X in  months,1617713628,4,1
135,mlax0b,Ajaypatel15,0.5267,Crypto lovers ,1617713474,0,1
137,mlaukn,EarthBoyZap,0.7184,The Day I Bought My First Bitcoin Ahhhh those were the days ,1617713262,0,1
138,mlas3w,ICameTolose,0.6369,What is your best case against investing in bitcoin,1617713040,36,1
139,mlarrt,GrE3nShark,0.0,Sacramento Kings Players Staff Can Get Paid in Bitcoin Owner,1617713007,2,1
140,mlaq61,Ill_Can5028,0.0,OMG Read The Bitcoin News here ,1617712861,0,1
141,mlanls,joshbobrowsky,0.0,Burrow CEO Stephen Kuhl Bitcoin amp Winklevoss Capital,1617712627,0,1
142,mlan93,shantiosito,0.4019,Bitcoin Rangebound With Support Near  lets go,1617712596,6,1
144,mlaif0,Dinah_Lynn,-0.3612,Whos down for a tease lol ,1617712146,0,1
145,mlahoe,sunnyraycom,0.0,Bitcoin Stories Diana Aguilar Bitcoin amp Crypto Journalist Venezuela episode ,1617712077,1,1
146,mlag1s,Dogecoinleap,-0.5868,Binance coin is really worth  what do you guys should I hold it or sell it,1617711930,0,1
148,mla5b3,MapleWizard802,0.6124,BISQ VS HODL HODL,1617710925,21,1
150,ml9ydc,Suspicious-Wallaby12,0.0,At what quantity should I take my btc off of the exchange,1617710315,49,1
152,ml9spp,Firstclasscreeps,0.0,Bit piggy  Creeptocurrency,1617709748,0,1
153,ml9r76,EstablishmentWide541,0.4404, profitable with Bitcoin,1617709596,0,1
154,ml9lgz,afiqazni,-0.6072,Dont just buy BITCOIN be BITCOIN,1617709014,0,1
157,ml9452,Alternative-Ad6901,-0.2732,What do you think about Bitcoins low scalability,1617707164,17,1
158,ml9277,slickcrypto_90,0.0,How can you cash out  wroth of bitcoins,1617706946,0,1
159,ml9242,bitcointothemoon_,0.6369,Summit Mining Crypto Mining Made Both Profitable amp Fair,1617706935,0,1
160,ml8zxw,watchurhp,0.7184,Buying with Cash,1617706720,5,1
161,ml8vhd,69HakunaMatata69,-0.6124,Is this a scam,1617706186,0,1
162,ml8so0,GroceryOk1476,-0.1027,Sacramento Kings To Pay Players With Bitcoin,1617705858,1,1
163,ml8qgd,achoccny,0.0,Cashing Out Large Amounts Of Bitcoin,1617705601,2,1
164,ml8og7,toxzl2,0.0,BTCS small US blockchain company has Charlie Lee as Independent Director,1617705355,0,1
165,ml8nq7,NoCampaign4770,0.0,Take a look at the state of the cryptocurrency market on the COINcom heat map,1617705271,4,1
167,ml8gs2,juniorboomerX,0.0,SEC reporting requirements Bitcoin,1617704440,6,1
168,ml8d9l,BitTradingMaster,0.0,Bitcoin Prediction ,1617704024,0,1
169,ml8cms,RepresentativeBad174,0.0,Any Predictions what bitcoin will do today,1617703946,9,1
170,ml873y,LismanAlexandru,0.8881,Hey there feedback needed We just started this educational series about bitcoin mining and the goal is to be structured and clear so that beginners can understand Were very interested in what you have to say so please tell us how to improve the series and what we should discuss next,1617703295,1,1
171,ml827c,flopperflop,-0.576,I am not interested in btc but I have a warning for you,1617702733,13,1
175,mnixlm,Ayrat333,0.0,Bitcoin,1617980032,3,1
181,mnin6a,TipUnusual8876,0.4404,Taxes on BTC received as a gift,1617979203,20,1
182,mnigoe,ysarsar,-0.6124,get scammed cause of google ads,1617978669,0,1
184,mniddu,SuckingOffaBitcoin,0.0,ONE simple thing we can all do to accelerate global Bitcoin mass adoption,1617978406,29,1
186,mnicww,SushiSpringRoll,0.0,What dictates Bitcoin price,1617978368,17,1
187,mni9l8,cuongtd,0.4847,Bitcoin never die ,1617978099,0,1
189,mni37w,MuliBoy,0.3612,Every bitcoin bull run is like another block confirmation,1617977578,10,1
190,mnhzmu,olivietti,0.0,What is Bitcoin  A very deep and philosophical answer,1617977277,0,1
191,mnhzji,Daveliuz,0.0,The Most Viewed Crypto Videos Ethereum Captured More Views on Youtube in  Months Than Bitcoin,1617977269,0,1
192,mnhyca,SuckingOffaBitcoin,0.4995,Colleague was just explaining to me about the market price and market cap of Bitcoinand why this makes the HODL Strategy magic collectively for all hodlers,1617977169,5,1
194,mnhvkc,Flunkring,0.0,Bitcoin taxes,1617976948,6,1
195,mnhupc,TickTockMrWick0,-0.4588,Do you guys think we will see btc dip below k,1617976879,1,1
197,mnhsxd,Finansman123,0.2023,Perianne Boring Bitcoin BTC could reach record highs this year,1617976757,7,1
198,mnhq7q,Quantimoon,0.0,Keynote Retail Central Bank Digital Currency CBDC,1617976528,3,1
199,mnhhmf,dikkitnit,0.0,How Bitcoin Fixes me  not by me  ,1617975800,1,1
201,mnhg3j,if_it_is_in_a,0.0,Naming the fractions of BTC,1617975673,30,1
202,mnhcs2,bulltrader2000,0.0,How to limit my Bitcoin node bandwidth usage,1617975388,4,1
203,mnharu,Basic_Bridge_8177,-0.34,Crazy how little morals these scammers have,1617975221,290,1
204,mnh95m,KendrickNg85,0.3182,What are your thoughts on Theta Do you believe it will be the next biggest hit amongst the rest of the Altcoins,1617975081,0,1
205,mnh7dq,khobi84,0.0,Intraday Market View for  Friday,1617974935,0,1
206,mnh6ce,Unusual_Exercise5219,0.6072,Michael Saylors Strategy to Retire Off of Bitcoin Without selling any,1617974843,4,1
207,mnh5qa,DrDankMemesPhD,0.0,A different way to view your Bitcoin balance,1617974788,16,1
210,mngw1l,BtcHoney,0.0,Bitcoin transaction not confirmed,1617973926,5,1
211,mngsvs,Coinchum,0.0,Crypto Crowdfunding,1617973648,1,1
212,mngsh1,AlonShvarts,-0.3612,There is only one way out of hyperinflation and that way is through hyperbitcoinization and continued ignorance of Bitcoin is proving to be expensive,1617973612,2,1
214,mngosc,insanicoffeetea,0.4588,do you think its possible to break  in  days,1617973284,2,1
219,mngh3y,mccormack555,0.0,COVID Lockdowns One Year On with Zuby  What Bitcoin Did,1617972568,2,1
222,mng6ga,Stock-Mixture8410,0.0,BITCOIN HOJE   FORMAS PARA COMEAR A INVESTIR HOJE  GRTIS  BITCOIN ,1617971516,0,1
228,mnfqk2,thomasKralow229,0.7096,The backstage of our hedge fund talks  trading stocks investing forexcrypto money financialfreedom profitopportunity success workfromhomethomaskralow dubai luxurylifestyle,1617969924,0,1
230,mnfj3e,GroceryOk1476,0.0,The electricity spent on bitcoin mining in China will be more than the total electricity consumption in Italy and Saudi Arabia,1617969171,3,1
231,mnfj36,oconnellcamera,-0.802,Bitcoin Selling Pressure is Declining Hints Key Glassnode Indicator,1617969170,0,1
232,mnfhdi,nomis_9,-0.6124,Binancial Scam,1617968995,11,1
233,mnfgbl,Hr876,0.0,BITCOIN IS ABOUT TO MAKE ITS NEXT MOVE TO ,1617968880,4,1
234,mnffwj,Money-Tucky1020,0.8225,Cryptocurrency Blowing up Giving is Caring,1617968836,1,1
235,mnfdhv,SisyphusDreams,-0.6124,bitFUG Giveaway Scam,1617968581,11,1
237,mnf8rx,EVERWILDOUTDOORS,0.0,Kanye West Jeff Bezos and Bill Gates tipped to be next big names in Bitcoin,1617968066,17,1
240,mnf1kx,Left_Rich_681,0.4588,Reasons why Bitcoin can see or surpass its Alltime high soon,1617967304,0,1
241,mnezcs,GroceryOk1476,0.1779,Bitcoin ATMs Are Growing Rapidly In CryptocurrencyFriendly Regions,1617967080,1,1
242,mney2d,asdfredditusername,0.0,Bitcoin ATM question,1617966945,5,1
243,mnewsl,asdfredditusername,0.0,Does anyone know whether or not Bitcoin ATMs require KYC when buying or selling BTC,1617966813,0,1
244,mnewe7,hosannabrand,0.6369,Why Bitcoin Could Rocket To  In ,1617966770,1,1
245,mnewbn,asdfredditusername,0.0,Do Bitcoin ATMs require KYC when buying or selling BTC,1617966761,0,1
246,mnevjr,nahaho,0.0,Borrowing against bitcoin,1617966683,22,1
247,mnesgg,CarnivalCandy20,-0.6124,Scam,1617966339,2,1
248,mnep6a,IntensityCareUnit,0.0,Bitcoin Rising  my first NFT on Opensea,1617965994,1,1
249,mnenpl,darianrrr,0.3612,Looks like bitcoin wants to go higher,1617965813,0,1
250,mneku0,Fiach_Dubh,0.0,Meltem Gives An Update on The Bitcoin Market Landscape  Coinbase Gold amp More  April th ,1617965470,6,1
256,mne9l8,SuckingOffaBitcoin,-0.2263,Forget alts Bitcoin is about to squirt a Moonshot see graph from my paid for subscription here,1617964107,11,1
257,mne8qk,reecytherapper,0.7184,BITCOIN TO THE MOON ,1617963997,4,1
258,mne72e,Alenai,0.0,Bitcoin Changed My Life  And Not In The Way You Think,1617963784,0,1
263,mnr4w4,frode7014,-0.1027,NBA Sacramento Kings to offer bitcoin pay option to players,1618003749,0,1
264,mnquj2,Turbulent_Guarantee8,0.836,SKL will bring the koalas safe to the moon ,1618002861,0,1
265,mnquc4,jonklinger,-0.296,Bitcoin Safety a book about protecting yourself from phishing scams and theft of your coins is out,1618002844,0,1
266,mnqt59,stamine,0.0,Is Coin Farm legit,1618002744,0,1
267,mnqsxi,thecryptovantage,0.8016,Is it really worth it to buy Bitcoin if you only have  available,1618002725,0,1
268,mnqpk2,frode7014,-0.296,For PayPal cofounder Bitcoin can be a Chinese financial weapon,1618002434,0,1
269,mnqpgt,Daveliuz,0.0,Scaling Bitcoin With The Erlay Protocol,1618002426,0,1
271,mnqhwb,RationalNarrator,-0.8271,Here a simple and short explanation of how Bitcoin works Im offering  in BTC to anyone who finds a factual mistake,1618001799,1,1
275,mnqeph,stellarowl12,-0.3326,Whats the Top FUD arguments that you hear against Bitcoin over the years I made a video explaining the Top  recycled FUD that Ive heard over the years,1618001526,0,1
277,mnq3me,MrSecurity87,0.0,  trillion market capitalization bitcoin    trillion infrastructure plan from Biden  coincidence,1618000587,0,1
278,mnpxfz,Flashy_Ground_3272,0.0,Tether coin,1618000060,0,1
279,mnpv5q,Bitcoin_Barons,0.4404,Bitcoin pump coming soon,1617999871,0,1
280,mnpnmx,Finansman123,0.0,Bitcoin BTC investor MicroStrategy blacklisted,1617999271,0,1
281,mnpmdu,sk2977,0.2023,MicroStrategy Performance since the start of its Bitcoin treasury program MSTR  BTC  NASDAQ ,1617999169,0,1
282,mnplz2,bitcointothemoon_,0.8126,Volatility Is Cryptos Best Friend,1617999137,0,1
283,mnpl5b,sidefly,0.0,Who Michael Saylor Was BEFORE Bitcoin,1617999071,0,1
285,mnpi9a,Daveliuz,0.0,Bitcoin Surge Has Kraken Considering Direct Listing,1617998841,0,1
291,mnpbjh,crypt0-j3sus,0.0,Putins coming for your Bitcoins,1617998306,4,1
293,mnp57r,Shutae,0.0,Bitcoin Privacy  all hodlers should read this,1617997769,0,1
300,mnoo1f,MessierIC1101,0.2263,Will you be prepared for BTC,1617996315,1,1
301,mnoni9,patrik_media,0.6249,Aperture a YouTuber with over  million subs published a great video about Bitcoin to the masses just minutes ago,1617996272,0,1
303,mnomd1,consultacpa,0.0,Is there a way to loan out your Bitcoin,1617996179,4,1
305,mnog97,Sylfaen8,-0.2263,Bitcoin atms disappeared in Portugal  coinatmradar,1617995666,1,1
307,mnocbg,misunderstandingit,0.802,Well since were sharing experiences with Scammers this one was fun,1617995346,10,1
309,mnobdt,Daveliuz,0.4995,The Art Of The HODL,1617995268,0,1
310,mno9nz,434_am,0.7602,The  is after all you have and bitcoin is the only exponential asset that will help you survive this Watch this video to understand it you wont regret it,1617995131,0,1
311,mno9bp,Logical_Username,0.4588,Getting my node up and running,1617995104,1,1
312,mnnz94,bbasssssyu,0.0,Bitcoin under carpet,1617994319,34,1
313,mnnz5w,CryptoCoveBTC,-0.2023,BITCOIN  Permissionless Borderless CensorshipResistant  Unstoppable,1617994311,3,1
314,mnnx2q,Zanziv,0.5574,Any women who got rich with bitcoin,1617994130,33,1
315,mnnvpr,Bubbly-Signature-938,0.8519,Trust investing win bitcoins faster join soon,1617994016,0,1
317,mnnmy3,Codyram5,-0.2263,My profittakinginvestment protection strategy stoploss orders set to  of the current price for positions which will see profit let the rest ride through the bear market Thoughts,1617993309,1,1
320,mnnau9,west------,-0.128,Btc unconfirmed,1617992310,9,1
322,mnn2tw,Daveliuz,0.4019,Chinese Tech Firm Meitu Buys  Bitcoin Treasury Now Holds  Million Worth in BTC and ETH,1617991649,0,1
324,mnn0ob,BashCo,0.0,Bitcoin Echo Chamber  April  Liveshow,1617991473,0,1
325,mnmz11,bitcointothemoon_,-0.4588,Ripple CTO Hints at XRP Ledger Upgrades to Enable an NFT Strategy,1617991343,0,1
327,mnmw01,Crafty_Supermarket15,0.7269,Willy Woo This is the first of the double tops this cycle Volatility is noticeably less this cycle,1617991109,2,1
328,mnmtpp,Vizion400,0.4466,SEC case against XRP should be a slam dunk WIN,1617990919,2,1
329,mnmlqm,unfuckingstoppable,0.7184,Bitcoin Fixes This Cops Seize K from Man Going to Buy Truck  April th,1617990256,2,1
331,mnmia3,StatusSuitable,0.296,how to withdraw money in another countries,1617989972,1,1
332,mnmh4h,sportifynews,0.0,Bitcoin vs Gold Which Should You Invest in Now,1617989876,1,1
333,mnmb74,micahangeloVII,-0.743,Private bitcoin supplier sounds legit s Anyway to auto block these disgusting scammers,1617989396,0,1
335,mnm8g7,campbed180,0.0,Beginners guide to Bitcoin Chart Analysis,1617989167,0,1
336,mnm6z0,EnyoHawk,0.7184,Get on everyone we are going to the moon ,1617989046,0,1
337,mnm4i5,lordagr,0.0,Coinbase  in Bitcoin for Joining   in Altcoins,1617988849,0,1
339,mnm3tj,Abdulahkabeer,0.3818,A Real Estate Company Owned by a CA Billionaire Will Start Accepting Bitcoin Rent Payments,1617988794,1,1
341,mnm2o0,TheOracleFTB,0.0,For those looking to manage their Bitcoin with a Trezor,1617988706,0,1
342,mnm0li,BashCo,0.0,Bitcoin Audible Guys Take   Bitcoin is Not What you Think it is,1617988538,0,1
343,mnlyon,TobiHovey,0.4767,Bitcoin ETF Approval Will Happen Morgan Creeks Mark Yusko,1617988385,1,1
344,mnlyl4,JustHereForTheBacon,0.0,How will the Coinbase IPO affect the price of bitcoin if at all,1617988377,1,1
345,mnlue3,Daveliuz,0.0,Executive Summary Why Every Fixed Income Investor Needs To Own Bitcoin As Portfolio Insurance,1617988042,0,1
347,mnlsbp,ricktik,-0.5106,Made my first NFT as an experiment offering this NFT including the physical pair of shoes,1617987877,0,1
348,mnlrq5,sylsau,-0.1027,There Are Two Kinds of People Losing Money With Bitcoin Impatients and NonBelievers,1617987836,1,1
349,mnlpds,Simplybitcoin1,0.0,Daily Bitcoin News April th ,1617987659,4,1
350,mrgfmt,Rosrit,0.0,rWallstreetbets bans discussions about crypto just after allowing it,1618498737,2,1
352,mrg9ze,Bitcoin-Manger,0.4588,Rap up my Head with bitcoin,1618498272,16,1
353,mrg3pk,r7GNM6NL,0.0,tool for tracking crypto portfolio,1618497752,1,1
355,mrg24g,Stock-Mixture8410,0.0,BITCOIN HOJE  PODEROSO BANCO MUNDIAL FALA SOBRE CRIPTOMOEDAS  BITCOIN ,1618497622,1,1
356,mrfv4j,epic-whale-services,-0.4588,If you lost password to your bitcoin we can found your password and bruteforce it,1618497019,2,1
358,mrfuab,loorene,0.0,The world is flat because of Bitcoin,1618496952,15,1
359,mrfto2,damnsonwhyyoutrippin,0.0,BTC to BCH address,1618496899,6,1
360,mrfs4w,Choice-Group-5322,0.0,My bitcoin is gonehacked,1618496768,2,1
361,mrfpy0,Glenncoco23,0.0,How do I do taxes for Bitcoin if I only sold a small amount of what I originally bought,1618496581,9,1
362,mrfol8,Substantial-Ad-5012,-0.2023,Bitcoin lows in March were in the s Feb were in the s and Jan were in the s,1618496461,2,1
363,mrfoca,Stock-Mixture8410,0.0,BITCOIN HOJE  CORRETORA DE CRIPTOMOEDAS VALENDO  BILHOES   BITCOIN,1618496439,1,1
364,mrfnks,bitcoinRN,0.0,Bitcoin vs other crypto today,1618496377,3,1
365,mrfnay,DrCrickets,0.7184,Proven BTC investment strategy Buy it Hold it,1618496356,1,1
368,mrfjoo,NeedleworkerNo2874,-0.5622,Well done Brother  yrs  RIP,1618496056,1,1
371,mrfh6a,Bitcoin_Magazine,0.0,Speedy Trial Has Been Merged Into Bitcoin Core Potentially Setting Path To Taproot Activation,1618495837,51,1
372,mrfe5p,Emotional-Ad-3475,0.4767,CNBC BlackRocks Larry Fink is fascinated of crypto,1618495585,6,1
373,mrfdup,spencertp31,0.0,Bitcoin is Humbling,1618495557,2,1
375,mrfbwc,MagicMonger,-0.128,Hodl vs short term trade,1618495394,15,1
376,mrfagz,TheZebrraKing,-0.7184,How to sell when you are under ,1618495271,13,1
378,mrf9zo,Stock-Mixture8410,0.0,BITCOIN HOJE  ITA VAI OFERECER INVESTIMENTOS EM CRIPTOMOEDAS  BITCOIN,1618495231,1,1
379,mrf6dx,c_barraud,0.0,Crypto Brief  April th   Christophe Barraud,1618494937,0,1
380,mrf2yr,The_Momox,0.0,Apparently peanut coin is the new new     ,1618494631,1,1
382,mrf2qa,BigPomegranates,0.0,Bitcoin and lightning,1618494613,10,1
384,mrezny,Lopsided-Crab-1245,0.2263,Bitfinex hackers carried about   million worth of Bitcoin BTC,1618494340,0,1
385,mrexze,forexworld41,0.7184,Btc to the moon,1618494202,2,1
387,mreupk,fjsuwjxjrnf,0.0,Can anyone explain the spike Is it a big buyer Im from stocks and I dont quite get it,1618493904,0,1
390,mreoqh,KimMarketer,0.0,Bitcoin vs Gold,1618493382,0,1
392,mrencx,TobiHovey,-0.1027,AXA Now Lets You Pay Your Insurance Premiums In Bitcoin,1618493258,0,1
393,mrelie,Forsaken_Winter9921,0.7184,Buy giftcards using crypto,1618493102,0,1
395,mregxd,khobi84,0.0,Intraday Market Open for  Thursday,1618492685,0,1
396,mredj3,fatma_ezzouhry,0.0,Latest Bitcoin price and analysis BTC to USD ,1618492365,0,1
397,mred9n,stephanlivera,0.0,SLP Peter Todd  Should Signal Have Used Bitcoin Instead,1618492341,3,1
399,mre98r,Creative_Agent_6785,0.836,What program is good for buying Bitcoin on the dips,1618491969,0,1
400,mre8cw,Boccon_Mattia,0.8807,Which is the best place to buy bitcoin,1618491885,0,1
406,mre1yb,BlueskyTailwind,0.0,Own  BTC and Have Another K to Invest More BTC or  ETH,1618491282,2,1
408,mrdysp,GammaSqueegee,0.0,First Inverse Bitcoin ETF Launches On Toronto Stock Exchange,1618490970,10,1
409,mrdwmi,paulinebigb,0.0,Bitcoin mining,1618490754,2,1
415,mrdnux,Consistent_Wrld_999,0.8807,Found some Bitcoin Merch thats not corny and I can actually wear with a  fit yes I bought the briefs ,1618489860,3,1
416,mrdn0c,Coin_Leg,0.4404,Easy bitcoin,1618489775,0,1
417,mrdmn2,DorothaBeam,0.0,AXA a multinational insurance firm is all set to offer a Bitcoin payment option for its customers in Switzerland making them the first allline insurer to do so,1618489740,0,1
418,mrdmcp,Consistent_Wrld_999,0.7184,Just bought some Bitcoin Merch ,1618489711,0,1
419,mrdlv4,dinero_jesus,0.5859,Amazing Facts About Bitcoin Halving,1618489658,0,1
420,mrdl9j,weskermode,0.0,Bitcoin ATM  Anyone seen these before,1618489596,0,1
421,mrdgv0,Jonawal1069,0.7184,Buy more BTC,1618489158,11,1
422,mrdfcb,Bitcoin_is_plan_A,0.4588,Goldman Sachs CEO David Soloman Acknowledges Bitcoin in st Quarter Earnings Call,1618489008,7,1
