Unnamed: 0,id,author,vader,title,created_utc,num_comments,score
3069,mn3qgn,kadudu888,0.8244,I dont know which is betterthe fact that Bitcoin will hit  this year or the fact that I am so committed to the idea so I have told everyone around me that Bitcoin will hit  this year so when it does hit I would be a legend,1617922480,10,1
3070,mn3p7t,Damxchange,0.0,Another hedge fund gets into Bitcoin This is all just getting started,1617922368,2,1
3071,mn3ou6,kadudu888,-0.0036,My exgf just texted me asking if I am still into Bitcoin I heard she isnt getting on well with this other guy as he just lost his job coz of covid and he is in arrear across everything Should I exercise my Bitcoin financial superpower and win her back or is this too lowhanded,1617922338,63,1
3073,mn3has,LegitimateTrash27,-0.5574,Thats a  gain they lost out on rip,1617921679,1,1
3074,mn3eid,DeFihippie,0.0,Bank account closure for Bitcoin purchase US Bank,1617921436,50,1
3076,mn39xn,thefoodboylover,-0.296,Peter Thiel Bitcoin may be a Chinese financial weapon says the Paypal cofounder,1617921048,6,1
3077,mn39fm,primalfabric,0.7906,Some pretty amazing developments are happening in bitcoin technology,1617921004,42,1
3079,mn367v,bumsebiene54,0.0,Scammer,1617920728,0,1
3080,mn34vf,Solid-Explanation-40,0.0,Ethereum Mini Airdrop last,1617920612,0,1
3082,mn2y6d,NckyDC,0.0,I made Bitcoin adoption guide for newbies,1617920065,0,1
3084,mn2twv,electrichour,-0.6597,Whats the counter argument to notion that bitcoins energy usage is environmentally destructive,1617919739,33,1
3085,mn2sk5,Daveliuz,0.0,Another Hedge Fund Gets Crypto Exposure via Grayscales GBTC,1617919632,0,1
3086,mn2ruq,primalfabric,0.0,What Bitcoin Trends will we see in  Any thoughts,1617919576,0,1
3087,mklgqx,GG-Enterprises,-0.6527,IRS wants to know about your Bitcoin this title kinda made me nervous when it dropped from my status bar ,1617631500,0,2
3088,mklfzo,Fishy-jo,0.7184,Bitcoin to the moon,1617631444,1,1
3089,mklfh6,botchan42069,0.3182,BTC Twitter account recommendations please,1617631405,8,1
3092,mkl68f,Abdulahkabeer,-0.4588,How Hacking Affects the Cryptocurrencies Market,1617630667,0,1
3093,mkl4is,GearFinancial4469,-0.7184,A Store In Izmir Turkey Started Selling Clothes With Bitcoin,1617630533,0,1
3095,mkl0z8,michell-gail,0.0,Bitcoin Mining Manufacturer Ebang Officially Launches Crypto Exchange,1617630252,1,1
3096,mkkv2e,bitcoincharities,0.8313,NEA Charitable Fundraising Services Can Now Accept Bitcoin for All Major Charities,1617629772,0,1
3099,mkkpi8,sportifynews,0.2263,New Wall Street Bitcoin Report Reveals Radical  Bitcoin Price Model Worth Understanding,1617629311,23,1
3101,mkknjc,MrDopple68,0.0258,Does Currency matter,1617629149,3,1
3102,mkkni3,khobi84,0.0,Intraday Market View for  Monday,1617629146,0,1
3103,mkklhu,kadudu888,0.7184,Walmart is buying Bitcoin Boom,1617628986,9,1
3104,mkklac,GearFinancial4469,0.0,MicroStrategy Buys  m Bitcoin,1617628967,1,1
3105,mkkkvj,moneyfreedom101,0.0,Gigachad Michael Saylor with a Bitcoin artifact,1617628932,1,1
3108,mkkbra,GearFinancial4469,0.0,Kevin Olearys attentiongrabbing China and Bitcoin announcement,1617628204,0,1
3109,mkk7fv,ohnoh18,0.0,Grayscales Intentions for a Bitcoin ETF,1617627856,58,1
3110,mkk4qp,rola0602,0.6908,Famous Comedian Bill Burrs Bitcoin Story Excites You,1617627637,0,1
3111,mkk0a6,Downtown-Web9709,0.0,Bitcoin in Denmark,1617627257,16,1
3112,mkjtvq,kadudu888,0.8807,What is the best way to get your parents to start buying Bitcoin so ultimately you will have some,1617626703,16,1
3114,mkjl9m,bitcointothemoon_,0.0,MicroStrategy Spends Another USD M on Bitcoin,1617625942,0,1
3116,mkjgrs,chancelloramerica,0.0,Liquidating BTC,1617625532,0,1
3118,mkj9bl,ohnoh18,0.3612,Michael Saylor on Twitter MicroStrategy has purchased an additional  bitcoins for  million in cash at an average price of  per bitcoin  As of  we hodl  bitcoins acquired for  billion at an average price of  per bitcoin MSTR,1617624854,360,1
3119,mkj83j,ohnoh18,0.0,MicroStrategy Acquires Additional  Million in Bitcoin at Average Price of ,1617624743,24,1
3120,mkj7pc,CoinCompassBTC,0.0,Do you have a Bitcoinrelated question Ask us amp we will answer it on our next QampA episode Bitcoin Basics Podcast,1617624708,0,1
3122,mkj6w4,Dense_Break_6289,0.0, CryptoTab           ,1617624638,0,1
3125,mkj2si,LilFractal,0.3612,Inventor of the screw pump,1617624262,0,1
3126,mkj0u7,michelle_conte,-0.1531,Bitcoin Solves Oil Flaring Problem,1617624094,11,1
3130,mkiemk,StarCrunchPunch,0.0,Bitcoin in the distant future,1617621942,2,1
3135,mki1xw,cryptokickstarter,0.0,Crypto Kickstarter Experiment,1617620670,1,1
3136,mki08r,4050Dennis,0.0,Crypto Networking,1617620512,0,1
3137,mkhxoy,Ridge_Soarer,0.0,Moving continents with Bitcoin metal seed backup plate,1617620251,76,1
3138,mkhuvn,BiggerWiggerDeluxe,0.4215,Norwegian newspaper that predicted the  gain in  months is now predicting bitcoin to half in value very soon Is it time to sell and buy the dip,1617619919,12,1
3143,mkh2an,itskayyuhvin,0.5423,Some optimism for Bitcoin this coming week,1617616607,1,1
3144,mkgw3t,plaxtito,0.0,btc  lean back keep it simple,1617615835,5,1
3146,mkgvel,xentagz,0.1027,Major Dutch retail bank ING urges customers to take their savings elsewhere Cash money has become a liability,1617615747,23,1
3147,mkgug7,Outside_Express,0.0,Cheapest way to get my BTC off Binance,1617615634,4,1
3148,mkgqmn,No_Fly_5159,-0.4588,Advice on withdrawing my profits,1617615166,11,1
3152,mkgjhy,plaxtito,0.0,btc kept simple,1617614333,0,1
3153,mkgjcy,botchan42069,0.7506,How true is the opinion that one can get filthy rich with BTC,1617614317,19,1
3156,mkgdh2,Cheap_Paramedic_5252,0.0,Swap BTC for DOT,1617613619,2,1
3157,mkgcd8,SpedesRulez,0.0,BTC situation,1617613476,15,1
3158,mkgap6,urchatbot,0.0,Making a difference in my life with BTC,1617613280,3,1
3159,mkg5m0,myurtsever,0.5256,Follow on Twitter NowonBitcoin displays the most accurate crypto live prices charts and crypto news from the worlds most trusted crypto exchanges,1617612649,1,1
3161,mkfyzb,sylsau,0.5106,Find Out What Bitcoins Relative Strength Index RSI Is and Why It Does Matter,1617611839,0,1
3164,mkfios,Itchy-Ad3944,0.0,Whats wazirx token and why its price is rising ,1617609836,0,1
3165,mkfhxj,bitcointothemoon_,0.0,Bitcoin and Ethereum Consolidate XRP and BTT Outperform,1617609742,0,1
3166,mms7v5,SimpleSwapExchange,-0.3818,China Threatens the US With Bitcoin,1617889785,11,1
3167,mms6vb,NubeDePedos,0.4588,I dont really know what came over meI saw the dip and I just bought,1617889703,0,1
3169,mms47e,Intelligent-Glove474,0.0,I need someone who can supply me with Bitcoin,1617889503,0,1
3170,mms0o7,NickyK01,0.6486,Bitcoin is the answer Fed Chairman goes on record to tell the truth  CoinVatic,1617889215,3,1
3171,mmrxxz,GroceryOk1476,0.0,  Million Bitcoin Address In Action After  Years,1617888977,6,1
3172,mmrxki,SpeaKrLipSync,0.0,Elon Musk Prediction for   Meme or reality,1617888941,5,1
3173,mmrnke,MindlessBadger281,0.5719,First  invested into Bitcoin happy to have taken the first big step,1617888072,16,4
3174,mmrnbm,novex9029,-0.4767,I just ruined my life Beware of scams Please help me,1617888053,14,2
3176,mmrhp5,Stock-Mixture8410,0.0,BITCOIN HOJE  MELHORES CRIPTOMOEDAS PARA INVESTIR EM   BITCOIN NEW,1617887568,0,0
3177,mmrg34,oconnellcamera,0.296,Fiat not Crypto and Bitcoin Predominantly Used in Money Laundering  BTCMANAGER,1617887434,7,1
3178,mmrfw1,SilverSlevin,0.0,The US Dollar is a CURRENCY,1617887415,3,1
3179,mmrc8d,floodedbard,-0.4019,Bitcoin Core Transaction Confirmation Problem,1617887088,20,1
3182,mmr5st,khobi84,0.0,Intraday Market View for  Thursday,1617886519,0,1
3183,mmr34j,Substantial-Ad-5012,0.0,Bitcoin will never go to zero in my lifetime,1617886273,714,2
3185,mmr016,pixlbabble,-0.0516,Btc Noob Question,1617885983,13,1
3186,mmqvba,Bitcoin_is_plan_A,0.4404,From euro coin to digital euro thanks to Bitcoin Lightning Network,1617885538,0,1
3190,mmqr8g,bitcointothemoon_,-0.0516,New South Korean Crypto Crackdown not Bluster as Banking Ties Strain,1617885134,0,1
3191,mmqp9n,vintagegirlgame,0.4767,Back in the game using Unemployment  to buy Bitcoin,1617884943,35,1
3192,mmqp3q,Stock-Mixture8410,0.0,BITCOIN HOJE  COFUNDADOR DO PAYPAL SUGERE REGULAMENTAO  BITCOIN NEWS,1617884924,0,1
3193,mmqoup,DogIndividual5787,0.7184,Buying Bitcoin,1617884899,8,1
3194,mmqkr4,FMEX_PH,0.2263,Why to one strategist bitcoins worth ,1617884476,5,1
3196,mmqd1j,Daveliuz,-0.8519,Petition Calls on New SEC Chairman to Drop Ripple Lawsuit and End War on XRP,1617883735,0,1
3197,mmqamo,userbeneficiary,0.0,Bitcoin in the Future Space Expanse,1617883484,10,1
3201,mmq32i,salil19,0.4588,Many Bitcoin Analysts call for rally beyond  Heres Why,1617882750,4,1
3202,mmq2yr,stay_liquid2,0.296,India joins the money printers,1617882740,1,1
3203,mmq0tk,Kenley_Dylan,0.7184,Guide on how to buy VAR Finance BSC token that will skyrocket in this week,1617882515,6,1
3204,mmq0be,miningbitcoinsue,0.0,Bitcoin Mining at your HOME,1617882461,0,1
3205,mmpvm4,Blockgeni,-0.4588,Whales Deposit  Million USDT in One Hour to Grab Bitcoin Dip,1617881960,0,1
3206,mmpufz,GiveRedditHugs,0.0,I just started Bitcoin mining,1617881824,0,1
3208,mmpmo9,bitcointothemoon_,0.0,Phemex Launches OTC Trading Enables Crypto Purchase with Bank Transfers,1617880947,0,1
3209,mmplnz,jacobcole008,0.0,A Year in Ripple Price Seeing a  Surge,1617880839,0,1
3212,mmpb68,althu__________,0.8689,Buy win,1617879668,6,1
3213,mmp9tg,divided-lady,-0.1027,Sophisticated Bitcoin Scam,1617879523,0,1
3214,mmp7sm,Bitcoin_is_plan_A,-0.296,Billionaire Peter Thiel on Bitcoin as a Financial Weapon By China Against the US Dollar,1617879277,3,1
3219,mmoxui,iwasanacidbaby,0.34,Even if Bitcoin increases in value how will it mean anything if you compare it to future inflation,1617878159,16,1
3221,mmotjl,luckyyorick,0.0,Real poker face of a bitcoin billionaire,1617877639,1,1
3222,mmoq8h,sylsau,0.5859, Tips To Win at the Bitcoin Accumulation Game,1617877232,4,1
3223,mmoo18,Old_Ad5632,0.2023,bitcoin and ether mining with playing games,1617876971,1,1
3224,mmonez,TheMadeLifestyle,0.7184,Just bought my first  in bitcoin,1617876889,213,1
3225,mmojp5,ForkastNews,0.5719,Ripple wins access to SECs internal documents on Bitcoin and Ether,1617876426,5,1
3227,mmoaqd,GroceryOk1476,0.0,Tesla CEO Elon Musk could start paying rent with Bitcoin BTC,1617875338,31,1
3228,mmo36x,-Blr-,0.7184,A heads up a few potential catalysts are coming up this month,1617874324,79,1
3230,mmny3b,badlandschugss,0.0,Where should I get bitcoin and how should I store it,1617873650,8,1
3231,mmntx5,Bitcoin_is_plan_A,0.6369,The cryptocurrency complex  led by Bitcoin  is the best hedge against hyperinflation because it resides outside of the mainstream financial system,1617873110,0,1
3232,mmnt2r,shali_desh,0.0,What is the bit coin price today,1617873003,0,1
3233,mmnqs6,Aromatic-Body-457,0.6369,Bitcoin the greatest invention since the discovery of agriculture,1617872684,6,1
3235,mmnoxm,ary1x,0.4404,Is my crypto safe,1617872452,7,1
3236,mmnldn,jamsmash2020,0.5423,Is BTC superior to all other cryptos,1617871999,2,1
3238,mmnj57,blunathan,0.0,Aside from Big companies and billionaires that own hundreds or thousands of Bitcoin What might be now the average for us Regular Common people Is  btc the average More Less,1617871699,22,1
3239,mmngkt,anshm1ttal,-0.3182,Our countries may ban bitcoin but our favourite hodling period is forever,1617871347,0,1
3241,mmnck3,PulitzerPrice,0.4019,How Coinbase Square and Fidelity will support Bitcoin,1617870820,1,1
3242,mmn9dc,CCZone,0.4588,Top Bitcoin Price Predictions,1617870437,0,1
3243,mmn8t6,Q9capital,0.0,Q Capital Sponsored Henri Arslanians Crypto Capsule Commentary,1617870360,0,1
3244,mmn81y,pocketnl,0.7964,Looking for Call of Duty Warzone players that want to win Sats over lightning ,1617870261,0,1
3246,mmn518,Bitcoin_is_plan_A,0.0,Mining Bitcoin with Nuclear Power,1617869875,3,1
3247,mmn45i,statypan,0.8402,I am all in on Bitcoin but honestly isnt the transaction fee too high for a everyday currency,1617869768,118,1
3249,mmn1th,j4kz,0.2263,To anyone worried that Bitcoin has taken too long to breakis unable to break k and are tired of waiting for another jump,1617869466,1,1
3252,mmmxnx,bitcointothemoon_,-0.7184,GAMEE Token GMEE to Launch on Uniswap on  April  Public Presale Sold Out in  Minutes Concluded M USD Private Presale,1617868945,0,1
3253,mmmxhd,Creepy-Purchase-5630,0.872,I feel like the floor weve trading in is solid The red days are rarely running without a quick come up Do you believe like me were in a healthy consolidation or like others that this a peak,1617868922,3,1
3258,mlupwa,bitcointothemoon_,-0.25,Bitcoin and Ethereum Stuck In Range While Altcoins Rally,1617771737,0,1
3260,mlunxp,Due-Toe9263,0.0,Bitcoin Beggar,1617771525,0,1
3261,mlunre,BBQCopter,0.0,Chinas Digital Currency Has Nothing to do with Bitcoin,1617771504,13,1
3262,mluhno,Due-Toe9263,0.0,Bitcoin begger,1617770826,4,1
3265,mlucmi,AsherTheNi9gerfucker,-0.6597,I fucked ur mom and I used bitcoins as digital Anal beads,1617770282,3,1
3266,mlu9dh,bitcointothemoon_,0.296,TA Bitcoin Corrects Below K But Heres Why Uptrend Is Still Intact,1617769939,0,1
3268,mlu0un,Karm_Me_up,0.5106,Grayscale Bitcoin Trust GBTC Files To Become an ETF with SEC  April th ,1617769063,14,1
3269,mltyin,TyrionTheTripod,0.4215,How Bitcoin saved my life,1617768821,10,1
3271,mltve0,Daveliuz,-0.4588,North Korean Hackers Threatened Bithumb Exchange With a M Ransom Amid the  Data Breach Says Report,1617768497,0,1
3273,mltjwt,redditofuse,0.5719, bitcoin bounty reward on The Falcon and the Winter Soldier on Disney,1617767322,0,1
3275,mltfo3,2021WereDoomed,0.0,My Retirement Plan Is Bitcoin  Now I just need to invest in it firsthaha,1617766903,0,1
3278,mlt6df,chriserlarreglo2005_,0.0,To the people who already invested in Bitcoin where should I start,1617765973,14,1
3280,mlt45y,Dumpster9,0.8074, BTC  BILLION OUT FLOW FROM EXCHANGES TODAY HUGE BUY SIGNIAL  BIG TECH COMPANY WHO WAS IT,1617765765,9,1
3281,mlt0xm,FMEX_PH,0.4939,Crypto Economy Nears  Trillion XRP Gains  BTC Dominance Drops to ,1617765463,2,1
3283,mlstke,MTPokitz,0.3818,Major Bitcoin players unite to form trade group to promote crypto,1617764745,1,1
3284,mlstgd,OBconnect,0.561,Crypto will make millionaires this bull run What do you guys think will be the next x,1617764735,1,1
3287,mlsji7,grrrrbark,0.4263,In Korea BTC crushed K resistance and is currently trading at K at  premium Look at this beautiful graph,1617763798,0,1
3288,mlsiwy,grrrrbark,-0.4215,In Korea BTC crushed K resistance and is currently trading at K at  premium,1617763748,0,1
3291,mls8ex,VampireVlad,-0.6597,How amp Why Michael Saylor amp MicroStrategy Can Become Bitcoin Villains,1617762768,5,1
3292,mls8ca,cloudava,0.0,We need a bitcoin name list,1617762761,5,1
3293,mls4kf,zolopei,0.0,Bitcoin Analysis With Metcalfes Law,1617762400,4,1
3297,mlrs2i,Daveliuz,0.0,BitcoinPegged Token Crafted by Binance Swells BTCB Now Commands  Billion Market Cap,1617761259,0,1
3304,mlqyya,Feeling-Sail-4331,0.0,Instala el navegador CryptoTab y comienza a ganar dinero extra por solo usarlo Mientras ests viendo vdeos en YouTube leyendo noticias y usando las redes sociales de la manera en la que lo haces a diario consigues bitcoines reales,1617758598,0,1
3305,mlqtfv,B0atingAccident,0.0,According to Crypto Quant k coins left exchange reserves in the last Hrs,1617758102,0,1
3306,mlqs0k,Jethroe1,0.7096,Bitcoin Hashrate Surpasses AllTime High as Even  ASICs Stay Profitable Bitcoins hashrate is moving alongside its price as old and new mining machines come online,1617757974,4,1
3307,mlqi0z,FireGarPax,0.624,What traditional assets is Bitcoin now more valuable than,1617757094,7,1
3308,mlqgk6,PsychologicalCost5,0.34,How to Easily Calculate Taxes on Your Bitcoin Earnings,1617756954,83,1
3309,mlqdks,elizabethalice205,0.8709,The key to trading success is emotional discipline If intelligence were the key there would be a lot more people making money trading,1617756683,1,1
3310,mlq8ee,A1_Power,0.0,This is why Bitcoin,1617756209,1,1
3313,mlq008,stonkscar,-0.7184,Selling a Car for Bitcoin,1617755429,10,1
3314,mlpsjd,JoeyDiamondHands,0.0,Crypto Exchanges,1617754742,1,1
3315,mlpsi0,MeesterRorke,0.0,SWAN bitcoin wont give me my bitcoin for a month,1617754738,11,1
3318,mlpn7x,Slapshot382,0.0,Bitcoin iPhone wallpaper live price chart,1617754269,9,1
3319,mlpkth,Daveliuz,0.0,NBA Team Sacramento Kings to Offer Players the Option of Getting Salary Paid in Bitcoin,1617754057,0,1
3322,mlpga0,Slownnn-blue,0.0,Mobile Crypto Currency,1617753657,0,1
3324,mlpbt3,BTCLasVegasFinder,-0.6486,I found  Bitcoins but cant liquidate them Am I screwed,1617753251,0,1
3328,mlp18i,Slapshot382,0.0,Was wondering if there were currently any Bitcoin related in person conferences,1617752281,3,1
3330,mloz2l,consciouscell,-0.6908,Michael Saylor There is No Way for Bitcoin to Fail,1617752099,22,1
3331,mloqnh,BashCo,0.0,Tales from the Crypt Citadel Dispatch e  bitcoin privacy and coinjoin with chris belcher and waxwing,1617751362,0,1
3332,mlooag,CryptoLover507,0.4019,I wish to Convert or exchange karmas in Bitcoins,1617751169,9,1
3334,mlom2i,drippa1111,0.0,Concept crypto,1617750980,2,1
3335,mlolex,tweezy_14,0.0,DeFi on Bitcoin,1617750919,75,1
3336,mlol6q,jfl88,0.0,What happened to Bitcoin transaction fees in Dec   Jan ,1617750899,20,1
3337,ml2r2j,TheLazerWolfProject,0.0,Sell your tesla buy more bitcoin,1617680695,3,1
3338,ml2qs3,akkun88,0.0,Bitcoin beginner,1617680667,8,1
3339,ml2m1p,weird_case,0.8402,When BTC goes high enough to change your life what do you intend to buy with it,1617680211,112,1
3340,ml2loi,kadudu888,0.9552,In  we will think even with Covid  is a great time just like how in  we think  was a great timeand if you had bought Bitcoin any time between  and you would be fine,1617680175,12,1
3342,ml2gag,Nazmul2203,0.8074,BUY WOOF COIN PLEASE,1617679665,3,1
3343,ml2c6d,austinmcraig,0.0,In  I lived on bitcoin for all expenses for  months Here is what some of those purchases cost in todays prices,1617679290,8,1
3344,ml2aku,The_Weekdae,-0.4588,Each dip I drip,1617679141,0,1
3345,ml250y,Angelina-B,0.7184,How high will the Bitcoin price rise,1617678649,14,1
3346,ml22ql,csharpdressedman,0.5574,When Bitcoin has been truly adopted most users will have no clue about the  bull run,1617678437,3,1
3347,ml22np,Daveliuz,0.8176,BTC Futures Open Interest Hits B Binance Captures Lions Share Signals Say  Chance of K Bitcoin by Months End,1617678429,0,1
3348,ml21vx,PulitzerPrice,0.5106,The worlds largest bitcoin manager vows to convert digital trust into an ETF,1617678358,1,1
3349,ml21l6,HessInvestments,0.0,A brief statement of my Bitcoin journey,1617678330,1,1
3350,ml1zs5,liverbump1,0.7184,Bitcoin Gold to the moon,1617678171,3,1
3355,ml1hq8,Rinatm,0.0,Bitcoin price at least k before Crypto Winter sets in  Michael Venuto,1617676511,1,1
3358,ml17cq,COVID19MurderHornet,0.0,Sacramento Kings to Offer Bitcoin Salary Option to All Players,1617675567,52,1
3359,ml168c,_613_,-0.6022,Biggest block in past hrs had little effect No sellers here ATH    gt K next fib stop,1617675468,1,1
3360,ml15w0,FMEX_PH,0.7184,To the moon Cryptocurrency market cap surges past  trillion,1617675437,12,1
3363,ml13hh,PrinceWhoPromes,0.0,Is Peter Schiff really against Bitcoin,1617675227,12,1
3365,ml11w1,donaldpercy,0.0258,Finally took some profits today so I could order this absolute animal A big thank you to everyone whos given me some solid advice over these past few months,1617675087,1,1
3366,ml1127,no-cap-sherlock,0.0,Bitcoin and behavioral econ,1617675010,8,1
3367,ml0z5u,ForSaleByBTC,0.7783,Seeking Advice How Best to Accept BTC for House,1617674846,2,1
3371,ml0tmq,Any_Salamander8084,0.0,RECOVER YOUR BITCOIN,1617674378,0,1
3372,ml0sin,Fun_Letter8435,0.6249,What great move began the movement Hey manare you HODLing,1617674285,1,1
3373,ml0pmi,SatOnMyBalls_,-0.886,To all the scammers DMing me about trading my Bitcoin for me sorry I lost it in a boating accident youll have to find someone else to scam,1617674034,8,1
3374,ml0okv,lilchefievert,-0.7184,What happens when you sell millions of bitcoin,1617673945,8,1
3375,ml0kwc,gengarmang17,0.0,bleacherreport on Instagram Bitcoin Giannis when asked what he does for a living  via itsdanielmac,1617673618,0,1
3377,ml0h54,BashCo,0.0,Bitcoin Audible Read  Noahbjectivity on Bitcoin Mining Nic Carter,1617673285,0,1
3378,ml0ghq,olivietti,0.0,Bitcoin Reservations  Weekly Recap,1617673227,0,1
3380,ml0e3a,incomemaker,0.4767,Giving Ebook on Bitcoin from Amazon kindle,1617673020,0,1
3382,ml03ud,DIVINEORDER8,0.7096, WHATS MOVING THIS BTC PUSH UP TO  ANY NEWS AVAILABLE THANKS,1617672102,2,1
3383,ml00jx,daydrinkingwithbob,0.2263,I did a video on why Im putting more than  of my net worth in Bitcoin over the next few months,1617671815,12,1
3384,mkzxgc,aeiousb,-0.4019,I want to go down the rabbit hole,1617671544,17,1
3385,mkztos,Daveliuz,0.5775,Shark Tanks Kevin OLeary Will Only Buy Clean Bitcoins  Says Institutions Will Not Buy Blood Coins From China,1617671230,0,1
3386,mkzsc3,weroureta17,0.8271, How i can buy bitcoins i need help P,1617671109,6,1
3387,mkzs0z,Blackcatloki,0.0,Scammer math is a bit off,1617671085,8,1
3389,mkzi7a,PoGoHarrison9two,0.4019,How much would Bitcoin have to average each day in growth to reach the potential of coin by the end of ,1617670241,36,1
3390,mkzf3v,VampireVlad,0.34,Why Bitcoiners Should Play Final Fantasy X,1617669969,16,1
3391,mkzetc,Glass-Matter-1428,-0.9039,What we need the most now more dumbass investors blindly throwing in money into crypto scams to create more FUD in Bitcoin after such schemes collapse ,1617669944,0,1
3392,mkzdrk,addi1973,-0.2263,IRS is demanding to know BTC balance,1617669856,39,1
3393,mkzb16,soceity,0.2263,A year ago I found a bug in ATampT and they paid me  on HackerOne I decided to have the bounty paid out in Bitcoin directly to my Coinbase account A year later that  is now worth over ,1617669627,165,1
3395,mkz6hm,Joepro2112,0.0,Zcash  Bitcoin ,1617669224,1,1
3397,mkz1x0,krodos_,-0.7297,SCAM or nah,1617668839,6,1
3398,mkyxvt,SubstantialBat5149,0.0,Btc loans,1617668503,12,1
3399,mkyri4,kadudu888,-0.6705,The daily Bitcoin move is now nearly  months of my salary In comparison staking my time and my youth working continuously at a rat race job for peanuts pay is the worst PoW investment ever,1617667954,1,1
3400,mkypoh,kadudu888,-0.6705,The daily Bitcoin move is now nearly  months of my salary In comparison staking my time and my youth working continuously at a job for peanuts pay is the worst PoW investment ever,1617667796,107,1
3401,mkynya,Daveliuz,0.0,Today Bitcoins Satoshi Nakamoto Turns ,1617667649,0,1
3402,mkyndr,kadudu888,-0.6249,The daily Bitcoin move is now nearly  months of my salary Staking my time and my youth working at a job is the worst PoW investment ever,1617667596,1,1
3403,mkyklt,eyeoft,0.0,Bitcoin is trading near  in South Korea as Kimchi Premium returns,1617667360,21,1
3404,mkyjr2,Fx_Crypto_Binary,0.7096,Ive BTC for sale Good rateHit me up right away,1617667283,0,1
3405,mkyity,olareddit00,0.5859,Wow Ripple CEO says each Bitcoin transaction costs  gallons of gas,1617667214,0,1
3406,mkyex0,NinerGiantRedDevil88,0.4019,Bitcoin Documentation Help,1617666866,3,1
3407,mkyeta,kadudu888,0.7297,Do institutions HODL better than retail,1617666856,6,1
3408,mkydry,GroceryOk1476,0.0,Description of bitcoin BTC mining from Ripple XRP CEO,1617666769,0,1
3409,mkycb2,lavazzalove,0.6249,Cameron and Tyler Winklevoss are back  this time as budding Bitcoin billionaires at the center of the future of money the creative economy and quite possibly a new operating model for Big Tech itself,1617666653,5,1
3410,mkybuz,500khz,0.5949,Why has Bitcoin stayed at  so long,1617666609,45,1
3411,mkyadb,roger_pct,0.7906,Give me your best bitcoin saved mefreed me story,1617666484,4,1
3412,mky8g2,GreatJobKeepitUp,0.0,Even if bitcoin went to one penny,1617666316,5,1
3414,mky1bn,Reasonable_War276,-0.7351,RECOVER YOUR LOST OR STOLEN BITCOIN,1617665716,3,1
3416,mkxtmz,SPedigrees,0.8271,Kevin OLeary says he will buy clean coin not bitcoin from China,1617665081,5,1
3417,mkxsro,ICameTolose,-0.34,Does the anonymous nature of Bitcoins founder bother anyone,1617665013,32,1
3419,mkxlx9,wasabilemon,-0.5423,Btc is about to drop,1617664428,4,1
3420,mkxl2l,tmoney159,0.9118,Im a new YouTuber creator focusing on Bitcoin and other investments What are your thoughts on my analysis I appreciate your feedback and support Ultimately I think the fundamentals right now are set up perfectly for widespread adoption,1617664359,0,1
3421,mkxjgu,Abell68,0.4588,Top  Companies Holding the Biggest Bags of Bitcoin,1617664224,61,1
3422,mkxjdt,J-be-like,0.8481,Buy k now or hold on its pretty much most I can do,1617664217,36,1
3423,mqt54k,whothefuckisjoerogan,0.4588,If history repeats itself the top might be closer than we think What do yall think,1618414642,0,1
3425,mqt12r,Bitcoin_Magazine,0.4215,This weeks Bitcoin Optech newsletter covers progress on Taproot activation a Bitcoin Core PR Review Club meeting and more,1618414307,1,1
3427,mqsmxh,geffpants,0.0,places where I can purchase prepaid MasterCard in Australia with BTC,1618413185,4,1
3428,mqslnt,Gariasrg,0.7964,THE ULTIMATE CRYPTO PUMP  BEST STRATEGIES TO TRADE CRYPTO NOW,1618413078,1,1
3430,mqsjtu,BrickTamland125,0.7184,Buying Bitcoin in Bulk,1618412936,12,1
3431,mqsiap,Hootsumdaddy,0.0,Average shiller vs Average Hodler,1618412807,1,1
3432,mqsfju,loic_supreme,0.0,Bitcoin passing Gold market cap,1618412592,4,1
3433,mqsf26,clipcity213,0.0,Bitcoin newcomer,1618412556,5,1
3434,mqsdit,SatOnMyBalls_,0.0165,A community to laugh at and mock the butthurt no coiners in rButtcoin These guys are like flat earthers claiming Bitcoin has no value despite the reality around them of what Bitcoin has grown to today,1618412433,9,1
3435,mqsbkk,BitcoinWide,0.3818,Eeven Miami will accept Bitcoin says its first major club to do so,1618412280,1,1
