Unnamed: 0,id,author,vader,title,created_utc,num_comments,score
8487,mwtnpa,BathroomBroker,0.6008,Bitcoin is NOT BROKEN  hang in there guys  rough night anyone else not sleep well This currency is the backbone of everything its not going to collapse were living were living ,1619179267,9,1
8488,mwtni1,PhatAssBoy8,-0.34,Just got into Bitcoin and seeing contradictory views need advice,1619179247,17,1
8489,mwtnhy,BarelyHereIGuess,0.4588,I managed to buy the dip,1619179247,5,1
8493,mwtiae,lifelongnov1ce,-0.3818,How likely are the following scenarios for losing your bitcoin,1619178702,4,1
8499,mwtew6,sonicode,-0.7003,I put my hand upon yo hip when I dip you dip we dip ,1619178357,3,1
8503,mwtb4f,HumbleGeniuz,0.0,The triple snakehead double tiger chart called this,1619177973,2,1
8507,mwt3cf,JoelOnCrypto,0.0,Bitcoin is  this year I am  this year,1619177102,5,1
8508,mwt0u2,gintrux,-0.4585,Is there any crypto onrampofframp service that could be used without any KYC  reward if you tell me,1619176836,0,1
8510,mwsz40,kleintjeskrant,0.6166,Fuck HODL I sold at k bought back at k and gained  BTC Who else was smart enough,1619176644,0,1
8511,mwsxv6,Sir_Baldington,0.0,Trying to understand the impact of Bitcoin Options  April expiration,1619176509,0,1
8513,mwsxq2,A117Z,0.0,Addressing some of the environmental concerns around Bitcoin,1619176493,1,1
8514,mwsum8,Yossarian2000,-0.5859,Why crypto is a giant fraud  article and rebuttals,1619176143,11,1
8515,mwsu7w,DerpDolphin2017,-0.4588,Ive lost  mil in BTC in  week,1619176101,9,1
8516,mwstyw,PM_BTC_FOR_SURPRISE,0.3724,I dont understand why BTC mining pools dont attack shitcoins,1619176074,7,1
8517,mwstad,giraffeteacher,0.0,BTCUSD What now,1619175988,3,1
8521,mwsp5w,tradri3,0.0,Can Bitcoin experience a massive transaction congestion,1619175559,8,1
8523,mwsmdp,VampireVlad,-0.4588,Why Bitcoin Is Bullish Even When The Price Dumps,1619175233,1,1
8524,mwsm04,BakersDozen,0.0,Down  in  hours  in a week  in a month and up  in  months,1619175186,42,1
8525,mwslui,Emotional_Swim5030,0.4588,Long term investing,1619175168,7,1
8528,mwsivl,EVERWILDOUTDOORS,0.0,Could Ethereum overtake Bitcoin as the worlds leading cryptocurrency,1619174824,6,1
8529,mwshyi,Ram_Pam_Pam,0.4588,EU wakes up after US night shift,1619174717,0,1
8532,mwse3q,2892958278274,-0.4019,Bitcoins dominance drop,1619174282,0,1
8533,mwsdyf,No_Cauliflower9135,-0.296,I refuse to believe that the Bitcoin market cap will stay under a trillion,1619174268,1,1
8535,mwsaqy,Happy-Butterscotch75,-0.9495,Hi guys quick question  I know the  dip yesterday isnt that big of a deal when you zoom out and no Im not panic selling BUT why is it that the whole crypto market took a dip yesterday  Did something happen or was it mass panic selling a cross multiple coins ,1619173877,17,1
8536,mwsaj3,GUCCI_Q,0.0,A brief list of Bitcoin dips in ,1619173850,0,1
8537,mws81z,deksters1er,-0.8402,when you dip i dip we dip,1619173555,7,1
8539,mws7tr,mr_cutarescu,0.4588,Is it going up,1619173529,14,1
8540,mws5yj,npjprods,0.4019,I panic bought,1619173314,1,1
8541,mws5sv,robjits91,0.7184,Just bought my first ever amount of bitcoin,1619173297,12,1
8542,mws5nz,o_sulivan,-0.0258,Thanks for the dip,1619173281,6,1
8543,mws558,philipskywalker,0.4588,Dip bought sir,1619173226,1,1
8545,mws186,Illustrious_Ad2607,0.0,Cryptotab,1619172761,0,1
8546,mws0aq,Jeanecek,0.4588,Bought the dip and ,1619172651,3,1
8548,mwrwaa,coinsmash1,0.0,Billionaire Took Psychedelics Got Bitcoin and is Now Into SPACsBloomberg,1619172170,0,1
8550,mwrulm,antyzoned,0.7184,Buying time,1619171986,10,1
8551,mwruct,mountainbonobo,-0.5423,Binance margin liquidation is yet again the leading cause of this dip,1619171953,5,1
8553,mwru6v,-------I-------,0.0,Hypothesis Elon Musk will announce a solar powered Bitcoin mining operation in the near future,1619171929,1,1
8555,mwrtgw,NoLoveInTheSouth5150,-0.2732,So do yall think the reason for this crypto crash is because of Bidens plans to raise capital gains tax,1619171833,15,1
8556,mwrt95,Odd-Contact-1922,0.836,Is now a good time to buy Bitcoin,1619171808,1,1
8558,mwrss5,PurpleDonuts21,-0.4588,Lets discuss this current dip and the coming months,1619171747,0,1
8559,mwrqy1,SlyCopper93,-0.6486,Loss porn My frist  dip,1619171510,1,1
8560,mwrqqd,TheRappingYogi,0.4588,I woke up with a massive correction this morning,1619171481,0,1
8561,mwrq20,bkrall,0.0,Find this insightful crypto content,1619171399,1,1
8563,mwrpdu,bkrall,0.0,BTC LOOKING BEARISH,1619171313,2,1
8564,mwrp3f,BTC_scrub,-0.6808,How low are we going to crash in your opinion,1619171277,28,1
8567,mwrm64,-PussMeister-,-0.7717,I was seriously thinking of selling,1619170891,22,1
8568,mwriuo,Iammyownworstenemyk,0.7184,NEED ADVICE Should I buy more bitcoin or just altcoins,1619170463,0,1
8570,mwrh6w,Habartino,0.6072,If I dont sell the taxes wont effect me,1619170253,9,1
8571,mwrgni,RemoteMaleficent2697,0.1779,Best investment during market crash  ,1619170194,1,1
8572,mwrfwk,RemoteMaleficent2697,0.3612,What to buy when market when market crash,1619170095,0,1
8574,mwrfau,i_dont_normally_,0.3612,Hodl and chill,1619170016,3,1
8576,mwrcu4,Uberob,-0.5423,User uUberob predicted crash with precision,1619169691,0,1
8578,mx2dyb,tinyvela,0.7184,Hello all Im new to this where do you usually buy your bitcoins,1619204131,17,1
8579,mx2cbj,Everydogehasitsday,0.0,Is the a crypto bible,1619204006,5,1
8581,mx2awl,ShldVBoughtBitcoin,0.0,The US Dollar after getting punched by Bitcoin,1619203895,4,1
8582,mx2ah3,BQ-Palpitation-713,0.0,Are we up or down Coinbase,1619203863,5,1
8583,mx2a3e,Fuelrod_22,0.0,Greyscale still seems bullish,1619203831,10,1
8586,mx26f5,kkehoe1,0.0,BTC Newbie,1619203554,9,1
8587,mx265b,Boatsman2017,-0.7184,Selling BTC for fiat,1619203530,7,1
8589,mx260h,MustyBlumpkin,0.0,Milo threw out laptop with  BTC on it  how many others did this,1619203520,0,1
8590,mx25sd,NoHedge_H-O-D-L,0.296,This money printing is not sustainableRun the numbers,1619203503,0,1
8591,mx25m8,Panitar,0.0,bitcoin networks,1619203489,2,1
8593,mx20kg,Stock-Mixture8410,0.0,BITCOIN HOJE  ETHEREUM  VOCE PRECISA SABER SOBRE CRIPTOMOEDAS  BITCOI,1619203093,1,1
8594,mx1zl3,pince,0.25,Benjamin Cowen respected bitcoin analyst gives a pep talk at the end of his video today to those that are currently feeling uncomfortable,1619203018,62,1
8595,mx1y8t,fireballx777,0.0,Saylor eyeing the price in the past few days,1619202916,1,1
8598,mx1ru5,color_creator,-0.5719,Does anybody find that rbtc the subreddit for bitcoin cash basically became a sub where people go and hate on bitcoin,1619202432,5,1
8599,mx1re8,Xdzhen,0.5697,Guys I made a medal for everyone who keeps holding and hasnt sold their Bitcoins during this harsh time ,1619202399,0,1
8601,mx1mjp,capgrzzly,0.4588,buy the dip,1619202035,1,1
8602,mx1jtj,SnooTangerines4358,-0.5267,Crypto corrections hurt I try to swallow it with my Buffet Theory,1619201836,1,1
8603,mx1hex,samdane7777,-0.3818,Expansive standards for surveillance threaten human autonomyour message to FATF  Coin Center,1619201654,1,1
8604,mx1h7g,reeceappau,0.7184,Should I buy bitcoin now,1619201639,0,1
8608,mx1cho,CardiologistOne6339,-0.7184,Ive been selling my used panties online,1619201291,4,1
8612,mx17nb,Bitcoin_Magazine,-0.5574,Bitcoin PeerToPeer Trading In Nigeria Rises  Since Central Banks Ban,1619200920,1,1
8613,mx1772,Confident_Pin_8506,0.0,Cryptocurrency mining equipment shop and more Spring Sale   Reduced prices,1619200887,0,1
8614,mx16p5,red_carpet_magic,-0.5994,The Bear Market right now watch til the end,1619200852,10,1
8615,mx15oz,john1982-59,0.0,The Big BTC Con,1619200787,11,1
8616,mx14ud,Bitcoin_is_plan_A,0.6908,US Marshals Service awards BitGo M to help it hold,1619200721,2,1
8617,mx145d,KiraRyuke,0.8567,HELP When to buy,1619200667,8,1
8618,mx13dd,Plomaritis,0.0,Bitcoin my LIFE CHANGER,1619200609,2,1
8622,mx0y65,cryptiz95,0.1531,cryptocurrency This is how you become rich Follow this and get over the fear BTC ETH LTC BCH,1619200210,1,1
8623,mx0x70,jam-hay,0.552,When you start enjoying the dumps more than the pumps,1619200137,7,1
8625,mx0wbz,Alexander_ALL_in,0.3182,Ladies and gentlemen please place your bets will btc go up or down Tommorow ,1619200068,0,1
8626,mx0ubi,quemeister,0.0,Why Im HODLing,1619199916,4,1
8627,mx0u7w,ReallyLongLake,0.0,Bitcoin Mining on the Commodore ,1619199909,2,1
8628,mx0sd6,dieseldan101,0.4588,Liquidation complete Back on up trend,1619199773,12,1
8629,mx0rgr,PhotoProxima,-0.0583,Can someone explain Craig Wright to me Wouldnt it be super easy to prove if you are the creator of BTC IT seems like a simple binary question that should never end up in court What is his claimevidence,1619199710,12,1
8630,mx0rd9,obamastansloveme,0.3182,Bitcoin Hits k,1619199701,4,1
8631,mx0qe2,Devildog0491,0.5267,This goes out to all you retail investors showin up here the last few months pretending youve been here for years,1619199630,0,1
8633,mx0jm8,LemmeGetDatOC,-0.4939,Ill warn ya next time my wife starts talking about bitcoin prompted by my father in law,1619199120,0,1
8635,mx0i7m,Buddygunz,0.4588,Buy the dips Lost k in  years,1619199013,40,1
8638,mx09zm,aksinya_sidorova,-0.5859,Biden tax plan devastates cryptocurrency market overnight,1619198399,8,1
8639,mx07cw,AndoCalrizzian,-0.5423,Is there anyway to determine when a transaction will fall out of the mempool after being unconfirmed for an extended period of time,1619198193,15,1
8640,mx0750,Neogan89,-0.5994,Bear with me,1619198177,2,1
8641,mx053c,Swccper,-0.7739,BTC bear media causing FUD,1619198019,7,1
8643,mx00ci,serajeas,0.3566,Bitcoin is more than money,1619197671,7,1
8644,mwzzz2,Far-Ad-1862,0.2263,What do you think Bitcoin will be worth in September,1619197642,14,1
8646,mwzsrs,wmredditor,0.6808,Louisiana House Passes Surprise Bill Praising Satoshi and Bitcoin For  Trillion Market Cap,1619197110,8,1
8648,mwzno8,buybitco,0.7184,how to buy bitcoin,1619196709,0,1
8649,mwznkn,Pufpufkilla,-0.1027,Question to Canadians or anyone who understands this article Bitcoin Tax The CRA Goes Hard After Crypto,1619196699,13,1
8650,mwzn48,ChronicTheOne,0.3182,Whats your source of information when you see huge dips and drops,1619196663,9,1
8651,mwzlcj,wilsonjay037,0.8402,I just bought the dip and i will keep buying ,1619196529,0,1
8652,mwzk9a,kriptoparasite,0.0,sayfa balk ayrca Bitcoin  dolarn altna dyor,1619196450,0,1
8653,mwzjun,kriptoparasite,0.0,Bitcoin  dolarn altna dyor kripto para birimleri ar bask altnda,1619196421,0,1
8655,mwzix0,MGTOW_and_Bitcoin,0.0,I have discovered a brand new fallacy due to the debate between Michael Saylor and Frank Giustra,1619196357,13,1
8656,mwzimg,Bitcoin_Magazine,0.0,Bitcoin Price Drops Below  Over  Billion In Trades Liquidated,1619196336,3,1
8657,mwzfuj,FieldOwn9763,-0.2732,Why is it that Coinbase charges more than the market price to purchase Bitcoin,1619196129,9,1
8659,mwzb01,cryptodude1957,0.4019,need help finding my old bitcoins I cant remember exchange I used,1619195758,0,1
8660,mwzawe,vcn14,0.0,Morgan Stanley Bitcoin Fund Draws M in  Weeks Filings Show,1619195748,6,1
8661,mwz9vo,neehapolitical,-0.4588,Fear of Tax Bitcoin plumate,1619195670,0,1
8663,mwz6yt,bloodydifficult,-0.4588,Taking Profits,1619195452,7,1
8665,mwz4ty,rach2bach,0.7906,A friend that works for a certain crypto company our chat is interesting,1619195285,0,1
8666,mx7p4v,Bemo98,0.0,Have a bitcoin  conference ticket,1619220014,13,1
8667,mx7o5l,Twelver313,0.0258,BITCOIN GODS PLEASE STOP THIS,1619219920,101,1
8668,mx7mxg,NeilComedy,0.6142,Struggling your whole life then you finally make a few bucks by buying Bitcoin and then this sshLe who took none of the risk wants to take  of it from you,1619219807,0,1
8669,mx7mar,thiagovscoelho,0.0,I wrote a glossary of bitcoin slang phrases what do you think about it,1619219751,0,1
8671,mx7ly2,NeilComedy,0.6142,Struggling your whole life then you finally make a few bucks by buying Bitcoin and then this asshole who took none of the risk wants to take  of it from you,1619219719,0,1
8672,mx7jnv,Cryptotian27,0.9094,Everybody should go buy dentacoin DCN while the price is HOT  HODL,1619219516,1,1
8673,mx7j2v,RedSparky26,0.0,Crypto Tax Question,1619219462,0,1
8677,mx77l7,superm8n,-0.1531,The nonexistent energy problem of bitcoin,1619218437,32,1
8678,mx761s,opuspryda,0.5106,how can we create a digital system of money beyond gov control theoretically,1619218308,0,1
8679,mx75rn,opuspryda,0.5106,how can we create a digital system of money beyond government control theoretically,1619218282,0,1
8680,mx73gv,andystacks,0.0,Cathie Wood ARK Invest on Bitcoin,1619218076,5,1
8683,mx6nh1,randrand127,0.0,Bitcoin Blockchains,1619216665,3,1
8685,mx6jha,Luisperezonline,0.0,Just keep HODLING ,1619216321,0,1
8686,mx6hw0,block1king,0.0,bitcoin collateral,1619216186,2,1
8687,mx6h4g,dhwqbehqwe,0.0,Telsa and Bitcoin,1619216122,2,1
8689,mx6do9,Bitcoin_Magazine,0.6808,TAKE A LOOK AT THIS Getting your friends into Bitcoin like,1619215828,3,1
8690,mx6dcn,DaveC138,0.0,Anyone of the view that BTC isnt THE future,1619215801,68,1
8692,mx6cns,kadudu888,-0.8979,What should we tell new panicking newbie whos selling coz of the  dip,1619215742,10,1
8693,mx6cjj,jam4ever_75,-0.4588,BTCs Dip is almost over,1619215733,2,1
8694,mx6c0f,Rappareenola,-0.8402,How can I use my BTC as down payment on a home and then have it back when I sell the home,1619215693,14,1
8696,mx65uv,kobisbeta,-0.8519,Big bitcoin sell off coming according to the fat ugly man in guganhime,1619215168,10,1
8697,mx63zb,NeverStopStacking,0.7184,Buying bitcoin,1619215008,2,1
8698,mx63ur,KashifSheikh786,0.0,The History of Bitcoin In  Minutes,1619214996,1,1
8699,mx63p9,arn_dt,0.5994,I met this guy online and he is claiming to help me to get money with crypto,1619214982,46,1
8700,mx60x9,mechanify,-0.296,Stop seeing Bitcoin as stocks,1619214752,9,1
8702,mx5xau,willthrowaway_,0.0,Prediction How much itll rise after the dip,1619214453,13,1
8705,mx5gas,strongwingstofly,-0.2738,Hillorie Le Crypto to Riches Review DO NOT BUY,1619213012,37,1
8706,mx5f4q,savertooth77,0.0,BTC as a hedge against inflation,1619212913,7,1
8707,mx5die,Winichskorn,0.5859,Is there any way to buy Bitcoin with no KYC that is not PP,1619212782,9,1
8708,mx5ber,Inittilltheend45k,0.34,Excited about the bitcoin rising,1619212614,5,1
8709,mx59q6,pawpex21,0.9246,Not even half way to the top of this bull run Buy and Hodl,1619212477,6,1
8710,mx59kb,_glock23_,0.4767,Why is Bitcoin valuable at all,1619212463,0,1
8711,mx5509,Embarrassed-Two3582,0.3612,Is it hard to buy crypto or am I just doing it wrong,1619212082,0,1
8712,mx50pn,rich-bich96,0.296,Money Movement,1619211729,6,1
8713,mx4xfq,linsanityy,0.1779,Banking Solutions for Bitcoin Companies,1619211465,0,1
8714,mx4wz2,Bitcoin_Magazine,0.7845,Bitfarms To Join Foundry USA Pool Will Boost Mining Performance Up To ,1619211426,1,1
8716,mx4tet,Uberse,-0.5423,Why Bitcoin Is Bad for the Environment,1619211117,13,1
8719,mx4pm0,TheOracleFTB,0.0,For crypto newbies How to send and receive cryptocurrency,1619210791,0,1
8721,mx4k4r,Aggravating_Bit_5252,0.7184,I bought from a atm,1619210338,10,1
8723,mx4ebj,AvaJohnson01,0.0,Bitcoin Trading,1619209856,0,1
8725,mx4amp,urrTech,0.8109,Why is the transaction fee so high right now It hasnt been this high since ,1619209558,7,1
8727,mx48vq,CrocoDeluxe,0.3612,What HODLing feels like recently,1619209412,0,1
8728,mx44n8,pawpex21,0.8633,We are less the half way in this bull run This chart show   and now wher we at Buy and hold,1619209080,18,1
8729,mx43ms,nikita2607,0.7906,Is bitcoin Working like this xD meme,1619208999,1,1
8732,mx421u,sumcollegekid,0.0,What is everyones opinion on the GBTC price if it turns into an ETF and returns to NAV,1619208872,0,1
8736,mx3xao,hdn75,-0.4588,Fixing the dip in EUR zone,1619208496,0,1
8740,mx3oe4,Just_Go_Full_Tilt,0.0,For anyone thats wondering whats happening to the markets its all this guy,1619207809,0,1
8741,mx3o53,BashCo,0.5106,Fun with Bitcoin Interview with Bitcoinmotorist,1619207785,0,1
8743,mx3kp2,TheNegaPoon,0.765,Financial Darwinism is playing out before our eyes So many HOGS coming into BTC and loading up their entitlement portfolio just to be slaughtered when they SODL at the first bump Please can someone help me rekindle my empathy for these people who refuse to do their homework,1619207493,27,1
8746,mx3jcc,Doufu,-0.7184,BTC Sell off,1619207375,0,1
8747,mx3hly,Solid-Context-7623,-0.4588,OnChain Metrics Explain The Bitcoin Price Dip,1619207239,0,1
8750,mx3cn1,WhoCaresForUsernames,0.6597,Some offtopic How long would you play this game,1619206840,10,1
8752,mx381j,SatoshiHeist,-0.5423,Recent Bitcoin Drop,1619206471,12,1
8753,mx35aw,GS_Doge,0.0,Main trend Elliott Waves and BTC distribution,1619206247,0,1
8755,mxuvs4,OpinionsAreUseless,0.0,Bitcoins Creator,1619304172,30,1
8756,mxuty4,Thatguyguygu,0.2878,you will receive a total of  dollars worth of berry coins,1619304016,2,1
8757,mxuri4,thisisntus997,0.4588,Is there a way I can find out how long my transaction will take Been waiting  days,1619303803,2,1
8760,mxul0w,Get-Rich-or-Die-Tryn,0.4404,Why I think ont Ontology Blockchain decentralized identity will be good for bitcoin and defi,1619303238,1,1
8761,mxukpl,Jeffersness,0.128,Crypto and legal weed financing,1619303209,4,1
8763,mxuhqm,ianmd,0.25,Found this originally on Reddit Any clues who created it,1619302945,54,1
8764,mxufjq,ouagadougou,0.0,Finding the ATH with Datascience,1619302759,1,1
8766,mxue90,Crypto_Raffles,0.0,Crypto Raffles  Tesla Model ,1619302648,1,1
8767,mxudxp,roachsmoker,-0.3875,When hodling until youre  years old and dont care about dips,1619302621,0,1
8769,mxuau4,kras_G12d,0.0,CONTNAGO BTC trade,1619302351,7,1
8774,mxtral,No-Librarian9752,0.0,Why wont bitcoin get regulated,1619300698,9,1
8775,mxtl8b,bruh_360,0.0,Why I think Dorian Satoshi Nakamoto is creator of Bitcoin,1619300188,4,1
8776,mxtj6z,koavf,0.6597,Jack Dorsey and Elon Musk agree on bitcoins green credentials,1619300012,63,1
8778,mxthoq,ExtHD,0.0,Bitcoin vs History,1619299879,0,1
8779,mxtgkk,BitFoliobiz,0.9781,Bitcoin BUY BUY BUY Buy Signal,1619299790,3,1
8780,mxtfik,Deanobrown2332,0.0,Btc Withdraw unassigned for  days,1619299698,8,1
8782,mxt4ff,impermanentlife,0.0,China and other countries own digital currencies  impact on BTC,1619298776,6,1
8784,mxsswr,Almighty_Tony,0.3182,This memes just hit different Watch your bitcoin ,1619297804,0,1
8785,mxsr1b,novakid703,0.0,Question about bitcoin and Robinhood,1619297653,9,1
8787,mxsnrq,slimejester,0.0,Elon Musk to host Saturday Night Live on May ,1619297388,22,1
8788,mxsnla,astoradota,0.0,Newbie Bitcoin Questions,1619297372,12,1
8791,mxsa9x,LifeOfjulio,0.0,Bitcoin Node  Raspberry Pi,1619296238,16,1
8797,mxrx88,iamtheprimeminister,0.0857,Its actually insane they write an article like this   percent LOL Bitcoin falls  percent to   Reuters UK,1619295141,0,1
8798,mxrw47,jacquesfuriously,0.0,May th will be next ATH,1619295043,8,1
8800,mxrnq4,_Patata,0.7184,I need to buy BNB or BTC with Paypal,1619294364,13,1
8801,mxrnef,WafflePooPooPP,-0.6124,Bitcoin is a large scale scam along with other crypto,1619294335,22,1
8803,mxrgra,AlexForeroHB,-0.9001,Is the dip over All the ones that panicked and sold ,1619293777,126,1
8804,mxrfcg,AfroInfo,0.0,Is coin market cap bugged,1619293663,1,1
8805,mxrdq3,FreedomNetwork1,0.6597,How much money can I save on fees using Bench Address,1619293519,4,1
8810,mxr2da,WhoIambrosis,0.2878,After completing this course you will receive a total of  dollars worth of coins,1619292565,2,1
8813,mxqx51,PeptideBond,0.6369,Surprisingly high network fee,1619292129,25,1
8814,mxqspc,tritone567,0.2732,Is bitcoin going to facilitate the creation of a oneworld global economy,1619291763,40,1
8821,mxqdqz,Djonso,0.34,How to keep track of my bitcoin value,1619290574,18,1
8822,mxqc1o,Background-Party-860,0.3818,How will credit economy be with Bitcoin,1619290436,14,1
8823,mxqa2v,matrixdiff,-0.128,Bitcoin transaction still unconfirmed after  days,1619290272,6,1
8824,mxq6f3,DrDankMemesPhD,0.0772,What do you want if youre a Bitcoin maxi,1619289971,6,1
8825,mxq5mv,MichaelRIR,0.34,Diamond hands  My BTC purchases since ,1619289906,0,1
8826,mxq344,SatoshiHeist,-0.4588,April nd Bitcoin Dump  Current Thoughts,1619289706,3,1
8828,mxpxkp,PartyScrewer,0.0,Question How does Bitcoin influence altcoins,1619289261,6,1
8829,mxpv02,Zealousideal-Rich-70,0.0,Bitcoin bot on telegram,1619289058,0,1
8831,mxps1d,Sophea_Mey,0.9303,If you improve by  everyday within a year you will have improved unless your compounding interest is much higher  Progress is progress no matter how small Envision the future you want and start taking the steps that will take you there,1619288811,2,1
8833,mxpm6y,Powerful28,0.0,US State Passes Resolution Commending Satoshi Nakamoto and Bitcoin,1619288343,5,1
8835,my770h,Amber_Sam,0.4019,Demand on the crypto side has been multiplefold to what we initially expected Theres a lot of excitement  DAN SCHULMAN CEO OF PAYPAL,1619353175,46,1
8836,my73nq,BitFoliobiz,-0.5,Bitcoin has no intrinsic value,1619352824,18,1
8837,my7219,Emotional_Swim5030,0.4588,Crypto for long term,1619352645,7,1
8842,my6xcm,amand000william,0.5994,This how you can take advantage of the  bull run of bitcoin,1619352163,0,1
8843,my6wlg,AlphaMonkey724,0.0,Bitcoin stays the same,1619352084,4,1
8844,my6vex,rola0602,0.0,EthereumComplete Guide on Worlds Second Crypto,1619351977,0,1
8846,my6qmy,russiancheese9,0.7184,Someone just bought Btc for USD according to Bittrex,1619351420,0,1
8847,my6o6u,BitFoliobiz,-0.5106,Who said that crypto investing was stressful,1619351147,1,1
8848,my6my8,throwaway7776_,0.0,I always wanted to be a millionaire thought id just ask reddit,1619351004,0,1
8849,my6mrq,russiancheese9,0.4588,New all time high,1619350982,0,1
8850,my6ltl,pleasegivemeyourbtc,0.0,Why would I NOT go all in on BTC,1619350875,35,1
8851,my6ibg,Matyg123,0.5994,When Bitcoin corrects in a bull market,1619350440,221,1
8852,my6i3r,BlackMetalIstWar,-0.296,First time buyer worried,1619350415,8,1
8853,my6flh,medical_syndrome,0.0,Digital coins,1619350112,1,1
8854,my6djw,Ok-Treacle5621,0.3182,Tip me  Dogecoins or  BTC please,1619349876,0,1
8855,my6cz6,Intelligent_Effort41,0.0,bitcoin italy,1619349816,0,1
8856,my6asu,Intelligent_Effort41,0.4939,BitKong Sng bc Bitcoin  Trang web nh bc bng bitcoin tt nht,1619349577,0,1
8858,my69et,Chaoulov,0.0,Still holding my BTC What about you,1619349425,14,1
8859,my692s,adam3us,-0.4588,hashrate mostly recovered to  EH about  below EH peak vs  down at  EH last weekend,1619349389,12,1
8860,my67rd,Lazy-Adhesiveness916,0.0,Bitcoin is the FuneralBurial of our information technology age,1619349230,8,1
8861,my675u,Thatguyguygu,0.2878,you will receive a total of  dollars worth of coins,1619349152,3,1
8862,my66ic,Chaoulov,-0.7184,What is your position Hold or Sold,1619349076,3,1
8863,my65mp,Meal_Successful,0.7992,Sideways bitcoin goes and whether up or down nobody knows Should it go down Ill hodl some more but should it go up Ill buy some more,1619348969,8,1
8866,my5x6l,Visible_Purple5476,0.0,Exchange doge to btc,1619347961,0,1
8867,my5wg6,zcpu,0.128,What negative things in your life have you left behind to invest in Bitcoin Good vibes only please,1619347876,67,1
8868,my5vfz,WayTo1ETH,0.0,Why the Winklevoss twins dont lend out their k Bitcoins but collect Bitcoins from their customers for lending,1619347754,0,1
8869,my5p20,Danielpedersem,0.7184,Bitcoin moon,1619346967,0,1
8871,my5ko4,CandisBalding,0.34,Louisiana Government Applauds Bitcoin and Its Anonymous Creator Satoshi Nakomoto,1619346433,0,1
8872,my5j6t,Newsjunkeefromlondon,-0.3182,Bitcoin loses its grip on  as weekend trading slumps,1619346244,5,1
8873,my5j2o,TradeBitter,0.4019,Crypto enthusiasts are looking at Doge like no coiners look at Bitcoin,1619346231,0,1
8874,my5gff,Bitcoingalore,-0.128,Join the Bitcoin Billionaires Discord Server,1619345922,0,1
8875,my5g3j,hit_th3_lights,0.0,Is Eve Online CEO bullish on bitcoin,1619345880,1,1
8876,my5fgf,Feisty-Trainer3099,0.7003,Safe Poodle the next Moonshot x Safe day young k holders CMC ang CG Listing coming soon,1619345808,0,1
8877,my5dq7,MachinariumPunk,0.0,TSLA to disclose Monday new bitcoin purchase,1619345611,0,1
8878,my5d6o,Dk_Oneshot01,0.6808,itcoin Girl Shell Protect Us Thru The Dip  Moon Soon ,1619345540,1,1
8879,my5cwh,Punrawee,0.3818,with wedsite can ship to thailand and accept bitcoin,1619345507,3,1
8880,my5alc,gabriel_kaye_1,0.5574,Please should I invest huge in bitcoin Need your advice,1619345234,2,1
8881,my54qh,Bitcoin_is_plan_A,-0.0516,Google searches of Bitcoin have just reached an alltime high in Turkey  following the governments recent ban on payments,1619344511,0,1
8882,my4vqi,r448191,0.0,How much more power is going to be required before bitcoin maxes out,1619343319,42,1
8884,my4uao,firimitura,0.0,Guys Wasnt the ATH in December Why are they talking about September,1619343138,0,1
8885,my4u5y,Lazy-Adhesiveness916,-0.296,If you think the energy consumption of the Bitcoin Network is damaging to the environment then consider this,1619343122,5,1
8886,my4slc,TheWorldBeyond11,-0.128,You guys ready for the next plunge,1619342916,15,1
8887,my4see,Bitcoin_is_plan_A,0.0,Did the louisiana house pass a bill commending Satoshi amp Bitcoin,1619342886,0,1
8889,my4rck,crypto_pub,0.2023,BTC Dominance Sinks to  ETH Valuation Rises  CoinQuora,1619342750,2,1
8894,my4j2n,RotiKirai,0.0,Why on earth is the general public drawn more to DOGE instead of BTC,1619341709,0,1
8896,my4azz,Wild_Attitude,-0.4588,Now Below K USD Is that right time to invest in bitcoin or wait for still to down,1619340707,1,1
8897,my4aqs,CandisBalding,0.0,Tim Draper Talks On Bitcoin As Facilitator Of The Global Economy,1619340671,0,1
8899,my44vc,laurgs,0.5473,Just want to give a toast to the HODL gang,1619339898,0,1
8900,my44tw,Wild_Attitude,0.3612,Crypto Will Be All Asset Classes Says Financial Analyst  CoinQuora,1619339893,1,1
8902,my401t,shickard,-0.5719,Fuck the haters buying the dip,1619339270,54,1
