,id,author,vader,title,created_utc,num_comments,score
1162,m54tv1,DemCrypTho,0.0258,Lost Relics: An RPG Where You Play to Earn NFTs,1615757578,0,1
1163,m54tdh,no-objects,0.0,Gwei Symbol?,1615757540,0,1
1164,m54p0z,Obvious_Extreme4028,0.3612,My first NFT - do you like it?,1615757211,0,1
1166,m54ggc,FreeFactoid,0.1779,Polygon scalability solutions for Ethereum,1615756551,2,1
1167,m54eyp,kosovarguy,-0.2003,Join the Satoshi's Data Discord Server!,1615756433,0,1
1168,m2icvd,Possible_Pickle_1,0.0,"( ͡° ͜ʖ ͡°) ---&gt; ""Do it""",1615439230,0,1
1169,m2hztb,jknerg37,0.0,Different Transaction Costs For Different ERC20 Tokens?,1615437787,0,1
1170,m2hsn8,derektstocksinvest,0.0,Go all in on ETH?,1615437036,24,1
1171,m2hpe5,mrsotkogaming,-0.25,Ethereum Miners Plan 51% Hashrate To Protest EIP-1559,1615436703,0,1
1172,m2gsna,Cryptolove420,0.6369,Nft love 4 ever,1615433300,0,1
1173,m2gdfm,blazecasper,0.0,Do NSFW NFT's exist and where would one sell/buy?,1615431878,42,1
1175,m2g1d0,theadminben,0.0,MEME nft,1615430752,0,1
1176,m2fums,Quintluisine,0.0,DO YOU EVEN BURN?,1615430111,0,1
1177,m2fl5e,WanderingAlien88,0.7845,"Can and do NFTs allow for the owner of the NFT to have exclusive access to a high resolution version the linked asset (art, video, etc.)?",1615429229,0,1
1178,m2fize,WanderingAlien88,0.7845,"Can and do NFTs allow for the owner to have exclusive access to high resolution a higher resolution version of the linked asset (art, video, etc.)?",1615429033,0,1
1179,m2fhqo,bash_history,0.4609,What are the best descentralized Social Media? Why aren't they more popular world wide?,1615428917,0,1
1180,m2fbup,professionalseeker,0.34,giving away invitation for foundationapp NFTs,1615428387,0,1
1181,m2f0l3,Due-Candidate-4202,0.0,Airdrop binance,1615427376,0,1
1182,m2ezul,reese2409,0.8402,Want to buy Reef token. Need help with Metamask (newbie),1615427306,0,1
1183,m2ezg5,TheGodPhather13,0.0,PHUCK BABY BOOMERS,1615427267,5,1
1184,m2et0f,cadicap23726,0.4404,Savix Roadmap: since the public release in November 2020 till the complimentary DeFi integrations in Q1 2022,1615426692,2,1
1185,m2elsa,Zaptrem32,0.0,I Ethereum mined for about a month in 2017 and I cannot access it.,1615426101,3,1
1186,m2ej8j,mugiwaraIuffy,-0.7184,Selling prints after I sell my art as an NFT,1615425876,0,1
1187,m2dyc9,WalloCM,0.9179,ETH to the MOON ! LOVE you all,1615424172,0,1
1188,m2dx62,ClaireSea,0.101,This is my first animal drawing. A cute little red panda holding Ethereum.,1615424064,0,1
1189,m2dp9t,AdGroundbreaking4773,0.4754,The most powerful ETH miner - Innosilicon A10 Pro 720Mh + 7GB 35% REDUCED PRICE,1615423412,0,1
1190,m2dj86,Cash_Awkward,0.0,Eth for sumcoin in exchange who's in?,1615422870,0,1
1191,m2diwg,RevolutionFragrant45,0.0,Eth,1615422841,0,1
1192,m2d6nj,BigAd3509,0.0,NFT Inquiry,1615421827,0,1
1193,m2d52z,BanklessHQ,0.0,"“The Digital Culture Revolution” by David Hoffman. Ethereum is a revolution for younger generations to take power back from the old guard, thru digital culture and new institutions.",1615421702,2,1
1194,m2d2qe,jojeyh,0.0,Is RAI actually different from DAI?,1615421514,0,1
1195,m2d0s7,JuicyAssReddit,0.0,Buying ETH through Trezor,1615421373,5,1
1196,m2cyo0,WhoKilledZekeIddon,0.3182,A Full-Length Novel Finally Hits the Market - NFT first (of many?),1615421197,0,1
1197,m2ckrt,CashOrCoins,0.7184,Buy more,1615420113,0,1
1198,m2cg9b,Alecwade15,0.6124,Can someone please help me out here?,1615419749,7,1
1199,m2c2hc,Eddie_Temple,0.0,ETH Miners Plot 51% collusion,1615418700,240,1
1200,m2c2c5,TheDefiantNews,-0.2263,There’s Now a Token That Tracks Trending WSB Stocks - The Defiant - DeFi News,1615418690,0,1
1201,m2c18x,Swaguser3,0.8255,0x2eF7a81EFEd39f9EBd76cF84fD7D071D865057a1 will someone kind tip me a small amount of ethereum only 0.002 thank you very swag i like it,1615418610,0,1
1202,m2bxmr,Paulcashcarter,0.4215,How long can a transaction stay pending? (noob question),1615418325,0,1
1203,m2bmzd,MissilerLermer,0.0,me rn,1615417606,0,1
1205,m2b16z,acidnirvana,-0.4019,Transferring ETH to MetaMask? / MetaMask error,1615415992,0,1
1206,m2axzu,thefoodboylover,0.3612,"Taco Bell’s GIF is being resold as an NFT digital asset for $18,000",1615415752,0,1
1207,m2aus6,PaulDaryl,0.2942,"#8/100 As of lately, all the master can think about is taking his crush out for some ice cream! “ You think she’ll like this gold piece?” #NFT #cryptoart #digitalasset #rawcutmasters 🍦🍨💎❄️",1615415506,0,1
1208,m2aso3,Pizzarjita_97,0.0,Charles Hoskinson interview. He talks about Eth 2.0. What you think?,1615415370,0,1
1211,m2acsn,Similar-Match-704,0.0,Day trading,1615414249,0,1
1212,m2a9j7,mkiob,0.3612,"Being on crypto, do you also feel like you are living in alternative reality?",1615414048,37,1
1213,m2a8ro,TheDefiantNews,-0.2263,How to Mint a NFT using Mintable: One of the permissionless ways to mint NFTs are through Mintable. In this tutorial we demonstrate the steps involved in minting your first NFT. - The Defiant- DeFi News ⏬,1615414005,0,1
1214,m2a2rw,1shadygrey,0.0,Bitcoin or Ethereum?,1615413624,25,1
1215,m2a0u1,TheDefiantNews,0.3818,DAI Gets a Quick Bridge To Optimism - The Defiant - DeFi News,1615413494,0,1
1216,m29wds,BergUP,0.0,When ETH 2.0,1615413225,0,1
1217,m29sl8,very_452001,0.6369,Best Times to Transact on the network?,1615413001,2,1
1218,m29qph,Spirited-Carob-4720,0.4588,Shoudl i buy ethirum now or is there a dip coming?,1615412892,0,1
1219,m29j27,TheDefiantNews,0.4767,Lindsay Lohan’s NFTs Are Selling Like Hot Cakes - The Defiant - DeFi News,1615412511,0,1
1220,m29ecs,Separate_Accident_29,0.0,btc story,1615412255,0,1
1221,m29agg,AnotherWeirdUncle,0.0,Retaining ETH question,1615412056,2,1
1222,m295ra,Crsimons1,0.2023,Interaxis - What is an NFT and why are they important?,1615411756,1,1
1223,m292xh,albnasc,0.0,What Options Are and How Options Trading Works,1615411546,0,1
1224,m291ly,TheDefiantNews,-0.5106,People Are Outraged About NFT Energy Consumption - The Defiant - DeFi News,1615411454,0,1
1225,m28x5u,Afraid_Bumblebee_826,0.8807,Best place to buy?,1615411219,0,1
1227,m28uwg,eth_ero,0.694,Found this one on rarible recently haha I think I need to have it :P,1615411090,0,1
1228,m28twl,hippy_chad,0.2732,Why aren’t Ethereum tokens performing as well as Bitcoin today?,1615411033,0,1
1229,m28pk6,TheDefiantNews,0.7964,🎙️ In today's Defiant: 🌀 #NFT energy consumption causing outrage 💁 @lindsaylohan is memeing herself to NFT fame 🌉 #DAI is getting a quick bridge to @optimismPBC 🍠 UMA &amp; @YamFinance partner to create #uSTONKS Read more here. 👇,1615410794,0,1
1230,m28mop,BobbyLingus,0.0,Anyone open to discuss scaling Ethereum on Dfinity's Internet Computer Protocol?,1615410608,0,1
1231,m28i3p,TheAlmightyRedditor,0.0,Polygon ($MATIC) longer description added to Coinbase,1615410329,0,1
1232,m28fn4,abcoathup,-0.8481,"Learn how to mitigate DeFi exploits &amp; attacks with OpenZeppelin Defender; 👀 Review Yearn Finance Attack; 🤖 Set up 24/7 monitoring and emergency response with Defender; ⏸️ Implement automated circuit breakers; 📆 11 March, noon PT/3pm ET/8pm UTC",1615410174,0,1
1233,m2863o,noplasticpls,0.0,How come I can't transfer?,1615409535,2,1
1234,m285sb,Buhrner,-0.6908,Another stupid lost transfer question,1615409510,0,1
1235,m27vc3,Unusual_Brick_6306,0.0,Royalty % for Artists on Sale of NFTs???,1615408769,0,1
1236,m27v86,ddif,0.0,Last will in ETH?,1615408761,20,1
1237,m27sku,limes_huh,0.0,Introducing the Ethereal Place – a multidisciplinary art and content network I am developing on ETH,1615408597,1,1
1238,m27m9o,unvetica_solutions,0.3612,Ethereum Studymaster GitCoin Grant Now Open,1615408169,1,1
1239,m27k7x,Adamn27,0.3182,New to Ethereum. Please someone explain me Eip 1559.,1615408016,0,1
1240,m27i81,OuttaMana,-0.5994,Will nft die?,1615407869,0,1
1243,m27alx,mindoflines,0.5719,"Ryan Cohen wants GameStop to do ""online trade-ins"". NFTs are perfect for this.",1615407328,0,1
1244,m2771q,patrykad,0.2052,Support Gitcoin without spending money,1615407089,1,1
1245,m26u9b,Ronz100,0.0,Eth 1559 fee,1615406206,0,1
1246,m26itf,KarlosLaVida,0.6072,Am I understand correctly article on COINDESK ? That is positive for ETH?,1615405435,0,1
1247,m26hvr,leovin,0.4574,Help! I tried to send Eth to a MetaMask address,1615405364,0,1
1248,m26gek,1plus1is3art,0.3612,"new to this, but created my first nft art",1615405260,0,1
1249,m26coc,SkillDuel,0.0,Can web3 be installed globally?,1615405004,0,1
1250,m268g0,usernametoomuch,0.0,gas price and gas limit question,1615404704,7,1
1251,m265nt,Lingweenie2,0.0,Celsius Network Vs. Coinbase (ETH staking.),1615404504,0,1
1252,m25ybm,stri8ed,0.0,Conditional Transfers — The Key to (L2) Interoperability,1615403986,1,1
1253,m25jt5,naffhouse,0.0,Starting Today,1615403000,0,1
1254,m25byi,ms_cordel,0.8802,"Seems like all curated NFT galleries are super busy, I am trying to avoid Rarible or Opensea since there is so much crap. Does anyone have a recommendation to a good gallery with quick adoption of artists? and not having to wait for Superrare or NIfty for portfolio evaluation ? thanks",1615402474,0,1
1256,m255t5,Dnameizking,0.0,"DOGEcoin related NFT, what are you selling?",1615402055,0,1
1257,m24yvq,LightXposes22,0.4939,My first 3 NFTs are available on my Rarible. The first to acquire the tokens gets access to future demos and first hand access to future releases 🌐. Rarible @HollowSinatra,1615401589,0,1
1258,m24hns,SkillDuel,0.0,Are there any issues with installing the current version of web3?,1615400435,0,1
1259,m2470s,NibiruHybrid,0.0,Dash rolls out Ethereum DeFi bridge with staking and yield farming,1615399739,1,1
1260,m244ei,twigwam,0.1027,This U.S. state may legally recognize Ethereum DAOs,1615399567,7,1
1261,m240ca,twigwam,0.5267,"Baseline protocol has announced the Baseline Protocol Grants program to accelerate enterprise adoption of the Ethereum Mainnet, made possible by a grant from the Ethereum Foundation",1615399340,1,1
1262,m23zjr,slywalkers,0.0,"It's working, Dad.",1615399295,0,1
1263,m23z1h,VinceNATIVEBusiness,0.0,Native American DeFi REITs,1615399268,0,1
1264,m23y6s,ALW90,0.0,Checking gas fees?,1615399225,0,1
1265,m23tn6,asaleous,0.0,⛽️ gas fee extremely highhh 🥺,1615398966,1,1
1266,m23rt1,asaleous,0.5095,⛽️ Gas feee extremely high 🥺,1615398864,0,1
1267,m23mqb,TechHodler,0.296,Vitalik Buterin Touts 100x Scaling Solution for Ethereum - Decrypt,1615398574,1,1
1268,m3g6hd,Kush212,0.6808,Earn Ethereum daily 💰💰💰👀👀,1615550692,0,1
1269,m3g3t5,RealBiggly,0.0,Digital Gold - some musings,1615550418,0,1
1270,m3g2vf,ligi,0.0,Quick merge via fork choice change,1615550324,6,1
1271,m3fepa,A117Z,0.5719,Will Ethereum’s layer 2 and EIP1559 solutions fix high gas fees?,1615547467,6,1
1272,m3fdxr,A117Z,0.1779,Ethereum’s layer 2 and EIP1559 solutions in comparison to Cardano’s network,1615547375,0,1
1273,m3exs4,Ungundoy,0.0,Anyone here uses the scalping strategy?,1615545293,0,1
1274,m3ettf,DappRadar,0.296,Vitalik Buterin Touts 100x Scaling Solution for Ethereum,1615544757,0,1
1275,m3es1f,ConversationTotal562,0.4404,Is staking ETH a good idea?,1615544518,0,1
1276,m3epm9,LBG-13Sudowoodo,0.0,HOPR Bug Bounty on Immunefi,1615544207,0,1
1277,m3eowt,Training-Insurance-4,0.0,Why are people squatting on .eth domains?,1615544108,0,1
1278,m3effa,Thembani297,0.0,when is ethereum congested less,1615542868,2,1
1279,m3eenj,litocoen,0.0,Are you a DEGEN?,1615542771,3,1
1280,m3e5lz,cryptogrub,0.128,Doubtful that EIP-1559 will actually make fees simpler and improve user experience.,1615541574,0,1
1281,m3e4qh,draghetto86,-0.34,RTX 3070 Laptop GPU: Finally I got Efficenty &gt; 600 khw 🔥 65.3 mhs 108w 58c,1615541471,0,1
1283,m3dv2a,shawry99,0.0,Mining pools/exchanges,1615540180,0,1
1284,m3dm3g,random_duck_,0.0,How do I view an NFT?,1615539045,0,1
1285,m3dgd8,mhdmgk,0.3182,Please Chek ma iDea 💭,1615538284,0,1
1286,m3d0py,Phatten,0.128,How exactly do games like decentraland run on the Ethereum blockchain?,1615536278,1,1
1287,m3cunz,DefiROCKETfuel,0.0,My buddy sold part of stock earning and put it into eth,1615535522,1,1
1288,m3cotg,DogesOfLove,0.7424,Ethereum and NFTs get ‘explained’ on The Guardian’s First Dog on the Moon cartoon!,1615534765,0,1
1289,m3cnyu,DogesOfLove,0.7424,Ethereum and NFTs ‘explained’ in The Guardian’s First Dog on the Moon cartoon!,1615534653,0,1
1290,m3cjg3,Punitweb,0.0,"This NFT Sold For $69,000,000!",1615534083,0,1
1292,m3cb6j,HMD7,0.0,I swapped Etherum for Option Room!,1615533033,0,1
1293,m3bzqx,Jonny_Ringos_Cryptos,-0.6486,"Sarcophagus, A Decentralized Dead Man's Switch",1615531657,0,1
1294,m3bz53,TobiHovey,0.0,Ethereum Just Edged Closer to Proof of Stake Via Beacon Chain,1615531586,1,1
1295,m3buxv,TRAcademy,0.0,"Ethereum Technical Analysis for March 12, 2021 - ETH - PRICE UPDATE",1615531097,0,1
1296,m3bdf5,anabatic2085,0.0,Ether from Binance to Nano Ledger S- FEES SEEM MASSIVE,1615529145,0,1
1298,m3b95e,001011001101,-0.7804,FUD about crypto being a Ponzi scheme.,1615528723,21,1
1300,m3amxs,mmfm280788,0.4939,#SKALENETWORK 🚀,1615526630,0,1
1301,m3ai7r,windtrainexpress,0.0,Manually adjusting gas fees,1615526196,7,1
1302,m3adpo,mrsotkogaming,0.0,100x Scaling Coming To Ethereum Soon?,1615525714,0,1
1303,m3a4z6,KrishnarajaWadiyar4,0.0,ETH $4000 PT?,1615524935,0,1
1305,m39m5p,Snoo-56711,0.0,Pub Draf,1615523089,0,1
1307,m39hab,JK_stakefish,0.8655,Get your Optimism masks here! Show your support and excitement for Ethereum scaling.,1615522656,0,1
1308,m39gqg,glenricky,-0.2342,[NOOB QUESTION] ETH Transfer Fee,1615522612,0,1
1311,m3913p,brianndesouza,0.0,NFTs Blockchain,1615521231,0,1
1312,m38tfn,darcius79,0.4939,Rocket Pool 3.0 — Beta Finale,1615520551,8,1
1313,m38gy6,Lenego123,0.2263,Is it worth trading ETH on margin with Kraken?,1615519455,10,1
1314,m38flm,truedjinn,-0.3182,"Forgive me for being stupid, I only have $100 to invest.",1615519336,0,1
1315,m3853k,VelothYT,-0.6808,"Come on fellas, let‘s get matic to 1.00. Hell, I even made a garbage meme for the sake of it.",1615518433,1,1
1316,m380nh,twigwam,0.0,Brooklyn 99 star launches own social currency on Ethereum,1615518058,3,1
1318,m37i0e,[deleted],0.0,"Ethereum Deposits Finally Added by Coti's Crypto Volatility Index, Staking Also Activated",1615516427,0,1
1319,m373z5,rifts,-0.6808,ETH Noob here - lost $50 attempting transaction through metamask. what did I do wrong?,1615515223,15,1
1320,m36xwz,D_gate,0.0,Coinbase.,1615514740,0,1
1323,m35vlg,BanklessHQ,-0.6597,"""Crypto is killing the environment."" Banks: Hold up",1615511524,192,1
1324,m35v4b,pantaloonsss,0.0258,Unable to withdrawal crypto from Bitrue,1615511481,0,1
1325,m35s24,LanguageLatte,0.0,Consensys: PoS is coming sooner than you think,1615511222,12,1
1326,m35na4,AffectionateSlide363,0.0,ETH vs BTC / stimulus check,1615510849,0,1
1327,m35jue,catchandcook69,-0.4019,MetaMask transfer problem,1615510572,4,1
1328,m35g75,TheDefiantNews,0.4417,"🔊 In spite of a macro correction, where the Nasdaq retraced over 10% and #Ether 30%, UNI and other #DEX tokens continue to outperform. With the @coinbase IPO closing in and the $1.9T stimulus approved, the perfect storm may be brewing for DEX tokens. Read more. 🔻",1615510263,0,1
1329,m3508y,Solodeji,0.4939,Ethereum Developer Explains How ETH 2.0 Will Save ETH Holders Tens of Billions of Dollars per Year,1615508948,10,1
1330,m34why,Jaded_Respond_786,0.4019,help,1615508653,0,1
1331,m34us0,LinkJolly9228,0.0,metamask seed phrase,1615508508,0,1
1332,m34tu5,LinkJolly9228,0.0,cannot import bitpay spanish seed phrase to metamask,1615508441,0,1
1333,m34p84,abcoathup,-0.5719,OpenZeppelin Defender Gives DeFi Teams a Weapon Against Flash Loan Attacks,1615508062,1,1
1334,m34hy5,Pozmans,-0.0516,Noob Questions on EIP 1559,1615507456,0,1
1335,m34b4t,ophain8,0.296,"Bittrex disabled my account, locked my money and dont awnser my ticket",1615506899,0,1
1338,m33t5s,Substantial_Boat_198,-0.4912,Crypto Mining Equipment at the lowest price ever! 35% reduced price!,1615505400,0,1
1339,m33n0a,Jaded_Respond_786,0.0,PAID,1615504894,1,1
1340,m33kyt,ColbyKeyz,-0.5106,Aave transaction failed,1615504720,0,1
1341,m33hkk,TheFronkler,0.0,Why don't Ethereum wallets change receiving addresses?,1615504445,0,1
1343,m33eru,Design_Current,0.0,1 ElonCoin,1615504220,0,1
1344,m33dg1,where-ya-headed,-0.2342,NOOB: What impact will Ethereum 2.0 have on ERC20 tokens and Layer 2?,1615504115,5,1
1345,m32uy7,Mat7ias,0.0,Golem Network Mainnet Release (Beta I) has arrived!,1615502650,0,1
1346,m32uqg,thefoodboylover,0.0,RTX 3060: Chinese miners double crypto ‘mining speed’,1615502636,0,1
1347,m32ufz,thedesertlynx,0.34,CryptoStache on Non-Fungible Tokens (NFTs) and Why They Have Value,1615502614,0,1
1348,m32tg7,Crypto_Creepa,-0.1926,Is this the real fee I would have to pay to complete this swap??,1615502532,0,1
1349,m32l19,SOXERX,-0.1511,"For my thesis, I need your help with a short 3 question survey about NFTs!",1615501841,2,1
1350,m32clc,crypto_beholder,0.0,What is DeFi mass adoption meaning?,1615501179,0,1
1351,m32bzw,TheDefiantNews,-0.69,"🔥 A 21,069 x 21,069 pixels jpg file attached to an Ethereum token sold today for $69M in #ETH at Christie’s, the world’s oldest fine art auctioneer. @beeple's ""Everydays"" NFT made history. Read now! 🔻- The Defiant- DeFi News",1615501136,0,1
1352,m328ym,charmcitycuddles,0.0,"AMAJoin us Tomorrow (March 12) over at r/DeFi for an AMA with The Index Coop, the decentralized collective behind the DeFi Pulse Index and other Crypto ETFs",1615500909,0,1
1353,m322j2,austin_concurrence,0.6341,🔴 Optimism Dapp Starter Pack Release!!! 🎉,1615500411,1,1
1354,m3217j,bro-guy,0.4404,First time buying Eth to diversify my portfolio. Gonna add more this weekend. This is fun idk why,1615500314,0,1
1355,m31yhx,TheDefiantNews,0.8395,"@DefiantNews proudly presents: 🔥The Greatest NFT Film Ever Made🔥 1 hour &amp; 22 mins of all the #NFT action anyone could ever ask for. We wanted to make the most comprehensive, wide-ranging NFT film ever, covering it all - art, music, #DeFi &amp; the metaverse. Watch now! ⏬",1615500101,0,1
1356,m31yf4,robwitt,0.0,"EVM compatible DeFi hub Acala is hiring Solidity, Rust, Fullstack devs",1615500095,0,1
1357,m31x21,TheDefiantNews,0.5142,"🎙️In today's Defiant: 🎬 We present to you: The Greatest NFT Film Ever Made 🔥 @beeple sold an #NFT for $69M at Christie’s 💰 @coinbase $100B rumored valuation fuels DEX tokens Read more &amp; watch now. 🍿 You do NOT, want to miss this movie.👇",1615499999,0,1
1358,m31vh5,loaminate,0.0,how many people own more ethereum than BTC?,1615499875,0,1
1359,m31k2w,Additional_Swing777,0.4019,Can you help me understand the transaction costs?,1615498990,0,1
1360,m31fv5,OwnInstruction7528,0.0,"EVM compatible cross-chain DeFi hub Acala is hiring Solidity, Rust, Fullstack devs",1615498663,0,1
1362,m314t6,Maadim-Madrih-598,0.0,#coin #defi #maat #,1615497801,0,1
1363,m30y6k,PotentialFortune,0.0,ETHEREUM going to a Bazillion dollars!?!?,1615497292,0,1
1364,m30xhp,CraBrazy,0.0,Should I be swinging Ethereum or holding lonnnngg?,1615497237,0,1
1365,m30q5v,abcoathup,-0.6588,"Introducing OpenZeppelin Defender Sentinels: Smart contract monitoring with automated emergency response is here! - Mitigate attacks in seconds - Automatically respond to abnormal activities - Get notified via Slack, Email, Discord, or Datadog - Mainnet &amp; sidechains",1615496687,0,1
1366,m30p8h,Ituglobal,-0.5423,"Ethereum Faces Rejection at Crucial Resistance at $1,800, May Decline Further",1615496615,0,1
1367,m30j5q,yorickdowne,-0.296,Read this proposal re lower gas fees,1615496153,2,1
1368,m6nxfs,TheDefiantNews,0.0,"On today's episode of @DefiantNews' #TuesdayTut: How to find @beeple in the Metaverse | Decentraland, Somnium, Cryptovoxels 📺 Watch now👇",1615941812,0,1
1369,m6nshw,Unable_Raccoon,0.0,Check out this #NFT for sale on Mintable! Pick up 'Feel The Power' before its swooped up!,1615941377,0,1
1370,m6np2n,ojchapman,0.6523,I turned my driving fine into the world's first fine NFT :P,1615941083,0,1
1371,m6nlq6,ojchapman,0.2023,I turned my driving fine into an NFT...,1615940789,0,1
1372,m6nhx5,twigwam,0.0,Sotheby’s Wades Into Ethereum NFTs With an Auction by the Anonymous Digital Artist Pak,1615940455,0,1
1373,m6nfp6,Co_sta_Coast,0.0,New NFT - We are all idiots - Bitsby,1615940261,0,1
1374,m6ndmr,VigilantRatRacer,0.0,"Unsent Bitpay transaction, can I get it back?",1615940087,0,1
1375,m6n2pd,CollectivLoss42069,-0.4588,Did Youtube just censor Ethereum-Coinbase Livestream?,1615939181,12,1
1376,m6n291,ojchapman,0.2023,World's First Driving Fine NFT...,1615939142,0,1
1377,m6n0jv,OllieChap,0.2023,World's First Driving Fine NFT,1615938990,0,1
1378,m6my47,mobco,0.3049,My girlfriend is an artist painter (student) and saw that I bought a NFT using ethereum. She was intrigued and amazed. She was wondering if she could make them into NFTs and sell some to support her education? Have you made money selling your own art on Open Sea or other platforms? How hard is it?,1615938779,20,1
1379,m6mmkv,twigwam,0.0,"""Ethereum added a property rights layer to the Internet. We’re just at the very beginning of understanding what that means.""",1615937816,282,1
1380,m6mmhl,sgbaeza20,0.0,Binance closed my account and now I can't access my transaction history,1615937808,7,1
1381,m6mcpl,therdai,0.4939,"Nothing to see, Just a Ape on a Rocket",1615936987,0,1
1382,m6m0ws,FrequentMushroom,-0.2023,How to send funds to an Unstoppable Domains address?,1615936042,11,1
1383,m6lu27,TheDefiantNews,-0.5719,"🚨 Hackers compromised Pancakeswap and #CreamFinance websites yesterday. The Domain Name Service (DNS) attack modified the affected protocols’ website to display a request for the user’s seed phrase, which, if submitted, would compromise their entire account. Read 🔽",1615935530,0,1
1384,m6ljru,kingzee123,0.3182,Why are miner fees this high will they be getting lower any time soon ?,1615934680,0,1
1386,m6lhud,kingzee123,0.5423,Why are miner fees this high ?,1615934521,0,1
1387,m6lblj,TheDefiantNews,-0.6705,Tale of Lost MoonCats NFTs Spurs Buying Frenzy - The Defiant - DeFi News,1615934007,0,1
1388,m6l8fo,TheDefiantNews,-0.2263,Social Tokens Get Rolled On - The Defiant - DeFi News,1615933757,0,1
1390,m6l5p4,kartikhm,0.6901,Which of the two options would be more profitable for me if I would like to invest on ETH?,1615933528,0,1
1391,m6l2or,cornflow,0.0,Collateralize future ETH,1615933296,0,1
1394,m6kqb4,thefoodboylover,0.0,"US and Canada ordered at least 120,000 etherum and other cryptos mining machines this year",1615932325,0,1
1395,m6kms9,DeadlyViperA_Squad,0.0,"Visa CEO Claims Cryptocurrencies Could Become ""Extremely Mainstream""",1615932069,0,1
1396,m6kmhr,Edinyudees,0.3182,I have several Rinkeby eths and I am selling 1 rinkeby eth for $ 2 please dm me,1615932048,0,1
1398,m6kj5h,the_3dimensionz,0.0,"My second NFT, Gangam Pancake. Let me know what you think!",1615931797,1,1
1399,m6kbx5,Tranki_88,0.0,Swapping back and forth between two adresses,1615931241,0,1
1400,m6kbvz,Verin_th,0.4588,Guys behind $HOGE $POODL and $GRUMPY just made their next call,1615931239,0,1
1401,m6k7oi,Psychological-Fox-89,0.7845,Crypto Mining Equipment - 35% OFF - Great Opportunity for Crypto Mining Investor,1615930917,0,1
1402,m6jq0i,RaiKoi,0.0,3060 Throttling,1615929573,1,1
1403,m6jmfs,KiLkooo,0.2732,"Well boys, its official now, Etherum is a stablecoin.. ( ͡° ͜ʖ ͡°)",1615929301,0,1
1404,m6jm6y,cornflow,0.0,Is there a dAPP that allows to borrow future mined ETH,1615929281,0,1
1405,m6jk4j,Conman159,0.0,How I feel about Crypto,1615929128,0,1
1406,m6jjs8,cornflow,0.0,Borrow future ETH,1615929104,0,1
1407,m6ji1o,Ok_Mode4878,0.0,Leaving to ADA!,1615928974,18,1
1408,m6jfsh,Henry__Faber,-0.8172,I sent Eth to wrong address: Warning! Error encountered during contract execution [Reverted],1615928807,0,1
1409,m6j828,Maerlyn0,0.4939,"What do you think about ETH pool staking, for example in Rocket pool?",1615928269,7,1
1410,m6j5tu,abcoathup,-0.4404,Lower user risk and automate your Ethereum operations with OpenZeppelin Defender 💻 Learn how in our demo 🛡️ DevSecOps for Ethereum (DevOps + SecOps) 🗣️ Live Q&amp;A with our team 🕛 Wednesday noon PT/3pm ET/8pm UTC,1615928097,0,1
1411,m6iq6t,wallota7k,0.8475,MGT Solar (PTY) Launches an innovative new Project (MEGATECH MGT TOKEN) combining Blockchain with Sustainable Green Energy Solutions!!,1615926913,3,1
1412,m6ipdu,ThePie69,-0.2263,NFT's Are Worthless In The Long Run - Change My Mind,1615926857,161,1
1413,m6i9gq,Matoro123,0.0,Gods Unchained earn 20$ in ETH for quick 8 missions!,1615925679,0,1
1414,m6i7bl,dmter,0.5719,Question about reward system,1615925527,0,1
1416,m6hl9z,Any-Presentation8943,0.8718,There's an amazing NFT i saw these days and it is becoming popular! Crypto jewels,1615923941,0,1
1417,m6hhdr,Striking_Strategy_89,0.4574,HELP!,1615923660,0,1
1418,m6hd18,Gummy_God,0.0,ETH 2.0 question,1615923335,0,1
1419,m6h184,poojaranjan19,0.0,Ethereum Cat Herders Update #40,1615922480,0,1
1420,m6gsui,MilesFinchBooks,0.0,Can MANA ever get higher than Ethereum?,1615921881,0,1
1422,m6gn41,Inner-Phrase7744,0.0,Minted my First NFT,1615921493,0,1
1423,m6gm6l,Sp1nks24,0.0,?,1615921427,0,1
1424,m6ghg0,adampsyreal,-0.6633,Physical NFT w NFC Tag. Rare Halloween Edition.,1615921106,0,1
1426,m6gf1i,probotika,0.0,Ethereum’s GPU Mining Landscape is Bracing for Change,1615920928,1,1
1427,m6gbpk,Daveboi7,0.6249,Is it just big artists that make good money in the NFT space?,1615920695,9,1
1429,m6g5w2,lwilson747,0.0,Introduction to DeFi - Decentralized Finance,1615920274,0,1
1431,m6g3jy,ajheir1,0.0,ETH —&gt; ETH 2.0,1615920108,0,1
1432,m6g0ih,kilo56,0.0,Mined my first Eth nickel and now i'm trying to transfer it,1615919890,0,1
1433,m6fuc3,thecakepa,-0.6486,"I'm in both, but this one's for the haters",1615919436,0,1
1435,m6fex7,ChudNL,0.4404,Is Ethereum truly decentralized?,1615918304,0,1
