,id,author,vader,title,created_utc,num_comments,score
0,lwz7v5,karalabe,0.0,"Geth v1.10.0 out! Snapshots, snap sync, pruning and more!",1614792141,59,90
1,lwyyai,deten,0.3182,Is there anything stopping Ethereum from introducing the technological advancements from Solana to improve transactions rate and reduce fees?,1614791471,0,1
3,lwyxes,i_have_chosen_a_name,0.8625,"I took out a crypto loan today, denominated in euros, with crypto as collateral. And (hopefully) this week I am going to a dealership in Calgary to buy a used car with it. They are okay with getting the entire amount in crypto.",1614791407,440,561
4,lwywe5,BlueSnake57,0.0,What does ethereum use the processing power for?,1614791337,14,0
5,lwypjo,ansteadm,0.0,Identity Management with Numio,1614790884,0,5
6,lwymjg,DappRadar,0.0,CryptoKitties Trading Volume Suddenly Grows 2300%,1614790695,0,2
7,lwygxc,infernal_toast,-0.25,The Disadvantages of Synthetic Assets,1614790305,0,1
9,lwxtne,TTAnalysis,0.658,Sorare is amazing!!,1614788661,0,1
10,lwxrck,MikeDinSD,-0.7184,Where can I sell my HODLETH license plates?,1614788501,0,1
11,lwx3d5,DemCrypTho,0.0,"Enjin to Tackle Soaring Gas Fees, Scaling With New Blockchain Products",1614786853,10,19
12,lwx2j8,ThrowAwayForEth,0.7184,Looking for a temporary exchange to buy ETH for a validator,1614786793,0,1
13,lwx1xc,NFTNewsToday,0.3182,Enjin announces new NFT scaling solution JumpNet,1614786748,0,1
14,lwwkz9,billosweet,0.0,NFTs keeping ethereum afloat,1614785543,0,0
18,lwvg1j,franzihei,0.7177,Solidity v0.8.2 is out! It adds an optimizer stage that can inline small amounts of code to save gas and provides more means to work with code documentation by exporting inline comments and allowing custom natspec tags.,1614782528,2,3
19,lwvd5j,bdinu89,0.2023,A Guide to The Top 5 Ethereum 2.0 (ETH 2.0) Staking Pools,1614782306,0,1
20,lwv5qd,itsblockchain,0.2023,Top 10 NFT Crypto Projects You Should Know,1614781746,0,1
21,lwux33,tekmol,0.0,How many shards could the beacon chain serve without getting too big?,1614781068,6,4
22,lwutw3,mostlikelyhomo,0.0,Gas fees to blockfi.,1614780818,0,1
23,lwuswq,[deleted],0.4588,"How is it possible to buy ETH directly, but not Bitcoin?",1614780740,0,1
24,lwu8ux,franktrader11,0.0,Can Thrash BTC in the next coming weeks🤡(Check out ETHBTC Chart),1614779192,0,1
25,lwu8el,lsmoralesr77,0.7696,PLEASE HELP!!! FRIEND ACCOUNT HACKED!!,1614779151,0,1
26,lwu4r5,Mercuryo-hare,0.0,Everybody talks about the NFT. What's that?,1614778879,0,1
27,lwtlj2,SnooKiwis1907,-0.4404,How to decode data from Ethereum block chain for developers,1614777295,0,1
28,lwtjh0,SnooKiwis1907,0.0,Decode data for DApps etherium/binance,1614777121,0,1
29,lwti6v,SnooKiwis1907,-0.4404,How to decode data from etherium/binance block chain for developers,1614777006,0,1
30,lwtfca,[deleted],0.0,EMSA,1614776736,0,1
31,lwteur,braaischwarma,0.0,Hey everyone! My NFT “une chat dans une baignoire” from my first collection “new reality collection 1”. Let me know what you think?,1614776691,2,2
32,lwteld,Badgergeddon,-0.5271,"Are we still allowed to whore our crypto art on here? Well if so I minted my first NFT! I'm still confused about Gas, why it cost $35... and I bet nobody buys it, but why not give it a shot right? 🤩",1614776670,2,0
33,lwt3ph,[deleted],0.0,Mark Cuban wants to introduce ticketing on blockchain as NFT's to NBA - GET protocol is already doing it on Ethereum,1614775735,0,1
34,lws9di,scarlett06,0.0,"If you had 1000 euros to invest, would you invest in Ethereum right now?",1614772866,0,1
35,lws3w8,NFTNewsToday,0.0,Ubisoft and Sorare launch 5-week One Shot League,1614772363,0,1
36,lws3v2,Solodeji,0.7506,Vitalik Buterin Proposes Cross-Rollup Scaling Solution. Here’s why it’s great for Ethereum (ETH) Price,1614772360,0,1
37,lws35z,[deleted],0.0,Transaction fee vs Gas?,1614772288,0,1
38,lwrz7j,tiranauser,0.3485,Ethereum cloud mining? Anyone know and experienced with it? And is it worth?,1614771874,0,1
39,lwrxo2,80hourweeks,0.0,"Bought some eth at 1.1k, it's 1.3k now and just made back my fees",1614771713,0,1
40,lwro9l,CoinjoyAssistant,0.5106,"Ethereum Flips Strong Resistance Levels as Price Eyes $2,000-Retest",1614770797,0,1
41,lwrnjn,HypedBanana0,0.4019,Smart contract ideas,1614770722,0,1
42,lwrh8k,kakashi_hatake_21,0.1779,API to fetch Locked Assets,1614770110,0,1
43,lwra8r,ZmasterFlash69,0.0,"Gensler hearing: Not only XRP, is Ethereum also a target of the SEC?",1614769451,0,1
44,lwr992,Mapumbu,0.4019,How do you actually make a smart contract on the ethereum network?,1614769360,0,1
45,lwr035,Wide-Froyo2483,0.6369,"Evolution, innovation, challenges in decentralised finance ( defi ) &amp; solution for scalability",1614768482,0,1
46,lwqrjo,Szangalar,0.0,Tokenizing a painting on Ethereum,1614767518,9,0
47,lwqqau,Eltii,0.0,Face Mask NFT,1614767412,14,0
48,lwqcfv,skai_paints,0.0,Selling Art for Crypto,1614765822,58,6
49,lwpvxe,El_genta,0.5423,What is Optimism?,1614763944,0,5
50,lwpnxw,Theyoungvinci,0.0,How do you feel about all of these NFTs? ‘Ethereum Coin’ - NonFungibleToken Via Project OpenSea,1614763002,0,1
51,lwpmv2,Theyoungvinci,-0.4019,"How do you feel about all of these NFTs? ‘Ethereum Coin’ - Graphite on Paper, 5”x 7”, March 2021, Non Fungible Token by Young Vinci",1614762861,0,1
52,lwpfwz,AustiniusWrex,0.0,Ethereum name origin,1614762046,14,8
53,lwp59e,-S-I-D-,0.168,Why is solidity used by many even though it is Turing complete thus posing security risks ??,1614760807,0,1
54,lwon19,[deleted],0.4522,How much is Layer 2 really going to help?,1614758722,20,3
55,lwoimm,imtransit,-0.4019,Trouble finding a particular eth dapp project.,1614758255,0,1
58,lwnwxj,[deleted],0.0,Ethereum,1614755848,0,1
59,lwnt75,WorldExpert,-0.4588,Cheat Sheet 2021,1614755440,0,1
60,lwnkol,captainlardnicus,0.0,I am selling myself as an NFT.,1614754488,0,1
61,lwnhil,Jak9090z,0.6996,"I make an NFT of our lord and savior, this is fun anyone else making NFT? Share em!",1614754141,0,1
63,lwnfck,[deleted],0.0,HODL HODL HODL,1614753904,0,1
64,lwndn6,[deleted],0.7745,Hi guys love ETH and heavily invested but when Is 2.0 coming? Thanks!,1614753727,0,1
65,lwn9t8,Previous_Bother929,0.0,READ THIS IF YOU OWN CRYPTO OR NFT,1614753296,0,1
66,lwn6rz,TRAcademy,0.0,"Ethereum Technical Analysis for March 3, 2021 - ETH",1614752979,0,1
67,lwmep4,Emphoro,0.6124,New item demons in my head a painting that I did at a hard time in my life I hope you all like it painting 1/1.,1614750040,0,1
68,lwmbz1,itsblockchain,0.7184,"NFTs are the latest trend in the crypto sphere. After the huge success of DEFI, investors are betting on NFT Tokens for higher returns. Let’s understand in detail, what is this hype all about.",1614749759,0,1
70,lwma2e,[deleted],0.6239,"If you're looking for the next game to play, Gods Unchained is giving away $20 to each person who completes some simple in-game missions. If you enter this code when signing up: yOwkLoSIcx I get $5 too!",1614749571,0,1
71,lwm4yo,Jabrail1,0.0,Invest in telcoin,1614749042,0,1
72,lwlvez,[deleted],0.0,What is ethereums token adress?,1614748084,4,3
73,lwlt9u,dapp_com,0.4767,"Top30 Gambling Dapps Eco by 30d Volume 🥇 Ethereum $200.82M, No.1 dice2win $192.09M",1614747876,2,1
74,lwlqm1,StupidAndFat_420,0.0,That time I bought ethereum for $10.48 per coin.,1614747638,0,1
75,lwl8l8,LoudCloudDragon,-0.25,3 Tx's stuck for days,1614745974,0,1
76,lwl61q,Brendan3005,-0.3182,"Frank Chapparo from The Block dives deep into Total Crypto Market Cap Token, TCAP with Cryptex Finance co-founders Joe Sticco &amp; Preston Van Loon on the latest episode of The Scoop.",1614745740,0,1
77,lwl40y,houseofeld,0.0,"but really, don't",1614745549,0,1
78,lwl3he,gymmaxxer,0.7184,How do I buy the Casper ICO if I live in America?,1614745494,0,1
79,lwkz1z,mr_steal_ur_grandma,0.5068,"I'm lost for words, my dad just gave me a ledger and my first full Eth as a graduation present. Very happy to be a part of this community!!",1614745103,0,1
80,lwkrp6,Crypto-,0.0,Anyone have Kovan eth?,1614744435,11,0
81,lwknum,beepiamajeep,0.3612,Do you guys like faucets here?,1614744083,0,0
82,lwkk7v,Flingotravels,0.4939,blessing,1614743757,0,1
83,lwk4mf,Redivivusllama,0.1511,New DeFi discord up and running! Call to action:,1614742339,0,0
84,lwjo1z,mrsotkogaming,0.6705,This Layer 2 Solution Will Allow Ethereum To Scale Dramatically (Optimistic Rollups),1614740792,12,70
86,lwj3th,[deleted],0.7184,"Under the hood, development continues. Excited about the coming weeks. Hero NFT issuance on ethereum.",1614738989,2,1
87,lwj38u,twigwam,0.1531,A deep dive into Eth 2.0 on The Scoop podcast with Preston Van Loon,1614738933,0,10
88,lwicw7,Quick-Simple-8910,0.0,Decentralized Stock-backed Tokens,1614736556,0,1
90,lwi1nn,manginahunter1970,0.4019,"Cardano is releasing KEVM, an Ethereum Virtual Machine for Cardano smart contract development.",1614735539,2,1
91,lwhsdx,goinglongoneth,0.0,d,1614734678,0,1
92,lwhrjj,bangers89,-0.128,Discussing ETH Futures &amp; Institutional Demand With the CME Group: Coinscrum : Crypto News &amp; Podcast,1614734600,0,1
93,lwhrjb,Immediate_Depth532,0.8481,"What do you think is the greatest value that blockchain brings, and when will society come to accept it?",1614734599,0,1
94,lwhmd8,TheDefiantNews,-0.2263,Dedaub Claims $250k in Bounty for Primitive Finance Bug - The Defiant - DeFi News,1614734134,0,1
95,lwhm5x,DirtyRiver2006,0.0,New to crypto,1614734117,0,1
96,lwhh97,TheDefiantNews,-0.4767,Furucumbo Commits to Compensating Hack Victims - The Defiant - DeFi News,1614733689,0,1
97,lwh4nu,TheDefiantNews,-0.2263,Yearn Raises Dai Vault Limit as Alchemix Deposits Surge - The Defiant - DeFi News,1614732609,0,1
98,lwh1x5,BrianAtSantiment,0.2023,"Ethereum's Top 10 Non-Exchange Whales Now Holding the Most Combined Tokens (16.86 ETH) Since July, 2016",1614732363,0,1
99,lwh1jl,billosweet,0.0,"Just grabbed another one of these NFTs off of Niftygateway, this one by Matt Gondek the Disney artist, thoughts?",1614732331,19,1
100,ly94r7,Enkaiyaketsuku,0.0,Game Changing NFT👇.. Its Now or Never,1614940456,0,1
101,ly94dp,azdjedi,0.34,How does L2 keep the security of Ethereum?,1614940408,2,7
103,ly8xv6,Elvi777,0.0,Is RTX 3060 TI 8gb also nerfed?,1614939569,0,1
104,ly8ts8,futureinallitsglory,-0.8205,Is ACA (Age Coin Accumulation) the worst mechanism in regards to sustainability and social equity consensus? Did ETH get it wrong?,1614939044,0,1
105,ly8l1g,bench4rench,0.0,What Are Gas Fees? | CoinMarketCap,1614937938,0,1
106,ly8jqw,Eelectriz,0.0,WHEN WILL ETH FEES GO DOWN,1614937769,10,0
107,ly8gpz,[deleted],0.0,Bear Vs Bull,1614937368,0,1
108,ly8e32,[deleted],-0.4019,Jack Du Rouge (Founder of Colony) &amp; Mattison S (Consensus) Are Cahosting n Clavuse M About Fault &amp; Decentralized Governance. This Friday at 6:30 p.m.,1614937021,0,1
110,ly7olt,HolmesMotion,0.0,Chart showing how much ETH people hold,1614933867,0,1
111,ly7hyc,misterbobdobalina09,0.0,Downsides of Proof of Stake?,1614932989,52,12
112,ly7ghd,[deleted],-0.296,ENS: No way to set up reverse record?,1614932777,0,1
114,ly78ko,BenjeOuss,0.6996,"The Ethereum flag has been put on Mount Everest, and turned into an NFT! Pretty cool right?",1614931755,1,1
115,ly7765,Quarantine-is-boring,0.162,Small ETH miner(: not big but ideal to start a portfolio (:,1614931570,0,1
116,ly74nq,GeorgeBailey176,-0.6908,Are you worried about the latest price drop in ETHEREUM?,1614931252,0,1
117,ly7418,GeorgeBailey176,-0.6908,Worried about the recent #ETHEREUM #ETH price drop?,1614931195,0,1
118,ly6zgp,bucketfite,0.4404,Is Ethereum a good idea to hodl?,1614930580,0,1
119,ly6q9l,jgarci33,0.0,For all the Crypto Parents that put Cocomelon to babysit while you trade,1614929416,0,1
120,ly64dn,[deleted],0.7579,Every article is “what are NFTs” and no articles are “how/where to buy NFTs” help?,1614926808,0,1
121,ly60u0,surfinThruLyfe,0.0,Ethereum now offered on AWS infrastructure,1614926397,0,5
122,ly5txg,Crypto_Saiyan,0.0,Ethereum vs Cardano,1614925568,4,1
123,ly5h16,Ituglobal,-0.6808,"Ethereum Confined Between $1,300 and $1,600 as Sellers Threaten to Short",1614924135,0,1
124,ly4nup,mrsotkogaming,-0.6124,Binance Chain Project Performs Exit Scam For $31 Million,1614921040,0,2
125,ly3exl,Brendan3005,0.5859,ETH: Technology Play or Store of Value?,1614916596,2,6
126,ly34ea,92896542,0.4019,Can I make an NFT out of a picture that I'm using in a print on demand design?,1614915578,0,1
128,ly2stf,Cold_Baby_5902,0.4404,Supporting Adam,1614914482,0,1
129,ly2ldj,KarIMalone,0.8442,Ok I'm wanting to buy $25k worth of either Ethereum or ADA. Why should I choose Ethereum?,1614913815,0,1
130,ly2cyy,HE_Penny,0.0,Posting ETH address online?,1614913084,0,1
131,ly27cy,[deleted],0.0,"If you sell, someone will buy.",1614912564,0,1
132,ly1w0e,[deleted],0.0,"How much can I expect in gas fees for this? Approving cost $8 and thought that was it. Minting is $55, what about the last 2 steps?",1614911513,0,1
133,ly1sdv,Immediate-Cut-9233,0.717,Gain 0.5 ETH when logging in and then gain 0.2 ETH for each referral! Let’s get that coin!📈🔥,1614911156,0,1
134,ly1dfl,LordHantulio,0.0,Alpha(ish) leakage on Dracula Protocol,1614909805,0,1
135,ly14hj,phosphor-feel,0.5719,[DISCUSSION] Will NFTs create a faster Ethereum growth?,1614909007,13,12
136,ly0mvw,MrDLicious,0.4588,Cardano can never be fundamentally decentilized as long as Hoskinson fosters his cult following,1614907412,0,1
137,ly0leg,TechHodler,0.5106,"Grayscale Is Buying More And More Ethereum, Adding 19,355 ETH To Their Ethereum Trust in 7 days",1614907273,25,166
139,ly09en,CumagMonkey,0.0,Tokamak Network DAO Vault token burn,1614906181,1,0
140,ly049k,Skeptain,-0.3595,German public service television podcast: What if there is only Bitcoin and no more fiat and banks?!,1614905712,0,1
141,lxzztl,twigwam,0.0,Mousse: An Ethereum 2.0 Emulator for Local Testing of Eth2 Applications,1614905311,1,3
142,lxzulv,[deleted],0.4753,New collection of NFTs approved on OpenSea!,1614904855,0,1
143,lxzfe4,Flynnster1963,0.4199,Texas Neanderthal’s. Even Kennedy’s bust didn’t like the comments!,1614903517,1,1
144,lxzaqx,LostFlowz,0.0,Burned Banksy NFT Sets Art And Crypto Worlds Alight,1614903125,4,4
145,lxz3a4,luxasreddit,0.0,Introducing CryptoTracker!,1614902493,0,1
146,lxylz9,Solodeji,0.2023,Ethereum Developer Shares Details of the Changes That Are Coming With Berlin Hard Fork,1614901015,4,11
147,lxygay,daclub33,0.0,Uncle Dunce Cramer,1614900538,0,1
148,lxyf6x,Teph87,0.0,Is it still possible to recover DAO eth?,1614900442,9,6
149,lxybd4,AllenOneDC,-0.7772,"Elrond vs Ethereum, Cardano, Polka Dot, Avalanche!! 🔥🔥🔥",1614900129,0,1
150,lxy34v,abcoathup,-0.2263,"🚨 Join our workshop: Service Monitoring &amp; Automated Emergency Response with OpenZeppelin Defender; Learn how to: Respond faster to smart contract exploits; Set up 24/7 service monitoring with Defender Sentinels; Streamline manual &amp; automated emergency response; 📆 11 March, noon PT/3pm ET/8pm UTC",1614899456,0,4
151,lxxy5u,[deleted],-0.3182,"🚨 Join our workshop: Service Monitoring &amp; Automated Emergency Response; Learn how to: Respond faster to smart contract exploits; Set up 24/7 service monitoring with Defender Sentinels; Streamline manual &amp; automated emergency response; 📆 Thursday 11 March, noon PT/3pm ET/8pm UTC",1614899057,0,1
152,lxxruc,twigwam,0.0,Global Insurance Heavyweight Launching Blockchain Pilot on Public Ethereum,1614898566,3,30
153,lxxiex,BanklessHQ,0.0,12 Token Metrics You Should Know [Bankless],1614897808,0,3
154,lxxdpq,ADhomin_em,0.0,How does Mintable gasless minting work?,1614897437,0,0
156,lxx1p7,TheDefiantNews,0.1597,"We lend it, trade it, save it.. 🤑 MONEY💰 But have you stopped to think about what it really is? Where it comes from? Check out episode 1 of the School of Block series we have teamed up with @Ledger to produce. 📺 Watch now, subscribe &amp; share. ⏬",1614896450,0,1
157,lxwrpb,[deleted],-0.2263,"🔥BIG ANNOUNCEMENT🔥 @DefiantNews has teamed up with @Ledger &amp; we are serving you with a weekly new series called School of Block. This week's episode examines what money REALLY is, and how crypto fits into the equation. 📺 Watch now, subscribe &amp; share. ⏬",1614895692,0,1
159,lxwkcm,TrendingBot,0.0,/r/ethereum hit 700k subscribers yesterday,1614895140,4,23
160,lxwavk,rkruegs123,0.0,Ethereum 2.0 transaction fees?,1614894403,4,1
161,lxvswy,itovault,0.296,Show Reddit: SpaceX shares tokenized as a pre-IPO Defi Token,1614892996,27,9
162,lxvofc,[deleted],0.0,Are there any insurance companies that provide for crypto related software services?,1614892652,0,1
164,lxvgin,[deleted],0.0,A little Hopium for everyone,1614892055,0,3
165,lxvbhv,TheDefiantNews,-0.6597,Aavegotchi NFT Drop Sells Out in Under One Minute - The Defiant - DeFi News,1614891687,0,1
166,lxv694,Victorvonstein,-0.4019,Some kind of transfer error?,1614891398,0,1
167,lxv18s,TheDefiantNews,0.3818,Amazon Makes Hosting An Ethereum Node Easier - The Defiant - DeFi News,1614891116,0,1
168,lxuu1o,TheDefiantNews,-0.2263,A Quick Guide To Accelerators Funding NFT Startups - The Defiant - DeFi News,1614890700,0,1
169,lxurp9,TheDefiantNews,-0.2263,DeFi Rebounds After Bleak February - The Defiant - DeFi News,1614890561,0,1
171,lxuner,trent_vanepps,0.4019,"March Mod Announcements 📣 Note on NFT Art Posts, Active / New Mods, Resource List",1614890315,77,31
173,lxuemb,nsfw_celbs,0.0,I got ya homie!,1614889800,0,1
174,lxu73g,ecipch,0.0,RX6800 + Phoenix miner.. 30 compute units?,1614889242,0,1
175,lxtp22,Itchy-Link,0.0,Art and NFT,1614888002,0,1
176,lxtf2h,kingzYzn,0.0,NFT tweet tokens,1614887271,0,1
177,lxtbxk,lwilson747,0.0,Zero Knowledge Proofs (ZKP) Masterclass,1614887047,0,1
180,lxt3mo,thecakepa,0.6908,I hope the situation improves soon,1614886451,0,1
181,lxsyqh,cigars_and_rum,0.836,Is now a good time to buy,1614886095,0,1
182,lxsy0g,TokenMint,0.0,ERC20 standard ELI5 (for beginners and non-developers),1614886042,0,1
183,lxsvq9,geoffisracing,0.0,Looking for Developer Feedback,1614885877,9,6
184,lxsgo3,[deleted],0.0,"Thеre is a Youtuber callеd ""Leоn Fаrаday"" that lеarns еvеrywееk а new skill. Нis rеlаtives рassеd аwаy whеn hе was 14, hе mаkes vidеos about оwn expеrienсe оf mastеring new skills аnd anоthеr videоs for peoplе tо kееp mоtivatiоn to lеаrn аnd try nеw things, becаuse wе have оnly one lifе !",1614884820,0,1
185,lxsgjt,[deleted],0.0,"Thеrе is а Youtuber cаllеd ""Leоn Faradаy"" thаt leаrns everywееk a new skill. Нis relativеs рassed awаy whеn hе wаs 14, hе mаkes videоs аbоut оwn ехpеrienсe of mastеring new skills and аnоther videоs fоr pеоple tо keep motivаtiоn tо lеarn and try new things, bеcause we havе оnly one lifе",1614884810,0,1
186,lxs91q,ef_esp,0.2263,Local Grants Honduras &amp; Colombia Roundup [ENG/ESP],1614884313,0,8
188,lxs7uj,RightBlacksmith9,0.5106,Grayscale Ethereum Trust ETHE selling below Eth price,1614884225,0,1
189,lxs4hj,abishekdharshan,0.1511,L2 Season is on 🔥! Zerion now support tracking for all balances on Polygon (ex Matic),1614883980,0,2
190,lxs0d2,Fitz6six,0.0,Can't deposit funds from avvegotchi,1614883683,0,1
191,lxrx3b,stones_and_anvils,0.0,How can we contribute to ETH development?,1614883450,3,9
192,lxrv47,ftsjonnyrich,0.0,Karma SOS,1614883307,16,44
193,lxrort,RightBlacksmith9,-0.4215,"Crypto, Stocks &amp; Bonds Are Plunging As Powell Fails To Deliver",1614882846,0,1
194,lxrf32,brovbro,0.0,How to loan yourself 8 quintillion dollars,1614882129,0,2
195,lxr4f0,twigwam,0.8074,"“PayPal's crypto unit is experimenting with smart contracts, and testing Ethereum and other blockchains as potential candidates to help the company improve payments and other transactions.”",1614881377,272,1520
196,lxr3j5,[deleted],0.4019,"“PayPal's crypto unit is experimenting with smart contracts, and testing Ethereum...""",1614881314,0,1
197,lxqykn,BlackTrickster,0.0,Should I ditch Litebit?,1614880977,4,1
198,lxqszc,[deleted],0.4588,Welcome to the Future,1614880572,6,8
200,m1hpji,TheForestPhoenix,0.644,Does ETH look bull right now or no? Thoughts... opinions?,1615327674,0,1
201,m1hovm,PAAlmasi,0.4199,Alchemy Now Supports Payment in Crypto!,1615327627,0,1
202,m1holy,rampagingk1tty,0.0,ETH price under EIP-1559/ETH2,1615327607,0,1
203,m1h28m,Kryptonian_Ace,0.0,ZSJL NFT,1615325914,0,1
206,m1gwyy,brownbrady,0.0,Why is Dorsey converting his NFT proceeds to Bitcoin for?,1615325537,11,1
207,m1gt0d,xobenzo,-0.5994,"Environmentalists reactionary war on cryptos and in specific , NFTs",1615325250,0,1
208,m1gr0p,RipsawBitcoin,0.5719,Miner Reward Pool Payout gas fees,1615325096,0,1
209,m1gd3s,thefoodboylover,0.0,NFTs: what are they and how do they work?,1615324092,0,1
210,m1ga0l,FishBucket84,0.25,I have created a step by step guide for the people who are new to Ethereum and the market in general.,1615323869,0,1
211,m1fv9c,borayds,0.0,Legend 🤩,1615322789,1,1
212,m1fmxx,stones_and_anvils,0.0,What does it take to 51% a PoS chain?,1615322143,35,1
213,m1f161,TheForestPhoenix,0.4215,ETH is shutting down the competition for the year lol. Curtains closed.,1615320512,0,1
214,m1ejpt,Far-Cheesecake5735,-0.296,How to Avoid ETH 2.0 Fork,1615319243,0,1
215,m1ee3x,tanim13,0.68,Road to 1 ETHER! $eth 2021 is my year to create generational wealth. 0.57 total as of today.,1615318807,0,1
216,m1ed3v,Negative-Ad-6715,0.4278,Can someone PLEASE help me I've transferred WETH instead of ETH :(,1615318730,0,1
217,m1ebm4,Negative-Ad-6715,0.4278,Can someone PLEASE help me :(,1615318610,0,1
218,m1e7d7,bush2874,0.0,What’s one thing about Ethereum that most people here might not know?,1615318307,15,1
219,m1e5ul,apollo8720,0.0,What ERC-721 implementations are all these NFT minting/marketplaces using?,1615318198,0,1
221,m1e03z,xnotic,0.4767,Ethereum-Based Social Network Minds Taps Into DeFi Rewards - Decrypt,1615317749,1,1
222,m1dvml,Ferret_Aware,0.0,Xbox-sized quantum computer at room temperature from IonQ by 2023,1615317410,0,1
223,m1dv7p,TheDefiantNews,-0.2263,Big Data Protocol Amasses 10% of DeFi TVL Over the Weekend - The Defiant - DeFi News,1615317382,0,1
225,m1drgk,TheDefiantNews,0.34,Withdrawal Delays Highlight NBA Top Shot Centralization - The Defiant - DeFi News,1615317108,0,1
226,m1dqlq,TheDefiantNews,-0.6124,DODO DEX Suffers $2.1M Hack - The Defiant - DeFi News,1615317048,0,1
227,m1dp8b,TheDefiantNews,-0.2263,Cover Protocol Token Dives After Yearn Breakup - The Defiant - DeFi News,1615316946,0,1
228,m1dou4,kola401,0.0,Where do you get your ethereum news?,1615316916,15,1
229,m1cptb,econoar,0.4215,"EthHub Weekly #156: EIP-1559 approved, March for Ethereum, Meitu buys more ETH than BTC, Geth v1.10.1 released, Yearn announces Partners program and YAM announces DAO House",1615314209,0,1
230,m1cbkc,TechHodler,0.0,The Wolf of Defi Lending,1615313143,40,1
231,m1c406,iartnewyork,0.4588,How long will the NFT digital art boom last?,1615312595,0,1
232,m1c1rh,Due-Representative30,-0.3182,Is this a scam or legit? Help,1615312428,0,1
233,m1bzs8,Niklaus1911,0.0,Test,1615312288,0,1
234,m1bxn5,Niklaus1911,0.0,A thought,1615312130,0,1
235,m1bumq,TobiHovey,0.0,Atari Is Building a Casino in Ethereum’s Virtual World Decentraland,1615311905,5,1
236,m1bski,lost_civilizations,0.0,Does yield farming rely on UPONLY?,1615311754,0,1
237,m1bnxt,DontTrustVerify,0.0,"Blockchain Domain NFT Sold for Record $100,000",1615311409,0,1
238,m1bnvq,ABobby077,0.0,Ethereum on Robinhood vs other Cybercurrencies (and exchanges),1615311405,0,1
239,m1bh55,Homaosapian,-0.6486,"Family members lost ETH in a scam, is there a chance for recovery?",1615310919,16,1
240,m1ber4,RyanZi19,0.5267,Relatively new to Ethereum/crypto. How do you gain from it?,1615310729,0,1
241,m1bd9t,poopoocherrybooboo5,0.0,I will be selling 50 of my Ethereum today for Dogecoin.,1615310614,0,1
242,m1asfn,jessea9737,0.8652,"Anyone looking into trying Voyager? Smooth and user friendly, plus your bank account deposits are usable instantly. If you sign up with my code and then trade $100, both of us will get $25 in Bitcoin which you could sell and buy Ethereum with. Good luck with your investing!! Here’s my code: 3667AE",1615309122,0,1
243,m1ake8,LBG-13Sudowoodo,0.3182,🟡🟡🟡 Curious where to get HOPR? Here is the list we know currently 🟡🟡🟡,1615308537,0,1
244,m1ahdm,JUBlolzing13,0.4019,1080TI settings Help.,1615308319,0,1
245,m1a8xd,hexonaut,0.5423,Announcing the Optimism Dai Bridge with Fast Withdrawals,1615307687,41,1
246,m1a7lt,kshucker,0.7184,Anybody know where I can buy an Ethereum flag to fly on my flagpole?,1615307589,0,1
247,m19vrk,pennymciccone,-0.1027,Who would pay 2 ETH for a poorly designed piece off of Adobe Illustrator?,1615306704,0,1
248,m19shp,dragonbenj,0.9439,Now the proud owner of 2 Ethereum thanks to GME profits !! Going to buy a 3rd with the stimmy check !!,1615306471,37,1
249,m19qs9,TRIPITIS,0.0,ENS - Where did my ETH go?,1615306342,4,1
250,m1989g,ElementBlocks,0.3612,"Made this for a discussion on Twitter, thought you would like it too.",1615304965,0,1
252,m19199,max78mb,0.0,$44 miner fee! Alternatives to ETH,1615304444,0,1
254,m18x62,OptimalBit5,0.6841,How to move EASY &amp; other tokens from Ethereum to Polygon Network- A comprehensive guide,1615304127,0,1
255,m187w6,mariapaulafn,0.0,These community projects are being ported to Golem’s mainnet,1615302194,11,1
256,m1835k,Longjumping-Sock-195,0.0,What would 12 year-old you never believe about adult you?,1615301829,0,1
257,m17xuw,ethanproia,-0.296,Why I’m Going to Stop Minting NFTs (For Now),1615301409,26,1
258,m17x9t,Funcle-Jerry,0.296,Trading to Stable coin VS Fiat currency,1615301364,0,1
259,m17sr4,ColinTalksCrypto,0.0,1INCH Exchange &amp; Token on Ethereum – Decentralized Exchange (DEX) Aggregator – Review,1615300998,0,1
260,m17p50,Available_Window1234,0.0,Vitalik at the Tim Ferriss Show!,1615300695,13,1
261,m17m25,TRAcademy,0.0,"Ethereum Technical Analysis for March 9, 2021 - ETH",1615300424,0,1
