,id,author,vader,title,created_utc,num_comments,score
2027,m61d4u,redcessna,0.4019,Newbie help - BOND/BOND token swap,1615870517,0,1
2028,m61cfb,Similar_Release6136,0.6908,Rocket Bunny thank me later,1615870440,0,1
2030,m60op3,tyr2665,0.0,First NFTs using Opensea/Ethereum,1615867866,1,1
2031,m60ni9,supersoeak,0.0772,If you want to realise the power of L2 try BTCs lightning network,1615867745,0,1
2032,m60eva,meanjan,0.25,Get notified when recommended Ethereum Gas Price reaches threshold,1615866895,30,1
2033,m607xl,Amaredues,-0.0772,Sorry little guy... maybe another day,1615866209,0,1
2034,m605tp,Lostinmythoughts4e,0.3612,Gone Like the Wind.,1615866006,0,1
2036,m5zjan,htown_hamza1,0.0,My Journey to $1 Million | Updated 3/15,1615863894,0,1
2037,mga8ml,ayushman0503,0.0,Ethereum Development Company in Singapore,1617088483,2,1
2038,mga2x0,GGReaperrr,-0.0516,Noob gets rekt by ETH gas fees,1617087761,440,1
2039,mg9vy8,godova,0.296,Visa Settlements Enhance Ethereum as 'Ultra Sound Money',1617086877,34,1
2040,mg9tn8,sportifynews,0.0,Decentralized Finance (DeFi) on Ethereum: The Future of Finance?,1617086566,0,1
2041,mg9fh8,jgrokatana,0.0,"How do you feel about ETH's stagnation today compared to its competitors, Cardano, Solana and Avalenche?",1617084782,0,1
2043,mg96u3,PaleCasual,0.296,The money printing industry must be making a mint.,1617083800,0,1
2045,mg8mlq,pipermerriam,0.0,An updated roadmap for Stateless Ethereum - Eth1.x Research,1617081462,23,1
2046,mg8hck,DiamondHandInvestor1,0.0,?????!,1617080878,0,1
2047,mg8gnq,DiamondHandInvestor1,0.0,?????????,1617080801,0,1
2048,mg8fh3,Callicon60,0.0,Out of the frame #openseacollection #nftart #art #nftartist #cryproart,1617080671,0,1
2049,mg813u,obamafeet,0.8481,let's gooooooooooo successfully purchased my first ETH trading up smaller coins :) :),1617079141,0,1
2051,mg73xs,mudgen,0.6908,EIP-2535 Diamonds is a standardized architecture for large smart contract systems. Standardization comes with the benefit of software integration. For example now there's a user interface that works for all diamonds,1617075786,6,1
2052,mg71i4,GregMaxwellKilledBTC,0.7351,Adopting endangered animals on the blockchain for fun and profit.,1617075541,0,1
2053,mg678t,Ituglobal,0.0,Euro Stays Fragile As ECB Accelerates the PEPP Process,1617072607,0,1
2055,mg5ls8,leavingcaforever,-0.541,I feel so discouraged buying my first eth investment,1617070596,0,1
2056,mg5bzj,Toycollector2021,0.5411,"Karl Lagerfeld by Elias Morgan, exclusively available on Rarible! There exists only one of this item, upon purchase the actual 1ft statue will be rewarded to its new owner. #NFT #NFTart #Lego #NFTartist #NFTcreator",1617069723,0,1
2057,mg59s7,mrsotkogaming,0.3818,"Whiteheart Finance - Huge Gains, Low Cap, Unique Features",1617069532,0,1
2058,mg53k1,LebJR1991,0.6369,What are the best Ethereum ClubHouse rooms?,1617068934,4,1
2059,mg4uek,rashyahampath,0.5562,Impressive Stats of the Launch !,1617068082,0,1
2060,mg4fgg,leavingcaforever,0.0,First-ever fractional eth purchase on Gemini,1617066699,0,1
2061,mg4bhd,ArcTanSusan,0.7371,KeepKey on its way! What online exchanges work BEST with keepkey?,1617066332,3,1
2062,mg2wxt,julianocgil,-0.0762,"Not kidding, where is Ethereum real used today?",1617061767,0,1
2063,mg2rbl,spelee,0.0,Newbie question regarding price of Ether &amp; relationship to cost of transaction on blockchain,1617061272,0,1
2064,mg2paj,mrfatbush,0.0,Visa has more conviction or knowledge about Ethereum that we don't?,1617061097,8,1
2065,mg2hzn,Ownmybets,0.4389,STC ICO don’t miss it!🚀,1617060441,0,1
2066,mg2h5l,Driabelyk,0.296,How can I invest my RRSP money in Ethereum?,1617060370,7,1
2067,mg2du9,Kingsz777,0.0,I have 1 eth?,1617060092,0,1
2068,mg2at5,Onetimeexperience,-0.6249,Be part of internet history: Worst NFT Ever,1617059834,0,1
2070,mg1s0i,LegPublic,-0.4404,"Joined the 2 ETH club today, scared and exited at the same time",1617058277,0,1
2071,mg1fux,FurrieBunnie,-0.1027,Why is a DAG memory hard?,1617057266,0,1
2072,mg0zbh,TheVictoriousX,0.0,NFT,1617055948,0,1
2073,mg0yj9,TheVictoriousX,0.0,QUESTION,1617055884,0,1
2074,mg0vt9,BrianAtSantiment,0.0,"Ethereum's Amount of New Addresses Continues Long-Term Climb, Tokens Continue Moving Off Exchanges",1617055662,1,1
2076,mg0rdz,aklosk,0.0,What protocol(s) will visa and other major banks use,1617055320,5,1
2077,mg0pim,DrinkMoreCodeMore,0.0,Liquity Raises $6M in Series A Funding,1617055184,0,1
2078,mg0e4f,CatalystFinder,0.4404,Eth 2.0 should be advertised better for noobs. This is the more underappreciated catalyst in the market.,1617054250,0,1
2079,mg0d4o,ISilvera,0.0,Eth-backed data cooperatives could transform digital marketing,1617054171,0,1
2080,mfzazy,SilesiaTech,0.7424,Ethereum NFT game. Buy yourself a part of virtual Berlin!,1617051295,0,1
2081,mfzabx,Mouad1992,-0.6124,Where's those $ETH killers? 💎🚀❤️,1617051245,0,1
2083,mfz1nu,Ill_Hope7508,0.3321,Ethermine losing its miners 3x more than it gains them from MEV (please doublecheck),1617050600,0,1
2084,mfz1j9,obsd92107,0.0,Ethereum “Killer” Solana Surges 14% on a Slow Market Day - Decrypt,1617050590,0,1
2085,mfz1h2,EkariKeimei,0.0,What to do with wallets when the fork happens,1617050586,10,1
2086,mfyuuc,Limus93,0.0,Hi there Ethereums!,1617050085,0,1
2087,mfytoc,Solomon7777,0.0,BitPaX,1617049998,0,1
2088,mfytlw,Turned81,0.2577,46821 Block Confirmations and Growing - Will the TX ever go through?,1617049993,0,1
2089,mfyny1,Warran_Simalia,0.4588,"$7.2 billion passes through Uniswap today, more than tripling previous high of $2.19b",1617049562,1,1
2090,mfymlg,hateshinakusora,0.0,"OMG Network, Hashcast, Varna DEX, L2 Quasar Fast Exits",1617049454,13,1
2092,mfy4dr,bpierre,0.4019,useNft() 0.4 adds support for MoonCats and CryptoKitties,1617048057,0,1
2093,mfy0ti,bestcheatv3,0.0,Will my transactions ever confirm??,1617047795,0,1
2094,mfxt80,EscapeSpare5015,-0.7351,Terrible terrible fees,1617047209,0,1
2095,mfxl2y,Bjorketre,0.0,[Question] Is there any statements or thoughts from Vitalik regarding CasperLabs and their issuing of Casper token?,1617046584,7,1
2096,mfxen1,BrianleeVictory,0.4019,Help With Brownie Questions for $Tip.,1617046106,0,1
2098,mfxasw,residentkim,0.0,Cryptocurrency Newbie here (Question),1617045818,0,1
2100,mfx81t,kmilrs,0.2263,"I built The Place, an Ethereum NFT-powered successor to r/place",1617045621,4,1
2101,mfx7ws,SpeedyCorals,0.8516,Thanks to ETH I can now retire and live off my interest rewards!,1617045613,0,1
2102,mfx4ba,zebzi,0.91,Check out handcraft stop-motion ethereum.♥️🥰 what do you think? ✂️,1617045351,1,1
2103,mfwmye,SketchySkunk,0.0,The London fork,1617044088,0,1
2104,mfwmkz,Otherwise_Explorer48,-0.296,No way people are actually buying this shirt,1617044062,0,1
2105,mfw661,CoinjoyAssistant,0.0,Visa Starts Settling Payments in USDC on Ethereum Blockchain,1617042814,0,1
2106,mfw257,stvmcg,0.0,What are non-fungible fillable tokens (NFFT)?,1617042506,0,1
2107,mfw0my,Noisekar,-0.504,Why 15s for block production? What happens if a contract code runs for more than 15s?,1617042396,0,1
2108,mfw0ji,dng-992,0.0,"Layer 2 options, how do they compare - CELR v MATIC v SKALE",1617042390,0,1
2109,mfvzqi,alvarolloret,0.6643,I ONLY own less than half ETH but I'm proud of it. Learning a lot!,1617042326,62,1
2110,mfvogt,Which-Wrongdoer7829,0.4019,Interesting ERC-20 project,1617041501,0,1
2111,mfvnq0,DrinkMoreCodeMore,0.6486,Growth hacker uses ETH and BTC to help the unhoused,1617041447,4,1
2112,mfvkyi,nater984,-0.3182,"Ethereum Price Prediction: ETH rolls toward $2,000 as resistance weakens",1617041242,0,1
2113,mfvi3h,Karampampoli,0.0,TIFU: I got scammed,1617041041,0,1
2114,mfvhna,Tiny-Ad-7093,0.9563,"Kinda new to ethereum from the research ive done on crypto i love it, but in curious if my current ETH will go away once it splits into ETH 2.0 i want to invest in 2.0 so im not sure if i should buy more ETH now or wait until 2.0 can somebody help me understand that please",1617041008,0,1
2115,mfvbec,tearductduck,0.7569,"Really enjoying this book right now and highly recommend it - ""The Infinite Machine"" (it's all about Ethereum and Vitalik)",1617040555,2,1
2116,mfv9tl,rowger2020,0.7096,Razor Network is the best decentralized Oracle network for decentralized; 🔸️Stablecoins 🔸️Insurance 🔸️Prediction markets 🔸️Creation of Synthetic assets 🔸️Lending 🔸️Exchanges and derivatives trading market 🔸️Identity.,1617040434,0,1
2117,mfv7oc,Wide_Meet9113,0.4215,Understanding Gas Fees on Popular Contracts,1617040281,0,1
2118,mfv4jr,NinjaDK,-0.7184,Crypto Art NFTs With ‘Superpowers’ Ether Cards Sell $9M in One Day,1617040060,0,1
2119,mfuire,boot_knocker_,0.0,L2 DEX 24 Hour Volume - 3/29,1617038427,1,1
2120,m1oh0m,DiscoGalaxy,0.0,Is Ethereum the groundwork for an internet 2.0?,1615347590,0,1
2121,m1obtu,againstgiants,0.0,"dropped my first-ever NFT on Foundation - ""THE LAST COMPACT DISC""",1615347117,0,1
2122,m1obda,mrsotkogaming,-0.1759,Ethereum Will Hard Fork Soon - Here's What's New!,1615347077,0,1
2123,m1o76c,joesmith91,0.0,NFTs on Ethereum May Not Be Sustainable: TRON Provides Alternative,1615346705,0,1
2124,m1nxep,cksggi,0.5106,4 cryptocurrencies left Bitcoin behind in appreciation,1615345948,0,1
2125,m1nvx7,Infamous_Sympathy_91,0.0,Diamondhedge Sub and ethereum members,1615345818,0,1
2127,m1nt9n,FeelingTown,-0.0772,I’ve just started to invest in Crypto. I think ethereum is the horse I bet on. However I only can afford a few thousand (Canadian) to start. Is it worth investing in a small portion or ETH or should I try to invest in a lower cost Crypto?,1615345584,0,1
2128,m1nt0b,Infamous_Sympathy_91,-0.5093,BITCOIN potential reversal/crash warning off 0.786 FIB level - remember the market likes to hurt retail investors! Maximum likely bottom $38794.,1615345565,1,1
2129,m1nsi5,secretmowney,0.0,Is this a BURN address? (HOGE),1615345522,0,1
2130,m1nn5g,babypawner,0.3182,Solution to scale Ethereum '100X’ is imminent and will get us through until Eth2: Vitalik,1615345062,0,1
2131,m1nj32,crscrl,0.0,Chris Carroll - Hyperballad (Official Music Video),1615344702,0,1
2132,m1ned5,One-Style3440,0.0,$1200,1615344266,0,1
2133,m1namz,PBJ918,0.1779,EIP 1559’s lack of compassion,1615343945,0,1
2134,m1n9vp,NFTSharpshooters,0.0,KOBE BRYANT GIVEAWAY ON MY TWITTER FOR MY NEW NFT,1615343880,0,1
2137,m1m9dd,harano1109,0.0,"How to get TERC (USDC, USDT, etc.) token on Kovan Testnet?",1615340817,0,1
2138,m1lqa6,Panosmek,0.0,Blockzero Labs: Bringing the next generation of decentralized projects,1615339179,0,1
2139,m1lpiv,xARRIxFLEXx,0.0,Plain Old Fashion Theft ... That's what BSC is ... But yet ppl are buying a centralized coin...,1615339113,0,1
2140,m1lkhp,_twilightsparkle96,0.2023,What is your top piece of advice for an ETH novice?,1615338685,0,1
2141,m1li32,Unusual_Site9511,0.0,Ethereum on CNBC,1615338477,0,1
2143,m1l07k,JoneyThairish,0.0,Can literally anything digital become an NFT?,1615337013,4,1
2145,m1kcg8,DieDeeDie,0.6486,Easy way to explain ETH is not only a storage of value,1615335083,0,1
2146,m1kbfk,NoobMaster69RGC,0.4215,"Etherium ""went missing""? Can someone help please.",1615335006,0,1
2147,m1k7rr,Sohrry,0.0,First NFT on the Market!,1615334708,0,1
2148,m1k61w,amr5120,-0.3612,This is ridiculous,1615334569,0,1
2149,m1k5n9,MissilerLermer,-0.4939,Easiest Way to Make &amp; Sell NFTs,1615334537,0,1
2151,m1juqc,shadowt1tan,0.0,ETH ETF Coming Soon TSX,1615333677,7,1
2152,m1juc4,springshop,0.0,Deadmau5 NFTS,1615333647,5,1
2154,m1jkdd,carloscancab,0.0,(1:30m) Metamask's Genius Turned 10 MILLION Developers Into Smart-Contract Coders: Minima CTO,1615332834,0,1
2155,m1ji69,RealPennyMuncher,0.4939,**slides hand in pants** 🦧🍿,1615332655,0,1
2156,m1jekq,jackdagnels,0.0,"The Graph and Paypal, potential partnership",1615332370,0,1
2160,m1j5h9,Neat_Temperature4796,0.0,Etherscan - what is behind the,1615331662,0,1
2161,m1j52t,RealPennyMuncher,0.4201,"More like, EtheriYUM",1615331630,0,1
2162,m1j4px,Neat_Temperature4796,0.0,What happened to this transaction,1615331602,0,1
2163,m1irdx,vbuterin,-0.0516,Privacy-related open problem for the cryptographers: improving stealth addresses,1615330589,2,1
2164,m1ikrg,JadedSoulRat,0.4201,CIO of US Global Investors Frank Holmes expects Ethereum to out-perform every major asset class in 2021,1615330078,0,1
2165,m1ig73,agustdisback,-0.6369,why do I need to pay money to sell NFT?,1615329718,2,1
2166,m1iakt,oznekenzo,0.0,"On Broadway, Manhattan. NFTs / ETH hitting mainstream 🌿",1615329283,1,1
2168,m1i40a,BrothrBear,-0.7269,Ways to combat bots stealing art to convert into NTFs,1615328790,0,1
2169,m1i2sv,LloydLadera,0.6124,I'm an artist looking to partner with a trader who wants to get into minting and selling original primo NFT artworks. Anyone out there interested?,1615328692,9,1
2170,m1hx4j,Nevermindxoxo,0.3612,Ready for Eth 2.0?,1615328257,0,1
2172,m4bjbm,obsd92107,0.0,Blockchain in Finance &amp; Fintech: The Future of Financial Services | ConsenSys,1615658374,0,1
2173,m4bgrg,dear_fellow,0.5106,Let me know your honest opinion.,1615658160,0,1
2175,m4au8d,coinmonks,0.0,Ether is becoming a deflationary cryptocurrency!?,1615656348,0,1
2176,m4am6p,RealPennyMuncher,0.0,Hodl onto your dicks. Another move coming here🦧🍿,1615655686,0,1
2177,m4afle,alealv88,-0.4767,What could happen to ETH price after the potential attack on April 1st?,1615655143,8,0
2178,m4aa20,KodaLG,0.7184,Buy more Bitcoin or Ethereum?,1615654720,0,1
2179,m49g5r,meanjan,-0.25,Exploring Ethereum Mempool - I built `harmony - Reduce Chaos in Mempool`,1615652246,3,1
2180,m49dan,thecakepa,0.3612,The market exactly one year ago... 😅,1615652007,0,1
2181,m4922f,TitleXVII,0.0,Made my first purchase,1615651123,22,1
2182,m48use,elliottruzicka,0.296,NFT story featured on Planet Money Podcast,1615650491,0,1
2183,m48n2d,Awkward_Judge_3308,0.4404,A question to my good people,1615649835,0,1
2184,m489ca,Niklaus1911,0.0,---,1615648679,0,1
2186,m484ml,otemzi11,0.0,"NFT is gradually becoming the new trending subject inside the crypto space, and few weeks back, MurAll came into existence, a medium their allows you to draw on canvas directly to the blockchain",1615648283,0,1
2187,m47y6d,filmnoiiir,0.7506,🚀🚀,1615647733,0,1
2188,m47tnb,Substantial-Town4106,0.0,Uniswap gas fees question?,1615647340,11,1
2189,m47mej,MuitoLegal,0.0,Invest in ETH or ETH games?,1615646676,0,1
2190,m4725t,TrumpIsACuntBitch,0.0,Is it just me or are these two graphs almost identical?,1615644779,0,1
2191,m470e2,RealPennyMuncher,0.2732,Well that escalated quickly,1615644618,0,1
2192,m46z6y,Thetanskeeper,0.7845,Looking like a good morning 😃,1615644507,0,1
2194,m46wco,Odd_Chemical_420,0.0,EIP - 1559: what ain't the miners practical?,1615644242,0,1
2195,m46w88,EthereumHoIder,0.7184,Other Cryptos: Lets go to the moon. Ethereum: Lets start a galaxy.,1615644231,0,1
2196,m46upg,MantryalOnTwitch,0.7506,SAFEMOON🚀🚀,1615644094,2,1
2198,m46nv9,DrRant,0.0,Staking after the 2.0 arrives,1615643458,55,1
2199,m46nsu,patrykad,0.7003,"Spendless - Earn interest on DAI and automatically donate it to charity. Give, without spending.",1615643451,0,1
2200,m46miy,Olli917,0.0,EIP-1599 release date?,1615643327,0,1
2202,m46c1d,georgengland,0.8807,Where is the best place to buy my first Ethereum?,1615642272,0,1
2203,m46bdx,djefoo,0.6135,1 OF 1 DIAMOND HANDS NFT FOR AUCTION!!!,1615642210,0,1
2204,m4631b,frrrni,0.7964,What's the best way to gift someone some ETH and some tokens?,1615641358,44,1
2205,m45xa5,fredrikaurdal,0.0,"NFT and Crypto Art Explained | Crypto Art For Beginners, How It Works",1615640770,0,1
2206,m45ojs,StephnCarlo,0.0,Question,1615639836,6,1
2207,m4521g,morukur,0.0,NFTs vs ERC721,1615637278,0,1
2208,m44zgy,ChillazChillazius,0.0,I made a thing,1615636975,1,1
2209,m44q3g,ImScart,0.0,Proof of stake,1615635854,53,1
2210,m44gum,Boss23121989,-0.2732,Why is Ethereum lagging behind bitcoin?,1615634665,0,1
2211,m44d00,ebasler,0.0,Staked vs Stored Ethereum,1615634175,0,1
2213,m444we,GlobalP2P,0.5859,Recent live BETA testing on Emirex for our compliant asset backed digital money BiPS,1615633188,0,1
2214,m444tl,wanderingcryptowolf,-0.8541,April Fools Day fast approaches 😱🤔 what will be??,1615633179,6,1
2215,m43zat,XpucToXT,0.0,Contracts on eth2,1615632443,0,1
2216,m43pp7,PedroHimself,0.0,NFT question!,1615631188,0,1
2217,m43nzu,Spongky,-0.4767,"new here, $90 fee in compound, i'm like what the hell.. should i proceed?",1615630970,0,1
2219,m43bls,Rocketshipbeyondmoon,0.0,Aavegotchi (GHST),1615629343,0,1
2221,m43ap3,Best_Ambassador516,0.4404,Funny Ethereum Story.,1615629213,0,1
2222,m42wl7,BeyondGodlikeBot,-0.34,Out of the **PoW** 🍳 into the **PoS** 🔥...,1615627215,0,1
2224,m42q1y,bubbelovesya,0.5411,ASTRONAUGHTY Nasa NFT 🍆👩‍🎨 See it to believe it! 🚀,1615626293,0,1
2225,m42hpf,blckwd1,0.2263,Must listen for anyone curious or cynical about why MetaKovan is pouring money into NFTs,1615625156,0,1
2227,m4292t,vertualvega,0.0,Eth and PayPal,1615623914,0,1
2229,m420yh,unitydivide,0.3818,Is one of the benefits of PoS over PoW that it would be much less susceptible to government interference?,1615622776,137,1
2230,m41wix,JobsAreDumb,0.4019,NFTs are a Smart move for Ethereum,1615622193,0,1
2231,m41stf,galaxy_van,0.0,Buying my first Ethereum,1615621696,0,1
2232,m41o3l,jacksam_3,-0.7184,Can I sell my art/animation more than one marketplace NFT ?,1615621067,0,1
2233,m41i5w,EuphoricSet6325,0.0,"Why is my transactions so expensive? Tried to mint a mooncat, but it cost 2.5 eth",1615620283,0,1
2234,m41eyz,Adaptabledna,-0.0516,"Noob Here, ETH 2.0 End of 2021 Price Prediction",1615619872,0,1
2235,m410wo,ImTheFriedOne,-0.3384,It’s my first time... I’m kind of nervous,1615618114,18,1
2236,m40xha,bdinu89,0.2023,Top Cryptocurrency Portfolio Trackers,1615617665,0,1
2237,m40wds,Focus_Leading,0.0,The in game pizza order is starting to blow up online guys I told you getting pizza and Blockchain gaming together would be the ticket to putting Decentraland on the map,1615617510,0,1
2238,m40w4y,Specialist_Ad9033,0.0,Adoption of Cryptocurrencies by Countries,1615617477,0,1
2239,m40t88,PCgaming4ever,0.0,First in game cryptocurrency purchase using Blockchain based decentraland,1615617111,1,1
2240,m40au2,FinalMedium8,-0.5423,Are these bad times to start mining?,1615614823,0,1
2241,m3zwy5,SniffleButtons,0.0,"Since ethereium is decentralized how can it be updated, and if they can update it, can they control it?",1615613163,0,1
2242,m3zlz4,bb10man,0.0,Point of view from a large(ish) scale miner,1615611947,0,1
2243,m3zjru,RealPennyMuncher,0.0,Here we goooo🦧🍿,1615611708,0,1
2244,m3z65m,stone2golf,0.3182,HUGE POTENTIAL,1615610184,0,1
2245,m3z4wp,jklepatch,0.0,EIP 1559 Simply Explained,1615610053,26,1
2246,m3z0f6,ATOMxBOMB,0.3182,Old school business owner with a unique use case idea for blockchain. Please advise.,1615609552,50,1
2247,m3yvrk,FiniteImaginaryPrime,0.0,[Adoption/MSM] WSJ Video explaining NFT's,1615609035,0,1
2248,m3yu7t,mrsotkogaming,0.4588,MicroStrategy Buys $15 Million In BTC At Near All Time High,1615608864,0,1
2249,m3ytga,IFearEars,0.7269,How long does approval for Staking on Coinbase take?,1615608787,16,1
2250,m3yrkp,vertualvega,0.4019,Need some help with ETH wallets,1615608585,17,1
2251,m3yptq,SugarPopNFT,0.0772,First time diving into NFTs. I give you: Creatur3,1615608402,0,1
2252,m3ym8f,PiccoloPlayful1088,0.0,Will the new ethereum EIP-1559 cause the ethereum price to surge?,1615608035,10,1
2253,m3yj1z,RealPennyMuncher,0.0,Bout time for another northward move here,1615607692,0,1
2254,m3yh0n,Rehcisf,0.1779,Crypto's Fastest Growing Casino,1615607469,0,1
2255,m3yci6,BoundariesAreFun,0.0,What are everyone's predictions for Ethereum's price as we head into 2022 and 2023?,1615606970,5,1
2256,m3y59r,Turnurr,0.6696,"In light of my first full ETH purchase, I’m tufting an ETH Logo Rug! *WIP* 💙",1615606189,0,1
2257,m3y3xx,Turnurr,0.6696,"In light of my first ETH purchase, I’m tufting an ethereum logo rug! *WIP* 💙",1615606046,0,1
2258,m3y2li,sandakersmann,-0.4767,Vitalik escalates ETH 2.0 merge as miners plan a 51% attack,1615605900,0,1
2259,m3xxig,lordJalil,0.7206,Check out this cool information about $BAT and Brave.,1615605379,0,1
2260,m3xrsq,BountyManagerBD,0.0,"Ethereum Will $20,000 USD in 2025, What you Think?",1615604789,0,1
2261,m3xrn2,debotten,0.0,Questions About Layer 2 Scaling,1615604773,5,1
2262,m3xlts,Emomilol1213,0.6369,"Hey all friendly ETH-hodlers, here's an Ethereum-battery NFT I recently created, check it out",1615604208,6,1
2263,m3xgmk,just_read_my_comment,0.0,POW NFT - The first mineable NFT,1615603685,1,1
2264,m3xe1w,Explanation_First,0.0,Ethereum Question!!,1615603416,0,1
2265,m3x1ki,binarychunk,-0.2732,Any way to fix my low rez file on Rarable?,1615602140,0,1
2266,m3x0xb,oscargml,0.0,Ripple,1615602071,0,1
2267,m3wwo8,1shadygrey,-0.4039,Artist who tokenized album for $11M explains why the NFT boom isn't like the ICO craze,1615601654,3,1
2268,m3wowl,Solodeji,-0.4767,Vitalik Buterin Shows How 51% Attack of Miners Could Send Network to Ethereum 2.0 Faster Than Expected,1615600883,0,1
2270,m3wb9i,coinsmash1,0.3182,NFT Meet and Greet (meme),1615599493,14,1
2271,m541jm,_bakakashi,0.0,Digital art styles,1615755394,0,1
2272,m53rdq,SentientSnack,0.0,Why Shouldn't I Take 90% Royalties on Secondary Sales (Mintable)??,1615754579,20,1
2273,m53qul,Mardo1234,0.0,New Currencies and trading,1615754535,0,1
2274,m53elo,NinjaDK,0.0,"Ether Cards pricing &amp; phoenix trait revealed - price starting at 0.3 ETH for common cards, 5 ETH for alpha cards &amp; 30 ETH for OG cards.",1615753562,0,1
2275,m53egh,diamondcodes5,0.0,How NFT works ??,1615753552,0,1
2276,m53e73,NinjaDK,0.0,"Ether Cards pricing &amp; phoenix trait revealed - price starting at 0.3 ETH for common cards, 5 ETH for alpha cards &amp; 40 ETH for OG cards.",1615753531,0,1
2278,m52yje,PAAlmasi,0.0,How Bancor Became the First AMM,1615752325,1,1
2279,m52yct,farhad1371,0.2732,How risky is to exchange NFT arts for profit?,1615752313,0,1
2280,m52ix9,MissilerLermer,0.3804,Stumbled on this video. Really cool stuff.,1615751153,3,1
2281,m525z8,diamondcodes5,0.3818,How Ethereum NFT Protect Artist Work ( How NFT IMMUTABILITY works on BLOCKCHAIN) ?,1615750180,0,1
2283,m520ru,bonfireofthehannitys,0.4753,Nice Article in Forbes!,1615749785,59,1
2284,m51xt7,StockFox05,0.0,Ethereum mining bot,1615749558,0,1
2286,m51qu4,fortnite-conspirancy,0.0,Is ethereum a coin or an index fund of all the coins running on ethereum?,1615749026,0,1
2287,m51f3g,CalligrapherNo9,-0.25,Metamask transaction stuck,1615748157,0,1
2289,m51aiq,EmptyGarden1302,0.0,What is the cheapest way to move some erc20 token from exchange to metamask,1615747804,0,1
2293,m50vvw,C0DER-,0.4404,Made this funny meme vid where wojak goes crypto,1615746675,0,1
2294,m50gig,freditoj,0.0,Ethereum as currency.,1615745458,20,1
2295,m509wl,applelovespotato,0.3182,this Detroit based audio company now accepts crypto for their mastering/mixing services.,1615744943,0,1
2296,m509qa,Gazoyz,0.0,New Rarible creator,1615744931,0,1
2298,m50746,casualpanic13,0.0,UnAlone by Scott Cameron AKA casualpanic13,1615744743,0,1
2299,m5070g,LaurenceDrake87,0.6369,Love It,1615744735,0,1
2300,m500kd,mrmonkey3319,0.0,Fees - is this right?,1615744229,0,1
2301,m4zzs7,Visualo,-0.296,Should we be worried about Solana?,1615744170,0,1
2302,m4zrk9,jchaselubitz,0.4404,Will Ethereum be Quantum Safe?,1615743531,0,1
2303,m4znau,pancakee1996,0.0,OEC Confirmed!,1615743194,0,1
2304,m4zm9i,chackenn,0.0,"1-10$ gas fee instead of 40$, what would happen to my transaction?",1615743119,0,1
2305,m4zhx8,BuddyUnited,0.7506,What will be the effect of the upgrade on ETH value ?,1615742768,0,1
2306,m4zh8q,lippimueller,0.0,NTFX kaufen?,1615742713,0,1
2308,m4z7w8,cryptototototo,0.0,ARK analyst discusses concerns with Proof of Stake,1615741965,147,2
2309,m4z3x2,phi_array,0.264,"Could ETH2 cause inflation and a drop on ETH value? Will it make mining easier, thus causing an influx of ETH?",1615741647,0,1
2310,m4z2et,phi_array,0.0,ELI5: the diff between gas and ether,1615741524,0,1
2312,m4ym5u,Itzmeee101,0.0,What is your price target after ETH 2.0 is released?,1615740180,0,1
2313,m4ygue,holle1997,0.0,EtherSlice,1615739728,0,1
2314,m4y1ag,MinistryOfGeeks,-0.4939,Minted my first NFT. Have I just wasted my Eth?,1615738428,0,1
2315,m4y0tx,[deleted],0.0,Minted my first NFT. Have I just wanted my Eth?,1615738386,0,1
2316,m4xwri,cryptogrape,0.0772,Has anyone else had issues with Coinbase deleting your crypto address after a missing transfer? Seems like a cover up.,1615738037,1,1
2317,m4xw6f,[deleted],0.5267,"My first NFT, I create Original art with satellites data.",1615737984,0,1
2319,m4xqa8,charmcitycuddles,0.296,Stable fees and Burning Eth. EIP-1559 Explained.,1615737527,0,1
2320,m4xmy6,mobco,0.0,What do you think of the NFT Etherland? Does it have long-term real potential based on your research?,1615737234,0,1
2321,m4xieq,muimota_,0.0,Where's beeple NFT? Shouldn't it be on the ETH blockchain?,1615736851,0,1
2322,m4xibx,ABetterPsychiatrist,-0.4314,"Are gas prices really this high, or am I doing something terribly wrong?",1615736845,15,1
2323,m4xbqr,1711198430497251,0.0,How to use Gas heatmap?,1615736276,0,1
2324,m4x83s,SecondBestYanntheMan,0.4019,Smart contract development,1615735958,0,1
2325,m4x003,AnubisNow,0.5106,Can blockchain bring some trust and proof of origin back to information on the web?,1615735239,0,1
2326,m4wyd5,hexayurt,0.3612,Sneak preview -&gt; Mattereum Asset Passport: Valcambi 100 Gram Gold Cast Bar (launching in the next ten days),1615735098,15,1
2327,m4wu8h,ANBU_Swad,0.0,"Who else seen this Anime NFT. I cant lie, its looks Sweeet!",1615734742,0,1
2328,m4wpm5,windyhorse,0.4404,Question about Rollups (how effectively do they really scale Ethereum?),1615734353,17,1
2329,m4woby,questionfortheweb,0.4404,Question About Rollups (how effectively do they really scale Ethereum?),1615734238,0,1
