,id,author,vader,title,created_utc,num_comments,score
551,m6x7rq,coinedge,-0.4588,"The fact that miners threatened ETH, whether bluff or not, means we should move to ETH 2.0 now",1615976193,42,1
553,m6x6zx,farukahmed1231,0.0,OMNI Meme Contest,1615976110,0,1
554,m6x6tx,coinmonks,0.0,Ethereum 2.0 vs Symbol (Part 7):,1615976091,0,1
555,m6x6rl,farukahmed1231,0.6369,OMNI is the best project,1615976082,0,1
556,m6x6bi,farukahmed1231,0.0,Have you Joined our Meme Contest,1615976026,0,1
557,m6x5fw,coinmonks,0.0,Blockchain for Data &amp; Databases,1615975915,0,1
558,m6x3rg,coinmonks,0.0,Decentralised government: How to build new systems that enable collective power.,1615975735,0,1
560,m6wvi3,Some_won,-0.34,Nvidia confirms it accidentally unlocked RTX 3060 Ethereum mining,1615974849,0,1
562,m6wup0,HeavySpaceTank,0.0,Wyre fees,1615974744,0,1
564,m6vmyu,Interesting_Ride_582,0.1461,This is ridiculous 😶 wtf,1615969470,26,1
565,m6vgaj,aliesov,0.0,Lympo Market Token Ecosystem Lightpaper,1615968709,0,1
567,m6vbwn,youlongchey,0.0,Why gas fee from flexpool is too much higer than 2miners? While flexpool paid by miner and 2miners are include in 1%.,1615968198,0,1
568,m6v968,coldramen__,0.0,Why tho?,1615967882,0,1
569,m6v524,11igor,0.0,[NFT] How do I mint 1000 NFTs at once?,1615967428,0,1
570,m6v1v3,ahmetcan88,0.4019,Anyone interested in some real crypto art?,1615967006,0,1
571,m6utls,Jelseriah,0.0,"Gas Limit Used up, what to do?",1615966045,16,1
573,m6uetb,Obvious_Extreme4028,0.0,ETH Yield,1615964258,0,1
574,m6u7fp,TonyLiberty,0.0,"YouTube ""Experts""",1615963359,0,1
575,m6u773,Popular_Ad9150,0.7184,Do I need to buy eth2 or will eth turn i to eth2 when it’s released?,1615963332,6,1
578,m6tmql,GNeibs,0.4767,Wise words,1615961011,0,1
579,m6t2ed,baddhabbits,0.6597,"I did make some art recently about Ethereum, hope you guys gonna like it ^^",1615958748,15,1
580,m6sza5,ExoticSweet147,0.4019,"Need help with my transaction,",1615958396,0,1
581,m6slj2,SUNMONEYMAKER,0.0,Does anyone know what are the steps to setting up my own blockchain?,1615956980,1,1
582,m6sfut,Combination_Shot,0.0,Does this count as the 2.0 club before 2.0?,1615956394,0,1
583,m6rzc1,cadicap23726,0.0,Savix Trinary: how DeFi tokenholder can recieve income from 3 sources at the same time?,1615954692,2,1
584,m6rwau,driver45672,0.5267,Does any one have a favourite NFT that they think really stands out... and is worth a 5 year hold. I'm after something like this that captures the historic moment we are in.,1615954402,1,1
585,m6rtj7,verity519,0.7375,r/cryptouptrend Like watching a community grow? You into crypto/ investing in cool assets? Crypto uptrend won't disappoint Join and post your crypto life away,1615954115,0,1
586,m6rsf0,CryptographerNo4585,0.0,Future of the internet,1615953996,0,1
587,m6r27l,enkawgneato,0.4767,Best time of day/week/month for low ETH gas fees?,1615951559,25,1
588,m6qy2b,Bows_N_Hoes,0.4588,Put my ether in a NEXO account for interest or stake it?,1615951155,0,1
589,m6qh9p,YoNoBaneo,-0.128,Me ayudarías a montar mi rig para ethereum?,1615949725,0,1
590,m6q833,Ancientcryptotrader,0.8481,Hey just found this moonshot up for bidding. 💎🚀🌝📈🚨 # NFT,1615948911,0,1
591,m6pzy8,erikasanchez1493,0.0,Check out this #NFT for sale on Mintable! Pick up 'Bitcoin and Basketball ' before its swooped up!,1615948226,0,1
592,m6py1d,ToadyGrouse,-0.6124,NFT - The Cryptobro Scam,1615948059,2,1
594,m6pob2,Madwax14,0.7814,Go check out this crazy nft pages 🚀🚀🚀🛰🛰🛰,1615947213,0,1
595,m6pd5v,NukeThe_Fish,0.4019,Smart Contracts for Property Title Transfer,1615946318,1,1
596,m6ovjd,Elclaudillo,0.0,"The time is now, a generative non repeating clock on a stream",1615944717,0,1
597,m6oot7,363363,0.0,7 Steps to Earn Additional APY on Your ETH,1615944127,0,1
598,m6ol1q,Jesse_Morningstar,-0.3305,THE ETHEREUM MOONSHOT - [DAY 2] : CAN WE EVER HAVE A FINANCIAL SYSTEM THAT DOES NOT CREATE MASSIVE SOCIAL INEQUALITIES?,1615943826,7,1
600,mf0aav,PravR,-0.6124,Ethereum Foundation Scam,1616933472,0,1
601,mezouq,gravemindx,0.0,ETH 2.0 and complex DEFI protocols sustainability.,1616930892,0,1
602,mez7c8,TurbulentAd3861,0.0,ERC20 historical data request assistance,1616928685,0,1
603,mez2c5,NORVEGICUM,-0.6124,Scam?,1616928035,14,1
604,meyqgp,JurysOut,0.0,Incorporating Ethereum into everyday life,1616926415,22,1
605,meyle6,Stephane_B,0.8495,Cryptocurrencies changed my priorities as a shop owner : Having more than one product ? Meh.. Worldwide shipping ? Pff.. Complex and mind blowing designs ? Just no.. Can pay with Ethereum ? Yes! Yes! Yes!,1616925725,0,1
608,mexo7y,FixxerGuz,0.0,"Event ETH 2021, is the giveaway legit?",1616921191,0,1
611,mexh7g,zirtalukki,0.0,Laura Clark vadimpopov9,1616920219,0,1
612,mexcwq,Jjj6232,0.0,I’m about to drop my ROOF ROOF Collection get ready!!! Starting bid will be 1$ a piece get ready because once drop the bid will go off 😎 @mcuban #NFT #nftcollector #NFTCommunity #NFTdrop #NFTcollectibles #NFTcollectible #artwork #ART #Digital #cryptocurrencies #Cryptoartists,1616919601,0,1
613,mex1fh,Willman970,0.5994,What is this pattern called lmao,1616918032,0,1
614,mewx3o,cxkoda,-0.1027,Claiming Coins after Hard Fork,1616917429,15,1
615,mewhsq,CryptoKing112,0.5696,Next eth based moonshot! Refer friends and get eth!,1616915175,0,1
616,mewaj0,jetha17,0.0,Who took the decision to switch to POS in Ethereum?,1616914164,0,1
617,mevpi1,cotyschwabe,0.4939,I Created My First NFT Today and I Wanted to Share My Experience,1616911271,1,1
618,mevjk1,Grand-Guarantee-7528,0.0,Rolled my Bitcoin into ethereum.,1616910511,36,1
619,mevfef,DemCrypTho,0.5994,"Play to Earn: NFTs, Asset Scarcity &amp; What it Means for You | Enjin Blog",1616909965,0,1
620,mevd1r,chriskalani,0.0,NFTs on SNL,1616909653,126,1
621,mevcwy,Darkonogade,-0.2263,The new AMD driver blocks ehtereum phoenix miner,1616909639,6,1
622,meuwot,geoffbezos,0.0,What's the difference between attestation and finality?,1616907620,0,1
623,meummb,bag-o-kindness-coins,0.1531,Ethereum Crypto Class Fighter,1616906446,0,1
624,meu2e7,rowger2020,-0.3919,Truly decentralized oracles are here Smart contracts do not have access to external data. Such data is necessary for operation of various decentralized applications. Traditionally this is done by using a centralized servers called “Oracles”. But they are a single point of failure in otherwise dece,1616904099,1,1
625,metxlk,Odawg1677,0.9666,Need help for a friend who's been super lucky to be set up as miner since the early days of rewards and her friend passed and now she needs help,1616903575,0,1
626,metx5b,Eggiejustin,0.0,Pantone using ERC 721 for NFTs,1616903529,0,1
627,metwo1,Eggiejustin,0.0,Pantone using ERC-721for NFTs,1616903479,0,1
628,metms9,AlternativeFactssss,0.7351,Adopting Endangered Animals on the Blockchain for Fun and Profit,1616902368,0,1
629,metlmg,PandaCartel,0.0,Has anyone else seen Ethereum2 coin on coinbase?,1616902238,0,1
630,mesvbj,sushirolex,-0.7506,Warning about HEX scam,1616899543,0,1
631,meslp9,Hochiminh42,-0.105,"I'm a newbie so please explain, apologies if this is a stupid question ...",1616898580,23,1
632,mes5cf,Usual_Pasta,0.296,Join the first ever NFT world.,1616896939,0,1
633,mes47x,MyAddidas,0.8591,Buy into Matic or wait for Optimism?,1616896822,14,1
635,mers8d,space_redditor,0.0,Fees...,1616895620,0,1
636,meqzua,InflationMission5254,0.4939,The first one to send over 300 USD in Bitcoin(BTC) or ETH to that address below will allow me to howmns the particules bending spacetime going into your reality in order to make you feel the experience of the truth reality that is not one that your cognition belive that it is.,1616892874,0,1
637,meqxww,AfraidOfCoffee,0.7351,The next NFT gold rush? - Adopting Endangered Animals on the Blockchain for Fun and Profit,1616892689,0,1
638,meqihd,corporate_robot_dude,0.4215,Would using Metamask in Tor be safer?,1616891274,0,1
639,meqhd8,Ok-Mechanic4463,0.0,New to metamask,1616891163,6,1
640,meqgm3,VitoCoinleone,0.0,my first nft,1616891092,0,1
641,meqb5m,pinoygs,0.0,"Ever since you got your first Ether, which Dapps have you personally used? What is that Dapp all about?",1616890585,31,1
642,meqaju,Thick_Horse_Dick,0.34,Adopt an endangered animal on the blockchain - Suraurwanda: Adopt a Gorilla,1616890529,0,1
643,meq79i,Pinkmoonjuice,0.68,I really wanted to draw Ethereum as an anime girl and make a comic with her in it...so I am! 😁💎❤,1616890229,0,1
644,meq3wx,Fl1p_Cid3,0.0,Ethereum Miners unite with a #ShowofForce in collaboration - Dubai New Style,1616889927,0,1
645,mepwu7,-Clayford08-,0.0,I sent this to a buddy back in early 2016! Just found it in my emails.,1616889287,1,1
646,mepuj5,BrownWasabi,-0.296,Missing CRO?,1616889069,0,1
647,mepqq6,-H4Mbino-,0.0,Just found this old email I sent to a buddy in early 2016. Times have changed,1616888721,0,1
648,mepmme,GumbelMiner,-0.4939,Can the Ethereum virtual machine become infected with malware?,1616888358,12,1
651,meokw9,Loshtradz,0.0,Ethereum Mining,1616885057,4,1
652,meohnp,Weird-Touch,0.0,Eth telegram miner,1616884770,0,1
653,meo9cm,Tyranoc4,-0.4019,The problem with NFTs,1616884036,24,1
656,menq2g,M1zuo,0.6476,"Proud new staker of eth (college student 22) Staked my first (and all of) my $1,000 worth of ETH through kraken!",1616882377,50,1
657,men93d,Masked_cauliflower,0.0,Info for beginner...?,1616880873,0,1
658,men4ys,LilRee12,0.0,Meta Mask on Chrome,1616880524,0,1
659,men41y,cheeseHorder,0.0,Why 32 Ether to stake?,1616880445,25,1
661,memk0v,FitzBusinessInsights,0.4184,I'm livestreaming creating a new NFT Artwork from designing to minting! Come say hi!,1616878763,0,1
662,memj84,cadicap23726,0.2695,"Savix $SVX ""defi for all"" Launched Today on Uniswap!!",1616878692,2,1
664,mem03a,nonswad,0.0,Updates timeline,1616877080,0,1
666,meltgq,Holiday_Weakness_696,-0.5423,Staking for ETH 2.0 or not. What if Ethereum losses importance and lower its price while you have your eths blocked? What are your thoughts on staking ETH 2.0 on Binance.,1616876529,0,1
667,melp78,Illustrious-Bench-90,0.0,Ankr Eth price anomaly?,1616876158,0,1
668,melkg8,CryptoS33k,0.836,"The NFT treasure hunt you're already playing, you just don't know it. Also raising funds for good causes :)",1616875767,0,1
670,melel1,CryptoS33k,0.4588,"You're already playing this NFT treasure hunt, you just dont know it yet.",1616875276,0,1
672,meldwj,CryptoS33k,0.4588,"You're already playing this NFT treasure hunt, you just dont know it.",1616875219,0,1
673,meld1h,CryptoS33k,0.4588,"Your'e already playing this NFT treasure hunt, you just dont know it yet",1616875157,0,1
674,mel7ak,sekineliana,-0.4215,Ugh,1616874658,0,1
675,mekrrm,Elephant_Gun,0.264,"Are discord scams like this common? What is their end-goal, just sending you to a spyware address like normal 'you won a prize' scams?",1616873371,7,1
676,mekovu,TheCarelessChampion,0.6124,Solve Care COVID-19 Daily Tips #2,1616873123,0,1
677,mh7wus,GunnitPlease,-0.4404,Taxes suck - converting BTC to ETH,1617202660,0,1
678,mh7jn6,curious__crypto,0.0,Any crypto traders out there that would be willing to tell us about their experiences using decentralized exchanges?,1617201620,0,1
679,mh7er1,beechin,0.0,Understanding how to use ENS to replace public address,1617201199,10,1
680,mh7c7x,gtfaith0819,-0.25,I'm stuck ?,1617201003,0,1
681,mh7b6q,gravemindx,-0.5803,Why would setting a Minimum transaction fee and a Maximum transaction fee would be a stupid idea??,1617200925,2,1
682,mh745n,starnez22,0.6249,Any great Ethereum/Crypto podcasts to learn from?,1617200357,134,1
683,mh740a,sneg5555,0.0,Unisocks Explained in-depth,1617200343,0,1
685,mh6mqo,jmo393,0.3802,By Proxy - original trip-hop music up on Open Sea!,1617198921,0,1
688,mh5kg3,aiqmhn,0.6369,🖤 KOLK 👽 NFT,1617195579,0,1
690,mh5bj8,StellaKarr,0.1779,"Over 40 DApp Integrations on Polygon Network this month. All with different goals and visions...The Polygon Network is growing very fast, you can experience Layer 2 scaling too. Bring your DApp to Polygon.",1617194730,0,1
691,mh5b94,throwaway775849,0.0,Running a node for RPC,1617194700,2,1
692,mh58v0,DappRadar,0.5719,How to earn profit playing Polka City,1617194456,0,1
693,mh57jf,Logical_Trolla,0.4019,Need some help with NFT entry fee.,1617194327,0,1
695,mh4zhn,chainlinkangel,0.6369,Love On Fist Sight (Chainlink),1617193549,1,1
696,mh4cxk,supersoeak,0.5267,Fee burning creates incentives to form a fee market outside of the protocol,1617191251,22,1
697,mh4c2a,ketaminekennith,0.7096,Now a good time to buy or wait for dip?,1617191150,0,1
698,mh3zat,PixelatedFoodie,0.0,How do I move my ETH on Binance to MetaMask?,1617189799,19,1
699,mh3xka,jestertwok,-0.2023,Could anybody send me some ETH on Rinkeby? All the faucets are empty.,1617189615,0,1
700,mh3w7p,LW3LW3,0.2263,Is mining even worth it?,1617189467,0,1
701,mh3rzu,CryptoCreateur,-0.4682,This past/last weeks remaining positions yet to sell. Who picked up on this and brought where I got in at? I mean I can happily say my learning is paying of!?,1617189010,1,1
703,mh32rs,damnedAI,0.3578,Over 72M worth of ETH Futures liquidated between 7:30 - 8 AM GMT !!,1617186098,1,1
704,mh32hp,StellaKarr,0.7096,Ankr is adding beta solutions for Layer2 API services to provide the best user experience for your DApps on Ethereum.,1617186067,0,1
705,mh3022,frank__costello,0.0,"""Ethereum and The Seven Dwarfs"" (2019)",1617185762,0,1
706,mh2ral,sportifynews,0.0,Can Ethereum (ETH) and Litecoin (LTC) grow faster than Bitcoin (BTC) for a while?,1617184740,0,1
707,mh2qpw,Gurney_Halleck_,0.0772,Egypt is making the use of Cargox (runs on Ethereum) mandatory for their new ACI customs system from the 1st of July,1617184656,0,1
708,mh2pz4,wenona0714,0.0,AMD makes its move on GPUs,1617184554,0,1
709,mh2pc6,wenona0714,0.0,"It's gamers versus miners, where do you stand?",1617184480,16,1
710,mh2n0t,StellaKarr,0.34,Matic now listed on Okex Exchange. You can now trade Matic to Usdt easily,1617184151,0,1
711,mh2hix,big_john83,0.3818,Can't wait for the nodes to accept this boiii,1617183517,0,1
712,mh2hbl,dragondude4,0.9059,"One of the best, most comprehensive write-ups I have ever read. Kudos to you u/GetYourAssToPluto. Bullish as fuck!",1617183489,0,1
713,mh2gzm,FishBucket84,0.25,[GUIDE] I Have Created The Absolute Beginner’s Guide to Cryptocurrency Investing,1617183444,0,1
714,mh2grj,HorseBootup,0.0,R3 Corda Now Has a Bridge to Public Blockchains With Arrival of Ethereum-Based XDC,1617183414,0,1
715,mh2dha,sportifynews,0.7184,NFT breakthrough: Ethereum co-founder Joe Lubin creates 99% energy efficient blockchain—and Damien Hirst is its first artist,1617182995,0,1
716,mh273j,Indecision999,-0.0516,Tipps for a Noob,1617182197,10,1
717,mh25zs,megaszabo,0.0,Why doesn't PALM use ETH for txn fees instead of its own token?,1617182078,0,1
718,mh1vw7,Onetimeexperience,-0.6249,Worst NFT Ever,1617180896,0,1
719,mh1vp6,bigwetsy,-0.6124,Is this a scam?,1617180870,0,1
720,mh1orh,GandALTtheHolder,0.3802,"Slovenian startup offers all-in-one POS terminal - allows paying with crypto, cards, and digital payments all on one device - Ethereum supported!",1617180005,0,1
721,mh1jk2,suky97,0.0,"Gas fee's questions, I'm new to this",1617179414,2,1
722,mh1i3u,JaguarAcrobatic5657,0.0,New node visibility,1617179222,0,1
723,mh156d,FirefighterFew2934,0.0,Hi Guys,1617177712,0,1
724,mh13kf,JaguarAcrobatic5657,0.0,New Ethereum Node,1617177535,0,1
725,mh0i3h,Direct-Perspective95,0.6476,Where is my transaction ? Please help !,1617175064,0,1
726,mh02vz,sabrina_ben,0.8481,Bullish traders cast low-risk Ethereum options bets with this clever strategy,1617173239,0,1
728,mgz9cq,tarponjohn,-0.25,My USDT stuck on the blockchain,1617169617,0,1
731,mgz181,Guilty_Feeling_7876,-0.3182,I lost 5.5 ETH from duplicate website,1617168637,0,1
733,mgy5ov,whatsasammy,0.6249,How long does using 'save low' gas fees take,1617165116,15,1
734,mgxr83,obeesix,0.0,Staking ETH guidance,1617163606,10,1
736,mgxohv,ZewdiM,0.8442,Hello Everyone. Here is a funny Skit on NFT's so we can take a break from all the searches. Enjoy,1617163332,0,1
737,mgx7vi,roysan,-0.6476,New legit scam attempt!,1617161611,54,1
739,mgww7b,tjd05,0.0,This is the price action I see...,1617160420,1,1
740,mgwtji,coronation1,0.0,Is there a way to sync to get the latest balance?,1617160159,0,1
741,mgwqgi,Infinite-Rift,0.0,Entire Ethereum Chain De/compressed | 2kb,1617159858,0,1
742,mgwqd6,Eakdogan,0.0,An Ethereum Billboard,1617159848,0,1
743,mgwpov,Eakdogan,0.0,Ethereum Billboard,1617159784,0,1
744,mgwj8q,Nearthenorth,0.0,Scammed out of 1.22ETH,1617159171,0,1
745,mgwevq,Altruistic-Scholar86,0.0,What happens to the current Ethereum token once Eth2.0 is released?,1617158744,1,1
746,mgw9h5,limodinho,0.6908,Bullish?,1617158224,28,1
747,mgw4ej,blowjobgirl25,-0.5859,"I have 50 eth, wtf should I do with it?",1617157754,524,1
748,mgw2qf,Bostonredditfun,0.6124,"Looking for help here- does anyone know why there is such a huge difference in how much i paid ($2,751.30) , vs how much i got in this transaction ($2,334.67)? My slippage was set to 2%",1617157597,0,1
749,mgw17s,BlockchainBR,0.0,Check out my new NFT Art,1617157452,0,1
751,mgvcsj,ExacoCGI,0.0,The two types of Crypto Art sellers.,1617155176,0,1
752,mgv8fd,rentsaar,0.7184,Is it safe/better to buy Binance-Peg Ethereum?,1617154775,0,1
753,mguzex,beechin,0.0,Understanding ENS,1617153918,0,1
755,mguoud,PeteInvests,0.4263,TOP ALTCOINS FOR APRIL 2021 | 300% Potential!,1617152936,0,1
756,mguk7d,nessa1177,0.0,Layer 2 DEXs,1617152519,25,1
757,mgu1cw,HopiaHodling,0.0,To my fellow miners: What are we going to do with our older GPUs once we move to POS?,1617150765,8,1
758,mgtrh8,InevitableAddendum29,0.128,This switch to British summer lime has got me feeling zesty,1617149838,3,1
759,mgtno7,SharkMasterSA,0.0,POS Questions,1617149491,0,1
761,mgtgjb,UkNE2001,0.0,$DG largely unknown hidden gem | NFT &amp; Gaming,1617148851,1,1
763,mgt3vy,UkNE2001,0.0,$DG largely unknown hidden gem,1617147713,0,1
764,mgsxug,LiftedKermit,0.4404,"Usual times for better dips, need some opinions",1617147178,0,1
765,mgsj3k,krunt7,0.5106,Is the concept of STORJ ethical?,1617145863,4,1
766,mgsdq5,trogdortb001,0.0,MyCrypto migrates their memberships to xDai Chain,1617145404,8,1
767,mgs7e1,GoiabEX,0.0,How much is this?,1617144865,0,1
769,mgrzb2,robwells_,0.0,Is Jesus Christ Satoshi?,1617144148,2,1
770,mgrh5f,Which-Wrongdoer7829,0.4019,Interesting ECR-20 project,1617142617,0,1
771,mgr3gb,Substantial_Boat_198,0.6369,Start mining crypto today - The best offer for Crypto mining equipment,1617141520,0,1
772,mgqx5o,Anthony-AltcoinXP,-0.2732,Why am I blocked here?,1617141001,0,1
773,mgqwtp,Theauntgate,0.5859,Miami Mayor wants to turn the city into a bitcoin and other cryptocurrencies mining hub with clean energy,1617140972,0,1
774,mgqwnk,tocip,0.0,I think this gives too much to discuss about,1617140957,0,1
775,mgqvgj,imToken,0.0,imToken Announces US$30 million Series B Investment,1617140858,2,1
776,mgqmib,Nick_Lyons,0.0,Ethereum Feature Film,1617140113,0,1
777,lwgxia,TheDefiantNews,-0.5574,“Tiananmen” Contract on BSC Seeking to Provoke CZ - The Defiant - DeFi News,1614731975,0,1
778,lwgvby,shift2future,0.0,The rise of the Ethereum economy,1614731778,74,1
779,lwgrl2,TheDefiantNews,-0.4404,Beeple &amp; Grimes are Latest in High-Profile NFT Auctions - The Defiant - DeFi News,1614731452,0,1
780,lwgohj,TheDefiantNews,-0.2263,3LAU Breaks NFT Auction Record with $11.6M in Sales - The Defiant - DeFi News,1614731170,0,1
781,lwgn3h,TheDefiantNews,0.6478,NFTs Have the Potential to Crack Royalties and Give More Value to Artists - The Defiant - DeFi News,1614731044,0,1
782,lwgg2o,patrickalphac,0.6369,A Glorious Guide to NFTs,1614730445,0,1
784,lwge5d,StatCallisBest,0.6124,Please help,1614730279,0,1
785,lwg8s8,dorgibit,-0.3164,Sharing my first NFT! Ethereum Fire Dragon Level 1 🔥,1614729823,2,1
787,lwg0n6,NFTNewsToday,-0.5574,"No, CryptoArtists Aren’t Harming the Planet",1614729157,0,1
788,lwfwa8,archpuddington,0.0,A company is being sold as an NFT...,1614728773,0,1
789,lwfs2o,jwolff97,-0.5411,ETH Being Stolen by Scammers! My Story,1614728410,0,1
790,lwfnlv,mickey_graham,0.7955,"Registrations are live for Chainlink Virtual Hackathon! Build DeFi, NFT, and Gaming dApps with $80k+ in prizes, hear from top projects and developers in crypto, and much more 🎉",1614728025,1,1
791,lwffgb,tomashustoles,0.0,Future is now,1614727344,0,1
793,lwferq,crujones76,0.0,Kuroshio Sea NFT - 2nd largest aquarium in the world,1614727292,1,1
797,lwf4i3,crujones76,0.0,Kuroshio Sea - NFT - 2nd largest aquarium in the world,1614726457,0,1
798,lwf3mi,crujones76,0.0,Kuroshio Sea - NFT - 2nd largest aquarium in the world - NFT,1614726386,0,1
799,lwf3gg,P99163,0.0,Difference between BTC and ETH transactions (funds only),1614726372,0,1
800,lwf2jk,crujones76,0.0,Kuroshio Sea - 2nd largest aquarium in the world - NFT,1614726294,0,1
801,lwf0vk,Aeroslythe,0.3818,What are the benefits of DeFi over current mainstream lending systems?,1614726172,24,1
802,lwewrd,LitigationAtty4you,0.0,Gifting ETH to staff,1614725854,0,1
803,lweo85,Tall_Irish_Guy,-0.5719,I messed up through lack of understanding. Tried to mint 999 tokens and it's 'dropped',1614725174,26,1
804,lwel2x,abcoathup,-0.2263,Webinar: Automate your Ethereum operations with OpenZeppelin Defender 🎦 Defender product demo 💡 Lowering user risk with Defender and Contracts 🛡️ DevSecOps for Ethereum (DevOps + SecOps) 🗣️ Live Q&amp;A with our team 🕛 Wednesday noon PT/3pm ET/8pm UTC,1614724923,0,1
805,lweiof,RightBlacksmith9,0.0,Old Video on Crypto and Ethereum,1614724727,0,1
806,lwdr9u,sloaner0,0.4019,Request for Help Understanding Contract Transaction,1614722600,0,1
807,lwdp0y,sloaner0,0.5007,Request for Help Understanding ETH Transaction... Did I Get Scammed???,1614722436,0,1
808,lwdimx,novastar11,0.6124,Need Help Please,1614721949,0,1
810,lwdgmy,lwilson747,0.0,Central Bank Digital Currency (CBDC) MasterClass,1614721805,0,1
811,lwdalm,fivecentsrich,0.0,Opensea!!!!,1614721333,0,1
815,lwd274,Drgempiree,-0.4019,Metamask hacked account,1614720672,0,1
816,lwd164,zebracrypto,-0.25,Question: Can you run an eth node for gas fees without mining transactions?,1614720591,0,1
818,lwcy8u,arcadot,0.0,DAO Refunds,1614720358,1,1
819,lwcxwk,crypt0mushroom,0.0,eip-1559,1614720327,2,1
820,lwcuop,BanklessHQ,0.25,Bitwise Chief Investment Officer sees a vision where Ethereum’s Uniswap replaces the NYSE,1614720074,17,1
821,lwcsv9,Glow-fly,0.0,3 questions about buying ETH. When? How much? Where to store?,1614719926,0,1
822,lwconc,CravinM1,-0.128,Finally got my risers and first real mining rig,1614719604,0,1
823,lwcjy9,Foreign_Shoulder_344,-0.7739,How DO I SELL ERC-20 Token - Space coin,1614719253,0,1
824,lwc776,bluepartdaflame,0.5951,support eip 1559!!!!,1614718283,0,1
825,lwblrq,jason78613,-0.0516,Noob question about transfer fees,1614716641,2,1
826,lwbjti,Solodeji,0.296,Ethereum (ETH) Launched On Amazon Managed Blockchain,1614716531,8,1
827,lwbfmv,Dogsanddogs,0.0,"Startup Pivots to Blockchain, Claims You Wouldn't Understand",1614716201,0,1
828,lwberi,Dogsanddogs,0.0,"Startup Pivots to Blockchain, Claims You Wouldnât Understand",1614716134,0,1
829,lwbeig,giteshtyagi,0.1779,Announcing General Availability of Ethereum on Amazon Managed Blockchain,1614716115,0,1
830,lwbafw,killahwatz808,0.6124,Created my first NFT. I call it Socially Distanced.,1614715797,0,1
831,lwb80t,cryptomoviearts,0.0,Cryptomoviearts awaiting ur Offers!,1614715607,0,1
833,lwalqw,keinblock,0.0,can someone come up with a concrete roadmap for what's happening with Ethereum right now ?,1614713943,0,1
834,lwalm7,securm0n,0.0,How does ethereum work exactly?,1614713933,4,1
835,lwaj0s,hmmmm0_0,0.6705,How to transfer binance smart chain pegged ethereum to ethereum that is mainnet compatible? (United States ie can’t use bridge),1614713741,8,1
836,lwails,koljagabinrichter,0.0,Kraken Staking,1614713709,0,1
837,lwa9g3,nelg3105,0.5423,Optimism vs Matic,1614713014,25,1
838,lwa6aj,Alexand0x,0.0,"district0x Dev Update - March 2nd, 2021",1614712770,0,1
839,lw9w0q,Samdoge,0.8303,I just bought my first NFT and I'm really excited about it! I got into crypto through doge and have now become interested in ETH. Thank you Ethereum!!,1614712017,0,1
840,lw9uzq,koljagabinrichter,0.0,Staking function on Kraken,1614711947,0,1
841,lw9rhx,poojaranjan19,0.6124,Overview of EIP-2315 for Berlin upgrade by Greg Colvin,1614711701,0,1
842,lw9d7z,Itstooeasydude,0.0,"Grayscale Purchases 3,347 ETH In The Last 24 hours",1614710690,0,1
843,lw9bqa,luizbalogh,0.0,Ethereum vs Cardano simple explained,1614710583,19,1
844,lw97xz,gbousta,-0.4404,Will EIP 1559 happen or will miners block it ?,1614710345,0,1
847,lw87ws,vish729,0.0,New Ether-backed ETP will be listed on the SIX Swiss Exchange under the ticker ETHE.,1614707823,0,1
848,lw84ex,FPLegend,-0.2732,How low can we expext ethereum to fall at some time ?,1614707584,0,1
849,lw7x5x,DappRadar,0.0,Ethereum generated more than $181 BILLION in transaction volumes in February 2021,1614707048,14,1
850,lw7ug3,vbuterin,-0.4404,Weak statelessness and/or state expiry: coming soon (x-post from EthMagicians),1614706862,39,1
851,lw7oyb,ef_esp,0.0,ESP February Roundup,1614706503,0,1
852,lw7ica,Jumadax,0.128,"With NFT on the rise, is it legal to buy and sell art depicting celebrities/athletes etc?",1614706022,10,1
853,lw7b6t,brovbro,0.0,"It's not NFTs you don't understand, it's art.",1614705534,0,1
854,lw79r2,Wonderful-Wealth5360,0.7424,Time to buy and stack luxcoin !,1614705435,0,1
855,lw75us,wobbzz,0.0,Hudson Jameson Hosting Ethereum + Zcash Cross-Pollination Session Mar. 4th!,1614705195,0,1
856,lw70my,hpatel13791,0.0,The merge might be happening sooner than people expect,1614704854,0,1
857,lw61ea,Metalmommy03,0.0,Staking,1614702543,0,1
858,lw5bw8,tomashustoles,0.0,Future is now - My first NFT,1614700835,0,1
859,lw5bjz,hyraw,0.0,Royalties for artists from NFTs associated with physical artwork,1614700819,39,1
