Unnamed: 0,id,author,vader,title,created_utc,num_comments,score
0,k60xtk,anmolgaur45,0.0,Audio streaming giant Spotify is looking into crypto payments,1607014309,0,1
3,k60nls,Throwaway4VPN,0.0,Bitcoin Core vs Bitcoin Cash  Truce,1607013486,4,1
4,k60lku,Guzzfa,0.5719,Swiss central bank says wholesale digital currency trial a success,1607013324,0,1
5,k60jpb,Fiach_Dubh,-0.4767,Paul Tudor Jones Talks Bitcoin Its The Wrong Marketcap Relative to Gold  Dec rd ,1607013182,1,1
7,k60d97,GoldenRain99,-0.4228,Aave Launches V in Bid to Make Borrowing Against Volatile Assets Less Risky Introduces collateral swaps,1607012652,2,1
8,k60akj,TheWierdGuy,-0.5574,It is generally accepted that around  million bitcoins have been forever lost due to human error We should start taking this into account when calculating Bitcoins market cap and do the same with other crytos,1607012440,7,1
11,k6058w,LandOnYourFeet,0.4019,Coronavirus Hackers targeted Covid vaccine supply cold chain Blockchain can help,1607012000,0,1
12,k603kk,PlasticMonitor9388,-0.5106,Account on coinbase blocked I cant sell buy or send cryptus No one give me a reply,1607011857,0,1
14,k602qm,SweetPie123,0.0,Paul Tudor Jones Says Bitcoin Could Be New Gold While Comparing Altcoins to Copper,1607011782,38,1
17,k5zxcg,patrickstar466,0.0,North America Gets Its First EnterpriseGrade Bitcoin Mining Pool from Titan,1607011332,0,1
18,k5zuak,BrandonZ0302,0.0,Bitcoin is the ultimate antilockdown investment says Nigel Farage,1607011069,10,1
19,k5zu9g,EthanPhan,0.0,Just in case this has not been posted here Imo this is extremely bullish for crypto,1607011066,2,1
20,k5zplq,gizram84,0.296,Block  Reuters Dec Dollar plummets on US stimulus hopes bitcoin hits alltime peak,1607010660,0,1
22,k5zne0,alliswell19,0.6621,Bitcoin Addresses Active in November Were Almost as High as Dec ,1607010473,1,1
23,k5zk0t,DoubleFaulty1,0.0,SampP Dow Jones Indices to Launch Crypto Indexes in ,1607010181,4,1
27,k5z643,Poo-et,0.6908,Exchange Globe just posted this on Twitter   Bitcoin prize for solving the puzzle,1607009007,6,1
29,k5yx3r,Suicidal-duck,0.0,Bitcoin arrives on Wall Street SampP Dow Jones launching crypto indexes in ,1607008181,0,1
31,k5yu8x,Fiach_Dubh,-0.5574,You might get fired if you dont own Bitcoin CoinShares Chairman on CNBC  Dec nd ,1607007910,2,1
32,k5yt51,BardCookie,0.3818,Spotify Considering Accepting Bitcoin,1607007817,0,1
33,k5ysmj,h3xadecimal2,0.743,AIs from AI Dungeon  to sexy to funny and one based wholly on Reddit,1607007773,0,1
34,k5yrkk,gcbeehler5,0.2023,No Bitcoins Price Did Not Set an AllTime High Heres Why  CoinMarketCap Blog,1607007679,2,1
39,k5yisk,TuanNguyen03,0.6369,Best Bitcoin Arbitrage Tool ,1607006868,0,1
40,k5ydah,Cryptodadd,0.0,SampP Dow Jones to Launch Crypto Index Funds Next Year,1607006368,23,1
42,k5y9lp,chardeemacdennis10,0.0,Classic My introduction to bitcoins in ,1607006018,3,1
43,k5y8dj,Plutusedge15,0.7213,Popular Crypto Traders Bitcoin Price Model Suggests KK By End of ,1607005899,3,1
44,k5y81x,LimbBizkit,0.0,Legacy German Bank to Start a Crypto Fund Next Year,1607005869,0,1
49,k5y5su,RonTurkey,0.3254,I get fucked on MOON distribution,1607005648,2,1
50,k5y0ms,anonibills,0.0,Does holding half of your Bitcoin as BTC and the other half wBTC make any sense,1607005157,13,1
52,k5xsz1,MammothSir9,0.3818,Last Month Casascius Owners Redeemed the Highest Number of Physical Bitcoins in  Years,1607004393,0,1
54,k5xoqt,bench4rench,0.6369,Revealed Which of the  Biggest Cryptos Performed Best in November  CoinMarketCap Blog,1607003991,0,1
57,k5xjm9,Mihail193193,0.0,Strawberry with a taste of bitcoin,1607003458,0,1
58,k5xicw,WaggishNickel,0.7269,Blackrock  the largest asset management firm on earth  is warming up to bitcoin ,1607003325,0,1
59,k5xhpc,Realityvoidx,0.0,Longterm investment coin options,1607003260,0,1
60,k5xc74,pegasoalato,0.0,Mining Etherum,1607002684,0,1
61,k5x7hv,ymirmar,0.0,Visa Partners With Ethereum DigitalDollar Startup That Raised  Million,1607002184,3,1
62,k5x3wn,seasle,0.5187,Hey America what is your government doing I thought I made some profit on my crypto today but its just the dollar being worth less,1607001775,3,1
63,k5x0oi,karmanopoly,-0.5106,Aretaeio Hospital joins the digitalization and blockchainization Era by offering EHCert to its patientsvisitors,1607001405,0,1
64,k5wwh8,srikar_tech,0.296,Digital Money is here and it is as real as it gets Crypto Adoption,1607000939,0,1
67,k5wpsh,charmcitycuddles,0.5574,Flare Network Sparking life into XRP with smart contract capabilities A brief intro to Flare Spark and FXRP,1607000219,2,1
68,k5wpb8,robis87,0.25,Real Vision Invested  of its Cash Holdings in Bitcoin,1607000164,13,1
69,k5wlv8,alvarosb,0.3818,A record for the future just like the one in the genesis block,1606999779,4,1
70,k5wkfr,hackernoon,-0.4767,Top  Risks and Scams Associated with the Cryptocurrency Market,1606999623,0,1
71,k5whmu,riqelme,-0.6908,Current sentiment around bitcoin shifting from fear to greed CoinShares chairman,1606999301,2,1
73,k5wgfb,Handybott,0.296, MAKE REAL MONEY WITH TELEGRAM BOTS,1606999161,0,1
74,k5wccw,9osama,0.0,Crypto Currency,1606998670,2,1
75,k5w2gi,rafaqatawan257,0.0,Crypto ExchangeTraded,1606997425,0,1
77,k5w0oh,MammothSir9,-0.3818,New Paper Ripple Network Doesnt Meet Criteria To Reach Consensus,1606997195,2,1
78,k5vxqa,Esukkf,0.0,Ethereum  and what this means for Ethereum Classic,1606996850,0,1
80,k80e2g,badaccountant28,0.3818,Onchain analyst says Bitcoin hodlers are only getting stronger,1607283454,18,1
82,k803qv,The-Techie,0.0,MicroStrategy Buys M More Bitcoin,1607282547,2,1
83,k802x6,ulfhednar910,0.7184,Moons,1607282477,0,1
87,k7zwoa,Frtankie,-0.7096,Lost or worthless coins  Taxing,1607281915,0,1
88,k7zsz8,MammothSir9,0.765,Top US Banking Regulator Reveals Positive Cryptocurrency Regulation Coming in Weeks,1607281587,0,1
89,k7zr93,usernameofficial1,-0.2755,Youre Pi if you dont like this crypto,1607281433,0,1
90,k7zqz2,sh3ltz,-0.3612,SCAM TEXT FOR LEDGER BUT FROM KYC,1607281408,2,1
91,k7zq7g,YHLQMDLG-Tech,0.765,Top US Banking Regulator Reveals Positive Cryptocurrency Regulation Coming in Weeks  Regulation Bitcoin News,1607281343,1,1
93,k7zmf2,FIlthzer,0.5106,Grayscale eth trust,1607281020,0,1
94,k7zlmf,supersayanssj3,0.0,Just found  XLM after not watching crypto for a couple of years Suggestions,1607280951,2,1
96,k7zhet,zspieg,0.0,ETH address for Flare airdrop,1607280592,17,1
97,k7zc76,patrickstar466,0.5574,Coinbase to Support Spark Token Airdrop to XRP Holders,1607280149,6,1
98,k7zaru,New_ShitLord,0.0,Crypto TribalismMaximalist,1607280029,6,1
105,k7ysax,AdmiralSkyOperator,0.7378,After lurking for years I finally decided to invest in MOON  Target Minimum,1607278441,0,1
106,k7yqld,LimbBizkit,0.4588,The butterfly effect Why DeFi will force BTC to break its M supply ceiling,1607278295,1,1
107,k7ylqm,xXguitarsenXx,-0.5859,How to sell my Cryptos Get the money into my bank account,1607277880,0,1
110,k7yixy,ZeusFinder,0.0,Coindesk Interview with acting OCC Chief Brian Brooks US Office of the Comptroller of the Currency,1607277647,0,1
113,k7yck5,ThinkandGrowFinance,0.0,The Next Global Currency,1607277093,0,1
114,k7yc3c,LimbBizkit,0.5719,Synthetic assets get real Competition for scalability new markets heats up,1607277058,0,1
115,k7y6o1,adamcasserole1,0.0,Books or other resources for learning about crypto,1607276597,9,1
119,k7xwag,Jfranks011,-0.4588,In Search of Lost Litecoins,1607275714,0,1
121,k7xtpd,cortasetas,0.8316,Last month the United Nations bought M tokens,1607275498,2,1
122,k7xsx8,ComfortableAd5419,0.3597,Can I get more money,1607275427,2,1
124,k7xqm6,RexFu,0.7184,First time buying this Cryptocurrency,1607275230,18,1
125,k7xp9m,ziggyzago,0.0,To my fellow hodlers,1607275111,0,1
126,k7xo5x,Cryptodadd,0.5267,CEO of  billion fund expects Ethereum to gain Wall Street traction this year,1607275010,3,1
127,k7xmzt,sylsau,0.7184,The  Golden Rules of Investment Are Formal Buying Bitcoin Now Is a NoBrainer,1607274907,1,1
128,k7xm56,paragismb,0.0,Taproot activation of Bitcoin is coming,1607274828,1,1
129,k7xhyw,TransporterPsychotic,-0.6124,Is Uhive a scam,1607274461,0,1
130,k7xg1c,IsThereCheese,0.0,All quiet on the crypto front,1607274306,31,1
132,k7x7uf,edwardianpug,-0.1027,When staring at the USD price gets distracting switch to the important price,1607273611,6,1
133,k7x7rg,atmosphere-streets,0.0,Market Making  Queue positioning scratching position sizing,1607273605,1,1
135,k7x5fy,JohnDenversCoPilot,-0.6369,Traded in the BTC and the abusive blonde,1607273410,24,1
136,k7x3um,satoshinakamoto7,0.5859,Bitcoin trying to hit  be like,1607273267,14,1
139,k7wyc9,eftdebitatm,0.4588,Nu Cypher outlook long term,1607272775,2,1
140,k7ws4s,kylexyz001,-0.6124,Is coinplacelimited a scam,1607272221,0,1
142,k7wpxs,Dry-Cryptographer997,-0.25,First DNM Run by women,1607272025,0,1
143,k7wloc,Cryptodadd,0.6369,Ethereum Hits Highest Realized Price Since  Bull Run,1607271639,6,1
145,k7wfya,robis87,0.7906,Renowned financial historian Niall Ferguson BTC will be the best investment opportunity coming out of the pandemic,1607271105,17,1
151,k7w3zw,Jhat3k1,0.8341,Inflation is happening all around us The answer in most cases is print more Great time to be a hodler,1607270044,14,1
156,k7vl5g,MK333666,0.0516,DeFi broke another record with  million users,1607268261,0,1
157,k7vkoi,redflexiseal,0.4588, of Ethereum circulating supply is now locked up in staking,1607268219,2,1
158,k7v8hg,slywalkers,0.0,Summary of  year Crypto Trading,1607267001,38,1
159,k7v33n,ethervescent,0.4404,Theres a lot of articles about FOMO among institutional investors right now This is good for crypto,1607266480,5,1
160,k7v295,mv3830,0.5574,Why do Blockchains and Crypto Have Value Some Simple Economics of the Blockchain Before Sound Money VIDEO,1607266402,0,1
162,k7uw8b,bronzemerald,-0.296,Crypto tracker with accurate percentage change stats by hour wchart no bugs includes NuCypher,1607265722,5,1
163,kc0le3,ModernRefrigerator,-0.4588,Bitcoin is way too volatile,1607819725,4,1
165,kc0bdj,walkonwayvs,-0.4939,After You Die  a resource for estate planning with your crypto assets,1607818697,3,1
168,kc0462,MammothSir9,0.0,Morgan Stanley Strategist Bitcoin Rising to Replace US Dollar as Worlds Reserve Currency,1607817963,2,1
169,kc03yv,smedsterwho,0.5719,Id like to put my money where my mouth is and start spending cryptocurrency in my daytoday life,1607817941,12,1
170,kc02ox,naviejsason,0.0,Everyone in crypto right now,1607817820,4,1
171,kbzzle,ShotBot,0.5267,Crypto Billionaires Ripples Jed McCaleb Now Worlds th Richest Person Cofounder Sells  Million XRP Last Week,1607817536,49,1
172,kbzwnd,fitnesssova,0.7739,THE ULTIMATE MOON SHOT  The Math Behind  Trillion Bitcoin Pricing Model,1607817228,3,1
173,kbzw61,ramonvls926,0.0,BTC at home ,1607817182,6,1
178,kbz8mk,CRYPTO_PREMIUM,0.0,CRYPTO PREMIUM SIGNAL,1607814821,0,1
181,kbz1jd,TR5_,0.296,Whos your money on,1607814131,181,1
182,kbyzsy,Maskimus,0.0,Bitcoin always eats first,1607813970,8,1
183,kbyxmw,DetroitGangster,0.0428,PLEASE HELP Freaking out Did I fuck up my validator process and lose my Ethereum,1607813753,3,1
186,kbysj3,Persianger,0.0,Bitcoin Hr,1607813238,1,1
187,kbysdp,venicerocco,0.0,Nasdaq  Altcoins That Could Outpace Bitcoin in the Coming Years,1607813225,3,1
188,kbyrjh,KomodoPlatform,0.4939,We are Komodo atomic swap leaders When this post is  hours old we will have just finished event  of our AtomicDEX Stress Test weekend Ask us anything  Moon AMA Giveaway Details within,1607813142,156,1
189,kbynti,gravityandlove,0.3182,What are the odds of a day  increase in BTCUSD ,1607812797,2,1
190,kbyhuc,GoldenRain99,0.0,Digital Artist Beeple Sells  of Crypto Art in  Minutes,1607812223,7,1
193,kbybif,askobi1,0.0,Tron TRX will outperform Bitcoin,1607811616,0,1
198,kby4lp,JohnDenversCoPilot,0.4588,Sums it up,1607810948,26,1
200,kby2yw,MobiPrivacyActivist,0.0,Business Insider explains Bitcoin,1607810788,0,1
201,kby2k2,hovsburner,0.0, Akon chats bitcoin crypto akoin,1607810748,0,1
206,kbxgfo,helloforrest,0.3612,I started a crypto comedy series Crypto Caps  Episode ,1607808748,13,1
209,kbx2sc,Salvatorigoozmo,0.2263,Flare Executes Spark Snapshot for XRP Airdrop  Heres Whats Next for Crypto Holders,1607807549,0,1
210,kbwzli,RoseFire007,0.4767,May your crypto go as viral as  but in gains,1607807243,2,1
213,kbwg02,Fiach_Dubh,0.0, Trillion Fidelity Investments CEO Abigail Johnson on Bitcoin amp The Lightning Network  Dec th ,1607805459,0,1
214,kbwerv,Fusobat,-0.5267,The French Finance Minister asked cryptocurrency providers to reveal the identity of crypto owners to curb terror financing,1607805345,0,1
216,kbw9so,Blaumannkuh,0.5994,Parsiq AMA Moon Cut,1607804901,0,1
217,kbvz9g,00100101011010,0.0,What makes an unknown coin move,1607803949,23,1
218,kbvyic,paperfaced,-0.694,RIP Coinbase,1607803886,2,1
220,kbvwom,I____q--p____I,0.3612,The Wealthy Are Jumping Into Bitcoin as Stigma Around Crypto Fades,1607803716,0,1
224,kbvlvw,blessive,0.0,ETHUSD Encounters Technical Resistance on Recovery Sally Hos Technical Analysis  December  ETH,1607802741,0,1
226,kbvgdo,Robindinho,0.8807,Whats your small market cap best bet to moon in the next  years,1607802247,2,1
227,kbv9vw,ShotBot,0.4588,Michael Saylor when bitcoin breaks k,1607801657,20,1
229,kbv4wo,DarcSystems,0.0,Xrp live,1607801219,2,1
230,kbuzvt,Upbeat_Editor_7880,0.0, BTC or  BTC   ETH ,1607800754,0,1
231,kbuwv7,TheGreatCryptopo,-0.1531,Institutions Are Bullish On Bitcoin Retail Holders Falling,1607800470,7,1
233,kbutvh,Jacktenz,0.4588,Can someone help me understand why anyone would want to fund microstrategies recent bitcoin raise,1607800205,11,1
234,kbutn9,Roy1984,0.0,Another Billionaire Wall Street Legend Has Changed His Tune On Bitcoin,1607800181,6,1
235,kbut6c,professordurian,0.0,Bitcoin Dumbledore  Headmaster of Bitcoin Rationalism and Wizardry,1607800135,5,1
236,kbus2z,sylsau,0.6908,Bitcoin Is Your Best Defense Against the Mass Surveillance Society,1607800033,4,1
237,kbunl0,SatoshiHeist,0.0, years ago bitcoin founder Satoshi Nakamoto made his final post Logged off and never came back The rest is history,1607799624,0,1
238,kbumjz,Plankton_Etn,0.7506,This December The Fintech Times is asking industry leaders for their View from the Top to gain an insight into the decisions behind the last months Today were looking at the issue of Digital Currencies hearing from Richard Ells Haipo Yang Allessandro Zamboni and Basil Al Askari on their,1607799539,0,1
239,kbulth,fd01,-0.5994,Amidst all the hype it feels Im the only one who is still in the red Where are you all Am I alone  joiner,1607799468,0,1
240,kbudju,da_dreamerr,0.0,Its Official Crypto on Front Page of US Tax Return,1607798719,15,1
241,kbu9pz,hmalik514,0.7184,You Can Now Buy Bitcoin On PayPal For ,1607798381,1,1
242,kbu8f0,AscensionZZ,0.0,Crypto mining phone,1607798265,0,1
244,kbu1xr,teflonjon321,0.4588,Me new to crypto every time the price fluctuates above my purchase price,1607797672,3,1
245,ke0uhq,communist_mini_pesto,0.4588,Circle High yield savings accounts built on Ethereum using AAVE and Yearn,1608087552,0,1
247,ke0pea,AESTHTK,0.2023,Anybody else playing games on Ethereum at the moment,1608087043,8,1
249,ke0coh,jeffery1212n,0.5106, Bitcoin Cash Enjoyed Over  Increases amid Sound Crypto Market,1608085801,1,1
256,kdzye9,MammothSir9,0.0,Italian Insurance Giant Generali Gets Into Bitcoin via Banking Arm Launching Crypto Custody Service,1608084387,2,1
257,kdzsh6,ramonvls926,0.0,Italian Insurance Giant Generali Gets Into Bitcoin via Banking Arm Launching Crypto Custody Service  Finance Bitcoin News,1608083829,1,1
262,kdz9li,sjgokou,0.5994,Top  Cryptocurrencies Worth Investing In ,1608081953,10,1
263,kdyxpl,MammothSir9,0.7351,SBIs Acquisition of Crypto Firm Helps the Asian Giant Create FullFledged Digital Asset Trading Desk,1608080791,0,1
264,kdys5r,wagnertamanaha,-0.2235,ETH is Not Money,1608080262,11,1
265,kdyp4j,ajudd4u,0.0,Bitcoin is borderless,1608079952,4,1
267,kdykgi,jxn1997,0.0,Blockchain Barbie Crypto Blog,1608079512,0,1
268,kdyf3b,anonergo,0.4588,Pick up another  BTC or diversify my portfolio with ETH,1608078989,0,1
269,kdydsl,SweetPie123,0.0,Secret bridge turns ERC tokens into privacy coins,1608078864,15,1
270,kdybe5,TheSource777,0.7184,Michael Saylor Tesla Should Buy Bitcoin With Famous Tesla Youtuber HyperChange,1608078636,2,1
275,kdxe56,miharbidaddah,-0.5423,UK investment firm Ruffer Investment Company has just invested  of their holdings into Bitcoin selling gold to get into BTC Prepare for a wave of stories like this over the coming weeks,1608075492,9,1
277,kdxcbm,BrianAtSantiment,0.0,The Amounts of Bitcoins Whale vs Large vs Small Addresses Have Fluctuated Very Differently This Past Month  Santiment Insights,1608075328,1,1
280,kdwytq,Empire_Building101,0.4939, BITCOIN MEME ENJOY,1608074109,2,1
281,kdwy3n,Roy1984,0.0,Legendary hedge fund manager Paul Tudor Jones says Bitcoin could be the equivalent of digital gold in  years and that cash may be gone,1608074039,6,1
282,kdwxwy,Souzze11,0.4588,Keepkey or Ledger for long term storage,1608074021,0,1
283,kdwvxq,joesmith91,0.4588,High Stakes on Polkadot Meet MANTRA DAO the Home of Polka DeFi,1608073848,21,1
286,kdwt40,MammothSir9,0.5046,Bank of America Investor Survey Highlights the Most Crowded Trades Long Tech Short USD Long Bitcoin,1608073585,0,1
288,kdwji9,blessive,0.1779,Monero Price Analysis XMR Keep on Growing,1608072747,0,1
289,kdwfd5,flowers_at_dusk,-0.5106,Hacker Steals  Million From Nexus Mutual CEO  Decrypt,1608072375,1,1
293,kdw5v1,BanklessHQ,0.1779,How to analyze crypto assets,1608071504,0,1
295,kdvxd6,velvenhavi,0.0,btc every time it tries to pass k,1608070752,6,1
300,kdviry,ig-sadiehanalei,0.6808,CasinoCoin Partners With SunCash K Users Gain Crytpo Access For Casinos amp Money Transfers,1608069481,1,1
303,kdva9q,Gasset,0.0,PP Bitcoin Trading Venezuela Colombia Account for Over  of Total Localbitcoins Volume,1608068747,0,1
305,kduwef,AdventuresinAtlanta,-0.7833,Gold will disappoint investors in   heres why the bulls arguments dont hold up,1608067548,13,1
307,kdul7x,CosmicDeception,0.0,Kin Launches Its Migration to Solana Blockchain Moving  Million Crypto Accounts,1608066577,0,1
310,kdug0b,Fiach_Dubh,0.0,Sell GBTC Buy QBTC  Winklevoss Twins Weigh In on Arbitraging Bitcoin Fund Premiums  Dec th ,1608066144,0,1
312,kdu8od,blessive,0.2023,Grayscale hits B Why Bitcoin institutional demand soaring at k is bullish,1608065548,0,1
314,kdtq2v,da_dreamerr,0.0,Ruffer Investment Co Allocates  Percent Portfolio  Million To Bitcoin,1608063999,7,1
316,kdtepp,Kylian0087,-0.7983,WARNING Ledger scam email be aware,1608063059,37,1
319,kdt4kh,dannydorrito,0.0,Ruffer Investment Allocated  of MultiStrategies Fund  million to Bitcoin in November,1608062243,1,1
320,kdt3qm,realucybaker,0.0,Disclaimer Bitcoin discount,1608062181,2,1
321,kdt0v0,HashMoose,0.7184,Monero Breaks Year High Amid Rising Concerns Over Online Ransom,1608062039,11,1
323,kdsxs9,itsbuzzpoint,-0.3182,IRS is setting the trap for bitcoin and virtual currency investors on  tax form,1608061785,24,1
324,kdsqo4,BardCookie,0.0,China is testing its digital currency in Suzhou Heres an early look at the user experience,1608061183,3,1
325,kdso76,bench4rench,-0.1295,Revealed What Investors Think BTC Will Be Worth in  Its Not Good News  CoinMarketCap,1608060982,2,1
326,kdslcg,loganjones44,-0.5859,Reasons for Bitcoins Drop After Failure To Break K Again,1608060746,1,1
329,ka1kl3,9onwick,-0.4019,Problems withdrawing cash from bitcoin,1607550751,0,1
334,ka174y,koukoucrypto,0.6908,Strong support for crypto industry regulation at recent G meeting,1607549570,2,1
335,ka174m,koukoucrypto,0.6597,Nexo founder on importance of crypto lending insurance and the differences between the  and  Bitcoin bull run,1607549569,1,1
336,ka1746,koukoucrypto,0.0,Crypto and stocks broker eToro becomes  billion unicorn,1607549568,4,1
337,ka173s,koukoucrypto,0.0,Grayscale  of new investors are now very familiar with Bitcoin,1607549567,2,1
339,ka1728,koukoucrypto,0.4404,Braves Des Martin talks Bitcoin as Web  tokenizing the web and why banks are dinosaurs,1607549563,1,1
340,ka16mm,loganjones44,-0.2732,Former Bitcoin Critic Billionaire Ray Dalio Goes Bullish on the Cryptocurrency,1607549527,2,1
341,ka12jb,koukoucrypto,0.2732,Market Wrap Bitcoin Recovers to K While Market Dynamics Juice DeFi Total Locked,1607549166,1,1
343,ka0zy4,nice2yz,0.5106,BitPay files with OCC to become national cryptonative trust bank,1607548936,0,1
344,ka0yep,Subject_Investment78,0.7845,Crypto Mining Equipment   OFF  Great Opportunity for Crypto Mining Investor,1607548807,0,1
346,ka0y4f,Laughingboy14,0.0,Make Room Wall Street Bitcoin Payments Startup BitPay Applies For National US Banking License,1607548782,0,1
348,ka0o04,makemoneyonline09,-0.8256,INSANE BITCOIN DROP Next Month ,1607547910,0,1
349,ka0hzs,2020-2021crypto,-0.296,Retail investors no longer aloud to invest in cryptocurrency cfd only professional investors,1607547424,6,1
350,ka0dyv,2020-2021crypto,-0.296,Retail investors no longer allowed to invest in cryptocurrency from January th  had this email today from IG Only professional traders allowed to continue trading,1607547088,0,1
351,ka0d5o,Roy1984,0.4588,Bitcoin goes to strong hands,1607547018,0,1
354,ka035h,jwinterm,-0.2732,DeFi leaders mishap sees his Eth validator subjected to continuous slashing,1607546200,3,1
355,k9zyky,stefa2k,0.0,Ethereum  explained for beginners,1607545812,0,1
356,k9zxr6,rivoke,0.0516,Ethereum Price Aims For  As ETH Deposit Contract Reaches  Million,1607545742,1,1
357,k9zx9r,LootCoin,0.4215,Bitcoin Making Progress on Bid to Oust Dollar Morgan Stanley Chief Global Strategist Says,1607545709,0,1
358,k9zuq5,extrashrimpfriedlife,0.0,Which crypto podcast do you follow,1607545491,0,1
359,k9zsmj,TheGreatCryptopo,0.0,The  Bitcoin Club Elite Club For Holders of One Bitcoin,1607545324,10,1
360,k9zldm,PBinKS613,-0.1531,If youre not currently in the crypto space whats stopping you,1607544739,0,1
361,k9zl12,PrestigiousBuy4615,0.7184,ANDX Token to the moon,1607544707,0,1
362,k9zigg,Gasset,0.0,BitPay Applies to Become a National US Bank,1607544493,1,1
363,k9zh1t,edwardianpug,0.0,ePaper Price Ticker All code on Github,1607544374,1,1
365,k9zgpr,ramonvls926,0.4215,BTC in reddits Popular page,1607544346,2,1
367,k9zetu,ramonvls926,0.0,Billionaire Ray Dalio Recognizes Bitcoin as Gold Alternative,1607544196,21,1
372,k9z74o,blessive,-0.4588,Ripple price prediction XRP to fall to  ahead analyst,1607543573,0,1
373,k9z71n,blessive,0.3182,Ripple coin could be Brexit trade solution,1607543567,0,1
374,k9z6z3,blessive,0.0,Standard Chartered Expects to Launch Bitcoin Custody in ,1607543562,0,1
375,k9z6x7,blessive,0.0,ETHUSD Bulls Still Eyeing  Upside Target Sally Hos Technical Analysis  December  ETH,1607543558,0,1
376,k9z6w2,blessive,0.0,Research Indicates Investments Flowing Out of Gold and Into Crypto,1607543556,0,1
377,k9z6ve,blessive,0.0,Ripple Price Analysis XRP Primed For a Breakout Following Stagnation At ,1607543554,0,1
379,k9z6tt,blessive,0.765,Jack Dorseys Square Invests M To Promote Green Energy For Bitcoin Mining,1607543550,0,1
380,k9z6sw,blessive,0.0,Bitcoin Investors Tested by Stimulus and Vaccine News,1607543548,0,1
382,k9z6rw,blessive,0.0, Reasons Why Bitcoin is Becoming a Mainstream Payment Option,1607543547,0,1
383,k9z43u,Gasset,-0.8625,Citigroup Downgrades Microstrategy to Sell Rating Over Aggressive Bitcoin Purchases,1607543337,10,1
390,k9yixc,jonbristow,-0.7184,LongTerm Bitcoin Holders Are Selling Off Their Coins,1607541612,18,1
393,k9ycrm,Whiskeywonder,0.4588,Get up to speed Institutional bankers in Geneva have started a defi bank,1607541111,0,1
396,k9y7rn,totophe1077,0.8176,reserve rights my biggest bag get ready for moon,1607540711,2,1
397,k9y44u,amo1282,0.0,Why I cant wait for crypto to be the new normal,1607540421,0,1
398,k9y0rz,Bitcoin1776,0.7184,A portrait of the man about to buy  Mil Bitcoin using bonds proceeds What do you think Would you recognize Mr Saylor if you saw him,1607540158,3,1
400,k9xvzo,TigerRaiders,-0.2023,MicroStrategy shares slide  after Citi downgrade on disproportionate bitcoin focus NASDAQMSTR,1607539778,1,1
401,k9xjig,baddgirl27,0.0,New crypto Pi,1607538758,0,1
406,k9wxxb,thelionshire,0.0,Fidelity unlocks Bitcoin as collateral for borrowing on BlockFi,1607536998,1,1
407,k9wxq7,PapiGrande52,0.3612,Elon Musk be like,1607536984,2,1
408,k9wwmh,PrimaryBranch,0.2263,Google Pay PhonePe account for  of UPI transactions crypto has huge scope in the Indian market,1607536899,1,1
409,kg1wup,testadex,0.0,ioTube Converting ERC Tokens from Ethereum to IoTeX  Community,1608355215,0,1
412,kg1ixr,blessive,0.6597,Litecoin Leads Weekly Crypto Gains With  Rise,1608353551,0,1
415,kg1aj8,Better_Intuition,0.4939,Can anyone please explain to me on how XRP is going to be legitemally succesful Or if anyone can tell me this is a pump and dump scam and XRP is just hyping in people to buying,1608352540,0,1
416,kg19rt,cryptokunbo,0.0,Nigeria becomes the nd Biggest Bitcoin Market Globally,1608352447,2,2
422,kg11h7,doob4266,-0.4588,Taking profits,1608351501,0,1
423,kg11gr,ToshiBoi,0.4939,When BTC all time high reaches kkkk,1608351499,9,8
425,kg0zxo,Pavan2426,0.4588,HIGH ROI TRX INVESTMENT ,1608351327,5,0
426,kg0zhs,devboricha,-0.296,Chris Wood cuts exposure to gold a first in years invests in Bitcoin,1608351277,0,2
427,kg0ye4,aminok,0.5994,Jake Chervinsky For my part Ill be helping BlockchainAssn evaluate grounds to challenge the rule under the APA Theyve hired one of the best lawyers in the country for this If youre a crypto company in the US amp havent talked to them about joining do it now,1608351159,0,2
428,kg0uyy,MammothSir9,0.0,Bitcoins Early Days Reporter Recalls K Sushi Dinner After Spending  BTC Former Bitcoin Dev Sells  BTC for Under  a Coin,1608350769,0,1
429,kg0rzs,TheCryptoCop,0.0,Bitcoin to the banks right now,1608350449,9,6
430,kg0nfj,blessive,0.2023,Incoming US Senator defends Bitcoin and crypto in conversation with US Treasury,1608349943,0,1
