Unnamed: 0,id,author,vader,title,created_utc,num_comments,score
2143,kjkqz3,HomieApathy,0.836,The BTC I spent on this sweater would now be worth usd worthy of every sat Worn through bear and bull Happy holidays folks,1608836451,11,1
2144,kjkpo3,Fritz1818,-0.296,Who remembers the Bitcoin Bowl BitPay paid ESPN  Bitcoins or k at the time to sponsor a college football game ESPN quickly converted the Bitcoins into fiat missing out on a  million dollar investment,1608836331,4,1
2148,kjkiz1,jj_hops,-0.2732,DefiCliq  Low Cap Gem K Advised by Bitcoin Foundation Founder,1608835661,0,1
2149,kjkgci,dannydorrito,0.0,Miami Mayor Exploring Ideas in Crypto Governance,1608835408,2,1
2152,kjjtyu,gfisbeck,0.4215,Forsage ETH Opportunity,1608833215,0,1
2153,kjjtjj,MammothSir9,0.2732,MinePlex Creates CrossFi Crypto Bank by Combining Traditional Finances With Blockchain,1608833172,0,1
2157,kjjddl,clogsroofer,-0.4588,Livecoin is hacked,1608831599,9,1
2158,kjjcl6,ShotBot,0.0,Roubini Bitcoins hyperbolic bubble is going to go bust,1608831521,34,1
2160,kjj8q5,great-sunshine,0.0,Bank not allowing purchase of Crypto,1608831124,12,1
2161,kjj8by,Electrical_Corner_24,0.7184,How Can I Buy Ethereum In Africa In ,1608831083,4,1
2162,kjj7mt,Electrical_Corner_24,0.7184,How can I buy Ethereum in Africa in ,1608831015,0,1
2165,kjj3a6,jwinterm,0.0,Farcaster BTCXMR Atomicswap community update December,1608830593,5,1
2166,kjj2b2,AlfonsoLaBarista,0.0,And on the third day XRP rose again,1608830500,0,1
2167,kjj1j9,nanobythebay,0.296,Which cryptos are least likely to be deemed securities by the SEC given their new approach to Ripple,1608830426,0,1
2168,kjj1g1,Electrical_Corner_24,0.8316,What is the easiest way to Buy Bitcoin in Africa in  ,1608830418,1,1
2169,kjiuay,Fiach_Dubh,0.0,Pomp amp Kevin OLeary on Bitcoin Rally and Regulation  Nov th ,1608829705,7,1
2170,kjitxg,da_dreamerr,0.0,Elad Roisman to replace Jay Clayton as SEC Chairman We have a pro Bitcoin head of the SEC,1608829663,0,1
2176,kjil3x,bench4rench,0.0,Ethereums  Biggest Moments in   CoinMarketCap,1608828809,0,1
2178,kjikfj,blessive,-0.4588,Ripple Price Analysis Despite  Daily Recovery XRP Still Down  On The Weekly,1608828743,0,1
2180,kjijm3,Fiach_Dubh,0.0,Michael Novogratz Talks the Bitcoin Rally and Regulation on CNBC  Dec th ,1608828663,0,1
2183,kjiaz0,milldrive,-0.4939,Mirror Trading International Russian Hackers and Freemasons Caused MTI Collapse,1608827787,3,1
2184,kji72x,daltonas,0.0,i found a group that manipulate cryptocurrencies prices is that legit what do you think,1608827388,0,1
2185,kji67m,daltonas,0.0,i found a group that manipulate cryptocurrencies prices is that legit,1608827299,0,1
2187,kjhv53,Stealthex_io,0.0,What was the most memorable thing in the crypto industry for you this year,1608826144,3,1
2188,kjhtqo,robert_digital_III,0.0,Lets hear it for Crypto Hitler,1608825999,4,1
2189,kjhtjr,MammothSir9,-0.6249,Localbitcoins Trader Facing up to  Years in Prison Over Bitcoin Fraud Schemes,1608825981,2,1
2191,kllz9e,DoJo_Mast3r,0.8579,We are lucky reddit has moon coin Lets not forget it,1609141164,30,1
2192,kllvyy,hackernoon,0.0, Predictions For Crypto Industry In  without trading,1609140734,0,1
2193,kllu7p,Cryptodragonnz,0.6802,This guy is more or less the Piers Morgan of New Zealand Two years ago he went to the radio waves to celebrate the supposed death of bitcoin You can taste the glee from his article Only up  since then And apparently crypto isnt regulated  good news for XRP then Who knew,1609140506,9,1
2194,kllqri,nikitko13,0.6597,Hope you guys like my crypto art D,1609140056,0,1
2197,kllobr,weeeedy_crypto,0.0,RollerCoin  Online Bitcoin Mining Simulator Game,1609139737,2,1
2198,kllnwr,coinmonks,0.0,My Bitcoin Story,1609139687,1,1
2199,kllmxk,AsianAmericanAffairs,0.4588,I spun up an uptime tracker for various Crypto Exchanges,1609139576,1,1
2200,kllmir,coinmonks,0.0,MicroStrategy  Adopting a Bitcoin Standard,1609139521,1,1
2202,kllkfj,ouxLatashia,0.7906,The Great Bull Run Will Bring What to the Whole Market,1609139264,1,1
2203,kllk96,coinmonks,0.0,Bitcoin  Digital Gold in a Digital World,1609139243,1,1
2204,kllk4t,coinmonks,0.0,Bitcoin  Volatility Hashpower and Network Effects,1609139225,1,1
2205,klljab,reddy_GG,0.4588,Top  coins your looking at investing in right now,1609139123,0,1
2206,kllipz,Pe1per,-0.4005,Ripple faces major lawsuit and Bitcoin continues to dominate the Market Last week in crypto ,1609139059,1,1
2208,kllfdy,vnfreeaz,0.0,XRP holder What should I do now,1609138666,0,1
2209,kll7ly,mytvwatchesme,0.0,They are my keys  they are my coins,1609137754,44,1
2210,kll1aq,toTheMoonAndBackBoys,0.3612,Israel to begin taxing Crypto Holdings further legitimizing the asset,1609137025,3,1
2212,klkzqz,eddosiamdiu,-0.5423, is the replicate of  Crash imminent Discuss,1609136844,1,1
2213,klkxew,febivencg3,0.4404,DLT pump explained,1609136579,0,1
2214,klkx2l,cryptomangofficial,0.0,Ethereum,1609136544,0,1
2216,klkogd,looperino_memes,0.0,Did CBDCs affect the crypto space in  and whats next in  Experts answer,1609135560,1,1
2219,klk6yq,throwreddit42069,0.0,Any crypto to crypto exchange which doesnt ask for ID,1609133615,0,1
2220,klk4t5,AlphaDawg93,0.0,NEW DIGITAL CURRENCY WAVE,1609133387,0,1
2222,klk1zw,Far_Guarantee_7184,0.7845,Is XLM Stellar Lumens Worth The Buy,1609133074,0,1
2223,kljznu,wagnertamanaha,0.0,Snowden on Bitcoin,1609132826,13,1
2224,kljx3l,Personal_Escape_2897,0.4404,DLT pump,1609132528,1,1
2225,kljwhe,badfishbeefcake,0.7184,What is the Reddit Moon,1609132467,2,1
2226,kljtv9,anton19811,0.7845,How long will this bull cycle last ,1609132171,69,1
2227,kljsp0,LogicalInjury9700,0.34,Pumping Alt Coins Discord Group Join Now ,1609132038,0,1
2228,kljqa9,firesauce928,-0.4215,Pump and Dump Discord Server,1609131791,0,1
2232,kljjbn,pm1045,0.296,Magic Internet Money go Brrr,1609131088,5,1
2234,kljdz2,TheAlkaris,0.0,What are your predictions for Bitcoin in ,1609130506,3,1
2236,kliypw,BrandonZ0302,-0.4588,Russian cryptocurrency exchange Livecoin hacked services disrupted,1609128869,0,1
2238,kliw7v,earnwithchristineg5,0.25,How to Trade Bitcoin Comprehensive Guide to Trading Bitcoin in ,1609128598,1,1
2239,klivks,alliswell19,0.0,Ethereums Market Cap is Larger than Ferrari and BMW,1609128530,0,1
2240,kliube,BrandonZ0302,0.7096,After promoting Bitcoin merch discount Mark Cuban praises BTC monetary policy,1609128388,14,1
2241,kliu90,MammothSir9,-0.836,Shark Tanks Kevin OLeary Warns Regulators Will Come Down Hard on Bitcoin  It Will Be Brutal,1609128380,2,1
2245,klilrp,slywalkers,0.0,CNN report Bitcoin is crashing upward,1609127501,41,1
2246,kliklx,Doriando707,0.0,XRP Army Logic,1609127381,3,1
2247,klihoe,Doriando707,0.0,Tim Ogilvie ProofofStake Was Bigger Than Eth  in ,1609127074,1,1
2248,klia9j,Brainsick001,0.296,Money printing,1609126320,0,1
2249,klhygf,DonkeysButtHole,0.0,UK Crypto Tax Question,1609125113,0,1
2251,klht2p,The__Lemming,0.4404,Crypto Pump Discord Community  For Those Interested,1609124584,0,1
2252,klhqba,Clash_My_Clans,0.0,The Ultimate Crypto Tax Guide ,1609124324,4,1
2253,klhog4,usernameofficial1,0.9001,Moons mooning,1609124128,0,1
2254,klho0b,Plutusedge15,-0.1027,Ripple Lawyer Says Theres One Legal Question at Center of XRP Lawsuit,1609124082,2,1
2255,klhmmp,blessive,0.6369,era altcoins Zilliqa ZIL and VeChain VET rocket higher amid Bitcoin boom,1609123948,0,1
2256,klhl12,moreleverage2,0.0,Should people move their selfhosted crypto to an exchange ahead of the proposed US regulations,1609123797,0,1
2257,klhfhn,joshmillerent,0.0,Augur The Crypto That Will Disrupt the Gambling Industry,1609123238,1,1
2259,klhd5r,Lucasso25,0.0516,Insane btc pump,1609123004,0,1
2260,klhcog,shwekhaw,0.7184,When you are holding XRP while the crypto market in general is mooning,1609122957,4,1
2261,klhbw2,tyzy_1187,0.3182,Does BTC have the ability to affect other coins based on its own price movements For example if BTC rises will alt coins follow,1609122877,8,1
2262,klha75,Timetraveler62540000,0.4588,Top  gainers of the Blockchain developer ecosystem excluding Ethereum,1609122710,5,1
2263,klh8lw,AdventuresinAtlanta,0.0,Israelis Must Now Disclose Crypto Holdings Report,1609122554,3,1
2264,klh7rk,thewealthmattress,0.0,Just crypto or cryptostocks,1609122470,0,1
2265,klh721,AutisticDalekOnSpeed,-0.4767,After seeing the btc ath being broken so many times in this time period i decided to ask my financial advisor about what he thinks of it He told me this,1609122400,3,1
2266,klh4dy,WeakHands_Trader,0.0,I predicted the EOY for BITCOIN over  months ago,1609122134,0,1
2269,klgplx,wired_kid,0.2732,Is Pumping and Dumping Legal,1609120679,3,1
2270,klgmhh,blessive,0.0,Bitcoin Price Surges Towards  in Latest Rally,1609120352,0,1
2273,klgg5u,Klebznebet,-0.5423,Crypto tax in Sweden kills me,1609119711,0,1
2274,klgfru,OneBlockAwayICO,0.2732,Why the central banks are rushing to create a digital currency,1609119674,12,1
2275,klgeuj,shrikant18,0.4588,Took some profit,1609119580,0,1
2276,klgcet,MuchTicket3,0.0,Daily tracking Bitcoin Price Once Exceeded K amid Fluctuated Crypto Market,1609119336,0,1
2278,klgbnx,SweetPie123,0.0,More Fortune  Companies Will Own Bitcoin By ,1609119259,0,1
2280,khtm71,ParentCompany,0.0,New to Crypto  Need Advice,1608595394,0,1
2281,khtm5s,TopThingsToKnow,0.4404,Quick  Profit on Longing Yearn FinanceYFI,1608595391,2,1
2282,khtlj3,ParentCompany,0.0,New To Crypto  Need Advice,1608595336,0,1
2286,khtf9w,blessive,0.6369,Is XRP investment the best cryptocurrency for beginners,1608594749,0,1
2292,khskgk,ramonvls926,0.0,My Lil Sis and DOGE,1608591886,91,1
2297,khs3a6,Roy1984,0.0,Tethers Exchange Supply amp  Billion US Stimulus Deal Offers Fuel to Bitcoin Bulls,1608590377,3,1
2298,khrzy4,BanklessHQ,0.4588,Did Mnuchin Break DeFi,1608590063,2,1
2299,khryk0,slywalkers,0.0,Scaramuccis SkyBridge files with SEC to launch Bitcoin fund,1608589943,1,1
2303,khqybv,Brosispay,0.9186,Get Going Grab a coffee buy a plane ticket pay your phone bill Buy Grocerry Shopping brosispay is growing and will be accepted by new businesses Pay with brosispay anywhere to anyone instantly for less than a cent,1608586929,5,1
2306,khqk97,TheGreatCryptopo,-0.6486,UK Crypto Exchange Hacked Reportedly Loses  Million,1608585757,3,1
2307,khqdoi,Novocoin,0.3818,What places that accept crypto,1608585199,0,1
2308,khqdh3,jaidancraig,0.5559,Peter Schiff Wont Stop Hating on Bitcoin,1608585183,0,1
2312,khq0pn,u_are_mad,-0.4019,Alts looking for any excuse to dump,1608584157,2,1
2313,khpyj3,Ethical-trade,0.4939,Amazon now supports Ethereum,1608583972,12,1
2315,khpxdi,Roy1984,-0.2023,Sierra Club leads lawsuit against NY town to prevent expanding Bitcoin mining operations,1608583873,3,1
2317,khpsir,suriansg,0.0,prediction market What will Coinbases market cap be one week after it starts publicly trading,1608583472,17,1
2318,khpqea,Lumin8_Crypto,0.3612,Cryptocurrency News Today Is Crypto Life Changing Like The Smartphone,1608583294,2,1
2320,khpjw7,loganjones44,0.4588,Bitcoin Price Dips to  After an AllTime High During the Weekend,1608582726,7,1
2324,khpdcr,BawceHog,0.7184,I am  ETH and looking to diversify into BTC Buy with cash USD or ETH,1608582170,2,1
2325,khpcwn,lifesaboxofchoco,0.34,Can bitcoin value be diluted maliciously by forking many version of it,1608582132,0,1
2326,khpbzi,diamondcd,0.3612,Just Hodl this season,1608582057,0,1
2327,khpbb8,diamondcd,0.3612,JUST HODL,1608582001,2,1
2328,khp574,ShotBot,0.5949,Observation Elon Musk and JP Morgan have a strong fascination with crypto but we arent aware of their bags,1608581486,12,1
2330,khp0p7,jakefromstat3farm23,0.4404,XLM Pump coming,1608581109,19,1
2331,khozhm,rachidafr,0.4019,The Reason Why a Simple Tweet From Elon Musk Can Boost Dogecoin Price by  in a Few Hours,1608581009,5,1
2333,khoyyh,Fiach_Dubh,0.0,Tesla Charging With The Bitcoin Lightning Network  Proof of Concept  May  ,1608580967,2,1
2334,khoszj,cashcreatorcalamity,-0.0258,Pump and dump scheme inquiry,1608580483,0,1
2337,khojje,IWriteCrypto,-0.8402,Binance Users Complain of Lost Funds Following Sudden Crash,1608579702,6,1
2338,khojdr,Diver_Driver,0.6249,Grayscale Temporarily Stops Accepting New Clients in Six Crypto Trusts,1608579688,1,1
2341,khobma,TheriamNorec,0.0,Twitted yesterday by Elon Musk,1608579067,3,1
2344,kho98q,burn__the__witch,0.7717,Bitcoin subreddit moves up to  on Reddits Top Growing Communities List,1608578884,3,1
2345,kho8ao,bananabeachboy,0.25,I created a list of Bitcoin Cryptocurrencies and Blockchain documentaries,1608578804,4,1
2346,kho80p,JG34579,0.0,Which Coin Will Replace Fiat Currencies Globally,1608578781,25,1
2350,kho1mn,me_you_69,0.4588,I am new to cryptocurrency and im thinking about buying bitcoin but wanted to hear your opinion I also need some tips on what to think about when buying and selling cryptocurrency,1608578275,2,1
2352,khnt12,MammothSir9,0.296,xSigma Recruits Former Ripple Engineer to Join xSigma DeFi,1608577585,2,1
2354,khnmqh,shah2018,-0.4588,Ledgers Christmas offer after the recent hack,1608577094,7,1
2356,khnkpt,herpefreesince1983jk,0.7184,Saw a sign time to buy xrp boys,1608576924,3,1
2357,khniyr,Snoo_671,0.0258,Story of A Great Scam Binance,1608576784,0,1
2358,khni8u,blessive,0.4215,Charlie Lee explains  Litecoin LTC rally in face of strong Bitcoin dominance run,1608576733,0,1
2359,khnh6z,da_f3nix,0.0,Anthony Scaramuccis  Billion Fund Registers for Bitcoin Investment,1608576655,3,1
2361,khnfj4,REALeyesRealize21,0.0,Why does this guy have Crypto in his name,1608576523,0,1
2366,kmpqdw,Tr33squid,0.0,Crypto Taxes  If the IRS is going to utilize Chainanalysis and Palantir to figure out how much we shouldve owed for the year why tf cant we utilize the same datasystem too,1609284655,14,1
2367,kmpod1,Yorkshire80,0.0,Panthers Russell Okung becomes first NFL player to be paid in bitcoin,1609284472,3,1
2369,kmpn3t,Podcastsandpot,0.0,Bittrex removing XRP,1609284361,0,1
2370,kmpm9j,Throwawayiea,0.7579,Reef launched this morning and its up  and climbing,1609284284,0,1
2371,kmphhz,Khaoz346,0.0,Bittrex to remove XRP,1609283858,171,1
2373,kmpg28,Khaoz346,0.0,Bittrex removing XRP markets,1609283727,2,1
2374,kmpdqk,ztudos2,0.0,BITTREX TO REMOVE XRP MARKETS ON JAN  ,1609283512,0,1
2377,kmp8cq,Queasy_Drawing_687,0.0,Curb your bitcoin usecase,1609283025,0,1
2378,kmp7xb,JanekJankovic,0.0,SEC vs RIPPLE  Forbes,1609282994,7,1
2380,kmp25q,finanx,0.0,How would someone buy and sell crypto without an exchange,1609282502,0,1
2384,kmohph,jkam332,-0.0516,Crypto Profits Outside The United States,1609280687,0,1
2385,kmohdq,Rubenvaughn,-0.296,No NFL player Russell Okung is not being paid in Bitcoin,1609280661,3,1
2387,kmoa4t,castorfromtheva,-0.2732,Update The SEC Is Now Officially Suing Ripple,1609280038,131,1
2389,kmo3db,Timesche,0.5423,Crypto mining from your mobile devices  Use code Timesche for  bonus in income ,1609279440,5,1
2390,kmo2u9,Roy1984,0.0,Why XRP suddenly spiked  in  minutes after a massive correction,1609279391,1,1
2393,kmo0c0,Daryldor,0.0,Working out Bitcoin percentage,1609279180,10,1
2395,kmnyny,jkam332,-0.4588,Crypto Profits outside USA,1609279028,0,1
2397,kmnxco,Lemonmule69,0.4215,Amazon settles securities lawsuit for   million in this sort of stuff happens The Xrp lawsuit will lead to regulatory clarity,1609278915,9,1
2399,kmnur5,shift2future,0.0,Coinbase This week in Bitcoin price ,1609278691,0,1
2401,kmnrg8,deathadder90,0.8847,Hold On To Your XRP We Are In For A Rough Ride But It Will Be Worth It To The Moon,1609278395,12,1
2403,kmnnbt,nikitko13,0.6597,Hope guys you will like it my crypto art,1609278049,3,1
2404,kmnlw2,monkeybombed,0.3597,More money going in,1609277922,6,1
2405,kmnli0,bench4rench,-0.6249,The  Worst Crypto News Stories of   CoinMarketCap,1609277891,0,1
2406,kmnjvy,hakyet,0.1655,Crypto has been performing better compared to other investments But always be careful as it is a risky business Always aim to have a wide variety in your portfolio,1609277747,0,1
2407,kmnj9g,BNieman,-0.4588,Ripple XRP Price Beating Continues After Several Exchanges Delist XRP from Trading,1609277693,4,1
2408,kmnhb1,loganjones44,0.4215,Bitcoin momentum slows altseason starts with Polkadot gaining ,1609277526,1,1
2409,kmnh3r,fraktalityworld,0.6597,Hope you guys will like my crypto art,1609277508,3,1
2410,kmnbfk,BardCookie,0.4588,Anthony Scaramuccis Skybridge has invested up to  million in bitcoin,1609277016,2,1
2413,kmn3c0,Max_uh,-0.296,How to stop a btc transaction from confirming,1609276359,0,1
2417,kmmq2b,Dirty-Dusty,0.9231,Wanting to buy  bitcoin to make sure I own at least one full unit if it actually moons,1609275248,26,1
2418,kmmoo4,blessive,0.0,Ethereum  what Ethereum is and why it is constantly compared to Bitcoin,1609275137,0,1
2419,kmmkj3,pale_blue_dots,0.0772,Christmas magic  A crypto user who lost roughly  from a smart contract mistake before the holidays is thanking the crypto community for donating  to help recover the loss,1609274780,8,1
2420,kmmjgx,looperino_memes,-0.7184,Time to sell before the SEC sues Satoshi,1609274681,8,1
2422,kmm59v,Glue_CH,0.25,This might be the last chance for you to exit XRP,1609273469,0,1
2424,kmm3qp,pgh_ski,0.0,Understanding Bitcoin Cryptography  Basics of Public Key CryptoElliptic Curves,1609273349,1,1
2425,kmlw2j,watchmaking,0.0772,Found an old invoice for a Raspberry Pi which I paid for in BTC over  today Hurts but worth it,1609272705,0,1
2426,kmltep,Synth777,-0.4588,Democrat judge overseeing Ripple lawsuit might dismiss charges,1609272473,12,1
2427,kmlqjs,mastermindset,0.128,XRP lawsuit collection if SEC would decide XRP is a security against SEC XRP XRP Labs,1609272235,7,1
2428,kmlpy9,HighlyAdaptive,0.6597,Hope you guys like my first of many more attempt at some Bitcoin art,1609272191,5,1
2430,kmlmpp,Shred-it-Brooo,0.8807,Join the Big Pump Signal discord Make easy profit by joining our k member community focuesed on pumping crypto prices,1609271941,0,1
2431,kmlkrj,Mobilenewsflash,0.0,BUCC  fully onchain privacy on Ethereum review and full transaction demonsatration,1609271780,0,1
2432,kmljo2,Shred-it-Brooo,0.8402,Join the Big Pump Signal Discord k members and growing Make fast profit and know when and what crypto the community will pump,1609271682,0,1
2433,kmlhzw,blessive,0.2023,Tesla Founder Elon Musk Agrees to a CryptoBased Mars Economy,1609271543,0,1
2435,kmlg1z,Synth777,0.0,SEC V Ripple The Cryptocurrency Trial Of The Century,1609271379,6,1
2436,kmlfzf,NOTPR0,0.7906,DEFI and CC are now up on uniswap or mintable on NDX Fully collateralized by the underlying tokens these indexes represent the target markets and passively adjust to track the top tokens allowing you to be exposed to all the top performers,1609271373,0,1
2437,kml7su,CryptoArtPulse,0.0,How to Invest in Crypto Art or Art NFTs The Beginner to Pro Guide,1609270689,3,1
2439,kml02o,TheDunbat,0.6369,XRP as security Rocket or Flop it,1609270032,0,1
2440,kmkzfb,Ano69,0.0,First hearing date of SEC VS Ripple is known,1609269975,22,1
2442,kmkupz,criptoretro2,0.7845, Was a Good Year for Crypto and Well Soon Have Even Better Ones  BeInCrypto,1609269563,0,1
2443,kmktvw,criptoretro2,0.7783,NexTech AR to Buy  Million in Bitcoin with Treasury Reserves,1609269490,0,1
2444,kmktvl,ShotBot,0.0,Kevin OLeary wants to know which of the traders own Bitcoin AskHalftime,1609269489,0,1
2445,kmkqta,loves_cereal,0.3818,In the event that XRP comes out alive and coinbase resumes trading,1609269220,5,1
2447,kmkqiq,Use-Then-Abuse,0.4215,XRP RN lol,1609269195,0,1
2448,kgv3em,lostsoul2016,0.6369,For some of us who are mere mortals and cant afford BTC what is the next best alternative,1608475339,2,1
2449,kgv2kz,lostsoul2016,0.6486,If BTC is out of reach for some of us what is the next best alternative,1608475257,2,1
2451,kgv17y,Willing-Fly-7659,0.875,Undertheradar asset class returns  x If youre interested in learning about a tiny asset class thats already returned investors as much as  in just over  days youll want to sign up for this nocost presentation,1608475115,0,1
2452,kgv070,Annual_Palpitation36,0.0,BITCOIN BLACK,1608475006,2,1
2453,kguzc3,robis87,0.0,Institutions Are Coming for Your Bitcoins As USDC Whales Make Massive Deposits on Coinbase,1608474912,1,1
2455,kguyb4,ModernRefrigerator,0.5719,You dont have to invest all your money in Bitcoin just the money you want to keep,1608474807,14,1
2456,kguy87,Snowzter,0.0,Crypto for a  yr old,1608474800,0,1
2463,kgulca,warwave7,0.6705,Bulls and Bears with the Moon lurking,1608473368,2,1
2466,kgujjp,MammothSir9,-0.4588,Weekend Market Action Sees Bitcoin Touch K  Billion in Short Positions Liquidated,1608473163,0,1
2469,kgudpt,Cheap_Journalist_573,0.891,I found an awesome gaming website sign up now to get an unlimited faucet everyday please join,1608472550,2,1
2470,kgudpa,WorkingLime,-0.4588, Bs ATH in Bolivares in Venezuelan currency VES were traded in Venezuela using LocalBitcoin that is  BTC down from  last week One BTC is around  Bs Monthly minimum wage is  USD,1608472548,8,1
2473,kgu4eo,Purest_Prodigy,-0.5233,My coworker mentioned crypto so Im selling a good chunk of my stack,1608471475,2,1
2474,kgu4ah,fuckaye,0.3612,What do you think articles like this will do to the market,1608471460,2,1
2476,kgtzl8,SirFletch,0.25,How I created a Digital Currency for MicroTransactions,1608470917,0,1
2477,kgtww5,TI-IC,0.0,Elon Musk tweeted this a few hours ago,1608470597,13,1
2478,kgtvqi,Colin-IRL,0.2757,Have k locked up in my etoro account but dont want to pay taxes,1608470468,14,1
2479,kgtvhu,TI-IC,0.0,Elon Musk not trying to FOMO in,1608470437,0,1
2480,kgtudc,RV_123,0.0,Elon vs Doge this morning,1608470303,3,1
2481,kgtrii,sylsau,0.8074,Bitcoin Continues Its Rally Supported by Institutional Who Are Gaining the Upper Hand Over Whales,1608469945,4,1
2483,kgtr1i,SweetPie123,-0.09,How it feels like having gains in crypto but no one to talk about it,1608469883,2,1
2486,kgtj4f,SweetPie123,0.0,DeFi Accounts for Almost  of Ethereum Transactions,1608468854,0,1
2487,kgtitg,stratguyatl88,0.4404,Musk pumping Doge,1608468818,6,1
2492,kgt5m0,Roy1984,0.0,Elon right now,1608466976,2,1
2494,kgt3wr,SubstantialRange,0.2263,Bitcoin Whales Buy Low Sell High Retail Investors Chase Rallies,1608466714,3,1
2495,kgt3ls,shah2018,0.0,Heres How Much You Would Have Made If You Invested In Bitcoin Instead Of Feeding Yourself,1608466665,12,1
2496,kgt1e6,Keithpelt,0.6705, rich men move  billion worth of Bitcoin,1608466317,0,1
2497,kgt11w,nirul_sensei,0.0,BITCOIN Cloud Mining,1608466270,0,1
2499,kgsxrr,EdwardM290,0.8918,Shoutout to the sicilian artist Arturo Di Modica The creator of the golden bull SEE YOU ON THE MOON,1608465804,5,1
2500,kgsx83,EdwardM290,0.9075,Shoutout to Arturo Di Modica The Sicilian creator of the BULL SEE YA ON THE MOON GUYS,1608465728,2,1
2501,kgsw4j,barbaky,0.0,The Elon effect,1608465591,4,1
2502,kgstg1,0hb0111,-0.4588,Is there a way to fill lost seed words,1608465168,0,1
2504,kgsp7g,P00PB0YY,0.0,Elon on twitter,1608464497,0,1
2505,kgsn5d,gobac29,0.0,For all Crypto beginners in this subreddit,1608464174,0,1
2507,kgsjny,microfreaky,0.6705,I read you can transfer your btc from Robinhood Pretty sure this is false,1608463632,0,1
2509,kgsh9f,NeptuneAgency,0.0,Elon calls BS on Bitcoin,1608463281,58,1
2513,kgs9as,kiutnic,0.4588,The Graph still going up,1608462098,4,1
2515,kgs5ee,blessive,0.8402,Bitcoin Price Breaks Above K New AllTime High Set,1608461522,0,1
2516,kgs3v4,ircrp,0.4404,Elon Musks tweet pumps Doge Coin over  in less than  minutes,1608461291,1,1
2519,kgrwb4,doge_c137,0.2716,it is very important to talk to your dog about bitcoin,1608460080,3,1
2520,kgrw0l,Antana18,-0.3182,Elon Musk is going nuts about Dogecoin again,1608460037,4,1
2521,kgruf6,keepingupwiththeos,0.1558,So much negative talk about LTC on this sub but it has the highest gains Why,1608459793,0,1
2522,kgrsbg,stockabuse,0.0,Why is the tick size for BTC options on deribit so large,1608459459,0,1
2524,kgrpni,slywalkers,0.2263,Someone Just Paid Whopping K to Send  Worth of Bitcoin,1608459020,0,1
2525,kgrmye,Ok-Salad3865,0.3612,Crypto enthusiast my intro post,1608458613,0,1
2526,kgrmbr,niquedegraaff,0.0,Current situation in Crypto Shopping Mall,1608458521,4,1
2527,kgrjg3,Spiritual_Navigator,0.0,Elon Musk trying to live a normal life,1608458078,21,1
2528,kgrinn,blessive,0.4588,Bitcoin Stabilizes After K Intraday Correction Litecoin Spikes Above  Market Watch,1608457955,0,1
2529,kgri86,robis87,0.4404,Elon Musk Changes Tune on Bitcoin Says Its His Safe Word,1608457889,6,1
2530,kgrg21,Laughingboy14,-0.4019,Coinbase CEO Brian Armstrong Issues Serious Warning As Bitcoin Surges Toward ,1608457557,0,1
2531,kgrfsd,Laughingboy14,0.4588,Bitcoins market cap could hit  trillion in  as its growing reserve currency status drives adoption higher a cryptocurrency expert says,1608457515,0,1
2532,k5ais6,myhaxdontwork,0.0772,Visa Partners With Ethereum To use USDC If you want to know why people are bullish on ETH,1606920443,8,1
2533,k5ah19,tycooperaow,0.0,Visa Partners With Ethereum Digital Dollar Startup That Raised  Million,1606920277,3,1
2535,k5aett,MJ_Graphics,-0.4588,night rain on car front window sound effect  short rain sound  rain on car while driving,1606920081,3,1
2538,k5a71o,cryptobriefing,0.0, Months Later Was Bitcoins Halving Priced In,1606919329,8,1
2539,k5a66x,milldrive,-0.6124,Stocksons Exit Scams Over  Million People And Takes Their Investments,1606919245,2,1
2540,k5a4c7,HassanAmmar22,0.0,Bitcoin Performance ,1606919059,0,1
2541,k5a4al,SammeyLobs,0.34,Not your keys  not your coins Upvotes  security for others,1606919054,0,1
2543,k5a2b4,gcbeehler5,0.0,Complete Guide To Ethereum  Staking Full Node Or Staking Pool,1606918875,1,1
2544,k5a1lx,SweetPie123,0.0,PayPal CEO Is Very Bullish on Digital Currencies of All Kinds,1606918802,13,1
2545,k59vgi,TobiHovey,0.3818,XRP Sees  Growth in Trading Volume on eToro,1606918191,1,1
2551,k59kal,SumaZero,0.0,Trend Forecast for Bitcoin Today December ,1606917073,0,1
2553,k59gim,robis87,0.0,PayPal CEO Dan Schulman at the Web Summit the Time is now for Crypto,1606916679,20,1
