Unnamed: 0,id,author,vader,title,created_utc,num_comments,score
6238,kmj5rd,hackernoon,0.0,Define and Backtest Crypto Algo Trading Strategies With Bitfinex Honey Framework Toolkit,1609264353,0,1
6239,kmj5hs,blessive,0.0,Litecoin Unseats Ripples XRP as The Fourth Largest Cryptocurrency,1609264329,0,1
6240,kmj4ip,SilverHoard,0.0,Ripple just put out a statement on the recent market activity and the SEC case,1609264239,40,1
6241,kmj4g3,Roarha,0.0,Dodged that XRP bullet,1609264231,0,1
6242,kmj2bz,IOB_llc,0.2263,An enhanced ETH pool with big downside protected,1609264054,1,1
6245,kmizbz,da_dreamerr,0.0,Greenpro CEO says firm will invest  million in bitcoin,1609263796,1,1
6246,kmizb5,pingpongplaya69420,0.0,Every day for XRP is Spain without the S,1609263795,5,1
6247,kmixds,BasicMiniTacos,0.0,Whats the Next Ripple,1609263633,0,1
6249,kmiuvi,ChinnyBeneath,0.4201,Kraken CEO Future is Extremely Bright for Ethereum and Investors Should Pay Attention,1609263409,49,1
6250,kmire4,samcornwell,0.0,Which nonBTC coin that existed prior to the  boom is closest to its ATH,1609263122,32,1
6251,kmiouk,industriousness,0.4404,Heres how to make your computer safe for crypto trading  Decrypt,1609262896,2,1
6253,kmio6s,doubled1c3,0.6369, Crypto Content Creators Youll Love,1609262839,0,1
6254,kmim9q,industriousness,-0.5994,XRPs Market Cap Fell  After SEC Lawsuit Heres How That Happened  Decrypt,1609262670,2,1
6259,kmieav,PsionicShift,0.0,Question on Beginning Crypto Investing,1609261988,0,1
6260,kmic0d,federisimo,0.0,Matt bitcoin Barkley of the Buffalo Bills has been trying to get paid in bitcoin for some time now He had his custom background made last week ,1609261786,0,1
6261,kmiba4,sylsau,0.8815,Buying Bitcoin Now at K Is Less Risky Than Buying Bitcoin When Its Price Was ,1609261726,76,1
6262,kmianf,pegcity,0.0,AMA Request That guy who turned  USD into over M USD with Ripple by ,1609261676,2,1
6265,kmi8fi,Eleskinex,0.0,Trading options on crypto,1609261489,0,1
6266,kmi7q3,SIXA_G37x,0.7003,Is OKEx a safe exchange I use Binance and Bittrex but am looking at something unavailable on there Thanks,1609261433,3,1
6267,kmi526,BlockBlanc,0.0,Crypto   meetup for beginners  Hong Kong Edition,1609261225,1,1
6268,kmi4r9,Fiach_Dubh,0.0,Kraken CEO Jesse Powell Live on Bloomberg Thinks Bitcoin Could Go to  Million over The Next Decade  Dec th ,1609261210,6,1
6269,kmi3lv,Antonio97x,0.8051,So glad XRP price is dumping so i can buy more XRP holders,1609261109,4,1
6273,kmi0su,SchmuW,0.7845,Looks like a good day to hodl,1609260857,8,1
6274,kmhzzf,inethereal,0.0,Looking for discussion of crypto tax strategies and avoiding US longterm capital gains taxes in ,1609260782,20,1
6275,kmhywb,bdkk52,0.0,NFL veteran Russell Okung will receive half of his  million salary in Bitcoin,1609260689,4,1
6277,kmhvja,Roy1984,0.3171,Why Bitcoin cannot be killed but can be crippled by the US Govt,1609260395,0,1
6278,kmhvj5,AntDoctor,-0.6204,KuCoin tries to bribe XRP bag holders so they can dump their own bags,1609260395,1,1
6281,kmhrzk,clfaccro,0.0,A LITTLE TOY Bitcoin info in one page,1609260082,0,1
6282,kmhqyq,industriousness,0.0,Litecoin Overtakes XRPs Market Cap As Price Slips to ,1609259995,9,1
6283,kmhq5i,Kris19275,0.4588,Looking for high volumelow fee exchange,1609259921,7,1
6284,kmhnfy,aras43,0.0,XRP price,1609259693,0,1
6285,kmhnc2,WinterPerception0,0.0,India eyes taxing Bitcoin transactions by ,1609259681,3,1
6287,kmhh6z,evanFFTF,-0.4588,Time is Short for Feedback on Invasive Cryptocurrency Surveillance Rules,1609259131,2,1
6288,kmhgoo,hollinger021,0.0,XRP decline,1609259087,0,1
6289,kmhfvj,I_snort_FUD,0.0,Litecoin officially moves past XRP as  nonstablecoin Crypto,1609259016,2,1
6290,kmhdya,MrRogCool,0.0,Change BTC to LTC,1609258846,0,1
6291,kmhd93,digiiital,-0.2263,Litecoin surpasses XRP in market cap amid Ripples SEC lawsuit,1609258780,3,1
6292,kmhd1k,robis87,0.2023,Miami Could Put   of Its Treasury Reserves Into Bitcoin Mayor Francis Suarez Alleges,1609258761,43,1
6293,kmhce9,cometothecaml,0.0,Litecoin has flipped XRP,1609258700,7,1
6297,kc2zcn,MammothSir9,-0.8074,Crypto Founder Faces  Years in Prison Over Millions of Dollars in Exit Scam Without Paying Taxes,1607828792,0,1
6300,kc2tem,coulsonlmd123,0.0,Vote with your btc,1607828156,5,1
6304,kc2n32,Fiach_Dubh,0.0, Trillion Fidelity Investments CEO Abigail Johnson on Bitcoin amp The Lightning Network  Dec th,1607827454,1,1
6305,kc2itk,patrickstar466,0.3612,Bitcoin newbie be like,1607826992,5,2
6306,kc2iqq,SerialMasticator,0.4215,Its easiest to stick to BTC and ETH,1607826984,16,1
6307,kc2i42,[deleted],0.4215,Its easiest to just stick to BTC and ETH,1607826919,2,1
6308,kc2e4p,matthewbarber87,-0.2577,SERIOUS Whats the point of crypto it its still so influenced by the US market and US Gov,1607826492,0,1
6309,kc1xxr,TheThinkerThaught,0.7184,Which crypto should i buy right now,1607824774,0,1
6310,kc1s5s,Saito720,0.0,Large or Massive BTC trades to USD Equivalent,1607824149,8,1
6313,kc1mj4,MACHOM3RCURY,0.2263,is crypto worth it,1607823558,0,1
6315,kc1d9j,vcazan,0.4939,Bitcoin price tracker Christmas tree ornament using WiFi to update in real time All I want for Christmas is Bitcoin Thanks uedwardianpug for posting your code the other day,1607822565,29,1
6316,kc1bxr,vcazan,0.4939,Bitcoin Christmas tree ornament with live price updated Price is in CAD Thanks uedwardianpug for posting your code the other day All I want for Christmas is Bitcoin,1607822435,0,1
6317,kc19pa,MambaM3ntality,0.0,Why DAI is the Holy Grail of Crypto,1607822198,0,1
6318,kc16rl,ajax2287,0.4215,Merit Cryptos,1607821900,0,1
6319,kc15gf,ModernRefrigerator,0.7184,When you buy Bitcoin on PayPal,1607821753,31,1
6323,kc0t73,FuckAntiMaskers,0.4588,Still cant bring myself to delete these alerts I set up around May yet   ,1607820507,8,1
6326,kc0n5l,crypto_on_watch,0.0,The next  months in XRP and major account re balancing,1607819905,0,1
6327,k41vn1,AutisticDalekOnSpeed,0.0,The future of gambling Hamsterpowered marble races come to Ethereum,1606761054,2,1
6329,k41uk6,GroovyGooseEgg,0.0,CoinZIR,1606760971,0,1
6331,k41n8j,Schapsouille,-0.6054,A whale gave no fucks and took profits k flash crash on Krakens xbtusd,1606760458,5,1
6332,k41lso,WaggishNickel,0.4588,Bitcoin just made a new all time high Heres what precipitated this event,1606760355,0,1
6333,k41jqv,Swimming_Hold_4863,-0.4588,Buying crypto at the peak and selling at the dip,1606760202,3,1
6337,k418lm,Romain_Jung,0.4588,Tezos Will Get Zcashs Privacy Features in Next Upgrade  Decrypt,1606759372,1,1
6338,k414zd,intothecryptoverse,-0.3818,Bitcoin The battle for k,1606759143,5,1
6342,k410y1,ngutheil,0.7184,Classic top setup Bitcoin price flash crashes on Kraken after alltime high,1606758849,2,1
6343,k410kh,ShotBot,-0.5994, year bear market overlayed on a Fibonacci spiral,1606758821,3,1
6344,k40zcc,blessive,0.4588,Bitcoin Breaks New AllTime Highs Targeting ,1606758737,0,1
6347,k40uq7,Oxygenjacket,-0.7506,The complete guide for avoiding being scammed by a phishing email,1606758402,2,1
6348,k40srd,gmz_88,0.0,The biggest news in crypto that nobody is talking about The US Gov is adopting stablecoins as part of their foreign policy,1606758254,3,1
6349,k40oe7,Jboi419,0.7184,Dont use PayPal to buy crypto,1606757936,0,1
6350,k40mp9,lutangclan1,-0.8271,Reminder New BTC ATH is super exciting for Crypto but remember to take profits and to be fearful when others are greedy,1606757814,0,1
6351,k40kir,Layupwithu,-0.5574,Did we all forget about Ethconnect huge scam,1606757663,19,1
6352,k40imn,loganjones44,0.5859,Bitcoin Mining Difficulty Reaches All Time High Levels as Price Goes Above k,1606757531,1,1
6353,k40ge4,digitalmoneyguru,0.0,History of Bitcoin,1606757367,0,1
6354,k40g6e,solitidute__,0.1027,Russia is set to legally recognize bitcoin,1606757355,16,1
6357,k406v1,20karaktererastesore,0.1531,After BTC and ETH am looking for another crypto to hold longterm Smart contracts  staking  low fees  monero privacy What do you suggest,1606756696,2,1
6358,k4033n,ethereumflow,0.6486,BTC hit a new CAD all time high of ,1606756397,2,1
6359,k3zxay,Plutusedge15,0.0,Eth ,1606755942,0,1
6360,k3zwet,mhucpr,0.0772,Lithuania tax authority sells seized digital currency for M,1606755873,0,1
6363,k3zq8k,em2391,0.0,BTC on Kraken from  to  in  minute,1606755422,19,1
6364,k3znxn,Plutusedge15,0.5719,Btc loves Yellen,1606755229,0,1
6367,k3zcpg,olihowells,0.0,BTC has finally escaped the earths atmosphere,1606754341,12,1
6368,k3zbbq,frankman2100,0.0,Will eth  genesis day be bullish,1606754227,0,1
6370,k3z7ph,sam_kaushik,0.6486,Bitcoin Explodes to Fresh AllTime High Heres What Could Come Next,1606753928,2,1
6371,k3z7hx,BonesSB,-0.0772,Serious How do large firms JPM Fidelity Grayscale etc store their crypto,1606753909,11,1
6372,k3z769,smou3lih,0.0,PayPal allows trading buying and selling through cryptocurrencies on its network,1606753885,2,1
6374,k3z6ah,salil19,0.34,Ethereum Gains Bullish Momentum Why ETH Could Retest ,1606753814,1,1
6375,k3z5m9,HashMoose,0.0,If a new ATH wont even get BTC to the front page of reddit what would,1606753761,142,1
6376,k3z5k2,SamsungGalaxyPlayer,0.6486,Megathread Bitcoin BTC hits all time high against USD according to several sources,1606753757,425,1
6377,k3z495,Fiach_Dubh,0.0258,Winklevoss Twins say Bitcoin will Disrupt Gold amp Could Reach  on CNBC  Nov th ,1606753648,1,1
6378,k3z0sr,olihowells,0.0516,Now BTC broke its all time high alts should follow,1606753363,12,1
6379,k3yxy0,olihowells,0.0,Bitcoin Crushes Previous AllTime Price Highs Surpassing s Bull Run  Market Updates Bitcoin News,1606753126,0,1
6380,k3yxri,devboricha,0.8074,Bitcoin hits record high of ,1606753113,0,1
6383,k3ywc6,olihowells,0.3182,Bitcoin hits new ATH on many exchanges,1606752990,0,1
6386,k3yrvz,robingo667,0.0,ZK International NASDAQ ZKIN joins forces with Dentoro to develop DeFi products for Ethereum,1606752609,1,1
6387,k3yq7o,traveladdikt,-0.4588,Is DeFi space a dumpster fire about to ravage the crypto space,1606752477,6,1
6389,k3yovj,MammothSir9,0.0,Bitcoin Crushes Previous AllTime Price Highs Surpassing s Bull Run,1606752368,0,1
6391,k3yl37,sylsau,-0.4019,Bitcoin Responds to the  Biggest Problems That Millions of People Are Experiencing Right Now,1606752098,8,1
6393,k3yig7,supared,0.6369,cheapest best descentralized exhange aggregator for eth to usdt,1606751896,0,1
6394,k3yf6c,usama745,0.5859,Now BTC is at  Wow ,1606751658,4,1
6395,k3ye6e,Salvatorigoozmo,0.6486,Bitcoin hits an alltime high of just under ,1606751583,0,1
6396,k3ydlr,blessive,0.0516,Bitcoin Just Broke The AllTime High Recorded In December ,1606751538,0,1
6397,k3yckh,da_dreamerr,0.8126,The research arm of New Yorkbased AllianceBernstein a global investment manager with  billion in assets under management has had a change of heart when it comes to bitcoin as an investment asset,1606751454,0,1
6398,k3ycg7,usama745,0.3182,OMG Bitcoin Hit  Bom,1606751444,0,1
6399,k3y8sd,anmolgaur45,0.6486,We did it Bitcoin has just hit a new all time high in binance,1606751130,3,1
6401,k3y80a,xanthopants,-0.5819,Still a totally lost noob,1606751065,0,1
6404,k3y5et,macdrai,0.7964,Easy money on this prediction market Will BTC break k before ,1606750860,0,1
6406,k3y3f6,Ikemen-1,0.0,Suggest me  coins,1606750698,0,1
6407,k3y1fs,JackButler2020,0.3182,Boom Did we hit it,1606750545,4,1
6408,k3xye9,Coin_Rabbit,0.3612,Why do crypto borrowers prefer to hodl their crypto,1606750281,0,1
6409,k3xy47,TR5_,0.2263,ETH Worth  Million Staked in Ethereum  Deposit Contract for Tomorrows Launch,1606750257,1,1
6410,k3xuzq,PAlove,0.3718,PayPals crypto move isnt perfect but it could help Bitcoin go mainstream,1606749999,3,1
6411,k3xuqb,ODready,0.4588,BTC all time high ladies and gentlemen,1606749977,2,1
6412,kb5yrk,LukaRosie,-0.4588,XRP dump after Snapshot,1607704020,0,1
6414,kb5wa7,that-crypto-dude,-0.4767,A Hypothetical Attack on the Bitcoin Codebase,1607703799,0,1
6415,kb5vr0,pale_blue_dots,0.8957,Billionaire Bond King Jeff Gundlach the economy is living off government rescues while hes neutral on Bitcoin which is a fascinating representation of animal spirits and speculation  Prediction in another month or two Gundlach will be buying BitcoinEthereum,1607703752,1,1
6419,kb5mev,reddittor,0.0,AOL was to Internet as PayPal is to Crypto,1607702942,21,1
6422,kb5l7x,BaldSoust,0.9606,The true wealth transfer would occur like this Huge corporates and wealthy people starts to buy bitcoin HARD pump it to M per btc and the satoshi just make it go poof with backdoor he implemented Thats all,1607702840,2,1
6424,kb5b8l,pale_blue_dots,0.9186,Millennials will boost Bitcoin and other cryptocurrencies adoption for years to come as the emerging market grows   Trillion Estimated to Be Coming Their Way From the Baby Boomers  Making Greatest Wealth Transfer In History and a Bright Future for Blockchain,1607701972,8,1
6427,kb50i4,bench4rench,0.4588,Zilliqa ZIL Breaks Out From LongTerm Resistance  TA  th of December,1607701026,1,1
6428,kb50h2,[deleted],0.0,Indiaampxs Banks Are Once More Serving Crypto Traders and Exchanges,1607701023,0,1
6431,kb4vs7,Shrabonk3534,0.296,ETF Ethereum bitcoin eth uniswap defi gem investing altcoins exchange money cryptocurrency trading investment decentralized,1607700602,0,1
6433,kb4na8,dannydorrito,0.0,Swedens government is considering the option of becoming a completely cashless society by adopting a digital currency the ekrona,1607699814,218,1
6435,kb4l18,DjackDjack,0.7184,The first ever noncustodial trading competition offers up to  in prizes,1607699601,2,1
6437,kb4ci1,Wilbeg,0.296,bitcoin bitcoinnews bitcoinexchange bitcointechnology bitcointrading bitcoinprice ethereum ethereumnews ethereumblockchain ethereumproject cryptocurrency blockchain trading crypto cryptocurrencies forex investment investing currency news money,1607698818,0,1
6440,kb3t9f,sylsau,-0.6249,Bitcoin Plunges to K  How Low Can Its Price Go,1607697029,16,1
6441,kb3pea,ramonvls926,0.34,Major Insurer Massmutual Invests  Million in Bitcoin for LongTerm Value  Bitcoin News,1607696652,0,1
6442,kb3hd5,TheWierdGuy,0.9001,Ether is a mixture of commodity currency bond and equity Imagine a owning a combination of gold money treasury notes and technology stock  when the market wakes up to this its going to be moon time,1607695864,61,1
6443,kb3f5j,ShotBot,0.0,Why Bitcoin Cash,1607695648,10,1
6444,kb3f49,pennystock2,0.802,Cryptocurrency Trading Tips Best Time To Invest in Crypto Currencies  The Top Coins,1607695645,2,1
6445,kb3ev4,Lumin8_Crypto,0.5267,CORRECTION  eToro Copy Trader XRP Airdrop and the  Gain,1607695620,1,1
6446,kb3e9r,MammothSir9,0.34,Major Insurer Massmutual Invests  Million in Bitcoin for LongTerm Value,1607695563,0,1
6447,kb37y7,pariswasnthome,-0.2263,Get your coins off the exchange Letter to secretary Mnuchin suggests US could restrict self custody of crypto assets,1607694977,25,1
6452,kb2z5o,cyger,-0.0258,Twitch Director Shaan Puri Moves  of Net Worth Into Bitcoin to Front Run Wave of Institutional Capital,1607694086,140,1
6453,kb2wae,SweetPie123,0.2263,Lil Yachty Launches Social Coin YACHTY Sells K Worth in  Minutes,1607693794,0,1
6454,kb2w9o,ax1g,-0.5994,Its starting  the slow painful trickle back down to k meanwhile everyone here is deluding themselves with dreams of it hitting k per coin The profits have already been made and cashed out time to reset,1607693792,8,1
6455,kb2q8t,cyger,0.0,Russian officials must disclose their crypto holdings by June ,1607693168,6,1
6459,kb27do,blessive,0.0,Russian president wants civil workers to report crypto holdings,1607691152,0,1
6460,kb24ee,Thavash,0.0,Bitcoin  Global Reserve Currency Confirmed,1607690820,2,1
6461,kb1why,blersion,-0.6908,Synthetix Price Prediction SNX is down  Further Losses Likely,1607689920,1,1
6463,kb1oqd,robis87,-0.836,Bitcoin Balance on Exchanges Falls to July  Lows Further Fueling Supply Crisis,1607689005,6,1
6464,kb1ojs,Optimal_Cantaloupe45,0.6289,Are you ready for tomorrows XRP utility fork Time to get your hands on SPARK,1607688983,0,1
6465,kb1mgp,HokkaidoNights,0.9349,Glad to see less BTC going to the moon posts  welcome to crypto enjoy the ride,1607688728,21,1
6468,kb1ifk,coingecko,0.3182,MassMutual has invested  million in Bitcoin for meaningful exposure,1607688246,1,1
6470,kb1d1y,Pulits12,0.0,Another One Insurance Giant MassMutual Jumps Into The Institutional Bitcoin Game With A Hulking M Investment  ZyCrypto,1607687605,0,1
6471,kb1cje,Eloise1988,0.0,Crypto PE,1607687538,0,1
6472,kb17qj,JustFoundItDudePT,-0.2617,What is wrong with Coinbase I know we are bearish but,1607686899,3,1
6475,kb13p9,Mrbitcoinnews22,0.0,Le premier FNB Ethereum au monde fait ses dbuts au Canada  avec un arrt de la ngociation,1607686354,0,1
6479,kb1012,Fiach_Dubh,0.0,Winklevoss Twins Talk Their Bitcoin Price Target amp Potential Stablecoin Regulation on CNBC  Dec th ,1607685855,2,1
6484,kb0n9e,Roy1984,0.0,Ether Insure Proven Product Enters DeFi Insurance,1607684108,0,1
6486,kb0lnt,bench4rench,-0.4215,XRP is Toxic Waste and Bitcoin Cash is a Pile of S Messari Report Says  CoinMarketCap,1607683874,3,1
6488,kb0duy,PJ83,0.0,Galaxy Digital led by Mike Novogratz invests in RedFOX Labs RFOX,1607682763,0,1
6489,kb0d4m,VSAlpha,0.3818,How can Pokket pay such high rates,1607682674,0,1
6491,kb0ao3,ymirmar,0.0,Insanely bullish Glassnode CTO predicts BTC price will X from here,1607682327,2,1
6495,ka7csh,ziggyzago,0.0,Will there be crypto robbery movies in the future,1607570219,2,1
6498,ka73e1,mrsotkogaming,-0.5423,JPMorgan Says Gold Will Suffer Because of Bitcoin,1607569270,6,1
6499,ka6s9u,Old-Percentage-6428,0.5493, k high but not extreme risk,1607568190,0,1
6500,ka6s3w,Throwawayiea,0.5622,CREATIVE I present to you The Kraken Ring offered for sale to Kraken CEO Jesse Powell  ETH USDT,1607568176,13,1
6501,ka6oem,BrandonZ0302,0.0,Movie based on darknet market Silk Road premiering in February,1607567803,5,1
6502,ka6ebd,DoubleFaulty1,0.4019,ProBlockchain Congressmen Ask SEC for Clarity on Crypto Custody,1607566810,2,1
6503,ka6c7f,BrandonZ0302,-0.0772,Bitstamp apologizes after posting report calling XRP toxic waste,1607566595,7,1
6505,ka622o,YangGangBangarang,0.0,In  years Grayscale will OWN not be a custodian of half of the Crypto that they currently manage,1607565628,137,1
6510,ka5ld3,w3llFukM35id3w4y5,0.4588,Crypto shouldnt be regulated too much says New Yorks top financial regulator Linda Lacewell,1607564042,11,1
6512,ka5cv4,Helmetowi,0.4588,Top  Altcoins That WILL x in   Cryptocurrency Trading amp Investing  Thoughts  ,1607563204,18,1
6513,ka5cla,Gh0sta,0.0,The Ether Fund by iqcorp will list on the Toronto Stock Exchange QETH tomorrow morning,1607563176,4,1
6514,ka5bul,jsells39,-0.5423,Coinbase down yet again Seems like it goes down every other day now,1607563100,4,1
6516,ka57iq,CryptoEllisYT,0.0,Where will the Cryptocurrency Market go next here is my opinion,1607562667,1,1
6518,ka53vh,ilflores,0.2263,BBVA bank will allow its clients to sellbuy and custody of bitcoins from January  via its Swiss subsidiary,1607562307,1,1
6519,ka51au,patrickstar466,0.0,Morgan Stanley Exec Makes The Case for Bitcoin to Become Global Reserve Currency,1607562049,39,1
6520,ka4zw5,ScarcityHairy2306,0.0,To all the scammers than contact me on Reddit,1607561918,0,1
6524,ka4ndh,intothecryptoverse,0.0772,Ethereum Q approaches  Heres what we want to see,1607560756,2,1
6525,ka4gds,Cris850,0.0,PC does not recognize gpus in risers only works in pcie slots,1607560107,0,1
6527,ka47dp,OneBlockAwayICO,0.0,Venezuela Evades Sanctions Pays allied countries in Bitcoin,1607559268,0,1
6529,ka40f3,mreed911,0.0,Cocoricos EGG announces a pushback of their coin listing date offers longer presale NOT A SHILL,1607558656,0,1
6532,ka3vfe,Rizvi30,0.2263, worth of Crypto Band,1607558215,0,1
6533,ka3sk6,blessive,-0.4939,Former bitcoin sceptic Ray Dalio expresses how BTC could provide protection against collapsing Fiat currency,1607557951,0,1
6536,ka3k53,Anoxie,0.0,Crypto Startup Investments,1607557149,0,1
6538,ka3g1z,Plutusedge15,0.0,Bitpay to files to become a bank,1607556775,1,1
6539,ka3f0q,pale_blue_dots,0.7184,So whats everyones opinion on the Moons implementation and integration now that its been a few months,1607556676,22,1
6541,ka31r6,GloriousGibbons,0.0,Fidelity Digital to Hold Bitcoin as Collateral for Cash Loans,1607555457,0,1
6545,ka2jrm,ChieftainBob,0.0,XRP and Coinbase question,1607553862,1,1
6546,ka2e8e,satoshinakamoto7,0.0,Paxos Becomes Latest Crypto Firm to File for Federal Bank Charter,1607553384,0,1
6548,ka27v0,cryptoxyz,-0.4019,Chainlink amp The World Economic Forum release a paper on standardizing oracles and bringing interoperability to blockchains and legacy systems,1607552807,2,1
6549,ka250o,mohiemen,0.4588,Bitcoin could go above  chart suggests,1607552535,17,1
6551,ka21la,BanklessHQ,0.5994,The Bull Case for Decentralized Index Funds,1607552228,0,1
6552,ka1ze9,jkonreddit,0.4588,Steve Wozniaks WOZX up  in two days Debuted at  and currently trading at  on Bithumb Global,1607552039,24,1
6554,k7804a,DankestDaddy69,0.0,This week in the world of crypto,1607176999,0,1
6555,k77ys2,phil100188,0.3612,Which crypto ATM is would you recommend,1607176863,0,1
6557,k77wa2,taytay1001,0.3612,Are there any easy onlinejobs that pay out crypto,1607176626,0,1
6558,k77mxi,fallenkeith2018,0.2023,There are alot of new investors coming to crypto  Make sure to stay safe and be careful of scams,1607175573,13,3
6559,k77lvn,Stealthex_io,0.2732,Ethereum gt Everything,1607175456,5,1
6561,k77kj9,TheCryptoDeity,0.0,Hello do you have a moment to talk about the gospel of the bitcoins,1607175299,146,4
6562,k77c0w,Rudivb,0.0,Bitcoin train is leaving,1607174323,11,3
6564,k775hx,MammothSir9,0.4019,Microstrategy Buys More Bitcoin Now Holding BTC Worth Over  Million in Treasury,1607173569,0,1
6568,k76wgg,SweetPie123,0.0,Ripple sells MoneyGram stock for  million,1607172502,0,2
6569,k76mu0,aminok,0.0,Radicle A peertopeer alternative to GitHub with Ethereum integration,1607171248,10,2
6571,k76kbj,harlsey,0.296,What is the main way you guys make money through crypto,1607170913,70,0
6572,k76k35,DivideWarm,-0.4748,i wanted to stake ethereum myself but there is a lot more risk involved then I considered this blog helped me alot with my research,1607170883,2,1
6574,k76ax5,arthur_fissure,0.0,Trading crypto the last couple of days,1607169656,14,6
6576,k769sn,Sastroprawiro,0.0,Step into crypto in January ,1607169505,14,2
6577,k768zd,Pulits12,0.0,Extremely bullish for Bitcoin MicroStrategy buys BTC again at ,1607169392,2,1
6578,k75yym,Mrbitcoinnews22,-0.4939,La hausse des prix du Bitcoin est menace alors que lor et le dollar amricain montrent des signes de reprise,1607167952,0,1
6579,k75yqj,nlrol,0.0,General questions about buying and selling alt coins,1607167918,0,1
6580,k75yi6,P00PB0YY,0.0,Bloomberg Analysts Bitcoin at K as Total Crypto Market Cap to Grow to  Trillion in ,1607167887,8,3
6582,k75tsv,jamespunk,0.8625,Been Buying Bitcoin monthly for the past  years this is my get rich slowly scheme,1607167247,0,1
6585,k75mrz,mariebilgera,0.3182,New to Ethereum Learn more about Yield farming to further increase your returns,1607166215,0,2
6591,k75iaq,Pulits12,0.0,Ripple cofounder Jed McCaleb intensifies XRP sales as the price slumps under ,1607165557,10,1
6596,k7507x,MammothSir9,0.3182,Darknet Market Crypto Revenues Hit AllTime Highs in ,1607162790,0,1
6599,k74tup,Laughingboy14,0.7184,Grayscale Bought Almost  Million in BTC in  Hours,1607161812,5,1
6605,k74jei,WorkbyH,0.0,CryptoTab,1607160105,0,1
6609,k74csw,saberstormx,0.8402,Moon farmers waking up on a Saturday,1607159033,9,5
6610,k74cki,beemerteam,0.0,Vectorspace AI Datasets ABT Crypto AMA Ask Me Anything,1607159000,0,1
6611,k74bj8,Monster_Chief17,0.6541,It works both ways but only if you HODL,1607158842,11,15
6612,k748z7,BrandonZ0302,0.0,MicroStrategy Buys Another  Million in Bitcoin,1607158432,8,3
6614,k746i3,[deleted],0.0,World of cryptocurrencies has changed India must rethink about its bitcoin rules,1607158034,0,1
6615,k744hu,[deleted],0.0,A summary of my time in Crypto,1607157737,0,1
6616,k7436w,1minutebitcoin,0.0,Bitcoin  Boom of Bust some of the most famous people talking about Bitcoin can you spot the difference,1607157518,4,0
6618,k73xj3,WinterPerception0,0.0,Spotify hiring people for crypto payments Facebooks Diem included,1607156652,0,1
6619,k73wt1,[deleted],0.0,British Politician Nigel Farage Says Bitcoin Is the Ultimate AntiLockdown Investment,1607156543,2,0
6625,k73imn,[deleted],0.3612, facts about Bitcoin In light of recent events Id like to say NotYourKeys NotYourFunds,1607154393,0,1
6626,k73h4f,purplebird99,0.0,staking coins on ledger nano,1607154169,0,1
6628,k73blg,Joe-M-4,-0.296,Andreas Antonopoulos how to avoid excessive fees on Bitcoin,1607153330,3,2
6629,k736zo,crypto_grandma,0.8126,How it feels seeing friends colleagues and old flames after Bitcoin hits a new all time high,1607152628,26,6
6631,k735lx,sriniramani,0.0,On ZLF Crypto on NoleX and Bololex,1607152419,0,1
6632,k734yd,totatree,0.128,Digital Currency Is in Congress Annual Defense Bill,1607152325,1,4
6633,k733b1,CutySugan,0.7096,Does holding ZAP is good for long time investment,1607152088,0,1
6635,k98dtp,BardCookie,0.0859,Wells Fargo Bitcoin and Other Cryptocurrencies Are Not A Fad,1607447996,1,1
6637,k988c5,Pulits12,0.0,Janet Yellen and the Fed Will Continue to Push Bitcoin to New Highs in the Next  Years,1607447537,23,1
6638,k986kw,TobiHovey,0.0859,Wells Fargo Bitcoin and Other Cryptocurrencies Are No Fad,1607447392,8,1
6639,k985mn,BrandonZ0302,0.4588,Ethereum  Beacon Chain may speed up enterprise blockchain adoption,1607447315,0,1
6646,k97mpf,IWriteCrypto,0.0,Gamers Millennials Far Ahead of the Bitcoin Learning Curve Says Study,1607445776,9,1
6649,k97eo1,pale_blue_dots,0.7717,Wells Fargo published a sevenpage investment report devoting a full page to bitcoin Cryptocurrency investing is a bit like living in the early days of the s gold rush As we roll into  well be discussing the digitalasset space more  its upside and downside,1607445108,34,1
