Unnamed: 0,id,author,vader,title,created_utc,num_comments,score
4204,ki9nhw,Razer443,0.0,Litecoin price predictions news ,1608657698,0,1
4206,ki9kbu,manhar2108,0.6833,XRP partners with SEC this bull market Bullish move,1608657435,4,1
4207,ki9hzc,Roy1984,0.4404,Participation in Ethereum  was much better than we expected,1608657248,0,1
4208,ki9dz0,[deleted],0.4588,Whales Shift  in Bitcoin as BTC Is Back Above ,1608656901,0,1
4209,ki9dos,madfires,-0.6249,Bitcoins Liquidity is Vanishing From Exchanges and Supply Crisis is Near Bullish for BTC Price,1608656877,25,1
4211,kisber,salil19,0.0,GrayScale Buys  Million Bitcoin,1608727015,0,1
4212,kis8iq,fallopiantubediver69,-0.4588,Aussie Coin base user trying to withdraw bitcoin profits,1608726646,0,1
4213,kis7b2,SweetPie123,0.4588,Number of active BTC addresses saw a  upswing in ,1608726486,14,1
4214,kis5rk,niloc_w,0.0,Five Charts That Tell the Story of  in Crypto  Andreessen Horowitz,1608726281,0,1
4215,kis0i9,bitcoinr0x,0.3182,XRP holders please read this,1608725649,5,1
4216,kirzvx,theShhepherd,0.9313,A friend got into crypto during XRPs run to  cents amp was like I cant wait to be rich when it hits  Lol he has no idea Im trading against him Shorting XRP looks great w this huge double bottom if their problems continue,1608725576,5,1
4217,kirzmt,bitcoinr0x,0.3182,XRP Holders please read this,1608725544,0,1
4220,kirn42,AntDoctor,0.0,XRP removed from coinbase home page,1608724011,3,1
4222,kirk18,JMoyer811,-0.0258,Just received this email after the Ledger hack  Be safe out there,1608723607,128,1
4223,kirgt4,Mrbitcoinnews22,0.0,Le fonds SkyBridge BTC de Scaramucci est lanc avec un investissement de  millions de dollars,1608723158,0,1
4224,kirfp2,Murky_Lobster_756,0.4939,XLM following XRP Anyone care to explain why,1608722992,2,1
4225,kirfh4,DoubleFaulty1,0.0,Several exchanges have already delisted XRP,1608722961,2,1
4226,kirejs,Gamerboy9809,0.0,What crytocurrency is this and how can I convert it to other cryptos,1608722825,3,1
4228,kirdqa,elubwea,-0.7184,Samsung galaxy watch faces sold as NFTs,1608722701,0,1
4229,kirckg,ramonvls926,0.2263,An Unknown User Incurs More Than  in Transaction Fees When Sending BTC Worth   Blockchain Bitcoin News,1608722541,12,1
4231,kir7l7,Sxlcosta,0.7845,Is it worth buying XRP now,1608721801,0,1
4232,kir6rm,robis87,0.0258,Just in Fidelity Backed OSL Suspends All XRP Trading and Payment Services,1608721690,3,1
4233,kir68d,jhutto2,0.0,FinCEN Introduces Proposed Crypto Reporting Requirements,1608721605,0,1
4234,kir5a2,StrongPlate,0.7814,Christmas carnage on shitcoins Almost every crypto is down but still market is up by  and all thanks to bitcoin,1608721466,0,1
4235,kir4pa,dogenoob1,0.4588,How do alt coins blowing up work,1608721390,47,1
4237,kir2b9,SamZFury,0.0,Major Development Hong Kong exchange suspends XRP trading,1608721067,3,1
4238,kir1yl,Offica_Farva,0.5423,Merry Xmas XRP Army,1608721010,6,1
4239,kir0pr,ElegantBasil6588,-0.4767,Whats wrong with XRP ,1608720812,0,1
4240,kiqzy0,BigPump_Signal,0.6249,JOIN IN CRYPTO PUMPS,1608720704,0,1
4241,kiqyoc,kaliki07,0.0,XRP going upaaaand its gonesued,1608720517,0,1
4242,kiqwgc,Roy1984,0.0,Tyler Winklevoss New US B COVID Stimulus Bill Is Advertisement for Bitcoin,1608720193,10,1
4244,kiqtpn,Aldennnnnnnn,-0.5994,Cryptocurrency XRP plunges  after SEC files lawsuit against Ripple,1608719794,0,1
4247,kiqqip,Aldennnnnnnn,-0.6249,Cryptocurrency XRP tumbles per cent after US SEC charges Ripple,1608719330,1,1
4248,kiqqa1,agentdanascullyx,0.4767,Trading at  Premium New Crypto Fund Astounds Even Bulls,1608719297,0,1
4249,kiqpag,2tidderevoli,0.2263,A reporter spent  bitcoins on a sushi dinner for dozens of strangers in  Those coins are worth  today,1608719149,1,1
4250,kiqp59,Isha_gupta111,0.0,Isha Gupta on LinkedIn bitcoin cryptocurrency buyucoin,1608719127,0,1
4251,kiqjau,therewasguy,0.0,Bestsafest crypto websites for trade and staking longterm ,1608718300,2,1
4253,kiqim9,tweetytooo,-0.6124,Ripple scam whitelist to get XRP from reserve escrow,1608718208,5,1
4254,kiqgtw,MammothSir9,0.2263,An Unknown User Incurs More Than  in Transaction Fees When Sending BTC Worth ,1608717970,0,1
4255,kiqgpp,aimhelix,-0.2584,Ripple CEO  reasons XRP token is not a security,1608717952,5,1
4257,kiq5qf,gobsmacked-8-,0.8807,Best time of dayweek to buy Bitcoin,1608716350,0,1
4259,kiq3ix,vinyarb,0.0,Cathie Wood and her  BTC price target,1608716022,3,1
4260,kipxjg,HansLanghans,-0.4588,XRP Selloff Intensifies as Industry Leaders Lament Ripple Demise,1608715124,1,1
4261,kipxd6,aleskalberry,0.0,What do I do if SEC sues XRP Will I be able to sue them too,1608715095,0,1
4262,kipx38,poorgirl27,0.7845,Are my ripple coins I bought years ago worth nothing,1608715054,0,1
4263,kipwkz,thepositiv1,-0.7184,Time to sell XRP,1608714980,2,1
4265,kipvkd,bench4rench,-0.4019,Famous Investor Says Utterly Illogical Bitcoin Will Go to Zero  and Reveals His Problem with Crypto  CoinMarketCap,1608714819,2,1
4266,kipv05,DarkestChaos,0.0,Market Trends Gold Silver Crypto Real Estate and More In  amp Beyond LIVE w Kenneth Ameduri,1608714738,0,1
4267,kips2s,SweetPie123,-0.296,Ripple CEO Garlinghouse responds to SEC complaint against XRP,1608714326,2,1
4268,kipry3,ares_abi,0.8316,Todays Buy Opportunity Ripple XRP,1608714305,2,1
4269,kippmo,TheL0ngGame,-0.4588,Me in the comments arguing about whether XRP is garbage  month ago,1608713992,2,1
4270,kiploe,KrysBezel,-0.2263,SEC Files  Billion Lawsuit against XRP Creator Ripple,1608713383,1,1
4272,kip6lj,kodi_saltstorm,0.0,XRP versus XLM regarding the sue of the SEC,1608711153,3,1
4276,kip3mn,Vulk4r1e,0.128,Why its hard to buy low and sell high,1608710724,2,1
4277,kip2hv,Crypto_push,0.4404,How Crypto Regulation in USA could be better under Biden Than Trump,1608710575,2,1
4279,kiozxp,sylsau,0.296,Bitcoin Will Replace the US Dollar As the Symbol of Money for the Alpha Generation,1608710232,4,1
4280,kioyzv,shubham412302,0.6597,Can someone recommend me a good decentralised cloud storage based on crypto,1608710080,2,1
4284,kiomvy,TysonSanXf,-0.2263,How Does the SECs Lawsuit against Ripple Affect the Crypto Sector,1608708447,32,1
4285,kioj74,DimaDaDeala,0.0,Crypto Newb here  Need some starting advice,1608707977,0,1
4286,kiog0r,JJslo,0.0,I think XRP fanatics should read Alamut by Vladimir Bartol,1608707554,36,1
4287,kiodtp,blockchain92400,0.0,What will happen to xrp when it will be de listed from Crypto hedge funds,1608707272,0,1
4288,keeclg,Fiach_Dubh,0.4588,Michael Novogratz on Bitcoin New All Time High Over  and launch of Bitcoin Fund BTCGU  Dec th ,1608142073,2,1
4289,keebp6,RyanKar14,0.0,This was legit me this morning watching us smash that ATH,1608141994,5,1
4291,keebca,MammothSir9,0.0,Snowden Reacts to Bitcoins New Price Milestone  Whistleblower Tweets One word Bitcoin,1608141963,0,1
4293,keea53,UKBrad,0.0,ALTS or BITCOIN,1608141865,0,1
4294,kee9rc,digitalmoneyguru,0.6597,Just appreciating this work of art Thank you Bitcoin for existing,1608141834,3,1
4295,kee994,TopThingsToKnow,0.0,COV Price Forecast  Covesting Price Prediction ,1608141795,2,1
4296,kee6wa,GloriousGibbons,0.0258,UK Firm Ruffer Piles  Million into Bitcoin in Defensive Move,1608141613,0,1
4297,kee5m0,SwagtimusPrime,0.0,CME Group announces Ethereum futures product,1608141510,3,1
4299,kedy0z,HashMoose,0.2263,Hedge Fund One River to Hold  Billion Worth of Bitcoin and Ethereum in ,1608140897,8,1
4301,kedup0,chelseaa2705,0.4404,Faucet for ZEC  a for DOGE easy just claim everyday,1608140619,2,1
4302,kedt7i,YoungCrispy,0.0,New Crypto with Potential,1608140501,0,1
4303,kedt3b,BanklessHQ,0.4404, Bull Run Tax Tips for ,1608140491,2,1
4304,kedltn,pyrax69,-0.2732,The Great Australian Crypto Exchange Scam  Qoin BTX Exchange Market Rigging Manipulation Maintained Inflated Price,1608139889,0,1
4305,kedjx4,tempMonero123,0.2023,Cool visualization of Bitcoin unconfirmed transactions,1608139725,3,1
4306,kedib4,Ok-Counter4002,-0.4215,Scam alert,1608139585,0,1
4309,ked34s,patrickstar466,0.0,One River Digital Pledges  Billion In Bitcoin BTC and Ether ETH By Early ,1608138307,0,1
4312,kecv52,Agusmac,-0.7184,Should i sell my ethereum for bitcointemporarily,1608137645,2,1
4313,kecun9,Techoverthemoon,0.0,Galaxy BTC fund in Canada has raised US million Lets go,1608137603,1,1
4314,kect89,VampireVlad,0.2023,No  Bitcoin AllTime High Until ,1608137484,3,1
4316,kecp83,jimboman213,0.2023,Passive income from my crypto savings,1608137148,0,1
4318,kecmjm,Moistcrumpetjuice,0.34,How come my portfolio value isnt updating on lever live Its showing prices from Dec th,1608136934,0,1
4320,keckw9,xR4E,0.9001,Is there any difference between buying Crypto A or buying Crypto B and exchange it for Crypto A,1608136789,4,1
4321,kecj7m,cryptobriefing,-0.4215,Binance Coinbase Crashed After Bitcoin Broke ,1608136648,115,2
4322,kecilc,stake_pool,0.7096,This sums it up nicely,1608136597,2,1
4323,kecidu,tarded_moonboi,0.5994,Massive Bull Case,1608136580,4,1
4324,keci8z,satoshinakamoto7,0.0,CME Group announces Ethereum futures,1608136567,1,1
4325,kech02,BardCookie,0.0,Ethereum smashes past  as CME unveils ETH futures product,1608136464,1,1
4329,kecd8k,CryptoElite9,0.296,Bitcoin The End Of Money As We Know It,1608136151,0,1
4331,kec9sh,robis87,0.0258,Another Bitcoin Whale Surfaces With  Billion and Alan Howards Backing There is going to be a generational allocation the flows have only just begun,1608135868,6,1
4332,kec9g7,Roy1984,0.4019,Proposal to reduce the special membership price to  moonmonth,1608135837,17,1
4333,kec83a,ramonvls926,0.6486,Market Update Bitcoin Price Hits New AllTime High Over k  Market Updates Bitcoin News,1608135729,0,1
4334,kec5w8,WaggishNickel,-0.4404,Bitcoin reaches  as the cryptos supply and demand shock begins to materialise,1608135539,9,1
4335,kec5my,TrentonJ,0.25,When Crypto is skyrocketing at an all time high but you have  XRP,1608135515,3,1
4336,kec424,zakoal,0.368,A  Billion Dollar Injection is Coming for Bitcoin  Says JP Morgan,1608135378,7,1
4337,kec0z3,Casta37,0.7845,Daily reminder to buy high and sell low guys To the moon,1608135109,0,1
4338,kec065,clogsroofer,0.4149,Stacking low amount of ETH why is APY so high,1608135035,4,1
4339,kebxb7,MammothSir9,0.6486,Market Update Bitcoin Price Hits New AllTime High Over k,1608134788,0,1
4340,kebx5o,manhar2108,0.8658,Time to call those who laughed when we said k was possible How are you celebrating,1608134775,14,1
4341,kebvek,TopThingsToKnow,0.4019,BTC Reached ATH Over  Can Bitcoin hit  today,1608134621,2,1
4343,kebsay,Casta37,0.0,New ATH HODLers vs newcomers,1608134367,4,1
4344,kebrq2,IvanKorGreatML,0.0,Ask What does the bitcoin community need,1608134315,0,1
4348,kebn98,Roy1984,0.0,Bitcoin Just Smashed Through Whats Next,1608133909,7,1
4349,kebmvx,Majestic-Proof-2437,0.0,AURON coin  Hybrid DeFi and CeFi,1608133873,0,1
4353,kebevm,annoyinglilbrother,-0.4588,Coinbase is down,1608133146,0,1
4354,kebe3s,Fiach_Dubh,0.0,Charles Schwab VP of Trading and Derivatives Randy Frederick on Bitcoin  Dec th ,1608133075,3,1
4356,keb528,PixelRouter,0.1531,Its Here TRADE Closed Alpha Invite Crypto Trading Game with  Real order book data Live Trading Soon,1608132226,1,1
4357,keb3lq,TheWierdGuy,0.7351,The best way to convince your parents to invest  of their portfolios in crypto is to tell them to invest ,1608132088,58,1
4358,keb35o,akrishna1,0.0,Bitcoin k ,1608132047,5,1
4359,keb0zk,Nexy007,0.0, Bancor is the  Trending Coin on LunarCrush  Spread the word,1608131832,0,1
4363,keavks,dannydorrito,0.8658,New B Fund Created to Buy BTC With Support from One River CEO amp Alan Howard,1608131320,0,1
4364,keauzw,pale_blue_dots,0.8481,Fair Isaac Corporation or FICO  of credit score notoriety  has teamed up with Bitfury Group to create a cryptocurrency risk assessment solution for financial institutions,1608131268,1,1
4371,keu3ym,sylsau,0.0,The Floodgates Are Now Open for Bitcoin,1608196285,3,1
4372,keu3w4,DrippinMonkeyButt,0.3182,BTC Hit  k Got my Lambo,1608196275,4,3
4373,keu3u1,zerohalo,0.7184,Bitcoin Price up  in last  hrs Above K Why Rally Isnt Over Yet,1608196266,8,2
4376,keu0o6,robis87,-0.25,Bitcoin shortage as Wall Street FOMO turns BTC whales into plankton,1608195807,3,3
4377,kettdo,Johndrc,0.0,Bitcoin will surpass Visa then Warren Seashells,1608194748,4,1
4381,keth8r,mofoss,-0.3089,Bitcoin leading the current trends  are you not entertained,1608193040,4,1
4383,ket8sy,StrongPlate,-0.5267,Luke noob insulting bitcoin while BAT shitcoin still sucking,1608191871,0,1
4386,keswqz,Hensiey,0.4588,Fund Managers Long Bitcoin While Shorting the US Dollar Survey Says,1608190277,2,1
4387,kessze,xerxes7777,-0.6908,Man who accidentally threw away bitcoin is probably in even deeper pain now that Bitcoin is around k He wouldve had  Million had he not thrown them away,1608189782,173,0
4388,kesny8,Swimming_Hold_4863,0.0258,Bitcoin hodlers when the price reach k,1608189126,2,1
4389,keslai,JustNat_Bros_RSA,0.0,Crypto currency fees,1608188775,0,1
4390,keseqv,blessive,0.4588,While Bitcoin topped when the CME released BTC futures Ethereum futures are bullish,1608187945,0,1
4391,kesebj,salil19,0.34,Gold Naysayer Turns To Bitcoin Overpriced Model Says Max Value K BTC,1608187898,4,0
4392,kescwy,Revolutionary-Ad3977,0.6369,Cryptocurrency market Analyse the best digital currencies,1608187716,0,1
4397,kerudb,Mercy-david,0.4404,Develop profitable Bitcoin mining bot,1608185420,2,1
4399,kersh6,MammothSir9,0.3182,M Bitcoin and the Promise of Scarcity,1608185195,2,1
4402,kerql3,Remarkable3897,0.4588,Why ETF BITW has gone  up,1608184975,0,1
4404,kerlyd,MCZorba,0.0,Litecoin vs other coins going into ,1608184449,0,1
4406,keriv8,[deleted],0.0,BTC The King,1608184093,6,1
4407,keribs,jhutto2,0.7269,Asian markets linger at record highs as US closes in on Covid relief deal,1608184027,0,1
4408,kerfbb,birdbamboo,0.0,Bitcoin has surpassed  for a brief moment on Coinmarketcap,1608183687,4,0
4409,ker517,baileyy0,0.7184,When to buy more,1608182542,0,1
4411,keqxjx,GoodmanSimon,0.4588,A coin for the medium to long term,1608181718,92,2
4415,keqiyk,[deleted],0.0,Crypto ,1608180177,0,1
4416,keqisd,Lawman2036,-0.1531,Good trailing stop loss for Bitcoin and Ether,1608180160,0,1
4419,keq977,wagnertamanaha,0.34,An amazing year for Bitcoin but not for the reason you think,1608179180,3,0
4422,keq213,RFV1985,0.7602,Moons are getting no love in the bull market,1608178438,20,1
4423,kepxb2,mrsotkogaming,0.3612,Bitcoin At  With Huge Institutional Demand Growing Daily,1608177970,4,3
4425,keptjp,VancityBash,0.0,Whats your crypto,1608177619,0,1
4426,kepsyb,StingerMcGee,0.8442,BBC News  Bitcoin hits alltime high reaching above ,1608177548,3,2
4427,kepg3b,SIBEX_Trade,-0.4215,Bitcoin broke  Whats next,1608176261,6,2
4428,kepezz,RangeFrequent,0.6369,Best crypto,1608176160,0,1
4431,kep7so,innocent117,0.0,Market cycle study  Where do you think we are,1608175466,6,2
4432,kep502,[deleted],0.0,A market cycle survey  What do you think,1608175203,4,2
4435,kep22d,totophe1077,0.4588,As we break k D,1608174925,2,4
4437,keoxur,[deleted],0.4588,Why pick up ethereum,1608174498,0,1
4438,keowm3,Saito720,0.0,Question on Bitcoin Price,1608174378,25,0
4440,keorwn,fallenkeith2018,0.7184,This family traded all their gold for bitcoin in  That bet has nearly tripled as bitcoin breaks above ,1608173935,3,3
4442,keopos,sivesta2,0.0,How to claim BCH NODE amp BCH ABC from Coinomi ,1608173723,0,1
4443,keoowg,[deleted],0.4588,What BlTCOlN went through to break out to a new ATH,1608173655,4,3
4444,keonf4,[deleted],0.0,Currently Streaming Here on Reddit,1608173524,0,1
4447,keojmp,DarkestChaos,0.7739,BITCOIN BREAKS   New All Time High Price Cryptocurrency News December  ,1608173169,2,0
4450,keod0v,normcrypto,0.0258,All Aboard the Billionaires Bitcoin Bandwagon,1608172610,10,1
4453,keo0m0,sushiiallday,0.8807,Best song for this moon run,1608171472,4,0
4456,kfdi1g,SnooGiraffes1305,0.0,Crypto Information,1608263540,0,1
4457,kfdi08,blessive,-0.0258,XRP Primed for Correction if Crucial Support Fails,1608263536,0,1
4459,kfddxt,Think-notlikedasheep,0.4019,Paypal is offering  for buying  of cryptocurrencies with a major catch,1608263122,21,4
4461,kfdalq,UBCStudent9929,0.4588,Ehm Top,1608262793,2,1
4462,kfd9h6,stokednsteezy,-0.7506,CORRECT ME IF IM UNINFORMED BUT DID COMPOUND JUST STEAL RIPPLES THUNDER HERE Compounds New Blockchain Readies DeFi for Central Bank Digital Currencies,1608262679,16,2
4463,kfd492,O3Labs,0.0,O Live   Ethereum Edition with our Communications Director,1608262159,0,1
4467,kfcwt3,waltzing07,-0.1531,Crypto  Rebel Cow News,1608261392,0,1
4469,kfcr9j,GeniusUnleashed,0.0,Wrote a pilot revolving around crypto,1608260823,4,1
4470,kfcqq9,MammothSir9,0.0,QE Infinity US Fed to Keep Rates at Zero BillionDollar Bond Purchases Until Economy Recovers,1608260769,0,1
4471,kfcq7p,Snoutysensations,0.0,NY Times covering crypto in Style section My  Sushi Dinner,1608260717,2,1
4472,kfcoa6,[deleted],0.4588,Chinese state TV covers Bitcoin pushing  above ,1608260528,2,0
4476,kfcbws,Medical_Scallion7450,0.296,Fastest way I found to make money,1608259276,0,1
4477,kfcaso,WhatAnEpicTurtle,0.8908,First time investor here  I just bought  of Bitcoin and within two minutes I am already in the green Im so excited,1608259166,2,1
4480,kfc3u1,[deleted],0.3182,Hoodie shop that accepts Crypto,1608258486,0,1
4481,kfbr53,MammothSir9,-0.5106,Coinbase Files Paperwork With SEC to Launch Public Offering,1608257185,0,1
4484,kfblhz,Fresh_chickented,0.2263,Buy high Sell low,1608256656,8,3
4485,kfbjze,Crypto4Canadians,0.0,How to Cash Crypto Out in Canada With Newton,1608256495,6,2
4486,kfbijf,blessive,0.0,Bitcoin price prediction BTC to move towards  next analyst,1608256345,0,1
4487,kfbcxl,GWtech,0.9001,Does this price rise seems to be similar to the very beginning of the previous rise from  to  except this started at  Also the google search trend have not yet begun to rise Could that possibly indicate it is not yet recognized by the masses and perhaps early in the rise,1608255780,30,5
4488,kfbcdt,BrandonZ0302,0.0,MoneyGram CEO Says Their Partnership With Ripple Is Pushing Boundaries,1608255721,7,8
4489,kfbalr,BardCookie,0.34,Megan Thee Stallion Is Giving Out Bitcoin on Twitter  Katy Perry pt,1608255536,8,0
4490,kfb9le,ShotBot,0.3744,Bitcoin is more religion than solution says billionaire Mark Cuban,1608255425,148,9
4492,kfb2ww,SweetPie123,0.0,Kim Dotcom throws weight behind BCH tips K price in ,1608254744,45,3
4493,kfauh0,solitidute__,0.0,The state of bitcoin,1608253925,2,1
4494,kfaskv,ShotBot,0.3182,Barstool Sports Dave Portnoy Knew Bitcoin Would Hit ,1608253742,4,3
4495,kfaijp,Iamahighlighter012,0.2382,My dad is older What are the best bullet pointsways to explain to him the worth of investing in Bitcoin He is interested but skeptical,1608252783,28,2
4497,kfa7xb,AustinH_34,0.0,Crypto books,1608251792,0,1
4499,kf9uqu,triviumfan4ever93,0.0,For a bitcoin what are your target price projections,1608250561,0,1
4502,kf9oes,gamerr023456,0.0,New mobile crypto out guys,1608249962,0,1
4503,kf9nha,HoonCackles,0.0,Could CME Ether Futures result in more sellpressure from shortseller whales article about BTC Futures listing seems relevant,1608249878,17,3
4504,kf9k60,dms2701,0.0,Entering the world of Crypto,1608249594,14,1
4505,kf9jg3,Themanimnot,-0.0695,David Rosenberg Everybody seems to believe that were going to get to that  million cap on the supply constraint but theres really nothing in the protocol to suggest that the supply of bitcoin cant go up once we hit that limit the economist said,1608249524,2,1
4506,kf9i1d,BrianAtSantiment,0.4588,Bitcoins Last AllTime High Peak Before Retracement Was Three Years Ago TO THE DAY  Santiment Insights,1608249387,4,2
4510,kf99dw,joemamagayasfhommybo,0.296,Join this crypto its going to be big,1608248583,2,1
4511,kf98qd,Tradefox555,0.296,Blockchain exchange I need my money back,1608248527,1,1
4512,kf941a,jjaymay29,-0.6249,Im the worst crypto trader,1608248074,70,5
4516,kf8qti,GuyOne,0.0,How Germany crypto regulations have helped Bitcoin adoption,1608246884,0,1
4517,kf8q3w,Fhelans,0.0,Bitcoin Transaction Fees Have Doubled This Week,1608246818,25,2
4520,kf8plo,FinnishArmy,0.4404,Crypto Exchange better than CoinbasePro,1608246771,2,1
4521,kf8p44,[deleted],0.0,Page World Economic Forum Report discusses a wide range of cryptocurrency use cases on Ethereum Tezos Stellar Bancor etc etc,1608246730,2,2
4526,kf8h62,notesy55,-0.4588,Lost BTC from Binanace to Coinbase,1608246055,0,1
4529,kf89nr,holykamina,0.836,Guggenheim Partners LLC recently said it might invest up to  of its  billion Macro Opportunities Fund in a Bitcoin trust,1608245377,0,1
4530,kf85tr,GuyOne,0.0,Crypto regulation now more institutionfriendly METACO head explains,1608245040,0,0
4532,kf80v6,Sam-BitIRA,0.0,Crypto in an IRA,1608244596,0,1
4533,kf7v64,[deleted],0.0,is Bitfex reliable,1608244109,0,1
4535,kf7jfr,Ituglobal,-0.7096,Bitcoin SV Faces Selling Pressure Throughout   Is Expected to Bring a Price Increase,1608243064,0,1
4536,kf7h4x,TulsaGrassFire,0.4404,Gemini Supporting Eth Staking,1608242861,3,1
4537,kf7g89,MammothSir9,0.296,New Law in Germany Embraces AllElectronic and Blockchain Crypto Securities,1608242784,0,1
4538,kf7f8a,Low_Fly_1036,0.5574,World Economic Forum Publishes Report on Digital Assets Crypto What Is It Good For An Overview of Cryptocurrency Use Cases,1608242694,0,0
4539,kf7dsp,_veorq,0.0,I wrote a crypto dictionary,1608242578,2,2
4540,kf7dgh,hackernoon,-0.1779,Safe Storage Hacks vs Vulnerabilities,1608242551,0,1
4544,kfqjec,[deleted],-0.3612,Bitcoin price rally near point of exhaustion,1608315702,2,1
4549,kfqc9k,Fiach_Dubh,0.0,Comptroller of The Currency on Coinbase IPO Bitcoin amp Regulation  Dec th ,1608315083,4,2
4550,kfq7ih,Abdulahkabeer,-0.6369,Bitcoin jumps over K Showing no Signs of Slowing down,1608314682,2,2
4552,kfq6gn,debrus,0.2023,Whats happening GRT is  up What have I missed,1608314600,42,0
4555,kfq0ug,arpee_j,0.3818,Online sticker store now accepting BTC and ETH,1608314144,6,2
4559,kfpt07,Tasty_Thanks_371,0.6249,CUDOS is a great crypto,1608313466,0,1
4561,kfprvp,JonNoName,0.0,Purchasing Crypto through Coinbase in Canada,1608313376,0,1
4565,kfpjyf,dannydorrito,0.7184,Ruffer Investment Used Coinbase to Execute M Bitcoin Buy,1608312712,14,29
4566,kfpftb,Tasty_Thanks_371,0.6369,CUDOS the best crypto,1608312348,0,1
4568,kfpbtd,ResponsibleAd9086,0.0,Ethereum Defi Dapp Compound to Launch New Blockchain,1608312022,0,1
4569,kfpbiv,Egalae,0.4588,What altcoins are yall loading up on right now,1608311997,122,4
4570,kfpb76,hand_spliced,0.0772,Ethereums market cap is  billion Teslas is  billion an increase of  billion this year alone,1608311966,2,1
4572,kfp3ib,sharatdotinfo,0.1027,Brave fixed their space issue Down from about GB to MB,1608311316,4,0
4573,kfp1nd,MammothSir9,0.3182, Billion in Bitcoin and Ether One River Hedge Fund to Increase Holdings From  Million,1608311167,0,1
4574,kfoxop,SoftBlocks,0.4767,Fiat inflows to the crypto market and DeFi popularity Data from instant exchanges,1608310848,2,1
4575,kfourq,pale_blue_dots,0.4588,Tech giant Microsoft and Big Four firm Ernst amp Young announced the expansion of a blockchainbased solution to extend to gaming rights and royalties management leveraging the Ethereum network,1608310608,2,3
4577,kforx3,mentuhotepiv,0.0, first crypto investment,1608310355,111,11
4578,kforkn,pale_blue_dots,0.5859,One River Asset Management has invested  million in Bitcoin and Ethereum with a plan to increase its holdings to  billion next year The company has two cryptocurrency funds the Bitcoin Fund and the Ethereum Fund,1608310328,2,1
4579,kfopzw,pale_blue_dots,-0.1027,Ethereum price faces practically no resistance towards  despite recent pullback  Despite the recent pullback on the daily chart the uptrend remains intact The Eth deposit contract has received over  million ETH which are now locked inside,1608310187,24,10
4580,kfopu5,mentuhotepiv,0.7184,If you had  to make your first investment in Crypto what would you buy,1608310172,2,1
4581,kfoowz,Throwawayiea,0.802,QUESTION Day Traderswhats your go to coin for a daily gain win,1608310094,6,3
4582,kfommo,intothecryptoverse,0.0,Bitcoin Lengthening Cycles StocktoFlow and the Four Year Cycle,1608309895,2,6
4583,kfolqw,dannydorrito,0.0, The year bitcoin went institutional,1608309819,2,7
4584,kfoelt,[deleted],0.765,Question Day Traders whats your go to coin for easy wins,1608309197,2,1
4587,kfo5ju,AD1AD,0.9081,Im hosting a Rocket League v Christmas Tournament with a  cryptocurrency prize pool  Comment on this reddit post for a ticket code if youd like to play,1608308412,0,1
4591,kfnrkv,getblockio,0.0,Hyperledger Besu Node  New Client for Ethereum,1608307206,2,1
4593,kfnkia,cryptobriefing,-0.34,The Top  Crypto Villains of ,1608306567,2,2
4596,kfngbb,RG_PankO,0.872,Buying Bitcoin at ATH is the norm during Bull Market because we are constantly at ATHs,1608306187,5,6
4601,kfn5ae,NOWPayments,0.7865,Are You Celebrating HODL Day,1608305239,1,2
4603,kfn4ge,atrueretard,0.2732,SEC Announces the Creation of the SecurityBased Swaps Joint Venture Led by Division of Examinations and Division of Trading and Markets,1608305162,4,3
4608,kfmrbv,MammothSir9,0.7717,CoinEx Celebrates Third Anniversary With Overall System and Product Upgrade,1608303966,0,1
4609,kfmpju,TopThingsToKnow,-0.1531,Did you miss the Bitcoin ATH train,1608303808,6,1
4611,kfmkb1,Lumin8_Crypto,-0.5423,Cryptocurrency News Today Bitcoin Crushes  Can BTC Crush ,1608303365,28,0
4612,kfmk4a,gaspergou,-0.6222,What is the most likely doomsday scenario for BTC,1608303347,24,0
4615,kfmcts,brunitob,0.0,Webapp Crypto tickers,1608302643,2,1
4616,kfm8zo,trueheavy,-0.694,HitBTC KYC SCAM,1608302276,0,1
4621,kflw45,doubie--,0.0,Advice on investing on crypto currency,1608301019,0,1
4623,kflo6p,bench4rench,0.7184,Litecoin LTC Finally Breaks Out Above LongTerm Resistance  TA  th of December,1608300229,2,1
4624,kn2w3m,ShotBot,0.0,What do you expect in Ethereum ,1609337332,2,1
