,title
8904,"I'm a noob and I bought at the top, along with ETH and LINK. But screw that, I'm putting more in now. Low-key have adrenaline at 1am EST"
8905,Another bitcoin question from a rookie lol but I’m sending bitcoin from one wallet to another only send about $100 worth of bitcoin but the fee says $400 how is that even possible
8946,"I am 13, I just started mining btc. This is the best."
8968,When will my bitcoins arrive at the other wallet? 32sat/vb
8994,Bitcoin can be bought and sold at the best price and without commission from here~~¶ https://localbitcoins.com/؟ch=1jges&amp;track=blog
9019,Hardware Wallet Recommendation To Store Multiple Coins
9030,Is it time to start mining again?
9034,"Only 8 blocks mined in the past 3 hours, 1 of them empty, and the Monday morning surge of transactions is rapidly causing fee rates to rise. We're currently suggesting 309 sats/vByte - Lightning users not affected! Download Muun Wallet or Phoenix"
9035,https://t.me/officialleashtoken
9037,Bitcoin hashrate drops after coal mine accident in China - Crypto DeFinance
9038,"Put .0016 Bitcoin into my Bitpay Wallet hoping to use it to get a 50$ mastercard, but It says there is not enough in the account to get it?"
9040,"You might find this helpful … I have been using lots of different cyptocurrency exchange platforms over the past 2 months but the best one so far was this one ➡('https://utt.impactcdn.com/P-A2773160-f355-457e-b45d-044b4360059a1.js','script','impactStat',document,window);impactStat('transformLinks');"
9054,Is there a web site that we can go to where we can monitor Taproot signaling percentages?
9063,Sending bitcoin to hard wallet
9069,"Are you guys mining ""pi"" a crypto currency which will have a potential growth in the coming years and going to be listed on various exchanges by this December ... So mine while you can"
9078,hardware wallet to hardware wallet
9090,Bitcoin Core Wallet - Will I need my passphrase
9100,Link Kısalt - Kısa Link İçin Bir Bağlantı Oluşturun!
9101,"&lt;script type=""text/javascript""&gt;(function(i,m,p,a,c,t){c.ire_o=p;c[p]=c[p]||function(){(c[p].a=c[p].a||[]).push(arguments)};t=a.createElement(m);var z=a.getElementsByTagName(m)[0];t.async=1;t.src=i;z.parentNode.insertBefore(t,z)})('https://utt.impactcdn.com/P-A2770063-62ef-4a4f-a9a3-167efba686901.js'"
9102,How many would be interested in free / 0 fees mining pool ?
9109,Help related to Bitcoin Mining
9124,Can’t transfer from EToro to wallet
9125,Cool browser game which give you free BTC
9137,"I know how to buy Bitcoin ?? At the cheapest price, if someone wants to know the site, call me and I will respond"
9142,We are here for you for your wallet validation for securing your wallet and fund from fraud just message if any help is needed we are always here for you
9147,Found my old wallet and the purchases I’ve made... which would have been worth €170K today!
9151,UNISAP is doing a new airdrop. Click here for some UNIA: https://uniaswap.com/?dre=3ILMYZ
9157,What would it take to free the online payment network that all merchants already accept?
9162,Free
9166,Tired of looking for a reliable Crypto Mining seller? Your research is over!
9171,"Newbie question, with mining capacity significantly reduced how does the network unclog?"
9193,Accepting payment through credit card and paying out as crypto
9206,✋Pi network = mine free with phone ✋
9225,How do digital wallets like coinbase wallet work?
9227,"We just saw the single largest 1-day drop in mining hash rate since Nov 2017. The hash rate on the network essentially halved, causing mayhem in BTC price as it crashed."
9230,can i trust this site?
9235,International NEWS! World Wide Mining Equipment Distributor - LogixMining
9238,don't keep your coins on exchanges folks. Cryptsy took all mine. Paul Vernon is a crook.
9240,Bitcoin wallet address hosted by an exchange.
9245,A respectable site to earn bitcoin
9255,"What if I told you the appearance of lack of volatility in th stock market is caused by mass market manipulation and volatility in the bitcoin cryptocurrency space is caused by it being a truly new, free and open market. The first free market in history is still a baby."
9272,Hold My Cosmo These Awesome Necklaces are FREE for a Very Limited Time! Only 1 Left
9282,My crypto Trezor wallet is italian mnemonic seed how do I import
9295,Solar + Battery + Bitcoin Mining: How Bitcoin mining could yield more renewable energy providing more reliable power
9300,"You will never get paid just for browsing the web — says who? Actually, you can! With CryptoTab Browser you surf the internet and mine bitcoin simultaneously. No investment, no hard work — just pure income. Really, you should give it a try!c"
9306,7 DEGREES TO ELON???? Is btc pump a ploy to distract us from whats going on behind the curtain???? Are you looking for a Crypto HEDGE??? Here is a theory on connections and links to stories of what is possibly to come. Watch links on this link for clues.
9310,Sent BTC to my Trevor wallet and it still hasn’t confirmed yet(been 12+ hours). Is this normal?
9312,Free 10$ btc
9315,This is the best electronic portfolio you'll ever see for investment and transfer directly to a bank or a bank card.
9322,Baillie Gifford Invests $100 Million In Blockchain.com
9328,New Platform Pi
9346,$25 Free BTC
9372,Accidentally gave coinbase address and not coinbase wallet address
9375,https://www.youtube.com/watch?v=pjInEbXLgrw&amp;t=508s
9381,Cheap mining rig?
9383,BIT Mining Limited Announces Trading of ADSs under New English Name and New Ticker Symbol
9389,You are missing out a lot if you haven’t tried CryptoTab Browser yet! It’s the world’s first browser with a built-in mining feature. It not only works as a great browser but also allows you to mine Bitcoins and grow your income.
9390,"This project has Rob Ferber as an advisor he is Tesla's former Scientist Director and Vice President chief engineer to the HyperLoop one according to linked in. tokenomics come out in two weeks. ""Pre mining"" registration open for a limited time."
9398,"Hi, I'm new here, can you help me? Anyone knows a btc wallet called 24coinchange.site?"
9400,BNB FROM TRUST WALLET GONE!!!!
9417,High miner fee? Transferred $15 worth of bitcoin from the Coinbase app and i’m seeing this. Other times it would show much smaller amounts for the fee on a small transaction (around a couple cents).
9421,Investing 50K USD as a business what exchange or site would yield us the most BTC?
9425,Transferring from hardware wallet to another hardware wallet
9451,Mine BTC on your phone!?
9477,Help! Accidentally sent USDT to a different Bitcoin wallet. Coinbase impossible to reach.
9483,Bitcoin free
9485,I have 4 different dated versions of an old BTC wallet from 2014 - Help seeing transactions + accurate balance + HD with a slash through it?
9486,Mining For Bitcoin With Flared Gas To Reduce Carbon Emissions
9487,Platform Review
9491,Bitcoin Mining Made Easy
9494,I'm trying to transfer my btc from blockchain trading wallet to my normal wallet but it's sayin insufficient funds
9506,free Bitcoin
9511,dont have access to wallet but have the address
9515,Do I have to make a new account on my Trezor wallet in order to receive a different cryptocurrency other than BTC?
9524,You might find this helpful … I have been using lots of different cyptocurrency exchange platforms over the past 2 months but the best one so far was this one ➡ https://app.impact.com/secure/member/set-current-usership-flow.ihtml?newUsershipId=2936286
9526,I just bought BTC and sent it to my hardware wallet with ease. Can I do the same with ETH on my Trezor hardware or do I have to make a new account on it?
9543,The mempool is out of control! Is the only way to chip away at the mempool's unconfirmed transactions by mining?
9544,So I downloaded roughly 30 to 40 different Bitcoin apps in 2020. Made a small test purchase/send in most from 1 app to another (to myself). How am I supposed to do my taxes with so many different apps and transactions?
9555,I just got .15 BTC for free!
9559,542fawaz@gmail.xom
9567,I created some Dogecoin accepted here buttons (.psd link in comments)
9594,"Shakepay Card - Earn bitcoin, not reward miles"
9655,Warning: CryptoMixer.io = Phishing site
9656,I have some old wallet.dat files with bitcoin and litecoin back from when my dad was mining crypto
9659,I have some old wallet.dat files back from when my dad was mining crypto
9663,"Bit Digital, Compute North Partner To Drive Sustainable Bitcoin Mining"
9667,CryptoTab Browser !!!!
9668,"I am sending you 1π! Pi is a new digital currency developed by Stanford PhDs, with over 10 million members worldwide. To claim your Pi, follow this link https://minepi.com/vjenzz and use my username (vjenzz) as your invitation code."
9676,Sending bitcoin from blockchain wallet over to betonline. I usually just send around $60 worth at a time. Done this for years. There's an insanely high network fee now?
9715,Memorizing wallet keys
9718,"BINANCE TO TRUST WALLET FEE ??? TOO MUCH !! From 203 USD IT DROPPED TO 170+ USD WHY IS THAT, I THOUGHT IT’S FREE AS IT’S SUPPORTED BY BINANCE I FEEL LIKE I GOT SCAMMED"
9720,Inside Argo Blockchain’s Mission To Change Bitcoin Mining
9722,GET AN AMAZON GIFT CARD FOR FREE.
9727,"Cash App Raises Minimum Bitcoin Withdrawal To 100,000 Sats"
9757,"The FASTEST way to buy BTC, hands down. I've shared my free $15 code below, so sign up, use the code, and get paid! https://cash.app/app/WNDZMGQ"
9761,"Please help me,I’m a 20 years old girl,I’m in college now but i can’t complete my studies because of money issues please help me with any amount of btc,any amount helps,here’s my btc wallet please help me"
9778,How do I transfer btc from Blockchain.com
9787,Update on P2P-DeFi Platform that you might be interested in
9833,Which platform is best for trading crypto?
9850,Free bitcoin mining website
9901,"Another city adopts Bitcoin. Imagine the next 6 months when more and more financially strapped US cities, counties, and even states realize they have an new reserve asset and store of wealth available... Jackson, Tennessee to Adopt Bitcoin, May Mine and Hold $BTC on Its Balance Sheet"
9904,Jack Dorsey's Square and Cathie Wood's Ark suggest bitcoin mining encourages the adoption of renewable energy and isn't environmentally-damaging.
9915,Free $10 AUD in BTC
9925,"Has anyone ever accidentally transferred their Bitcoins to a wrong wallet? If so, did you get the bitcoins back or were they gone forever?"
9978,Opinions about Bybitok.com
9979,"I used to mine Bitcoin in 2016, would I still have any?"
9980,Cathie Wood’s ARK Says Bitcoin Mining Is Good for the Planet
9990,What hot wallet to get?
10017,I don't understand why BTC mining pools don't attack shitcoins
10056,Hypothesis: Elon Musk will announce a solar powered Bitcoin mining operation in the near future
10099,what is the incentive to mine bitcoin after all bitcoins aree minted?
10102,Mining machine
10104,Exodus vs Trust wallet? For beginners
10118,"Bitcoin’s free-fall below $50,000 has it testing a new technical threshold that could signal even more weakness ahead"
10123,Cryptocurrency mining equipment shop and more! Spring Sale - 15% Reduced prices
10130,http://fumacrom.com/2O6A
10138,Bitcoin Mining on the Commodore 64?
10147,http://fumacrom.com/2LPv
10149,The whole China mining threat got me thinking
10150,Recomendable Bitcoin wallet
10160,how to buy bitcoin .....You might find this helpful … I have been using lots of different cyptocurrency exchange platforms over the past 2 months but the best one so far was this one ➡r.kraken.com/XxYD6X
10190,Is there a platform where I can buy &amp; then instantly withdraw thousands in BTC?
10200,*THIS PLATFORM _IS_ 100% REAL AND LEGIT📌📍📌. MY ADVICE IS THAT GIVE IT A TRY AND YOU WILL ALSO PARTAKE IN SHARING YOUR OWN TESTIMONIES💸💵💴💶💰* VISIT OUR GOOGLE VERIFIED PAGE TO KNOW MORE https://peter-mallouk.business.site/ *MANY INVESTORS THOUGHT IT WAS SCAM* *BUT WHEN THEY GAVE IT A TRY THEY
10212,"Hello everyone, I want to share something really nice. This is CryptoTab Browser. I use it a lot and it can bring you additional profit. You need to try it! Install the browser and start earning Bitcoins by just browsing the web."
10214,🚀💰 ATTENTION ASTRONAUTS! I PRESENT TO YOU: THE UNHEARD-OF HIDDEN GEM ✌🦄 DEFI | ICO (Serious Project – Insane Potential – See for Yourself) BIG ANNOUNCEMENT INCOMING TONIGHT! Link in the comments
10233,Wallet recommendations
10237,"Bitfarms To Join Foundry USA Pool, Will Boost Mining Performance Up To 15%"
10248,Grow your Bitcoin with the best bitcoin investment platform. Its legit and secured Its 100% paying. Instant payout REGISTER NOW!! BITCOIN ACCEPTABLE 5% REFERRAL COMMISSIONS NO WITHDRAWAL FEES PERFECT MONEY ACCEPTABLE Message me on whatsapp ‪+1 (972) 750‑4268‬
10263,"Dear Family, Dear Friends, - A letter to all of you who still have no bitcoin. | dergigi.com"
10295,A very cool site for you to profit from shortening the links here
10300,Hey! Scratch your lot and take away $200 Amazon gift card.
10310,CryptoTab Browser - How To Remote Controll Your Devices
10314,"Please refer to the picture. https://berrystore.co.kr Log in, tap log in. Create a wallet, press My Page. Coupon number: BO6HOC will immediately deposit an additional 200 units If you don't register the coupon number, you can't deposit it. A total of 300 + attendance roulette events will give you"
10315,"The average time to mine a bitcoin block is 10 minutes. Since the creation of the blockchain, does anyone know the longest time it took to mine a block? Thanks for your feedback."
10317,https://www.youtube.com/watch?v=95TItfcWq8c&amp;t=63s
10321,﻿ 사진참고하세요 1인당 총300개지급됩니다 지급받는데 5분도안걸리니 빨리받으세요 수량이커서 이벤트 끝나기전에 서둘러야 됩니다. 안드로이드 : https://play.google.com/store/apps/details?id=com.fandomberry.berrystore 아이폰은 앱스토어에서 검색 ￼ 사진 삭제 사진 설명을 입력하세요. 어플설치후 사진처럼 카카오로 간편가입하고 지갑생성하고 마이페이지누르고 쿠폰누르고 쿠폰번호: BO6HOC (미리복사) 등록하면 즉시 200개 추가로 입금됩니다 쿠폰번호 등록안하면 입금안되요
10334,Recommended Bitcoin wallet for purchases?
10345,Get free Crypto
10349,Man Forget Bitcoin Wallet Password and Lose More Than 395 Million Dollars
10362,"Hey guys, how are you? I do not want them to think that it is Spam, as a bellboy I found this Crypto casino that gives you a wheel shot every 24 hours that supposedly can pay you up to 1BTC. I've been open every day for a week and I have $ 27. https://bc.game/i-38e1r1i5-n/"
10363,"So, BitFund and Multimine (mobile phone bitcoin mining apps), are these scams or... are they legit?"
10397,FREE $20 worth of Earnathon Tokens WITHOUT DEPOSIT
10435,Claim BTH from an old Wallet
10437,Coinbase wallet very high fee!
10445,Open A Bitcoin Account | Best Bitcoin Wallet
10498,Bitcoin is very Important for this pandemic corona period to get free bitcoin
10506,Profitable Bitcoin Mining
10507,Make money online easily Signup here: https://sha-256.io/?ref=Grace101 and start getting Bitcoins easily...free &amp; legit.. 🆒 cash out instantly..no waiting direct to your wallet💵 😁😜☺️
10509,"I made this site to watch the Bitcoin Roller Coaster Guy go up and down as the price updates. You can change the currency and up/down thresholds, let me know what you think!"
10512,All cloud mining website (legit&amp;free) DOGE-BTC-TRX-LTC-BNB-ETH
10520,How to expand a mining farm
10525,6 stereotypes about mining and their refutation
10555,"Simple And Secure. Fast Crypto Swaps, Free of Custody. NO KYC, NO LIMITS, NO RESTRICTIONS. It is crypto bull season, Use Novoswap.com and instantly swap between $SAFEMOON $DOGE $XRP $BTC, $USDT, $ETH, $XLM, $ADA, $DOT, $LINK, &amp;ATOM, $BCH, $UNI, $SUSHI, $AAVE, $XEM, $ETC, $TRX"
10559,Free Mining Bitcoin
10570,Long-term Bitcoin investing: ETF (tax-free) or self-custody?
10579,How do you stake your crypto after you already put it into your hard wallet? Is it one or the other?
10580,I just registered on the waiting list for my new Damex card. 🎉👉 Sign up for yours here: %referral_code% and join the future of money.
10588,"Earn Crypto for free! Introduce myself, my experience."
10592,Exchange =&gt; Wallet
10593,Stealthex.io
10635,"GOT A BITCOIN WALLET HERE , WHAT NEXT ?"
10642,Sphinx.chat
10655,"I have a wallet from which I only know the private key, some bbtc, how can I get access to it/convert it to something else?"
10676,Want to make millions hit the link
10686,Bitcoin Wallet - Still Necessary
10697,Splitfront investment platform...an investment platform that pays stable income 2.7%daily for 30 days ....text me on the link below to get started ..remember you are your own boss..
10705,"Usa Skrill per inviare denaro ad amici o parenti, gioca e paga online o invia pagamenti internazionali ai commercianti in modo rapido e veloce. Apri un conto: https://account.skrill.com/signup?rid=158313235&amp;utm_source=RAF&amp;utm_campaign=IOS"
10722,Cold Wallet
10724,Free Money!
10740,bitcoin free
10752,Free bonuses when you use my link and referral code! Bybit leverage trading. If you live in the United States you must use a VPN before signing up.
10776,Crypto miners are killing free CI
10799,is there any way to check if app (game) is mining crypto on my pc?
10811,"Newbie Tutorial: Install Ubuntu Linux, Tor, Bitcoin Core, and Specter Wallet"
10817,Get Free 300 coin right now
10822,Check out my BTC wallet
10840,Logix Mining - World's most trusted Cryptocurrency Mining Equipment Seller - Amazing reduced prices!
10879,There is a an ad on YouTube promoting an #BTC scam allegedly involving Elon Musk https://twitter.com/qizles/status/1386638853675626496?s=19
10886,Get free coin 300
10903,Looking to retrieve forked coins from a blockchain.com wallet.
10914,Get free coin 300 right now
10939,Free money from Nexo?
10947,Have No Fear of having No Money….Be Currency Free…Be Fearless
10958,https://www.reddit.com/r/Bitcoin/comments/mz3n7b/irritated/?utm_source=share&amp;utm_medium=ios_app&amp;utm_name=iossmf
10967,Kansas City Chiefs tight end Sean Culkin just earned his Chad Card
11010,Which is the best practice to sweep your private keys from wallet papers to hardware wallet?
11013,I’ve had so many wonderful experiences with my platform which makes Cryptocurrency much more interesting as day goes by.
11016,Hi all! I created a site last night with high quality crypto March offering a variety of collections! Give it a look and hopefully something catches your eye
11017,Citadel Dispatch e0.1.9 - bitcoin hardware with @ketominer and @nvk
11021,Mining with Free Electricity?
11031,"Free 10,000 berry coin 100$ AirDrop"
11037,$DIGI $DKBSF WIN a year's free subscription:
11052,"Thank you Bitcoin. The mining bots abusing free CPU testing and automatization services in the last couple of months and they are stopping offering their services for open source projects... Bjarne: ""I told you so."""
11057,"""To all hatters on earth, I'm already mining the moon "" Doge coin"
11058,Inflation In Argentina - email from client at work who ordered a melting ice cube / gift card
11074,What is cheapest way to transfer funds from exhange (coinbase pro) to wallet (ledger) ?
11084,Claim Free Crypto Daily - GlobalHive Official Faucet Website
11087,How safe is Coinbase wallet?
11088,The fastest way to Synchronize a wallet with 1K+ private keys? Perhaps Electrum to Bitcoin-Qt (Bitcoin Core) wallet? Any advice?
11115,PancakeSwap Tutorial - How to use PancakeSwap with Trust Wallet - Fees Under 50 Cents!
11117,Use p2p crypto trading platform to avoid tax on bitcoin profit taking?
11136,"Robinhood Crypto is splitting up $1 Million in cash! Sign up with my link, trade crypto and we'll both get a piece 🤝 https://join.robinhood.com/marcusk5?crypto_promo=1"
11137,How does the Bitcoin protocol choose whether a miner's hash power goes to mining new bitcoin or toward confirming transactions?
11140,from where can i buy btc to send directly to my wallet???
11149,Tales from the Crypt: Citadel Dispatch e0.1.9 - bitcoin hardware with @ketominer and @nvk
11162,Cryptocurrency Mining Equipment shop and more! Spring SALE!
11200,How to mine bitcoin?
11203,Stay away from clearsave.io. They’re all scammers (https://uk.trustpilot.com/review/clearsave.io) and you can’t believe any information they give is 100% real. No one at clearsave even seem to be responding to their clients when they ask for a withdrawal.
11211,Converting Bitcoin into virtual VISA card without identification?
11213,Change your browser and start making Bitcoins while u browse. (Worth spending INR 55) copy the link https://cryptotabbrowser.com/22211129
11217,https://cryptotabbrowser.com/22211129 Worth spending 55 INR. Change your browser today and start mining Bitcoins for future.
11222,twitch follow bot free
11226,Free Bitcoin Mining. Change your browser to Cryptotab Browser (crome replica) mine Bitcoins while u browse. INR 55 at Google Play Store. (Apk won't work/must buy) worth spending. Link below #bitcoin #mining #cryptocurrency
11230,Earn free Bitcoins. I paid 55 INR and it is worth paying.
11280,Why won’t an altruistic miner mine low fee transactions?
11289,Crypto Island: Bequia to be site of world's first Bitcoin community
11297,how do i make a BC wallet?
11304,Trade with www.cryptowealthfxt.com
11309,https://bitcoin8m.org/en/2021/03/19/6-prominent-bitcoin-scalability-problems-and-how-they-affect-its-full-scale-adoption/
11313,Hy I'm new in the cryptocurrency world can anyone explain to how to open a wallet and do you have any recommendations before buying bitcoin ?
11321,MINING BITCOINS
11336,"Hi i am a 16 year old Indian and i want to buy bitcoin worth 300₹ , i have a wallet. And i can only pay with UPI. Please reply it would be helpful. Thanks"
11345,Wallet didnt pull in my BTC
11371,My eCommerce site now accepts Crypto
11383,Don't forget to join the conversation on #Telegram https://t.me/TCNTokenchat
11395,Copper mine becomes first mine to be sold as a physical NFT.
11398,I sent it from my Wallet to Ledger. Can it ever be confirmed?
11400,How to get free BTC worth 5$
11407,Browser Mining
11416,$200 amazon free gift card!
11420,Free AXU between 3000 and 5000 (BIGGEST AIRDROP)
11423,HARAMBECOIN baby dont say we didnt tell you to buy early. www.officialharambe.com
11442,https://teespring.com/es/real-life-2938?pid=333&amp;cid=6633&amp;sid=front
11455,Can I copy the blocks folder from Windows to a Raspberry Pi so I don't have to re-download the whole thing?
11459,Spare change app?
11465,free crypto coins
11491,"Bitcoin adoption advances free market values, not communist or nationalist values. It is dubious from first principles that the CCP has or would ever want to weaponize it"
11501,How to choose a digital wallet to store your cryptocurrencies? | SoC
11509,Ledger crypto wallet
11515,Avoid mining fees
11542,Withdrawals from Bitcoin mining
11543,Install now
11568,"I created an app that lists the best methods to earn free cryptocurrencies. No ads, only trusted and working ways!"
11572,"There are as many combinations of your wallet's 24 seed words, as there are atoms in the universe"
11576,"Oakland A's Say They Plan to HODL Bitcoin, Will Use Gains To Sign Free"
11588,Is Degiro a good platform to buy Bitcoin in europe?
11589,Bitcoin Mining Difficulty Aims for All-Time High; Hashrate Already There
11610,Bankrupt Crypto Lending Platform Cred Had UK Fugitive in Charge of Funds - [This will happen when lend out your Bitcoin)
11612,Github Server Hacked to Mine Bitcoin and Other Cryptocurrencies
11613,FREE CASH BONUS
11617,Inside The World's Largest Bitcoin Mine
11619,Bitcoin Mining Operations in China Threaten Climate Goals
11620,Transfering crypto to hardware wallet
11624,https://cryptotabbrowser.com/landing/67/17793335/?p=spring21
11625,Bitcoins Cradle animation | 4K UHD @60fps | Download 3D model
11634,"Earn $5 using my referral link and start getting BTC/cash for all the internet bandwidth you’re not using at home, office or even in your phone (android only though for now sorry iOS peeps such as myself!)"
11638,Hackers Target Github Server Infrastructure to Mine Cryptocurrencies
11645,Looking for website i can buy bitcoin directly with debit card
11646,Whats the difference in having BC inside a wallet like blockchain and having the actual code for them?
11653,You can buy and sell bitcoin from this link below 👇
11654,Elly wallet updated and it now allows buying crypto with Mastercard and Visa. Bitcoin supported (obviously).
11656,Free Bitcoin: Major US Fast Food Chain Chipotle Giving Away $100K in BTC to Celebrate National Burrito Day
11668,Hardware Wallet in Insecure Home
11683,Need urgent help (blockchain.info wallet backup)
11722,Alternate use for a retired Bitcoin mining operation?
11732,Why is a hardware wallet better than a paper wallet?
11735,Friendly reminder: bitcoin wasn’t created to make you rich. It was created to make you free.
11752,mine btc for free here the reff
11758,Use this to mine free bitcoin plzplzplzplzplz I am begging you
11762,Use it to mine bitcoin plz try it I am begging you plz try it and help me too. t.me/BTC_Miner_af_b…
11764,cash app to coinbase wallet’s outrageous miner fees.
11769,Intelligent Cryptocurrency Free Masterclass
11773,"EARN 0.003 100% FREE MINING.....NO WITHDRAWAL FEE,fastest free mining"
11789,"I set up my BTC in the Ledger Live wallet, with my Nano X and I wrote down the 24 word seed phrase. If someone stole my seed phrase, wouldn't they have access to my wallet anyways?"
11792,Help what do i do with my wallet?
11797,Old bitcoin wallet
