,title
16,Chinese Bitcoin mining farm
23,I wrote a brilliant whitepaper for my open source app. But I'm not sure how to make it in reality. lol
33,Best Browser for minning bitcoin easily
34,Join the waitlist for the BlockFi credit card with my link and we’ll both start earning bitcoin soon.
35,want to trade 0.5 btc with bitlatery.com
37,"Install CryptoTab browser and get real Bitcoins for using it. Your earnings will keep growing as long as you're watching YouTube, reading news and using your social network accounts daily."
38,Free btc quick survey
39,Amazing browser for mining bitcoin easily
40,Mining Bitcoin with computers more than four times more expensive than mining for gold
51,"House fire destroyed computer, hard wallet, and password."
53,How to mine bitcoin.
67,I made a ranked choice voting app using Bitcoin Signed Messages: Hivemind
69,Bitcoin mining using phone without battery loss 😍😎
101,Atomic wallet glitched. Reward for anyone who can assist. No backup seed.
102,"Atomic wallet crashing, reward for anyone who can assist. Please take a look!!! NO SEED"
105,"Can anyone help here? Exodus wallet will not open, no seed. Reward for anyone who can help!"
106,Is referral for free Butcoins and other cryptos allowed here?
118,I just shorted #ACY at $15 and I believe it will drop. This stock has declared bankruptcy and it will be another dying stock soon. https://tradestockalerts.com/day-trading-alert Great Way to Make Money is with Shorting Stocks! #daytrading #daytrade #shortingstocks #shortstocks
125,is there an app or program that plays certain kind of music when btc price changes?
131,"After its recent integration of a native podcasting network, the Breez Lightning client has announced that it is partnering with Lightning Network node hosting platform Voltage to give podcasters more seamless connectivity to the Layer 2 network."
133,Is this site trustworthy?
135,Bot auto mining satochis
171,you can get free $200 Amazon Gift Card.. click link:
173,WoWDoge.io - Dogecoin Cloud Mining
174,CryptoTab Browser
183,EARN BITCOIN FOR FREE.
186,Summit Mining: Crypto Mining Made Both Profitable &amp; Fair
188,https://t.me/joinchat/7gpg3_mE8PRkYjli
198,"Hey there, feedback needed! We just started this educational series about bitcoin mining, and the goal is to be structured and clear, so that beginners can understand. We’re very interested in what you have to say, so please tell us how to improve the series and what we should discuss next."
206,"Cannot be trusted. I tried to look up mg capital online https://mgcapitalscam.com/ but it looks like it doesn’t have a website which is kind of shady. If you guys don’t know yet, mg capital operates clearsave.io which is a broker that has been called a “scam” by many people."
207,"Riot to Acquire Whinstone, Creating a US- Based Industry Leader in Bitcoin Mining: US-based Bitcoin miner with owner and operator of America’s largest Bitcoin hosting facility will create leading US-based corporate pillar in support of the Bitcoin mining network"
212,Someone has transferred ~$1 billion from a bitcoin wallet quiet since 2015 | Ars Technica
220,I created an app for getting cryptocurrencies ticker and trade data in real time from multiple exchanges
222,"🔸🚰 Claim Free $BTC $ETH $BNB every 20 min.🔸 🚦 Join now : https://betfury.io/?r= 🌐 Login your $TRX , $ETH &amp; $BSC Wallet! 🌐 Deposits/Withdrawals 🌐 Playing any games! 🌐 Mining $BFG ( $TRX &amp; $BTC ) 🌐 Staking payouts"
225,Free TON DeFi Alliance to Lead the Decentralized Finance Ecosystem Growth of TON Blockchain
259,Are you interested in/Binary/ forex option Trade(trading in binary and bitcion mining
265,The electricity spent on bitcoin mining in China will be more than the total electricity consumption in Italy and Saudi Arabia
271,Wallet suggestions
291,GENERATE FREE BITCOIN
313,Blockware Mining alternatives
317,free bitcoin mining
319,"Sovryn, the leading DeFi for Bitcoin trading platform, is launching SOV token trading on Tuesday 13th April 2021. live.sovryn.app"
321,BNB Deposit have not made to Binance.US Wallet for almost a week
338,"""Free"" rewards at exchanges"
341,Confused (Mining)
356,Buying bitcoin using gift card
365,Is anyone else having deposit pending issues with Coinbase? They appear to be holding deposits as free money for days and weeks.
383,Free Bitcoin Mining Websites To Earn 1 BTC l Highest Paying Websites 2021
398,"I Found a Way to get Free Bitcoin, no joke, Its free and Bitcoin is $58,000, now Heading up, all u do is mine Bitcoin on your cell or Computer, (CLICK 1 BUTTON) and make free money !! I made $767.00 so far in a week, Heres the Link, https://minebitcoins.co/"
415,Can I have a wallet/address (?) in two different phones with two different apps?
419,Pi network = free mining app (will go public this year)
425,Crypto-First Trading App SimpleFX to Introduce Staking
426,How to restore old Armory wallet from 2013?
441,Question about hardware wallets
467,Total noob question: Wallet for PC?
468,Bitcoin mining
469,Pi network = free mining app with phone
486,Today we launched PowerTrade: Bitcoin options trading app!
487,Coldcard MK3 MicroSD card
496,"YYPoker - The best poker gaming platform to play with friends and family. One click customize your poker tables with your preferred settings, and one click invite your friends to join the poker party."
537,Bitcoin transfer from wallet to wallet.
540,FREE BITCOIN MONEY
558,FREE MONEY From Bitcoin !!!!! be quick to buy no joke it goes more expensive by the hour
573,"MINING WITHOUT NOISE AND HEAT, BUT WITH SAVINGS OF ELECTRICITY AND BIG PROFITABILITY?"
574,BETAPROFITSS; The world's largest 100% certified instant Peer to Peer Platform
605,Flooded Coal Mine Highlights Chinese Bitcoin Miners’ Reliance on Dirty Power
610,https://forevercrypto.blogspot.com/2021/04/free-cryptos-for-dummies.html
612,Found an old seed screenshot but forgot what app I used! Any ideas?
613,Hardware Wallet Recommendations
620,Steve Wozniak’s EFFORCE (WOZX) Now Listed on Bitcoin.com Exchange and Opens Platform to the Public
634,"Tradis.ai, as anyone already used this platform."
640,"Found multibit wallet on old laptop, can't figure out how to get my bitcoin!"
650,https://twitter.com/bitxoina/status/1384855510248214529?s=21
672,Finally I found it! In 2011 have saved a private key for a wallet with 1 BTC just for fun. Today I can buy a new PC for that disc.
678,The best legit bitcoin cloud mining for starters
719,Feel free to share these charicatures :) #Bitcoin
725,Here are some post-halving calculations. Can you all buy and hold $35 to $550 of new bitcoin each year? Feel free to check &amp; correct my math!
727,"CryptoTab Browser - Lightweight, fast, and ready to mine!"
730,"Hey guys, just made a video trying to explain bitcoin mining concentration - LMK what you think!"
733,New Tezos Bakery - Sebuh.net
737,"With the BTC dip, you might be wondering how to finally buy some? Below is my personal link to revolut, their fee is low and you can trade crypto and stocks super easily. Anyone who installs using my link, can DM me for free setup advice, it's free &amp; I'll earn a referral fee from revolut"
755,What's an actual good wallet
764,So Thursday night cash app sent my btc with just a $1 fee which means it will never confirm on the network. Their support isn’t helping me so what can I do?
768,Pi wallet answers !
782,These Amazing Necklaces are FREE for a Very Limited Time! Only 1 Left
804,I finally got a hw wallet but since moveing crypto around is not free I want to make sure I do it right the first time and am looking for advise.
806,Newbie question about wallets (not hardware) that I haven't been able to answer on my own
813,Program for detecting Bitcoin mining on your computer?
829,Thoughts on Gemini's Credit Card announcement today?
833,Gemini credit card update
840,plz join my mining network
841,Why does it get increasingly harder to mine the remaining Bitcoin and at what rate does it get harder?
842,Bitcoin.com FREE
861,"In order to succeed, your desire for success should be greater than your fear of failure. It's not about keeping bitcoin in your wallet you can also invest your bitcoin in other to earn more return to your wallet"
868,"“Bitcoin adoption advances globalist free market values, not communist or nationalist values. It is dubious from first principles that the CCP has or would ever want to weaponize it.”"
877,Best and Easiest Cryptocurrency Platform.
925,An excellent site to profit from mining cryptocurrencies
936,It is the time for new generation of Cloud Mining
938,Check out one of the biggest crypto gambling sites - Bitsler. They have free daily promotions with a yearly prizepool of over $1 MILLION!
942,You might find this helpful ... I've been using a lot of different cryptocurrency mining platforms over the past 2 months but the best one so far is this ➡ https://envbtc.com/?ref=HILMY
947,Mining on your phone!!!
956,Ethereum Miners Strike Back in Bid to Retain PoW Mining Community
960,I actually am only aware of 2 but are there more free transaction currencies out in the market? Thanks for helping out.
965,You might find this helpful...I Have been using lots of different cyptocureney exchange platform over the past 2 years but the best one so far was this one https://www.kraken.com/tr-tr/
969,There should be a Coin shaped payment thing for Bitcoin instead of card shape like that of Credit/Debit cards
973,"👆👆👆👆👆👆👆👆👆 Congratulations to everyone who benefited from my company.Believe it or live it ! Registration fee $0:00 Registration bonus :$30 Daily earning :$1000 Weekly earning :$7500 Monthly:$15,000 Instant cash out 👍 If interested Ask me how Just tap on the link below"
976,Remember Laszlo Hanyecz - the guy who bought two pizzas for 10K btc? There's an NFT crypto meme about him currently selling on Rarible.com
977,Has anybody else gotten this before when trying to send crypto from one wallet to another?
984,The IRS Wants Help Hacking Cryptocurrency Hardware Wallets
989,"Currently making these for anyone who wants one, link to Etsy page below"
1004,Abkhazia to Criminalize Crypto Mining and Extend ‘Temporary’ Ban
1014,Elon Musk makes electrical cars because he has a bad conscience because mining BTCs costs so much energy
1016,Totally undervalued Bitcoin Mining Stock! $BTC.CN Bluesky Digital Assets. Huge Q1 financials announced today
1019,Made this unique Minecraft-themed Bitcoin mining artwork GIF!
1021,"Get BITCOIN for free without investment ($59,843+) | Earn 1 BTC in 1 day"
1048,Could anyone help me feel more comfortable with my wallet choice?
1065,Can I have permission to promote my cryptotab link please?
1071,BTCAsia.com
1075,Mining Bitcoin FREE!!
1091,Turn your free time into profit :D
1092,"Makes £14.36 mining Bitcoin, goes to check electrical cost meter"
1107,bicoin for free!!!trust me!!!
1111,"I have an investment offer I would love to introduce you to, The Investment is mainly on mining platform and bitcoin market which I’m based in If you would be interested.. As you know Investments in this market are very lucrative, Investment that would earn very decent profit margin on weekly"
1117,Chance to win free bitcoin
1121,"good site, thank you"
1135,[HELP] how do I open a WALLET.DAT file?
1147,Abkhazia Plans to Criminalize Crypto Mining as Energy Crisis Deepens— Extends Temporary Ban
1148,"Hey, everybody! Check out the brand new CryptoTab browser! You just use it like a regular browser (watch Youtube, browse websites or social media networks, etc.) and earn income in BTC at the same time thanks to its built-in mining algorithm!"
1159,"More money into Bitcoin—Price analysis 4/2: BTC, ETH, BNB, ADA, DOT, XRP, UNI, LTC, LINK, THETA"
1161,Free btc server depend mining platform
1181,"Bitcoin Mining Difficulty Sets New Records, BTC Miners Capture $1.5 Billion in Revenue Last Month"
1196,Which Chart app/site do you use? And how do you like looking at the chart?
1200,I need a good wallet recommendation based on two parameters.
1217,"Develop your network; earn faster more money! Share your personal link with your friends and subscribers to invite new users to the mining network. The more active miners there are in your network, the more money you earn!"
1227,Can I transfer my wallet with the 12 word key?
1232,Weak point of blockchain wallet
1239,Difference between coinbase (portfolio) and coinbase wallet
1248,"Installa il browser CryptoTab e inizia a guadagnare soldi extra semplicemente per usarlo. Finché guardi YouTube, leggi le notizie e utilizzi i social network come fai ogni giorno, ottieni Bitcoin veri."
1256,Help recovering Bitcoin from an old Ninki wallet.
1259,KlV wallet
1261,"#bitcoin #bitcoinmining #freebitcoin #freebitcoins #freebitcoinmining #freecrypto #cryptocurrency #crypto I Found a Way to get Free Bitcoin, no joke, Its free and Bitcoin is $58,000 ,now Heading up, all u do is mine Bitcoin on your cell or Computer, (CLICK 1 BUTTON) and make free money made $700.00"
1273,Is there a way to retrieve a wrong network tx? 0.39 BTC sent to a OMNI USDT wallet.
1279,Whats the cheapest mining “thing” i could buy ? That is actually usefull and will generate money ?
1280,COIN Mine some coin for free.
1281,Old wallet showed balance - then didn't... help?
1287,Fiat (Visa Card etc.) to Bitcoin Payment Gateway for webshop?
1289,"I have an old bitcoin wallet that starts with a 7, not your normal 1 or 3. wondering if anyone knows of such a thing."
1291,"I Found a Way to get Free Bitcoin, no joke, Its free and Bitcoin is $58,000 ,now Heading up, all u do is mine Bitcoin on your cell or Computer, (CLICK 1 BUTTON) and make free money !! I made $700 so far in a week, Heres the Link, minebitcoins.co"
1293,Cold wallet noob question about my seed (lol)
1303,"Can't make Bitcoin 2021 in Miami, free ticket"
1305,"Chinese Lottery Firm Rebrands, Purchases Bitcoin Mining Rig Manufacturer for $100 Million"
1312,180 PIP For Free Today 8 April 2021
1319,What is the best bitcoin wallet for international people?
1327,How to send to Ledger HWW from Blockchain wallet
1331,XELS Launches Eco-Conscious Blockchain Platform for Carbon Offset Credits
1334,"Installieren Sie den CryptoTab-Browser und verdienen Sie zusätzlich Geld, indem Sie ihn ganz normal verwenden. Während Sie wie üblich YouTube-Videos aufrufen, die Nachrichten lesen oder soziale Netzwerke nutzen, können Sie echte Bitcoins verdienen."
1370,Crypto Mining Equipment at the lowest price ever! 35% reduced price!
1390,[Contest] I won a free Chipotle Burrito in their Bitcoin contest but the code expires tomorrow so I'll send it to the highest voted bitcoin meme in the comments tonight 8PM EST.
1392,"If you have lost your wallet password and seed, would you still be considered as a “HODLER” ?"
1404,"Bitcoin mining in China will exceed energy consumption of 181 countries by 2024, study warns"
1407,"Let's brainstorm the Integral.link approach to making better AMM DEX, weak and strong sides."
1413,BTC ATH party livestream (link to follow)
1421,Cold wallet for day trading
1428,Riot Blockchain Acquires Bitcoin Mining Facility in Texas
1431,trib.al/qPGk45x
1444,So recently Ive got a message in Discord that I won a prize of 0.61 BTC on a site called OracleBTC.com. Is this safe or is it a scan?
1504,"Juz curious, im using MSI RX 580, should i join the mining pool or solo mine?"
1543,Bowser Wallet from UndercoverWallet.com
1562,$325 million fraud at a crypto trading platform
1579,Bitcoin Mining Step-By-Step Guide for Beginners
1585,"Cold Wallet + Coinbase , what should I use to transfer from coinbase to a more secure cold storage ??"
1623,Hypothetical Mining Question
1626,"🔶 BetFury Airdrop 🔶 🔸🚰 Claim Free $BTC $ETH $BNB every 20 min.🔸 🌐 Login your $TRX , $ETH &amp; $BSC Wallet! 🌐 Deposits/Withdrawals 🌐 Playing any games! 🌐 Mining $BFG ( $TRX &amp; $BTC ) 🌐 Staking payouts"
1633,Bitcoin debt card and taxes
1637,Free 200$ Amazon Gift Card
1659,Bitcoin mining in the oil patch.
1666,hello everyone.you should check out this crypto investment site.i doubled my money in no time.this is the best i have used...i feel so happy. click on the link https://cryptvail.com/ ..thank me later.
1670,Do bitcoin wallet providers give me private keys they generated and saved?
1674,Free mining app (will go public this year). ‘Pi Network’
1677,how a paper wallet (set off line) is set on blockchain (on line) ?
1684,"Let's recognize Scam Artist Zach Alam, who developed the Coinplanter app that won a Coinbase contest"
1688,HODLing in Trust Wallet - Good or bad idea?
1695,💸 Earn free BTC and multiply your crypto with BetFury BOXes 📦 Enjoy the easy way to get cryptocurrency! Real rewards every 20 min 💥 👉 https://betfury.io/
1696,FAST BITCOIN GENERATOR. FREE 2.5 BTC. Generate Get Up to 2.5 BTC In to You BTC Wallet! Website URL: http://genxbtc.eu
1705,Hi this is mark with the wallet issue and someone help out please?
1713,Best Exchange Site to start day trading with a small investment.
1719,Tokenomy Earn. Staking Platform
1732,Do follow &amp; invest backpackers for exciting tips and vouchers on world travel. Long term coin holders to get special vouchers. bitclout.com/u/backpackers
1736,BTC options trading now the Apple app store! Powertrade’s approved app releases Thursday the 15th!
1741,"Low Cost 24/7 Bitcoin, Crypto &amp; Gold IRA Self-Trading Platform"
1758,Market Cipher For Free Enjoy :)
1762,Can someone help me with mining?
1780,Any thoughts about how quantum computing can really totally disrupt the Bitcoin mining game? I'm sure we will see Q computers before Bitcoin mining comes to an end (projected to be circa 2040). Actually same question applies to any crypto that can be mined.
1799,Big Scam Alert! Oraclebtc.com
1805,Bitcoin Wallet App Disappeared from APP store
1809,"Accidentally sent my BTC to BTCsv wallet, is there anyway to retrieve??"
1816,Please Check My BTC Mining Calculator
1837,Hey to everyone one I love bit coin and I want to buy 15-50 worth of bit coin but I’m under age so I can buy any but if anyone can send some to my wallet and I’ll cash app you that will be awesome
1839,How dohashes and mining algorithms work? An interesting look into the guts of Bitcoin.
1849,Bitcoin Mining Firm Blockcap Moves Headquarters To Texas As State Embraces Bitcoin
1853,My first ever bit of BTC😄 ( I managed to find a app that lets you send and receive btc under 18 ) - I’m 17
1854,Link to create Coinbase account and win $10: coinbase.com/join/lop_dh
1878,If you guys want to mine bitcoin for free without any investment then click the link below and register. It's a legit cloud mining site and with a minimum of .0003BTC withdrawal amount. So register with the link below.
1885,Bitcoin Mining Hash Rate Drops As Blackouts Instituted In China
1898,I invested in jan 2018 in BTC .. In Dec 2020 my wallet and got hacked. I'm ready to invest again and i'm not sure where to start.
1902,How I gain my BTC for free
1915,Is your bitcoin wallet 0.0000000000 you can make it 0.1123689447 per hour Ask me how https://t.me/joinchat/AAAAAE3oP7OxrxyzGufEng
1935,This is just friendly warning ⚠️ that mining power needs to move out from China 🇨🇳
1938,What is THE BEST phone app to invest into bitcoin!?
1975,https://beincrypto.com/china-bitcoin-investment-alternative/
1981,Resetting a Hard Wallet
1991,Bitcoin cost relation to mining profitability
1992,"Bitcoin Ticker for Kindle Oasis, open Hodl.bar in browser, tap the round “i” icon on the chart for the instructions. Should work on other devices with a browser"
1993,Nice one! 😍 Link 👉 https://shop.bitbase.es/collections/toda-la-coleccion/products/camiseta-bitcoin-just-hodl-it
1995,Nice one! 😍😍😍 👉 https://shop.bitbase.es/collections/toda-la-coleccion/products/camiseta-bitcoin-just-hodl-it
2001,Single-use mobile wallet suggestions?
2002,Mining fees too high for me: what's going on?
2010,You may track down this supportive … I have been utilizing bunches of various cyptocurrency trade stages in the course of recent months however the best one so far was this one ➡https://app.impact.com/secure/mediapartner/marketplace/new-campaign-marketplace-flow.ihtml
2013,Bitcoin sent to Blockchain wallet missing funds. Offering a reward for successful help
2019,Smartlands Platform Launch: Tokenizing the Real Economy in Europe With a First-Mover Advantage
2028,Trust wallet issue
2042,How do I download bisq on MacBook
2085,"Imagine what happened to the world recently,with the COVID-19 shutting down several industries,and yet people are still making cool cash from this investment platform. Send me a message on how to begin and make huge profits from your comfort zone."
2086,Doing research into Bitcoin mining. I would really appreciate some help
2088,How do I find my Bitcoin core wallet?
2105,"Accidentally put a low transfer fee in Guarda wallet and now my BTC transfer is stuck for days, can't make RBF or Double Spend. Please help"
2109,Only 2 % of Coinbase funds are insured - Buy a hardware wallet
2125,"They are experts in credit reform and help individuals achieve their credit goals. A process developed, refined, and proven over many years and thousands of clients cutt.ly/QvDQCvQ"
2136,"The Ternoa Blockchain (CAPS) Unveils SecretNFT, Its NFT Platform"
2144,"Quit doubting so that you can earn, so many people are benefiting from our platform you too can be part of this, take risks and earn huge reward DM ME FOR INFO ON BINARY OPTION #money💰 #wealth #investment #forextrader #motivation #fitness #"
2145,When will network free up? I have transactions pending for days.
2148,Do you know that most of the time your computer capacity remains unused? Start using your computer resources more efficiently and earn at the same time! Install CryptoTab browser and it will mine bitcoins in the background while you are just surfing the web. Join my mining pool -
2154,A cryptotag titanium wallet backup review
2184,"Free Bitcoin Lottery, Bitcoin savings wallet, Bitcoin faucet."
2198,paper wallet question
2201,"Hi everyone, if you want to multiply your money, sign up at this link and open a trade, fold your money"
2229,Why did Bitpay partner with Mastercard for its credit card? What is the value in the Mastercard network?
2233,"Take the joy in cloud mining together. No need to deploy mining rigs, you can start mining right away by purchasing hashrate! Sign up with my referral link, you can receive 5T*3 hashrate as gift."
2242,The media is trying to show the bitcoin as new coal. Everything uses energy we all know this. My fear is that the media has the power and haters are with them. What is your prediction about this hype around carbon footprint of bitcoin mining. Will media fade this bullrun ?
2246,Interview: Sustainable Bitcoin Mining In North America With Peter Wall
2249,I still think it’s way too high for what it is and on top of that think of the Mining people like the bank check the address though ya that who’s handling all of your transactions let that sink in
2252,What Bitcoin app is this?
2267,Help/advice needed: Bitcoin transferred successfully but then transferred back to original wallet.
2268,Android wallet...
2269,Commodore 64 Mining Rig
2272,Is Metamask really the best ethereum wallet for a newbie?
2302,Btc for free ( yah it's real)
2308,Duelbits FREE 5$ SIGN UP NOW
2313,"Last time I bought BTC was in 2016. Now I'm gonna go all in once again, but what platform has the lowest commissions?"
2321,"US City To Become Bitcoin Hub, For Crypto Payments And Mining"
2336,#SUMMER 2021 CRYPTOTAB BROWSER
2338,How to recover a bitcoin wallet from private key (no seed phrase)
2340,Looking for wallet that can generate new send to and received from addresses
2344,Everyone in Crypto needs to download this app. It’s free and easy to use. Earn Crypto on your phone it’s that simple. Get it today don’t wait. Invite code: elibarber51
2371,Where is best to store your Bitcoin? In your wallet or is it an issue to just keep it in your app such ass Coinbase? I have a Coinbase wallet and he app and am curious where is the best place to store it?
2375,(Bitcoin) Eco-friendly mining proposal by ripples co-founder.
2380,"If you think the transaction fees were bad during the China mining shutdowns, just imagine how much worse they would be if ALL of those PayPal and Robinhoold users were buying and transacting on-chain."
2395,USING A MOBILE PHONE TO MINING
2445,"I wish all the crypro app stop working, so I'm not keep looking at them all the time... 😅😵‍💫"
2463,Free bitcoin mining app
2486,how to get free bitcoin
2494,Couple questions! Wallet/DCA
2508,Get fractal shares for free on Bitpanda - and win a Tesla
2516,Hey guys i just make an Crypto Notepad app for holders!
2534,Free money
2544,"What BitCoin wallet service is this? I dug through my photo archives to find this screenshot since it has my passphrase on it (redacted), but I can't remember which site or app it's from. Does anyone recognize the UI?"
2546,Any website that I can buy crypto with credit/debit card with low fee
2559,There’s evidence of the first complex arbitrage systems around the time when the Code of Hammurabi was written in 1760 BC. To understand arbitrage is first to understand the never-ending search for inefficient markets. What's the best platform for Crypto arbitrage??
2561,Can you mine bitcoin in space?
2566,I startet Bitcoin Mining Today
2612,Seed signer . Works for multi signatures. Specter wallet is extremely difficult to set up through umbrel
2631,Hey guys I just make an Crypto Notepad app!
2638,Best Wallet For anonymity ?
2641,Can I mine BTC using only an HP Pavilion 15 with a GTX1050 and Core i5 8th gen?
