,title
2644,"Instantly swap your crypto in seconds. Fast Crypto Swaps. NO SIGN UP, NO KYC, NO LIMITS, NO RESTRICTIONS. It is crypto bull season, Use Novoswap.com and instantly swap between $SAFEMOON $DOGE $XRP $BTC, $USDT, $ETH, $XLM, $ADA, $DOT, $LINK, &amp;ATOM, $BCH, $UNI, $SUSHI, $AAVE, $XEM, $TRX"
2650,Is coinx.ai a safe bitcoin platform. There is nothing on Google.
2653,Are you interested in making extra cash from your mobile phone or pc to earn a good profit directly into your bank account or bitcoin wallet?
2683,This weekend AncestralEYE (ATEYE) &amp; AlgorandEYE (ALGOEYE) giving away randomly. Just create in you Algorand wallet this ATEYE and ALGOEYE asset account to participate and receive them. By CRISMART
2696,Coin mining
2725,I want to buy Bitcoin to transfer straight to my wallet
2729,Wirex or Binance card
2742,Bitcoin wallet
2749,"The value of Bitcoin SHOULD NOT BE dependent on government acceptance. Bitcoin should expect to be ""banned"" if it is truly free. Value should be based on how free (as in freedom) something is."
2750,Free Bitcoin
2760,The truth about crypto mining energy consumption
2762,Wallet without coins
2765,Instantcloudmining.com cloud mining both BTC &amp; ETH in one place. Get your risk free seven day trial below.
2767,How do I move Bitcoin from CashApp to Blockchain Wallet?
2771,Do you want to win 5 DOLLARS FOR FREE in NFT? You only need to register in this new game (do it before APRIL ends)
2772,Hey come join me and mine
2775,This asshole tried to dm me I bet he will tell me if I give him all my wallet info he will double my value in btc the best part is looks like in the pic it’s a guy on a yacht drinking Bombay people with money dnt drink shitty Bombay first give away
2778,https://www.dw.com/en/will-bitcoin-become-millennial-gold/a-56162599
2781,Samourai Wallet public addresses
2782,Found wallet from 2016 and overwhelmed with decisions
2791,Hardware Equivalent to Google Authenticator for 2FA?
2793,20 people needed. Mine Bitcoin. Legit site and real payment proof
2797,Go Phish: How This Bitcoin Investor Lost 17 BTC To An iPhone App
2809,Is ZenLedger legit? (Crypto Tax app)
2811,How to mine bitcoin safely
2824,Get 200$ free amazon gift card
2835,Mine Bitcoin with ONLY as passive income? You surely DON'T wanna miss it!
2842,Free bitcoin
2847,ICM Mining APP
2866,BTC Withdrawl to my wallet
2879,Best Bitcoin mining app
2897,Wallet
2907,Give free Trezor for anyone
2912,Is it possible to change the words that are used to secure a wallet?
2928,PHT Token Mining App Review
2935,Canadian Bitcoin Platform That Pays When You Shake Your Phone
2967,If you want to start mining bitcoin click this link?!!!?!?!?!
2972,Get $200 Amazon gift card
3004,Sports gambling on websites... is it safe to receive my earnings in bitcoin to my coinbase pro wallet?
3016,Did you guys know you can play CS:GO for Bitcoin over the Lightning Network?! It's incredible! By far the best way to get some free sats!
3035,Want crypto earning options besides faucets and cloud mining?
3039,Mining Bitcoin (or altcoins) with a small photovoltaik setup at home
3040,Buy BTC For Wallet (Underage)
3044,Is it safe to use a closed-source software wallet with a H/W wallet?
3058,"Found this app which is pretty niche, I think it's a great platform for those who are interested in a more closed crypto society.."
3067,"Man Downloads Wrong App, Losing $600,000 in Bitcoin"
3069,paper wallet
3072,CryptoDrunk #27: John McAfee - “I have never lost a bet” 🍆 - CryptoDrunks.com
3077,Need tips for first time mining !
3083,"Bitcoin Mining Difficulty Rise, Record Number of ASIC Miners Come Online"
3084,Played around a bit with Phoenix wallet with a friend just now. Loved it. Payments finished in under 2 seconds. Questions inside...
3085,Mining on your desktop
3133,Bitcoin mining!
3134,Bitcoin mining stocks
3143,DC to DC mining power.
3158,NDAX platform
3171,join this bitcoin browser you can mine bitcoin while using the internet like everyday tasks
3173,Help! I need a Bitcoin wallet.
3196,Burritos or Bitcoin game. Guess a 6-digit passcode to win free burritos or Bitcoin value at $500 or $25k. Real deal from Chitpotle.
3219,Bitcoin never got to trust wallet?
3229,Follow me on BetFury. Let's hunt for Bitcoins together!Get an exciting experience on #1 I-Gaming platform with daily payouts!
3247,"National Burrito Day 2021: Chipotle to give away free burritos and $100,000 in Bitcoin Thursday"
3255,Inside a Bitcoin mining farm
3265,Investing in bitcoin investment platform
3278,Hardware Wallets
3282,How to recover a damaged Wallet.DAT
3283,"You will never get paid just for browsing the web — says who? Actually, you can! With CryptoTab Browser you surf the internet and mine bitcoin simultaneously. No investment, no hard work — just pure income. Really, you should give it a try!"
3286,"Got sent USDT to my BTC (Coinbase wallet), can anyone help???"
3299,Just got my BTC card!
3314,Bitcoin mining Investment platform
3329,Limited space! Don’t forget to add app after sign up!
3337,Top 3 2021 best crypto yield in kind platform
3353,Best app for androoid for buying
3378,Old BTC Wallet Mystery
3386,Using another wallet to retrieve BTC
3394,A man loses $1 million in bitcoin after downloading fake Wallet App from AppStore | Be careful
3402,"YouTube's Cold Fusion says that BTC has been highly compromised, and even controlled, by big banks thanks to Blockstream (Lightning network). What do others think about this?https://www.youtube.com/watch?v=iYn6EQDqTkU"
3406,Where can I buy visa gift card with NO time limit?
3417,#ETH –Wow #Ethereum is over 2k! – Up over 6%! Make money with our stock alerts at https://tradestockalerts.com/penny-stock-alerts –#pennystocks #stockalerts
3423,What is the easiest mobile wallet to use when purchasing and spending BTC? I mean EASIEST. I am going to try and scared I will mess up. Also can I use a prepaid Visa card or have to use my own? Every site/wallet claims to be the best. I will only be doing this with the phone.
3427,Electric sheeps says 1yr free minning
3428,Pi Network!! The No.1 Mobile Coin Mining!!
3431,FREE BITCOIN
3432,bit.ly/3spFKtE
3433,"Friends, let me share with you a cool browser with built-in mining features, I've been using it few weeks now and results are great! You get paid in Bitcoins and payments come directly to your Bitcoin wallet. Download it here -"
3437,"Get free bitcoin ,there a chance to win 200$ in one roll don't miss it Click the link below and try it http://bit.ly/3spFKtE"
3444,https://opensea.io/assets/0x495f947276749ce646f68ac8c248420045cb7b5e/82740654160899823304018469638938340458066880381547538052249439233350217760769
3468,Why Bitcoin Free Open Source Software Matters
3473,"China’s bitcoin mining is threatening its climate change targets, study says"
3480,New Bitcoin Mining Giant Emerging in US With USD 651M Deal
3495,Join Robinhood get a Free stock
3508,2021 is mining crypto (bitcoin specifically) worth it
3518,"market cipher referal link, https://marketciphertrading.com?ref=18843"
3528,Bitcoin Mining
3543,What is the best hardware wallet ? Why ?
3552,Ledger (Wallet) and Shopify Face Class Action Over Massive Data Breach
3564,Please use this Link
3568,Bitcoin Mining Manufacturer Ebang Officially Launches Crypto Exchange
3572,"Check out this Bitcoin art NFT, Social Capitol... and please take a look at my art on Opensea. Link in comments. ECBYart"
3578,https://cb.run/Pzn0
3584,Starbucks Customers Can Now Pay With Bitcoin via Bakkt’s Digital Wallet App
3588,https://youtu.be/yAUrzAyOCnw
3590,500.com Limited Announces Acquisition of a 7-nanometer Mining Machine Manufacturer and New Issuance of Preference Shares
3596,https://get.cryptobrowser.site/29/21952372
3597,"Hey guys, every day I post my results mining with an RTX 2060s, help me improving my content."
3609,Why do I need a wallet if I am holding on Coinbase my BTC?
3611,Unlocking wallet from 2013
3648,Mine Bitcoin from your smartphone
3649,iOS App Stole $1.6 Million In Bitcoins From Users
3650,Butcoin for free↗️↗️
3652,Mining communities
3655,Get $1000 Sent to Your Cash App! get free money on cash app hack///only USA &amp; UK peoples //how to get free money on cash app hack without human verification
3666,State Street to provide tech for institutional Bitcoin trading platform
3670,3PGKWjK4ryXvEWPzHeXXQj6JzTsKCKrqLN оплата за размещение на сайте reddit моя почта vladimirarhipov985@gmail.com
3675,"BNB RETURN WALLET FOR BITCOIN , CRYPTO"
3692,FREE BITCOIN!!!!
3701,Bitcoin Mining at your HOME!
3703,I just started Bitcoin mining
3709,Best XMR Wallet??
3723,bitcoin and ether mining with playing games
3731,"State Street to Use New Crypto Trading Platform It’s Helping Build, Platform’s CEO Says"
3739,"[Question] Found old wallet from 2014, how can I transfer / cash out my BTC?"
3740,"I want to buy some bitcoin for a friend's daughter without using wallet, is this complicated?"
3749,Mining Bitcoin with Nuclear Power
3768,Get 4000 shares of Tesla FREE!
3773,How does a 24 word brain wallet compare to a traditional seed?
3784,MVU cloud mining
3807,Any fellow Django devs interested in helping me create a free educational platform for people who might want to learn more about Bitcoin?
3815,"Coinbase team just announced 1Q21 data including revenue of ~$1.8B, trading volume of $335B &amp; assets on the platform of $223B (11.3% of crypto asset market) with 56M users"
3821,Never mine with a 1660 or below :(
3825,Bitcoin Hashrate Surpasses All-Time High as Even 2014 ASICs Stay Profitable Bitcoin's hashrate is moving alongside its price as old and new mining machines come online.
3828,Will you uninstall the Exchange App and just Hold Bitcoin?
3861,Exodus.com
3879,Rtx 3090 mining
3889,Giving Free Ebook just review it on amazon
3906,Bitcoin Audible: Read_513 - Noahbjectivity on Bitcoin Mining [Nic Carter]
3926,Easy way to run your own node with a Hardware Wallet.
3940,Description of bitcoin (BTC) mining from Ripple (XRP) CEO
3942,Anyone know where I can buy btc with bank account/debit card?
3947,Had to customize the #Cashapp card to support the cause!
3971,Guys I found the best platform for crypto exchange.What do you think is there a best .It has a rating of 4.8
3979,Mining and profit
3981,Track a crypto wallet
3994,Please help me recover my wallet with 100btc. Here's my seed phrase
4000,"My dad bought some satoshis through a trading app and lost them, any help please?"
4008,"Cloud mining for Bitcoin does NOT work, just buy and HODL Bitcoin, don't ask me how I know...."
4023,Moving Bitcoin Safely From Online Wallet/Exchange eg Blockchain.info
4045,Let's mine expensive bitcoin!
4061,Blockchain app down?
4067,Is mining BTC worth it for beginners right now in 2021?
4085,Free ETH Miner
4091,App for alerts on bitcoin price by percentage?
4106,Where can i get a bitcoin wallet?
4108,Is mining still profitable in 2021
4131,Is mining still worth it?
4144,Why is it so hard to find a site I can buy btc off of instead of just haveing to do it peer to peer.
4146,Best nfc card style hardware wallet?
4152,Lost on how to get mBTC from NiceHash to wallet then selling it
4168,Coinbase - if you decide to nuy bitcoing through coinbase use this link you get free 10gdp in ur account.
4198,Sent btc to link wallet - help!
4214,Remember the guy who hid a 10 BTC paper wallet in his brick wall during a remodel?
4215,"My new cash app card, designed by yours truly"
4239,"ENV Finance, a platform for fundraising environmental projects with cryptocurrencies and get rewarded for it. [new token / ICO till 18th April]"
4249,Check Out My New Referral Link
4267,"Guys, thank you all for another great live stream. You rock! For those that couldn't attend the live stream, here's the link to watch it now!🎬🎥😎📈"
4270,What's that dip? Did I miss something or is the app messing up?
4273,Is bitpay a good wallet just to hold Crypto?
4284,https://metamask.app.link/send/0xf26a1D5058166797D55D1c37195A3f402a2c72eb@1?value=1e18
4289,The site of paid watching ads hgmoney.icu/Home
4312,"If you own bitcoin, you need to run a node. A node gives you a voice to vote on code changes, validate your own transactions and improve network efficiency by supporting the mempool. Here is mine."
4339,Can I send bitcoin through lightning to the Guarda Wallet? and how?
4345,How to Set Up a Ledger Nano X Wallet for Your Bitcoin
4347,Is there a site that shows orphaned blocks?
4357,YoWhatsapp APK Download v13.20.0 With Crack (Latest Version)2021
4366,The most profitable Crypto Mining on the market! Huge discounts!
4378,Hello. I found a site where they really pay in cryptocurrency.
4382,From yesterday I sent a transaction to binance and it is still pending/unconfirmed. My question is. Did I lose my money? Or will it revert back into my trust wallet after some time?
4386,Hello. I found a site where they really pay.
4387,Is there anyway to buy crypto with a prepaid debit card?
4392,Get Your Nexo Card Earlier
4405,Doge on Webull ? Looking promising another platform to buy it on !
4406,MOGO CANADA - just signed a deal with coinsquare sing up now! Do not miss out on this promotion! Withdrawal $20 instantly or keep it in bitcoin invest for free! Sign up up before the promo is no longer live!
4431,AXA Switzerland Activates Bitcoin Payment Option For Customers - InsideBitcoins.com
4439,Is mining stuck ? 185 blocks are waiting to minded.
4448,Any suggestions on Platform for Crypto?
4451,Bitcoin (Lightning) Self-Custody Speed Run (using Strike &amp; Blue Wallet)
4463,Best ethereum wallet for a beginner?
4465,My first Bitcoin Wallet
4467,Pi Coin Mining
4468,free bitcoin website
4469,best and free website to free bitcoin minning
4499,"(question) ""unconfirmed"" bitcoin in green wallet"
4515,Bitcoin Hashrate Drops After China Coal Mine Explosion; Difficulty at ATH
4567,"Hey I love bitcoin dips, but usually miss them... Is there a tracker app I can set-up to notify me when bitcoin drops to xxxxx?? Something similar to setting ""buy limits"" on stocks, etc... Any suggestions are much appreciated -"
4569,Do Free Bitcoin transaction accelerators even work?
4574,How to mine your bitcoin to earn more Profits
4581,How to expand a mining farm in 2021
4586,Bitcoin Mining: Why is it Harder to Mine Bitcoin Now? The Top Coin
4594,https://www.b.saifme.co/post/see-if-i-could-not-learn-what-it-had-to-teach-and-not-when-i-came-to-die-discover-that-i-had-not
4598,What platform has the lowest cost to trade/buy? I placed a limit order on voyager and at more than 1.5% lower than my limit it still didn’t fill. Are people really giving up more than 3% of profit/loss to buy and sell?
4608,Interior Designers in Bangalore | Best Interior Design | Addongroup.org
4613,Found my old blockchain wallet from 2014
4620,I signed up to play The Crypto Prophecies trading game. Use my code and get $5 worth of tokens to play for free.
4621,Bitcoin mining is being used to reduce greenhouse gases
4624,Coinbase Wallet - Recommend or Not?
4625,Free Bitcoin ????
4626,How to get free bitcoin (..slowly)
4631,Posted a twitter link to Willy Woo's post mortem on the crash today and it was deleted by mods...
4632,Bitcoin noob here. Why are these fees so high? I'm using trust wallet and to send $30 of BTC the network fee is $16. It seems crazy to me.
4674,Mining and ecology
4676,Rewards Card!
4677,This is very danger if china restart the mining rigs after block 681408 immediately.
4689,Mining vs buying
4690,"Ich habe ein paar hilfreiche Informationen für alle, die ihr Einkommen steigern wollen. Probiert CryptoTab Browser aus und ihr werdet sehen, wie einfach es ist, Bitcoins zu verdienen. Die eingebaute Miningfunktion macht alles für euch. Nutzt meinen Link, um ihn zu installieren https://cryptotabbrows"
4697,The most profitable Crypto Mining Equipment on the market! Huge discounts!
4705,Blockchain Wallet BTC to ETH swap taking forever?
4711,changenow.io is a scam site. They are thieves
4716,I have btc in my blockchain.com wallet but i am not able to send anywhere.
4720,"In the very, very early days of bitcoin, I tried to mine on an old computer of mine and I have no idea if it was successful. How do I find that out?"
4735,Hi! I’m a newbie and have invested in Bitcoin. I’m planning to hold it for a couple years. Is it wise to leave the money in Coinbase wallet? Or should I use a different one?
4738,Hey all check out HollaEx they just added a bunch of new alt coins to the wallet.
4750,Riding BTC wave for free
4751,Hi dear reedit. Today i found in my google drive. Propably backup of my old bitcoin wallet . Wallet_bb.txt who know how and where i can restore this ? Because normal bitcoin wallet dont have. Recovery walet from txt file.
4754,Coinbase to trust wallet
4771,So what are the best exchanges for buying Bitcoin then transfer ur key/address onto ur own wallet for cold storage. There’s a ton of confusion out there and I feel there should be a simple easy to understand Avenue
4774,You are missing out a lot if you haven’t tried CryptoTab Browser yet! It’s the world’s first browser with a built-in mining feature. It not only works as a great browser but also allows you to mine Bitcoins and grow your income. Download it here
4776,Bitcoin Mining is NOT Solving Complex Math Problems [Beginner's Guide]
4778,Venmo adds crypto trading to its app
4782,Best platform to use in the UK?
4799,South African Crypto Platform Revix Raises $4.1 Million
4801,Help please! I sent $1000 but received $0.30 from one wallet to another. Can someone help me figure out what happened!? This was like two months worth of groceries for me and my kids...
4817,Bitcoin Mining - Fire Hazzard?
4821,Found old wallet address with 0.5 bitcoin in
4840,Canadian crypto miner Bitfarms is planning a huge new bitcoin mining site in Argentina
4844,https://www.reddit.com/user/Final-Perspective-22/draft/0931838e-a1ca-11eb-93a2-9aaac83b51cb
4849,Earn free BTC and ETH with this PokemonGo-like game!
4850,for mining bitcoins while doing any work you want
4854,Free $35 worth of bitcoin
4864,"If in crypto, you are given an option to get RISK FREE 3 percent a month for entire life, provided you can't put money or hold any coin ever, would do you take it?"
4898,Is there a way I can use Bitcoin (or other crypto) to Buy a prepaid Visa (Or another prepaid debit card)?
4906,Bitcoin transactions are FREE SPEECH
4915,Used Bitcoin faucets back in 2013. Haven't touched my wallet since. Help!
4921,Free Bitcoin Mining Game: Play Online &amp; Mine Crypto | RollerCoin
4928,http://CoTrader.com
4929,🚀 CoTrader: The world first investment funds platform live on BSC.cotrader.com (and was first on ETH.cotrader.com too since 2018)
4941,2 Cents per Kilowatt Hour: Bitfarms to Launch a 210 MW Bitcoin Mining Operation in Argentina
4942,Risk of centralised Bitcoin mining
4955,Sent BNB to wrong address on trust wallet.
4956,Official Unstoppable Wallet admin are SCAMMING via the telegram linked to their app. ALL PROOF SHOWN.
4958,You might find this helpful … I have been using lots of different cyptocurrency exchange platforms over the past 2 months but the best one so far was this on ➡privacy@impact.com
4960,"Join me on NDAX to start trading BTC, ETH, LTC, LINK, USDT, XRP, EOS, DOGE, ADA, and XLM on Canada's most secure exchange with 0 deposit fees and 0.2% trading fees. --Use my referral link and we will both get $10."
4962,I used to mine under a large pool in 2012/2013. Any chance of recovering what I earned?
4977,Secure and fault tolerant BIP39 seed storage app
4982,Is exodus wallet safe?
4991,BitPay multisig wallet issue
4997,https://rollercoin.com/?r=kmdszlwu this link gives you gift rollertokens hurry up that the offer ends and generates bitcoin and dogecoin
5030,35% of hash rate went down because of a coal mine flood in Xinjiang
5039,"Massive fee? I used trust wallet to move about $30 worth of bitcoin, did I pay this $514.22 fee? Thanks for the help."
5049,"What are people's current BTC holdings in this subreddit? Mine is BTC 0.21. Just in the interest of community sharing, what's yours (if you're comfortable disclosing)?"
5067,BTC mining
5068,How Bitcoin Mining Can Catalyze Solar Development w/ Max Webster
5069,https://news.bitcoin.com/craig-wrights-law-firm-granted-permission-from-high-court-to-serve-bitcoin-org-operator-cobra/
5089,I don’t have a Hardware Wallet to store my btc after I buy this discount. Any recommendations?
5107,Bitcoin mining platform
5140,Best platform to hold my crypto?
5143,Updating from old pre-forks wallet
5176,three websites to earn some free crypto
5179,Sold bitcoin but funds not showing up on my blockchain GBP wallet
5224,Merchant solution to accept crypto LN with credit card withdrawal
5299,hey guys check this app for bit coin
5343,https://www.google.com/amp/s/www.cbsnews.com/amp/news/venmo-bitcoin-investors-cryptocurrency/
5357,The first 10 comments get free sample packs of marijuana and THC gummies by Quad.WTF
5362,top 3 free bitcoin mining websites / you can earn 0.002 bitcoin
5369,Buying bitcoin on Coinbase use this link get extra $10 dollars for free.
5371,Buying bitcoin on coinbase use this link and get a extra $10 cash for free it works and it's legit
5376,Get 0.10 free cakes
5384,Hello World.i am here to brought to you an opportunity for you to make good amount of money from Binance exchange platform.You will only need to register for free and make deposit for trading to earn good profits Register now&gt;&gt;&gt; https://www.binance.cc/it/register?ref=ZRO4WZGN
5397,Lets mine bitcoin for free!!
5399,Get bitcoin for free!!
5421,n of m multisignature with hardware wallets?
5426,"People do know there are “other” ways to buy #Dogecoin, right? I mean we do not need Robinhood app, but we can use apps like : crypto.com - just wondering I guess..."
5437,Created a wallet at bitaddress.org in 2014... now what?
5446,Are you interested in crypto investments??? Then Trade with a Google verified and popular crypto investor mallouk Peter and avoid being scammed👇 https://tradewithpeter.com/
5453,you can get free bit coin by this link
5464,Bircoin mining | Larger purpose?
5482,To the people that are saying Bitcoin mining is using too much electricity
5500,https://www.worldcryptocoins.com/post/digital-news-today
5501,"Noob Mining - I know my hash rate is terrible, but am I actually mining? I know I won't accumulate anything appreciable but I wanted to know how to do it. I'm using f2pool."
5504,TMW I open the ledger app in Dec 2021 and BTC’s at 250K &amp; ETH at 10K
5509,Www.bitcopan.com
5510,https://cryptotabbrowser.com/21643056
5513,Noob Mining Question
5533,Download pi crypto currency app
5537,"Would you recommend to transfer bitcoin from a trading platform to coinsmart and then deposit it into a bank, or directly deposit it into the bank?"
5546,Compromised Private Keys in Hardware Wallets
5553,http://t.me/PTLKTokenAirdropBot New Airdrop Instant withdraw Join fast
5560,What is your favorite cryptocurrency app? Thanks!
5571,EXODUS vs GREEN WALLET ?
5572,"This guy wants to mine ""my"" bitcoins for me. I don't have any but still, it's hilarious."
5576,EXODUS vs GREEN WALLET ? And why? Thanks!
5577,Mine your own crypto free on smartphone
5599,"China's Bitcoin Mining Dominance Will Soon Take A Hit, As Australian/US Company Orders Over 11,000 New Rigs..."
5606,Thoughts on Biden administrations plan for regulating crypto? https://news.bitcoin.com/biden-administration-cryptocurrency-regulation-treasury-sec/
5610,What is the difference between a private key wallet and a trading account?
5614,Why is it taking so long to mine block 680692?
5625,Get free bit!!
5643,How does mining bitcoin cryptocurrency?
5668,Simplify the way you trade cryptocurrency by joining me on NDAX – Use my referral link and we will both get $10.
5674,"“Bitcoin adoption advances globalist free market values, not communist or nationalist values. It is dubious from first principles that the Chinese Communist Party has or would ever want to weaponize it”"
5679,Mobile BTC telegram miner make $15.52 daily and $465.71 fast and easy withdrawals Link: https://t.me/BTC_Miner_au_bot?start=823549928
5681,You Can Mine Cryptocurrency Using Commodore 64
5685,"Cryptocurrency technology company DMG buys another 1,800 ASIC mining machines."
5687,"US Residents - Worst case scenario, BTC and cryptos moon the next 24 months, but government now taxes unrealized gains (see link)....would you consider domiciling your cryptos to another country to save some taxes? And if so, which?"
5714,"Blockfi, the best crypto trading platform"
5716,Blockfi the best crypto platform
5743,I'm new to bittcoin and I mine It.
5744,Bitcoin Wallet
5751,We are almost 10% away from mining all the existing Bitcoins. What happens next?
5753,"FreeBitcoin is giving you 10 Wheel of Fortune Free Spins whenever you deposit BTC at FreeBitco.in, regardless of the amount"
5768,Mine this transaction for me.
5779,Welcome To https://dailybitstrade.com/?ref=Rebecca769 ♻️MINMUM DEPOSIT $25
5782,CRED- an Indian credit card management and bill payment company has come up this ad “ pay your credit card bills on CRED and stand a chance to win 1 BTC”. To the moon !
5812,Moving BTC from exchange to hard wallet taxable event?
5822,sweetybit.com legit site?
5827,CoinBox Wallet App
5830,"$65 in an old wallet, is it possible to move it cheaply?"
5851,Mine Bitcoin on any iOS device or computer
5857,Atomic Wallet
5859,"Theoretically, what would it take for Amazon (feel free to apply this to other platforms) to use Bitcoin? What would it take for/what would happen if a country was to invest copiously in Bitcoin?"
5861,Best Wallet for immediate buy/transfer small amounts of BTC?
5862,"Theoretically, what would it take for Amazon (feel free to apply this to other platforms) to use Bitcoin? What would it take for/what would happen if a country to invest copiously in Bitcoin?"
5869,$15 FREE Bitcoin...Read on for more details
