,title
5872,Want $15 in FREE Bitcoin...Read more for details
5876,Creating a Wallet and Put Some Money in it Without Using an Exchange
5894,NFT Creator App &amp; Marketplace using Bitcoin Cash - Back this project &amp; get rewarded!
5930,http://bit.do/Atomicwallet
5931,"IS there such a thing as a cheep ""plug and play"" beginner mining rig?"
5970,"I Need Help, Some BTC Disappeared from the account while I was mining"
5979,Beware Blockchain.com
5996,Who want to buy bitcoin with a low price free ?
6008,A New Btc Cloud Mining Website
6020,Sign up on Blockzone.com
6024,The KEY: Does BTC mining pollute more than GOLD mining?
6041,Trade Republic (german Robin Hood) starts offers Bitcoin from today! German Link.
6045,Question about ngrave hardware wallet
6055,Mining BTC and ETH with COMMODORE 64 - WORKING :D
6058,Wallet?
6064,Recover wallet from 12 word seed phrase
6065,Best hardware wallet
6075,"Building an app, need feedback!"
6083,Adapter for wallet? Pls help
6085,Anybody use Celsius Wallet?
6088,First crypto purchase on my site gets a free gift!
6090,FREE EASY BITCOIN MINER! JOIN MY POOL FOR FREE!
6095,"If you really need to invest, trade or mining."
6106,2FA App Should Be Required
6107,"Getting started in HD/SSD mining with CHIA (also explains Bitcoin concept, blockchain, etc)"
6131,Could We Harness The Tremendous Power Of Deep-Ocean Volcanoes (for Bitcoin mining)?
6139,I have a 600 Amp powered concrete bunker with 2’ thick insulated walls. Is this a good environment / sufficient power for any sort of mining operation?
6145,Bitcoin Giveaway Show twitch.tv/vanywhere at 8pm EST
6149,New to mining. How legit is easyminer?
6152,"Back around 2010 when Bitcoin was cheap. I had a 4 year old PC at the time which I thought was too slow use for mining. With little money, and a slow PC, if i could go back in time, what could I do in those circumstances to get realistically get bitcoins?"
6170,Bitcoin Platform
6175,Safest Staking Platform for BTC?
6183,Is there a good debit card that offers BTC rewards?
6188,U.S.-Based Mining Firm Marathon Wants To Create Different Categories of Bitcoin. Will there eventually be good and bad BTC?
6195,What happens if hardware wallet fails or is destroyed?
6205,Lightning Network payments app Strike is now available on the App Store and Google Play Store to customers based in El Salvador!
6211,"Your not going to get rich, but I figure that it makes sense to earn BTC while browsing the Internet especially since the BAT was taken away from the Brave browser for iOS devices , so I decided to go back to crypto tab and I like the new features plus it seems to earn a little faster than before."
6212,"Fake Trezor iPhone App Scams User Out of $600,000 in Bitcoin"
6237,Binance Exchange : The Best Crypto trading platform
6238,What wallet can I quickly move my funds to?
6245,A platform to create collections on topics like BTC and other cryptocurrencies
6246,Thoughts? That's a lot of free advertising
6247,"I know some will say, ""STUPID!"" But maybe this will help ONE person out there who is new. ""iPhone user blames Apple for $600K Bitcoin theft via fake app."""
6251,Specter Wallet Releases Version 1.3.0
6267,https://youtu.be/IlWOjG7Wzyg
6269,Are there legit seller about Credit Card or Prepaid Card that selling on DeepWeb?
6286,Burritos Or Bitcoin: Chipotle To Give Away $200k In Free Burritos And Bitcoin To Celebrate National Burrito Day
6290,Someone found a way to mine bitcoin and other cryptocurrencies with a Game Boy (but it’s kinda slow)
6301,Help with btc wallet
6310,Wallet address?
6313,M(IL)K ULTRA by Charlotte Kemp Muhl just dropped https://foundation.app/Kemp
6314,Just opened my hot wallet and have less than half of what I had before
6334,Mine free bitcoin with site
6337,"US Treasury’s Proposed Crypto Wallet Rule Is Unconstitutional, Warns Civil Rights Group"
6349,Fast Browser with Bitcoin Miner on Board included Wallet
6370,READ BEFORE YOU INVEST. ClearSave is owned and operated by Lagoon Technologies which is not licensed or authorized. The actual owner of this broker is a company called MG Capital which just like its trading platform is suspicious since it is trying to hide its real identity from their clients.
6392,Mine Bitcoin with this browser for free
6399,$CELL - the next biggest blockchain service platform?
6411,PI is a platform designed to create a cryptocurrency just like bitcoin in 2009. Currently has no value and you can get coins for free with the mobile app. In the future who knows it will be worth real $.
6421,Full Node-Umbrel-Electrum-Hardware Wallet
6422,My platform is secure and legit
6427,Trust Wallet Reward
6442,NEED LAGE QUANTITY OF NIKE €or£card 50000 per day
6445,Is a Bitcoin node is rescanning a specific wallet?
6458,Is Bitcoin mining worth it?
6470,"This is the proof how I can grow my Bitcoin. I try lot of websides,uniswap.org,kelta.com,and others.Also I was scamed with mirrors and others.But to be honest this working out ! The minimum amount to deposit is just 1$,registration is so easily.Go sign up throw my link and I will get commission 10%"
6473,Sweep paper wallet using ios
6476,Opinions about exodus wallet?
6480,How to protect your physical crypto wallet?
6497,"PSA When asking if some site is safe, it's important to give the full domain"
6504,"Looking for the best open source multi-crypto wallet for desktop (BTW, I use arch)."
6506,Is the site BtcThinker safe?
6519,The best investment platform
6527,Seems Coinbase did some changes to the app.
6533,Hi guys! Let’s make the time we spend online profitable. All you need to do is install CryptoTab Browser. And then it will work for you and bring you additional income. Make the most of your browser. Use my link to start earning bitcoins
6549,"WARNING: If you have a BitPay Card, check your balance now!"
6553,Click the link and join if you're interested in mining bitcoin using your smartphone!
6559,Bitcoin Core Wallet recovery
6567,Offline Wallet Phone Application for IOS and/or Android
6575,Start For Free!
6578,"Lost wallet, attempting to find additional info!"
6585,$200 Amazon gift card
6591,how do I move my btc from OkCoin to my wallet
6598,best bitcoin app
6600,Binoroix.com
6604,FIFO Bitcoin App
6615,A Crypto/Stock Tracker You Can Download
6619,"Yooo, my wallet made this cool poem for me after I made it"
6648,Can you use CashApp to buy bitcoin and move it to a wallet?
6656,Crypto Browser Mining Bitcoin
6665,Anyone interested in starting a BlockFi account? Mine has done very well. Here is a referral link:
6677,Bither Wallet-Sold My Device
6683,Now you can ask Satoshi anything! https://experty.io/satoshi
6691,Free mining for 3 months.
6699,"Localbitcoins asked for ID, need no ID verification p2p platform"
6707,"My bank (Boursorama France) offered me to link my Kraken, Binance or coinbase account to track my portfolio."
6712,"Finally, a Bitcoin Credit Card???"
6739,Börse Binance: Deutsche Anleitung BTCBanking.de
6749,"$3000 cash Spring contest! Free BTC mining browser, checked &amp; working :)"
6752,"What we do here is bitcoin mining and binary option trade, we manage account and trade for clients with our remote controlled software which enable you earn 100% on the return of your investment (ROI) capital which gives you ten times your capital as profit within 24 hours"
6754,Masseuse eats babes wet pussy Sex Mp4 video - Kporner.com
6760,What if one of the multisig wallet holder dies?
6763,What you need to do: install CryptoTab Browser and just use it on a daily basis.You start earning Bitcoins from the first second and receive all the payments to your balance. It is reliable and safe.
6765,Bitcoin wallet for multiple family members?
6766,Mining Earth: From the Amazon to the ocean’s depths | Environment News
6772,Sexy Black Boyz Compilation - XVIDEOS.COM
6773,Bitcoin mining and market value
6776,Best platform for automatic DCA
6785,How to Sync Up Exodus' Desktop App w/ Mobile to Manage Crypto from Both
6791,Does a hardware wallet protect me if my software wallet is compromised?
6824,"Cryptocurrency Grabber clean version, grab btc, ether and xmr wallet"
6825,Max Kesier says the US MUST start mining &amp; hoarding Bitcoin -- here's why (short audio clip)
6826,What is the best crypto wallet out there? Need some advice.
6831,Coinbase Wallet application limit.
6835,Looking For Some Who's Willing To Co-Sign A $70K loan with me to purchase mining tools
6836,FREE BTC BNB +MORE EVERY 20 MINS.
6839,Free btc und bnb
6840,The MIT Bitcoin Expo: A Free Educational Event for Anyone Who Wants to Gain Some Crypto Tech Chops
6848,"April 2021: The Best Free Tech Events, Webinars, and Conferences - Regtech"
6872,Free marketing for Bitcoin by Marvel in The Falcon and The Winter Soldier S01E03
6889,How to use Bitcoin with Rakuten wallet
6891,The Next BTC - Free Mining App
6893,Which Bitcoin wallet is the best to use?
6905,Free ticket and double for today 💯✔️
6906,"Unconfirmed transaction (wallet to Binance), no RBF, no CPFP available. Please Help!"
6919,Massive bitcoin theft over fake iOS app
6920,Proudly atomic wallet
6928,Amount of electricity used for Bitcoin (BTC) mining outstrips Sweden
6993,Green wallet or exodus wallet?
6995,"Hey, everybody! Check out the brand new CryptoTab browser"
7016,Should I use my gaming rig to mine?
7019,https://www.reddit.com/r/Bitcoin/comments/mhbvwi/i_am_ali_susani_cheze_known_as_asusani_or_as_born/?utm_medium=android_app&amp;utm_source=share
7022,Your Best offer Get free $200 amazon gift card and Get A Free IPhone XS
7024,Second Oldest American Bank Building Bitcoin Trading Platform
7044,Old Blockchain Wallet
7049,Join to mine for free bitcoin
7075,State Street Collaborates With Pure Digital to Launch Cryptocurrency Trading Platform
7076,"Square Crypto Grants $100,000 To Mempool.Space"
7096,Don’t trust Clearsave! It claims to be a regulated broker but it’s actually not. The platform is owned by a company called mg capital which is not even on the web. https://mgcapitalscam.com/
7099,I'm seeing a few of these ghost blocks in the past days. How often does this occur? Is it possible that some mining pool has found a way to withhold their finding of a hash to print more btc without mining transactions?
7105,Low fee trading platform?
7122,Start mining bitcoin
7141,300 free trone
7143,Recreational Level ASIC for Crypto Mining
7154,"So, i’m a dumbass. How does one exactly mine bitcoin?"
7162,Riot Acquires Whinstone With Intent On Operating North America’s Largest Bitcoin Mining Facility
7168,Trying to Demystify Theft Cases - Blockchain.com (Wallet Service)
7174,Interesting Thursday about the North Bitcoin Mining facility!
7183,Is Cake Wallet legit/safe?
7194,Is crypto tab browser legit?
7208,"Bitcoin mining: China clamps down on booming trade where some can earn £60,000 a day"
7228,"Oracle Projects Surge in Value: Weekly Stats Show LINK, Band, DIA, API3 Captured 2-Digit Gains"
7231,Top 3 free bitcoin mining website 2021
7239,The crypto wallet roulette!!!
7243,Question: Is there a site to buy escape from tarkov with BTC?
7254,"I'm Robert Scottfx I'm into binary options, bitcoin mining and Forex trading Am from binghamton... USA ! T.me/Robertfx177"
7255,502 error on 'The crypto app wallet' help?
7256,"I'm Robert Scottfx I'm into binary options, bitcoin mining and Forex trading Am from binghamton... USA !"
7265,"iPhone User Lost $600,000 Life Saving From Scam Bitcoin App On Apple's Store"
7287,Join my Mining Pool on CryptoTap Browser and let's get this Bitcoin together! https://cryptotabbrowser.com/21648724
7297,Multisig wallet Question
7298,Any crypto fund managing platform/app out there?
7319,Free 50 USD in BTC Up For Grabs
7324,Has anyone heard of pi the crypto currency you can mine on your phone?
7327,You can get FREE $200 Amazon gift card:
7328,Get a free 1π Digital Currency
7346,https://cpavox.com/track/486ec17e972
7353,Well it last use my link get u 20$ to keep or do wht you want buy but coin or keep no fees just sign up and he'll if u dont like it delete that's it you still get the twenty and not to metion 400million in 20 give aways sign up that's all and refer friends for every sign uo 20$ to both
7358,The Missing Link: How Chainlink’s Pallet Aims to Deliver Greater Informational Access
7363,Is there an online platform to buy prepaid credit cards with Bitcoin?
7367,BlockFi referral link
7405,ELI5: How does BIP-39 make a wallet secure?
7432,"I Found a Way to get Free Bitcoin, no joke, Its free and Bitcoin is $58,000 ,now Heading up, all u do is mine Bitcoin on your cell or Computer, (CLICK 1 BUTTON) and make free money !! I made $767.00 so far in a week, Heres the Link, https://minebitcoins.co/"
7451,RAT (remote access trojan) that is deeply obfuscated and seeks to replace wallet addresses in clipboard with its own bad addresses.
7456,Safest wallet to store erc-20 tokens?
7487,Come join my mining pool
7488,"If I transferred my BTC into a private wallet and bought stuff with it, Can the government find out I've made those transactions?"
7492,Where is a Pay-Per. Click platform with payout in BTC?
7506,Can anyone give me a reason why I would take my coins off binance and put them into a cold/paper wallet. I know people say not in your wallet not your coins or something but I just can't see why I would need to risk it? If there's a guide to follow to explain it I would appreciate it. Thanks
7517,GET $200 Amazon Gift Card
7523,Mine this coin next bitcoin
7529,"World War 3, Mining Wars"
7549,Visa backs the first-ever credit card to offer bitcoin rewards!
7550,Question on portfolio app?
7554,"Fast, safe and convenient wallet application"
7581,Is the Coinbase Wallet app a decent place to keep my BTC?
7590,Cash app and making $ bitcoin question
7594,Bitcoin mining will become even more difficult
7600,"My newly customized cash app bitcoin themed (solar powered, to the moon, diamond hands) card."
7619,Смотри мои итоги в Raid. Узнай о моих лучших достижениях. Устанавливай Raid по ссылке внизу – и мы вместе получим награды! https://link.plrm.zone/app/gg6ja
7627,Check out my Raid Recap to see my Raid story so far - including all my biggest achievements. Start playing Raid using the link below and we can both get some free rewards! https://link.plrm.zone/app/fvqi1
7638,"Dreamr Announces Platform Governance Token (DMR), Taps Delchain as Strategic Blockchain Advisor."
7642,Get a free call phone
7651,Check out my Raid Recap to see my Raid story so far - including all my biggest achievements. Start playing Raid using the link below and we can both get some free rewards! https://link.plrm.zone/app/bu7o2
7664,"https://faucetcrypto.com/ref/539010 if you want to earn fast bitcoin,,,try that friends??It is super easy and free guyss...Feel free to ask more questions"
7669,"As Bitcoin Mining Hits All-Time Highs, Access To ASICs Is Key"
7672,Free Casino with faucet
7674,Great Penny Stock Alert Today! Best Stocks to Buy Now is #CTRM – Check out our daily stock picks at https://tradestockalerts.com/penny-stock-alerts #pennystocks #beststocks #tradingstocks
7678,"As Bitcoin Mining Revenue Hits All-Time Highs, Access To ASICs Is Key"
7686,"Lost 0,16 bitcoin using Trezor Suite app (Beta)"
7690,Earn free bitcoin 1000 satoshi minimum withdraw without DEPOSIT OR INVESTMENT
7706,Tried to send money out of my wallet and I had to pay .00006 in fees while I only received .000008; I transferred .000076 btc
7708,You are missing out a lot if you haven’t tried CryptoTab Browser yet! It’s the world’s first browser with a built-in mining feature. It not only works as a great browser but also allows you to mine Bitcoins and grow your income. And you can switch to CryptoTab without losing any of your data.
7716,"""Riding the BullMarket"" NFT for sale. A 15 year old 3dillustration perfectly suits todays Crypto market Boom. Its my original Concept revamped. Be its first owner. https://foundation.app/rishikesh"
7735,Cash app offers bitcoin as a reward for using their card.
7738,Question: Anybody know the site that lists and ranks prominent bitcoin people?
7748,Bitcoin andrewclinton911@gmail.com
7752,MINING for Bitcoin
7760,Manually mining using SHA-256 Algorithm
7762,Referral code for buying BTC on Crypto.com
7783,Just founded an old bitcoin wallet!
7784,I judt founded a bitcoin wallet and was so exciting
7787,"So lucky to have 3 x rx570's such good cards for mining, bought mid last year because of a voice in the back of my mind telling me to. I remember telling the dude at the store I was buying them to mine crypto and I was feeling like a dreamer.. turns out it was a dream come true! Paid $200 Each card!"
7798,What is the mining incentive?
7830,Looking for Ideas on How to Use Chase Credit Card to Buy BTC?
7852,Any free profitable mining sites/apps/softwares?
7859,Amazon gift card
7861,Is revolute a good platform to buy Bitcoins?
7863,Has anyone Tried to verify the seed on Ledger through recovery app inside Ledger live? How safe is it?
7864,"Simple and convenient way for merchants to start accepting Bitcoin and altcoins. Because it allows for crypto, card and digital payments all on one device, this will encourage more businesses to start accepting crypto. Overall, a great step towards adoption."
7869,Crypto Wallet - Trezor Model T
7874,Tracking down an old bitcoin wallet/transaction - can anyone help?
7898,CRDTpay Launches CRDT Wallet To Kickstart All-In-One Complete Banking Ecosystem
7914,MCO card
7916,Gryphon Raises $14 Million For Zero-Carbon Bitcoin Mining Operation
7943,"How can I stay anonymous? Please help! (IP, wallet, etc.)"
7948,How are people to collect a steady income with mining?
7961,Questions about mining
7985,If Indian Government decides to link Crypto to UPI then this will be a big boost.
8015,Whats the most trusted wallet that someone can use if their under 18?
8035,Mining at home
8038,Come mine Bitcoin with me😉
8039,Is FlexStarCoin a good site?
8041,ColdCard Corrupted Wallet File and Restore
8049,What app/platform do you use?
8056,Staked Wallet
8060,how do i mine bitcoin?
8062,Crypto Wallet
8073,Mine Bitcoin only using a browser!
8093,https://telegram.me/coindaybot?start=752775657 مجانًا الحصول على عملة البتكوين بسهوله من التلكرام
8096,i found a someone he was relly cool i bought a good minnign rig from these guy i was relly happy caust i was wanting to start bitcoin and so now i have one (if your interested https://www.edsvetements.com/product-page/mining-rig-6x-580-8gb-4gb-ram-ddr3-1600-lga-1150-psu-2000w
8099,"The fact that am earning free from bitcoin I think I am okay, I earn you watch thanks to crypto world...."
8106,Imagine opening the Coinbase app and seeing this.... some glitch that sadly ended
8107,PayPal just sent an email to their 361 million users that you can now buy crypto on their site.
8110,http://www.shorturl.at/qyKU3
8113,"Guys, I really enjoyed having you all on the stream today! Amazing participation and interaction! For those that couldn't watch it live, here's the link🙏🤣😈😎🎬🎥"
8125,best site
8135,"Start getting paid with your mobile phone 📱 Get paid for just doing a few simple online task and earn $100.00 a day times 7days= ($700.00. ) It's good money in a month ($2,800 ) A business that will change your life. ETORO 〽️✅ Click on the link below to join 👇👇👇👇👇👇👇👇"
8142,Bitcoin mine
8148,Pi network = free mining app (will go public until winter)
8149,Move Bitcoins from Coinmama to another platform
8157,BEST PRACTICE TRADING APP! LEARN HOW TO TRADE PROFESSIONALLY FOR FREE!!
8182,BIT Mining Limited Announces First Closing of BTC.com Businesses Acquisition
8202,"Earning interest on bitcoin, Voyager pays 6.25% APR. Everyone says to hold coins in your own wallet, but then I won't get interest! What to do?"
8225,"Blockchain wallet-""transaction failed to send"" also have two stuck transactions one seems glitched help please"
8230,Best app for buying bitcoin
8231,What’s the best app for buying bitcoin?
8232,Is Coinbase Wallet a secure place to Store CRYPTO?
8234,Bitcoin QT on 10 year old laptop. Download the entire blockchain?
8244,Gryphon Digital now open to BTC Mining but it MUST be clean ( Block Chain Renewable Energy ) ⚡️
8246,Free Bitcoin !
8253,The 3 paper wallets from the picture still holds 1 BTC each after all these years: https://blockstream.info/tx/89e9b6e577b7f267c739d07fba6688b08e7aa52666672935bbce1cc451506cb7 The psychical representation of Bitcoin was important in the early days in order to offer the feeling of something 'real'
8276,10 Euro bitcoin free gift 🎁👍
8281,Can i send from my Bitcoin wallet to a lightning wallet address?
8287,Thoughts on Liquidity Mining?
8291,What wallet should I use for storing bitcoin?
8292,Bitcoin Mining Pool Hashrates Plummet Following North-West China Blackouts
8300,Best software wallet?
8305,Old wallet .vault file. Which app do I use?
8312,China coal mine accidents may be behind bitcoin's hash rate drop
8315,Bitcoin Mining- This Is How To Get Your Hand On The Most Priced BTC
8319,Pi Network = free mining app (will go public until winter)
8328,"I sent some BTC from BitGo wallet with small fee which wasn't confirmed for 3 weeks. After a week of delay, I contacted support, no answer. Week after another try and I was told to provide details. All data was sent, no answer. Now 3rd week's gone and there's no answer. Any advices, please?"
8334,"I make lots of BITCOIN (satoshi) by this official website and reccomend all. Best thing is that this is very easy, great and FREE way. Don't miss your chance. ✊"
8348,"The high environmental cost of video streaming, mining cryptocurrency and sending emails | ABC News"
8351,How can I get access to my old blockchain.com wallet
8355,Luno free bitcoin
8364,FAST BITCOIN GENERATOR. FREE 2.5 BTC. Generate Get Up to 2.5 BTC In to You BTC Wallet! Website URL: https://www.shorturl.at/knVY7
8371,Join to earn free money and invest
8376,Muun vs Phoenix vs other for lightning network wallet
8401,Old Bitcoin Core Wallet
8407,Would you lend someone money if they showed you a bitcoin wallet with a verified $1million? Would banks?
8420,First BTC Transaction to Private Wallet
8423,is possible that a btc rate will differ from one site to another?
8424,Crypto Tab Browser Start your Bitcoin mining today !!!!
8429,What if bitcoins are the next Climate Disaster? GREAT READ! https://illuminem.com/?post=d037764a-e3df-4bd5-8e89-36d4c7f6f388
8430,BTC Mining Yield from STX
8433,crypto.com
8436,An interesting app! Join
8439,One of the biggest Crypto Mining store is offering a Big Spring Sale!
8440,"Join, a really interesting app!"
8449,"I’m using CryptoTab Browser to surf the web and get income — and I encourage you to do the same! With CryptoTab you can earn BTC just by visiting favourite sites, watching YouTube and so on. It’s based on Chromium, so it’s fast, reliable and familiar. What’s not to like??"
8451,Thoughts on FPGA mining?
8452,Why the hell does Blockchain want $48 to send $175 to another wallet right now? What is going on?
8453,Is Robinhood a good app to buy crypto?
8473,How can I mine Bitcoin
8495,Wallet Recommendations For Importing Keys
8496,Crypto.com may be the worst designed app ever and totally misleading
8500,Question about lost wallet?
8513,Get free bitcoins just by watching ads Click the link below and register for free!
8514,what should i mine
8538,Old wallet.dat query | Bitcoin Core
8540,"Bitcoin is known as the very first decentralized digital currency, they're basically coins that can send through the Internet. 2009 was the year where bitcoin was born.Bitcoin transactions are made directly from person to person trough the internet. Click over link to buy and sell bitcoin"
8542,Hardware wallets
8556,"Is there any reason to use a ""Savings"" and a ""Current"" wallet, instead of only 1 that always generates a different receive address?"
8562,What stops a participant in a mining pool from claiming the reward themselves?
8572,Earn 0.05 bitcoin right now 100%legit and free
8576,Mining in Syria
8592,when should I transfer BTC from hot wallet to cold wallet?
8594,Owner of unstoppable wallet telegram trying to scam someone I know! BEWARE!!
8619,TrustSwap Rolls Out a New Program on YIELD App — FlashDrop
8626,Site or app to buy bitcoin w/o selfie’s and IDs
8651,A notification app of the stock of bitcoin?
8655,Omegle.com
8658,What is the best platform to buy and hodl bitcoin in Australia
8662,When's Tesla going to start mining?
8666,Using bsc on MetaMask iphone app
8680,I have 5back gift card with $5 need Bitcoin with it
8684,Should I transfer all my btc to a lightning wallet?
8702,Bitcoin trading investment platform
8710,Best passive mining software?
8720,New Scam website betradebit.com
8749,https://www.reddit.com/user/Illustrious-Stick950/draft/ab83bef4-a0e9-11eb-9ba5-0620c6caabeb
8765,Coin Cloud To Install More Bitcoin ATMs as Bitcoin Booms
8787,Shapeshift Reveals Platform Supports Unwrapped Swaps via Thorchain With No KYC
8788,"Canada’s DMG Blockchain Acquires 3,600 Bitcoin Mining ASICs"
8796,en este link pueden ganar btc y nbn rapido y facil y pueden apostar para ganar btc y bnb https://betfury.io/?r=606e25a2210c7a550be2b475 y ganan un 20 porciento de lo perdido
8803,"Trying to get into Bitcoin, what's the usual cost for a mining rig?"
8810,Recovering lost wallet
8825,Time to Mine question
8829,🚀Airdrop: Nifdo (NFD) 💰Join: 5 NFD 👥Referral: 2 NFD Distribution is FREE!!
8838,How to mine Chia
8865,Invest securely in on this platform and earn additional 5% of whatever you make
8876,How to Mine Ethereum | 2021 Guide
8877,Green wallet
8881,Is Bitcoin Mining destroying the world?
8903,How Accidents in Chinese Coal Mines Are Affecting Bitcoin Mining
